2026-01-02 16:29:24,331 - __main__ - INFO - 🌐 API Server Logging Initialized
2026-01-02 16:29:24,332 - __main__ - INFO - 📝 Logs saved to: logs/dq_api_20260102_162924.log
2026-01-02 16:29:24,389 - __main__ - INFO - APP_SETTINGS loaded. Audit enabled: True
2026-01-02 16:29:24,390 - __main__ - INFO - ✅ All DQ modules loaded successfully
2026-01-02 16:29:24,393 - dq_error_log - INFO - ErrorLogger initialized with database: dq_checks
2026-01-02 16:29:24,393 - dq_audit - INFO - Audit class initialized with database: dq_checks
2026-01-02 16:29:24,394 - __main__ - INFO - ✅ ErrorLogger and DataQualityAudit initialized
2026-01-02 16:29:24,400 - __main__ - INFO - 🚀 Starting Data Quality Framework API
2026-01-02 16:29:24,401 - __main__ - INFO - 📊 Modules available: True
2026-01-02 16:29:24,401 - __main__ - INFO - 🔧 Config file mode: False
2026-01-02 16:29:24,402 - __main__ - INFO - 📋 Available endpoints:
2026-01-02 16:29:24,403 - __main__ - INFO -   GET  /              - API status
2026-01-02 16:29:24,403 - __main__ - INFO -   GET  /api/health    - Health check
2026-01-02 16:29:24,405 - __main__ - INFO -   POST /api/check-single - Single source analysis
2026-01-02 16:29:24,406 - __main__ - INFO -   POST /api/compare   - Source-target comparison
2026-01-02 16:29:24,406 - __main__ - INFO -   POST /api/upload    - File upload
2026-01-02 16:29:24,407 - __main__ - INFO -   GET  /api/sessions  - List sessions
2026-01-02 16:29:24,408 - __main__ - INFO -   GET  /api/sessions/<id> - Get session data
2026-01-02 16:29:24,408 - __main__ - INFO -   GET  /api/debug-db  - Database debug
2026-01-02 16:29:24,409 - __main__ - INFO - 🌍 Server starting on 0.0.0.0:5000 (debug=False)
2026-01-02 16:29:40,752 - __main__ - INFO - GET /api/health - Request started
2026-01-02 16:29:40,754 - __main__ - INFO - Completed with status 200 in 0.002s
2026-01-02 16:29:42,803 - __main__ - INFO - POST /api/upload - Request started
2026-01-02 16:29:42,816 - __main__ - INFO - File uploaded: 20260102_162942_sample_data.csv (csv)
2026-01-02 16:29:42,817 - __main__ - INFO - Completed with status 200 in 0.014s
2026-01-02 16:29:44,863 - __main__ - INFO - POST /api/upload - Request started
2026-01-02 16:29:44,913 - __main__ - INFO - File uploaded: 20260102_162944_sample_data.xlsx (excel)
2026-01-02 16:29:44,915 - __main__ - INFO - Completed with status 200 in 0.052s
2026-01-02 16:30:04,549 - __main__ - INFO - POST /api/compare - Request started
2026-01-02 16:30:04,552 - __main__ - INFO - Comparison analysis request received
2026-01-02 16:30:04,553 - __main__ - INFO - Starting comparison for session CMP_20260102_163004
2026-01-02 16:30:04,555 - dq_comparison - INFO - Starting comparison analysis in UI mode
2026-01-02 16:30:04,556 - dq_comparison - INFO - LOADING SOURCE AND TARGET DATA
2026-01-02 16:30:04,558 - dq_comparison - INFO - 
==================================================
2026-01-02 16:30:04,559 - dq_comparison - INFO - 🔗 SOURCE DATA CONFIGURATION
2026-01-02 16:30:04,560 - dq_comparison - INFO - ==================================================
2026-01-02 16:30:04,562 - dq_comparison - INFO - 
🗄️ SOURCE DATABASE CONFIGURATION
2026-01-02 16:30:04,563 - dq_comparison - INFO - ----------------------------------------
2026-01-02 16:30:04,564 - dq_comparison - INFO - UI mode: Using provided database configuration for SOURCE
2026-01-02 16:30:04,564 - dq_unified - INFO - Loading data from DATABASE
2026-01-02 16:30:04,566 - dq_unified - INFO - Loading large database table: customers
2026-01-02 16:30:04,567 - dq_unified - INFO - Normalized DB config with schema: dq_checks
2026-01-02 16:30:04,749 - dq_unified - INFO - MySQL table customers has 15 rows
2026-01-02 16:30:04,749 - dq_unified - INFO - Loading 15 rows from MySQL...
2026-01-02 16:30:05,355 - dq_unified - INFO - Loaded 15 rows from MySQL
2026-01-02 16:30:05,371 - dq_unified - INFO - Memory optimization: 0.0MB -> 0.0MB (Saved: 0.0MB)
2026-01-02 16:30:05,372 - dq_unified - INFO - Standardizing data types...
2026-01-02 16:30:05,376 - dq_unified - INFO - Data type standardization complete
2026-01-02 16:30:05,378 - dq_unified - INFO - Loaded 15 rows, 10 columns. Memory: 121.7MB total, 0.0MB for dataframe
2026-01-02 16:30:05,380 - dq_comparison - INFO - SOURCE database loaded: 15 rows, 10 columns
2026-01-02 16:30:05,381 - dq_comparison - INFO - 
==================================================
2026-01-02 16:30:05,381 - dq_comparison - INFO - 🔗 TARGET DATA CONFIGURATION
2026-01-02 16:30:05,382 - dq_comparison - INFO - ==================================================
2026-01-02 16:30:05,382 - dq_comparison - INFO - 
🗄️ TARGET DATABASE CONFIGURATION
2026-01-02 16:30:05,383 - dq_comparison - INFO - ----------------------------------------
2026-01-02 16:30:05,385 - dq_comparison - INFO - UI mode: Using provided database configuration for TARGET
2026-01-02 16:30:05,385 - dq_unified - INFO - Loading data from DATABASE
2026-01-02 16:30:05,386 - dq_unified - INFO - Loading large database table: customers
2026-01-02 16:30:05,387 - dq_unified - INFO - Normalized DB config with schema: public
2026-01-02 16:30:05,489 - dq_unified - INFO - PostgreSQL table public.customers has 15 rows
2026-01-02 16:30:05,489 - dq_unified - INFO - Loading 15 rows from PostgreSQL...
2026-01-02 16:30:05,497 - dq_unified - INFO - Loaded 15 rows from PostgreSQL
2026-01-02 16:30:05,504 - dq_unified - INFO - Memory optimization: 0.0MB -> 0.0MB (Saved: 0.0MB)
2026-01-02 16:30:05,505 - dq_unified - INFO - Standardizing data types...
2026-01-02 16:30:05,513 - dq_unified - INFO - Data type standardization complete
2026-01-02 16:30:05,515 - dq_unified - INFO - Loaded 15 rows, 10 columns. Memory: 122.3MB total, 0.0MB for dataframe
2026-01-02 16:30:05,516 - dq_comparison - INFO - TARGET database loaded: 15 rows, 10 columns
2026-01-02 16:30:05,517 - dq_comparison - INFO - Source data loaded: 15 rows, 10 columns
2026-01-02 16:30:05,518 - dq_comparison - INFO - Target data loaded: 15 rows, 10 columns
2026-01-02 16:30:05,518 - dq_comparison - INFO - SELECTING COLUMNS FOR COMPARISON
2026-01-02 16:30:05,519 - dq_comparison - INFO - Source columns (original): ['CustomerName', 'Email', 'Phone', 'Salary', 'Department', 'JoinDate', 'PostalCode', 'City', 'Country', 'State']
2026-01-02 16:30:05,520 - dq_comparison - INFO - Target columns (original): ['customername', 'email', 'phone', 'salary', 'department', 'joindate', 'postalcode', 'city', 'country', 'state']
2026-01-02 16:30:05,520 - dq_comparison - INFO - Common columns lowercased: ['state', 'email', 'department', 'country', 'salary', 'city', 'postalcode', 'joindate', 'phone', 'customername']
2026-01-02 16:30:05,522 - dq_comparison - INFO - Found 10 common columns between source and target (case-insensitive, excluding CustomerID)
2026-01-02 16:30:05,523 - dq_comparison - INFO - User column selection input: all
2026-01-02 16:30:05,524 - dq_comparison - INFO - User selected ALL common columns for comparison
2026-01-02 16:30:05,525 - dq_comparison - INFO - Selected 10 columns for comparison: ['State', 'Email', 'Department', 'Country', 'Salary']...
2026-01-02 16:30:05,525 - dq_comparison - INFO - GENERATING COMPREHENSIVE COMPARISON REPORT
2026-01-02 16:30:05,526 - dq_comparison - INFO - Report details - Source: Database: mysql - dq_checks.customers, Target: Database: postgresql - dq_checks.customers, Selected columns: 10
2026-01-02 16:30:05,527 - dq_comparison - INFO - Initializing Error Logger...
2026-01-02 16:30:05,528 - dq_error_log - INFO - ErrorLogger initialized with database: dq_checks
2026-01-02 16:30:05,554 - dq_error_log - INFO - Database connection successful
2026-01-02 16:30:05,555 - dq_comparison - INFO - Session ID: CMP_20260102_163005
2026-01-02 16:30:05,556 - dq_comparison - INFO - ✅ Row counts match: 15 rows
2026-01-02 16:30:05,557 - dq_comparison - INFO - Comparing column structures...
2026-01-02 16:30:05,558 - dq_comparison - INFO - Column structure comparison complete. Match: True
2026-01-02 16:30:05,559 - dq_comparison - INFO - Validating primary key/unique fields...
2026-01-02 16:30:05,561 - dq_comparison - INFO - Checking key fields: ['PostalCode']
2026-01-02 16:30:05,562 - dq_comparison - WARNING - No key fields found in both datasets
2026-01-02 16:30:05,583 - dq_comparison - INFO - Comparing table-level metadata...
2026-01-02 16:30:05,599 - dq_comparison - INFO - Table metadata comparison complete. Match: False
2026-01-02 16:30:05,599 - dq_comparison - INFO - SECOND CHECK: HASH-BASED COMPARISON WITH PERFECT NORMALIZATION
2026-01-02 16:30:05,600 - dq_comparison - INFO - Source DF columns: ['CustomerName', 'Email', 'Phone', 'Salary', 'Department', 'JoinDate', 'PostalCode', 'City', 'Country', 'State']
2026-01-02 16:30:05,600 - dq_comparison - INFO - Target DF columns: ['customername', 'email', 'phone', 'salary', 'department', 'joindate', 'postalcode', 'city', 'country', 'state']
2026-01-02 16:30:05,600 - dq_comparison - INFO - Selected columns for comparison: ['State', 'Email', 'Department', 'Country', 'Salary', 'City', 'PostalCode', 'JoinDate', 'Phone', 'CustomerName']
2026-01-02 16:30:05,601 - dq_comparison - INFO - Using 10 common columns for hash comparison
2026-01-02 16:30:05,601 - dq_comparison - INFO - Source columns: ['State', 'Email', 'Department', 'Country', 'Salary', 'City', 'PostalCode', 'JoinDate', 'Phone', 'CustomerName']
2026-01-02 16:30:05,602 - dq_comparison - INFO - Target columns: ['state', 'email', 'department', 'country', 'salary', 'city', 'postalcode', 'joindate', 'phone', 'customername']
2026-01-02 16:30:05,602 - dq_comparison - INFO - Generating hashes for source data (15 rows)...
2026-01-02 16:30:05,612 - dq_comparison - INFO - Generating hashes for target data (15 rows)...
2026-01-02 16:30:05,616 - dq_comparison - INFO - Hash-based Comparison Results (with duplicate handling):
2026-01-02 16:30:05,616 - dq_comparison - INFO -   • Unique source hashes: 14
2026-01-02 16:30:05,617 - dq_comparison - INFO -   • Unique target hashes: 14
2026-01-02 16:30:05,618 - dq_comparison - INFO -   • Common hashes: 14
2026-01-02 16:30:05,618 - dq_comparison - INFO -   • Common rows (counting duplicates): 15
2026-01-02 16:30:05,619 - dq_comparison - INFO -   • Rows only in source (counting duplicates): 0
2026-01-02 16:30:05,620 - dq_comparison - INFO -   • Rows only in target (counting duplicates): 0
2026-01-02 16:30:05,620 - dq_comparison - INFO - PERFORMING DETAILED COLUMN-BY-COLUMN COMPARISON...
2026-01-02 16:30:05,622 - dq_comparison - INFO - Will compare 15 rows (min of source:15 and target:15)
2026-01-02 16:30:05,636 - dq_comparison - INFO - Found 0 column value mismatches across all rows
2026-01-02 16:30:05,637 - dq_comparison - INFO - Returning counts for simple scoring:
2026-01-02 16:30:05,638 - dq_comparison - INFO -   Common rows: 15
2026-01-02 16:30:05,639 - dq_comparison - INFO -   Unique to source: 0
2026-01-02 16:30:05,639 - dq_comparison - INFO -   Unique to target: 0
2026-01-02 16:30:05,640 - dq_comparison - INFO -   Value mismatches: 0
2026-01-02 16:30:05,640 - dq_comparison - INFO - Analyzing data quality metrics...
2026-01-02 16:30:05,659 - dq_comparison - INFO - Null values - Source: 6 (4.00%), Target: 7 (4.67%)
2026-01-02 16:30:05,675 - dq_comparison - INFO - Duplicate rows (normalized) - Source: 1, Target: 1
2026-01-02 16:30:05,678 - dq_comparison - INFO - Source duplicate samples: ['Row 2', 'Row 7']
2026-01-02 16:30:05,679 - dq_comparison - INFO - Target duplicate samples: ['Row 2', 'Row 7']
2026-01-02 16:30:05,691 - dq_error_log - INFO - Retrieved 2 errors for session CMP_20260102_163005
2026-01-02 16:30:05,691 - dq_comparison - INFO - 
📊 SIMPLE SCORING CALCULATION:
2026-01-02 16:30:05,692 - dq_comparison - INFO -   Source rows: 15
2026-01-02 16:30:05,692 - dq_comparison - INFO -   Common rows (matched): 15
2026-01-02 16:30:05,693 - dq_comparison - INFO -   Calculation: (15 / 15) * 100 = 100.00%
2026-01-02 16:30:05,694 - dq_comparison - INFO -   Explanation: 15 matched rows out of 15 total source rows
2026-01-02 16:30:05,694 - dq_comparison - INFO - 
=== AUDIT LOGGING SECTION ===
2026-01-02 16:30:05,695 - dq_comparison - INFO - 🔍 Audit logging is ENABLED in APP_SETTINGS
2026-01-02 16:30:05,696 - dq_audit - INFO - Audit class initialized with database: dq_checks
2026-01-02 16:30:05,696 - dq_comparison - INFO - Attempting to log audit record for session: CMP_20260102_163005
2026-01-02 16:30:05,697 - dq_audit - INFO - Starting database insertion for comparison...
2026-01-02 16:30:05,715 - dq_audit - INFO - Inserted comparison record with ID: 509
2026-01-02 16:30:05,715 - dq_comparison - INFO - ✅ Audit record logged successfully (ID: 509)
2026-01-02 16:30:05,726 - dq_error_log - INFO - Retrieved 2 error logs for session CMP_20260102_163005
2026-01-02 16:30:05,739 - dq_error_log - INFO - Retrieved summary: 2 total errors for session CMP_20260102_163005
2026-01-02 16:30:05,740 - dq_audit - INFO - Audit class initialized with database: dq_checks
2026-01-02 16:30:05,755 - dq_audit - INFO - Retrieved 1 audit logs for session CMP_20260102_163005
2026-01-02 16:30:05,755 - dq_comparison - INFO - 
🔍 Final results verification:
2026-01-02 16:30:05,756 - dq_comparison - INFO -    Session ID: CMP_20260102_163005
2026-01-02 16:30:05,756 - dq_comparison - INFO -    DQ Score (Simple %): 100.00%
2026-01-02 16:30:05,757 - dq_comparison - INFO -    Source rows: 15
2026-01-02 16:30:05,757 - dq_comparison - INFO -    Matched rows: 15
2026-01-02 16:30:05,759 - dq_comparison - INFO -    Calculation: (15 / 15) * 100
2026-01-02 16:30:05,760 - dq_comparison - INFO - Comparison analysis completed successfully
2026-01-02 16:30:05,776 - dq_audit - INFO - Retrieved 1 audit logs for session CMP_20260102_163005
2026-01-02 16:30:05,789 - dq_error_log - INFO - Retrieved 2 error logs for session CMP_20260102_163005
2026-01-02 16:30:05,809 - dq_error_log - INFO - Retrieved summary: 2 total errors for session CMP_20260102_163005
2026-01-02 16:30:05,810 - __main__ - INFO - Comparison completed for session CMP_20260102_163004
2026-01-02 16:30:05,813 - __main__ - INFO - Completed with status 200 in 1.264s
