2026-01-28 14:42:38,281 - __main__ - INFO - 🌐 API Server Logging Initialized
2026-01-28 14:42:38,283 - __main__ - INFO - 📝 Logs saved to: logs/dq_api_20260128_144238.log
2026-01-28 14:42:38,571 - __main__ - INFO - APP_SETTINGS loaded. Audit enabled: True
2026-01-28 14:42:38,572 - __main__ - INFO - ✅ All DQ modules loaded successfully
2026-01-28 14:42:38,575 - dq_error_log - INFO - ErrorLogger initialized with database: dq_checks
2026-01-28 14:42:38,577 - dq_audit - INFO - Audit class initialized with database: dq_checks
2026-01-28 14:42:38,578 - __main__ - INFO - ✅ ErrorLogger and DataQualityAudit initialized
2026-01-28 14:42:38,600 - __main__ - INFO - 🚀 Starting Data Quality Framework API
2026-01-28 14:42:38,600 - __main__ - INFO - 📊 Modules available: True
2026-01-28 14:42:38,601 - __main__ - INFO - 🔧 Config file mode: False
2026-01-28 14:42:38,602 - __main__ - INFO - 📋 Available endpoints:
2026-01-28 14:42:38,603 - __main__ - INFO -   GET  /              - API status
2026-01-28 14:42:38,603 - __main__ - INFO -   GET  /api/health    - Health check
2026-01-28 14:42:38,605 - __main__ - INFO -   POST /api/check-single - Single source analysis
2026-01-28 14:42:38,606 - __main__ - INFO -   POST /api/compare   - Source-target comparison
2026-01-28 14:42:38,607 - __main__ - INFO -   GET  /api/compare/{id} - Get comparison results
2026-01-28 14:42:38,608 - __main__ - INFO -   GET  /api/compare/{id}/mismatches - Paginated mismatches
2026-01-28 14:42:38,609 - __main__ - INFO -   GET  /api/compare/{id}/rows/source_only - Source-only rows
2026-01-28 14:42:38,610 - __main__ - INFO -   GET  /api/compare/{id}/rows/target_only - Target-only rows
2026-01-28 14:42:38,611 - __main__ - INFO -   GET  /api/compare/{id}/rows/count - Row counts
2026-01-28 14:42:38,613 - __main__ - INFO -   POST /api/upload    - File upload
2026-01-28 14:42:38,614 - __main__ - INFO -   GET  /api/sessions  - List sessions
2026-01-28 14:42:38,615 - __main__ - INFO -   GET  /api/sessions/<id> - Get session data
2026-01-28 14:42:38,616 - __main__ - INFO -   GET  /api/debug-db  - Database debug
2026-01-28 14:42:38,617 - __main__ - INFO - 🌍 Server starting on 0.0.0.0:5000 (debug=False)
2026-01-28 14:44:19,780 - __main__ - INFO - POST /api/compare - Request started
2026-01-28 14:44:19,781 - __main__ - INFO - Comparison request - Source: database, Target: csv
2026-01-28 14:44:19,783 - __main__ - INFO - Comparison analysis request received
2026-01-28 14:44:19,783 - __main__ - INFO - DEBUG source_data from nested: {'source_type': 'database', 'db_type': 'mysql', 'host': 'localhost', 'port': 3306, 'database': 'dq_checks', 'table': 'employee', 'user': 'root', 'password': 'root'}
2026-01-28 14:44:19,784 - __main__ - INFO - Starting comparison for session CMP_20260128_144419
2026-01-28 14:44:19,785 - dq_comparison - INFO - Starting comparison analysis in UI mode
2026-01-28 14:44:19,785 - dq_comparison - INFO - LOADING SOURCE AND TARGET DATA
2026-01-28 14:44:19,787 - dq_comparison - INFO - 
==================================================
2026-01-28 14:44:19,787 - dq_comparison - INFO - 🔗 SOURCE DATA CONFIGURATION
2026-01-28 14:44:19,788 - dq_comparison - INFO - ==================================================
2026-01-28 14:44:19,788 - dq_comparison - INFO - 
🗄️ SOURCE DATABASE CONFIGURATION
2026-01-28 14:44:19,788 - dq_comparison - INFO - ----------------------------------------
2026-01-28 14:44:19,790 - dq_comparison - INFO - UI mode: Using provided database configuration for SOURCE
2026-01-28 14:44:19,790 - dq_unified - INFO - Loading data from DATABASE
2026-01-28 14:44:19,791 - dq_unified - INFO - Loading large database table: employee
2026-01-28 14:44:19,791 - dq_unified - INFO - Normalized DB config with schema: dq_checks
2026-01-28 14:44:20,020 - dq_unified - INFO - MySQL table employee has 89,999 rows
2026-01-28 14:44:20,020 - dq_unified - INFO - Loading 89,999 rows from MySQL...
2026-01-28 14:44:21,323 - dq_unified - INFO - Loaded 89,999 rows from MySQL
2026-01-28 14:44:21,918 - dq_unified - INFO - Memory optimization: 60.7MB -> 25.7MB (Saved: 35.0MB)
2026-01-28 14:44:22,003 - dq_unified - INFO - Loaded 89,999 rows, 12 columns. Memory: 207.2MB total, 25.7MB for dataframe
2026-01-28 14:44:22,004 - dq_comparison - INFO - SOURCE database loaded: 89,999 rows, 12 columns
2026-01-28 14:44:22,005 - dq_comparison - INFO - 
==================================================
2026-01-28 14:44:22,005 - dq_comparison - INFO - 🔗 TARGET DATA CONFIGURATION
2026-01-28 14:44:22,006 - dq_comparison - INFO - ==================================================
2026-01-28 14:44:22,006 - dq_comparison - INFO - DEBUG load_csv_source called for TARGET
2026-01-28 14:44:22,007 - dq_comparison - INFO - DEBUG: Using file_path from 'target_file_path': C:\\Users\\003160\\OneDrive - wisseninfotech.com\\Documents\\DQ-Checks-Shashi\\Test_data\\source_data_90k.csv
2026-01-28 14:44:22,235 - dq_comparison - INFO - TARGET CSV loaded: 89,999 rows, 12 columns
2026-01-28 14:44:22,235 - dq_comparison - INFO - Source data loaded: 89999 rows, 12 columns
2026-01-28 14:44:22,236 - dq_comparison - INFO - Target data loaded: 89999 rows, 12 columns
2026-01-28 14:44:22,236 - dq_comparison - INFO - SELECTING COLUMNS FOR COMPARISON
2026-01-28 14:44:22,237 - dq_comparison - INFO - Source columns (original): ['id', 'customer_id', 'transaction_id', 'customer_name', 'email', 'phone', 'transaction_date', 'amount', 'quantity', 'age', 'status', 'description']
2026-01-28 14:44:22,237 - dq_comparison - INFO - Target columns (original): ['id', 'customer_id', 'transaction_id', 'customer_name', 'email', 'phone', 'transaction_date', 'amount', 'quantity', 'age', 'status', 'description']
2026-01-28 14:44:22,238 - dq_comparison - INFO - Common columns lowercased: ['phone', 'quantity', 'customer_name', 'transaction_date', 'id', 'status', 'email', 'transaction_id', 'description', 'age', 'amount', 'customer_id']
2026-01-28 14:44:22,238 - dq_comparison - INFO - Found 12 common columns between source and target (case-insensitive)
2026-01-28 14:44:22,239 - dq_comparison - INFO - User column selection input: all
2026-01-28 14:44:22,239 - dq_comparison - INFO - User selected ALL common columns for comparison
2026-01-28 14:44:22,240 - dq_comparison - INFO - Selected 12 columns for comparison: ['phone', 'quantity', 'customer_name', 'transaction_date', 'id']...
2026-01-28 14:44:22,240 - dq_comparison - INFO - GENERATING COMPREHENSIVE COMPARISON REPORT
2026-01-28 14:44:22,241 - dq_comparison - INFO - Report details - Source: Database: mysql - dq_checks.employee, Target: CSV: source_data_90k.csv, Selected columns: 12
2026-01-28 14:44:22,241 - dq_comparison - INFO - Initializing Error Logger...
2026-01-28 14:44:22,242 - dq_error_log - INFO - ErrorLogger initialized with database: dq_checks
2026-01-28 14:44:22,275 - dq_error_log - INFO - Database connection successful
2026-01-28 14:44:22,276 - dq_comparison - INFO - Session ID: CMP_20260128_144422
2026-01-28 14:44:22,277 - dq_comparison - INFO - ✅ Row counts match: 89,999 rows
2026-01-28 14:44:22,278 - dq_comparison - INFO - Comparing column structures...
2026-01-28 14:44:22,279 - dq_comparison - WARNING - Found 12 incompatible data type mismatches
2026-01-28 14:44:22,279 - dq_comparison - INFO - Column structure comparison complete. Match: False
2026-01-28 14:44:22,279 - dq_comparison - INFO - Validating primary key/unique fields...
2026-01-28 14:44:22,280 - dq_comparison - INFO - Checking key fields: ['id', 'customer_id']
2026-01-28 14:44:22,299 - dq_comparison - WARNING - Field 'id' has duplicates in source: 406 rows
2026-01-28 14:44:22,300 - dq_comparison - WARNING - Field 'id' has duplicates in target: 406 rows
2026-01-28 14:44:22,333 - dq_comparison - WARNING - Field 'customer_id' has duplicates in source: 806 rows
2026-01-28 14:44:22,334 - dq_comparison - WARNING - Field 'customer_id' has duplicates in target: 804 rows
2026-01-28 14:44:22,334 - dq_comparison - INFO - Primary key validation complete. Passed: False
2026-01-28 14:44:22,400 - dq_comparison - INFO - Comparing table-level metadata...
2026-01-28 14:44:23,434 - dq_comparison - INFO - Table metadata comparison complete. Match: False
2026-01-28 14:44:23,451 - dq_comparison - INFO - SECOND CHECK: HASH-BASED COMPARISON WITH PERFECT NORMALIZATION
2026-01-28 14:44:23,508 - dq_comparison - INFO - Starting comparison of 179,998 total rows...
2026-01-28 14:44:23,509 - dq_comparison - INFO - === DEBUG: DATA TYPE CHECK ===
2026-01-28 14:44:23,510 - dq_comparison - INFO - Column: phone
2026-01-28 14:44:23,510 - dq_comparison - INFO -   Source type: <class 'str'>, value: 212-127-8383
2026-01-28 14:44:23,510 - dq_comparison - INFO -   Target type: <class 'str'>, value: 212-127-8383
2026-01-28 14:44:23,511 - dq_comparison - INFO -   Normalized: '2121278383' vs '2121278383'
2026-01-28 14:44:23,511 - dq_comparison - INFO -   Match: True
2026-01-28 14:44:23,512 - dq_comparison - INFO - Column: quantity
2026-01-28 14:44:23,512 - dq_comparison - INFO -   Source type: <class 'str'>, value: 41
2026-01-28 14:44:23,513 - dq_comparison - INFO -   Target type: <class 'numpy.int64'>, value: 41
2026-01-28 14:44:23,513 - dq_comparison - INFO -   Normalized: '41' vs '41'
2026-01-28 14:44:23,514 - dq_comparison - INFO -   Match: True
2026-01-28 14:44:23,515 - dq_comparison - INFO - Column: customer_name
2026-01-28 14:44:23,515 - dq_comparison - INFO -   Source type: <class 'str'>, value:   Michael Davis  
2026-01-28 14:44:23,516 - dq_comparison - INFO -   Target type: <class 'str'>, value: Michael Davis
2026-01-28 14:44:23,516 - dq_comparison - INFO -   Normalized: 'michael davis' vs 'michael davis'
2026-01-28 14:44:23,517 - dq_comparison - INFO -   Match: True
2026-01-28 14:44:23,517 - dq_comparison - INFO - Source DF columns: ['id', 'customer_id', 'transaction_id', 'customer_name', 'email', 'phone', 'transaction_date', 'amount', 'quantity', 'age', 'status', 'description']
2026-01-28 14:44:23,518 - dq_comparison - INFO - Target DF columns: ['id', 'customer_id', 'transaction_id', 'customer_name', 'email', 'phone', 'transaction_date', 'amount', 'quantity', 'age', 'status', 'description']
2026-01-28 14:44:23,518 - dq_comparison - INFO - Selected columns for comparison: ['phone', 'quantity', 'customer_name', 'transaction_date', 'id', 'status', 'email', 'transaction_id', 'description', 'age', 'amount', 'customer_id']
2026-01-28 14:44:23,519 - dq_comparison - INFO - Using 12 common columns for hash comparison
2026-01-28 14:44:23,519 - dq_comparison - INFO - Source columns: ['phone', 'quantity', 'customer_name', 'transaction_date', 'id', 'status', 'email', 'transaction_id', 'description', 'age', 'amount', 'customer_id']
2026-01-28 14:44:23,520 - dq_comparison - INFO - Target columns: ['phone', 'quantity', 'customer_name', 'transaction_date', 'id', 'status', 'email', 'transaction_id', 'description', 'age', 'amount', 'customer_id']
2026-01-28 14:44:23,521 - dq_comparison - INFO - Generating hashes for source data (89999 rows)...
2026-01-28 14:44:28,688 - dq_comparison - INFO -    Hashing source data: 10.0% complete (18,000/179,998 rows)
2026-01-28 14:44:32,391 - dq_comparison - INFO -    Hashing source data: 20.0% complete (36,000/179,998 rows)
2026-01-28 14:44:35,542 - dq_comparison - INFO -    Hashing source data: 27.8% complete (50,000/179,998 rows)
2026-01-28 14:44:39,120 - dq_comparison - INFO -    Hashing source data: 37.8% complete (68,000/179,998 rows)
2026-01-28 14:44:42,391 - dq_comparison - INFO -    Hashing source data: 47.8% complete (86,000/179,998 rows)
2026-01-28 14:44:43,178 - dq_comparison - INFO - === DEBUG: SAMPLE HASHES ===
2026-01-28 14:44:43,180 - dq_comparison - INFO - Hash 1: 5b77237971306189... (sample row 0)
2026-01-28 14:44:43,181 - dq_comparison - INFO - Hash 2: ce30d6f697902b95... (sample row 1)
2026-01-28 14:44:43,181 - dq_comparison - INFO - Hash 3: a2d2755af53918a0... (sample row 2)
2026-01-28 14:44:43,182 - dq_comparison - INFO - Generating hashes for target data (89999 rows)...
2026-01-28 14:44:45,112 - dq_comparison - INFO -    Hashing target data: 55.6% complete (100,000/179,998 rows)
2026-01-28 14:44:49,484 - dq_comparison - INFO -    Hashing target data: 65.6% complete (118,000/179,998 rows)
2026-01-28 14:44:54,383 - dq_comparison - INFO -    Hashing target data: 75.6% complete (136,000/179,998 rows)
2026-01-28 14:44:58,777 - dq_comparison - INFO -    Hashing target data: 83.3% complete (150,000/179,998 rows)
2026-01-28 14:45:03,893 - dq_comparison - INFO -    Hashing target data: 93.3% complete (168,000/179,998 rows)
2026-01-28 14:45:07,252 - dq_comparison - INFO - 
======================================================================
2026-01-28 14:45:07,253 - dq_comparison - INFO - 🔍 DEBUG: ANALYZING WHY HASHES DON'T MATCH
2026-01-28 14:45:07,254 - dq_comparison - INFO - ======================================================================
2026-01-28 14:45:07,255 - dq_comparison - INFO - 
--- Analyzing Row 0 ---
2026-01-28 14:45:07,256 - dq_comparison - INFO - Column 'phone' → 'phone':
2026-01-28 14:45:07,256 - dq_comparison - INFO -   Source: '212-127-8383' (type: str) → '2121278383'
2026-01-28 14:45:07,257 - dq_comparison - INFO -   Target: '212-127-8383' (type: str) → '2121278383'
2026-01-28 14:45:07,257 - dq_comparison - INFO -   Match after normalization: ✅ YES
2026-01-28 14:45:07,258 - dq_comparison - INFO - Column 'quantity' → 'quantity':
2026-01-28 14:45:07,259 - dq_comparison - INFO -   Source: '41' (type: str) → '41'
2026-01-28 14:45:07,259 - dq_comparison - INFO -   Target: '41' (type: int64) → '41'
2026-01-28 14:45:07,260 - dq_comparison - INFO -   Match after normalization: ✅ YES
2026-01-28 14:45:07,260 - dq_comparison - INFO - Column 'customer_name' → 'customer_name':
2026-01-28 14:45:07,261 - dq_comparison - INFO -   Source: '  Michael Davis  ' (type: str) → 'michael davis'
2026-01-28 14:45:07,262 - dq_comparison - INFO -   Target: 'Michael Davis' (type: str) → 'michael davis'
2026-01-28 14:45:07,262 - dq_comparison - INFO -   Match after normalization: ✅ YES
2026-01-28 14:45:07,263 - dq_comparison - INFO - Column 'transaction_date' → 'transaction_date':
2026-01-28 14:45:07,264 - dq_comparison - INFO -   Source: '04-10-2023' (type: str) → '2023-10-04'
2026-01-28 14:45:07,265 - dq_comparison - INFO -   Target: '04-10-2023' (type: str) → '2023-10-04'
2026-01-28 14:45:07,266 - dq_comparison - INFO -   Match after normalization: ✅ YES
2026-01-28 14:45:07,266 - dq_comparison - INFO - Column 'id' → 'id':
2026-01-28 14:45:07,267 - dq_comparison - INFO -   Source: '78303' (type: str) → '78303'
2026-01-28 14:45:07,268 - dq_comparison - INFO -   Target: '78303' (type: int64) → '78303'
2026-01-28 14:45:07,268 - dq_comparison - INFO -   Match after normalization: ✅ YES
2026-01-28 14:45:07,269 - dq_comparison - INFO - 
Hash components for Row 0:
2026-01-28 14:45:07,269 - dq_comparison - INFO - Source hash string start: 2121278383|41|michael davis...
2026-01-28 14:45:07,271 - dq_comparison - INFO - Target hash string start: 2121278383|41|michael davis...
2026-01-28 14:45:07,271 - dq_comparison - INFO - Same? ✅ YES
2026-01-28 14:45:07,272 - dq_comparison - INFO - 
--- Analyzing Row 1 ---
2026-01-28 14:45:07,274 - dq_comparison - INFO - Column 'phone' → 'phone':
2026-01-28 14:45:07,274 - dq_comparison - INFO -   Source: 'None' (type: NoneType) → 'NULL'
2026-01-28 14:45:07,275 - dq_comparison - INFO -   Target: '(212) 706-7216' (type: str) → '2127067216'
2026-01-28 14:45:07,276 - dq_comparison - INFO -   Match after normalization: ❌ NO
2026-01-28 14:45:07,276 - dq_comparison - INFO - Column 'quantity' → 'quantity':
2026-01-28 14:45:07,277 - dq_comparison - INFO -   Source: '73' (type: str) → '73'
2026-01-28 14:45:07,277 - dq_comparison - INFO -   Target: '73' (type: int64) → '73'
2026-01-28 14:45:07,278 - dq_comparison - INFO -   Match after normalization: ✅ YES
2026-01-28 14:45:07,278 - dq_comparison - INFO - Column 'customer_name' → 'customer_name':
2026-01-28 14:45:07,279 - dq_comparison - INFO -   Source: 'Susan Brown' (type: str) → 'susan brown'
2026-01-28 14:45:07,280 - dq_comparison - INFO -   Target: 'Susan Brown' (type: str) → 'susan brown'
2026-01-28 14:45:07,280 - dq_comparison - INFO -   Match after normalization: ✅ YES
2026-01-28 14:45:07,281 - dq_comparison - INFO - Column 'transaction_date' → 'transaction_date':
2026-01-28 14:45:07,281 - dq_comparison - INFO -   Source: '04-07-2023' (type: str) → '2023-07-04'
2026-01-28 14:45:07,281 - dq_comparison - INFO -   Target: '04-07-2023' (type: str) → '2023-07-04'
2026-01-28 14:45:07,282 - dq_comparison - INFO -   Match after normalization: ✅ YES
2026-01-28 14:45:07,282 - dq_comparison - INFO - Column 'id' → 'id':
2026-01-28 14:45:07,283 - dq_comparison - INFO -   Source: '66465' (type: str) → '66465'
2026-01-28 14:45:07,283 - dq_comparison - INFO -   Target: '66465' (type: int64) → '66465'
2026-01-28 14:45:07,283 - dq_comparison - INFO -   Match after normalization: ✅ YES
2026-01-28 14:45:07,284 - dq_comparison - INFO - 
Hash components for Row 1:
2026-01-28 14:45:07,284 - dq_comparison - INFO - Source hash string start: NULL|73|susan brown...
2026-01-28 14:45:07,285 - dq_comparison - INFO - Target hash string start: 2127067216|73|susan brown...
2026-01-28 14:45:07,285 - dq_comparison - INFO - Same? ❌ NO
2026-01-28 14:45:07,286 - dq_comparison - INFO - 
--- Analyzing Row 2 ---
2026-01-28 14:45:07,286 - dq_comparison - INFO - Column 'phone' → 'phone':
2026-01-28 14:45:07,288 - dq_comparison - INFO -   Source: '1212392873A' (type: str) → '1212392873'
2026-01-28 14:45:07,288 - dq_comparison - INFO -   Target: '12123928735' (type: str) → '12123928735'
2026-01-28 14:45:07,289 - dq_comparison - INFO -   Match after normalization: ❌ NO
2026-01-28 14:45:07,289 - dq_comparison - INFO - Column 'quantity' → 'quantity':
2026-01-28 14:45:07,290 - dq_comparison - INFO -   Source: '17' (type: str) → '17'
2026-01-28 14:45:07,291 - dq_comparison - INFO -   Target: '17' (type: int64) → '17'
2026-01-28 14:45:07,291 - dq_comparison - INFO -   Match after normalization: ✅ YES
2026-01-28 14:45:07,291 - dq_comparison - INFO - Column 'customer_name' → 'customer_name':
2026-01-28 14:45:07,292 - dq_comparison - INFO -   Source: 'nan' (type: float) → 'NULL'
2026-01-28 14:45:07,292 - dq_comparison - INFO -   Target: 'nan' (type: float) → 'NULL'
2026-01-28 14:45:07,292 - dq_comparison - INFO -   Match after normalization: ✅ YES
2026-01-28 14:45:07,292 - dq_comparison - INFO - Column 'transaction_date' → 'transaction_date':
2026-01-28 14:45:07,293 - dq_comparison - INFO -   Source: '10-03-2023' (type: str) → '2023-03-10'
2026-01-28 14:45:07,293 - dq_comparison - INFO -   Target: '10-03-2023' (type: str) → '2023-03-10'
2026-01-28 14:45:07,294 - dq_comparison - INFO -   Match after normalization: ✅ YES
2026-01-28 14:45:07,294 - dq_comparison - INFO - Column 'id' → 'id':
2026-01-28 14:45:07,295 - dq_comparison - INFO -   Source: '93228' (type: str) → '93228'
2026-01-28 14:45:07,296 - dq_comparison - INFO -   Target: '93228' (type: int64) → '93228'
2026-01-28 14:45:07,297 - dq_comparison - INFO -   Match after normalization: ✅ YES
2026-01-28 14:45:07,297 - dq_comparison - INFO - 
Hash components for Row 2:
2026-01-28 14:45:07,298 - dq_comparison - INFO - Source hash string start: 1212392873|17|NULL...
2026-01-28 14:45:07,299 - dq_comparison - INFO - Target hash string start: 12123928735|17|NULL...
2026-01-28 14:45:07,299 - dq_comparison - INFO - Same? ❌ NO
2026-01-28 14:45:07,299 - dq_comparison - INFO - 
--- Column Data Types Analysis ---
2026-01-28 14:45:07,300 - dq_comparison - INFO - Column 1: 'phone' (object) ↔ 'phone' (object)
2026-01-28 14:45:07,300 - dq_comparison - INFO -   Sample: Source='212-127-8383', Target='212-127-8383'
2026-01-28 14:45:07,301 - dq_comparison - INFO - Column 2: 'quantity' (category) ↔ 'quantity' (int64)
2026-01-28 14:45:07,301 - dq_comparison - INFO -   Sample: Source='41', Target='41'
2026-01-28 14:45:07,302 - dq_comparison - INFO - Column 3: 'customer_name' (category) ↔ 'customer_name' (object)
2026-01-28 14:45:07,303 - dq_comparison - INFO -   Sample: Source='  Michael Davis  ', Target='Michael Davis'
2026-01-28 14:45:07,303 - dq_comparison - INFO - Column 4: 'transaction_date' (category) ↔ 'transaction_date' (object)
2026-01-28 14:45:07,304 - dq_comparison - INFO -   Sample: Source='04-10-2023', Target='04-10-2023'
2026-01-28 14:45:07,304 - dq_comparison - INFO - Column 5: 'id' (object) ↔ 'id' (int64)
2026-01-28 14:45:07,305 - dq_comparison - INFO -   Sample: Source='78303', Target='78303'
2026-01-28 14:45:07,305 - dq_comparison - INFO - PERFORMING DETAILED ROW-LEVEL COMPARISON WITH PAGINATION...
2026-01-28 14:45:07,333 - dq_comparison - INFO - Found 18 total mismatches
2026-01-28 14:45:07,334 - dq_comparison - INFO - Will process detailed comparisons for first 18 rows
2026-01-28 14:45:07,646 - dq_comparison - INFO - 
================================================================================
2026-01-28 14:45:07,648 - dq_comparison - INFO - DETAILED MISMATCH SUMMARY:
2026-01-28 14:45:07,649 - dq_comparison - INFO -   Total mismatches found: 9
2026-01-28 14:45:07,650 - dq_comparison - INFO -   Detailed comparisons logged: 9
2026-01-28 14:45:07,651 - dq_comparison - INFO -   First 10 rows displayed above
2026-01-28 14:45:07,651 - dq_comparison - INFO -   All mismatches stored in database with complete data
2026-01-28 14:45:07,652 - dq_comparison - INFO - ================================================================================
2026-01-28 14:45:07,726 - dq_comparison - INFO - Hash-based Comparison Results (with duplicate handling):
2026-01-28 14:45:07,727 - dq_comparison - INFO -   • Unique source hashes: 89796
2026-01-28 14:45:07,727 - dq_comparison - INFO -   • Unique target hashes: 89796
2026-01-28 14:45:07,728 - dq_comparison - INFO -   • Common hashes: 89787
2026-01-28 14:45:07,728 - dq_comparison - INFO -   • Common rows (counting duplicates): 89,990
2026-01-28 14:45:07,730 - dq_comparison - INFO -   • Rows only in source (counting duplicates): 9
2026-01-28 14:45:07,730 - dq_comparison - INFO -   • Rows only in target (counting duplicates): 9
2026-01-28 14:45:07,793 - dq_comparison - INFO - HASH-ONLY COMPARISON COMPLETED
2026-01-28 14:45:07,793 - dq_comparison - INFO - Returning counts for simple scoring:
2026-01-28 14:45:07,794 - dq_comparison - INFO -   Common rows: 89,990
2026-01-28 14:45:07,795 - dq_comparison - INFO -   Unique to source: 9
2026-01-28 14:45:07,795 - dq_comparison - INFO -   Unique to target: 9
2026-01-28 14:45:07,796 - dq_comparison - INFO -   Value mismatches: 216
2026-01-28 14:45:07,796 - dq_comparison - INFO -   Missing rows: 9
2026-01-28 14:45:07,797 - dq_comparison - INFO -   Extra rows: 9
2026-01-28 14:45:07,797 - dq_comparison - INFO - 
========================================================================================================================
COMPARISON: Mysql Database vs CSV (source_data_90k.csv)
========================================================================================================================
Row   | Diff Count | Source (Sample)                          | Target (Sample)                         
------------------------------------------------------------------------------------------------------------------------
2     | 2          | phone: 212-127-8383                      | phone: 212-127-8383                     
3     | 2          | phone: NULL                              | phone: (212) 706-7216                   
4     | 3          | phone: 1212392873A                       | phone: 12123928735                      
5     | 2          | phone: 2125-982-408                      | phone: 2125982408                       
6     | 1          | phone: (212) 876-9757                    | phone: (212) 876-9757                   
7     | 2          | phone: NULL                              | phone: 212-752-8338                     
8     | 1          | phone: 212-648-2980                      | phone: 212-648-2980                     
9     | 2          | phone: 12128295968                       | phone: 12128295968                      
10    | 1          | phone: 2126087878                        | phone: 2126087878                       
------------------------------------------------------------------------------------------------------------------------
Showing all 9 mismatched rows.
========================================================================================================================
2026-01-28 14:45:07,798 - dq_comparison - INFO - Returning enhanced mismatch structure with 9 detailed mismatches
2026-01-28 14:45:07,845 - dq_comparison - INFO - New structure: 9 detailed mismatches
2026-01-28 14:45:07,846 - dq_comparison - INFO - Analyzing data quality metrics...
2026-01-28 14:45:25,603 - dq_comparison - INFO - Null values - Source: 7442 (0.69%), Target: 7439 (0.69%)
2026-01-28 14:45:26,090 - dq_comparison - INFO - Duplicate rows (normalized) - Source: 203, Target: 203
2026-01-28 14:45:26,360 - dq_comparison - INFO - Source duplicate samples: ['Row 169', 'Row 383', 'Row 639']
2026-01-28 14:45:26,557 - dq_comparison - INFO - Target duplicate samples: ['Row 169', 'Row 383', 'Row 639']
2026-01-28 14:45:26,601 - dq_error_log - INFO - Retrieved 14 error logs for session CMP_20260128_144422
2026-01-28 14:45:26,602 - dq_comparison - INFO - 
📊 SIMPLE SCORING CALCULATION:
2026-01-28 14:45:26,603 - dq_comparison - INFO -   Source rows: 89999
2026-01-28 14:45:26,604 - dq_comparison - INFO -   Common rows (matched): 89990
2026-01-28 14:45:26,605 - dq_comparison - INFO -   Calculation: (89990 / 89999) * 100 = 99.99%
2026-01-28 14:45:26,606 - dq_comparison - INFO -   Explanation: 89990 matched rows out of 89999 total source rows
2026-01-28 14:45:26,606 - dq_comparison - INFO - 
=== AUDIT LOGGING SECTION ===
2026-01-28 14:45:26,607 - dq_comparison - INFO - 🔍 Audit logging is ENABLED in APP_SETTINGS
2026-01-28 14:45:26,608 - dq_audit - INFO - Audit class initialized with database: dq_checks
2026-01-28 14:45:26,609 - dq_comparison - INFO - Attempting to log audit record for session: CMP_20260128_144422
2026-01-28 14:45:26,610 - dq_audit - INFO - Starting database insertion for comparison...
2026-01-28 14:45:26,630 - dq_audit - INFO - Inserted comparison record with ID: 826
2026-01-28 14:45:26,631 - dq_comparison - INFO - ✅ Audit record logged successfully (ID: 826)
2026-01-28 14:45:26,646 - dq_error_log - INFO - Retrieved 14 error logs for session CMP_20260128_144422
2026-01-28 14:45:26,662 - dq_error_log - INFO - Retrieved summary: 14 total errors for session CMP_20260128_144422
2026-01-28 14:45:26,664 - dq_audit - INFO - Audit class initialized with database: dq_checks
2026-01-28 14:45:26,685 - dq_audit - INFO - Retrieved 1 audit logs for session CMP_20260128_144422
2026-01-28 14:45:26,686 - dq_comparison - INFO - 
🔍 Final results verification:
2026-01-28 14:45:26,686 - dq_comparison - INFO -    Session ID: CMP_20260128_144422
2026-01-28 14:45:26,687 - dq_comparison - INFO -    DQ Score (Simple %): 99.99%
2026-01-28 14:45:26,688 - dq_comparison - INFO -    Source rows: 89999
2026-01-28 14:45:26,688 - dq_comparison - INFO -    Matched rows: 89990
2026-01-28 14:45:26,689 - dq_comparison - INFO -    Calculation: (89990 / 89999) * 100
2026-01-28 14:45:26,689 - dq_comparison - INFO - Comparison analysis completed successfully
2026-01-28 14:45:26,850 - dq_audit - INFO - Retrieved 1 audit logs for session CMP_20260128_144422
2026-01-28 14:45:26,870 - dq_error_log - INFO - Retrieved 14 error logs for session CMP_20260128_144422
2026-01-28 14:45:26,889 - dq_error_log - INFO - Retrieved summary: 14 total errors for session CMP_20260128_144422
2026-01-28 14:45:26,891 - __main__ - INFO - Comparison completed for session CMP_20260128_144419
2026-01-28 14:45:26,893 - __main__ - INFO - Response size: 2,383 bytes
2026-01-28 14:45:26,897 - __main__ - INFO - Completed with status 200 in 67.117s
2026-01-28 14:49:01,201 - __main__ - INFO - POST /api/compare - Request started
2026-01-28 14:49:01,202 - __main__ - INFO - Comparison request - Source: database, Target: csv
2026-01-28 14:49:01,202 - __main__ - INFO - Comparison analysis request received
2026-01-28 14:49:01,204 - __main__ - INFO - DEBUG source_data from nested: {'source_type': 'database', 'db_type': 'mysql', 'host': 'localhost', 'port': 3306, 'database': 'dq_checks', 'table': 'customers_bkp', 'user': 'root', 'password': 'root'}
2026-01-28 14:49:01,204 - __main__ - INFO - Starting comparison for session CMP_20260128_144901
2026-01-28 14:49:01,205 - dq_comparison - INFO - Starting comparison analysis in UI mode
2026-01-28 14:49:01,206 - dq_comparison - INFO - LOADING SOURCE AND TARGET DATA
2026-01-28 14:49:01,206 - dq_comparison - INFO - 
==================================================
2026-01-28 14:49:01,206 - dq_comparison - INFO - 🔗 SOURCE DATA CONFIGURATION
2026-01-28 14:49:01,207 - dq_comparison - INFO - ==================================================
2026-01-28 14:49:01,207 - dq_comparison - INFO - 
🗄️ SOURCE DATABASE CONFIGURATION
2026-01-28 14:49:01,208 - dq_comparison - INFO - ----------------------------------------
2026-01-28 14:49:01,208 - dq_comparison - INFO - UI mode: Using provided database configuration for SOURCE
2026-01-28 14:49:01,209 - dq_unified - INFO - Loading data from DATABASE
2026-01-28 14:49:01,209 - dq_unified - INFO - Loading large database table: customers_bkp
2026-01-28 14:49:01,210 - dq_unified - INFO - Normalized DB config with schema: dq_checks
2026-01-28 14:49:01,252 - dq_unified - INFO - MySQL table customers_bkp has 12 rows
2026-01-28 14:49:01,252 - dq_unified - INFO - Loading 12 rows from MySQL...
2026-01-28 14:49:01,258 - dq_unified - INFO - Loaded 12 rows from MySQL
2026-01-28 14:49:01,263 - dq_unified - INFO - Memory optimization: 0.0MB -> 0.0MB (Saved: 0.0MB)
2026-01-28 14:49:01,265 - dq_unified - INFO - Loaded 12 rows, 10 columns. Memory: 153.6MB total, 0.0MB for dataframe
2026-01-28 14:49:01,266 - dq_comparison - INFO - SOURCE database loaded: 12 rows, 10 columns
2026-01-28 14:49:01,267 - dq_comparison - INFO - 
==================================================
2026-01-28 14:49:01,267 - dq_comparison - INFO - 🔗 TARGET DATA CONFIGURATION
2026-01-28 14:49:01,268 - dq_comparison - INFO - ==================================================
2026-01-28 14:49:01,269 - dq_comparison - INFO - DEBUG load_csv_source called for TARGET
2026-01-28 14:49:01,269 - dq_comparison - INFO - DEBUG: Using file_path from 'target_file_path': C:\\Users\\003160\\OneDrive - wisseninfotech.com\\Documents\\DQ-Checks-Shashi\\Test_data\\sample_data.csv
2026-01-28 14:49:01,273 - dq_comparison - INFO - TARGET CSV loaded: 15 rows, 10 columns
2026-01-28 14:49:01,274 - dq_comparison - INFO - Source data loaded: 12 rows, 10 columns
2026-01-28 14:49:01,274 - dq_comparison - INFO - Target data loaded: 15 rows, 10 columns
2026-01-28 14:49:01,275 - dq_comparison - INFO - SELECTING COLUMNS FOR COMPARISON
2026-01-28 14:49:01,275 - dq_comparison - INFO - Source columns (original): ['CustomerName', 'Email', 'Phone', 'Salary', 'Department', 'JoinDate', 'PostalCode', 'City', 'Country', 'State']
2026-01-28 14:49:01,276 - dq_comparison - INFO - Target columns (original): ['CustomerName', 'Email', 'Phone', 'Salary', 'Department', 'JoinDate', 'PostalCode', 'City', 'Country', 'State']
2026-01-28 14:49:01,276 - dq_comparison - INFO - Common columns lowercased: ['phone', 'state', 'country', 'city', 'department', 'postalcode', 'customername', 'email', 'salary', 'joindate']
2026-01-28 14:49:01,277 - dq_comparison - INFO - Found 10 common columns between source and target (case-insensitive)
2026-01-28 14:49:01,278 - dq_comparison - INFO - User column selection input: all
2026-01-28 14:49:01,278 - dq_comparison - INFO - User selected ALL common columns for comparison
2026-01-28 14:49:01,278 - dq_comparison - INFO - Selected 10 columns for comparison: ['Phone', 'State', 'Country', 'City', 'Department']...
2026-01-28 14:49:01,279 - dq_comparison - INFO - GENERATING COMPREHENSIVE COMPARISON REPORT
2026-01-28 14:49:01,279 - dq_comparison - INFO - Report details - Source: Database: mysql - dq_checks.customers_bkp, Target: CSV: sample_data.csv, Selected columns: 10
2026-01-28 14:49:01,280 - dq_comparison - INFO - Initializing Error Logger...
2026-01-28 14:49:01,281 - dq_error_log - INFO - ErrorLogger initialized with database: dq_checks
2026-01-28 14:49:01,294 - dq_error_log - INFO - Database connection successful
2026-01-28 14:49:01,295 - dq_comparison - INFO - Session ID: CMP_20260128_144901
2026-01-28 14:49:01,295 - dq_comparison - WARNING - ❌ Row count mismatch: Source=12, Target=15, Difference=3
2026-01-28 14:49:01,296 - dq_comparison - WARNING -    Extra in target: 3 rows
2026-01-28 14:49:01,296 - dq_comparison - INFO - Comparing column structures...
2026-01-28 14:49:01,297 - dq_comparison - WARNING - Found 8 incompatible data type mismatches
2026-01-28 14:49:01,298 - dq_comparison - INFO - Column structure comparison complete. Match: False
2026-01-28 14:49:01,298 - dq_comparison - INFO - Validating primary key/unique fields...
2026-01-28 14:49:01,299 - dq_comparison - INFO - Checking key fields: ['PostalCode']
2026-01-28 14:49:01,301 - dq_comparison - WARNING - Field 'PostalCode' has duplicates in source: 4 rows
2026-01-28 14:49:01,302 - dq_comparison - INFO - Primary key validation complete. Passed: False
2026-01-28 14:49:01,313 - dq_comparison - INFO - Comparing table-level metadata...
2026-01-28 14:49:01,324 - dq_comparison - INFO - Table metadata comparison complete. Match: False
2026-01-28 14:49:01,336 - dq_comparison - INFO - SECOND CHECK: HASH-BASED COMPARISON WITH PERFECT NORMALIZATION
2026-01-28 14:49:01,339 - dq_comparison - INFO - Starting comparison of 27 total rows...
2026-01-28 14:49:01,340 - dq_comparison - INFO - === DEBUG: DATA TYPE CHECK ===
2026-01-28 14:49:01,340 - dq_comparison - INFO - Column: Phone
2026-01-28 14:49:01,340 - dq_comparison - INFO -   Source type: <class 'str'>, value: 1234567890
2026-01-28 14:49:01,341 - dq_comparison - INFO -   Target type: <class 'numpy.int64'>, value: 1234567890
2026-01-28 14:49:01,341 - dq_comparison - INFO -   Normalized: '1234567890' vs '1234567890'
2026-01-28 14:49:01,342 - dq_comparison - INFO -   Match: True
2026-01-28 14:49:01,342 - dq_comparison - INFO - Column: State
2026-01-28 14:49:01,343 - dq_comparison - INFO -   Source type: <class 'str'>, value: TS
2026-01-28 14:49:01,343 - dq_comparison - INFO -   Target type: <class 'str'>, value: TS
2026-01-28 14:49:01,344 - dq_comparison - INFO -   Normalized: 'ts' vs 'ts'
2026-01-28 14:49:01,344 - dq_comparison - INFO -   Match: True
2026-01-28 14:49:01,345 - dq_comparison - INFO - Column: Country
2026-01-28 14:49:01,345 - dq_comparison - INFO -   Source type: <class 'str'>, value: USA
2026-01-28 14:49:01,345 - dq_comparison - INFO -   Target type: <class 'str'>, value: USA
2026-01-28 14:49:01,346 - dq_comparison - INFO -   Normalized: 'usa' vs 'usa'
2026-01-28 14:49:01,346 - dq_comparison - INFO -   Match: True
2026-01-28 14:49:01,347 - dq_comparison - INFO - Source DF columns: ['CustomerName', 'Email', 'Phone', 'Salary', 'Department', 'JoinDate', 'PostalCode', 'City', 'Country', 'State']
2026-01-28 14:49:01,348 - dq_comparison - INFO - Target DF columns: ['CustomerName', 'Email', 'Phone', 'Salary', 'Department', 'JoinDate', 'PostalCode', 'City', 'Country', 'State']
2026-01-28 14:49:01,348 - dq_comparison - INFO - Selected columns for comparison: ['Phone', 'State', 'Country', 'City', 'Department', 'PostalCode', 'CustomerName', 'Email', 'Salary', 'JoinDate']
2026-01-28 14:49:01,349 - dq_comparison - INFO - Using 10 common columns for hash comparison
2026-01-28 14:49:01,349 - dq_comparison - INFO - Source columns: ['Phone', 'State', 'Country', 'City', 'Department', 'PostalCode', 'CustomerName', 'Email', 'Salary', 'JoinDate']
2026-01-28 14:49:01,350 - dq_comparison - INFO - Target columns: ['Phone', 'State', 'Country', 'City', 'Department', 'PostalCode', 'CustomerName', 'Email', 'Salary', 'JoinDate']
2026-01-28 14:49:01,350 - dq_comparison - INFO - Generating hashes for source data (12 rows)...
2026-01-28 14:49:01,354 - dq_comparison - INFO -    Hashing source data: 11.1% complete (3/27 rows)
2026-01-28 14:49:01,356 - dq_comparison - INFO -    Hashing source data: 22.2% complete (6/27 rows)
2026-01-28 14:49:01,357 - dq_comparison - INFO -    Hashing source data: 33.3% complete (9/27 rows)
2026-01-28 14:49:01,358 - dq_comparison - INFO -    Hashing source data: 44.4% complete (12/27 rows)
2026-01-28 14:49:01,359 - dq_comparison - INFO - === DEBUG: SAMPLE HASHES ===
2026-01-28 14:49:01,360 - dq_comparison - INFO - Hash 1: c1ef85d4bcce4cc3... (sample row 0)
2026-01-28 14:49:01,360 - dq_comparison - INFO - Hash 2: 84ff6a4767c30b73... (sample row 1)
2026-01-28 14:49:01,361 - dq_comparison - INFO - Hash 3: 0af0f20ed07fdfb5... (sample row 2)
2026-01-28 14:49:01,362 - dq_comparison - INFO - Generating hashes for target data (15 rows)...
2026-01-28 14:49:01,363 - dq_comparison - INFO -    Hashing target data: 55.6% complete (15/27 rows)
2026-01-28 14:49:01,365 - dq_comparison - INFO -    Hashing target data: 66.7% complete (18/27 rows)
2026-01-28 14:49:01,366 - dq_comparison - INFO -    Hashing target data: 77.8% complete (21/27 rows)
2026-01-28 14:49:01,366 - dq_comparison - INFO -    Hashing target data: 88.9% complete (24/27 rows)
2026-01-28 14:49:01,369 - dq_comparison - INFO -    Hashing target data: 100.0% complete (27/27 rows)
2026-01-28 14:49:01,370 - dq_comparison - INFO - 
======================================================================
2026-01-28 14:49:01,371 - dq_comparison - INFO - 🔍 DEBUG: ANALYZING WHY HASHES DON'T MATCH
2026-01-28 14:49:01,371 - dq_comparison - INFO - ======================================================================
2026-01-28 14:49:01,372 - dq_comparison - INFO - 
--- Analyzing Row 0 ---
2026-01-28 14:49:01,373 - dq_comparison - INFO - Column 'Phone' → 'Phone':
2026-01-28 14:49:01,374 - dq_comparison - INFO -   Source: '1234567890' (type: str) → '1234567890'
2026-01-28 14:49:01,375 - dq_comparison - INFO -   Target: '1234567890' (type: int64) → '1234567890'
2026-01-28 14:49:01,375 - dq_comparison - INFO -   Match after normalization: ✅ YES
2026-01-28 14:49:01,376 - dq_comparison - INFO - Column 'State' → 'State':
2026-01-28 14:49:01,376 - dq_comparison - INFO -   Source: 'TS' (type: str) → 'ts'
2026-01-28 14:49:01,377 - dq_comparison - INFO -   Target: 'TS' (type: str) → 'ts'
2026-01-28 14:49:01,377 - dq_comparison - INFO -   Match after normalization: ✅ YES
2026-01-28 14:49:01,378 - dq_comparison - INFO - Column 'Country' → 'Country':
2026-01-28 14:49:01,379 - dq_comparison - INFO -   Source: 'USA' (type: str) → 'usa'
2026-01-28 14:49:01,379 - dq_comparison - INFO -   Target: 'USA' (type: str) → 'usa'
2026-01-28 14:49:01,380 - dq_comparison - INFO -   Match after normalization: ✅ YES
2026-01-28 14:49:01,380 - dq_comparison - INFO - Column 'City' → 'City':
2026-01-28 14:49:01,381 - dq_comparison - INFO -   Source: 'New York' (type: str) → 'new york'
2026-01-28 14:49:01,381 - dq_comparison - INFO -   Target: 'New York' (type: str) → 'new york'
2026-01-28 14:49:01,382 - dq_comparison - INFO -   Match after normalization: ✅ YES
2026-01-28 14:49:01,382 - dq_comparison - INFO - Column 'Department' → 'Department':
2026-01-28 14:49:01,383 - dq_comparison - INFO -   Source: 'IT' (type: str) → 'it'
2026-01-28 14:49:01,385 - dq_comparison - INFO -   Target: 'IT             ' (type: str) → 'it'
2026-01-28 14:49:01,385 - dq_comparison - INFO -   Match after normalization: ✅ YES
2026-01-28 14:49:01,386 - dq_comparison - INFO - 
Hash components for Row 0:
2026-01-28 14:49:01,387 - dq_comparison - INFO - Source hash string start: 1234567890|ts|usa...
2026-01-28 14:49:01,387 - dq_comparison - INFO - Target hash string start: 1234567890|ts|usa...
2026-01-28 14:49:01,389 - dq_comparison - INFO - Same? ✅ YES
2026-01-28 14:49:01,390 - dq_comparison - INFO - 
--- Analyzing Row 1 ---
2026-01-28 14:49:01,391 - dq_comparison - INFO - Column 'Phone' → 'Phone':
2026-01-28 14:49:01,392 - dq_comparison - INFO -   Source: '9876543210' (type: str) → '9876543210'
2026-01-28 14:49:01,392 - dq_comparison - INFO -   Target: '9876543210' (type: int64) → '9876543210'
2026-01-28 14:49:01,393 - dq_comparison - INFO -   Match after normalization: ✅ YES
2026-01-28 14:49:01,393 - dq_comparison - INFO - Column 'State' → 'State':
2026-01-28 14:49:01,394 - dq_comparison - INFO -   Source: 'AP' (type: str) → 'ap'
2026-01-28 14:49:01,395 - dq_comparison - INFO -   Target: 'AP' (type: str) → 'ap'
2026-01-28 14:49:01,395 - dq_comparison - INFO -   Match after normalization: ✅ YES
2026-01-28 14:49:01,396 - dq_comparison - INFO - Column 'Country' → 'Country':
2026-01-28 14:49:01,397 - dq_comparison - INFO -   Source: 'USA' (type: str) → 'usa'
2026-01-28 14:49:01,397 - dq_comparison - INFO -   Target: 'USA' (type: str) → 'usa'
2026-01-28 14:49:01,398 - dq_comparison - INFO -   Match after normalization: ✅ YES
2026-01-28 14:49:01,399 - dq_comparison - INFO - Column 'City' → 'City':
2026-01-28 14:49:01,400 - dq_comparison - INFO -   Source: 'India' (type: str) → 'india'
2026-01-28 14:49:01,401 - dq_comparison - INFO -   Target: 'Chicago' (type: str) → 'chicago'
2026-01-28 14:49:01,401 - dq_comparison - INFO -   Match after normalization: ❌ NO
2026-01-28 14:49:01,402 - dq_comparison - INFO - Column 'Department' → 'Department':
2026-01-28 14:49:01,403 - dq_comparison - INFO -   Source: 'HR' (type: str) → 'hr'
2026-01-28 14:49:01,404 - dq_comparison - INFO -   Target: '       HR' (type: str) → 'hr'
2026-01-28 14:49:01,405 - dq_comparison - INFO -   Match after normalization: ✅ YES
2026-01-28 14:49:01,406 - dq_comparison - INFO - 
Hash components for Row 1:
2026-01-28 14:49:01,406 - dq_comparison - INFO - Source hash string start: 9876543210|ap|usa...
2026-01-28 14:49:01,407 - dq_comparison - INFO - Target hash string start: 9876543210|ap|usa...
2026-01-28 14:49:01,408 - dq_comparison - INFO - Same? ✅ YES
2026-01-28 14:49:01,409 - dq_comparison - INFO - 
--- Analyzing Row 2 ---
2026-01-28 14:49:01,410 - dq_comparison - INFO - Column 'Phone' → 'Phone':
2026-01-28 14:49:01,410 - dq_comparison - INFO -   Source: '5551234567' (type: str) → '5551234567'
2026-01-28 14:49:01,411 - dq_comparison - INFO -   Target: '5551234567' (type: int64) → '5551234567'
2026-01-28 14:49:01,413 - dq_comparison - INFO -   Match after normalization: ✅ YES
2026-01-28 14:49:01,413 - dq_comparison - INFO - Column 'State' → 'State':
2026-01-28 14:49:01,414 - dq_comparison - INFO -   Source: 'KL' (type: str) → 'kl'
2026-01-28 14:49:01,415 - dq_comparison - INFO -   Target: 'KL' (type: str) → 'kl'
2026-01-28 14:49:01,417 - dq_comparison - INFO -   Match after normalization: ✅ YES
2026-01-28 14:49:01,418 - dq_comparison - INFO - Column 'Country' → 'Country':
2026-01-28 14:49:01,419 - dq_comparison - INFO -   Source: 'USA' (type: str) → 'usa'
2026-01-28 14:49:01,421 - dq_comparison - INFO -   Target: 'USA' (type: str) → 'usa'
2026-01-28 14:49:01,421 - dq_comparison - INFO -   Match after normalization: ✅ YES
2026-01-28 14:49:01,422 - dq_comparison - INFO - Column 'City' → 'City':
2026-01-28 14:49:01,422 - dq_comparison - INFO -   Source: 'Boston' (type: str) → 'boston'
2026-01-28 14:49:01,424 - dq_comparison - INFO -   Target: 'Boston' (type: str) → 'boston'
2026-01-28 14:49:01,424 - dq_comparison - INFO -   Match after normalization: ✅ YES
2026-01-28 14:49:01,425 - dq_comparison - INFO - Column 'Department' → 'Department':
2026-01-28 14:49:01,426 - dq_comparison - INFO -   Source: 'Finance' (type: str) → 'finance'
2026-01-28 14:49:01,426 - dq_comparison - INFO -   Target: 'Finance' (type: str) → 'finance'
2026-01-28 14:49:01,427 - dq_comparison - INFO -   Match after normalization: ✅ YES
2026-01-28 14:49:01,428 - dq_comparison - INFO - 
Hash components for Row 2:
2026-01-28 14:49:01,429 - dq_comparison - INFO - Source hash string start: 5551234567|kl|usa...
2026-01-28 14:49:01,430 - dq_comparison - INFO - Target hash string start: 5551234567|kl|usa...
2026-01-28 14:49:01,431 - dq_comparison - INFO - Same? ✅ YES
2026-01-28 14:49:01,431 - dq_comparison - INFO - 
--- Column Data Types Analysis ---
2026-01-28 14:49:01,432 - dq_comparison - INFO - Column 1: 'Phone' (object) ↔ 'Phone' (int64)
2026-01-28 14:49:01,434 - dq_comparison - INFO -   Sample: Source='1234567890', Target='1234567890'
2026-01-28 14:49:01,435 - dq_comparison - INFO - Column 2: 'State' (object) ↔ 'State' (object)
2026-01-28 14:49:01,436 - dq_comparison - INFO -   Sample: Source='TS', Target='TS'
2026-01-28 14:49:01,437 - dq_comparison - INFO - Column 3: 'Country' (category) ↔ 'Country' (object)
2026-01-28 14:49:01,437 - dq_comparison - INFO -   Sample: Source='USA', Target='USA'
2026-01-28 14:49:01,438 - dq_comparison - INFO - Column 4: 'City' (object) ↔ 'City' (object)
2026-01-28 14:49:01,439 - dq_comparison - INFO -   Sample: Source='New York', Target='New York'
2026-01-28 14:49:01,440 - dq_comparison - INFO - Column 5: 'Department' (category) ↔ 'Department' (object)
2026-01-28 14:49:01,441 - dq_comparison - INFO -   Sample: Source='IT', Target='IT             '
2026-01-28 14:49:01,442 - dq_comparison - INFO - PERFORMING DETAILED ROW-LEVEL COMPARISON WITH PAGINATION...
2026-01-28 14:49:01,443 - dq_comparison - INFO - Found 10 total mismatches
2026-01-28 14:49:01,443 - dq_comparison - INFO - Will process detailed comparisons for first 10 rows
2026-01-28 14:49:01,550 - dq_comparison - INFO - 
================================================================================
2026-01-28 14:49:01,551 - dq_comparison - INFO - DETAILED MISMATCH SUMMARY:
2026-01-28 14:49:01,552 - dq_comparison - INFO -   Total mismatches found: 7
2026-01-28 14:49:01,553 - dq_comparison - INFO -   Detailed comparisons logged: 7
2026-01-28 14:49:01,553 - dq_comparison - INFO -   First 10 rows displayed above
2026-01-28 14:49:01,554 - dq_comparison - INFO -   All mismatches stored in database with complete data
2026-01-28 14:49:01,555 - dq_comparison - INFO - ================================================================================
2026-01-28 14:49:01,555 - dq_comparison - INFO - Hash-based Comparison Results (with duplicate handling):
2026-01-28 14:49:01,555 - dq_comparison - INFO -   • Unique source hashes: 11
2026-01-28 14:49:01,556 - dq_comparison - INFO -   • Unique target hashes: 15
2026-01-28 14:49:01,556 - dq_comparison - INFO -   • Common hashes: 8
2026-01-28 14:49:01,557 - dq_comparison - INFO -   • Common rows (counting duplicates): 8
2026-01-28 14:49:01,557 - dq_comparison - INFO -   • Rows only in source (counting duplicates): 4
2026-01-28 14:49:01,558 - dq_comparison - INFO -   • Rows only in target (counting duplicates): 7
2026-01-28 14:49:01,563 - dq_comparison - INFO - HASH-ONLY COMPARISON COMPLETED
2026-01-28 14:49:01,564 - dq_comparison - INFO - Returning counts for simple scoring:
2026-01-28 14:49:01,565 - dq_comparison - INFO -   Common rows: 8
2026-01-28 14:49:01,565 - dq_comparison - INFO -   Unique to source: 4
2026-01-28 14:49:01,566 - dq_comparison - INFO -   Unique to target: 7
2026-01-28 14:49:01,566 - dq_comparison - INFO -   Value mismatches: 110
2026-01-28 14:49:01,567 - dq_comparison - INFO -   Missing rows: 4
2026-01-28 14:49:01,568 - dq_comparison - INFO -   Extra rows: 7
2026-01-28 14:49:01,568 - dq_comparison - INFO - 
========================================================================================================================
COMPARISON: Mysql Database vs CSV (sample_data.csv)
========================================================================================================================
Row   | Diff Count | Source (Sample)                          | Target (Sample)                         
------------------------------------------------------------------------------------------------------------------------
3     | 1          | Phone: 9876543210                        | Phone: 9876543210                       
8     | 1          | Phone: 2223334444                        | Phone: 2223334444                       
11    | 1          | Phone: 6667778888                        | Phone: 6667778888                       
2     | 1          | Phone: 1234567890                        | Phone: 1234567890                       
14    | 10         | Phone: NULL                              | Phone: 9990001111                       
15    | 9          | Phone: NULL                              | Phone: 1112222                          
16    | 10         | Phone: NULL                              | Phone: 1112223333                       
------------------------------------------------------------------------------------------------------------------------
Showing all 7 mismatched rows.
========================================================================================================================
2026-01-28 14:49:01,569 - dq_comparison - INFO - Returning enhanced mismatch structure with 7 detailed mismatches
2026-01-28 14:49:01,570 - dq_comparison - INFO - New structure: 7 detailed mismatches
2026-01-28 14:49:01,571 - dq_comparison - INFO - Analyzing data quality metrics...
2026-01-28 14:49:01,586 - dq_comparison - INFO - Null values - Source: 4 (3.33%), Target: 6 (4.00%)
2026-01-28 14:49:01,590 - dq_comparison - INFO - Duplicate rows (normalized) - Source: 1, Target: 0
2026-01-28 14:49:01,591 - dq_comparison - INFO - Source duplicate samples: ['Row 2', 'Row 7']
2026-01-28 14:49:01,615 - dq_error_log - INFO - Retrieved 10 error logs for session CMP_20260128_144901
2026-01-28 14:49:01,616 - dq_comparison - INFO - 
📊 SIMPLE SCORING CALCULATION:
2026-01-28 14:49:01,617 - dq_comparison - INFO -   Source rows: 12
2026-01-28 14:49:01,618 - dq_comparison - INFO -   Common rows (matched): 8
2026-01-28 14:49:01,619 - dq_comparison - INFO -   Calculation: (8 / 12) * 100 = 66.67%
2026-01-28 14:49:01,619 - dq_comparison - INFO -   Explanation: 8 matched rows out of 12 total source rows
2026-01-28 14:49:01,620 - dq_comparison - INFO - 
=== AUDIT LOGGING SECTION ===
2026-01-28 14:49:01,621 - dq_comparison - INFO - 🔍 Audit logging is ENABLED in APP_SETTINGS
2026-01-28 14:49:01,621 - dq_audit - INFO - Audit class initialized with database: dq_checks
2026-01-28 14:49:01,622 - dq_comparison - INFO - Attempting to log audit record for session: CMP_20260128_144901
2026-01-28 14:49:01,622 - dq_audit - INFO - Starting database insertion for comparison...
2026-01-28 14:49:01,640 - dq_audit - INFO - Inserted comparison record with ID: 827
2026-01-28 14:49:01,641 - dq_comparison - INFO - ✅ Audit record logged successfully (ID: 827)
2026-01-28 14:49:01,654 - dq_error_log - INFO - Retrieved 10 error logs for session CMP_20260128_144901
2026-01-28 14:49:01,666 - dq_error_log - INFO - Retrieved summary: 10 total errors for session CMP_20260128_144901
2026-01-28 14:49:01,668 - dq_audit - INFO - Audit class initialized with database: dq_checks
2026-01-28 14:49:01,696 - dq_audit - INFO - Retrieved 1 audit logs for session CMP_20260128_144901
2026-01-28 14:49:01,697 - dq_comparison - INFO - 
🔍 Final results verification:
2026-01-28 14:49:01,699 - dq_comparison - INFO -    Session ID: CMP_20260128_144901
2026-01-28 14:49:01,700 - dq_comparison - INFO -    DQ Score (Simple %): 66.67%
2026-01-28 14:49:01,700 - dq_comparison - INFO -    Source rows: 12
2026-01-28 14:49:01,701 - dq_comparison - INFO -    Matched rows: 8
2026-01-28 14:49:01,702 - dq_comparison - INFO -    Calculation: (8 / 12) * 100
2026-01-28 14:49:01,703 - dq_comparison - INFO - Comparison analysis completed successfully
2026-01-28 14:49:01,724 - dq_audit - INFO - Retrieved 1 audit logs for session CMP_20260128_144901
2026-01-28 14:49:01,738 - dq_error_log - INFO - Retrieved 10 error logs for session CMP_20260128_144901
2026-01-28 14:49:01,752 - dq_error_log - INFO - Retrieved summary: 10 total errors for session CMP_20260128_144901
2026-01-28 14:49:01,754 - __main__ - INFO - Comparison completed for session CMP_20260128_144901
2026-01-28 14:49:01,756 - __main__ - INFO - Response size: 2,226 bytes
2026-01-28 14:49:01,757 - __main__ - INFO - Completed with status 200 in 0.556s
