2026-01-16 17:32:31,605 - __main__ - INFO - 🌐 API Server Logging Initialized
2026-01-16 17:32:31,606 - __main__ - INFO - 📝 Logs saved to: logs/dq_api_20260116_173231.log
2026-01-16 17:32:31,885 - dq_rules - WARNING - Could not load config from database: name 'get_db_connection' is not defined
2026-01-16 17:32:31,890 - __main__ - INFO - APP_SETTINGS loaded. Audit enabled: True
2026-01-16 17:32:31,891 - __main__ - INFO - ✅ All DQ modules loaded successfully
2026-01-16 17:32:31,896 - dq_error_log - INFO - ErrorLogger initialized with database: dq_checks
2026-01-16 17:32:31,897 - dq_audit - INFO - Audit class initialized with database: dq_checks
2026-01-16 17:32:31,898 - __main__ - INFO - ✅ ErrorLogger and DataQualityAudit initialized
2026-01-16 17:32:31,936 - __main__ - INFO - 🚀 Starting Data Quality Framework API
2026-01-16 17:32:31,937 - __main__ - INFO - 📊 Modules available: True
2026-01-16 17:32:31,939 - __main__ - INFO - 🔧 Config file mode: False
2026-01-16 17:32:31,939 - __main__ - INFO - 📋 Available endpoints:
2026-01-16 17:32:31,940 - __main__ - INFO -   GET  /              - API status
2026-01-16 17:32:31,940 - __main__ - INFO -   GET  /api/health    - Health check
2026-01-16 17:32:31,942 - __main__ - INFO -   POST /api/check-single - Single source analysis
2026-01-16 17:32:31,943 - __main__ - INFO -   POST /api/compare   - Source-target comparison
2026-01-16 17:32:31,943 - __main__ - INFO -   GET  /api/compare/{id} - Get comparison results
2026-01-16 17:32:31,944 - __main__ - INFO -   GET  /api/compare/{id}/mismatches - Paginated mismatches
2026-01-16 17:32:31,945 - __main__ - INFO -   GET  /api/compare/{id}/rows/source_only - Source-only rows
2026-01-16 17:32:31,946 - __main__ - INFO -   GET  /api/compare/{id}/rows/target_only - Target-only rows
2026-01-16 17:32:31,948 - __main__ - INFO -   GET  /api/compare/{id}/rows/count - Row counts
2026-01-16 17:32:31,949 - __main__ - INFO -   POST /api/upload    - File upload
2026-01-16 17:32:31,952 - __main__ - INFO -   GET  /api/sessions  - List sessions
2026-01-16 17:32:31,952 - __main__ - INFO -   GET  /api/sessions/<id> - Get session data
2026-01-16 17:32:31,954 - __main__ - INFO -   GET  /api/debug-db  - Database debug
2026-01-16 17:32:31,954 - __main__ - INFO - 🌍 Server starting on 0.0.0.0:5000 (debug=False)
2026-01-16 17:33:08,814 - __main__ - INFO - POST /api/compare - Request started
2026-01-16 17:33:08,815 - __main__ - INFO - Comparison request - Source: database, Target: database
2026-01-16 17:33:08,816 - __main__ - INFO - Comparison analysis request received
2026-01-16 17:33:08,817 - __main__ - INFO - DEBUG source_data from nested: {'source_type': 'database', 'db_type': 'postgresql', 'host': 'localhost', 'port': 5432, 'database': 'dq_checks', 'table': 'customers_bkp', 'user': 'postgres', 'password': 'postgres'}
2026-01-16 17:33:08,819 - __main__ - INFO - Starting comparison for session CMP_20260116_173308
2026-01-16 17:33:08,820 - dq_comparison - INFO - Starting comparison analysis in UI mode
2026-01-16 17:33:08,821 - dq_comparison - INFO - LOADING SOURCE AND TARGET DATA
2026-01-16 17:33:08,821 - dq_comparison - INFO - 
==================================================
2026-01-16 17:33:08,822 - dq_comparison - INFO - 🔗 SOURCE DATA CONFIGURATION
2026-01-16 17:33:08,822 - dq_comparison - INFO - ==================================================
2026-01-16 17:33:08,824 - dq_comparison - INFO - 
🗄️ SOURCE DATABASE CONFIGURATION
2026-01-16 17:33:08,824 - dq_comparison - INFO - ----------------------------------------
2026-01-16 17:33:08,825 - dq_comparison - INFO - UI mode: Using provided database configuration for SOURCE
2026-01-16 17:33:08,826 - dq_unified - INFO - Loading data from DATABASE
2026-01-16 17:33:08,826 - dq_unified - INFO - Loading large database table: customers_bkp
2026-01-16 17:33:08,827 - dq_unified - INFO - Normalized DB config with schema: public
2026-01-16 17:33:09,079 - dq_unified - INFO - PostgreSQL table public.customers_bkp has 12 rows
2026-01-16 17:33:09,080 - dq_unified - INFO - Loading 12 rows from PostgreSQL...
2026-01-16 17:33:10,603 - dq_unified - INFO - Loaded 12 rows from PostgreSQL
2026-01-16 17:33:10,613 - dq_unified - INFO - Memory optimization: 0.0MB -> 0.0MB (Saved: 0.0MB)
2026-01-16 17:33:10,614 - dq_unified - INFO - Standardizing data types...
2026-01-16 17:33:10,618 - dq_unified - INFO - Data type standardization complete
2026-01-16 17:33:10,620 - dq_unified - INFO - Loaded 12 rows, 11 columns. Memory: 121.8MB total, 0.0MB for dataframe
2026-01-16 17:33:10,621 - dq_comparison - INFO - SOURCE database loaded: 12 rows, 11 columns
2026-01-16 17:33:10,621 - dq_comparison - INFO - 
==================================================
2026-01-16 17:33:10,622 - dq_comparison - INFO - 🔗 TARGET DATA CONFIGURATION
2026-01-16 17:33:10,622 - dq_comparison - INFO - ==================================================
2026-01-16 17:33:10,624 - dq_comparison - INFO - 
🗄️ TARGET DATABASE CONFIGURATION
2026-01-16 17:33:10,624 - dq_comparison - INFO - ----------------------------------------
2026-01-16 17:33:10,624 - dq_comparison - INFO - Converted db_type to numeric code: 2
2026-01-16 17:33:10,625 - dq_comparison - INFO - Selected database type code: mysql
2026-01-16 17:33:10,625 - dq_unified - INFO - Getting database config from config file
2026-01-16 17:33:10,626 - dq_unified - INFO - Using MYSQL configuration from config file
2026-01-16 17:33:10,626 - dq_unified - INFO - Database configuration from config file: mysql, Table: customers
2026-01-16 17:33:10,628 - dq_unified - INFO - Loading data from DATABASE
2026-01-16 17:33:10,628 - dq_unified - INFO - Loading large database table: customers
2026-01-16 17:33:10,629 - dq_unified - INFO - Normalized DB config with schema: dq_checks
2026-01-16 17:33:10,663 - dq_unified - INFO - MySQL table customers has 15 rows
2026-01-16 17:33:10,664 - dq_unified - INFO - Loading 15 rows from MySQL...
2026-01-16 17:33:10,668 - dq_unified - INFO - Loaded 15 rows from MySQL
2026-01-16 17:33:10,675 - dq_unified - INFO - Memory optimization: 0.0MB -> 0.0MB (Saved: 0.0MB)
2026-01-16 17:33:10,676 - dq_unified - INFO - Standardizing data types...
2026-01-16 17:33:10,680 - dq_unified - INFO - Data type standardization complete
2026-01-16 17:33:10,681 - dq_unified - INFO - Loaded 15 rows, 10 columns. Memory: 126.2MB total, 0.0MB for dataframe
2026-01-16 17:33:10,682 - dq_comparison - INFO - TARGET database loaded: 15 rows, 10 columns
2026-01-16 17:33:10,682 - dq_comparison - INFO - Source data loaded: 12 rows, 11 columns
2026-01-16 17:33:10,683 - dq_comparison - INFO - Target data loaded: 15 rows, 10 columns
2026-01-16 17:33:10,684 - dq_comparison - INFO - SELECTING COLUMNS FOR COMPARISON
2026-01-16 17:33:10,685 - dq_comparison - INFO - Source columns (original): ['customername', 'email', 'phone', 'salary', 'department', 'joindate', 'postalcode', 'city', 'country', 'state', 'customer_id']
2026-01-16 17:33:10,686 - dq_comparison - INFO - Target columns (original): ['CustomerName', 'Email', 'Phone', 'Salary', 'Department', 'JoinDate', 'PostalCode', 'City', 'Country', 'State']
2026-01-16 17:33:10,687 - dq_comparison - INFO - Common columns lowercased: ['salary', 'city', 'customername', 'joindate', 'department', 'postalcode', 'state', 'country', 'phone', 'email']
2026-01-16 17:33:10,687 - dq_comparison - INFO - Found 10 common columns between source and target (case-insensitive)
2026-01-16 17:33:10,689 - dq_comparison - INFO - User column selection input: all
2026-01-16 17:33:10,690 - dq_comparison - INFO - User selected ALL common columns for comparison
2026-01-16 17:33:10,690 - dq_comparison - INFO - Selected 10 columns for comparison: ['salary', 'city', 'customername', 'joindate', 'department']...
2026-01-16 17:33:10,691 - dq_comparison - INFO - GENERATING COMPREHENSIVE COMPARISON REPORT
2026-01-16 17:33:10,692 - dq_comparison - INFO - Report details - Source: Database: postgresql - dq_checks.customers_bkp, Target: Database: mysql - dq_checks.customers, Selected columns: 10
2026-01-16 17:33:10,692 - dq_comparison - INFO - Initializing Error Logger...
2026-01-16 17:33:10,692 - dq_error_log - INFO - ErrorLogger initialized with database: dq_checks
2026-01-16 17:33:10,711 - dq_error_log - INFO - Database connection successful
2026-01-16 17:33:10,711 - dq_comparison - INFO - Session ID: CMP_20260116_173310
2026-01-16 17:33:10,711 - dq_comparison - WARNING - ❌ Row count mismatch: Source=12, Target=15, Difference=3
2026-01-16 17:33:10,712 - dq_comparison - WARNING -    Extra in target: 3 rows
2026-01-16 17:33:10,713 - dq_comparison - INFO - Comparing column structures...
2026-01-16 17:33:10,714 - dq_comparison - WARNING - Column count mismatch: Source=11, Target=10
2026-01-16 17:33:10,715 - dq_comparison - WARNING - Columns missing in target: ['customer_id']
2026-01-16 17:33:10,716 - dq_comparison - INFO - Column structure comparison complete. Match: False
2026-01-16 17:33:10,717 - dq_comparison - INFO - Validating primary key/unique fields...
2026-01-16 17:33:10,718 - dq_comparison - INFO - Checking key fields: ['postalcode']
2026-01-16 17:33:10,718 - dq_comparison - WARNING - No key fields found in both datasets
2026-01-16 17:33:10,738 - dq_comparison - INFO - Comparing table-level metadata...
2026-01-16 17:33:10,748 - dq_comparison - INFO - Table metadata comparison complete. Match: False
2026-01-16 17:33:10,774 - dq_comparison - INFO - SECOND CHECK: HASH-BASED COMPARISON WITH PERFECT NORMALIZATION
2026-01-16 17:33:10,817 - dq_comparison - INFO - === DEBUG: DATA TYPE CHECK ===
2026-01-16 17:33:10,818 - dq_comparison - INFO - Column: salary
2026-01-16 17:33:10,819 - dq_comparison - INFO -   Source type: <class 'numpy.float32'>, value: 50000.0
2026-01-16 17:33:10,819 - dq_comparison - INFO -   Target type: <class 'numpy.float32'>, value: 50000.0
2026-01-16 17:33:10,821 - dq_comparison - INFO -   Normalized: '50000' vs '50000'
2026-01-16 17:33:10,821 - dq_comparison - INFO -   Match: True
2026-01-16 17:33:10,822 - dq_comparison - INFO - Column: city
2026-01-16 17:33:10,822 - dq_comparison - INFO -   Source type: <class 'str'>, value: New York
2026-01-16 17:33:10,824 - dq_comparison - INFO -   Target type: <class 'str'>, value: New York
2026-01-16 17:33:10,825 - dq_comparison - INFO -   Normalized: 'new york' vs 'new york'
2026-01-16 17:33:10,825 - dq_comparison - INFO -   Match: True
2026-01-16 17:33:10,826 - dq_comparison - INFO - Column: customername
2026-01-16 17:33:10,826 - dq_comparison - INFO -   Source type: <class 'str'>, value: John Doe
2026-01-16 17:33:10,827 - dq_comparison - INFO -   Target type: <class 'str'>, value: John Doe
2026-01-16 17:33:10,827 - dq_comparison - INFO -   Normalized: 'john doe' vs 'john doe'
2026-01-16 17:33:10,828 - dq_comparison - INFO -   Match: True
2026-01-16 17:33:10,829 - dq_comparison - INFO - Source DF columns: ['customername', 'email', 'phone', 'salary', 'department', 'joindate', 'postalcode', 'city', 'country', 'state', 'customer_id']
2026-01-16 17:33:10,830 - dq_comparison - INFO - Target DF columns: ['CustomerName', 'Email', 'Phone', 'Salary', 'Department', 'JoinDate', 'PostalCode', 'City', 'Country', 'State']
2026-01-16 17:33:10,831 - dq_comparison - INFO - Selected columns for comparison: ['salary', 'city', 'customername', 'joindate', 'department', 'postalcode', 'state', 'country', 'phone', 'email']
2026-01-16 17:33:10,831 - dq_comparison - INFO - Using 10 common columns for hash comparison
2026-01-16 17:33:10,832 - dq_comparison - INFO - Source columns: ['salary', 'city', 'customername', 'joindate', 'department', 'postalcode', 'state', 'country', 'phone', 'email']
2026-01-16 17:33:10,832 - dq_comparison - INFO - Target columns: ['Salary', 'City', 'CustomerName', 'JoinDate', 'Department', 'PostalCode', 'State', 'Country', 'Phone', 'Email']
2026-01-16 17:33:10,834 - dq_comparison - INFO - Generating hashes for source data (12 rows)...
2026-01-16 17:33:10,838 - dq_comparison - INFO - === DEBUG: SAMPLE HASHES ===
2026-01-16 17:33:10,838 - dq_comparison - INFO - Hash 1: 59ba6739a036ee55... (sample row 0)
2026-01-16 17:33:10,839 - dq_comparison - INFO - Hash 2: 7fd76ae9c4b1796c... (sample row 1)
2026-01-16 17:33:10,840 - dq_comparison - INFO - Hash 3: 9d097f232878e86f... (sample row 2)
2026-01-16 17:33:10,841 - dq_comparison - INFO - Generating hashes for target data (15 rows)...
2026-01-16 17:33:10,845 - dq_comparison - INFO - 
======================================================================
2026-01-16 17:33:10,846 - dq_comparison - INFO - 🔍 DEBUG: ANALYZING WHY HASHES DON'T MATCH
2026-01-16 17:33:10,847 - dq_comparison - INFO - ======================================================================
2026-01-16 17:33:10,848 - dq_comparison - INFO - 
--- Analyzing Row 0 ---
2026-01-16 17:33:10,850 - dq_comparison - INFO - Column 'salary' → 'Salary':
2026-01-16 17:33:10,850 - dq_comparison - INFO -   Source: '50000.0' (type: float32) → '50000'
2026-01-16 17:33:10,851 - dq_comparison - INFO -   Target: '50000.0' (type: float32) → '50000'
2026-01-16 17:33:10,853 - dq_comparison - INFO -   Match after normalization: ✅ YES
2026-01-16 17:33:10,853 - dq_comparison - INFO - Column 'city' → 'City':
2026-01-16 17:33:10,854 - dq_comparison - INFO -   Source: 'New York' (type: str) → 'new york'
2026-01-16 17:33:10,855 - dq_comparison - INFO -   Target: 'New York' (type: str) → 'new york'
2026-01-16 17:33:10,855 - dq_comparison - INFO -   Match after normalization: ✅ YES
2026-01-16 17:33:10,856 - dq_comparison - INFO - Column 'customername' → 'CustomerName':
2026-01-16 17:33:10,858 - dq_comparison - INFO -   Source: 'John Doe' (type: str) → 'john doe'
2026-01-16 17:33:10,858 - dq_comparison - INFO -   Target: 'John Doe' (type: str) → 'john doe'
2026-01-16 17:33:10,859 - dq_comparison - INFO -   Match after normalization: ✅ YES
2026-01-16 17:33:10,860 - dq_comparison - INFO - Column 'joindate' → 'JoinDate':
2026-01-16 17:33:10,860 - dq_comparison - INFO -   Source: '1673740800000000000' (type: int64) → '2023-01-15'
2026-01-16 17:33:10,861 - dq_comparison - INFO -   Target: '1673740800000000000' (type: int64) → '2023-01-15'
2026-01-16 17:33:10,861 - dq_comparison - INFO -   Match after normalization: ✅ YES
2026-01-16 17:33:10,862 - dq_comparison - INFO - Column 'department' → 'Department':
2026-01-16 17:33:10,862 - dq_comparison - INFO -   Source: 'IT' (type: str) → 'it'
2026-01-16 17:33:10,863 - dq_comparison - INFO -   Target: 'IT' (type: str) → 'it'
2026-01-16 17:33:10,863 - dq_comparison - INFO -   Match after normalization: ✅ YES
2026-01-16 17:33:10,864 - dq_comparison - INFO - 
Hash components for Row 0:
2026-01-16 17:33:10,864 - dq_comparison - INFO - Source hash string start: 50000|new york|john doe...
2026-01-16 17:33:10,865 - dq_comparison - INFO - Target hash string start: 50000|new york|john doe...
2026-01-16 17:33:10,866 - dq_comparison - INFO - Same? ✅ YES
2026-01-16 17:33:10,866 - dq_comparison - INFO - 
--- Analyzing Row 1 ---
2026-01-16 17:33:10,868 - dq_comparison - INFO - Column 'salary' → 'Salary':
2026-01-16 17:33:10,868 - dq_comparison - INFO -   Source: '55000.0' (type: float32) → '55000'
2026-01-16 17:33:10,869 - dq_comparison - INFO -   Target: '60000.0' (type: float32) → '60000'
2026-01-16 17:33:10,870 - dq_comparison - INFO -   Match after normalization: ❌ NO
2026-01-16 17:33:10,871 - dq_comparison - INFO - Column 'city' → 'City':
2026-01-16 17:33:10,871 - dq_comparison - INFO -   Source: 'Boston' (type: str) → 'boston'
2026-01-16 17:33:10,872 - dq_comparison - INFO -   Target: 'Chicago' (type: str) → 'chicago'
2026-01-16 17:33:10,873 - dq_comparison - INFO -   Match after normalization: ❌ NO
2026-01-16 17:33:10,874 - dq_comparison - INFO - Column 'customername' → 'CustomerName':
2026-01-16 17:33:10,875 - dq_comparison - INFO -   Source: 'Bob Johnson' (type: str) → 'bob johnson'
2026-01-16 17:33:10,876 - dq_comparison - INFO -   Target: 'Jane Smith' (type: str) → 'jane smith'
2026-01-16 17:33:10,876 - dq_comparison - INFO -   Match after normalization: ❌ NO
2026-01-16 17:33:10,877 - dq_comparison - INFO - Column 'joindate' → 'JoinDate':
2026-01-16 17:33:10,878 - dq_comparison - INFO -   Source: '1678406400000000000' (type: int64) → '2023-03-10'
2026-01-16 17:33:10,879 - dq_comparison - INFO -   Target: '1676851200000000000' (type: int64) → '2023-02-20'
2026-01-16 17:33:10,879 - dq_comparison - INFO -   Match after normalization: ❌ NO
2026-01-16 17:33:10,880 - dq_comparison - INFO -   ⚠️ DATE MISMATCH DETECTED!
2026-01-16 17:33:10,880 - dq_comparison - INFO -     Source appears to be: 1678406400000000000
2026-01-16 17:33:10,881 - dq_comparison - INFO -     Target appears to be (timestamp): 1676851200000000000
2026-01-16 17:33:10,882 - dq_comparison - INFO -     Target as date (converted): 2023-02-20
2026-01-16 17:33:10,883 - dq_comparison - INFO - Column 'department' → 'Department':
2026-01-16 17:33:10,884 - dq_comparison - INFO -   Source: 'Finance' (type: str) → 'finance'
2026-01-16 17:33:10,884 - dq_comparison - INFO -   Target: 'HR' (type: str) → 'hr'
2026-01-16 17:33:10,885 - dq_comparison - INFO -   Match after normalization: ❌ NO
2026-01-16 17:33:10,886 - dq_comparison - INFO - 
Hash components for Row 1:
2026-01-16 17:33:10,887 - dq_comparison - INFO - Source hash string start: 55000|boston|bob johnson...
2026-01-16 17:33:10,888 - dq_comparison - INFO - Target hash string start: 60000|chicago|jane smith...
2026-01-16 17:33:10,889 - dq_comparison - INFO - Same? ❌ NO
2026-01-16 17:33:10,889 - dq_comparison - INFO - 
--- Analyzing Row 2 ---
2026-01-16 17:33:10,891 - dq_comparison - INFO - Column 'salary' → 'Salary':
2026-01-16 17:33:10,892 - dq_comparison - INFO -   Source: '70000.0' (type: float32) → '70000'
2026-01-16 17:33:10,892 - dq_comparison - INFO -   Target: '55000.0' (type: float32) → '55000'
2026-01-16 17:33:10,893 - dq_comparison - INFO -   Match after normalization: ❌ NO
2026-01-16 17:33:10,893 - dq_comparison - INFO - Column 'city' → 'City':
2026-01-16 17:33:10,894 - dq_comparison - INFO -   Source: 'Seattle' (type: str) → 'seattle'
2026-01-16 17:33:10,894 - dq_comparison - INFO -   Target: 'Boston' (type: str) → 'boston'
2026-01-16 17:33:10,896 - dq_comparison - INFO -   Match after normalization: ❌ NO
2026-01-16 17:33:10,896 - dq_comparison - INFO - Column 'customername' → 'CustomerName':
2026-01-16 17:33:10,897 - dq_comparison - INFO -   Source: 'Alice Brown' (type: str) → 'alice brown'
2026-01-16 17:33:10,898 - dq_comparison - INFO -   Target: 'Bob Johnson' (type: str) → 'bob johnson'
2026-01-16 17:33:10,899 - dq_comparison - INFO -   Match after normalization: ❌ NO
2026-01-16 17:33:10,900 - dq_comparison - INFO - Column 'joindate' → 'JoinDate':
2026-01-16 17:33:10,900 - dq_comparison - INFO -   Source: '1673740800000000000' (type: int64) → '2023-01-15'
2026-01-16 17:33:10,901 - dq_comparison - INFO -   Target: '1678406400000000000' (type: int64) → '2023-03-10'
2026-01-16 17:33:10,901 - dq_comparison - INFO -   Match after normalization: ❌ NO
2026-01-16 17:33:10,903 - dq_comparison - INFO -   ⚠️ DATE MISMATCH DETECTED!
2026-01-16 17:33:10,903 - dq_comparison - INFO -     Source appears to be: 1673740800000000000
2026-01-16 17:33:10,904 - dq_comparison - INFO -     Target appears to be (timestamp): 1678406400000000000
2026-01-16 17:33:10,905 - dq_comparison - INFO -     Target as date (converted): 2023-03-10
2026-01-16 17:33:10,906 - dq_comparison - INFO - Column 'department' → 'Department':
2026-01-16 17:33:10,907 - dq_comparison - INFO -   Source: 'IT' (type: str) → 'it'
2026-01-16 17:33:10,908 - dq_comparison - INFO -   Target: 'Finance' (type: str) → 'finance'
2026-01-16 17:33:10,909 - dq_comparison - INFO -   Match after normalization: ❌ NO
2026-01-16 17:33:10,910 - dq_comparison - INFO - 
Hash components for Row 2:
2026-01-16 17:33:10,911 - dq_comparison - INFO - Source hash string start: 70000|seattle|alice brown...
2026-01-16 17:33:10,912 - dq_comparison - INFO - Target hash string start: 55000|boston|bob johnson...
2026-01-16 17:33:10,912 - dq_comparison - INFO - Same? ❌ NO
2026-01-16 17:33:10,913 - dq_comparison - INFO - 
--- Column Data Types Analysis ---
2026-01-16 17:33:10,914 - dq_comparison - INFO - Column 1: 'salary' (float32) ↔ 'Salary' (float32)
2026-01-16 17:33:10,915 - dq_comparison - INFO -   Sample: Source='50000.0', Target='50000.0'
2026-01-16 17:33:10,915 - dq_comparison - INFO - Column 2: 'city' (object) ↔ 'City' (object)
2026-01-16 17:33:10,916 - dq_comparison - INFO -   Sample: Source='New York', Target='New York'
2026-01-16 17:33:10,917 - dq_comparison - INFO - Column 3: 'customername' (object) ↔ 'CustomerName' (object)
2026-01-16 17:33:10,918 - dq_comparison - INFO -   Sample: Source='John Doe', Target='John Doe'
2026-01-16 17:33:10,919 - dq_comparison - INFO - Column 4: 'joindate' (int64) ↔ 'JoinDate' (int64)
2026-01-16 17:33:10,919 - dq_comparison - INFO -   Sample: Source='1673740800000000000', Target='1673740800000000000'
2026-01-16 17:33:10,920 - dq_comparison - INFO - Column 5: 'department' (category) ↔ 'Department' (category)
2026-01-16 17:33:10,922 - dq_comparison - INFO -   Sample: Source='IT', Target='IT'
2026-01-16 17:33:10,922 - dq_comparison - INFO - PERFORMING DETAILED ROW-LEVEL COMPARISON WITH PAGINATION...
2026-01-16 17:33:10,922 - dq_comparison - INFO - Found 9 total mismatches
2026-01-16 17:33:10,923 - dq_comparison - INFO - Will process detailed comparisons for first 9 rows
2026-01-16 17:33:11,016 - dq_comparison - INFO - 
================================================================================
2026-01-16 17:33:11,017 - dq_comparison - INFO - DETAILED MISMATCH SUMMARY:
2026-01-16 17:33:11,017 - dq_comparison - INFO -   Total mismatches found: 8
2026-01-16 17:33:11,018 - dq_comparison - INFO -   Detailed comparisons logged: 8
2026-01-16 17:33:11,019 - dq_comparison - INFO -   First 10 rows displayed above
2026-01-16 17:33:11,019 - dq_comparison - INFO -   All mismatches stored in database with complete data
2026-01-16 17:33:11,019 - dq_comparison - INFO - ================================================================================
2026-01-16 17:33:11,021 - dq_comparison - INFO - Hash-based Comparison Results (with duplicate handling):
2026-01-16 17:33:11,021 - dq_comparison - INFO -   • Unique source hashes: 11
2026-01-16 17:33:11,021 - dq_comparison - INFO -   • Unique target hashes: 14
2026-01-16 17:33:11,022 - dq_comparison - INFO -   • Common hashes: 8
2026-01-16 17:33:11,023 - dq_comparison - INFO -   • Common rows (counting duplicates): 9
2026-01-16 17:33:11,023 - dq_comparison - INFO -   • Rows only in source (counting duplicates): 3
2026-01-16 17:33:11,024 - dq_comparison - INFO -   • Rows only in target (counting duplicates): 6
2026-01-16 17:33:11,025 - dq_comparison - INFO - HASH-ONLY COMPARISON COMPLETED
2026-01-16 17:33:11,025 - dq_comparison - INFO - Returning counts for simple scoring:
2026-01-16 17:33:11,026 - dq_comparison - INFO -   Common rows: 9
2026-01-16 17:33:11,027 - dq_comparison - INFO -   Unique to source: 3
2026-01-16 17:33:11,027 - dq_comparison - INFO -   Unique to target: 6
2026-01-16 17:33:11,027 - dq_comparison - INFO -   Value mismatches: 90
2026-01-16 17:33:11,029 - dq_comparison - INFO -   Missing rows: 3
2026-01-16 17:33:11,029 - dq_comparison - INFO -   Extra rows: 6
2026-01-16 17:33:11,030 - dq_comparison - INFO - 
========================================================================================================================
COMPARISON: Postgresql Database vs Mysql Database
========================================================================================================================
Row   | Diff Count | Source (Sample)                          | Target (Sample)                         
------------------------------------------------------------------------------------------------------------------------
11    | 10         | salary: 60000.0                          | Salary: 62000.0                         
12    | 8          | salary: 62000.0                          | Salary: 45000.0                         
13    | 9          | salary: NULL                             | Salary: 53000.0                         
3     | 9          | salary: 55000.0                          | Salary: 60000.0                         
8     | 9          | salary: 58000.0                          | Salary: NULL                            
14    | 10         | salary: NULL                             | Salary: 67000.0                         
15    | 9          | salary: NULL                             | Salary: NULL                            
16    | 10         | salary: NULL                             | Salary: 49000.0                         
------------------------------------------------------------------------------------------------------------------------
Showing all 8 mismatched rows.
========================================================================================================================
2026-01-16 17:33:11,031 - dq_comparison - INFO - Returning enhanced mismatch structure with 8 detailed mismatches
2026-01-16 17:33:11,031 - dq_comparison - INFO - New structure: 8 detailed mismatches
2026-01-16 17:33:11,032 - dq_comparison - INFO - Analyzing data quality metrics...
2026-01-16 17:33:11,041 - dq_comparison - INFO - Null values - Source: 6 (5.00%), Target: 6 (4.00%)
2026-01-16 17:33:11,043 - dq_comparison - INFO - Duplicate rows (normalized) - Source: 1, Target: 1
2026-01-16 17:33:11,045 - dq_comparison - INFO - Source duplicate samples: ['Row 2', 'Row 6']
2026-01-16 17:33:11,047 - dq_comparison - INFO - Target duplicate samples: ['Row 2', 'Row 7']
2026-01-16 17:33:11,057 - dq_error_log - INFO - Retrieved 11 error logs for session CMP_20260116_173310
2026-01-16 17:33:11,058 - dq_comparison - INFO - 
📊 SIMPLE SCORING CALCULATION:
2026-01-16 17:33:11,059 - dq_comparison - INFO -   Source rows: 12
2026-01-16 17:33:11,059 - dq_comparison - INFO -   Common rows (matched): 9
2026-01-16 17:33:11,060 - dq_comparison - INFO -   Calculation: (9 / 12) * 100 = 75.00%
2026-01-16 17:33:11,061 - dq_comparison - INFO -   Explanation: 9 matched rows out of 12 total source rows
2026-01-16 17:33:11,061 - dq_comparison - INFO - 
=== AUDIT LOGGING SECTION ===
2026-01-16 17:33:11,062 - dq_comparison - INFO - 🔍 Audit logging is ENABLED in APP_SETTINGS
2026-01-16 17:33:11,063 - dq_audit - INFO - Audit class initialized with database: dq_checks
2026-01-16 17:33:11,063 - dq_comparison - INFO - Attempting to log audit record for session: CMP_20260116_173310
2026-01-16 17:33:11,064 - dq_audit - INFO - Starting database insertion for comparison...
2026-01-16 17:33:11,081 - dq_audit - INFO - Inserted comparison record with ID: 725
2026-01-16 17:33:11,081 - dq_comparison - INFO - ✅ Audit record logged successfully (ID: 725)
2026-01-16 17:33:11,092 - dq_error_log - INFO - Retrieved 11 error logs for session CMP_20260116_173310
2026-01-16 17:33:11,104 - dq_error_log - INFO - Retrieved summary: 11 total errors for session CMP_20260116_173310
2026-01-16 17:33:11,105 - dq_audit - INFO - Audit class initialized with database: dq_checks
2026-01-16 17:33:11,118 - dq_audit - INFO - Retrieved 1 audit logs for session CMP_20260116_173310
2026-01-16 17:33:11,119 - dq_comparison - INFO - 
🔍 Final results verification:
2026-01-16 17:33:11,120 - dq_comparison - INFO -    Session ID: CMP_20260116_173310
2026-01-16 17:33:11,121 - dq_comparison - INFO -    DQ Score (Simple %): 75.00%
2026-01-16 17:33:11,121 - dq_comparison - INFO -    Source rows: 12
2026-01-16 17:33:11,122 - dq_comparison - INFO -    Matched rows: 9
2026-01-16 17:33:11,123 - dq_comparison - INFO -    Calculation: (9 / 12) * 100
2026-01-16 17:33:11,123 - dq_comparison - INFO - Comparison analysis completed successfully
2026-01-16 17:33:11,139 - dq_audit - INFO - Retrieved 1 audit logs for session CMP_20260116_173310
2026-01-16 17:33:11,150 - dq_error_log - INFO - Retrieved 11 error logs for session CMP_20260116_173310
2026-01-16 17:33:11,162 - dq_error_log - INFO - Retrieved summary: 11 total errors for session CMP_20260116_173310
2026-01-16 17:33:11,162 - __main__ - INFO - Comparison completed for session CMP_20260116_173308
2026-01-16 17:33:11,167 - __main__ - INFO - Completed with status 200 in 2.353s
