2026-01-12 12:10:24,236 - dq_comparison - INFO - DEBUG HASH ROW: description: 'Text with, commas' -> 'text with, commas' | transaction_id: 'TX00042382' -> 'TX00042382' | transaction_date: '13-05-2023' -> '2023-05-13' | quantity: '19' -> '19' | customer_id: 'CUST042382' -> 'CUST042382'
2026-01-12 12:10:24,270 - dq_comparison - INFO - DEBUG HASH STRING: text with, commas|TX00042382|2023-05-13|19|CUST042382...
2026-01-12 12:10:24,270 - dq_comparison - INFO - DEBUG HASH RESULT: 90c73281...
2026-01-12 12:10:24,272 - dq_comparison - INFO - DEBUG HASH ROW: description: 'Text with& ampersands' -> 'text with& ampersands' | transaction_id: 'TX00054837' -> 'TX00054837' | transaction_date: '28-12-2023' -> '2023-12-28' | quantity: '86' -> '86' | customer_id: 'CUST054837' -> 'CUST054837'
2026-01-12 12:10:24,272 - dq_comparison - INFO - DEBUG HASH STRING: text with& ampersands|TX00054837|2023-12-28|86|CUST054837...
2026-01-12 12:10:24,273 - dq_comparison - INFO - DEBUG HASH RESULT: 2ce64205...
2026-01-12 12:10:24,274 - dq_comparison - INFO - DEBUG HASH ROW: description: 'Text with? questions' -> 'text with? questions' | transaction_id: 'TX00096065' -> 'TX00096065' | transaction_date: '21-06-2023' -> '2023-06-21' | quantity: '59' -> '59' | customer_id: 'CUST096065' -> 'CUST096065'
2026-01-12 12:10:24,274 - dq_comparison - INFO - DEBUG HASH STRING: text with? questions|TX00096065|2023-06-21|59|CUST096065...
2026-01-12 12:10:24,275 - dq_comparison - INFO - DEBUG HASH RESULT: 180ff4ea...
2026-01-12 12:10:24,276 - dq_comparison - INFO - DEBUG HASH ROW: description: 'Text with. periods' -> 'text with. periods' | transaction_id: 'TX00065876' -> 'TX00065876' | transaction_date: '04/23/2023' -> '2023-04-23' | quantity: '22' -> '22' | customer_id: 'CUST065876' -> 'CUST065876'
2026-01-12 12:10:24,276 - dq_comparison - INFO - DEBUG HASH STRING: text with. periods|TX00065876|2023-04-23|22|CUST065876...
2026-01-12 12:10:24,277 - dq_comparison - INFO - DEBUG HASH RESULT: ecc8397f...
2026-01-12 12:10:24,278 - dq_comparison - INFO - DEBUG HASH ROW: description: 'Text with~tildes' -> 'text with~tildes' | transaction_id: 'TX00063282' -> 'TX00063282' | transaction_date: '31-01-2023' -> '2023-01-31' | quantity: '70' -> '70' | customer_id: 'CUST063282' -> 'CUST063282'
2026-01-12 12:10:24,278 - dq_comparison - INFO - DEBUG HASH STRING: text with~tildes|TX00063282|2023-01-31|70|CUST063282...
2026-01-12 12:10:24,279 - dq_comparison - INFO - DEBUG HASH RESULT: 174f5bad...
2026-01-12 12:10:24,280 - dq_comparison - INFO - DEBUG HASH ROW: description: 'Text with trailing spaces  ' -> 'text with trailing spaces' | transaction_id: 'TX00093113' -> 'TX00093113' | transaction_date: '21-05-2023' -> '2023-05-21' | quantity: '15' -> '15' | customer_id: 'CUST093113' -> 'CUST093113'
2026-01-12 12:10:24,280 - dq_comparison - INFO - DEBUG HASH STRING: text with trailing spaces|TX00093113|2023-05-21|15|CUST093113...
2026-01-12 12:10:24,281 - dq_comparison - INFO - DEBUG HASH RESULT: 9491abd5...
2026-01-12 12:10:24,282 - dq_comparison - INFO - DEBUG HASH ROW: description: 'Text with$dollar signs' -> 'text with$dollar signs' | transaction_id: 'TX00064055' -> 'TX00064055' | transaction_date: '02-02-2023' -> '2023-02-02' | quantity: '53' -> '53' | customer_id: 'CUST064055' -> 'CUST064055'
2026-01-12 12:10:24,282 - dq_comparison - INFO - DEBUG HASH STRING: text with$dollar signs|TX00064055|2023-02-02|53|CUST064055...
2026-01-12 12:10:24,283 - dq_comparison - INFO - DEBUG HASH RESULT: d0b0a51c...
2026-01-12 12:10:24,283 - dq_comparison - INFO - DEBUG HASH ROW: description: 'Text with? questions' -> 'text with? questions' | transaction_id: 'TX00046648' -> 'TX00046648' | transaction_date: '23-02-2023' -> '2023-02-23' | quantity: '32' -> '32' | customer_id: 'CUST046648' -> 'CUST046648'
2026-01-12 12:10:24,284 - dq_comparison - INFO - DEBUG HASH STRING: text with? questions|TX00046648|2023-02-23|32|CUST046648...
2026-01-12 12:10:24,284 - dq_comparison - INFO - DEBUG HASH RESULT: 66bfadea...
2026-01-12 12:10:24,285 - dq_comparison - INFO - DEBUG HASH ROW: description: 'Text with trailing spaces  ' -> 'text with trailing spaces' | transaction_id: 'TX00000738' -> 'TX00000738' | transaction_date: '20-12-2023' -> '2023-12-20' | quantity: '1' -> '1' | customer_id: 'CUST000738' -> 'CUST000738'
2026-01-12 12:10:24,285 - dq_comparison - INFO - DEBUG HASH STRING: text with trailing spaces|TX00000738|2023-12-20|1|CUST000738...
2026-01-12 12:10:24,286 - dq_comparison - INFO - DEBUG HASH RESULT: 87ce6019...
2026-01-12 12:10:24,287 - dq_comparison - INFO - DEBUG HASH ROW: description: 'Text with	tabs' -> 'text with tabs' | transaction_id: 'TX00029474' -> 'TX00029474' | transaction_date: '29-12-2023' -> '2023-12-29' | quantity: '10' -> '10' | customer_id: 'CUST029474' -> 'CUST029474'
2026-01-12 12:10:24,287 - dq_comparison - INFO - DEBUG HASH STRING: text with tabs|TX00029474|2023-12-29|10|CUST029474...
2026-01-12 12:10:24,288 - dq_comparison - INFO - DEBUG HASH RESULT: 063a87ff...
2026-01-12 12:10:24,289 - dq_comparison - INFO - DEBUG HASH ROW: description: 'Text with\backslashes' -> 'text with\backslashes' | transaction_id: 'TX00060659' -> 'TX00060659' | transaction_date: '26-12-2023' -> '2023-12-26' | quantity: '22' -> '22' | customer_id: 'CUST060659' -> 'CUST060659'
2026-01-12 12:10:24,289 - dq_comparison - INFO - DEBUG HASH STRING: text with\backslashes|TX00060659|2023-12-26|22|CUST060659...
2026-01-12 12:10:24,290 - dq_comparison - INFO - DEBUG HASH RESULT: 72f991b5...
2026-01-12 12:10:24,290 - dq_comparison - INFO - DEBUG HASH ROW: description: 'Text with& ampersands' -> 'text with& ampersands' | transaction_id: 'TX00008834' -> 'TX00008834' | transaction_date: '25-06-2023' -> '2023-06-25' | quantity: '22' -> '22' | customer_id: 'CUST008834' -> 'CUST008834'
2026-01-12 12:10:24,291 - dq_comparison - INFO - DEBUG HASH STRING: text with& ampersands|TX00008834|2023-06-25|22|CUST008834...
2026-01-12 12:10:24,292 - dq_comparison - INFO - DEBUG HASH RESULT: 1ed901ee...
2026-01-12 12:10:24,292 - dq_comparison - INFO - DEBUG HASH ROW: description: 'Text with! exclamations' -> 'text with! exclamations' | transaction_id: 'TX00094245' -> 'TX00094245' | transaction_date: '04-02-2023' -> '2023-02-04' | quantity: '86' -> '86' | customer_id: 'CUST094245' -> 'CUST094245'
2026-01-12 12:10:24,293 - dq_comparison - INFO - DEBUG HASH STRING: text with! exclamations|TX00094245|2023-02-04|86|CUST094245...
2026-01-12 12:10:24,293 - dq_comparison - INFO - DEBUG HASH RESULT: ef10f4cc...
2026-01-12 12:10:24,294 - dq_comparison - INFO - DEBUG HASH ROW: description: 'Text with, commas' -> 'text with, commas' | transaction_id: 'TX00098176' -> 'TX00098176' | transaction_date: '22-02-2023' -> '2023-02-22' | quantity: '73' -> '73' | customer_id: 'CUST098176' -> 'CUST098176'
2026-01-12 12:10:24,295 - dq_comparison - INFO - DEBUG HASH STRING: text with, commas|TX00098176|2023-02-22|73|CUST098176...
2026-01-12 12:10:24,295 - dq_comparison - INFO - DEBUG HASH RESULT: a1a1caf0...
2026-01-12 12:10:24,296 - dq_comparison - INFO - DEBUG HASH ROW: description: 'Text with? questions' -> 'text with? questions' | transaction_id: 'TX00076515' -> 'TX00076515' | transaction_date: '05-11-2023' -> '2023-11-05' | quantity: '3' -> '3' | customer_id: 'CUST076515' -> 'CUST076515'
2026-01-12 12:10:24,296 - dq_comparison - INFO - DEBUG HASH STRING: text with? questions|TX00076515|2023-11-05|3|CUST076515...
2026-01-12 12:10:24,297 - dq_comparison - INFO - DEBUG HASH RESULT: a22ac819...
2026-01-12 12:10:24,297 - dq_comparison - INFO - DEBUG HASH ROW: description: 'Text with#hashtags' -> 'text with#hashtags' | transaction_id: 'TX00036418' -> 'TX00036418' | transaction_date: '01-07-2023' -> '2023-07-01' | quantity: '53' -> '53' | customer_id: 'CUST036418' -> 'CUST036418'
2026-01-12 12:10:24,299 - dq_comparison - INFO - DEBUG HASH STRING: text with#hashtags|TX00036418|2023-07-01|53|CUST036418...
2026-01-12 12:10:24,299 - dq_comparison - INFO - DEBUG HASH RESULT: 90a76dc7...
2026-01-12 12:10:24,300 - dq_comparison - INFO - DEBUG HASH ROW: description: 'Text with"quotes"' -> 'text with"quotes"' | transaction_id: 'TX00099189' -> 'TX00099189' | transaction_date: '01-08-2023' -> '2023-08-01' | quantity: '2' -> '2' | customer_id: 'CUST099189' -> 'CUST099189'
2026-01-12 12:10:24,301 - dq_comparison - INFO - DEBUG HASH STRING: text with"quotes"|TX00099189|2023-08-01|2|CUST099189...
2026-01-12 12:10:24,301 - dq_comparison - INFO - DEBUG HASH RESULT: 3267c7cc...
2026-01-12 12:10:24,302 - dq_comparison - INFO - DEBUG HASH ROW: description: 'Text with - dashes' -> 'text with - dashes' | transaction_id: 'TX00027550' -> 'TX00027550' | transaction_date: '31-10-2023' -> '2023-10-31' | quantity: '45' -> '45' | customer_id: 'CUST027550' -> 'CUST027550'
2026-01-12 12:10:24,302 - dq_comparison - INFO - DEBUG HASH STRING: text with - dashes|TX00027550|2023-10-31|45|CUST027550...
2026-01-12 12:10:24,303 - dq_comparison - INFO - DEBUG HASH RESULT: 0fe9ff30...
2026-01-12 12:10:24,304 - dq_comparison - INFO - DEBUG HASH ROW: description: 'Text with(parentheses)' -> 'text with(parentheses)' | transaction_id: 'TX00083448' -> 'TX00083448' | transaction_date: '07-01-2023' -> '2023-01-07' | quantity: '48' -> '48' | customer_id: 'CUST083448' -> 'CUST083448'
2026-01-12 12:10:24,304 - dq_comparison - INFO - DEBUG HASH STRING: text with(parentheses)|TX00083448|2023-01-07|48|CUST083448...
2026-01-12 12:10:24,305 - dq_comparison - INFO - DEBUG HASH RESULT: d6e8a9c4...
2026-01-12 12:10:24,305 - dq_comparison - INFO - DEBUG HASH ROW: description: 'Text with*asterisks' -> 'text with*asterisks' | transaction_id: 'TX00034627' -> 'TX00034627' | transaction_date: '29-01-2023' -> '2023-01-29' | quantity: '7' -> '7' | customer_id: 'CUST034627' -> 'CUST034627'
2026-01-12 12:10:24,306 - dq_comparison - INFO - DEBUG HASH STRING: text with*asterisks|TX00034627|2023-01-29|7|CUST034627...
2026-01-12 12:10:24,307 - dq_comparison - INFO - DEBUG HASH RESULT: f131384c...
2026-01-12 12:10:24,307 - dq_comparison - INFO - DEBUG HASH ROW: description: 'Text with trailing spaces  ' -> 'text with trailing spaces' | transaction_id: 'TX00045332' -> 'TX00045332' | transaction_date: '12-03-2023' -> '2023-03-12' | quantity: '99' -> '99' | customer_id: 'CUST045332' -> 'CUST045332'
2026-01-12 12:10:24,308 - dq_comparison - INFO - DEBUG HASH STRING: text with trailing spaces|TX00045332|2023-03-12|99|CUST045332...
2026-01-12 12:10:24,308 - dq_comparison - INFO - DEBUG HASH RESULT: 2f84e936...
2026-01-12 12:10:24,309 - dq_comparison - INFO - DEBUG HASH ROW: description: 'Text with mixed CAPITAL and lowercase' -> 'text with mixed capital and lowercase' | transaction_id: 'TX00059684' -> 'TX00059684' | transaction_date: '19-10-2023' -> '2023-10-19' | quantity: '76' -> '76' | customer_id: 'CUST059684' -> 'CUST059684'
2026-01-12 12:10:24,310 - dq_comparison - INFO - DEBUG HASH STRING: text with mixed capital and lowercase|TX00059684|2023-10-19|76|CUST059684...
2026-01-12 12:10:24,310 - dq_comparison - INFO - DEBUG HASH RESULT: 9d66d942...
2026-01-12 12:10:24,311 - dq_comparison - INFO - DEBUG HASH ROW: description: 'Text with! exclamations' -> 'text with! exclamations' | transaction_id: 'TX00000130' -> 'TX00000130' | transaction_date: '22-07-2023' -> '2023-07-22' | quantity: '26' -> '26' | customer_id: 'CUST000130' -> 'CUST000130'
2026-01-12 12:10:24,311 - dq_comparison - INFO - DEBUG HASH STRING: text with! exclamations|TX00000130|2023-07-22|26|CUST000130...
2026-01-12 12:10:24,312 - dq_comparison - INFO - DEBUG HASH RESULT: 3a4f9e39...
2026-01-12 12:10:24,313 - dq_comparison - INFO - DEBUG HASH ROW: description: 'Text with@at signs' -> 'text with@at signs' | transaction_id: 'TX00024978' -> 'TX00024978' | transaction_date: '02-01-2023' -> '2023-01-02' | quantity: '86' -> '86' | customer_id: 'CUST024978' -> 'CUST024978'
2026-01-12 12:10:24,313 - dq_comparison - INFO - DEBUG HASH STRING: text with@at signs|TX00024978|2023-01-02|86|CUST024978...
2026-01-12 12:10:24,314 - dq_comparison - INFO - DEBUG HASH RESULT: f584cc75...
2026-01-12 12:10:24,315 - dq_comparison - INFO - DEBUG HASH ROW: description: 'Normal text without issues' -> 'normal text without issues' | transaction_id: 'TX00070887' -> 'TX00070887' | transaction_date: '08-07-2023' -> '2023-07-08' | quantity: '40' -> '40' | customer_id: 'CUST070887' -> 'CUST070887'
2026-01-12 12:10:24,315 - dq_comparison - INFO - DEBUG HASH STRING: normal text without issues|TX00070887|2023-07-08|40|CUST070887...
2026-01-12 12:10:24,316 - dq_comparison - INFO - DEBUG HASH RESULT: 94310fa6...
2026-01-12 12:10:24,316 - dq_comparison - INFO - DEBUG HASH ROW: description: 'Text with~tildes' -> 'text with~tildes' | transaction_id: 'TX00061135' -> 'TX00061135' | transaction_date: '18-04-2023' -> '2023-04-18' | quantity: '31' -> '31' | customer_id: 'CUST061135' -> 'CUST061135'
2026-01-12 12:10:24,317 - dq_comparison - INFO - DEBUG HASH STRING: text with~tildes|TX00061135|2023-04-18|31|CUST061135...
2026-01-12 12:10:24,318 - dq_comparison - INFO - DEBUG HASH RESULT: 97e93052...
2026-01-12 12:10:24,318 - dq_comparison - INFO - DEBUG HASH ROW: description: 'Text with$dollar signs' -> 'text with$dollar signs' | transaction_id: 'TX00064968' -> 'TX00064968' | transaction_date: '16-03-2023' -> '2023-03-16' | quantity: '32' -> '32' | customer_id: 'CUST064968' -> 'CUST064968'
2026-01-12 12:10:24,319 - dq_comparison - INFO - DEBUG HASH STRING: text with$dollar signs|TX00064968|2023-03-16|32|CUST064968...
2026-01-12 12:10:24,319 - dq_comparison - INFO - DEBUG HASH RESULT: 6e4a3f4c...
2026-01-12 12:10:24,319 - dq_comparison - INFO - DEBUG HASH ROW: description: 'Text with  multiple   spaces' -> 'text with multiple spaces' | transaction_id: 'TX00004790' -> 'TX00004790' | transaction_date: '22-01-2023' -> '2023-01-22' | quantity: '84' -> '84' | customer_id: 'CUST004790' -> 'CUST004790'
2026-01-12 12:10:24,320 - dq_comparison - INFO - DEBUG HASH STRING: text with multiple spaces|TX00004790|2023-01-22|84|CUST004790...
2026-01-12 12:10:24,321 - dq_comparison - INFO - DEBUG HASH RESULT: a08accb5...
2026-01-12 12:10:24,321 - dq_comparison - INFO - DEBUG HASH ROW: description: 'Text with"quotes"' -> 'text with"quotes"' | transaction_id: 'TX00032399' -> 'TX00032399' | transaction_date: '30-08-2023' -> '2023-08-30' | quantity: '43' -> '43' | customer_id: 'CUST032399' -> 'CUST032399'
2026-01-12 12:10:24,322 - dq_comparison - INFO - DEBUG HASH STRING: text with"quotes"|TX00032399|2023-08-30|43|CUST032399...
2026-01-12 12:10:24,322 - dq_comparison - INFO - DEBUG HASH RESULT: 3386a1df...
2026-01-12 12:10:24,323 - dq_comparison - INFO - DEBUG HASH ROW: description: 'Text with@at signs' -> 'text with@at signs' | transaction_id: 'TX00003195' -> 'TX00003195' | transaction_date: '16-10-2023' -> '2023-10-16' | quantity: '96' -> '96' | customer_id: 'CUST003195' -> 'CUST003195'
2026-01-12 12:10:24,324 - dq_comparison - INFO - DEBUG HASH STRING: text with@at signs|TX00003195|2023-10-16|96|CUST003195...
2026-01-12 12:10:24,324 - dq_comparison - INFO - DEBUG HASH RESULT: 95a11524...
2026-01-12 12:10:24,325 - dq_comparison - INFO - DEBUG HASH ROW: description: 'Text with, commas' -> 'text with, commas' | transaction_id: 'TX00031017' -> 'TX00031017' | transaction_date: '15-12-2023' -> '2023-12-15' | quantity: '93' -> '93' | customer_id: 'CUST031017' -> 'CUST031017'
2026-01-12 12:10:24,326 - dq_comparison - INFO - DEBUG HASH STRING: text with, commas|TX00031017|2023-12-15|93|CUST031017...
2026-01-12 12:10:24,326 - dq_comparison - INFO - DEBUG HASH RESULT: d06c45a8...
2026-01-12 12:10:24,328 - dq_comparison - INFO - DEBUG HASH ROW: description: 'Text with mixed CAPITAL and lowercase' -> 'text with mixed capital and lowercase' | transaction_id: 'TX00082706' -> 'TX00082706' | transaction_date: '23-10-2023' -> '2023-10-23' | quantity: '63' -> '63' | customer_id: 'CUST082706' -> 'CUST082706'
2026-01-12 12:10:24,328 - dq_comparison - INFO - DEBUG HASH STRING: text with mixed capital and lowercase|TX00082706|2023-10-23|63|CUST082706...
2026-01-12 12:10:24,329 - dq_comparison - INFO - DEBUG HASH RESULT: 2695538e...
2026-01-12 12:10:24,329 - dq_comparison - INFO - DEBUG HASH ROW: description: 'Text with_underscores' -> 'text with_underscores' | transaction_id: 'TX00047199' -> 'TX00047199' | transaction_date: '25-06-2023' -> '2023-06-25' | quantity: '28' -> '28' | customer_id: 'CUST047199' -> 'CUST047199'
2026-01-12 12:10:24,330 - dq_comparison - INFO - DEBUG HASH STRING: text with_underscores|TX00047199|2023-06-25|28|CUST047199...
2026-01-12 12:10:24,330 - dq_comparison - INFO - DEBUG HASH RESULT: a6706e6d...
2026-01-12 12:10:24,331 - dq_comparison - INFO - DEBUG HASH ROW: description: 'Text with. periods' -> 'text with. periods' | transaction_id: 'TX00023325' -> 'TX00023325' | transaction_date: '10-04-2023' -> '2023-04-10' | quantity: '76' -> '76' | customer_id: 'CUST023325' -> 'CUST023325'
2026-01-12 12:10:24,332 - dq_comparison - INFO - DEBUG HASH STRING: text with. periods|TX00023325|2023-04-10|76|CUST023325...
2026-01-12 12:10:24,332 - dq_comparison - INFO - DEBUG HASH RESULT: 559c8336...
2026-01-12 12:10:24,333 - dq_comparison - INFO - DEBUG HASH ROW: description: 'Text with%percent signs' -> 'text with%percent signs' | transaction_id: 'TX00014397' -> 'TX00014397' | transaction_date: '07-12-2023' -> '2023-12-07' | quantity: '35' -> '35' | customer_id: 'CUST014397' -> 'CUST014397'
2026-01-12 12:10:24,333 - dq_comparison - INFO - DEBUG HASH STRING: text with%percent signs|TX00014397|2023-12-07|35|CUST014397...
2026-01-12 12:10:24,334 - dq_comparison - INFO - DEBUG HASH RESULT: ab73f74b...
2026-01-12 12:10:24,335 - dq_comparison - INFO - DEBUG HASH ROW: description: 'Text with*asterisks' -> 'text with*asterisks' | transaction_id: 'TX00030395' -> 'TX00030395' | transaction_date: '02-12-2023' -> '2023-12-02' | quantity: '26' -> '26' | customer_id: 'CUST030395' -> 'CUST030395'
2026-01-12 12:10:24,335 - dq_comparison - INFO - DEBUG HASH STRING: text with*asterisks|TX00030395|2023-12-02|26|CUST030395...
2026-01-12 12:10:24,336 - dq_comparison - INFO - DEBUG HASH RESULT: 86f4135d...
2026-01-12 12:10:24,336 - dq_comparison - INFO - DEBUG HASH ROW: description: 'Text with*asterisks' -> 'text with*asterisks' | transaction_id: 'TX00013150' -> 'TX00013150' | transaction_date: '06-11-2023' -> '2023-11-06' | quantity: '19' -> '19' | customer_id: 'CUST013150' -> 'CUST013150'
2026-01-12 12:10:24,337 - dq_comparison - INFO - DEBUG HASH STRING: text with*asterisks|TX00013150|2023-11-06|19|CUST013150...
2026-01-12 12:10:24,337 - dq_comparison - INFO - DEBUG HASH RESULT: abd5d3f6...
2026-01-12 12:10:24,338 - dq_comparison - INFO - DEBUG HASH ROW: description: 'Text with, commas' -> 'text with, commas' | transaction_id: 'TX00061527' -> 'TX00061527' | transaction_date: '08-05-2023' -> '2023-05-08' | quantity: '74' -> '74' | customer_id: 'CUST061527' -> 'CUST061527'
2026-01-12 12:10:24,339 - dq_comparison - INFO - DEBUG HASH STRING: text with, commas|TX00061527|2023-05-08|74|CUST061527...
2026-01-12 12:10:24,339 - dq_comparison - INFO - DEBUG HASH RESULT: 2f3a291c...
2026-01-12 12:10:24,340 - dq_comparison - INFO - DEBUG HASH ROW: description: 'Text with! exclamations' -> 'text with! exclamations' | transaction_id: 'TX00036172' -> 'TX00036172' | transaction_date: '12-07-2023' -> '2023-07-12' | quantity: '46' -> '46' | customer_id: 'CUST036172' -> 'CUST036172'
2026-01-12 12:10:24,341 - dq_comparison - INFO - DEBUG HASH STRING: text with! exclamations|TX00036172|2023-07-12|46|CUST036172...
2026-01-12 12:10:24,341 - dq_comparison - INFO - DEBUG HASH RESULT: fd839d2e...
2026-01-12 12:10:24,342 - dq_comparison - INFO - DEBUG HASH ROW: description: 'Text with{braces}' -> 'text with{braces}' | transaction_id: 'TX00091627' -> 'TX00091627' | transaction_date: '11/20/2023' -> '2023-11-20' | quantity: '65' -> '65' | customer_id: 'CUST091627' -> 'CUST091627'
2026-01-12 12:10:24,342 - dq_comparison - INFO - DEBUG HASH STRING: text with{braces}|TX00091627|2023-11-20|65|CUST091627...
2026-01-12 12:10:24,343 - dq_comparison - INFO - DEBUG HASH RESULT: 9c775416...
2026-01-12 12:10:24,344 - dq_comparison - INFO - DEBUG HASH ROW: description: 'Text with~tildes' -> 'text with~tildes' | transaction_id: 'TX00029395' -> 'TX00029395' | transaction_date: '05-08-2023' -> '2023-08-05' | quantity: '26' -> '26' | customer_id: 'CUST029395' -> 'CUST029395'
2026-01-12 12:10:24,344 - dq_comparison - INFO - DEBUG HASH STRING: text with~tildes|TX00029395|2023-08-05|26|CUST029395...
2026-01-12 12:10:24,345 - dq_comparison - INFO - DEBUG HASH RESULT: 66c2d3f5...
2026-01-12 12:10:24,346 - dq_comparison - INFO - DEBUG HASH ROW: description: 'Text with mixed CAPITAL and lowercase' -> 'text with mixed capital and lowercase' | transaction_id: 'TX00025601' -> 'TX00025601' | transaction_date: '04-05-2023' -> '2023-05-04' | quantity: '25' -> '25' | customer_id: 'CUST025601' -> 'CUST025601'
2026-01-12 12:10:24,346 - dq_comparison - INFO - DEBUG HASH STRING: text with mixed capital and lowercase|TX00025601|2023-05-04|25|CUST025601...
2026-01-12 12:10:24,347 - dq_comparison - INFO - DEBUG HASH RESULT: 1e68926c...
2026-01-12 12:10:24,348 - dq_comparison - INFO - DEBUG HASH ROW: description: 'Text with& ampersands' -> 'text with& ampersands' | transaction_id: 'TX00062326' -> 'TX00062326' | transaction_date: '04/24/2023' -> '2023-04-24' | quantity: '21' -> '21' | customer_id: 'CUST062326' -> 'CUST062326'
2026-01-12 12:10:24,348 - dq_comparison - INFO - DEBUG HASH STRING: text with& ampersands|TX00062326|2023-04-24|21|CUST062326...
2026-01-12 12:10:24,349 - dq_comparison - INFO - DEBUG HASH RESULT: e592b308...
2026-01-12 12:10:24,350 - dq_comparison - INFO - DEBUG HASH ROW: description: 'Text with  multiple   spaces' -> 'text with multiple spaces' | transaction_id: 'TX00082202' -> 'TX00082202' | transaction_date: '07-11-2023' -> '2023-11-07' | quantity: '17' -> '17' | customer_id: 'CUST082202' -> 'CUST082202'
2026-01-12 12:10:24,350 - dq_comparison - INFO - DEBUG HASH STRING: text with multiple spaces|TX00082202|2023-11-07|17|CUST082202...
2026-01-12 12:10:24,351 - dq_comparison - INFO - DEBUG HASH RESULT: 94fc13fb...
2026-01-12 12:10:24,351 - dq_comparison - INFO - DEBUG HASH ROW: description: 'Text with(parentheses)' -> 'text with(parentheses)' | transaction_id: 'TX00068039' -> 'TX00068039' | transaction_date: '11-08-2023' -> '2023-08-11' | quantity: '68' -> '68' | customer_id: 'CUST068039' -> 'CUST068039'
2026-01-12 12:10:24,352 - dq_comparison - INFO - DEBUG HASH STRING: text with(parentheses)|TX00068039|2023-08-11|68|CUST068039...
2026-01-12 12:10:24,353 - dq_comparison - INFO - DEBUG HASH RESULT: afa97788...
2026-01-12 12:10:24,353 - dq_comparison - INFO - DEBUG HASH ROW: description: 'Text with_underscores' -> 'text with_underscores' | transaction_id: 'TX00034422' -> 'TX00034422' | transaction_date: '15-04-2023' -> '2023-04-15' | quantity: '21' -> '21' | customer_id: 'CUST034422' -> 'CUST034422'
2026-01-12 12:10:24,354 - dq_comparison - INFO - DEBUG HASH STRING: text with_underscores|TX00034422|2023-04-15|21|CUST034422...
2026-01-12 12:10:24,354 - dq_comparison - INFO - DEBUG HASH RESULT: d75017cd...
2026-01-12 12:10:24,355 - dq_comparison - INFO - DEBUG HASH ROW: description: 'Text with`backticks' -> 'text with`backticks' | transaction_id: 'TX00037791' -> 'TX00037791' | transaction_date: '08-11-2023' -> '2023-11-08' | quantity: '75' -> '75' | customer_id: 'CUST037791' -> 'CUST037791'
2026-01-12 12:10:24,356 - dq_comparison - INFO - DEBUG HASH STRING: text with`backticks|TX00037791|2023-11-08|75|CUST037791...
2026-01-12 12:10:24,356 - dq_comparison - INFO - DEBUG HASH RESULT: 18aa6710...
2026-01-12 12:10:24,357 - dq_comparison - INFO - DEBUG HASH ROW: description: 'Text with[brackets]' -> 'text with[brackets]' | transaction_id: 'TX00032751' -> 'TX00032751' | transaction_date: '11/18/2023' -> '2023-11-18' | quantity: '4' -> '4' | customer_id: 'CUST032751' -> 'CUST032751'
2026-01-12 12:10:24,358 - dq_comparison - INFO - DEBUG HASH STRING: text with[brackets]|TX00032751|2023-11-18|4|CUST032751...
2026-01-12 12:10:24,358 - dq_comparison - INFO - DEBUG HASH RESULT: c5236a3d...
2026-01-12 12:10:24,360 - dq_comparison - INFO - DEBUG HASH ROW: description: 'Text with'apostrophes' -> 'text with'apostrophes' | transaction_id: 'TX00009821' -> 'TX00009821' | transaction_date: '04/18/2023' -> '2023-04-18' | quantity: '17' -> '17' | customer_id: 'CUST009821' -> 'CUST009821'
2026-01-12 12:10:24,360 - dq_comparison - INFO - DEBUG HASH STRING: text with'apostrophes|TX00009821|2023-04-18|17|CUST009821...
2026-01-12 12:10:24,361 - dq_comparison - INFO - DEBUG HASH RESULT: 072802fa...
2026-01-12 12:10:24,362 - dq_comparison - INFO - DEBUG HASH ROW: description: '  Text with leading spaces' -> 'text with leading spaces' | transaction_id: 'TX00033923' -> 'TX00033923' | transaction_date: '17-06-2023' -> '2023-06-17' | quantity: '53' -> '53' | customer_id: 'CUST033923' -> 'CUST033923'
2026-01-12 12:10:24,362 - dq_comparison - INFO - DEBUG HASH STRING: text with leading spaces|TX00033923|2023-06-17|53|CUST033923...
2026-01-12 12:10:24,363 - dq_comparison - INFO - DEBUG HASH RESULT: 12ad27cf...
2026-01-12 12:10:24,364 - dq_comparison - INFO - DEBUG HASH ROW: description: 'Text with
newlines' -> 'text with newlines' | transaction_id: 'TX00059630' -> 'TX00059630' | transaction_date: '27-12-2023' -> '2023-12-27' | quantity: '15' -> '15' | customer_id: 'CUST059630' -> 'CUST059630'
2026-01-12 12:10:24,366 - dq_comparison - INFO - DEBUG HASH STRING: text with newlines|TX00059630|2023-12-27|15|CUST059630...
2026-01-12 12:10:24,366 - dq_comparison - INFO - DEBUG HASH RESULT: 54cd0452...
2026-01-12 12:10:24,368 - dq_comparison - INFO - DEBUG HASH ROW: description: 'Text with trailing spaces  ' -> 'text with trailing spaces' | transaction_id: 'TX00009458' -> 'TX00009458' | transaction_date: '16-08-2023' -> '2023-08-16' | quantity: '85' -> '85' | customer_id: 'CUST009458' -> 'CUST009458'
2026-01-12 12:10:24,368 - dq_comparison - INFO - DEBUG HASH STRING: text with trailing spaces|TX00009458|2023-08-16|85|CUST009458...
2026-01-12 12:10:24,369 - dq_comparison - INFO - DEBUG HASH RESULT: 781f8593...
2026-01-12 12:10:24,370 - dq_comparison - INFO - DEBUG HASH ROW: description: 'Text with"quotes"' -> 'text with"quotes"' | transaction_id: 'TX00055439' -> 'TX00055439' | transaction_date: '09-11-2023' -> '2023-11-09' | quantity: '73' -> '73' | customer_id: 'CUST055439' -> 'CUST055439'
2026-01-12 12:10:24,371 - dq_comparison - INFO - DEBUG HASH STRING: text with"quotes"|TX00055439|2023-11-09|73|CUST055439...
2026-01-12 12:10:24,371 - dq_comparison - INFO - DEBUG HASH RESULT: b9e8a4cf...
2026-01-12 12:10:24,372 - dq_comparison - INFO - DEBUG HASH ROW: description: 'Text with~tildes' -> 'text with~tildes' | transaction_id: 'TX00053630' -> 'TX00053630' | transaction_date: '22-09-2023' -> '2023-09-22' | quantity: '22' -> '22' | customer_id: 'CUST053630' -> 'CUST053630'
2026-01-12 12:10:24,373 - dq_comparison - INFO - DEBUG HASH STRING: text with~tildes|TX00053630|2023-09-22|22|CUST053630...
2026-01-12 12:10:24,374 - dq_comparison - INFO - DEBUG HASH RESULT: 28ee42f2...
2026-01-12 12:10:24,374 - dq_comparison - INFO - DEBUG HASH ROW: description: 'Text with; semicolons' -> 'text with; semicolons' | transaction_id: 'TX00065556' -> 'TX00065556' | transaction_date: '08-08-2023' -> '2023-08-08' | quantity: '70' -> '70' | customer_id: 'CUST065556' -> 'CUST065556'
2026-01-12 12:10:24,376 - dq_comparison - INFO - DEBUG HASH STRING: text with; semicolons|TX00065556|2023-08-08|70|CUST065556...
2026-01-12 12:10:24,376 - dq_comparison - INFO - DEBUG HASH RESULT: 9eec18ee...
2026-01-12 12:10:24,377 - dq_comparison - INFO - DEBUG HASH ROW: description: 'Text with`backticks' -> 'text with`backticks' | transaction_id: 'TX00087771' -> 'TX00087771' | transaction_date: '08/21/2023' -> '2023-08-21' | quantity: '23' -> '23' | customer_id: 'CUST087771' -> 'CUST087771'
2026-01-12 12:10:24,377 - dq_comparison - INFO - DEBUG HASH STRING: text with`backticks|TX00087771|2023-08-21|23|CUST087771...
2026-01-12 12:10:24,378 - dq_comparison - INFO - DEBUG HASH RESULT: 291e15fd...
2026-01-12 12:10:24,379 - dq_comparison - INFO - DEBUG HASH ROW: description: 'Text with`backticks' -> 'text with`backticks' | transaction_id: 'TX00023730' -> 'TX00023730' | transaction_date: '17-03-2023' -> '2023-03-17' | quantity: '19' -> '19' | customer_id: 'CUST023730' -> 'CUST023730'
2026-01-12 12:10:24,379 - dq_comparison - INFO - DEBUG HASH STRING: text with`backticks|TX00023730|2023-03-17|19|CUST023730...
2026-01-12 12:10:24,380 - dq_comparison - INFO - DEBUG HASH RESULT: 28b98b42...
2026-01-12 12:10:24,381 - dq_comparison - INFO - DEBUG HASH ROW: description: 'Text with, commas' -> 'text with, commas' | transaction_id: 'TX00001644' -> 'TX00001644' | transaction_date: '01-06-2023' -> '2023-06-01' | quantity: '41' -> '41' | customer_id: 'CUST001644' -> 'CUST001644'
2026-01-12 12:10:24,381 - dq_comparison - INFO - DEBUG HASH STRING: text with, commas|TX00001644|2023-06-01|41|CUST001644...
2026-01-12 12:10:24,382 - dq_comparison - INFO - DEBUG HASH RESULT: 2f9389f8...
2026-01-12 12:10:24,383 - dq_comparison - INFO - DEBUG HASH ROW: description: 'Text with(parentheses)' -> 'text with(parentheses)' | transaction_id: 'TX00016278' -> 'TX00016278' | transaction_date: '22-04-2023' -> '2023-04-22' | quantity: '78' -> '78' | customer_id: 'CUST016278' -> 'CUST016278'
2026-01-12 12:10:24,383 - dq_comparison - INFO - DEBUG HASH STRING: text with(parentheses)|TX00016278|2023-04-22|78|CUST016278...
2026-01-12 12:10:24,384 - dq_comparison - INFO - DEBUG HASH RESULT: baac332b...
2026-01-12 12:10:24,384 - dq_comparison - INFO - DEBUG HASH ROW: description: 'Text with~tildes' -> 'text with~tildes' | transaction_id: 'TX00062287' -> 'TX00062287' | transaction_date: '22-06-2023' -> '2023-06-22' | quantity: '94' -> '94' | customer_id: 'CUST062287' -> 'CUST062287'
2026-01-12 12:10:24,385 - dq_comparison - INFO - DEBUG HASH STRING: text with~tildes|TX00062287|2023-06-22|94|CUST062287...
2026-01-12 12:10:24,386 - dq_comparison - INFO - DEBUG HASH RESULT: 0516fe34...
2026-01-12 12:10:24,387 - dq_comparison - INFO - DEBUG HASH ROW: description: 'Text with; semicolons' -> 'text with; semicolons' | transaction_id: 'TX00062130' -> 'TX00062130' | transaction_date: '19-09-2023' -> '2023-09-19' | quantity: '66' -> '66' | customer_id: 'CUST062130' -> 'CUST062130'
2026-01-12 12:10:24,388 - dq_comparison - INFO - DEBUG HASH STRING: text with; semicolons|TX00062130|2023-09-19|66|CUST062130...
2026-01-12 12:10:24,388 - dq_comparison - INFO - DEBUG HASH RESULT: 5fa0b56e...
2026-01-12 12:10:24,389 - dq_comparison - INFO - DEBUG HASH ROW: description: 'Text with_underscores' -> 'text with_underscores' | transaction_id: 'TX00035256' -> 'TX00035256' | transaction_date: '08-06-2023' -> '2023-06-08' | quantity: '80' -> '80' | customer_id: 'CUST035256' -> 'CUST035256'
2026-01-12 12:10:24,390 - dq_comparison - INFO - DEBUG HASH STRING: text with_underscores|TX00035256|2023-06-08|80|CUST035256...
2026-01-12 12:10:24,390 - dq_comparison - INFO - DEBUG HASH RESULT: aa6183ad...
2026-01-12 12:10:24,392 - dq_comparison - INFO - DEBUG HASH ROW: description: 'Text with! exclamations' -> 'text with! exclamations' | transaction_id: 'TX00081527' -> 'TX00081527' | transaction_date: '15-11-2023' -> '2023-11-15' | quantity: '48' -> '48' | customer_id: 'CUST081527' -> 'CUST081527'
2026-01-12 12:10:24,392 - dq_comparison - INFO - DEBUG HASH STRING: text with! exclamations|TX00081527|2023-11-15|48|CUST081527...
2026-01-12 12:10:24,393 - dq_comparison - INFO - DEBUG HASH RESULT: c8650085...
2026-01-12 12:10:24,393 - dq_comparison - INFO - DEBUG HASH ROW: description: 'Text with'apostrophes' -> 'text with'apostrophes' | transaction_id: 'TX00088532' -> 'TX00088532' | transaction_date: '30-01-2023' -> '2023-01-30' | quantity: '26' -> '26' | customer_id: 'CUST088532' -> 'CUST088532'
2026-01-12 12:10:24,395 - dq_comparison - INFO - DEBUG HASH STRING: text with'apostrophes|TX00088532|2023-01-30|26|CUST088532...
2026-01-12 12:10:24,395 - dq_comparison - INFO - DEBUG HASH RESULT: b5005ac9...
2026-01-12 12:10:24,396 - dq_comparison - INFO - DEBUG HASH ROW: description: 'Text with#hashtags' -> 'text with#hashtags' | transaction_id: 'TX00068364' -> 'TX00068364' | transaction_date: '25-11-2023' -> '2023-11-25' | quantity: '99' -> '99' | customer_id: 'CUST068364' -> 'CUST068364'
2026-01-12 12:10:24,397 - dq_comparison - INFO - DEBUG HASH STRING: text with#hashtags|TX00068364|2023-11-25|99|CUST068364...
2026-01-12 12:10:24,397 - dq_comparison - INFO - DEBUG HASH RESULT: 4ebdd092...
2026-01-12 12:10:24,398 - dq_comparison - INFO - DEBUG HASH ROW: description: 'Text with  multiple   spaces' -> 'text with multiple spaces' | transaction_id: 'TX00024943' -> 'TX00024943' | transaction_date: '28-03-2023' -> '2023-03-28' | quantity: '97' -> '97' | customer_id: 'CUST024943' -> 'CUST024943'
2026-01-12 12:10:24,399 - dq_comparison - INFO - DEBUG HASH STRING: text with multiple spaces|TX00024943|2023-03-28|97|CUST024943...
2026-01-12 12:10:24,400 - dq_comparison - INFO - DEBUG HASH RESULT: ecc0ec72...
2026-01-12 12:10:24,400 - dq_comparison - INFO - DEBUG HASH ROW: description: 'Text with@at signs' -> 'text with@at signs' | transaction_id: 'TX00081665' -> 'TX00081665' | transaction_date: '04/22/2023' -> '2023-04-22' | quantity: '53' -> '53' | customer_id: 'CUST081665' -> 'CUST081665'
2026-01-12 12:10:24,401 - dq_comparison - INFO - DEBUG HASH STRING: text with@at signs|TX00081665|2023-04-22|53|CUST081665...
2026-01-12 12:10:24,401 - dq_comparison - INFO - DEBUG HASH RESULT: cddff20b...
2026-01-12 12:10:24,402 - dq_comparison - INFO - DEBUG HASH ROW: description: 'Text with
newlines' -> 'text with newlines' | transaction_id: 'TX00056540' -> 'TX00056540' | transaction_date: '15-12-2023' -> '2023-12-15' | quantity: '47' -> '47' | customer_id: 'CUST056540' -> 'CUST056540'
2026-01-12 12:10:24,402 - dq_comparison - INFO - DEBUG HASH STRING: text with newlines|TX00056540|2023-12-15|47|CUST056540...
2026-01-12 12:10:24,403 - dq_comparison - INFO - DEBUG HASH RESULT: 433d7765...
2026-01-12 12:10:24,404 - dq_comparison - INFO - DEBUG HASH ROW: description: 'Text with[brackets]' -> 'text with[brackets]' | transaction_id: 'TX00062426' -> 'TX00062426' | transaction_date: '12-04-2023' -> '2023-04-12' | quantity: '34' -> '34' | customer_id: 'CUST062426' -> 'CUST062426'
2026-01-12 12:10:24,404 - dq_comparison - INFO - DEBUG HASH STRING: text with[brackets]|TX00062426|2023-04-12|34|CUST062426...
2026-01-12 12:10:24,405 - dq_comparison - INFO - DEBUG HASH RESULT: f4ac3990...
2026-01-12 12:10:24,406 - dq_comparison - INFO - DEBUG HASH ROW: description: 'Text with& ampersands' -> 'text with& ampersands' | transaction_id: 'TX00036137' -> 'TX00036137' | transaction_date: '05-04-2023' -> '2023-04-05' | quantity: '89' -> '89' | customer_id: 'CUST036137' -> 'CUST036137'
2026-01-12 12:10:24,407 - dq_comparison - INFO - DEBUG HASH STRING: text with& ampersands|TX00036137|2023-04-05|89|CUST036137...
2026-01-12 12:10:24,407 - dq_comparison - INFO - DEBUG HASH RESULT: 0b42f3f7...
2026-01-12 12:10:24,408 - dq_comparison - INFO - DEBUG HASH ROW: description: 'Text with! exclamations' -> 'text with! exclamations' | transaction_id: 'TX00085923' -> 'TX00085923' | transaction_date: '03-08-2023' -> '2023-08-03' | quantity: '93' -> '93' | customer_id: 'CUST085923' -> 'CUST085923'
2026-01-12 12:10:24,409 - dq_comparison - INFO - DEBUG HASH STRING: text with! exclamations|TX00085923|2023-08-03|93|CUST085923...
2026-01-12 12:10:24,409 - dq_comparison - INFO - DEBUG HASH RESULT: 38be362d...
2026-01-12 12:10:24,410 - dq_comparison - INFO - DEBUG HASH ROW: description: 'Text with  multiple   spaces' -> 'text with multiple spaces' | transaction_id: 'TX00018641' -> 'TX00018641' | transaction_date: '09/24/2023' -> '2023-09-24' | quantity: '31' -> '31' | customer_id: 'CUST018641' -> 'CUST018641'
2026-01-12 12:10:24,411 - dq_comparison - INFO - DEBUG HASH STRING: text with multiple spaces|TX00018641|2023-09-24|31|CUST018641...
2026-01-12 12:10:24,411 - dq_comparison - INFO - DEBUG HASH RESULT: d98cdb62...
2026-01-12 12:10:24,412 - dq_comparison - INFO - DEBUG HASH ROW: description: 'Text with; semicolons' -> 'text with; semicolons' | transaction_id: 'TX00078605' -> 'TX00078605' | transaction_date: '07-11-2023' -> '2023-11-07' | quantity: '96' -> '96' | customer_id: 'CUST078605' -> 'CUST078605'
2026-01-12 12:10:24,413 - dq_comparison - INFO - DEBUG HASH STRING: text with; semicolons|TX00078605|2023-11-07|96|CUST078605...
2026-01-12 12:10:24,413 - dq_comparison - INFO - DEBUG HASH RESULT: 533f81ff...
2026-01-12 12:10:24,414 - dq_comparison - INFO - DEBUG HASH ROW: description: 'Normal text without issues' -> 'normal text without issues' | transaction_id: 'TX00030487' -> 'TX00030487' | transaction_date: '11-12-2023' -> '2023-12-11' | quantity: '13' -> '13' | customer_id: 'CUST030487' -> 'CUST030487'
2026-01-12 12:10:24,414 - dq_comparison - INFO - DEBUG HASH STRING: normal text without issues|TX00030487|2023-12-11|13|CUST030487...
2026-01-12 12:10:24,415 - dq_comparison - INFO - DEBUG HASH RESULT: 611d8fd1...
2026-01-12 12:10:24,416 - dq_comparison - INFO - DEBUG HASH ROW: description: 'Text with? questions' -> 'text with? questions' | transaction_id: 'TX00072652' -> 'TX00072652' | transaction_date: '29-04-2023' -> '2023-04-29' | quantity: '26' -> '26' | customer_id: 'CUST072652' -> 'CUST072652'
2026-01-12 12:10:24,416 - dq_comparison - INFO - DEBUG HASH STRING: text with? questions|TX00072652|2023-04-29|26|CUST072652...
2026-01-12 12:10:24,417 - dq_comparison - INFO - DEBUG HASH RESULT: 7f0bea0c...
2026-01-12 12:10:24,418 - dq_comparison - INFO - DEBUG HASH ROW: description: 'Text with$dollar signs' -> 'text with$dollar signs' | transaction_id: 'TX00027526' -> 'TX00027526' | transaction_date: '05-10-2023' -> '2023-10-05' | quantity: '77' -> '77' | customer_id: 'CUST027526' -> 'CUST027526'
2026-01-12 12:10:24,418 - dq_comparison - INFO - DEBUG HASH STRING: text with$dollar signs|TX00027526|2023-10-05|77|CUST027526...
2026-01-12 12:10:24,419 - dq_comparison - INFO - DEBUG HASH RESULT: 50d418a2...
2026-01-12 12:10:24,420 - dq_comparison - INFO - DEBUG HASH ROW: description: 'Text with! exclamations' -> 'text with! exclamations' | transaction_id: 'TX00099067' -> 'TX00099067' | transaction_date: '06-08-2023' -> '2023-08-06' | quantity: '26' -> '26' | customer_id: 'CUST099067' -> 'CUST099067'
2026-01-12 12:10:24,420 - dq_comparison - INFO - DEBUG HASH STRING: text with! exclamations|TX00099067|2023-08-06|26|CUST099067...
2026-01-12 12:10:24,421 - dq_comparison - INFO - DEBUG HASH RESULT: 1538306c...
2026-01-12 12:10:24,422 - dq_comparison - INFO - DEBUG HASH ROW: description: 'Text with[brackets]' -> 'text with[brackets]' | transaction_id: 'TX00041202' -> 'TX00041202' | transaction_date: '29-04-2023' -> '2023-04-29' | quantity: '35' -> '35' | customer_id: 'CUST041202' -> 'CUST041202'
2026-01-12 12:10:24,422 - dq_comparison - INFO - DEBUG HASH STRING: text with[brackets]|TX00041202|2023-04-29|35|CUST041202...
2026-01-12 12:10:24,424 - dq_comparison - INFO - DEBUG HASH RESULT: 04920092...
2026-01-12 12:10:24,425 - dq_comparison - INFO - DEBUG HASH ROW: description: 'Text with[brackets]' -> 'text with[brackets]' | transaction_id: 'TX00044776' -> 'TX00044776' | transaction_date: '05-02-2023' -> '2023-02-05' | quantity: '69' -> '69' | customer_id: 'CUST044776' -> 'CUST044776'
2026-01-12 12:10:24,425 - dq_comparison - INFO - DEBUG HASH STRING: text with[brackets]|TX00044776|2023-02-05|69|CUST044776...
2026-01-12 12:10:24,425 - dq_comparison - INFO - DEBUG HASH RESULT: 1a5cc02b...
2026-01-12 12:10:24,426 - dq_comparison - INFO - DEBUG HASH ROW: description: 'Text with? questions' -> 'text with? questions' | transaction_id: 'TX00098617' -> 'TX00098617' | transaction_date: '10/26/2023' -> '2023-10-26' | quantity: '70' -> '70' | customer_id: 'CUST098617' -> 'CUST098617'
2026-01-12 12:10:24,426 - dq_comparison - INFO - DEBUG HASH STRING: text with? questions|TX00098617|2023-10-26|70|CUST098617...
2026-01-12 12:10:24,427 - dq_comparison - INFO - DEBUG HASH RESULT: 2aac42b3...
2026-01-12 12:10:24,427 - dq_comparison - INFO - DEBUG HASH ROW: description: 'Text with%percent signs' -> 'text with%percent signs' | transaction_id: 'TX00092755' -> 'TX00092755' | transaction_date: '30-12-2023' -> '2023-12-30' | quantity: '7' -> '7' | customer_id: 'CUST092755' -> 'CUST092755'
2026-01-12 12:10:24,428 - dq_comparison - INFO - DEBUG HASH STRING: text with%percent signs|TX00092755|2023-12-30|7|CUST092755...
2026-01-12 12:10:24,428 - dq_comparison - INFO - DEBUG HASH RESULT: db0f8d78...
2026-01-12 12:10:24,429 - dq_comparison - INFO - DEBUG HASH ROW: description: 'Text with<angle brackets>' -> 'text with<angle brackets>' | transaction_id: 'TX00042927' -> 'TX00042927' | transaction_date: '30-07-2023' -> '2023-07-30' | quantity: '93' -> '93' | customer_id: 'CUST042927' -> 'CUST042927'
2026-01-12 12:10:24,430 - dq_comparison - INFO - DEBUG HASH STRING: text with<angle brackets>|TX00042927|2023-07-30|93|CUST042927...
2026-01-12 12:10:24,430 - dq_comparison - INFO - DEBUG HASH RESULT: 3f9bed09...
2026-01-12 12:10:24,431 - dq_comparison - INFO - DEBUG HASH ROW: description: 'Text with/slashes' -> 'text with/slashes' | transaction_id: 'TX00069337' -> 'TX00069337' | transaction_date: '19-12-2023' -> '2023-12-19' | quantity: '33' -> '33' | customer_id: 'CUST069337' -> 'CUST069337'
2026-01-12 12:10:24,432 - dq_comparison - INFO - DEBUG HASH STRING: text with/slashes|TX00069337|2023-12-19|33|CUST069337...
2026-01-12 12:10:24,432 - dq_comparison - INFO - DEBUG HASH RESULT: 328c5289...
2026-01-12 12:10:24,433 - dq_comparison - INFO - DEBUG HASH ROW: description: 'Text with! exclamations' -> 'text with! exclamations' | transaction_id: 'TX00072437' -> 'TX00072437' | transaction_date: '18-09-2023' -> '2023-09-18' | quantity: '56' -> '56' | customer_id: 'CUST072437' -> 'CUST072437'
2026-01-12 12:10:24,434 - dq_comparison - INFO - DEBUG HASH STRING: text with! exclamations|TX00072437|2023-09-18|56|CUST072437...
2026-01-12 12:10:24,434 - dq_comparison - INFO - DEBUG HASH RESULT: da07b465...
2026-01-12 12:10:24,435 - dq_comparison - INFO - DEBUG HASH ROW: description: 'Text with. periods' -> 'text with. periods' | transaction_id: 'TX00050802' -> 'TX00050802' | transaction_date: '10-12-2023' -> '2023-12-10' | quantity: '18' -> '18' | customer_id: 'CUST050802' -> 'CUST050802'
2026-01-12 12:10:24,435 - dq_comparison - INFO - DEBUG HASH STRING: text with. periods|TX00050802|2023-12-10|18|CUST050802...
2026-01-12 12:10:24,436 - dq_comparison - INFO - DEBUG HASH RESULT: e589e7ee...
2026-01-12 12:10:24,437 - dq_comparison - INFO - DEBUG HASH ROW: description: 'Normal text without issues' -> 'normal text without issues' | transaction_id: 'TX00093539' -> 'TX00093539' | transaction_date: '14-08-2023' -> '2023-08-14' | quantity: '100' -> '100' | customer_id: 'CUST093539' -> 'CUST093539'
2026-01-12 12:10:24,437 - dq_comparison - INFO - DEBUG HASH STRING: normal text without issues|TX00093539|2023-08-14|100|CUST093539...
2026-01-12 12:10:24,439 - dq_comparison - INFO - DEBUG HASH RESULT: d5929b6b...
2026-01-12 12:10:24,439 - dq_comparison - INFO - DEBUG HASH ROW: description: 'Text with trailing spaces  ' -> 'text with trailing spaces' | transaction_id: 'TX00043096' -> 'TX00043096' | transaction_date: '09/23/2023' -> '2023-09-23' | quantity: '85' -> '85' | customer_id: 'CUST043096' -> 'CUST043096'
2026-01-12 12:10:24,440 - dq_comparison - INFO - DEBUG HASH STRING: text with trailing spaces|TX00043096|2023-09-23|85|CUST043096...
2026-01-12 12:10:24,440 - dq_comparison - INFO - DEBUG HASH RESULT: 26aefe96...
2026-01-12 12:10:24,441 - dq_comparison - INFO - DEBUG HASH ROW: description: 'Text with
newlines' -> 'text with newlines' | transaction_id: 'TX00024344' -> 'TX00024344' | transaction_date: '27-04-2023' -> '2023-04-27' | quantity: '92' -> '92' | customer_id: 'CUST024344' -> 'CUST024344'
2026-01-12 12:10:24,442 - dq_comparison - INFO - DEBUG HASH STRING: text with newlines|TX00024344|2023-04-27|92|CUST024344...
2026-01-12 12:10:24,442 - dq_comparison - INFO - DEBUG HASH RESULT: 10575343...
2026-01-12 12:10:24,443 - dq_comparison - INFO - DEBUG HASH ROW: description: 'Text with#hashtags' -> 'text with#hashtags' | transaction_id: 'TX00051467' -> 'TX00051467' | transaction_date: '24-08-2023' -> '2023-08-24' | quantity: '30' -> '30' | customer_id: 'CUST051467' -> 'CUST051467'
2026-01-12 12:10:24,443 - dq_comparison - INFO - DEBUG HASH STRING: text with#hashtags|TX00051467|2023-08-24|30|CUST051467...
2026-01-12 12:10:24,444 - dq_comparison - INFO - DEBUG HASH RESULT: 9cf9551f...
2026-01-12 12:10:24,445 - dq_comparison - INFO - DEBUG HASH ROW: description: 'Text with_underscores' -> 'text with_underscores' | transaction_id: 'TX00045694' -> 'TX00045694' | transaction_date: '08-04-2023' -> '2023-04-08' | quantity: '42' -> '42' | customer_id: 'CUST045694' -> 'CUST045694'
2026-01-12 12:10:24,445 - dq_comparison - INFO - DEBUG HASH STRING: text with_underscores|TX00045694|2023-04-08|42|CUST045694...
2026-01-12 12:10:24,446 - dq_comparison - INFO - DEBUG HASH RESULT: cc4c8940...
2026-01-12 12:10:24,447 - dq_comparison - INFO - DEBUG HASH ROW: description: 'Text with(parentheses)' -> 'text with(parentheses)' | transaction_id: 'TX00091569' -> 'TX00091569' | transaction_date: '11-03-2023' -> '2023-03-11' | quantity: '29' -> '29' | customer_id: 'CUST091569' -> 'CUST091569'
2026-01-12 12:10:24,447 - dq_comparison - INFO - DEBUG HASH STRING: text with(parentheses)|TX00091569|2023-03-11|29|CUST091569...
2026-01-12 12:10:24,447 - dq_comparison - INFO - DEBUG HASH RESULT: b3f955bc...
2026-01-12 12:10:24,448 - dq_comparison - INFO - DEBUG HASH ROW: description: 'Text with@at signs' -> 'text with@at signs' | transaction_id: 'TX00007895' -> 'TX00007895' | transaction_date: '10-07-2023' -> '2023-07-10' | quantity: '3' -> '3' | customer_id: 'CUST007895' -> 'CUST007895'
2026-01-12 12:10:24,449 - dq_comparison - INFO - DEBUG HASH STRING: text with@at signs|TX00007895|2023-07-10|3|CUST007895...
2026-01-12 12:10:24,449 - dq_comparison - INFO - DEBUG HASH RESULT: dd26d1c9...
2026-01-12 12:10:24,450 - dq_comparison - INFO - DEBUG HASH ROW: description: 'Normal text without issues' -> 'normal text without issues' | transaction_id: 'TX00040417' -> 'TX00040417' | transaction_date: '06-08-2023' -> '2023-08-06' | quantity: '87' -> '87' | customer_id: 'CUST040417' -> 'CUST040417'
2026-01-12 12:10:24,451 - dq_comparison - INFO - DEBUG HASH STRING: normal text without issues|TX00040417|2023-08-06|87|CUST040417...
2026-01-12 12:10:24,451 - dq_comparison - INFO - DEBUG HASH RESULT: 4cd2fc74...
2026-01-12 12:10:24,452 - dq_comparison - INFO - DEBUG HASH ROW: description: 'Text with trailing spaces  ' -> 'text with trailing spaces' | transaction_id: 'TX00011274' -> 'TX00011274' | transaction_date: '14-01-2023' -> '2023-01-14' | quantity: '87' -> '87' | customer_id: 'CUST011274' -> 'CUST011274'
2026-01-12 12:10:24,452 - dq_comparison - INFO - DEBUG HASH STRING: text with trailing spaces|TX00011274|2023-01-14|87|CUST011274...
2026-01-12 12:10:24,453 - dq_comparison - INFO - DEBUG HASH RESULT: e70b9f4d...
2026-01-12 12:10:24,453 - dq_comparison - INFO - DEBUG HASH ROW: description: 'Text with#hashtags' -> 'text with#hashtags' | transaction_id: 'TX00094042' -> 'TX00094042' | transaction_date: '08-10-2023' -> '2023-10-08' | quantity: '46' -> '46' | customer_id: 'CUST094042' -> 'CUST094042'
2026-01-12 12:10:24,454 - dq_comparison - INFO - DEBUG HASH STRING: text with#hashtags|TX00094042|2023-10-08|46|CUST094042...
2026-01-12 12:10:24,454 - dq_comparison - INFO - DEBUG HASH RESULT: 71f4f317...
2026-01-12 12:10:24,455 - dq_comparison - INFO - DEBUG HASH ROW: description: 'Text with! exclamations' -> 'text with! exclamations' | transaction_id: 'TX00014630' -> 'TX00014630' | transaction_date: '24-04-2023' -> '2023-04-24' | quantity: '42' -> '42' | customer_id: 'CUST014630' -> 'CUST014630'
2026-01-12 12:10:24,455 - dq_comparison - INFO - DEBUG HASH STRING: text with! exclamations|TX00014630|2023-04-24|42|CUST014630...
2026-01-12 12:10:24,456 - dq_comparison - INFO - DEBUG HASH RESULT: 6aec7ddb...
2026-01-12 12:10:24,457 - dq_comparison - INFO - DEBUG HASH ROW: description: 'Text with; semicolons' -> 'text with; semicolons' | transaction_id: 'TX00067520' -> 'TX00067520' | transaction_date: '06-03-2023' -> '2023-03-06' | quantity: '27' -> '27' | customer_id: 'CUST067520' -> 'CUST067520'
2026-01-12 12:10:24,457 - dq_comparison - INFO - DEBUG HASH STRING: text with; semicolons|TX00067520|2023-03-06|27|CUST067520...
2026-01-12 12:10:24,458 - dq_comparison - INFO - DEBUG HASH RESULT: f28fe3ad...
2026-01-12 12:10:24,459 - dq_comparison - INFO - DEBUG HASH ROW: description: 'Normal text without issues' -> 'normal text without issues' | transaction_id: 'TX00010349' -> 'TX00010349' | transaction_date: '30-01-2023' -> '2023-01-30' | quantity: '74' -> '74' | customer_id: 'CUST010349' -> 'CUST010349'
2026-01-12 12:10:24,459 - dq_comparison - INFO - DEBUG HASH STRING: normal text without issues|TX00010349|2023-01-30|74|CUST010349...
2026-01-12 12:10:24,460 - dq_comparison - INFO - DEBUG HASH RESULT: 27f64986...
2026-01-12 12:10:24,461 - dq_comparison - INFO - DEBUG HASH ROW: description: 'Text with\backslashes' -> 'text with\backslashes' | transaction_id: 'TX00048989' -> 'TX00048989' | transaction_date: '19-11-2023' -> '2023-11-19' | quantity: '48' -> '48' | customer_id: 'CUST048989' -> 'CUST048989'
2026-01-12 12:10:24,461 - dq_comparison - INFO - DEBUG HASH STRING: text with\backslashes|TX00048989|2023-11-19|48|CUST048989...
2026-01-12 12:10:24,462 - dq_comparison - INFO - DEBUG HASH RESULT: 67e7741d...
2026-01-12 12:10:24,462 - dq_comparison - INFO - DEBUG HASH ROW: description: 'Text with|pipes' -> 'text with|pipes' | transaction_id: 'TX00074386' -> 'TX00074386' | transaction_date: '03-07-2023' -> '2023-07-03' | quantity: '19' -> '19' | customer_id: 'CUST074386' -> 'CUST074386'
2026-01-12 12:10:24,463 - dq_comparison - INFO - DEBUG HASH STRING: text with|pipes|TX00074386|2023-07-03|19|CUST074386...
2026-01-12 12:10:24,464 - dq_comparison - INFO - DEBUG HASH RESULT: e0614a04...
2026-01-12 12:10:24,464 - dq_comparison - INFO - DEBUG HASH ROW: description: 'Text with@at signs' -> 'text with@at signs' | transaction_id: 'TX00099167' -> 'TX00099167' | transaction_date: '27-07-2023' -> '2023-07-27' | quantity: '17' -> '17' | customer_id: 'CUST099167' -> 'CUST099167'
2026-01-12 12:10:24,465 - dq_comparison - INFO - DEBUG HASH STRING: text with@at signs|TX00099167|2023-07-27|17|CUST099167...
2026-01-12 12:10:24,465 - dq_comparison - INFO - DEBUG HASH RESULT: 09675ba4...
2026-01-12 12:10:24,466 - dq_comparison - INFO - DEBUG HASH ROW: description: 'Text with - dashes' -> 'text with - dashes' | transaction_id: 'TX00033520' -> 'TX00033520' | transaction_date: '25-01-2023' -> '2023-01-25' | quantity: '35' -> '35' | customer_id: 'CUST033520' -> 'CUST033520'
2026-01-12 12:10:24,467 - dq_comparison - INFO - DEBUG HASH STRING: text with - dashes|TX00033520|2023-01-25|35|CUST033520...
2026-01-12 12:10:24,467 - dq_comparison - INFO - DEBUG HASH RESULT: 92153677...
2026-01-12 12:10:24,468 - dq_comparison - INFO - DEBUG HASH ROW: description: 'Text with& ampersands' -> 'text with& ampersands' | transaction_id: 'TX00010274' -> 'TX00010274' | transaction_date: '07-07-2023' -> '2023-07-07' | quantity: '89' -> '89' | customer_id: 'CUST010274' -> 'CUST010274'
2026-01-12 12:10:24,468 - dq_comparison - INFO - DEBUG HASH STRING: text with& ampersands|TX00010274|2023-07-07|89|CUST010274...
2026-01-12 12:10:24,469 - dq_comparison - INFO - DEBUG HASH RESULT: a2e72eed...
2026-01-12 12:10:24,470 - dq_comparison - INFO - DEBUG HASH ROW: description: 'Text with`backticks' -> 'text with`backticks' | transaction_id: 'TX00086032' -> 'TX00086032' | transaction_date: '15-03-2023' -> '2023-03-15' | quantity: '40' -> '40' | customer_id: 'CUST086032' -> 'CUST086032'
2026-01-12 12:10:24,470 - dq_comparison - INFO - DEBUG HASH STRING: text with`backticks|TX00086032|2023-03-15|40|CUST086032...
2026-01-12 12:10:24,471 - dq_comparison - INFO - DEBUG HASH RESULT: 064c46df...
2026-01-12 12:10:24,471 - dq_comparison - INFO - DEBUG HASH ROW: description: 'Text with  multiple   spaces' -> 'text with multiple spaces' | transaction_id: 'TX00087059' -> 'TX00087059' | transaction_date: '10-11-2023' -> '2023-11-10' | quantity: '96' -> '96' | customer_id: 'CUST087059' -> 'CUST087059'
2026-01-12 12:10:24,472 - dq_comparison - INFO - DEBUG HASH STRING: text with multiple spaces|TX00087059|2023-11-10|96|CUST087059...
2026-01-12 12:10:24,472 - dq_comparison - INFO - DEBUG HASH RESULT: 26522b64...
2026-01-12 12:10:24,473 - dq_comparison - INFO - DEBUG HASH ROW: description: 'Text with! exclamations' -> 'text with! exclamations' | transaction_id: 'TX00012836' -> 'TX00012836' | transaction_date: '05-09-2023' -> '2023-09-05' | quantity: '5' -> '5' | customer_id: 'CUST012836' -> 'CUST012836'
2026-01-12 12:10:24,474 - dq_comparison - INFO - DEBUG HASH STRING: text with! exclamations|TX00012836|2023-09-05|5|CUST012836...
2026-01-12 12:10:24,474 - dq_comparison - INFO - DEBUG HASH RESULT: 53a8795e...
2026-01-12 12:10:24,475 - dq_comparison - INFO - DEBUG HASH ROW: description: 'Text with{braces}' -> 'text with{braces}' | transaction_id: 'TX00065228' -> 'TX00065228' | transaction_date: '27-06-2023' -> '2023-06-27' | quantity: '22' -> '22' | customer_id: 'CUST065228' -> 'CUST065228'
2026-01-12 12:10:24,475 - dq_comparison - INFO - DEBUG HASH STRING: text with{braces}|TX00065228|2023-06-27|22|CUST065228...
2026-01-12 12:10:24,476 - dq_comparison - INFO - DEBUG HASH RESULT: 310c5d9c...
2026-01-12 12:10:24,477 - dq_comparison - INFO - DEBUG HASH ROW: description: 'Text with~tildes' -> 'text with~tildes' | transaction_id: 'TX00097732' -> 'TX00097732' | transaction_date: '26-03-2023' -> '2023-03-26' | quantity: '11' -> '11' | customer_id: 'CUST097732' -> 'CUST097732'
2026-01-12 12:10:24,477 - dq_comparison - INFO - DEBUG HASH STRING: text with~tildes|TX00097732|2023-03-26|11|CUST097732...
2026-01-12 12:10:24,478 - dq_comparison - INFO - DEBUG HASH RESULT: cdc8add3...
2026-01-12 12:10:24,479 - dq_comparison - INFO - DEBUG HASH ROW: description: 'Text with[brackets]' -> 'text with[brackets]' | transaction_id: 'TX00085965' -> 'TX00085965' | transaction_date: '10-12-2023' -> '2023-12-10' | quantity: '45' -> '45' | customer_id: 'CUST085965' -> 'CUST085965'
2026-01-12 12:10:24,479 - dq_comparison - INFO - DEBUG HASH STRING: text with[brackets]|TX00085965|2023-12-10|45|CUST085965...
2026-01-12 12:10:24,480 - dq_comparison - INFO - DEBUG HASH RESULT: 660f76d3...
2026-01-12 12:10:24,480 - dq_comparison - INFO - DEBUG HASH ROW: description: '  Text with leading spaces' -> 'text with leading spaces' | transaction_id: 'TX00034855' -> 'TX00034855' | transaction_date: '21-11-2023' -> '2023-11-21' | quantity: '53' -> '53' | customer_id: 'CUST034855' -> 'CUST034855'
2026-01-12 12:10:24,481 - dq_comparison - INFO - DEBUG HASH STRING: text with leading spaces|TX00034855|2023-11-21|53|CUST034855...
2026-01-12 12:10:24,481 - dq_comparison - INFO - DEBUG HASH RESULT: 41994881...
2026-01-12 12:10:24,482 - dq_comparison - INFO - DEBUG HASH ROW: description: 'Text with"quotes"' -> 'text with"quotes"' | transaction_id: 'TX00089216' -> 'TX00089216' | transaction_date: '21-08-2023' -> '2023-08-21' | quantity: '63' -> '63' | customer_id: 'CUST089216' -> 'CUST089216'
2026-01-12 12:10:24,483 - dq_comparison - INFO - DEBUG HASH STRING: text with"quotes"|TX00089216|2023-08-21|63|CUST089216...
2026-01-12 12:10:24,483 - dq_comparison - INFO - DEBUG HASH RESULT: b2a096aa...
2026-01-12 12:10:24,484 - dq_comparison - INFO - DEBUG HASH ROW: description: 'Text with? questions' -> 'text with? questions' | transaction_id: 'TX00074131' -> 'TX00074131' | transaction_date: '09/22/2023' -> '2023-09-22' | quantity: '15' -> '15' | customer_id: 'CUST074131' -> 'CUST074131'
2026-01-12 12:10:24,484 - dq_comparison - INFO - DEBUG HASH STRING: text with? questions|TX00074131|2023-09-22|15|CUST074131...
2026-01-12 12:10:24,486 - dq_comparison - INFO - DEBUG HASH RESULT: ec9061bf...
2026-01-12 12:10:24,487 - dq_comparison - INFO - DEBUG HASH ROW: description: 'Text with%percent signs' -> 'text with%percent signs' | transaction_id: 'TX00011845' -> 'TX00011845' | transaction_date: '01-06-2023' -> '2023-06-01' | quantity: '13' -> '13' | customer_id: 'CUST011845' -> 'CUST011845'
2026-01-12 12:10:24,487 - dq_comparison - INFO - DEBUG HASH STRING: text with%percent signs|TX00011845|2023-06-01|13|CUST011845...
2026-01-12 12:10:24,488 - dq_comparison - INFO - DEBUG HASH RESULT: 287f3ea3...
2026-01-12 12:10:24,489 - dq_comparison - INFO - DEBUG HASH ROW: description: 'Text with$dollar signs' -> 'text with$dollar signs' | transaction_id: 'TX00051955' -> 'TX00051955' | transaction_date: '26-07-2023' -> '2023-07-26' | quantity: '7' -> '7' | customer_id: 'CUST051955' -> 'CUST051955'
2026-01-12 12:10:24,489 - dq_comparison - INFO - DEBUG HASH STRING: text with$dollar signs|TX00051955|2023-07-26|7|CUST051955...
2026-01-12 12:10:24,490 - dq_comparison - INFO - DEBUG HASH RESULT: 05553278...
2026-01-12 12:10:24,491 - dq_comparison - INFO - DEBUG HASH ROW: description: 'Text with; semicolons' -> 'text with; semicolons' | transaction_id: 'TX00056211' -> 'TX00056211' | transaction_date: '12/20/2023' -> '2023-12-20' | quantity: '63' -> '63' | customer_id: 'CUST056211' -> 'CUST056211'
2026-01-12 12:10:24,491 - dq_comparison - INFO - DEBUG HASH STRING: text with; semicolons|TX00056211|2023-12-20|63|CUST056211...
2026-01-12 12:10:24,492 - dq_comparison - INFO - DEBUG HASH RESULT: 4cc340f9...
2026-01-12 12:10:24,492 - dq_comparison - INFO - DEBUG HASH ROW: description: 'Text with! exclamations' -> 'text with! exclamations' | transaction_id: 'TX00046116' -> 'TX00046116' | transaction_date: '02-02-2023' -> '2023-02-02' | quantity: '53' -> '53' | customer_id: 'CUST046116' -> 'CUST046116'
2026-01-12 12:10:24,492 - dq_comparison - INFO - DEBUG HASH STRING: text with! exclamations|TX00046116|2023-02-02|53|CUST046116...
2026-01-12 12:10:24,493 - dq_comparison - INFO - DEBUG HASH RESULT: b0d99694...
2026-01-12 12:10:24,494 - dq_comparison - INFO - DEBUG HASH ROW: description: 'Text with
newlines' -> 'text with newlines' | transaction_id: 'TX00092477' -> 'TX00092477' | transaction_date: '15-12-2023' -> '2023-12-15' | quantity: '27' -> '27' | customer_id: 'CUST092477' -> 'CUST092477'
2026-01-12 12:10:24,494 - dq_comparison - INFO - DEBUG HASH STRING: text with newlines|TX00092477|2023-12-15|27|CUST092477...
2026-01-12 12:10:24,495 - dq_comparison - INFO - DEBUG HASH RESULT: b6add351...
2026-01-12 12:10:24,496 - dq_comparison - INFO - DEBUG HASH ROW: description: 'Text with\backslashes' -> 'text with\backslashes' | transaction_id: 'TX00012865' -> 'TX00012865' | transaction_date: '27-11-2023' -> '2023-11-27' | quantity: '1' -> '1' | customer_id: 'CUST012865' -> 'CUST012865'
2026-01-12 12:10:24,496 - dq_comparison - INFO - DEBUG HASH STRING: text with\backslashes|TX00012865|2023-11-27|1|CUST012865...
2026-01-12 12:10:24,497 - dq_comparison - INFO - DEBUG HASH RESULT: b71f488a...
2026-01-12 12:10:24,498 - dq_comparison - INFO - DEBUG HASH ROW: description: 'Text with/slashes' -> 'text with/slashes' | transaction_id: 'TX00054819' -> 'TX00054819' | transaction_date: '16-01-2023' -> '2023-01-16' | quantity: '18' -> '18' | customer_id: 'CUST054819' -> 'CUST054819'
2026-01-12 12:10:24,498 - dq_comparison - INFO - DEBUG HASH STRING: text with/slashes|TX00054819|2023-01-16|18|CUST054819...
2026-01-12 12:10:24,500 - dq_comparison - INFO - DEBUG HASH RESULT: a7a5b99a...
2026-01-12 12:10:24,500 - dq_comparison - INFO - DEBUG HASH ROW: description: 'Text with\backslashes' -> 'text with\backslashes' | transaction_id: 'TX00097658' -> 'TX00097658' | transaction_date: '09-10-2023' -> '2023-10-09' | quantity: '25' -> '25' | customer_id: 'CUST097658' -> 'CUST097658'
2026-01-12 12:10:24,500 - dq_comparison - INFO - DEBUG HASH STRING: text with\backslashes|TX00097658|2023-10-09|25|CUST097658...
2026-01-12 12:10:24,501 - dq_comparison - INFO - DEBUG HASH RESULT: 12878147...
2026-01-12 12:10:24,502 - dq_comparison - INFO - DEBUG HASH ROW: description: 'Text with trailing spaces  ' -> 'text with trailing spaces' | transaction_id: 'TX00061218' -> 'TX00061218' | transaction_date: '01-11-2023' -> '2023-11-01' | quantity: '78' -> '78' | customer_id: 'CUST061218' -> 'CUST061218'
2026-01-12 12:10:24,502 - dq_comparison - INFO - DEBUG HASH STRING: text with trailing spaces|TX00061218|2023-11-01|78|CUST061218...
2026-01-12 12:10:24,503 - dq_comparison - INFO - DEBUG HASH RESULT: 7d8ce8ed...
2026-01-12 12:10:24,503 - dq_comparison - INFO - DEBUG HASH ROW: description: 'Text with& ampersands' -> 'text with& ampersands' | transaction_id: 'TX00035598' -> 'TX00035598' | transaction_date: '17-11-2023' -> '2023-11-17' | quantity: '53' -> '53' | customer_id: 'CUST035598' -> 'CUST035598'
2026-01-12 12:10:24,504 - dq_comparison - INFO - DEBUG HASH STRING: text with& ampersands|TX00035598|2023-11-17|53|CUST035598...
2026-01-12 12:10:24,505 - dq_comparison - INFO - DEBUG HASH RESULT: b3a491f1...
2026-01-12 12:10:24,505 - dq_comparison - INFO - DEBUG HASH ROW: description: 'Text with - dashes' -> 'text with - dashes' | transaction_id: 'TX00014719' -> 'TX00014719' | transaction_date: '28-07-2023' -> '2023-07-28' | quantity: '66' -> '66' | customer_id: 'CUST014719' -> 'CUST014719'
2026-01-12 12:10:24,506 - dq_comparison - INFO - DEBUG HASH STRING: text with - dashes|TX00014719|2023-07-28|66|CUST014719...
2026-01-12 12:10:24,506 - dq_comparison - INFO - DEBUG HASH RESULT: 7e0b1f99...
2026-01-12 12:10:24,507 - dq_comparison - INFO - DEBUG HASH ROW: description: 'Text with\backslashes' -> 'text with\backslashes' | transaction_id: 'TX00048721' -> 'TX00048721' | transaction_date: '07/15/2023' -> '2023-07-15' | quantity: '97' -> '97' | customer_id: 'CUST048721' -> 'CUST048721'
2026-01-12 12:10:24,508 - dq_comparison - INFO - DEBUG HASH STRING: text with\backslashes|TX00048721|2023-07-15|97|CUST048721...
2026-01-12 12:10:24,508 - dq_comparison - INFO - DEBUG HASH RESULT: 0bed3dae...
2026-01-12 12:10:24,509 - dq_comparison - INFO - DEBUG HASH ROW: description: 'Text with mixed CAPITAL and lowercase' -> 'text with mixed capital and lowercase' | transaction_id: 'TX00086927' -> 'TX00086927' | transaction_date: '11-07-2023' -> '2023-07-11' | quantity: '96' -> '96' | customer_id: 'CUST086927' -> 'CUST086927'
2026-01-12 12:10:24,510 - dq_comparison - INFO - DEBUG HASH STRING: text with mixed capital and lowercase|TX00086927|2023-07-11|96|CUST086927...
2026-01-12 12:10:24,510 - dq_comparison - INFO - DEBUG HASH RESULT: c88f00ce...
2026-01-12 12:10:24,511 - dq_comparison - INFO - DEBUG HASH ROW: description: 'Text with(parentheses)' -> 'text with(parentheses)' | transaction_id: 'TX00044221' -> 'TX00044221' | transaction_date: '12/18/2023' -> '2023-12-18' | quantity: '62' -> '62' | customer_id: 'CUST044221' -> 'CUST044221'
2026-01-12 12:10:24,511 - dq_comparison - INFO - DEBUG HASH STRING: text with(parentheses)|TX00044221|2023-12-18|62|CUST044221...
2026-01-12 12:10:24,512 - dq_comparison - INFO - DEBUG HASH RESULT: ff335fe2...
2026-01-12 12:10:24,513 - dq_comparison - INFO - DEBUG HASH ROW: description: 'Text with	tabs' -> 'text with tabs' | transaction_id: 'TX00038080' -> 'TX00038080' | transaction_date: '18-11-2023' -> '2023-11-18' | quantity: '2' -> '2' | customer_id: 'CUST038080' -> 'CUST038080'
2026-01-12 12:10:24,513 - dq_comparison - INFO - DEBUG HASH STRING: text with tabs|TX00038080|2023-11-18|2|CUST038080...
2026-01-12 12:10:24,514 - dq_comparison - INFO - DEBUG HASH RESULT: 1a2bf978...
2026-01-12 12:10:24,514 - dq_comparison - INFO - DEBUG HASH ROW: description: 'Text with|pipes' -> 'text with|pipes' | transaction_id: 'TX00015785' -> 'TX00015785' | transaction_date: '25-01-2023' -> '2023-01-25' | quantity: '54' -> '54' | customer_id: 'CUST015785' -> 'CUST015785'
2026-01-12 12:10:24,515 - dq_comparison - INFO - DEBUG HASH STRING: text with|pipes|TX00015785|2023-01-25|54|CUST015785...
2026-01-12 12:10:24,515 - dq_comparison - INFO - DEBUG HASH RESULT: 22b43fb6...
2026-01-12 12:10:24,517 - dq_comparison - INFO - DEBUG HASH ROW: description: 'Text with? questions' -> 'text with? questions' | transaction_id: 'TX00026521' -> 'TX00026521' | transaction_date: '05-02-2023' -> '2023-02-05' | quantity: '53' -> '53' | customer_id: 'CUST026521' -> 'CUST026521'
2026-01-12 12:10:24,517 - dq_comparison - INFO - DEBUG HASH STRING: text with? questions|TX00026521|2023-02-05|53|CUST026521...
2026-01-12 12:10:24,518 - dq_comparison - INFO - DEBUG HASH RESULT: b3ef9eed...
2026-01-12 12:10:24,518 - dq_comparison - INFO - DEBUG HASH ROW: description: 'Text with<angle brackets>' -> 'text with<angle brackets>' | transaction_id: 'TX00087517' -> 'TX00087517' | transaction_date: '03/17/2023' -> '2023-03-17' | quantity: '79' -> '79' | customer_id: 'CUST087517' -> 'CUST087517'
2026-01-12 12:10:24,519 - dq_comparison - INFO - DEBUG HASH STRING: text with<angle brackets>|TX00087517|2023-03-17|79|CUST087517...
2026-01-12 12:10:24,519 - dq_comparison - INFO - DEBUG HASH RESULT: e843df5e...
2026-01-12 12:10:24,520 - dq_comparison - INFO - DEBUG HASH ROW: description: 'Text with"quotes"' -> 'text with"quotes"' | transaction_id: 'TX00059955' -> 'TX00059955' | transaction_date: '23-02-2023' -> '2023-02-23' | quantity: '68' -> '68' | customer_id: 'CUST059955' -> 'CUST059955'
2026-01-12 12:10:24,521 - dq_comparison - INFO - DEBUG HASH STRING: text with"quotes"|TX00059955|2023-02-23|68|CUST059955...
2026-01-12 12:10:24,521 - dq_comparison - INFO - DEBUG HASH RESULT: fd70d2e6...
2026-01-12 12:10:24,522 - dq_comparison - INFO - DEBUG HASH ROW: description: 'Text with"quotes"' -> 'text with"quotes"' | transaction_id: 'TX00019674' -> 'TX00019674' | transaction_date: '27-01-2023' -> '2023-01-27' | quantity: '51' -> '51' | customer_id: 'CUST019674' -> 'CUST019674'
2026-01-12 12:10:24,523 - dq_comparison - INFO - DEBUG HASH STRING: text with"quotes"|TX00019674|2023-01-27|51|CUST019674...
2026-01-12 12:10:24,523 - dq_comparison - INFO - DEBUG HASH RESULT: c2b02973...
2026-01-12 12:10:24,523 - dq_comparison - INFO - DEBUG HASH ROW: description: 'Text with[brackets]' -> 'text with[brackets]' | transaction_id: 'TX00022344' -> 'TX00022344' | transaction_date: '25-06-2023' -> '2023-06-25' | quantity: '94' -> '94' | customer_id: 'CUST022344' -> 'CUST022344'
2026-01-12 12:10:24,523 - dq_comparison - INFO - DEBUG HASH STRING: text with[brackets]|TX00022344|2023-06-25|94|CUST022344...
2026-01-12 12:10:24,525 - dq_comparison - INFO - DEBUG HASH RESULT: 2bfb51d4...
2026-01-12 12:10:24,525 - dq_comparison - INFO - DEBUG HASH ROW: description: 'Text with, commas' -> 'text with, commas' | transaction_id: 'TX00080304' -> 'TX00080304' | transaction_date: '08-06-2023' -> '2023-06-08' | quantity: '66' -> '66' | customer_id: 'CUST080304' -> 'CUST080304'
2026-01-12 12:10:24,526 - dq_comparison - INFO - DEBUG HASH STRING: text with, commas|TX00080304|2023-06-08|66|CUST080304...
2026-01-12 12:10:24,526 - dq_comparison - INFO - DEBUG HASH RESULT: 73511932...
2026-01-12 12:10:24,526 - dq_comparison - INFO - DEBUG HASH ROW: description: 'Text with~tildes' -> 'text with~tildes' | transaction_id: 'TX00072036' -> 'TX00072036' | transaction_date: '04/15/2023' -> '2023-04-15' | quantity: '1' -> '1' | customer_id: 'CUST072036' -> 'CUST072036'
2026-01-12 12:10:24,528 - dq_comparison - INFO - DEBUG HASH STRING: text with~tildes|TX00072036|2023-04-15|1|CUST072036...
2026-01-12 12:10:24,528 - dq_comparison - INFO - DEBUG HASH RESULT: c6c98e7e...
2026-01-12 12:10:24,529 - dq_comparison - INFO - DEBUG HASH ROW: description: 'Text with~tildes' -> 'text with~tildes' | transaction_id: 'TX00049692' -> 'TX00049692' | transaction_date: '26-07-2023' -> '2023-07-26' | quantity: '11' -> '11' | customer_id: 'CUST049692' -> 'CUST049692'
2026-01-12 12:10:24,529 - dq_comparison - INFO - DEBUG HASH STRING: text with~tildes|TX00049692|2023-07-26|11|CUST049692...
2026-01-12 12:10:24,529 - dq_comparison - INFO - DEBUG HASH RESULT: 5c635937...
2026-01-12 12:10:24,530 - dq_comparison - INFO - DEBUG HASH ROW: description: 'Text with<angle brackets>' -> 'text with<angle brackets>' | transaction_id: 'TX00096442' -> 'TX00096442' | transaction_date: '01-12-2023' -> '2023-12-01' | quantity: '87' -> '87' | customer_id: 'CUST096442' -> 'CUST096442'
2026-01-12 12:10:24,531 - dq_comparison - INFO - DEBUG HASH STRING: text with<angle brackets>|TX00096442|2023-12-01|87|CUST096442...
2026-01-12 12:10:24,531 - dq_comparison - INFO - DEBUG HASH RESULT: 7f67dc60...
2026-01-12 12:10:24,533 - dq_comparison - INFO - DEBUG HASH ROW: description: 'Text with'apostrophes' -> 'text with'apostrophes' | transaction_id: 'TX00093010' -> 'TX00093010' | transaction_date: '24-12-2023' -> '2023-12-24' | quantity: '50' -> '50' | customer_id: 'CUST093010' -> 'CUST093010'
2026-01-12 12:10:24,533 - dq_comparison - INFO - DEBUG HASH STRING: text with'apostrophes|TX00093010|2023-12-24|50|CUST093010...
2026-01-12 12:10:24,534 - dq_comparison - INFO - DEBUG HASH RESULT: 187b385c...
2026-01-12 12:10:24,534 - dq_comparison - INFO - DEBUG HASH ROW: description: 'Text with%percent signs' -> 'text with%percent signs' | transaction_id: 'TX00008753' -> 'TX00008753' | transaction_date: '23-05-2023' -> '2023-05-23' | quantity: '100' -> '100' | customer_id: 'CUST008753' -> 'CUST008753'
2026-01-12 12:10:24,535 - dq_comparison - INFO - DEBUG HASH STRING: text with%percent signs|TX00008753|2023-05-23|100|CUST008753...
2026-01-12 12:10:24,536 - dq_comparison - INFO - DEBUG HASH RESULT: 1b5a3022...
2026-01-12 12:10:24,536 - dq_comparison - INFO - DEBUG HASH ROW: description: 'Text with[brackets]' -> 'text with[brackets]' | transaction_id: 'TX00048952' -> 'TX00048952' | transaction_date: '20-03-2023' -> '2023-03-20' | quantity: '59' -> '59' | customer_id: 'CUST048952' -> 'CUST048952'
2026-01-12 12:10:24,537 - dq_comparison - INFO - DEBUG HASH STRING: text with[brackets]|TX00048952|2023-03-20|59|CUST048952...
2026-01-12 12:10:24,538 - dq_comparison - INFO - DEBUG HASH RESULT: 42f15885...
2026-01-12 12:10:24,538 - dq_comparison - INFO - DEBUG HASH ROW: description: 'Text with mixed CAPITAL and lowercase' -> 'text with mixed capital and lowercase' | transaction_id: 'TX00030658' -> 'TX00030658' | transaction_date: '10-03-2023' -> '2023-03-10' | quantity: '9' -> '9' | customer_id: 'CUST030658' -> 'CUST030658'
2026-01-12 12:10:24,539 - dq_comparison - INFO - DEBUG HASH STRING: text with mixed capital and lowercase|TX00030658|2023-03-10|9|CUST030658...
2026-01-12 12:10:24,539 - dq_comparison - INFO - DEBUG HASH RESULT: 2a6c9745...
2026-01-12 12:10:24,540 - dq_comparison - INFO - DEBUG HASH ROW: description: 'Text with`backticks' -> 'text with`backticks' | transaction_id: 'TX00067983' -> 'TX00067983' | transaction_date: '25-05-2023' -> '2023-05-25' | quantity: '77' -> '77' | customer_id: 'CUST067983' -> 'CUST067983'
2026-01-12 12:10:24,541 - dq_comparison - INFO - DEBUG HASH STRING: text with`backticks|TX00067983|2023-05-25|77|CUST067983...
2026-01-12 12:10:24,541 - dq_comparison - INFO - DEBUG HASH RESULT: 000ee3f9...
2026-01-12 12:10:24,542 - dq_comparison - INFO - DEBUG HASH ROW: description: 'Text with{braces}' -> 'text with{braces}' | transaction_id: 'TX00055417' -> 'TX00055417' | transaction_date: '01-05-2023' -> '2023-05-01' | quantity: '28' -> '28' | customer_id: 'CUST055417' -> 'CUST055417'
2026-01-12 12:10:24,542 - dq_comparison - INFO - DEBUG HASH STRING: text with{braces}|TX00055417|2023-05-01|28|CUST055417...
2026-01-12 12:10:24,543 - dq_comparison - INFO - DEBUG HASH RESULT: 3af2c02b...
2026-01-12 12:10:24,544 - dq_comparison - INFO - DEBUG HASH ROW: description: 'Text with; semicolons' -> 'text with; semicolons' | transaction_id: 'TX00084570' -> 'TX00084570' | transaction_date: '19-04-2023' -> '2023-04-19' | quantity: '71' -> '71' | customer_id: 'CUST084570' -> 'CUST084570'
2026-01-12 12:10:24,544 - dq_comparison - INFO - DEBUG HASH STRING: text with; semicolons|TX00084570|2023-04-19|71|CUST084570...
2026-01-12 12:10:24,545 - dq_comparison - INFO - DEBUG HASH RESULT: 54a7753b...
2026-01-12 12:10:24,546 - dq_comparison - INFO - DEBUG HASH ROW: description: 'Text with; semicolons' -> 'text with; semicolons' | transaction_id: 'TX00096078' -> 'TX00096078' | transaction_date: '11-07-2023' -> '2023-07-11' | quantity: '3' -> '3' | customer_id: 'CUST096078' -> 'CUST096078'
2026-01-12 12:10:24,546 - dq_comparison - INFO - DEBUG HASH STRING: text with; semicolons|TX00096078|2023-07-11|3|CUST096078...
2026-01-12 12:10:24,546 - dq_comparison - INFO - DEBUG HASH RESULT: c7153f82...
2026-01-12 12:10:24,547 - dq_comparison - INFO - DEBUG HASH ROW: description: 'Text with#hashtags' -> 'text with#hashtags' | transaction_id: 'TX00078887' -> 'TX00078887' | transaction_date: '18-06-2023' -> '2023-06-18' | quantity: '28' -> '28' | customer_id: 'CUST078887' -> 'CUST078887'
2026-01-12 12:10:24,547 - dq_comparison - INFO - DEBUG HASH STRING: text with#hashtags|TX00078887|2023-06-18|28|CUST078887...
2026-01-12 12:10:24,548 - dq_comparison - INFO - DEBUG HASH RESULT: 62785511...
2026-01-12 12:10:24,549 - dq_comparison - INFO - DEBUG HASH ROW: description: 'Text with, commas' -> 'text with, commas' | transaction_id: 'TX00095814' -> 'TX00095814' | transaction_date: '18-02-2023' -> '2023-02-18' | quantity: '32' -> '32' | customer_id: 'CUST095814' -> 'CUST095814'
2026-01-12 12:10:24,549 - dq_comparison - INFO - DEBUG HASH STRING: text with, commas|TX00095814|2023-02-18|32|CUST095814...
2026-01-12 12:10:24,550 - dq_comparison - INFO - DEBUG HASH RESULT: 19710e97...
2026-01-12 12:10:24,550 - dq_comparison - INFO - DEBUG HASH ROW: description: 'Text with~tildes' -> 'text with~tildes' | transaction_id: 'TX00033557' -> 'TX00033557' | transaction_date: '17-03-2023' -> '2023-03-17' | quantity: '95' -> '95' | customer_id: 'CUST033557' -> 'CUST033557'
2026-01-12 12:10:24,551 - dq_comparison - INFO - DEBUG HASH STRING: text with~tildes|TX00033557|2023-03-17|95|CUST033557...
2026-01-12 12:10:24,551 - dq_comparison - INFO - DEBUG HASH RESULT: 418cd453...
2026-01-12 12:10:24,552 - dq_comparison - INFO - DEBUG HASH ROW: description: 'Text with& ampersands' -> 'text with& ampersands' | transaction_id: 'TX00070497' -> 'TX00070497' | transaction_date: '19-02-2023' -> '2023-02-19' | quantity: '89' -> '89' | customer_id: 'CUST070497' -> 'CUST070497'
2026-01-12 12:10:24,553 - dq_comparison - INFO - DEBUG HASH STRING: text with& ampersands|TX00070497|2023-02-19|89|CUST070497...
2026-01-12 12:10:24,553 - dq_comparison - INFO - DEBUG HASH RESULT: f4c6e627...
2026-01-12 12:10:24,554 - dq_comparison - INFO - DEBUG HASH ROW: description: '  Text with leading spaces' -> 'text with leading spaces' | transaction_id: 'TX00028358' -> 'TX00028358' | transaction_date: '17-10-2023' -> '2023-10-17' | quantity: '97' -> '97' | customer_id: 'CUST028358' -> 'CUST028358'
2026-01-12 12:10:24,555 - dq_comparison - INFO - DEBUG HASH STRING: text with leading spaces|TX00028358|2023-10-17|97|CUST028358...
2026-01-12 12:10:24,555 - dq_comparison - INFO - DEBUG HASH RESULT: b14b7583...
2026-01-12 12:10:24,556 - dq_comparison - INFO - DEBUG HASH ROW: description: 'Text with|pipes' -> 'text with|pipes' | transaction_id: 'TX00011124' -> 'TX00011124' | transaction_date: '21-08-2023' -> '2023-08-21' | quantity: '18' -> '18' | customer_id: 'CUST011124' -> 'CUST011124'
2026-01-12 12:10:24,556 - dq_comparison - INFO - DEBUG HASH STRING: text with|pipes|TX00011124|2023-08-21|18|CUST011124...
2026-01-12 12:10:24,557 - dq_comparison - INFO - DEBUG HASH RESULT: f7bebeb5...
2026-01-12 12:10:24,557 - dq_comparison - INFO - DEBUG HASH ROW: description: 'Text with"quotes"' -> 'text with"quotes"' | transaction_id: 'TX00083134' -> 'TX00083134' | transaction_date: '09-07-2023' -> '2023-07-09' | quantity: '9' -> '9' | customer_id: 'CUST083134' -> 'CUST083134'
2026-01-12 12:10:24,558 - dq_comparison - INFO - DEBUG HASH STRING: text with"quotes"|TX00083134|2023-07-09|9|CUST083134...
2026-01-12 12:10:24,559 - dq_comparison - INFO - DEBUG HASH RESULT: 360c7a99...
2026-01-12 12:10:24,559 - dq_comparison - INFO - DEBUG HASH ROW: description: 'Text with\backslashes' -> 'text with\backslashes' | transaction_id: 'TX00019930' -> 'TX00019930' | transaction_date: '08-06-2023' -> '2023-06-08' | quantity: '95' -> '95' | customer_id: 'CUST019930' -> 'CUST019930'
2026-01-12 12:10:24,560 - dq_comparison - INFO - DEBUG HASH STRING: text with\backslashes|TX00019930|2023-06-08|95|CUST019930...
2026-01-12 12:10:24,560 - dq_comparison - INFO - DEBUG HASH RESULT: 579669d8...
2026-01-12 12:10:24,562 - dq_comparison - INFO - DEBUG HASH ROW: description: 'Text with mixed CAPITAL and lowercase' -> 'text with mixed capital and lowercase' | transaction_id: 'TX00055263' -> 'TX00055263' | transaction_date: '01-10-2023' -> '2023-10-01' | quantity: '97' -> '97' | customer_id: 'CUST055263' -> 'CUST055263'
2026-01-12 12:10:24,562 - dq_comparison - INFO - DEBUG HASH STRING: text with mixed capital and lowercase|TX00055263|2023-10-01|97|CUST055263...
2026-01-12 12:10:24,563 - dq_comparison - INFO - DEBUG HASH RESULT: a80709fa...
2026-01-12 12:10:24,563 - dq_comparison - INFO - DEBUG HASH ROW: description: 'Text with"quotes"' -> 'text with"quotes"' | transaction_id: 'TX00007161' -> 'TX00007161' | transaction_date: '09/24/2023' -> '2023-09-24' | quantity: '48' -> '48' | customer_id: 'CUST007161' -> 'CUST007161'
2026-01-12 12:10:24,564 - dq_comparison - INFO - DEBUG HASH STRING: text with"quotes"|TX00007161|2023-09-24|48|CUST007161...
2026-01-12 12:10:24,564 - dq_comparison - INFO - DEBUG HASH RESULT: 2fa7891d...
2026-01-12 12:10:24,565 - dq_comparison - INFO - DEBUG HASH ROW: description: 'Text with  multiple   spaces' -> 'text with multiple spaces' | transaction_id: 'TX00047952' -> 'TX00047952' | transaction_date: '16-07-2023' -> '2023-07-16' | quantity: '10' -> '10' | customer_id: 'CUST047952' -> 'CUST047952'
2026-01-12 12:10:24,566 - dq_comparison - INFO - DEBUG HASH STRING: text with multiple spaces|TX00047952|2023-07-16|10|CUST047952...
2026-01-12 12:10:24,566 - dq_comparison - INFO - DEBUG HASH RESULT: 9966bce5...
2026-01-12 12:10:24,567 - dq_comparison - INFO - DEBUG HASH ROW: description: 'Text with_underscores' -> 'text with_underscores' | transaction_id: 'TX00046000' -> 'TX00046000' | transaction_date: '08-10-2023' -> '2023-10-08' | quantity: '18' -> '18' | customer_id: 'CUST046000' -> 'CUST046000'
2026-01-12 12:10:24,567 - dq_comparison - INFO - DEBUG HASH STRING: text with_underscores|TX00046000|2023-10-08|18|CUST046000...
2026-01-12 12:10:24,568 - dq_comparison - INFO - DEBUG HASH RESULT: afd35197...
2026-01-12 12:10:24,569 - dq_comparison - INFO - DEBUG HASH ROW: description: 'Text with*asterisks' -> 'text with*asterisks' | transaction_id: 'TX00044401' -> 'TX00044401' | transaction_date: '09-02-2023' -> '2023-02-09' | quantity: '44' -> '44' | customer_id: 'CUST044401' -> 'CUST044401'
2026-01-12 12:10:24,569 - dq_comparison - INFO - DEBUG HASH STRING: text with*asterisks|TX00044401|2023-02-09|44|CUST044401...
2026-01-12 12:10:24,570 - dq_comparison - INFO - DEBUG HASH RESULT: d495fc06...
2026-01-12 12:10:24,570 - dq_comparison - INFO - DEBUG HASH ROW: description: 'Text with@at signs' -> 'text with@at signs' | transaction_id: 'TX00018884' -> 'TX00018884' | transaction_date: '20-10-2023' -> '2023-10-20' | quantity: '21' -> '21' | customer_id: 'CUST018884' -> 'CUST018884'
2026-01-12 12:10:24,571 - dq_comparison - INFO - DEBUG HASH STRING: text with@at signs|TX00018884|2023-10-20|21|CUST018884...
2026-01-12 12:10:24,571 - dq_comparison - INFO - DEBUG HASH RESULT: e5ee5f61...
2026-01-12 12:10:24,572 - dq_comparison - INFO - DEBUG HASH ROW: description: 'Text with[brackets]' -> 'text with[brackets]' | transaction_id: 'TX00036181' -> 'TX00036181' | transaction_date: '02-09-2023' -> '2023-09-02' | quantity: '36' -> '36' | customer_id: 'CUST036181' -> 'CUST036181'
2026-01-12 12:10:24,573 - dq_comparison - INFO - DEBUG HASH STRING: text with[brackets]|TX00036181|2023-09-02|36|CUST036181...
2026-01-12 12:10:24,573 - dq_comparison - INFO - DEBUG HASH RESULT: c94614f8...
2026-01-12 12:10:24,574 - dq_comparison - INFO - DEBUG HASH ROW: description: 'Text with(parentheses)' -> 'text with(parentheses)' | transaction_id: 'TX00073635' -> 'TX00073635' | transaction_date: '13-11-2023' -> '2023-11-13' | quantity: '87' -> '87' | customer_id: 'CUST073635' -> 'CUST073635'
2026-01-12 12:10:24,574 - dq_comparison - INFO - DEBUG HASH STRING: text with(parentheses)|TX00073635|2023-11-13|87|CUST073635...
2026-01-12 12:10:24,575 - dq_comparison - INFO - DEBUG HASH RESULT: 67ca3d12...
2026-01-12 12:10:24,576 - dq_comparison - INFO - DEBUG HASH ROW: description: 'Text with#hashtags' -> 'text with#hashtags' | transaction_id: 'TX00010109' -> 'TX00010109' | transaction_date: '23-09-2023' -> '2023-09-23' | quantity: '36' -> '36' | customer_id: 'CUST010109' -> 'CUST010109'
2026-01-12 12:10:24,576 - dq_comparison - INFO - DEBUG HASH STRING: text with#hashtags|TX00010109|2023-09-23|36|CUST010109...
2026-01-12 12:10:24,577 - dq_comparison - INFO - DEBUG HASH RESULT: d89ff0da...
2026-01-12 12:10:24,577 - dq_comparison - INFO - DEBUG HASH ROW: description: 'Text with trailing spaces  ' -> 'text with trailing spaces' | transaction_id: 'TX00015637' -> 'TX00015637' | transaction_date: '08-06-2023' -> '2023-06-08' | quantity: '43' -> '43' | customer_id: 'CUST015637' -> 'CUST015637'
2026-01-12 12:10:24,578 - dq_comparison - INFO - DEBUG HASH STRING: text with trailing spaces|TX00015637|2023-06-08|43|CUST015637...
2026-01-12 12:10:24,579 - dq_comparison - INFO - DEBUG HASH RESULT: dcf44e91...
2026-01-12 12:10:24,579 - dq_comparison - INFO - DEBUG HASH ROW: description: '  Text with leading spaces' -> 'text with leading spaces' | transaction_id: 'TX00032744' -> 'TX00032744' | transaction_date: '27-03-2023' -> '2023-03-27' | quantity: '68' -> '68' | customer_id: 'CUST032744' -> 'CUST032744'
2026-01-12 12:10:24,580 - dq_comparison - INFO - DEBUG HASH STRING: text with leading spaces|TX00032744|2023-03-27|68|CUST032744...
2026-01-12 12:10:24,580 - dq_comparison - INFO - DEBUG HASH RESULT: 919a312a...
2026-01-12 12:10:24,581 - dq_comparison - INFO - DEBUG HASH ROW: description: 'Text with<angle brackets>' -> 'text with<angle brackets>' | transaction_id: 'TX00078143' -> 'TX00078143' | transaction_date: '22-11-2023' -> '2023-11-22' | quantity: '32' -> '32' | customer_id: 'CUST078143' -> 'CUST078143'
2026-01-12 12:10:24,581 - dq_comparison - INFO - DEBUG HASH STRING: text with<angle brackets>|TX00078143|2023-11-22|32|CUST078143...
2026-01-12 12:10:24,582 - dq_comparison - INFO - DEBUG HASH RESULT: 990d0882...
2026-01-12 12:10:24,583 - dq_comparison - INFO - DEBUG HASH ROW: description: 'Text with\backslashes' -> 'text with\backslashes' | transaction_id: 'TX00048233' -> 'TX00048233' | transaction_date: '24-03-2023' -> '2023-03-24' | quantity: '75' -> '75' | customer_id: 'CUST048233' -> 'CUST048233'
2026-01-12 12:10:24,583 - dq_comparison - INFO - DEBUG HASH STRING: text with\backslashes|TX00048233|2023-03-24|75|CUST048233...
2026-01-12 12:10:24,584 - dq_comparison - INFO - DEBUG HASH RESULT: 09f76d2f...
2026-01-12 12:10:24,585 - dq_comparison - INFO - DEBUG HASH ROW: description: 'Text with! exclamations' -> 'text with! exclamations' | transaction_id: 'TX00072664' -> 'TX00072664' | transaction_date: '28-07-2023' -> '2023-07-28' | quantity: '68' -> '68' | customer_id: 'CUST072664' -> 'CUST072664'
2026-01-12 12:10:24,585 - dq_comparison - INFO - DEBUG HASH STRING: text with! exclamations|TX00072664|2023-07-28|68|CUST072664...
2026-01-12 12:10:24,585 - dq_comparison - INFO - DEBUG HASH RESULT: 523205f5...
2026-01-12 12:10:24,586 - dq_comparison - INFO - DEBUG HASH ROW: description: 'Text with\backslashes' -> 'text with\backslashes' | transaction_id: 'TX00039138' -> 'TX00039138' | transaction_date: '01-04-2023' -> '2023-04-01' | quantity: '73' -> '73' | customer_id: 'CUST039138' -> 'CUST039138'
2026-01-12 12:10:24,587 - dq_comparison - INFO - DEBUG HASH STRING: text with\backslashes|TX00039138|2023-04-01|73|CUST039138...
2026-01-12 12:10:24,587 - dq_comparison - INFO - DEBUG HASH RESULT: dfde60ce...
2026-01-12 12:10:24,588 - dq_comparison - INFO - DEBUG HASH ROW: description: 'Text with; semicolons' -> 'text with; semicolons' | transaction_id: 'TX00017423' -> 'TX00017423' | transaction_date: '27-11-2023' -> '2023-11-27' | quantity: '72' -> '72' | customer_id: 'CUST017423' -> 'CUST017423'
2026-01-12 12:10:24,588 - dq_comparison - INFO - DEBUG HASH STRING: text with; semicolons|TX00017423|2023-11-27|72|CUST017423...
2026-01-12 12:10:24,589 - dq_comparison - INFO - DEBUG HASH RESULT: 2ede6dc2...
2026-01-12 12:10:24,589 - dq_comparison - INFO - DEBUG HASH ROW: description: 'Text with{braces}' -> 'text with{braces}' | transaction_id: 'TX00024316' -> 'TX00024316' | transaction_date: '10/25/2023' -> '2023-10-25' | quantity: '63' -> '63' | customer_id: 'CUST024316' -> 'CUST024316'
2026-01-12 12:10:24,590 - dq_comparison - INFO - DEBUG HASH STRING: text with{braces}|TX00024316|2023-10-25|63|CUST024316...
2026-01-12 12:10:24,590 - dq_comparison - INFO - DEBUG HASH RESULT: 931cb156...
2026-01-12 12:10:24,591 - dq_comparison - INFO - DEBUG HASH ROW: description: 'Text with@at signs' -> 'text with@at signs' | transaction_id: 'TX00067272' -> 'TX00067272' | transaction_date: '14-12-2023' -> '2023-12-14' | quantity: '18' -> '18' | customer_id: 'CUST067272' -> 'CUST067272'
2026-01-12 12:10:24,592 - dq_comparison - INFO - DEBUG HASH STRING: text with@at signs|TX00067272|2023-12-14|18|CUST067272...
2026-01-12 12:10:24,592 - dq_comparison - INFO - DEBUG HASH RESULT: 408c6a78...
2026-01-12 12:10:24,593 - dq_comparison - INFO - DEBUG HASH ROW: description: 'Text with*asterisks' -> 'text with*asterisks' | transaction_id: 'TX00085164' -> 'TX00085164' | transaction_date: '24-08-2023' -> '2023-08-24' | quantity: '20' -> '20' | customer_id: 'CUST085164' -> 'CUST085164'
2026-01-12 12:10:24,594 - dq_comparison - INFO - DEBUG HASH STRING: text with*asterisks|TX00085164|2023-08-24|20|CUST085164...
2026-01-12 12:10:24,594 - dq_comparison - INFO - DEBUG HASH RESULT: 3532fb5b...
2026-01-12 12:10:24,595 - dq_comparison - INFO - DEBUG HASH ROW: description: 'Text with - dashes' -> 'text with - dashes' | transaction_id: 'TX00050303' -> 'TX00050303' | transaction_date: '20-07-2023' -> '2023-07-20' | quantity: '49' -> '49' | customer_id: 'CUST050303' -> 'CUST050303'
2026-01-12 12:10:24,595 - dq_comparison - INFO - DEBUG HASH STRING: text with - dashes|TX00050303|2023-07-20|49|CUST050303...
2026-01-12 12:10:24,596 - dq_comparison - INFO - DEBUG HASH RESULT: 37f896e8...
2026-01-12 12:10:24,596 - dq_comparison - INFO - DEBUG HASH ROW: description: 'Text with; semicolons' -> 'text with; semicolons' | transaction_id: 'TX00080489' -> 'TX00080489' | transaction_date: '12-12-2023' -> '2023-12-12' | quantity: '87' -> '87' | customer_id: 'CUST080489' -> 'CUST080489'
2026-01-12 12:10:24,597 - dq_comparison - INFO - DEBUG HASH STRING: text with; semicolons|TX00080489|2023-12-12|87|CUST080489...
2026-01-12 12:10:24,598 - dq_comparison - INFO - DEBUG HASH RESULT: 851d0917...
2026-01-12 12:10:24,598 - dq_comparison - INFO - DEBUG HASH ROW: description: 'Text with  multiple   spaces' -> 'text with multiple spaces' | transaction_id: 'TX00072926' -> 'TX00072926' | transaction_date: '02-05-2023' -> '2023-05-02' | quantity: '66' -> '66' | customer_id: 'CUST072926' -> 'CUST072926'
2026-01-12 12:10:24,599 - dq_comparison - INFO - DEBUG HASH STRING: text with multiple spaces|TX00072926|2023-05-02|66|CUST072926...
2026-01-12 12:10:24,599 - dq_comparison - INFO - DEBUG HASH RESULT: a076e018...
2026-01-12 12:10:24,600 - dq_comparison - INFO - DEBUG HASH ROW: description: 'Text with*asterisks' -> 'text with*asterisks' | transaction_id: 'TX00058074' -> 'TX00058074' | transaction_date: '10-03-2023' -> '2023-03-10' | quantity: '92' -> '92' | customer_id: 'CUST058074' -> 'CUST058074'
2026-01-12 12:10:24,601 - dq_comparison - INFO - DEBUG HASH STRING: text with*asterisks|TX00058074|2023-03-10|92|CUST058074...
2026-01-12 12:10:24,601 - dq_comparison - INFO - DEBUG HASH RESULT: daf3a721...
2026-01-12 12:10:24,602 - dq_comparison - INFO - DEBUG HASH ROW: description: 'Text with/slashes' -> 'text with/slashes' | transaction_id: 'TX00056832' -> 'TX00056832' | transaction_date: '04-09-2023' -> '2023-09-04' | quantity: '35' -> '35' | customer_id: 'CUST056832' -> 'CUST056832'
2026-01-12 12:10:24,602 - dq_comparison - INFO - DEBUG HASH STRING: text with/slashes|TX00056832|2023-09-04|35|CUST056832...
2026-01-12 12:10:24,603 - dq_comparison - INFO - DEBUG HASH RESULT: 1815dc50...
2026-01-12 12:10:24,604 - dq_comparison - INFO - DEBUG HASH ROW: description: 'Text with. periods' -> 'text with. periods' | transaction_id: 'TX00094939' -> 'TX00094939' | transaction_date: '16-10-2023' -> '2023-10-16' | quantity: '52' -> '52' | customer_id: 'CUST094939' -> 'CUST094939'
2026-01-12 12:10:24,604 - dq_comparison - INFO - DEBUG HASH STRING: text with. periods|TX00094939|2023-10-16|52|CUST094939...
2026-01-12 12:10:24,604 - dq_comparison - INFO - DEBUG HASH RESULT: 58de31f4...
2026-01-12 12:10:24,605 - dq_comparison - INFO - DEBUG HASH ROW: description: 'Text with  multiple   spaces' -> 'text with multiple spaces' | transaction_id: 'TX00012198' -> 'TX00012198' | transaction_date: '20-12-2023' -> '2023-12-20' | quantity: '49' -> '49' | customer_id: 'CUST012198' -> 'CUST012198'
2026-01-12 12:10:24,606 - dq_comparison - INFO - DEBUG HASH STRING: text with multiple spaces|TX00012198|2023-12-20|49|CUST012198...
2026-01-12 12:10:24,606 - dq_comparison - INFO - DEBUG HASH RESULT: f8d338f9...
2026-01-12 12:10:24,607 - dq_comparison - INFO - DEBUG HASH ROW: description: 'Text with@at signs' -> 'text with@at signs' | transaction_id: 'TX00008735' -> 'TX00008735' | transaction_date: '10-02-2023' -> '2023-02-10' | quantity: '93' -> '93' | customer_id: 'CUST008735' -> 'CUST008735'
2026-01-12 12:10:24,608 - dq_comparison - INFO - DEBUG HASH STRING: text with@at signs|TX00008735|2023-02-10|93|CUST008735...
2026-01-12 12:10:24,608 - dq_comparison - INFO - DEBUG HASH RESULT: be6a0605...
2026-01-12 12:10:24,609 - dq_comparison - INFO - DEBUG HASH ROW: description: 'Text with? questions' -> 'text with? questions' | transaction_id: 'TX00048839' -> 'TX00048839' | transaction_date: '03-02-2023' -> '2023-02-03' | quantity: '11' -> '11' | customer_id: 'CUST048839' -> 'CUST048839'
2026-01-12 12:10:24,609 - dq_comparison - INFO - DEBUG HASH STRING: text with? questions|TX00048839|2023-02-03|11|CUST048839...
2026-01-12 12:10:24,610 - dq_comparison - INFO - DEBUG HASH RESULT: 91185e17...
2026-01-12 12:10:24,611 - dq_comparison - INFO - DEBUG HASH ROW: description: 'Text with_underscores' -> 'text with_underscores' | transaction_id: 'TX00047970' -> 'TX00047970' | transaction_date: '20-02-2023' -> '2023-02-20' | quantity: '11' -> '11' | customer_id: 'CUST047970' -> 'CUST047970'
2026-01-12 12:10:24,611 - dq_comparison - INFO - DEBUG HASH STRING: text with_underscores|TX00047970|2023-02-20|11|CUST047970...
2026-01-12 12:10:24,612 - dq_comparison - INFO - DEBUG HASH RESULT: aece9aee...
2026-01-12 12:10:24,612 - dq_comparison - INFO - DEBUG HASH ROW: description: 'Text with! exclamations' -> 'text with! exclamations' | transaction_id: 'TX00054314' -> 'TX00054314' | transaction_date: '20-02-2023' -> '2023-02-20' | quantity: '70' -> '70' | customer_id: 'CUST054314' -> 'CUST054314'
2026-01-12 12:10:24,613 - dq_comparison - INFO - DEBUG HASH STRING: text with! exclamations|TX00054314|2023-02-20|70|CUST054314...
2026-01-12 12:10:24,613 - dq_comparison - INFO - DEBUG HASH RESULT: 4fd4683c...
2026-01-12 12:10:24,614 - dq_comparison - INFO - DEBUG HASH ROW: description: 'Text with_underscores' -> 'text with_underscores' | transaction_id: 'TX00013369' -> 'TX00013369' | transaction_date: '12-04-2023' -> '2023-04-12' | quantity: '86' -> '86' | customer_id: 'CUST013369' -> 'CUST013369'
2026-01-12 12:10:24,615 - dq_comparison - INFO - DEBUG HASH STRING: text with_underscores|TX00013369|2023-04-12|86|CUST013369...
2026-01-12 12:10:24,615 - dq_comparison - INFO - DEBUG HASH RESULT: 5722e24f...
2026-01-12 12:10:24,616 - dq_comparison - INFO - DEBUG HASH ROW: description: 'Text with"quotes"' -> 'text with"quotes"' | transaction_id: 'TX00026721' -> 'TX00026721' | transaction_date: '12-07-2023' -> '2023-07-12' | quantity: '12' -> '12' | customer_id: 'CUST026721' -> 'CUST026721'
2026-01-12 12:10:24,617 - dq_comparison - INFO - DEBUG HASH STRING: text with"quotes"|TX00026721|2023-07-12|12|CUST026721...
2026-01-12 12:10:24,617 - dq_comparison - INFO - DEBUG HASH RESULT: bbfabe6c...
2026-01-12 12:10:24,618 - dq_comparison - INFO - DEBUG HASH ROW: description: 'Text with  multiple   spaces' -> 'text with multiple spaces' | transaction_id: 'TX00069771' -> 'TX00069771' | transaction_date: '02/22/2023' -> '2023-02-22' | quantity: '70' -> '70' | customer_id: 'CUST069771' -> 'CUST069771'
2026-01-12 12:10:24,618 - dq_comparison - INFO - DEBUG HASH STRING: text with multiple spaces|TX00069771|2023-02-22|70|CUST069771...
2026-01-12 12:10:24,619 - dq_comparison - INFO - DEBUG HASH RESULT: 0bbc78d0...
2026-01-12 12:10:24,620 - dq_comparison - INFO - DEBUG HASH ROW: description: 'Text with#hashtags' -> 'text with#hashtags' | transaction_id: 'TX00095722' -> 'TX00095722' | transaction_date: '12-03-2023' -> '2023-03-12' | quantity: '36' -> '36' | customer_id: 'CUST095722' -> 'CUST095722'
2026-01-12 12:10:24,620 - dq_comparison - INFO - DEBUG HASH STRING: text with#hashtags|TX00095722|2023-03-12|36|CUST095722...
2026-01-12 12:10:24,621 - dq_comparison - INFO - DEBUG HASH RESULT: 8ac3d2bb...
2026-01-12 12:10:24,621 - dq_comparison - INFO - DEBUG HASH ROW: description: 'Text with@at signs' -> 'text with@at signs' | transaction_id: 'TX00074085' -> 'TX00074085' | transaction_date: '31-01-2023' -> '2023-01-31' | quantity: '51' -> '51' | customer_id: 'CUST074085' -> 'CUST074085'
2026-01-12 12:10:24,622 - dq_comparison - INFO - DEBUG HASH STRING: text with@at signs|TX00074085|2023-01-31|51|CUST074085...
2026-01-12 12:10:24,622 - dq_comparison - INFO - DEBUG HASH RESULT: 20f60480...
2026-01-12 12:10:24,623 - dq_comparison - INFO - DEBUG HASH ROW: description: 'Text with#hashtags' -> 'text with#hashtags' | transaction_id: 'TX00003292' -> 'TX00003292' | transaction_date: '13-06-2023' -> '2023-06-13' | quantity: '58' -> '58' | customer_id: 'CUST003292' -> 'CUST003292'
2026-01-12 12:10:24,624 - dq_comparison - INFO - DEBUG HASH STRING: text with#hashtags|TX00003292|2023-06-13|58|CUST003292...
2026-01-12 12:10:24,624 - dq_comparison - INFO - DEBUG HASH RESULT: 5f99b9ac...
2026-01-12 12:10:24,625 - dq_comparison - INFO - DEBUG HASH ROW: description: 'Text with{braces}' -> 'text with{braces}' | transaction_id: 'TX00017339' -> 'TX00017339' | transaction_date: '23-08-2023' -> '2023-08-23' | quantity: '3' -> '3' | customer_id: 'CUST017339' -> 'CUST017339'
2026-01-12 12:10:24,626 - dq_comparison - INFO - DEBUG HASH STRING: text with{braces}|TX00017339|2023-08-23|3|CUST017339...
2026-01-12 12:10:24,627 - dq_comparison - INFO - DEBUG HASH RESULT: 407414b9...
2026-01-12 12:10:24,628 - dq_comparison - INFO - DEBUG HASH ROW: description: 'Text with. periods' -> 'text with. periods' | transaction_id: 'TX00018080' -> 'TX00018080' | transaction_date: '24-11-2023' -> '2023-11-24' | quantity: '56' -> '56' | customer_id: 'CUST018080' -> 'CUST018080'
2026-01-12 12:10:24,628 - dq_comparison - INFO - DEBUG HASH STRING: text with. periods|TX00018080|2023-11-24|56|CUST018080...
2026-01-12 12:10:24,629 - dq_comparison - INFO - DEBUG HASH RESULT: 952b8cb4...
2026-01-12 12:10:24,630 - dq_comparison - INFO - DEBUG HASH ROW: description: 'Text with, commas' -> 'text with, commas' | transaction_id: 'TX00034721' -> 'TX00034721' | transaction_date: '03-08-2023' -> '2023-08-03' | quantity: '99' -> '99' | customer_id: 'CUST034721' -> 'CUST034721'
2026-01-12 12:10:24,630 - dq_comparison - INFO - DEBUG HASH STRING: text with, commas|TX00034721|2023-08-03|99|CUST034721...
2026-01-12 12:10:24,630 - dq_comparison - INFO - DEBUG HASH RESULT: aa648af8...
2026-01-12 12:10:24,632 - dq_comparison - INFO - DEBUG HASH ROW: description: 'Text with'apostrophes' -> 'text with'apostrophes' | transaction_id: 'TX00089258' -> 'TX00089258' | transaction_date: '09-11-2023' -> '2023-11-09' | quantity: '41' -> '41' | customer_id: 'CUST089258' -> 'CUST089258'
2026-01-12 12:10:24,632 - dq_comparison - INFO - DEBUG HASH STRING: text with'apostrophes|TX00089258|2023-11-09|41|CUST089258...
2026-01-12 12:10:24,633 - dq_comparison - INFO - DEBUG HASH RESULT: 14a0071f...
2026-01-12 12:10:24,634 - dq_comparison - INFO - DEBUG HASH ROW: description: 'Text with! exclamations' -> 'text with! exclamations' | transaction_id: 'TX00048087' -> 'TX00048087' | transaction_date: '02-09-2023' -> '2023-09-02' | quantity: '12' -> '12' | customer_id: 'CUST048087' -> 'CUST048087'
2026-01-12 12:10:24,634 - dq_comparison - INFO - DEBUG HASH STRING: text with! exclamations|TX00048087|2023-09-02|12|CUST048087...
2026-01-12 12:10:24,635 - dq_comparison - INFO - DEBUG HASH RESULT: 43a2844b...
2026-01-12 12:10:24,635 - dq_comparison - INFO - DEBUG HASH ROW: description: 'Text with@at signs' -> 'text with@at signs' | transaction_id: 'TX00010873' -> 'TX00010873' | transaction_date: '10-01-2023' -> '2023-01-10' | quantity: '69' -> '69' | customer_id: 'CUST010873' -> 'CUST010873'
2026-01-12 12:10:24,636 - dq_comparison - INFO - DEBUG HASH STRING: text with@at signs|TX00010873|2023-01-10|69|CUST010873...
2026-01-12 12:10:24,636 - dq_comparison - INFO - DEBUG HASH RESULT: 5c8d3052...
2026-01-12 12:10:24,638 - dq_comparison - INFO - DEBUG HASH ROW: description: 'Text with trailing spaces  ' -> 'text with trailing spaces' | transaction_id: 'TX00058189' -> 'TX00058189' | transaction_date: '21-03-2023' -> '2023-03-21' | quantity: '33' -> '33' | customer_id: 'CUST058189' -> 'CUST058189'
2026-01-12 12:10:24,638 - dq_comparison - INFO - DEBUG HASH STRING: text with trailing spaces|TX00058189|2023-03-21|33|CUST058189...
2026-01-12 12:10:24,639 - dq_comparison - INFO - DEBUG HASH RESULT: 1905ba0b...
2026-01-12 12:10:24,640 - dq_comparison - INFO - DEBUG HASH ROW: description: 'Text with~tildes' -> 'text with~tildes' | transaction_id: 'TX00096612' -> 'TX00096612' | transaction_date: '13-05-2023' -> '2023-05-13' | quantity: '75' -> '75' | customer_id: 'CUST096612' -> 'CUST096612'
2026-01-12 12:10:24,640 - dq_comparison - INFO - DEBUG HASH STRING: text with~tildes|TX00096612|2023-05-13|75|CUST096612...
2026-01-12 12:10:24,641 - dq_comparison - INFO - DEBUG HASH RESULT: c4b17182...
2026-01-12 12:10:24,641 - dq_comparison - INFO - DEBUG HASH ROW: description: 'Text with@at signs' -> 'text with@at signs' | transaction_id: 'TX00017427' -> 'TX00017427' | transaction_date: '03-11-2023' -> '2023-11-03' | quantity: '99' -> '99' | customer_id: 'CUST017427' -> 'CUST017427'
2026-01-12 12:10:24,642 - dq_comparison - INFO - DEBUG HASH STRING: text with@at signs|TX00017427|2023-11-03|99|CUST017427...
2026-01-12 12:10:24,642 - dq_comparison - INFO - DEBUG HASH RESULT: 607f9548...
2026-01-12 12:10:24,643 - dq_comparison - INFO - DEBUG HASH ROW: description: 'Text with$dollar signs' -> 'text with$dollar signs' | transaction_id: 'TX00072103' -> 'TX00072103' | transaction_date: '30-11-2023' -> '2023-11-30' | quantity: '80' -> '80' | customer_id: 'CUST072103' -> 'CUST072103'
2026-01-12 12:10:24,644 - dq_comparison - INFO - DEBUG HASH STRING: text with$dollar signs|TX00072103|2023-11-30|80|CUST072103...
2026-01-12 12:10:24,644 - dq_comparison - INFO - DEBUG HASH RESULT: deb0adf5...
2026-01-12 12:10:24,645 - dq_comparison - INFO - DEBUG HASH ROW: description: 'Text with'apostrophes' -> 'text with'apostrophes' | transaction_id: 'TX00092795' -> 'TX00092795' | transaction_date: '26-01-2023' -> '2023-01-26' | quantity: '92' -> '92' | customer_id: 'CUST092795' -> 'CUST092795'
2026-01-12 12:10:24,645 - dq_comparison - INFO - DEBUG HASH STRING: text with'apostrophes|TX00092795|2023-01-26|92|CUST092795...
2026-01-12 12:10:24,646 - dq_comparison - INFO - DEBUG HASH RESULT: 657a0ca0...
2026-01-12 12:10:24,647 - dq_comparison - INFO - DEBUG HASH ROW: description: 'Text with\backslashes' -> 'text with\backslashes' | transaction_id: 'TX00083903' -> 'TX00083903' | transaction_date: '22-03-2023' -> '2023-03-22' | quantity: '36' -> '36' | customer_id: 'CUST083903' -> 'CUST083903'
2026-01-12 12:10:24,647 - dq_comparison - INFO - DEBUG HASH STRING: text with\backslashes|TX00083903|2023-03-22|36|CUST083903...
2026-01-12 12:10:24,648 - dq_comparison - INFO - DEBUG HASH RESULT: d191e0bb...
2026-01-12 12:10:24,649 - dq_comparison - INFO - DEBUG HASH ROW: description: 'Text with\backslashes' -> 'text with\backslashes' | transaction_id: 'TX00001784' -> 'TX00001784' | transaction_date: '23-11-2023' -> '2023-11-23' | quantity: '89' -> '89' | customer_id: 'CUST001784' -> 'CUST001784'
2026-01-12 12:10:24,649 - dq_comparison - INFO - DEBUG HASH STRING: text with\backslashes|TX00001784|2023-11-23|89|CUST001784...
2026-01-12 12:10:24,650 - dq_comparison - INFO - DEBUG HASH RESULT: fae69d95...
2026-01-12 12:10:24,650 - dq_comparison - INFO - DEBUG HASH ROW: description: 'Text with& ampersands' -> 'text with& ampersands' | transaction_id: 'TX00088471' -> 'TX00088471' | transaction_date: '11-03-2023' -> '2023-03-11' | quantity: '23' -> '23' | customer_id: 'CUST088471' -> 'CUST088471'
2026-01-12 12:10:24,651 - dq_comparison - INFO - DEBUG HASH STRING: text with& ampersands|TX00088471|2023-03-11|23|CUST088471...
2026-01-12 12:10:24,651 - dq_comparison - INFO - DEBUG HASH RESULT: c9505408...
2026-01-12 12:10:24,652 - dq_comparison - INFO - DEBUG HASH ROW: description: 'Text with`backticks' -> 'text with`backticks' | transaction_id: 'TX00048243' -> 'TX00048243' | transaction_date: '05-06-2023' -> '2023-06-05' | quantity: '74' -> '74' | customer_id: 'CUST048243' -> 'CUST048243'
2026-01-12 12:10:24,653 - dq_comparison - INFO - DEBUG HASH STRING: text with`backticks|TX00048243|2023-06-05|74|CUST048243...
2026-01-12 12:10:24,653 - dq_comparison - INFO - DEBUG HASH RESULT: 33a2004c...
2026-01-12 12:10:24,654 - dq_comparison - INFO - DEBUG HASH ROW: description: 'Text with& ampersands' -> 'text with& ampersands' | transaction_id: 'TX00036231' -> 'TX00036231' | transaction_date: '04-01-2023' -> '2023-01-04' | quantity: '13' -> '13' | customer_id: 'CUST036231' -> 'CUST036231'
2026-01-12 12:10:24,655 - dq_comparison - INFO - DEBUG HASH STRING: text with& ampersands|TX00036231|2023-01-04|13|CUST036231...
2026-01-12 12:10:24,656 - dq_comparison - INFO - DEBUG HASH RESULT: 3c9524cd...
2026-01-12 12:10:24,656 - dq_comparison - INFO - DEBUG HASH ROW: description: 'Text with'apostrophes' -> 'text with'apostrophes' | transaction_id: 'TX00050529' -> 'TX00050529' | transaction_date: '21-08-2023' -> '2023-08-21' | quantity: '10' -> '10' | customer_id: 'CUST050529' -> 'CUST050529'
2026-01-12 12:10:24,657 - dq_comparison - INFO - DEBUG HASH STRING: text with'apostrophes|TX00050529|2023-08-21|10|CUST050529...
2026-01-12 12:10:24,657 - dq_comparison - INFO - DEBUG HASH RESULT: f081be7b...
2026-01-12 12:10:24,658 - dq_comparison - INFO - DEBUG HASH ROW: description: 'Text with
newlines' -> 'text with newlines' | transaction_id: 'TX00061110' -> 'TX00061110' | transaction_date: '22-09-2023' -> '2023-09-22' | quantity: '15' -> '15' | customer_id: 'CUST061110' -> 'CUST061110'
2026-01-12 12:10:24,659 - dq_comparison - INFO - DEBUG HASH STRING: text with newlines|TX00061110|2023-09-22|15|CUST061110...
2026-01-12 12:10:24,659 - dq_comparison - INFO - DEBUG HASH RESULT: a5aa7afe...
2026-01-12 12:10:24,660 - dq_comparison - INFO - DEBUG HASH ROW: description: 'Text with? questions' -> 'text with? questions' | transaction_id: 'TX00048466' -> 'TX00048466' | transaction_date: '01-12-2023' -> '2023-12-01' | quantity: '77' -> '77' | customer_id: 'CUST048466' -> 'CUST048466'
2026-01-12 12:10:24,661 - dq_comparison - INFO - DEBUG HASH STRING: text with? questions|TX00048466|2023-12-01|77|CUST048466...
2026-01-12 12:10:24,661 - dq_comparison - INFO - DEBUG HASH RESULT: fc548567...
2026-01-12 12:10:24,662 - dq_comparison - INFO - DEBUG HASH ROW: description: 'Text with; semicolons' -> 'text with; semicolons' | transaction_id: 'TX00085726' -> 'TX00085726' | transaction_date: '29-05-2023' -> '2023-05-29' | quantity: '61' -> '61' | customer_id: 'CUST085726' -> 'CUST085726'
2026-01-12 12:10:24,662 - dq_comparison - INFO - DEBUG HASH STRING: text with; semicolons|TX00085726|2023-05-29|61|CUST085726...
2026-01-12 12:10:24,663 - dq_comparison - INFO - DEBUG HASH RESULT: 0d27f7b1...
2026-01-12 12:10:24,664 - dq_comparison - INFO - DEBUG HASH ROW: description: 'Normal text without issues' -> 'normal text without issues' | transaction_id: 'TX00031796' -> 'TX00031796' | transaction_date: '03/16/2023' -> '2023-03-16' | quantity: '71' -> '71' | customer_id: 'CUST031796' -> 'CUST031796'
2026-01-12 12:10:24,664 - dq_comparison - INFO - DEBUG HASH STRING: normal text without issues|TX00031796|2023-03-16|71|CUST031796...
2026-01-12 12:10:24,665 - dq_comparison - INFO - DEBUG HASH RESULT: 00cfcf73...
2026-01-12 12:10:24,666 - dq_comparison - INFO - DEBUG HASH ROW: description: 'Text with{braces}' -> 'text with{braces}' | transaction_id: 'TX00005463' -> 'TX00005463' | transaction_date: '18-06-2023' -> '2023-06-18' | quantity: '82' -> '82' | customer_id: 'CUST005463' -> 'CUST005463'
2026-01-12 12:10:24,666 - dq_comparison - INFO - DEBUG HASH STRING: text with{braces}|TX00005463|2023-06-18|82|CUST005463...
2026-01-12 12:10:24,667 - dq_comparison - INFO - DEBUG HASH RESULT: 7e12d2c0...
2026-01-12 12:10:24,668 - dq_comparison - INFO - DEBUG HASH ROW: description: 'Text with@at signs' -> 'text with@at signs' | transaction_id: 'TX00071389' -> 'TX00071389' | transaction_date: '05-01-2023' -> '2023-01-05' | quantity: '88' -> '88' | customer_id: 'CUST071389' -> 'CUST071389'
2026-01-12 12:10:24,668 - dq_comparison - INFO - DEBUG HASH STRING: text with@at signs|TX00071389|2023-01-05|88|CUST071389...
2026-01-12 12:10:24,669 - dq_comparison - INFO - DEBUG HASH RESULT: e8f94da7...
2026-01-12 12:10:24,669 - dq_comparison - INFO - DEBUG HASH ROW: description: 'Text with trailing spaces  ' -> 'text with trailing spaces' | transaction_id: 'TX00081845' -> 'TX00081845' | transaction_date: '08-12-2023' -> '2023-12-08' | quantity: '90' -> '90' | customer_id: 'CUST081845' -> 'CUST081845'
2026-01-12 12:10:24,671 - dq_comparison - INFO - DEBUG HASH STRING: text with trailing spaces|TX00081845|2023-12-08|90|CUST081845...
2026-01-12 12:10:24,671 - dq_comparison - INFO - DEBUG HASH RESULT: 05c12933...
2026-01-12 12:10:24,672 - dq_comparison - INFO - DEBUG HASH ROW: description: 'Text with"quotes"' -> 'text with"quotes"' | transaction_id: 'TX00069202' -> 'TX00069202' | transaction_date: '26-11-2023' -> '2023-11-26' | quantity: '91' -> '91' | customer_id: 'CUST069202' -> 'CUST069202'
2026-01-12 12:10:24,673 - dq_comparison - INFO - DEBUG HASH STRING: text with"quotes"|TX00069202|2023-11-26|91|CUST069202...
2026-01-12 12:10:24,673 - dq_comparison - INFO - DEBUG HASH RESULT: aaa29737...
2026-01-12 12:10:24,674 - dq_comparison - INFO - DEBUG HASH ROW: description: 'Text with? questions' -> 'text with? questions' | transaction_id: 'TX00087042' -> 'TX00087042' | transaction_date: '23-05-2023' -> '2023-05-23' | quantity: '100' -> '100' | customer_id: 'CUST087042' -> 'CUST087042'
2026-01-12 12:10:24,675 - dq_comparison - INFO - DEBUG HASH STRING: text with? questions|TX00087042|2023-05-23|100|CUST087042...
2026-01-12 12:10:24,675 - dq_comparison - INFO - DEBUG HASH RESULT: 3e3d3a7e...
2026-01-12 12:10:24,676 - dq_comparison - INFO - DEBUG HASH ROW: description: 'Text with{braces}' -> 'text with{braces}' | transaction_id: 'TX00099501' -> 'TX00099501' | transaction_date: '25-04-2023' -> '2023-04-25' | quantity: '47' -> '47' | customer_id: 'CUST099501' -> 'CUST099501'
2026-01-12 12:10:24,677 - dq_comparison - INFO - DEBUG HASH STRING: text with{braces}|TX00099501|2023-04-25|47|CUST099501...
2026-01-12 12:10:24,677 - dq_comparison - INFO - DEBUG HASH RESULT: 0d6a001e...
2026-01-12 12:10:24,678 - dq_comparison - INFO - DEBUG HASH ROW: description: 'Text with
newlines' -> 'text with newlines' | transaction_id: 'TX00084837' -> 'TX00084837' | transaction_date: '05/20/2023' -> '2023-05-20' | quantity: '43' -> '43' | customer_id: 'CUST084837' -> 'CUST084837'
2026-01-12 12:10:24,679 - dq_comparison - INFO - DEBUG HASH STRING: text with newlines|TX00084837|2023-05-20|43|CUST084837...
2026-01-12 12:10:24,679 - dq_comparison - INFO - DEBUG HASH RESULT: af83e5a8...
2026-01-12 12:10:24,680 - dq_comparison - INFO - DEBUG HASH ROW: description: 'Text with#hashtags' -> 'text with#hashtags' | transaction_id: 'TX00083514' -> 'TX00083514' | transaction_date: '06-02-2023' -> '2023-02-06' | quantity: '99' -> '99' | customer_id: 'CUST083514' -> 'CUST083514'
2026-01-12 12:10:24,681 - dq_comparison - INFO - DEBUG HASH STRING: text with#hashtags|TX00083514|2023-02-06|99|CUST083514...
2026-01-12 12:10:24,681 - dq_comparison - INFO - DEBUG HASH RESULT: be58cd64...
2026-01-12 12:10:24,682 - dq_comparison - INFO - DEBUG HASH ROW: description: 'Text with mixed CAPITAL and lowercase' -> 'text with mixed capital and lowercase' | transaction_id: 'TX00067808' -> 'TX00067808' | transaction_date: '10-08-2023' -> '2023-08-10' | quantity: '39' -> '39' | customer_id: 'CUST067808' -> 'CUST067808'
2026-01-12 12:10:24,683 - dq_comparison - INFO - DEBUG HASH STRING: text with mixed capital and lowercase|TX00067808|2023-08-10|39|CUST067808...
2026-01-12 12:10:24,683 - dq_comparison - INFO - DEBUG HASH RESULT: 278a0da4...
2026-01-12 12:10:24,684 - dq_comparison - INFO - DEBUG HASH ROW: description: 'Normal text without issues' -> 'normal text without issues' | transaction_id: 'TX00087054' -> 'TX00087054' | transaction_date: '24-05-2023' -> '2023-05-24' | quantity: '96' -> '96' | customer_id: 'CUST087054' -> 'CUST087054'
2026-01-12 12:10:24,685 - dq_comparison - INFO - DEBUG HASH STRING: normal text without issues|TX00087054|2023-05-24|96|CUST087054...
2026-01-12 12:10:24,685 - dq_comparison - INFO - DEBUG HASH RESULT: fde26884...
2026-01-12 12:10:24,686 - dq_comparison - INFO - DEBUG HASH ROW: description: 'Text with~tildes' -> 'text with~tildes' | transaction_id: 'TX00015874' -> 'TX00015874' | transaction_date: '29-09-2023' -> '2023-09-29' | quantity: '36' -> '36' | customer_id: 'CUST015874' -> 'CUST015874'
2026-01-12 12:10:24,686 - dq_comparison - INFO - DEBUG HASH STRING: text with~tildes|TX00015874|2023-09-29|36|CUST015874...
2026-01-12 12:10:24,687 - dq_comparison - INFO - DEBUG HASH RESULT: 9dab95c1...
2026-01-12 12:10:24,688 - dq_comparison - INFO - DEBUG HASH ROW: description: 'Text with	tabs' -> 'text with tabs' | transaction_id: 'TX00090970' -> 'TX00090970' | transaction_date: '28-07-2023' -> '2023-07-28' | quantity: '77' -> '77' | customer_id: 'CUST090970' -> 'CUST090970'
2026-01-12 12:10:24,688 - dq_comparison - INFO - DEBUG HASH STRING: text with tabs|TX00090970|2023-07-28|77|CUST090970...
2026-01-12 12:10:24,689 - dq_comparison - INFO - DEBUG HASH RESULT: aa042166...
2026-01-12 12:10:24,690 - dq_comparison - INFO - DEBUG HASH ROW: description: 'Text with@at signs' -> 'text with@at signs' | transaction_id: 'TX00008968' -> 'TX00008968' | transaction_date: '08-03-2023' -> '2023-03-08' | quantity: '17' -> '17' | customer_id: 'CUST008968' -> 'CUST008968'
2026-01-12 12:10:24,691 - dq_comparison - INFO - DEBUG HASH STRING: text with@at signs|TX00008968|2023-03-08|17|CUST008968...
2026-01-12 12:10:24,691 - dq_comparison - INFO - DEBUG HASH RESULT: 1bbfebce...
2026-01-12 12:10:24,692 - dq_comparison - INFO - DEBUG HASH ROW: description: 'Text with, commas' -> 'text with, commas' | transaction_id: 'TX00097997' -> 'TX00097997' | transaction_date: '09-10-2023' -> '2023-10-09' | quantity: '53' -> '53' | customer_id: 'CUST097997' -> 'CUST097997'
2026-01-12 12:10:24,692 - dq_comparison - INFO - DEBUG HASH STRING: text with, commas|TX00097997|2023-10-09|53|CUST097997...
2026-01-12 12:10:24,693 - dq_comparison - INFO - DEBUG HASH RESULT: 1e2d92e2...
2026-01-12 12:10:24,694 - dq_comparison - INFO - DEBUG HASH ROW: description: 'Text with"quotes"' -> 'text with"quotes"' | transaction_id: 'TX00024658' -> 'TX00024658' | transaction_date: '22-03-2023' -> '2023-03-22' | quantity: '17' -> '17' | customer_id: 'CUST024658' -> 'CUST024658'
2026-01-12 12:10:24,694 - dq_comparison - INFO - DEBUG HASH STRING: text with"quotes"|TX00024658|2023-03-22|17|CUST024658...
2026-01-12 12:10:24,695 - dq_comparison - INFO - DEBUG HASH RESULT: 6432905b...
2026-01-12 12:10:24,696 - dq_comparison - INFO - DEBUG HASH ROW: description: 'Text with? questions' -> 'text with? questions' | transaction_id: 'TX00017413' -> 'TX00017413' | transaction_date: '16-11-2023' -> '2023-11-16' | quantity: '59' -> '59' | customer_id: 'CUST017413' -> 'CUST017413'
2026-01-12 12:10:24,696 - dq_comparison - INFO - DEBUG HASH STRING: text with? questions|TX00017413|2023-11-16|59|CUST017413...
2026-01-12 12:10:24,697 - dq_comparison - INFO - DEBUG HASH RESULT: 56446109...
2026-01-12 12:10:24,697 - dq_comparison - INFO - DEBUG HASH ROW: description: 'Text with'apostrophes' -> 'text with'apostrophes' | transaction_id: 'TX00084127' -> 'TX00084127' | transaction_date: '04-11-2023' -> '2023-11-04' | quantity: '11' -> '11' | customer_id: 'CUST084127' -> 'CUST084127'
2026-01-12 12:10:24,698 - dq_comparison - INFO - DEBUG HASH STRING: text with'apostrophes|TX00084127|2023-11-04|11|CUST084127...
2026-01-12 12:10:24,699 - dq_comparison - INFO - DEBUG HASH RESULT: d7d9fede...
2026-01-12 12:10:24,699 - dq_comparison - INFO - DEBUG HASH ROW: description: 'Text with%percent signs' -> 'text with%percent signs' | transaction_id: 'TX00014013' -> 'TX00014013' | transaction_date: '24-02-2023' -> '2023-02-24' | quantity: '83' -> '83' | customer_id: 'CUST014013' -> 'CUST014013'
2026-01-12 12:10:24,700 - dq_comparison - INFO - DEBUG HASH STRING: text with%percent signs|TX00014013|2023-02-24|83|CUST014013...
2026-01-12 12:10:24,700 - dq_comparison - INFO - DEBUG HASH RESULT: 53f7b1a1...
2026-01-12 12:10:24,702 - dq_comparison - INFO - DEBUG HASH ROW: description: 'Text with trailing spaces  ' -> 'text with trailing spaces' | transaction_id: 'TX00050711' -> 'TX00050711' | transaction_date: '09/16/2023' -> '2023-09-16' | quantity: '42' -> '42' | customer_id: 'CUST050711' -> 'CUST050711'
2026-01-12 12:10:24,703 - dq_comparison - INFO - DEBUG HASH STRING: text with trailing spaces|TX00050711|2023-09-16|42|CUST050711...
2026-01-12 12:10:24,703 - dq_comparison - INFO - DEBUG HASH RESULT: 1263e4a0...
2026-01-12 12:10:24,704 - dq_comparison - INFO - DEBUG HASH ROW: description: 'Text with_underscores' -> 'text with_underscores' | transaction_id: 'TX00099013' -> 'TX00099013' | transaction_date: '24-09-2023' -> '2023-09-24' | quantity: '77' -> '77' | customer_id: 'CUST099013' -> 'CUST099013'
2026-01-12 12:10:24,704 - dq_comparison - INFO - DEBUG HASH STRING: text with_underscores|TX00099013|2023-09-24|77|CUST099013...
2026-01-12 12:10:24,705 - dq_comparison - INFO - DEBUG HASH RESULT: 9cab030c...
2026-01-12 12:10:24,706 - dq_comparison - INFO - DEBUG HASH ROW: description: 'Text with, commas' -> 'text with, commas' | transaction_id: 'TX00023909' -> 'TX00023909' | transaction_date: '17-06-2023' -> '2023-06-17' | quantity: '51' -> '51' | customer_id: 'CUST023909' -> 'CUST023909'
2026-01-12 12:10:24,706 - dq_comparison - INFO - DEBUG HASH STRING: text with, commas|TX00023909|2023-06-17|51|CUST023909...
2026-01-12 12:10:24,707 - dq_comparison - INFO - DEBUG HASH RESULT: 7e7dd93e...
2026-01-12 12:10:24,707 - dq_comparison - INFO - DEBUG HASH ROW: description: 'Text with(parentheses)' -> 'text with(parentheses)' | transaction_id: 'TX00026142' -> 'TX00026142' | transaction_date: '20-09-2023' -> '2023-09-20' | quantity: '52' -> '52' | customer_id: 'CUST026142' -> 'CUST026142'
2026-01-12 12:10:24,708 - dq_comparison - INFO - DEBUG HASH STRING: text with(parentheses)|TX00026142|2023-09-20|52|CUST026142...
2026-01-12 12:10:24,708 - dq_comparison - INFO - DEBUG HASH RESULT: 506dbbcd...
2026-01-12 12:10:24,709 - dq_comparison - INFO - DEBUG HASH ROW: description: 'Text with|pipes' -> 'text with|pipes' | transaction_id: 'TX00029191' -> 'TX00029191' | transaction_date: '08/20/2023' -> '2023-08-20' | quantity: '76' -> '76' | customer_id: 'CUST029191' -> 'CUST029191'
2026-01-12 12:10:24,710 - dq_comparison - INFO - DEBUG HASH STRING: text with|pipes|TX00029191|2023-08-20|76|CUST029191...
2026-01-12 12:10:24,710 - dq_comparison - INFO - DEBUG HASH RESULT: f1b4fcea...
2026-01-12 12:10:24,711 - dq_comparison - INFO - DEBUG HASH ROW: description: 'Text with! exclamations' -> 'text with! exclamations' | transaction_id: 'TX00077930' -> 'TX00077930' | transaction_date: '17-09-2023' -> '2023-09-17' | quantity: '30' -> '30' | customer_id: 'CUST077930' -> 'CUST077930'
2026-01-12 12:10:24,712 - dq_comparison - INFO - DEBUG HASH STRING: text with! exclamations|TX00077930|2023-09-17|30|CUST077930...
2026-01-12 12:10:24,712 - dq_comparison - INFO - DEBUG HASH RESULT: 66976205...
2026-01-12 12:10:24,713 - dq_comparison - INFO - DEBUG HASH ROW: description: 'Text with trailing spaces  ' -> 'text with trailing spaces' | transaction_id: 'TX00041096' -> 'TX00041096' | transaction_date: '07-12-2023' -> '2023-12-07' | quantity: '52' -> '52' | customer_id: 'CUST041096' -> 'CUST041096'
2026-01-12 12:10:24,714 - dq_comparison - INFO - DEBUG HASH STRING: text with trailing spaces|TX00041096|2023-12-07|52|CUST041096...
2026-01-12 12:10:24,714 - dq_comparison - INFO - DEBUG HASH RESULT: 3b28d2c3...
2026-01-12 12:10:24,715 - dq_comparison - INFO - DEBUG HASH ROW: description: 'Text with! exclamations' -> 'text with! exclamations' | transaction_id: 'TX00003450' -> 'TX00003450' | transaction_date: '05-12-2023' -> '2023-12-05' | quantity: '77' -> '77' | customer_id: 'CUST003450' -> 'CUST003450'
2026-01-12 12:10:24,716 - dq_comparison - INFO - DEBUG HASH STRING: text with! exclamations|TX00003450|2023-12-05|77|CUST003450...
2026-01-12 12:10:24,716 - dq_comparison - INFO - DEBUG HASH RESULT: 43f76aa6...
2026-01-12 12:10:24,717 - dq_comparison - INFO - DEBUG HASH ROW: description: 'Text with$dollar signs' -> 'text with$dollar signs' | transaction_id: 'TX00071429' -> 'TX00071429' | transaction_date: '05-09-2023' -> '2023-09-05' | quantity: '50' -> '50' | customer_id: 'CUST071429' -> 'CUST071429'
2026-01-12 12:10:24,717 - dq_comparison - INFO - DEBUG HASH STRING: text with$dollar signs|TX00071429|2023-09-05|50|CUST071429...
2026-01-12 12:10:24,718 - dq_comparison - INFO - DEBUG HASH RESULT: 3779c7c5...
2026-01-12 12:10:24,718 - dq_comparison - INFO - DEBUG HASH ROW: description: 'Text with'apostrophes' -> 'text with'apostrophes' | transaction_id: 'TX00010052' -> 'TX00010052' | transaction_date: '06-10-2023' -> '2023-10-06' | quantity: '12' -> '12' | customer_id: 'CUST010052' -> 'CUST010052'
2026-01-12 12:10:24,719 - dq_comparison - INFO - DEBUG HASH STRING: text with'apostrophes|TX00010052|2023-10-06|12|CUST010052...
2026-01-12 12:10:24,720 - dq_comparison - INFO - DEBUG HASH RESULT: 39b3f8ce...
2026-01-12 12:10:24,720 - dq_comparison - INFO - DEBUG HASH ROW: description: 'Text with trailing spaces  ' -> 'text with trailing spaces' | transaction_id: 'TX00079712' -> 'TX00079712' | transaction_date: '29-09-2023' -> '2023-09-29' | quantity: '5' -> '5' | customer_id: 'CUST079712' -> 'CUST079712'
2026-01-12 12:10:24,721 - dq_comparison - INFO - DEBUG HASH STRING: text with trailing spaces|TX00079712|2023-09-29|5|CUST079712...
2026-01-12 12:10:24,722 - dq_comparison - INFO - DEBUG HASH RESULT: b23bd857...
2026-01-12 12:10:24,722 - dq_comparison - INFO - DEBUG HASH ROW: description: 'Text with$dollar signs' -> 'text with$dollar signs' | transaction_id: 'TX00049193' -> 'TX00049193' | transaction_date: '05-03-2023' -> '2023-03-05' | quantity: '63' -> '63' | customer_id: 'CUST049193' -> 'CUST049193'
2026-01-12 12:10:24,723 - dq_comparison - INFO - DEBUG HASH STRING: text with$dollar signs|TX00049193|2023-03-05|63|CUST049193...
2026-01-12 12:10:24,723 - dq_comparison - INFO - DEBUG HASH RESULT: 815c54ff...
2026-01-12 12:10:24,724 - dq_comparison - INFO - DEBUG HASH ROW: description: 'Text with@at signs' -> 'text with@at signs' | transaction_id: 'TX00091220' -> 'TX00091220' | transaction_date: '10-11-2023' -> '2023-11-10' | quantity: '94' -> '94' | customer_id: 'CUST091220' -> 'CUST091220'
2026-01-12 12:10:24,725 - dq_comparison - INFO - DEBUG HASH STRING: text with@at signs|TX00091220|2023-11-10|94|CUST091220...
2026-01-12 12:10:24,725 - dq_comparison - INFO - DEBUG HASH RESULT: aa999fa4...
2026-01-12 12:10:24,726 - dq_comparison - INFO - DEBUG HASH ROW: description: 'Text with
newlines' -> 'text with newlines' | transaction_id: 'TX00016226' -> 'TX00016226' | transaction_date: '03-06-2023' -> '2023-06-03' | quantity: '52' -> '52' | customer_id: 'CUST016226' -> 'CUST016226'
2026-01-12 12:10:24,727 - dq_comparison - INFO - DEBUG HASH STRING: text with newlines|TX00016226|2023-06-03|52|CUST016226...
2026-01-12 12:10:24,727 - dq_comparison - INFO - DEBUG HASH RESULT: e527a069...
2026-01-12 12:10:24,728 - dq_comparison - INFO - DEBUG HASH ROW: description: 'Text with%percent signs' -> 'text with%percent signs' | transaction_id: 'TX00055724' -> 'TX00055724' | transaction_date: '07-11-2023' -> '2023-11-07' | quantity: '98' -> '98' | customer_id: 'CUST055724' -> 'CUST055724'
2026-01-12 12:10:24,728 - dq_comparison - INFO - DEBUG HASH STRING: text with%percent signs|TX00055724|2023-11-07|98|CUST055724...
2026-01-12 12:10:24,729 - dq_comparison - INFO - DEBUG HASH RESULT: 4f233cf1...
2026-01-12 12:10:24,730 - dq_comparison - INFO - DEBUG HASH ROW: description: 'Text with@at signs' -> 'text with@at signs' | transaction_id: 'TX00086299' -> 'TX00086299' | transaction_date: '09-03-2023' -> '2023-03-09' | quantity: '14' -> '14' | customer_id: 'CUST086299' -> 'CUST086299'
2026-01-12 12:10:24,730 - dq_comparison - INFO - DEBUG HASH STRING: text with@at signs|TX00086299|2023-03-09|14|CUST086299...
2026-01-12 12:10:24,731 - dq_comparison - INFO - DEBUG HASH RESULT: d27551f7...
2026-01-12 12:10:24,732 - dq_comparison - INFO - DEBUG HASH ROW: description: 'Text with; semicolons' -> 'text with; semicolons' | transaction_id: 'TX00007142' -> 'TX00007142' | transaction_date: '03-05-2023' -> '2023-05-03' | quantity: '63' -> '63' | customer_id: 'CUST007142' -> 'CUST007142'
2026-01-12 12:10:24,732 - dq_comparison - INFO - DEBUG HASH STRING: text with; semicolons|TX00007142|2023-05-03|63|CUST007142...
2026-01-12 12:10:24,733 - dq_comparison - INFO - DEBUG HASH RESULT: 2a9af788...
2026-01-12 12:10:24,734 - dq_comparison - INFO - DEBUG HASH ROW: description: 'Text with? questions' -> 'text with? questions' | transaction_id: 'TX00020911' -> 'TX00020911' | transaction_date: '12-05-2023' -> '2023-05-12' | quantity: '55' -> '55' | customer_id: 'CUST020911' -> 'CUST020911'
2026-01-12 12:10:24,734 - dq_comparison - INFO - DEBUG HASH STRING: text with? questions|TX00020911|2023-05-12|55|CUST020911...
2026-01-12 12:10:24,735 - dq_comparison - INFO - DEBUG HASH RESULT: 3d64607b...
2026-01-12 12:10:24,736 - dq_comparison - INFO - DEBUG HASH ROW: description: 'Text with'apostrophes' -> 'text with'apostrophes' | transaction_id: 'TX00031067' -> 'TX00031067' | transaction_date: '17-05-2023' -> '2023-05-17' | quantity: '9' -> '9' | customer_id: 'CUST031067' -> 'CUST031067'
2026-01-12 12:10:24,736 - dq_comparison - INFO - DEBUG HASH STRING: text with'apostrophes|TX00031067|2023-05-17|9|CUST031067...
2026-01-12 12:10:24,737 - dq_comparison - INFO - DEBUG HASH RESULT: d2cf74f9...
2026-01-12 12:10:24,737 - dq_comparison - INFO - DEBUG HASH ROW: description: 'Text with. periods' -> 'text with. periods' | transaction_id: 'TX00042136' -> 'TX00042136' | transaction_date: '09/18/2023' -> '2023-09-18' | quantity: '9' -> '9' | customer_id: 'CUST042136' -> 'CUST042136'
2026-01-12 12:10:24,738 - dq_comparison - INFO - DEBUG HASH STRING: text with. periods|TX00042136|2023-09-18|9|CUST042136...
2026-01-12 12:10:24,738 - dq_comparison - INFO - DEBUG HASH RESULT: 24693f21...
2026-01-12 12:10:24,739 - dq_comparison - INFO - DEBUG HASH ROW: description: '  Text with leading spaces' -> 'text with leading spaces' | transaction_id: 'TX00025029' -> 'TX00025029' | transaction_date: '13-07-2023' -> '2023-07-13' | quantity: '16' -> '16' | customer_id: 'CUST025029' -> 'CUST025029'
2026-01-12 12:10:24,739 - dq_comparison - INFO - DEBUG HASH STRING: text with leading spaces|TX00025029|2023-07-13|16|CUST025029...
2026-01-12 12:10:24,740 - dq_comparison - INFO - DEBUG HASH RESULT: 88b3a2b8...
2026-01-12 12:10:24,740 - dq_comparison - INFO - DEBUG HASH ROW: description: 'Text with. periods' -> 'text with. periods' | transaction_id: 'TX00053080' -> 'TX00053080' | transaction_date: '09-08-2023' -> '2023-08-09' | quantity: '46' -> '46' | customer_id: 'CUST053080' -> 'CUST053080'
2026-01-12 12:10:24,741 - dq_comparison - INFO - DEBUG HASH STRING: text with. periods|TX00053080|2023-08-09|46|CUST053080...
2026-01-12 12:10:24,741 - dq_comparison - INFO - DEBUG HASH RESULT: 5f5a2092...
2026-01-12 12:10:24,742 - dq_comparison - INFO - DEBUG HASH ROW: description: 'Text with[brackets]' -> 'text with[brackets]' | transaction_id: 'TX00081228' -> 'TX00081228' | transaction_date: '03-11-2023' -> '2023-11-03' | quantity: '50' -> '50' | customer_id: 'CUST081228' -> 'CUST081228'
2026-01-12 12:10:24,742 - dq_comparison - INFO - DEBUG HASH STRING: text with[brackets]|TX00081228|2023-11-03|50|CUST081228...
2026-01-12 12:10:24,743 - dq_comparison - INFO - DEBUG HASH RESULT: 4823bbb8...
2026-01-12 12:10:24,744 - dq_comparison - INFO - DEBUG HASH ROW: description: 'Text with"quotes"' -> 'text with"quotes"' | transaction_id: 'TX00053107' -> 'TX00053107' | transaction_date: '11-12-2023' -> '2023-12-11' | quantity: '59' -> '59' | customer_id: 'CUST053107' -> 'CUST053107'
2026-01-12 12:10:24,744 - dq_comparison - INFO - DEBUG HASH STRING: text with"quotes"|TX00053107|2023-12-11|59|CUST053107...
2026-01-12 12:10:24,745 - dq_comparison - INFO - DEBUG HASH RESULT: 0d93a542...
2026-01-12 12:10:24,746 - dq_comparison - INFO - DEBUG HASH ROW: description: 'Text with@at signs' -> 'text with@at signs' | transaction_id: 'TX00041233' -> 'TX00041233' | transaction_date: '25-06-2023' -> '2023-06-25' | quantity: '82' -> '82' | customer_id: 'CUST041233' -> 'CUST041233'
2026-01-12 12:10:24,746 - dq_comparison - INFO - DEBUG HASH STRING: text with@at signs|TX00041233|2023-06-25|82|CUST041233...
2026-01-12 12:10:24,746 - dq_comparison - INFO - DEBUG HASH RESULT: 1b96ea5e...
2026-01-12 12:10:24,747 - dq_comparison - INFO - DEBUG HASH ROW: description: 'Text with~tildes' -> 'text with~tildes' | transaction_id: 'TX00080399' -> 'TX00080399' | transaction_date: '09-11-2023' -> '2023-11-09' | quantity: '72' -> '72' | customer_id: 'CUST080399' -> 'CUST080399'
2026-01-12 12:10:24,748 - dq_comparison - INFO - DEBUG HASH STRING: text with~tildes|TX00080399|2023-11-09|72|CUST080399...
2026-01-12 12:10:24,748 - dq_comparison - INFO - DEBUG HASH RESULT: 1612373c...
2026-01-12 12:10:24,749 - dq_comparison - INFO - DEBUG HASH ROW: description: 'Text with"quotes"' -> 'text with"quotes"' | transaction_id: 'TX00020344' -> 'TX00020344' | transaction_date: '28-05-2023' -> '2023-05-28' | quantity: '78' -> '78' | customer_id: 'CUST020344' -> 'CUST020344'
2026-01-12 12:10:24,749 - dq_comparison - INFO - DEBUG HASH STRING: text with"quotes"|TX00020344|2023-05-28|78|CUST020344...
2026-01-12 12:10:24,750 - dq_comparison - INFO - DEBUG HASH RESULT: 8fa1de31...
2026-01-12 12:10:24,751 - dq_comparison - INFO - DEBUG HASH ROW: description: 'Text with"quotes"' -> 'text with"quotes"' | transaction_id: 'TX00041539' -> 'TX00041539' | transaction_date: '04-04-2023' -> '2023-04-04' | quantity: '21' -> '21' | customer_id: 'CUST041539' -> 'CUST041539'
2026-01-12 12:10:24,751 - dq_comparison - INFO - DEBUG HASH STRING: text with"quotes"|TX00041539|2023-04-04|21|CUST041539...
2026-01-12 12:10:24,751 - dq_comparison - INFO - DEBUG HASH RESULT: eb6dedda...
2026-01-12 12:10:24,752 - dq_comparison - INFO - DEBUG HASH ROW: description: 'Text with[brackets]' -> 'text with[brackets]' | transaction_id: 'TX00078314' -> 'TX00078314' | transaction_date: '14-06-2023' -> '2023-06-14' | quantity: '29' -> '29' | customer_id: 'CUST078314' -> 'CUST078314'
2026-01-12 12:10:24,753 - dq_comparison - INFO - DEBUG HASH STRING: text with[brackets]|TX00078314|2023-06-14|29|CUST078314...
2026-01-12 12:10:24,753 - dq_comparison - INFO - DEBUG HASH RESULT: 68e1ed60...
2026-01-12 12:10:24,754 - dq_comparison - INFO - DEBUG HASH ROW: description: 'Normal text without issues' -> 'normal text without issues' | transaction_id: 'TX00062186' -> 'TX00062186' | transaction_date: '07-04-2023' -> '2023-04-07' | quantity: '56' -> '56' | customer_id: 'CUST062186' -> 'CUST062186'
2026-01-12 12:10:24,755 - dq_comparison - INFO - DEBUG HASH STRING: normal text without issues|TX00062186|2023-04-07|56|CUST062186...
2026-01-12 12:10:24,756 - dq_comparison - INFO - DEBUG HASH RESULT: a4e73b3a...
2026-01-12 12:10:24,757 - dq_comparison - INFO - DEBUG HASH ROW: description: 'Text with; semicolons' -> 'text with; semicolons' | transaction_id: 'TX00072800' -> 'TX00072800' | transaction_date: '13-04-2023' -> '2023-04-13' | quantity: '54' -> '54' | customer_id: 'CUST072800' -> 'CUST072800'
2026-01-12 12:10:24,757 - dq_comparison - INFO - DEBUG HASH STRING: text with; semicolons|TX00072800|2023-04-13|54|CUST072800...
2026-01-12 12:10:24,758 - dq_comparison - INFO - DEBUG HASH RESULT: 56a15a84...
2026-01-12 12:10:24,759 - dq_comparison - INFO - DEBUG HASH ROW: description: 'Text with*asterisks' -> 'text with*asterisks' | transaction_id: 'TX00073333' -> 'TX00073333' | transaction_date: '26-11-2023' -> '2023-11-26' | quantity: '25' -> '25' | customer_id: 'CUST073333' -> 'CUST073333'
2026-01-12 12:10:24,759 - dq_comparison - INFO - DEBUG HASH STRING: text with*asterisks|TX00073333|2023-11-26|25|CUST073333...
2026-01-12 12:10:24,760 - dq_comparison - INFO - DEBUG HASH RESULT: 614d45db...
2026-01-12 12:10:24,761 - dq_comparison - INFO - DEBUG HASH ROW: description: 'Text with~tildes' -> 'text with~tildes' | transaction_id: 'TX00096131' -> 'TX00096131' | transaction_date: '09-12-2023' -> '2023-12-09' | quantity: '72' -> '72' | customer_id: 'CUST096131' -> 'CUST096131'
2026-01-12 12:10:24,761 - dq_comparison - INFO - DEBUG HASH STRING: text with~tildes|TX00096131|2023-12-09|72|CUST096131...
2026-01-12 12:10:24,762 - dq_comparison - INFO - DEBUG HASH RESULT: 6be1ba32...
2026-01-12 12:10:24,763 - dq_comparison - INFO - DEBUG HASH ROW: description: 'Text with*asterisks' -> 'text with*asterisks' | transaction_id: 'TX00092832' -> 'TX00092832' | transaction_date: '24-12-2023' -> '2023-12-24' | quantity: '76' -> '76' | customer_id: 'CUST092832' -> 'CUST092832'
2026-01-12 12:10:24,763 - dq_comparison - INFO - DEBUG HASH STRING: text with*asterisks|TX00092832|2023-12-24|76|CUST092832...
2026-01-12 12:10:24,764 - dq_comparison - INFO - DEBUG HASH RESULT: efdcc827...
2026-01-12 12:10:24,766 - dq_comparison - INFO - DEBUG HASH ROW: description: 'Text with! exclamations' -> 'text with! exclamations' | transaction_id: 'TX00087335' -> 'TX00087335' | transaction_date: '24-05-2023' -> '2023-05-24' | quantity: '42' -> '42' | customer_id: 'CUST087335' -> 'CUST087335'
2026-01-12 12:10:24,766 - dq_comparison - INFO - DEBUG HASH STRING: text with! exclamations|TX00087335|2023-05-24|42|CUST087335...
2026-01-12 12:10:24,767 - dq_comparison - INFO - DEBUG HASH RESULT: 48873d12...
2026-01-12 12:10:24,768 - dq_comparison - INFO - DEBUG HASH ROW: description: 'Text with! exclamations' -> 'text with! exclamations' | transaction_id: 'TX00069382' -> 'TX00069382' | transaction_date: '03-10-2023' -> '2023-10-03' | quantity: '44' -> '44' | customer_id: 'CUST069382' -> 'CUST069382'
2026-01-12 12:10:24,768 - dq_comparison - INFO - DEBUG HASH STRING: text with! exclamations|TX00069382|2023-10-03|44|CUST069382...
2026-01-12 12:10:24,768 - dq_comparison - INFO - DEBUG HASH RESULT: 4a33e505...
2026-01-12 12:10:24,769 - dq_comparison - INFO - DEBUG HASH ROW: description: '  Text with leading spaces' -> 'text with leading spaces' | transaction_id: 'TX00021706' -> 'TX00021706' | transaction_date: '03-12-2023' -> '2023-12-03' | quantity: '74' -> '74' | customer_id: 'CUST021706' -> 'CUST021706'
2026-01-12 12:10:24,770 - dq_comparison - INFO - DEBUG HASH STRING: text with leading spaces|TX00021706|2023-12-03|74|CUST021706...
2026-01-12 12:10:24,771 - dq_comparison - INFO - DEBUG HASH RESULT: b977e310...
2026-01-12 12:10:24,771 - dq_comparison - INFO - DEBUG HASH ROW: description: 'Text with#hashtags' -> 'text with#hashtags' | transaction_id: 'TX00064704' -> 'TX00064704' | transaction_date: '29-09-2023' -> '2023-09-29' | quantity: '93' -> '93' | customer_id: 'CUST064704' -> 'CUST064704'
2026-01-12 12:10:24,772 - dq_comparison - INFO - DEBUG HASH STRING: text with#hashtags|TX00064704|2023-09-29|93|CUST064704...
2026-01-12 12:10:24,772 - dq_comparison - INFO - DEBUG HASH RESULT: b2b33768...
2026-01-12 12:10:24,773 - dq_comparison - INFO - DEBUG HASH ROW: description: 'Text with! exclamations' -> 'text with! exclamations' | transaction_id: 'TX00086088' -> 'TX00086088' | transaction_date: '31-12-2023' -> '2023-12-31' | quantity: '30' -> '30' | customer_id: 'CUST086088' -> 'CUST086088'
2026-01-12 12:10:24,774 - dq_comparison - INFO - DEBUG HASH STRING: text with! exclamations|TX00086088|2023-12-31|30|CUST086088...
2026-01-12 12:10:24,774 - dq_comparison - INFO - DEBUG HASH RESULT: cb384bad...
2026-01-12 12:10:24,775 - dq_comparison - INFO - DEBUG HASH ROW: description: 'Text with'apostrophes' -> 'text with'apostrophes' | transaction_id: 'TX00060583' -> 'TX00060583' | transaction_date: '24-07-2023' -> '2023-07-24' | quantity: '63' -> '63' | customer_id: 'CUST060583' -> 'CUST060583'
2026-01-12 12:10:24,776 - dq_comparison - INFO - DEBUG HASH STRING: text with'apostrophes|TX00060583|2023-07-24|63|CUST060583...
2026-01-12 12:10:24,776 - dq_comparison - INFO - DEBUG HASH RESULT: ba222340...
2026-01-12 12:10:24,777 - dq_comparison - INFO - DEBUG HASH ROW: description: 'Text with? questions' -> 'text with? questions' | transaction_id: 'TX00040822' -> 'TX00040822' | transaction_date: '28-03-2023' -> '2023-03-28' | quantity: '17' -> '17' | customer_id: 'CUST040822' -> 'CUST040822'
2026-01-12 12:10:24,777 - dq_comparison - INFO - DEBUG HASH STRING: text with? questions|TX00040822|2023-03-28|17|CUST040822...
2026-01-12 12:10:24,778 - dq_comparison - INFO - DEBUG HASH RESULT: 5d45c9c9...
2026-01-12 12:10:24,779 - dq_comparison - INFO - DEBUG HASH ROW: description: 'Text with(parentheses)' -> 'text with(parentheses)' | transaction_id: 'TX00084858' -> 'TX00084858' | transaction_date: '06-02-2023' -> '2023-02-06' | quantity: '84' -> '84' | customer_id: 'CUST084858' -> 'CUST084858'
2026-01-12 12:10:24,779 - dq_comparison - INFO - DEBUG HASH STRING: text with(parentheses)|TX00084858|2023-02-06|84|CUST084858...
2026-01-12 12:10:24,780 - dq_comparison - INFO - DEBUG HASH RESULT: 9167ebd5...
2026-01-12 12:10:24,780 - dq_comparison - INFO - DEBUG HASH ROW: description: '  Text with leading spaces' -> 'text with leading spaces' | transaction_id: 'TX00053122' -> 'TX00053122' | transaction_date: '04-03-2023' -> '2023-03-04' | quantity: '81' -> '81' | customer_id: 'CUST053122' -> 'CUST053122'
2026-01-12 12:10:24,781 - dq_comparison - INFO - DEBUG HASH STRING: text with leading spaces|TX00053122|2023-03-04|81|CUST053122...
2026-01-12 12:10:24,781 - dq_comparison - INFO - DEBUG HASH RESULT: 11cfec57...
2026-01-12 12:10:24,782 - dq_comparison - INFO - DEBUG HASH ROW: description: 'Text with! exclamations' -> 'text with! exclamations' | transaction_id: 'TX00031088' -> 'TX00031088' | transaction_date: '23-08-2023' -> '2023-08-23' | quantity: '1' -> '1' | customer_id: 'CUST031088' -> 'CUST031088'
2026-01-12 12:10:24,782 - dq_comparison - INFO - DEBUG HASH STRING: text with! exclamations|TX00031088|2023-08-23|1|CUST031088...
2026-01-12 12:10:24,783 - dq_comparison - INFO - DEBUG HASH RESULT: 1e0a6c9b...
2026-01-12 12:10:24,784 - dq_comparison - INFO - DEBUG HASH ROW: description: 'Text with|pipes' -> 'text with|pipes' | transaction_id: 'TX00019159' -> 'TX00019159' | transaction_date: '26-06-2023' -> '2023-06-26' | quantity: '45' -> '45' | customer_id: 'CUST019159' -> 'CUST019159'
2026-01-12 12:10:24,784 - dq_comparison - INFO - DEBUG HASH STRING: text with|pipes|TX00019159|2023-06-26|45|CUST019159...
2026-01-12 12:10:24,785 - dq_comparison - INFO - DEBUG HASH RESULT: dce36592...
2026-01-12 12:10:24,786 - dq_comparison - INFO - DEBUG HASH ROW: description: 'Text with@at signs' -> 'text with@at signs' | transaction_id: 'TX00081272' -> 'TX00081272' | transaction_date: '23-08-2023' -> '2023-08-23' | quantity: '19' -> '19' | customer_id: 'CUST081272' -> 'CUST081272'
2026-01-12 12:10:24,786 - dq_comparison - INFO - DEBUG HASH STRING: text with@at signs|TX00081272|2023-08-23|19|CUST081272...
2026-01-12 12:10:24,787 - dq_comparison - INFO - DEBUG HASH RESULT: 0435e752...
2026-01-12 12:10:24,788 - dq_comparison - INFO - DEBUG HASH ROW: description: 'Text with/slashes' -> 'text with/slashes' | transaction_id: 'TX00089334' -> 'TX00089334' | transaction_date: '16-08-2023' -> '2023-08-16' | quantity: '43' -> '43' | customer_id: 'CUST089334' -> 'CUST089334'
2026-01-12 12:10:24,788 - dq_comparison - INFO - DEBUG HASH STRING: text with/slashes|TX00089334|2023-08-16|43|CUST089334...
2026-01-12 12:10:24,789 - dq_comparison - INFO - DEBUG HASH RESULT: 91a276a7...
2026-01-12 12:10:24,790 - dq_comparison - INFO - DEBUG HASH ROW: description: 'Text with@at signs' -> 'text with@at signs' | transaction_id: 'TX00062409' -> 'TX00062409' | transaction_date: '14-11-2023' -> '2023-11-14' | quantity: '5' -> '5' | customer_id: 'CUST062409' -> 'CUST062409'
2026-01-12 12:10:24,790 - dq_comparison - INFO - DEBUG HASH STRING: text with@at signs|TX00062409|2023-11-14|5|CUST062409...
2026-01-12 12:10:24,791 - dq_comparison - INFO - DEBUG HASH RESULT: bb21a0ea...
2026-01-12 12:10:24,792 - dq_comparison - INFO - DEBUG HASH ROW: description: 'Text with@at signs' -> 'text with@at signs' | transaction_id: 'TX00000664' -> 'TX00000664' | transaction_date: '09-03-2023' -> '2023-03-09' | quantity: '52' -> '52' | customer_id: 'CUST000664' -> 'CUST000664'
2026-01-12 12:10:24,792 - dq_comparison - INFO - DEBUG HASH STRING: text with@at signs|TX00000664|2023-03-09|52|CUST000664...
2026-01-12 12:10:24,793 - dq_comparison - INFO - DEBUG HASH RESULT: fb575f95...
2026-01-12 12:10:24,794 - dq_comparison - INFO - DEBUG HASH ROW: description: 'Text with*asterisks' -> 'text with*asterisks' | transaction_id: 'TX00002119' -> 'TX00002119' | transaction_date: '30-01-2023' -> '2023-01-30' | quantity: '5' -> '5' | customer_id: 'CUST002119' -> 'CUST002119'
2026-01-12 12:10:24,794 - dq_comparison - INFO - DEBUG HASH STRING: text with*asterisks|TX00002119|2023-01-30|5|CUST002119...
2026-01-12 12:10:24,795 - dq_comparison - INFO - DEBUG HASH RESULT: 1abcbcfc...
2026-01-12 12:10:24,795 - dq_comparison - INFO - DEBUG HASH ROW: description: 'Text with[brackets]' -> 'text with[brackets]' | transaction_id: 'TX00014072' -> 'TX00014072' | transaction_date: '22-11-2023' -> '2023-11-22' | quantity: '71' -> '71' | customer_id: 'CUST014072' -> 'CUST014072'
2026-01-12 12:10:24,796 - dq_comparison - INFO - DEBUG HASH STRING: text with[brackets]|TX00014072|2023-11-22|71|CUST014072...
2026-01-12 12:10:24,797 - dq_comparison - INFO - DEBUG HASH RESULT: ebb7a296...
2026-01-12 12:10:24,797 - dq_comparison - INFO - DEBUG HASH ROW: description: 'Text with - dashes' -> 'text with - dashes' | transaction_id: 'TX00001131' -> 'TX00001131' | transaction_date: '05-03-2023' -> '2023-03-05' | quantity: '59' -> '59' | customer_id: 'CUST001131' -> 'CUST001131'
2026-01-12 12:10:24,798 - dq_comparison - INFO - DEBUG HASH STRING: text with - dashes|TX00001131|2023-03-05|59|CUST001131...
2026-01-12 12:10:24,798 - dq_comparison - INFO - DEBUG HASH RESULT: a678373d...
2026-01-12 12:10:24,799 - dq_comparison - INFO - DEBUG HASH ROW: description: 'Text with, commas' -> 'text with, commas' | transaction_id: 'TX00063220' -> 'TX00063220' | transaction_date: '16-10-2023' -> '2023-10-16' | quantity: '49' -> '49' | customer_id: 'CUST063220' -> 'CUST063220'
2026-01-12 12:10:24,799 - dq_comparison - INFO - DEBUG HASH STRING: text with, commas|TX00063220|2023-10-16|49|CUST063220...
2026-01-12 12:10:24,800 - dq_comparison - INFO - DEBUG HASH RESULT: 7d523597...
2026-01-12 12:10:24,801 - dq_comparison - INFO - DEBUG HASH ROW: description: 'Text with/slashes' -> 'text with/slashes' | transaction_id: 'TX00089033' -> 'TX00089033' | transaction_date: '13-01-2023' -> '2023-01-13' | quantity: '58' -> '58' | customer_id: 'CUST089033' -> 'CUST089033'
2026-01-12 12:10:24,801 - dq_comparison - INFO - DEBUG HASH STRING: text with/slashes|TX00089033|2023-01-13|58|CUST089033...
2026-01-12 12:10:24,802 - dq_comparison - INFO - DEBUG HASH RESULT: 660a6e9f...
2026-01-12 12:10:24,803 - dq_comparison - INFO - DEBUG HASH ROW: description: 'Text with@at signs' -> 'text with@at signs' | transaction_id: 'TX00060309' -> 'TX00060309' | transaction_date: '02-05-2023' -> '2023-05-02' | quantity: '27' -> '27' | customer_id: 'CUST060309' -> 'CUST060309'
2026-01-12 12:10:24,803 - dq_comparison - INFO - DEBUG HASH STRING: text with@at signs|TX00060309|2023-05-02|27|CUST060309...
2026-01-12 12:10:24,804 - dq_comparison - INFO - DEBUG HASH RESULT: aa7c1924...
2026-01-12 12:10:24,805 - dq_comparison - INFO - DEBUG HASH ROW: description: 'Text with. periods' -> 'text with. periods' | transaction_id: 'TX00022234' -> 'TX00022234' | transaction_date: '18-05-2023' -> '2023-05-18' | quantity: '90' -> '90' | customer_id: 'CUST022234' -> 'CUST022234'
2026-01-12 12:10:24,805 - dq_comparison - INFO - DEBUG HASH STRING: text with. periods|TX00022234|2023-05-18|90|CUST022234...
2026-01-12 12:10:24,806 - dq_comparison - INFO - DEBUG HASH RESULT: b754b2ea...
2026-01-12 12:10:24,807 - dq_comparison - INFO - DEBUG HASH ROW: description: 'Text with, commas' -> 'text with, commas' | transaction_id: 'TX00005398' -> 'TX00005398' | transaction_date: '05-06-2023' -> '2023-06-05' | quantity: '21' -> '21' | customer_id: 'CUST005398' -> 'CUST005398'
2026-01-12 12:10:24,807 - dq_comparison - INFO - DEBUG HASH STRING: text with, commas|TX00005398|2023-06-05|21|CUST005398...
2026-01-12 12:10:24,808 - dq_comparison - INFO - DEBUG HASH RESULT: 25025b1f...
2026-01-12 12:10:24,809 - dq_comparison - INFO - DEBUG HASH ROW: description: 'Text with! exclamations' -> 'text with! exclamations' | transaction_id: 'TX00077256' -> 'TX00077256' | transaction_date: '02/24/2023' -> '2023-02-24' | quantity: '54' -> '54' | customer_id: 'CUST077256' -> 'CUST077256'
2026-01-12 12:10:24,809 - dq_comparison - INFO - DEBUG HASH STRING: text with! exclamations|TX00077256|2023-02-24|54|CUST077256...
2026-01-12 12:10:24,810 - dq_comparison - INFO - DEBUG HASH RESULT: 27f2d5be...
2026-01-12 12:10:24,811 - dq_comparison - INFO - DEBUG HASH ROW: description: 'Text with'apostrophes' -> 'text with'apostrophes' | transaction_id: 'TX00070978' -> 'TX00070978' | transaction_date: '18-08-2023' -> '2023-08-18' | quantity: '42' -> '42' | customer_id: 'CUST070978' -> 'CUST070978'
2026-01-12 12:10:24,811 - dq_comparison - INFO - DEBUG HASH STRING: text with'apostrophes|TX00070978|2023-08-18|42|CUST070978...
2026-01-12 12:10:24,812 - dq_comparison - INFO - DEBUG HASH RESULT: ec181b15...
2026-01-12 12:10:24,813 - dq_comparison - INFO - DEBUG HASH ROW: description: '  Text with leading spaces' -> 'text with leading spaces' | transaction_id: 'TX00032047' -> 'TX00032047' | transaction_date: '10-06-2023' -> '2023-06-10' | quantity: '95' -> '95' | customer_id: 'CUST032047' -> 'CUST032047'
2026-01-12 12:10:24,813 - dq_comparison - INFO - DEBUG HASH STRING: text with leading spaces|TX00032047|2023-06-10|95|CUST032047...
2026-01-12 12:10:24,814 - dq_comparison - INFO - DEBUG HASH RESULT: f922cb2f...
2026-01-12 12:10:24,814 - dq_comparison - INFO - DEBUG HASH ROW: description: 'Text with& ampersands' -> 'text with& ampersands' | transaction_id: 'TX00077260' -> 'TX00077260' | transaction_date: '07-03-2023' -> '2023-03-07' | quantity: '48' -> '48' | customer_id: 'CUST077260' -> 'CUST077260'
2026-01-12 12:10:24,815 - dq_comparison - INFO - DEBUG HASH STRING: text with& ampersands|TX00077260|2023-03-07|48|CUST077260...
2026-01-12 12:10:24,816 - dq_comparison - INFO - DEBUG HASH RESULT: 00883e5b...
2026-01-12 12:10:24,817 - dq_comparison - INFO - DEBUG HASH ROW: description: 'Text with{braces}' -> 'text with{braces}' | transaction_id: 'TX00024669' -> 'TX00024669' | transaction_date: '19-08-2023' -> '2023-08-19' | quantity: '52' -> '52' | customer_id: 'CUST024669' -> 'CUST024669'
2026-01-12 12:10:24,817 - dq_comparison - INFO - DEBUG HASH STRING: text with{braces}|TX00024669|2023-08-19|52|CUST024669...
2026-01-12 12:10:24,817 - dq_comparison - INFO - DEBUG HASH RESULT: b28f184b...
2026-01-12 12:10:24,818 - dq_comparison - INFO - DEBUG HASH ROW: description: 'Text with*asterisks' -> 'text with*asterisks' | transaction_id: 'TX00027572' -> 'TX00027572' | transaction_date: '21-09-2023' -> '2023-09-21' | quantity: '73' -> '73' | customer_id: 'CUST027572' -> 'CUST027572'
2026-01-12 12:10:24,819 - dq_comparison - INFO - DEBUG HASH STRING: text with*asterisks|TX00027572|2023-09-21|73|CUST027572...
2026-01-12 12:10:24,819 - dq_comparison - INFO - DEBUG HASH RESULT: 2a699b18...
2026-01-12 12:10:24,820 - dq_comparison - INFO - DEBUG HASH ROW: description: 'Normal text without issues' -> 'normal text without issues' | transaction_id: 'TX00022004' -> 'TX00022004' | transaction_date: '01-06-2023' -> '2023-06-01' | quantity: '92' -> '92' | customer_id: 'CUST022004' -> 'CUST022004'
2026-01-12 12:10:24,820 - dq_comparison - INFO - DEBUG HASH STRING: normal text without issues|TX00022004|2023-06-01|92|CUST022004...
2026-01-12 12:10:24,821 - dq_comparison - INFO - DEBUG HASH RESULT: b5fc5201...
2026-01-12 12:10:24,822 - dq_comparison - INFO - DEBUG HASH ROW: description: 'Text with[brackets]' -> 'text with[brackets]' | transaction_id: 'TX00098338' -> 'TX00098338' | transaction_date: '22-11-2023' -> '2023-11-22' | quantity: '58' -> '58' | customer_id: 'CUST098338' -> 'CUST098338'
2026-01-12 12:10:24,822 - dq_comparison - INFO - DEBUG HASH STRING: text with[brackets]|TX00098338|2023-11-22|58|CUST098338...
2026-01-12 12:10:24,823 - dq_comparison - INFO - DEBUG HASH RESULT: 62bce3d2...
2026-01-12 12:10:24,824 - dq_comparison - INFO - DEBUG HASH ROW: description: 'Text with mixed CAPITAL and lowercase' -> 'text with mixed capital and lowercase' | transaction_id: 'TX00044259' -> 'TX00044259' | transaction_date: '10-01-2023' -> '2023-01-10' | quantity: '35' -> '35' | customer_id: 'CUST044259' -> 'CUST044259'
2026-01-12 12:10:24,824 - dq_comparison - INFO - DEBUG HASH STRING: text with mixed capital and lowercase|TX00044259|2023-01-10|35|CUST044259...
2026-01-12 12:10:24,825 - dq_comparison - INFO - DEBUG HASH RESULT: 23f0f875...
2026-01-12 12:10:24,825 - dq_comparison - INFO - DEBUG HASH ROW: description: 'Text with	tabs' -> 'text with tabs' | transaction_id: 'TX00005621' -> 'TX00005621' | transaction_date: '06/29/2023' -> '2023-06-29' | quantity: '62' -> '62' | customer_id: 'CUST005621' -> 'CUST005621'
2026-01-12 12:10:24,827 - dq_comparison - INFO - DEBUG HASH STRING: text with tabs|TX00005621|2023-06-29|62|CUST005621...
2026-01-12 12:10:24,828 - dq_comparison - INFO - DEBUG HASH RESULT: 72f83966...
2026-01-12 12:10:24,829 - dq_comparison - INFO - DEBUG HASH ROW: description: 'Text with*asterisks' -> 'text with*asterisks' | transaction_id: 'TX00031953' -> 'TX00031953' | transaction_date: '18-04-2023' -> '2023-04-18' | quantity: '77' -> '77' | customer_id: 'CUST031953' -> 'CUST031953'
2026-01-12 12:10:24,829 - dq_comparison - INFO - DEBUG HASH STRING: text with*asterisks|TX00031953|2023-04-18|77|CUST031953...
2026-01-12 12:10:24,830 - dq_comparison - INFO - DEBUG HASH RESULT: f8cfc082...
2026-01-12 12:10:24,831 - dq_comparison - INFO - DEBUG HASH ROW: description: 'Text with. periods' -> 'text with. periods' | transaction_id: 'TX00087303' -> 'TX00087303' | transaction_date: '09-11-2023' -> '2023-11-09' | quantity: '16' -> '16' | customer_id: 'CUST087303' -> 'CUST087303'
2026-01-12 12:10:24,832 - dq_comparison - INFO - DEBUG HASH STRING: text with. periods|TX00087303|2023-11-09|16|CUST087303...
2026-01-12 12:10:24,832 - dq_comparison - INFO - DEBUG HASH RESULT: 1a25ac15...
2026-01-12 12:10:24,834 - dq_comparison - INFO - DEBUG HASH ROW: description: 'Text with& ampersands' -> 'text with& ampersands' | transaction_id: 'TX00015065' -> 'TX00015065' | transaction_date: '13-07-2023' -> '2023-07-13' | quantity: '69' -> '69' | customer_id: 'CUST015065' -> 'CUST015065'
2026-01-12 12:10:24,834 - dq_comparison - INFO - DEBUG HASH STRING: text with& ampersands|TX00015065|2023-07-13|69|CUST015065...
2026-01-12 12:10:24,834 - dq_comparison - INFO - DEBUG HASH RESULT: 22ea448f...
2026-01-12 12:10:24,835 - dq_comparison - INFO - DEBUG HASH ROW: description: 'Text with! exclamations' -> 'text with! exclamations' | transaction_id: 'TX00001239' -> 'TX00001239' | transaction_date: '08-12-2023' -> '2023-12-08' | quantity: '47' -> '47' | customer_id: 'CUST001239' -> 'CUST001239'
2026-01-12 12:10:24,836 - dq_comparison - INFO - DEBUG HASH STRING: text with! exclamations|TX00001239|2023-12-08|47|CUST001239...
2026-01-12 12:10:24,836 - dq_comparison - INFO - DEBUG HASH RESULT: 17d7be72...
2026-01-12 12:10:24,837 - dq_comparison - INFO - DEBUG HASH ROW: description: '  Text with leading spaces' -> 'text with leading spaces' | transaction_id: 'TX00006660' -> 'TX00006660' | transaction_date: '24-12-2023' -> '2023-12-24' | quantity: '40' -> '40' | customer_id: 'CUST006660' -> 'CUST006660'
2026-01-12 12:10:24,837 - dq_comparison - INFO - DEBUG HASH STRING: text with leading spaces|TX00006660|2023-12-24|40|CUST006660...
2026-01-12 12:10:24,838 - dq_comparison - INFO - DEBUG HASH RESULT: 1c1b0779...
2026-01-12 12:10:24,839 - dq_comparison - INFO - DEBUG HASH ROW: description: 'Text with@at signs' -> 'text with@at signs' | transaction_id: 'TX00059758' -> 'TX00059758' | transaction_date: '30-11-2023' -> '2023-11-30' | quantity: '82' -> '82' | customer_id: 'CUST059758' -> 'CUST059758'
2026-01-12 12:10:24,839 - dq_comparison - INFO - DEBUG HASH STRING: text with@at signs|TX00059758|2023-11-30|82|CUST059758...
2026-01-12 12:10:24,840 - dq_comparison - INFO - DEBUG HASH RESULT: fd5a68a8...
2026-01-12 12:10:24,840 - dq_comparison - INFO - DEBUG HASH ROW: description: 'Text with@at signs' -> 'text with@at signs' | transaction_id: 'TX00006110' -> 'TX00006110' | transaction_date: '31-08-2023' -> '2023-08-31' | quantity: '33' -> '33' | customer_id: 'CUST006110' -> 'CUST006110'
2026-01-12 12:10:24,841 - dq_comparison - INFO - DEBUG HASH STRING: text with@at signs|TX00006110|2023-08-31|33|CUST006110...
2026-01-12 12:10:24,841 - dq_comparison - INFO - DEBUG HASH RESULT: 6062dbbb...
2026-01-12 12:10:24,842 - dq_comparison - INFO - DEBUG HASH ROW: description: 'Text with trailing spaces  ' -> 'text with trailing spaces' | transaction_id: 'TX00090152' -> 'TX00090152' | transaction_date: '06-09-2023' -> '2023-09-06' | quantity: '26' -> '26' | customer_id: 'CUST090152' -> 'CUST090152'
2026-01-12 12:10:24,842 - dq_comparison - INFO - DEBUG HASH STRING: text with trailing spaces|TX00090152|2023-09-06|26|CUST090152...
2026-01-12 12:10:24,843 - dq_comparison - INFO - DEBUG HASH RESULT: 4393c80e...
2026-01-12 12:10:24,844 - dq_comparison - INFO - DEBUG HASH ROW: description: 'Text with[brackets]' -> 'text with[brackets]' | transaction_id: 'TX00055216' -> 'TX00055216' | transaction_date: '04/18/2023' -> '2023-04-18' | quantity: '70' -> '70' | customer_id: 'CUST055216' -> 'CUST055216'
2026-01-12 12:10:24,845 - dq_comparison - INFO - DEBUG HASH STRING: text with[brackets]|TX00055216|2023-04-18|70|CUST055216...
2026-01-12 12:10:24,846 - dq_comparison - INFO - DEBUG HASH RESULT: 4d159ea3...
2026-01-12 12:10:24,846 - dq_comparison - INFO - DEBUG HASH ROW: description: 'Text with, commas' -> 'text with, commas' | transaction_id: 'TX00082721' -> 'TX00082721' | transaction_date: '16-01-2023' -> '2023-01-16' | quantity: '7' -> '7' | customer_id: 'CUST082721' -> 'CUST082721'
2026-01-12 12:10:24,847 - dq_comparison - INFO - DEBUG HASH STRING: text with, commas|TX00082721|2023-01-16|7|CUST082721...
2026-01-12 12:10:24,848 - dq_comparison - INFO - DEBUG HASH RESULT: ec5fff84...
2026-01-12 12:10:24,848 - dq_comparison - INFO - DEBUG HASH ROW: description: 'Text with, commas' -> 'text with, commas' | transaction_id: 'TX00015584' -> 'TX00015584' | transaction_date: '13-01-2023' -> '2023-01-13' | quantity: '8' -> '8' | customer_id: 'CUST015584' -> 'CUST015584'
2026-01-12 12:10:24,849 - dq_comparison - INFO - DEBUG HASH STRING: text with, commas|TX00015584|2023-01-13|8|CUST015584...
2026-01-12 12:10:24,849 - dq_comparison - INFO - DEBUG HASH RESULT: 44242438...
2026-01-12 12:10:24,850 - dq_comparison - INFO - DEBUG HASH ROW: description: 'Text with	tabs' -> 'text with tabs' | transaction_id: 'TX00038893' -> 'TX00038893' | transaction_date: '22-07-2023' -> '2023-07-22' | quantity: '33' -> '33' | customer_id: 'CUST038893' -> 'CUST038893'
2026-01-12 12:10:24,851 - dq_comparison - INFO - DEBUG HASH STRING: text with tabs|TX00038893|2023-07-22|33|CUST038893...
2026-01-12 12:10:24,851 - dq_comparison - INFO - DEBUG HASH RESULT: 4575322c...
2026-01-12 12:10:24,852 - dq_comparison - INFO - DEBUG HASH ROW: description: 'Text with%percent signs' -> 'text with%percent signs' | transaction_id: 'TX00091787' -> 'TX00091787' | transaction_date: '24-04-2023' -> '2023-04-24' | quantity: '10' -> '10' | customer_id: 'CUST091787' -> 'CUST091787'
2026-01-12 12:10:24,853 - dq_comparison - INFO - DEBUG HASH STRING: text with%percent signs|TX00091787|2023-04-24|10|CUST091787...
2026-01-12 12:10:24,853 - dq_comparison - INFO - DEBUG HASH RESULT: 79efcf67...
2026-01-12 12:10:24,854 - dq_comparison - INFO - DEBUG HASH ROW: description: 'Text with"quotes"' -> 'text with"quotes"' | transaction_id: 'TX00089611' -> 'TX00089611' | transaction_date: '28-08-2023' -> '2023-08-28' | quantity: '35' -> '35' | customer_id: 'CUST089611' -> 'CUST089611'
2026-01-12 12:10:24,855 - dq_comparison - INFO - DEBUG HASH STRING: text with"quotes"|TX00089611|2023-08-28|35|CUST089611...
2026-01-12 12:10:24,855 - dq_comparison - INFO - DEBUG HASH RESULT: 48ab654a...
2026-01-12 12:10:24,856 - dq_comparison - INFO - DEBUG HASH ROW: description: 'Text with`backticks' -> 'text with`backticks' | transaction_id: 'TX00081985' -> 'TX00081985' | transaction_date: '10-10-2023' -> '2023-10-10' | quantity: '68' -> '68' | customer_id: 'CUST081985' -> 'CUST081985'
2026-01-12 12:10:24,857 - dq_comparison - INFO - DEBUG HASH STRING: text with`backticks|TX00081985|2023-10-10|68|CUST081985...
2026-01-12 12:10:24,857 - dq_comparison - INFO - DEBUG HASH RESULT: 2e57f958...
2026-01-12 12:10:24,858 - dq_comparison - INFO - DEBUG HASH ROW: description: 'Text with"quotes"' -> 'text with"quotes"' | transaction_id: 'TX00048323' -> 'TX00048323' | transaction_date: '07-12-2023' -> '2023-12-07' | quantity: '12' -> '12' | customer_id: 'CUST048323' -> 'CUST048323'
2026-01-12 12:10:24,858 - dq_comparison - INFO - DEBUG HASH STRING: text with"quotes"|TX00048323|2023-12-07|12|CUST048323...
2026-01-12 12:10:24,859 - dq_comparison - INFO - DEBUG HASH RESULT: ab93d55e...
2026-01-12 12:10:24,860 - dq_comparison - INFO - DEBUG HASH ROW: description: 'Text with
newlines' -> 'text with newlines' | transaction_id: 'TX00058169' -> 'TX00058169' | transaction_date: '11-01-2023' -> '2023-01-11' | quantity: '71' -> '71' | customer_id: 'CUST058169' -> 'CUST058169'
2026-01-12 12:10:24,860 - dq_comparison - INFO - DEBUG HASH STRING: text with newlines|TX00058169|2023-01-11|71|CUST058169...
2026-01-12 12:10:24,861 - dq_comparison - INFO - DEBUG HASH RESULT: 8051fc50...
2026-01-12 12:10:24,862 - dq_comparison - INFO - DEBUG HASH ROW: description: 'Text with'apostrophes' -> 'text with'apostrophes' | transaction_id: 'TX00061672' -> 'TX00061672' | transaction_date: '19-09-2023' -> '2023-09-19' | quantity: '99' -> '99' | customer_id: 'CUST061672' -> 'CUST061672'
2026-01-12 12:10:24,862 - dq_comparison - INFO - DEBUG HASH STRING: text with'apostrophes|TX00061672|2023-09-19|99|CUST061672...
2026-01-12 12:10:24,863 - dq_comparison - INFO - DEBUG HASH RESULT: 42fa14f7...
2026-01-12 12:10:24,864 - dq_comparison - INFO - DEBUG HASH ROW: description: 'Text with~tildes' -> 'text with~tildes' | transaction_id: 'TX00067443' -> 'TX00067443' | transaction_date: '22-11-2023' -> '2023-11-22' | quantity: '95' -> '95' | customer_id: 'CUST067443' -> 'CUST067443'
2026-01-12 12:10:24,864 - dq_comparison - INFO - DEBUG HASH STRING: text with~tildes|TX00067443|2023-11-22|95|CUST067443...
2026-01-12 12:10:24,865 - dq_comparison - INFO - DEBUG HASH RESULT: b770331e...
2026-01-12 12:10:24,866 - dq_comparison - INFO - DEBUG HASH ROW: description: 'Text with<angle brackets>' -> 'text with<angle brackets>' | transaction_id: 'TX00085537' -> 'TX00085537' | transaction_date: '22-05-2023' -> '2023-05-22' | quantity: '12' -> '12' | customer_id: 'CUST085537' -> 'CUST085537'
2026-01-12 12:10:24,866 - dq_comparison - INFO - DEBUG HASH STRING: text with<angle brackets>|TX00085537|2023-05-22|12|CUST085537...
2026-01-12 12:10:24,867 - dq_comparison - INFO - DEBUG HASH RESULT: b81b3073...
2026-01-12 12:10:24,868 - dq_comparison - INFO - DEBUG HASH ROW: description: 'Text with! exclamations' -> 'text with! exclamations' | transaction_id: 'TX00087778' -> 'TX00087778' | transaction_date: '20-11-2023' -> '2023-11-20' | quantity: '42' -> '42' | customer_id: 'CUST087778' -> 'CUST087778'
2026-01-12 12:10:24,868 - dq_comparison - INFO - DEBUG HASH STRING: text with! exclamations|TX00087778|2023-11-20|42|CUST087778...
2026-01-12 12:10:24,869 - dq_comparison - INFO - DEBUG HASH RESULT: 631feb5e...
2026-01-12 12:10:24,870 - dq_comparison - INFO - DEBUG HASH ROW: description: 'Text with'apostrophes' -> 'text with'apostrophes' | transaction_id: 'TX00077953' -> 'TX00077953' | transaction_date: '07-12-2023' -> '2023-12-07' | quantity: '86' -> '86' | customer_id: 'CUST077953' -> 'CUST077953'
2026-01-12 12:10:24,870 - dq_comparison - INFO - DEBUG HASH STRING: text with'apostrophes|TX00077953|2023-12-07|86|CUST077953...
2026-01-12 12:10:24,871 - dq_comparison - INFO - DEBUG HASH RESULT: 22bfae91...
2026-01-12 12:10:24,872 - dq_comparison - INFO - DEBUG HASH ROW: description: 'Text with~tildes' -> 'text with~tildes' | transaction_id: 'TX00006662' -> 'TX00006662' | transaction_date: '10-09-2023' -> '2023-09-10' | quantity: '75' -> '75' | customer_id: 'CUST006662' -> 'CUST006662'
2026-01-12 12:10:24,872 - dq_comparison - INFO - DEBUG HASH STRING: text with~tildes|TX00006662|2023-09-10|75|CUST006662...
2026-01-12 12:10:24,873 - dq_comparison - INFO - DEBUG HASH RESULT: 12c2c7ca...
2026-01-12 12:10:24,874 - dq_comparison - INFO - DEBUG HASH ROW: description: 'Text with	tabs' -> 'text with tabs' | transaction_id: 'TX00006968' -> 'TX00006968' | transaction_date: '24-02-2023' -> '2023-02-24' | quantity: '81' -> '81' | customer_id: 'CUST006968' -> 'CUST006968'
2026-01-12 12:10:24,874 - dq_comparison - INFO - DEBUG HASH STRING: text with tabs|TX00006968|2023-02-24|81|CUST006968...
2026-01-12 12:10:24,875 - dq_comparison - INFO - DEBUG HASH RESULT: 999cb44d...
2026-01-12 12:10:24,875 - dq_comparison - INFO - DEBUG HASH ROW: description: 'Text with(parentheses)' -> 'text with(parentheses)' | transaction_id: 'TX00039428' -> 'TX00039428' | transaction_date: '03-09-2023' -> '2023-09-03' | quantity: '8' -> '8' | customer_id: 'CUST039428' -> 'CUST039428'
2026-01-12 12:10:24,876 - dq_comparison - INFO - DEBUG HASH STRING: text with(parentheses)|TX00039428|2023-09-03|8|CUST039428...
2026-01-12 12:10:24,876 - dq_comparison - INFO - DEBUG HASH RESULT: da57b679...
2026-01-12 12:10:24,877 - dq_comparison - INFO - DEBUG HASH ROW: description: 'Text with  multiple   spaces' -> 'text with multiple spaces' | transaction_id: 'TX00018281' -> 'TX00018281' | transaction_date: '09/19/2023' -> '2023-09-19' | quantity: '40' -> '40' | customer_id: 'CUST018281' -> 'CUST018281'
2026-01-12 12:10:24,878 - dq_comparison - INFO - DEBUG HASH STRING: text with multiple spaces|TX00018281|2023-09-19|40|CUST018281...
2026-01-12 12:10:24,878 - dq_comparison - INFO - DEBUG HASH RESULT: 8c86f59c...
2026-01-12 12:10:24,879 - dq_comparison - INFO - DEBUG HASH ROW: description: 'Text with%percent signs' -> 'text with%percent signs' | transaction_id: 'TX00091741' -> 'TX00091741' | transaction_date: '05-03-2023' -> '2023-03-05' | quantity: '59' -> '59' | customer_id: 'CUST091741' -> 'CUST091741'
2026-01-12 12:10:24,880 - dq_comparison - INFO - DEBUG HASH STRING: text with%percent signs|TX00091741|2023-03-05|59|CUST091741...
2026-01-12 12:10:24,880 - dq_comparison - INFO - DEBUG HASH RESULT: 4aa4b232...
2026-01-12 12:10:24,881 - dq_comparison - INFO - DEBUG HASH ROW: description: 'Text with~tildes' -> 'text with~tildes' | transaction_id: 'TX00050512' -> 'TX00050512' | transaction_date: '01-08-2023' -> '2023-08-01' | quantity: '38' -> '38' | customer_id: 'CUST050512' -> 'CUST050512'
2026-01-12 12:10:24,882 - dq_comparison - INFO - DEBUG HASH STRING: text with~tildes|TX00050512|2023-08-01|38|CUST050512...
2026-01-12 12:10:24,882 - dq_comparison - INFO - DEBUG HASH RESULT: f5df9a57...
2026-01-12 12:10:24,883 - dq_comparison - INFO - DEBUG HASH ROW: description: 'Text with@at signs' -> 'text with@at signs' | transaction_id: 'TX00050702' -> 'TX00050702' | transaction_date: '10-08-2023' -> '2023-08-10' | quantity: '18' -> '18' | customer_id: 'CUST050702' -> 'CUST050702'
2026-01-12 12:10:24,884 - dq_comparison - INFO - DEBUG HASH STRING: text with@at signs|TX00050702|2023-08-10|18|CUST050702...
2026-01-12 12:10:24,884 - dq_comparison - INFO - DEBUG HASH RESULT: 4eb45ea0...
2026-01-12 12:10:24,885 - dq_comparison - INFO - DEBUG HASH ROW: description: 'Text with? questions' -> 'text with? questions' | transaction_id: 'TX00012304' -> 'TX00012304' | transaction_date: '04-12-2023' -> '2023-12-04' | quantity: '78' -> '78' | customer_id: 'CUST012304' -> 'CUST012304'
2026-01-12 12:10:24,886 - dq_comparison - INFO - DEBUG HASH STRING: text with? questions|TX00012304|2023-12-04|78|CUST012304...
2026-01-12 12:10:24,886 - dq_comparison - INFO - DEBUG HASH RESULT: 675d4639...
2026-01-12 12:10:24,887 - dq_comparison - INFO - DEBUG HASH ROW: description: 'Text with? questions' -> 'text with? questions' | transaction_id: 'TX00081994' -> 'TX00081994' | transaction_date: '20-01-2023' -> '2023-01-20' | quantity: '44' -> '44' | customer_id: 'CUST081994' -> 'CUST081994'
2026-01-12 12:10:24,887 - dq_comparison - INFO - DEBUG HASH STRING: text with? questions|TX00081994|2023-01-20|44|CUST081994...
2026-01-12 12:10:24,888 - dq_comparison - INFO - DEBUG HASH RESULT: fd8d96f5...
2026-01-12 12:10:24,889 - dq_comparison - INFO - DEBUG HASH ROW: description: 'Text with"quotes"' -> 'text with"quotes"' | transaction_id: 'TX00015304' -> 'TX00015304' | transaction_date: '23-06-2023' -> '2023-06-23' | quantity: '58' -> '58' | customer_id: 'CUST015304' -> 'CUST015304'
2026-01-12 12:10:24,889 - dq_comparison - INFO - DEBUG HASH STRING: text with"quotes"|TX00015304|2023-06-23|58|CUST015304...
2026-01-12 12:10:24,890 - dq_comparison - INFO - DEBUG HASH RESULT: 357f378a...
2026-01-12 12:10:24,891 - dq_comparison - INFO - DEBUG HASH ROW: description: 'Text with/slashes' -> 'text with/slashes' | transaction_id: 'TX00073538' -> 'TX00073538' | transaction_date: '28-02-2023' -> '2023-02-28' | quantity: '21' -> '21' | customer_id: 'CUST073538' -> 'CUST073538'
2026-01-12 12:10:24,891 - dq_comparison - INFO - DEBUG HASH STRING: text with/slashes|TX00073538|2023-02-28|21|CUST073538...
2026-01-12 12:10:24,892 - dq_comparison - INFO - DEBUG HASH RESULT: 1abe6748...
2026-01-12 12:10:24,893 - dq_comparison - INFO - DEBUG HASH ROW: description: 'Text with
newlines' -> 'text with newlines' | transaction_id: 'TX00022033' -> 'TX00022033' | transaction_date: '12-11-2023' -> '2023-11-12' | quantity: '55' -> '55' | customer_id: 'CUST022033' -> 'CUST022033'
2026-01-12 12:10:24,893 - dq_comparison - INFO - DEBUG HASH STRING: text with newlines|TX00022033|2023-11-12|55|CUST022033...
2026-01-12 12:10:24,894 - dq_comparison - INFO - DEBUG HASH RESULT: 25196941...
2026-01-12 12:10:24,895 - dq_comparison - INFO - DEBUG HASH ROW: description: 'Text with~tildes' -> 'text with~tildes' | transaction_id: 'TX00071613' -> 'TX00071613' | transaction_date: '22-01-2023' -> '2023-01-22' | quantity: '74' -> '74' | customer_id: 'CUST071613' -> 'CUST071613'
2026-01-12 12:10:24,895 - dq_comparison - INFO - DEBUG HASH STRING: text with~tildes|TX00071613|2023-01-22|74|CUST071613...
2026-01-12 12:10:24,896 - dq_comparison - INFO - DEBUG HASH RESULT: b6c71a4d...
2026-01-12 12:10:24,897 - dq_comparison - INFO - DEBUG HASH ROW: description: 'Text with"quotes"' -> 'text with"quotes"' | transaction_id: 'TX00089698' -> 'TX00089698' | transaction_date: '03-10-2023' -> '2023-10-03' | quantity: '58' -> '58' | customer_id: 'CUST089698' -> 'CUST089698'
2026-01-12 12:10:24,897 - dq_comparison - INFO - DEBUG HASH STRING: text with"quotes"|TX00089698|2023-10-03|58|CUST089698...
2026-01-12 12:10:24,898 - dq_comparison - INFO - DEBUG HASH RESULT: bf4d3d69...
2026-01-12 12:10:24,899 - dq_comparison - INFO - DEBUG HASH ROW: description: 'Text with; semicolons' -> 'text with; semicolons' | transaction_id: 'TX00027950' -> 'TX00027950' | transaction_date: '08-05-2023' -> '2023-05-08' | quantity: '75' -> '75' | customer_id: 'CUST027950' -> 'CUST027950'
2026-01-12 12:10:24,899 - dq_comparison - INFO - DEBUG HASH STRING: text with; semicolons|TX00027950|2023-05-08|75|CUST027950...
2026-01-12 12:10:24,900 - dq_comparison - INFO - DEBUG HASH RESULT: 6e6a2b23...
2026-01-12 12:10:24,901 - dq_comparison - INFO - DEBUG HASH ROW: description: 'Text with; semicolons' -> 'text with; semicolons' | transaction_id: 'TX00039236' -> 'TX00039236' | transaction_date: '10/25/2023' -> '2023-10-25' | quantity: '47' -> '47' | customer_id: 'CUST039236' -> 'CUST039236'
2026-01-12 12:10:24,901 - dq_comparison - INFO - DEBUG HASH STRING: text with; semicolons|TX00039236|2023-10-25|47|CUST039236...
2026-01-12 12:10:24,902 - dq_comparison - INFO - DEBUG HASH RESULT: 61d0fe6b...
2026-01-12 12:10:24,902 - dq_comparison - INFO - DEBUG HASH ROW: description: 'Normal text without issues' -> 'normal text without issues' | transaction_id: 'TX00070460' -> 'TX00070460' | transaction_date: '03-09-2023' -> '2023-09-03' | quantity: '84' -> '84' | customer_id: 'CUST070460' -> 'CUST070460'
2026-01-12 12:10:24,903 - dq_comparison - INFO - DEBUG HASH STRING: normal text without issues|TX00070460|2023-09-03|84|CUST070460...
2026-01-12 12:10:24,904 - dq_comparison - INFO - DEBUG HASH RESULT: b57fcb8e...
2026-01-12 12:10:24,905 - dq_comparison - INFO - DEBUG HASH ROW: description: 'Text with(parentheses)' -> 'text with(parentheses)' | transaction_id: 'TX00041099' -> 'TX00041099' | transaction_date: '08-11-2023' -> '2023-11-08' | quantity: '69' -> '69' | customer_id: 'CUST041099' -> 'CUST041099'
2026-01-12 12:10:24,906 - dq_comparison - INFO - DEBUG HASH STRING: text with(parentheses)|TX00041099|2023-11-08|69|CUST041099...
2026-01-12 12:10:24,906 - dq_comparison - INFO - DEBUG HASH RESULT: 44d6af09...
2026-01-12 12:10:24,907 - dq_comparison - INFO - DEBUG HASH ROW: description: 'Text with~tildes' -> 'text with~tildes' | transaction_id: 'TX00047453' -> 'TX00047453' | transaction_date: '20-07-2023' -> '2023-07-20' | quantity: '97' -> '97' | customer_id: 'CUST047453' -> 'CUST047453'
2026-01-12 12:10:24,908 - dq_comparison - INFO - DEBUG HASH STRING: text with~tildes|TX00047453|2023-07-20|97|CUST047453...
2026-01-12 12:10:24,909 - dq_comparison - INFO - DEBUG HASH RESULT: 34f039ca...
2026-01-12 12:10:24,909 - dq_comparison - INFO - DEBUG HASH ROW: description: 'Text with& ampersands' -> 'text with& ampersands' | transaction_id: 'TX00075097' -> 'TX00075097' | transaction_date: '06-06-2023' -> '2023-06-06' | quantity: '2' -> '2' | customer_id: 'CUST075097' -> 'CUST075097'
2026-01-12 12:10:24,910 - dq_comparison - INFO - DEBUG HASH STRING: text with& ampersands|TX00075097|2023-06-06|2|CUST075097...
2026-01-12 12:10:24,910 - dq_comparison - INFO - DEBUG HASH RESULT: 22cbb936...
2026-01-12 12:10:24,911 - dq_comparison - INFO - DEBUG HASH ROW: description: 'Text with_underscores' -> 'text with_underscores' | transaction_id: 'TX00032629' -> 'TX00032629' | transaction_date: '21-10-2023' -> '2023-10-21' | quantity: '76' -> '76' | customer_id: 'CUST032629' -> 'CUST032629'
2026-01-12 12:10:24,912 - dq_comparison - INFO - DEBUG HASH STRING: text with_underscores|TX00032629|2023-10-21|76|CUST032629...
2026-01-12 12:10:24,912 - dq_comparison - INFO - DEBUG HASH RESULT: 469967fe...
2026-01-12 12:10:24,913 - dq_comparison - INFO - DEBUG HASH ROW: description: 'Text with, commas' -> 'text with, commas' | transaction_id: 'TX00071780' -> 'TX00071780' | transaction_date: '03-07-2023' -> '2023-07-03' | quantity: '68' -> '68' | customer_id: 'CUST071780' -> 'CUST071780'
2026-01-12 12:10:24,915 - dq_comparison - INFO - DEBUG HASH STRING: text with, commas|TX00071780|2023-07-03|68|CUST071780...
2026-01-12 12:10:24,915 - dq_comparison - INFO - DEBUG HASH RESULT: 32337639...
2026-01-12 12:10:24,917 - dq_comparison - INFO - DEBUG HASH ROW: description: 'Text with  multiple   spaces' -> 'text with multiple spaces' | transaction_id: 'TX00063961' -> 'TX00063961' | transaction_date: '11-12-2023' -> '2023-12-11' | quantity: '11' -> '11' | customer_id: 'CUST063961' -> 'CUST063961'
2026-01-12 12:10:24,918 - dq_comparison - INFO - DEBUG HASH STRING: text with multiple spaces|TX00063961|2023-12-11|11|CUST063961...
2026-01-12 12:10:24,918 - dq_comparison - INFO - DEBUG HASH RESULT: b2b7f603...
2026-01-12 12:10:24,919 - dq_comparison - INFO - DEBUG HASH ROW: description: 'Text with~tildes' -> 'text with~tildes' | transaction_id: 'TX00015325' -> 'TX00015325' | transaction_date: '23-03-2023' -> '2023-03-23' | quantity: '69' -> '69' | customer_id: 'CUST015325' -> 'CUST015325'
2026-01-12 12:10:24,920 - dq_comparison - INFO - DEBUG HASH STRING: text with~tildes|TX00015325|2023-03-23|69|CUST015325...
2026-01-12 12:10:24,921 - dq_comparison - INFO - DEBUG HASH RESULT: ca039b50...
2026-01-12 12:10:24,923 - dq_comparison - INFO - DEBUG HASH ROW: description: 'Text with%percent signs' -> 'text with%percent signs' | transaction_id: 'TX00021388' -> 'TX00021388' | transaction_date: '24-07-2023' -> '2023-07-24' | quantity: '68' -> '68' | customer_id: 'CUST021388' -> 'CUST021388'
2026-01-12 12:10:24,923 - dq_comparison - INFO - DEBUG HASH STRING: text with%percent signs|TX00021388|2023-07-24|68|CUST021388...
2026-01-12 12:10:24,924 - dq_comparison - INFO - DEBUG HASH RESULT: 9c69bbcc...
2026-01-12 12:10:24,926 - dq_comparison - INFO - DEBUG HASH ROW: description: 'Text with[brackets]' -> 'text with[brackets]' | transaction_id: 'TX00058921' -> 'TX00058921' | transaction_date: '12/19/2023' -> '2023-12-19' | quantity: '82' -> '82' | customer_id: 'CUST058921' -> 'CUST058921'
2026-01-12 12:10:24,926 - dq_comparison - INFO - DEBUG HASH STRING: text with[brackets]|TX00058921|2023-12-19|82|CUST058921...
2026-01-12 12:10:24,927 - dq_comparison - INFO - DEBUG HASH RESULT: ce0af319...
2026-01-12 12:10:24,928 - dq_comparison - INFO - DEBUG HASH ROW: description: 'Text with? questions' -> 'text with? questions' | transaction_id: 'TX00010961' -> 'TX00010961' | transaction_date: '02-11-2023' -> '2023-11-02' | quantity: '100' -> '100' | customer_id: 'CUST010961' -> 'CUST010961'
2026-01-12 12:10:24,929 - dq_comparison - INFO - DEBUG HASH STRING: text with? questions|TX00010961|2023-11-02|100|CUST010961...
2026-01-12 12:10:24,930 - dq_comparison - INFO - DEBUG HASH RESULT: 954a638a...
2026-01-12 12:10:24,931 - dq_comparison - INFO - DEBUG HASH ROW: description: 'Text with"quotes"' -> 'text with"quotes"' | transaction_id: 'TX00083590' -> 'TX00083590' | transaction_date: '01-08-2023' -> '2023-08-01' | quantity: '21' -> '21' | customer_id: 'CUST083590' -> 'CUST083590'
2026-01-12 12:10:24,931 - dq_comparison - INFO - DEBUG HASH STRING: text with"quotes"|TX00083590|2023-08-01|21|CUST083590...
2026-01-12 12:10:24,932 - dq_comparison - INFO - DEBUG HASH RESULT: bdc73892...
2026-01-12 12:10:24,933 - dq_comparison - INFO - DEBUG HASH ROW: description: 'Text with  multiple   spaces' -> 'text with multiple spaces' | transaction_id: 'TX00071153' -> 'TX00071153' | transaction_date: '03-12-2023' -> '2023-12-03' | quantity: '67' -> '67' | customer_id: 'CUST071153' -> 'CUST071153'
2026-01-12 12:10:24,933 - dq_comparison - INFO - DEBUG HASH STRING: text with multiple spaces|TX00071153|2023-12-03|67|CUST071153...
2026-01-12 12:10:24,935 - dq_comparison - INFO - DEBUG HASH RESULT: 84252be7...
2026-01-12 12:10:24,936 - dq_comparison - INFO - DEBUG HASH ROW: description: 'Text with*asterisks' -> 'text with*asterisks' | transaction_id: 'TX00030012' -> 'TX00030012' | transaction_date: '23-11-2023' -> '2023-11-23' | quantity: '1' -> '1' | customer_id: 'CUST030012' -> 'CUST030012'
2026-01-12 12:10:24,936 - dq_comparison - INFO - DEBUG HASH STRING: text with*asterisks|TX00030012|2023-11-23|1|CUST030012...
2026-01-12 12:10:24,937 - dq_comparison - INFO - DEBUG HASH RESULT: d2aa2bea...
2026-01-12 12:10:24,938 - dq_comparison - INFO - DEBUG HASH ROW: description: 'Text with. periods' -> 'text with. periods' | transaction_id: 'TX00092825' -> 'TX00092825' | transaction_date: '31-10-2023' -> '2023-10-31' | quantity: '52' -> '52' | customer_id: 'CUST092825' -> 'CUST092825'
2026-01-12 12:10:24,939 - dq_comparison - INFO - DEBUG HASH STRING: text with. periods|TX00092825|2023-10-31|52|CUST092825...
2026-01-12 12:10:24,939 - dq_comparison - INFO - DEBUG HASH RESULT: 1cc6219b...
2026-01-12 12:10:24,941 - dq_comparison - INFO - DEBUG HASH ROW: description: 'Normal text without issues' -> 'normal text without issues' | transaction_id: 'TX00002065' -> 'TX00002065' | transaction_date: '21-08-2023' -> '2023-08-21' | quantity: '82' -> '82' | customer_id: 'CUST002065' -> 'CUST002065'
2026-01-12 12:10:24,942 - dq_comparison - INFO - DEBUG HASH STRING: normal text without issues|TX00002065|2023-08-21|82|CUST002065...
2026-01-12 12:10:24,942 - dq_comparison - INFO - DEBUG HASH RESULT: 37157e0c...
2026-01-12 12:10:24,943 - dq_comparison - INFO - DEBUG HASH ROW: description: 'Text with*asterisks' -> 'text with*asterisks' | transaction_id: 'TX00063555' -> 'TX00063555' | transaction_date: '21-04-2023' -> '2023-04-21' | quantity: '98' -> '98' | customer_id: 'CUST063555' -> 'CUST063555'
2026-01-12 12:10:24,944 - dq_comparison - INFO - DEBUG HASH STRING: text with*asterisks|TX00063555|2023-04-21|98|CUST063555...
2026-01-12 12:10:24,945 - dq_comparison - INFO - DEBUG HASH RESULT: e9fcd56c...
2026-01-12 12:10:24,946 - dq_comparison - INFO - DEBUG HASH ROW: description: 'Text with{braces}' -> 'text with{braces}' | transaction_id: 'TX00079032' -> 'TX00079032' | transaction_date: '20-04-2023' -> '2023-04-20' | quantity: '8' -> '8' | customer_id: 'CUST079032' -> 'CUST079032'
2026-01-12 12:10:24,947 - dq_comparison - INFO - DEBUG HASH STRING: text with{braces}|TX00079032|2023-04-20|8|CUST079032...
2026-01-12 12:10:24,947 - dq_comparison - INFO - DEBUG HASH RESULT: 0b6fcf12...
2026-01-12 12:10:24,948 - dq_comparison - INFO - DEBUG HASH ROW: description: 'Text with<angle brackets>' -> 'text with<angle brackets>' | transaction_id: 'TX00024513' -> 'TX00024513' | transaction_date: '17-09-2023' -> '2023-09-17' | quantity: '18' -> '18' | customer_id: 'CUST024513' -> 'CUST024513'
2026-01-12 12:10:24,950 - dq_comparison - INFO - DEBUG HASH STRING: text with<angle brackets>|TX00024513|2023-09-17|18|CUST024513...
2026-01-12 12:10:24,950 - dq_comparison - INFO - DEBUG HASH RESULT: c3c377b4...
2026-01-12 12:10:24,951 - dq_comparison - INFO - DEBUG HASH ROW: description: 'Text with	tabs' -> 'text with tabs' | transaction_id: 'TX00086961' -> 'TX00086961' | transaction_date: '05-12-2023' -> '2023-12-05' | quantity: '48' -> '48' | customer_id: 'CUST086961' -> 'CUST086961'
2026-01-12 12:10:24,952 - dq_comparison - INFO - DEBUG HASH STRING: text with tabs|TX00086961|2023-12-05|48|CUST086961...
2026-01-12 12:10:24,952 - dq_comparison - INFO - DEBUG HASH RESULT: da923def...
2026-01-12 12:10:24,954 - dq_comparison - INFO - DEBUG HASH ROW: description: 'Text with! exclamations' -> 'text with! exclamations' | transaction_id: 'TX00042950' -> 'TX00042950' | transaction_date: '22-04-2023' -> '2023-04-22' | quantity: '54' -> '54' | customer_id: 'CUST042950' -> 'CUST042950'
2026-01-12 12:10:24,956 - dq_comparison - INFO - DEBUG HASH STRING: text with! exclamations|TX00042950|2023-04-22|54|CUST042950...
2026-01-12 12:10:24,957 - dq_comparison - INFO - DEBUG HASH RESULT: f80ff5fa...
2026-01-12 12:10:24,958 - dq_comparison - INFO - DEBUG HASH ROW: description: 'Text with; semicolons' -> 'text with; semicolons' | transaction_id: 'TX00068286' -> 'TX00068286' | transaction_date: '04-02-2023' -> '2023-02-04' | quantity: '89' -> '89' | customer_id: 'CUST068286' -> 'CUST068286'
2026-01-12 12:10:24,959 - dq_comparison - INFO - DEBUG HASH STRING: text with; semicolons|TX00068286|2023-02-04|89|CUST068286...
2026-01-12 12:10:24,960 - dq_comparison - INFO - DEBUG HASH RESULT: d73fea38...
2026-01-12 12:10:24,962 - dq_comparison - INFO - DEBUG HASH ROW: description: 'Text with - dashes' -> 'text with - dashes' | transaction_id: 'TX00098139' -> 'TX00098139' | transaction_date: '02-02-2023' -> '2023-02-02' | quantity: '11' -> '11' | customer_id: 'CUST098139' -> 'CUST098139'
2026-01-12 12:10:24,962 - dq_comparison - INFO - DEBUG HASH STRING: text with - dashes|TX00098139|2023-02-02|11|CUST098139...
2026-01-12 12:10:24,964 - dq_comparison - INFO - DEBUG HASH RESULT: 26bca1a1...
2026-01-12 12:10:24,966 - dq_comparison - INFO - DEBUG HASH ROW: description: 'Text with; semicolons' -> 'text with; semicolons' | transaction_id: 'TX00052190' -> 'TX00052190' | transaction_date: '16-11-2023' -> '2023-11-16' | quantity: '64' -> '64' | customer_id: 'CUST052190' -> 'CUST052190'
2026-01-12 12:10:24,967 - dq_comparison - INFO - DEBUG HASH STRING: text with; semicolons|TX00052190|2023-11-16|64|CUST052190...
2026-01-12 12:10:24,968 - dq_comparison - INFO - DEBUG HASH RESULT: f03cf16b...
2026-01-12 12:10:24,969 - dq_comparison - INFO - DEBUG HASH ROW: description: 'Text with  multiple   spaces' -> 'text with multiple spaces' | transaction_id: 'TX00051713' -> 'TX00051713' | transaction_date: '12-05-2023' -> '2023-05-12' | quantity: '91' -> '91' | customer_id: 'CUST051713' -> 'CUST051713'
2026-01-12 12:10:24,970 - dq_comparison - INFO - DEBUG HASH STRING: text with multiple spaces|TX00051713|2023-05-12|91|CUST051713...
2026-01-12 12:10:24,971 - dq_comparison - INFO - DEBUG HASH RESULT: 307f3dde...
2026-01-12 12:10:24,972 - dq_comparison - INFO - DEBUG HASH ROW: description: 'Text with\backslashes' -> 'text with\backslashes' | transaction_id: 'TX00071642' -> 'TX00071642' | transaction_date: '08-12-2023' -> '2023-12-08' | quantity: '86' -> '86' | customer_id: 'CUST071642' -> 'CUST071642'
2026-01-12 12:10:24,973 - dq_comparison - INFO - DEBUG HASH STRING: text with\backslashes|TX00071642|2023-12-08|86|CUST071642...
2026-01-12 12:10:24,975 - dq_comparison - INFO - DEBUG HASH RESULT: 88231ea7...
2026-01-12 12:10:24,977 - dq_comparison - INFO - DEBUG HASH ROW: description: 'Text with
newlines' -> 'text with newlines' | transaction_id: 'TX00062127' -> 'TX00062127' | transaction_date: '28-10-2023' -> '2023-10-28' | quantity: '98' -> '98' | customer_id: 'CUST062127' -> 'CUST062127'
2026-01-12 12:10:24,978 - dq_comparison - INFO - DEBUG HASH STRING: text with newlines|TX00062127|2023-10-28|98|CUST062127...
2026-01-12 12:10:24,980 - dq_comparison - INFO - DEBUG HASH RESULT: cab324eb...
2026-01-12 12:10:24,984 - dq_comparison - INFO - DEBUG HASH ROW: description: 'Text with|pipes' -> 'text with|pipes' | transaction_id: 'TX00057354' -> 'TX00057354' | transaction_date: '20-01-2023' -> '2023-01-20' | quantity: '42' -> '42' | customer_id: 'CUST057354' -> 'CUST057354'
2026-01-12 12:10:24,986 - dq_comparison - INFO - DEBUG HASH STRING: text with|pipes|TX00057354|2023-01-20|42|CUST057354...
2026-01-12 12:10:24,989 - dq_comparison - INFO - DEBUG HASH RESULT: 93dc5454...
2026-01-12 12:10:24,993 - dq_comparison - INFO - DEBUG HASH ROW: description: 'Text with - dashes' -> 'text with - dashes' | transaction_id: 'TX00063561' -> 'TX00063561' | transaction_date: '04-04-2023' -> '2023-04-04' | quantity: '3' -> '3' | customer_id: 'CUST063561' -> 'CUST063561'
2026-01-12 12:10:24,996 - dq_comparison - INFO - DEBUG HASH STRING: text with - dashes|TX00063561|2023-04-04|3|CUST063561...
2026-01-12 12:10:24,997 - dq_comparison - INFO - DEBUG HASH RESULT: ac470473...
2026-01-12 12:10:25,001 - dq_comparison - INFO - DEBUG HASH ROW: description: 'Text with! exclamations' -> 'text with! exclamations' | transaction_id: 'TX00024120' -> 'TX00024120' | transaction_date: '17-12-2023' -> '2023-12-17' | quantity: '43' -> '43' | customer_id: 'CUST024120' -> 'CUST024120'
2026-01-12 12:10:25,003 - dq_comparison - INFO - DEBUG HASH STRING: text with! exclamations|TX00024120|2023-12-17|43|CUST024120...
2026-01-12 12:10:25,005 - dq_comparison - INFO - DEBUG HASH RESULT: 2943b25a...
2026-01-12 12:10:25,007 - dq_comparison - INFO - DEBUG HASH ROW: description: 'Text with. periods' -> 'text with. periods' | transaction_id: 'TX00002803' -> 'TX00002803' | transaction_date: '27-07-2023' -> '2023-07-27' | quantity: '65' -> '65' | customer_id: 'CUST002803' -> 'CUST002803'
2026-01-12 12:10:25,008 - dq_comparison - INFO - DEBUG HASH STRING: text with. periods|TX00002803|2023-07-27|65|CUST002803...
2026-01-12 12:10:25,009 - dq_comparison - INFO - DEBUG HASH RESULT: 7c0da9b1...
2026-01-12 12:10:25,012 - dq_comparison - INFO - DEBUG HASH ROW: description: 'Text with#hashtags' -> 'text with#hashtags' | transaction_id: 'TX00087493' -> 'TX00087493' | transaction_date: '01-01-2024' -> '2024-01-01' | quantity: '67' -> '67' | customer_id: 'CUST087493' -> 'CUST087493'
2026-01-12 12:10:25,012 - dq_comparison - INFO - DEBUG HASH STRING: text with#hashtags|TX00087493|2024-01-01|67|CUST087493...
2026-01-12 12:10:25,013 - dq_comparison - INFO - DEBUG HASH RESULT: 659f0865...
2026-01-12 12:10:25,015 - dq_comparison - INFO - DEBUG HASH ROW: description: 'Text with*asterisks' -> 'text with*asterisks' | transaction_id: 'TX00009146' -> 'TX00009146' | transaction_date: '02-06-2023' -> '2023-06-02' | quantity: '84' -> '84' | customer_id: 'CUST009146' -> 'CUST009146'
2026-01-12 12:10:25,016 - dq_comparison - INFO - DEBUG HASH STRING: text with*asterisks|TX00009146|2023-06-02|84|CUST009146...
2026-01-12 12:10:25,017 - dq_comparison - INFO - DEBUG HASH RESULT: 3d300e22...
2026-01-12 12:10:25,018 - dq_comparison - INFO - DEBUG HASH ROW: description: 'Text with~tildes' -> 'text with~tildes' | transaction_id: 'TX00014879' -> 'TX00014879' | transaction_date: '10-10-2023' -> '2023-10-10' | quantity: '1' -> '1' | customer_id: 'CUST014879' -> 'CUST014879'
2026-01-12 12:10:25,019 - dq_comparison - INFO - DEBUG HASH STRING: text with~tildes|TX00014879|2023-10-10|1|CUST014879...
2026-01-12 12:10:25,020 - dq_comparison - INFO - DEBUG HASH RESULT: ac774400...
2026-01-12 12:10:25,022 - dq_comparison - INFO - DEBUG HASH ROW: description: 'Text with'apostrophes' -> 'text with'apostrophes' | transaction_id: 'TX00047729' -> 'TX00047729' | transaction_date: '03-05-2023' -> '2023-05-03' | quantity: '26' -> '26' | customer_id: 'CUST047729' -> 'CUST047729'
2026-01-12 12:10:25,024 - dq_comparison - INFO - DEBUG HASH STRING: text with'apostrophes|TX00047729|2023-05-03|26|CUST047729...
2026-01-12 12:10:25,024 - dq_comparison - INFO - DEBUG HASH RESULT: d5c8d53d...
2026-01-12 12:10:25,027 - dq_comparison - INFO - DEBUG HASH ROW: description: 'Text with"quotes"' -> 'text with"quotes"' | transaction_id: 'TX00025907' -> 'TX00025907' | transaction_date: '07-11-2023' -> '2023-11-07' | quantity: '50' -> '50' | customer_id: 'CUST025907' -> 'CUST025907'
2026-01-12 12:10:25,028 - dq_comparison - INFO - DEBUG HASH STRING: text with"quotes"|TX00025907|2023-11-07|50|CUST025907...
2026-01-12 12:10:25,029 - dq_comparison - INFO - DEBUG HASH RESULT: 7705edb4...
2026-01-12 12:10:25,030 - dq_comparison - INFO - DEBUG HASH ROW: description: 'Text with<angle brackets>' -> 'text with<angle brackets>' | transaction_id: 'TX00086462' -> 'TX00086462' | transaction_date: '06-01-2023' -> '2023-01-06' | quantity: '17' -> '17' | customer_id: 'CUST086462' -> 'CUST086462'
2026-01-12 12:10:25,031 - dq_comparison - INFO - DEBUG HASH STRING: text with<angle brackets>|TX00086462|2023-01-06|17|CUST086462...
2026-01-12 12:10:25,032 - dq_comparison - INFO - DEBUG HASH RESULT: 6e0b8b8e...
2026-01-12 12:10:25,034 - dq_comparison - INFO - DEBUG HASH ROW: description: 'Text with'apostrophes' -> 'text with'apostrophes' | transaction_id: 'TX00042370' -> 'TX00042370' | transaction_date: '08-04-2023' -> '2023-04-08' | quantity: '25' -> '25' | customer_id: 'CUST042370' -> 'CUST042370'
2026-01-12 12:10:25,035 - dq_comparison - INFO - DEBUG HASH STRING: text with'apostrophes|TX00042370|2023-04-08|25|CUST042370...
2026-01-12 12:10:25,036 - dq_comparison - INFO - DEBUG HASH RESULT: 7a4e6017...
2026-01-12 12:10:25,038 - dq_comparison - INFO - DEBUG HASH ROW: description: 'Text with(parentheses)' -> 'text with(parentheses)' | transaction_id: 'TX00087365' -> 'TX00087365' | transaction_date: '17-04-2023' -> '2023-04-17' | quantity: '61' -> '61' | customer_id: 'CUST087365' -> 'CUST087365'
2026-01-12 12:10:25,039 - dq_comparison - INFO - DEBUG HASH STRING: text with(parentheses)|TX00087365|2023-04-17|61|CUST087365...
2026-01-12 12:10:25,042 - dq_comparison - INFO - DEBUG HASH RESULT: dcbbd235...
2026-01-12 12:10:25,044 - dq_comparison - INFO - DEBUG HASH ROW: description: 'Text with? questions' -> 'text with? questions' | transaction_id: 'TX00083191' -> 'TX00083191' | transaction_date: '26-06-2023' -> '2023-06-26' | quantity: '3' -> '3' | customer_id: 'CUST083191' -> 'CUST083191'
2026-01-12 12:10:25,048 - dq_comparison - INFO - DEBUG HASH STRING: text with? questions|TX00083191|2023-06-26|3|CUST083191...
2026-01-12 12:10:25,049 - dq_comparison - INFO - DEBUG HASH RESULT: 77fb1e32...
2026-01-12 12:10:25,051 - dq_comparison - INFO - DEBUG HASH ROW: description: 'Text with/slashes' -> 'text with/slashes' | transaction_id: 'TX00066641' -> 'TX00066641' | transaction_date: '12/16/2023' -> '2023-12-16' | quantity: '6' -> '6' | customer_id: 'CUST066641' -> 'CUST066641'
2026-01-12 12:10:25,052 - dq_comparison - INFO - DEBUG HASH STRING: text with/slashes|TX00066641|2023-12-16|6|CUST066641...
2026-01-12 12:10:25,053 - dq_comparison - INFO - DEBUG HASH RESULT: b62d2ce9...
2026-01-12 12:10:25,056 - dq_comparison - INFO - DEBUG HASH ROW: description: 'Text with`backticks' -> 'text with`backticks' | transaction_id: 'TX00021237' -> 'TX00021237' | transaction_date: '01-01-2024' -> '2024-01-01' | quantity: '11' -> '11' | customer_id: 'CUST021237' -> 'CUST021237'
2026-01-12 12:10:25,057 - dq_comparison - INFO - DEBUG HASH STRING: text with`backticks|TX00021237|2024-01-01|11|CUST021237...
2026-01-12 12:10:25,058 - dq_comparison - INFO - DEBUG HASH RESULT: 245163b9...
2026-01-12 12:10:25,060 - dq_comparison - INFO - DEBUG HASH ROW: description: 'Text with/slashes' -> 'text with/slashes' | transaction_id: 'TX00015016' -> 'TX00015016' | transaction_date: '03/21/2023' -> '2023-03-21' | quantity: '20' -> '20' | customer_id: 'CUST015016' -> 'CUST015016'
2026-01-12 12:10:25,060 - dq_comparison - INFO - DEBUG HASH STRING: text with/slashes|TX00015016|2023-03-21|20|CUST015016...
2026-01-12 12:10:25,061 - dq_comparison - INFO - DEBUG HASH RESULT: a582025c...
2026-01-12 12:10:25,063 - dq_comparison - INFO - DEBUG HASH ROW: description: 'Text with, commas' -> 'text with, commas' | transaction_id: 'TX00092936' -> 'TX00092936' | transaction_date: '04-10-2023' -> '2023-10-04' | quantity: '84' -> '84' | customer_id: 'CUST092936' -> 'CUST092936'
2026-01-12 12:10:25,064 - dq_comparison - INFO - DEBUG HASH STRING: text with, commas|TX00092936|2023-10-04|84|CUST092936...
2026-01-12 12:10:25,066 - dq_comparison - INFO - DEBUG HASH RESULT: 8b343bc7...
2026-01-12 12:10:25,067 - dq_comparison - INFO - DEBUG HASH ROW: description: 'Text with_underscores' -> 'text with_underscores' | transaction_id: 'TX00041517' -> 'TX00041517' | transaction_date: '29-08-2023' -> '2023-08-29' | quantity: '54' -> '54' | customer_id: 'CUST041517' -> 'CUST041517'
2026-01-12 12:10:25,068 - dq_comparison - INFO - DEBUG HASH STRING: text with_underscores|TX00041517|2023-08-29|54|CUST041517...
2026-01-12 12:10:25,069 - dq_comparison - INFO - DEBUG HASH RESULT: 383b6ab0...
2026-01-12 12:10:25,071 - dq_comparison - INFO - DEBUG HASH ROW: description: 'Text with~tildes' -> 'text with~tildes' | transaction_id: 'TX00033701' -> 'TX00033701' | transaction_date: '11/30/2023' -> '2023-11-30' | quantity: '42' -> '42' | customer_id: 'CUST033701' -> 'CUST033701'
2026-01-12 12:10:25,072 - dq_comparison - INFO - DEBUG HASH STRING: text with~tildes|TX00033701|2023-11-30|42|CUST033701...
2026-01-12 12:10:25,073 - dq_comparison - INFO - DEBUG HASH RESULT: b8d5dac0...
2026-01-12 12:10:25,074 - dq_comparison - INFO - DEBUG HASH ROW: description: 'Text with'apostrophes' -> 'text with'apostrophes' | transaction_id: 'TX00075941' -> 'TX00075941' | transaction_date: '10/21/2023' -> '2023-10-21' | quantity: '84' -> '84' | customer_id: 'CUST075941' -> 'CUST075941'
2026-01-12 12:10:25,076 - dq_comparison - INFO - DEBUG HASH STRING: text with'apostrophes|TX00075941|2023-10-21|84|CUST075941...
2026-01-12 12:10:25,076 - dq_comparison - INFO - DEBUG HASH RESULT: 01a5efe6...
2026-01-12 12:10:25,078 - dq_comparison - INFO - DEBUG HASH ROW: description: 'Text with#hashtags' -> 'text with#hashtags' | transaction_id: 'TX00023984' -> 'TX00023984' | transaction_date: '03-12-2023' -> '2023-12-03' | quantity: '29' -> '29' | customer_id: 'CUST023984' -> 'CUST023984'
2026-01-12 12:10:25,079 - dq_comparison - INFO - DEBUG HASH STRING: text with#hashtags|TX00023984|2023-12-03|29|CUST023984...
2026-01-12 12:10:25,080 - dq_comparison - INFO - DEBUG HASH RESULT: 7ee0eb79...
2026-01-12 12:10:25,081 - dq_comparison - INFO - DEBUG HASH ROW: description: 'Text with  multiple   spaces' -> 'text with multiple spaces' | transaction_id: 'TX00014334' -> 'TX00014334' | transaction_date: '30-10-2023' -> '2023-10-30' | quantity: '85' -> '85' | customer_id: 'CUST014334' -> 'CUST014334'
2026-01-12 12:10:25,082 - dq_comparison - INFO - DEBUG HASH STRING: text with multiple spaces|TX00014334|2023-10-30|85|CUST014334...
2026-01-12 12:10:25,083 - dq_comparison - INFO - DEBUG HASH RESULT: a391a98c...
2026-01-12 12:10:25,085 - dq_comparison - INFO - DEBUG HASH ROW: description: 'Text with%percent signs' -> 'text with%percent signs' | transaction_id: 'TX00020172' -> 'TX00020172' | transaction_date: '29-09-2023' -> '2023-09-29' | quantity: '63' -> '63' | customer_id: 'CUST020172' -> 'CUST020172'
2026-01-12 12:10:25,086 - dq_comparison - INFO - DEBUG HASH STRING: text with%percent signs|TX00020172|2023-09-29|63|CUST020172...
2026-01-12 12:10:25,087 - dq_comparison - INFO - DEBUG HASH RESULT: fa99d582...
2026-01-12 12:10:25,088 - dq_comparison - INFO - DEBUG HASH ROW: description: 'Text with<angle brackets>' -> 'text with<angle brackets>' | transaction_id: 'TX00030285' -> 'TX00030285' | transaction_date: '19-07-2023' -> '2023-07-19' | quantity: '94' -> '94' | customer_id: 'CUST030285' -> 'CUST030285'
2026-01-12 12:10:25,090 - dq_comparison - INFO - DEBUG HASH STRING: text with<angle brackets>|TX00030285|2023-07-19|94|CUST030285...
2026-01-12 12:10:25,091 - dq_comparison - INFO - DEBUG HASH RESULT: d729e193...
2026-01-12 12:10:25,092 - dq_comparison - INFO - DEBUG HASH ROW: description: 'Text with[brackets]' -> 'text with[brackets]' | transaction_id: 'TX00081137' -> 'TX00081137' | transaction_date: '29-08-2023' -> '2023-08-29' | quantity: '91' -> '91' | customer_id: 'CUST081137' -> 'CUST081137'
2026-01-12 12:10:25,094 - dq_comparison - INFO - DEBUG HASH STRING: text with[brackets]|TX00081137|2023-08-29|91|CUST081137...
2026-01-12 12:10:25,095 - dq_comparison - INFO - DEBUG HASH RESULT: 1114e55b...
2026-01-12 12:10:25,097 - dq_comparison - INFO - DEBUG HASH ROW: description: 'Text with$dollar signs' -> 'text with$dollar signs' | transaction_id: 'TX00068118' -> 'TX00068118' | transaction_date: '09-04-2023' -> '2023-04-09' | quantity: '77' -> '77' | customer_id: 'CUST068118' -> 'CUST068118'
2026-01-12 12:10:25,099 - dq_comparison - INFO - DEBUG HASH STRING: text with$dollar signs|TX00068118|2023-04-09|77|CUST068118...
2026-01-12 12:10:25,102 - dq_comparison - INFO - DEBUG HASH RESULT: eab9ca97...
2026-01-12 12:10:25,104 - dq_comparison - INFO - DEBUG HASH ROW: description: 'Text with#hashtags' -> 'text with#hashtags' | transaction_id: 'TX00023217' -> 'TX00023217' | transaction_date: '22-11-2023' -> '2023-11-22' | quantity: '23' -> '23' | customer_id: 'CUST023217' -> 'CUST023217'
2026-01-12 12:10:25,105 - dq_comparison - INFO - DEBUG HASH STRING: text with#hashtags|TX00023217|2023-11-22|23|CUST023217...
2026-01-12 12:10:25,106 - dq_comparison - INFO - DEBUG HASH RESULT: bbcbe51d...
2026-01-12 12:10:25,107 - dq_comparison - INFO - DEBUG HASH ROW: description: 'Text with%percent signs' -> 'text with%percent signs' | transaction_id: 'TX00099820' -> 'TX00099820' | transaction_date: '18-07-2023' -> '2023-07-18' | quantity: '1' -> '1' | customer_id: 'CUST099820' -> 'CUST099820'
2026-01-12 12:10:25,108 - dq_comparison - INFO - DEBUG HASH STRING: text with%percent signs|TX00099820|2023-07-18|1|CUST099820...
2026-01-12 12:10:25,109 - dq_comparison - INFO - DEBUG HASH RESULT: 108c6635...
2026-01-12 12:10:25,110 - dq_comparison - INFO - DEBUG HASH ROW: description: 'Text with%percent signs' -> 'text with%percent signs' | transaction_id: 'TX00061573' -> 'TX00061573' | transaction_date: '07-11-2023' -> '2023-11-07' | quantity: '28' -> '28' | customer_id: 'CUST061573' -> 'CUST061573'
2026-01-12 12:10:25,111 - dq_comparison - INFO - DEBUG HASH STRING: text with%percent signs|TX00061573|2023-11-07|28|CUST061573...
2026-01-12 12:10:25,112 - dq_comparison - INFO - DEBUG HASH RESULT: 7de5cc34...
2026-01-12 12:10:25,114 - dq_comparison - INFO - DEBUG HASH ROW: description: 'Text with? questions' -> 'text with? questions' | transaction_id: 'TX00032407' -> 'TX00032407' | transaction_date: '29-06-2023' -> '2023-06-29' | quantity: '37' -> '37' | customer_id: 'CUST032407' -> 'CUST032407'
2026-01-12 12:10:25,115 - dq_comparison - INFO - DEBUG HASH STRING: text with? questions|TX00032407|2023-06-29|37|CUST032407...
2026-01-12 12:10:25,116 - dq_comparison - INFO - DEBUG HASH RESULT: 4c6e1199...
2026-01-12 12:10:25,120 - dq_comparison - INFO - DEBUG HASH ROW: description: 'Text with{braces}' -> 'text with{braces}' | transaction_id: 'TX00055209' -> 'TX00055209' | transaction_date: '26-01-2023' -> '2023-01-26' | quantity: '23' -> '23' | customer_id: 'CUST055209' -> 'CUST055209'
2026-01-12 12:10:25,122 - dq_comparison - INFO - DEBUG HASH STRING: text with{braces}|TX00055209|2023-01-26|23|CUST055209...
2026-01-12 12:10:25,123 - dq_comparison - INFO - DEBUG HASH RESULT: 0125679b...
2026-01-12 12:10:25,126 - dq_comparison - INFO - DEBUG HASH ROW: description: 'Text with@at signs' -> 'text with@at signs' | transaction_id: 'TX00037556' -> 'TX00037556' | transaction_date: '03/28/2023' -> '2023-03-28' | quantity: '42' -> '42' | customer_id: 'CUST037556' -> 'CUST037556'
2026-01-12 12:10:25,127 - dq_comparison - INFO - DEBUG HASH STRING: text with@at signs|TX00037556|2023-03-28|42|CUST037556...
2026-01-12 12:10:25,128 - dq_comparison - INFO - DEBUG HASH RESULT: ccc06348...
2026-01-12 12:10:25,129 - dq_comparison - INFO - DEBUG HASH ROW: description: 'Text with mixed CAPITAL and lowercase' -> 'text with mixed capital and lowercase' | transaction_id: 'TX00052343' -> 'TX00052343' | transaction_date: '20-12-2023' -> '2023-12-20' | quantity: '57' -> '57' | customer_id: 'CUST052343' -> 'CUST052343'
2026-01-12 12:10:25,131 - dq_comparison - INFO - DEBUG HASH STRING: text with mixed capital and lowercase|TX00052343|2023-12-20|57|CUST052343...
2026-01-12 12:10:25,132 - dq_comparison - INFO - DEBUG HASH RESULT: db201f75...
2026-01-12 12:10:25,135 - dq_comparison - INFO - DEBUG HASH ROW: description: 'Text with<angle brackets>' -> 'text with<angle brackets>' | transaction_id: 'TX00064855' -> 'TX00064855' | transaction_date: '02-06-2023' -> '2023-06-02' | quantity: '44' -> '44' | customer_id: 'CUST064855' -> 'CUST064855'
2026-01-12 12:10:25,136 - dq_comparison - INFO - DEBUG HASH STRING: text with<angle brackets>|TX00064855|2023-06-02|44|CUST064855...
2026-01-12 12:10:25,137 - dq_comparison - INFO - DEBUG HASH RESULT: 1ebc3439...
2026-01-12 12:10:25,139 - dq_comparison - INFO - DEBUG HASH ROW: description: 'Text with'apostrophes' -> 'text with'apostrophes' | transaction_id: 'TX00002077' -> 'TX00002077' | transaction_date: '31-07-2023' -> '2023-07-31' | quantity: '54' -> '54' | customer_id: 'CUST002077' -> 'CUST002077'
2026-01-12 12:10:25,140 - dq_comparison - INFO - DEBUG HASH STRING: text with'apostrophes|TX00002077|2023-07-31|54|CUST002077...
2026-01-12 12:10:25,141 - dq_comparison - INFO - DEBUG HASH RESULT: 4479a8b3...
2026-01-12 12:10:25,143 - dq_comparison - INFO - DEBUG HASH ROW: description: 'Text with& ampersands' -> 'text with& ampersands' | transaction_id: 'TX00043795' -> 'TX00043795' | transaction_date: '02-07-2023' -> '2023-07-02' | quantity: '84' -> '84' | customer_id: 'CUST043795' -> 'CUST043795'
2026-01-12 12:10:25,144 - dq_comparison - INFO - DEBUG HASH STRING: text with& ampersands|TX00043795|2023-07-02|84|CUST043795...
2026-01-12 12:10:25,145 - dq_comparison - INFO - DEBUG HASH RESULT: 1812629d...
2026-01-12 12:10:25,146 - dq_comparison - INFO - DEBUG HASH ROW: description: 'Text with\backslashes' -> 'text with\backslashes' | transaction_id: 'TX00025667' -> 'TX00025667' | transaction_date: '26-01-2023' -> '2023-01-26' | quantity: '40' -> '40' | customer_id: 'CUST025667' -> 'CUST025667'
2026-01-12 12:10:25,148 - dq_comparison - INFO - DEBUG HASH STRING: text with\backslashes|TX00025667|2023-01-26|40|CUST025667...
2026-01-12 12:10:25,149 - dq_comparison - INFO - DEBUG HASH RESULT: 39dfb673...
2026-01-12 12:10:25,150 - dq_comparison - INFO - DEBUG HASH ROW: description: '  Text with leading spaces' -> 'text with leading spaces' | transaction_id: 'TX00022821' -> 'TX00022821' | transaction_date: '09/17/2023' -> '2023-09-17' | quantity: '41' -> '41' | customer_id: 'CUST022821' -> 'CUST022821'
2026-01-12 12:10:25,152 - dq_comparison - INFO - DEBUG HASH STRING: text with leading spaces|TX00022821|2023-09-17|41|CUST022821...
2026-01-12 12:10:25,153 - dq_comparison - INFO - DEBUG HASH RESULT: 0b819c00...
2026-01-12 12:10:25,155 - dq_comparison - INFO - DEBUG HASH ROW: description: 'Text with? questions' -> 'text with? questions' | transaction_id: 'TX00002675' -> 'TX00002675' | transaction_date: '21-09-2023' -> '2023-09-21' | quantity: '44' -> '44' | customer_id: 'CUST002675' -> 'CUST002675'
2026-01-12 12:10:25,156 - dq_comparison - INFO - DEBUG HASH STRING: text with? questions|TX00002675|2023-09-21|44|CUST002675...
2026-01-12 12:10:25,157 - dq_comparison - INFO - DEBUG HASH RESULT: bbbd0b42...
2026-01-12 12:10:25,159 - dq_comparison - INFO - DEBUG HASH ROW: description: 'Text with! exclamations' -> 'text with! exclamations' | transaction_id: 'TX00085563' -> 'TX00085563' | transaction_date: '04-09-2023' -> '2023-09-04' | quantity: '39' -> '39' | customer_id: 'CUST085563' -> 'CUST085563'
2026-01-12 12:10:25,160 - dq_comparison - INFO - DEBUG HASH STRING: text with! exclamations|TX00085563|2023-09-04|39|CUST085563...
2026-01-12 12:10:25,162 - dq_comparison - INFO - DEBUG HASH RESULT: 26bddafb...
2026-01-12 12:10:25,166 - dq_comparison - INFO - DEBUG HASH ROW: description: 'Text with, commas' -> 'text with, commas' | transaction_id: 'TX00021384' -> 'TX00021384' | transaction_date: '14-02-2023' -> '2023-02-14' | quantity: '53' -> '53' | customer_id: 'CUST021384' -> 'CUST021384'
2026-01-12 12:10:25,167 - dq_comparison - INFO - DEBUG HASH STRING: text with, commas|TX00021384|2023-02-14|53|CUST021384...
2026-01-12 12:10:25,169 - dq_comparison - INFO - DEBUG HASH RESULT: 218727d4...
2026-01-12 12:10:25,173 - dq_comparison - INFO - DEBUG HASH ROW: description: 'Text with mixed CAPITAL and lowercase' -> 'text with mixed capital and lowercase' | transaction_id: 'TX00072833' -> 'TX00072833' | transaction_date: '26-06-2023' -> '2023-06-26' | quantity: '9' -> '9' | customer_id: 'CUST072833' -> 'CUST072833'
2026-01-12 12:10:25,174 - dq_comparison - INFO - DEBUG HASH STRING: text with mixed capital and lowercase|TX00072833|2023-06-26|9|CUST072833...
2026-01-12 12:10:25,175 - dq_comparison - INFO - DEBUG HASH RESULT: 860f6cbc...
2026-01-12 12:10:25,177 - dq_comparison - INFO - DEBUG HASH ROW: description: 'Text with#hashtags' -> 'text with#hashtags' | transaction_id: 'TX00027191' -> 'TX00027191' | transaction_date: '09/24/2023' -> '2023-09-24' | quantity: '63' -> '63' | customer_id: 'CUST027191' -> 'CUST027191'
2026-01-12 12:10:25,178 - dq_comparison - INFO - DEBUG HASH STRING: text with#hashtags|TX00027191|2023-09-24|63|CUST027191...
2026-01-12 12:10:25,179 - dq_comparison - INFO - DEBUG HASH RESULT: 4f0214f9...
2026-01-12 12:10:25,182 - dq_comparison - INFO - DEBUG HASH ROW: description: 'Text with`backticks' -> 'text with`backticks' | transaction_id: 'TX00081114' -> 'TX00081114' | transaction_date: '13-07-2023' -> '2023-07-13' | quantity: '25' -> '25' | customer_id: 'CUST081114' -> 'CUST081114'
2026-01-12 12:10:25,184 - dq_comparison - INFO - DEBUG HASH STRING: text with`backticks|TX00081114|2023-07-13|25|CUST081114...
2026-01-12 12:10:25,185 - dq_comparison - INFO - DEBUG HASH RESULT: 3f467196...
2026-01-12 12:10:25,188 - dq_comparison - INFO - DEBUG HASH ROW: description: 'Text with$dollar signs' -> 'text with$dollar signs' | transaction_id: 'TX00014835' -> 'TX00014835' | transaction_date: '13-04-2023' -> '2023-04-13' | quantity: '35' -> '35' | customer_id: 'CUST014835' -> 'CUST014835'
2026-01-12 12:10:25,189 - dq_comparison - INFO - DEBUG HASH STRING: text with$dollar signs|TX00014835|2023-04-13|35|CUST014835...
2026-01-12 12:10:25,191 - dq_comparison - INFO - DEBUG HASH RESULT: 792b6bc1...
2026-01-12 12:10:25,193 - dq_comparison - INFO - DEBUG HASH ROW: description: 'Text with? questions' -> 'text with? questions' | transaction_id: 'TX00068173' -> 'TX00068173' | transaction_date: '08-02-2023' -> '2023-02-08' | quantity: '54' -> '54' | customer_id: 'CUST068173' -> 'CUST068173'
2026-01-12 12:10:25,194 - dq_comparison - INFO - DEBUG HASH STRING: text with? questions|TX00068173|2023-02-08|54|CUST068173...
2026-01-12 12:10:25,196 - dq_comparison - INFO - DEBUG HASH RESULT: 27133d2d...
2026-01-12 12:10:25,199 - dq_comparison - INFO - DEBUG HASH ROW: description: 'Text with! exclamations' -> 'text with! exclamations' | transaction_id: 'TX00000059' -> 'TX00000059' | transaction_date: '27-05-2023' -> '2023-05-27' | quantity: '97' -> '97' | customer_id: 'CUST000059' -> 'CUST000059'
2026-01-12 12:10:25,203 - dq_comparison - INFO - DEBUG HASH STRING: text with! exclamations|TX00000059|2023-05-27|97|CUST000059...
2026-01-12 12:10:25,205 - dq_comparison - INFO - DEBUG HASH RESULT: 24bce436...
2026-01-12 12:10:25,209 - dq_comparison - INFO - DEBUG HASH ROW: description: 'Text with#hashtags' -> 'text with#hashtags' | transaction_id: 'TX00033242' -> 'TX00033242' | transaction_date: '01-02-2023' -> '2023-02-01' | quantity: '67' -> '67' | customer_id: 'CUST033242' -> 'CUST033242'
2026-01-12 12:10:25,211 - dq_comparison - INFO - DEBUG HASH STRING: text with#hashtags|TX00033242|2023-02-01|67|CUST033242...
2026-01-12 12:10:25,213 - dq_comparison - INFO - DEBUG HASH RESULT: 8ceba40c...
2026-01-12 12:10:25,214 - dq_comparison - INFO - DEBUG HASH ROW: description: 'Text with	tabs' -> 'text with tabs' | transaction_id: 'TX00028208' -> 'TX00028208' | transaction_date: '08-12-2023' -> '2023-12-08' | quantity: '86' -> '86' | customer_id: 'CUST028208' -> 'CUST028208'
2026-01-12 12:10:25,215 - dq_comparison - INFO - DEBUG HASH STRING: text with tabs|TX00028208|2023-12-08|86|CUST028208...
2026-01-12 12:10:25,216 - dq_comparison - INFO - DEBUG HASH RESULT: 23ab5bc1...
2026-01-12 12:10:25,218 - dq_comparison - INFO - DEBUG HASH ROW: description: 'Text with  multiple   spaces' -> 'text with multiple spaces' | transaction_id: 'TX00048504' -> 'TX00048504' | transaction_date: '11-07-2023' -> '2023-07-11' | quantity: '61' -> '61' | customer_id: 'CUST048504' -> 'CUST048504'
2026-01-12 12:10:25,219 - dq_comparison - INFO - DEBUG HASH STRING: text with multiple spaces|TX00048504|2023-07-11|61|CUST048504...
2026-01-12 12:10:25,220 - dq_comparison - INFO - DEBUG HASH RESULT: 1b0dff02...
2026-01-12 12:10:25,221 - dq_comparison - INFO - DEBUG HASH ROW: description: 'Text with{braces}' -> 'text with{braces}' | transaction_id: 'TX00089925' -> 'TX00089925' | transaction_date: '22-10-2023' -> '2023-10-22' | quantity: '100' -> '100' | customer_id: 'CUST089925' -> 'CUST089925'
2026-01-12 12:10:25,222 - dq_comparison - INFO - DEBUG HASH STRING: text with{braces}|TX00089925|2023-10-22|100|CUST089925...
2026-01-12 12:10:25,223 - dq_comparison - INFO - DEBUG HASH RESULT: f82ea8b0...
2026-01-12 12:10:25,225 - dq_comparison - INFO - DEBUG HASH ROW: description: 'Normal text without issues' -> 'normal text without issues' | transaction_id: 'TX00030130' -> 'TX00030130' | transaction_date: '18-08-2023' -> '2023-08-18' | quantity: '34' -> '34' | customer_id: 'CUST030130' -> 'CUST030130'
2026-01-12 12:10:25,226 - dq_comparison - INFO - DEBUG HASH STRING: normal text without issues|TX00030130|2023-08-18|34|CUST030130...
2026-01-12 12:10:25,227 - dq_comparison - INFO - DEBUG HASH RESULT: 999055a3...
2026-01-12 12:10:25,228 - dq_comparison - INFO - DEBUG HASH ROW: description: 'Text with trailing spaces  ' -> 'text with trailing spaces' | transaction_id: 'TX00080870' -> 'TX00080870' | transaction_date: '25-09-2023' -> '2023-09-25' | quantity: '97' -> '97' | customer_id: 'CUST080870' -> 'CUST080870'
2026-01-12 12:10:25,229 - dq_comparison - INFO - DEBUG HASH STRING: text with trailing spaces|TX00080870|2023-09-25|97|CUST080870...
2026-01-12 12:10:25,230 - dq_comparison - INFO - DEBUG HASH RESULT: 5719a325...
2026-01-12 12:10:25,232 - dq_comparison - INFO - DEBUG HASH ROW: description: 'Text with|pipes' -> 'text with|pipes' | transaction_id: 'TX00099257' -> 'TX00099257' | transaction_date: '10-10-2023' -> '2023-10-10' | quantity: '34' -> '34' | customer_id: 'CUST099257' -> 'CUST099257'
2026-01-12 12:10:25,233 - dq_comparison - INFO - DEBUG HASH STRING: text with|pipes|TX00099257|2023-10-10|34|CUST099257...
2026-01-12 12:10:25,234 - dq_comparison - INFO - DEBUG HASH RESULT: 356598a2...
2026-01-12 12:10:25,235 - dq_comparison - INFO - DEBUG HASH ROW: description: 'Text with"quotes"' -> 'text with"quotes"' | transaction_id: 'TX00021748' -> 'TX00021748' | transaction_date: '11-03-2023' -> '2023-03-11' | quantity: '32' -> '32' | customer_id: 'CUST021748' -> 'CUST021748'
2026-01-12 12:10:25,236 - dq_comparison - INFO - DEBUG HASH STRING: text with"quotes"|TX00021748|2023-03-11|32|CUST021748...
2026-01-12 12:10:25,237 - dq_comparison - INFO - DEBUG HASH RESULT: 5968725d...
2026-01-12 12:10:25,239 - dq_comparison - INFO - DEBUG HASH ROW: description: 'Text with~tildes' -> 'text with~tildes' | transaction_id: 'TX00039045' -> 'TX00039045' | transaction_date: '01-09-2023' -> '2023-09-01' | quantity: '58' -> '58' | customer_id: 'CUST039045' -> 'CUST039045'
2026-01-12 12:10:25,240 - dq_comparison - INFO - DEBUG HASH STRING: text with~tildes|TX00039045|2023-09-01|58|CUST039045...
2026-01-12 12:10:25,240 - dq_comparison - INFO - DEBUG HASH RESULT: 94425e82...
2026-01-12 12:10:25,243 - dq_comparison - INFO - DEBUG HASH ROW: description: 'Text with@at signs' -> 'text with@at signs' | transaction_id: 'TX00065232' -> 'TX00065232' | transaction_date: '03-01-2023' -> '2023-01-03' | quantity: '76' -> '76' | customer_id: 'CUST065232' -> 'CUST065232'
2026-01-12 12:10:25,244 - dq_comparison - INFO - DEBUG HASH STRING: text with@at signs|TX00065232|2023-01-03|76|CUST065232...
2026-01-12 12:10:25,245 - dq_comparison - INFO - DEBUG HASH RESULT: 95add2aa...
2026-01-12 12:10:25,247 - dq_comparison - INFO - DEBUG HASH ROW: description: 'Text with$dollar signs' -> 'text with$dollar signs' | transaction_id: 'TX00012560' -> 'TX00012560' | transaction_date: '21-06-2023' -> '2023-06-21' | quantity: '90' -> '90' | customer_id: 'CUST012560' -> 'CUST012560'
2026-01-12 12:10:25,248 - dq_comparison - INFO - DEBUG HASH STRING: text with$dollar signs|TX00012560|2023-06-21|90|CUST012560...
2026-01-12 12:10:25,249 - dq_comparison - INFO - DEBUG HASH RESULT: 2bfab641...
2026-01-12 12:10:25,251 - dq_comparison - INFO - DEBUG HASH ROW: description: 'Text with@at signs' -> 'text with@at signs' | transaction_id: 'TX00075277' -> 'TX00075277' | transaction_date: '11-02-2023' -> '2023-02-11' | quantity: '72' -> '72' | customer_id: 'CUST075277' -> 'CUST075277'
2026-01-12 12:10:25,252 - dq_comparison - INFO - DEBUG HASH STRING: text with@at signs|TX00075277|2023-02-11|72|CUST075277...
2026-01-12 12:10:25,254 - dq_comparison - INFO - DEBUG HASH RESULT: 10692f2a...
2026-01-12 12:10:25,256 - dq_comparison - INFO - DEBUG HASH ROW: description: 'Text with	tabs' -> 'text with tabs' | transaction_id: 'TX00049213' -> 'TX00049213' | transaction_date: '14-08-2023' -> '2023-08-14' | quantity: '88' -> '88' | customer_id: 'CUST049213' -> 'CUST049213'
2026-01-12 12:10:25,257 - dq_comparison - INFO - DEBUG HASH STRING: text with tabs|TX00049213|2023-08-14|88|CUST049213...
2026-01-12 12:10:25,258 - dq_comparison - INFO - DEBUG HASH RESULT: c8f5c9d3...
2026-01-12 12:10:25,259 - dq_comparison - INFO - DEBUG HASH ROW: description: 'Text with<angle brackets>' -> 'text with<angle brackets>' | transaction_id: 'TX00098270' -> 'TX00098270' | transaction_date: '05-10-2023' -> '2023-10-05' | quantity: '37' -> '37' | customer_id: 'CUST098270' -> 'CUST098270'
2026-01-12 12:10:25,261 - dq_comparison - INFO - DEBUG HASH STRING: text with<angle brackets>|TX00098270|2023-10-05|37|CUST098270...
2026-01-12 12:10:25,262 - dq_comparison - INFO - DEBUG HASH RESULT: a4d8a1d6...
2026-01-12 12:10:25,264 - dq_comparison - INFO - DEBUG HASH ROW: description: 'Text with	tabs' -> 'text with tabs' | transaction_id: 'TX00001294' -> 'TX00001294' | transaction_date: '31-03-2023' -> '2023-03-31' | quantity: '81' -> '81' | customer_id: 'CUST001294' -> 'CUST001294'
2026-01-12 12:10:25,265 - dq_comparison - INFO - DEBUG HASH STRING: text with tabs|TX00001294|2023-03-31|81|CUST001294...
2026-01-12 12:10:25,265 - dq_comparison - INFO - DEBUG HASH RESULT: 8ddbcbbb...
2026-01-12 12:10:25,267 - dq_comparison - INFO - DEBUG HASH ROW: description: 'Text with. periods' -> 'text with. periods' | transaction_id: 'TX00037665' -> 'TX00037665' | transaction_date: '12-06-2023' -> '2023-06-12' | quantity: '92' -> '92' | customer_id: 'CUST037665' -> 'CUST037665'
2026-01-12 12:10:25,268 - dq_comparison - INFO - DEBUG HASH STRING: text with. periods|TX00037665|2023-06-12|92|CUST037665...
2026-01-12 12:10:25,270 - dq_comparison - INFO - DEBUG HASH RESULT: c2d7a824...
2026-01-12 12:10:25,272 - dq_comparison - INFO - DEBUG HASH ROW: description: 'Text with  multiple   spaces' -> 'text with multiple spaces' | transaction_id: 'TX00081910' -> 'TX00081910' | transaction_date: '04-09-2023' -> '2023-09-04' | quantity: '74' -> '74' | customer_id: 'CUST081910' -> 'CUST081910'
2026-01-12 12:10:25,274 - dq_comparison - INFO - DEBUG HASH STRING: text with multiple spaces|TX00081910|2023-09-04|74|CUST081910...
2026-01-12 12:10:25,275 - dq_comparison - INFO - DEBUG HASH RESULT: dbb84cc2...
2026-01-12 12:10:25,276 - dq_comparison - INFO - DEBUG HASH ROW: description: 'Text with& ampersands' -> 'text with& ampersands' | transaction_id: 'TX00097170' -> 'TX00097170' | transaction_date: '24-01-2023' -> '2023-01-24' | quantity: '77' -> '77' | customer_id: 'CUST097170' -> 'CUST097170'
2026-01-12 12:10:25,278 - dq_comparison - INFO - DEBUG HASH STRING: text with& ampersands|TX00097170|2023-01-24|77|CUST097170...
2026-01-12 12:10:25,278 - dq_comparison - INFO - DEBUG HASH RESULT: 91d5f2b7...
2026-01-12 12:10:25,280 - dq_comparison - INFO - DEBUG HASH ROW: description: 'Text with{braces}' -> 'text with{braces}' | transaction_id: 'TX00089434' -> 'TX00089434' | transaction_date: '25-05-2023' -> '2023-05-25' | quantity: '93' -> '93' | customer_id: 'CUST089434' -> 'CUST089434'
2026-01-12 12:10:25,282 - dq_comparison - INFO - DEBUG HASH STRING: text with{braces}|TX00089434|2023-05-25|93|CUST089434...
2026-01-12 12:10:25,282 - dq_comparison - INFO - DEBUG HASH RESULT: d4f01655...
2026-01-12 12:10:25,284 - dq_comparison - INFO - DEBUG HASH ROW: description: 'Text with"quotes"' -> 'text with"quotes"' | transaction_id: 'TX00007122' -> 'TX00007122' | transaction_date: '23-04-2023' -> '2023-04-23' | quantity: '91' -> '91' | customer_id: 'CUST007122' -> 'CUST007122'
2026-01-12 12:10:25,284 - dq_comparison - INFO - DEBUG HASH STRING: text with"quotes"|TX00007122|2023-04-23|91|CUST007122...
2026-01-12 12:10:25,285 - dq_comparison - INFO - DEBUG HASH RESULT: abb6a9cd...
2026-01-12 12:10:25,287 - dq_comparison - INFO - DEBUG HASH ROW: description: 'Text with@at signs' -> 'text with@at signs' | transaction_id: 'TX00005167' -> 'TX00005167' | transaction_date: '14-04-2023' -> '2023-04-14' | quantity: '80' -> '80' | customer_id: 'CUST005167' -> 'CUST005167'
2026-01-12 12:10:25,288 - dq_comparison - INFO - DEBUG HASH STRING: text with@at signs|TX00005167|2023-04-14|80|CUST005167...
2026-01-12 12:10:25,289 - dq_comparison - INFO - DEBUG HASH RESULT: addc83d3...
2026-01-12 12:10:25,290 - dq_comparison - INFO - DEBUG HASH ROW: description: 'Text with; semicolons' -> 'text with; semicolons' | transaction_id: 'TX00048071' -> 'TX00048071' | transaction_date: '08/24/2023' -> '2023-08-24' | quantity: '48' -> '48' | customer_id: 'CUST048071' -> 'CUST048071'
2026-01-12 12:10:25,292 - dq_comparison - INFO - DEBUG HASH STRING: text with; semicolons|TX00048071|2023-08-24|48|CUST048071...
2026-01-12 12:10:25,292 - dq_comparison - INFO - DEBUG HASH RESULT: 53d60dfa...
2026-01-12 12:10:25,293 - dq_comparison - INFO - DEBUG HASH ROW: description: 'Text with"quotes"' -> 'text with"quotes"' | transaction_id: 'TX00079567' -> 'TX00079567' | transaction_date: '01-01-2023' -> '2023-01-01' | quantity: '91' -> '91' | customer_id: 'CUST079567' -> 'CUST079567'
2026-01-12 12:10:25,294 - dq_comparison - INFO - DEBUG HASH STRING: text with"quotes"|TX00079567|2023-01-01|91|CUST079567...
2026-01-12 12:10:25,295 - dq_comparison - INFO - DEBUG HASH RESULT: 133af4fa...
2026-01-12 12:10:25,296 - dq_comparison - INFO - DEBUG HASH ROW: description: 'Text with%percent signs' -> 'text with%percent signs' | transaction_id: 'TX00033051' -> 'TX00033051' | transaction_date: '09/21/2023' -> '2023-09-21' | quantity: '41' -> '41' | customer_id: 'CUST033051' -> 'CUST033051'
2026-01-12 12:10:25,297 - dq_comparison - INFO - DEBUG HASH STRING: text with%percent signs|TX00033051|2023-09-21|41|CUST033051...
2026-01-12 12:10:25,298 - dq_comparison - INFO - DEBUG HASH RESULT: 9a7204d2...
2026-01-12 12:10:25,300 - dq_comparison - INFO - DEBUG HASH ROW: description: 'Text with(parentheses)' -> 'text with(parentheses)' | transaction_id: 'TX00025334' -> 'TX00025334' | transaction_date: '25-10-2023' -> '2023-10-25' | quantity: '30' -> '30' | customer_id: 'CUST025334' -> 'CUST025334'
2026-01-12 12:10:25,301 - dq_comparison - INFO - DEBUG HASH STRING: text with(parentheses)|TX00025334|2023-10-25|30|CUST025334...
2026-01-12 12:10:25,301 - dq_comparison - INFO - DEBUG HASH RESULT: 8d3539c7...
2026-01-12 12:10:25,302 - dq_comparison - INFO - DEBUG HASH ROW: description: '  Text with leading spaces' -> 'text with leading spaces' | transaction_id: 'TX00045167' -> 'TX00045167' | transaction_date: '01-01-2024' -> '2024-01-01' | quantity: '46' -> '46' | customer_id: 'CUST045167' -> 'CUST045167'
2026-01-12 12:10:25,303 - dq_comparison - INFO - DEBUG HASH STRING: text with leading spaces|TX00045167|2024-01-01|46|CUST045167...
2026-01-12 12:10:25,304 - dq_comparison - INFO - DEBUG HASH RESULT: 622e478d...
2026-01-12 12:10:25,306 - dq_comparison - INFO - DEBUG HASH ROW: description: 'Text with  multiple   spaces' -> 'text with multiple spaces' | transaction_id: 'TX00015495' -> 'TX00015495' | transaction_date: '18-03-2023' -> '2023-03-18' | quantity: '97' -> '97' | customer_id: 'CUST015495' -> 'CUST015495'
2026-01-12 12:10:25,306 - dq_comparison - INFO - DEBUG HASH STRING: text with multiple spaces|TX00015495|2023-03-18|97|CUST015495...
2026-01-12 12:10:25,306 - dq_comparison - INFO - DEBUG HASH RESULT: 9bbce3f4...
2026-01-12 12:10:25,309 - dq_comparison - INFO - DEBUG HASH ROW: description: 'Text with`backticks' -> 'text with`backticks' | transaction_id: 'TX00058901' -> 'TX00058901' | transaction_date: '05-09-2023' -> '2023-09-05' | quantity: '69' -> '69' | customer_id: 'CUST058901' -> 'CUST058901'
2026-01-12 12:10:25,310 - dq_comparison - INFO - DEBUG HASH STRING: text with`backticks|TX00058901|2023-09-05|69|CUST058901...
2026-01-12 12:10:25,310 - dq_comparison - INFO - DEBUG HASH RESULT: 6f0bbf62...
2026-01-12 12:10:25,311 - dq_comparison - INFO - DEBUG HASH ROW: description: 'Text with! exclamations' -> 'text with! exclamations' | transaction_id: 'TX00061041' -> 'TX00061041' | transaction_date: '09-11-2023' -> '2023-11-09' | quantity: '1' -> '1' | customer_id: 'CUST061041' -> 'CUST061041'
2026-01-12 12:10:25,312 - dq_comparison - INFO - DEBUG HASH STRING: text with! exclamations|TX00061041|2023-11-09|1|CUST061041...
2026-01-12 12:10:25,313 - dq_comparison - INFO - DEBUG HASH RESULT: 41de08cc...
2026-01-12 12:10:25,315 - dq_comparison - INFO - DEBUG HASH ROW: description: 'Text with
newlines' -> 'text with newlines' | transaction_id: 'TX00070816' -> 'TX00070816' | transaction_date: '05-01-2023' -> '2023-01-05' | quantity: '46' -> '46' | customer_id: 'CUST070816' -> 'CUST070816'
2026-01-12 12:10:25,316 - dq_comparison - INFO - DEBUG HASH STRING: text with newlines|TX00070816|2023-01-05|46|CUST070816...
2026-01-12 12:10:25,317 - dq_comparison - INFO - DEBUG HASH RESULT: f5ee9510...
2026-01-12 12:10:25,319 - dq_comparison - INFO - DEBUG HASH ROW: description: 'Text with_underscores' -> 'text with_underscores' | transaction_id: 'TX00084543' -> 'TX00084543' | transaction_date: '28-01-2023' -> '2023-01-28' | quantity: '38' -> '38' | customer_id: 'CUST084543' -> 'CUST084543'
2026-01-12 12:10:25,320 - dq_comparison - INFO - DEBUG HASH STRING: text with_underscores|TX00084543|2023-01-28|38|CUST084543...
2026-01-12 12:10:25,320 - dq_comparison - INFO - DEBUG HASH RESULT: c56aa31c...
2026-01-12 12:10:25,322 - dq_comparison - INFO - DEBUG HASH ROW: description: 'Text with, commas' -> 'text with, commas' | transaction_id: 'TX00075953' -> 'TX00075953' | transaction_date: '25-11-2023' -> '2023-11-25' | quantity: '94' -> '94' | customer_id: 'CUST075953' -> 'CUST075953'
2026-01-12 12:10:25,323 - dq_comparison - INFO - DEBUG HASH STRING: text with, commas|TX00075953|2023-11-25|94|CUST075953...
2026-01-12 12:10:25,323 - dq_comparison - INFO - DEBUG HASH RESULT: 87068ebe...
2026-01-12 12:10:25,325 - dq_comparison - INFO - DEBUG HASH ROW: description: 'Text with`backticks' -> 'text with`backticks' | transaction_id: 'TX00033088' -> 'TX00033088' | transaction_date: '27-04-2023' -> '2023-04-27' | quantity: '68' -> '68' | customer_id: 'CUST033088' -> 'CUST033088'
2026-01-12 12:10:25,326 - dq_comparison - INFO - DEBUG HASH STRING: text with`backticks|TX00033088|2023-04-27|68|CUST033088...
2026-01-12 12:10:25,326 - dq_comparison - INFO - DEBUG HASH RESULT: 8178b475...
2026-01-12 12:10:25,327 - dq_comparison - INFO - DEBUG HASH ROW: description: 'Text with  multiple   spaces' -> 'text with multiple spaces' | transaction_id: 'TX00099979' -> 'TX00099979' | transaction_date: '03-07-2023' -> '2023-07-03' | quantity: '68' -> '68' | customer_id: 'CUST099979' -> 'CUST099979'
2026-01-12 12:10:25,328 - dq_comparison - INFO - DEBUG HASH STRING: text with multiple spaces|TX00099979|2023-07-03|68|CUST099979...
2026-01-12 12:10:25,329 - dq_comparison - INFO - DEBUG HASH RESULT: c2e853bf...
2026-01-12 12:10:25,330 - dq_comparison - INFO - DEBUG HASH ROW: description: 'Text with{braces}' -> 'text with{braces}' | transaction_id: 'TX00005251' -> 'TX00005251' | transaction_date: '10/17/2023' -> '2023-10-17' | quantity: '80' -> '80' | customer_id: 'CUST005251' -> 'CUST005251'
2026-01-12 12:10:25,331 - dq_comparison - INFO - DEBUG HASH STRING: text with{braces}|TX00005251|2023-10-17|80|CUST005251...
2026-01-12 12:10:25,331 - dq_comparison - INFO - DEBUG HASH RESULT: a1af0600...
2026-01-12 12:10:25,333 - dq_comparison - INFO - DEBUG HASH ROW: description: 'Text with'apostrophes' -> 'text with'apostrophes' | transaction_id: 'TX00038293' -> 'TX00038293' | transaction_date: '16-11-2023' -> '2023-11-16' | quantity: '91' -> '91' | customer_id: 'CUST038293' -> 'CUST038293'
2026-01-12 12:10:25,333 - dq_comparison - INFO - DEBUG HASH STRING: text with'apostrophes|TX00038293|2023-11-16|91|CUST038293...
2026-01-12 12:10:25,334 - dq_comparison - INFO - DEBUG HASH RESULT: 9824952b...
2026-01-12 12:10:25,335 - dq_comparison - INFO - DEBUG HASH ROW: description: 'Text with, commas' -> 'text with, commas' | transaction_id: 'TX00017045' -> 'TX00017045' | transaction_date: '29-06-2023' -> '2023-06-29' | quantity: '100' -> '100' | customer_id: 'CUST017045' -> 'CUST017045'
2026-01-12 12:10:25,336 - dq_comparison - INFO - DEBUG HASH STRING: text with, commas|TX00017045|2023-06-29|100|CUST017045...
2026-01-12 12:10:25,336 - dq_comparison - INFO - DEBUG HASH RESULT: 4b26b3ba...
2026-01-12 12:10:25,338 - dq_comparison - INFO - DEBUG HASH ROW: description: 'Text with  multiple   spaces' -> 'text with multiple spaces' | transaction_id: 'TX00060986' -> 'TX00060986' | transaction_date: '11-11-2023' -> '2023-11-11' | quantity: '16' -> '16' | customer_id: 'CUST060986' -> 'CUST060986'
2026-01-12 12:10:25,339 - dq_comparison - INFO - DEBUG HASH STRING: text with multiple spaces|TX00060986|2023-11-11|16|CUST060986...
2026-01-12 12:10:25,339 - dq_comparison - INFO - DEBUG HASH RESULT: a32f61cf...
2026-01-12 12:10:25,340 - dq_comparison - INFO - DEBUG HASH ROW: description: 'Text with trailing spaces  ' -> 'text with trailing spaces' | transaction_id: 'TX00016012' -> 'TX00016012' | transaction_date: '18-12-2023' -> '2023-12-18' | quantity: '100' -> '100' | customer_id: 'CUST016012' -> 'CUST016012'
2026-01-12 12:10:25,341 - dq_comparison - INFO - DEBUG HASH STRING: text with trailing spaces|TX00016012|2023-12-18|100|CUST016012...
2026-01-12 12:10:25,342 - dq_comparison - INFO - DEBUG HASH RESULT: a7660dc6...
2026-01-12 12:10:25,343 - dq_comparison - INFO - DEBUG HASH ROW: description: 'Text with\backslashes' -> 'text with\backslashes' | transaction_id: 'TX00041354' -> 'TX00041354' | transaction_date: '05-04-2023' -> '2023-04-05' | quantity: '48' -> '48' | customer_id: 'CUST041354' -> 'CUST041354'
2026-01-12 12:10:25,345 - dq_comparison - INFO - DEBUG HASH STRING: text with\backslashes|TX00041354|2023-04-05|48|CUST041354...
2026-01-12 12:10:25,345 - dq_comparison - INFO - DEBUG HASH RESULT: a3ec78b4...
2026-01-12 12:10:25,346 - dq_comparison - INFO - DEBUG HASH ROW: description: 'Text with? questions' -> 'text with? questions' | transaction_id: 'TX00072554' -> 'TX00072554' | transaction_date: '09-03-2023' -> '2023-03-09' | quantity: '30' -> '30' | customer_id: 'CUST072554' -> 'CUST072554'
2026-01-12 12:10:25,347 - dq_comparison - INFO - DEBUG HASH STRING: text with? questions|TX00072554|2023-03-09|30|CUST072554...
2026-01-12 12:10:25,348 - dq_comparison - INFO - DEBUG HASH RESULT: 456dd37f...
2026-01-12 12:10:25,349 - dq_comparison - INFO - DEBUG HASH ROW: description: 'Normal text without issues' -> 'normal text without issues' | transaction_id: 'TX00080517' -> 'TX00080517' | transaction_date: '20-04-2023' -> '2023-04-20' | quantity: '7' -> '7' | customer_id: 'CUST080517' -> 'CUST080517'
2026-01-12 12:10:25,349 - dq_comparison - INFO - DEBUG HASH STRING: normal text without issues|TX00080517|2023-04-20|7|CUST080517...
2026-01-12 12:10:25,351 - dq_comparison - INFO - DEBUG HASH RESULT: e2cd7c1f...
2026-01-12 12:10:25,352 - dq_comparison - INFO - DEBUG HASH ROW: description: 'Normal text without issues' -> 'normal text without issues' | transaction_id: 'TX00011331' -> 'TX00011331' | transaction_date: '10/21/2023' -> '2023-10-21' | quantity: '15' -> '15' | customer_id: 'CUST011331' -> 'CUST011331'
2026-01-12 12:10:25,352 - dq_comparison - INFO - DEBUG HASH STRING: normal text without issues|TX00011331|2023-10-21|15|CUST011331...
2026-01-12 12:10:25,354 - dq_comparison - INFO - DEBUG HASH RESULT: 38d9b20a...
2026-01-12 12:10:25,354 - dq_comparison - INFO - DEBUG HASH ROW: description: 'Text with%percent signs' -> 'text with%percent signs' | transaction_id: 'TX00064321' -> 'TX00064321' | transaction_date: '01/31/2023' -> '2023-01-31' | quantity: '74' -> '74' | customer_id: 'CUST064321' -> 'CUST064321'
2026-01-12 12:10:25,355 - dq_comparison - INFO - DEBUG HASH STRING: text with%percent signs|TX00064321|2023-01-31|74|CUST064321...
2026-01-12 12:10:25,355 - dq_comparison - INFO - DEBUG HASH RESULT: 35f82d74...
2026-01-12 12:10:25,357 - dq_comparison - INFO - DEBUG HASH ROW: description: 'Text with
newlines' -> 'text with newlines' | transaction_id: 'TX00032574' -> 'TX00032574' | transaction_date: '29-12-2023' -> '2023-12-29' | quantity: '44' -> '44' | customer_id: 'CUST032574' -> 'CUST032574'
2026-01-12 12:10:25,358 - dq_comparison - INFO - DEBUG HASH STRING: text with newlines|TX00032574|2023-12-29|44|CUST032574...
2026-01-12 12:10:25,358 - dq_comparison - INFO - DEBUG HASH RESULT: c84488d8...
2026-01-12 12:10:25,359 - dq_comparison - INFO - DEBUG HASH ROW: description: 'Text with& ampersands' -> 'text with& ampersands' | transaction_id: 'TX00066539' -> 'TX00066539' | transaction_date: '28-03-2023' -> '2023-03-28' | quantity: '4' -> '4' | customer_id: 'CUST066539' -> 'CUST066539'
2026-01-12 12:10:25,359 - dq_comparison - INFO - DEBUG HASH STRING: text with& ampersands|TX00066539|2023-03-28|4|CUST066539...
2026-01-12 12:10:25,360 - dq_comparison - INFO - DEBUG HASH RESULT: 4c318d27...
2026-01-12 12:10:25,361 - dq_comparison - INFO - DEBUG HASH ROW: description: 'Text with trailing spaces  ' -> 'text with trailing spaces' | transaction_id: 'TX00078886' -> 'TX00078886' | transaction_date: '01/14/2023' -> '2023-01-14' | quantity: '54' -> '54' | customer_id: 'CUST078886' -> 'CUST078886'
2026-01-12 12:10:25,362 - dq_comparison - INFO - DEBUG HASH STRING: text with trailing spaces|TX00078886|2023-01-14|54|CUST078886...
2026-01-12 12:10:25,362 - dq_comparison - INFO - DEBUG HASH RESULT: b3523228...
2026-01-12 12:10:25,363 - dq_comparison - INFO - DEBUG HASH ROW: description: 'Text with@at signs' -> 'text with@at signs' | transaction_id: 'TX00026235' -> 'TX00026235' | transaction_date: '26-03-2023' -> '2023-03-26' | quantity: '99' -> '99' | customer_id: 'CUST026235' -> 'CUST026235'
2026-01-12 12:10:25,364 - dq_comparison - INFO - DEBUG HASH STRING: text with@at signs|TX00026235|2023-03-26|99|CUST026235...
2026-01-12 12:10:25,365 - dq_comparison - INFO - DEBUG HASH RESULT: 060ad097...
2026-01-12 12:10:25,366 - dq_comparison - INFO - DEBUG HASH ROW: description: 'Text with	tabs' -> 'text with tabs' | transaction_id: 'TX00030274' -> 'TX00030274' | transaction_date: '20-10-2023' -> '2023-10-20' | quantity: '97' -> '97' | customer_id: 'CUST030274' -> 'CUST030274'
2026-01-12 12:10:25,366 - dq_comparison - INFO - DEBUG HASH STRING: text with tabs|TX00030274|2023-10-20|97|CUST030274...
2026-01-12 12:10:25,367 - dq_comparison - INFO - DEBUG HASH RESULT: eeafdebf...
2026-01-12 12:10:25,367 - dq_comparison - INFO - DEBUG HASH ROW: description: 'Text with~tildes' -> 'text with~tildes' | transaction_id: 'TX00097761' -> 'TX00097761' | transaction_date: '31-05-2023' -> '2023-05-31' | quantity: '85' -> '85' | customer_id: 'CUST097761' -> 'CUST097761'
2026-01-12 12:10:25,368 - dq_comparison - INFO - DEBUG HASH STRING: text with~tildes|TX00097761|2023-05-31|85|CUST097761...
2026-01-12 12:10:25,369 - dq_comparison - INFO - DEBUG HASH RESULT: 0989e511...
2026-01-12 12:10:25,370 - dq_comparison - INFO - DEBUG HASH ROW: description: 'Text with
newlines' -> 'text with newlines' | transaction_id: 'TX00049337' -> 'TX00049337' | transaction_date: '27-11-2023' -> '2023-11-27' | quantity: '33' -> '33' | customer_id: 'CUST049337' -> 'CUST049337'
2026-01-12 12:10:25,371 - dq_comparison - INFO - DEBUG HASH STRING: text with newlines|TX00049337|2023-11-27|33|CUST049337...
2026-01-12 12:10:25,372 - dq_comparison - INFO - DEBUG HASH RESULT: 5bdc6da2...
2026-01-12 12:10:25,373 - dq_comparison - INFO - DEBUG HASH ROW: description: 'Text with{braces}' -> 'text with{braces}' | transaction_id: 'TX00039492' -> 'TX00039492' | transaction_date: '27-01-2023' -> '2023-01-27' | quantity: '33' -> '33' | customer_id: 'CUST039492' -> 'CUST039492'
2026-01-12 12:10:25,373 - dq_comparison - INFO - DEBUG HASH STRING: text with{braces}|TX00039492|2023-01-27|33|CUST039492...
2026-01-12 12:10:25,374 - dq_comparison - INFO - DEBUG HASH RESULT: ed65fe3a...
2026-01-12 12:10:25,375 - dq_comparison - INFO - DEBUG HASH ROW: description: 'Text with`backticks' -> 'text with`backticks' | transaction_id: 'TX00075682' -> 'TX00075682' | transaction_date: '01-01-2023' -> '2023-01-01' | quantity: '49' -> '49' | customer_id: 'CUST075682' -> 'CUST075682'
2026-01-12 12:10:25,376 - dq_comparison - INFO - DEBUG HASH STRING: text with`backticks|TX00075682|2023-01-01|49|CUST075682...
2026-01-12 12:10:25,377 - dq_comparison - INFO - DEBUG HASH RESULT: 575472d7...
2026-01-12 12:10:25,378 - dq_comparison - INFO - DEBUG HASH ROW: description: 'Normal text without issues' -> 'normal text without issues' | transaction_id: 'TX00075454' -> 'TX00075454' | transaction_date: '15-12-2023' -> '2023-12-15' | quantity: '81' -> '81' | customer_id: 'CUST075454' -> 'CUST075454'
2026-01-12 12:10:25,379 - dq_comparison - INFO - DEBUG HASH STRING: normal text without issues|TX00075454|2023-12-15|81|CUST075454...
2026-01-12 12:10:25,379 - dq_comparison - INFO - DEBUG HASH RESULT: 1ef2c75e...
2026-01-12 12:10:25,381 - dq_comparison - INFO - DEBUG HASH ROW: description: 'Text with<angle brackets>' -> 'text with<angle brackets>' | transaction_id: 'TX00045112' -> 'TX00045112' | transaction_date: '25-07-2023' -> '2023-07-25' | quantity: '5' -> '5' | customer_id: 'CUST045112' -> 'CUST045112'
2026-01-12 12:10:25,381 - dq_comparison - INFO - DEBUG HASH STRING: text with<angle brackets>|TX00045112|2023-07-25|5|CUST045112...
2026-01-12 12:10:25,382 - dq_comparison - INFO - DEBUG HASH RESULT: 6f79044e...
2026-01-12 12:10:25,383 - dq_comparison - INFO - DEBUG HASH ROW: description: 'Text with%percent signs' -> 'text with%percent signs' | transaction_id: 'TX00098764' -> 'TX00098764' | transaction_date: '30-06-2023' -> '2023-06-30' | quantity: '95' -> '95' | customer_id: 'CUST098764' -> 'CUST098764'
2026-01-12 12:10:25,383 - dq_comparison - INFO - DEBUG HASH STRING: text with%percent signs|TX00098764|2023-06-30|95|CUST098764...
2026-01-12 12:10:25,384 - dq_comparison - INFO - DEBUG HASH RESULT: fcb5b222...
2026-01-12 12:10:25,385 - dq_comparison - INFO - DEBUG HASH ROW: description: 'Text with; semicolons' -> 'text with; semicolons' | transaction_id: 'TX00058731' -> 'TX00058731' | transaction_date: '01-04-2023' -> '2023-04-01' | quantity: '81' -> '81' | customer_id: 'CUST058731' -> 'CUST058731'
2026-01-12 12:10:25,386 - dq_comparison - INFO - DEBUG HASH STRING: text with; semicolons|TX00058731|2023-04-01|81|CUST058731...
2026-01-12 12:10:25,386 - dq_comparison - INFO - DEBUG HASH RESULT: 80b1e30b...
2026-01-12 12:10:25,388 - dq_comparison - INFO - DEBUG HASH ROW: description: 'Text with(parentheses)' -> 'text with(parentheses)' | transaction_id: 'TX00037694' -> 'TX00037694' | transaction_date: '09-04-2023' -> '2023-04-09' | quantity: '51' -> '51' | customer_id: 'CUST037694' -> 'CUST037694'
2026-01-12 12:10:25,388 - dq_comparison - INFO - DEBUG HASH STRING: text with(parentheses)|TX00037694|2023-04-09|51|CUST037694...
2026-01-12 12:10:25,389 - dq_comparison - INFO - DEBUG HASH RESULT: 9d99ed9c...
2026-01-12 12:10:25,390 - dq_comparison - INFO - DEBUG HASH ROW: description: 'Text with! exclamations' -> 'text with! exclamations' | transaction_id: 'TX00014324' -> 'TX00014324' | transaction_date: '17-12-2023' -> '2023-12-17' | quantity: '66' -> '66' | customer_id: 'CUST014324' -> 'CUST014324'
2026-01-12 12:10:25,390 - dq_comparison - INFO - DEBUG HASH STRING: text with! exclamations|TX00014324|2023-12-17|66|CUST014324...
2026-01-12 12:10:25,391 - dq_comparison - INFO - DEBUG HASH RESULT: 3ef9baab...
2026-01-12 12:10:25,392 - dq_comparison - INFO - DEBUG HASH ROW: description: 'Text with@at signs' -> 'text with@at signs' | transaction_id: 'TX00094598' -> 'TX00094598' | transaction_date: '07/31/2023' -> '2023-07-31' | quantity: '30' -> '30' | customer_id: 'CUST094598' -> 'CUST094598'
2026-01-12 12:10:25,392 - dq_comparison - INFO - DEBUG HASH STRING: text with@at signs|TX00094598|2023-07-31|30|CUST094598...
2026-01-12 12:10:25,393 - dq_comparison - INFO - DEBUG HASH RESULT: f26fcfde...
2026-01-12 12:10:25,394 - dq_comparison - INFO - DEBUG HASH ROW: description: 'Text with{braces}' -> 'text with{braces}' | transaction_id: 'TX00009048' -> 'TX00009048' | transaction_date: '17-02-2023' -> '2023-02-17' | quantity: '47' -> '47' | customer_id: 'CUST009048' -> 'CUST009048'
2026-01-12 12:10:25,394 - dq_comparison - INFO - DEBUG HASH STRING: text with{braces}|TX00009048|2023-02-17|47|CUST009048...
2026-01-12 12:10:25,395 - dq_comparison - INFO - DEBUG HASH RESULT: eb9d883d...
2026-01-12 12:10:25,396 - dq_comparison - INFO - DEBUG HASH ROW: description: 'Text with`backticks' -> 'text with`backticks' | transaction_id: 'TX00092932' -> 'TX00092932' | transaction_date: '24-07-2023' -> '2023-07-24' | quantity: '66' -> '66' | customer_id: 'CUST092932' -> 'CUST092932'
2026-01-12 12:10:25,396 - dq_comparison - INFO - DEBUG HASH STRING: text with`backticks|TX00092932|2023-07-24|66|CUST092932...
2026-01-12 12:10:25,397 - dq_comparison - INFO - DEBUG HASH RESULT: a401890d...
2026-01-12 12:10:25,398 - dq_comparison - INFO - DEBUG HASH ROW: description: 'Text with@at signs' -> 'text with@at signs' | transaction_id: 'TX00070219' -> 'TX00070219' | transaction_date: '30-10-2023' -> '2023-10-30' | quantity: '74' -> '74' | customer_id: 'CUST070219' -> 'CUST070219'
2026-01-12 12:10:25,398 - dq_comparison - INFO - DEBUG HASH STRING: text with@at signs|TX00070219|2023-10-30|74|CUST070219...
2026-01-12 12:10:25,399 - dq_comparison - INFO - DEBUG HASH RESULT: 536fef3b...
2026-01-12 12:10:25,400 - dq_comparison - INFO - DEBUG HASH ROW: description: 'Text with<angle brackets>' -> 'text with<angle brackets>' | transaction_id: 'TX00061684' -> 'TX00061684' | transaction_date: '03-08-2023' -> '2023-08-03' | quantity: '83' -> '83' | customer_id: 'CUST061684' -> 'CUST061684'
2026-01-12 12:10:25,400 - dq_comparison - INFO - DEBUG HASH STRING: text with<angle brackets>|TX00061684|2023-08-03|83|CUST061684...
2026-01-12 12:10:25,401 - dq_comparison - INFO - DEBUG HASH RESULT: c38494c6...
2026-01-12 12:10:25,402 - dq_comparison - INFO - DEBUG HASH ROW: description: 'Text with~tildes' -> 'text with~tildes' | transaction_id: 'TX00076923' -> 'TX00076923' | transaction_date: '09-08-2023' -> '2023-08-09' | quantity: '17' -> '17' | customer_id: 'CUST076923' -> 'CUST076923'
2026-01-12 12:10:25,403 - dq_comparison - INFO - DEBUG HASH STRING: text with~tildes|TX00076923|2023-08-09|17|CUST076923...
2026-01-12 12:10:25,403 - dq_comparison - INFO - DEBUG HASH RESULT: 5d6f8d6f...
2026-01-12 12:10:25,404 - dq_comparison - INFO - DEBUG HASH ROW: description: 'Text with'apostrophes' -> 'text with'apostrophes' | transaction_id: 'TX00071470' -> 'TX00071470' | transaction_date: '20-09-2023' -> '2023-09-20' | quantity: '44' -> '44' | customer_id: 'CUST071470' -> 'CUST071470'
2026-01-12 12:10:25,405 - dq_comparison - INFO - DEBUG HASH STRING: text with'apostrophes|TX00071470|2023-09-20|44|CUST071470...
2026-01-12 12:10:25,406 - dq_comparison - INFO - DEBUG HASH RESULT: 8f7b3bbd...
2026-01-12 12:10:25,407 - dq_comparison - INFO - DEBUG HASH ROW: description: '  Text with leading spaces' -> 'text with leading spaces' | transaction_id: 'TX00044942' -> 'TX00044942' | transaction_date: '14-03-2023' -> '2023-03-14' | quantity: '16' -> '16' | customer_id: 'CUST044942' -> 'CUST044942'
2026-01-12 12:10:25,407 - dq_comparison - INFO - DEBUG HASH STRING: text with leading spaces|TX00044942|2023-03-14|16|CUST044942...
2026-01-12 12:10:25,408 - dq_comparison - INFO - DEBUG HASH RESULT: 740a3004...
2026-01-12 12:10:25,410 - dq_comparison - INFO - DEBUG HASH ROW: description: 'Text with'apostrophes' -> 'text with'apostrophes' | transaction_id: 'TX00002954' -> 'TX00002954' | transaction_date: '19-10-2023' -> '2023-10-19' | quantity: '95' -> '95' | customer_id: 'CUST002954' -> 'CUST002954'
2026-01-12 12:10:25,410 - dq_comparison - INFO - DEBUG HASH STRING: text with'apostrophes|TX00002954|2023-10-19|95|CUST002954...
2026-01-12 12:10:25,411 - dq_comparison - INFO - DEBUG HASH RESULT: 0e1a00e7...
2026-01-12 12:10:25,412 - dq_comparison - INFO - DEBUG HASH ROW: description: 'Text with*asterisks' -> 'text with*asterisks' | transaction_id: 'TX00001608' -> 'TX00001608' | transaction_date: '20-04-2023' -> '2023-04-20' | quantity: '84' -> '84' | customer_id: 'CUST001608' -> 'CUST001608'
2026-01-12 12:10:25,412 - dq_comparison - INFO - DEBUG HASH STRING: text with*asterisks|TX00001608|2023-04-20|84|CUST001608...
2026-01-12 12:10:25,413 - dq_comparison - INFO - DEBUG HASH RESULT: d05108ea...
2026-01-12 12:10:25,414 - dq_comparison - INFO - DEBUG HASH ROW: description: 'Text with@at signs' -> 'text with@at signs' | transaction_id: 'TX00054392' -> 'TX00054392' | transaction_date: '15-05-2023' -> '2023-05-15' | quantity: '13' -> '13' | customer_id: 'CUST054392' -> 'CUST054392'
2026-01-12 12:10:25,414 - dq_comparison - INFO - DEBUG HASH STRING: text with@at signs|TX00054392|2023-05-15|13|CUST054392...
2026-01-12 12:10:25,415 - dq_comparison - INFO - DEBUG HASH RESULT: c494f499...
2026-01-12 12:10:25,416 - dq_comparison - INFO - DEBUG HASH ROW: description: 'Text with[brackets]' -> 'text with[brackets]' | transaction_id: 'TX00097656' -> 'TX00097656' | transaction_date: '23-10-2023' -> '2023-10-23' | quantity: '2' -> '2' | customer_id: 'CUST097656' -> 'CUST097656'
2026-01-12 12:10:25,417 - dq_comparison - INFO - DEBUG HASH STRING: text with[brackets]|TX00097656|2023-10-23|2|CUST097656...
2026-01-12 12:10:25,417 - dq_comparison - INFO - DEBUG HASH RESULT: 8b567c01...
2026-01-12 12:10:25,418 - dq_comparison - INFO - DEBUG HASH ROW: description: 'Text with#hashtags' -> 'text with#hashtags' | transaction_id: 'TX00061590' -> 'TX00061590' | transaction_date: '27-04-2023' -> '2023-04-27' | quantity: '95' -> '95' | customer_id: 'CUST061590' -> 'CUST061590'
2026-01-12 12:10:25,419 - dq_comparison - INFO - DEBUG HASH STRING: text with#hashtags|TX00061590|2023-04-27|95|CUST061590...
2026-01-12 12:10:25,419 - dq_comparison - INFO - DEBUG HASH RESULT: 9c32a73c...
2026-01-12 12:10:25,421 - dq_comparison - INFO - DEBUG HASH ROW: description: 'Text with~tildes' -> 'text with~tildes' | transaction_id: 'TX00016286' -> 'TX00016286' | transaction_date: '10-12-2023' -> '2023-12-10' | quantity: '51' -> '51' | customer_id: 'CUST016286' -> 'CUST016286'
2026-01-12 12:10:25,421 - dq_comparison - INFO - DEBUG HASH STRING: text with~tildes|TX00016286|2023-12-10|51|CUST016286...
2026-01-12 12:10:25,422 - dq_comparison - INFO - DEBUG HASH RESULT: cd561092...
2026-01-12 12:10:25,423 - dq_comparison - INFO - DEBUG HASH ROW: description: 'Text with? questions' -> 'text with? questions' | transaction_id: 'TX00008292' -> 'TX00008292' | transaction_date: '17-09-2023' -> '2023-09-17' | quantity: '78' -> '78' | customer_id: 'CUST008292' -> 'CUST008292'
2026-01-12 12:10:25,423 - dq_comparison - INFO - DEBUG HASH STRING: text with? questions|TX00008292|2023-09-17|78|CUST008292...
2026-01-12 12:10:25,424 - dq_comparison - INFO - DEBUG HASH RESULT: e07fe72a...
2026-01-12 12:10:25,425 - dq_comparison - INFO - DEBUG HASH ROW: description: 'Text with/slashes' -> 'text with/slashes' | transaction_id: 'TX00061103' -> 'TX00061103' | transaction_date: '10-10-2023' -> '2023-10-10' | quantity: '79' -> '79' | customer_id: 'CUST061103' -> 'CUST061103'
2026-01-12 12:10:25,426 - dq_comparison - INFO - DEBUG HASH STRING: text with/slashes|TX00061103|2023-10-10|79|CUST061103...
2026-01-12 12:10:25,426 - dq_comparison - INFO - DEBUG HASH RESULT: e6443402...
2026-01-12 12:10:25,427 - dq_comparison - INFO - DEBUG HASH ROW: description: 'Text with*asterisks' -> 'text with*asterisks' | transaction_id: 'TX00098404' -> 'TX00098404' | transaction_date: '11-06-2023' -> '2023-06-11' | quantity: '30' -> '30' | customer_id: 'CUST098404' -> 'CUST098404'
2026-01-12 12:10:25,428 - dq_comparison - INFO - DEBUG HASH STRING: text with*asterisks|TX00098404|2023-06-11|30|CUST098404...
2026-01-12 12:10:25,429 - dq_comparison - INFO - DEBUG HASH RESULT: c088b905...
2026-01-12 12:10:25,430 - dq_comparison - INFO - DEBUG HASH ROW: description: 'Text with	tabs' -> 'text with tabs' | transaction_id: 'TX00037205' -> 'TX00037205' | transaction_date: '12-03-2023' -> '2023-03-12' | quantity: '74' -> '74' | customer_id: 'CUST037205' -> 'CUST037205'
2026-01-12 12:10:25,430 - dq_comparison - INFO - DEBUG HASH STRING: text with tabs|TX00037205|2023-03-12|74|CUST037205...
2026-01-12 12:10:25,431 - dq_comparison - INFO - DEBUG HASH RESULT: 60ccf23e...
2026-01-12 12:10:25,432 - dq_comparison - INFO - DEBUG HASH ROW: description: 'Text with? questions' -> 'text with? questions' | transaction_id: 'TX00021054' -> 'TX00021054' | transaction_date: '05-02-2023' -> '2023-02-05' | quantity: '100' -> '100' | customer_id: 'CUST021054' -> 'CUST021054'
2026-01-12 12:10:25,432 - dq_comparison - INFO - DEBUG HASH STRING: text with? questions|TX00021054|2023-02-05|100|CUST021054...
2026-01-12 12:10:25,433 - dq_comparison - INFO - DEBUG HASH RESULT: cbd8f5b5...
2026-01-12 12:10:25,434 - dq_comparison - INFO - DEBUG HASH ROW: description: 'Text with! exclamations' -> 'text with! exclamations' | transaction_id: 'TX00027042' -> 'TX00027042' | transaction_date: '28-09-2023' -> '2023-09-28' | quantity: '46' -> '46' | customer_id: 'CUST027042' -> 'CUST027042'
2026-01-12 12:10:25,434 - dq_comparison - INFO - DEBUG HASH STRING: text with! exclamations|TX00027042|2023-09-28|46|CUST027042...
2026-01-12 12:10:25,435 - dq_comparison - INFO - DEBUG HASH RESULT: 7628bdce...
2026-01-12 12:10:25,436 - dq_comparison - INFO - DEBUG HASH ROW: description: 'Text with
newlines' -> 'text with newlines' | transaction_id: 'TX00087496' -> 'TX00087496' | transaction_date: '11-05-2023' -> '2023-05-11' | quantity: '50' -> '50' | customer_id: 'CUST087496' -> 'CUST087496'
2026-01-12 12:10:25,436 - dq_comparison - INFO - DEBUG HASH STRING: text with newlines|TX00087496|2023-05-11|50|CUST087496...
2026-01-12 12:10:25,437 - dq_comparison - INFO - DEBUG HASH RESULT: 09eec4fa...
2026-01-12 12:10:25,438 - dq_comparison - INFO - DEBUG HASH ROW: description: 'Text with~tildes' -> 'text with~tildes' | transaction_id: 'TX00023119' -> 'TX00023119' | transaction_date: '07-03-2023' -> '2023-03-07' | quantity: '22' -> '22' | customer_id: 'CUST023119' -> 'CUST023119'
2026-01-12 12:10:25,439 - dq_comparison - INFO - DEBUG HASH STRING: text with~tildes|TX00023119|2023-03-07|22|CUST023119...
2026-01-12 12:10:25,439 - dq_comparison - INFO - DEBUG HASH RESULT: fae594e9...
2026-01-12 12:10:25,440 - dq_comparison - INFO - DEBUG HASH ROW: description: 'Text with\backslashes' -> 'text with\backslashes' | transaction_id: 'TX00008130' -> 'TX00008130' | transaction_date: '06-04-2023' -> '2023-04-06' | quantity: '8' -> '8' | customer_id: 'CUST008130' -> 'CUST008130'
2026-01-12 12:10:25,441 - dq_comparison - INFO - DEBUG HASH STRING: text with\backslashes|TX00008130|2023-04-06|8|CUST008130...
2026-01-12 12:10:25,441 - dq_comparison - INFO - DEBUG HASH RESULT: 82826514...
2026-01-12 12:10:25,442 - dq_comparison - INFO - DEBUG HASH ROW: description: 'Text with. periods' -> 'text with. periods' | transaction_id: 'TX00066190' -> 'TX00066190' | transaction_date: '18-07-2023' -> '2023-07-18' | quantity: '29' -> '29' | customer_id: 'CUST066190' -> 'CUST066190'
2026-01-12 12:10:25,443 - dq_comparison - INFO - DEBUG HASH STRING: text with. periods|TX00066190|2023-07-18|29|CUST066190...
2026-01-12 12:10:25,443 - dq_comparison - INFO - DEBUG HASH RESULT: 408fffad...
2026-01-12 12:10:25,444 - dq_comparison - INFO - DEBUG HASH ROW: description: 'Text with*asterisks' -> 'text with*asterisks' | transaction_id: 'TX00083346' -> 'TX00083346' | transaction_date: '24-08-2023' -> '2023-08-24' | quantity: '79' -> '79' | customer_id: 'CUST083346' -> 'CUST083346'
2026-01-12 12:10:25,445 - dq_comparison - INFO - DEBUG HASH STRING: text with*asterisks|TX00083346|2023-08-24|79|CUST083346...
2026-01-12 12:10:25,445 - dq_comparison - INFO - DEBUG HASH RESULT: 4267010e...
2026-01-12 12:10:25,446 - dq_comparison - INFO - DEBUG HASH ROW: description: 'Text with\backslashes' -> 'text with\backslashes' | transaction_id: 'TX00054460' -> 'TX00054460' | transaction_date: '05-09-2023' -> '2023-09-05' | quantity: '81' -> '81' | customer_id: 'CUST054460' -> 'CUST054460'
2026-01-12 12:10:25,447 - dq_comparison - INFO - DEBUG HASH STRING: text with\backslashes|TX00054460|2023-09-05|81|CUST054460...
2026-01-12 12:10:25,447 - dq_comparison - INFO - DEBUG HASH RESULT: 770f9d99...
2026-01-12 12:10:25,448 - dq_comparison - INFO - DEBUG HASH ROW: description: 'Text with; semicolons' -> 'text with; semicolons' | transaction_id: 'TX00016149' -> 'TX00016149' | transaction_date: '15-09-2023' -> '2023-09-15' | quantity: '5' -> '5' | customer_id: 'CUST016149' -> 'CUST016149'
2026-01-12 12:10:25,449 - dq_comparison - INFO - DEBUG HASH STRING: text with; semicolons|TX00016149|2023-09-15|5|CUST016149...
2026-01-12 12:10:25,449 - dq_comparison - INFO - DEBUG HASH RESULT: 68d86618...
2026-01-12 12:10:25,450 - dq_comparison - INFO - DEBUG HASH ROW: description: 'Text with"quotes"' -> 'text with"quotes"' | transaction_id: 'TX00000864' -> 'TX00000864' | transaction_date: '23-07-2023' -> '2023-07-23' | quantity: '50' -> '50' | customer_id: 'CUST000864' -> 'CUST000864'
2026-01-12 12:10:25,451 - dq_comparison - INFO - DEBUG HASH STRING: text with"quotes"|TX00000864|2023-07-23|50|CUST000864...
2026-01-12 12:10:25,451 - dq_comparison - INFO - DEBUG HASH RESULT: 051095b6...
2026-01-12 12:10:25,452 - dq_comparison - INFO - DEBUG HASH ROW: description: 'Text with
newlines' -> 'text with newlines' | transaction_id: 'TX00024799' -> 'TX00024799' | transaction_date: '18-10-2023' -> '2023-10-18' | quantity: '52' -> '52' | customer_id: 'CUST024799' -> 'CUST024799'
2026-01-12 12:10:25,452 - dq_comparison - INFO - DEBUG HASH STRING: text with newlines|TX00024799|2023-10-18|52|CUST024799...
2026-01-12 12:10:25,453 - dq_comparison - INFO - DEBUG HASH RESULT: d9cde1d9...
2026-01-12 12:10:25,454 - dq_comparison - INFO - DEBUG HASH ROW: description: 'Text with*asterisks' -> 'text with*asterisks' | transaction_id: 'TX00069082' -> 'TX00069082' | transaction_date: '04-07-2023' -> '2023-07-04' | quantity: '85' -> '85' | customer_id: 'CUST069082' -> 'CUST069082'
2026-01-12 12:10:25,454 - dq_comparison - INFO - DEBUG HASH STRING: text with*asterisks|TX00069082|2023-07-04|85|CUST069082...
2026-01-12 12:10:25,455 - dq_comparison - INFO - DEBUG HASH RESULT: da690c87...
2026-01-12 12:10:25,456 - dq_comparison - INFO - DEBUG HASH ROW: description: 'Text with@at signs' -> 'text with@at signs' | transaction_id: 'TX00079633' -> 'TX00079633' | transaction_date: '19-10-2023' -> '2023-10-19' | quantity: '63' -> '63' | customer_id: 'CUST079633' -> 'CUST079633'
2026-01-12 12:10:25,456 - dq_comparison - INFO - DEBUG HASH STRING: text with@at signs|TX00079633|2023-10-19|63|CUST079633...
2026-01-12 12:10:25,457 - dq_comparison - INFO - DEBUG HASH RESULT: 46e71949...
2026-01-12 12:10:25,458 - dq_comparison - INFO - DEBUG HASH ROW: description: 'Text with<angle brackets>' -> 'text with<angle brackets>' | transaction_id: 'TX00082634' -> 'TX00082634' | transaction_date: '18-04-2023' -> '2023-04-18' | quantity: '31' -> '31' | customer_id: 'CUST082634' -> 'CUST082634'
2026-01-12 12:10:25,459 - dq_comparison - INFO - DEBUG HASH STRING: text with<angle brackets>|TX00082634|2023-04-18|31|CUST082634...
2026-01-12 12:10:25,459 - dq_comparison - INFO - DEBUG HASH RESULT: 6d44f642...
2026-01-12 12:10:25,460 - dq_comparison - INFO - DEBUG HASH ROW: description: 'Text with$dollar signs' -> 'text with$dollar signs' | transaction_id: 'TX00098277' -> 'TX00098277' | transaction_date: '08-07-2023' -> '2023-07-08' | quantity: '20' -> '20' | customer_id: 'CUST098277' -> 'CUST098277'
2026-01-12 12:10:25,461 - dq_comparison - INFO - DEBUG HASH STRING: text with$dollar signs|TX00098277|2023-07-08|20|CUST098277...
2026-01-12 12:10:25,461 - dq_comparison - INFO - DEBUG HASH RESULT: 107249de...
2026-01-12 12:10:25,462 - dq_comparison - INFO - DEBUG HASH ROW: description: 'Text with trailing spaces  ' -> 'text with trailing spaces' | transaction_id: 'TX00042531' -> 'TX00042531' | transaction_date: '10-06-2023' -> '2023-06-10' | quantity: '35' -> '35' | customer_id: 'CUST042531' -> 'CUST042531'
2026-01-12 12:10:25,463 - dq_comparison - INFO - DEBUG HASH STRING: text with trailing spaces|TX00042531|2023-06-10|35|CUST042531...
2026-01-12 12:10:25,463 - dq_comparison - INFO - DEBUG HASH RESULT: ebaaab40...
2026-01-12 12:10:25,464 - dq_comparison - INFO - DEBUG HASH ROW: description: 'Text with trailing spaces  ' -> 'text with trailing spaces' | transaction_id: 'TX00046455' -> 'TX00046455' | transaction_date: '12-11-2023' -> '2023-11-12' | quantity: '99' -> '99' | customer_id: 'CUST046455' -> 'CUST046455'
2026-01-12 12:10:25,464 - dq_comparison - INFO - DEBUG HASH STRING: text with trailing spaces|TX00046455|2023-11-12|99|CUST046455...
2026-01-12 12:10:25,465 - dq_comparison - INFO - DEBUG HASH RESULT: 64762364...
2026-01-12 12:10:25,466 - dq_comparison - INFO - DEBUG HASH ROW: description: 'Text with[brackets]' -> 'text with[brackets]' | transaction_id: 'TX00010474' -> 'TX00010474' | transaction_date: '04-05-2023' -> '2023-05-04' | quantity: '30' -> '30' | customer_id: 'CUST010474' -> 'CUST010474'
2026-01-12 12:10:25,466 - dq_comparison - INFO - DEBUG HASH STRING: text with[brackets]|TX00010474|2023-05-04|30|CUST010474...
2026-01-12 12:10:25,467 - dq_comparison - INFO - DEBUG HASH RESULT: 07cbe1d1...
2026-01-12 12:10:25,468 - dq_comparison - INFO - DEBUG HASH ROW: description: 'Text with%percent signs' -> 'text with%percent signs' | transaction_id: 'TX00022517' -> 'TX00022517' | transaction_date: '09-04-2023' -> '2023-04-09' | quantity: '13' -> '13' | customer_id: 'CUST022517' -> 'CUST022517'
2026-01-12 12:10:25,468 - dq_comparison - INFO - DEBUG HASH STRING: text with%percent signs|TX00022517|2023-04-09|13|CUST022517...
2026-01-12 12:10:25,469 - dq_comparison - INFO - DEBUG HASH RESULT: 323aafd2...
2026-01-12 12:10:25,469 - dq_comparison - INFO - DEBUG HASH ROW: description: 'Text with'apostrophes' -> 'text with'apostrophes' | transaction_id: 'TX00055091' -> 'TX00055091' | transaction_date: '09-01-2023' -> '2023-01-09' | quantity: '72' -> '72' | customer_id: 'CUST055091' -> 'CUST055091'
2026-01-12 12:10:25,470 - dq_comparison - INFO - DEBUG HASH STRING: text with'apostrophes|TX00055091|2023-01-09|72|CUST055091...
2026-01-12 12:10:25,471 - dq_comparison - INFO - DEBUG HASH RESULT: c9491528...
2026-01-12 12:10:25,472 - dq_comparison - INFO - DEBUG HASH ROW: description: 'Text with& ampersands' -> 'text with& ampersands' | transaction_id: 'TX00002822' -> 'TX00002822' | transaction_date: '18-09-2023' -> '2023-09-18' | quantity: '94' -> '94' | customer_id: 'CUST002822' -> 'CUST002822'
2026-01-12 12:10:25,472 - dq_comparison - INFO - DEBUG HASH STRING: text with& ampersands|TX00002822|2023-09-18|94|CUST002822...
2026-01-12 12:10:25,473 - dq_comparison - INFO - DEBUG HASH RESULT: 0b7168a8...
2026-01-12 12:10:25,474 - dq_comparison - INFO - DEBUG HASH ROW: description: 'Text with. periods' -> 'text with. periods' | transaction_id: 'TX00018406' -> 'TX00018406' | transaction_date: '10-02-2023' -> '2023-02-10' | quantity: '29' -> '29' | customer_id: 'CUST018406' -> 'CUST018406'
2026-01-12 12:10:25,474 - dq_comparison - INFO - DEBUG HASH STRING: text with. periods|TX00018406|2023-02-10|29|CUST018406...
2026-01-12 12:10:25,475 - dq_comparison - INFO - DEBUG HASH RESULT: 2d1532a4...
2026-01-12 12:10:25,476 - dq_comparison - INFO - DEBUG HASH ROW: description: 'Text with& ampersands' -> 'text with& ampersands' | transaction_id: 'TX00079625' -> 'TX00079625' | transaction_date: '11-08-2023' -> '2023-08-11' | quantity: '51' -> '51' | customer_id: 'CUST079625' -> 'CUST079625'
2026-01-12 12:10:25,476 - dq_comparison - INFO - DEBUG HASH STRING: text with& ampersands|TX00079625|2023-08-11|51|CUST079625...
2026-01-12 12:10:25,477 - dq_comparison - INFO - DEBUG HASH RESULT: 7a1c5cb7...
2026-01-12 12:10:25,478 - dq_comparison - INFO - DEBUG HASH ROW: description: 'Text with/slashes' -> 'text with/slashes' | transaction_id: 'TX00002165' -> 'TX00002165' | transaction_date: '02-02-2023' -> '2023-02-02' | quantity: '51' -> '51' | customer_id: 'CUST002165' -> 'CUST002165'
2026-01-12 12:10:25,478 - dq_comparison - INFO - DEBUG HASH STRING: text with/slashes|TX00002165|2023-02-02|51|CUST002165...
2026-01-12 12:10:25,479 - dq_comparison - INFO - DEBUG HASH RESULT: c2480de5...
2026-01-12 12:10:25,480 - dq_comparison - INFO - DEBUG HASH ROW: description: 'Text with_underscores' -> 'text with_underscores' | transaction_id: 'TX00005281' -> 'TX00005281' | transaction_date: '02/13/2023' -> '2023-02-13' | quantity: '21' -> '21' | customer_id: 'CUST005281' -> 'CUST005281'
2026-01-12 12:10:25,480 - dq_comparison - INFO - DEBUG HASH STRING: text with_underscores|TX00005281|2023-02-13|21|CUST005281...
2026-01-12 12:10:25,481 - dq_comparison - INFO - DEBUG HASH RESULT: dac02a6b...
2026-01-12 12:10:25,482 - dq_comparison - INFO - DEBUG HASH ROW: description: 'Text with"quotes"' -> 'text with"quotes"' | transaction_id: 'TX00018941' -> 'TX00018941' | transaction_date: '12/19/2023' -> '2023-12-19' | quantity: '12' -> '12' | customer_id: 'CUST018941' -> 'CUST018941'
2026-01-12 12:10:25,482 - dq_comparison - INFO - DEBUG HASH STRING: text with"quotes"|TX00018941|2023-12-19|12|CUST018941...
2026-01-12 12:10:25,483 - dq_comparison - INFO - DEBUG HASH RESULT: b36917d2...
2026-01-12 12:10:25,484 - dq_comparison - INFO - DEBUG HASH ROW: description: 'Text with{braces}' -> 'text with{braces}' | transaction_id: 'TX00028184' -> 'TX00028184' | transaction_date: '19-07-2023' -> '2023-07-19' | quantity: '6' -> '6' | customer_id: 'CUST028184' -> 'CUST028184'
2026-01-12 12:10:25,485 - dq_comparison - INFO - DEBUG HASH STRING: text with{braces}|TX00028184|2023-07-19|6|CUST028184...
2026-01-12 12:10:25,485 - dq_comparison - INFO - DEBUG HASH RESULT: a18f291c...
2026-01-12 12:10:25,486 - dq_comparison - INFO - DEBUG HASH ROW: description: 'Text with{braces}' -> 'text with{braces}' | transaction_id: 'TX00039858' -> 'TX00039858' | transaction_date: '04-06-2023' -> '2023-06-04' | quantity: '55' -> '55' | customer_id: 'CUST039858' -> 'CUST039858'
2026-01-12 12:10:25,487 - dq_comparison - INFO - DEBUG HASH STRING: text with{braces}|TX00039858|2023-06-04|55|CUST039858...
2026-01-12 12:10:25,487 - dq_comparison - INFO - DEBUG HASH RESULT: 712da6bd...
2026-01-12 12:10:25,488 - dq_comparison - INFO - DEBUG HASH ROW: description: 'Text with	tabs' -> 'text with tabs' | transaction_id: 'TX00019729' -> 'TX00019729' | transaction_date: '16-04-2023' -> '2023-04-16' | quantity: '73' -> '73' | customer_id: 'CUST019729' -> 'CUST019729'
2026-01-12 12:10:25,489 - dq_comparison - INFO - DEBUG HASH STRING: text with tabs|TX00019729|2023-04-16|73|CUST019729...
2026-01-12 12:10:25,490 - dq_comparison - INFO - DEBUG HASH RESULT: 601e745a...
2026-01-12 12:10:25,491 - dq_comparison - INFO - DEBUG HASH ROW: description: 'Text with$dollar signs' -> 'text with$dollar signs' | transaction_id: 'TX00096722' -> 'TX00096722' | transaction_date: '25-04-2023' -> '2023-04-25' | quantity: '23' -> '23' | customer_id: 'CUST096722' -> 'CUST096722'
2026-01-12 12:10:25,491 - dq_comparison - INFO - DEBUG HASH STRING: text with$dollar signs|TX00096722|2023-04-25|23|CUST096722...
2026-01-12 12:10:25,492 - dq_comparison - INFO - DEBUG HASH RESULT: b2688944...
2026-01-12 12:10:25,493 - dq_comparison - INFO - DEBUG HASH ROW: description: 'Text with(parentheses)' -> 'text with(parentheses)' | transaction_id: 'TX00086906' -> 'TX00086906' | transaction_date: '17-02-2023' -> '2023-02-17' | quantity: '36' -> '36' | customer_id: 'CUST086906' -> 'CUST086906'
2026-01-12 12:10:25,494 - dq_comparison - INFO - DEBUG HASH STRING: text with(parentheses)|TX00086906|2023-02-17|36|CUST086906...
2026-01-12 12:10:25,494 - dq_comparison - INFO - DEBUG HASH RESULT: e62b6ed6...
2026-01-12 12:10:25,495 - dq_comparison - INFO - DEBUG HASH ROW: description: 'Normal text without issues' -> 'normal text without issues' | transaction_id: 'TX00098874' -> 'TX00098874' | transaction_date: '05-06-2023' -> '2023-06-05' | quantity: '57' -> '57' | customer_id: 'CUST098874' -> 'CUST098874'
2026-01-12 12:10:25,496 - dq_comparison - INFO - DEBUG HASH STRING: normal text without issues|TX00098874|2023-06-05|57|CUST098874...
2026-01-12 12:10:25,496 - dq_comparison - INFO - DEBUG HASH RESULT: 6db0db1b...
2026-01-12 12:10:25,497 - dq_comparison - INFO - DEBUG HASH ROW: description: 'Text with#hashtags' -> 'text with#hashtags' | transaction_id: 'TX00086267' -> 'TX00086267' | transaction_date: '15-03-2023' -> '2023-03-15' | quantity: '20' -> '20' | customer_id: 'CUST086267' -> 'CUST086267'
2026-01-12 12:10:25,498 - dq_comparison - INFO - DEBUG HASH STRING: text with#hashtags|TX00086267|2023-03-15|20|CUST086267...
2026-01-12 12:10:25,499 - dq_comparison - INFO - DEBUG HASH RESULT: 6bd5e5e7...
2026-01-12 12:10:25,500 - dq_comparison - INFO - DEBUG HASH ROW: description: 'Text with"quotes"' -> 'text with"quotes"' | transaction_id: 'TX00082674' -> 'TX00082674' | transaction_date: '15-03-2023' -> '2023-03-15' | quantity: '98' -> '98' | customer_id: 'CUST082674' -> 'CUST082674'
2026-01-12 12:10:25,500 - dq_comparison - INFO - DEBUG HASH STRING: text with"quotes"|TX00082674|2023-03-15|98|CUST082674...
2026-01-12 12:10:25,501 - dq_comparison - INFO - DEBUG HASH RESULT: 6612bf0a...
2026-01-12 12:10:25,502 - dq_comparison - INFO - DEBUG HASH ROW: description: 'Text with~tildes' -> 'text with~tildes' | transaction_id: 'TX00067700' -> 'TX00067700' | transaction_date: '13-11-2023' -> '2023-11-13' | quantity: '24' -> '24' | customer_id: 'CUST067700' -> 'CUST067700'
2026-01-12 12:10:25,502 - dq_comparison - INFO - DEBUG HASH STRING: text with~tildes|TX00067700|2023-11-13|24|CUST067700...
2026-01-12 12:10:25,503 - dq_comparison - INFO - DEBUG HASH RESULT: 907748b5...
2026-01-12 12:10:25,504 - dq_comparison - INFO - DEBUG HASH ROW: description: 'Text with{braces}' -> 'text with{braces}' | transaction_id: 'TX00093853' -> 'TX00093853' | transaction_date: '16-03-2023' -> '2023-03-16' | quantity: '19' -> '19' | customer_id: 'CUST093853' -> 'CUST093853'
2026-01-12 12:10:25,505 - dq_comparison - INFO - DEBUG HASH STRING: text with{braces}|TX00093853|2023-03-16|19|CUST093853...
2026-01-12 12:10:25,505 - dq_comparison - INFO - DEBUG HASH RESULT: dd081528...
2026-01-12 12:10:25,507 - dq_comparison - INFO - DEBUG HASH ROW: description: 'Text with, commas' -> 'text with, commas' | transaction_id: 'TX00066787' -> 'TX00066787' | transaction_date: '12-05-2023' -> '2023-05-12' | quantity: '97' -> '97' | customer_id: 'CUST066787' -> 'CUST066787'
2026-01-12 12:10:25,507 - dq_comparison - INFO - DEBUG HASH STRING: text with, commas|TX00066787|2023-05-12|97|CUST066787...
2026-01-12 12:10:25,508 - dq_comparison - INFO - DEBUG HASH RESULT: 63b170a2...
2026-01-12 12:10:25,509 - dq_comparison - INFO - DEBUG HASH ROW: description: 'Normal text without issues' -> 'normal text without issues' | transaction_id: 'TX00076455' -> 'TX00076455' | transaction_date: '19-03-2023' -> '2023-03-19' | quantity: '7' -> '7' | customer_id: 'CUST076455' -> 'CUST076455'
2026-01-12 12:10:25,509 - dq_comparison - INFO - DEBUG HASH STRING: normal text without issues|TX00076455|2023-03-19|7|CUST076455...
2026-01-12 12:10:25,510 - dq_comparison - INFO - DEBUG HASH RESULT: 44c4843b...
2026-01-12 12:10:25,511 - dq_comparison - INFO - DEBUG HASH ROW: description: 'Text with mixed CAPITAL and lowercase' -> 'text with mixed capital and lowercase' | transaction_id: 'TX00074355' -> 'TX00074355' | transaction_date: '25-02-2023' -> '2023-02-25' | quantity: '50' -> '50' | customer_id: 'CUST074355' -> 'CUST074355'
2026-01-12 12:10:25,511 - dq_comparison - INFO - DEBUG HASH STRING: text with mixed capital and lowercase|TX00074355|2023-02-25|50|CUST074355...
2026-01-12 12:10:25,512 - dq_comparison - INFO - DEBUG HASH RESULT: 06272287...
2026-01-12 12:10:25,513 - dq_comparison - INFO - DEBUG HASH ROW: description: 'Text with& ampersands' -> 'text with& ampersands' | transaction_id: 'TX00042838' -> 'TX00042838' | transaction_date: '22-04-2023' -> '2023-04-22' | quantity: '58' -> '58' | customer_id: 'CUST042838' -> 'CUST042838'
2026-01-12 12:10:25,514 - dq_comparison - INFO - DEBUG HASH STRING: text with& ampersands|TX00042838|2023-04-22|58|CUST042838...
2026-01-12 12:10:25,514 - dq_comparison - INFO - DEBUG HASH RESULT: 0a06ce52...
2026-01-12 12:10:25,515 - dq_comparison - INFO - DEBUG HASH ROW: description: 'Text with\backslashes' -> 'text with\backslashes' | transaction_id: 'TX00036735' -> 'TX00036735' | transaction_date: '10-08-2023' -> '2023-08-10' | quantity: '40' -> '40' | customer_id: 'CUST036735' -> 'CUST036735'
2026-01-12 12:10:25,516 - dq_comparison - INFO - DEBUG HASH STRING: text with\backslashes|TX00036735|2023-08-10|40|CUST036735...
2026-01-12 12:10:25,516 - dq_comparison - INFO - DEBUG HASH RESULT: 3af22cb3...
2026-01-12 12:10:25,518 - dq_comparison - INFO - DEBUG HASH ROW: description: 'Text with! exclamations' -> 'text with! exclamations' | transaction_id: 'TX00090377' -> 'TX00090377' | transaction_date: '10-02-2023' -> '2023-02-10' | quantity: '32' -> '32' | customer_id: 'CUST090377' -> 'CUST090377'
2026-01-12 12:10:25,519 - dq_comparison - INFO - DEBUG HASH STRING: text with! exclamations|TX00090377|2023-02-10|32|CUST090377...
2026-01-12 12:10:25,519 - dq_comparison - INFO - DEBUG HASH RESULT: 73f3bf0b...
2026-01-12 12:10:25,521 - dq_comparison - INFO - DEBUG HASH ROW: description: 'Text with$dollar signs' -> 'text with$dollar signs' | transaction_id: 'TX00049030' -> 'TX00049030' | transaction_date: '24-12-2023' -> '2023-12-24' | quantity: '69' -> '69' | customer_id: 'CUST049030' -> 'CUST049030'
2026-01-12 12:10:25,521 - dq_comparison - INFO - DEBUG HASH STRING: text with$dollar signs|TX00049030|2023-12-24|69|CUST049030...
2026-01-12 12:10:25,522 - dq_comparison - INFO - DEBUG HASH RESULT: f4d35e85...
2026-01-12 12:10:25,523 - dq_comparison - INFO - DEBUG HASH ROW: description: 'Text with<angle brackets>' -> 'text with<angle brackets>' | transaction_id: 'TX00064481' -> 'TX00064481' | transaction_date: '09-10-2023' -> '2023-10-09' | quantity: '82' -> '82' | customer_id: 'CUST064481' -> 'CUST064481'
2026-01-12 12:10:25,523 - dq_comparison - INFO - DEBUG HASH STRING: text with<angle brackets>|TX00064481|2023-10-09|82|CUST064481...
2026-01-12 12:10:25,524 - dq_comparison - INFO - DEBUG HASH RESULT: 8b645b50...
2026-01-12 12:10:25,525 - dq_comparison - INFO - DEBUG HASH ROW: description: 'Normal text without issues' -> 'normal text without issues' | transaction_id: 'TX00039910' -> 'TX00039910' | transaction_date: '17-01-2023' -> '2023-01-17' | quantity: '33' -> '33' | customer_id: 'CUST039910' -> 'CUST039910'
2026-01-12 12:10:25,525 - dq_comparison - INFO - DEBUG HASH STRING: normal text without issues|TX00039910|2023-01-17|33|CUST039910...
2026-01-12 12:10:25,526 - dq_comparison - INFO - DEBUG HASH RESULT: 7a3dad2d...
2026-01-12 12:10:25,527 - dq_comparison - INFO - DEBUG HASH ROW: description: 'Text with! exclamations' -> 'text with! exclamations' | transaction_id: 'TX00004984' -> 'TX00004984' | transaction_date: '24-11-2023' -> '2023-11-24' | quantity: '35' -> '35' | customer_id: 'CUST004984' -> 'CUST004984'
2026-01-12 12:10:25,528 - dq_comparison - INFO - DEBUG HASH STRING: text with! exclamations|TX00004984|2023-11-24|35|CUST004984...
2026-01-12 12:10:25,528 - dq_comparison - INFO - DEBUG HASH RESULT: 55d2faf0...
2026-01-12 12:10:25,529 - dq_comparison - INFO - DEBUG HASH ROW: description: 'Text with. periods' -> 'text with. periods' | transaction_id: 'TX00032978' -> 'TX00032978' | transaction_date: '02-10-2023' -> '2023-10-02' | quantity: '80' -> '80' | customer_id: 'CUST032978' -> 'CUST032978'
2026-01-12 12:10:25,530 - dq_comparison - INFO - DEBUG HASH STRING: text with. periods|TX00032978|2023-10-02|80|CUST032978...
2026-01-12 12:10:25,531 - dq_comparison - INFO - DEBUG HASH RESULT: 2c5f54c5...
2026-01-12 12:10:25,532 - dq_comparison - INFO - DEBUG HASH ROW: description: 'Text with|pipes' -> 'text with|pipes' | transaction_id: 'TX00016140' -> 'TX00016140' | transaction_date: '12-01-2023' -> '2023-01-12' | quantity: '50' -> '50' | customer_id: 'CUST016140' -> 'CUST016140'
2026-01-12 12:10:25,532 - dq_comparison - INFO - DEBUG HASH STRING: text with|pipes|TX00016140|2023-01-12|50|CUST016140...
2026-01-12 12:10:25,533 - dq_comparison - INFO - DEBUG HASH RESULT: e89c11d7...
2026-01-12 12:10:25,534 - dq_comparison - INFO - DEBUG HASH ROW: description: 'Text with\backslashes' -> 'text with\backslashes' | transaction_id: 'TX00028331' -> 'TX00028331' | transaction_date: '08-07-2023' -> '2023-07-08' | quantity: '57' -> '57' | customer_id: 'CUST028331' -> 'CUST028331'
2026-01-12 12:10:25,534 - dq_comparison - INFO - DEBUG HASH STRING: text with\backslashes|TX00028331|2023-07-08|57|CUST028331...
2026-01-12 12:10:25,535 - dq_comparison - INFO - DEBUG HASH RESULT: 9d3298b7...
2026-01-12 12:10:25,536 - dq_comparison - INFO - DEBUG HASH ROW: description: 'Text with mixed CAPITAL and lowercase' -> 'text with mixed capital and lowercase' | transaction_id: 'TX00069193' -> 'TX00069193' | transaction_date: '16-04-2023' -> '2023-04-16' | quantity: '6' -> '6' | customer_id: 'CUST069193' -> 'CUST069193'
2026-01-12 12:10:25,536 - dq_comparison - INFO - DEBUG HASH STRING: text with mixed capital and lowercase|TX00069193|2023-04-16|6|CUST069193...
2026-01-12 12:10:25,537 - dq_comparison - INFO - DEBUG HASH RESULT: 89dfc560...
2026-01-12 12:10:25,538 - dq_comparison - INFO - DEBUG HASH ROW: description: 'Text with*asterisks' -> 'text with*asterisks' | transaction_id: 'TX00064483' -> 'TX00064483' | transaction_date: '20-04-2023' -> '2023-04-20' | quantity: '14' -> '14' | customer_id: 'CUST064483' -> 'CUST064483'
2026-01-12 12:10:25,539 - dq_comparison - INFO - DEBUG HASH STRING: text with*asterisks|TX00064483|2023-04-20|14|CUST064483...
2026-01-12 12:10:25,540 - dq_comparison - INFO - DEBUG HASH RESULT: 2788b1de...
2026-01-12 12:10:25,541 - dq_comparison - INFO - DEBUG HASH ROW: description: 'Text with\backslashes' -> 'text with\backslashes' | transaction_id: 'TX00059811' -> 'TX00059811' | transaction_date: '03-03-2023' -> '2023-03-03' | quantity: '13' -> '13' | customer_id: 'CUST059811' -> 'CUST059811'
2026-01-12 12:10:25,541 - dq_comparison - INFO - DEBUG HASH STRING: text with\backslashes|TX00059811|2023-03-03|13|CUST059811...
2026-01-12 12:10:25,542 - dq_comparison - INFO - DEBUG HASH RESULT: 455e3e86...
2026-01-12 12:10:25,543 - dq_comparison - INFO - DEBUG HASH ROW: description: 'Text with trailing spaces  ' -> 'text with trailing spaces' | transaction_id: 'TX00086421' -> 'TX00086421' | transaction_date: '10-08-2023' -> '2023-08-10' | quantity: '4' -> '4' | customer_id: 'CUST086421' -> 'CUST086421'
2026-01-12 12:10:25,543 - dq_comparison - INFO - DEBUG HASH STRING: text with trailing spaces|TX00086421|2023-08-10|4|CUST086421...
2026-01-12 12:10:25,544 - dq_comparison - INFO - DEBUG HASH RESULT: 3747eac6...
2026-01-12 12:10:25,545 - dq_comparison - INFO - DEBUG HASH ROW: description: 'Text with& ampersands' -> 'text with& ampersands' | transaction_id: 'TX00001562' -> 'TX00001562' | transaction_date: '19-02-2023' -> '2023-02-19' | quantity: '6' -> '6' | customer_id: 'CUST001562' -> 'CUST001562'
2026-01-12 12:10:25,545 - dq_comparison - INFO - DEBUG HASH STRING: text with& ampersands|TX00001562|2023-02-19|6|CUST001562...
2026-01-12 12:10:25,546 - dq_comparison - INFO - DEBUG HASH RESULT: 566213a6...
2026-01-12 12:10:25,547 - dq_comparison - INFO - DEBUG HASH ROW: description: 'Text with~tildes' -> 'text with~tildes' | transaction_id: 'TX00091832' -> 'TX00091832' | transaction_date: '06-11-2023' -> '2023-11-06' | quantity: '27' -> '27' | customer_id: 'CUST091832' -> 'CUST091832'
2026-01-12 12:10:25,548 - dq_comparison - INFO - DEBUG HASH STRING: text with~tildes|TX00091832|2023-11-06|27|CUST091832...
2026-01-12 12:10:25,548 - dq_comparison - INFO - DEBUG HASH RESULT: 741118c9...
2026-01-12 12:10:25,549 - dq_comparison - INFO - DEBUG HASH ROW: description: 'Text with\backslashes' -> 'text with\backslashes' | transaction_id: 'TX00041754' -> 'TX00041754' | transaction_date: '19-12-2023' -> '2023-12-19' | quantity: '54' -> '54' | customer_id: 'CUST041754' -> 'CUST041754'
2026-01-12 12:10:25,550 - dq_comparison - INFO - DEBUG HASH STRING: text with\backslashes|TX00041754|2023-12-19|54|CUST041754...
2026-01-12 12:10:25,550 - dq_comparison - INFO - DEBUG HASH RESULT: e3f9f1ff...
2026-01-12 12:10:25,552 - dq_comparison - INFO - DEBUG HASH ROW: description: 'Text with; semicolons' -> 'text with; semicolons' | transaction_id: 'TX00070628' -> 'TX00070628' | transaction_date: '30-06-2023' -> '2023-06-30' | quantity: '20' -> '20' | customer_id: 'CUST070628' -> 'CUST070628'
2026-01-12 12:10:25,552 - dq_comparison - INFO - DEBUG HASH STRING: text with; semicolons|TX00070628|2023-06-30|20|CUST070628...
2026-01-12 12:10:25,553 - dq_comparison - INFO - DEBUG HASH RESULT: a06d932c...
2026-01-12 12:10:25,554 - dq_comparison - INFO - DEBUG HASH ROW: description: 'Text with	tabs' -> 'text with tabs' | transaction_id: 'TX00022881' -> 'TX00022881' | transaction_date: '08-06-2023' -> '2023-06-08' | quantity: '10' -> '10' | customer_id: 'CUST022881' -> 'CUST022881'
2026-01-12 12:10:25,554 - dq_comparison - INFO - DEBUG HASH STRING: text with tabs|TX00022881|2023-06-08|10|CUST022881...
2026-01-12 12:10:25,555 - dq_comparison - INFO - DEBUG HASH RESULT: bbe5113f...
2026-01-12 12:10:25,556 - dq_comparison - INFO - DEBUG HASH ROW: description: 'Text with  multiple   spaces' -> 'text with multiple spaces' | transaction_id: 'TX00072124' -> 'TX00072124' | transaction_date: '08-03-2023' -> '2023-03-08' | quantity: '52' -> '52' | customer_id: 'CUST072124' -> 'CUST072124'
2026-01-12 12:10:25,556 - dq_comparison - INFO - DEBUG HASH STRING: text with multiple spaces|TX00072124|2023-03-08|52|CUST072124...
2026-01-12 12:10:25,557 - dq_comparison - INFO - DEBUG HASH RESULT: 948c1144...
2026-01-12 12:10:25,558 - dq_comparison - INFO - DEBUG HASH ROW: description: 'Text with"quotes"' -> 'text with"quotes"' | transaction_id: 'TX00072503' -> 'TX00072503' | transaction_date: '13-06-2023' -> '2023-06-13' | quantity: '77' -> '77' | customer_id: 'CUST072503' -> 'CUST072503'
2026-01-12 12:10:25,558 - dq_comparison - INFO - DEBUG HASH STRING: text with"quotes"|TX00072503|2023-06-13|77|CUST072503...
2026-01-12 12:10:25,559 - dq_comparison - INFO - DEBUG HASH RESULT: 337c3e17...
2026-01-12 12:10:25,560 - dq_comparison - INFO - DEBUG HASH ROW: description: 'Text with*asterisks' -> 'text with*asterisks' | transaction_id: 'TX00089829' -> 'TX00089829' | transaction_date: '22-07-2023' -> '2023-07-22' | quantity: '98' -> '98' | customer_id: 'CUST089829' -> 'CUST089829'
2026-01-12 12:10:25,561 - dq_comparison - INFO - DEBUG HASH STRING: text with*asterisks|TX00089829|2023-07-22|98|CUST089829...
2026-01-12 12:10:25,561 - dq_comparison - INFO - DEBUG HASH RESULT: 26b0d284...
2026-01-12 12:10:25,562 - dq_comparison - INFO - DEBUG HASH ROW: description: 'Text with_underscores' -> 'text with_underscores' | transaction_id: 'TX00063945' -> 'TX00063945' | transaction_date: '13-07-2023' -> '2023-07-13' | quantity: '13' -> '13' | customer_id: 'CUST063945' -> 'CUST063945'
2026-01-12 12:10:25,563 - dq_comparison - INFO - DEBUG HASH STRING: text with_underscores|TX00063945|2023-07-13|13|CUST063945...
2026-01-12 12:10:25,563 - dq_comparison - INFO - DEBUG HASH RESULT: 9b14e8f9...
2026-01-12 12:10:25,565 - dq_comparison - INFO - DEBUG HASH ROW: description: 'Text with%percent signs' -> 'text with%percent signs' | transaction_id: 'TX00099330' -> 'TX00099330' | transaction_date: '03-06-2023' -> '2023-06-03' | quantity: '97' -> '97' | customer_id: 'CUST099330' -> 'CUST099330'
2026-01-12 12:10:25,565 - dq_comparison - INFO - DEBUG HASH STRING: text with%percent signs|TX00099330|2023-06-03|97|CUST099330...
2026-01-12 12:10:25,567 - dq_comparison - INFO - DEBUG HASH RESULT: 45873e3e...
2026-01-12 12:10:25,568 - dq_comparison - INFO - DEBUG HASH ROW: description: 'Text with\backslashes' -> 'text with\backslashes' | transaction_id: 'TX00026762' -> 'TX00026762' | transaction_date: '18-09-2023' -> '2023-09-18' | quantity: '47' -> '47' | customer_id: 'CUST026762' -> 'CUST026762'
2026-01-12 12:10:25,568 - dq_comparison - INFO - DEBUG HASH STRING: text with\backslashes|TX00026762|2023-09-18|47|CUST026762...
2026-01-12 12:10:25,569 - dq_comparison - INFO - DEBUG HASH RESULT: 00fd5e24...
2026-01-12 12:10:25,570 - dq_comparison - INFO - DEBUG HASH ROW: description: 'Text with
newlines' -> 'text with newlines' | transaction_id: 'TX00025278' -> 'TX00025278' | transaction_date: '30-04-2023' -> '2023-04-30' | quantity: '63' -> '63' | customer_id: 'CUST025278' -> 'CUST025278'
2026-01-12 12:10:25,570 - dq_comparison - INFO - DEBUG HASH STRING: text with newlines|TX00025278|2023-04-30|63|CUST025278...
2026-01-12 12:10:25,571 - dq_comparison - INFO - DEBUG HASH RESULT: 9c81fae4...
2026-01-12 12:10:25,572 - dq_comparison - INFO - DEBUG HASH ROW: description: 'Text with& ampersands' -> 'text with& ampersands' | transaction_id: 'TX00098550' -> 'TX00098550' | transaction_date: '15-09-2023' -> '2023-09-15' | quantity: '37' -> '37' | customer_id: 'CUST098550' -> 'CUST098550'
2026-01-12 12:10:25,572 - dq_comparison - INFO - DEBUG HASH STRING: text with& ampersands|TX00098550|2023-09-15|37|CUST098550...
2026-01-12 12:10:25,573 - dq_comparison - INFO - DEBUG HASH RESULT: d30ff598...
2026-01-12 12:10:25,574 - dq_comparison - INFO - DEBUG HASH ROW: description: 'Text with
newlines' -> 'text with newlines' | transaction_id: 'TX00053010' -> 'TX00053010' | transaction_date: '23-03-2023' -> '2023-03-23' | quantity: '48' -> '48' | customer_id: 'CUST053010' -> 'CUST053010'
2026-01-12 12:10:25,574 - dq_comparison - INFO - DEBUG HASH STRING: text with newlines|TX00053010|2023-03-23|48|CUST053010...
2026-01-12 12:10:25,575 - dq_comparison - INFO - DEBUG HASH RESULT: d6fbe929...
2026-01-12 12:10:25,576 - dq_comparison - INFO - DEBUG HASH ROW: description: 'Text with$dollar signs' -> 'text with$dollar signs' | transaction_id: 'TX00085794' -> 'TX00085794' | transaction_date: '08-02-2023' -> '2023-02-08' | quantity: '92' -> '92' | customer_id: 'CUST085794' -> 'CUST085794'
2026-01-12 12:10:25,576 - dq_comparison - INFO - DEBUG HASH STRING: text with$dollar signs|TX00085794|2023-02-08|92|CUST085794...
2026-01-12 12:10:25,577 - dq_comparison - INFO - DEBUG HASH RESULT: 400a5f79...
2026-01-12 12:10:25,578 - dq_comparison - INFO - DEBUG HASH ROW: description: 'Text with. periods' -> 'text with. periods' | transaction_id: 'TX00005951' -> 'TX00005951' | transaction_date: '08/15/2023' -> '2023-08-15' | quantity: '69' -> '69' | customer_id: 'CUST005951' -> 'CUST005951'
2026-01-12 12:10:25,578 - dq_comparison - INFO - DEBUG HASH STRING: text with. periods|TX00005951|2023-08-15|69|CUST005951...
2026-01-12 12:10:25,579 - dq_comparison - INFO - DEBUG HASH RESULT: ac65295d...
2026-01-12 12:10:25,580 - dq_comparison - INFO - DEBUG HASH ROW: description: 'Text with<angle brackets>' -> 'text with<angle brackets>' | transaction_id: 'TX00013386' -> 'TX00013386' | transaction_date: '08-01-2023' -> '2023-01-08' | quantity: '20' -> '20' | customer_id: 'CUST013386' -> 'CUST013386'
2026-01-12 12:10:25,580 - dq_comparison - INFO - DEBUG HASH STRING: text with<angle brackets>|TX00013386|2023-01-08|20|CUST013386...
2026-01-12 12:10:25,581 - dq_comparison - INFO - DEBUG HASH RESULT: 4e852a11...
2026-01-12 12:10:25,582 - dq_comparison - INFO - DEBUG HASH ROW: description: 'Text with/slashes' -> 'text with/slashes' | transaction_id: 'TX00082169' -> 'TX00082169' | transaction_date: '13-12-2023' -> '2023-12-13' | quantity: '64' -> '64' | customer_id: 'CUST082169' -> 'CUST082169'
2026-01-12 12:10:25,583 - dq_comparison - INFO - DEBUG HASH STRING: text with/slashes|TX00082169|2023-12-13|64|CUST082169...
2026-01-12 12:10:25,584 - dq_comparison - INFO - DEBUG HASH RESULT: c5b646e9...
2026-01-12 12:10:25,585 - dq_comparison - INFO - DEBUG HASH ROW: description: 'Text with& ampersands' -> 'text with& ampersands' | transaction_id: 'TX00041731' -> 'TX00041731' | transaction_date: '01/18/2023' -> '2023-01-18' | quantity: '38' -> '38' | customer_id: 'CUST041731' -> 'CUST041731'
2026-01-12 12:10:25,586 - dq_comparison - INFO - DEBUG HASH STRING: text with& ampersands|TX00041731|2023-01-18|38|CUST041731...
2026-01-12 12:10:25,586 - dq_comparison - INFO - DEBUG HASH RESULT: 4e87dda6...
2026-01-12 12:10:25,588 - dq_comparison - INFO - DEBUG HASH ROW: description: 'Text with! exclamations' -> 'text with! exclamations' | transaction_id: 'TX00096030' -> 'TX00096030' | transaction_date: '10-10-2023' -> '2023-10-10' | quantity: '54' -> '54' | customer_id: 'CUST096030' -> 'CUST096030'
2026-01-12 12:10:25,588 - dq_comparison - INFO - DEBUG HASH STRING: text with! exclamations|TX00096030|2023-10-10|54|CUST096030...
2026-01-12 12:10:25,589 - dq_comparison - INFO - DEBUG HASH RESULT: f7ab58fa...
2026-01-12 12:10:25,590 - dq_comparison - INFO - DEBUG HASH ROW: description: 'Text with  multiple   spaces' -> 'text with multiple spaces' | transaction_id: 'TX00069536' -> 'TX00069536' | transaction_date: '05/27/2023' -> '2023-05-27' | quantity: '73' -> '73' | customer_id: 'CUST069536' -> 'CUST069536'
2026-01-12 12:10:25,591 - dq_comparison - INFO - DEBUG HASH STRING: text with multiple spaces|TX00069536|2023-05-27|73|CUST069536...
2026-01-12 12:10:25,592 - dq_comparison - INFO - DEBUG HASH RESULT: 92dd529d...
2026-01-12 12:10:25,593 - dq_comparison - INFO - DEBUG HASH ROW: description: 'Text with! exclamations' -> 'text with! exclamations' | transaction_id: 'TX00003971' -> 'TX00003971' | transaction_date: '05/15/2023' -> '2023-05-15' | quantity: '96' -> '96' | customer_id: 'CUST003971' -> 'CUST003971'
2026-01-12 12:10:25,593 - dq_comparison - INFO - DEBUG HASH STRING: text with! exclamations|TX00003971|2023-05-15|96|CUST003971...
2026-01-12 12:10:25,593 - dq_comparison - INFO - DEBUG HASH RESULT: 8c7812d8...
2026-01-12 12:10:25,595 - dq_comparison - INFO - DEBUG HASH ROW: description: 'Text with. periods' -> 'text with. periods' | transaction_id: 'TX00063328' -> 'TX00063328' | transaction_date: '08-09-2023' -> '2023-09-08' | quantity: '34' -> '34' | customer_id: 'CUST063328' -> 'CUST063328'
2026-01-12 12:10:25,596 - dq_comparison - INFO - DEBUG HASH STRING: text with. periods|TX00063328|2023-09-08|34|CUST063328...
2026-01-12 12:10:25,597 - dq_comparison - INFO - DEBUG HASH RESULT: d565d985...
2026-01-12 12:10:25,598 - dq_comparison - INFO - DEBUG HASH ROW: description: 'Text with*asterisks' -> 'text with*asterisks' | transaction_id: 'TX00059431' -> 'TX00059431' | transaction_date: '01/25/2023' -> '2023-01-25' | quantity: '34' -> '34' | customer_id: 'CUST059431' -> 'CUST059431'
2026-01-12 12:10:25,598 - dq_comparison - INFO - DEBUG HASH STRING: text with*asterisks|TX00059431|2023-01-25|34|CUST059431...
2026-01-12 12:10:25,599 - dq_comparison - INFO - DEBUG HASH RESULT: 24544174...
2026-01-12 12:10:25,601 - dq_comparison - INFO - DEBUG HASH ROW: description: 'Text with? questions' -> 'text with? questions' | transaction_id: 'TX00086522' -> 'TX00086522' | transaction_date: '16-11-2023' -> '2023-11-16' | quantity: '22' -> '22' | customer_id: 'CUST086522' -> 'CUST086522'
2026-01-12 12:10:25,601 - dq_comparison - INFO - DEBUG HASH STRING: text with? questions|TX00086522|2023-11-16|22|CUST086522...
2026-01-12 12:10:25,602 - dq_comparison - INFO - DEBUG HASH RESULT: 618dcbd2...
2026-01-12 12:10:25,603 - dq_comparison - INFO - DEBUG HASH ROW: description: 'Text with<angle brackets>' -> 'text with<angle brackets>' | transaction_id: 'TX00013602' -> 'TX00013602' | transaction_date: '10-04-2023' -> '2023-04-10' | quantity: '64' -> '64' | customer_id: 'CUST013602' -> 'CUST013602'
2026-01-12 12:10:25,604 - dq_comparison - INFO - DEBUG HASH STRING: text with<angle brackets>|TX00013602|2023-04-10|64|CUST013602...
2026-01-12 12:10:25,604 - dq_comparison - INFO - DEBUG HASH RESULT: 8fb49785...
2026-01-12 12:10:25,605 - dq_comparison - INFO - DEBUG HASH ROW: description: 'Text with{braces}' -> 'text with{braces}' | transaction_id: 'TX00054919' -> 'TX00054919' | transaction_date: '24-08-2023' -> '2023-08-24' | quantity: '7' -> '7' | customer_id: 'CUST054919' -> 'CUST054919'
2026-01-12 12:10:25,606 - dq_comparison - INFO - DEBUG HASH STRING: text with{braces}|TX00054919|2023-08-24|7|CUST054919...
2026-01-12 12:10:25,607 - dq_comparison - INFO - DEBUG HASH RESULT: 2809bba6...
2026-01-12 12:10:25,608 - dq_comparison - INFO - DEBUG HASH ROW: description: 'Text with; semicolons' -> 'text with; semicolons' | transaction_id: 'TX00037079' -> 'TX00037079' | transaction_date: '29-05-2023' -> '2023-05-29' | quantity: '75' -> '75' | customer_id: 'CUST037079' -> 'CUST037079'
2026-01-12 12:10:25,608 - dq_comparison - INFO - DEBUG HASH STRING: text with; semicolons|TX00037079|2023-05-29|75|CUST037079...
2026-01-12 12:10:25,609 - dq_comparison - INFO - DEBUG HASH RESULT: 13d30051...
2026-01-12 12:10:25,610 - dq_comparison - INFO - DEBUG HASH ROW: description: 'Text with_underscores' -> 'text with_underscores' | transaction_id: 'TX00002590' -> 'TX00002590' | transaction_date: '19-04-2023' -> '2023-04-19' | quantity: '74' -> '74' | customer_id: 'CUST002590' -> 'CUST002590'
2026-01-12 12:10:25,610 - dq_comparison - INFO - DEBUG HASH STRING: text with_underscores|TX00002590|2023-04-19|74|CUST002590...
2026-01-12 12:10:25,611 - dq_comparison - INFO - DEBUG HASH RESULT: 96937e63...
2026-01-12 12:10:25,612 - dq_comparison - INFO - DEBUG HASH ROW: description: 'Text with! exclamations' -> 'text with! exclamations' | transaction_id: 'TX00075843' -> 'TX00075843' | transaction_date: '28-08-2023' -> '2023-08-28' | quantity: '55' -> '55' | customer_id: 'CUST075843' -> 'CUST075843'
2026-01-12 12:10:25,612 - dq_comparison - INFO - DEBUG HASH STRING: text with! exclamations|TX00075843|2023-08-28|55|CUST075843...
2026-01-12 12:10:25,613 - dq_comparison - INFO - DEBUG HASH RESULT: d23b4ee8...
2026-01-12 12:10:25,614 - dq_comparison - INFO - DEBUG HASH ROW: description: 'Text with"quotes"' -> 'text with"quotes"' | transaction_id: 'TX00050156' -> 'TX00050156' | transaction_date: '10-06-2023' -> '2023-06-10' | quantity: '100' -> '100' | customer_id: 'CUST050156' -> 'CUST050156'
2026-01-12 12:10:25,614 - dq_comparison - INFO - DEBUG HASH STRING: text with"quotes"|TX00050156|2023-06-10|100|CUST050156...
2026-01-12 12:10:25,615 - dq_comparison - INFO - DEBUG HASH RESULT: 5732a36d...
2026-01-12 12:10:25,616 - dq_comparison - INFO - DEBUG HASH ROW: description: 'Text with	tabs' -> 'text with tabs' | transaction_id: 'TX00071835' -> 'TX00071835' | transaction_date: '15-05-2023' -> '2023-05-15' | quantity: '11' -> '11' | customer_id: 'CUST071835' -> 'CUST071835'
2026-01-12 12:10:25,616 - dq_comparison - INFO - DEBUG HASH STRING: text with tabs|TX00071835|2023-05-15|11|CUST071835...
2026-01-12 12:10:25,617 - dq_comparison - INFO - DEBUG HASH RESULT: e7a0e2dd...
2026-01-12 12:10:25,618 - dq_comparison - INFO - DEBUG HASH ROW: description: 'Text with - dashes' -> 'text with - dashes' | transaction_id: 'TX00040463' -> 'TX00040463' | transaction_date: '19-12-2023' -> '2023-12-19' | quantity: '80' -> '80' | customer_id: 'CUST040463' -> 'CUST040463'
2026-01-12 12:10:25,618 - dq_comparison - INFO - DEBUG HASH STRING: text with - dashes|TX00040463|2023-12-19|80|CUST040463...
2026-01-12 12:10:25,619 - dq_comparison - INFO - DEBUG HASH RESULT: b78acb19...
2026-01-12 12:10:25,620 - dq_comparison - INFO - DEBUG HASH ROW: description: 'Text with
newlines' -> 'text with newlines' | transaction_id: 'TX00078764' -> 'TX00078764' | transaction_date: '20-09-2023' -> '2023-09-20' | quantity: '27' -> '27' | customer_id: 'CUST078764' -> 'CUST078764'
2026-01-12 12:10:25,620 - dq_comparison - INFO - DEBUG HASH STRING: text with newlines|TX00078764|2023-09-20|27|CUST078764...
2026-01-12 12:10:25,621 - dq_comparison - INFO - DEBUG HASH RESULT: a9e76484...
2026-01-12 12:10:25,622 - dq_comparison - INFO - DEBUG HASH ROW: description: 'Text with[brackets]' -> 'text with[brackets]' | transaction_id: 'TX00042968' -> 'TX00042968' | transaction_date: '01-02-2023' -> '2023-02-01' | quantity: '87' -> '87' | customer_id: 'CUST042968' -> 'CUST042968'
2026-01-12 12:10:25,623 - dq_comparison - INFO - DEBUG HASH STRING: text with[brackets]|TX00042968|2023-02-01|87|CUST042968...
2026-01-12 12:10:25,623 - dq_comparison - INFO - DEBUG HASH RESULT: 391951d7...
2026-01-12 12:10:25,624 - dq_comparison - INFO - DEBUG HASH ROW: description: 'Text with trailing spaces  ' -> 'text with trailing spaces' | transaction_id: 'TX00097459' -> 'TX00097459' | transaction_date: '30-08-2023' -> '2023-08-30' | quantity: '29' -> '29' | customer_id: 'CUST097459' -> 'CUST097459'
2026-01-12 12:10:25,626 - dq_comparison - INFO - DEBUG HASH STRING: text with trailing spaces|TX00097459|2023-08-30|29|CUST097459...
2026-01-12 12:10:25,626 - dq_comparison - INFO - DEBUG HASH RESULT: af89b8ea...
2026-01-12 12:10:25,627 - dq_comparison - INFO - DEBUG HASH ROW: description: 'Text with`backticks' -> 'text with`backticks' | transaction_id: 'TX00077983' -> 'TX00077983' | transaction_date: '06-11-2023' -> '2023-11-06' | quantity: '28' -> '28' | customer_id: 'CUST077983' -> 'CUST077983'
2026-01-12 12:10:25,627 - dq_comparison - INFO - DEBUG HASH STRING: text with`backticks|TX00077983|2023-11-06|28|CUST077983...
2026-01-12 12:10:25,628 - dq_comparison - INFO - DEBUG HASH RESULT: 11d6b6af...
2026-01-12 12:10:25,629 - dq_comparison - INFO - DEBUG HASH ROW: description: 'Text with_underscores' -> 'text with_underscores' | transaction_id: 'TX00004722' -> 'TX00004722' | transaction_date: '12-06-2023' -> '2023-06-12' | quantity: '29' -> '29' | customer_id: 'CUST004722' -> 'CUST004722'
2026-01-12 12:10:25,630 - dq_comparison - INFO - DEBUG HASH STRING: text with_underscores|TX00004722|2023-06-12|29|CUST004722...
2026-01-12 12:10:25,630 - dq_comparison - INFO - DEBUG HASH RESULT: ebb24355...
2026-01-12 12:10:25,631 - dq_comparison - INFO - DEBUG HASH ROW: description: 'Text with - dashes' -> 'text with - dashes' | transaction_id: 'TX00016067' -> 'TX00016067' | transaction_date: '12-08-2023' -> '2023-08-12' | quantity: '52' -> '52' | customer_id: 'CUST016067' -> 'CUST016067'
2026-01-12 12:10:25,632 - dq_comparison - INFO - DEBUG HASH STRING: text with - dashes|TX00016067|2023-08-12|52|CUST016067...
2026-01-12 12:10:25,632 - dq_comparison - INFO - DEBUG HASH RESULT: 7386884e...
2026-01-12 12:10:25,634 - dq_comparison - INFO - DEBUG HASH ROW: description: 'Text with#hashtags' -> 'text with#hashtags' | transaction_id: 'TX00065995' -> 'TX00065995' | transaction_date: '16-07-2023' -> '2023-07-16' | quantity: '59' -> '59' | customer_id: 'CUST065995' -> 'CUST065995'
2026-01-12 12:10:25,634 - dq_comparison - INFO - DEBUG HASH STRING: text with#hashtags|TX00065995|2023-07-16|59|CUST065995...
2026-01-12 12:10:25,635 - dq_comparison - INFO - DEBUG HASH RESULT: d0817774...
2026-01-12 12:10:25,636 - dq_comparison - INFO - DEBUG HASH ROW: description: 'Text with\backslashes' -> 'text with\backslashes' | transaction_id: 'TX00078304' -> 'TX00078304' | transaction_date: '08-10-2023' -> '2023-10-08' | quantity: '47' -> '47' | customer_id: 'CUST078304' -> 'CUST078304'
2026-01-12 12:10:25,636 - dq_comparison - INFO - DEBUG HASH STRING: text with\backslashes|TX00078304|2023-10-08|47|CUST078304...
2026-01-12 12:10:25,637 - dq_comparison - INFO - DEBUG HASH RESULT: 1e1c5de0...
2026-01-12 12:10:25,638 - dq_comparison - INFO - DEBUG HASH ROW: description: 'Text with#hashtags' -> 'text with#hashtags' | transaction_id: 'TX00087109' -> 'TX00087109' | transaction_date: '28-02-2023' -> '2023-02-28' | quantity: '35' -> '35' | customer_id: 'CUST087109' -> 'CUST087109'
2026-01-12 12:10:25,638 - dq_comparison - INFO - DEBUG HASH STRING: text with#hashtags|TX00087109|2023-02-28|35|CUST087109...
2026-01-12 12:10:25,639 - dq_comparison - INFO - DEBUG HASH RESULT: ca929c4f...
2026-01-12 12:10:25,640 - dq_comparison - INFO - DEBUG HASH ROW: description: 'Text with<angle brackets>' -> 'text with<angle brackets>' | transaction_id: 'TX00002556' -> 'TX00002556' | transaction_date: '11/17/2023' -> '2023-11-17' | quantity: '2' -> '2' | customer_id: 'CUST002556' -> 'CUST002556'
2026-01-12 12:10:25,640 - dq_comparison - INFO - DEBUG HASH STRING: text with<angle brackets>|TX00002556|2023-11-17|2|CUST002556...
2026-01-12 12:10:25,641 - dq_comparison - INFO - DEBUG HASH RESULT: 96471999...
2026-01-12 12:10:25,643 - dq_comparison - INFO - DEBUG HASH ROW: description: 'Text with
newlines' -> 'text with newlines' | transaction_id: 'TX00044558' -> 'TX00044558' | transaction_date: '17-01-2023' -> '2023-01-17' | quantity: '35' -> '35' | customer_id: 'CUST044558' -> 'CUST044558'
2026-01-12 12:10:25,643 - dq_comparison - INFO - DEBUG HASH STRING: text with newlines|TX00044558|2023-01-17|35|CUST044558...
2026-01-12 12:10:25,644 - dq_comparison - INFO - DEBUG HASH RESULT: d0460adb...
2026-01-12 12:10:25,645 - dq_comparison - INFO - DEBUG HASH ROW: description: 'Text with[brackets]' -> 'text with[brackets]' | transaction_id: 'TX00028806' -> 'TX00028806' | transaction_date: '11-05-2023' -> '2023-05-11' | quantity: '75' -> '75' | customer_id: 'CUST028806' -> 'CUST028806'
2026-01-12 12:10:25,646 - dq_comparison - INFO - DEBUG HASH STRING: text with[brackets]|TX00028806|2023-05-11|75|CUST028806...
2026-01-12 12:10:25,646 - dq_comparison - INFO - DEBUG HASH RESULT: c334de5b...
2026-01-12 12:10:25,647 - dq_comparison - INFO - DEBUG HASH ROW: description: '  Text with leading spaces' -> 'text with leading spaces' | transaction_id: 'TX00092302' -> 'TX00092302' | transaction_date: '24-06-2023' -> '2023-06-24' | quantity: '64' -> '64' | customer_id: 'CUST092302' -> 'CUST092302'
2026-01-12 12:10:25,648 - dq_comparison - INFO - DEBUG HASH STRING: text with leading spaces|TX00092302|2023-06-24|64|CUST092302...
2026-01-12 12:10:25,648 - dq_comparison - INFO - DEBUG HASH RESULT: 83f553a2...
2026-01-12 12:10:25,649 - dq_comparison - INFO - DEBUG HASH ROW: description: 'Text with"quotes"' -> 'text with"quotes"' | transaction_id: 'TX00029550' -> 'TX00029550' | transaction_date: '21-07-2023' -> '2023-07-21' | quantity: '61' -> '61' | customer_id: 'CUST029550' -> 'CUST029550'
2026-01-12 12:10:25,650 - dq_comparison - INFO - DEBUG HASH STRING: text with"quotes"|TX00029550|2023-07-21|61|CUST029550...
2026-01-12 12:10:25,650 - dq_comparison - INFO - DEBUG HASH RESULT: 68c18218...
2026-01-12 12:10:25,651 - dq_comparison - INFO - DEBUG HASH ROW: description: 'Normal text without issues' -> 'normal text without issues' | transaction_id: 'TX00058229' -> 'TX00058229' | transaction_date: '01-11-2023' -> '2023-11-01' | quantity: '3' -> '3' | customer_id: 'CUST058229' -> 'CUST058229'
2026-01-12 12:10:25,652 - dq_comparison - INFO - DEBUG HASH STRING: normal text without issues|TX00058229|2023-11-01|3|CUST058229...
2026-01-12 12:10:25,652 - dq_comparison - INFO - DEBUG HASH RESULT: cace9742...
2026-01-12 12:10:25,653 - dq_comparison - INFO - DEBUG HASH ROW: description: 'Text with$dollar signs' -> 'text with$dollar signs' | transaction_id: 'TX00076626' -> 'TX00076626' | transaction_date: '07-03-2023' -> '2023-03-07' | quantity: '42' -> '42' | customer_id: 'CUST076626' -> 'CUST076626'
2026-01-12 12:10:25,654 - dq_comparison - INFO - DEBUG HASH STRING: text with$dollar signs|TX00076626|2023-03-07|42|CUST076626...
2026-01-12 12:10:25,654 - dq_comparison - INFO - DEBUG HASH RESULT: 5c8e0801...
2026-01-12 12:10:25,655 - dq_comparison - INFO - DEBUG HASH ROW: description: '  Text with leading spaces' -> 'text with leading spaces' | transaction_id: 'TX00092634' -> 'TX00092634' | transaction_date: '19-07-2023' -> '2023-07-19' | quantity: '20' -> '20' | customer_id: 'CUST092634' -> 'CUST092634'
2026-01-12 12:10:25,656 - dq_comparison - INFO - DEBUG HASH STRING: text with leading spaces|TX00092634|2023-07-19|20|CUST092634...
2026-01-12 12:10:25,656 - dq_comparison - INFO - DEBUG HASH RESULT: 81c78155...
2026-01-12 12:10:25,657 - dq_comparison - INFO - DEBUG HASH ROW: description: 'Text with, commas' -> 'text with, commas' | transaction_id: 'TX00069926' -> 'TX00069926' | transaction_date: '08-08-2023' -> '2023-08-08' | quantity: '19' -> '19' | customer_id: 'CUST069926' -> 'CUST069926'
2026-01-12 12:10:25,658 - dq_comparison - INFO - DEBUG HASH STRING: text with, commas|TX00069926|2023-08-08|19|CUST069926...
2026-01-12 12:10:25,658 - dq_comparison - INFO - DEBUG HASH RESULT: 60415ede...
2026-01-12 12:10:25,659 - dq_comparison - INFO - DEBUG HASH ROW: description: 'Text with|pipes' -> 'text with|pipes' | transaction_id: 'TX00091610' -> 'TX00091610' | transaction_date: '27-02-2023' -> '2023-02-27' | quantity: '5' -> '5' | customer_id: 'CUST091610' -> 'CUST091610'
2026-01-12 12:10:25,660 - dq_comparison - INFO - DEBUG HASH STRING: text with|pipes|TX00091610|2023-02-27|5|CUST091610...
2026-01-12 12:10:25,661 - dq_comparison - INFO - DEBUG HASH RESULT: fe7537d6...
2026-01-12 12:10:25,662 - dq_comparison - INFO - DEBUG HASH ROW: description: 'Text with trailing spaces  ' -> 'text with trailing spaces' | transaction_id: 'TX00015490' -> 'TX00015490' | transaction_date: '25-06-2023' -> '2023-06-25' | quantity: '33' -> '33' | customer_id: 'CUST015490' -> 'CUST015490'
2026-01-12 12:10:25,662 - dq_comparison - INFO - DEBUG HASH STRING: text with trailing spaces|TX00015490|2023-06-25|33|CUST015490...
2026-01-12 12:10:25,663 - dq_comparison - INFO - DEBUG HASH RESULT: 2764d251...
2026-01-12 12:10:25,664 - dq_comparison - INFO - DEBUG HASH ROW: description: 'Text with\backslashes' -> 'text with\backslashes' | transaction_id: 'TX00068090' -> 'TX00068090' | transaction_date: '26-01-2023' -> '2023-01-26' | quantity: '28' -> '28' | customer_id: 'CUST068090' -> 'CUST068090'
2026-01-12 12:10:25,664 - dq_comparison - INFO - DEBUG HASH STRING: text with\backslashes|TX00068090|2023-01-26|28|CUST068090...
2026-01-12 12:10:25,665 - dq_comparison - INFO - DEBUG HASH RESULT: 1d268ae6...
2026-01-12 12:10:25,666 - dq_comparison - INFO - DEBUG HASH ROW: description: 'Text with`backticks' -> 'text with`backticks' | transaction_id: 'TX00098655' -> 'TX00098655' | transaction_date: '29-05-2023' -> '2023-05-29' | quantity: '73' -> '73' | customer_id: 'CUST098655' -> 'CUST098655'
2026-01-12 12:10:25,666 - dq_comparison - INFO - DEBUG HASH STRING: text with`backticks|TX00098655|2023-05-29|73|CUST098655...
2026-01-12 12:10:25,667 - dq_comparison - INFO - DEBUG HASH RESULT: 1039bebd...
2026-01-12 12:10:25,668 - dq_comparison - INFO - DEBUG HASH ROW: description: 'Text with"quotes"' -> 'text with"quotes"' | transaction_id: 'TX00044139' -> 'TX00044139' | transaction_date: '29-04-2023' -> '2023-04-29' | quantity: '61' -> '61' | customer_id: 'CUST044139' -> 'CUST044139'
2026-01-12 12:10:25,668 - dq_comparison - INFO - DEBUG HASH STRING: text with"quotes"|TX00044139|2023-04-29|61|CUST044139...
2026-01-12 12:10:25,669 - dq_comparison - INFO - DEBUG HASH RESULT: 4034710a...
2026-01-12 12:10:25,669 - dq_comparison - INFO - DEBUG HASH ROW: description: 'Text with& ampersands' -> 'text with& ampersands' | transaction_id: 'TX00075657' -> 'TX00075657' | transaction_date: '04-09-2023' -> '2023-09-04' | quantity: '98' -> '98' | customer_id: 'CUST075657' -> 'CUST075657'
2026-01-12 12:10:25,670 - dq_comparison - INFO - DEBUG HASH STRING: text with& ampersands|TX00075657|2023-09-04|98|CUST075657...
2026-01-12 12:10:25,670 - dq_comparison - INFO - DEBUG HASH RESULT: f1ad0eb7...
2026-01-12 12:10:25,671 - dq_comparison - INFO - DEBUG HASH ROW: description: 'Text with(parentheses)' -> 'text with(parentheses)' | transaction_id: 'TX00064513' -> 'TX00064513' | transaction_date: '29-05-2023' -> '2023-05-29' | quantity: '78' -> '78' | customer_id: 'CUST064513' -> 'CUST064513'
2026-01-12 12:10:25,672 - dq_comparison - INFO - DEBUG HASH STRING: text with(parentheses)|TX00064513|2023-05-29|78|CUST064513...
2026-01-12 12:10:25,672 - dq_comparison - INFO - DEBUG HASH RESULT: 273df229...
2026-01-12 12:10:25,673 - dq_comparison - INFO - DEBUG HASH ROW: description: 'Text with'apostrophes' -> 'text with'apostrophes' | transaction_id: 'TX00075401' -> 'TX00075401' | transaction_date: '10/30/2023' -> '2023-10-30' | quantity: '74' -> '74' | customer_id: 'CUST075401' -> 'CUST075401'
2026-01-12 12:10:25,674 - dq_comparison - INFO - DEBUG HASH STRING: text with'apostrophes|TX00075401|2023-10-30|74|CUST075401...
2026-01-12 12:10:25,674 - dq_comparison - INFO - DEBUG HASH RESULT: 18495c46...
2026-01-12 12:10:25,675 - dq_comparison - INFO - DEBUG HASH ROW: description: 'Text with|pipes' -> 'text with|pipes' | transaction_id: 'TX00026672' -> 'TX00026672' | transaction_date: '20-01-2023' -> '2023-01-20' | quantity: '45' -> '45' | customer_id: 'CUST026672' -> 'CUST026672'
2026-01-12 12:10:25,676 - dq_comparison - INFO - DEBUG HASH STRING: text with|pipes|TX00026672|2023-01-20|45|CUST026672...
2026-01-12 12:10:25,676 - dq_comparison - INFO - DEBUG HASH RESULT: 63556af2...
2026-01-12 12:10:25,678 - dq_comparison - INFO - DEBUG HASH ROW: description: 'Text with@at signs' -> 'text with@at signs' | transaction_id: 'TX00069394' -> 'TX00069394' | transaction_date: '30-08-2023' -> '2023-08-30' | quantity: '91' -> '91' | customer_id: 'CUST069394' -> 'CUST069394'
2026-01-12 12:10:25,678 - dq_comparison - INFO - DEBUG HASH STRING: text with@at signs|TX00069394|2023-08-30|91|CUST069394...
2026-01-12 12:10:25,679 - dq_comparison - INFO - DEBUG HASH RESULT: 9cd01f5e...
2026-01-12 12:10:25,679 - dq_comparison - INFO - DEBUG HASH ROW: description: 'Text with*asterisks' -> 'text with*asterisks' | transaction_id: 'TX00009370' -> 'TX00009370' | transaction_date: '15-01-2023' -> '2023-01-15' | quantity: '2' -> '2' | customer_id: 'CUST009370' -> 'CUST009370'
2026-01-12 12:10:25,680 - dq_comparison - INFO - DEBUG HASH STRING: text with*asterisks|TX00009370|2023-01-15|2|CUST009370...
2026-01-12 12:10:25,681 - dq_comparison - INFO - DEBUG HASH RESULT: 598ded03...
2026-01-12 12:10:25,682 - dq_comparison - INFO - DEBUG HASH ROW: description: 'Text with{braces}' -> 'text with{braces}' | transaction_id: 'TX00024126' -> 'TX00024126' | transaction_date: '07/19/2023' -> '2023-07-19' | quantity: '64' -> '64' | customer_id: 'CUST024126' -> 'CUST024126'
2026-01-12 12:10:25,682 - dq_comparison - INFO - DEBUG HASH STRING: text with{braces}|TX00024126|2023-07-19|64|CUST024126...
2026-01-12 12:10:25,683 - dq_comparison - INFO - DEBUG HASH RESULT: 9f37a9f1...
2026-01-12 12:10:25,684 - dq_comparison - INFO - DEBUG HASH ROW: description: 'Text with%percent signs' -> 'text with%percent signs' | transaction_id: 'TX00019862' -> 'TX00019862' | transaction_date: '25-04-2023' -> '2023-04-25' | quantity: '9' -> '9' | customer_id: 'CUST019862' -> 'CUST019862'
2026-01-12 12:10:25,684 - dq_comparison - INFO - DEBUG HASH STRING: text with%percent signs|TX00019862|2023-04-25|9|CUST019862...
2026-01-12 12:10:25,685 - dq_comparison - INFO - DEBUG HASH RESULT: c64c2819...
2026-01-12 12:10:25,685 - dq_comparison - INFO - DEBUG HASH ROW: description: 'Text with. periods' -> 'text with. periods' | transaction_id: 'TX00001011' -> 'TX00001011' | transaction_date: '03-09-2023' -> '2023-09-03' | quantity: '23' -> '23' | customer_id: 'CUST001011' -> 'CUST001011'
2026-01-12 12:10:25,686 - dq_comparison - INFO - DEBUG HASH STRING: text with. periods|TX00001011|2023-09-03|23|CUST001011...
2026-01-12 12:10:25,686 - dq_comparison - INFO - DEBUG HASH RESULT: e5e6d069...
2026-01-12 12:10:25,687 - dq_comparison - INFO - DEBUG HASH ROW: description: 'Text with mixed CAPITAL and lowercase' -> 'text with mixed capital and lowercase' | transaction_id: 'TX00043615' -> 'TX00043615' | transaction_date: '01-04-2023' -> '2023-04-01' | quantity: '56' -> '56' | customer_id: 'CUST043615' -> 'CUST043615'
2026-01-12 12:10:25,688 - dq_comparison - INFO - DEBUG HASH STRING: text with mixed capital and lowercase|TX00043615|2023-04-01|56|CUST043615...
2026-01-12 12:10:25,689 - dq_comparison - INFO - DEBUG HASH RESULT: 66cd80a0...
2026-01-12 12:10:25,689 - dq_comparison - INFO - DEBUG HASH ROW: description: 'Text with{braces}' -> 'text with{braces}' | transaction_id: 'TX00048709' -> 'TX00048709' | transaction_date: '07-11-2023' -> '2023-11-07' | quantity: '52' -> '52' | customer_id: 'CUST048709' -> 'CUST048709'
2026-01-12 12:10:25,690 - dq_comparison - INFO - DEBUG HASH STRING: text with{braces}|TX00048709|2023-11-07|52|CUST048709...
2026-01-12 12:10:25,690 - dq_comparison - INFO - DEBUG HASH RESULT: 97dca8c0...
2026-01-12 12:10:25,691 - dq_comparison - INFO - DEBUG HASH ROW: description: 'Text with'apostrophes' -> 'text with'apostrophes' | transaction_id: 'TX00005364' -> 'TX00005364' | transaction_date: '24-08-2023' -> '2023-08-24' | quantity: '59' -> '59' | customer_id: 'CUST005364' -> 'CUST005364'
2026-01-12 12:10:25,692 - dq_comparison - INFO - DEBUG HASH STRING: text with'apostrophes|TX00005364|2023-08-24|59|CUST005364...
2026-01-12 12:10:25,692 - dq_comparison - INFO - DEBUG HASH RESULT: 645ca6b2...
2026-01-12 12:10:25,693 - dq_comparison - INFO - DEBUG HASH ROW: description: 'Text with"quotes"' -> 'text with"quotes"' | transaction_id: 'TX00001506' -> 'TX00001506' | transaction_date: '10/20/2023' -> '2023-10-20' | quantity: '5' -> '5' | customer_id: 'CUST001506' -> 'CUST001506'
2026-01-12 12:10:25,694 - dq_comparison - INFO - DEBUG HASH STRING: text with"quotes"|TX00001506|2023-10-20|5|CUST001506...
2026-01-12 12:10:25,694 - dq_comparison - INFO - DEBUG HASH RESULT: 2573adba...
2026-01-12 12:10:25,695 - dq_comparison - INFO - DEBUG HASH ROW: description: 'Text with"quotes"' -> 'text with"quotes"' | transaction_id: 'TX00095696' -> 'TX00095696' | transaction_date: '02-01-2023' -> '2023-01-02' | quantity: '37' -> '37' | customer_id: 'CUST095696' -> 'CUST095696'
2026-01-12 12:10:25,695 - dq_comparison - INFO - DEBUG HASH STRING: text with"quotes"|TX00095696|2023-01-02|37|CUST095696...
2026-01-12 12:10:25,696 - dq_comparison - INFO - DEBUG HASH RESULT: b5523d9a...
2026-01-12 12:10:25,697 - dq_comparison - INFO - DEBUG HASH ROW: description: 'Text with mixed CAPITAL and lowercase' -> 'text with mixed capital and lowercase' | transaction_id: 'TX00042735' -> 'TX00042735' | transaction_date: '27-10-2023' -> '2023-10-27' | quantity: '95' -> '95' | customer_id: 'CUST042735' -> 'CUST042735'
2026-01-12 12:10:25,697 - dq_comparison - INFO - DEBUG HASH STRING: text with mixed capital and lowercase|TX00042735|2023-10-27|95|CUST042735...
2026-01-12 12:10:25,698 - dq_comparison - INFO - DEBUG HASH RESULT: 4402912f...
2026-01-12 12:10:25,699 - dq_comparison - INFO - DEBUG HASH ROW: description: 'Text with'apostrophes' -> 'text with'apostrophes' | transaction_id: 'TX00022696' -> 'TX00022696' | transaction_date: '06-06-2023' -> '2023-06-06' | quantity: '37' -> '37' | customer_id: 'CUST022696' -> 'CUST022696'
2026-01-12 12:10:25,699 - dq_comparison - INFO - DEBUG HASH STRING: text with'apostrophes|TX00022696|2023-06-06|37|CUST022696...
2026-01-12 12:10:25,700 - dq_comparison - INFO - DEBUG HASH RESULT: 42ca4194...
2026-01-12 12:10:25,701 - dq_comparison - INFO - DEBUG HASH ROW: description: 'Text with\backslashes' -> 'text with\backslashes' | transaction_id: 'TX00038234' -> 'TX00038234' | transaction_date: '04-08-2023' -> '2023-08-04' | quantity: '10' -> '10' | customer_id: 'CUST038234' -> 'CUST038234'
2026-01-12 12:10:25,701 - dq_comparison - INFO - DEBUG HASH STRING: text with\backslashes|TX00038234|2023-08-04|10|CUST038234...
2026-01-12 12:10:25,701 - dq_comparison - INFO - DEBUG HASH RESULT: 2561a5ba...
2026-01-12 12:10:25,702 - dq_comparison - INFO - DEBUG HASH ROW: description: 'Text with? questions' -> 'text with? questions' | transaction_id: 'TX00079553' -> 'TX00079553' | transaction_date: '22-10-2023' -> '2023-10-22' | quantity: '47' -> '47' | customer_id: 'CUST079553' -> 'CUST079553'
2026-01-12 12:10:25,703 - dq_comparison - INFO - DEBUG HASH STRING: text with? questions|TX00079553|2023-10-22|47|CUST079553...
2026-01-12 12:10:25,703 - dq_comparison - INFO - DEBUG HASH RESULT: c191078a...
2026-01-12 12:10:25,704 - dq_comparison - INFO - DEBUG HASH ROW: description: 'Text with{braces}' -> 'text with{braces}' | transaction_id: 'TX00066471' -> 'TX00066471' | transaction_date: '08-07-2023' -> '2023-07-08' | quantity: '6' -> '6' | customer_id: 'CUST066471' -> 'CUST066471'
2026-01-12 12:10:25,705 - dq_comparison - INFO - DEBUG HASH STRING: text with{braces}|TX00066471|2023-07-08|6|CUST066471...
2026-01-12 12:10:25,705 - dq_comparison - INFO - DEBUG HASH RESULT: 5138a051...
2026-01-12 12:10:25,706 - dq_comparison - INFO - DEBUG HASH ROW: description: 'Text with mixed CAPITAL and lowercase' -> 'text with mixed capital and lowercase' | transaction_id: 'TX00019284' -> 'TX00019284' | transaction_date: '22-06-2023' -> '2023-06-22' | quantity: '9' -> '9' | customer_id: 'CUST019284' -> 'CUST019284'
2026-01-12 12:10:25,707 - dq_comparison - INFO - DEBUG HASH STRING: text with mixed capital and lowercase|TX00019284|2023-06-22|9|CUST019284...
2026-01-12 12:10:25,708 - dq_comparison - INFO - DEBUG HASH RESULT: ad9e2a85...
2026-01-12 12:10:25,709 - dq_comparison - INFO - DEBUG HASH ROW: description: 'Text with? questions' -> 'text with? questions' | transaction_id: 'TX00040566' -> 'TX00040566' | transaction_date: '05-07-2023' -> '2023-07-05' | quantity: '95' -> '95' | customer_id: 'CUST040566' -> 'CUST040566'
2026-01-12 12:10:25,709 - dq_comparison - INFO - DEBUG HASH STRING: text with? questions|TX00040566|2023-07-05|95|CUST040566...
2026-01-12 12:10:25,710 - dq_comparison - INFO - DEBUG HASH RESULT: 9bf7a6ed...
2026-01-12 12:10:25,711 - dq_comparison - INFO - DEBUG HASH ROW: description: 'Text with_underscores' -> 'text with_underscores' | transaction_id: 'TX00076956' -> 'TX00076956' | transaction_date: '02-08-2023' -> '2023-08-02' | quantity: '98' -> '98' | customer_id: 'CUST076956' -> 'CUST076956'
2026-01-12 12:10:25,711 - dq_comparison - INFO - DEBUG HASH STRING: text with_underscores|TX00076956|2023-08-02|98|CUST076956...
2026-01-12 12:10:25,712 - dq_comparison - INFO - DEBUG HASH RESULT: 0767ff1b...
2026-01-12 12:10:25,713 - dq_comparison - INFO - DEBUG HASH ROW: description: 'Text with'apostrophes' -> 'text with'apostrophes' | transaction_id: 'TX00099590' -> 'TX00099590' | transaction_date: '11-01-2023' -> '2023-01-11' | quantity: '33' -> '33' | customer_id: 'CUST099590' -> 'CUST099590'
2026-01-12 12:10:25,713 - dq_comparison - INFO - DEBUG HASH STRING: text with'apostrophes|TX00099590|2023-01-11|33|CUST099590...
2026-01-12 12:10:25,714 - dq_comparison - INFO - DEBUG HASH RESULT: 2991ac9a...
2026-01-12 12:10:25,715 - dq_comparison - INFO - DEBUG HASH ROW: description: 'Text with[brackets]' -> 'text with[brackets]' | transaction_id: 'TX00056551' -> 'TX00056551' | transaction_date: '03/30/2023' -> '2023-03-30' | quantity: '63' -> '63' | customer_id: 'CUST056551' -> 'CUST056551'
2026-01-12 12:10:25,715 - dq_comparison - INFO - DEBUG HASH STRING: text with[brackets]|TX00056551|2023-03-30|63|CUST056551...
2026-01-12 12:10:25,716 - dq_comparison - INFO - DEBUG HASH RESULT: 7068cfa0...
2026-01-12 12:10:25,717 - dq_comparison - INFO - DEBUG HASH ROW: description: 'Text with{braces}' -> 'text with{braces}' | transaction_id: 'TX00034112' -> 'TX00034112' | transaction_date: '27-01-2023' -> '2023-01-27' | quantity: '95' -> '95' | customer_id: 'CUST034112' -> 'CUST034112'
2026-01-12 12:10:25,717 - dq_comparison - INFO - DEBUG HASH STRING: text with{braces}|TX00034112|2023-01-27|95|CUST034112...
2026-01-12 12:10:25,718 - dq_comparison - INFO - DEBUG HASH RESULT: 623d827f...
2026-01-12 12:10:25,719 - dq_comparison - INFO - DEBUG HASH ROW: description: 'Text with. periods' -> 'text with. periods' | transaction_id: 'TX00049080' -> 'TX00049080' | transaction_date: '15-03-2023' -> '2023-03-15' | quantity: '62' -> '62' | customer_id: 'CUST049080' -> 'CUST049080'
2026-01-12 12:10:25,720 - dq_comparison - INFO - DEBUG HASH STRING: text with. periods|TX00049080|2023-03-15|62|CUST049080...
2026-01-12 12:10:25,720 - dq_comparison - INFO - DEBUG HASH RESULT: 63dda1a3...
2026-01-12 12:10:25,721 - dq_comparison - INFO - DEBUG HASH ROW: description: 'Text with, commas' -> 'text with, commas' | transaction_id: 'TX00024936' -> 'TX00024936' | transaction_date: '11-08-2023' -> '2023-08-11' | quantity: '21' -> '21' | customer_id: 'CUST024936' -> 'CUST024936'
2026-01-12 12:10:25,722 - dq_comparison - INFO - DEBUG HASH STRING: text with, commas|TX00024936|2023-08-11|21|CUST024936...
2026-01-12 12:10:25,723 - dq_comparison - INFO - DEBUG HASH RESULT: eb252785...
2026-01-12 12:10:25,724 - dq_comparison - INFO - DEBUG HASH ROW: description: 'Text with{braces}' -> 'text with{braces}' | transaction_id: 'TX00033543' -> 'TX00033543' | transaction_date: '06-05-2023' -> '2023-05-06' | quantity: '60' -> '60' | customer_id: 'CUST033543' -> 'CUST033543'
2026-01-12 12:10:25,724 - dq_comparison - INFO - DEBUG HASH STRING: text with{braces}|TX00033543|2023-05-06|60|CUST033543...
2026-01-12 12:10:25,725 - dq_comparison - INFO - DEBUG HASH RESULT: 73b5de5b...
2026-01-12 12:10:25,726 - dq_comparison - INFO - DEBUG HASH ROW: description: '  Text with leading spaces' -> 'text with leading spaces' | transaction_id: 'TX00007408' -> 'TX00007408' | transaction_date: '06-04-2023' -> '2023-04-06' | quantity: '48' -> '48' | customer_id: 'CUST007408' -> 'CUST007408'
2026-01-12 12:10:25,726 - dq_comparison - INFO - DEBUG HASH STRING: text with leading spaces|TX00007408|2023-04-06|48|CUST007408...
2026-01-12 12:10:25,727 - dq_comparison - INFO - DEBUG HASH RESULT: b529dbb9...
2026-01-12 12:10:25,728 - dq_comparison - INFO - DEBUG HASH ROW: description: 'Text with. periods' -> 'text with. periods' | transaction_id: 'TX00017014' -> 'TX00017014' | transaction_date: '23-01-2023' -> '2023-01-23' | quantity: '51' -> '51' | customer_id: 'CUST017014' -> 'CUST017014'
2026-01-12 12:10:25,728 - dq_comparison - INFO - DEBUG HASH STRING: text with. periods|TX00017014|2023-01-23|51|CUST017014...
2026-01-12 12:10:25,729 - dq_comparison - INFO - DEBUG HASH RESULT: 00df992b...
2026-01-12 12:10:25,730 - dq_comparison - INFO - DEBUG HASH ROW: description: 'Text with(parentheses)' -> 'text with(parentheses)' | transaction_id: 'TX00014861' -> 'TX00014861' | transaction_date: '04/19/2023' -> '2023-04-19' | quantity: '77' -> '77' | customer_id: 'CUST014861' -> 'CUST014861'
2026-01-12 12:10:25,731 - dq_comparison - INFO - DEBUG HASH STRING: text with(parentheses)|TX00014861|2023-04-19|77|CUST014861...
2026-01-12 12:10:25,731 - dq_comparison - INFO - DEBUG HASH RESULT: ee728399...
2026-01-12 12:10:25,732 - dq_comparison - INFO - DEBUG HASH ROW: description: 'Text with	tabs' -> 'text with tabs' | transaction_id: 'TX00003087' -> 'TX00003087' | transaction_date: '28-01-2023' -> '2023-01-28' | quantity: '74' -> '74' | customer_id: 'CUST003087' -> 'CUST003087'
2026-01-12 12:10:25,733 - dq_comparison - INFO - DEBUG HASH STRING: text with tabs|TX00003087|2023-01-28|74|CUST003087...
2026-01-12 12:10:25,733 - dq_comparison - INFO - DEBUG HASH RESULT: 7229709d...
2026-01-12 12:10:25,735 - dq_comparison - INFO - DEBUG HASH ROW: description: 'Text with/slashes' -> 'text with/slashes' | transaction_id: 'TX00058497' -> 'TX00058497' | transaction_date: '02-02-2023' -> '2023-02-02' | quantity: '26' -> '26' | customer_id: 'CUST058497' -> 'CUST058497'
2026-01-12 12:10:25,736 - dq_comparison - INFO - DEBUG HASH STRING: text with/slashes|TX00058497|2023-02-02|26|CUST058497...
2026-01-12 12:10:25,736 - dq_comparison - INFO - DEBUG HASH RESULT: 7b91d151...
2026-01-12 12:10:25,737 - dq_comparison - INFO - DEBUG HASH ROW: description: 'Text with[brackets]' -> 'text with[brackets]' | transaction_id: 'TX00030341' -> 'TX00030341' | transaction_date: '06-05-2023' -> '2023-05-06' | quantity: '39' -> '39' | customer_id: 'CUST030341' -> 'CUST030341'
2026-01-12 12:10:25,738 - dq_comparison - INFO - DEBUG HASH STRING: text with[brackets]|TX00030341|2023-05-06|39|CUST030341...
2026-01-12 12:10:25,739 - dq_comparison - INFO - DEBUG HASH RESULT: bc749aa3...
2026-01-12 12:10:25,740 - dq_comparison - INFO - DEBUG HASH ROW: description: 'Text with, commas' -> 'text with, commas' | transaction_id: 'TX00032487' -> 'TX00032487' | transaction_date: '05-05-2023' -> '2023-05-05' | quantity: '78' -> '78' | customer_id: 'CUST032487' -> 'CUST032487'
2026-01-12 12:10:25,740 - dq_comparison - INFO - DEBUG HASH STRING: text with, commas|TX00032487|2023-05-05|78|CUST032487...
2026-01-12 12:10:25,741 - dq_comparison - INFO - DEBUG HASH RESULT: a759175b...
2026-01-12 12:10:25,742 - dq_comparison - INFO - DEBUG HASH ROW: description: 'Text with#hashtags' -> 'text with#hashtags' | transaction_id: 'TX00059396' -> 'TX00059396' | transaction_date: '01/21/2023' -> '2023-01-21' | quantity: '71' -> '71' | customer_id: 'CUST059396' -> 'CUST059396'
2026-01-12 12:10:25,742 - dq_comparison - INFO - DEBUG HASH STRING: text with#hashtags|TX00059396|2023-01-21|71|CUST059396...
2026-01-12 12:10:25,743 - dq_comparison - INFO - DEBUG HASH RESULT: 5ca451ca...
2026-01-12 12:10:25,744 - dq_comparison - INFO - DEBUG HASH ROW: description: 'Text with@at signs' -> 'text with@at signs' | transaction_id: 'TX00010247' -> 'TX00010247' | transaction_date: '05-08-2023' -> '2023-08-05' | quantity: '84' -> '84' | customer_id: 'CUST010247' -> 'CUST010247'
2026-01-12 12:10:25,744 - dq_comparison - INFO - DEBUG HASH STRING: text with@at signs|TX00010247|2023-08-05|84|CUST010247...
2026-01-12 12:10:25,745 - dq_comparison - INFO - DEBUG HASH RESULT: 1c3be5aa...
2026-01-12 12:10:25,746 - dq_comparison - INFO - DEBUG HASH ROW: description: 'Text with[brackets]' -> 'text with[brackets]' | transaction_id: 'TX00060361' -> 'TX00060361' | transaction_date: '05-04-2023' -> '2023-04-05' | quantity: '74' -> '74' | customer_id: 'CUST060361' -> 'CUST060361'
2026-01-12 12:10:25,746 - dq_comparison - INFO - DEBUG HASH STRING: text with[brackets]|TX00060361|2023-04-05|74|CUST060361...
2026-01-12 12:10:25,747 - dq_comparison - INFO - DEBUG HASH RESULT: e268af4b...
2026-01-12 12:10:25,748 - dq_comparison - INFO - DEBUG HASH ROW: description: 'Text with. periods' -> 'text with. periods' | transaction_id: 'TX00065283' -> 'TX00065283' | transaction_date: '07-09-2023' -> '2023-09-07' | quantity: '81' -> '81' | customer_id: 'CUST065283' -> 'CUST065283'
2026-01-12 12:10:25,748 - dq_comparison - INFO - DEBUG HASH STRING: text with. periods|TX00065283|2023-09-07|81|CUST065283...
2026-01-12 12:10:25,749 - dq_comparison - INFO - DEBUG HASH RESULT: 478783bb...
2026-01-12 12:10:25,750 - dq_comparison - INFO - DEBUG HASH ROW: description: 'Text with& ampersands' -> 'text with& ampersands' | transaction_id: 'TX00097312' -> 'TX00097312' | transaction_date: '17-09-2023' -> '2023-09-17' | quantity: '99' -> '99' | customer_id: 'CUST097312' -> 'CUST097312'
2026-01-12 12:10:25,750 - dq_comparison - INFO - DEBUG HASH STRING: text with& ampersands|TX00097312|2023-09-17|99|CUST097312...
2026-01-12 12:10:25,751 - dq_comparison - INFO - DEBUG HASH RESULT: fdf23743...
2026-01-12 12:10:25,752 - dq_comparison - INFO - DEBUG HASH ROW: description: 'Text with
newlines' -> 'text with newlines' | transaction_id: 'TX00017749' -> 'TX00017749' | transaction_date: '13-05-2023' -> '2023-05-13' | quantity: '78' -> '78' | customer_id: 'CUST017749' -> 'CUST017749'
2026-01-12 12:10:25,752 - dq_comparison - INFO - DEBUG HASH STRING: text with newlines|TX00017749|2023-05-13|78|CUST017749...
2026-01-12 12:10:25,753 - dq_comparison - INFO - DEBUG HASH RESULT: cf4212d9...
2026-01-12 12:10:25,754 - dq_comparison - INFO - DEBUG HASH ROW: description: 'Text with@at signs' -> 'text with@at signs' | transaction_id: 'TX00040712' -> 'TX00040712' | transaction_date: '28-10-2023' -> '2023-10-28' | quantity: '98' -> '98' | customer_id: 'CUST040712' -> 'CUST040712'
2026-01-12 12:10:25,755 - dq_comparison - INFO - DEBUG HASH STRING: text with@at signs|TX00040712|2023-10-28|98|CUST040712...
2026-01-12 12:10:25,755 - dq_comparison - INFO - DEBUG HASH RESULT: 175c1e56...
2026-01-12 12:10:25,756 - dq_comparison - INFO - DEBUG HASH ROW: description: 'Text with\backslashes' -> 'text with\backslashes' | transaction_id: 'TX00057115' -> 'TX00057115' | transaction_date: '25-01-2023' -> '2023-01-25' | quantity: '45' -> '45' | customer_id: 'CUST057115' -> 'CUST057115'
2026-01-12 12:10:25,757 - dq_comparison - INFO - DEBUG HASH STRING: text with\backslashes|TX00057115|2023-01-25|45|CUST057115...
2026-01-12 12:10:25,758 - dq_comparison - INFO - DEBUG HASH RESULT: 368c4c80...
2026-01-12 12:10:25,759 - dq_comparison - INFO - DEBUG HASH ROW: description: 'Text with& ampersands' -> 'text with& ampersands' | transaction_id: 'TX00058621' -> 'TX00058621' | transaction_date: '08/18/2023' -> '2023-08-18' | quantity: '74' -> '74' | customer_id: 'CUST058621' -> 'CUST058621'
2026-01-12 12:10:25,759 - dq_comparison - INFO - DEBUG HASH STRING: text with& ampersands|TX00058621|2023-08-18|74|CUST058621...
2026-01-12 12:10:25,760 - dq_comparison - INFO - DEBUG HASH RESULT: 5903ee9a...
2026-01-12 12:10:25,761 - dq_comparison - INFO - DEBUG HASH ROW: description: 'Text with
newlines' -> 'text with newlines' | transaction_id: 'TX00056796' -> 'TX00056796' | transaction_date: '11/27/2023' -> '2023-11-27' | quantity: '37' -> '37' | customer_id: 'CUST056796' -> 'CUST056796'
2026-01-12 12:10:25,761 - dq_comparison - INFO - DEBUG HASH STRING: text with newlines|TX00056796|2023-11-27|37|CUST056796...
2026-01-12 12:10:25,762 - dq_comparison - INFO - DEBUG HASH RESULT: a316726d...
2026-01-12 12:10:25,763 - dq_comparison - INFO - DEBUG HASH ROW: description: 'Text with$dollar signs' -> 'text with$dollar signs' | transaction_id: 'TX00068041' -> 'TX00068041' | transaction_date: '04/14/2023' -> '2023-04-14' | quantity: '15' -> '15' | customer_id: 'CUST068041' -> 'CUST068041'
2026-01-12 12:10:25,763 - dq_comparison - INFO - DEBUG HASH STRING: text with$dollar signs|TX00068041|2023-04-14|15|CUST068041...
2026-01-12 12:10:25,764 - dq_comparison - INFO - DEBUG HASH RESULT: a440cedc...
2026-01-12 12:10:25,765 - dq_comparison - INFO - DEBUG HASH ROW: description: '  Text with leading spaces' -> 'text with leading spaces' | transaction_id: 'TX00031829' -> 'TX00031829' | transaction_date: '06-08-2023' -> '2023-08-06' | quantity: '3' -> '3' | customer_id: 'CUST031829' -> 'CUST031829'
2026-01-12 12:10:25,765 - dq_comparison - INFO - DEBUG HASH STRING: text with leading spaces|TX00031829|2023-08-06|3|CUST031829...
2026-01-12 12:10:25,766 - dq_comparison - INFO - DEBUG HASH RESULT: 276d140a...
2026-01-12 12:10:25,766 - dq_comparison - INFO - DEBUG HASH ROW: description: 'Text with[brackets]' -> 'text with[brackets]' | transaction_id: 'TX00021149' -> 'TX00021149' | transaction_date: '17-01-2023' -> '2023-01-17' | quantity: '23' -> '23' | customer_id: 'CUST021149' -> 'CUST021149'
2026-01-12 12:10:25,767 - dq_comparison - INFO - DEBUG HASH STRING: text with[brackets]|TX00021149|2023-01-17|23|CUST021149...
2026-01-12 12:10:25,767 - dq_comparison - INFO - DEBUG HASH RESULT: fdcedd94...
2026-01-12 12:10:25,768 - dq_comparison - INFO - DEBUG HASH ROW: description: 'Text with`backticks' -> 'text with`backticks' | transaction_id: 'TX00090584' -> 'TX00090584' | transaction_date: '07-01-2023' -> '2023-01-07' | quantity: '76' -> '76' | customer_id: 'CUST090584' -> 'CUST090584'
2026-01-12 12:10:25,769 - dq_comparison - INFO - DEBUG HASH STRING: text with`backticks|TX00090584|2023-01-07|76|CUST090584...
2026-01-12 12:10:25,769 - dq_comparison - INFO - DEBUG HASH RESULT: f8f79d6c...
2026-01-12 12:10:25,770 - dq_comparison - INFO - DEBUG HASH ROW: description: 'Normal text without issues' -> 'normal text without issues' | transaction_id: 'TX00008390' -> 'TX00008390' | transaction_date: '28-10-2023' -> '2023-10-28' | quantity: '21' -> '21' | customer_id: 'CUST008390' -> 'CUST008390'
2026-01-12 12:10:25,771 - dq_comparison - INFO - DEBUG HASH STRING: normal text without issues|TX00008390|2023-10-28|21|CUST008390...
2026-01-12 12:10:25,771 - dq_comparison - INFO - DEBUG HASH RESULT: 6e1e33eb...
2026-01-12 12:10:25,772 - dq_comparison - INFO - DEBUG HASH ROW: description: 'Text with/slashes' -> 'text with/slashes' | transaction_id: 'TX00037740' -> 'TX00037740' | transaction_date: '10-03-2023' -> '2023-03-10' | quantity: '33' -> '33' | customer_id: 'CUST037740' -> 'CUST037740'
2026-01-12 12:10:25,773 - dq_comparison - INFO - DEBUG HASH STRING: text with/slashes|TX00037740|2023-03-10|33|CUST037740...
2026-01-12 12:10:25,773 - dq_comparison - INFO - DEBUG HASH RESULT: a2847132...
2026-01-12 12:10:25,774 - dq_comparison - INFO - DEBUG HASH ROW: description: 'Text with#hashtags' -> 'text with#hashtags' | transaction_id: 'TX00088436' -> 'TX00088436' | transaction_date: '21-03-2023' -> '2023-03-21' | quantity: '97' -> '97' | customer_id: 'CUST088436' -> 'CUST088436'
2026-01-12 12:10:25,775 - dq_comparison - INFO - DEBUG HASH STRING: text with#hashtags|TX00088436|2023-03-21|97|CUST088436...
2026-01-12 12:10:25,775 - dq_comparison - INFO - DEBUG HASH RESULT: 41ea2b90...
2026-01-12 12:10:25,776 - dq_comparison - INFO - DEBUG HASH ROW: description: 'Text with~tildes' -> 'text with~tildes' | transaction_id: 'TX00020100' -> 'TX00020100' | transaction_date: '19-03-2023' -> '2023-03-19' | quantity: '-3' -> '-3' | customer_id: 'CUST020100' -> 'CUST020100'
2026-01-12 12:10:25,777 - dq_comparison - INFO - DEBUG HASH STRING: text with~tildes|TX00020100|2023-03-19|-3|CUST020100...
2026-01-12 12:10:25,777 - dq_comparison - INFO - DEBUG HASH RESULT: 1f48110b...
2026-01-12 12:10:25,778 - dq_comparison - INFO - DEBUG HASH ROW: description: 'Text with%percent signs' -> 'text with%percent signs' | transaction_id: 'TX00028185' -> 'TX00028185' | transaction_date: '10-03-2023' -> '2023-03-10' | quantity: '9' -> '9' | customer_id: 'CUST028185' -> 'CUST028185'
2026-01-12 12:10:25,778 - dq_comparison - INFO - DEBUG HASH STRING: text with%percent signs|TX00028185|2023-03-10|9|CUST028185...
2026-01-12 12:10:25,779 - dq_comparison - INFO - DEBUG HASH RESULT: f730142e...
2026-01-12 12:10:25,781 - dq_comparison - INFO - DEBUG HASH ROW: description: 'Text with(parentheses)' -> 'text with(parentheses)' | transaction_id: 'TX00040383' -> 'TX00040383' | transaction_date: '11-04-2023' -> '2023-04-11' | quantity: '2' -> '2' | customer_id: 'CUST040383' -> 'CUST040383'
2026-01-12 12:10:25,781 - dq_comparison - INFO - DEBUG HASH STRING: text with(parentheses)|TX00040383|2023-04-11|2|CUST040383...
2026-01-12 12:10:25,782 - dq_comparison - INFO - DEBUG HASH RESULT: 50cd741c...
2026-01-12 12:10:25,783 - dq_comparison - INFO - DEBUG HASH ROW: description: 'Text with{braces}' -> 'text with{braces}' | transaction_id: 'TX00059999' -> 'TX00059999' | transaction_date: '21-07-2023' -> '2023-07-21' | quantity: '47' -> '47' | customer_id: 'CUST059999' -> 'CUST059999'
2026-01-12 12:10:25,784 - dq_comparison - INFO - DEBUG HASH STRING: text with{braces}|TX00059999|2023-07-21|47|CUST059999...
2026-01-12 12:10:25,784 - dq_comparison - INFO - DEBUG HASH RESULT: edde9b8b...
2026-01-12 12:10:25,786 - dq_comparison - INFO - DEBUG HASH ROW: description: 'Text with#hashtags' -> 'text with#hashtags' | transaction_id: 'TX00068465' -> 'TX00068465' | transaction_date: '29-08-2023' -> '2023-08-29' | quantity: '37' -> '37' | customer_id: 'CUST068465' -> 'CUST068465'
2026-01-12 12:10:25,786 - dq_comparison - INFO - DEBUG HASH STRING: text with#hashtags|TX00068465|2023-08-29|37|CUST068465...
2026-01-12 12:10:25,786 - dq_comparison - INFO - DEBUG HASH RESULT: 06b60fad...
2026-01-12 12:10:25,788 - dq_comparison - INFO - DEBUG HASH ROW: description: 'Text with%percent signs' -> 'text with%percent signs' | transaction_id: 'TX00023089' -> 'TX00023089' | transaction_date: '01-11-2023' -> '2023-11-01' | quantity: '14' -> '14' | customer_id: 'CUST023089' -> 'CUST023089'
2026-01-12 12:10:25,788 - dq_comparison - INFO - DEBUG HASH STRING: text with%percent signs|TX00023089|2023-11-01|14|CUST023089...
2026-01-12 12:10:25,789 - dq_comparison - INFO - DEBUG HASH RESULT: 03b055ff...
2026-01-12 12:10:25,790 - dq_comparison - INFO - DEBUG HASH ROW: description: 'Text with! exclamations' -> 'text with! exclamations' | transaction_id: 'TX00082097' -> 'TX00082097' | transaction_date: '21-08-2023' -> '2023-08-21' | quantity: '67' -> '67' | customer_id: 'CUST082097' -> 'CUST082097'
2026-01-12 12:10:25,790 - dq_comparison - INFO - DEBUG HASH STRING: text with! exclamations|TX00082097|2023-08-21|67|CUST082097...
2026-01-12 12:10:25,791 - dq_comparison - INFO - DEBUG HASH RESULT: 481aaac0...
2026-01-12 12:10:25,792 - dq_comparison - INFO - DEBUG HASH ROW: description: 'Text with|pipes' -> 'text with|pipes' | transaction_id: 'TX00023660' -> 'TX00023660' | transaction_date: '12-06-2023' -> '2023-06-12' | quantity: '68' -> '68' | customer_id: 'CUST023660' -> 'CUST023660'
2026-01-12 12:10:25,793 - dq_comparison - INFO - DEBUG HASH STRING: text with|pipes|TX00023660|2023-06-12|68|CUST023660...
2026-01-12 12:10:25,793 - dq_comparison - INFO - DEBUG HASH RESULT: e4535cd4...
2026-01-12 12:10:25,794 - dq_comparison - INFO - DEBUG HASH ROW: description: 'Text with"quotes"' -> 'text with"quotes"' | transaction_id: 'TX00050527' -> 'TX00050527' | transaction_date: '21-10-2023' -> '2023-10-21' | quantity: '23' -> '23' | customer_id: 'CUST050527' -> 'CUST050527'
2026-01-12 12:10:25,795 - dq_comparison - INFO - DEBUG HASH STRING: text with"quotes"|TX00050527|2023-10-21|23|CUST050527...
2026-01-12 12:10:25,795 - dq_comparison - INFO - DEBUG HASH RESULT: e92a7254...
2026-01-12 12:10:25,796 - dq_comparison - INFO - DEBUG HASH ROW: description: '  Text with leading spaces' -> 'text with leading spaces' | transaction_id: 'TX00031148' -> 'TX00031148' | transaction_date: '10-04-2023' -> '2023-04-10' | quantity: '73' -> '73' | customer_id: 'CUST031148' -> 'CUST031148'
2026-01-12 12:10:25,797 - dq_comparison - INFO - DEBUG HASH STRING: text with leading spaces|TX00031148|2023-04-10|73|CUST031148...
2026-01-12 12:10:25,797 - dq_comparison - INFO - DEBUG HASH RESULT: 4ade39cd...
2026-01-12 12:10:25,798 - dq_comparison - INFO - DEBUG HASH ROW: description: 'Text with%percent signs' -> 'text with%percent signs' | transaction_id: 'TX00050776' -> 'TX00050776' | transaction_date: '12/22/2023' -> '2023-12-22' | quantity: '83' -> '83' | customer_id: 'CUST050776' -> 'CUST050776'
2026-01-12 12:10:25,799 - dq_comparison - INFO - DEBUG HASH STRING: text with%percent signs|TX00050776|2023-12-22|83|CUST050776...
2026-01-12 12:10:25,799 - dq_comparison - INFO - DEBUG HASH RESULT: f2a4b7df...
2026-01-12 12:10:25,801 - dq_comparison - INFO - DEBUG HASH ROW: description: 'Text with(parentheses)' -> 'text with(parentheses)' | transaction_id: 'TX00050389' -> 'TX00050389' | transaction_date: '14-07-2023' -> '2023-07-14' | quantity: '21' -> '21' | customer_id: 'CUST050389' -> 'CUST050389'
2026-01-12 12:10:25,801 - dq_comparison - INFO - DEBUG HASH STRING: text with(parentheses)|TX00050389|2023-07-14|21|CUST050389...
2026-01-12 12:10:25,802 - dq_comparison - INFO - DEBUG HASH RESULT: 4a17d398...
2026-01-12 12:10:25,803 - dq_comparison - INFO - DEBUG HASH ROW: description: 'Text with; semicolons' -> 'text with; semicolons' | transaction_id: 'TX00067771' -> 'TX00067771' | transaction_date: '02/25/2023' -> '2023-02-25' | quantity: '61' -> '61' | customer_id: 'CUST067771' -> 'CUST067771'
2026-01-12 12:10:25,803 - dq_comparison - INFO - DEBUG HASH STRING: text with; semicolons|TX00067771|2023-02-25|61|CUST067771...
2026-01-12 12:10:25,803 - dq_comparison - INFO - DEBUG HASH RESULT: 08673b75...
2026-01-12 12:10:25,805 - dq_comparison - INFO - DEBUG HASH ROW: description: 'Text with#hashtags' -> 'text with#hashtags' | transaction_id: 'TX00077892' -> 'TX00077892' | transaction_date: '17-12-2023' -> '2023-12-17' | quantity: '89' -> '89' | customer_id: 'CUST077892' -> 'CUST077892'
2026-01-12 12:10:25,805 - dq_comparison - INFO - DEBUG HASH STRING: text with#hashtags|TX00077892|2023-12-17|89|CUST077892...
2026-01-12 12:10:25,806 - dq_comparison - INFO - DEBUG HASH RESULT: 9c3454a2...
2026-01-12 12:10:25,807 - dq_comparison - INFO - DEBUG HASH ROW: description: 'Text with - dashes' -> 'text with - dashes' | transaction_id: 'TX00021537' -> 'TX00021537' | transaction_date: '03-11-2023' -> '2023-11-03' | quantity: '9' -> '9' | customer_id: 'CUST021537' -> 'CUST021537'
2026-01-12 12:10:25,807 - dq_comparison - INFO - DEBUG HASH STRING: text with - dashes|TX00021537|2023-11-03|9|CUST021537...
2026-01-12 12:10:25,808 - dq_comparison - INFO - DEBUG HASH RESULT: 48bb9e57...
2026-01-12 12:10:25,809 - dq_comparison - INFO - DEBUG HASH ROW: description: 'Text with - dashes' -> 'text with - dashes' | transaction_id: 'TX00022103' -> 'TX00022103' | transaction_date: '07-08-2023' -> '2023-08-07' | quantity: '50' -> '50' | customer_id: 'CUST022103' -> 'CUST022103'
2026-01-12 12:10:25,809 - dq_comparison - INFO - DEBUG HASH STRING: text with - dashes|TX00022103|2023-08-07|50|CUST022103...
2026-01-12 12:10:25,810 - dq_comparison - INFO - DEBUG HASH RESULT: 4072d10c...
2026-01-12 12:10:25,811 - dq_comparison - INFO - DEBUG HASH ROW: description: 'Text with$dollar signs' -> 'text with$dollar signs' | transaction_id: 'TX00099592' -> 'TX00099592' | transaction_date: '20-08-2023' -> '2023-08-20' | quantity: '26' -> '26' | customer_id: 'CUST099592' -> 'CUST099592'
2026-01-12 12:10:25,811 - dq_comparison - INFO - DEBUG HASH STRING: text with$dollar signs|TX00099592|2023-08-20|26|CUST099592...
2026-01-12 12:10:25,811 - dq_comparison - INFO - DEBUG HASH RESULT: 21237096...
2026-01-12 12:10:25,812 - dq_comparison - INFO - DEBUG HASH ROW: description: '  Text with leading spaces' -> 'text with leading spaces' | transaction_id: 'TX00035163' -> 'TX00035163' | transaction_date: '17-11-2023' -> '2023-11-17' | quantity: '98' -> '98' | customer_id: 'CUST035163' -> 'CUST035163'
2026-01-12 12:10:25,813 - dq_comparison - INFO - DEBUG HASH STRING: text with leading spaces|TX00035163|2023-11-17|98|CUST035163...
2026-01-12 12:10:25,814 - dq_comparison - INFO - DEBUG HASH RESULT: 036ab20b...
2026-01-12 12:10:25,815 - dq_comparison - INFO - DEBUG HASH ROW: description: 'Text with~tildes' -> 'text with~tildes' | transaction_id: 'TX00079200' -> 'TX00079200' | transaction_date: '26-05-2023' -> '2023-05-26' | quantity: '-3' -> '-3' | customer_id: 'CUST079200' -> 'CUST079200'
2026-01-12 12:10:25,815 - dq_comparison - INFO - DEBUG HASH STRING: text with~tildes|TX00079200|2023-05-26|-3|CUST079200...
2026-01-12 12:10:25,816 - dq_comparison - INFO - DEBUG HASH RESULT: 808c5dd6...
2026-01-12 12:10:25,817 - dq_comparison - INFO - DEBUG HASH ROW: description: '  Text with leading spaces' -> 'text with leading spaces' | transaction_id: 'TX00061341' -> 'TX00061341' | transaction_date: '05-07-2023' -> '2023-07-05' | quantity: '60' -> '60' | customer_id: 'CUST061341' -> 'CUST061341'
2026-01-12 12:10:25,817 - dq_comparison - INFO - DEBUG HASH STRING: text with leading spaces|TX00061341|2023-07-05|60|CUST061341...
2026-01-12 12:10:25,818 - dq_comparison - INFO - DEBUG HASH RESULT: 2c3ac3c4...
2026-01-12 12:10:25,819 - dq_comparison - INFO - DEBUG HASH ROW: description: 'Text with& ampersands' -> 'text with& ampersands' | transaction_id: 'TX00024884' -> 'TX00024884' | transaction_date: '08-10-2023' -> '2023-10-08' | quantity: '60' -> '60' | customer_id: 'CUST024884' -> 'CUST024884'
2026-01-12 12:10:25,819 - dq_comparison - INFO - DEBUG HASH STRING: text with& ampersands|TX00024884|2023-10-08|60|CUST024884...
2026-01-12 12:10:25,820 - dq_comparison - INFO - DEBUG HASH RESULT: 912b6d55...
2026-01-12 12:10:25,821 - dq_comparison - INFO - DEBUG HASH ROW: description: 'Text with'apostrophes' -> 'text with'apostrophes' | transaction_id: 'TX00005770' -> 'TX00005770' | transaction_date: '11-11-2023' -> '2023-11-11' | quantity: '39' -> '39' | customer_id: 'CUST005770' -> 'CUST005770'
2026-01-12 12:10:25,821 - dq_comparison - INFO - DEBUG HASH STRING: text with'apostrophes|TX00005770|2023-11-11|39|CUST005770...
2026-01-12 12:10:25,822 - dq_comparison - INFO - DEBUG HASH RESULT: fda37fd9...
2026-01-12 12:10:25,823 - dq_comparison - INFO - DEBUG HASH ROW: description: 'Text with	tabs' -> 'text with tabs' | transaction_id: 'TX00020548' -> 'TX00020548' | transaction_date: '18-02-2023' -> '2023-02-18' | quantity: '49' -> '49' | customer_id: 'CUST020548' -> 'CUST020548'
2026-01-12 12:10:25,823 - dq_comparison - INFO - DEBUG HASH STRING: text with tabs|TX00020548|2023-02-18|49|CUST020548...
2026-01-12 12:10:25,824 - dq_comparison - INFO - DEBUG HASH RESULT: 0061b6f0...
2026-01-12 12:10:25,825 - dq_comparison - INFO - DEBUG HASH ROW: description: 'Text with@at signs' -> 'text with@at signs' | transaction_id: 'TX00018947' -> 'TX00018947' | transaction_date: '16-12-2023' -> '2023-12-16' | quantity: '64' -> '64' | customer_id: 'CUST018947' -> 'CUST018947'
2026-01-12 12:10:25,825 - dq_comparison - INFO - DEBUG HASH STRING: text with@at signs|TX00018947|2023-12-16|64|CUST018947...
2026-01-12 12:10:25,825 - dq_comparison - INFO - DEBUG HASH RESULT: 56fb9150...
2026-01-12 12:10:25,828 - dq_comparison - INFO - DEBUG HASH ROW: description: 'Text with! exclamations' -> 'text with! exclamations' | transaction_id: 'TX00049058' -> 'TX00049058' | transaction_date: '16-12-2023' -> '2023-12-16' | quantity: '30' -> '30' | customer_id: 'CUST049058' -> 'CUST049058'
2026-01-12 12:10:25,828 - dq_comparison - INFO - DEBUG HASH STRING: text with! exclamations|TX00049058|2023-12-16|30|CUST049058...
2026-01-12 12:10:25,829 - dq_comparison - INFO - DEBUG HASH RESULT: 9a19498b...
2026-01-12 12:10:25,830 - dq_comparison - INFO - DEBUG HASH ROW: description: 'Text with; semicolons' -> 'text with; semicolons' | transaction_id: 'TX00022069' -> 'TX00022069' | transaction_date: '24-07-2023' -> '2023-07-24' | quantity: '1' -> '1' | customer_id: 'CUST022069' -> 'CUST022069'
2026-01-12 12:10:25,830 - dq_comparison - INFO - DEBUG HASH STRING: text with; semicolons|TX00022069|2023-07-24|1|CUST022069...
2026-01-12 12:10:25,830 - dq_comparison - INFO - DEBUG HASH RESULT: 6ee08d98...
2026-01-12 12:10:25,832 - dq_comparison - INFO - DEBUG HASH ROW: description: '  Text with leading spaces' -> 'text with leading spaces' | transaction_id: 'TX00026256' -> 'TX00026256' | transaction_date: '04/28/2023' -> '2023-04-28' | quantity: '97' -> '97' | customer_id: 'CUST026256' -> 'CUST026256'
2026-01-12 12:10:25,832 - dq_comparison - INFO - DEBUG HASH STRING: text with leading spaces|TX00026256|2023-04-28|97|CUST026256...
2026-01-12 12:10:25,833 - dq_comparison - INFO - DEBUG HASH RESULT: 426e44d2...
2026-01-12 12:10:25,834 - dq_comparison - INFO - DEBUG HASH ROW: description: 'Text with\backslashes' -> 'text with\backslashes' | transaction_id: 'TX00076203' -> 'TX00076203' | transaction_date: '11-06-2023' -> '2023-06-11' | quantity: '85' -> '85' | customer_id: 'CUST076203' -> 'CUST076203'
2026-01-12 12:10:25,834 - dq_comparison - INFO - DEBUG HASH STRING: text with\backslashes|TX00076203|2023-06-11|85|CUST076203...
2026-01-12 12:10:25,835 - dq_comparison - INFO - DEBUG HASH RESULT: a5904956...
2026-01-12 12:10:25,836 - dq_comparison - INFO - DEBUG HASH ROW: description: 'Text with& ampersands' -> 'text with& ampersands' | transaction_id: 'TX00040541' -> 'TX00040541' | transaction_date: '02/20/2023' -> '2023-02-20' | quantity: '30' -> '30' | customer_id: 'CUST040541' -> 'CUST040541'
2026-01-12 12:10:25,836 - dq_comparison - INFO - DEBUG HASH STRING: text with& ampersands|TX00040541|2023-02-20|30|CUST040541...
2026-01-12 12:10:25,837 - dq_comparison - INFO - DEBUG HASH RESULT: ea6eaba4...
2026-01-12 12:10:25,838 - dq_comparison - INFO - DEBUG HASH ROW: description: 'Text with - dashes' -> 'text with - dashes' | transaction_id: 'TX00066864' -> 'TX00066864' | transaction_date: '23-12-2023' -> '2023-12-23' | quantity: '80' -> '80' | customer_id: 'CUST066864' -> 'CUST066864'
2026-01-12 12:10:25,838 - dq_comparison - INFO - DEBUG HASH STRING: text with - dashes|TX00066864|2023-12-23|80|CUST066864...
2026-01-12 12:10:25,839 - dq_comparison - INFO - DEBUG HASH RESULT: 00ad9620...
2026-01-12 12:10:25,840 - dq_comparison - INFO - DEBUG HASH ROW: description: '  Text with leading spaces' -> 'text with leading spaces' | transaction_id: 'TX00006614' -> 'TX00006614' | transaction_date: '15-09-2023' -> '2023-09-15' | quantity: '77' -> '77' | customer_id: 'CUST006614' -> 'CUST006614'
2026-01-12 12:10:25,840 - dq_comparison - INFO - DEBUG HASH STRING: text with leading spaces|TX00006614|2023-09-15|77|CUST006614...
2026-01-12 12:10:25,841 - dq_comparison - INFO - DEBUG HASH RESULT: 0cf908a4...
2026-01-12 12:10:25,842 - dq_comparison - INFO - DEBUG HASH ROW: description: 'Text with_underscores' -> 'text with_underscores' | transaction_id: 'TX00052238' -> 'TX00052238' | transaction_date: '29-03-2023' -> '2023-03-29' | quantity: '11' -> '11' | customer_id: 'CUST052238' -> 'CUST052238'
2026-01-12 12:10:25,842 - dq_comparison - INFO - DEBUG HASH STRING: text with_underscores|TX00052238|2023-03-29|11|CUST052238...
2026-01-12 12:10:25,843 - dq_comparison - INFO - DEBUG HASH RESULT: 334b07cb...
2026-01-12 12:10:25,844 - dq_comparison - INFO - DEBUG HASH ROW: description: 'Text with$dollar signs' -> 'text with$dollar signs' | transaction_id: 'TX00068813' -> 'TX00068813' | transaction_date: '03-11-2023' -> '2023-11-03' | quantity: '25' -> '25' | customer_id: 'CUST068813' -> 'CUST068813'
2026-01-12 12:10:25,845 - dq_comparison - INFO - DEBUG HASH STRING: text with$dollar signs|TX00068813|2023-11-03|25|CUST068813...
2026-01-12 12:10:25,846 - dq_comparison - INFO - DEBUG HASH RESULT: c25262b2...
2026-01-12 12:10:25,847 - dq_comparison - INFO - DEBUG HASH ROW: description: 'Text with? questions' -> 'text with? questions' | transaction_id: 'TX00084198' -> 'TX00084198' | transaction_date: '13-03-2023' -> '2023-03-13' | quantity: '10' -> '10' | customer_id: 'CUST084198' -> 'CUST084198'
2026-01-12 12:10:25,847 - dq_comparison - INFO - DEBUG HASH STRING: text with? questions|TX00084198|2023-03-13|10|CUST084198...
2026-01-12 12:10:25,848 - dq_comparison - INFO - DEBUG HASH RESULT: c9c19abf...
2026-01-12 12:10:25,849 - dq_comparison - INFO - DEBUG HASH ROW: description: 'Text with mixed CAPITAL and lowercase' -> 'text with mixed capital and lowercase' | transaction_id: 'TX00081257' -> 'TX00081257' | transaction_date: '11-03-2023' -> '2023-03-11' | quantity: '23' -> '23' | customer_id: 'CUST081257' -> 'CUST081257'
2026-01-12 12:10:25,849 - dq_comparison - INFO - DEBUG HASH STRING: text with mixed capital and lowercase|TX00081257|2023-03-11|23|CUST081257...
2026-01-12 12:10:25,850 - dq_comparison - INFO - DEBUG HASH RESULT: 3f180a9a...
2026-01-12 12:10:25,851 - dq_comparison - INFO - DEBUG HASH ROW: description: 'Text with? questions' -> 'text with? questions' | transaction_id: 'TX00008084' -> 'TX00008084' | transaction_date: '14-08-2023' -> '2023-08-14' | quantity: '24' -> '24' | customer_id: 'CUST008084' -> 'CUST008084'
2026-01-12 12:10:25,851 - dq_comparison - INFO - DEBUG HASH STRING: text with? questions|TX00008084|2023-08-14|24|CUST008084...
2026-01-12 12:10:25,852 - dq_comparison - INFO - DEBUG HASH RESULT: 47f4f652...
2026-01-12 12:10:25,853 - dq_comparison - INFO - DEBUG HASH ROW: description: 'Text with; semicolons' -> 'text with; semicolons' | transaction_id: 'TX00000501' -> 'TX00000501' | transaction_date: '07-04-2023' -> '2023-04-07' | quantity: '74' -> '74' | customer_id: 'CUST000501' -> 'CUST000501'
2026-01-12 12:10:25,854 - dq_comparison - INFO - DEBUG HASH STRING: text with; semicolons|TX00000501|2023-04-07|74|CUST000501...
2026-01-12 12:10:25,854 - dq_comparison - INFO - DEBUG HASH RESULT: 872075e9...
2026-01-12 12:10:25,855 - dq_comparison - INFO - DEBUG HASH ROW: description: 'Text with  multiple   spaces' -> 'text with multiple spaces' | transaction_id: 'TX00070113' -> 'TX00070113' | transaction_date: '26-06-2023' -> '2023-06-26' | quantity: '7' -> '7' | customer_id: 'CUST070113' -> 'CUST070113'
2026-01-12 12:10:25,856 - dq_comparison - INFO - DEBUG HASH STRING: text with multiple spaces|TX00070113|2023-06-26|7|CUST070113...
2026-01-12 12:10:25,857 - dq_comparison - INFO - DEBUG HASH RESULT: 83fb628c...
2026-01-12 12:10:25,858 - dq_comparison - INFO - DEBUG HASH ROW: description: 'Text with`backticks' -> 'text with`backticks' | transaction_id: 'TX00002336' -> 'TX00002336' | transaction_date: '08-12-2023' -> '2023-12-08' | quantity: '69' -> '69' | customer_id: 'CUST002336' -> 'CUST002336'
2026-01-12 12:10:25,858 - dq_comparison - INFO - DEBUG HASH STRING: text with`backticks|TX00002336|2023-12-08|69|CUST002336...
2026-01-12 12:10:25,859 - dq_comparison - INFO - DEBUG HASH RESULT: 6a14b985...
2026-01-12 12:10:25,860 - dq_comparison - INFO - DEBUG HASH ROW: description: 'Text with(parentheses)' -> 'text with(parentheses)' | transaction_id: 'TX00089234' -> 'TX00089234' | transaction_date: '10-11-2023' -> '2023-11-10' | quantity: '16' -> '16' | customer_id: 'CUST089234' -> 'CUST089234'
2026-01-12 12:10:25,860 - dq_comparison - INFO - DEBUG HASH STRING: text with(parentheses)|TX00089234|2023-11-10|16|CUST089234...
2026-01-12 12:10:25,861 - dq_comparison - INFO - DEBUG HASH RESULT: b76973ae...
2026-01-12 12:10:25,862 - dq_comparison - INFO - DEBUG HASH ROW: description: 'Text with
newlines' -> 'text with newlines' | transaction_id: 'TX00076758' -> 'TX00076758' | transaction_date: '12-03-2023' -> '2023-03-12' | quantity: '28' -> '28' | customer_id: 'CUST076758' -> 'CUST076758'
2026-01-12 12:10:25,863 - dq_comparison - INFO - DEBUG HASH STRING: text with newlines|TX00076758|2023-03-12|28|CUST076758...
2026-01-12 12:10:25,863 - dq_comparison - INFO - DEBUG HASH RESULT: 3d9d8609...
2026-01-12 12:10:25,864 - dq_comparison - INFO - DEBUG HASH ROW: description: 'Text with$dollar signs' -> 'text with$dollar signs' | transaction_id: 'TX00077002' -> 'TX00077002' | transaction_date: '18-12-2023' -> '2023-12-18' | quantity: '90' -> '90' | customer_id: 'CUST077002' -> 'CUST077002'
2026-01-12 12:10:25,865 - dq_comparison - INFO - DEBUG HASH STRING: text with$dollar signs|TX00077002|2023-12-18|90|CUST077002...
2026-01-12 12:10:25,866 - dq_comparison - INFO - DEBUG HASH RESULT: f583b583...
2026-01-12 12:10:25,867 - dq_comparison - INFO - DEBUG HASH ROW: description: 'Text with! exclamations' -> 'text with! exclamations' | transaction_id: 'TX00075423' -> 'TX00075423' | transaction_date: '01-12-2023' -> '2023-12-01' | quantity: '16' -> '16' | customer_id: 'CUST075423' -> 'CUST075423'
2026-01-12 12:10:25,867 - dq_comparison - INFO - DEBUG HASH STRING: text with! exclamations|TX00075423|2023-12-01|16|CUST075423...
2026-01-12 12:10:25,868 - dq_comparison - INFO - DEBUG HASH RESULT: e3835aa9...
2026-01-12 12:10:25,869 - dq_comparison - INFO - DEBUG HASH ROW: description: 'Text with%percent signs' -> 'text with%percent signs' | transaction_id: 'TX00084196' -> 'TX00084196' | transaction_date: '07-01-2023' -> '2023-01-07' | quantity: '33' -> '33' | customer_id: 'CUST084196' -> 'CUST084196'
2026-01-12 12:10:25,869 - dq_comparison - INFO - DEBUG HASH STRING: text with%percent signs|TX00084196|2023-01-07|33|CUST084196...
2026-01-12 12:10:25,870 - dq_comparison - INFO - DEBUG HASH RESULT: b042241f...
2026-01-12 12:10:25,871 - dq_comparison - INFO - DEBUG HASH ROW: description: 'Text with[brackets]' -> 'text with[brackets]' | transaction_id: 'TX00071012' -> 'TX00071012' | transaction_date: '14-11-2023' -> '2023-11-14' | quantity: '77' -> '77' | customer_id: 'CUST071012' -> 'CUST071012'
2026-01-12 12:10:25,872 - dq_comparison - INFO - DEBUG HASH STRING: text with[brackets]|TX00071012|2023-11-14|77|CUST071012...
2026-01-12 12:10:25,872 - dq_comparison - INFO - DEBUG HASH RESULT: f91d199b...
2026-01-12 12:10:25,873 - dq_comparison - INFO - DEBUG HASH ROW: description: 'Text with%percent signs' -> 'text with%percent signs' | transaction_id: 'TX00078462' -> 'TX00078462' | transaction_date: '07-06-2023' -> '2023-06-07' | quantity: '71' -> '71' | customer_id: 'CUST078462' -> 'CUST078462'
2026-01-12 12:10:25,874 - dq_comparison - INFO - DEBUG HASH STRING: text with%percent signs|TX00078462|2023-06-07|71|CUST078462...
2026-01-12 12:10:25,874 - dq_comparison - INFO - DEBUG HASH RESULT: 840eb147...
2026-01-12 12:10:25,875 - dq_comparison - INFO - DEBUG HASH ROW: description: 'Text with! exclamations' -> 'text with! exclamations' | transaction_id: 'TX00016653' -> 'TX00016653' | transaction_date: '09-03-2023' -> '2023-03-09' | quantity: '75' -> '75' | customer_id: 'CUST016653' -> 'CUST016653'
2026-01-12 12:10:25,876 - dq_comparison - INFO - DEBUG HASH STRING: text with! exclamations|TX00016653|2023-03-09|75|CUST016653...
2026-01-12 12:10:25,876 - dq_comparison - INFO - DEBUG HASH RESULT: 7058f831...
2026-01-12 12:10:25,877 - dq_comparison - INFO - DEBUG HASH ROW: description: 'Text with'apostrophes' -> 'text with'apostrophes' | transaction_id: 'TX00000519' -> 'TX00000519' | transaction_date: '03-08-2023' -> '2023-08-03' | quantity: '58' -> '58' | customer_id: 'CUST000519' -> 'CUST000519'
2026-01-12 12:10:25,878 - dq_comparison - INFO - DEBUG HASH STRING: text with'apostrophes|TX00000519|2023-08-03|58|CUST000519...
2026-01-12 12:10:25,878 - dq_comparison - INFO - DEBUG HASH RESULT: b04d61e0...
2026-01-12 12:10:25,880 - dq_comparison - INFO - DEBUG HASH ROW: description: 'Text with'apostrophes' -> 'text with'apostrophes' | transaction_id: 'TX00032152' -> 'TX00032152' | transaction_date: '24-02-2023' -> '2023-02-24' | quantity: '37' -> '37' | customer_id: 'CUST032152' -> 'CUST032152'
2026-01-12 12:10:25,880 - dq_comparison - INFO - DEBUG HASH STRING: text with'apostrophes|TX00032152|2023-02-24|37|CUST032152...
2026-01-12 12:10:25,881 - dq_comparison - INFO - DEBUG HASH RESULT: 616dbe9e...
2026-01-12 12:10:25,882 - dq_comparison - INFO - DEBUG HASH ROW: description: 'Text with/slashes' -> 'text with/slashes' | transaction_id: 'TX00007160' -> 'TX00007160' | transaction_date: '08-01-2023' -> '2023-01-08' | quantity: '91' -> '91' | customer_id: 'CUST007160' -> 'CUST007160'
2026-01-12 12:10:25,882 - dq_comparison - INFO - DEBUG HASH STRING: text with/slashes|TX00007160|2023-01-08|91|CUST007160...
2026-01-12 12:10:25,883 - dq_comparison - INFO - DEBUG HASH RESULT: 4d6148a9...
2026-01-12 12:10:25,884 - dq_comparison - INFO - DEBUG HASH ROW: description: 'Text with*asterisks' -> 'text with*asterisks' | transaction_id: 'TX00086373' -> 'TX00086373' | transaction_date: '17-04-2023' -> '2023-04-17' | quantity: '70' -> '70' | customer_id: 'CUST086373' -> 'CUST086373'
2026-01-12 12:10:25,884 - dq_comparison - INFO - DEBUG HASH STRING: text with*asterisks|TX00086373|2023-04-17|70|CUST086373...
2026-01-12 12:10:25,885 - dq_comparison - INFO - DEBUG HASH RESULT: f31b6d7a...
2026-01-12 12:10:25,886 - dq_comparison - INFO - DEBUG HASH ROW: description: 'Text with	tabs' -> 'text with tabs' | transaction_id: 'TX00053969' -> 'TX00053969' | transaction_date: '27-04-2023' -> '2023-04-27' | quantity: '34' -> '34' | customer_id: 'CUST053969' -> 'CUST053969'
2026-01-12 12:10:25,886 - dq_comparison - INFO - DEBUG HASH STRING: text with tabs|TX00053969|2023-04-27|34|CUST053969...
2026-01-12 12:10:25,887 - dq_comparison - INFO - DEBUG HASH RESULT: ca61c6c1...
2026-01-12 12:10:25,888 - dq_comparison - INFO - DEBUG HASH ROW: description: 'Text with<angle brackets>' -> 'text with<angle brackets>' | transaction_id: 'TX00006361' -> 'TX00006361' | transaction_date: '03/13/2023' -> '2023-03-13' | quantity: '33' -> '33' | customer_id: 'CUST006361' -> 'CUST006361'
2026-01-12 12:10:25,888 - dq_comparison - INFO - DEBUG HASH STRING: text with<angle brackets>|TX00006361|2023-03-13|33|CUST006361...
2026-01-12 12:10:25,889 - dq_comparison - INFO - DEBUG HASH RESULT: fd7485aa...
2026-01-12 12:10:25,890 - dq_comparison - INFO - DEBUG HASH ROW: description: 'Text with[brackets]' -> 'text with[brackets]' | transaction_id: 'TX00026584' -> 'TX00026584' | transaction_date: '17-10-2023' -> '2023-10-17' | quantity: '83' -> '83' | customer_id: 'CUST026584' -> 'CUST026584'
2026-01-12 12:10:25,891 - dq_comparison - INFO - DEBUG HASH STRING: text with[brackets]|TX00026584|2023-10-17|83|CUST026584...
2026-01-12 12:10:25,891 - dq_comparison - INFO - DEBUG HASH RESULT: 1659c639...
2026-01-12 12:10:25,893 - dq_comparison - INFO - DEBUG HASH ROW: description: 'Text with@at signs' -> 'text with@at signs' | transaction_id: 'TX00067895' -> 'TX00067895' | transaction_date: '30-03-2023' -> '2023-03-30' | quantity: '43' -> '43' | customer_id: 'CUST067895' -> 'CUST067895'
2026-01-12 12:10:25,893 - dq_comparison - INFO - DEBUG HASH STRING: text with@at signs|TX00067895|2023-03-30|43|CUST067895...
2026-01-12 12:10:25,894 - dq_comparison - INFO - DEBUG HASH RESULT: ed07b439...
2026-01-12 12:10:25,895 - dq_comparison - INFO - DEBUG HASH ROW: description: 'Text with - dashes' -> 'text with - dashes' | transaction_id: 'TX00056142' -> 'TX00056142' | transaction_date: '26-06-2023' -> '2023-06-26' | quantity: '89' -> '89' | customer_id: 'CUST056142' -> 'CUST056142'
2026-01-12 12:10:25,895 - dq_comparison - INFO - DEBUG HASH STRING: text with - dashes|TX00056142|2023-06-26|89|CUST056142...
2026-01-12 12:10:25,896 - dq_comparison - INFO - DEBUG HASH RESULT: 4d02be06...
2026-01-12 12:10:25,897 - dq_comparison - INFO - DEBUG HASH ROW: description: 'Text with%percent signs' -> 'text with%percent signs' | transaction_id: 'TX00031281' -> 'TX00031281' | transaction_date: '03/16/2023' -> '2023-03-16' | quantity: '66' -> '66' | customer_id: 'CUST031281' -> 'CUST031281'
2026-01-12 12:10:25,897 - dq_comparison - INFO - DEBUG HASH STRING: text with%percent signs|TX00031281|2023-03-16|66|CUST031281...
2026-01-12 12:10:25,898 - dq_comparison - INFO - DEBUG HASH RESULT: b6655525...
2026-01-12 12:10:25,899 - dq_comparison - INFO - DEBUG HASH ROW: description: 'Text with|pipes' -> 'text with|pipes' | transaction_id: 'TX00006655' -> 'TX00006655' | transaction_date: '23-01-2023' -> '2023-01-23' | quantity: '40' -> '40' | customer_id: 'CUST006655' -> 'CUST006655'
2026-01-12 12:10:25,899 - dq_comparison - INFO - DEBUG HASH STRING: text with|pipes|TX00006655|2023-01-23|40|CUST006655...
2026-01-12 12:10:25,900 - dq_comparison - INFO - DEBUG HASH RESULT: 796c9e39...
2026-01-12 12:10:25,901 - dq_comparison - INFO - DEBUG HASH ROW: description: 'Text with\backslashes' -> 'text with\backslashes' | transaction_id: 'TX00050090' -> 'TX00050090' | transaction_date: '22-04-2023' -> '2023-04-22' | quantity: '99' -> '99' | customer_id: 'CUST050090' -> 'CUST050090'
2026-01-12 12:10:25,901 - dq_comparison - INFO - DEBUG HASH STRING: text with\backslashes|TX00050090|2023-04-22|99|CUST050090...
2026-01-12 12:10:25,902 - dq_comparison - INFO - DEBUG HASH RESULT: c558b00d...
2026-01-12 12:10:25,903 - dq_comparison - INFO - DEBUG HASH ROW: description: 'Text with& ampersands' -> 'text with& ampersands' | transaction_id: 'TX00045453' -> 'TX00045453' | transaction_date: '20-09-2023' -> '2023-09-20' | quantity: '61' -> '61' | customer_id: 'CUST045453' -> 'CUST045453'
2026-01-12 12:10:25,903 - dq_comparison - INFO - DEBUG HASH STRING: text with& ampersands|TX00045453|2023-09-20|61|CUST045453...
2026-01-12 12:10:25,905 - dq_comparison - INFO - DEBUG HASH RESULT: a406ee87...
2026-01-12 12:10:25,906 - dq_comparison - INFO - DEBUG HASH ROW: description: 'Text with. periods' -> 'text with. periods' | transaction_id: 'TX00017374' -> 'TX00017374' | transaction_date: '20-03-2023' -> '2023-03-20' | quantity: '73' -> '73' | customer_id: 'CUST017374' -> 'CUST017374'
2026-01-12 12:10:25,907 - dq_comparison - INFO - DEBUG HASH STRING: text with. periods|TX00017374|2023-03-20|73|CUST017374...
2026-01-12 12:10:25,908 - dq_comparison - INFO - DEBUG HASH RESULT: 15ed4c47...
2026-01-12 12:10:25,909 - dq_comparison - INFO - DEBUG HASH ROW: description: 'Text with$dollar signs' -> 'text with$dollar signs' | transaction_id: 'TX00059614' -> 'TX00059614' | transaction_date: '17-04-2023' -> '2023-04-17' | quantity: '37' -> '37' | customer_id: 'CUST059614' -> 'CUST059614'
2026-01-12 12:10:25,909 - dq_comparison - INFO - DEBUG HASH STRING: text with$dollar signs|TX00059614|2023-04-17|37|CUST059614...
2026-01-12 12:10:25,910 - dq_comparison - INFO - DEBUG HASH RESULT: 85c43be4...
2026-01-12 12:10:25,911 - dq_comparison - INFO - DEBUG HASH ROW: description: 'Text with? questions' -> 'text with? questions' | transaction_id: 'TX00057278' -> 'TX00057278' | transaction_date: '13-04-2023' -> '2023-04-13' | quantity: '28' -> '28' | customer_id: 'CUST057278' -> 'CUST057278'
2026-01-12 12:10:25,911 - dq_comparison - INFO - DEBUG HASH STRING: text with? questions|TX00057278|2023-04-13|28|CUST057278...
2026-01-12 12:10:25,912 - dq_comparison - INFO - DEBUG HASH RESULT: 773b18d1...
2026-01-12 12:10:25,913 - dq_comparison - INFO - DEBUG HASH ROW: description: 'Text with trailing spaces  ' -> 'text with trailing spaces' | transaction_id: 'TX00084066' -> 'TX00084066' | transaction_date: '09/15/2023' -> '2023-09-15' | quantity: '53' -> '53' | customer_id: 'CUST084066' -> 'CUST084066'
2026-01-12 12:10:25,913 - dq_comparison - INFO - DEBUG HASH STRING: text with trailing spaces|TX00084066|2023-09-15|53|CUST084066...
2026-01-12 12:10:25,914 - dq_comparison - INFO - DEBUG HASH RESULT: 9e28d5fc...
2026-01-12 12:10:25,915 - dq_comparison - INFO - DEBUG HASH ROW: description: 'Text with\backslashes' -> 'text with\backslashes' | transaction_id: 'TX00059479' -> 'TX00059479' | transaction_date: '01-05-2023' -> '2023-05-01' | quantity: '67' -> '67' | customer_id: 'CUST059479' -> 'CUST059479'
2026-01-12 12:10:25,915 - dq_comparison - INFO - DEBUG HASH STRING: text with\backslashes|TX00059479|2023-05-01|67|CUST059479...
2026-01-12 12:10:25,916 - dq_comparison - INFO - DEBUG HASH RESULT: a78f4b00...
2026-01-12 12:10:25,917 - dq_comparison - INFO - DEBUG HASH ROW: description: 'Text with{braces}' -> 'text with{braces}' | transaction_id: 'TX00004966' -> 'TX00004966' | transaction_date: '07/17/2023' -> '2023-07-17' | quantity: '33' -> '33' | customer_id: 'CUST004966' -> 'CUST004966'
2026-01-12 12:10:25,917 - dq_comparison - INFO - DEBUG HASH STRING: text with{braces}|TX00004966|2023-07-17|33|CUST004966...
2026-01-12 12:10:25,918 - dq_comparison - INFO - DEBUG HASH RESULT: ad6d16b5...
2026-01-12 12:10:25,919 - dq_comparison - INFO - DEBUG HASH ROW: description: 'Text with~tildes' -> 'text with~tildes' | transaction_id: 'TX00037118' -> 'TX00037118' | transaction_date: '13-10-2023' -> '2023-10-13' | quantity: '3' -> '3' | customer_id: 'CUST037118' -> 'CUST037118'
2026-01-12 12:10:25,919 - dq_comparison - INFO - DEBUG HASH STRING: text with~tildes|TX00037118|2023-10-13|3|CUST037118...
2026-01-12 12:10:25,920 - dq_comparison - INFO - DEBUG HASH RESULT: 5390b6e9...
2026-01-12 12:10:25,921 - dq_comparison - INFO - DEBUG HASH ROW: description: 'Text with trailing spaces  ' -> 'text with trailing spaces' | transaction_id: 'TX00010047' -> 'TX00010047' | transaction_date: '21-08-2023' -> '2023-08-21' | quantity: '50' -> '50' | customer_id: 'CUST010047' -> 'CUST010047'
2026-01-12 12:10:25,921 - dq_comparison - INFO - DEBUG HASH STRING: text with trailing spaces|TX00010047|2023-08-21|50|CUST010047...
2026-01-12 12:10:25,922 - dq_comparison - INFO - DEBUG HASH RESULT: b1cabcb3...
2026-01-12 12:10:25,923 - dq_comparison - INFO - DEBUG HASH ROW: description: 'Text with'apostrophes' -> 'text with'apostrophes' | transaction_id: 'TX00052272' -> 'TX00052272' | transaction_date: '06-07-2023' -> '2023-07-06' | quantity: '67' -> '67' | customer_id: 'CUST052272' -> 'CUST052272'
2026-01-12 12:10:25,923 - dq_comparison - INFO - DEBUG HASH STRING: text with'apostrophes|TX00052272|2023-07-06|67|CUST052272...
2026-01-12 12:10:25,924 - dq_comparison - INFO - DEBUG HASH RESULT: c32caaea...
2026-01-12 12:10:25,925 - dq_comparison - INFO - DEBUG HASH ROW: description: 'Text with|pipes' -> 'text with|pipes' | transaction_id: 'TX00011227' -> 'TX00011227' | transaction_date: '14-02-2023' -> '2023-02-14' | quantity: '57' -> '57' | customer_id: 'CUST011227' -> 'CUST011227'
2026-01-12 12:10:25,926 - dq_comparison - INFO - DEBUG HASH STRING: text with|pipes|TX00011227|2023-02-14|57|CUST011227...
2026-01-12 12:10:25,926 - dq_comparison - INFO - DEBUG HASH RESULT: 38421359...
2026-01-12 12:10:25,927 - dq_comparison - INFO - DEBUG HASH ROW: description: 'Text with{braces}' -> 'text with{braces}' | transaction_id: 'TX00083131' -> 'TX00083131' | transaction_date: '24-12-2023' -> '2023-12-24' | quantity: '69' -> '69' | customer_id: 'CUST083131' -> 'CUST083131'
2026-01-12 12:10:25,928 - dq_comparison - INFO - DEBUG HASH STRING: text with{braces}|TX00083131|2023-12-24|69|CUST083131...
2026-01-12 12:10:25,928 - dq_comparison - INFO - DEBUG HASH RESULT: 97ec3251...
2026-01-12 12:10:25,929 - dq_comparison - INFO - DEBUG HASH ROW: description: 'Text with*asterisks' -> 'text with*asterisks' | transaction_id: 'TX00076908' -> 'TX00076908' | transaction_date: '08-09-2023' -> '2023-09-08' | quantity: '43' -> '43' | customer_id: 'CUST076908' -> 'CUST076908'
2026-01-12 12:10:25,930 - dq_comparison - INFO - DEBUG HASH STRING: text with*asterisks|TX00076908|2023-09-08|43|CUST076908...
2026-01-12 12:10:25,931 - dq_comparison - INFO - DEBUG HASH RESULT: 5afeba8a...
2026-01-12 12:10:25,931 - dq_comparison - INFO - DEBUG HASH ROW: description: 'Text with|pipes' -> 'text with|pipes' | transaction_id: 'TX00078610' -> 'TX00078610' | transaction_date: '24-02-2023' -> '2023-02-24' | quantity: '83' -> '83' | customer_id: 'CUST078610' -> 'CUST078610'
2026-01-12 12:10:25,932 - dq_comparison - INFO - DEBUG HASH STRING: text with|pipes|TX00078610|2023-02-24|83|CUST078610...
2026-01-12 12:10:25,932 - dq_comparison - INFO - DEBUG HASH RESULT: 89f3e542...
2026-01-12 12:10:25,933 - dq_comparison - INFO - DEBUG HASH ROW: description: 'Text with? questions' -> 'text with? questions' | transaction_id: 'TX00064058' -> 'TX00064058' | transaction_date: '11-11-2023' -> '2023-11-11' | quantity: '32' -> '32' | customer_id: 'CUST064058' -> 'CUST064058'
2026-01-12 12:10:25,934 - dq_comparison - INFO - DEBUG HASH STRING: text with? questions|TX00064058|2023-11-11|32|CUST064058...
2026-01-12 12:10:25,934 - dq_comparison - INFO - DEBUG HASH RESULT: c23281ca...
2026-01-12 12:10:25,935 - dq_comparison - INFO - DEBUG HASH ROW: description: 'Text with`backticks' -> 'text with`backticks' | transaction_id: 'TX00074032' -> 'TX00074032' | transaction_date: '29-05-2023' -> '2023-05-29' | quantity: '42' -> '42' | customer_id: 'CUST074032' -> 'CUST074032'
2026-01-12 12:10:25,936 - dq_comparison - INFO - DEBUG HASH STRING: text with`backticks|TX00074032|2023-05-29|42|CUST074032...
2026-01-12 12:10:25,936 - dq_comparison - INFO - DEBUG HASH RESULT: ef18a182...
2026-01-12 12:10:25,937 - dq_comparison - INFO - DEBUG HASH ROW: description: 'Text with(parentheses)' -> 'text with(parentheses)' | transaction_id: 'TX00088699' -> 'TX00088699' | transaction_date: '03-07-2023' -> '2023-07-03' | quantity: '7' -> '7' | customer_id: 'CUST088699' -> 'CUST088699'
2026-01-12 12:10:25,938 - dq_comparison - INFO - DEBUG HASH STRING: text with(parentheses)|TX00088699|2023-07-03|7|CUST088699...
2026-01-12 12:10:25,939 - dq_comparison - INFO - DEBUG HASH RESULT: 5233b399...
2026-01-12 12:10:25,940 - dq_comparison - INFO - DEBUG HASH ROW: description: 'Text with%percent signs' -> 'text with%percent signs' | transaction_id: 'TX00006219' -> 'TX00006219' | transaction_date: '09-08-2023' -> '2023-08-09' | quantity: '31' -> '31' | customer_id: 'CUST006219' -> 'CUST006219'
2026-01-12 12:10:25,940 - dq_comparison - INFO - DEBUG HASH STRING: text with%percent signs|TX00006219|2023-08-09|31|CUST006219...
2026-01-12 12:10:25,941 - dq_comparison - INFO - DEBUG HASH RESULT: 41c84b9f...
2026-01-12 12:10:25,942 - dq_comparison - INFO - DEBUG HASH ROW: description: 'Text with[brackets]' -> 'text with[brackets]' | transaction_id: 'TX00025237' -> 'TX00025237' | transaction_date: '14-10-2023' -> '2023-10-14' | quantity: '82' -> '82' | customer_id: 'CUST025237' -> 'CUST025237'
2026-01-12 12:10:25,942 - dq_comparison - INFO - DEBUG HASH STRING: text with[brackets]|TX00025237|2023-10-14|82|CUST025237...
2026-01-12 12:10:25,943 - dq_comparison - INFO - DEBUG HASH RESULT: 5dac1942...
2026-01-12 12:10:25,944 - dq_comparison - INFO - DEBUG HASH ROW: description: 'Normal text without issues' -> 'normal text without issues' | transaction_id: 'TX00090192' -> 'TX00090192' | transaction_date: '17-05-2023' -> '2023-05-17' | quantity: '100' -> '100' | customer_id: 'CUST090192' -> 'CUST090192'
2026-01-12 12:10:25,944 - dq_comparison - INFO - DEBUG HASH STRING: normal text without issues|TX00090192|2023-05-17|100|CUST090192...
2026-01-12 12:10:25,945 - dq_comparison - INFO - DEBUG HASH RESULT: be2ea236...
2026-01-12 12:10:25,946 - dq_comparison - INFO - DEBUG HASH ROW: description: 'Text with$dollar signs' -> 'text with$dollar signs' | transaction_id: 'TX00055500' -> 'TX00055500' | transaction_date: '07-11-2023' -> '2023-11-07' | quantity: '-2' -> '-2' | customer_id: 'CUST055500' -> 'CUST055500'
2026-01-12 12:10:25,946 - dq_comparison - INFO - DEBUG HASH STRING: text with$dollar signs|TX00055500|2023-11-07|-2|CUST055500...
2026-01-12 12:10:25,947 - dq_comparison - INFO - DEBUG HASH RESULT: 877d14b8...
2026-01-12 12:10:25,948 - dq_comparison - INFO - DEBUG HASH ROW: description: 'Text with! exclamations' -> 'text with! exclamations' | transaction_id: 'TX00089920' -> 'TX00089920' | transaction_date: '12-05-2023' -> '2023-05-12' | quantity: '42' -> '42' | customer_id: 'CUST089920' -> 'CUST089920'
2026-01-12 12:10:25,948 - dq_comparison - INFO - DEBUG HASH STRING: text with! exclamations|TX00089920|2023-05-12|42|CUST089920...
2026-01-12 12:10:25,950 - dq_comparison - INFO - DEBUG HASH RESULT: bafff865...
2026-01-12 12:10:25,951 - dq_comparison - INFO - DEBUG HASH ROW: description: 'Text with mixed CAPITAL and lowercase' -> 'text with mixed capital and lowercase' | transaction_id: 'TX00052197' -> 'TX00052197' | transaction_date: '28-04-2023' -> '2023-04-28' | quantity: '30' -> '30' | customer_id: 'CUST052197' -> 'CUST052197'
2026-01-12 12:10:25,951 - dq_comparison - INFO - DEBUG HASH STRING: text with mixed capital and lowercase|TX00052197|2023-04-28|30|CUST052197...
2026-01-12 12:10:25,952 - dq_comparison - INFO - DEBUG HASH RESULT: 5b746da9...
2026-01-12 12:10:25,953 - dq_comparison - INFO - DEBUG HASH ROW: description: 'Text with(parentheses)' -> 'text with(parentheses)' | transaction_id: 'TX00027567' -> 'TX00027567' | transaction_date: '21-04-2023' -> '2023-04-21' | quantity: '48' -> '48' | customer_id: 'CUST027567' -> 'CUST027567'
2026-01-12 12:10:25,953 - dq_comparison - INFO - DEBUG HASH STRING: text with(parentheses)|TX00027567|2023-04-21|48|CUST027567...
2026-01-12 12:10:25,954 - dq_comparison - INFO - DEBUG HASH RESULT: 3f43d0eb...
2026-01-12 12:10:25,955 - dq_comparison - INFO - DEBUG HASH ROW: description: 'Text with\backslashes' -> 'text with\backslashes' | transaction_id: 'TX00093930' -> 'TX00093930' | transaction_date: '21-02-2023' -> '2023-02-21' | quantity: '45' -> '45' | customer_id: 'CUST093930' -> 'CUST093930'
2026-01-12 12:10:25,955 - dq_comparison - INFO - DEBUG HASH STRING: text with\backslashes|TX00093930|2023-02-21|45|CUST093930...
2026-01-12 12:10:25,956 - dq_comparison - INFO - DEBUG HASH RESULT: b7e85482...
2026-01-12 12:10:25,957 - dq_comparison - INFO - DEBUG HASH ROW: description: '  Text with leading spaces' -> 'text with leading spaces' | transaction_id: 'TX00015635' -> 'TX00015635' | transaction_date: '26-11-2023' -> '2023-11-26' | quantity: '42' -> '42' | customer_id: 'CUST015635' -> 'CUST015635'
2026-01-12 12:10:25,957 - dq_comparison - INFO - DEBUG HASH STRING: text with leading spaces|TX00015635|2023-11-26|42|CUST015635...
2026-01-12 12:10:25,958 - dq_comparison - INFO - DEBUG HASH RESULT: 034c1d63...
2026-01-12 12:10:25,959 - dq_comparison - INFO - DEBUG HASH ROW: description: 'Text with! exclamations' -> 'text with! exclamations' | transaction_id: 'TX00062899' -> 'TX00062899' | transaction_date: '23-08-2023' -> '2023-08-23' | quantity: '3' -> '3' | customer_id: 'CUST062899' -> 'CUST062899'
2026-01-12 12:10:25,960 - dq_comparison - INFO - DEBUG HASH STRING: text with! exclamations|TX00062899|2023-08-23|3|CUST062899...
2026-01-12 12:10:25,960 - dq_comparison - INFO - DEBUG HASH RESULT: b0b9df89...
2026-01-12 12:10:25,961 - dq_comparison - INFO - DEBUG HASH ROW: description: 'Text with\backslashes' -> 'text with\backslashes' | transaction_id: 'TX00093781' -> 'TX00093781' | transaction_date: '14-04-2023' -> '2023-04-14' | quantity: '49' -> '49' | customer_id: 'CUST093781' -> 'CUST093781'
2026-01-12 12:10:25,962 - dq_comparison - INFO - DEBUG HASH STRING: text with\backslashes|TX00093781|2023-04-14|49|CUST093781...
2026-01-12 12:10:25,962 - dq_comparison - INFO - DEBUG HASH RESULT: 853325a2...
2026-01-12 12:10:25,963 - dq_comparison - INFO - DEBUG HASH ROW: description: 'Text with`backticks' -> 'text with`backticks' | transaction_id: 'TX00042279' -> 'TX00042279' | transaction_date: '01-12-2023' -> '2023-12-01' | quantity: '96' -> '96' | customer_id: 'CUST042279' -> 'CUST042279'
2026-01-12 12:10:25,965 - dq_comparison - INFO - DEBUG HASH STRING: text with`backticks|TX00042279|2023-12-01|96|CUST042279...
2026-01-12 12:10:25,965 - dq_comparison - INFO - DEBUG HASH RESULT: 4b4ff60b...
2026-01-12 12:10:25,966 - dq_comparison - INFO - DEBUG HASH ROW: description: 'Text with#hashtags' -> 'text with#hashtags' | transaction_id: 'TX00001770' -> 'TX00001770' | transaction_date: '01-08-2023' -> '2023-08-01' | quantity: '76' -> '76' | customer_id: 'CUST001770' -> 'CUST001770'
2026-01-12 12:10:25,966 - dq_comparison - INFO - DEBUG HASH STRING: text with#hashtags|TX00001770|2023-08-01|76|CUST001770...
2026-01-12 12:10:25,967 - dq_comparison - INFO - DEBUG HASH RESULT: bc5b3638...
2026-01-12 12:10:25,968 - dq_comparison - INFO - DEBUG HASH ROW: description: '  Text with leading spaces' -> 'text with leading spaces' | transaction_id: 'TX00026284' -> 'TX00026284' | transaction_date: '30-01-2023' -> '2023-01-30' | quantity: '35' -> '35' | customer_id: 'CUST026284' -> 'CUST026284'
2026-01-12 12:10:25,969 - dq_comparison - INFO - DEBUG HASH STRING: text with leading spaces|TX00026284|2023-01-30|35|CUST026284...
2026-01-12 12:10:25,969 - dq_comparison - INFO - DEBUG HASH RESULT: e32b9f2d...
2026-01-12 12:10:25,970 - dq_comparison - INFO - DEBUG HASH ROW: description: 'Text with<angle brackets>' -> 'text with<angle brackets>' | transaction_id: 'TX00036477' -> 'TX00036477' | transaction_date: '10-10-2023' -> '2023-10-10' | quantity: '98' -> '98' | customer_id: 'CUST036477' -> 'CUST036477'
2026-01-12 12:10:25,970 - dq_comparison - INFO - DEBUG HASH STRING: text with<angle brackets>|TX00036477|2023-10-10|98|CUST036477...
2026-01-12 12:10:25,971 - dq_comparison - INFO - DEBUG HASH RESULT: a422bbae...
2026-01-12 12:10:25,972 - dq_comparison - INFO - DEBUG HASH ROW: description: 'Text with@at signs' -> 'text with@at signs' | transaction_id: 'TX00051941' -> 'TX00051941' | transaction_date: '09/29/2023' -> '2023-09-29' | quantity: '42' -> '42' | customer_id: 'CUST051941' -> 'CUST051941'
2026-01-12 12:10:25,972 - dq_comparison - INFO - DEBUG HASH STRING: text with@at signs|TX00051941|2023-09-29|42|CUST051941...
2026-01-12 12:10:25,973 - dq_comparison - INFO - DEBUG HASH RESULT: 97b91a37...
2026-01-12 12:10:25,974 - dq_comparison - INFO - DEBUG HASH ROW: description: 'Text with`backticks' -> 'text with`backticks' | transaction_id: 'TX00081674' -> 'TX00081674' | transaction_date: '04-05-2023' -> '2023-05-04' | quantity: '53' -> '53' | customer_id: 'CUST081674' -> 'CUST081674'
2026-01-12 12:10:25,975 - dq_comparison - INFO - DEBUG HASH STRING: text with`backticks|TX00081674|2023-05-04|53|CUST081674...
2026-01-12 12:10:25,975 - dq_comparison - INFO - DEBUG HASH RESULT: 79b00109...
2026-01-12 12:10:25,976 - dq_comparison - INFO - DEBUG HASH ROW: description: 'Text with/slashes' -> 'text with/slashes' | transaction_id: 'TX00032747' -> 'TX00032747' | transaction_date: '07-12-2023' -> '2023-12-07' | quantity: '74' -> '74' | customer_id: 'CUST032747' -> 'CUST032747'
2026-01-12 12:10:25,977 - dq_comparison - INFO - DEBUG HASH STRING: text with/slashes|TX00032747|2023-12-07|74|CUST032747...
2026-01-12 12:10:25,977 - dq_comparison - INFO - DEBUG HASH RESULT: b1c2c584...
2026-01-12 12:10:25,979 - dq_comparison - INFO - DEBUG HASH ROW: description: 'Text with|pipes' -> 'text with|pipes' | transaction_id: 'TX00055832' -> 'TX00055832' | transaction_date: '04-09-2023' -> '2023-09-04' | quantity: '23' -> '23' | customer_id: 'CUST055832' -> 'CUST055832'
2026-01-12 12:10:25,979 - dq_comparison - INFO - DEBUG HASH STRING: text with|pipes|TX00055832|2023-09-04|23|CUST055832...
2026-01-12 12:10:25,980 - dq_comparison - INFO - DEBUG HASH RESULT: 48aeb230...
2026-01-12 12:10:25,981 - dq_comparison - INFO - DEBUG HASH ROW: description: 'Text with  multiple   spaces' -> 'text with multiple spaces' | transaction_id: 'TX00073163' -> 'TX00073163' | transaction_date: '25-04-2023' -> '2023-04-25' | quantity: '48' -> '48' | customer_id: 'CUST073163' -> 'CUST073163'
2026-01-12 12:10:25,981 - dq_comparison - INFO - DEBUG HASH STRING: text with multiple spaces|TX00073163|2023-04-25|48|CUST073163...
2026-01-12 12:10:25,982 - dq_comparison - INFO - DEBUG HASH RESULT: 5bbc166e...
2026-01-12 12:10:25,983 - dq_comparison - INFO - DEBUG HASH ROW: description: 'Normal text without issues' -> 'normal text without issues' | transaction_id: 'TX00098326' -> 'TX00098326' | transaction_date: '12/14/2023' -> '2023-12-14' | quantity: '46' -> '46' | customer_id: 'CUST098326' -> 'CUST098326'
2026-01-12 12:10:25,983 - dq_comparison - INFO - DEBUG HASH STRING: normal text without issues|TX00098326|2023-12-14|46|CUST098326...
2026-01-12 12:10:25,984 - dq_comparison - INFO - DEBUG HASH RESULT: 6b8eb596...
2026-01-12 12:10:25,985 - dq_comparison - INFO - DEBUG HASH ROW: description: '  Text with leading spaces' -> 'text with leading spaces' | transaction_id: 'TX00023815' -> 'TX00023815' | transaction_date: '03-04-2023' -> '2023-04-03' | quantity: '91' -> '91' | customer_id: 'CUST023815' -> 'CUST023815'
2026-01-12 12:10:25,986 - dq_comparison - INFO - DEBUG HASH STRING: text with leading spaces|TX00023815|2023-04-03|91|CUST023815...
2026-01-12 12:10:25,986 - dq_comparison - INFO - DEBUG HASH RESULT: 1343eaa2...
2026-01-12 12:10:25,987 - dq_comparison - INFO - DEBUG HASH ROW: description: 'Normal text without issues' -> 'normal text without issues' | transaction_id: 'TX00067036' -> 'TX00067036' | transaction_date: '08/14/2023' -> '2023-08-14' | quantity: '30' -> '30' | customer_id: 'CUST067036' -> 'CUST067036'
2026-01-12 12:10:25,988 - dq_comparison - INFO - DEBUG HASH STRING: normal text without issues|TX00067036|2023-08-14|30|CUST067036...
2026-01-12 12:10:25,988 - dq_comparison - INFO - DEBUG HASH RESULT: 90c72257...
2026-01-12 12:10:25,989 - dq_comparison - INFO - DEBUG HASH ROW: description: 'Text with	tabs' -> 'text with tabs' | transaction_id: 'TX00052715' -> 'TX00052715' | transaction_date: '23-09-2023' -> '2023-09-23' | quantity: '93' -> '93' | customer_id: 'CUST052715' -> 'CUST052715'
2026-01-12 12:10:25,990 - dq_comparison - INFO - DEBUG HASH STRING: text with tabs|TX00052715|2023-09-23|93|CUST052715...
2026-01-12 12:10:25,990 - dq_comparison - INFO - DEBUG HASH RESULT: 09427b84...
2026-01-12 12:10:25,991 - dq_comparison - INFO - DEBUG HASH ROW: description: 'Text with; semicolons' -> 'text with; semicolons' | transaction_id: 'TX00049283' -> 'TX00049283' | transaction_date: '01-03-2023' -> '2023-03-01' | quantity: '62' -> '62' | customer_id: 'CUST049283' -> 'CUST049283'
2026-01-12 12:10:25,992 - dq_comparison - INFO - DEBUG HASH STRING: text with; semicolons|TX00049283|2023-03-01|62|CUST049283...
2026-01-12 12:10:25,992 - dq_comparison - INFO - DEBUG HASH RESULT: 1cdc9746...
2026-01-12 12:10:25,993 - dq_comparison - INFO - DEBUG HASH ROW: description: 'Text with<angle brackets>' -> 'text with<angle brackets>' | transaction_id: 'TX00092513' -> 'TX00092513' | transaction_date: '06/29/2023' -> '2023-06-29' | quantity: '33' -> '33' | customer_id: 'CUST092513' -> 'CUST092513'
2026-01-12 12:10:25,994 - dq_comparison - INFO - DEBUG HASH STRING: text with<angle brackets>|TX00092513|2023-06-29|33|CUST092513...
2026-01-12 12:10:25,995 - dq_comparison - INFO - DEBUG HASH RESULT: 76b2a68a...
2026-01-12 12:10:25,995 - dq_comparison - INFO - DEBUG HASH ROW: description: 'Text with|pipes' -> 'text with|pipes' | transaction_id: 'TX00027836' -> 'TX00027836' | transaction_date: '04/17/2023' -> '2023-04-17' | quantity: '92' -> '92' | customer_id: 'CUST027836' -> 'CUST027836'
2026-01-12 12:10:25,996 - dq_comparison - INFO - DEBUG HASH STRING: text with|pipes|TX00027836|2023-04-17|92|CUST027836...
2026-01-12 12:10:25,996 - dq_comparison - INFO - DEBUG HASH RESULT: 880d81f2...
2026-01-12 12:10:25,997 - dq_comparison - INFO - DEBUG HASH ROW: description: 'Text with|pipes' -> 'text with|pipes' | transaction_id: 'TX00061065' -> 'TX00061065' | transaction_date: '22-04-2023' -> '2023-04-22' | quantity: '1' -> '1' | customer_id: 'CUST061065' -> 'CUST061065'
2026-01-12 12:10:25,998 - dq_comparison - INFO - DEBUG HASH STRING: text with|pipes|TX00061065|2023-04-22|1|CUST061065...
2026-01-12 12:10:25,998 - dq_comparison - INFO - DEBUG HASH RESULT: 07d51c04...
2026-01-12 12:10:25,999 - dq_comparison - INFO - DEBUG HASH ROW: description: 'Text with"quotes"' -> 'text with"quotes"' | transaction_id: 'TX00021303' -> 'TX00021303' | transaction_date: '21-08-2023' -> '2023-08-21' | quantity: '3' -> '3' | customer_id: 'CUST021303' -> 'CUST021303'
2026-01-12 12:10:25,999 - dq_comparison - INFO - DEBUG HASH STRING: text with"quotes"|TX00021303|2023-08-21|3|CUST021303...
2026-01-12 12:10:26,000 - dq_comparison - INFO - DEBUG HASH RESULT: 373acba6...
2026-01-12 12:10:26,001 - dq_comparison - INFO - DEBUG HASH ROW: description: 'Text with	tabs' -> 'text with tabs' | transaction_id: 'TX00031424' -> 'TX00031424' | transaction_date: '05-12-2023' -> '2023-12-05' | quantity: '75' -> '75' | customer_id: 'CUST031424' -> 'CUST031424'
2026-01-12 12:10:26,001 - dq_comparison - INFO - DEBUG HASH STRING: text with tabs|TX00031424|2023-12-05|75|CUST031424...
2026-01-12 12:10:26,002 - dq_comparison - INFO - DEBUG HASH RESULT: a6358e04...
2026-01-12 12:10:26,003 - dq_comparison - INFO - DEBUG HASH ROW: description: 'Text with. periods' -> 'text with. periods' | transaction_id: 'TX00095990' -> 'TX00095990' | transaction_date: '10-06-2023' -> '2023-06-10' | quantity: '18' -> '18' | customer_id: 'CUST095990' -> 'CUST095990'
2026-01-12 12:10:26,003 - dq_comparison - INFO - DEBUG HASH STRING: text with. periods|TX00095990|2023-06-10|18|CUST095990...
2026-01-12 12:10:26,004 - dq_comparison - INFO - DEBUG HASH RESULT: 88920137...
2026-01-12 12:10:26,005 - dq_comparison - INFO - DEBUG HASH ROW: description: 'Text with	tabs' -> 'text with tabs' | transaction_id: 'TX00021967' -> 'TX00021967' | transaction_date: '14-02-2023' -> '2023-02-14' | quantity: '10' -> '10' | customer_id: 'CUST021967' -> 'CUST021967'
2026-01-12 12:10:26,005 - dq_comparison - INFO - DEBUG HASH STRING: text with tabs|TX00021967|2023-02-14|10|CUST021967...
2026-01-12 12:10:26,006 - dq_comparison - INFO - DEBUG HASH RESULT: 1ce16bcc...
2026-01-12 12:10:26,007 - dq_comparison - INFO - DEBUG HASH ROW: description: 'Text with/slashes' -> 'text with/slashes' | transaction_id: 'TX00009816' -> 'TX00009816' | transaction_date: '02-05-2023' -> '2023-05-02' | quantity: '50' -> '50' | customer_id: 'CUST009816' -> 'CUST009816'
2026-01-12 12:10:26,007 - dq_comparison - INFO - DEBUG HASH STRING: text with/slashes|TX00009816|2023-05-02|50|CUST009816...
2026-01-12 12:10:26,008 - dq_comparison - INFO - DEBUG HASH RESULT: 94a66fe8...
2026-01-12 12:10:26,009 - dq_comparison - INFO - DEBUG HASH ROW: description: 'Text with. periods' -> 'text with. periods' | transaction_id: 'TX00013787' -> 'TX00013787' | transaction_date: '26-01-2023' -> '2023-01-26' | quantity: '86' -> '86' | customer_id: 'CUST013787' -> 'CUST013787'
2026-01-12 12:10:26,009 - dq_comparison - INFO - DEBUG HASH STRING: text with. periods|TX00013787|2023-01-26|86|CUST013787...
2026-01-12 12:10:26,010 - dq_comparison - INFO - DEBUG HASH RESULT: 627f3568...
2026-01-12 12:10:26,011 - dq_comparison - INFO - DEBUG HASH ROW: description: 'Text with|pipes' -> 'text with|pipes' | transaction_id: 'TX00034594' -> 'TX00034594' | transaction_date: '14-11-2023' -> '2023-11-14' | quantity: '1' -> '1' | customer_id: 'CUST034594' -> 'CUST034594'
2026-01-12 12:10:26,011 - dq_comparison - INFO - DEBUG HASH STRING: text with|pipes|TX00034594|2023-11-14|1|CUST034594...
2026-01-12 12:10:26,011 - dq_comparison - INFO - DEBUG HASH RESULT: f5719c2a...
2026-01-12 12:10:26,013 - dq_comparison - INFO - DEBUG HASH ROW: description: 'Text with%percent signs' -> 'text with%percent signs' | transaction_id: 'TX00060522' -> 'TX00060522' | transaction_date: '28-10-2023' -> '2023-10-28' | quantity: '51' -> '51' | customer_id: 'CUST060522' -> 'CUST060522'
2026-01-12 12:10:26,013 - dq_comparison - INFO - DEBUG HASH STRING: text with%percent signs|TX00060522|2023-10-28|51|CUST060522...
2026-01-12 12:10:26,014 - dq_comparison - INFO - DEBUG HASH RESULT: 017390d7...
2026-01-12 12:10:26,016 - dq_comparison - INFO - DEBUG HASH ROW: description: 'Text with  multiple   spaces' -> 'text with multiple spaces' | transaction_id: 'TX00092313' -> 'TX00092313' | transaction_date: '06-04-2023' -> '2023-04-06' | quantity: '76' -> '76' | customer_id: 'CUST092313' -> 'CUST092313'
2026-01-12 12:10:26,016 - dq_comparison - INFO - DEBUG HASH STRING: text with multiple spaces|TX00092313|2023-04-06|76|CUST092313...
2026-01-12 12:10:26,017 - dq_comparison - INFO - DEBUG HASH RESULT: 39da596b...
2026-01-12 12:10:26,018 - dq_comparison - INFO - DEBUG HASH ROW: description: 'Text with
newlines' -> 'text with newlines' | transaction_id: 'TX00036673' -> 'TX00036673' | transaction_date: '16-06-2023' -> '2023-06-16' | quantity: '35' -> '35' | customer_id: 'CUST036673' -> 'CUST036673'
2026-01-12 12:10:26,019 - dq_comparison - INFO - DEBUG HASH STRING: text with newlines|TX00036673|2023-06-16|35|CUST036673...
2026-01-12 12:10:26,019 - dq_comparison - INFO - DEBUG HASH RESULT: 7b56bdba...
2026-01-12 12:10:26,020 - dq_comparison - INFO - DEBUG HASH ROW: description: 'Text with mixed CAPITAL and lowercase' -> 'text with mixed capital and lowercase' | transaction_id: 'TX00090724' -> 'TX00090724' | transaction_date: '21-06-2023' -> '2023-06-21' | quantity: '28' -> '28' | customer_id: 'CUST090724' -> 'CUST090724'
2026-01-12 12:10:26,021 - dq_comparison - INFO - DEBUG HASH STRING: text with mixed capital and lowercase|TX00090724|2023-06-21|28|CUST090724...
2026-01-12 12:10:26,021 - dq_comparison - INFO - DEBUG HASH RESULT: 4d9e307f...
2026-01-12 12:10:26,023 - dq_comparison - INFO - DEBUG HASH ROW: description: 'Text with\backslashes' -> 'text with\backslashes' | transaction_id: 'TX00015649' -> 'TX00015649' | transaction_date: '31-12-2023' -> '2023-12-31' | quantity: '65' -> '65' | customer_id: 'CUST015649' -> 'CUST015649'
2026-01-12 12:10:26,023 - dq_comparison - INFO - DEBUG HASH STRING: text with\backslashes|TX00015649|2023-12-31|65|CUST015649...
2026-01-12 12:10:26,024 - dq_comparison - INFO - DEBUG HASH RESULT: 103a1bda...
2026-01-12 12:10:26,025 - dq_comparison - INFO - DEBUG HASH ROW: description: 'Text with"quotes"' -> 'text with"quotes"' | transaction_id: 'TX00065697' -> 'TX00065697' | transaction_date: '26-02-2023' -> '2023-02-26' | quantity: '58' -> '58' | customer_id: 'CUST065697' -> 'CUST065697'
2026-01-12 12:10:26,025 - dq_comparison - INFO - DEBUG HASH STRING: text with"quotes"|TX00065697|2023-02-26|58|CUST065697...
2026-01-12 12:10:26,026 - dq_comparison - INFO - DEBUG HASH RESULT: a5552301...
2026-01-12 12:10:26,026 - dq_comparison - INFO - DEBUG HASH ROW: description: 'Text with - dashes' -> 'text with - dashes' | transaction_id: 'TX00056791' -> 'TX00056791' | transaction_date: '06-03-2023' -> '2023-03-06' | quantity: '53' -> '53' | customer_id: 'CUST056791' -> 'CUST056791'
2026-01-12 12:10:26,027 - dq_comparison - INFO - DEBUG HASH STRING: text with - dashes|TX00056791|2023-03-06|53|CUST056791...
2026-01-12 12:10:26,027 - dq_comparison - INFO - DEBUG HASH RESULT: b73a6b4e...
2026-01-12 12:10:26,028 - dq_comparison - INFO - DEBUG HASH ROW: description: 'Text with`backticks' -> 'text with`backticks' | transaction_id: 'TX00029179' -> 'TX00029179' | transaction_date: '25-09-2023' -> '2023-09-25' | quantity: '88' -> '88' | customer_id: 'CUST029179' -> 'CUST029179'
2026-01-12 12:10:26,029 - dq_comparison - INFO - DEBUG HASH STRING: text with`backticks|TX00029179|2023-09-25|88|CUST029179...
2026-01-12 12:10:26,029 - dq_comparison - INFO - DEBUG HASH RESULT: 67841c67...
2026-01-12 12:10:26,030 - dq_comparison - INFO - DEBUG HASH ROW: description: 'Text with(parentheses)' -> 'text with(parentheses)' | transaction_id: 'TX00022062' -> 'TX00022062' | transaction_date: '19-03-2023' -> '2023-03-19' | quantity: '24' -> '24' | customer_id: 'CUST022062' -> 'CUST022062'
2026-01-12 12:10:26,031 - dq_comparison - INFO - DEBUG HASH STRING: text with(parentheses)|TX00022062|2023-03-19|24|CUST022062...
2026-01-12 12:10:26,032 - dq_comparison - INFO - DEBUG HASH RESULT: 368082e9...
2026-01-12 12:10:26,032 - dq_comparison - INFO - DEBUG HASH ROW: description: 'Text with! exclamations' -> 'text with! exclamations' | transaction_id: 'TX00022151' -> 'TX00022151' | transaction_date: '03-05-2023' -> '2023-05-03' | quantity: '76' -> '76' | customer_id: 'CUST022151' -> 'CUST022151'
2026-01-12 12:10:26,033 - dq_comparison - INFO - DEBUG HASH STRING: text with! exclamations|TX00022151|2023-05-03|76|CUST022151...
2026-01-12 12:10:26,034 - dq_comparison - INFO - DEBUG HASH RESULT: e8896395...
2026-01-12 12:10:26,035 - dq_comparison - INFO - DEBUG HASH ROW: description: 'Text with. periods' -> 'text with. periods' | transaction_id: 'TX00065229' -> 'TX00065229' | transaction_date: '05-10-2023' -> '2023-10-05' | quantity: '82' -> '82' | customer_id: 'CUST065229' -> 'CUST065229'
2026-01-12 12:10:26,035 - dq_comparison - INFO - DEBUG HASH STRING: text with. periods|TX00065229|2023-10-05|82|CUST065229...
2026-01-12 12:10:26,036 - dq_comparison - INFO - DEBUG HASH RESULT: 8344b0d2...
2026-01-12 12:10:26,037 - dq_comparison - INFO - DEBUG HASH ROW: description: 'Text with? questions' -> 'text with? questions' | transaction_id: 'TX00088033' -> 'TX00088033' | transaction_date: '26-03-2023' -> '2023-03-26' | quantity: '94' -> '94' | customer_id: 'CUST088033' -> 'CUST088033'
2026-01-12 12:10:26,037 - dq_comparison - INFO - DEBUG HASH STRING: text with? questions|TX00088033|2023-03-26|94|CUST088033...
2026-01-12 12:10:26,038 - dq_comparison - INFO - DEBUG HASH RESULT: cc7f46ba...
2026-01-12 12:10:26,039 - dq_comparison - INFO - DEBUG HASH ROW: description: 'Text with. periods' -> 'text with. periods' | transaction_id: 'TX00087303' -> 'TX00087303' | transaction_date: '09-11-2023' -> '2023-11-09' | quantity: '16' -> '16' | customer_id: 'CUST087303' -> 'CUST087303'
2026-01-12 12:10:26,039 - dq_comparison - INFO - DEBUG HASH STRING: text with. periods|TX00087303|2023-11-09|16|CUST087303...
2026-01-12 12:10:26,040 - dq_comparison - INFO - DEBUG HASH RESULT: a0f4ec22...
2026-01-12 12:10:26,041 - dq_comparison - INFO - DEBUG HASH ROW: description: 'Text with$dollar signs' -> 'text with$dollar signs' | transaction_id: 'TX00034985' -> 'TX00034985' | transaction_date: '28-07-2023' -> '2023-07-28' | quantity: '77' -> '77' | customer_id: 'CUST034985' -> 'CUST034985'
2026-01-12 12:10:26,041 - dq_comparison - INFO - DEBUG HASH STRING: text with$dollar signs|TX00034985|2023-07-28|77|CUST034985...
2026-01-12 12:10:26,042 - dq_comparison - INFO - DEBUG HASH RESULT: fe581dd7...
2026-01-12 12:10:26,043 - dq_comparison - INFO - DEBUG HASH ROW: description: 'Text with(parentheses)' -> 'text with(parentheses)' | transaction_id: 'TX00039098' -> 'TX00039098' | transaction_date: '29-10-2023' -> '2023-10-29' | quantity: '40' -> '40' | customer_id: 'CUST039098' -> 'CUST039098'
2026-01-12 12:10:26,044 - dq_comparison - INFO - DEBUG HASH STRING: text with(parentheses)|TX00039098|2023-10-29|40|CUST039098...
2026-01-12 12:10:26,044 - dq_comparison - INFO - DEBUG HASH RESULT: 0c70d8a3...
2026-01-12 12:10:26,045 - dq_comparison - INFO - DEBUG HASH ROW: description: 'Text with_underscores' -> 'text with_underscores' | transaction_id: 'TX00068532' -> 'TX00068532' | transaction_date: '15-09-2023' -> '2023-09-15' | quantity: '27' -> '27' | customer_id: 'CUST068532' -> 'CUST068532'
2026-01-12 12:10:26,046 - dq_comparison - INFO - DEBUG HASH STRING: text with_underscores|TX00068532|2023-09-15|27|CUST068532...
2026-01-12 12:10:26,046 - dq_comparison - INFO - DEBUG HASH RESULT: 1fe15c52...
2026-01-12 12:10:26,047 - dq_comparison - INFO - DEBUG HASH ROW: description: 'Text with  multiple   spaces' -> 'text with multiple spaces' | transaction_id: 'TX00028369' -> 'TX00028369' | transaction_date: '03-10-2023' -> '2023-10-03' | quantity: '9' -> '9' | customer_id: 'CUST028369' -> 'CUST028369'
2026-01-12 12:10:26,048 - dq_comparison - INFO - DEBUG HASH STRING: text with multiple spaces|TX00028369|2023-10-03|9|CUST028369...
2026-01-12 12:10:26,049 - dq_comparison - INFO - DEBUG HASH RESULT: 1705742e...
2026-01-12 12:10:26,050 - dq_comparison - INFO - DEBUG HASH ROW: description: 'Text with[brackets]' -> 'text with[brackets]' | transaction_id: 'TX00063970' -> 'TX00063970' | transaction_date: '26-12-2023' -> '2023-12-26' | quantity: '55' -> '55' | customer_id: 'CUST063970' -> 'CUST063970'
2026-01-12 12:10:26,051 - dq_comparison - INFO - DEBUG HASH STRING: text with[brackets]|TX00063970|2023-12-26|55|CUST063970...
2026-01-12 12:10:26,051 - dq_comparison - INFO - DEBUG HASH RESULT: ee2efe23...
2026-01-12 12:10:26,052 - dq_comparison - INFO - DEBUG HASH ROW: description: 'Text with{braces}' -> 'text with{braces}' | transaction_id: 'TX00090011' -> 'TX00090011' | transaction_date: '18-09-2023' -> '2023-09-18' | quantity: '50' -> '50' | customer_id: 'CUST090011' -> 'CUST090011'
2026-01-12 12:10:26,053 - dq_comparison - INFO - DEBUG HASH STRING: text with{braces}|TX00090011|2023-09-18|50|CUST090011...
2026-01-12 12:10:26,053 - dq_comparison - INFO - DEBUG HASH RESULT: d8feb5a1...
2026-01-12 12:10:26,054 - dq_comparison - INFO - DEBUG HASH ROW: description: 'Text with[brackets]' -> 'text with[brackets]' | transaction_id: 'TX00033167' -> 'TX00033167' | transaction_date: '22-11-2023' -> '2023-11-22' | quantity: '32' -> '32' | customer_id: 'CUST033167' -> 'CUST033167'
2026-01-12 12:10:26,055 - dq_comparison - INFO - DEBUG HASH STRING: text with[brackets]|TX00033167|2023-11-22|32|CUST033167...
2026-01-12 12:10:26,055 - dq_comparison - INFO - DEBUG HASH RESULT: 1aed5f29...
2026-01-12 12:10:26,057 - dq_comparison - INFO - DEBUG HASH ROW: description: 'Text with; semicolons' -> 'text with; semicolons' | transaction_id: 'TX00083983' -> 'TX00083983' | transaction_date: '07-10-2023' -> '2023-10-07' | quantity: '5' -> '5' | customer_id: 'CUST083983' -> 'CUST083983'
2026-01-12 12:10:26,058 - dq_comparison - INFO - DEBUG HASH STRING: text with; semicolons|TX00083983|2023-10-07|5|CUST083983...
2026-01-12 12:10:26,058 - dq_comparison - INFO - DEBUG HASH RESULT: 5c5dccc8...
2026-01-12 12:10:26,059 - dq_comparison - INFO - DEBUG HASH ROW: description: 'Text with_underscores' -> 'text with_underscores' | transaction_id: 'TX00027372' -> 'TX00027372' | transaction_date: '10-09-2023' -> '2023-09-10' | quantity: '23' -> '23' | customer_id: 'CUST027372' -> 'CUST027372'
2026-01-12 12:10:26,060 - dq_comparison - INFO - DEBUG HASH STRING: text with_underscores|TX00027372|2023-09-10|23|CUST027372...
2026-01-12 12:10:26,060 - dq_comparison - INFO - DEBUG HASH RESULT: 10b7a9ae...
2026-01-12 12:10:26,061 - dq_comparison - INFO - DEBUG HASH ROW: description: 'Text with$dollar signs' -> 'text with$dollar signs' | transaction_id: 'TX00029975' -> 'TX00029975' | transaction_date: '09-01-2023' -> '2023-01-09' | quantity: '97' -> '97' | customer_id: 'CUST029975' -> 'CUST029975'
2026-01-12 12:10:26,062 - dq_comparison - INFO - DEBUG HASH STRING: text with$dollar signs|TX00029975|2023-01-09|97|CUST029975...
2026-01-12 12:10:26,063 - dq_comparison - INFO - DEBUG HASH RESULT: d5ff8091...
2026-01-12 12:10:26,063 - dq_comparison - INFO - DEBUG HASH ROW: description: 'Text with`backticks' -> 'text with`backticks' | transaction_id: 'TX00071449' -> 'TX00071449' | transaction_date: '20-06-2023' -> '2023-06-20' | quantity: '84' -> '84' | customer_id: 'CUST071449' -> 'CUST071449'
2026-01-12 12:10:26,064 - dq_comparison - INFO - DEBUG HASH STRING: text with`backticks|TX00071449|2023-06-20|84|CUST071449...
2026-01-12 12:10:26,065 - dq_comparison - INFO - DEBUG HASH RESULT: 7485dbc2...
2026-01-12 12:10:26,066 - dq_comparison - INFO - DEBUG HASH ROW: description: 'Text with/slashes' -> 'text with/slashes' | transaction_id: 'TX00020456' -> 'TX00020456' | transaction_date: '08/29/2023' -> '2023-08-29' | quantity: '13' -> '13' | customer_id: 'CUST020456' -> 'CUST020456'
2026-01-12 12:10:26,066 - dq_comparison - INFO - DEBUG HASH STRING: text with/slashes|TX00020456|2023-08-29|13|CUST020456...
2026-01-12 12:10:26,067 - dq_comparison - INFO - DEBUG HASH RESULT: 8d886b2f...
2026-01-12 12:10:26,068 - dq_comparison - INFO - DEBUG HASH ROW: description: 'Text with trailing spaces  ' -> 'text with trailing spaces' | transaction_id: 'TX00091996' -> 'TX00091996' | transaction_date: '22-09-2023' -> '2023-09-22' | quantity: '67' -> '67' | customer_id: 'CUST091996' -> 'CUST091996'
2026-01-12 12:10:26,068 - dq_comparison - INFO - DEBUG HASH STRING: text with trailing spaces|TX00091996|2023-09-22|67|CUST091996...
2026-01-12 12:10:26,069 - dq_comparison - INFO - DEBUG HASH RESULT: a6a6792a...
2026-01-12 12:10:26,070 - dq_comparison - INFO - DEBUG HASH ROW: description: 'Text with%percent signs' -> 'text with%percent signs' | transaction_id: 'TX00010307' -> 'TX00010307' | transaction_date: '20-03-2023' -> '2023-03-20' | quantity: '88' -> '88' | customer_id: 'CUST010307' -> 'CUST010307'
2026-01-12 12:10:26,071 - dq_comparison - INFO - DEBUG HASH STRING: text with%percent signs|TX00010307|2023-03-20|88|CUST010307...
2026-01-12 12:10:26,071 - dq_comparison - INFO - DEBUG HASH RESULT: 725564fd...
2026-01-12 12:10:26,072 - dq_comparison - INFO - DEBUG HASH ROW: description: 'Text with$dollar signs' -> 'text with$dollar signs' | transaction_id: 'TX00012944' -> 'TX00012944' | transaction_date: '03-04-2023' -> '2023-04-03' | quantity: '27' -> '27' | customer_id: 'CUST012944' -> 'CUST012944'
2026-01-12 12:10:26,074 - dq_comparison - INFO - DEBUG HASH STRING: text with$dollar signs|TX00012944|2023-04-03|27|CUST012944...
2026-01-12 12:10:26,074 - dq_comparison - INFO - DEBUG HASH RESULT: 4cd92bce...
2026-01-12 12:10:26,075 - dq_comparison - INFO - DEBUG HASH ROW: description: 'Text with_underscores' -> 'text with_underscores' | transaction_id: 'TX00024724' -> 'TX00024724' | transaction_date: '28-04-2023' -> '2023-04-28' | quantity: '29' -> '29' | customer_id: 'CUST024724' -> 'CUST024724'
2026-01-12 12:10:26,077 - dq_comparison - INFO - DEBUG HASH STRING: text with_underscores|TX00024724|2023-04-28|29|CUST024724...
2026-01-12 12:10:26,077 - dq_comparison - INFO - DEBUG HASH RESULT: 91861baa...
2026-01-12 12:10:26,077 - dq_comparison - INFO - DEBUG HASH ROW: description: 'Text with[brackets]' -> 'text with[brackets]' | transaction_id: 'TX00014878' -> 'TX00014878' | transaction_date: '29-11-2023' -> '2023-11-29' | quantity: '73' -> '73' | customer_id: 'CUST014878' -> 'CUST014878'
2026-01-12 12:10:26,078 - dq_comparison - INFO - DEBUG HASH STRING: text with[brackets]|TX00014878|2023-11-29|73|CUST014878...
2026-01-12 12:10:26,078 - dq_comparison - INFO - DEBUG HASH RESULT: 780634db...
2026-01-12 12:10:26,079 - dq_comparison - INFO - DEBUG HASH ROW: description: 'Text with? questions' -> 'text with? questions' | transaction_id: 'TX00058261' -> 'TX00058261' | transaction_date: '12-02-2023' -> '2023-02-12' | quantity: '10' -> '10' | customer_id: 'CUST058261' -> 'CUST058261'
2026-01-12 12:10:26,080 - dq_comparison - INFO - DEBUG HASH STRING: text with? questions|TX00058261|2023-02-12|10|CUST058261...
2026-01-12 12:10:26,080 - dq_comparison - INFO - DEBUG HASH RESULT: 80611ba2...
2026-01-12 12:10:26,081 - dq_comparison - INFO - DEBUG HASH ROW: description: 'Text with(parentheses)' -> 'text with(parentheses)' | transaction_id: 'TX00087427' -> 'TX00087427' | transaction_date: '22-07-2023' -> '2023-07-22' | quantity: '25' -> '25' | customer_id: 'CUST087427' -> 'CUST087427'
2026-01-12 12:10:26,082 - dq_comparison - INFO - DEBUG HASH STRING: text with(parentheses)|TX00087427|2023-07-22|25|CUST087427...
2026-01-12 12:10:26,082 - dq_comparison - INFO - DEBUG HASH RESULT: ddb2624d...
2026-01-12 12:10:26,083 - dq_comparison - INFO - DEBUG HASH ROW: description: 'Text with? questions' -> 'text with? questions' | transaction_id: 'TX00090254' -> 'TX00090254' | transaction_date: '14-12-2023' -> '2023-12-14' | quantity: '87' -> '87' | customer_id: 'CUST090254' -> 'CUST090254'
2026-01-12 12:10:26,084 - dq_comparison - INFO - DEBUG HASH STRING: text with? questions|TX00090254|2023-12-14|87|CUST090254...
2026-01-12 12:10:26,084 - dq_comparison - INFO - DEBUG HASH RESULT: 136d17a6...
2026-01-12 12:10:26,086 - dq_comparison - INFO - DEBUG HASH ROW: description: 'Text with<angle brackets>' -> 'text with<angle brackets>' | transaction_id: 'TX00097622' -> 'TX00097622' | transaction_date: '04/27/2023' -> '2023-04-27' | quantity: '28' -> '28' | customer_id: 'CUST097622' -> 'CUST097622'
2026-01-12 12:10:26,086 - dq_comparison - INFO - DEBUG HASH STRING: text with<angle brackets>|TX00097622|2023-04-27|28|CUST097622...
2026-01-12 12:10:26,088 - dq_comparison - INFO - DEBUG HASH RESULT: dab0dac0...
2026-01-12 12:10:26,088 - dq_comparison - INFO - DEBUG HASH ROW: description: 'Text with - dashes' -> 'text with - dashes' | transaction_id: 'TX00046340' -> 'TX00046340' | transaction_date: '14-11-2023' -> '2023-11-14' | quantity: '6' -> '6' | customer_id: 'CUST046340' -> 'CUST046340'
2026-01-12 12:10:26,089 - dq_comparison - INFO - DEBUG HASH STRING: text with - dashes|TX00046340|2023-11-14|6|CUST046340...
2026-01-12 12:10:26,090 - dq_comparison - INFO - DEBUG HASH RESULT: a37f1402...
2026-01-12 12:10:26,091 - dq_comparison - INFO - DEBUG HASH ROW: description: 'Text with? questions' -> 'text with? questions' | transaction_id: 'TX00027800' -> 'TX00027800' | transaction_date: '31-10-2023' -> '2023-10-31' | quantity: '61' -> '61' | customer_id: 'CUST027800' -> 'CUST027800'
2026-01-12 12:10:26,091 - dq_comparison - INFO - DEBUG HASH STRING: text with? questions|TX00027800|2023-10-31|61|CUST027800...
2026-01-12 12:10:26,092 - dq_comparison - INFO - DEBUG HASH RESULT: a2179c10...
2026-01-12 12:10:26,093 - dq_comparison - INFO - DEBUG HASH ROW: description: 'Text with'apostrophes' -> 'text with'apostrophes' | transaction_id: 'TX00058529' -> 'TX00058529' | transaction_date: '21-03-2023' -> '2023-03-21' | quantity: '90' -> '90' | customer_id: 'CUST058529' -> 'CUST058529'
2026-01-12 12:10:26,093 - dq_comparison - INFO - DEBUG HASH STRING: text with'apostrophes|TX00058529|2023-03-21|90|CUST058529...
2026-01-12 12:10:26,094 - dq_comparison - INFO - DEBUG HASH RESULT: 3cb1aa15...
2026-01-12 12:10:26,095 - dq_comparison - INFO - DEBUG HASH ROW: description: 'Text with|pipes' -> 'text with|pipes' | transaction_id: 'TX00068749' -> 'TX00068749' | transaction_date: '09-12-2023' -> '2023-12-09' | quantity: '71' -> '71' | customer_id: 'CUST068749' -> 'CUST068749'
2026-01-12 12:10:26,095 - dq_comparison - INFO - DEBUG HASH STRING: text with|pipes|TX00068749|2023-12-09|71|CUST068749...
2026-01-12 12:10:26,096 - dq_comparison - INFO - DEBUG HASH RESULT: e617729b...
2026-01-12 12:10:26,097 - dq_comparison - INFO - DEBUG HASH ROW: description: 'Text with'apostrophes' -> 'text with'apostrophes' | transaction_id: 'TX00081440' -> 'TX00081440' | transaction_date: '25-05-2023' -> '2023-05-25' | quantity: '97' -> '97' | customer_id: 'CUST081440' -> 'CUST081440'
2026-01-12 12:10:26,098 - dq_comparison - INFO - DEBUG HASH STRING: text with'apostrophes|TX00081440|2023-05-25|97|CUST081440...
2026-01-12 12:10:26,098 - dq_comparison - INFO - DEBUG HASH RESULT: c72514e6...
2026-01-12 12:10:26,099 - dq_comparison - INFO - DEBUG HASH ROW: description: 'Text with%percent signs' -> 'text with%percent signs' | transaction_id: 'TX00064601' -> 'TX00064601' | transaction_date: '04/21/2023' -> '2023-04-21' | quantity: '16' -> '16' | customer_id: 'CUST064601' -> 'CUST064601'
2026-01-12 12:10:26,100 - dq_comparison - INFO - DEBUG HASH STRING: text with%percent signs|TX00064601|2023-04-21|16|CUST064601...
2026-01-12 12:10:26,100 - dq_comparison - INFO - DEBUG HASH RESULT: 1cbe86b4...
2026-01-12 12:10:26,101 - dq_comparison - INFO - DEBUG HASH ROW: description: 'Text with_underscores' -> 'text with_underscores' | transaction_id: 'TX00049528' -> 'TX00049528' | transaction_date: '29-01-2023' -> '2023-01-29' | quantity: '41' -> '41' | customer_id: 'CUST049528' -> 'CUST049528'
2026-01-12 12:10:26,102 - dq_comparison - INFO - DEBUG HASH STRING: text with_underscores|TX00049528|2023-01-29|41|CUST049528...
2026-01-12 12:10:26,102 - dq_comparison - INFO - DEBUG HASH RESULT: 7a9ab2d2...
2026-01-12 12:10:26,103 - dq_comparison - INFO - DEBUG HASH ROW: description: 'Text with%percent signs' -> 'text with%percent signs' | transaction_id: 'TX00095451' -> 'TX00095451' | transaction_date: '12-10-2023' -> '2023-10-12' | quantity: '98' -> '98' | customer_id: 'CUST095451' -> 'CUST095451'
2026-01-12 12:10:26,104 - dq_comparison - INFO - DEBUG HASH STRING: text with%percent signs|TX00095451|2023-10-12|98|CUST095451...
2026-01-12 12:10:26,105 - dq_comparison - INFO - DEBUG HASH RESULT: 9038d35e...
2026-01-12 12:10:26,106 - dq_comparison - INFO - DEBUG HASH ROW: description: 'Text with`backticks' -> 'text with`backticks' | transaction_id: 'TX00048198' -> 'TX00048198' | transaction_date: '03-07-2023' -> '2023-07-03' | quantity: '4' -> '4' | customer_id: 'CUST048198' -> 'CUST048198'
2026-01-12 12:10:26,106 - dq_comparison - INFO - DEBUG HASH STRING: text with`backticks|TX00048198|2023-07-03|4|CUST048198...
2026-01-12 12:10:26,107 - dq_comparison - INFO - DEBUG HASH RESULT: 887c5111...
2026-01-12 12:10:26,108 - dq_comparison - INFO - DEBUG HASH ROW: description: 'Text with`backticks' -> 'text with`backticks' | transaction_id: 'TX00020427' -> 'TX00020427' | transaction_date: '01-01-2024' -> '2024-01-01' | quantity: '8' -> '8' | customer_id: 'CUST020427' -> 'CUST020427'
2026-01-12 12:10:26,108 - dq_comparison - INFO - DEBUG HASH STRING: text with`backticks|TX00020427|2024-01-01|8|CUST020427...
2026-01-12 12:10:26,109 - dq_comparison - INFO - DEBUG HASH RESULT: edaaacd8...
2026-01-12 12:10:26,110 - dq_comparison - INFO - DEBUG HASH ROW: description: 'Normal text without issues' -> 'normal text without issues' | transaction_id: 'TX00065500' -> 'TX00065500' | transaction_date: '11-12-2023' -> '2023-12-11' | quantity: '12' -> '12' | customer_id: 'CUST065500' -> 'CUST065500'
2026-01-12 12:10:26,110 - dq_comparison - INFO - DEBUG HASH STRING: normal text without issues|TX00065500|2023-12-11|12|CUST065500...
2026-01-12 12:10:26,111 - dq_comparison - INFO - DEBUG HASH RESULT: 9440552d...
2026-01-12 12:10:26,112 - dq_comparison - INFO - DEBUG HASH ROW: description: 'Text with trailing spaces  ' -> 'text with trailing spaces' | transaction_id: 'TX00035086' -> 'TX00035086' | transaction_date: '06/15/2023' -> '2023-06-15' | quantity: '66' -> '66' | customer_id: 'CUST035086' -> 'CUST035086'
2026-01-12 12:10:26,112 - dq_comparison - INFO - DEBUG HASH STRING: text with trailing spaces|TX00035086|2023-06-15|66|CUST035086...
2026-01-12 12:10:26,113 - dq_comparison - INFO - DEBUG HASH RESULT: 382cc53a...
2026-01-12 12:10:26,114 - dq_comparison - INFO - DEBUG HASH ROW: description: 'Text with{braces}' -> 'text with{braces}' | transaction_id: 'TX00057880' -> 'TX00057880' | transaction_date: '01-02-2023' -> '2023-02-01' | quantity: '87' -> '87' | customer_id: 'CUST057880' -> 'CUST057880'
2026-01-12 12:10:26,114 - dq_comparison - INFO - DEBUG HASH STRING: text with{braces}|TX00057880|2023-02-01|87|CUST057880...
2026-01-12 12:10:26,115 - dq_comparison - INFO - DEBUG HASH RESULT: 33d622b1...
2026-01-12 12:10:26,116 - dq_comparison - INFO - DEBUG HASH ROW: description: 'Text with\backslashes' -> 'text with\backslashes' | transaction_id: 'TX00032781' -> 'TX00032781' | transaction_date: '06/16/2023' -> '2023-06-16' | quantity: '60' -> '60' | customer_id: 'CUST032781' -> 'CUST032781'
2026-01-12 12:10:26,116 - dq_comparison - INFO - DEBUG HASH STRING: text with\backslashes|TX00032781|2023-06-16|60|CUST032781...
2026-01-12 12:10:26,117 - dq_comparison - INFO - DEBUG HASH RESULT: 85659673...
2026-01-12 12:10:26,118 - dq_comparison - INFO - DEBUG HASH ROW: description: 'Text with	tabs' -> 'text with tabs' | transaction_id: 'TX00009908' -> 'TX00009908' | transaction_date: '07-11-2023' -> '2023-11-07' | quantity: '95' -> '95' | customer_id: 'CUST009908' -> 'CUST009908'
2026-01-12 12:10:26,118 - dq_comparison - INFO - DEBUG HASH STRING: text with tabs|TX00009908|2023-11-07|95|CUST009908...
2026-01-12 12:10:26,120 - dq_comparison - INFO - DEBUG HASH RESULT: b133b2db...
2026-01-12 12:10:26,121 - dq_comparison - INFO - DEBUG HASH ROW: description: 'Text with
newlines' -> 'text with newlines' | transaction_id: 'TX00048416' -> 'TX00048416' | transaction_date: '03/29/2023' -> '2023-03-29' | quantity: '63' -> '63' | customer_id: 'CUST048416' -> 'CUST048416'
2026-01-12 12:10:26,122 - dq_comparison - INFO - DEBUG HASH STRING: text with newlines|TX00048416|2023-03-29|63|CUST048416...
2026-01-12 12:10:26,122 - dq_comparison - INFO - DEBUG HASH RESULT: 4d9dc267...
2026-01-12 12:10:26,123 - dq_comparison - INFO - DEBUG HASH ROW: description: 'Text with{braces}' -> 'text with{braces}' | transaction_id: 'TX00000367' -> 'TX00000367' | transaction_date: '29-07-2023' -> '2023-07-29' | quantity: '40' -> '40' | customer_id: 'CUST000367' -> 'CUST000367'
2026-01-12 12:10:26,124 - dq_comparison - INFO - DEBUG HASH STRING: text with{braces}|TX00000367|2023-07-29|40|CUST000367...
2026-01-12 12:10:26,124 - dq_comparison - INFO - DEBUG HASH RESULT: 8a669a25...
2026-01-12 12:10:26,126 - dq_comparison - INFO - DEBUG HASH ROW: description: 'Text with\backslashes' -> 'text with\backslashes' | transaction_id: 'TX00056960' -> 'TX00056960' | transaction_date: '12-06-2023' -> '2023-06-12' | quantity: '22' -> '22' | customer_id: 'CUST056960' -> 'CUST056960'
2026-01-12 12:10:26,126 - dq_comparison - INFO - DEBUG HASH STRING: text with\backslashes|TX00056960|2023-06-12|22|CUST056960...
2026-01-12 12:10:26,127 - dq_comparison - INFO - DEBUG HASH RESULT: f62f006e...
2026-01-12 12:10:26,127 - dq_comparison - INFO - DEBUG HASH ROW: description: 'Text with*asterisks' -> 'text with*asterisks' | transaction_id: 'TX00018911' -> 'TX00018911' | transaction_date: '07/27/2023' -> '2023-07-27' | quantity: '41' -> '41' | customer_id: 'CUST018911' -> 'CUST018911'
2026-01-12 12:10:26,128 - dq_comparison - INFO - DEBUG HASH STRING: text with*asterisks|TX00018911|2023-07-27|41|CUST018911...
2026-01-12 12:10:26,128 - dq_comparison - INFO - DEBUG HASH RESULT: 74611501...
2026-01-12 12:10:26,129 - dq_comparison - INFO - DEBUG HASH ROW: description: 'Text with, commas' -> 'text with, commas' | transaction_id: 'TX00067903' -> 'TX00067903' | transaction_date: '05-07-2023' -> '2023-07-05' | quantity: '61' -> '61' | customer_id: 'CUST067903' -> 'CUST067903'
2026-01-12 12:10:26,130 - dq_comparison - INFO - DEBUG HASH STRING: text with, commas|TX00067903|2023-07-05|61|CUST067903...
2026-01-12 12:10:26,130 - dq_comparison - INFO - DEBUG HASH RESULT: ad8f2282...
2026-01-12 12:10:26,132 - dq_comparison - INFO - DEBUG HASH ROW: description: 'Text with. periods' -> 'text with. periods' | transaction_id: 'TX00008670' -> 'TX00008670' | transaction_date: '14-12-2023' -> '2023-12-14' | quantity: '72' -> '72' | customer_id: 'CUST008670' -> 'CUST008670'
2026-01-12 12:10:26,132 - dq_comparison - INFO - DEBUG HASH STRING: text with. periods|TX00008670|2023-12-14|72|CUST008670...
2026-01-12 12:10:26,133 - dq_comparison - INFO - DEBUG HASH RESULT: b5c4403a...
2026-01-12 12:10:26,134 - dq_comparison - INFO - DEBUG HASH ROW: description: 'Text with  multiple   spaces' -> 'text with multiple spaces' | transaction_id: 'TX00052358' -> 'TX00052358' | transaction_date: '30-08-2023' -> '2023-08-30' | quantity: '57' -> '57' | customer_id: 'CUST052358' -> 'CUST052358'
2026-01-12 12:10:26,134 - dq_comparison - INFO - DEBUG HASH STRING: text with multiple spaces|TX00052358|2023-08-30|57|CUST052358...
2026-01-12 12:10:26,134 - dq_comparison - INFO - DEBUG HASH RESULT: 3d670b21...
2026-01-12 12:10:26,135 - dq_comparison - INFO - DEBUG HASH ROW: description: 'Text with mixed CAPITAL and lowercase' -> 'text with mixed capital and lowercase' | transaction_id: 'TX00051043' -> 'TX00051043' | transaction_date: '09-02-2023' -> '2023-02-09' | quantity: '77' -> '77' | customer_id: 'CUST051043' -> 'CUST051043'
2026-01-12 12:10:26,135 - dq_comparison - INFO - DEBUG HASH STRING: text with mixed capital and lowercase|TX00051043|2023-02-09|77|CUST051043...
2026-01-12 12:10:26,136 - dq_comparison - INFO - DEBUG HASH RESULT: 55ca1d3b...
2026-01-12 12:10:26,137 - dq_comparison - INFO - DEBUG HASH ROW: description: 'Text with
newlines' -> 'text with newlines' | transaction_id: 'TX00070740' -> 'TX00070740' | transaction_date: '02-02-2023' -> '2023-02-02' | quantity: '100' -> '100' | customer_id: 'CUST070740' -> 'CUST070740'
2026-01-12 12:10:26,138 - dq_comparison - INFO - DEBUG HASH STRING: text with newlines|TX00070740|2023-02-02|100|CUST070740...
2026-01-12 12:10:26,138 - dq_comparison - INFO - DEBUG HASH RESULT: 38494a29...
2026-01-12 12:10:26,139 - dq_comparison - INFO - DEBUG HASH ROW: description: 'Text with trailing spaces  ' -> 'text with trailing spaces' | transaction_id: 'TX00063784' -> 'TX00063784' | transaction_date: '09-03-2023' -> '2023-03-09' | quantity: '4' -> '4' | customer_id: 'CUST063784' -> 'CUST063784'
2026-01-12 12:10:26,140 - dq_comparison - INFO - DEBUG HASH STRING: text with trailing spaces|TX00063784|2023-03-09|4|CUST063784...
2026-01-12 12:10:26,140 - dq_comparison - INFO - DEBUG HASH RESULT: 5156046d...
2026-01-12 12:10:26,141 - dq_comparison - INFO - DEBUG HASH ROW: description: 'Text with, commas' -> 'text with, commas' | transaction_id: 'TX00064176' -> 'TX00064176' | transaction_date: '09/16/2023' -> '2023-09-16' | quantity: '7' -> '7' | customer_id: 'CUST064176' -> 'CUST064176'
2026-01-12 12:10:26,142 - dq_comparison - INFO - DEBUG HASH STRING: text with, commas|TX00064176|2023-09-16|7|CUST064176...
2026-01-12 12:10:26,143 - dq_comparison - INFO - DEBUG HASH RESULT: cd0aa36e...
2026-01-12 12:10:26,144 - dq_comparison - INFO - DEBUG HASH ROW: description: 'Text with|pipes' -> 'text with|pipes' | transaction_id: 'TX00062073' -> 'TX00062073' | transaction_date: '01-09-2023' -> '2023-09-01' | quantity: '15' -> '15' | customer_id: 'CUST062073' -> 'CUST062073'
2026-01-12 12:10:26,144 - dq_comparison - INFO - DEBUG HASH STRING: text with|pipes|TX00062073|2023-09-01|15|CUST062073...
2026-01-12 12:10:26,144 - dq_comparison - INFO - DEBUG HASH RESULT: c6c18063...
2026-01-12 12:10:26,145 - dq_comparison - INFO - DEBUG HASH ROW: description: 'Text with<angle brackets>' -> 'text with<angle brackets>' | transaction_id: 'TX00038735' -> 'TX00038735' | transaction_date: '29-10-2023' -> '2023-10-29' | quantity: '12' -> '12' | customer_id: 'CUST038735' -> 'CUST038735'
2026-01-12 12:10:26,146 - dq_comparison - INFO - DEBUG HASH STRING: text with<angle brackets>|TX00038735|2023-10-29|12|CUST038735...
2026-01-12 12:10:26,146 - dq_comparison - INFO - DEBUG HASH RESULT: 885a3584...
2026-01-12 12:10:26,147 - dq_comparison - INFO - DEBUG HASH ROW: description: 'Text with[brackets]' -> 'text with[brackets]' | transaction_id: 'TX00092001' -> 'TX00092001' | transaction_date: '06/25/2023' -> '2023-06-25' | quantity: '6' -> '6' | customer_id: 'CUST092001' -> 'CUST092001'
2026-01-12 12:10:26,148 - dq_comparison - INFO - DEBUG HASH STRING: text with[brackets]|TX00092001|2023-06-25|6|CUST092001...
2026-01-12 12:10:26,149 - dq_comparison - INFO - DEBUG HASH RESULT: ea2e6df3...
2026-01-12 12:10:26,150 - dq_comparison - INFO - DEBUG HASH ROW: description: 'Text with, commas' -> 'text with, commas' | transaction_id: 'TX00095729' -> 'TX00095729' | transaction_date: '01-05-2023' -> '2023-05-01' | quantity: '16' -> '16' | customer_id: 'CUST095729' -> 'CUST095729'
2026-01-12 12:10:26,150 - dq_comparison - INFO - DEBUG HASH STRING: text with, commas|TX00095729|2023-05-01|16|CUST095729...
2026-01-12 12:10:26,151 - dq_comparison - INFO - DEBUG HASH RESULT: 48bcac00...
2026-01-12 12:10:26,152 - dq_comparison - INFO - DEBUG HASH ROW: description: 'Text with\backslashes' -> 'text with\backslashes' | transaction_id: 'TX00070632' -> 'TX00070632' | transaction_date: '16-10-2023' -> '2023-10-16' | quantity: '37' -> '37' | customer_id: 'CUST070632' -> 'CUST070632'
2026-01-12 12:10:26,152 - dq_comparison - INFO - DEBUG HASH STRING: text with\backslashes|TX00070632|2023-10-16|37|CUST070632...
2026-01-12 12:10:26,153 - dq_comparison - INFO - DEBUG HASH RESULT: 4a764b85...
2026-01-12 12:10:26,154 - dq_comparison - INFO - DEBUG HASH ROW: description: 'Text with<angle brackets>' -> 'text with<angle brackets>' | transaction_id: 'TX00083609' -> 'TX00083609' | transaction_date: '12-11-2023' -> '2023-11-12' | quantity: '59' -> '59' | customer_id: 'CUST083609' -> 'CUST083609'
2026-01-12 12:10:26,154 - dq_comparison - INFO - DEBUG HASH STRING: text with<angle brackets>|TX00083609|2023-11-12|59|CUST083609...
2026-01-12 12:10:26,155 - dq_comparison - INFO - DEBUG HASH RESULT: b5a39a25...
2026-01-12 12:10:26,156 - dq_comparison - INFO - DEBUG HASH ROW: description: 'Text with$dollar signs' -> 'text with$dollar signs' | transaction_id: 'TX00079245' -> 'TX00079245' | transaction_date: '12-03-2023' -> '2023-03-12' | quantity: '11' -> '11' | customer_id: 'CUST079245' -> 'CUST079245'
2026-01-12 12:10:26,157 - dq_comparison - INFO - DEBUG HASH STRING: text with$dollar signs|TX00079245|2023-03-12|11|CUST079245...
2026-01-12 12:10:26,157 - dq_comparison - INFO - DEBUG HASH RESULT: fd9095ab...
2026-01-12 12:10:26,158 - dq_comparison - INFO - DEBUG HASH ROW: description: 'Text with. periods' -> 'text with. periods' | transaction_id: 'TX00023058' -> 'TX00023058' | transaction_date: '31-07-2023' -> '2023-07-31' | quantity: '93' -> '93' | customer_id: 'CUST023058' -> 'CUST023058'
2026-01-12 12:10:26,159 - dq_comparison - INFO - DEBUG HASH STRING: text with. periods|TX00023058|2023-07-31|93|CUST023058...
2026-01-12 12:10:26,160 - dq_comparison - INFO - DEBUG HASH RESULT: 59250b59...
2026-01-12 12:10:26,161 - dq_comparison - INFO - DEBUG HASH ROW: description: 'Text with, commas' -> 'text with, commas' | transaction_id: 'TX00061249' -> 'TX00061249' | transaction_date: '10-11-2023' -> '2023-11-10' | quantity: '1' -> '1' | customer_id: 'CUST061249' -> 'CUST061249'
2026-01-12 12:10:26,161 - dq_comparison - INFO - DEBUG HASH STRING: text with, commas|TX00061249|2023-11-10|1|CUST061249...
2026-01-12 12:10:26,162 - dq_comparison - INFO - DEBUG HASH RESULT: db2f94f3...
2026-01-12 12:10:26,163 - dq_comparison - INFO - DEBUG HASH ROW: description: 'Text with"quotes"' -> 'text with"quotes"' | transaction_id: 'TX00020999' -> 'TX00020999' | transaction_date: '25-03-2023' -> '2023-03-25' | quantity: '77' -> '77' | customer_id: 'CUST020999' -> 'CUST020999'
2026-01-12 12:10:26,163 - dq_comparison - INFO - DEBUG HASH STRING: text with"quotes"|TX00020999|2023-03-25|77|CUST020999...
2026-01-12 12:10:26,164 - dq_comparison - INFO - DEBUG HASH RESULT: 59dd5e07...
2026-01-12 12:10:26,165 - dq_comparison - INFO - DEBUG HASH ROW: description: 'Text with~tildes' -> 'text with~tildes' | transaction_id: 'TX00077662' -> 'TX00077662' | transaction_date: '09-03-2023' -> '2023-03-09' | quantity: '85' -> '85' | customer_id: 'CUST077662' -> 'CUST077662'
2026-01-12 12:10:26,166 - dq_comparison - INFO - DEBUG HASH STRING: text with~tildes|TX00077662|2023-03-09|85|CUST077662...
2026-01-12 12:10:26,166 - dq_comparison - INFO - DEBUG HASH RESULT: e24feaab...
2026-01-12 12:10:26,167 - dq_comparison - INFO - DEBUG HASH ROW: description: '  Text with leading spaces' -> 'text with leading spaces' | transaction_id: 'TX00045898' -> 'TX00045898' | transaction_date: '13-03-2023' -> '2023-03-13' | quantity: '10' -> '10' | customer_id: 'CUST045898' -> 'CUST045898'
2026-01-12 12:10:26,168 - dq_comparison - INFO - DEBUG HASH STRING: text with leading spaces|TX00045898|2023-03-13|10|CUST045898...
2026-01-12 12:10:26,168 - dq_comparison - INFO - DEBUG HASH RESULT: afdcaa3f...
2026-01-12 12:10:26,170 - dq_comparison - INFO - DEBUG HASH ROW: description: 'Text with%percent signs' -> 'text with%percent signs' | transaction_id: 'TX00023534' -> 'TX00023534' | transaction_date: '02-02-2023' -> '2023-02-02' | quantity: '84' -> '84' | customer_id: 'CUST023534' -> 'CUST023534'
2026-01-12 12:10:26,170 - dq_comparison - INFO - DEBUG HASH STRING: text with%percent signs|TX00023534|2023-02-02|84|CUST023534...
2026-01-12 12:10:26,171 - dq_comparison - INFO - DEBUG HASH RESULT: 108f79a0...
2026-01-12 12:10:26,172 - dq_comparison - INFO - DEBUG HASH ROW: description: 'Text with  multiple   spaces' -> 'text with multiple spaces' | transaction_id: 'TX00093408' -> 'TX00093408' | transaction_date: '04-06-2023' -> '2023-06-04' | quantity: '17' -> '17' | customer_id: 'CUST093408' -> 'CUST093408'
2026-01-12 12:10:26,172 - dq_comparison - INFO - DEBUG HASH STRING: text with multiple spaces|TX00093408|2023-06-04|17|CUST093408...
2026-01-12 12:10:26,173 - dq_comparison - INFO - DEBUG HASH RESULT: 288332b5...
2026-01-12 12:10:26,174 - dq_comparison - INFO - DEBUG HASH ROW: description: 'Text with~tildes' -> 'text with~tildes' | transaction_id: 'TX00002666' -> 'TX00002666' | transaction_date: '08/20/2023' -> '2023-08-20' | quantity: '32' -> '32' | customer_id: 'CUST002666' -> 'CUST002666'
2026-01-12 12:10:26,174 - dq_comparison - INFO - DEBUG HASH STRING: text with~tildes|TX00002666|2023-08-20|32|CUST002666...
2026-01-12 12:10:26,175 - dq_comparison - INFO - DEBUG HASH RESULT: 93674f7b...
2026-01-12 12:10:26,176 - dq_comparison - INFO - DEBUG HASH ROW: description: 'Text with#hashtags' -> 'text with#hashtags' | transaction_id: 'TX00062462' -> 'TX00062462' | transaction_date: '11-05-2023' -> '2023-05-11' | quantity: '2' -> '2' | customer_id: 'CUST062462' -> 'CUST062462'
2026-01-12 12:10:26,177 - dq_comparison - INFO - DEBUG HASH STRING: text with#hashtags|TX00062462|2023-05-11|2|CUST062462...
2026-01-12 12:10:26,177 - dq_comparison - INFO - DEBUG HASH RESULT: 80cb9692...
2026-01-12 12:10:26,178 - dq_comparison - INFO - DEBUG HASH ROW: description: 'Text with, commas' -> 'text with, commas' | transaction_id: 'TX00006034' -> 'TX00006034' | transaction_date: '20-01-2023' -> '2023-01-20' | quantity: '79' -> '79' | customer_id: 'CUST006034' -> 'CUST006034'
2026-01-12 12:10:26,179 - dq_comparison - INFO - DEBUG HASH STRING: text with, commas|TX00006034|2023-01-20|79|CUST006034...
2026-01-12 12:10:26,180 - dq_comparison - INFO - DEBUG HASH RESULT: 191657d2...
2026-01-12 12:10:26,181 - dq_comparison - INFO - DEBUG HASH ROW: description: 'Text with#hashtags' -> 'text with#hashtags' | transaction_id: 'TX00016926' -> 'TX00016926' | transaction_date: '05/31/2023' -> '2023-05-31' | quantity: '47' -> '47' | customer_id: 'CUST016926' -> 'CUST016926'
2026-01-12 12:10:26,181 - dq_comparison - INFO - DEBUG HASH STRING: text with#hashtags|TX00016926|2023-05-31|47|CUST016926...
2026-01-12 12:10:26,182 - dq_comparison - INFO - DEBUG HASH RESULT: 92efa73f...
2026-01-12 12:10:26,183 - dq_comparison - INFO - DEBUG HASH ROW: description: 'Text with*asterisks' -> 'text with*asterisks' | transaction_id: 'TX00063546' -> 'TX00063546' | transaction_date: '12-09-2023' -> '2023-09-12' | quantity: '56' -> '56' | customer_id: 'CUST063546' -> 'CUST063546'
2026-01-12 12:10:26,184 - dq_comparison - INFO - DEBUG HASH STRING: text with*asterisks|TX00063546|2023-09-12|56|CUST063546...
2026-01-12 12:10:26,184 - dq_comparison - INFO - DEBUG HASH RESULT: ac08e700...
2026-01-12 12:10:26,185 - dq_comparison - INFO - DEBUG HASH ROW: description: 'Text with$dollar signs' -> 'text with$dollar signs' | transaction_id: 'TX00053975' -> 'TX00053975' | transaction_date: '20-06-2023' -> '2023-06-20' | quantity: '6' -> '6' | customer_id: 'CUST053975' -> 'CUST053975'
2026-01-12 12:10:26,185 - dq_comparison - INFO - DEBUG HASH STRING: text with$dollar signs|TX00053975|2023-06-20|6|CUST053975...
2026-01-12 12:10:26,186 - dq_comparison - INFO - DEBUG HASH RESULT: c705a7d7...
2026-01-12 12:10:26,187 - dq_comparison - INFO - DEBUG HASH ROW: description: 'Text with
newlines' -> 'text with newlines' | transaction_id: 'TX00024231' -> 'TX00024231' | transaction_date: '08/18/2023' -> '2023-08-18' | quantity: '24' -> '24' | customer_id: 'CUST024231' -> 'CUST024231'
2026-01-12 12:10:26,188 - dq_comparison - INFO - DEBUG HASH STRING: text with newlines|TX00024231|2023-08-18|24|CUST024231...
2026-01-12 12:10:26,188 - dq_comparison - INFO - DEBUG HASH RESULT: 48e7577c...
2026-01-12 12:10:26,189 - dq_comparison - INFO - DEBUG HASH ROW: description: 'Text with|pipes' -> 'text with|pipes' | transaction_id: 'TX00031254' -> 'TX00031254' | transaction_date: '16-04-2023' -> '2023-04-16' | quantity: '94' -> '94' | customer_id: 'CUST031254' -> 'CUST031254'
2026-01-12 12:10:26,190 - dq_comparison - INFO - DEBUG HASH STRING: text with|pipes|TX00031254|2023-04-16|94|CUST031254...
2026-01-12 12:10:26,190 - dq_comparison - INFO - DEBUG HASH RESULT: 1545d5a8...
2026-01-12 12:10:26,191 - dq_comparison - INFO - DEBUG HASH ROW: description: 'Text with'apostrophes' -> 'text with'apostrophes' | transaction_id: 'TX00030695' -> 'TX00030695' | transaction_date: '03-06-2023' -> '2023-06-03' | quantity: '90' -> '90' | customer_id: 'CUST030695' -> 'CUST030695'
2026-01-12 12:10:26,192 - dq_comparison - INFO - DEBUG HASH STRING: text with'apostrophes|TX00030695|2023-06-03|90|CUST030695...
2026-01-12 12:10:26,193 - dq_comparison - INFO - DEBUG HASH RESULT: a39ad288...
2026-01-12 12:10:26,194 - dq_comparison - INFO - DEBUG HASH ROW: description: 'Text with
newlines' -> 'text with newlines' | transaction_id: 'TX00049607' -> 'TX00049607' | transaction_date: '13-07-2023' -> '2023-07-13' | quantity: '31' -> '31' | customer_id: 'CUST049607' -> 'CUST049607'
2026-01-12 12:10:26,194 - dq_comparison - INFO - DEBUG HASH STRING: text with newlines|TX00049607|2023-07-13|31|CUST049607...
2026-01-12 12:10:26,195 - dq_comparison - INFO - DEBUG HASH RESULT: 5f37c735...
2026-01-12 12:10:26,196 - dq_comparison - INFO - DEBUG HASH ROW: description: 'Text with, commas' -> 'text with, commas' | transaction_id: 'TX00075752' -> 'TX00075752' | transaction_date: '16-04-2023' -> '2023-04-16' | quantity: '1' -> '1' | customer_id: 'CUST075752' -> 'CUST075752'
2026-01-12 12:10:26,197 - dq_comparison - INFO - DEBUG HASH STRING: text with, commas|TX00075752|2023-04-16|1|CUST075752...
2026-01-12 12:10:26,198 - dq_comparison - INFO - DEBUG HASH RESULT: 382f06e3...
2026-01-12 12:10:26,199 - dq_comparison - INFO - DEBUG HASH ROW: description: 'Text with{braces}' -> 'text with{braces}' | transaction_id: 'TX00039727' -> 'TX00039727' | transaction_date: '26-02-2023' -> '2023-02-26' | quantity: '1' -> '1' | customer_id: 'CUST039727' -> 'CUST039727'
2026-01-12 12:10:26,199 - dq_comparison - INFO - DEBUG HASH STRING: text with{braces}|TX00039727|2023-02-26|1|CUST039727...
2026-01-12 12:10:26,200 - dq_comparison - INFO - DEBUG HASH RESULT: 5b5dc31a...
2026-01-12 12:10:26,201 - dq_comparison - INFO - DEBUG HASH ROW: description: 'Text with"quotes"' -> 'text with"quotes"' | transaction_id: 'TX00065701' -> 'TX00065701' | transaction_date: '09/27/2023' -> '2023-09-27' | quantity: '96' -> '96' | customer_id: 'CUST065701' -> 'CUST065701'
2026-01-12 12:10:26,201 - dq_comparison - INFO - DEBUG HASH STRING: text with"quotes"|TX00065701|2023-09-27|96|CUST065701...
2026-01-12 12:10:26,202 - dq_comparison - INFO - DEBUG HASH RESULT: a05a1458...
2026-01-12 12:10:26,203 - dq_comparison - INFO - DEBUG HASH ROW: description: 'Text with|pipes' -> 'text with|pipes' | transaction_id: 'TX00061197' -> 'TX00061197' | transaction_date: '06-07-2023' -> '2023-07-06' | quantity: '40' -> '40' | customer_id: 'CUST061197' -> 'CUST061197'
2026-01-12 12:10:26,204 - dq_comparison - INFO - DEBUG HASH STRING: text with|pipes|TX00061197|2023-07-06|40|CUST061197...
2026-01-12 12:10:26,204 - dq_comparison - INFO - DEBUG HASH RESULT: b2acd1fb...
2026-01-12 12:10:26,205 - dq_comparison - INFO - DEBUG HASH ROW: description: 'Text with? questions' -> 'text with? questions' | transaction_id: 'TX00055893' -> 'TX00055893' | transaction_date: '17-02-2023' -> '2023-02-17' | quantity: '10' -> '10' | customer_id: 'CUST055893' -> 'CUST055893'
2026-01-12 12:10:26,206 - dq_comparison - INFO - DEBUG HASH STRING: text with? questions|TX00055893|2023-02-17|10|CUST055893...
2026-01-12 12:10:26,206 - dq_comparison - INFO - DEBUG HASH RESULT: 4bb64ff1...
2026-01-12 12:10:26,207 - dq_comparison - INFO - DEBUG HASH ROW: description: 'Text with_underscores' -> 'text with_underscores' | transaction_id: 'TX00097021' -> 'TX00097021' | transaction_date: '02-01-2023' -> '2023-01-02' | quantity: '76' -> '76' | customer_id: 'CUST097021' -> 'CUST097021'
2026-01-12 12:10:26,208 - dq_comparison - INFO - DEBUG HASH STRING: text with_underscores|TX00097021|2023-01-02|76|CUST097021...
2026-01-12 12:10:26,208 - dq_comparison - INFO - DEBUG HASH RESULT: b2a5d545...
2026-01-12 12:10:26,209 - dq_comparison - INFO - DEBUG HASH ROW: description: 'Text with<angle brackets>' -> 'text with<angle brackets>' | transaction_id: 'TX00008304' -> 'TX00008304' | transaction_date: '14-05-2023' -> '2023-05-14' | quantity: '78' -> '78' | customer_id: 'CUST008304' -> 'CUST008304'
2026-01-12 12:10:26,209 - dq_comparison - INFO - DEBUG HASH STRING: text with<angle brackets>|TX00008304|2023-05-14|78|CUST008304...
2026-01-12 12:10:26,210 - dq_comparison - INFO - DEBUG HASH RESULT: ca02c7ce...
2026-01-12 12:10:26,211 - dq_comparison - INFO - DEBUG HASH ROW: description: 'Text with[brackets]' -> 'text with[brackets]' | transaction_id: 'TX00046628' -> 'TX00046628' | transaction_date: '04-11-2023' -> '2023-11-04' | quantity: '71' -> '71' | customer_id: 'CUST046628' -> 'CUST046628'
2026-01-12 12:10:26,211 - dq_comparison - INFO - DEBUG HASH STRING: text with[brackets]|TX00046628|2023-11-04|71|CUST046628...
2026-01-12 12:10:26,212 - dq_comparison - INFO - DEBUG HASH RESULT: f411c5e9...
2026-01-12 12:10:26,213 - dq_comparison - INFO - DEBUG HASH ROW: description: 'Text with, commas' -> 'text with, commas' | transaction_id: 'TX00064166' -> 'TX00064166' | transaction_date: '03/28/2023' -> '2023-03-28' | quantity: '65' -> '65' | customer_id: 'CUST064166' -> 'CUST064166'
2026-01-12 12:10:26,213 - dq_comparison - INFO - DEBUG HASH STRING: text with, commas|TX00064166|2023-03-28|65|CUST064166...
2026-01-12 12:10:26,214 - dq_comparison - INFO - DEBUG HASH RESULT: 082c7fa5...
2026-01-12 12:10:26,215 - dq_comparison - INFO - DEBUG HASH ROW: description: 'Text with
newlines' -> 'text with newlines' | transaction_id: 'TX00085198' -> 'TX00085198' | transaction_date: '11-02-2023' -> '2023-02-11' | quantity: '76' -> '76' | customer_id: 'CUST085198' -> 'CUST085198'
2026-01-12 12:10:26,216 - dq_comparison - INFO - DEBUG HASH STRING: text with newlines|TX00085198|2023-02-11|76|CUST085198...
2026-01-12 12:10:26,216 - dq_comparison - INFO - DEBUG HASH RESULT: 12baac18...
2026-01-12 12:10:26,217 - dq_comparison - INFO - DEBUG HASH ROW: description: 'Text with*asterisks' -> 'text with*asterisks' | transaction_id: 'TX00090489' -> 'TX00090489' | transaction_date: '21-05-2023' -> '2023-05-21' | quantity: '32' -> '32' | customer_id: 'CUST090489' -> 'CUST090489'
2026-01-12 12:10:26,217 - dq_comparison - INFO - DEBUG HASH STRING: text with*asterisks|TX00090489|2023-05-21|32|CUST090489...
2026-01-12 12:10:26,218 - dq_comparison - INFO - DEBUG HASH RESULT: 2f17ee21...
2026-01-12 12:10:26,219 - dq_comparison - INFO - DEBUG HASH ROW: description: 'Text with{braces}' -> 'text with{braces}' | transaction_id: 'TX00067389' -> 'TX00067389' | transaction_date: '17-02-2023' -> '2023-02-17' | quantity: '36' -> '36' | customer_id: 'CUST067389' -> 'CUST067389'
2026-01-12 12:10:26,219 - dq_comparison - INFO - DEBUG HASH STRING: text with{braces}|TX00067389|2023-02-17|36|CUST067389...
2026-01-12 12:10:26,220 - dq_comparison - INFO - DEBUG HASH RESULT: 35da4027...
2026-01-12 12:10:26,221 - dq_comparison - INFO - DEBUG HASH ROW: description: 'Text with<angle brackets>' -> 'text with<angle brackets>' | transaction_id: 'TX00057444' -> 'TX00057444' | transaction_date: '31-12-2023' -> '2023-12-31' | quantity: '90' -> '90' | customer_id: 'CUST057444' -> 'CUST057444'
2026-01-12 12:10:26,221 - dq_comparison - INFO - DEBUG HASH STRING: text with<angle brackets>|TX00057444|2023-12-31|90|CUST057444...
2026-01-12 12:10:26,222 - dq_comparison - INFO - DEBUG HASH RESULT: d78255bf...
2026-01-12 12:10:26,223 - dq_comparison - INFO - DEBUG HASH ROW: description: 'Text with@at signs' -> 'text with@at signs' | transaction_id: 'TX00094237' -> 'TX00094237' | transaction_date: '10-01-2023' -> '2023-01-10' | quantity: '21' -> '21' | customer_id: 'CUST094237' -> 'CUST094237'
2026-01-12 12:10:26,224 - dq_comparison - INFO - DEBUG HASH STRING: text with@at signs|TX00094237|2023-01-10|21|CUST094237...
2026-01-12 12:10:26,225 - dq_comparison - INFO - DEBUG HASH RESULT: abcd27e1...
2026-01-12 12:10:26,226 - dq_comparison - INFO - DEBUG HASH ROW: description: 'Text with! exclamations' -> 'text with! exclamations' | transaction_id: 'TX00097890' -> 'TX00097890' | transaction_date: '05/19/2023' -> '2023-05-19' | quantity: '99' -> '99' | customer_id: 'CUST097890' -> 'CUST097890'
2026-01-12 12:10:26,226 - dq_comparison - INFO - DEBUG HASH STRING: text with! exclamations|TX00097890|2023-05-19|99|CUST097890...
2026-01-12 12:10:26,226 - dq_comparison - INFO - DEBUG HASH RESULT: 783bc584...
2026-01-12 12:10:26,228 - dq_comparison - INFO - DEBUG HASH ROW: description: 'Text with(parentheses)' -> 'text with(parentheses)' | transaction_id: 'TX00016121' -> 'TX00016121' | transaction_date: '12-01-2023' -> '2023-01-12' | quantity: '26' -> '26' | customer_id: 'CUST016121' -> 'CUST016121'
2026-01-12 12:10:26,229 - dq_comparison - INFO - DEBUG HASH STRING: text with(parentheses)|TX00016121|2023-01-12|26|CUST016121...
2026-01-12 12:10:26,229 - dq_comparison - INFO - DEBUG HASH RESULT: 04b9e868...
2026-01-12 12:10:26,230 - dq_comparison - INFO - DEBUG HASH ROW: description: 'Text with& ampersands' -> 'text with& ampersands' | transaction_id: 'TX00010664' -> 'TX00010664' | transaction_date: '15-06-2023' -> '2023-06-15' | quantity: '41' -> '41' | customer_id: 'CUST010664' -> 'CUST010664'
2026-01-12 12:10:26,230 - dq_comparison - INFO - DEBUG HASH STRING: text with& ampersands|TX00010664|2023-06-15|41|CUST010664...
2026-01-12 12:10:26,231 - dq_comparison - INFO - DEBUG HASH RESULT: c5568fd5...
2026-01-12 12:10:26,232 - dq_comparison - INFO - DEBUG HASH ROW: description: 'Text with& ampersands' -> 'text with& ampersands' | transaction_id: 'TX00043725' -> 'TX00043725' | transaction_date: '04-04-2023' -> '2023-04-04' | quantity: '16' -> '16' | customer_id: 'CUST043725' -> 'CUST043725'
2026-01-12 12:10:26,232 - dq_comparison - INFO - DEBUG HASH STRING: text with& ampersands|TX00043725|2023-04-04|16|CUST043725...
2026-01-12 12:10:26,233 - dq_comparison - INFO - DEBUG HASH RESULT: ac191317...
2026-01-12 12:10:26,234 - dq_comparison - INFO - DEBUG HASH ROW: description: 'Text with[brackets]' -> 'text with[brackets]' | transaction_id: 'TX00058178' -> 'TX00058178' | transaction_date: '22-09-2023' -> '2023-09-22' | quantity: '87' -> '87' | customer_id: 'CUST058178' -> 'CUST058178'
2026-01-12 12:10:26,234 - dq_comparison - INFO - DEBUG HASH STRING: text with[brackets]|TX00058178|2023-09-22|87|CUST058178...
2026-01-12 12:10:26,235 - dq_comparison - INFO - DEBUG HASH RESULT: 78d4bd66...
2026-01-12 12:10:26,236 - dq_comparison - INFO - DEBUG HASH ROW: description: 'Text with. periods' -> 'text with. periods' | transaction_id: 'TX00073399' -> 'TX00073399' | transaction_date: '06-12-2023' -> '2023-12-06' | quantity: '98' -> '98' | customer_id: 'CUST073399' -> 'CUST073399'
2026-01-12 12:10:26,236 - dq_comparison - INFO - DEBUG HASH STRING: text with. periods|TX00073399|2023-12-06|98|CUST073399...
2026-01-12 12:10:26,237 - dq_comparison - INFO - DEBUG HASH RESULT: 0114422b...
2026-01-12 12:10:26,238 - dq_comparison - INFO - DEBUG HASH ROW: description: 'Text with<angle brackets>' -> 'text with<angle brackets>' | transaction_id: 'TX00004788' -> 'TX00004788' | transaction_date: '04-08-2023' -> '2023-08-04' | quantity: '21' -> '21' | customer_id: 'CUST004788' -> 'CUST004788'
2026-01-12 12:10:26,238 - dq_comparison - INFO - DEBUG HASH STRING: text with<angle brackets>|TX00004788|2023-08-04|21|CUST004788...
2026-01-12 12:10:26,239 - dq_comparison - INFO - DEBUG HASH RESULT: 76f3eee7...
2026-01-12 12:10:26,240 - dq_comparison - INFO - DEBUG HASH ROW: description: 'Text with~tildes' -> 'text with~tildes' | transaction_id: 'TX00059052' -> 'TX00059052' | transaction_date: '08-03-2023' -> '2023-03-08' | quantity: '67' -> '67' | customer_id: 'CUST059052' -> 'CUST059052'
2026-01-12 12:10:26,240 - dq_comparison - INFO - DEBUG HASH STRING: text with~tildes|TX00059052|2023-03-08|67|CUST059052...
2026-01-12 12:10:26,241 - dq_comparison - INFO - DEBUG HASH RESULT: f0be4796...
2026-01-12 12:10:26,242 - dq_comparison - INFO - DEBUG HASH ROW: description: 'Text with@at signs' -> 'text with@at signs' | transaction_id: 'TX00082175' -> 'TX00082175' | transaction_date: '11-11-2023' -> '2023-11-11' | quantity: '10' -> '10' | customer_id: 'CUST082175' -> 'CUST082175'
2026-01-12 12:10:26,242 - dq_comparison - INFO - DEBUG HASH STRING: text with@at signs|TX00082175|2023-11-11|10|CUST082175...
2026-01-12 12:10:26,243 - dq_comparison - INFO - DEBUG HASH RESULT: 78f8b6f9...
2026-01-12 12:10:26,245 - dq_comparison - INFO - DEBUG HASH ROW: description: 'Text with'apostrophes' -> 'text with'apostrophes' | transaction_id: 'TX00026926' -> 'TX00026926' | transaction_date: '10-07-2023' -> '2023-07-10' | quantity: '28' -> '28' | customer_id: 'CUST026926' -> 'CUST026926'
2026-01-12 12:10:26,245 - dq_comparison - INFO - DEBUG HASH STRING: text with'apostrophes|TX00026926|2023-07-10|28|CUST026926...
2026-01-12 12:10:26,246 - dq_comparison - INFO - DEBUG HASH RESULT: d5626ecd...
2026-01-12 12:10:26,247 - dq_comparison - INFO - DEBUG HASH ROW: description: 'Text with`backticks' -> 'text with`backticks' | transaction_id: 'TX00086248' -> 'TX00086248' | transaction_date: '29-11-2023' -> '2023-11-29' | quantity: '35' -> '35' | customer_id: 'CUST086248' -> 'CUST086248'
2026-01-12 12:10:26,248 - dq_comparison - INFO - DEBUG HASH STRING: text with`backticks|TX00086248|2023-11-29|35|CUST086248...
2026-01-12 12:10:26,249 - dq_comparison - INFO - DEBUG HASH RESULT: f47519fa...
2026-01-12 12:10:26,250 - dq_comparison - INFO - DEBUG HASH ROW: description: 'Text with
newlines' -> 'text with newlines' | transaction_id: 'TX00004475' -> 'TX00004475' | transaction_date: '23-07-2023' -> '2023-07-23' | quantity: '45' -> '45' | customer_id: 'CUST004475' -> 'CUST004475'
2026-01-12 12:10:26,250 - dq_comparison - INFO - DEBUG HASH STRING: text with newlines|TX00004475|2023-07-23|45|CUST004475...
2026-01-12 12:10:26,251 - dq_comparison - INFO - DEBUG HASH RESULT: 69ced144...
2026-01-12 12:10:26,253 - dq_comparison - INFO - DEBUG HASH ROW: description: 'Text with, commas' -> 'text with, commas' | transaction_id: 'TX00008262' -> 'TX00008262' | transaction_date: '04-03-2023' -> '2023-03-04' | quantity: '57' -> '57' | customer_id: 'CUST008262' -> 'CUST008262'
2026-01-12 12:10:26,253 - dq_comparison - INFO - DEBUG HASH STRING: text with, commas|TX00008262|2023-03-04|57|CUST008262...
2026-01-12 12:10:26,254 - dq_comparison - INFO - DEBUG HASH RESULT: 0e151064...
2026-01-12 12:10:26,255 - dq_comparison - INFO - DEBUG HASH ROW: description: 'Text with trailing spaces  ' -> 'text with trailing spaces' | transaction_id: 'TX00076148' -> 'TX00076148' | transaction_date: '27-10-2023' -> '2023-10-27' | quantity: '41' -> '41' | customer_id: 'CUST076148' -> 'CUST076148'
2026-01-12 12:10:26,255 - dq_comparison - INFO - DEBUG HASH STRING: text with trailing spaces|TX00076148|2023-10-27|41|CUST076148...
2026-01-12 12:10:26,256 - dq_comparison - INFO - DEBUG HASH RESULT: 0642e1a3...
2026-01-12 12:10:26,257 - dq_comparison - INFO - DEBUG HASH ROW: description: 'Text with`backticks' -> 'text with`backticks' | transaction_id: 'TX00043492' -> 'TX00043492' | transaction_date: '25-09-2023' -> '2023-09-25' | quantity: '72' -> '72' | customer_id: 'CUST043492' -> 'CUST043492'
2026-01-12 12:10:26,258 - dq_comparison - INFO - DEBUG HASH STRING: text with`backticks|TX00043492|2023-09-25|72|CUST043492...
2026-01-12 12:10:26,259 - dq_comparison - INFO - DEBUG HASH RESULT: c0b3b59b...
2026-01-12 12:10:26,260 - dq_comparison - INFO - DEBUG HASH ROW: description: 'Text with~tildes' -> 'text with~tildes' | transaction_id: 'TX00012280' -> 'TX00012280' | transaction_date: '16-10-2023' -> '2023-10-16' | quantity: '45' -> '45' | customer_id: 'CUST012280' -> 'CUST012280'
2026-01-12 12:10:26,260 - dq_comparison - INFO - DEBUG HASH STRING: text with~tildes|TX00012280|2023-10-16|45|CUST012280...
2026-01-12 12:10:26,261 - dq_comparison - INFO - DEBUG HASH RESULT: 74ebbfcd...
2026-01-12 12:10:26,262 - dq_comparison - INFO - DEBUG HASH ROW: description: 'Normal text without issues' -> 'normal text without issues' | transaction_id: 'TX00078109' -> 'TX00078109' | transaction_date: '17-09-2023' -> '2023-09-17' | quantity: '53' -> '53' | customer_id: 'CUST078109' -> 'CUST078109'
2026-01-12 12:10:26,262 - dq_comparison - INFO - DEBUG HASH STRING: normal text without issues|TX00078109|2023-09-17|53|CUST078109...
2026-01-12 12:10:26,263 - dq_comparison - INFO - DEBUG HASH RESULT: 6a4b1c35...
2026-01-12 12:10:26,264 - dq_comparison - INFO - DEBUG HASH ROW: description: 'Text with$dollar signs' -> 'text with$dollar signs' | transaction_id: 'TX00061275' -> 'TX00061275' | transaction_date: '20-06-2023' -> '2023-06-20' | quantity: '81' -> '81' | customer_id: 'CUST061275' -> 'CUST061275'
2026-01-12 12:10:26,264 - dq_comparison - INFO - DEBUG HASH STRING: text with$dollar signs|TX00061275|2023-06-20|81|CUST061275...
2026-01-12 12:10:26,265 - dq_comparison - INFO - DEBUG HASH RESULT: cddf1508...
2026-01-12 12:10:26,266 - dq_comparison - INFO - DEBUG HASH ROW: description: 'Text with|pipes' -> 'text with|pipes' | transaction_id: 'TX00096887' -> 'TX00096887' | transaction_date: '09-08-2023' -> '2023-08-09' | quantity: '65' -> '65' | customer_id: 'CUST096887' -> 'CUST096887'
2026-01-12 12:10:26,266 - dq_comparison - INFO - DEBUG HASH STRING: text with|pipes|TX00096887|2023-08-09|65|CUST096887...
2026-01-12 12:10:26,267 - dq_comparison - INFO - DEBUG HASH RESULT: 1ac7f160...
2026-01-12 12:10:26,268 - dq_comparison - INFO - DEBUG HASH ROW: description: 'Text with[brackets]' -> 'text with[brackets]' | transaction_id: 'TX00041535' -> 'TX00041535' | transaction_date: '21-06-2023' -> '2023-06-21' | quantity: '23' -> '23' | customer_id: 'CUST041535' -> 'CUST041535'
2026-01-12 12:10:26,268 - dq_comparison - INFO - DEBUG HASH STRING: text with[brackets]|TX00041535|2023-06-21|23|CUST041535...
2026-01-12 12:10:26,269 - dq_comparison - INFO - DEBUG HASH RESULT: 0b1b86b8...
2026-01-12 12:10:26,270 - dq_comparison - INFO - DEBUG HASH ROW: description: 'Text with|pipes' -> 'text with|pipes' | transaction_id: 'TX00033702' -> 'TX00033702' | transaction_date: '12-05-2023' -> '2023-05-12' | quantity: '20' -> '20' | customer_id: 'CUST033702' -> 'CUST033702'
2026-01-12 12:10:26,270 - dq_comparison - INFO - DEBUG HASH STRING: text with|pipes|TX00033702|2023-05-12|20|CUST033702...
2026-01-12 12:10:26,271 - dq_comparison - INFO - DEBUG HASH RESULT: 97bfee8a...
2026-01-12 12:10:26,272 - dq_comparison - INFO - DEBUG HASH ROW: description: 'Text with_underscores' -> 'text with_underscores' | transaction_id: 'TX00004356' -> 'TX00004356' | transaction_date: '08/29/2023' -> '2023-08-29' | quantity: '16' -> '16' | customer_id: 'CUST004356' -> 'CUST004356'
2026-01-12 12:10:26,272 - dq_comparison - INFO - DEBUG HASH STRING: text with_underscores|TX00004356|2023-08-29|16|CUST004356...
2026-01-12 12:10:26,274 - dq_comparison - INFO - DEBUG HASH RESULT: fade48be...
2026-01-12 12:10:26,275 - dq_comparison - INFO - DEBUG HASH ROW: description: 'Text with`backticks' -> 'text with`backticks' | transaction_id: 'TX00095202' -> 'TX00095202' | transaction_date: '11-03-2023' -> '2023-03-11' | quantity: '97' -> '97' | customer_id: 'CUST095202' -> 'CUST095202'
2026-01-12 12:10:26,275 - dq_comparison - INFO - DEBUG HASH STRING: text with`backticks|TX00095202|2023-03-11|97|CUST095202...
2026-01-12 12:10:26,275 - dq_comparison - INFO - DEBUG HASH RESULT: 980bd6cc...
2026-01-12 12:10:26,276 - dq_comparison - INFO - DEBUG HASH ROW: description: 'Text with"quotes"' -> 'text with"quotes"' | transaction_id: 'TX00028888' -> 'TX00028888' | transaction_date: '30-06-2023' -> '2023-06-30' | quantity: '43' -> '43' | customer_id: 'CUST028888' -> 'CUST028888'
2026-01-12 12:10:26,276 - dq_comparison - INFO - DEBUG HASH STRING: text with"quotes"|TX00028888|2023-06-30|43|CUST028888...
2026-01-12 12:10:26,278 - dq_comparison - INFO - DEBUG HASH RESULT: b840abbd...
2026-01-12 12:10:26,278 - dq_comparison - INFO - DEBUG HASH ROW: description: 'Text with  multiple   spaces' -> 'text with multiple spaces' | transaction_id: 'TX00054958' -> 'TX00054958' | transaction_date: '09-08-2023' -> '2023-08-09' | quantity: '73' -> '73' | customer_id: 'CUST054958' -> 'CUST054958'
2026-01-12 12:10:26,280 - dq_comparison - INFO - DEBUG HASH STRING: text with multiple spaces|TX00054958|2023-08-09|73|CUST054958...
2026-01-12 12:10:26,280 - dq_comparison - INFO - DEBUG HASH RESULT: 7bb75fce...
2026-01-12 12:10:26,280 - dq_comparison - INFO - DEBUG HASH ROW: description: 'Text with& ampersands' -> 'text with& ampersands' | transaction_id: 'TX00077224' -> 'TX00077224' | transaction_date: '27-02-2023' -> '2023-02-27' | quantity: '9' -> '9' | customer_id: 'CUST077224' -> 'CUST077224'
2026-01-12 12:10:26,281 - dq_comparison - INFO - DEBUG HASH STRING: text with& ampersands|TX00077224|2023-02-27|9|CUST077224...
2026-01-12 12:10:26,281 - dq_comparison - INFO - DEBUG HASH RESULT: 4ee372ee...
2026-01-12 12:10:26,283 - dq_comparison - INFO - DEBUG HASH ROW: description: 'Text with@at signs' -> 'text with@at signs' | transaction_id: 'TX00046430' -> 'TX00046430' | transaction_date: '13-05-2023' -> '2023-05-13' | quantity: '73' -> '73' | customer_id: 'CUST046430' -> 'CUST046430'
2026-01-12 12:10:26,284 - dq_comparison - INFO - DEBUG HASH STRING: text with@at signs|TX00046430|2023-05-13|73|CUST046430...
2026-01-12 12:10:26,284 - dq_comparison - INFO - DEBUG HASH RESULT: 198bad18...
2026-01-12 12:10:26,285 - dq_comparison - INFO - DEBUG HASH ROW: description: 'Text with - dashes' -> 'text with - dashes' | transaction_id: 'TX00024284' -> 'TX00024284' | transaction_date: '07-09-2023' -> '2023-09-07' | quantity: '2' -> '2' | customer_id: 'CUST024284' -> 'CUST024284'
2026-01-12 12:10:26,285 - dq_comparison - INFO - DEBUG HASH STRING: text with - dashes|TX00024284|2023-09-07|2|CUST024284...
2026-01-12 12:10:26,285 - dq_comparison - INFO - DEBUG HASH RESULT: a2ec90dc...
2026-01-12 12:10:26,288 - dq_comparison - INFO - DEBUG HASH ROW: description: 'Text with. periods' -> 'text with. periods' | transaction_id: 'TX00098152' -> 'TX00098152' | transaction_date: '04-02-2023' -> '2023-02-04' | quantity: '13' -> '13' | customer_id: 'CUST098152' -> 'CUST098152'
2026-01-12 12:10:26,288 - dq_comparison - INFO - DEBUG HASH STRING: text with. periods|TX00098152|2023-02-04|13|CUST098152...
2026-01-12 12:10:26,288 - dq_comparison - INFO - DEBUG HASH RESULT: 7901812c...
2026-01-12 12:10:26,289 - dq_comparison - INFO - DEBUG HASH ROW: description: 'Text with[brackets]' -> 'text with[brackets]' | transaction_id: 'TX00043153' -> 'TX00043153' | transaction_date: '30-01-2023' -> '2023-01-30' | quantity: '47' -> '47' | customer_id: 'CUST043153' -> 'CUST043153'
2026-01-12 12:10:26,290 - dq_comparison - INFO - DEBUG HASH STRING: text with[brackets]|TX00043153|2023-01-30|47|CUST043153...
2026-01-12 12:10:26,291 - dq_comparison - INFO - DEBUG HASH RESULT: e18e37cd...
2026-01-12 12:10:26,292 - dq_comparison - INFO - DEBUG HASH ROW: description: 'Text with
newlines' -> 'text with newlines' | transaction_id: 'TX00052093' -> 'TX00052093' | transaction_date: '06-09-2023' -> '2023-09-06' | quantity: '65' -> '65' | customer_id: 'CUST052093' -> 'CUST052093'
2026-01-12 12:10:26,292 - dq_comparison - INFO - DEBUG HASH STRING: text with newlines|TX00052093|2023-09-06|65|CUST052093...
2026-01-12 12:10:26,293 - dq_comparison - INFO - DEBUG HASH RESULT: f9f3fb13...
2026-01-12 12:10:26,294 - dq_comparison - INFO - DEBUG HASH ROW: description: 'Text with! exclamations' -> 'text with! exclamations' | transaction_id: 'TX00040750' -> 'TX00040750' | transaction_date: '09-12-2023' -> '2023-12-09' | quantity: '90' -> '90' | customer_id: 'CUST040750' -> 'CUST040750'
2026-01-12 12:10:26,295 - dq_comparison - INFO - DEBUG HASH STRING: text with! exclamations|TX00040750|2023-12-09|90|CUST040750...
2026-01-12 12:10:26,295 - dq_comparison - INFO - DEBUG HASH RESULT: ea270883...
2026-01-12 12:10:26,296 - dq_comparison - INFO - DEBUG HASH ROW: description: 'Text with; semicolons' -> 'text with; semicolons' | transaction_id: 'TX00097770' -> 'TX00097770' | transaction_date: '09-12-2023' -> '2023-12-09' | quantity: '23' -> '23' | customer_id: 'CUST097770' -> 'CUST097770'
2026-01-12 12:10:26,297 - dq_comparison - INFO - DEBUG HASH STRING: text with; semicolons|TX00097770|2023-12-09|23|CUST097770...
2026-01-12 12:10:26,298 - dq_comparison - INFO - DEBUG HASH RESULT: 46ce48e3...
2026-01-12 12:10:26,298 - dq_comparison - INFO - DEBUG HASH ROW: description: 'Text with[brackets]' -> 'text with[brackets]' | transaction_id: 'TX00085976' -> 'TX00085976' | transaction_date: '25-03-2023' -> '2023-03-25' | quantity: '95' -> '95' | customer_id: 'CUST085976' -> 'CUST085976'
2026-01-12 12:10:26,299 - dq_comparison - INFO - DEBUG HASH STRING: text with[brackets]|TX00085976|2023-03-25|95|CUST085976...
2026-01-12 12:10:26,299 - dq_comparison - INFO - DEBUG HASH RESULT: 752f5b1c...
2026-01-12 12:10:26,301 - dq_comparison - INFO - DEBUG HASH ROW: description: 'Text with& ampersands' -> 'text with& ampersands' | transaction_id: 'TX00016239' -> 'TX00016239' | transaction_date: '01-09-2023' -> '2023-09-01' | quantity: '41' -> '41' | customer_id: 'CUST016239' -> 'CUST016239'
2026-01-12 12:10:26,301 - dq_comparison - INFO - DEBUG HASH STRING: text with& ampersands|TX00016239|2023-09-01|41|CUST016239...
2026-01-12 12:10:26,302 - dq_comparison - INFO - DEBUG HASH RESULT: f90ba2e3...
2026-01-12 12:10:26,303 - dq_comparison - INFO - DEBUG HASH ROW: description: 'Text with - dashes' -> 'text with - dashes' | transaction_id: 'TX00080800' -> 'TX00080800' | transaction_date: '03-10-2023' -> '2023-10-03' | quantity: '19' -> '19' | customer_id: 'CUST080800' -> 'CUST080800'
2026-01-12 12:10:26,304 - dq_comparison - INFO - DEBUG HASH STRING: text with - dashes|TX00080800|2023-10-03|19|CUST080800...
2026-01-12 12:10:26,304 - dq_comparison - INFO - DEBUG HASH RESULT: fbb04684...
2026-01-12 12:10:26,305 - dq_comparison - INFO - DEBUG HASH ROW: description: '  Text with leading spaces' -> 'text with leading spaces' | transaction_id: 'TX00094168' -> 'TX00094168' | transaction_date: '11-05-2023' -> '2023-05-11' | quantity: '73' -> '73' | customer_id: 'CUST094168' -> 'CUST094168'
2026-01-12 12:10:26,306 - dq_comparison - INFO - DEBUG HASH STRING: text with leading spaces|TX00094168|2023-05-11|73|CUST094168...
2026-01-12 12:10:26,307 - dq_comparison - INFO - DEBUG HASH RESULT: 5c153791...
2026-01-12 12:10:26,308 - dq_comparison - INFO - DEBUG HASH ROW: description: 'Text with\backslashes' -> 'text with\backslashes' | transaction_id: 'TX00015555' -> 'TX00015555' | transaction_date: '17-08-2023' -> '2023-08-17' | quantity: '35' -> '35' | customer_id: 'CUST015555' -> 'CUST015555'
2026-01-12 12:10:26,308 - dq_comparison - INFO - DEBUG HASH STRING: text with\backslashes|TX00015555|2023-08-17|35|CUST015555...
2026-01-12 12:10:26,309 - dq_comparison - INFO - DEBUG HASH RESULT: 6e4031d6...
2026-01-12 12:10:26,310 - dq_comparison - INFO - DEBUG HASH ROW: description: 'Text with{braces}' -> 'text with{braces}' | transaction_id: 'TX00011067' -> 'TX00011067' | transaction_date: '03-04-2023' -> '2023-04-03' | quantity: '54' -> '54' | customer_id: 'CUST011067' -> 'CUST011067'
2026-01-12 12:10:26,310 - dq_comparison - INFO - DEBUG HASH STRING: text with{braces}|TX00011067|2023-04-03|54|CUST011067...
2026-01-12 12:10:26,311 - dq_comparison - INFO - DEBUG HASH RESULT: 4c0c8939...
2026-01-12 12:10:26,312 - dq_comparison - INFO - DEBUG HASH ROW: description: 'Text with trailing spaces  ' -> 'text with trailing spaces' | transaction_id: 'TX00008263' -> 'TX00008263' | transaction_date: '20-12-2023' -> '2023-12-20' | quantity: '37' -> '37' | customer_id: 'CUST008263' -> 'CUST008263'
2026-01-12 12:10:26,312 - dq_comparison - INFO - DEBUG HASH STRING: text with trailing spaces|TX00008263|2023-12-20|37|CUST008263...
2026-01-12 12:10:26,313 - dq_comparison - INFO - DEBUG HASH RESULT: bcde843c...
2026-01-12 12:10:26,314 - dq_comparison - INFO - DEBUG HASH ROW: description: 'Text with\backslashes' -> 'text with\backslashes' | transaction_id: 'TX00084010' -> 'TX00084010' | transaction_date: '25-07-2023' -> '2023-07-25' | quantity: '41' -> '41' | customer_id: 'CUST084010' -> 'CUST084010'
2026-01-12 12:10:26,314 - dq_comparison - INFO - DEBUG HASH STRING: text with\backslashes|TX00084010|2023-07-25|41|CUST084010...
2026-01-12 12:10:26,315 - dq_comparison - INFO - DEBUG HASH RESULT: 65636212...
2026-01-12 12:10:26,316 - dq_comparison - INFO - DEBUG HASH ROW: description: 'Text with{braces}' -> 'text with{braces}' | transaction_id: 'TX00021860' -> 'TX00021860' | transaction_date: '28-04-2023' -> '2023-04-28' | quantity: '3' -> '3' | customer_id: 'CUST021860' -> 'CUST021860'
2026-01-12 12:10:26,316 - dq_comparison - INFO - DEBUG HASH STRING: text with{braces}|TX00021860|2023-04-28|3|CUST021860...
2026-01-12 12:10:26,317 - dq_comparison - INFO - DEBUG HASH RESULT: 70c654c6...
2026-01-12 12:10:26,318 - dq_comparison - INFO - DEBUG HASH ROW: description: 'Text with$dollar signs' -> 'text with$dollar signs' | transaction_id: 'TX00027281' -> 'TX00027281' | transaction_date: '12/16/2023' -> '2023-12-16' | quantity: '80' -> '80' | customer_id: 'CUST027281' -> 'CUST027281'
2026-01-12 12:10:26,318 - dq_comparison - INFO - DEBUG HASH STRING: text with$dollar signs|TX00027281|2023-12-16|80|CUST027281...
2026-01-12 12:10:26,319 - dq_comparison - INFO - DEBUG HASH RESULT: 76b07da1...
2026-01-12 12:10:26,320 - dq_comparison - INFO - DEBUG HASH ROW: description: 'Text with$dollar signs' -> 'text with$dollar signs' | transaction_id: 'TX00022381' -> 'TX00022381' | transaction_date: '01-05-2023' -> '2023-05-01' | quantity: '14' -> '14' | customer_id: 'CUST022381' -> 'CUST022381'
2026-01-12 12:10:26,320 - dq_comparison - INFO - DEBUG HASH STRING: text with$dollar signs|TX00022381|2023-05-01|14|CUST022381...
2026-01-12 12:10:26,321 - dq_comparison - INFO - DEBUG HASH RESULT: e13991d6...
2026-01-12 12:10:26,322 - dq_comparison - INFO - DEBUG HASH ROW: description: 'Text with<angle brackets>' -> 'text with<angle brackets>' | transaction_id: 'TX00006473' -> 'TX00006473' | transaction_date: '19-12-2023' -> '2023-12-19' | quantity: '92' -> '92' | customer_id: 'CUST006473' -> 'CUST006473'
2026-01-12 12:10:26,323 - dq_comparison - INFO - DEBUG HASH STRING: text with<angle brackets>|TX00006473|2023-12-19|92|CUST006473...
2026-01-12 12:10:26,323 - dq_comparison - INFO - DEBUG HASH RESULT: 2442037c...
2026-01-12 12:10:26,324 - dq_comparison - INFO - DEBUG HASH ROW: description: 'Text with(parentheses)' -> 'text with(parentheses)' | transaction_id: 'TX00095030' -> 'TX00095030' | transaction_date: '28-02-2023' -> '2023-02-28' | quantity: '44' -> '44' | customer_id: 'CUST095030' -> 'CUST095030'
2026-01-12 12:10:26,325 - dq_comparison - INFO - DEBUG HASH STRING: text with(parentheses)|TX00095030|2023-02-28|44|CUST095030...
2026-01-12 12:10:26,325 - dq_comparison - INFO - DEBUG HASH RESULT: 23982116...
2026-01-12 12:10:26,326 - dq_comparison - INFO - DEBUG HASH ROW: description: 'Text with*asterisks' -> 'text with*asterisks' | transaction_id: 'TX00069952' -> 'TX00069952' | transaction_date: '17-08-2023' -> '2023-08-17' | quantity: '53' -> '53' | customer_id: 'CUST069952' -> 'CUST069952'
2026-01-12 12:10:26,327 - dq_comparison - INFO - DEBUG HASH STRING: text with*asterisks|TX00069952|2023-08-17|53|CUST069952...
2026-01-12 12:10:26,328 - dq_comparison - INFO - DEBUG HASH RESULT: a8a72e3e...
2026-01-12 12:10:26,329 - dq_comparison - INFO - DEBUG HASH ROW: description: 'Text with%percent signs' -> 'text with%percent signs' | transaction_id: 'TX00068784' -> 'TX00068784' | transaction_date: '23-08-2023' -> '2023-08-23' | quantity: '22' -> '22' | customer_id: 'CUST068784' -> 'CUST068784'
2026-01-12 12:10:26,329 - dq_comparison - INFO - DEBUG HASH STRING: text with%percent signs|TX00068784|2023-08-23|22|CUST068784...
2026-01-12 12:10:26,330 - dq_comparison - INFO - DEBUG HASH RESULT: b0e3264f...
2026-01-12 12:10:26,331 - dq_comparison - INFO - DEBUG HASH ROW: description: 'Text with. periods' -> 'text with. periods' | transaction_id: 'TX00077756' -> 'TX00077756' | transaction_date: '06-08-2023' -> '2023-08-06' | quantity: '4' -> '4' | customer_id: 'CUST077756' -> 'CUST077756'
2026-01-12 12:10:26,331 - dq_comparison - INFO - DEBUG HASH STRING: text with. periods|TX00077756|2023-08-06|4|CUST077756...
2026-01-12 12:10:26,332 - dq_comparison - INFO - DEBUG HASH RESULT: aeac9d7a...
2026-01-12 12:10:26,333 - dq_comparison - INFO - DEBUG HASH ROW: description: 'Text with	tabs' -> 'text with tabs' | transaction_id: 'TX00080673' -> 'TX00080673' | transaction_date: '02/20/2023' -> '2023-02-20' | quantity: '76' -> '76' | customer_id: 'CUST080673' -> 'CUST080673'
2026-01-12 12:10:26,333 - dq_comparison - INFO - DEBUG HASH STRING: text with tabs|TX00080673|2023-02-20|76|CUST080673...
2026-01-12 12:10:26,334 - dq_comparison - INFO - DEBUG HASH RESULT: 40f119b8...
2026-01-12 12:10:26,335 - dq_comparison - INFO - DEBUG HASH ROW: description: 'Text with%percent signs' -> 'text with%percent signs' | transaction_id: 'TX00052332' -> 'TX00052332' | transaction_date: '12-05-2023' -> '2023-05-12' | quantity: '87' -> '87' | customer_id: 'CUST052332' -> 'CUST052332'
2026-01-12 12:10:26,336 - dq_comparison - INFO - DEBUG HASH STRING: text with%percent signs|TX00052332|2023-05-12|87|CUST052332...
2026-01-12 12:10:26,336 - dq_comparison - INFO - DEBUG HASH RESULT: d2008cf7...
2026-01-12 12:10:26,337 - dq_comparison - INFO - DEBUG HASH ROW: description: '  Text with leading spaces' -> 'text with leading spaces' | transaction_id: 'TX00017337' -> 'TX00017337' | transaction_date: '19-03-2023' -> '2023-03-19' | quantity: '100' -> '100' | customer_id: 'CUST017337' -> 'CUST017337'
2026-01-12 12:10:26,337 - dq_comparison - INFO - DEBUG HASH STRING: text with leading spaces|TX00017337|2023-03-19|100|CUST017337...
2026-01-12 12:10:26,338 - dq_comparison - INFO - DEBUG HASH RESULT: 39712faa...
2026-01-12 12:10:26,339 - dq_comparison - INFO - DEBUG HASH ROW: description: 'Text with{braces}' -> 'text with{braces}' | transaction_id: 'TX00012908' -> 'TX00012908' | transaction_date: '17-04-2023' -> '2023-04-17' | quantity: '15' -> '15' | customer_id: 'CUST012908' -> 'CUST012908'
2026-01-12 12:10:26,339 - dq_comparison - INFO - DEBUG HASH STRING: text with{braces}|TX00012908|2023-04-17|15|CUST012908...
2026-01-12 12:10:26,340 - dq_comparison - INFO - DEBUG HASH RESULT: 28941339...
2026-01-12 12:10:26,340 - dq_comparison - INFO - DEBUG HASH ROW: description: 'Text with/slashes' -> 'text with/slashes' | transaction_id: 'TX00091776' -> 'TX00091776' | transaction_date: '07-11-2023' -> '2023-11-07' | quantity: '78' -> '78' | customer_id: 'CUST091776' -> 'CUST091776'
2026-01-12 12:10:26,341 - dq_comparison - INFO - DEBUG HASH STRING: text with/slashes|TX00091776|2023-11-07|78|CUST091776...
2026-01-12 12:10:26,342 - dq_comparison - INFO - DEBUG HASH RESULT: 7b79a7ff...
2026-01-12 12:10:26,343 - dq_comparison - INFO - DEBUG HASH ROW: description: 'Text with*asterisks' -> 'text with*asterisks' | transaction_id: 'TX00052500' -> 'TX00052500' | transaction_date: '23-10-2023' -> '2023-10-23' | quantity: '-2' -> '-2' | customer_id: 'CUST052500' -> 'CUST052500'
2026-01-12 12:10:26,343 - dq_comparison - INFO - DEBUG HASH STRING: text with*asterisks|TX00052500|2023-10-23|-2|CUST052500...
2026-01-12 12:10:26,344 - dq_comparison - INFO - DEBUG HASH RESULT: 563e5d10...
2026-01-12 12:10:26,345 - dq_comparison - INFO - DEBUG HASH ROW: description: 'Text with, commas' -> 'text with, commas' | transaction_id: 'TX00057073' -> 'TX00057073' | transaction_date: '08-06-2023' -> '2023-06-08' | quantity: '42' -> '42' | customer_id: 'CUST057073' -> 'CUST057073'
2026-01-12 12:10:26,345 - dq_comparison - INFO - DEBUG HASH STRING: text with, commas|TX00057073|2023-06-08|42|CUST057073...
2026-01-12 12:10:26,346 - dq_comparison - INFO - DEBUG HASH RESULT: 3c45fd14...
2026-01-12 12:10:26,347 - dq_comparison - INFO - DEBUG HASH ROW: description: 'Text with@at signs' -> 'text with@at signs' | transaction_id: 'TX00005001' -> 'TX00005001' | transaction_date: '04/30/2023' -> '2023-04-30' | quantity: '17' -> '17' | customer_id: 'CUST005001' -> 'CUST005001'
2026-01-12 12:10:26,347 - dq_comparison - INFO - DEBUG HASH STRING: text with@at signs|TX00005001|2023-04-30|17|CUST005001...
2026-01-12 12:10:26,348 - dq_comparison - INFO - DEBUG HASH RESULT: 711858df...
2026-01-12 12:10:26,349 - dq_comparison - INFO - DEBUG HASH ROW: description: 'Normal text without issues' -> 'normal text without issues' | transaction_id: 'TX00090503' -> 'TX00090503' | transaction_date: '09/14/2023' -> '2023-09-14' | quantity: '95' -> '95' | customer_id: 'CUST090503' -> 'CUST090503'
2026-01-12 12:10:26,350 - dq_comparison - INFO - DEBUG HASH STRING: normal text without issues|TX00090503|2023-09-14|95|CUST090503...
2026-01-12 12:10:26,351 - dq_comparison - INFO - DEBUG HASH RESULT: f06f3859...
2026-01-12 12:10:26,352 - dq_comparison - INFO - DEBUG HASH ROW: description: 'Text with  multiple   spaces' -> 'text with multiple spaces' | transaction_id: 'TX00087829' -> 'TX00087829' | transaction_date: '28-09-2023' -> '2023-09-28' | quantity: '43' -> '43' | customer_id: 'CUST087829' -> 'CUST087829'
2026-01-12 12:10:26,353 - dq_comparison - INFO - DEBUG HASH STRING: text with multiple spaces|TX00087829|2023-09-28|43|CUST087829...
2026-01-12 12:10:26,354 - dq_comparison - INFO - DEBUG HASH RESULT: dcbb3dc7...
2026-01-12 12:10:26,355 - dq_comparison - INFO - DEBUG HASH ROW: description: 'Text with. periods' -> 'text with. periods' | transaction_id: 'TX00089014' -> 'TX00089014' | transaction_date: '20-09-2023' -> '2023-09-20' | quantity: '19' -> '19' | customer_id: 'CUST089014' -> 'CUST089014'
2026-01-12 12:10:26,355 - dq_comparison - INFO - DEBUG HASH STRING: text with. periods|TX00089014|2023-09-20|19|CUST089014...
2026-01-12 12:10:26,356 - dq_comparison - INFO - DEBUG HASH RESULT: 6192d261...
2026-01-12 12:10:26,357 - dq_comparison - INFO - DEBUG HASH ROW: description: 'Text with_underscores' -> 'text with_underscores' | transaction_id: 'TX00094050' -> 'TX00094050' | transaction_date: '07-04-2023' -> '2023-04-07' | quantity: '99' -> '99' | customer_id: 'CUST094050' -> 'CUST094050'
2026-01-12 12:10:26,358 - dq_comparison - INFO - DEBUG HASH STRING: text with_underscores|TX00094050|2023-04-07|99|CUST094050...
2026-01-12 12:10:26,358 - dq_comparison - INFO - DEBUG HASH RESULT: 22f79770...
2026-01-12 12:10:26,359 - dq_comparison - INFO - DEBUG HASH ROW: description: 'Text with. periods' -> 'text with. periods' | transaction_id: 'TX00042501' -> 'TX00042501' | transaction_date: '11-10-2023' -> '2023-10-11' | quantity: '58' -> '58' | customer_id: 'CUST042501' -> 'CUST042501'
2026-01-12 12:10:26,360 - dq_comparison - INFO - DEBUG HASH STRING: text with. periods|TX00042501|2023-10-11|58|CUST042501...
2026-01-12 12:10:26,361 - dq_comparison - INFO - DEBUG HASH RESULT: c1aad7ae...
2026-01-12 12:10:26,362 - dq_comparison - INFO - DEBUG HASH ROW: description: 'Text with\backslashes' -> 'text with\backslashes' | transaction_id: 'TX00027274' -> 'TX00027274' | transaction_date: '17-08-2023' -> '2023-08-17' | quantity: '21' -> '21' | customer_id: 'CUST027274' -> 'CUST027274'
2026-01-12 12:10:26,362 - dq_comparison - INFO - DEBUG HASH STRING: text with\backslashes|TX00027274|2023-08-17|21|CUST027274...
2026-01-12 12:10:26,363 - dq_comparison - INFO - DEBUG HASH RESULT: 69660af0...
2026-01-12 12:10:26,364 - dq_comparison - INFO - DEBUG HASH ROW: description: 'Text with	tabs' -> 'text with tabs' | transaction_id: 'TX00026863' -> 'TX00026863' | transaction_date: '27-07-2023' -> '2023-07-27' | quantity: '81' -> '81' | customer_id: 'CUST026863' -> 'CUST026863'
2026-01-12 12:10:26,364 - dq_comparison - INFO - DEBUG HASH STRING: text with tabs|TX00026863|2023-07-27|81|CUST026863...
2026-01-12 12:10:26,365 - dq_comparison - INFO - DEBUG HASH RESULT: c564b6f6...
2026-01-12 12:10:26,366 - dq_comparison - INFO - DEBUG HASH ROW: description: 'Text with@at signs' -> 'text with@at signs' | transaction_id: 'TX00045960' -> 'TX00045960' | transaction_date: '29-09-2023' -> '2023-09-29' | quantity: '54' -> '54' | customer_id: 'CUST045960' -> 'CUST045960'
2026-01-12 12:10:26,366 - dq_comparison - INFO - DEBUG HASH STRING: text with@at signs|TX00045960|2023-09-29|54|CUST045960...
2026-01-12 12:10:26,367 - dq_comparison - INFO - DEBUG HASH RESULT: b1efcfc7...
2026-01-12 12:10:26,368 - dq_comparison - INFO - DEBUG HASH ROW: description: 'Normal text without issues' -> 'normal text without issues' | transaction_id: 'TX00079315' -> 'TX00079315' | transaction_date: '20-11-2023' -> '2023-11-20' | quantity: '24' -> '24' | customer_id: 'CUST079315' -> 'CUST079315'
2026-01-12 12:10:26,369 - dq_comparison - INFO - DEBUG HASH STRING: normal text without issues|TX00079315|2023-11-20|24|CUST079315...
2026-01-12 12:10:26,369 - dq_comparison - INFO - DEBUG HASH RESULT: 99b46003...
2026-01-12 12:10:26,370 - dq_comparison - INFO - DEBUG HASH ROW: description: 'Text with%percent signs' -> 'text with%percent signs' | transaction_id: 'TX00074222' -> 'TX00074222' | transaction_date: '31-10-2023' -> '2023-10-31' | quantity: '1' -> '1' | customer_id: 'CUST074222' -> 'CUST074222'
2026-01-12 12:10:26,371 - dq_comparison - INFO - DEBUG HASH STRING: text with%percent signs|TX00074222|2023-10-31|1|CUST074222...
2026-01-12 12:10:26,371 - dq_comparison - INFO - DEBUG HASH RESULT: f7778413...
2026-01-12 12:10:26,373 - dq_comparison - INFO - DEBUG HASH ROW: description: 'Text with~tildes' -> 'text with~tildes' | transaction_id: 'TX00098193' -> 'TX00098193' | transaction_date: '21-12-2023' -> '2023-12-21' | quantity: '39' -> '39' | customer_id: 'CUST098193' -> 'CUST098193'
2026-01-12 12:10:26,373 - dq_comparison - INFO - DEBUG HASH STRING: text with~tildes|TX00098193|2023-12-21|39|CUST098193...
2026-01-12 12:10:26,374 - dq_comparison - INFO - DEBUG HASH RESULT: ce2918fd...
2026-01-12 12:10:26,375 - dq_comparison - INFO - DEBUG HASH ROW: description: 'Text with! exclamations' -> 'text with! exclamations' | transaction_id: 'TX00014991' -> 'TX00014991' | transaction_date: '02/13/2023' -> '2023-02-13' | quantity: '31' -> '31' | customer_id: 'CUST014991' -> 'CUST014991'
2026-01-12 12:10:26,375 - dq_comparison - INFO - DEBUG HASH STRING: text with! exclamations|TX00014991|2023-02-13|31|CUST014991...
2026-01-12 12:10:26,376 - dq_comparison - INFO - DEBUG HASH RESULT: 3fe6bb71...
2026-01-12 12:10:26,377 - dq_comparison - INFO - DEBUG HASH ROW: description: 'Text with
newlines' -> 'text with newlines' | transaction_id: 'TX00009040' -> 'TX00009040' | transaction_date: '07-12-2023' -> '2023-12-07' | quantity: '65' -> '65' | customer_id: 'CUST009040' -> 'CUST009040'
2026-01-12 12:10:26,377 - dq_comparison - INFO - DEBUG HASH STRING: text with newlines|TX00009040|2023-12-07|65|CUST009040...
2026-01-12 12:10:26,378 - dq_comparison - INFO - DEBUG HASH RESULT: e753bcfe...
2026-01-12 12:10:26,379 - dq_comparison - INFO - DEBUG HASH ROW: description: 'Text with{braces}' -> 'text with{braces}' | transaction_id: 'TX00079173' -> 'TX00079173' | transaction_date: '10-05-2023' -> '2023-05-10' | quantity: '44' -> '44' | customer_id: 'CUST079173' -> 'CUST079173'
2026-01-12 12:10:26,379 - dq_comparison - INFO - DEBUG HASH STRING: text with{braces}|TX00079173|2023-05-10|44|CUST079173...
2026-01-12 12:10:26,380 - dq_comparison - INFO - DEBUG HASH RESULT: c2cf58d5...
2026-01-12 12:10:26,382 - dq_comparison - INFO - DEBUG HASH ROW: description: 'Text with; semicolons' -> 'text with; semicolons' | transaction_id: 'TX00035179' -> 'TX00035179' | transaction_date: '06-12-2023' -> '2023-12-06' | quantity: '76' -> '76' | customer_id: 'CUST035179' -> 'CUST035179'
2026-01-12 12:10:26,382 - dq_comparison - INFO - DEBUG HASH STRING: text with; semicolons|TX00035179|2023-12-06|76|CUST035179...
2026-01-12 12:10:26,383 - dq_comparison - INFO - DEBUG HASH RESULT: a97bdbe3...
2026-01-12 12:10:26,384 - dq_comparison - INFO - DEBUG HASH ROW: description: 'Text with<angle brackets>' -> 'text with<angle brackets>' | transaction_id: 'TX00016209' -> 'TX00016209' | transaction_date: '27-10-2023' -> '2023-10-27' | quantity: '54' -> '54' | customer_id: 'CUST016209' -> 'CUST016209'
2026-01-12 12:10:26,385 - dq_comparison - INFO - DEBUG HASH STRING: text with<angle brackets>|TX00016209|2023-10-27|54|CUST016209...
2026-01-12 12:10:26,385 - dq_comparison - INFO - DEBUG HASH RESULT: a25d2b0f...
2026-01-12 12:10:26,386 - dq_comparison - INFO - DEBUG HASH ROW: description: 'Text with mixed CAPITAL and lowercase' -> 'text with mixed capital and lowercase' | transaction_id: 'TX00095641' -> 'TX00095641' | transaction_date: '21-09-2023' -> '2023-09-21' | quantity: '69' -> '69' | customer_id: 'CUST095641' -> 'CUST095641'
2026-01-12 12:10:26,387 - dq_comparison - INFO - DEBUG HASH STRING: text with mixed capital and lowercase|TX00095641|2023-09-21|69|CUST095641...
2026-01-12 12:10:26,387 - dq_comparison - INFO - DEBUG HASH RESULT: bf7c1caa...
2026-01-12 12:10:26,388 - dq_comparison - INFO - DEBUG HASH ROW: description: 'Text with[brackets]' -> 'text with[brackets]' | transaction_id: 'TX00080146' -> 'TX00080146' | transaction_date: '11-07-2023' -> '2023-07-11' | quantity: '4' -> '4' | customer_id: 'CUST080146' -> 'CUST080146'
2026-01-12 12:10:26,389 - dq_comparison - INFO - DEBUG HASH STRING: text with[brackets]|TX00080146|2023-07-11|4|CUST080146...
2026-01-12 12:10:26,389 - dq_comparison - INFO - DEBUG HASH RESULT: 97080981...
2026-01-12 12:10:26,390 - dq_comparison - INFO - DEBUG HASH ROW: description: 'Text with! exclamations' -> 'text with! exclamations' | transaction_id: 'TX00011171' -> 'TX00011171' | transaction_date: '10-05-2023' -> '2023-05-10' | quantity: '38' -> '38' | customer_id: 'CUST011171' -> 'CUST011171'
2026-01-12 12:10:26,391 - dq_comparison - INFO - DEBUG HASH STRING: text with! exclamations|TX00011171|2023-05-10|38|CUST011171...
2026-01-12 12:10:26,392 - dq_comparison - INFO - DEBUG HASH RESULT: 8e482843...
2026-01-12 12:10:26,393 - dq_comparison - INFO - DEBUG HASH ROW: description: 'Text with. periods' -> 'text with. periods' | transaction_id: 'TX00098570' -> 'TX00098570' | transaction_date: '01/31/2023' -> '2023-01-31' | quantity: '50' -> '50' | customer_id: 'CUST098570' -> 'CUST098570'
2026-01-12 12:10:26,393 - dq_comparison - INFO - DEBUG HASH STRING: text with. periods|TX00098570|2023-01-31|50|CUST098570...
2026-01-12 12:10:26,394 - dq_comparison - INFO - DEBUG HASH RESULT: e4e8a182...
2026-01-12 12:10:26,395 - dq_comparison - INFO - DEBUG HASH ROW: description: 'Text with - dashes' -> 'text with - dashes' | transaction_id: 'TX00065383' -> 'TX00065383' | transaction_date: '12-04-2023' -> '2023-04-12' | quantity: '67' -> '67' | customer_id: 'CUST065383' -> 'CUST065383'
2026-01-12 12:10:26,395 - dq_comparison - INFO - DEBUG HASH STRING: text with - dashes|TX00065383|2023-04-12|67|CUST065383...
2026-01-12 12:10:26,396 - dq_comparison - INFO - DEBUG HASH RESULT: 3a6c8814...
2026-01-12 12:10:26,397 - dq_comparison - INFO - DEBUG HASH ROW: description: 'Text with& ampersands' -> 'text with& ampersands' | transaction_id: 'TX00017459' -> 'TX00017459' | transaction_date: '11-10-2023' -> '2023-10-11' | quantity: '93' -> '93' | customer_id: 'CUST017459' -> 'CUST017459'
2026-01-12 12:10:26,397 - dq_comparison - INFO - DEBUG HASH STRING: text with& ampersands|TX00017459|2023-10-11|93|CUST017459...
2026-01-12 12:10:26,398 - dq_comparison - INFO - DEBUG HASH RESULT: 6a34f722...
2026-01-12 12:10:26,399 - dq_comparison - INFO - DEBUG HASH ROW: description: 'Text with#hashtags' -> 'text with#hashtags' | transaction_id: 'TX00028843' -> 'TX00028843' | transaction_date: '02-09-2023' -> '2023-09-02' | quantity: '94' -> '94' | customer_id: 'CUST028843' -> 'CUST028843'
2026-01-12 12:10:26,399 - dq_comparison - INFO - DEBUG HASH STRING: text with#hashtags|TX00028843|2023-09-02|94|CUST028843...
2026-01-12 12:10:26,400 - dq_comparison - INFO - DEBUG HASH RESULT: 7a82c6c5...
2026-01-12 12:10:26,401 - dq_comparison - INFO - DEBUG HASH ROW: description: 'Text with& ampersands' -> 'text with& ampersands' | transaction_id: 'TX00050925' -> 'TX00050925' | transaction_date: '10-03-2023' -> '2023-03-10' | quantity: '22' -> '22' | customer_id: 'CUST050925' -> 'CUST050925'
2026-01-12 12:10:26,402 - dq_comparison - INFO - DEBUG HASH STRING: text with& ampersands|TX00050925|2023-03-10|22|CUST050925...
2026-01-12 12:10:26,402 - dq_comparison - INFO - DEBUG HASH RESULT: 9d7aaa09...
2026-01-12 12:10:26,403 - dq_comparison - INFO - DEBUG HASH ROW: description: 'Text with, commas' -> 'text with, commas' | transaction_id: 'TX00072043' -> 'TX00072043' | transaction_date: '15-12-2023' -> '2023-12-15' | quantity: '17' -> '17' | customer_id: 'CUST072043' -> 'CUST072043'
2026-01-12 12:10:26,404 - dq_comparison - INFO - DEBUG HASH STRING: text with, commas|TX00072043|2023-12-15|17|CUST072043...
2026-01-12 12:10:26,404 - dq_comparison - INFO - DEBUG HASH RESULT: 143c1f44...
2026-01-12 12:10:26,405 - dq_comparison - INFO - DEBUG HASH ROW: description: 'Text with$dollar signs' -> 'text with$dollar signs' | transaction_id: 'TX00062198' -> 'TX00062198' | transaction_date: '28-09-2023' -> '2023-09-28' | quantity: '98' -> '98' | customer_id: 'CUST062198' -> 'CUST062198'
2026-01-12 12:10:26,406 - dq_comparison - INFO - DEBUG HASH STRING: text with$dollar signs|TX00062198|2023-09-28|98|CUST062198...
2026-01-12 12:10:26,406 - dq_comparison - INFO - DEBUG HASH RESULT: 38b3b7f0...
2026-01-12 12:10:26,407 - dq_comparison - INFO - DEBUG HASH ROW: description: 'Text with? questions' -> 'text with? questions' | transaction_id: 'TX00059332' -> 'TX00059332' | transaction_date: '15-11-2023' -> '2023-11-15' | quantity: '12' -> '12' | customer_id: 'CUST059332' -> 'CUST059332'
2026-01-12 12:10:26,408 - dq_comparison - INFO - DEBUG HASH STRING: text with? questions|TX00059332|2023-11-15|12|CUST059332...
2026-01-12 12:10:26,408 - dq_comparison - INFO - DEBUG HASH RESULT: f603ea62...
2026-01-12 12:10:26,410 - dq_comparison - INFO - DEBUG HASH ROW: description: 'Text with mixed CAPITAL and lowercase' -> 'text with mixed capital and lowercase' | transaction_id: 'TX00054338' -> 'TX00054338' | transaction_date: '18-07-2023' -> '2023-07-18' | quantity: '16' -> '16' | customer_id: 'CUST054338' -> 'CUST054338'
2026-01-12 12:10:26,410 - dq_comparison - INFO - DEBUG HASH STRING: text with mixed capital and lowercase|TX00054338|2023-07-18|16|CUST054338...
2026-01-12 12:10:26,411 - dq_comparison - INFO - DEBUG HASH RESULT: 0f4027b6...
2026-01-12 12:10:26,413 - dq_comparison - INFO - DEBUG HASH ROW: description: 'Text with<angle brackets>' -> 'text with<angle brackets>' | transaction_id: 'TX00008367' -> 'TX00008367' | transaction_date: '01-08-2023' -> '2023-08-01' | quantity: '69' -> '69' | customer_id: 'CUST008367' -> 'CUST008367'
2026-01-12 12:10:26,413 - dq_comparison - INFO - DEBUG HASH STRING: text with<angle brackets>|TX00008367|2023-08-01|69|CUST008367...
2026-01-12 12:10:26,414 - dq_comparison - INFO - DEBUG HASH RESULT: 7495ac42...
2026-01-12 12:10:26,415 - dq_comparison - INFO - DEBUG HASH ROW: description: 'Text with'apostrophes' -> 'text with'apostrophes' | transaction_id: 'TX00044159' -> 'TX00044159' | transaction_date: '07-07-2023' -> '2023-07-07' | quantity: '21' -> '21' | customer_id: 'CUST044159' -> 'CUST044159'
2026-01-12 12:10:26,415 - dq_comparison - INFO - DEBUG HASH STRING: text with'apostrophes|TX00044159|2023-07-07|21|CUST044159...
2026-01-12 12:10:26,416 - dq_comparison - INFO - DEBUG HASH RESULT: 47145df0...
2026-01-12 12:10:26,417 - dq_comparison - INFO - DEBUG HASH ROW: description: 'Normal text without issues' -> 'normal text without issues' | transaction_id: 'TX00025910' -> 'TX00025910' | transaction_date: '08-08-2023' -> '2023-08-08' | quantity: '7' -> '7' | customer_id: 'CUST025910' -> 'CUST025910'
2026-01-12 12:10:26,417 - dq_comparison - INFO - DEBUG HASH STRING: normal text without issues|TX00025910|2023-08-08|7|CUST025910...
2026-01-12 12:10:26,418 - dq_comparison - INFO - DEBUG HASH RESULT: bea9558a...
2026-01-12 12:10:26,419 - dq_comparison - INFO - DEBUG HASH ROW: description: '  Text with leading spaces' -> 'text with leading spaces' | transaction_id: 'TX00082633' -> 'TX00082633' | transaction_date: '08-01-2023' -> '2023-01-08' | quantity: '55' -> '55' | customer_id: 'CUST082633' -> 'CUST082633'
2026-01-12 12:10:26,419 - dq_comparison - INFO - DEBUG HASH STRING: text with leading spaces|TX00082633|2023-01-08|55|CUST082633...
2026-01-12 12:10:26,420 - dq_comparison - INFO - DEBUG HASH RESULT: 966ded2f...
2026-01-12 12:10:26,421 - dq_comparison - INFO - DEBUG HASH ROW: description: 'Text with\backslashes' -> 'text with\backslashes' | transaction_id: 'TX00095721' -> 'TX00095721' | transaction_date: '04-11-2023' -> '2023-11-04' | quantity: '78' -> '78' | customer_id: 'CUST095721' -> 'CUST095721'
2026-01-12 12:10:26,422 - dq_comparison - INFO - DEBUG HASH STRING: text with\backslashes|TX00095721|2023-11-04|78|CUST095721...
2026-01-12 12:10:26,422 - dq_comparison - INFO - DEBUG HASH RESULT: bbce2a52...
2026-01-12 12:10:26,423 - dq_comparison - INFO - DEBUG HASH ROW: description: 'Text with mixed CAPITAL and lowercase' -> 'text with mixed capital and lowercase' | transaction_id: 'TX00003937' -> 'TX00003937' | transaction_date: '12-04-2023' -> '2023-04-12' | quantity: '94' -> '94' | customer_id: 'CUST003937' -> 'CUST003937'
2026-01-12 12:10:26,424 - dq_comparison - INFO - DEBUG HASH STRING: text with mixed capital and lowercase|TX00003937|2023-04-12|94|CUST003937...
2026-01-12 12:10:26,424 - dq_comparison - INFO - DEBUG HASH RESULT: 5c27c6ea...
2026-01-12 12:10:26,425 - dq_comparison - INFO - DEBUG HASH ROW: description: 'Text with; semicolons' -> 'text with; semicolons' | transaction_id: 'TX00010177' -> 'TX00010177' | transaction_date: '19-07-2023' -> '2023-07-19' | quantity: '28' -> '28' | customer_id: 'CUST010177' -> 'CUST010177'
2026-01-12 12:10:26,426 - dq_comparison - INFO - DEBUG HASH STRING: text with; semicolons|TX00010177|2023-07-19|28|CUST010177...
2026-01-12 12:10:26,426 - dq_comparison - INFO - DEBUG HASH RESULT: ce38efcd...
2026-01-12 12:10:26,427 - dq_comparison - INFO - DEBUG HASH ROW: description: 'Text with[brackets]' -> 'text with[brackets]' | transaction_id: 'TX00068341' -> 'TX00068341' | transaction_date: '03/27/2023' -> '2023-03-27' | quantity: '70' -> '70' | customer_id: 'CUST068341' -> 'CUST068341'
2026-01-12 12:10:26,428 - dq_comparison - INFO - DEBUG HASH STRING: text with[brackets]|TX00068341|2023-03-27|70|CUST068341...
2026-01-12 12:10:26,428 - dq_comparison - INFO - DEBUG HASH RESULT: 9465bc6c...
2026-01-12 12:10:26,429 - dq_comparison - INFO - DEBUG HASH ROW: description: 'Text with@at signs' -> 'text with@at signs' | transaction_id: 'TX00008044' -> 'TX00008044' | transaction_date: '04-04-2023' -> '2023-04-04' | quantity: '22' -> '22' | customer_id: 'CUST008044' -> 'CUST008044'
2026-01-12 12:10:26,429 - dq_comparison - INFO - DEBUG HASH STRING: text with@at signs|TX00008044|2023-04-04|22|CUST008044...
2026-01-12 12:10:26,430 - dq_comparison - INFO - DEBUG HASH RESULT: 559d671b...
2026-01-12 12:10:26,431 - dq_comparison - INFO - DEBUG HASH ROW: description: 'Text with[brackets]' -> 'text with[brackets]' | transaction_id: 'TX00055492' -> 'TX00055492' | transaction_date: '19-09-2023' -> '2023-09-19' | quantity: '57' -> '57' | customer_id: 'CUST055492' -> 'CUST055492'
2026-01-12 12:10:26,431 - dq_comparison - INFO - DEBUG HASH STRING: text with[brackets]|TX00055492|2023-09-19|57|CUST055492...
2026-01-12 12:10:26,432 - dq_comparison - INFO - DEBUG HASH RESULT: e86de7f6...
2026-01-12 12:10:26,433 - dq_comparison - INFO - DEBUG HASH ROW: description: 'Text with@at signs' -> 'text with@at signs' | transaction_id: 'TX00049457' -> 'TX00049457' | transaction_date: '06-10-2023' -> '2023-10-06' | quantity: '77' -> '77' | customer_id: 'CUST049457' -> 'CUST049457'
2026-01-12 12:10:26,433 - dq_comparison - INFO - DEBUG HASH STRING: text with@at signs|TX00049457|2023-10-06|77|CUST049457...
2026-01-12 12:10:26,434 - dq_comparison - INFO - DEBUG HASH RESULT: 1e807f0e...
2026-01-12 12:10:26,435 - dq_comparison - INFO - DEBUG HASH ROW: description: 'Text with
newlines' -> 'text with newlines' | transaction_id: 'TX00012704' -> 'TX00012704' | transaction_date: '18-09-2023' -> '2023-09-18' | quantity: '25' -> '25' | customer_id: 'CUST012704' -> 'CUST012704'
2026-01-12 12:10:26,435 - dq_comparison - INFO - DEBUG HASH STRING: text with newlines|TX00012704|2023-09-18|25|CUST012704...
2026-01-12 12:10:26,436 - dq_comparison - INFO - DEBUG HASH RESULT: a98d9dcd...
2026-01-12 12:10:26,437 - dq_comparison - INFO - DEBUG HASH ROW: description: 'Text with$dollar signs' -> 'text with$dollar signs' | transaction_id: 'TX00091631' -> 'TX00091631' | transaction_date: '08-04-2023' -> '2023-04-08' | quantity: '70' -> '70' | customer_id: 'CUST091631' -> 'CUST091631'
2026-01-12 12:10:26,438 - dq_comparison - INFO - DEBUG HASH STRING: text with$dollar signs|TX00091631|2023-04-08|70|CUST091631...
2026-01-12 12:10:26,438 - dq_comparison - INFO - DEBUG HASH RESULT: 473e975b...
2026-01-12 12:10:26,439 - dq_comparison - INFO - DEBUG HASH ROW: description: 'Text with
newlines' -> 'text with newlines' | transaction_id: 'TX00061744' -> 'TX00061744' | transaction_date: '10-12-2023' -> '2023-12-10' | quantity: '7' -> '7' | customer_id: 'CUST061744' -> 'CUST061744'
2026-01-12 12:10:26,440 - dq_comparison - INFO - DEBUG HASH STRING: text with newlines|TX00061744|2023-12-10|7|CUST061744...
2026-01-12 12:10:26,441 - dq_comparison - INFO - DEBUG HASH RESULT: 070f219e...
2026-01-12 12:10:26,442 - dq_comparison - INFO - DEBUG HASH ROW: description: 'Text with*asterisks' -> 'text with*asterisks' | transaction_id: 'TX00068583' -> 'TX00068583' | transaction_date: '23-07-2023' -> '2023-07-23' | quantity: '3' -> '3' | customer_id: 'CUST068583' -> 'CUST068583'
2026-01-12 12:10:26,442 - dq_comparison - INFO - DEBUG HASH STRING: text with*asterisks|TX00068583|2023-07-23|3|CUST068583...
2026-01-12 12:10:26,443 - dq_comparison - INFO - DEBUG HASH RESULT: 28749070...
2026-01-12 12:10:26,444 - dq_comparison - INFO - DEBUG HASH ROW: description: 'Text with	tabs' -> 'text with tabs' | transaction_id: 'TX00040534' -> 'TX00040534' | transaction_date: '24-02-2023' -> '2023-02-24' | quantity: '7' -> '7' | customer_id: 'CUST040534' -> 'CUST040534'
2026-01-12 12:10:26,444 - dq_comparison - INFO - DEBUG HASH STRING: text with tabs|TX00040534|2023-02-24|7|CUST040534...
2026-01-12 12:10:26,445 - dq_comparison - INFO - DEBUG HASH RESULT: bea86fe1...
2026-01-12 12:10:26,446 - dq_comparison - INFO - DEBUG HASH ROW: description: 'Text with
newlines' -> 'text with newlines' | transaction_id: 'TX00045589' -> 'TX00045589' | transaction_date: '31-05-2023' -> '2023-05-31' | quantity: '80' -> '80' | customer_id: 'CUST045589' -> 'CUST045589'
2026-01-12 12:10:26,446 - dq_comparison - INFO - DEBUG HASH STRING: text with newlines|TX00045589|2023-05-31|80|CUST045589...
2026-01-12 12:10:26,447 - dq_comparison - INFO - DEBUG HASH RESULT: 73d3c5c6...
2026-01-12 12:10:26,448 - dq_comparison - INFO - DEBUG HASH ROW: description: 'Text with	tabs' -> 'text with tabs' | transaction_id: 'TX00097557' -> 'TX00097557' | transaction_date: '28-08-2023' -> '2023-08-28' | quantity: '31' -> '31' | customer_id: 'CUST097557' -> 'CUST097557'
2026-01-12 12:10:26,448 - dq_comparison - INFO - DEBUG HASH STRING: text with tabs|TX00097557|2023-08-28|31|CUST097557...
2026-01-12 12:10:26,449 - dq_comparison - INFO - DEBUG HASH RESULT: 6840b786...
2026-01-12 12:10:26,450 - dq_comparison - INFO - DEBUG HASH ROW: description: 'Text with%percent signs' -> 'text with%percent signs' | transaction_id: 'TX00033960' -> 'TX00033960' | transaction_date: '28-05-2023' -> '2023-05-28' | quantity: '85' -> '85' | customer_id: 'CUST033960' -> 'CUST033960'
2026-01-12 12:10:26,450 - dq_comparison - INFO - DEBUG HASH STRING: text with%percent signs|TX00033960|2023-05-28|85|CUST033960...
2026-01-12 12:10:26,451 - dq_comparison - INFO - DEBUG HASH RESULT: ea386279...
2026-01-12 12:10:26,452 - dq_comparison - INFO - DEBUG HASH ROW: description: 'Text with& ampersands' -> 'text with& ampersands' | transaction_id: 'TX00089438' -> 'TX00089438' | transaction_date: '16-04-2023' -> '2023-04-16' | quantity: '3' -> '3' | customer_id: 'CUST089438' -> 'CUST089438'
2026-01-12 12:10:26,453 - dq_comparison - INFO - DEBUG HASH STRING: text with& ampersands|TX00089438|2023-04-16|3|CUST089438...
2026-01-12 12:10:26,453 - dq_comparison - INFO - DEBUG HASH RESULT: 0c280988...
2026-01-12 12:10:26,454 - dq_comparison - INFO - DEBUG HASH ROW: description: 'Text with_underscores' -> 'text with_underscores' | transaction_id: 'TX00058195' -> 'TX00058195' | transaction_date: '03-11-2023' -> '2023-11-03' | quantity: '42' -> '42' | customer_id: 'CUST058195' -> 'CUST058195'
2026-01-12 12:10:26,455 - dq_comparison - INFO - DEBUG HASH STRING: text with_underscores|TX00058195|2023-11-03|42|CUST058195...
2026-01-12 12:10:26,455 - dq_comparison - INFO - DEBUG HASH RESULT: ea614ccd...
2026-01-12 12:10:26,456 - dq_comparison - INFO - DEBUG HASH ROW: description: 'Text with? questions' -> 'text with? questions' | transaction_id: 'TX00072614' -> 'TX00072614' | transaction_date: '17-03-2023' -> '2023-03-17' | quantity: '43' -> '43' | customer_id: 'CUST072614' -> 'CUST072614'
2026-01-12 12:10:26,457 - dq_comparison - INFO - DEBUG HASH STRING: text with? questions|TX00072614|2023-03-17|43|CUST072614...
2026-01-12 12:10:26,458 - dq_comparison - INFO - DEBUG HASH RESULT: 25281e1e...
2026-01-12 12:10:26,458 - dq_comparison - INFO - DEBUG HASH ROW: description: 'Text with  multiple   spaces' -> 'text with multiple spaces' | transaction_id: 'TX00059185' -> 'TX00059185' | transaction_date: '23-06-2023' -> '2023-06-23' | quantity: '24' -> '24' | customer_id: 'CUST059185' -> 'CUST059185'
2026-01-12 12:10:26,459 - dq_comparison - INFO - DEBUG HASH STRING: text with multiple spaces|TX00059185|2023-06-23|24|CUST059185...
2026-01-12 12:10:26,460 - dq_comparison - INFO - DEBUG HASH RESULT: aa86e584...
2026-01-12 12:10:26,461 - dq_comparison - INFO - DEBUG HASH ROW: description: 'Text with, commas' -> 'text with, commas' | transaction_id: 'TX00040659' -> 'TX00040659' | transaction_date: '30-05-2023' -> '2023-05-30' | quantity: '100' -> '100' | customer_id: 'CUST040659' -> 'CUST040659'
2026-01-12 12:10:26,461 - dq_comparison - INFO - DEBUG HASH STRING: text with, commas|TX00040659|2023-05-30|100|CUST040659...
2026-01-12 12:10:26,462 - dq_comparison - INFO - DEBUG HASH RESULT: 68aa13af...
2026-01-12 12:10:26,463 - dq_comparison - INFO - DEBUG HASH ROW: description: 'Text with
newlines' -> 'text with newlines' | transaction_id: 'TX00028571' -> 'TX00028571' | transaction_date: '04-09-2023' -> '2023-09-04' | quantity: '64' -> '64' | customer_id: 'CUST028571' -> 'CUST028571'
2026-01-12 12:10:26,463 - dq_comparison - INFO - DEBUG HASH STRING: text with newlines|TX00028571|2023-09-04|64|CUST028571...
2026-01-12 12:10:26,464 - dq_comparison - INFO - DEBUG HASH RESULT: 2a0b9eff...
2026-01-12 12:10:26,465 - dq_comparison - INFO - DEBUG HASH ROW: description: 'Text with|pipes' -> 'text with|pipes' | transaction_id: 'TX00052159' -> 'TX00052159' | transaction_date: '07-01-2023' -> '2023-01-07' | quantity: '71' -> '71' | customer_id: 'CUST052159' -> 'CUST052159'
2026-01-12 12:10:26,465 - dq_comparison - INFO - DEBUG HASH STRING: text with|pipes|TX00052159|2023-01-07|71|CUST052159...
2026-01-12 12:10:26,466 - dq_comparison - INFO - DEBUG HASH RESULT: d39a676d...
2026-01-12 12:10:26,467 - dq_comparison - INFO - DEBUG HASH ROW: description: 'Text with	tabs' -> 'text with tabs' | transaction_id: 'TX00043774' -> 'TX00043774' | transaction_date: '25-06-2023' -> '2023-06-25' | quantity: '22' -> '22' | customer_id: 'CUST043774' -> 'CUST043774'
2026-01-12 12:10:26,467 - dq_comparison - INFO - DEBUG HASH STRING: text with tabs|TX00043774|2023-06-25|22|CUST043774...
2026-01-12 12:10:26,468 - dq_comparison - INFO - DEBUG HASH RESULT: fd34b0d5...
2026-01-12 12:10:26,469 - dq_comparison - INFO - DEBUG HASH ROW: description: 'Text with@at signs' -> 'text with@at signs' | transaction_id: 'TX00017336' -> 'TX00017336' | transaction_date: '12-08-2023' -> '2023-08-12' | quantity: '41' -> '41' | customer_id: 'CUST017336' -> 'CUST017336'
2026-01-12 12:10:26,469 - dq_comparison - INFO - DEBUG HASH STRING: text with@at signs|TX00017336|2023-08-12|41|CUST017336...
2026-01-12 12:10:26,470 - dq_comparison - INFO - DEBUG HASH RESULT: 69cf5855...
2026-01-12 12:10:26,471 - dq_comparison - INFO - DEBUG HASH ROW: description: 'Text with`backticks' -> 'text with`backticks' | transaction_id: 'TX00074265' -> 'TX00074265' | transaction_date: '27-07-2023' -> '2023-07-27' | quantity: '15' -> '15' | customer_id: 'CUST074265' -> 'CUST074265'
2026-01-12 12:10:26,471 - dq_comparison - INFO - DEBUG HASH STRING: text with`backticks|TX00074265|2023-07-27|15|CUST074265...
2026-01-12 12:10:26,472 - dq_comparison - INFO - DEBUG HASH RESULT: 7002f525...
2026-01-12 12:10:26,473 - dq_comparison - INFO - DEBUG HASH ROW: description: 'Text with*asterisks' -> 'text with*asterisks' | transaction_id: 'TX00091489' -> 'TX00091489' | transaction_date: '22-11-2023' -> '2023-11-22' | quantity: '29' -> '29' | customer_id: 'CUST091489' -> 'CUST091489'
2026-01-12 12:10:26,473 - dq_comparison - INFO - DEBUG HASH STRING: text with*asterisks|TX00091489|2023-11-22|29|CUST091489...
2026-01-12 12:10:26,473 - dq_comparison - INFO - DEBUG HASH RESULT: 0d424460...
2026-01-12 12:10:26,474 - dq_comparison - INFO - DEBUG HASH ROW: description: 'Text with~tildes' -> 'text with~tildes' | transaction_id: 'TX00080338' -> 'TX00080338' | transaction_date: '25-04-2023' -> '2023-04-25' | quantity: '48' -> '48' | customer_id: 'CUST080338' -> 'CUST080338'
2026-01-12 12:10:26,475 - dq_comparison - INFO - DEBUG HASH STRING: text with~tildes|TX00080338|2023-04-25|48|CUST080338...
2026-01-12 12:10:26,476 - dq_comparison - INFO - DEBUG HASH RESULT: a67558fd...
2026-01-12 12:10:26,476 - dq_comparison - INFO - DEBUG HASH ROW: description: 'Text with
newlines' -> 'text with newlines' | transaction_id: 'TX00032077' -> 'TX00032077' | transaction_date: '15-03-2023' -> '2023-03-15' | quantity: '84' -> '84' | customer_id: 'CUST032077' -> 'CUST032077'
2026-01-12 12:10:26,477 - dq_comparison - INFO - DEBUG HASH STRING: text with newlines|TX00032077|2023-03-15|84|CUST032077...
2026-01-12 12:10:26,477 - dq_comparison - INFO - DEBUG HASH RESULT: 109539ca...
2026-01-12 12:10:26,478 - dq_comparison - INFO - DEBUG HASH ROW: description: 'Text with - dashes' -> 'text with - dashes' | transaction_id: 'TX00048403' -> 'TX00048403' | transaction_date: '07-05-2023' -> '2023-05-07' | quantity: '62' -> '62' | customer_id: 'CUST048403' -> 'CUST048403'
2026-01-12 12:10:26,478 - dq_comparison - INFO - DEBUG HASH STRING: text with - dashes|TX00048403|2023-05-07|62|CUST048403...
2026-01-12 12:10:26,479 - dq_comparison - INFO - DEBUG HASH RESULT: 594f02b9...
2026-01-12 12:10:26,480 - dq_comparison - INFO - DEBUG HASH ROW: description: 'Text with - dashes' -> 'text with - dashes' | transaction_id: 'TX00045077' -> 'TX00045077' | transaction_date: '15-05-2023' -> '2023-05-15' | quantity: '78' -> '78' | customer_id: 'CUST045077' -> 'CUST045077'
2026-01-12 12:10:26,480 - dq_comparison - INFO - DEBUG HASH STRING: text with - dashes|TX00045077|2023-05-15|78|CUST045077...
2026-01-12 12:10:26,481 - dq_comparison - INFO - DEBUG HASH RESULT: f4f3c288...
2026-01-12 12:10:26,482 - dq_comparison - INFO - DEBUG HASH ROW: description: 'Text with  multiple   spaces' -> 'text with multiple spaces' | transaction_id: 'TX00033237' -> 'TX00033237' | transaction_date: '08-06-2023' -> '2023-06-08' | quantity: '11' -> '11' | customer_id: 'CUST033237' -> 'CUST033237'
2026-01-12 12:10:26,482 - dq_comparison - INFO - DEBUG HASH STRING: text with multiple spaces|TX00033237|2023-06-08|11|CUST033237...
2026-01-12 12:10:26,483 - dq_comparison - INFO - DEBUG HASH RESULT: f8d110f8...
2026-01-12 12:10:26,483 - dq_comparison - INFO - DEBUG HASH ROW: description: 'Text with$dollar signs' -> 'text with$dollar signs' | transaction_id: 'TX00013013' -> 'TX00013013' | transaction_date: '08-09-2023' -> '2023-09-08' | quantity: '30' -> '30' | customer_id: 'CUST013013' -> 'CUST013013'
2026-01-12 12:10:26,484 - dq_comparison - INFO - DEBUG HASH STRING: text with$dollar signs|TX00013013|2023-09-08|30|CUST013013...
2026-01-12 12:10:26,484 - dq_comparison - INFO - DEBUG HASH RESULT: acf84e6c...
2026-01-12 12:10:26,485 - dq_comparison - INFO - DEBUG HASH ROW: description: 'Text with& ampersands' -> 'text with& ampersands' | transaction_id: 'TX00043189' -> 'TX00043189' | transaction_date: '08-07-2023' -> '2023-07-08' | quantity: '11' -> '11' | customer_id: 'CUST043189' -> 'CUST043189'
2026-01-12 12:10:26,486 - dq_comparison - INFO - DEBUG HASH STRING: text with& ampersands|TX00043189|2023-07-08|11|CUST043189...
2026-01-12 12:10:26,486 - dq_comparison - INFO - DEBUG HASH RESULT: 986ba56e...
2026-01-12 12:10:26,487 - dq_comparison - INFO - DEBUG HASH ROW: description: 'Text with(parentheses)' -> 'text with(parentheses)' | transaction_id: 'TX00026559' -> 'TX00026559' | transaction_date: '07-04-2023' -> '2023-04-07' | quantity: '84' -> '84' | customer_id: 'CUST026559' -> 'CUST026559'
2026-01-12 12:10:26,488 - dq_comparison - INFO - DEBUG HASH STRING: text with(parentheses)|TX00026559|2023-04-07|84|CUST026559...
2026-01-12 12:10:26,488 - dq_comparison - INFO - DEBUG HASH RESULT: 87bc1b39...
2026-01-12 12:10:26,489 - dq_comparison - INFO - DEBUG HASH ROW: description: 'Text with|pipes' -> 'text with|pipes' | transaction_id: 'TX00022484' -> 'TX00022484' | transaction_date: '01-05-2023' -> '2023-05-01' | quantity: '14' -> '14' | customer_id: 'CUST022484' -> 'CUST022484'
2026-01-12 12:10:26,490 - dq_comparison - INFO - DEBUG HASH STRING: text with|pipes|TX00022484|2023-05-01|14|CUST022484...
2026-01-12 12:10:26,490 - dq_comparison - INFO - DEBUG HASH RESULT: b67201b9...
2026-01-12 12:10:26,491 - dq_comparison - INFO - DEBUG HASH ROW: description: 'Normal text without issues' -> 'normal text without issues' | transaction_id: 'TX00015847' -> 'TX00015847' | transaction_date: '30-01-2023' -> '2023-01-30' | quantity: '93' -> '93' | customer_id: 'CUST015847' -> 'CUST015847'
2026-01-12 12:10:26,492 - dq_comparison - INFO - DEBUG HASH STRING: normal text without issues|TX00015847|2023-01-30|93|CUST015847...
2026-01-12 12:10:26,492 - dq_comparison - INFO - DEBUG HASH RESULT: 3b432c4d...
2026-01-12 12:10:26,493 - dq_comparison - INFO - DEBUG HASH ROW: description: 'Text with? questions' -> 'text with? questions' | transaction_id: 'TX00004258' -> 'TX00004258' | transaction_date: '28-08-2023' -> '2023-08-28' | quantity: '38' -> '38' | customer_id: 'CUST004258' -> 'CUST004258'
2026-01-12 12:10:26,494 - dq_comparison - INFO - DEBUG HASH STRING: text with? questions|TX00004258|2023-08-28|38|CUST004258...
2026-01-12 12:10:26,494 - dq_comparison - INFO - DEBUG HASH RESULT: b36087bd...
2026-01-12 12:10:26,495 - dq_comparison - INFO - DEBUG HASH ROW: description: 'Text with! exclamations' -> 'text with! exclamations' | transaction_id: 'TX00029313' -> 'TX00029313' | transaction_date: '29-11-2023' -> '2023-11-29' | quantity: '59' -> '59' | customer_id: 'CUST029313' -> 'CUST029313'
2026-01-12 12:10:26,496 - dq_comparison - INFO - DEBUG HASH STRING: text with! exclamations|TX00029313|2023-11-29|59|CUST029313...
2026-01-12 12:10:26,496 - dq_comparison - INFO - DEBUG HASH RESULT: c4341373...
2026-01-12 12:10:26,497 - dq_comparison - INFO - DEBUG HASH ROW: description: 'Text with(parentheses)' -> 'text with(parentheses)' | transaction_id: 'TX00049770' -> 'TX00049770' | transaction_date: '25-12-2023' -> '2023-12-25' | quantity: '52' -> '52' | customer_id: 'CUST049770' -> 'CUST049770'
2026-01-12 12:10:26,497 - dq_comparison - INFO - DEBUG HASH STRING: text with(parentheses)|TX00049770|2023-12-25|52|CUST049770...
2026-01-12 12:10:26,498 - dq_comparison - INFO - DEBUG HASH RESULT: 521f5093...
2026-01-12 12:10:26,499 - dq_comparison - INFO - DEBUG HASH ROW: description: 'Text with~tildes' -> 'text with~tildes' | transaction_id: 'TX00066847' -> 'TX00066847' | transaction_date: '11-09-2023' -> '2023-09-11' | quantity: '65' -> '65' | customer_id: 'CUST066847' -> 'CUST066847'
2026-01-12 12:10:26,499 - dq_comparison - INFO - DEBUG HASH STRING: text with~tildes|TX00066847|2023-09-11|65|CUST066847...
2026-01-12 12:10:26,500 - dq_comparison - INFO - DEBUG HASH RESULT: d7af7ad2...
2026-01-12 12:10:26,501 - dq_comparison - INFO - DEBUG HASH ROW: description: 'Text with{braces}' -> 'text with{braces}' | transaction_id: 'TX00005055' -> 'TX00005055' | transaction_date: '06-12-2023' -> '2023-12-06' | quantity: '57' -> '57' | customer_id: 'CUST005055' -> 'CUST005055'
2026-01-12 12:10:26,501 - dq_comparison - INFO - DEBUG HASH STRING: text with{braces}|TX00005055|2023-12-06|57|CUST005055...
2026-01-12 12:10:26,502 - dq_comparison - INFO - DEBUG HASH RESULT: 0f7bf8d6...
2026-01-12 12:10:26,502 - dq_comparison - INFO - DEBUG HASH ROW: description: 'Text with~tildes' -> 'text with~tildes' | transaction_id: 'TX00022290' -> 'TX00022290' | transaction_date: '19-01-2023' -> '2023-01-19' | quantity: '1' -> '1' | customer_id: 'CUST022290' -> 'CUST022290'
2026-01-12 12:10:26,503 - dq_comparison - INFO - DEBUG HASH STRING: text with~tildes|TX00022290|2023-01-19|1|CUST022290...
2026-01-12 12:10:26,504 - dq_comparison - INFO - DEBUG HASH RESULT: c7c2a88c...
2026-01-12 12:10:26,505 - dq_comparison - INFO - DEBUG HASH ROW: description: 'Text with"quotes"' -> 'text with"quotes"' | transaction_id: 'TX00068788' -> 'TX00068788' | transaction_date: '13-02-2023' -> '2023-02-13' | quantity: '14' -> '14' | customer_id: 'CUST068788' -> 'CUST068788'
2026-01-12 12:10:26,505 - dq_comparison - INFO - DEBUG HASH STRING: text with"quotes"|TX00068788|2023-02-13|14|CUST068788...
2026-01-12 12:10:26,505 - dq_comparison - INFO - DEBUG HASH RESULT: 264a32ce...
2026-01-12 12:10:26,507 - dq_comparison - INFO - DEBUG HASH ROW: description: '  Text with leading spaces' -> 'text with leading spaces' | transaction_id: 'TX00014282' -> 'TX00014282' | transaction_date: '31-05-2023' -> '2023-05-31' | quantity: '38' -> '38' | customer_id: 'CUST014282' -> 'CUST014282'
2026-01-12 12:10:26,507 - dq_comparison - INFO - DEBUG HASH STRING: text with leading spaces|TX00014282|2023-05-31|38|CUST014282...
2026-01-12 12:10:26,508 - dq_comparison - INFO - DEBUG HASH RESULT: 0737177c...
2026-01-12 12:10:26,509 - dq_comparison - INFO - DEBUG HASH ROW: description: 'Text with[brackets]' -> 'text with[brackets]' | transaction_id: 'TX00098813' -> 'TX00098813' | transaction_date: '28-03-2023' -> '2023-03-28' | quantity: '1' -> '1' | customer_id: 'CUST098813' -> 'CUST098813'
2026-01-12 12:10:26,509 - dq_comparison - INFO - DEBUG HASH STRING: text with[brackets]|TX00098813|2023-03-28|1|CUST098813...
2026-01-12 12:10:26,510 - dq_comparison - INFO - DEBUG HASH RESULT: a9ce4c89...
2026-01-12 12:10:26,511 - dq_comparison - INFO - DEBUG HASH ROW: description: 'Text with~tildes' -> 'text with~tildes' | transaction_id: 'TX00019645' -> 'TX00019645' | transaction_date: '22-09-2023' -> '2023-09-22' | quantity: '84' -> '84' | customer_id: 'CUST019645' -> 'CUST019645'
2026-01-12 12:10:26,511 - dq_comparison - INFO - DEBUG HASH STRING: text with~tildes|TX00019645|2023-09-22|84|CUST019645...
2026-01-12 12:10:26,512 - dq_comparison - INFO - DEBUG HASH RESULT: 3d5e7de3...
2026-01-12 12:10:26,513 - dq_comparison - INFO - DEBUG HASH ROW: description: 'Text with<angle brackets>' -> 'text with<angle brackets>' | transaction_id: 'TX00077594' -> 'TX00077594' | transaction_date: '10-11-2023' -> '2023-11-10' | quantity: '34' -> '34' | customer_id: 'CUST077594' -> 'CUST077594'
2026-01-12 12:10:26,513 - dq_comparison - INFO - DEBUG HASH STRING: text with<angle brackets>|TX00077594|2023-11-10|34|CUST077594...
2026-01-12 12:10:26,514 - dq_comparison - INFO - DEBUG HASH RESULT: 068d7e9e...
2026-01-12 12:10:26,514 - dq_comparison - INFO - DEBUG HASH ROW: description: 'Text with/slashes' -> 'text with/slashes' | transaction_id: 'TX00018372' -> 'TX00018372' | transaction_date: '19-08-2023' -> '2023-08-19' | quantity: '83' -> '83' | customer_id: 'CUST018372' -> 'CUST018372'
2026-01-12 12:10:26,515 - dq_comparison - INFO - DEBUG HASH STRING: text with/slashes|TX00018372|2023-08-19|83|CUST018372...
2026-01-12 12:10:26,515 - dq_comparison - INFO - DEBUG HASH RESULT: 3cb98f5f...
2026-01-12 12:10:26,516 - dq_comparison - INFO - DEBUG HASH ROW: description: 'Text with~tildes' -> 'text with~tildes' | transaction_id: 'TX00032549' -> 'TX00032549' | transaction_date: '17-05-2023' -> '2023-05-17' | quantity: '9' -> '9' | customer_id: 'CUST032549' -> 'CUST032549'
2026-01-12 12:10:26,517 - dq_comparison - INFO - DEBUG HASH STRING: text with~tildes|TX00032549|2023-05-17|9|CUST032549...
2026-01-12 12:10:26,517 - dq_comparison - INFO - DEBUG HASH RESULT: d320b448...
2026-01-12 12:10:26,518 - dq_comparison - INFO - DEBUG HASH ROW: description: 'Text with~tildes' -> 'text with~tildes' | transaction_id: 'TX00098717' -> 'TX00098717' | transaction_date: '11-09-2023' -> '2023-09-11' | quantity: '61' -> '61' | customer_id: 'CUST098717' -> 'CUST098717'
2026-01-12 12:10:26,519 - dq_comparison - INFO - DEBUG HASH STRING: text with~tildes|TX00098717|2023-09-11|61|CUST098717...
2026-01-12 12:10:26,519 - dq_comparison - INFO - DEBUG HASH RESULT: 831c381e...
2026-01-12 12:10:26,520 - dq_comparison - INFO - DEBUG HASH ROW: description: 'Text with  multiple   spaces' -> 'text with multiple spaces' | transaction_id: 'TX00067010' -> 'TX00067010' | transaction_date: '01-11-2023' -> '2023-11-01' | quantity: '1' -> '1' | customer_id: 'CUST067010' -> 'CUST067010'
2026-01-12 12:10:26,521 - dq_comparison - INFO - DEBUG HASH STRING: text with multiple spaces|TX00067010|2023-11-01|1|CUST067010...
2026-01-12 12:10:26,521 - dq_comparison - INFO - DEBUG HASH RESULT: 497deef8...
2026-01-12 12:10:26,522 - dq_comparison - INFO - DEBUG HASH ROW: description: 'Text with mixed CAPITAL and lowercase' -> 'text with mixed capital and lowercase' | transaction_id: 'TX00008759' -> 'TX00008759' | transaction_date: '25-07-2023' -> '2023-07-25' | quantity: '77' -> '77' | customer_id: 'CUST008759' -> 'CUST008759'
2026-01-12 12:10:26,522 - dq_comparison - INFO - DEBUG HASH STRING: text with mixed capital and lowercase|TX00008759|2023-07-25|77|CUST008759...
2026-01-12 12:10:26,523 - dq_comparison - INFO - DEBUG HASH RESULT: 392fc2a0...
2026-01-12 12:10:26,524 - dq_comparison - INFO - DEBUG HASH ROW: description: 'Text with_underscores' -> 'text with_underscores' | transaction_id: 'TX00056417' -> 'TX00056417' | transaction_date: '05-05-2023' -> '2023-05-05' | quantity: '56' -> '56' | customer_id: 'CUST056417' -> 'CUST056417'
2026-01-12 12:10:26,524 - dq_comparison - INFO - DEBUG HASH STRING: text with_underscores|TX00056417|2023-05-05|56|CUST056417...
2026-01-12 12:10:26,525 - dq_comparison - INFO - DEBUG HASH RESULT: 4959a080...
2026-01-12 12:10:26,526 - dq_comparison - INFO - DEBUG HASH ROW: description: 'Text with"quotes"' -> 'text with"quotes"' | transaction_id: 'TX00075938' -> 'TX00075938' | transaction_date: '23-05-2023' -> '2023-05-23' | quantity: '20' -> '20' | customer_id: 'CUST075938' -> 'CUST075938'
2026-01-12 12:10:26,526 - dq_comparison - INFO - DEBUG HASH STRING: text with"quotes"|TX00075938|2023-05-23|20|CUST075938...
2026-01-12 12:10:26,527 - dq_comparison - INFO - DEBUG HASH RESULT: dad20723...
2026-01-12 12:10:26,528 - dq_comparison - INFO - DEBUG HASH ROW: description: 'Text with'apostrophes' -> 'text with'apostrophes' | transaction_id: 'TX00023708' -> 'TX00023708' | transaction_date: '15-01-2023' -> '2023-01-15' | quantity: '30' -> '30' | customer_id: 'CUST023708' -> 'CUST023708'
