2026-01-09 18:22:27,222 - __main__ - INFO - 🌐 API Server Logging Initialized
2026-01-09 18:22:27,224 - __main__ - INFO - 📝 Logs saved to: logs/dq_api_20260109_182227.log
2026-01-09 18:22:27,271 - __main__ - INFO - APP_SETTINGS loaded. Audit enabled: True
2026-01-09 18:22:27,271 - __main__ - INFO - ✅ All DQ modules loaded successfully
2026-01-09 18:22:27,274 - dq_error_log - INFO - ErrorLogger initialized with database: dq_checks
2026-01-09 18:22:27,274 - dq_audit - INFO - Audit class initialized with database: dq_checks
2026-01-09 18:22:27,275 - __main__ - INFO - ✅ ErrorLogger and DataQualityAudit initialized
2026-01-09 18:22:27,281 - __main__ - INFO - 🚀 Starting Data Quality Framework API
2026-01-09 18:22:27,282 - __main__ - INFO - 📊 Modules available: True
2026-01-09 18:22:27,282 - __main__ - INFO - 🔧 Config file mode: False
2026-01-09 18:22:27,283 - __main__ - INFO - 📋 Available endpoints:
2026-01-09 18:22:27,284 - __main__ - INFO -   GET  /              - API status
2026-01-09 18:22:27,284 - __main__ - INFO -   GET  /api/health    - Health check
2026-01-09 18:22:27,284 - __main__ - INFO -   POST /api/check-single - Single source analysis
2026-01-09 18:22:27,285 - __main__ - INFO -   POST /api/compare   - Source-target comparison
2026-01-09 18:22:27,286 - __main__ - INFO -   POST /api/upload    - File upload
2026-01-09 18:22:27,286 - __main__ - INFO -   GET  /api/sessions  - List sessions
2026-01-09 18:22:27,287 - __main__ - INFO -   GET  /api/sessions/<id> - Get session data
2026-01-09 18:22:27,287 - __main__ - INFO -   GET  /api/debug-db  - Database debug
2026-01-09 18:22:27,288 - __main__ - INFO - 🌍 Server starting on 0.0.0.0:5000 (debug=False)
2026-01-09 18:22:43,305 - __main__ - INFO - POST /api/compare - Request started
2026-01-09 18:22:43,308 - __main__ - INFO - Comparison request - Source: csv, Target: excel
2026-01-09 18:22:43,309 - __main__ - INFO - Comparison analysis request received
2026-01-09 18:22:43,312 - __main__ - INFO - DEBUG source_data from nested: {'source_type': 'csv', 'source_file_path': 'C:\\\\Users\\\\003160\\\\OneDrive - wisseninfotech.com\\\\Documents\\\\DQ-Checks-Shashi\\\\API_Test_Scrips\\\\sorce-target\\\\test_target.csv'}
2026-01-09 18:22:43,313 - __main__ - INFO - Starting comparison for session CMP_20260109_182243
2026-01-09 18:22:43,315 - dq_comparison - INFO - Starting comparison analysis in UI mode
2026-01-09 18:22:43,316 - dq_comparison - INFO - LOADING SOURCE AND TARGET DATA
2026-01-09 18:22:43,317 - dq_comparison - INFO - 
==================================================
2026-01-09 18:22:43,318 - dq_comparison - INFO - 🔗 SOURCE DATA CONFIGURATION
2026-01-09 18:22:43,319 - dq_comparison - INFO - ==================================================
2026-01-09 18:22:43,320 - dq_comparison - INFO - DEBUG load_csv_source called for SOURCE
2026-01-09 18:22:43,322 - dq_comparison - INFO - DEBUG: Using file_path from 'file_path': C:\\Users\\003160\\OneDrive - wisseninfotech.com\\Documents\\DQ-Checks-Shashi\\API_Test_Scrips\\sorce-target\\test_target.csv
2026-01-09 18:22:43,335 - dq_comparison - INFO - SOURCE CSV loaded: 50 rows, 8 columns
2026-01-09 18:22:43,337 - dq_comparison - INFO - 
==================================================
2026-01-09 18:22:43,337 - dq_comparison - INFO - 🔗 TARGET DATA CONFIGURATION
2026-01-09 18:22:43,338 - dq_comparison - INFO - ==================================================
2026-01-09 18:22:43,339 - dq_comparison - INFO - DEBUG load_excel_source called for TARGET
2026-01-09 18:22:43,340 - dq_comparison - INFO - DEBUG ui_data: {'source_type': 'excel', 'target_file_path': 'C:\\\\Users\\\\003160\\\\OneDrive - wisseninfotech.com\\\\Documents\\\\DQ-Checks-Shashi\\\\API_Test_Scrips\\\\sorce-target\\\\test_source.xlsx'}
2026-01-09 18:22:43,341 - dq_comparison - INFO - DEBUG ui_data type: <class 'dict'>
2026-01-09 18:22:43,342 - dq_comparison - INFO - DEBUG Found target_file_path in ui_data: C:\\Users\\003160\\OneDrive - wisseninfotech.com\\Documents\\DQ-Checks-Shashi\\API_Test_Scrips\\sorce-target\\test_source.xlsx
2026-01-09 18:22:44,381 - dq_comparison - INFO - TARGET Excel loaded: 50 rows, 8 columns
2026-01-09 18:22:44,381 - dq_comparison - INFO - Source data loaded: 50 rows, 8 columns
2026-01-09 18:22:44,382 - dq_comparison - INFO - Target data loaded: 50 rows, 8 columns
2026-01-09 18:22:44,382 - dq_comparison - INFO - SELECTING COLUMNS FOR COMPARISON
2026-01-09 18:22:44,383 - dq_comparison - INFO - Source columns (original): ['CustomerID', 'FirstName', 'LastName', 'PhoneNumber', 'Email', 'Salary', 'JoinDate', 'Address']
2026-01-09 18:22:44,384 - dq_comparison - INFO - Target columns (original): ['CustomerID', 'FirstName', 'LastName', 'PhoneNumber', 'Email', 'Salary', 'JoinDate', 'Address']
2026-01-09 18:22:44,384 - dq_comparison - INFO - Common columns lowercased: ['customerid', 'joindate', 'phonenumber', 'email', 'salary', 'firstname', 'address', 'lastname']
2026-01-09 18:22:44,385 - dq_comparison - INFO - Found 8 common columns between source and target (case-insensitive)
2026-01-09 18:22:44,385 - dq_comparison - INFO - User column selection input: all
2026-01-09 18:22:44,386 - dq_comparison - INFO - User selected ALL common columns for comparison
2026-01-09 18:22:44,387 - dq_comparison - INFO - Selected 8 columns for comparison: ['CustomerID', 'JoinDate', 'PhoneNumber', 'Email', 'Salary']...
2026-01-09 18:22:44,387 - dq_comparison - INFO - GENERATING COMPREHENSIVE COMPARISON REPORT
2026-01-09 18:22:44,387 - dq_comparison - INFO - Report details - Source: CSV: test_target.csv, Target: Excel: test_source.xlsx (Sheet1), Selected columns: 8
2026-01-09 18:22:44,388 - dq_comparison - INFO - Initializing Error Logger...
2026-01-09 18:22:44,388 - dq_error_log - INFO - ErrorLogger initialized with database: dq_checks
2026-01-09 18:22:44,507 - dq_error_log - INFO - Database connection successful
2026-01-09 18:22:44,508 - dq_comparison - INFO - Session ID: CMP_20260109_182244
2026-01-09 18:22:44,509 - dq_comparison - INFO - ✅ Row counts match: 50 rows
2026-01-09 18:22:44,509 - dq_comparison - INFO - Comparing column structures...
2026-01-09 18:22:44,510 - dq_comparison - WARNING - Found 1 incompatible data type mismatches
2026-01-09 18:22:44,511 - dq_comparison - INFO - Column structure comparison complete. Match: False
2026-01-09 18:22:44,524 - dq_comparison - INFO - Validating primary key/unique fields...
2026-01-09 18:22:44,525 - dq_comparison - INFO - Checking key fields: ['CustomerID', 'CustomerID']
2026-01-09 18:22:44,527 - dq_comparison - INFO - Primary key validation complete. Passed: True
2026-01-09 18:22:44,528 - dq_comparison - INFO - Comparing table-level metadata...
2026-01-09 18:22:44,538 - dq_comparison - INFO - Table metadata comparison complete. Match: True
2026-01-09 18:22:44,539 - dq_comparison - INFO - SECOND CHECK: HASH-BASED COMPARISON WITH PERFECT NORMALIZATION
2026-01-09 18:22:44,561 - dq_comparison - INFO - === DEBUG: DATA TYPE CHECK ===
2026-01-09 18:22:44,562 - dq_comparison - INFO - Column: CustomerID
2026-01-09 18:22:44,562 - dq_comparison - INFO -   Source type: <class 'numpy.int64'>, value: 1
2026-01-09 18:22:44,563 - dq_comparison - INFO -   Target type: <class 'numpy.int64'>, value: 1
2026-01-09 18:22:44,564 - dq_comparison - INFO -   Normalized: '1' vs '1'
2026-01-09 18:22:44,565 - dq_comparison - INFO -   Match: True
2026-01-09 18:22:44,566 - dq_comparison - INFO - Column: JoinDate
2026-01-09 18:22:44,567 - dq_comparison - INFO -   Source type: <class 'str'>, value: 26-10-2025
2026-01-09 18:22:44,568 - dq_comparison - INFO -   Target type: <class 'pandas._libs.tslibs.timestamps.Timestamp'>, value: 2025-10-26 00:00:00
2026-01-09 18:22:44,571 - dq_comparison - INFO -   Normalized: '2025-10-26' vs '2025-10-26'
2026-01-09 18:22:44,573 - dq_comparison - INFO -   Match: True
2026-01-09 18:22:44,574 - dq_comparison - INFO - Column: PhoneNumber
2026-01-09 18:22:44,575 - dq_comparison - INFO -   Source type: <class 'numpy.int64'>, value: -6089
2026-01-09 18:22:44,575 - dq_comparison - INFO -   Target type: <class 'str'>, value: +1-486-229-5375
2026-01-09 18:22:44,576 - dq_comparison - INFO -   Normalized: '6089' vs '14862295375'
2026-01-09 18:22:44,577 - dq_comparison - INFO -   Match: False
2026-01-09 18:22:44,577 - dq_comparison - INFO - Source DF columns: ['CustomerID', 'FirstName', 'LastName', 'PhoneNumber', 'Email', 'Salary', 'JoinDate', 'Address']
2026-01-09 18:22:44,578 - dq_comparison - INFO - Target DF columns: ['CustomerID', 'FirstName', 'LastName', 'PhoneNumber', 'Email', 'Salary', 'JoinDate', 'Address']
2026-01-09 18:22:44,578 - dq_comparison - INFO - Selected columns for comparison: ['CustomerID', 'JoinDate', 'PhoneNumber', 'Email', 'Salary', 'FirstName', 'Address', 'LastName']
2026-01-09 18:22:44,579 - dq_comparison - INFO - Using 8 common columns for hash comparison
2026-01-09 18:22:44,579 - dq_comparison - INFO - Source columns: ['CustomerID', 'JoinDate', 'PhoneNumber', 'Email', 'Salary', 'FirstName', 'Address', 'LastName']
2026-01-09 18:22:44,581 - dq_comparison - INFO - Target columns: ['CustomerID', 'JoinDate', 'PhoneNumber', 'Email', 'Salary', 'FirstName', 'Address', 'LastName']
2026-01-09 18:22:44,581 - dq_comparison - INFO - Generating hashes for source data (50 rows)...
2026-01-09 18:22:44,583 - dq_comparison - INFO - DEBUG HASH ROW: CustomerID: '1' -> '1' | JoinDate: '26-10-2025' -> '2025-10-26' | PhoneNumber: '-6089' -> '6089' | Email: 'mark.morris@example.com' -> 'mark.morris@example.com' | Salary: '111916' -> '111916'
2026-01-09 18:22:44,584 - dq_comparison - INFO - DEBUG HASH STRING: 1|2025-10-26|6089|mark.morris@example.com|111916...
2026-01-09 18:22:44,585 - dq_comparison - INFO - DEBUG HASH RESULT: 082157c4...
2026-01-09 18:22:44,585 - dq_comparison - INFO - DEBUG HASH ROW: CustomerID: '2' -> '2' | JoinDate: '31-05-2025' -> '2025-05-31' | PhoneNumber: '-3294' -> '3294' | Email: 'dennis.owens@example.com' -> 'dennis.owens@example.com' | Salary: '39264' -> '39264'
2026-01-09 18:22:44,586 - dq_comparison - INFO - DEBUG HASH STRING: 2|2025-05-31|3294|dennis.owens@example.com|39264...
2026-01-09 18:22:44,586 - dq_comparison - INFO - DEBUG HASH RESULT: 14f087fc...
2026-01-09 18:22:44,587 - dq_comparison - INFO - DEBUG HASH ROW: CustomerID: '3' -> '3' | JoinDate: '31-03-2024' -> '2024-03-31' | PhoneNumber: '-10861' -> '10861' | Email: 'felicia.hatfield@example.com' -> 'felicia.hatfield@example.com' | Salary: '41191' -> '41191'
2026-01-09 18:22:44,588 - dq_comparison - INFO - DEBUG HASH STRING: 3|2024-03-31|10861|felicia.hatfield@example.com|41191...
2026-01-09 18:22:44,589 - dq_comparison - INFO - DEBUG HASH RESULT: ece840e3...
2026-01-09 18:22:44,590 - dq_comparison - INFO - DEBUG HASH ROW: CustomerID: '4' -> '4' | JoinDate: '19-12-2023' -> '2023-12-19' | PhoneNumber: '-10469' -> '10469' | Email: 'michael.jenkins@example.com' -> 'michael.jenkins@example.com' | Salary: '116934' -> '116934'
2026-01-09 18:22:44,591 - dq_comparison - INFO - DEBUG HASH STRING: 4|2023-12-19|10469|michael.jenkins@example.com|116934...
2026-01-09 18:22:44,591 - dq_comparison - INFO - DEBUG HASH RESULT: c8c7cbf8...
2026-01-09 18:22:44,592 - dq_comparison - INFO - DEBUG HASH ROW: CustomerID: '5' -> '5' | JoinDate: '23-01-2025' -> '2025-01-23' | PhoneNumber: '-6209' -> '6209' | Email: 'nicholas.smith@example.com' -> 'nicholas.smith@example.com' | Salary: '46558' -> '46558'
2026-01-09 18:22:44,592 - dq_comparison - INFO - DEBUG HASH STRING: 5|2025-01-23|6209|nicholas.smith@example.com|46558...
2026-01-09 18:22:44,593 - dq_comparison - INFO - DEBUG HASH RESULT: f6f32116...
2026-01-09 18:22:44,594 - dq_comparison - INFO - DEBUG HASH ROW: CustomerID: '6' -> '6' | JoinDate: '18-12-2022' -> '2022-12-18' | PhoneNumber: '-5301' -> '5301' | Email: 'joseph.guerra@example.com' -> 'joseph.guerra@example.com' | Salary: '79928' -> '79928'
2026-01-09 18:22:44,594 - dq_comparison - INFO - DEBUG HASH STRING: 6|2022-12-18|5301|joseph.guerra@example.com|79928...
2026-01-09 18:22:44,595 - dq_comparison - INFO - DEBUG HASH RESULT: 22653e49...
2026-01-09 18:22:44,597 - dq_comparison - INFO - DEBUG HASH ROW: CustomerID: '7' -> '7' | JoinDate: '19-11-2025' -> '2025-11-19' | PhoneNumber: '-3679' -> '3679' | Email: 'gabrielle.bell@example.com' -> 'gabrielle.bell@example.com' | Salary: '85292' -> '85292'
2026-01-09 18:22:44,597 - dq_comparison - INFO - DEBUG HASH STRING: 7|2025-11-19|3679|gabrielle.bell@example.com|85292...
2026-01-09 18:22:44,598 - dq_comparison - INFO - DEBUG HASH RESULT: e6763063...
2026-01-09 18:22:44,599 - dq_comparison - INFO - DEBUG HASH ROW: CustomerID: '8' -> '8' | JoinDate: '16-07-2021' -> '2021-07-16' | PhoneNumber: '-9013' -> '9013' | Email: 'joel.barber@example.com' -> 'joel.barber@example.com' | Salary: '50803' -> '50803'
2026-01-09 18:22:44,599 - dq_comparison - INFO - DEBUG HASH STRING: 8|2021-07-16|9013|joel.barber@example.com|50803...
2026-01-09 18:22:44,600 - dq_comparison - INFO - DEBUG HASH RESULT: 4f4aa187...
2026-01-09 18:22:44,601 - dq_comparison - INFO - DEBUG HASH ROW: CustomerID: '9' -> '9' | JoinDate: '29-03-2022' -> '2022-03-29' | PhoneNumber: '-2926' -> '2926' | Email: 'autumn.flores@example.com' -> 'autumn.flores@example.com' | Salary: '84264' -> '84264'
2026-01-09 18:22:44,602 - dq_comparison - INFO - DEBUG HASH STRING: 9|2022-03-29|2926|autumn.flores@example.com|84264...
2026-01-09 18:22:44,602 - dq_comparison - INFO - DEBUG HASH RESULT: 0dc70d4e...
2026-01-09 18:22:44,603 - dq_comparison - INFO - DEBUG HASH ROW: CustomerID: '10' -> '10' | JoinDate: '24-04-2025' -> '2025-04-24' | PhoneNumber: '-6066' -> '6066' | Email: 'jared.andrews@example.com' -> 'jared.andrews@example.com' | Salary: '119153' -> '119153'
2026-01-09 18:22:44,604 - dq_comparison - INFO - DEBUG HASH STRING: 10|2025-04-24|6066|jared.andrews@example.com|119153...
2026-01-09 18:22:44,605 - dq_comparison - INFO - DEBUG HASH RESULT: 1a7952c5...
2026-01-09 18:22:44,606 - dq_comparison - INFO - DEBUG HASH ROW: CustomerID: '11' -> '11' | JoinDate: '15-06-2022' -> '2022-06-15' | PhoneNumber: '-8404' -> '8404' | Email: 'jason.kim@example.com' -> 'jason.kim@example.com' | Salary: '39331' -> '39331'
2026-01-09 18:22:44,607 - dq_comparison - INFO - DEBUG HASH STRING: 11|2022-06-15|8404|jason.kim@example.com|39331...
2026-01-09 18:22:44,608 - dq_comparison - INFO - DEBUG HASH RESULT: 7b21a36b...
2026-01-09 18:22:44,608 - dq_comparison - INFO - DEBUG HASH ROW: CustomerID: '12' -> '12' | JoinDate: '07-04-2025' -> '2025-04-07' | PhoneNumber: '-6989' -> '6989' | Email: 'ryan.barton@example.com' -> 'ryan.barton@example.com' | Salary: '48099' -> '48099'
2026-01-09 18:22:44,609 - dq_comparison - INFO - DEBUG HASH STRING: 12|2025-04-07|6989|ryan.barton@example.com|48099...
2026-01-09 18:22:44,610 - dq_comparison - INFO - DEBUG HASH RESULT: b4eb56c4...
2026-01-09 18:22:44,611 - dq_comparison - INFO - DEBUG HASH ROW: CustomerID: '13' -> '13' | JoinDate: '11-11-2023' -> '2023-11-11' | PhoneNumber: '-2739' -> '2739' | Email: 'michael.williams@example.com' -> 'michael.williams@example.com' | Salary: '95775' -> '95775'
2026-01-09 18:22:44,611 - dq_comparison - INFO - DEBUG HASH STRING: 13|2023-11-11|2739|michael.williams@example.com|95775...
2026-01-09 18:22:44,611 - dq_comparison - INFO - DEBUG HASH RESULT: b99c6a16...
2026-01-09 18:22:44,612 - dq_comparison - INFO - DEBUG HASH ROW: CustomerID: '14' -> '14' | JoinDate: '16-02-2025' -> '2025-02-16' | PhoneNumber: '-5970' -> '5970' | Email: 'jennifer.white@example.com' -> 'jennifer.white@example.com' | Salary: '83452' -> '83452'
2026-01-09 18:22:44,613 - dq_comparison - INFO - DEBUG HASH STRING: 14|2025-02-16|5970|jennifer.white@example.com|83452...
2026-01-09 18:22:44,614 - dq_comparison - INFO - DEBUG HASH RESULT: 737cdfda...
2026-01-09 18:22:44,614 - dq_comparison - INFO - DEBUG HASH ROW: CustomerID: '15' -> '15' | JoinDate: '21-05-2024' -> '2024-05-21' | PhoneNumber: '-3211' -> '3211' | Email: 'shawn.park@example.com' -> 'shawn.park@example.com' | Salary: '98946' -> '98946'
2026-01-09 18:22:44,615 - dq_comparison - INFO - DEBUG HASH STRING: 15|2024-05-21|3211|shawn.park@example.com|98946...
2026-01-09 18:22:44,616 - dq_comparison - INFO - DEBUG HASH RESULT: 86fd0996...
2026-01-09 18:22:44,618 - dq_comparison - INFO - DEBUG HASH ROW: CustomerID: '16' -> '16' | JoinDate: '09-02-2024' -> '2024-02-09' | PhoneNumber: '-6509' -> '6509' | Email: 'jill.robertson@example.com' -> 'jill.robertson@example.com' | Salary: '49573' -> '49573'
2026-01-09 18:22:44,618 - dq_comparison - INFO - DEBUG HASH STRING: 16|2024-02-09|6509|jill.robertson@example.com|49573...
2026-01-09 18:22:44,618 - dq_comparison - INFO - DEBUG HASH RESULT: 52820bbe...
2026-01-09 18:22:44,619 - dq_comparison - INFO - DEBUG HASH ROW: CustomerID: '17' -> '17' | JoinDate: '04-07-2025' -> '2025-07-04' | PhoneNumber: '-6587' -> '6587' | Email: 'robert.lyons@example.com' -> 'robert.lyons@example.com' | Salary: '36536' -> '36536'
2026-01-09 18:22:44,620 - dq_comparison - INFO - DEBUG HASH STRING: 17|2025-07-04|6587|robert.lyons@example.com|36536...
2026-01-09 18:22:44,621 - dq_comparison - INFO - DEBUG HASH RESULT: e17267b1...
2026-01-09 18:22:44,621 - dq_comparison - INFO - DEBUG HASH ROW: CustomerID: '18' -> '18' | JoinDate: '09-01-2023' -> '2023-01-09' | PhoneNumber: '-7685' -> '7685' | Email: 'jacob.acevedo@example.com' -> 'jacob.acevedo@example.com' | Salary: '34641' -> '34641'
2026-01-09 18:22:44,622 - dq_comparison - INFO - DEBUG HASH STRING: 18|2023-01-09|7685|jacob.acevedo@example.com|34641...
2026-01-09 18:22:44,623 - dq_comparison - INFO - DEBUG HASH RESULT: 13192c33...
2026-01-09 18:22:44,623 - dq_comparison - INFO - DEBUG HASH ROW: CustomerID: '19' -> '19' | JoinDate: '22-09-2023' -> '2023-09-22' | PhoneNumber: '-10790' -> '10790' | Email: 'christina.park@example.com' -> 'christina.park@example.com' | Salary: '106994' -> '106994'
2026-01-09 18:22:44,624 - dq_comparison - INFO - DEBUG HASH STRING: 19|2023-09-22|10790|christina.park@example.com|106994...
2026-01-09 18:22:44,624 - dq_comparison - INFO - DEBUG HASH RESULT: 6b22accc...
2026-01-09 18:22:44,625 - dq_comparison - INFO - DEBUG HASH ROW: CustomerID: '20' -> '20' | JoinDate: '22-04-2023' -> '2023-04-22' | PhoneNumber: '-5015' -> '5015' | Email: 'barbara.morgan@example.com' -> 'barbara.morgan@example.com' | Salary: '38187' -> '38187'
2026-01-09 18:22:44,626 - dq_comparison - INFO - DEBUG HASH STRING: 20|2023-04-22|5015|barbara.morgan@example.com|38187...
2026-01-09 18:22:44,627 - dq_comparison - INFO - DEBUG HASH RESULT: e6653a34...
2026-01-09 18:22:44,628 - dq_comparison - INFO - DEBUG HASH ROW: CustomerID: '21' -> '21' | JoinDate: '22-07-2024' -> '2024-07-22' | PhoneNumber: '403564312' -> '403564312' | Email: 'april.lee@example.com' -> 'april.lee@example.com' | Salary: '71935' -> '71935'
2026-01-09 18:22:44,628 - dq_comparison - INFO - DEBUG HASH STRING: 21|2024-07-22|403564312|april.lee@example.com|71935...
2026-01-09 18:22:44,629 - dq_comparison - INFO - DEBUG HASH RESULT: d562ba0e...
2026-01-09 18:22:44,630 - dq_comparison - INFO - DEBUG HASH ROW: CustomerID: '22' -> '22' | JoinDate: '27-07-2025' -> '2025-07-27' | PhoneNumber: '596727654' -> '596727654' | Email: 'christina.morrison@example.com' -> 'christina.morrison@example.com' | Salary: '100357' -> '100357'
2026-01-09 18:22:44,631 - dq_comparison - INFO - DEBUG HASH STRING: 22|2025-07-27|596727654|christina.morrison@example.com|100357...
2026-01-09 18:22:44,631 - dq_comparison - INFO - DEBUG HASH RESULT: aa691506...
2026-01-09 18:22:44,632 - dq_comparison - INFO - DEBUG HASH ROW: CustomerID: '23' -> '23' | JoinDate: '27-10-2023' -> '2023-10-27' | PhoneNumber: '669882738' -> '669882738' | Email: 'jennifer.morgan@example.com' -> 'jennifer.morgan@example.com' | Salary: '74962' -> '74962'
2026-01-09 18:22:44,633 - dq_comparison - INFO - DEBUG HASH STRING: 23|2023-10-27|669882738|jennifer.morgan@example.com|74962...
2026-01-09 18:22:44,634 - dq_comparison - INFO - DEBUG HASH RESULT: c033cdce...
2026-01-09 18:22:44,635 - dq_comparison - INFO - DEBUG HASH ROW: CustomerID: '24' -> '24' | JoinDate: '20-01-2021' -> '2021-01-20' | PhoneNumber: '706194796' -> '706194796' | Email: 'david.duran@example.com' -> 'david.duran@example.com' | Salary: '98121' -> '98121'
2026-01-09 18:22:44,636 - dq_comparison - INFO - DEBUG HASH STRING: 24|2021-01-20|706194796|david.duran@example.com|98121...
2026-01-09 18:22:44,636 - dq_comparison - INFO - DEBUG HASH RESULT: 51890584...
2026-01-09 18:22:44,637 - dq_comparison - INFO - DEBUG HASH ROW: CustomerID: '25' -> '25' | JoinDate: '30-12-2021' -> '2021-12-30' | PhoneNumber: '971341309' -> '971341309' | Email: 'jordan.wood@example.com' -> 'jordan.wood@example.com' | Salary: '45422' -> '45422'
2026-01-09 18:22:44,638 - dq_comparison - INFO - DEBUG HASH STRING: 25|2021-12-30|971341309|jordan.wood@example.com|45422...
2026-01-09 18:22:44,640 - dq_comparison - INFO - DEBUG HASH RESULT: fa6c3863...
2026-01-09 18:22:44,641 - dq_comparison - INFO - DEBUG HASH ROW: CustomerID: '26' -> '26' | JoinDate: '16-01-2024' -> '2024-01-16' | PhoneNumber: '899898226' -> '899898226' | Email: 'jeffrey.freeman@example.com' -> 'jeffrey.freeman@example.com' | Salary: '111634' -> '111634'
2026-01-09 18:22:44,641 - dq_comparison - INFO - DEBUG HASH STRING: 26|2024-01-16|899898226|jeffrey.freeman@example.com|111634...
2026-01-09 18:22:44,642 - dq_comparison - INFO - DEBUG HASH RESULT: a44cca1a...
2026-01-09 18:22:44,643 - dq_comparison - INFO - DEBUG HASH ROW: CustomerID: '27' -> '27' | JoinDate: '01-01-2024' -> '2024-01-01' | PhoneNumber: '622773601' -> '622773601' | Email: 'elizabeth.wright@example.com' -> 'elizabeth.wright@example.com' | Salary: '99097' -> '99097'
2026-01-09 18:22:44,644 - dq_comparison - INFO - DEBUG HASH STRING: 27|2024-01-01|622773601|elizabeth.wright@example.com|99097...
2026-01-09 18:22:44,644 - dq_comparison - INFO - DEBUG HASH RESULT: 317624fe...
2026-01-09 18:22:44,645 - dq_comparison - INFO - DEBUG HASH ROW: CustomerID: '28' -> '28' | JoinDate: '03-11-2024' -> '2024-11-03' | PhoneNumber: '399227427' -> '399227427' | Email: 'martin.reed@example.com' -> 'martin.reed@example.com' | Salary: '114429' -> '114429'
2026-01-09 18:22:44,646 - dq_comparison - INFO - DEBUG HASH STRING: 28|2024-11-03|399227427|martin.reed@example.com|114429...
2026-01-09 18:22:44,646 - dq_comparison - INFO - DEBUG HASH RESULT: 11816455...
2026-01-09 18:22:44,647 - dq_comparison - INFO - DEBUG HASH ROW: CustomerID: '29' -> '29' | JoinDate: '02-06-2022' -> '2022-06-02' | PhoneNumber: '219444645' -> '219444645' | Email: 'elizabeth.lane@example.com' -> 'elizabeth.lane@example.com' | Salary: '93270' -> '93270'
2026-01-09 18:22:44,648 - dq_comparison - INFO - DEBUG HASH STRING: 29|2022-06-02|219444645|elizabeth.lane@example.com|93270...
2026-01-09 18:22:44,649 - dq_comparison - INFO - DEBUG HASH RESULT: a21e6b72...
2026-01-09 18:22:44,649 - dq_comparison - INFO - DEBUG HASH ROW: CustomerID: '30' -> '30' | JoinDate: '21-09-2025' -> '2025-09-21' | PhoneNumber: '195605788' -> '195605788' | Email: 'michael.jordan@example.com' -> 'michael.jordan@example.com' | Salary: '76901' -> '76901'
2026-01-09 18:22:44,650 - dq_comparison - INFO - DEBUG HASH STRING: 30|2025-09-21|195605788|michael.jordan@example.com|76901...
2026-01-09 18:22:44,650 - dq_comparison - INFO - DEBUG HASH RESULT: f7c770bd...
2026-01-09 18:22:44,651 - dq_comparison - INFO - DEBUG HASH ROW: CustomerID: '31' -> '31' | JoinDate: '19-10-2024' -> '2024-10-19' | PhoneNumber: '-10910' -> '10910' | Email: 'edward.ramirez@example.com' -> 'edward.ramirez@example.com' | Salary: '40447' -> '40447'
2026-01-09 18:22:44,652 - dq_comparison - INFO - DEBUG HASH STRING: 31|2024-10-19|10910|edward.ramirez@example.com|40447...
2026-01-09 18:22:44,652 - dq_comparison - INFO - DEBUG HASH RESULT: 09f4c420...
2026-01-09 18:22:44,654 - dq_comparison - INFO - DEBUG HASH ROW: CustomerID: '32' -> '32' | JoinDate: '05-09-2024' -> '2024-09-05' | PhoneNumber: '-7479' -> '7479' | Email: 'linda.melendez@example.com' -> 'linda.melendez@example.com' | Salary: '117596' -> '117596'
2026-01-09 18:22:44,655 - dq_comparison - INFO - DEBUG HASH STRING: 32|2024-09-05|7479|linda.melendez@example.com|117596...
2026-01-09 18:22:44,656 - dq_comparison - INFO - DEBUG HASH RESULT: 1e2b5758...
2026-01-09 18:22:44,656 - dq_comparison - INFO - DEBUG HASH ROW: CustomerID: '33' -> '33' | JoinDate: '08-08-2025' -> '2025-08-08' | PhoneNumber: '-3980' -> '3980' | Email: 'douglas.smith@example.com' -> 'douglas.smith@example.com' | Salary: '44106' -> '44106'
2026-01-09 18:22:44,657 - dq_comparison - INFO - DEBUG HASH STRING: 33|2025-08-08|3980|douglas.smith@example.com|44106...
2026-01-09 18:22:44,658 - dq_comparison - INFO - DEBUG HASH RESULT: d39cefad...
2026-01-09 18:22:44,660 - dq_comparison - INFO - DEBUG HASH ROW: CustomerID: '34' -> '34' | JoinDate: '30-07-2021' -> '2021-07-30' | PhoneNumber: '-9634' -> '9634' | Email: 'nathaniel.white@example.com' -> 'nathaniel.white@example.com' | Salary: '85426' -> '85426'
2026-01-09 18:22:44,660 - dq_comparison - INFO - DEBUG HASH STRING: 34|2021-07-30|9634|nathaniel.white@example.com|85426...
2026-01-09 18:22:44,661 - dq_comparison - INFO - DEBUG HASH RESULT: 7019f8e1...
2026-01-09 18:22:44,663 - dq_comparison - INFO - DEBUG HASH ROW: CustomerID: '35' -> '35' | JoinDate: '02-11-2022' -> '2022-11-02' | PhoneNumber: '-5759' -> '5759' | Email: 'connie.nguyen@example.com' -> 'connie.nguyen@example.com' | Salary: '88819' -> '88819'
2026-01-09 18:22:44,663 - dq_comparison - INFO - DEBUG HASH STRING: 35|2022-11-02|5759|connie.nguyen@example.com|88819...
2026-01-09 18:22:44,664 - dq_comparison - INFO - DEBUG HASH RESULT: ee87f5b3...
2026-01-09 18:22:44,666 - dq_comparison - INFO - DEBUG HASH ROW: CustomerID: '36' -> '36' | JoinDate: '15-04-2021' -> '2021-04-15' | PhoneNumber: '-8942' -> '8942' | Email: 'lisa.woods@example.com' -> 'lisa.woods@example.com' | Salary: '61162' -> '61162'
2026-01-09 18:22:44,666 - dq_comparison - INFO - DEBUG HASH STRING: 36|2021-04-15|8942|lisa.woods@example.com|61162...
2026-01-09 18:22:44,667 - dq_comparison - INFO - DEBUG HASH RESULT: ccfe1dda...
2026-01-09 18:22:44,668 - dq_comparison - INFO - DEBUG HASH ROW: CustomerID: '37' -> '37' | JoinDate: '03-03-2024' -> '2024-03-03' | PhoneNumber: '-2948' -> '2948' | Email: 'jeanne.nichols@example.com' -> 'jeanne.nichols@example.com' | Salary: '98239' -> '98239'
2026-01-09 18:22:44,669 - dq_comparison - INFO - DEBUG HASH STRING: 37|2024-03-03|2948|jeanne.nichols@example.com|98239...
2026-01-09 18:22:44,670 - dq_comparison - INFO - DEBUG HASH RESULT: 4fde16fd...
2026-01-09 18:22:44,672 - dq_comparison - INFO - DEBUG HASH ROW: CustomerID: '38' -> '38' | JoinDate: '23-09-2021' -> '2021-09-23' | PhoneNumber: '-3785' -> '3785' | Email: 'logan.gross@example.com' -> 'logan.gross@example.com' | Salary: '60926' -> '60926'
2026-01-09 18:22:44,673 - dq_comparison - INFO - DEBUG HASH STRING: 38|2021-09-23|3785|logan.gross@example.com|60926...
2026-01-09 18:22:44,673 - dq_comparison - INFO - DEBUG HASH RESULT: ca43d5c6...
2026-01-09 18:22:44,674 - dq_comparison - INFO - DEBUG HASH ROW: CustomerID: '39' -> '39' | JoinDate: '08-06-2021' -> '2021-06-08' | PhoneNumber: '-5948' -> '5948' | Email: 'kevin.yates@example.com' -> 'kevin.yates@example.com' | Salary: '111507' -> '111507'
2026-01-09 18:22:44,675 - dq_comparison - INFO - DEBUG HASH STRING: 39|2021-06-08|5948|kevin.yates@example.com|111507...
2026-01-09 18:22:44,675 - dq_comparison - INFO - DEBUG HASH RESULT: 148b5b51...
2026-01-09 18:22:44,676 - dq_comparison - INFO - DEBUG HASH ROW: CustomerID: '40' -> '40' | JoinDate: '06-05-2025' -> '2025-05-06' | PhoneNumber: '-8441' -> '8441' | Email: 'lisa.moore@example.com' -> 'lisa.moore@example.com' | Salary: '34060' -> '34060'
2026-01-09 18:22:44,676 - dq_comparison - INFO - DEBUG HASH STRING: 40|2025-05-06|8441|lisa.moore@example.com|34060...
2026-01-09 18:22:44,677 - dq_comparison - INFO - DEBUG HASH RESULT: 170d9396...
2026-01-09 18:22:44,677 - dq_comparison - INFO - DEBUG HASH ROW: CustomerID: '41' -> '41' | JoinDate: '17-01-2021' -> '2021-01-17' | PhoneNumber: '-7453' -> '7453' | Email: 'scott.ashley@example.com' -> 'scott.ashley@example.com' | Salary: '113363' -> '113363'
2026-01-09 18:22:44,678 - dq_comparison - INFO - DEBUG HASH STRING: 41|2021-01-17|7453|scott.ashley@example.com|113363...
2026-01-09 18:22:44,678 - dq_comparison - INFO - DEBUG HASH RESULT: b62ac1db...
2026-01-09 18:22:44,679 - dq_comparison - INFO - DEBUG HASH ROW: CustomerID: '42' -> '42' | JoinDate: '01-08-2021' -> '2021-08-01' | PhoneNumber: '-11032' -> '11032' | Email: 'david.baker@example.com' -> 'david.baker@example.com' | Salary: '93681' -> '93681'
2026-01-09 18:22:44,680 - dq_comparison - INFO - DEBUG HASH STRING: 42|2021-08-01|11032|david.baker@example.com|93681...
2026-01-09 18:22:44,680 - dq_comparison - INFO - DEBUG HASH RESULT: 13cd8a47...
2026-01-09 18:22:44,681 - dq_comparison - INFO - DEBUG HASH ROW: CustomerID: '43' -> '43' | JoinDate: '22-08-2023' -> '2023-08-22' | PhoneNumber: '-3543' -> '3543' | Email: 'rachel.rodriguez@example.com' -> 'rachel.rodriguez@example.com' | Salary: '77279' -> '77279'
2026-01-09 18:22:44,682 - dq_comparison - INFO - DEBUG HASH STRING: 43|2023-08-22|3543|rachel.rodriguez@example.com|77279...
2026-01-09 18:22:44,682 - dq_comparison - INFO - DEBUG HASH RESULT: 1c2c7c14...
2026-01-09 18:22:44,683 - dq_comparison - INFO - DEBUG HASH ROW: CustomerID: '44' -> '44' | JoinDate: '21-06-2022' -> '2022-06-21' | PhoneNumber: '-10449' -> '10449' | Email: 'jonathan.brown@example.com' -> 'jonathan.brown@example.com' | Salary: '84295' -> '84295'
2026-01-09 18:22:44,684 - dq_comparison - INFO - DEBUG HASH STRING: 44|2022-06-21|10449|jonathan.brown@example.com|84295...
2026-01-09 18:22:44,684 - dq_comparison - INFO - DEBUG HASH RESULT: fe0bd178...
2026-01-09 18:22:44,686 - dq_comparison - INFO - DEBUG HASH ROW: CustomerID: '45' -> '45' | JoinDate: '02-06-2024' -> '2024-06-02' | PhoneNumber: '-4190' -> '4190' | Email: 'stephanie.jordan@example.com' -> 'stephanie.jordan@example.com' | Salary: '62444' -> '62444'
2026-01-09 18:22:44,687 - dq_comparison - INFO - DEBUG HASH STRING: 45|2024-06-02|4190|stephanie.jordan@example.com|62444...
2026-01-09 18:22:44,688 - dq_comparison - INFO - DEBUG HASH RESULT: 25e762d5...
2026-01-09 18:22:44,690 - dq_comparison - INFO - DEBUG HASH ROW: CustomerID: '46' -> '46' | JoinDate: '27-02-2024' -> '2024-02-27' | PhoneNumber: '-4947' -> '4947' | Email: 'kathleen.medina@example.com' -> 'kathleen.medina@example.com' | Salary: '108150' -> '108150'
2026-01-09 18:22:44,690 - dq_comparison - INFO - DEBUG HASH STRING: 46|2024-02-27|4947|kathleen.medina@example.com|108150...
2026-01-09 18:22:44,690 - dq_comparison - INFO - DEBUG HASH RESULT: b6278f02...
2026-01-09 18:22:44,692 - dq_comparison - INFO - DEBUG HASH ROW: CustomerID: '47' -> '47' | JoinDate: '18-10-2025' -> '2025-10-18' | PhoneNumber: '-10213' -> '10213' | Email: 'donna.melton@example.com' -> 'donna.melton@example.com' | Salary: '55606' -> '55606'
2026-01-09 18:22:44,693 - dq_comparison - INFO - DEBUG HASH STRING: 47|2025-10-18|10213|donna.melton@example.com|55606...
2026-01-09 18:22:44,694 - dq_comparison - INFO - DEBUG HASH RESULT: b2537b8e...
2026-01-09 18:22:44,695 - dq_comparison - INFO - DEBUG HASH ROW: CustomerID: '48' -> '48' | JoinDate: '08-03-2021' -> '2021-03-08' | PhoneNumber: '-9672' -> '9672' | Email: 'connor.hull@example.com' -> 'connor.hull@example.com' | Salary: '65948' -> '65948'
2026-01-09 18:22:44,695 - dq_comparison - INFO - DEBUG HASH STRING: 48|2021-03-08|9672|connor.hull@example.com|65948...
2026-01-09 18:22:44,696 - dq_comparison - INFO - DEBUG HASH RESULT: dea00459...
2026-01-09 18:22:44,697 - dq_comparison - INFO - DEBUG HASH ROW: CustomerID: '49' -> '49' | JoinDate: '13-05-2022' -> '2022-05-13' | PhoneNumber: '-6568' -> '6568' | Email: 'stacey.jacobs@example.com' -> 'stacey.jacobs@example.com' | Salary: '38311' -> '38311'
2026-01-09 18:22:44,698 - dq_comparison - INFO - DEBUG HASH STRING: 49|2022-05-13|6568|stacey.jacobs@example.com|38311...
2026-01-09 18:22:44,698 - dq_comparison - INFO - DEBUG HASH RESULT: a9912ee0...
2026-01-09 18:22:44,699 - dq_comparison - INFO - DEBUG HASH ROW: CustomerID: '50' -> '50' | JoinDate: '03-12-2023' -> '2023-12-03' | PhoneNumber: '-3462' -> '3462' | Email: 'mark.lester@example.com' -> 'mark.lester@example.com' | Salary: '37605' -> '37605'
2026-01-09 18:22:44,699 - dq_comparison - INFO - DEBUG HASH STRING: 50|2023-12-03|3462|mark.lester@example.com|37605...
2026-01-09 18:22:44,699 - dq_comparison - INFO - DEBUG HASH RESULT: 7d8d634f...
2026-01-09 18:22:44,700 - dq_comparison - INFO - === DEBUG: SAMPLE HASHES ===
2026-01-09 18:22:44,701 - dq_comparison - INFO - Hash 1: 082157c4f4e5e938... (sample row 0)
2026-01-09 18:22:44,701 - dq_comparison - INFO - Hash 2: 14f087fc9b42ffe2... (sample row 1)
2026-01-09 18:22:44,702 - dq_comparison - INFO - Hash 3: ece840e32b074ab9... (sample row 2)
2026-01-09 18:22:44,702 - dq_comparison - INFO - Generating hashes for target data (50 rows)...
2026-01-09 18:22:44,712 - dq_comparison - INFO - 
======================================================================
2026-01-09 18:22:44,713 - dq_comparison - INFO - 🔍 DEBUG: ANALYZING WHY HASHES DON'T MATCH
2026-01-09 18:22:44,715 - dq_comparison - INFO - ======================================================================
2026-01-09 18:22:44,715 - dq_comparison - INFO - 
--- Analyzing Row 0 ---
2026-01-09 18:22:44,716 - dq_comparison - INFO - Column 'CustomerID' → 'CustomerID':
2026-01-09 18:22:44,716 - dq_comparison - INFO -   Source: '1' (type: int64) → '1'
2026-01-09 18:22:44,717 - dq_comparison - INFO -   Target: '1' (type: int64) → '1'
2026-01-09 18:22:44,718 - dq_comparison - INFO -   Match after normalization: ✅ YES
2026-01-09 18:22:44,720 - dq_comparison - INFO - Column 'JoinDate' → 'JoinDate':
2026-01-09 18:22:44,721 - dq_comparison - INFO -   Source: '26-10-2025' (type: str) → '2025-10-26'
2026-01-09 18:22:44,721 - dq_comparison - INFO -   Target: '2025-10-26 00:00:00' (type: Timestamp) → '2025-10-26'
2026-01-09 18:22:44,722 - dq_comparison - INFO -   Match after normalization: ✅ YES
2026-01-09 18:22:44,723 - dq_comparison - INFO - Column 'PhoneNumber' → 'PhoneNumber':
2026-01-09 18:22:44,724 - dq_comparison - INFO -   Source: '-6089' (type: int64) → '6089'
2026-01-09 18:22:44,725 - dq_comparison - INFO -   Target: '+1-486-229-5375' (type: str) → '14862295375'
2026-01-09 18:22:44,726 - dq_comparison - INFO -   Match after normalization: ❌ NO
2026-01-09 18:22:44,727 - dq_comparison - INFO - Column 'Email' → 'Email':
2026-01-09 18:22:44,728 - dq_comparison - INFO -   Source: 'mark.morris@example.com' (type: str) → 'mark.morris@example.com'
2026-01-09 18:22:44,728 - dq_comparison - INFO -   Target: 'mark.morris@example.com' (type: str) → 'mark.morris@example.com'
2026-01-09 18:22:44,729 - dq_comparison - INFO -   Match after normalization: ✅ YES
2026-01-09 18:22:44,730 - dq_comparison - INFO - Column 'Salary' → 'Salary':
2026-01-09 18:22:44,730 - dq_comparison - INFO -   Source: '111916' (type: int64) → '111916'
2026-01-09 18:22:44,732 - dq_comparison - INFO -   Target: '111916' (type: int64) → '111916'
2026-01-09 18:22:44,733 - dq_comparison - INFO -   Match after normalization: ✅ YES
2026-01-09 18:22:44,734 - dq_comparison - INFO - 
Hash components for Row 0:
2026-01-09 18:22:44,736 - dq_comparison - INFO - Source hash string start: 1|2025-10-26|6089...
2026-01-09 18:22:44,737 - dq_comparison - INFO - Target hash string start: 1|2025-10-26|14862295375...
2026-01-09 18:22:44,738 - dq_comparison - INFO - Same? ❌ NO
2026-01-09 18:22:44,739 - dq_comparison - INFO - 
--- Analyzing Row 1 ---
2026-01-09 18:22:44,741 - dq_comparison - INFO - Column 'CustomerID' → 'CustomerID':
2026-01-09 18:22:44,742 - dq_comparison - INFO -   Source: '2' (type: int64) → '2'
2026-01-09 18:22:44,742 - dq_comparison - INFO -   Target: '2' (type: int64) → '2'
2026-01-09 18:22:44,743 - dq_comparison - INFO -   Match after normalization: ✅ YES
2026-01-09 18:22:44,744 - dq_comparison - INFO - Column 'JoinDate' → 'JoinDate':
2026-01-09 18:22:44,745 - dq_comparison - INFO -   Source: '31-05-2025' (type: str) → '2025-05-31'
2026-01-09 18:22:44,746 - dq_comparison - INFO -   Target: '2025-05-31 00:00:00' (type: Timestamp) → '2025-05-31'
2026-01-09 18:22:44,747 - dq_comparison - INFO -   Match after normalization: ✅ YES
2026-01-09 18:22:44,748 - dq_comparison - INFO - Column 'PhoneNumber' → 'PhoneNumber':
2026-01-09 18:22:44,749 - dq_comparison - INFO -   Source: '-3294' (type: int64) → '3294'
2026-01-09 18:22:44,749 - dq_comparison - INFO -   Target: '+1-844-558-1893' (type: str) → '18445581893'
2026-01-09 18:22:44,749 - dq_comparison - INFO -   Match after normalization: ❌ NO
2026-01-09 18:22:44,750 - dq_comparison - INFO - Column 'Email' → 'Email':
2026-01-09 18:22:44,750 - dq_comparison - INFO -   Source: 'dennis.owens@example.com' (type: str) → 'dennis.owens@example.com'
2026-01-09 18:22:44,751 - dq_comparison - INFO -   Target: 'dennis.owens@example.com' (type: str) → 'dennis.owens@example.com'
2026-01-09 18:22:44,751 - dq_comparison - INFO -   Match after normalization: ✅ YES
2026-01-09 18:22:44,752 - dq_comparison - INFO - Column 'Salary' → 'Salary':
2026-01-09 18:22:44,752 - dq_comparison - INFO -   Source: '39264' (type: int64) → '39264'
2026-01-09 18:22:44,753 - dq_comparison - INFO -   Target: '39264' (type: int64) → '39264'
2026-01-09 18:22:44,753 - dq_comparison - INFO -   Match after normalization: ✅ YES
2026-01-09 18:22:44,754 - dq_comparison - INFO - 
Hash components for Row 1:
2026-01-09 18:22:44,754 - dq_comparison - INFO - Source hash string start: 2|2025-05-31|3294...
2026-01-09 18:22:44,755 - dq_comparison - INFO - Target hash string start: 2|2025-05-31|18445581893...
2026-01-09 18:22:44,755 - dq_comparison - INFO - Same? ❌ NO
2026-01-09 18:22:44,756 - dq_comparison - INFO - 
--- Analyzing Row 2 ---
2026-01-09 18:22:44,757 - dq_comparison - INFO - Column 'CustomerID' → 'CustomerID':
2026-01-09 18:22:44,757 - dq_comparison - INFO -   Source: '3' (type: int64) → '3'
2026-01-09 18:22:44,758 - dq_comparison - INFO -   Target: '3' (type: int64) → '3'
2026-01-09 18:22:44,758 - dq_comparison - INFO -   Match after normalization: ✅ YES
2026-01-09 18:22:44,759 - dq_comparison - INFO - Column 'JoinDate' → 'JoinDate':
2026-01-09 18:22:44,760 - dq_comparison - INFO -   Source: '31-03-2024' (type: str) → '2024-03-31'
2026-01-09 18:22:44,760 - dq_comparison - INFO -   Target: '2024-03-31 00:00:00' (type: Timestamp) → '2024-03-31'
2026-01-09 18:22:44,761 - dq_comparison - INFO -   Match after normalization: ✅ YES
2026-01-09 18:22:44,761 - dq_comparison - INFO - Column 'PhoneNumber' → 'PhoneNumber':
2026-01-09 18:22:44,762 - dq_comparison - INFO -   Source: '-10861' (type: int64) → '10861'
2026-01-09 18:22:44,762 - dq_comparison - INFO -   Target: '+1-910-312-9640' (type: str) → '19103129640'
2026-01-09 18:22:44,763 - dq_comparison - INFO -   Match after normalization: ❌ NO
2026-01-09 18:22:44,764 - dq_comparison - INFO - Column 'Email' → 'Email':
2026-01-09 18:22:44,765 - dq_comparison - INFO -   Source: 'felicia.hatfield@example.com' (type: str) → 'felicia.hatfield@example.com'
2026-01-09 18:22:44,765 - dq_comparison - INFO -   Target: 'felicia.hatfield@example.com' (type: str) → 'felicia.hatfield@example.com'
2026-01-09 18:22:44,766 - dq_comparison - INFO -   Match after normalization: ✅ YES
2026-01-09 18:22:44,767 - dq_comparison - INFO - Column 'Salary' → 'Salary':
2026-01-09 18:22:44,768 - dq_comparison - INFO -   Source: '41191' (type: int64) → '41191'
2026-01-09 18:22:44,769 - dq_comparison - INFO -   Target: '41191' (type: int64) → '41191'
2026-01-09 18:22:44,770 - dq_comparison - INFO -   Match after normalization: ✅ YES
2026-01-09 18:22:44,770 - dq_comparison - INFO - 
Hash components for Row 2:
2026-01-09 18:22:44,772 - dq_comparison - INFO - Source hash string start: 3|2024-03-31|10861...
2026-01-09 18:22:44,772 - dq_comparison - INFO - Target hash string start: 3|2024-03-31|19103129640...
2026-01-09 18:22:44,773 - dq_comparison - INFO - Same? ❌ NO
2026-01-09 18:22:44,774 - dq_comparison - INFO - 
--- Column Data Types Analysis ---
2026-01-09 18:22:44,775 - dq_comparison - INFO - Column 1: 'CustomerID' (int64) ↔ 'CustomerID' (int64)
2026-01-09 18:22:44,776 - dq_comparison - INFO -   Sample: Source='1', Target='1'
2026-01-09 18:22:44,777 - dq_comparison - INFO - Column 2: 'JoinDate' (object) ↔ 'JoinDate' (datetime64[ns])
2026-01-09 18:22:44,778 - dq_comparison - INFO -   Sample: Source='26-10-2025', Target='2025-10-26 00:00:00'
2026-01-09 18:22:44,779 - dq_comparison - INFO - Column 3: 'PhoneNumber' (int64) ↔ 'PhoneNumber' (object)
2026-01-09 18:22:44,780 - dq_comparison - INFO -   Sample: Source='-6089', Target='+1-486-229-5375'
2026-01-09 18:22:44,781 - dq_comparison - INFO - Column 4: 'Email' (object) ↔ 'Email' (object)
2026-01-09 18:22:44,782 - dq_comparison - INFO -   Sample: Source='mark.morris@example.com', Target='mark.morris@example.com'
2026-01-09 18:22:44,783 - dq_comparison - INFO - Column 5: 'Salary' (int64) ↔ 'Salary' (int64)
2026-01-09 18:22:44,784 - dq_comparison - INFO -   Sample: Source='111916', Target='111916'
2026-01-09 18:22:44,785 - dq_comparison - INFO - === DEBUG: DIRECT ROW COMPARISON ===
2026-01-09 18:22:44,786 - dq_comparison - INFO - --- Comparing Row 0 ---
2026-01-09 18:22:44,787 - dq_comparison - INFO -   ✅ CustomerID: '1' → '1' vs '1' → '1'
2026-01-09 18:22:44,788 - dq_comparison - INFO -   ✅ JoinDate: '26-10-2025' → '2025-10-26' vs '2025-10-26 00:00:00' → '2025-10-26'
2026-01-09 18:22:44,790 - dq_comparison - INFO -   ❌ PhoneNumber: '-6089' → '6089' vs '+1-486-229-5375' → '14862295375'
2026-01-09 18:22:44,790 - dq_comparison - INFO -     Mismatch type: <class 'numpy.int64'> vs <class 'str'>
2026-01-09 18:22:44,791 - dq_comparison - INFO -   ✅ Email: 'mark.morris@example.com' → 'mark.morris@example.com' vs 'mark.morris@example.com' → 'mark.morris@example.com'
2026-01-09 18:22:44,792 - dq_comparison - INFO -   ✅ Salary: '111916' → '111916' vs '111916' → '111916'
2026-01-09 18:22:44,793 - dq_comparison - INFO - --- Comparing Row 1 ---
2026-01-09 18:22:44,794 - dq_comparison - INFO -   ✅ CustomerID: '2' → '2' vs '2' → '2'
2026-01-09 18:22:44,795 - dq_comparison - INFO -   ✅ JoinDate: '31-05-2025' → '2025-05-31' vs '2025-05-31 00:00:00' → '2025-05-31'
2026-01-09 18:22:44,796 - dq_comparison - INFO -   ❌ PhoneNumber: '-3294' → '3294' vs '+1-844-558-1893' → '18445581893'
2026-01-09 18:22:44,797 - dq_comparison - INFO -     Mismatch type: <class 'numpy.int64'> vs <class 'str'>
2026-01-09 18:22:44,798 - dq_comparison - INFO -   ✅ Email: 'dennis.owens@example.com' → 'dennis.owens@example.com' vs 'dennis.owens@example.com' → 'dennis.owens@example.com'
2026-01-09 18:22:44,799 - dq_comparison - INFO -   ✅ Salary: '39264' → '39264' vs '39264' → '39264'
2026-01-09 18:22:44,800 - dq_comparison - INFO - --- Comparing Row 2 ---
2026-01-09 18:22:44,801 - dq_comparison - INFO -   ✅ CustomerID: '3' → '3' vs '3' → '3'
2026-01-09 18:22:44,802 - dq_comparison - INFO -   ✅ JoinDate: '31-03-2024' → '2024-03-31' vs '2024-03-31 00:00:00' → '2024-03-31'
2026-01-09 18:22:44,803 - dq_comparison - INFO -   ❌ PhoneNumber: '-10861' → '10861' vs '+1-910-312-9640' → '19103129640'
2026-01-09 18:22:44,804 - dq_comparison - INFO -     Mismatch type: <class 'numpy.int64'> vs <class 'str'>
2026-01-09 18:22:44,804 - dq_comparison - INFO -   ✅ Email: 'felicia.hatfield@example.com' → 'felicia.hatfield@example.com' vs 'felicia.hatfield@example.com' → 'felicia.hatfield@example.com'
2026-01-09 18:22:44,806 - dq_comparison - INFO -   ✅ Salary: '41191' → '41191' vs '41191' → '41191'
2026-01-09 18:22:44,806 - dq_comparison - INFO - Hash-based Comparison Results (with duplicate handling):
2026-01-09 18:22:44,807 - dq_comparison - INFO -   • Unique source hashes: 50
2026-01-09 18:22:44,808 - dq_comparison - INFO -   • Unique target hashes: 50
2026-01-09 18:22:44,809 - dq_comparison - INFO -   • Common hashes: 10
2026-01-09 18:22:44,809 - dq_comparison - INFO -   • Common rows (counting duplicates): 10
2026-01-09 18:22:44,810 - dq_comparison - INFO -   • Rows only in source (counting duplicates): 40
2026-01-09 18:22:44,810 - dq_comparison - INFO -   • Rows only in target (counting duplicates): 40
2026-01-09 18:22:44,811 - dq_comparison - INFO - Found 40 rows missing in target
2026-01-09 18:22:44,858 - dq_comparison - INFO - Found 40 extra rows in target
2026-01-09 18:22:44,903 - dq_comparison - INFO - HASH-ONLY COMPARISON COMPLETED
2026-01-09 18:22:44,903 - dq_comparison - INFO - Returning counts for simple scoring:
2026-01-09 18:22:44,904 - dq_comparison - INFO -   Common rows: 10
2026-01-09 18:22:44,904 - dq_comparison - INFO -   Unique to source: 40
2026-01-09 18:22:44,905 - dq_comparison - INFO -   Unique to target: 40
2026-01-09 18:22:44,905 - dq_comparison - INFO -   Value mismatches: 640
2026-01-09 18:22:44,906 - dq_comparison - INFO -   Missing rows: 40
2026-01-09 18:22:44,906 - dq_comparison - INFO -   Extra rows: 40
2026-01-09 18:22:44,907 - dq_comparison - INFO - Analyzing data quality metrics...
2026-01-09 18:22:44,923 - dq_comparison - INFO - Null values - Source: 5 (1.25%), Target: 5 (1.25%)
2026-01-09 18:22:44,925 - dq_comparison - INFO - Duplicate rows (normalized) - Source: 0, Target: 0
2026-01-09 18:22:44,936 - dq_error_log - INFO - Retrieved 11 error logs for session CMP_20260109_182244
2026-01-09 18:22:44,936 - dq_comparison - INFO - 
📊 SIMPLE SCORING CALCULATION:
2026-01-09 18:22:44,937 - dq_comparison - INFO -   Source rows: 50
2026-01-09 18:22:44,937 - dq_comparison - INFO -   Common rows (matched): 10
2026-01-09 18:22:44,938 - dq_comparison - INFO -   Calculation: (10 / 50) * 100 = 20.00%
2026-01-09 18:22:44,939 - dq_comparison - INFO -   Explanation: 10 matched rows out of 50 total source rows
2026-01-09 18:22:44,940 - dq_comparison - INFO - 
=== AUDIT LOGGING SECTION ===
2026-01-09 18:22:44,941 - dq_comparison - INFO - 🔍 Audit logging is ENABLED in APP_SETTINGS
2026-01-09 18:22:44,942 - dq_audit - INFO - Audit class initialized with database: dq_checks
2026-01-09 18:22:44,945 - dq_comparison - INFO - Attempting to log audit record for session: CMP_20260109_182244
2026-01-09 18:22:44,945 - dq_audit - INFO - Starting database insertion for comparison...
2026-01-09 18:22:44,960 - dq_audit - INFO - Inserted comparison record with ID: 591
2026-01-09 18:22:44,960 - dq_comparison - INFO - ✅ Audit record logged successfully (ID: 591)
2026-01-09 18:22:44,969 - dq_error_log - INFO - Retrieved 11 error logs for session CMP_20260109_182244
2026-01-09 18:22:44,978 - dq_error_log - INFO - Retrieved summary: 11 total errors for session CMP_20260109_182244
2026-01-09 18:22:44,980 - dq_audit - INFO - Audit class initialized with database: dq_checks
2026-01-09 18:22:44,992 - dq_audit - INFO - Retrieved 1 audit logs for session CMP_20260109_182244
2026-01-09 18:22:44,993 - dq_comparison - INFO - 
🔍 Final results verification:
2026-01-09 18:22:44,994 - dq_comparison - INFO -    Session ID: CMP_20260109_182244
2026-01-09 18:22:44,995 - dq_comparison - INFO -    DQ Score (Simple %): 20.00%
2026-01-09 18:22:44,995 - dq_comparison - INFO -    Source rows: 50
2026-01-09 18:22:44,996 - dq_comparison - INFO -    Matched rows: 10
2026-01-09 18:22:44,996 - dq_comparison - INFO -    Calculation: (10 / 50) * 100
2026-01-09 18:22:44,997 - dq_comparison - INFO - Comparison analysis completed successfully
2026-01-09 18:22:45,007 - dq_audit - INFO - Retrieved 1 audit logs for session CMP_20260109_182244
2026-01-09 18:22:45,016 - dq_error_log - INFO - Retrieved 11 error logs for session CMP_20260109_182244
2026-01-09 18:22:45,025 - dq_error_log - INFO - Retrieved summary: 11 total errors for session CMP_20260109_182244
2026-01-09 18:22:45,026 - __main__ - INFO - Comparison completed for session CMP_20260109_182243
2026-01-09 18:22:45,030 - __main__ - INFO - Completed with status 200 in 1.724s
2026-01-09 18:22:56,042 - __main__ - INFO - POST /api/compare - Request started
2026-01-09 18:22:56,044 - __main__ - INFO - Comparison request - Source: excel, Target: csv
2026-01-09 18:22:56,046 - __main__ - INFO - Comparison analysis request received
2026-01-09 18:22:56,049 - __main__ - INFO - DEBUG source_data from nested: {'source_type': 'excel', 'source_file_path': 'C:\\\\Users\\\\003160\\\\OneDrive - wisseninfotech.com\\\\Documents\\\\DQ-Checks-Shashi\\\\API_Test_Scrips\\\\sorce-target\\\\test_source.xlsx'}
2026-01-09 18:22:56,050 - __main__ - INFO - Starting comparison for session CMP_20260109_182256
2026-01-09 18:22:56,051 - dq_comparison - INFO - Starting comparison analysis in UI mode
2026-01-09 18:22:56,052 - dq_comparison - INFO - LOADING SOURCE AND TARGET DATA
2026-01-09 18:22:56,054 - dq_comparison - INFO - 
==================================================
2026-01-09 18:22:56,056 - dq_comparison - INFO - 🔗 SOURCE DATA CONFIGURATION
2026-01-09 18:22:56,057 - dq_comparison - INFO - ==================================================
2026-01-09 18:22:56,058 - dq_comparison - INFO - DEBUG load_excel_source called for SOURCE
2026-01-09 18:22:56,059 - dq_comparison - INFO - DEBUG ui_data: {'source_type': 'excel', 'source_file_path': 'C:\\\\Users\\\\003160\\\\OneDrive - wisseninfotech.com\\\\Documents\\\\DQ-Checks-Shashi\\\\API_Test_Scrips\\\\sorce-target\\\\test_source.xlsx', 'file_path': 'C:\\\\Users\\\\003160\\\\OneDrive - wisseninfotech.com\\\\Documents\\\\DQ-Checks-Shashi\\\\API_Test_Scrips\\\\sorce-target\\\\test_source.xlsx', 'sheet_name': None}
2026-01-09 18:22:56,060 - dq_comparison - INFO - DEBUG ui_data type: <class 'dict'>
2026-01-09 18:22:56,061 - dq_comparison - INFO - DEBUG Found file_path in ui_data: C:\\Users\\003160\\OneDrive - wisseninfotech.com\\Documents\\DQ-Checks-Shashi\\API_Test_Scrips\\sorce-target\\test_source.xlsx
2026-01-09 18:22:56,096 - dq_comparison - INFO - SOURCE Excel loaded: 50 rows, 8 columns
2026-01-09 18:22:56,096 - dq_comparison - INFO - 
==================================================
2026-01-09 18:22:56,097 - dq_comparison - INFO - 🔗 TARGET DATA CONFIGURATION
2026-01-09 18:22:56,098 - dq_comparison - INFO - ==================================================
2026-01-09 18:22:56,099 - dq_comparison - INFO - DEBUG load_csv_source called for TARGET
2026-01-09 18:22:56,099 - dq_comparison - INFO - DEBUG: Using file_path from 'target_file_path': C:\\Users\\003160\\OneDrive - wisseninfotech.com\\Documents\\DQ-Checks-Shashi\\API_Test_Scrips\\sorce-target\\test_target.csv
2026-01-09 18:22:56,107 - dq_comparison - INFO - TARGET CSV loaded: 50 rows, 8 columns
2026-01-09 18:22:56,108 - dq_comparison - INFO - Source data loaded: 50 rows, 8 columns
2026-01-09 18:22:56,109 - dq_comparison - INFO - Target data loaded: 50 rows, 8 columns
2026-01-09 18:22:56,110 - dq_comparison - INFO - SELECTING COLUMNS FOR COMPARISON
2026-01-09 18:22:56,111 - dq_comparison - INFO - Source columns (original): ['CustomerID', 'FirstName', 'LastName', 'PhoneNumber', 'Email', 'Salary', 'JoinDate', 'Address']
2026-01-09 18:22:56,113 - dq_comparison - INFO - Target columns (original): ['CustomerID', 'FirstName', 'LastName', 'PhoneNumber', 'Email', 'Salary', 'JoinDate', 'Address']
2026-01-09 18:22:56,114 - dq_comparison - INFO - Common columns lowercased: ['customerid', 'joindate', 'phonenumber', 'email', 'salary', 'firstname', 'address', 'lastname']
2026-01-09 18:22:56,115 - dq_comparison - INFO - Found 8 common columns between source and target (case-insensitive)
2026-01-09 18:22:56,116 - dq_comparison - INFO - User column selection input: all
2026-01-09 18:22:56,117 - dq_comparison - INFO - User selected ALL common columns for comparison
2026-01-09 18:22:56,118 - dq_comparison - INFO - Selected 8 columns for comparison: ['CustomerID', 'JoinDate', 'PhoneNumber', 'Email', 'Salary']...
2026-01-09 18:22:56,120 - dq_comparison - INFO - GENERATING COMPREHENSIVE COMPARISON REPORT
2026-01-09 18:22:56,121 - dq_comparison - INFO - Report details - Source: Excel: test_source.xlsx (Sheet1), Target: CSV: test_target.csv, Selected columns: 8
2026-01-09 18:22:56,121 - dq_comparison - INFO - Initializing Error Logger...
2026-01-09 18:22:56,122 - dq_error_log - INFO - ErrorLogger initialized with database: dq_checks
2026-01-09 18:22:56,136 - dq_error_log - INFO - Database connection successful
2026-01-09 18:22:56,138 - dq_comparison - INFO - Session ID: CMP_20260109_182256
2026-01-09 18:22:56,140 - dq_comparison - INFO - ✅ Row counts match: 50 rows
2026-01-09 18:22:56,141 - dq_comparison - INFO - Comparing column structures...
2026-01-09 18:22:56,142 - dq_comparison - WARNING - Found 1 incompatible data type mismatches
2026-01-09 18:22:56,143 - dq_comparison - INFO - Column structure comparison complete. Match: False
2026-01-09 18:22:56,158 - dq_comparison - INFO - Validating primary key/unique fields...
2026-01-09 18:22:56,159 - dq_comparison - INFO - Checking key fields: ['CustomerID', 'CustomerID']
2026-01-09 18:22:56,160 - dq_comparison - INFO - Primary key validation complete. Passed: True
2026-01-09 18:22:56,161 - dq_comparison - INFO - Comparing table-level metadata...
2026-01-09 18:22:56,168 - dq_comparison - INFO - Table metadata comparison complete. Match: True
2026-01-09 18:22:56,169 - dq_comparison - INFO - SECOND CHECK: HASH-BASED COMPARISON WITH PERFECT NORMALIZATION
2026-01-09 18:22:56,172 - dq_comparison - INFO - === DEBUG: DATA TYPE CHECK ===
2026-01-09 18:22:56,173 - dq_comparison - INFO - Column: CustomerID
2026-01-09 18:22:56,174 - dq_comparison - INFO -   Source type: <class 'numpy.int64'>, value: 1
2026-01-09 18:22:56,175 - dq_comparison - INFO -   Target type: <class 'numpy.int64'>, value: 1
2026-01-09 18:22:56,176 - dq_comparison - INFO -   Normalized: '1' vs '1'
2026-01-09 18:22:56,177 - dq_comparison - INFO -   Match: True
2026-01-09 18:22:56,179 - dq_comparison - INFO - Column: JoinDate
2026-01-09 18:22:56,180 - dq_comparison - INFO -   Source type: <class 'pandas._libs.tslibs.timestamps.Timestamp'>, value: 2025-10-26 00:00:00
2026-01-09 18:22:56,181 - dq_comparison - INFO -   Target type: <class 'str'>, value: 26-10-2025
2026-01-09 18:22:56,182 - dq_comparison - INFO -   Normalized: '2025-10-26' vs '2025-10-26'
2026-01-09 18:22:56,183 - dq_comparison - INFO -   Match: True
2026-01-09 18:22:56,185 - dq_comparison - INFO - Column: PhoneNumber
2026-01-09 18:22:56,186 - dq_comparison - INFO -   Source type: <class 'str'>, value: +1-486-229-5375
2026-01-09 18:22:56,187 - dq_comparison - INFO -   Target type: <class 'numpy.int64'>, value: -6089
2026-01-09 18:22:56,188 - dq_comparison - INFO -   Normalized: '14862295375' vs '6089'
2026-01-09 18:22:56,188 - dq_comparison - INFO -   Match: False
2026-01-09 18:22:56,189 - dq_comparison - INFO - Source DF columns: ['CustomerID', 'FirstName', 'LastName', 'PhoneNumber', 'Email', 'Salary', 'JoinDate', 'Address']
2026-01-09 18:22:56,190 - dq_comparison - INFO - Target DF columns: ['CustomerID', 'FirstName', 'LastName', 'PhoneNumber', 'Email', 'Salary', 'JoinDate', 'Address']
2026-01-09 18:22:56,191 - dq_comparison - INFO - Selected columns for comparison: ['CustomerID', 'JoinDate', 'PhoneNumber', 'Email', 'Salary', 'FirstName', 'Address', 'LastName']
2026-01-09 18:22:56,192 - dq_comparison - INFO - Using 8 common columns for hash comparison
2026-01-09 18:22:56,192 - dq_comparison - INFO - Source columns: ['CustomerID', 'JoinDate', 'PhoneNumber', 'Email', 'Salary', 'FirstName', 'Address', 'LastName']
2026-01-09 18:22:56,193 - dq_comparison - INFO - Target columns: ['CustomerID', 'JoinDate', 'PhoneNumber', 'Email', 'Salary', 'FirstName', 'Address', 'LastName']
2026-01-09 18:22:56,194 - dq_comparison - INFO - Generating hashes for source data (50 rows)...
2026-01-09 18:22:56,197 - dq_comparison - INFO - DEBUG HASH ROW: CustomerID: '1' -> '1' | JoinDate: '2025-10-26 00:00:00' -> '2025-10-26' | PhoneNumber: '+1-486-229-5375' -> '14862295375' | Email: 'mark.morris@example.com' -> 'mark.morris@example.com' | Salary: '111916' -> '111916'
2026-01-09 18:22:56,197 - dq_comparison - INFO - DEBUG HASH STRING: 1|2025-10-26|14862295375|mark.morris@example.com|111916...
2026-01-09 18:22:56,198 - dq_comparison - INFO - DEBUG HASH RESULT: b4800c32...
2026-01-09 18:22:56,200 - dq_comparison - INFO - DEBUG HASH ROW: CustomerID: '2' -> '2' | JoinDate: '2025-05-31 00:00:00' -> '2025-05-31' | PhoneNumber: '+1-844-558-1893' -> '18445581893' | Email: 'dennis.owens@example.com' -> 'dennis.owens@example.com' | Salary: '39264' -> '39264'
2026-01-09 18:22:56,201 - dq_comparison - INFO - DEBUG HASH STRING: 2|2025-05-31|18445581893|dennis.owens@example.com|39264...
2026-01-09 18:22:56,201 - dq_comparison - INFO - DEBUG HASH RESULT: 4197d21c...
2026-01-09 18:22:56,203 - dq_comparison - INFO - DEBUG HASH ROW: CustomerID: '3' -> '3' | JoinDate: '2024-03-31 00:00:00' -> '2024-03-31' | PhoneNumber: '+1-910-312-9640' -> '19103129640' | Email: 'felicia.hatfield@example.com' -> 'felicia.hatfield@example.com' | Salary: '41191' -> '41191'
2026-01-09 18:22:56,203 - dq_comparison - INFO - DEBUG HASH STRING: 3|2024-03-31|19103129640|felicia.hatfield@example.com|41191...
2026-01-09 18:22:56,205 - dq_comparison - INFO - DEBUG HASH RESULT: 714db705...
2026-01-09 18:22:56,206 - dq_comparison - INFO - DEBUG HASH ROW: CustomerID: '4' -> '4' | JoinDate: '2023-12-19 00:00:00' -> '2023-12-19' | PhoneNumber: '+1-402-883-9185' -> '14028839185' | Email: 'michael.jenkins@example.com' -> 'michael.jenkins@example.com' | Salary: '116934' -> '116934'
2026-01-09 18:22:56,207 - dq_comparison - INFO - DEBUG HASH STRING: 4|2023-12-19|14028839185|michael.jenkins@example.com|116934...
2026-01-09 18:22:56,208 - dq_comparison - INFO - DEBUG HASH RESULT: 480f0939...
2026-01-09 18:22:56,210 - dq_comparison - INFO - DEBUG HASH ROW: CustomerID: '5' -> '5' | JoinDate: '2025-01-23 00:00:00' -> '2025-01-23' | PhoneNumber: '+1-754-612-4844' -> '17546124844' | Email: 'nicholas.smith@example.com' -> 'nicholas.smith@example.com' | Salary: '46558' -> '46558'
2026-01-09 18:22:56,210 - dq_comparison - INFO - DEBUG HASH STRING: 5|2025-01-23|17546124844|nicholas.smith@example.com|46558...
2026-01-09 18:22:56,211 - dq_comparison - INFO - DEBUG HASH RESULT: 938961bd...
2026-01-09 18:22:56,212 - dq_comparison - INFO - DEBUG HASH ROW: CustomerID: '6' -> '6' | JoinDate: '2022-12-18 00:00:00' -> '2022-12-18' | PhoneNumber: '+1-700-357-4245' -> '17003574245' | Email: 'joseph.guerra@example.com' -> 'joseph.guerra@example.com' | Salary: '79928' -> '79928'
2026-01-09 18:22:56,212 - dq_comparison - INFO - DEBUG HASH STRING: 6|2022-12-18|17003574245|joseph.guerra@example.com|79928...
2026-01-09 18:22:56,213 - dq_comparison - INFO - DEBUG HASH RESULT: d69b54e9...
2026-01-09 18:22:56,215 - dq_comparison - INFO - DEBUG HASH ROW: CustomerID: '7' -> '7' | JoinDate: '2025-11-19 00:00:00' -> '2025-11-19' | PhoneNumber: '+1-229-749-2702' -> '12297492702' | Email: 'gabrielle.bell@example.com' -> 'gabrielle.bell@example.com' | Salary: '85292' -> '85292'
2026-01-09 18:22:56,216 - dq_comparison - INFO - DEBUG HASH STRING: 7|2025-11-19|12297492702|gabrielle.bell@example.com|85292...
2026-01-09 18:22:56,217 - dq_comparison - INFO - DEBUG HASH RESULT: 6849be7d...
2026-01-09 18:22:56,218 - dq_comparison - INFO - DEBUG HASH ROW: CustomerID: '8' -> '8' | JoinDate: '2021-07-16 00:00:00' -> '2021-07-16' | PhoneNumber: '+1-569-212-8233' -> '15692128233' | Email: 'joel.barber@example.com' -> 'joel.barber@example.com' | Salary: '50803' -> '50803'
2026-01-09 18:22:56,219 - dq_comparison - INFO - DEBUG HASH STRING: 8|2021-07-16|15692128233|joel.barber@example.com|50803...
2026-01-09 18:22:56,220 - dq_comparison - INFO - DEBUG HASH RESULT: 86b785c0...
2026-01-09 18:22:56,222 - dq_comparison - INFO - DEBUG HASH ROW: CustomerID: '9' -> '9' | JoinDate: '2022-03-29 00:00:00' -> '2022-03-29' | PhoneNumber: '+1-852-913-1162' -> '18529131162' | Email: 'autumn.flores@example.com' -> 'autumn.flores@example.com' | Salary: '84264' -> '84264'
2026-01-09 18:22:56,223 - dq_comparison - INFO - DEBUG HASH STRING: 9|2022-03-29|18529131162|autumn.flores@example.com|84264...
2026-01-09 18:22:56,224 - dq_comparison - INFO - DEBUG HASH RESULT: 15c46874...
2026-01-09 18:22:56,225 - dq_comparison - INFO - DEBUG HASH ROW: CustomerID: '10' -> '10' | JoinDate: '2025-04-24 00:00:00' -> '2025-04-24' | PhoneNumber: '+1-519-801-4747' -> '15198014747' | Email: 'jared.andrews@example.com' -> 'jared.andrews@example.com' | Salary: '119153' -> '119153'
2026-01-09 18:22:56,226 - dq_comparison - INFO - DEBUG HASH STRING: 10|2025-04-24|15198014747|jared.andrews@example.com|119153...
2026-01-09 18:22:56,227 - dq_comparison - INFO - DEBUG HASH RESULT: 2789aca9...
2026-01-09 18:22:56,228 - dq_comparison - INFO - DEBUG HASH ROW: CustomerID: '11' -> '11' | JoinDate: '2022-06-15 00:00:00' -> '2022-06-15' | PhoneNumber: '+1-953-403-7049' -> '19534037049' | Email: 'jason.kim@example.com' -> 'jason.kim@example.com' | Salary: '39331' -> '39331'
2026-01-09 18:22:56,228 - dq_comparison - INFO - DEBUG HASH STRING: 11|2022-06-15|19534037049|jason.kim@example.com|39331...
2026-01-09 18:22:56,229 - dq_comparison - INFO - DEBUG HASH RESULT: e0b797cc...
2026-01-09 18:22:56,230 - dq_comparison - INFO - DEBUG HASH ROW: CustomerID: '12' -> '12' | JoinDate: '2025-04-07 00:00:00' -> '2025-04-07' | PhoneNumber: '+1-717-252-6021' -> '17172526021' | Email: 'ryan.barton@example.com' -> 'ryan.barton@example.com' | Salary: '48099' -> '48099'
2026-01-09 18:22:56,231 - dq_comparison - INFO - DEBUG HASH STRING: 12|2025-04-07|17172526021|ryan.barton@example.com|48099...
2026-01-09 18:22:56,232 - dq_comparison - INFO - DEBUG HASH RESULT: cd1c108d...
2026-01-09 18:22:56,233 - dq_comparison - INFO - DEBUG HASH ROW: CustomerID: '13' -> '13' | JoinDate: '2023-11-11 00:00:00' -> '2023-11-11' | PhoneNumber: '+1-737-364-1639' -> '17373641639' | Email: 'michael.williams@example.com' -> 'michael.williams@example.com' | Salary: '95775' -> '95775'
2026-01-09 18:22:56,234 - dq_comparison - INFO - DEBUG HASH STRING: 13|2023-11-11|17373641639|michael.williams@example.com|95775...
2026-01-09 18:22:56,235 - dq_comparison - INFO - DEBUG HASH RESULT: 24635ed8...
2026-01-09 18:22:56,237 - dq_comparison - INFO - DEBUG HASH ROW: CustomerID: '14' -> '14' | JoinDate: '2025-02-16 00:00:00' -> '2025-02-16' | PhoneNumber: '+1-637-238-5096' -> '16372385096' | Email: 'jennifer.white@example.com' -> 'jennifer.white@example.com' | Salary: '83452' -> '83452'
2026-01-09 18:22:56,238 - dq_comparison - INFO - DEBUG HASH STRING: 14|2025-02-16|16372385096|jennifer.white@example.com|83452...
2026-01-09 18:22:56,240 - dq_comparison - INFO - DEBUG HASH RESULT: 0fa50d5f...
2026-01-09 18:22:56,241 - dq_comparison - INFO - DEBUG HASH ROW: CustomerID: '15' -> '15' | JoinDate: '2024-05-21 00:00:00' -> '2024-05-21' | PhoneNumber: '+1-951-293-1968' -> '19512931968' | Email: 'shawn.park@example.com' -> 'shawn.park@example.com' | Salary: '98946' -> '98946'
2026-01-09 18:22:56,242 - dq_comparison - INFO - DEBUG HASH STRING: 15|2024-05-21|19512931968|shawn.park@example.com|98946...
2026-01-09 18:22:56,243 - dq_comparison - INFO - DEBUG HASH RESULT: 2b4e679b...
2026-01-09 18:22:56,245 - dq_comparison - INFO - DEBUG HASH ROW: CustomerID: '16' -> '16' | JoinDate: '2024-02-09 00:00:00' -> '2024-02-09' | PhoneNumber: '+1-941-392-5177' -> '19413925177' | Email: 'jill.robertson@example.com' -> 'jill.robertson@example.com' | Salary: '49573' -> '49573'
2026-01-09 18:22:56,246 - dq_comparison - INFO - DEBUG HASH STRING: 16|2024-02-09|19413925177|jill.robertson@example.com|49573...
2026-01-09 18:22:56,247 - dq_comparison - INFO - DEBUG HASH RESULT: f7a9a096...
2026-01-09 18:22:56,248 - dq_comparison - INFO - DEBUG HASH ROW: CustomerID: '17' -> '17' | JoinDate: '2025-07-04 00:00:00' -> '2025-07-04' | PhoneNumber: '+1-964-203-5421' -> '19642035421' | Email: 'robert.lyons@example.com' -> 'robert.lyons@example.com' | Salary: '36536' -> '36536'
2026-01-09 18:22:56,250 - dq_comparison - INFO - DEBUG HASH STRING: 17|2025-07-04|19642035421|robert.lyons@example.com|36536...
2026-01-09 18:22:56,251 - dq_comparison - INFO - DEBUG HASH RESULT: 183c38dd...
2026-01-09 18:22:56,252 - dq_comparison - INFO - DEBUG HASH ROW: CustomerID: '18' -> '18' | JoinDate: '2023-01-09 00:00:00' -> '2023-01-09' | PhoneNumber: '+1-475-348-6863' -> '14753486863' | Email: 'jacob.acevedo@example.com' -> 'jacob.acevedo@example.com' | Salary: '34641' -> '34641'
2026-01-09 18:22:56,253 - dq_comparison - INFO - DEBUG HASH STRING: 18|2023-01-09|14753486863|jacob.acevedo@example.com|34641...
2026-01-09 18:22:56,254 - dq_comparison - INFO - DEBUG HASH RESULT: 9e386622...
2026-01-09 18:22:56,255 - dq_comparison - INFO - DEBUG HASH ROW: CustomerID: '19' -> '19' | JoinDate: '2023-09-22 00:00:00' -> '2023-09-22' | PhoneNumber: '+1-420-770-9601' -> '14207709601' | Email: 'christina.park@example.com' -> 'christina.park@example.com' | Salary: '106994' -> '106994'
2026-01-09 18:22:56,255 - dq_comparison - INFO - DEBUG HASH STRING: 19|2023-09-22|14207709601|christina.park@example.com|106994...
2026-01-09 18:22:56,256 - dq_comparison - INFO - DEBUG HASH RESULT: a081a0cf...
2026-01-09 18:22:56,256 - dq_comparison - INFO - DEBUG HASH ROW: CustomerID: '20' -> '20' | JoinDate: '2023-04-22 00:00:00' -> '2023-04-22' | PhoneNumber: '+1-886-250-3880' -> '18862503880' | Email: 'barbara.morgan@example.com' -> 'barbara.morgan@example.com' | Salary: '38187' -> '38187'
2026-01-09 18:22:56,257 - dq_comparison - INFO - DEBUG HASH STRING: 20|2023-04-22|18862503880|barbara.morgan@example.com|38187...
2026-01-09 18:22:56,258 - dq_comparison - INFO - DEBUG HASH RESULT: 874b173f...
2026-01-09 18:22:56,259 - dq_comparison - INFO - DEBUG HASH ROW: CustomerID: '21' -> '21' | JoinDate: '2024-07-22 00:00:00' -> '2024-07-22' | PhoneNumber: '0403564312' -> '403564312' | Email: 'april.lee@example.com' -> 'april.lee@example.com' | Salary: '71935' -> '71935'
2026-01-09 18:22:56,260 - dq_comparison - INFO - DEBUG HASH STRING: 21|2024-07-22|403564312|april.lee@example.com|71935...
2026-01-09 18:22:56,261 - dq_comparison - INFO - DEBUG HASH RESULT: d562ba0e...
2026-01-09 18:22:56,262 - dq_comparison - INFO - DEBUG HASH ROW: CustomerID: '22' -> '22' | JoinDate: '2025-07-27 00:00:00' -> '2025-07-27' | PhoneNumber: '0596727654' -> '596727654' | Email: 'christina.morrison@example.com' -> 'christina.morrison@example.com' | Salary: '100357' -> '100357'
2026-01-09 18:22:56,263 - dq_comparison - INFO - DEBUG HASH STRING: 22|2025-07-27|596727654|christina.morrison@example.com|100357...
2026-01-09 18:22:56,263 - dq_comparison - INFO - DEBUG HASH RESULT: aa691506...
2026-01-09 18:22:56,264 - dq_comparison - INFO - DEBUG HASH ROW: CustomerID: '23' -> '23' | JoinDate: '2023-10-27 00:00:00' -> '2023-10-27' | PhoneNumber: '0669882738' -> '669882738' | Email: 'jennifer.morgan@example.com' -> 'jennifer.morgan@example.com' | Salary: '74962' -> '74962'
2026-01-09 18:22:56,265 - dq_comparison - INFO - DEBUG HASH STRING: 23|2023-10-27|669882738|jennifer.morgan@example.com|74962...
2026-01-09 18:22:56,266 - dq_comparison - INFO - DEBUG HASH RESULT: c033cdce...
2026-01-09 18:22:56,267 - dq_comparison - INFO - DEBUG HASH ROW: CustomerID: '24' -> '24' | JoinDate: '2021-01-20 00:00:00' -> '2021-01-20' | PhoneNumber: '0706194796' -> '706194796' | Email: 'david.duran@example.com' -> 'david.duran@example.com' | Salary: '98121' -> '98121'
2026-01-09 18:22:56,268 - dq_comparison - INFO - DEBUG HASH STRING: 24|2021-01-20|706194796|david.duran@example.com|98121...
2026-01-09 18:22:56,268 - dq_comparison - INFO - DEBUG HASH RESULT: 51890584...
2026-01-09 18:22:56,269 - dq_comparison - INFO - DEBUG HASH ROW: CustomerID: '25' -> '25' | JoinDate: '2021-12-30 00:00:00' -> '2021-12-30' | PhoneNumber: '0971341309' -> '971341309' | Email: 'jordan.wood@example.com' -> 'jordan.wood@example.com' | Salary: '45422' -> '45422'
2026-01-09 18:22:56,270 - dq_comparison - INFO - DEBUG HASH STRING: 25|2021-12-30|971341309|jordan.wood@example.com|45422...
2026-01-09 18:22:56,270 - dq_comparison - INFO - DEBUG HASH RESULT: fa6c3863...
2026-01-09 18:22:56,270 - dq_comparison - INFO - DEBUG HASH ROW: CustomerID: '26' -> '26' | JoinDate: '2024-01-16 00:00:00' -> '2024-01-16' | PhoneNumber: '0899898226' -> '899898226' | Email: 'jeffrey.freeman@example.com' -> 'jeffrey.freeman@example.com' | Salary: '111634' -> '111634'
2026-01-09 18:22:56,271 - dq_comparison - INFO - DEBUG HASH STRING: 26|2024-01-16|899898226|jeffrey.freeman@example.com|111634...
2026-01-09 18:22:56,271 - dq_comparison - INFO - DEBUG HASH RESULT: a44cca1a...
2026-01-09 18:22:56,272 - dq_comparison - INFO - DEBUG HASH ROW: CustomerID: '27' -> '27' | JoinDate: '2024-01-01 00:00:00' -> '2024-01-01' | PhoneNumber: '0622773601' -> '622773601' | Email: 'elizabeth.wright@example.com' -> 'elizabeth.wright@example.com' | Salary: '99097' -> '99097'
2026-01-09 18:22:56,272 - dq_comparison - INFO - DEBUG HASH STRING: 27|2024-01-01|622773601|elizabeth.wright@example.com|99097...
2026-01-09 18:22:56,273 - dq_comparison - INFO - DEBUG HASH RESULT: 317624fe...
2026-01-09 18:22:56,274 - dq_comparison - INFO - DEBUG HASH ROW: CustomerID: '28' -> '28' | JoinDate: '2024-11-03 00:00:00' -> '2024-11-03' | PhoneNumber: '0399227427' -> '399227427' | Email: 'martin.reed@example.com' -> 'martin.reed@example.com' | Salary: '114429' -> '114429'
2026-01-09 18:22:56,274 - dq_comparison - INFO - DEBUG HASH STRING: 28|2024-11-03|399227427|martin.reed@example.com|114429...
2026-01-09 18:22:56,274 - dq_comparison - INFO - DEBUG HASH RESULT: 11816455...
2026-01-09 18:22:56,275 - dq_comparison - INFO - DEBUG HASH ROW: CustomerID: '29' -> '29' | JoinDate: '2022-06-02 00:00:00' -> '2022-06-02' | PhoneNumber: '0219444645' -> '219444645' | Email: 'elizabeth.lane@example.com' -> 'elizabeth.lane@example.com' | Salary: '93270' -> '93270'
2026-01-09 18:22:56,276 - dq_comparison - INFO - DEBUG HASH STRING: 29|2022-06-02|219444645|elizabeth.lane@example.com|93270...
2026-01-09 18:22:56,276 - dq_comparison - INFO - DEBUG HASH RESULT: a21e6b72...
2026-01-09 18:22:56,277 - dq_comparison - INFO - DEBUG HASH ROW: CustomerID: '30' -> '30' | JoinDate: '2025-09-21 00:00:00' -> '2025-09-21' | PhoneNumber: '0195605788' -> '195605788' | Email: 'michael.jordan@example.com' -> 'michael.jordan@example.com' | Salary: '76901' -> '76901'
2026-01-09 18:22:56,277 - dq_comparison - INFO - DEBUG HASH STRING: 30|2025-09-21|195605788|michael.jordan@example.com|76901...
2026-01-09 18:22:56,278 - dq_comparison - INFO - DEBUG HASH RESULT: f7c770bd...
2026-01-09 18:22:56,279 - dq_comparison - INFO - DEBUG HASH ROW: CustomerID: '31' -> '31' | JoinDate: '2024-10-19 00:00:00' -> '2024-10-19' | PhoneNumber: '+1-716-509-9686' -> '17165099686' | Email: 'edward.ramirez@example.com' -> 'edward.ramirez@example.com' | Salary: '40447' -> '40447'
2026-01-09 18:22:56,279 - dq_comparison - INFO - DEBUG HASH STRING: 31|2024-10-19|17165099686|edward.ramirez@example.com|40447...
2026-01-09 18:22:56,280 - dq_comparison - INFO - DEBUG HASH RESULT: f098e2bd...
2026-01-09 18:22:56,281 - dq_comparison - INFO - DEBUG HASH ROW: CustomerID: '32' -> '32' | JoinDate: '2024-09-05 00:00:00' -> '2024-09-05' | PhoneNumber: '+1-660-836-5984' -> '16608365984' | Email: 'linda.melendez@example.com' -> 'linda.melendez@example.com' | Salary: '117596' -> '117596'
2026-01-09 18:22:56,281 - dq_comparison - INFO - DEBUG HASH STRING: 32|2024-09-05|16608365984|linda.melendez@example.com|117596...
2026-01-09 18:22:56,282 - dq_comparison - INFO - DEBUG HASH RESULT: d0e14f1a...
2026-01-09 18:22:56,282 - dq_comparison - INFO - DEBUG HASH ROW: CustomerID: '33' -> '33' | JoinDate: '2025-08-08 00:00:00' -> '2025-08-08' | PhoneNumber: '+1-944-778-2259' -> '19447782259' | Email: 'douglas.smith@example.com' -> 'douglas.smith@example.com' | Salary: '44106' -> '44106'
2026-01-09 18:22:56,283 - dq_comparison - INFO - DEBUG HASH STRING: 33|2025-08-08|19447782259|douglas.smith@example.com|44106...
2026-01-09 18:22:56,283 - dq_comparison - INFO - DEBUG HASH RESULT: c936ba7e...
2026-01-09 18:22:56,284 - dq_comparison - INFO - DEBUG HASH ROW: CustomerID: '34' -> '34' | JoinDate: '2021-07-30 00:00:00' -> '2021-07-30' | PhoneNumber: '+1-281-577-8777' -> '12815778777' | Email: 'nathaniel.white@example.com' -> 'nathaniel.white@example.com' | Salary: '85426' -> '85426'
2026-01-09 18:22:56,285 - dq_comparison - INFO - DEBUG HASH STRING: 34|2021-07-30|12815778777|nathaniel.white@example.com|85426...
2026-01-09 18:22:56,286 - dq_comparison - INFO - DEBUG HASH RESULT: cebd334c...
2026-01-09 18:22:56,287 - dq_comparison - INFO - DEBUG HASH ROW: CustomerID: '35' -> '35' | JoinDate: '2022-11-02 00:00:00' -> '2022-11-02' | PhoneNumber: '+1-671-720-4369' -> '16717204369' | Email: 'connie.nguyen@example.com' -> 'connie.nguyen@example.com' | Salary: '88819' -> '88819'
2026-01-09 18:22:56,287 - dq_comparison - INFO - DEBUG HASH STRING: 35|2022-11-02|16717204369|connie.nguyen@example.com|88819...
2026-01-09 18:22:56,288 - dq_comparison - INFO - DEBUG HASH RESULT: 29f26743...
2026-01-09 18:22:56,288 - dq_comparison - INFO - DEBUG HASH ROW: CustomerID: '36' -> '36' | JoinDate: '2021-04-15 00:00:00' -> '2021-04-15' | PhoneNumber: '+1-629-815-7499' -> '16298157499' | Email: 'LISA.WOODS@EXAMPLE.COM' -> 'lisa.woods@example.com' | Salary: '61162' -> '61162'
2026-01-09 18:22:56,289 - dq_comparison - INFO - DEBUG HASH STRING: 36|2021-04-15|16298157499|lisa.woods@example.com|61162...
2026-01-09 18:22:56,289 - dq_comparison - INFO - DEBUG HASH RESULT: 9488b5f1...
2026-01-09 18:22:56,290 - dq_comparison - INFO - DEBUG HASH ROW: CustomerID: '37' -> '37' | JoinDate: '2024-03-03 00:00:00' -> '2024-03-03' | PhoneNumber: '+1-327-345-2277' -> '13273452277' | Email: 'JEANNE.NICHOLS@EXAMPLE.COM' -> 'jeanne.nichols@example.com' | Salary: '98239' -> '98239'
2026-01-09 18:22:56,290 - dq_comparison - INFO - DEBUG HASH STRING: 37|2024-03-03|13273452277|jeanne.nichols@example.com|98239...
2026-01-09 18:22:56,291 - dq_comparison - INFO - DEBUG HASH RESULT: 93c7b5b5...
2026-01-09 18:22:56,292 - dq_comparison - INFO - DEBUG HASH ROW: CustomerID: '38' -> '38' | JoinDate: '2021-09-23 00:00:00' -> '2021-09-23' | PhoneNumber: '+1-600-977-2209' -> '16009772209' | Email: 'LOGAN.GROSS@EXAMPLE.COM' -> 'logan.gross@example.com' | Salary: '60926' -> '60926'
2026-01-09 18:22:56,292 - dq_comparison - INFO - DEBUG HASH STRING: 38|2021-09-23|16009772209|logan.gross@example.com|60926...
2026-01-09 18:22:56,293 - dq_comparison - INFO - DEBUG HASH RESULT: 4cde7c75...
2026-01-09 18:22:56,294 - dq_comparison - INFO - DEBUG HASH ROW: CustomerID: '39' -> '39' | JoinDate: '2021-06-08 00:00:00' -> '2021-06-08' | PhoneNumber: '+1-912-484-4553' -> '19124844553' | Email: 'KEVIN.YATES@EXAMPLE.COM' -> 'kevin.yates@example.com' | Salary: '111507' -> '111507'
2026-01-09 18:22:56,294 - dq_comparison - INFO - DEBUG HASH STRING: 39|2021-06-08|19124844553|kevin.yates@example.com|111507...
2026-01-09 18:22:56,295 - dq_comparison - INFO - DEBUG HASH RESULT: 35076358...
2026-01-09 18:22:56,296 - dq_comparison - INFO - DEBUG HASH ROW: CustomerID: '40' -> '40' | JoinDate: '2025-05-06 00:00:00' -> '2025-05-06' | PhoneNumber: '+1-689-889-6864' -> '16898896864' | Email: 'LISA.MOORE@EXAMPLE.COM' -> 'lisa.moore@example.com' | Salary: '34060' -> '34060'
2026-01-09 18:22:56,296 - dq_comparison - INFO - DEBUG HASH STRING: 40|2025-05-06|16898896864|lisa.moore@example.com|34060...
2026-01-09 18:22:56,297 - dq_comparison - INFO - DEBUG HASH RESULT: c39d1a28...
2026-01-09 18:22:56,298 - dq_comparison - INFO - DEBUG HASH ROW: CustomerID: '41' -> '41' | JoinDate: '2021-01-17 00:00:00' -> '2021-01-17' | PhoneNumber: '+1-530-864-6060' -> '15308646060' | Email: 'scott.ashley@example.com' -> 'scott.ashley@example.com' | Salary: '113363' -> '113363'
2026-01-09 18:22:56,299 - dq_comparison - INFO - DEBUG HASH STRING: 41|2021-01-17|15308646060|scott.ashley@example.com|113363...
2026-01-09 18:22:56,301 - dq_comparison - INFO - DEBUG HASH RESULT: 897bab89...
2026-01-09 18:22:56,301 - dq_comparison - INFO - DEBUG HASH ROW: CustomerID: '42' -> '42' | JoinDate: '2021-08-01 00:00:00' -> '2021-08-01' | PhoneNumber: '+1-485-825-9723' -> '14858259723' | Email: 'david.baker@example.com' -> 'david.baker@example.com' | Salary: '93681' -> '93681'
2026-01-09 18:22:56,301 - dq_comparison - INFO - DEBUG HASH STRING: 42|2021-08-01|14858259723|david.baker@example.com|93681...
2026-01-09 18:22:56,302 - dq_comparison - INFO - DEBUG HASH RESULT: cfdaccbd...
2026-01-09 18:22:56,303 - dq_comparison - INFO - DEBUG HASH ROW: CustomerID: '43' -> '43' | JoinDate: '2023-08-22 00:00:00' -> '2023-08-22' | PhoneNumber: '+1-983-307-2254' -> '19833072254' | Email: 'rachel.rodriguez@example.com' -> 'rachel.rodriguez@example.com' | Salary: '77279' -> '77279'
2026-01-09 18:22:56,303 - dq_comparison - INFO - DEBUG HASH STRING: 43|2023-08-22|19833072254|rachel.rodriguez@example.com|77279...
2026-01-09 18:22:56,304 - dq_comparison - INFO - DEBUG HASH RESULT: 4119ac6e...
2026-01-09 18:22:56,304 - dq_comparison - INFO - DEBUG HASH ROW: CustomerID: '44' -> '44' | JoinDate: '2022-06-21 00:00:00' -> '2022-06-21' | PhoneNumber: '+1-402-864-9184' -> '14028649184' | Email: 'jonathan.brown@example.com' -> 'jonathan.brown@example.com' | Salary: '84295' -> '84295'
2026-01-09 18:22:56,305 - dq_comparison - INFO - DEBUG HASH STRING: 44|2022-06-21|14028649184|jonathan.brown@example.com|84295...
2026-01-09 18:22:56,305 - dq_comparison - INFO - DEBUG HASH RESULT: 0fcea539...
2026-01-09 18:22:56,306 - dq_comparison - INFO - DEBUG HASH ROW: CustomerID: '45' -> '45' | JoinDate: '2024-06-02 00:00:00' -> '2024-06-02' | PhoneNumber: '+1-672-650-2869' -> '16726502869' | Email: 'stephanie.jordan@example.com' -> 'stephanie.jordan@example.com' | Salary: '62444' -> '62444'
2026-01-09 18:22:56,306 - dq_comparison - INFO - DEBUG HASH STRING: 45|2024-06-02|16726502869|stephanie.jordan@example.com|62444...
2026-01-09 18:22:56,307 - dq_comparison - INFO - DEBUG HASH RESULT: 6cf7bb3c...
2026-01-09 18:22:56,309 - dq_comparison - INFO - DEBUG HASH ROW: CustomerID: '46' -> '46' | JoinDate: '2024-02-27 00:00:00' -> '2024-02-27' | PhoneNumber: '+1-438-318-4192' -> '14383184192' | Email: 'kathleen.medina@example.com' -> 'kathleen.medina@example.com' | Salary: '108150' -> '108150'
2026-01-09 18:22:56,310 - dq_comparison - INFO - DEBUG HASH STRING: 46|2024-02-27|14383184192|kathleen.medina@example.com|108150...
2026-01-09 18:22:56,310 - dq_comparison - INFO - DEBUG HASH RESULT: a41285c0...
2026-01-09 18:22:56,312 - dq_comparison - INFO - DEBUG HASH ROW: CustomerID: '47' -> '47' | JoinDate: '2025-10-18 00:00:00' -> '2025-10-18' | PhoneNumber: '+1-968-819-8427' -> '19688198427' | Email: 'donna.melton@example.com' -> 'donna.melton@example.com' | Salary: '55606' -> '55606'
2026-01-09 18:22:56,312 - dq_comparison - INFO - DEBUG HASH STRING: 47|2025-10-18|19688198427|donna.melton@example.com|55606...
2026-01-09 18:22:56,313 - dq_comparison - INFO - DEBUG HASH RESULT: fd05233d...
2026-01-09 18:22:56,314 - dq_comparison - INFO - DEBUG HASH ROW: CustomerID: '48' -> '48' | JoinDate: '2021-03-08 00:00:00' -> '2021-03-08' | PhoneNumber: '+1-583-701-8389' -> '15837018389' | Email: 'connor.hull@example.com' -> 'connor.hull@example.com' | Salary: '65948' -> '65948'
2026-01-09 18:22:56,315 - dq_comparison - INFO - DEBUG HASH STRING: 48|2021-03-08|15837018389|connor.hull@example.com|65948...
2026-01-09 18:22:56,316 - dq_comparison - INFO - DEBUG HASH RESULT: e91fdd88...
2026-01-09 18:22:56,317 - dq_comparison - INFO - DEBUG HASH ROW: CustomerID: '49' -> '49' | JoinDate: '2022-05-13 00:00:00' -> '2022-05-13' | PhoneNumber: '+1-470-353-5746' -> '14703535746' | Email: 'stacey.jacobs@example.com' -> 'stacey.jacobs@example.com' | Salary: '38311' -> '38311'
2026-01-09 18:22:56,317 - dq_comparison - INFO - DEBUG HASH STRING: 49|2022-05-13|14703535746|stacey.jacobs@example.com|38311...
2026-01-09 18:22:56,318 - dq_comparison - INFO - DEBUG HASH RESULT: 5c8da8ff...
2026-01-09 18:22:56,319 - dq_comparison - INFO - DEBUG HASH ROW: CustomerID: '50' -> '50' | JoinDate: '2023-12-03 00:00:00' -> '2023-12-03' | PhoneNumber: '+1-901-861-1701' -> '19018611701' | Email: 'mark.lester@example.com' -> 'mark.lester@example.com' | Salary: '37605' -> '37605'
2026-01-09 18:22:56,319 - dq_comparison - INFO - DEBUG HASH STRING: 50|2023-12-03|19018611701|mark.lester@example.com|37605...
2026-01-09 18:22:56,320 - dq_comparison - INFO - DEBUG HASH RESULT: a8f12ff2...
2026-01-09 18:22:56,320 - dq_comparison - INFO - === DEBUG: SAMPLE HASHES ===
2026-01-09 18:22:56,321 - dq_comparison - INFO - Hash 1: b4800c3231398f1c... (sample row 0)
2026-01-09 18:22:56,322 - dq_comparison - INFO - Hash 2: 4197d21c82faabe1... (sample row 1)
2026-01-09 18:22:56,322 - dq_comparison - INFO - Hash 3: 714db70537b0a85c... (sample row 2)
2026-01-09 18:22:56,323 - dq_comparison - INFO - Generating hashes for target data (50 rows)...
2026-01-09 18:22:56,331 - dq_comparison - INFO - 
======================================================================
2026-01-09 18:22:56,331 - dq_comparison - INFO - 🔍 DEBUG: ANALYZING WHY HASHES DON'T MATCH
2026-01-09 18:22:56,332 - dq_comparison - INFO - ======================================================================
2026-01-09 18:22:56,333 - dq_comparison - INFO - 
--- Analyzing Row 0 ---
2026-01-09 18:22:56,333 - dq_comparison - INFO - Column 'CustomerID' → 'CustomerID':
2026-01-09 18:22:56,334 - dq_comparison - INFO -   Source: '1' (type: int64) → '1'
2026-01-09 18:22:56,334 - dq_comparison - INFO -   Target: '1' (type: int64) → '1'
2026-01-09 18:22:56,335 - dq_comparison - INFO -   Match after normalization: ✅ YES
2026-01-09 18:22:56,335 - dq_comparison - INFO - Column 'JoinDate' → 'JoinDate':
2026-01-09 18:22:56,336 - dq_comparison - INFO -   Source: '2025-10-26 00:00:00' (type: Timestamp) → '2025-10-26'
2026-01-09 18:22:56,336 - dq_comparison - INFO -   Target: '26-10-2025' (type: str) → '2025-10-26'
2026-01-09 18:22:56,337 - dq_comparison - INFO -   Match after normalization: ✅ YES
2026-01-09 18:22:56,337 - dq_comparison - INFO - Column 'PhoneNumber' → 'PhoneNumber':
2026-01-09 18:22:56,338 - dq_comparison - INFO -   Source: '+1-486-229-5375' (type: str) → '14862295375'
2026-01-09 18:22:56,339 - dq_comparison - INFO -   Target: '-6089' (type: int64) → '6089'
2026-01-09 18:22:56,339 - dq_comparison - INFO -   Match after normalization: ❌ NO
2026-01-09 18:22:56,340 - dq_comparison - INFO - Column 'Email' → 'Email':
2026-01-09 18:22:56,340 - dq_comparison - INFO -   Source: 'mark.morris@example.com' (type: str) → 'mark.morris@example.com'
2026-01-09 18:22:56,341 - dq_comparison - INFO -   Target: 'mark.morris@example.com' (type: str) → 'mark.morris@example.com'
2026-01-09 18:22:56,341 - dq_comparison - INFO -   Match after normalization: ✅ YES
2026-01-09 18:22:56,342 - dq_comparison - INFO - Column 'Salary' → 'Salary':
2026-01-09 18:22:56,343 - dq_comparison - INFO -   Source: '111916' (type: int64) → '111916'
2026-01-09 18:22:56,343 - dq_comparison - INFO -   Target: '111916' (type: int64) → '111916'
2026-01-09 18:22:56,344 - dq_comparison - INFO -   Match after normalization: ✅ YES
2026-01-09 18:22:56,344 - dq_comparison - INFO - 
Hash components for Row 0:
2026-01-09 18:22:56,345 - dq_comparison - INFO - Source hash string start: 1|2025-10-26|14862295375...
2026-01-09 18:22:56,345 - dq_comparison - INFO - Target hash string start: 1|2025-10-26|6089...
2026-01-09 18:22:56,346 - dq_comparison - INFO - Same? ❌ NO
2026-01-09 18:22:56,346 - dq_comparison - INFO - 
--- Analyzing Row 1 ---
2026-01-09 18:22:56,347 - dq_comparison - INFO - Column 'CustomerID' → 'CustomerID':
2026-01-09 18:22:56,347 - dq_comparison - INFO -   Source: '2' (type: int64) → '2'
2026-01-09 18:22:56,348 - dq_comparison - INFO -   Target: '2' (type: int64) → '2'
2026-01-09 18:22:56,348 - dq_comparison - INFO -   Match after normalization: ✅ YES
2026-01-09 18:22:56,349 - dq_comparison - INFO - Column 'JoinDate' → 'JoinDate':
2026-01-09 18:22:56,349 - dq_comparison - INFO -   Source: '2025-05-31 00:00:00' (type: Timestamp) → '2025-05-31'
2026-01-09 18:22:56,350 - dq_comparison - INFO -   Target: '31-05-2025' (type: str) → '2025-05-31'
2026-01-09 18:22:56,350 - dq_comparison - INFO -   Match after normalization: ✅ YES
2026-01-09 18:22:56,351 - dq_comparison - INFO - Column 'PhoneNumber' → 'PhoneNumber':
2026-01-09 18:22:56,351 - dq_comparison - INFO -   Source: '+1-844-558-1893' (type: str) → '18445581893'
2026-01-09 18:22:56,351 - dq_comparison - INFO -   Target: '-3294' (type: int64) → '3294'
2026-01-09 18:22:56,352 - dq_comparison - INFO -   Match after normalization: ❌ NO
2026-01-09 18:22:56,352 - dq_comparison - INFO - Column 'Email' → 'Email':
2026-01-09 18:22:56,353 - dq_comparison - INFO -   Source: 'dennis.owens@example.com' (type: str) → 'dennis.owens@example.com'
2026-01-09 18:22:56,353 - dq_comparison - INFO -   Target: 'dennis.owens@example.com' (type: str) → 'dennis.owens@example.com'
2026-01-09 18:22:56,355 - dq_comparison - INFO -   Match after normalization: ✅ YES
2026-01-09 18:22:56,355 - dq_comparison - INFO - Column 'Salary' → 'Salary':
2026-01-09 18:22:56,356 - dq_comparison - INFO -   Source: '39264' (type: int64) → '39264'
2026-01-09 18:22:56,356 - dq_comparison - INFO -   Target: '39264' (type: int64) → '39264'
2026-01-09 18:22:56,357 - dq_comparison - INFO -   Match after normalization: ✅ YES
2026-01-09 18:22:56,357 - dq_comparison - INFO - 
Hash components for Row 1:
2026-01-09 18:22:56,358 - dq_comparison - INFO - Source hash string start: 2|2025-05-31|18445581893...
2026-01-09 18:22:56,358 - dq_comparison - INFO - Target hash string start: 2|2025-05-31|3294...
2026-01-09 18:22:56,359 - dq_comparison - INFO - Same? ❌ NO
2026-01-09 18:22:56,359 - dq_comparison - INFO - 
--- Analyzing Row 2 ---
2026-01-09 18:22:56,360 - dq_comparison - INFO - Column 'CustomerID' → 'CustomerID':
2026-01-09 18:22:56,361 - dq_comparison - INFO -   Source: '3' (type: int64) → '3'
2026-01-09 18:22:56,361 - dq_comparison - INFO -   Target: '3' (type: int64) → '3'
2026-01-09 18:22:56,362 - dq_comparison - INFO -   Match after normalization: ✅ YES
2026-01-09 18:22:56,362 - dq_comparison - INFO - Column 'JoinDate' → 'JoinDate':
2026-01-09 18:22:56,363 - dq_comparison - INFO -   Source: '2024-03-31 00:00:00' (type: Timestamp) → '2024-03-31'
2026-01-09 18:22:56,363 - dq_comparison - INFO -   Target: '31-03-2024' (type: str) → '2024-03-31'
2026-01-09 18:22:56,363 - dq_comparison - INFO -   Match after normalization: ✅ YES
2026-01-09 18:22:56,364 - dq_comparison - INFO - Column 'PhoneNumber' → 'PhoneNumber':
2026-01-09 18:22:56,364 - dq_comparison - INFO -   Source: '+1-910-312-9640' (type: str) → '19103129640'
2026-01-09 18:22:56,365 - dq_comparison - INFO -   Target: '-10861' (type: int64) → '10861'
2026-01-09 18:22:56,365 - dq_comparison - INFO -   Match after normalization: ❌ NO
2026-01-09 18:22:56,366 - dq_comparison - INFO - Column 'Email' → 'Email':
2026-01-09 18:22:56,366 - dq_comparison - INFO -   Source: 'felicia.hatfield@example.com' (type: str) → 'felicia.hatfield@example.com'
2026-01-09 18:22:56,367 - dq_comparison - INFO -   Target: 'felicia.hatfield@example.com' (type: str) → 'felicia.hatfield@example.com'
2026-01-09 18:22:56,367 - dq_comparison - INFO -   Match after normalization: ✅ YES
2026-01-09 18:22:56,367 - dq_comparison - INFO - Column 'Salary' → 'Salary':
2026-01-09 18:22:56,368 - dq_comparison - INFO -   Source: '41191' (type: int64) → '41191'
2026-01-09 18:22:56,368 - dq_comparison - INFO -   Target: '41191' (type: int64) → '41191'
2026-01-09 18:22:56,369 - dq_comparison - INFO -   Match after normalization: ✅ YES
2026-01-09 18:22:56,369 - dq_comparison - INFO - 
Hash components for Row 2:
2026-01-09 18:22:56,370 - dq_comparison - INFO - Source hash string start: 3|2024-03-31|19103129640...
2026-01-09 18:22:56,370 - dq_comparison - INFO - Target hash string start: 3|2024-03-31|10861...
2026-01-09 18:22:56,370 - dq_comparison - INFO - Same? ❌ NO
2026-01-09 18:22:56,371 - dq_comparison - INFO - 
--- Column Data Types Analysis ---
2026-01-09 18:22:56,371 - dq_comparison - INFO - Column 1: 'CustomerID' (int64) ↔ 'CustomerID' (int64)
2026-01-09 18:22:56,372 - dq_comparison - INFO -   Sample: Source='1', Target='1'
2026-01-09 18:22:56,372 - dq_comparison - INFO - Column 2: 'JoinDate' (datetime64[ns]) ↔ 'JoinDate' (object)
2026-01-09 18:22:56,373 - dq_comparison - INFO -   Sample: Source='2025-10-26 00:00:00', Target='26-10-2025'
2026-01-09 18:22:56,373 - dq_comparison - INFO - Column 3: 'PhoneNumber' (object) ↔ 'PhoneNumber' (int64)
2026-01-09 18:22:56,374 - dq_comparison - INFO -   Sample: Source='+1-486-229-5375', Target='-6089'
2026-01-09 18:22:56,375 - dq_comparison - INFO - Column 4: 'Email' (object) ↔ 'Email' (object)
2026-01-09 18:22:56,376 - dq_comparison - INFO -   Sample: Source='mark.morris@example.com', Target='mark.morris@example.com'
2026-01-09 18:22:56,377 - dq_comparison - INFO - Column 5: 'Salary' (int64) ↔ 'Salary' (int64)
2026-01-09 18:22:56,378 - dq_comparison - INFO -   Sample: Source='111916', Target='111916'
2026-01-09 18:22:56,378 - dq_comparison - INFO - === DEBUG: DIRECT ROW COMPARISON ===
2026-01-09 18:22:56,379 - dq_comparison - INFO - --- Comparing Row 0 ---
2026-01-09 18:22:56,380 - dq_comparison - INFO -   ✅ CustomerID: '1' → '1' vs '1' → '1'
2026-01-09 18:22:56,381 - dq_comparison - INFO -   ✅ JoinDate: '2025-10-26 00:00:00' → '2025-10-26' vs '26-10-2025' → '2025-10-26'
2026-01-09 18:22:56,382 - dq_comparison - INFO -   ❌ PhoneNumber: '+1-486-229-5375' → '14862295375' vs '-6089' → '6089'
2026-01-09 18:22:56,383 - dq_comparison - INFO -     Mismatch type: <class 'str'> vs <class 'numpy.int64'>
2026-01-09 18:22:56,384 - dq_comparison - INFO -   ✅ Email: 'mark.morris@example.com' → 'mark.morris@example.com' vs 'mark.morris@example.com' → 'mark.morris@example.com'
2026-01-09 18:22:56,385 - dq_comparison - INFO -   ✅ Salary: '111916' → '111916' vs '111916' → '111916'
2026-01-09 18:22:56,386 - dq_comparison - INFO - --- Comparing Row 1 ---
2026-01-09 18:22:56,387 - dq_comparison - INFO -   ✅ CustomerID: '2' → '2' vs '2' → '2'
2026-01-09 18:22:56,388 - dq_comparison - INFO -   ✅ JoinDate: '2025-05-31 00:00:00' → '2025-05-31' vs '31-05-2025' → '2025-05-31'
2026-01-09 18:22:56,389 - dq_comparison - INFO -   ❌ PhoneNumber: '+1-844-558-1893' → '18445581893' vs '-3294' → '3294'
2026-01-09 18:22:56,390 - dq_comparison - INFO -     Mismatch type: <class 'str'> vs <class 'numpy.int64'>
2026-01-09 18:22:56,391 - dq_comparison - INFO -   ✅ Email: 'dennis.owens@example.com' → 'dennis.owens@example.com' vs 'dennis.owens@example.com' → 'dennis.owens@example.com'
2026-01-09 18:22:56,391 - dq_comparison - INFO -   ✅ Salary: '39264' → '39264' vs '39264' → '39264'
2026-01-09 18:22:56,392 - dq_comparison - INFO - --- Comparing Row 2 ---
2026-01-09 18:22:56,392 - dq_comparison - INFO -   ✅ CustomerID: '3' → '3' vs '3' → '3'
2026-01-09 18:22:56,393 - dq_comparison - INFO -   ✅ JoinDate: '2024-03-31 00:00:00' → '2024-03-31' vs '31-03-2024' → '2024-03-31'
2026-01-09 18:22:56,394 - dq_comparison - INFO -   ❌ PhoneNumber: '+1-910-312-9640' → '19103129640' vs '-10861' → '10861'
2026-01-09 18:22:56,394 - dq_comparison - INFO -     Mismatch type: <class 'str'> vs <class 'numpy.int64'>
2026-01-09 18:22:56,395 - dq_comparison - INFO -   ✅ Email: 'felicia.hatfield@example.com' → 'felicia.hatfield@example.com' vs 'felicia.hatfield@example.com' → 'felicia.hatfield@example.com'
2026-01-09 18:22:56,396 - dq_comparison - INFO -   ✅ Salary: '41191' → '41191' vs '41191' → '41191'
2026-01-09 18:22:56,398 - dq_comparison - INFO - Hash-based Comparison Results (with duplicate handling):
2026-01-09 18:22:56,398 - dq_comparison - INFO -   • Unique source hashes: 50
2026-01-09 18:22:56,399 - dq_comparison - INFO -   • Unique target hashes: 50
2026-01-09 18:22:56,400 - dq_comparison - INFO -   • Common hashes: 10
2026-01-09 18:22:56,400 - dq_comparison - INFO -   • Common rows (counting duplicates): 10
2026-01-09 18:22:56,401 - dq_comparison - INFO -   • Rows only in source (counting duplicates): 40
2026-01-09 18:22:56,402 - dq_comparison - INFO -   • Rows only in target (counting duplicates): 40
2026-01-09 18:22:56,403 - dq_comparison - INFO - Found 40 rows missing in target
2026-01-09 18:22:56,455 - dq_comparison - INFO - Found 40 extra rows in target
2026-01-09 18:22:56,499 - dq_comparison - INFO - HASH-ONLY COMPARISON COMPLETED
2026-01-09 18:22:56,499 - dq_comparison - INFO - Returning counts for simple scoring:
2026-01-09 18:22:56,500 - dq_comparison - INFO -   Common rows: 10
2026-01-09 18:22:56,500 - dq_comparison - INFO -   Unique to source: 40
2026-01-09 18:22:56,501 - dq_comparison - INFO -   Unique to target: 40
2026-01-09 18:22:56,501 - dq_comparison - INFO -   Value mismatches: 640
2026-01-09 18:22:56,501 - dq_comparison - INFO -   Missing rows: 40
2026-01-09 18:22:56,502 - dq_comparison - INFO -   Extra rows: 40
2026-01-09 18:22:56,502 - dq_comparison - INFO - Analyzing data quality metrics...
2026-01-09 18:22:56,520 - dq_comparison - INFO - Null values - Source: 5 (1.25%), Target: 5 (1.25%)
2026-01-09 18:22:56,523 - dq_comparison - INFO - Duplicate rows (normalized) - Source: 0, Target: 0
2026-01-09 18:22:56,535 - dq_error_log - INFO - Retrieved 11 error logs for session CMP_20260109_182256
2026-01-09 18:22:56,536 - dq_comparison - INFO - 
📊 SIMPLE SCORING CALCULATION:
2026-01-09 18:22:56,537 - dq_comparison - INFO -   Source rows: 50
2026-01-09 18:22:56,538 - dq_comparison - INFO -   Common rows (matched): 10
2026-01-09 18:22:56,539 - dq_comparison - INFO -   Calculation: (10 / 50) * 100 = 20.00%
2026-01-09 18:22:56,540 - dq_comparison - INFO -   Explanation: 10 matched rows out of 50 total source rows
2026-01-09 18:22:56,541 - dq_comparison - INFO - 
=== AUDIT LOGGING SECTION ===
2026-01-09 18:22:56,542 - dq_comparison - INFO - 🔍 Audit logging is ENABLED in APP_SETTINGS
2026-01-09 18:22:56,544 - dq_audit - INFO - Audit class initialized with database: dq_checks
2026-01-09 18:22:56,545 - dq_comparison - INFO - Attempting to log audit record for session: CMP_20260109_182256
2026-01-09 18:22:56,546 - dq_audit - INFO - Starting database insertion for comparison...
2026-01-09 18:22:56,559 - dq_audit - INFO - Inserted comparison record with ID: 592
2026-01-09 18:22:56,559 - dq_comparison - INFO - ✅ Audit record logged successfully (ID: 592)
2026-01-09 18:22:56,568 - dq_error_log - INFO - Retrieved 11 error logs for session CMP_20260109_182256
2026-01-09 18:22:56,577 - dq_error_log - INFO - Retrieved summary: 11 total errors for session CMP_20260109_182256
2026-01-09 18:22:56,577 - dq_audit - INFO - Audit class initialized with database: dq_checks
2026-01-09 18:22:56,588 - dq_audit - INFO - Retrieved 1 audit logs for session CMP_20260109_182256
2026-01-09 18:22:56,589 - dq_comparison - INFO - 
🔍 Final results verification:
2026-01-09 18:22:56,590 - dq_comparison - INFO -    Session ID: CMP_20260109_182256
2026-01-09 18:22:56,590 - dq_comparison - INFO -    DQ Score (Simple %): 20.00%
2026-01-09 18:22:56,591 - dq_comparison - INFO -    Source rows: 50
2026-01-09 18:22:56,591 - dq_comparison - INFO -    Matched rows: 10
2026-01-09 18:22:56,591 - dq_comparison - INFO -    Calculation: (10 / 50) * 100
2026-01-09 18:22:56,592 - dq_comparison - INFO - Comparison analysis completed successfully
2026-01-09 18:22:56,602 - dq_audit - INFO - Retrieved 1 audit logs for session CMP_20260109_182256
2026-01-09 18:22:56,612 - dq_error_log - INFO - Retrieved 11 error logs for session CMP_20260109_182256
2026-01-09 18:22:56,623 - dq_error_log - INFO - Retrieved summary: 11 total errors for session CMP_20260109_182256
2026-01-09 18:22:56,624 - __main__ - INFO - Comparison completed for session CMP_20260109_182256
2026-01-09 18:22:56,627 - __main__ - INFO - Completed with status 200 in 0.585s
2026-01-09 18:23:09,260 - __main__ - INFO - POST /api/compare - Request started
2026-01-09 18:23:09,262 - __main__ - INFO - Comparison request - Source: database, Target: csv
2026-01-09 18:23:09,264 - __main__ - INFO - Comparison analysis request received
2026-01-09 18:23:09,265 - __main__ - INFO - DEBUG source_data from nested: {'source_type': 'database', 'db_type': 'postgresql', 'host': 'localhost', 'port': 5432, 'database': 'dq_checks', 'table': 'customers', 'user': 'postgres', 'password': 'postgres'}
2026-01-09 18:23:09,266 - __main__ - INFO - Starting comparison for session CMP_20260109_182309
2026-01-09 18:23:09,267 - dq_comparison - INFO - Starting comparison analysis in UI mode
2026-01-09 18:23:09,268 - dq_comparison - INFO - LOADING SOURCE AND TARGET DATA
2026-01-09 18:23:09,268 - dq_comparison - INFO - 
==================================================
2026-01-09 18:23:09,270 - dq_comparison - INFO - 🔗 SOURCE DATA CONFIGURATION
2026-01-09 18:23:09,271 - dq_comparison - INFO - ==================================================
2026-01-09 18:23:09,272 - dq_comparison - INFO - 
🗄️ SOURCE DATABASE CONFIGURATION
2026-01-09 18:23:09,273 - dq_comparison - INFO - ----------------------------------------
2026-01-09 18:23:09,274 - dq_comparison - INFO - UI mode: Using provided database configuration for SOURCE
2026-01-09 18:23:09,276 - dq_unified - INFO - Loading data from DATABASE
2026-01-09 18:23:09,276 - dq_unified - INFO - Loading large database table: customers
2026-01-09 18:23:09,278 - dq_unified - INFO - Normalized DB config with schema: public
2026-01-09 18:23:09,383 - dq_unified - INFO - PostgreSQL table public.customers has 15 rows
2026-01-09 18:23:09,383 - dq_unified - INFO - Loading 15 rows from PostgreSQL...
2026-01-09 18:23:10,073 - dq_unified - INFO - Loaded 15 rows from PostgreSQL
2026-01-09 18:23:10,082 - dq_unified - INFO - Memory optimization: 0.0MB -> 0.0MB (Saved: 0.0MB)
2026-01-09 18:23:10,083 - dq_unified - INFO - Standardizing data types...
2026-01-09 18:23:10,087 - dq_unified - INFO - Data type standardization complete
2026-01-09 18:23:10,089 - dq_unified - INFO - Loaded 15 rows, 10 columns. Memory: 136.3MB total, 0.0MB for dataframe
2026-01-09 18:23:10,090 - dq_comparison - INFO - SOURCE database loaded: 15 rows, 10 columns
2026-01-09 18:23:10,091 - dq_comparison - INFO - 
==================================================
2026-01-09 18:23:10,092 - dq_comparison - INFO - 🔗 TARGET DATA CONFIGURATION
2026-01-09 18:23:10,092 - dq_comparison - INFO - ==================================================
2026-01-09 18:23:10,093 - dq_comparison - INFO - DEBUG load_csv_source called for TARGET
2026-01-09 18:23:10,093 - dq_comparison - INFO - DEBUG: Using file_path from 'target_file_path': C:\\Users\\003160\\OneDrive - wisseninfotech.com\\Documents\\DQ-Checks-Shashi\\Test_data\\sample_data.csv
2026-01-09 18:23:10,099 - dq_comparison - INFO - TARGET CSV loaded: 15 rows, 10 columns
2026-01-09 18:23:10,099 - dq_comparison - INFO - Source data loaded: 15 rows, 10 columns
2026-01-09 18:23:10,099 - dq_comparison - INFO - Target data loaded: 15 rows, 10 columns
2026-01-09 18:23:10,100 - dq_comparison - INFO - SELECTING COLUMNS FOR COMPARISON
2026-01-09 18:23:10,100 - dq_comparison - INFO - Source columns (original): ['customername', 'email', 'phone', 'salary', 'department', 'joindate', 'postalcode', 'city', 'country', 'state']
2026-01-09 18:23:10,101 - dq_comparison - INFO - Target columns (original): ['CustomerName', 'Email', 'Phone', 'Salary', 'Department', 'JoinDate', 'PostalCode', 'City', 'Country', 'State']
2026-01-09 18:23:10,103 - dq_comparison - INFO - Common columns lowercased: ['joindate', 'customername', 'email', 'country', 'salary', 'postalcode', 'city', 'state', 'phone', 'department']
2026-01-09 18:23:10,104 - dq_comparison - INFO - Found 10 common columns between source and target (case-insensitive)
2026-01-09 18:23:10,104 - dq_comparison - INFO - User column selection input: all
2026-01-09 18:23:10,105 - dq_comparison - INFO - User selected ALL common columns for comparison
2026-01-09 18:23:10,105 - dq_comparison - INFO - Selected 10 columns for comparison: ['joindate', 'customername', 'email', 'country', 'salary']...
2026-01-09 18:23:10,106 - dq_comparison - INFO - GENERATING COMPREHENSIVE COMPARISON REPORT
2026-01-09 18:23:10,106 - dq_comparison - INFO - Report details - Source: Database: postgresql - dq_checks.customers, Target: CSV: sample_data.csv, Selected columns: 10
2026-01-09 18:23:10,107 - dq_comparison - INFO - Initializing Error Logger...
2026-01-09 18:23:10,107 - dq_error_log - INFO - ErrorLogger initialized with database: dq_checks
2026-01-09 18:23:10,116 - dq_error_log - INFO - Database connection successful
2026-01-09 18:23:10,117 - dq_comparison - INFO - Session ID: CMP_20260109_182310
2026-01-09 18:23:10,118 - dq_comparison - INFO - ✅ Row counts match: 15 rows
2026-01-09 18:23:10,119 - dq_comparison - INFO - Comparing column structures...
2026-01-09 18:23:10,120 - dq_comparison - WARNING - Found 6 incompatible data type mismatches
2026-01-09 18:23:10,120 - dq_comparison - INFO - Column structure comparison complete. Match: False
2026-01-09 18:23:10,191 - dq_comparison - INFO - Validating primary key/unique fields...
2026-01-09 18:23:10,191 - dq_comparison - INFO - Checking key fields: ['postalcode']
2026-01-09 18:23:10,192 - dq_comparison - WARNING - No key fields found in both datasets
2026-01-09 18:23:10,201 - dq_comparison - INFO - Comparing table-level metadata...
2026-01-09 18:23:10,220 - dq_comparison - INFO - Table metadata comparison complete. Match: False
2026-01-09 18:23:10,221 - dq_comparison - INFO - SECOND CHECK: HASH-BASED COMPARISON WITH PERFECT NORMALIZATION
2026-01-09 18:23:10,225 - dq_comparison - INFO - === DEBUG: DATA TYPE CHECK ===
2026-01-09 18:23:10,226 - dq_comparison - INFO - Column: joindate
2026-01-09 18:23:10,227 - dq_comparison - INFO -   Source type: <class 'numpy.int64'>, value: 1673740800000000000
2026-01-09 18:23:10,228 - dq_comparison - INFO -   Target type: <class 'str'>, value: 15-01-2023
2026-01-09 18:23:10,230 - dq_comparison - INFO -   Normalized: '2023-01-15' vs '2023-01-15'
2026-01-09 18:23:10,231 - dq_comparison - INFO -   Match: True
2026-01-09 18:23:10,232 - dq_comparison - INFO - Column: customername
2026-01-09 18:23:10,232 - dq_comparison - INFO -   Source type: <class 'str'>, value: John Doe
2026-01-09 18:23:10,233 - dq_comparison - INFO -   Target type: <class 'str'>, value:    John Doe
2026-01-09 18:23:10,233 - dq_comparison - INFO -   Normalized: 'john doe' vs 'john doe'
2026-01-09 18:23:10,235 - dq_comparison - INFO -   Match: True
2026-01-09 18:23:10,236 - dq_comparison - INFO - Column: email
2026-01-09 18:23:10,237 - dq_comparison - INFO -   Source type: <class 'str'>, value: john@email.com
2026-01-09 18:23:10,238 - dq_comparison - INFO -   Target type: <class 'str'>, value: john@email.com
2026-01-09 18:23:10,239 - dq_comparison - INFO -   Normalized: 'john@email.com' vs 'john@email.com'
2026-01-09 18:23:10,240 - dq_comparison - INFO -   Match: True
2026-01-09 18:23:10,241 - dq_comparison - INFO - Source DF columns: ['customername', 'email', 'phone', 'salary', 'department', 'joindate', 'postalcode', 'city', 'country', 'state']
2026-01-09 18:23:10,242 - dq_comparison - INFO - Target DF columns: ['CustomerName', 'Email', 'Phone', 'Salary', 'Department', 'JoinDate', 'PostalCode', 'City', 'Country', 'State']
2026-01-09 18:23:10,243 - dq_comparison - INFO - Selected columns for comparison: ['joindate', 'customername', 'email', 'country', 'salary', 'postalcode', 'city', 'state', 'phone', 'department']
2026-01-09 18:23:10,244 - dq_comparison - INFO - Using 10 common columns for hash comparison
2026-01-09 18:23:10,245 - dq_comparison - INFO - Source columns: ['joindate', 'customername', 'email', 'country', 'salary', 'postalcode', 'city', 'state', 'phone', 'department']
2026-01-09 18:23:10,245 - dq_comparison - INFO - Target columns: ['JoinDate', 'CustomerName', 'Email', 'Country', 'Salary', 'PostalCode', 'City', 'State', 'Phone', 'Department']
2026-01-09 18:23:10,247 - dq_comparison - INFO - Generating hashes for source data (15 rows)...
2026-01-09 18:23:10,251 - dq_comparison - INFO - DEBUG HASH ROW: joindate: '1673740800000000000' -> '2023-01-15' | customername: 'John Doe' -> 'john doe' | email: 'john@email.com' -> 'john@email.com' | country: 'USA' -> 'usa' | salary: '50000.0' -> '50000'
2026-01-09 18:23:10,252 - dq_comparison - INFO - DEBUG HASH STRING: 2023-01-15|john doe|john@email.com|usa|50000...
2026-01-09 18:23:10,252 - dq_comparison - INFO - DEBUG HASH RESULT: 05270b08...
2026-01-09 18:23:10,253 - dq_comparison - INFO - DEBUG HASH ROW: joindate: '1676851200000000000' -> '2023-02-20' | customername: 'Jane Smith' -> 'jane smith' | email: 'jane@email.com' -> 'jane@email.com' | country: 'USA' -> 'usa' | salary: '60000.0' -> '60000'
2026-01-09 18:23:10,254 - dq_comparison - INFO - DEBUG HASH STRING: 2023-02-20|jane smith|jane@email.com|usa|60000...
2026-01-09 18:23:10,254 - dq_comparison - INFO - DEBUG HASH RESULT: b492d676...
2026-01-09 18:23:10,255 - dq_comparison - INFO - DEBUG HASH ROW: joindate: '1678406400000000000' -> '2023-03-10' | customername: 'Bob Johnson' -> 'bob johnson' | email: 'None' -> 'NULL' | country: 'USA' -> 'usa' | salary: '55000.0' -> '55000'
2026-01-09 18:23:10,256 - dq_comparison - INFO - DEBUG HASH STRING: 2023-03-10|bob johnson|NULL|usa|55000...
2026-01-09 18:23:10,256 - dq_comparison - INFO - DEBUG HASH RESULT: a9f38256...
2026-01-09 18:23:10,257 - dq_comparison - INFO - DEBUG HASH ROW: joindate: '1673740800000000000' -> '2023-01-15' | customername: 'Alice Brown' -> 'alice brown' | email: 'alice@email.com' -> 'alice@email.com' | country: 'USA' -> 'usa' | salary: '70000.0' -> '70000'
2026-01-09 18:23:10,257 - dq_comparison - INFO - DEBUG HASH STRING: 2023-01-15|alice brown|alice@email.com|usa|70000...
2026-01-09 18:23:10,258 - dq_comparison - INFO - DEBUG HASH RESULT: 22bb83e3...
2026-01-09 18:23:10,259 - dq_comparison - INFO - DEBUG HASH ROW: joindate: '1680652800000000000' -> '2023-04-05' | customername: 'Charlie Wilson' -> 'charlie wilson' | email: 'charlie@email.com' -> 'charlie@email.com' | country: 'USA' -> 'usa' | salary: '48000.0' -> '48000'
2026-01-09 18:23:10,260 - dq_comparison - INFO - DEBUG HASH STRING: 2023-04-05|charlie wilson|charlie@email.com|usa|48000...
2026-01-09 18:23:10,261 - dq_comparison - INFO - DEBUG HASH RESULT: bc019761...
2026-01-09 18:23:10,263 - dq_comparison - INFO - DEBUG HASH ROW: joindate: '1673740800000000000' -> '2023-01-15' | customername: 'John Doe' -> 'john doe' | email: 'john@email.com' -> 'john@email.com' | country: 'USA' -> 'usa' | salary: '50000.0' -> '50000'
2026-01-09 18:23:10,263 - dq_comparison - INFO - DEBUG HASH STRING: 2023-01-15|john doe|john@email.com|usa|50000...
2026-01-09 18:23:10,265 - dq_comparison - INFO - DEBUG HASH RESULT: 05270b08...
2026-01-09 18:23:10,266 - dq_comparison - INFO - DEBUG HASH ROW: joindate: '1683849600000000000' -> '2023-05-12' | customername: 'David Lee' -> 'david lee' | email: 'david@email.com' -> 'david@email.com' | country: 'USA' -> 'usa' | salary: 'nan' -> 'NULL'
2026-01-09 18:23:10,266 - dq_comparison - INFO - DEBUG HASH STRING: 2023-05-12|david lee|david@email.com|usa|NULL...
2026-01-09 18:23:10,267 - dq_comparison - INFO - DEBUG HASH RESULT: ca86ecd9...
2026-01-09 18:23:10,267 - dq_comparison - INFO - DEBUG HASH ROW: joindate: '1687046400000000000' -> '2023-06-18' | customername: 'Sarah Chen' -> 'sarah chen' | email: 'sarah@email.com' -> 'sarah@email.com' | country: 'USA' -> 'usa' | salary: '52000.0' -> '52000'
2026-01-09 18:23:10,268 - dq_comparison - INFO - DEBUG HASH STRING: 2023-06-18|sarah chen|sarah@email.com|usa|52000...
2026-01-09 18:23:10,268 - dq_comparison - INFO - DEBUG HASH RESULT: 12401390...
2026-01-09 18:23:10,269 - dq_comparison - INFO - DEBUG HASH ROW: joindate: '1689984000000000000' -> '2023-07-22' | customername: 'Mike Davis' -> 'mike davis' | email: 'invalid-email' -> 'invalid-email' | country: 'USA' -> 'usa' | salary: '58000.0' -> '58000'
2026-01-09 18:23:10,269 - dq_comparison - INFO - DEBUG HASH STRING: 2023-07-22|mike davis|invalid-email|usa|58000...
2026-01-09 18:23:10,270 - dq_comparison - INFO - DEBUG HASH RESULT: 873e4152...
2026-01-09 18:23:10,271 - dq_comparison - INFO - DEBUG HASH ROW: joindate: '1693353600000000000' -> '2023-08-30' | customername: 'Lisa Wang' -> 'lisa wang' | email: 'lisa@email.com' -> 'lisa@email.com' | country: 'USA' -> 'usa' | salary: '62000.0' -> '62000'
2026-01-09 18:23:10,271 - dq_comparison - INFO - DEBUG HASH STRING: 2023-08-30|lisa wang|lisa@email.com|usa|62000...
2026-01-09 18:23:10,271 - dq_comparison - INFO - DEBUG HASH RESULT: ad8ddad0...
2026-01-09 18:23:10,272 - dq_comparison - INFO - DEBUG HASH ROW: joindate: '1694304000000000000' -> '2023-09-10' | customername: 'Tom Wilson' -> 'tom wilson' | email: 'tom@email.com' -> 'tom@email.com' | country: 'USA' -> 'usa' | salary: '45000.0' -> '45000'
2026-01-09 18:23:10,273 - dq_comparison - INFO - DEBUG HASH STRING: 2023-09-10|tom wilson|tom@email.com|usa|45000...
2026-01-09 18:23:10,273 - dq_comparison - INFO - DEBUG HASH RESULT: 4dc4ef06...
2026-01-09 18:23:10,274 - dq_comparison - INFO - DEBUG HASH ROW: joindate: '1697328000000000000' -> '2023-10-15' | customername: 'None' -> 'NULL' | email: 'empty@email.com' -> 'empty@email.com' | country: 'USA' -> 'usa' | salary: '53000.0' -> '53000'
2026-01-09 18:23:10,274 - dq_comparison - INFO - DEBUG HASH STRING: 2023-10-15|NULL|empty@email.com|usa|53000...
2026-01-09 18:23:10,275 - dq_comparison - INFO - DEBUG HASH RESULT: 699bf199...
2026-01-09 18:23:10,276 - dq_comparison - INFO - DEBUG HASH ROW: joindate: '1700438400000000000' -> '2023-11-20' | customername: 'Robert Brown' -> 'robert brown' | email: 'robert@email.com' -> 'robert@email.com' | country: 'USA' -> 'usa' | salary: '67000.0' -> '67000'
2026-01-09 18:23:10,276 - dq_comparison - INFO - DEBUG HASH STRING: 2023-11-20|robert brown|robert@email.com|usa|67000...
2026-01-09 18:23:10,277 - dq_comparison - INFO - DEBUG HASH RESULT: 5f75b7f1...
2026-01-09 18:23:10,278 - dq_comparison - INFO - DEBUG HASH ROW: joindate: '1701734400000000000' -> '2023-12-05' | customername: 'Nancy Davis' -> 'nancy davis' | email: 'nancy@email.com' -> 'nancy@email.com' | country: 'USA' -> 'usa' | salary: 'nan' -> 'NULL'
2026-01-09 18:23:10,279 - dq_comparison - INFO - DEBUG HASH STRING: 2023-12-05|nancy davis|nancy@email.com|usa|NULL...
2026-01-09 18:23:10,280 - dq_comparison - INFO - DEBUG HASH RESULT: 978dbdfc...
2026-01-09 18:23:10,281 - dq_comparison - INFO - DEBUG HASH ROW: joindate: '1704844800000000000' -> '2024-01-10' | customername: 'Kevin Lee' -> 'kevin lee' | email: 'kevin@email.com' -> 'kevin@email.com' | country: 'USA' -> 'usa' | salary: '49000.0' -> '49000'
2026-01-09 18:23:10,282 - dq_comparison - INFO - DEBUG HASH STRING: 2024-01-10|kevin lee|kevin@email.com|usa|49000...
2026-01-09 18:23:10,282 - dq_comparison - INFO - DEBUG HASH RESULT: 7dadd9c5...
2026-01-09 18:23:10,283 - dq_comparison - INFO - === DEBUG: SAMPLE HASHES ===
2026-01-09 18:23:10,283 - dq_comparison - INFO - Hash 1: 05270b089809dc5b... (sample row 0)
2026-01-09 18:23:10,285 - dq_comparison - INFO - Hash 2: b492d676ae79a1ce... (sample row 1)
2026-01-09 18:23:10,286 - dq_comparison - INFO - Hash 3: a9f3825616eafd86... (sample row 2)
2026-01-09 18:23:10,287 - dq_comparison - INFO - Generating hashes for target data (15 rows)...
2026-01-09 18:23:10,292 - dq_comparison - INFO - 
======================================================================
2026-01-09 18:23:10,292 - dq_comparison - INFO - 🔍 DEBUG: ANALYZING WHY HASHES DON'T MATCH
2026-01-09 18:23:10,293 - dq_comparison - INFO - ======================================================================
2026-01-09 18:23:10,293 - dq_comparison - INFO - 
--- Analyzing Row 0 ---
2026-01-09 18:23:10,295 - dq_comparison - INFO - Column 'joindate' → 'JoinDate':
2026-01-09 18:23:10,295 - dq_comparison - INFO -   Source: '1673740800000000000' (type: int64) → '2023-01-15'
2026-01-09 18:23:10,296 - dq_comparison - INFO -   Target: '15-01-2023' (type: str) → '2023-01-15'
2026-01-09 18:23:10,297 - dq_comparison - INFO -   Match after normalization: ✅ YES
2026-01-09 18:23:10,297 - dq_comparison - INFO - Column 'customername' → 'CustomerName':
2026-01-09 18:23:10,297 - dq_comparison - INFO -   Source: 'John Doe' (type: str) → 'john doe'
2026-01-09 18:23:10,298 - dq_comparison - INFO -   Target: '   John Doe' (type: str) → 'john doe'
2026-01-09 18:23:10,298 - dq_comparison - INFO -   Match after normalization: ✅ YES
2026-01-09 18:23:10,299 - dq_comparison - INFO - Column 'email' → 'Email':
2026-01-09 18:23:10,299 - dq_comparison - INFO -   Source: 'john@email.com' (type: str) → 'john@email.com'
2026-01-09 18:23:10,300 - dq_comparison - INFO -   Target: 'john@email.com' (type: str) → 'john@email.com'
2026-01-09 18:23:10,300 - dq_comparison - INFO -   Match after normalization: ✅ YES
2026-01-09 18:23:10,301 - dq_comparison - INFO - Column 'country' → 'Country':
2026-01-09 18:23:10,301 - dq_comparison - INFO -   Source: 'USA' (type: str) → 'usa'
2026-01-09 18:23:10,302 - dq_comparison - INFO -   Target: 'USA' (type: str) → 'usa'
2026-01-09 18:23:10,302 - dq_comparison - INFO -   Match after normalization: ✅ YES
2026-01-09 18:23:10,303 - dq_comparison - INFO - Column 'salary' → 'Salary':
2026-01-09 18:23:10,303 - dq_comparison - INFO -   Source: '50000.0' (type: float32) → '50000'
2026-01-09 18:23:10,304 - dq_comparison - INFO -   Target: '50000.0' (type: float64) → '50000'
2026-01-09 18:23:10,304 - dq_comparison - INFO -   Match after normalization: ✅ YES
2026-01-09 18:23:10,305 - dq_comparison - INFO - 
Hash components for Row 0:
2026-01-09 18:23:10,306 - dq_comparison - INFO - Source hash string start: 2023-01-15|john doe|john@email.com...
2026-01-09 18:23:10,306 - dq_comparison - INFO - Target hash string start: 2023-01-15|john doe|john@email.com...
2026-01-09 18:23:10,307 - dq_comparison - INFO - Same? ✅ YES
2026-01-09 18:23:10,307 - dq_comparison - INFO - 
--- Analyzing Row 1 ---
2026-01-09 18:23:10,308 - dq_comparison - INFO - Column 'joindate' → 'JoinDate':
2026-01-09 18:23:10,309 - dq_comparison - INFO -   Source: '1676851200000000000' (type: int64) → '2023-02-20'
2026-01-09 18:23:10,309 - dq_comparison - INFO -   Target: '20-02-2023' (type: str) → '2023-02-20'
2026-01-09 18:23:10,310 - dq_comparison - INFO -   Match after normalization: ✅ YES
2026-01-09 18:23:10,310 - dq_comparison - INFO - Column 'customername' → 'CustomerName':
2026-01-09 18:23:10,311 - dq_comparison - INFO -   Source: 'Jane Smith' (type: str) → 'jane smith'
2026-01-09 18:23:10,311 - dq_comparison - INFO -   Target: 'Jane      Smith' (type: str) → 'jane smith'
2026-01-09 18:23:10,312 - dq_comparison - INFO -   Match after normalization: ✅ YES
2026-01-09 18:23:10,312 - dq_comparison - INFO - Column 'email' → 'Email':
2026-01-09 18:23:10,314 - dq_comparison - INFO -   Source: 'jane@email.com' (type: str) → 'jane@email.com'
2026-01-09 18:23:10,314 - dq_comparison - INFO -   Target: 'jane@email.com' (type: str) → 'jane@email.com'
2026-01-09 18:23:10,315 - dq_comparison - INFO -   Match after normalization: ✅ YES
2026-01-09 18:23:10,315 - dq_comparison - INFO - Column 'country' → 'Country':
2026-01-09 18:23:10,316 - dq_comparison - INFO -   Source: 'USA' (type: str) → 'usa'
2026-01-09 18:23:10,316 - dq_comparison - INFO -   Target: 'USA' (type: str) → 'usa'
2026-01-09 18:23:10,317 - dq_comparison - INFO -   Match after normalization: ✅ YES
2026-01-09 18:23:10,317 - dq_comparison - INFO - Column 'salary' → 'Salary':
2026-01-09 18:23:10,318 - dq_comparison - INFO -   Source: '60000.0' (type: float32) → '60000'
2026-01-09 18:23:10,318 - dq_comparison - INFO -   Target: '60000.0' (type: float64) → '60000'
2026-01-09 18:23:10,319 - dq_comparison - INFO -   Match after normalization: ✅ YES
2026-01-09 18:23:10,319 - dq_comparison - INFO - 
Hash components for Row 1:
2026-01-09 18:23:10,320 - dq_comparison - INFO - Source hash string start: 2023-02-20|jane smith|jane@email.com...
2026-01-09 18:23:10,320 - dq_comparison - INFO - Target hash string start: 2023-02-20|jane smith|jane@email.com...
2026-01-09 18:23:10,321 - dq_comparison - INFO - Same? ✅ YES
2026-01-09 18:23:10,321 - dq_comparison - INFO - 
--- Analyzing Row 2 ---
2026-01-09 18:23:10,322 - dq_comparison - INFO - Column 'joindate' → 'JoinDate':
2026-01-09 18:23:10,323 - dq_comparison - INFO -   Source: '1678406400000000000' (type: int64) → '2023-03-10'
2026-01-09 18:23:10,323 - dq_comparison - INFO -   Target: '10-03-2023' (type: str) → '2023-03-10'
2026-01-09 18:23:10,324 - dq_comparison - INFO -   Match after normalization: ✅ YES
2026-01-09 18:23:10,324 - dq_comparison - INFO - Column 'customername' → 'CustomerName':
2026-01-09 18:23:10,325 - dq_comparison - INFO -   Source: 'Bob Johnson' (type: str) → 'bob johnson'
2026-01-09 18:23:10,325 - dq_comparison - INFO -   Target: 'Bob        Johnson' (type: str) → 'bob johnson'
2026-01-09 18:23:10,326 - dq_comparison - INFO -   Match after normalization: ✅ YES
2026-01-09 18:23:10,326 - dq_comparison - INFO - Column 'email' → 'Email':
2026-01-09 18:23:10,327 - dq_comparison - INFO -   Source: 'None' (type: NoneType) → 'NULL'
2026-01-09 18:23:10,328 - dq_comparison - INFO -   Target: 'nan' (type: float) → 'NULL'
2026-01-09 18:23:10,328 - dq_comparison - INFO -   Match after normalization: ✅ YES
2026-01-09 18:23:10,329 - dq_comparison - INFO - Column 'country' → 'Country':
2026-01-09 18:23:10,329 - dq_comparison - INFO -   Source: 'USA' (type: str) → 'usa'
2026-01-09 18:23:10,330 - dq_comparison - INFO -   Target: 'USA' (type: str) → 'usa'
2026-01-09 18:23:10,330 - dq_comparison - INFO -   Match after normalization: ✅ YES
2026-01-09 18:23:10,331 - dq_comparison - INFO - Column 'salary' → 'Salary':
2026-01-09 18:23:10,332 - dq_comparison - INFO -   Source: '55000.0' (type: float32) → '55000'
2026-01-09 18:23:10,333 - dq_comparison - INFO -   Target: '55000.0' (type: float64) → '55000'
2026-01-09 18:23:10,334 - dq_comparison - INFO -   Match after normalization: ✅ YES
2026-01-09 18:23:10,335 - dq_comparison - INFO - 
Hash components for Row 2:
2026-01-09 18:23:10,336 - dq_comparison - INFO - Source hash string start: 2023-03-10|bob johnson|NULL...
2026-01-09 18:23:10,337 - dq_comparison - INFO - Target hash string start: 2023-03-10|bob johnson|NULL...
2026-01-09 18:23:10,337 - dq_comparison - INFO - Same? ✅ YES
2026-01-09 18:23:10,338 - dq_comparison - INFO - 
--- Column Data Types Analysis ---
2026-01-09 18:23:10,339 - dq_comparison - INFO - Column 1: 'joindate' (int64) ↔ 'JoinDate' (object)
2026-01-09 18:23:10,339 - dq_comparison - INFO -   Sample: Source='1673740800000000000', Target='15-01-2023'
2026-01-09 18:23:10,340 - dq_comparison - INFO - Column 2: 'customername' (object) ↔ 'CustomerName' (object)
2026-01-09 18:23:10,341 - dq_comparison - INFO -   Sample: Source='John Doe', Target='   John Doe'
2026-01-09 18:23:10,342 - dq_comparison - INFO - Column 3: 'email' (object) ↔ 'Email' (object)
2026-01-09 18:23:10,343 - dq_comparison - INFO -   Sample: Source='john@email.com', Target='john@email.com'
2026-01-09 18:23:10,343 - dq_comparison - INFO - Column 4: 'country' (category) ↔ 'Country' (object)
2026-01-09 18:23:10,344 - dq_comparison - INFO -   Sample: Source='USA', Target='USA'
2026-01-09 18:23:10,345 - dq_comparison - INFO - Column 5: 'salary' (float32) ↔ 'Salary' (float64)
2026-01-09 18:23:10,346 - dq_comparison - INFO -   Sample: Source='50000.0', Target='50000.0'
2026-01-09 18:23:10,346 - dq_comparison - INFO - === DEBUG: DIRECT ROW COMPARISON ===
2026-01-09 18:23:10,347 - dq_comparison - INFO - --- Comparing Row 0 ---
2026-01-09 18:23:10,348 - dq_comparison - INFO -   ✅ joindate: '1673740800000000000' → '2023-01-15' vs '15-01-2023' → '2023-01-15'
2026-01-09 18:23:10,349 - dq_comparison - INFO -   ✅ customername: 'John Doe' → 'john doe' vs '   John Doe' → 'john doe'
2026-01-09 18:23:10,350 - dq_comparison - INFO -   ✅ email: 'john@email.com' → 'john@email.com' vs 'john@email.com' → 'john@email.com'
2026-01-09 18:23:10,351 - dq_comparison - INFO -   ✅ country: 'USA' → 'usa' vs 'USA' → 'usa'
2026-01-09 18:23:10,351 - dq_comparison - INFO -   ✅ salary: '50000.0' → '50000' vs '50000.0' → '50000'
2026-01-09 18:23:10,352 - dq_comparison - INFO - --- Comparing Row 1 ---
2026-01-09 18:23:10,353 - dq_comparison - INFO -   ✅ joindate: '1676851200000000000' → '2023-02-20' vs '20-02-2023' → '2023-02-20'
2026-01-09 18:23:10,354 - dq_comparison - INFO -   ✅ customername: 'Jane Smith' → 'jane smith' vs 'Jane      Smith' → 'jane smith'
2026-01-09 18:23:10,355 - dq_comparison - INFO -   ✅ email: 'jane@email.com' → 'jane@email.com' vs 'jane@email.com' → 'jane@email.com'
2026-01-09 18:23:10,355 - dq_comparison - INFO -   ✅ country: 'USA' → 'usa' vs 'USA' → 'usa'
2026-01-09 18:23:10,356 - dq_comparison - INFO -   ✅ salary: '60000.0' → '60000' vs '60000.0' → '60000'
2026-01-09 18:23:10,357 - dq_comparison - INFO - --- Comparing Row 2 ---
2026-01-09 18:23:10,358 - dq_comparison - INFO -   ✅ joindate: '1678406400000000000' → '2023-03-10' vs '10-03-2023' → '2023-03-10'
2026-01-09 18:23:10,358 - dq_comparison - INFO -   ✅ customername: 'Bob Johnson' → 'bob johnson' vs 'Bob        Johnson' → 'bob johnson'
2026-01-09 18:23:10,359 - dq_comparison - INFO -   ✅ email: 'None' → 'NULL' vs 'nan' → 'NULL'
2026-01-09 18:23:10,360 - dq_comparison - INFO -   ✅ country: 'USA' → 'usa' vs 'USA' → 'usa'
2026-01-09 18:23:10,360 - dq_comparison - INFO -   ✅ salary: '55000.0' → '55000' vs '55000.0' → '55000'
2026-01-09 18:23:10,360 - dq_comparison - INFO - Hash-based Comparison Results (with duplicate handling):
2026-01-09 18:23:10,362 - dq_comparison - INFO -   • Unique source hashes: 14
2026-01-09 18:23:10,363 - dq_comparison - INFO -   • Unique target hashes: 14
2026-01-09 18:23:10,363 - dq_comparison - INFO -   • Common hashes: 13
2026-01-09 18:23:10,364 - dq_comparison - INFO -   • Common rows (counting duplicates): 14
2026-01-09 18:23:10,364 - dq_comparison - INFO -   • Rows only in source (counting duplicates): 1
2026-01-09 18:23:10,365 - dq_comparison - INFO -   • Rows only in target (counting duplicates): 1
2026-01-09 18:23:10,365 - dq_comparison - INFO - Found 1 rows missing in target
2026-01-09 18:23:10,380 - dq_comparison - INFO - Found 1 extra rows in target
2026-01-09 18:23:10,391 - dq_comparison - INFO - HASH-ONLY COMPARISON COMPLETED
2026-01-09 18:23:10,392 - dq_comparison - INFO - Returning counts for simple scoring:
2026-01-09 18:23:10,392 - dq_comparison - INFO -   Common rows: 14
2026-01-09 18:23:10,393 - dq_comparison - INFO -   Unique to source: 1
2026-01-09 18:23:10,394 - dq_comparison - INFO -   Unique to target: 1
2026-01-09 18:23:10,394 - dq_comparison - INFO -   Value mismatches: 20
2026-01-09 18:23:10,395 - dq_comparison - INFO -   Missing rows: 1
2026-01-09 18:23:10,395 - dq_comparison - INFO -   Extra rows: 1
2026-01-09 18:23:10,396 - dq_comparison - INFO - Analyzing data quality metrics...
2026-01-09 18:23:10,405 - dq_comparison - INFO - Null values - Source: 7 (4.67%), Target: 6 (4.00%)
2026-01-09 18:23:10,418 - dq_comparison - INFO - Duplicate rows (normalized) - Source: 1, Target: 1
2026-01-09 18:23:10,421 - dq_comparison - INFO - Source duplicate samples: ['Row 2', 'Row 7']
2026-01-09 18:23:10,423 - dq_comparison - INFO - Target duplicate samples: ['Row 2', 'Row 7']
2026-01-09 18:23:10,437 - dq_error_log - INFO - Retrieved 10 error logs for session CMP_20260109_182310
2026-01-09 18:23:10,437 - dq_comparison - INFO - 
📊 SIMPLE SCORING CALCULATION:
2026-01-09 18:23:10,438 - dq_comparison - INFO -   Source rows: 15
2026-01-09 18:23:10,439 - dq_comparison - INFO -   Common rows (matched): 14
2026-01-09 18:23:10,439 - dq_comparison - INFO -   Calculation: (14 / 15) * 100 = 93.33%
2026-01-09 18:23:10,440 - dq_comparison - INFO -   Explanation: 14 matched rows out of 15 total source rows
2026-01-09 18:23:10,441 - dq_comparison - INFO - 
=== AUDIT LOGGING SECTION ===
2026-01-09 18:23:10,442 - dq_comparison - INFO - 🔍 Audit logging is ENABLED in APP_SETTINGS
2026-01-09 18:23:10,442 - dq_audit - INFO - Audit class initialized with database: dq_checks
2026-01-09 18:23:10,443 - dq_comparison - INFO - Attempting to log audit record for session: CMP_20260109_182310
2026-01-09 18:23:10,445 - dq_audit - INFO - Starting database insertion for comparison...
2026-01-09 18:23:10,462 - dq_audit - INFO - Inserted comparison record with ID: 593
2026-01-09 18:23:10,462 - dq_comparison - INFO - ✅ Audit record logged successfully (ID: 593)
2026-01-09 18:23:10,473 - dq_error_log - INFO - Retrieved 10 error logs for session CMP_20260109_182310
2026-01-09 18:23:10,487 - dq_error_log - INFO - Retrieved summary: 10 total errors for session CMP_20260109_182310
2026-01-09 18:23:10,487 - dq_audit - INFO - Audit class initialized with database: dq_checks
2026-01-09 18:23:10,502 - dq_audit - INFO - Retrieved 1 audit logs for session CMP_20260109_182310
2026-01-09 18:23:10,502 - dq_comparison - INFO - 
🔍 Final results verification:
2026-01-09 18:23:10,503 - dq_comparison - INFO -    Session ID: CMP_20260109_182310
2026-01-09 18:23:10,504 - dq_comparison - INFO -    DQ Score (Simple %): 93.33%
2026-01-09 18:23:10,505 - dq_comparison - INFO -    Source rows: 15
2026-01-09 18:23:10,505 - dq_comparison - INFO -    Matched rows: 14
2026-01-09 18:23:10,506 - dq_comparison - INFO -    Calculation: (14 / 15) * 100
2026-01-09 18:23:10,506 - dq_comparison - INFO - Comparison analysis completed successfully
2026-01-09 18:23:10,518 - dq_audit - INFO - Retrieved 1 audit logs for session CMP_20260109_182310
2026-01-09 18:23:10,530 - dq_error_log - INFO - Retrieved 10 error logs for session CMP_20260109_182310
2026-01-09 18:23:10,540 - dq_error_log - INFO - Retrieved summary: 10 total errors for session CMP_20260109_182310
2026-01-09 18:23:10,540 - __main__ - INFO - Comparison completed for session CMP_20260109_182309
2026-01-09 18:23:10,543 - __main__ - INFO - Completed with status 200 in 1.283s
2026-01-09 18:23:21,064 - __main__ - INFO - POST /api/compare - Request started
2026-01-09 18:23:21,065 - __main__ - INFO - Comparison request - Source: csv, Target: database
2026-01-09 18:23:21,067 - __main__ - INFO - Comparison analysis request received
2026-01-09 18:23:21,068 - __main__ - INFO - DEBUG source_data from nested: {'source_type': 'csv', 'source_file_path': 'C:\\\\Users\\\\003160\\\\OneDrive - wisseninfotech.com\\\\Documents\\\\DQ-Checks-Shashi\\\\Test_data\\\\sample_data.csv'}
2026-01-09 18:23:21,069 - __main__ - INFO - Starting comparison for session CMP_20260109_182321
2026-01-09 18:23:21,071 - dq_comparison - INFO - Starting comparison analysis in UI mode
2026-01-09 18:23:21,071 - dq_comparison - INFO - LOADING SOURCE AND TARGET DATA
2026-01-09 18:23:21,071 - dq_comparison - INFO - 
==================================================
2026-01-09 18:23:21,072 - dq_comparison - INFO - 🔗 SOURCE DATA CONFIGURATION
2026-01-09 18:23:21,073 - dq_comparison - INFO - ==================================================
2026-01-09 18:23:21,073 - dq_comparison - INFO - DEBUG load_csv_source called for SOURCE
2026-01-09 18:23:21,074 - dq_comparison - INFO - DEBUG: Using file_path from 'file_path': C:\\Users\\003160\\OneDrive - wisseninfotech.com\\Documents\\DQ-Checks-Shashi\\Test_data\\sample_data.csv
2026-01-09 18:23:21,078 - dq_comparison - INFO - SOURCE CSV loaded: 15 rows, 10 columns
2026-01-09 18:23:21,078 - dq_comparison - INFO - 
==================================================
2026-01-09 18:23:21,080 - dq_comparison - INFO - 🔗 TARGET DATA CONFIGURATION
2026-01-09 18:23:21,080 - dq_comparison - INFO - ==================================================
2026-01-09 18:23:21,081 - dq_comparison - INFO - 
🗄️ TARGET DATABASE CONFIGURATION
2026-01-09 18:23:21,081 - dq_comparison - INFO - ----------------------------------------
2026-01-09 18:23:21,082 - dq_comparison - INFO - Converted db_type to numeric code: 2
2026-01-09 18:23:21,083 - dq_comparison - INFO - Selected database type code: mysql
2026-01-09 18:23:21,084 - dq_unified - INFO - Getting database config from config file
2026-01-09 18:23:21,084 - dq_unified - INFO - Using MYSQL configuration from config file
2026-01-09 18:23:21,086 - dq_unified - INFO - Database configuration from config file: mysql, Table: customers
2026-01-09 18:23:21,087 - dq_unified - INFO - Loading data from DATABASE
2026-01-09 18:23:21,088 - dq_unified - INFO - Loading large database table: customers
2026-01-09 18:23:21,089 - dq_unified - INFO - Normalized DB config with schema: dq_checks
2026-01-09 18:23:21,103 - dq_unified - INFO - MySQL table customers has 15 rows
2026-01-09 18:23:21,103 - dq_unified - INFO - Loading 15 rows from MySQL...
2026-01-09 18:23:21,108 - dq_unified - INFO - Loaded 15 rows from MySQL
2026-01-09 18:23:21,113 - dq_unified - INFO - Memory optimization: 0.0MB -> 0.0MB (Saved: 0.0MB)
2026-01-09 18:23:21,113 - dq_unified - INFO - Standardizing data types...
2026-01-09 18:23:21,116 - dq_unified - INFO - Data type standardization complete
2026-01-09 18:23:21,118 - dq_unified - INFO - Loaded 15 rows, 10 columns. Memory: 136.8MB total, 0.0MB for dataframe
2026-01-09 18:23:21,118 - dq_comparison - INFO - TARGET database loaded: 15 rows, 10 columns
2026-01-09 18:23:21,119 - dq_comparison - INFO - Source data loaded: 15 rows, 10 columns
2026-01-09 18:23:21,120 - dq_comparison - INFO - Target data loaded: 15 rows, 10 columns
2026-01-09 18:23:21,120 - dq_comparison - INFO - SELECTING COLUMNS FOR COMPARISON
2026-01-09 18:23:21,121 - dq_comparison - INFO - Source columns (original): ['CustomerName', 'Email', 'Phone', 'Salary', 'Department', 'JoinDate', 'PostalCode', 'City', 'Country', 'State']
2026-01-09 18:23:21,121 - dq_comparison - INFO - Target columns (original): ['CustomerName', 'Email', 'Phone', 'Salary', 'Department', 'JoinDate', 'PostalCode', 'City', 'Country', 'State']
2026-01-09 18:23:21,122 - dq_comparison - INFO - Common columns lowercased: ['joindate', 'customername', 'email', 'country', 'salary', 'postalcode', 'city', 'state', 'phone', 'department']
2026-01-09 18:23:21,123 - dq_comparison - INFO - Found 10 common columns between source and target (case-insensitive)
2026-01-09 18:23:21,123 - dq_comparison - INFO - User column selection input: all
2026-01-09 18:23:21,123 - dq_comparison - INFO - User selected ALL common columns for comparison
2026-01-09 18:23:21,125 - dq_comparison - INFO - Selected 10 columns for comparison: ['JoinDate', 'CustomerName', 'Email', 'Country', 'Salary']...
2026-01-09 18:23:21,126 - dq_comparison - INFO - GENERATING COMPREHENSIVE COMPARISON REPORT
2026-01-09 18:23:21,126 - dq_comparison - INFO - Report details - Source: CSV: sample_data.csv, Target: Database: mysql - dq_checks.customers, Selected columns: 10
2026-01-09 18:23:21,127 - dq_comparison - INFO - Initializing Error Logger...
2026-01-09 18:23:21,127 - dq_error_log - INFO - ErrorLogger initialized with database: dq_checks
2026-01-09 18:23:21,139 - dq_error_log - INFO - Database connection successful
2026-01-09 18:23:21,140 - dq_comparison - INFO - Session ID: CMP_20260109_182321
2026-01-09 18:23:21,141 - dq_comparison - INFO - ✅ Row counts match: 15 rows
2026-01-09 18:23:21,141 - dq_comparison - INFO - Comparing column structures...
2026-01-09 18:23:21,142 - dq_comparison - WARNING - Found 8 incompatible data type mismatches
2026-01-09 18:23:21,142 - dq_comparison - INFO - Column structure comparison complete. Match: False
2026-01-09 18:23:21,243 - dq_comparison - INFO - Validating primary key/unique fields...
2026-01-09 18:23:21,243 - dq_comparison - INFO - Checking key fields: ['PostalCode']
2026-01-09 18:23:21,247 - dq_comparison - WARNING - Field 'PostalCode' has duplicates in source: 2 rows
2026-01-09 18:23:21,251 - dq_comparison - WARNING - Field 'PostalCode' has duplicates in target: 2 rows
2026-01-09 18:23:21,252 - dq_comparison - INFO - Primary key validation complete. Passed: False
2026-01-09 18:23:21,280 - dq_comparison - INFO - Comparing table-level metadata...
2026-01-09 18:23:21,295 - dq_comparison - INFO - Table metadata comparison complete. Match: False
2026-01-09 18:23:21,296 - dq_comparison - INFO - SECOND CHECK: HASH-BASED COMPARISON WITH PERFECT NORMALIZATION
2026-01-09 18:23:21,299 - dq_comparison - INFO - === DEBUG: DATA TYPE CHECK ===
2026-01-09 18:23:21,300 - dq_comparison - INFO - Column: JoinDate
2026-01-09 18:23:21,301 - dq_comparison - INFO -   Source type: <class 'str'>, value: 15-01-2023
2026-01-09 18:23:21,301 - dq_comparison - INFO -   Target type: <class 'numpy.int64'>, value: 1673740800000000000
2026-01-09 18:23:21,302 - dq_comparison - INFO -   Normalized: '2023-01-15' vs '2023-01-15'
2026-01-09 18:23:21,303 - dq_comparison - INFO -   Match: True
2026-01-09 18:23:21,304 - dq_comparison - INFO - Column: CustomerName
2026-01-09 18:23:21,305 - dq_comparison - INFO -   Source type: <class 'str'>, value:    John Doe
2026-01-09 18:23:21,305 - dq_comparison - INFO -   Target type: <class 'str'>, value: John Doe
2026-01-09 18:23:21,307 - dq_comparison - INFO -   Normalized: 'john doe' vs 'john doe'
2026-01-09 18:23:21,307 - dq_comparison - INFO -   Match: True
2026-01-09 18:23:21,308 - dq_comparison - INFO - Column: Email
2026-01-09 18:23:21,308 - dq_comparison - INFO -   Source type: <class 'str'>, value: john@email.com
2026-01-09 18:23:21,309 - dq_comparison - INFO -   Target type: <class 'str'>, value: john@email.com
2026-01-09 18:23:21,310 - dq_comparison - INFO -   Normalized: 'john@email.com' vs 'john@email.com'
2026-01-09 18:23:21,310 - dq_comparison - INFO -   Match: True
2026-01-09 18:23:21,311 - dq_comparison - INFO - Source DF columns: ['CustomerName', 'Email', 'Phone', 'Salary', 'Department', 'JoinDate', 'PostalCode', 'City', 'Country', 'State']
2026-01-09 18:23:21,311 - dq_comparison - INFO - Target DF columns: ['CustomerName', 'Email', 'Phone', 'Salary', 'Department', 'JoinDate', 'PostalCode', 'City', 'Country', 'State']
2026-01-09 18:23:21,312 - dq_comparison - INFO - Selected columns for comparison: ['JoinDate', 'CustomerName', 'Email', 'Country', 'Salary', 'PostalCode', 'City', 'State', 'Phone', 'Department']
2026-01-09 18:23:21,313 - dq_comparison - INFO - Using 10 common columns for hash comparison
2026-01-09 18:23:21,313 - dq_comparison - INFO - Source columns: ['JoinDate', 'CustomerName', 'Email', 'Country', 'Salary', 'PostalCode', 'City', 'State', 'Phone', 'Department']
2026-01-09 18:23:21,314 - dq_comparison - INFO - Target columns: ['JoinDate', 'CustomerName', 'Email', 'Country', 'Salary', 'PostalCode', 'City', 'State', 'Phone', 'Department']
2026-01-09 18:23:21,314 - dq_comparison - INFO - Generating hashes for source data (15 rows)...
2026-01-09 18:23:21,315 - dq_comparison - INFO - DEBUG HASH ROW: JoinDate: '15-01-2023' -> '2023-01-15' | CustomerName: '   John Doe' -> 'john doe' | Email: 'john@email.com' -> 'john@email.com' | Country: 'USA' -> 'usa' | Salary: '50000.0' -> '50000'
2026-01-09 18:23:21,316 - dq_comparison - INFO - DEBUG HASH STRING: 2023-01-15|john doe|john@email.com|usa|50000...
2026-01-09 18:23:21,317 - dq_comparison - INFO - DEBUG HASH RESULT: 05270b08...
2026-01-09 18:23:21,317 - dq_comparison - INFO - DEBUG HASH ROW: JoinDate: '20-02-2023' -> '2023-02-20' | CustomerName: 'Jane      Smith' -> 'jane smith' | Email: 'jane@email.com' -> 'jane@email.com' | Country: 'USA' -> 'usa' | Salary: '60000.0' -> '60000'
2026-01-09 18:23:21,318 - dq_comparison - INFO - DEBUG HASH STRING: 2023-02-20|jane smith|jane@email.com|usa|60000...
2026-01-09 18:23:21,319 - dq_comparison - INFO - DEBUG HASH RESULT: b492d676...
2026-01-09 18:23:21,320 - dq_comparison - INFO - DEBUG HASH ROW: JoinDate: '10-03-2023' -> '2023-03-10' | CustomerName: 'Bob        Johnson' -> 'bob johnson' | Email: 'nan' -> 'NULL' | Country: 'USA' -> 'usa' | Salary: '55000.0' -> '55000'
2026-01-09 18:23:21,321 - dq_comparison - INFO - DEBUG HASH STRING: 2023-03-10|bob johnson|NULL|usa|55000...
2026-01-09 18:23:21,321 - dq_comparison - INFO - DEBUG HASH RESULT: a9f38256...
2026-01-09 18:23:21,322 - dq_comparison - INFO - DEBUG HASH ROW: JoinDate: '15-01-2023' -> '2023-01-15' | CustomerName: 'Alice Brown' -> 'alice brown' | Email: 'alice@email.com' -> 'alice@email.com' | Country: 'USA' -> 'usa' | Salary: '70000.0' -> '70000'
2026-01-09 18:23:21,322 - dq_comparison - INFO - DEBUG HASH STRING: 2023-01-15|alice brown|alice@email.com|usa|70000...
2026-01-09 18:23:21,323 - dq_comparison - INFO - DEBUG HASH RESULT: 22bb83e3...
2026-01-09 18:23:21,323 - dq_comparison - INFO - DEBUG HASH ROW: JoinDate: '05-04-2023' -> '2023-04-05' | CustomerName: 'Charlie Wilson' -> 'charlie wilson' | Email: 'charlie@email.com' -> 'charlie@email.com' | Country: 'USA' -> 'usa' | Salary: '48000.0' -> '48000'
2026-01-09 18:23:21,325 - dq_comparison - INFO - DEBUG HASH STRING: 2023-04-05|charlie wilson|charlie@email.com|usa|48000...
2026-01-09 18:23:21,325 - dq_comparison - INFO - DEBUG HASH RESULT: bc019761...
2026-01-09 18:23:21,326 - dq_comparison - INFO - DEBUG HASH ROW: JoinDate: '15-01-2023' -> '2023-01-15' | CustomerName: 'John Doe        ' -> 'john doe' | Email: 'john@email.com' -> 'john@email.com' | Country: 'USA' -> 'usa' | Salary: '50000.0' -> '50000'
2026-01-09 18:23:21,326 - dq_comparison - INFO - DEBUG HASH STRING: 2023-01-15|john doe|john@email.com|usa|50000...
2026-01-09 18:23:21,327 - dq_comparison - INFO - DEBUG HASH RESULT: 05270b08...
2026-01-09 18:23:21,327 - dq_comparison - INFO - DEBUG HASH ROW: JoinDate: '12-05-2023' -> '2023-05-12' | CustomerName: 'David         Lee' -> 'david lee' | Email: 'david@email.com' -> 'david@email.com' | Country: 'USA' -> 'usa' | Salary: 'nan' -> 'NULL'
2026-01-09 18:23:21,328 - dq_comparison - INFO - DEBUG HASH STRING: 2023-05-12|david lee|david@email.com|usa|NULL...
2026-01-09 18:23:21,328 - dq_comparison - INFO - DEBUG HASH RESULT: ca86ecd9...
2026-01-09 18:23:21,329 - dq_comparison - INFO - DEBUG HASH ROW: JoinDate: '18-06-2023' -> '2023-06-18' | CustomerName: '  Sarah      Chen  ' -> 'sarah chen' | Email: 'sarah@email.com' -> 'sarah@email.com' | Country: 'USA' -> 'usa' | Salary: '52000.0' -> '52000'
2026-01-09 18:23:21,330 - dq_comparison - INFO - DEBUG HASH STRING: 2023-06-18|sarah chen|sarah@email.com|usa|52000...
2026-01-09 18:23:21,331 - dq_comparison - INFO - DEBUG HASH RESULT: 12401390...
2026-01-09 18:23:21,332 - dq_comparison - INFO - DEBUG HASH ROW: JoinDate: '22-07-2023' -> '2023-07-22' | CustomerName: 'Mike Davis' -> 'mike davis' | Email: 'invalid-email' -> 'invalid-email' | Country: 'USA' -> 'usa' | Salary: '58000.0' -> '58000'
2026-01-09 18:23:21,332 - dq_comparison - INFO - DEBUG HASH STRING: 2023-07-22|mike davis|invalid-email|usa|58000...
2026-01-09 18:23:21,333 - dq_comparison - INFO - DEBUG HASH RESULT: c31062ef...
2026-01-09 18:23:21,334 - dq_comparison - INFO - DEBUG HASH ROW: JoinDate: '30-08-2023' -> '2023-08-30' | CustomerName: 'Lisa       Wang' -> 'lisa wang' | Email: 'lisa@email.com' -> 'lisa@email.com' | Country: 'USA' -> 'usa' | Salary: '62000.0' -> '62000'
2026-01-09 18:23:21,335 - dq_comparison - INFO - DEBUG HASH STRING: 2023-08-30|lisa wang|lisa@email.com|usa|62000...
2026-01-09 18:23:21,336 - dq_comparison - INFO - DEBUG HASH RESULT: ad8ddad0...
2026-01-09 18:23:21,336 - dq_comparison - INFO - DEBUG HASH ROW: JoinDate: '10-09-2023' -> '2023-09-10' | CustomerName: 'Tom Wilson' -> 'tom wilson' | Email: 'tom@email.com       ' -> 'tom@email.com' | Country: 'USA' -> 'usa' | Salary: '45000.0' -> '45000'
2026-01-09 18:23:21,337 - dq_comparison - INFO - DEBUG HASH STRING: 2023-09-10|tom wilson|tom@email.com|usa|45000...
2026-01-09 18:23:21,337 - dq_comparison - INFO - DEBUG HASH RESULT: 4dc4ef06...
2026-01-09 18:23:21,338 - dq_comparison - INFO - DEBUG HASH ROW: JoinDate: '15-10-2023' -> '2023-10-15' | CustomerName: 'nan' -> 'NULL' | Email: 'empty@email.com' -> 'empty@email.com' | Country: 'USA' -> 'usa' | Salary: '53000.0' -> '53000'
2026-01-09 18:23:21,338 - dq_comparison - INFO - DEBUG HASH STRING: 2023-10-15|NULL|empty@email.com|usa|53000...
2026-01-09 18:23:21,339 - dq_comparison - INFO - DEBUG HASH RESULT: 699bf199...
2026-01-09 18:23:21,340 - dq_comparison - INFO - DEBUG HASH ROW: JoinDate: '20-11-2023' -> '2023-11-20' | CustomerName: '            Robert Brown' -> 'robert brown' | Email: 'robert@email.com' -> 'robert@email.com' | Country: 'USA' -> 'usa' | Salary: '67000.0' -> '67000'
2026-01-09 18:23:21,340 - dq_comparison - INFO - DEBUG HASH STRING: 2023-11-20|robert brown|robert@email.com|usa|67000...
2026-01-09 18:23:21,341 - dq_comparison - INFO - DEBUG HASH RESULT: 5f75b7f1...
2026-01-09 18:23:21,342 - dq_comparison - INFO - DEBUG HASH ROW: JoinDate: '05-12-2023' -> '2023-12-05' | CustomerName: 'Nancy Davis' -> 'nancy davis' | Email: 'nancy@email.com' -> 'nancy@email.com' | Country: 'USA' -> 'usa' | Salary: 'nan' -> 'NULL'
2026-01-09 18:23:21,343 - dq_comparison - INFO - DEBUG HASH STRING: 2023-12-05|nancy davis|nancy@email.com|usa|NULL...
2026-01-09 18:23:21,343 - dq_comparison - INFO - DEBUG HASH RESULT: 978dbdfc...
2026-01-09 18:23:21,344 - dq_comparison - INFO - DEBUG HASH ROW: JoinDate: '10-01-2024' -> '2024-01-10' | CustomerName: 'Kevin Lee' -> 'kevin lee' | Email: 'kevin@email.com' -> 'kevin@email.com' | Country: 'USA' -> 'usa' | Salary: '49000.0' -> '49000'
2026-01-09 18:23:21,344 - dq_comparison - INFO - DEBUG HASH STRING: 2024-01-10|kevin lee|kevin@email.com|usa|49000...
2026-01-09 18:23:21,345 - dq_comparison - INFO - DEBUG HASH RESULT: 7dadd9c5...
2026-01-09 18:23:21,345 - dq_comparison - INFO - === DEBUG: SAMPLE HASHES ===
2026-01-09 18:23:21,346 - dq_comparison - INFO - Hash 1: 05270b089809dc5b... (sample row 0)
2026-01-09 18:23:21,346 - dq_comparison - INFO - Hash 2: b492d676ae79a1ce... (sample row 1)
2026-01-09 18:23:21,347 - dq_comparison - INFO - Hash 3: a9f3825616eafd86... (sample row 2)
2026-01-09 18:23:21,348 - dq_comparison - INFO - Generating hashes for target data (15 rows)...
2026-01-09 18:23:21,351 - dq_comparison - INFO - 
======================================================================
2026-01-09 18:23:21,351 - dq_comparison - INFO - 🔍 DEBUG: ANALYZING WHY HASHES DON'T MATCH
2026-01-09 18:23:21,352 - dq_comparison - INFO - ======================================================================
2026-01-09 18:23:21,353 - dq_comparison - INFO - 
--- Analyzing Row 0 ---
2026-01-09 18:23:21,353 - dq_comparison - INFO - Column 'JoinDate' → 'JoinDate':
2026-01-09 18:23:21,353 - dq_comparison - INFO -   Source: '15-01-2023' (type: str) → '2023-01-15'
2026-01-09 18:23:21,354 - dq_comparison - INFO -   Target: '1673740800000000000' (type: int64) → '2023-01-15'
2026-01-09 18:23:21,355 - dq_comparison - INFO -   Match after normalization: ✅ YES
2026-01-09 18:23:21,355 - dq_comparison - INFO - Column 'CustomerName' → 'CustomerName':
2026-01-09 18:23:21,356 - dq_comparison - INFO -   Source: '   John Doe' (type: str) → 'john doe'
2026-01-09 18:23:21,357 - dq_comparison - INFO -   Target: 'John Doe' (type: str) → 'john doe'
2026-01-09 18:23:21,358 - dq_comparison - INFO -   Match after normalization: ✅ YES
2026-01-09 18:23:21,359 - dq_comparison - INFO - Column 'Email' → 'Email':
2026-01-09 18:23:21,359 - dq_comparison - INFO -   Source: 'john@email.com' (type: str) → 'john@email.com'
2026-01-09 18:23:21,360 - dq_comparison - INFO -   Target: 'john@email.com' (type: str) → 'john@email.com'
2026-01-09 18:23:21,361 - dq_comparison - INFO -   Match after normalization: ✅ YES
2026-01-09 18:23:21,361 - dq_comparison - INFO - Column 'Country' → 'Country':
2026-01-09 18:23:21,362 - dq_comparison - INFO -   Source: 'USA' (type: str) → 'usa'
2026-01-09 18:23:21,362 - dq_comparison - INFO -   Target: 'USA' (type: str) → 'usa'
2026-01-09 18:23:21,363 - dq_comparison - INFO -   Match after normalization: ✅ YES
2026-01-09 18:23:21,364 - dq_comparison - INFO - Column 'Salary' → 'Salary':
2026-01-09 18:23:21,364 - dq_comparison - INFO -   Source: '50000.0' (type: float64) → '50000'
2026-01-09 18:23:21,364 - dq_comparison - INFO -   Target: '50000.0' (type: float32) → '50000'
2026-01-09 18:23:21,365 - dq_comparison - INFO -   Match after normalization: ✅ YES
2026-01-09 18:23:21,366 - dq_comparison - INFO - 
Hash components for Row 0:
2026-01-09 18:23:21,368 - dq_comparison - INFO - Source hash string start: 2023-01-15|john doe|john@email.com...
2026-01-09 18:23:21,368 - dq_comparison - INFO - Target hash string start: 2023-01-15|john doe|john@email.com...
2026-01-09 18:23:21,369 - dq_comparison - INFO - Same? ✅ YES
2026-01-09 18:23:21,370 - dq_comparison - INFO - 
--- Analyzing Row 1 ---
2026-01-09 18:23:21,370 - dq_comparison - INFO - Column 'JoinDate' → 'JoinDate':
2026-01-09 18:23:21,371 - dq_comparison - INFO -   Source: '20-02-2023' (type: str) → '2023-02-20'
2026-01-09 18:23:21,372 - dq_comparison - INFO -   Target: '1676851200000000000' (type: int64) → '2023-02-20'
2026-01-09 18:23:21,373 - dq_comparison - INFO -   Match after normalization: ✅ YES
2026-01-09 18:23:21,373 - dq_comparison - INFO - Column 'CustomerName' → 'CustomerName':
2026-01-09 18:23:21,374 - dq_comparison - INFO -   Source: 'Jane      Smith' (type: str) → 'jane smith'
2026-01-09 18:23:21,375 - dq_comparison - INFO -   Target: 'Jane Smith' (type: str) → 'jane smith'
2026-01-09 18:23:21,375 - dq_comparison - INFO -   Match after normalization: ✅ YES
2026-01-09 18:23:21,376 - dq_comparison - INFO - Column 'Email' → 'Email':
2026-01-09 18:23:21,377 - dq_comparison - INFO -   Source: 'jane@email.com' (type: str) → 'jane@email.com'
2026-01-09 18:23:21,378 - dq_comparison - INFO -   Target: 'jane@email.com' (type: str) → 'jane@email.com'
2026-01-09 18:23:21,378 - dq_comparison - INFO -   Match after normalization: ✅ YES
2026-01-09 18:23:21,379 - dq_comparison - INFO - Column 'Country' → 'Country':
2026-01-09 18:23:21,379 - dq_comparison - INFO -   Source: 'USA' (type: str) → 'usa'
2026-01-09 18:23:21,379 - dq_comparison - INFO -   Target: 'USA' (type: str) → 'usa'
2026-01-09 18:23:21,380 - dq_comparison - INFO -   Match after normalization: ✅ YES
2026-01-09 18:23:21,380 - dq_comparison - INFO - Column 'Salary' → 'Salary':
2026-01-09 18:23:21,382 - dq_comparison - INFO -   Source: '60000.0' (type: float64) → '60000'
2026-01-09 18:23:21,382 - dq_comparison - INFO -   Target: '60000.0' (type: float32) → '60000'
2026-01-09 18:23:21,383 - dq_comparison - INFO -   Match after normalization: ✅ YES
2026-01-09 18:23:21,383 - dq_comparison - INFO - 
Hash components for Row 1:
2026-01-09 18:23:21,385 - dq_comparison - INFO - Source hash string start: 2023-02-20|jane smith|jane@email.com...
2026-01-09 18:23:21,385 - dq_comparison - INFO - Target hash string start: 2023-02-20|jane smith|jane@email.com...
2026-01-09 18:23:21,385 - dq_comparison - INFO - Same? ✅ YES
2026-01-09 18:23:21,386 - dq_comparison - INFO - 
--- Analyzing Row 2 ---
2026-01-09 18:23:21,387 - dq_comparison - INFO - Column 'JoinDate' → 'JoinDate':
2026-01-09 18:23:21,388 - dq_comparison - INFO -   Source: '10-03-2023' (type: str) → '2023-03-10'
2026-01-09 18:23:21,388 - dq_comparison - INFO -   Target: '1678406400000000000' (type: int64) → '2023-03-10'
2026-01-09 18:23:21,389 - dq_comparison - INFO -   Match after normalization: ✅ YES
2026-01-09 18:23:21,390 - dq_comparison - INFO - Column 'CustomerName' → 'CustomerName':
2026-01-09 18:23:21,391 - dq_comparison - INFO -   Source: 'Bob        Johnson' (type: str) → 'bob johnson'
2026-01-09 18:23:21,391 - dq_comparison - INFO -   Target: 'Bob Johnson' (type: str) → 'bob johnson'
2026-01-09 18:23:21,391 - dq_comparison - INFO -   Match after normalization: ✅ YES
2026-01-09 18:23:21,392 - dq_comparison - INFO - Column 'Email' → 'Email':
2026-01-09 18:23:21,393 - dq_comparison - INFO -   Source: 'nan' (type: float) → 'NULL'
2026-01-09 18:23:21,393 - dq_comparison - INFO -   Target: '' (type: str) → 'NULL'
2026-01-09 18:23:21,394 - dq_comparison - INFO -   Match after normalization: ✅ YES
2026-01-09 18:23:21,394 - dq_comparison - INFO - Column 'Country' → 'Country':
2026-01-09 18:23:21,395 - dq_comparison - INFO -   Source: 'USA' (type: str) → 'usa'
2026-01-09 18:23:21,396 - dq_comparison - INFO -   Target: 'USA' (type: str) → 'usa'
2026-01-09 18:23:21,396 - dq_comparison - INFO -   Match after normalization: ✅ YES
2026-01-09 18:23:21,396 - dq_comparison - INFO - Column 'Salary' → 'Salary':
2026-01-09 18:23:21,398 - dq_comparison - INFO -   Source: '55000.0' (type: float64) → '55000'
2026-01-09 18:23:21,398 - dq_comparison - INFO -   Target: '55000.0' (type: float32) → '55000'
2026-01-09 18:23:21,399 - dq_comparison - INFO -   Match after normalization: ✅ YES
2026-01-09 18:23:21,400 - dq_comparison - INFO - 
Hash components for Row 2:
2026-01-09 18:23:21,401 - dq_comparison - INFO - Source hash string start: 2023-03-10|bob johnson|NULL...
2026-01-09 18:23:21,401 - dq_comparison - INFO - Target hash string start: 2023-03-10|bob johnson|NULL...
2026-01-09 18:23:21,402 - dq_comparison - INFO - Same? ✅ YES
2026-01-09 18:23:21,402 - dq_comparison - INFO - 
--- Column Data Types Analysis ---
2026-01-09 18:23:21,403 - dq_comparison - INFO - Column 1: 'JoinDate' (object) ↔ 'JoinDate' (int64)
2026-01-09 18:23:21,404 - dq_comparison - INFO -   Sample: Source='15-01-2023', Target='1673740800000000000'
2026-01-09 18:23:21,405 - dq_comparison - INFO - Column 2: 'CustomerName' (object) ↔ 'CustomerName' (object)
2026-01-09 18:23:21,406 - dq_comparison - INFO -   Sample: Source='   John Doe', Target='John Doe'
2026-01-09 18:23:21,406 - dq_comparison - INFO - Column 3: 'Email' (object) ↔ 'Email' (object)
2026-01-09 18:23:21,407 - dq_comparison - INFO -   Sample: Source='john@email.com', Target='john@email.com'
2026-01-09 18:23:21,407 - dq_comparison - INFO - Column 4: 'Country' (object) ↔ 'Country' (category)
2026-01-09 18:23:21,408 - dq_comparison - INFO -   Sample: Source='USA', Target='USA'
2026-01-09 18:23:21,408 - dq_comparison - INFO - Column 5: 'Salary' (float64) ↔ 'Salary' (float32)
2026-01-09 18:23:21,409 - dq_comparison - INFO -   Sample: Source='50000.0', Target='50000.0'
2026-01-09 18:23:21,409 - dq_comparison - INFO - === DEBUG: DIRECT ROW COMPARISON ===
2026-01-09 18:23:21,410 - dq_comparison - INFO - --- Comparing Row 0 ---
2026-01-09 18:23:21,411 - dq_comparison - INFO -   ✅ JoinDate: '15-01-2023' → '2023-01-15' vs '1673740800000000000' → '2023-01-15'
2026-01-09 18:23:21,411 - dq_comparison - INFO -   ✅ CustomerName: '   John Doe' → 'john doe' vs 'John Doe' → 'john doe'
2026-01-09 18:23:21,412 - dq_comparison - INFO -   ✅ Email: 'john@email.com' → 'john@email.com' vs 'john@email.com' → 'john@email.com'
2026-01-09 18:23:21,413 - dq_comparison - INFO -   ✅ Country: 'USA' → 'usa' vs 'USA' → 'usa'
2026-01-09 18:23:21,413 - dq_comparison - INFO -   ✅ Salary: '50000.0' → '50000' vs '50000.0' → '50000'
2026-01-09 18:23:21,414 - dq_comparison - INFO - --- Comparing Row 1 ---
2026-01-09 18:23:21,415 - dq_comparison - INFO -   ✅ JoinDate: '20-02-2023' → '2023-02-20' vs '1676851200000000000' → '2023-02-20'
2026-01-09 18:23:21,416 - dq_comparison - INFO -   ✅ CustomerName: 'Jane      Smith' → 'jane smith' vs 'Jane Smith' → 'jane smith'
2026-01-09 18:23:21,417 - dq_comparison - INFO -   ✅ Email: 'jane@email.com' → 'jane@email.com' vs 'jane@email.com' → 'jane@email.com'
2026-01-09 18:23:21,417 - dq_comparison - INFO -   ✅ Country: 'USA' → 'usa' vs 'USA' → 'usa'
2026-01-09 18:23:21,418 - dq_comparison - INFO -   ✅ Salary: '60000.0' → '60000' vs '60000.0' → '60000'
2026-01-09 18:23:21,418 - dq_comparison - INFO - --- Comparing Row 2 ---
2026-01-09 18:23:21,419 - dq_comparison - INFO -   ✅ JoinDate: '10-03-2023' → '2023-03-10' vs '1678406400000000000' → '2023-03-10'
2026-01-09 18:23:21,419 - dq_comparison - INFO -   ✅ CustomerName: 'Bob        Johnson' → 'bob johnson' vs 'Bob Johnson' → 'bob johnson'
2026-01-09 18:23:21,420 - dq_comparison - INFO -   ✅ Email: 'nan' → 'NULL' vs '' → 'NULL'
2026-01-09 18:23:21,420 - dq_comparison - INFO -   ✅ Country: 'USA' → 'usa' vs 'USA' → 'usa'
2026-01-09 18:23:21,421 - dq_comparison - INFO -   ✅ Salary: '55000.0' → '55000' vs '55000.0' → '55000'
2026-01-09 18:23:21,421 - dq_comparison - INFO - Hash-based Comparison Results (with duplicate handling):
2026-01-09 18:23:21,422 - dq_comparison - INFO -   • Unique source hashes: 14
2026-01-09 18:23:21,423 - dq_comparison - INFO -   • Unique target hashes: 14
2026-01-09 18:23:21,424 - dq_comparison - INFO -   • Common hashes: 13
2026-01-09 18:23:21,425 - dq_comparison - INFO -   • Common rows (counting duplicates): 14
2026-01-09 18:23:21,425 - dq_comparison - INFO -   • Rows only in source (counting duplicates): 1
2026-01-09 18:23:21,426 - dq_comparison - INFO -   • Rows only in target (counting duplicates): 1
2026-01-09 18:23:21,426 - dq_comparison - INFO - Found 1 rows missing in target
2026-01-09 18:23:21,444 - dq_comparison - INFO - Found 1 extra rows in target
2026-01-09 18:23:21,458 - dq_comparison - INFO - HASH-ONLY COMPARISON COMPLETED
2026-01-09 18:23:21,458 - dq_comparison - INFO - Returning counts for simple scoring:
2026-01-09 18:23:21,459 - dq_comparison - INFO -   Common rows: 14
2026-01-09 18:23:21,460 - dq_comparison - INFO -   Unique to source: 1
2026-01-09 18:23:21,460 - dq_comparison - INFO -   Unique to target: 1
2026-01-09 18:23:21,462 - dq_comparison - INFO -   Value mismatches: 20
2026-01-09 18:23:21,463 - dq_comparison - INFO -   Missing rows: 1
2026-01-09 18:23:21,463 - dq_comparison - INFO -   Extra rows: 1
2026-01-09 18:23:21,465 - dq_comparison - INFO - Analyzing data quality metrics...
2026-01-09 18:23:21,478 - dq_comparison - INFO - Null values - Source: 6 (4.00%), Target: 6 (4.00%)
2026-01-09 18:23:21,481 - dq_comparison - INFO - Duplicate rows (normalized) - Source: 1, Target: 1
2026-01-09 18:23:21,483 - dq_comparison - INFO - Source duplicate samples: ['Row 2', 'Row 7']
2026-01-09 18:23:21,485 - dq_comparison - INFO - Target duplicate samples: ['Row 2', 'Row 7']
2026-01-09 18:23:21,500 - dq_error_log - INFO - Retrieved 12 error logs for session CMP_20260109_182321
2026-01-09 18:23:21,502 - dq_comparison - INFO - 
📊 SIMPLE SCORING CALCULATION:
2026-01-09 18:23:21,503 - dq_comparison - INFO -   Source rows: 15
2026-01-09 18:23:21,504 - dq_comparison - INFO -   Common rows (matched): 14
2026-01-09 18:23:21,505 - dq_comparison - INFO -   Calculation: (14 / 15) * 100 = 93.33%
2026-01-09 18:23:21,506 - dq_comparison - INFO -   Explanation: 14 matched rows out of 15 total source rows
2026-01-09 18:23:21,506 - dq_comparison - INFO - 
=== AUDIT LOGGING SECTION ===
2026-01-09 18:23:21,508 - dq_comparison - INFO - 🔍 Audit logging is ENABLED in APP_SETTINGS
2026-01-09 18:23:21,508 - dq_audit - INFO - Audit class initialized with database: dq_checks
2026-01-09 18:23:21,510 - dq_comparison - INFO - Attempting to log audit record for session: CMP_20260109_182321
2026-01-09 18:23:21,511 - dq_audit - INFO - Starting database insertion for comparison...
2026-01-09 18:23:21,526 - dq_audit - INFO - Inserted comparison record with ID: 594
2026-01-09 18:23:21,527 - dq_comparison - INFO - ✅ Audit record logged successfully (ID: 594)
2026-01-09 18:23:21,541 - dq_error_log - INFO - Retrieved 12 error logs for session CMP_20260109_182321
2026-01-09 18:23:21,560 - dq_error_log - INFO - Retrieved summary: 12 total errors for session CMP_20260109_182321
2026-01-09 18:23:21,561 - dq_audit - INFO - Audit class initialized with database: dq_checks
2026-01-09 18:23:21,578 - dq_audit - INFO - Retrieved 1 audit logs for session CMP_20260109_182321
2026-01-09 18:23:21,579 - dq_comparison - INFO - 
🔍 Final results verification:
2026-01-09 18:23:21,580 - dq_comparison - INFO -    Session ID: CMP_20260109_182321
2026-01-09 18:23:21,581 - dq_comparison - INFO -    DQ Score (Simple %): 93.33%
2026-01-09 18:23:21,581 - dq_comparison - INFO -    Source rows: 15
2026-01-09 18:23:21,582 - dq_comparison - INFO -    Matched rows: 14
2026-01-09 18:23:21,582 - dq_comparison - INFO -    Calculation: (14 / 15) * 100
2026-01-09 18:23:21,583 - dq_comparison - INFO - Comparison analysis completed successfully
2026-01-09 18:23:21,595 - dq_audit - INFO - Retrieved 1 audit logs for session CMP_20260109_182321
2026-01-09 18:23:21,611 - dq_error_log - INFO - Retrieved 12 error logs for session CMP_20260109_182321
2026-01-09 18:23:21,627 - dq_error_log - INFO - Retrieved summary: 12 total errors for session CMP_20260109_182321
2026-01-09 18:23:21,628 - __main__ - INFO - Comparison completed for session CMP_20260109_182321
2026-01-09 18:23:21,631 - __main__ - INFO - Completed with status 200 in 0.567s
2026-01-09 18:23:37,871 - __main__ - INFO - POST /api/compare - Request started
2026-01-09 18:23:37,872 - __main__ - INFO - Comparison request - Source: database, Target: excel
2026-01-09 18:23:37,873 - __main__ - INFO - Comparison analysis request received
2026-01-09 18:23:37,875 - __main__ - INFO - DEBUG source_data from nested: {'source_type': 'database', 'db_type': 'mysql', 'host': 'localhost', 'port': 3306, 'database': 'dq_checks', 'table': 'customers', 'user': 'root', 'password': 'root'}
2026-01-09 18:23:37,876 - __main__ - INFO - Starting comparison for session CMP_20260109_182337
2026-01-09 18:23:37,876 - dq_comparison - INFO - Starting comparison analysis in UI mode
2026-01-09 18:23:37,877 - dq_comparison - INFO - LOADING SOURCE AND TARGET DATA
2026-01-09 18:23:37,878 - dq_comparison - INFO - 
==================================================
2026-01-09 18:23:37,879 - dq_comparison - INFO - 🔗 SOURCE DATA CONFIGURATION
2026-01-09 18:23:37,879 - dq_comparison - INFO - ==================================================
2026-01-09 18:23:37,880 - dq_comparison - INFO - 
🗄️ SOURCE DATABASE CONFIGURATION
2026-01-09 18:23:37,882 - dq_comparison - INFO - ----------------------------------------
2026-01-09 18:23:37,882 - dq_comparison - INFO - UI mode: Using provided database configuration for SOURCE
2026-01-09 18:23:37,883 - dq_unified - INFO - Loading data from DATABASE
2026-01-09 18:23:37,883 - dq_unified - INFO - Loading large database table: customers
2026-01-09 18:23:37,884 - dq_unified - INFO - Normalized DB config with schema: dq_checks
2026-01-09 18:23:37,896 - dq_unified - INFO - MySQL table customers has 15 rows
2026-01-09 18:23:37,897 - dq_unified - INFO - Loading 15 rows from MySQL...
2026-01-09 18:23:37,903 - dq_unified - INFO - Loaded 15 rows from MySQL
2026-01-09 18:23:37,907 - dq_unified - INFO - Memory optimization: 0.0MB -> 0.0MB (Saved: 0.0MB)
2026-01-09 18:23:37,908 - dq_unified - INFO - Standardizing data types...
2026-01-09 18:23:37,911 - dq_unified - INFO - Data type standardization complete
2026-01-09 18:23:37,912 - dq_unified - INFO - Loaded 15 rows, 10 columns. Memory: 137.0MB total, 0.0MB for dataframe
2026-01-09 18:23:37,913 - dq_comparison - INFO - SOURCE database loaded: 15 rows, 10 columns
2026-01-09 18:23:37,913 - dq_comparison - INFO - 
==================================================
2026-01-09 18:23:37,914 - dq_comparison - INFO - 🔗 TARGET DATA CONFIGURATION
2026-01-09 18:23:37,914 - dq_comparison - INFO - ==================================================
2026-01-09 18:23:37,914 - dq_comparison - INFO - DEBUG load_excel_source called for TARGET
2026-01-09 18:23:37,915 - dq_comparison - INFO - DEBUG ui_data: {'source_type': 'excel', 'target_file_path': 'C:\\\\Users\\\\003160\\\\OneDrive - wisseninfotech.com\\\\Documents\\\\DQ-Checks-Shashi\\\\Test_data\\\\sample_data.xlsx'}
2026-01-09 18:23:37,916 - dq_comparison - INFO - DEBUG ui_data type: <class 'dict'>
2026-01-09 18:23:37,917 - dq_comparison - INFO - DEBUG Found target_file_path in ui_data: C:\\Users\\003160\\OneDrive - wisseninfotech.com\\Documents\\DQ-Checks-Shashi\\Test_data\\sample_data.xlsx
2026-01-09 18:23:37,966 - dq_comparison - INFO - TARGET Excel loaded: 15 rows, 10 columns
2026-01-09 18:23:37,967 - dq_comparison - INFO - Source data loaded: 15 rows, 10 columns
2026-01-09 18:23:37,968 - dq_comparison - INFO - Target data loaded: 15 rows, 10 columns
2026-01-09 18:23:37,969 - dq_comparison - INFO - SELECTING COLUMNS FOR COMPARISON
2026-01-09 18:23:37,969 - dq_comparison - INFO - Source columns (original): ['CustomerName', 'Email', 'Phone', 'Salary', 'Department', 'JoinDate', 'PostalCode', 'City', 'Country', 'State']
2026-01-09 18:23:37,970 - dq_comparison - INFO - Target columns (original): ['CustomerName', 'Email', 'Phone', 'Salary', 'Department', 'JoinDate', 'PostalCode', 'City', 'Country', 'State']
2026-01-09 18:23:37,971 - dq_comparison - INFO - Common columns lowercased: ['joindate', 'customername', 'email', 'country', 'salary', 'postalcode', 'city', 'state', 'phone', 'department']
2026-01-09 18:23:37,971 - dq_comparison - INFO - Found 10 common columns between source and target (case-insensitive)
2026-01-09 18:23:37,972 - dq_comparison - INFO - User column selection input: all
2026-01-09 18:23:37,974 - dq_comparison - INFO - User selected ALL common columns for comparison
2026-01-09 18:23:37,974 - dq_comparison - INFO - Selected 10 columns for comparison: ['JoinDate', 'CustomerName', 'Email', 'Country', 'Salary']...
2026-01-09 18:23:37,974 - dq_comparison - INFO - GENERATING COMPREHENSIVE COMPARISON REPORT
2026-01-09 18:23:37,975 - dq_comparison - INFO - Report details - Source: Database: mysql - dq_checks.customers, Target: Excel: sample_data.xlsx (sample_data), Selected columns: 10
2026-01-09 18:23:37,977 - dq_comparison - INFO - Initializing Error Logger...
2026-01-09 18:23:37,977 - dq_error_log - INFO - ErrorLogger initialized with database: dq_checks
2026-01-09 18:23:37,992 - dq_error_log - INFO - Database connection successful
2026-01-09 18:23:37,994 - dq_comparison - INFO - Session ID: CMP_20260109_182337
2026-01-09 18:23:37,994 - dq_comparison - INFO - ✅ Row counts match: 15 rows
2026-01-09 18:23:37,995 - dq_comparison - INFO - Comparing column structures...
2026-01-09 18:23:37,996 - dq_comparison - WARNING - Found 7 incompatible data type mismatches
2026-01-09 18:23:37,997 - dq_comparison - INFO - Column structure comparison complete. Match: False
2026-01-09 18:23:38,078 - dq_comparison - INFO - Validating primary key/unique fields...
2026-01-09 18:23:38,078 - dq_comparison - INFO - Checking key fields: ['PostalCode']
2026-01-09 18:23:38,080 - dq_comparison - WARNING - Field 'PostalCode' has duplicates in source: 2 rows
2026-01-09 18:23:38,081 - dq_comparison - WARNING - Field 'PostalCode' has duplicates in target: 2 rows
2026-01-09 18:23:38,081 - dq_comparison - INFO - Primary key validation complete. Passed: False
2026-01-09 18:23:38,108 - dq_comparison - INFO - Comparing table-level metadata...
2026-01-09 18:23:38,119 - dq_comparison - INFO - Table metadata comparison complete. Match: False
2026-01-09 18:23:38,120 - dq_comparison - INFO - SECOND CHECK: HASH-BASED COMPARISON WITH PERFECT NORMALIZATION
2026-01-09 18:23:38,122 - dq_comparison - INFO - === DEBUG: DATA TYPE CHECK ===
2026-01-09 18:23:38,123 - dq_comparison - INFO - Column: JoinDate
2026-01-09 18:23:38,124 - dq_comparison - INFO -   Source type: <class 'numpy.int64'>, value: 1673740800000000000
2026-01-09 18:23:38,126 - dq_comparison - INFO -   Target type: <class 'pandas._libs.tslibs.timestamps.Timestamp'>, value: 2023-01-15 00:00:00
2026-01-09 18:23:38,127 - dq_comparison - INFO -   Normalized: '2023-01-15' vs '2023-01-15'
2026-01-09 18:23:38,128 - dq_comparison - INFO -   Match: True
2026-01-09 18:23:38,129 - dq_comparison - INFO - Column: CustomerName
2026-01-09 18:23:38,130 - dq_comparison - INFO -   Source type: <class 'str'>, value: John Doe
2026-01-09 18:23:38,130 - dq_comparison - INFO -   Target type: <class 'str'>, value: John Doe
2026-01-09 18:23:38,131 - dq_comparison - INFO -   Normalized: 'john doe' vs 'john doe'
2026-01-09 18:23:38,132 - dq_comparison - INFO -   Match: True
2026-01-09 18:23:38,132 - dq_comparison - INFO - Column: Email
2026-01-09 18:23:38,133 - dq_comparison - INFO -   Source type: <class 'str'>, value: john@email.com
2026-01-09 18:23:38,133 - dq_comparison - INFO -   Target type: <class 'str'>, value: john@email.com
2026-01-09 18:23:38,135 - dq_comparison - INFO -   Normalized: 'john@email.com' vs 'john@email.com'
2026-01-09 18:23:38,135 - dq_comparison - INFO -   Match: True
2026-01-09 18:23:38,136 - dq_comparison - INFO - Source DF columns: ['CustomerName', 'Email', 'Phone', 'Salary', 'Department', 'JoinDate', 'PostalCode', 'City', 'Country', 'State']
2026-01-09 18:23:38,136 - dq_comparison - INFO - Target DF columns: ['CustomerName', 'Email', 'Phone', 'Salary', 'Department', 'JoinDate', 'PostalCode', 'City', 'Country', 'State']
2026-01-09 18:23:38,137 - dq_comparison - INFO - Selected columns for comparison: ['JoinDate', 'CustomerName', 'Email', 'Country', 'Salary', 'PostalCode', 'City', 'State', 'Phone', 'Department']
2026-01-09 18:23:38,138 - dq_comparison - INFO - Using 10 common columns for hash comparison
2026-01-09 18:23:38,138 - dq_comparison - INFO - Source columns: ['JoinDate', 'CustomerName', 'Email', 'Country', 'Salary', 'PostalCode', 'City', 'State', 'Phone', 'Department']
2026-01-09 18:23:38,139 - dq_comparison - INFO - Target columns: ['JoinDate', 'CustomerName', 'Email', 'Country', 'Salary', 'PostalCode', 'City', 'State', 'Phone', 'Department']
2026-01-09 18:23:38,140 - dq_comparison - INFO - Generating hashes for source data (15 rows)...
2026-01-09 18:23:38,143 - dq_comparison - INFO - DEBUG HASH ROW: JoinDate: '1673740800000000000' -> '2023-01-15' | CustomerName: 'John Doe' -> 'john doe' | Email: 'john@email.com' -> 'john@email.com' | Country: 'USA' -> 'usa' | Salary: '50000.0' -> '50000'
2026-01-09 18:23:38,144 - dq_comparison - INFO - DEBUG HASH STRING: 2023-01-15|john doe|john@email.com|usa|50000...
2026-01-09 18:23:38,145 - dq_comparison - INFO - DEBUG HASH RESULT: 05270b08...
2026-01-09 18:23:38,146 - dq_comparison - INFO - DEBUG HASH ROW: JoinDate: '1676851200000000000' -> '2023-02-20' | CustomerName: 'Jane Smith' -> 'jane smith' | Email: 'jane@email.com' -> 'jane@email.com' | Country: 'USA' -> 'usa' | Salary: '60000.0' -> '60000'
2026-01-09 18:23:38,147 - dq_comparison - INFO - DEBUG HASH STRING: 2023-02-20|jane smith|jane@email.com|usa|60000...
2026-01-09 18:23:38,147 - dq_comparison - INFO - DEBUG HASH RESULT: b492d676...
2026-01-09 18:23:38,149 - dq_comparison - INFO - DEBUG HASH ROW: JoinDate: '1678406400000000000' -> '2023-03-10' | CustomerName: 'Bob Johnson' -> 'bob johnson' | Email: '' -> 'NULL' | Country: 'USA' -> 'usa' | Salary: '55000.0' -> '55000'
2026-01-09 18:23:38,150 - dq_comparison - INFO - DEBUG HASH STRING: 2023-03-10|bob johnson|NULL|usa|55000...
2026-01-09 18:23:38,150 - dq_comparison - INFO - DEBUG HASH RESULT: a9f38256...
2026-01-09 18:23:38,152 - dq_comparison - INFO - DEBUG HASH ROW: JoinDate: '1673740800000000000' -> '2023-01-15' | CustomerName: 'Alice Brown' -> 'alice brown' | Email: 'alice@email.com' -> 'alice@email.com' | Country: 'USA' -> 'usa' | Salary: '70000.0' -> '70000'
2026-01-09 18:23:38,153 - dq_comparison - INFO - DEBUG HASH STRING: 2023-01-15|alice brown|alice@email.com|usa|70000...
2026-01-09 18:23:38,153 - dq_comparison - INFO - DEBUG HASH RESULT: 22bb83e3...
2026-01-09 18:23:38,155 - dq_comparison - INFO - DEBUG HASH ROW: JoinDate: '1680652800000000000' -> '2023-04-05' | CustomerName: 'Charlie Wilson' -> 'charlie wilson' | Email: 'charlie@email.com' -> 'charlie@email.com' | Country: 'USA' -> 'usa' | Salary: '48000.0' -> '48000'
2026-01-09 18:23:38,156 - dq_comparison - INFO - DEBUG HASH STRING: 2023-04-05|charlie wilson|charlie@email.com|usa|48000...
2026-01-09 18:23:38,157 - dq_comparison - INFO - DEBUG HASH RESULT: bc019761...
2026-01-09 18:23:38,157 - dq_comparison - INFO - DEBUG HASH ROW: JoinDate: '1673740800000000000' -> '2023-01-15' | CustomerName: 'John Doe' -> 'john doe' | Email: 'john@email.com' -> 'john@email.com' | Country: 'USA' -> 'usa' | Salary: '50000.0' -> '50000'
2026-01-09 18:23:38,159 - dq_comparison - INFO - DEBUG HASH STRING: 2023-01-15|john doe|john@email.com|usa|50000...
2026-01-09 18:23:38,159 - dq_comparison - INFO - DEBUG HASH RESULT: 05270b08...
2026-01-09 18:23:38,160 - dq_comparison - INFO - DEBUG HASH ROW: JoinDate: '1683849600000000000' -> '2023-05-12' | CustomerName: 'David Lee' -> 'david lee' | Email: 'david@email.com' -> 'david@email.com' | Country: 'USA' -> 'usa' | Salary: 'nan' -> 'NULL'
2026-01-09 18:23:38,162 - dq_comparison - INFO - DEBUG HASH STRING: 2023-05-12|david lee|david@email.com|usa|NULL...
2026-01-09 18:23:38,162 - dq_comparison - INFO - DEBUG HASH RESULT: ca86ecd9...
2026-01-09 18:23:38,164 - dq_comparison - INFO - DEBUG HASH ROW: JoinDate: '1687046400000000000' -> '2023-06-18' | CustomerName: 'Sarah Chen' -> 'sarah chen' | Email: 'sarah@email.com' -> 'sarah@email.com' | Country: 'USA' -> 'usa' | Salary: '52000.0' -> '52000'
2026-01-09 18:23:38,164 - dq_comparison - INFO - DEBUG HASH STRING: 2023-06-18|sarah chen|sarah@email.com|usa|52000...
2026-01-09 18:23:38,164 - dq_comparison - INFO - DEBUG HASH RESULT: 12401390...
2026-01-09 18:23:38,166 - dq_comparison - INFO - DEBUG HASH ROW: JoinDate: '1689984000000000000' -> '2023-07-22' | CustomerName: 'Mike Davis' -> 'mike davis' | Email: 'invalid-email' -> 'invalid-email' | Country: 'USA' -> 'usa' | Salary: '58000.0' -> '58000'
2026-01-09 18:23:38,167 - dq_comparison - INFO - DEBUG HASH STRING: 2023-07-22|mike davis|invalid-email|usa|58000...
2026-01-09 18:23:38,168 - dq_comparison - INFO - DEBUG HASH RESULT: 873e4152...
2026-01-09 18:23:38,168 - dq_comparison - INFO - DEBUG HASH ROW: JoinDate: '1693353600000000000' -> '2023-08-30' | CustomerName: 'Lisa Wang' -> 'lisa wang' | Email: 'lisa@email.com' -> 'lisa@email.com' | Country: 'USA' -> 'usa' | Salary: '62000.0' -> '62000'
2026-01-09 18:23:38,170 - dq_comparison - INFO - DEBUG HASH STRING: 2023-08-30|lisa wang|lisa@email.com|usa|62000...
2026-01-09 18:23:38,170 - dq_comparison - INFO - DEBUG HASH RESULT: ad8ddad0...
2026-01-09 18:23:38,171 - dq_comparison - INFO - DEBUG HASH ROW: JoinDate: '1694304000000000000' -> '2023-09-10' | CustomerName: 'Tom Wilson' -> 'tom wilson' | Email: 'tom@email.com' -> 'tom@email.com' | Country: 'USA' -> 'usa' | Salary: '45000.0' -> '45000'
2026-01-09 18:23:38,171 - dq_comparison - INFO - DEBUG HASH STRING: 2023-09-10|tom wilson|tom@email.com|usa|45000...
2026-01-09 18:23:38,172 - dq_comparison - INFO - DEBUG HASH RESULT: 4dc4ef06...
2026-01-09 18:23:38,173 - dq_comparison - INFO - DEBUG HASH ROW: JoinDate: '1697328000000000000' -> '2023-10-15' | CustomerName: 'None' -> 'NULL' | Email: 'empty@email.com' -> 'empty@email.com' | Country: 'USA' -> 'usa' | Salary: '53000.0' -> '53000'
2026-01-09 18:23:38,174 - dq_comparison - INFO - DEBUG HASH STRING: 2023-10-15|NULL|empty@email.com|usa|53000...
2026-01-09 18:23:38,174 - dq_comparison - INFO - DEBUG HASH RESULT: 699bf199...
2026-01-09 18:23:38,175 - dq_comparison - INFO - DEBUG HASH ROW: JoinDate: '1700438400000000000' -> '2023-11-20' | CustomerName: 'Robert Brown' -> 'robert brown' | Email: 'robert@email.com' -> 'robert@email.com' | Country: 'USA' -> 'usa' | Salary: '67000.0' -> '67000'
2026-01-09 18:23:38,175 - dq_comparison - INFO - DEBUG HASH STRING: 2023-11-20|robert brown|robert@email.com|usa|67000...
2026-01-09 18:23:38,177 - dq_comparison - INFO - DEBUG HASH RESULT: 5f75b7f1...
2026-01-09 18:23:38,178 - dq_comparison - INFO - DEBUG HASH ROW: JoinDate: '1701734400000000000' -> '2023-12-05' | CustomerName: 'Nancy Davis' -> 'nancy davis' | Email: 'nancy@email.com' -> 'nancy@email.com' | Country: 'USA' -> 'usa' | Salary: 'nan' -> 'NULL'
2026-01-09 18:23:38,178 - dq_comparison - INFO - DEBUG HASH STRING: 2023-12-05|nancy davis|nancy@email.com|usa|NULL...
2026-01-09 18:23:38,179 - dq_comparison - INFO - DEBUG HASH RESULT: 978dbdfc...
2026-01-09 18:23:38,179 - dq_comparison - INFO - DEBUG HASH ROW: JoinDate: '1704844800000000000' -> '2024-01-10' | CustomerName: 'Kevin Lee' -> 'kevin lee' | Email: 'kevin@email.com' -> 'kevin@email.com' | Country: 'USA' -> 'usa' | Salary: '49000.0' -> '49000'
2026-01-09 18:23:38,180 - dq_comparison - INFO - DEBUG HASH STRING: 2024-01-10|kevin lee|kevin@email.com|usa|49000...
2026-01-09 18:23:38,181 - dq_comparison - INFO - DEBUG HASH RESULT: 7dadd9c5...
2026-01-09 18:23:38,182 - dq_comparison - INFO - === DEBUG: SAMPLE HASHES ===
2026-01-09 18:23:38,183 - dq_comparison - INFO - Hash 1: 05270b089809dc5b... (sample row 0)
2026-01-09 18:23:38,184 - dq_comparison - INFO - Hash 2: b492d676ae79a1ce... (sample row 1)
2026-01-09 18:23:38,185 - dq_comparison - INFO - Hash 3: a9f3825616eafd86... (sample row 2)
2026-01-09 18:23:38,185 - dq_comparison - INFO - Generating hashes for target data (15 rows)...
2026-01-09 18:23:38,190 - dq_comparison - INFO - 
======================================================================
2026-01-09 18:23:38,190 - dq_comparison - INFO - 🔍 DEBUG: ANALYZING WHY HASHES DON'T MATCH
2026-01-09 18:23:38,192 - dq_comparison - INFO - ======================================================================
2026-01-09 18:23:38,192 - dq_comparison - INFO - 
--- Analyzing Row 0 ---
2026-01-09 18:23:38,194 - dq_comparison - INFO - Column 'JoinDate' → 'JoinDate':
2026-01-09 18:23:38,194 - dq_comparison - INFO -   Source: '1673740800000000000' (type: int64) → '2023-01-15'
2026-01-09 18:23:38,195 - dq_comparison - INFO -   Target: '2023-01-15 00:00:00' (type: Timestamp) → '2023-01-15'
2026-01-09 18:23:38,195 - dq_comparison - INFO -   Match after normalization: ✅ YES
2026-01-09 18:23:38,196 - dq_comparison - INFO - Column 'CustomerName' → 'CustomerName':
2026-01-09 18:23:38,197 - dq_comparison - INFO -   Source: 'John Doe' (type: str) → 'john doe'
2026-01-09 18:23:38,198 - dq_comparison - INFO -   Target: 'John Doe' (type: str) → 'john doe'
2026-01-09 18:23:38,199 - dq_comparison - INFO -   Match after normalization: ✅ YES
2026-01-09 18:23:38,199 - dq_comparison - INFO - Column 'Email' → 'Email':
2026-01-09 18:23:38,200 - dq_comparison - INFO -   Source: 'john@email.com' (type: str) → 'john@email.com'
2026-01-09 18:23:38,200 - dq_comparison - INFO -   Target: 'john@email.com' (type: str) → 'john@email.com'
2026-01-09 18:23:38,201 - dq_comparison - INFO -   Match after normalization: ✅ YES
2026-01-09 18:23:38,201 - dq_comparison - INFO - Column 'Country' → 'Country':
2026-01-09 18:23:38,201 - dq_comparison - INFO -   Source: 'USA' (type: str) → 'usa'
2026-01-09 18:23:38,203 - dq_comparison - INFO -   Target: 'USA' (type: str) → 'usa'
2026-01-09 18:23:38,204 - dq_comparison - INFO -   Match after normalization: ✅ YES
2026-01-09 18:23:38,205 - dq_comparison - INFO - Column 'Salary' → 'Salary':
2026-01-09 18:23:38,205 - dq_comparison - INFO -   Source: '50000.0' (type: float32) → '50000'
2026-01-09 18:23:38,206 - dq_comparison - INFO -   Target: '50000.0' (type: float64) → '50000'
2026-01-09 18:23:38,206 - dq_comparison - INFO -   Match after normalization: ✅ YES
2026-01-09 18:23:38,207 - dq_comparison - INFO - 
Hash components for Row 0:
2026-01-09 18:23:38,207 - dq_comparison - INFO - Source hash string start: 2023-01-15|john doe|john@email.com...
2026-01-09 18:23:38,208 - dq_comparison - INFO - Target hash string start: 2023-01-15|john doe|john@email.com...
2026-01-09 18:23:38,209 - dq_comparison - INFO - Same? ✅ YES
2026-01-09 18:23:38,210 - dq_comparison - INFO - 
--- Analyzing Row 1 ---
2026-01-09 18:23:38,210 - dq_comparison - INFO - Column 'JoinDate' → 'JoinDate':
2026-01-09 18:23:38,211 - dq_comparison - INFO -   Source: '1676851200000000000' (type: int64) → '2023-02-20'
2026-01-09 18:23:38,212 - dq_comparison - INFO -   Target: '2023-02-20 00:00:00' (type: Timestamp) → '2023-02-20'
2026-01-09 18:23:38,213 - dq_comparison - INFO -   Match after normalization: ✅ YES
2026-01-09 18:23:38,213 - dq_comparison - INFO - Column 'CustomerName' → 'CustomerName':
2026-01-09 18:23:38,214 - dq_comparison - INFO -   Source: 'Jane Smith' (type: str) → 'jane smith'
2026-01-09 18:23:38,215 - dq_comparison - INFO -   Target: 'Jane Smith' (type: str) → 'jane smith'
2026-01-09 18:23:38,215 - dq_comparison - INFO -   Match after normalization: ✅ YES
2026-01-09 18:23:38,216 - dq_comparison - INFO - Column 'Email' → 'Email':
2026-01-09 18:23:38,216 - dq_comparison - INFO -   Source: 'jane@email.com' (type: str) → 'jane@email.com'
2026-01-09 18:23:38,217 - dq_comparison - INFO -   Target: 'jane@email.com' (type: str) → 'jane@email.com'
2026-01-09 18:23:38,217 - dq_comparison - INFO -   Match after normalization: ✅ YES
2026-01-09 18:23:38,219 - dq_comparison - INFO - Column 'Country' → 'Country':
2026-01-09 18:23:38,219 - dq_comparison - INFO -   Source: 'USA' (type: str) → 'usa'
2026-01-09 18:23:38,220 - dq_comparison - INFO -   Target: 'USA' (type: str) → 'usa'
2026-01-09 18:23:38,220 - dq_comparison - INFO -   Match after normalization: ✅ YES
2026-01-09 18:23:38,221 - dq_comparison - INFO - Column 'Salary' → 'Salary':
2026-01-09 18:23:38,221 - dq_comparison - INFO -   Source: '60000.0' (type: float32) → '60000'
2026-01-09 18:23:38,222 - dq_comparison - INFO -   Target: '60000.0' (type: float64) → '60000'
2026-01-09 18:23:38,223 - dq_comparison - INFO -   Match after normalization: ✅ YES
2026-01-09 18:23:38,224 - dq_comparison - INFO - 
Hash components for Row 1:
2026-01-09 18:23:38,224 - dq_comparison - INFO - Source hash string start: 2023-02-20|jane smith|jane@email.com...
2026-01-09 18:23:38,225 - dq_comparison - INFO - Target hash string start: 2023-02-20|jane smith|jane@email.com...
2026-01-09 18:23:38,226 - dq_comparison - INFO - Same? ✅ YES
2026-01-09 18:23:38,227 - dq_comparison - INFO - 
--- Analyzing Row 2 ---
2026-01-09 18:23:38,227 - dq_comparison - INFO - Column 'JoinDate' → 'JoinDate':
2026-01-09 18:23:38,227 - dq_comparison - INFO -   Source: '1678406400000000000' (type: int64) → '2023-03-10'
2026-01-09 18:23:38,229 - dq_comparison - INFO -   Target: '2023-03-10 00:00:00' (type: Timestamp) → '2023-03-10'
2026-01-09 18:23:38,229 - dq_comparison - INFO -   Match after normalization: ✅ YES
2026-01-09 18:23:38,231 - dq_comparison - INFO - Column 'CustomerName' → 'CustomerName':
2026-01-09 18:23:38,231 - dq_comparison - INFO -   Source: 'Bob Johnson' (type: str) → 'bob johnson'
2026-01-09 18:23:38,232 - dq_comparison - INFO -   Target: 'Bob Johnson' (type: str) → 'bob johnson'
2026-01-09 18:23:38,232 - dq_comparison - INFO -   Match after normalization: ✅ YES
2026-01-09 18:23:38,233 - dq_comparison - INFO - Column 'Email' → 'Email':
2026-01-09 18:23:38,233 - dq_comparison - INFO -   Source: '' (type: str) → 'NULL'
2026-01-09 18:23:38,234 - dq_comparison - INFO -   Target: 'nan' (type: float) → 'NULL'
2026-01-09 18:23:38,234 - dq_comparison - INFO -   Match after normalization: ✅ YES
2026-01-09 18:23:38,235 - dq_comparison - INFO - Column 'Country' → 'Country':
2026-01-09 18:23:38,236 - dq_comparison - INFO -   Source: 'USA' (type: str) → 'usa'
2026-01-09 18:23:38,237 - dq_comparison - INFO -   Target: 'USA' (type: str) → 'usa'
2026-01-09 18:23:38,238 - dq_comparison - INFO -   Match after normalization: ✅ YES
2026-01-09 18:23:38,238 - dq_comparison - INFO - Column 'Salary' → 'Salary':
2026-01-09 18:23:38,239 - dq_comparison - INFO -   Source: '55000.0' (type: float32) → '55000'
2026-01-09 18:23:38,239 - dq_comparison - INFO -   Target: '55000.0' (type: float64) → '55000'
2026-01-09 18:23:38,240 - dq_comparison - INFO -   Match after normalization: ✅ YES
2026-01-09 18:23:38,240 - dq_comparison - INFO - 
Hash components for Row 2:
2026-01-09 18:23:38,242 - dq_comparison - INFO - Source hash string start: 2023-03-10|bob johnson|NULL...
2026-01-09 18:23:38,242 - dq_comparison - INFO - Target hash string start: 2023-03-10|bob johnson|NULL...
2026-01-09 18:23:38,243 - dq_comparison - INFO - Same? ✅ YES
2026-01-09 18:23:38,243 - dq_comparison - INFO - 
--- Column Data Types Analysis ---
2026-01-09 18:23:38,243 - dq_comparison - INFO - Column 1: 'JoinDate' (int64) ↔ 'JoinDate' (datetime64[ns])
2026-01-09 18:23:38,245 - dq_comparison - INFO -   Sample: Source='1673740800000000000', Target='2023-01-15 00:00:00'
2026-01-09 18:23:38,245 - dq_comparison - INFO - Column 2: 'CustomerName' (object) ↔ 'CustomerName' (object)
2026-01-09 18:23:38,246 - dq_comparison - INFO -   Sample: Source='John Doe', Target='John Doe'
2026-01-09 18:23:38,247 - dq_comparison - INFO - Column 3: 'Email' (object) ↔ 'Email' (object)
2026-01-09 18:23:38,248 - dq_comparison - INFO -   Sample: Source='john@email.com', Target='john@email.com'
2026-01-09 18:23:38,248 - dq_comparison - INFO - Column 4: 'Country' (category) ↔ 'Country' (object)
2026-01-09 18:23:38,249 - dq_comparison - INFO -   Sample: Source='USA', Target='USA'
2026-01-09 18:23:38,250 - dq_comparison - INFO - Column 5: 'Salary' (float32) ↔ 'Salary' (float64)
2026-01-09 18:23:38,250 - dq_comparison - INFO -   Sample: Source='50000.0', Target='50000.0'
2026-01-09 18:23:38,251 - dq_comparison - INFO - === DEBUG: DIRECT ROW COMPARISON ===
2026-01-09 18:23:38,252 - dq_comparison - INFO - --- Comparing Row 0 ---
2026-01-09 18:23:38,253 - dq_comparison - INFO -   ✅ JoinDate: '1673740800000000000' → '2023-01-15' vs '2023-01-15 00:00:00' → '2023-01-15'
2026-01-09 18:23:38,253 - dq_comparison - INFO -   ✅ CustomerName: 'John Doe' → 'john doe' vs 'John Doe' → 'john doe'
2026-01-09 18:23:38,254 - dq_comparison - INFO -   ✅ Email: 'john@email.com' → 'john@email.com' vs 'john@email.com' → 'john@email.com'
2026-01-09 18:23:38,255 - dq_comparison - INFO -   ✅ Country: 'USA' → 'usa' vs 'USA' → 'usa'
2026-01-09 18:23:38,256 - dq_comparison - INFO -   ✅ Salary: '50000.0' → '50000' vs '50000.0' → '50000'
2026-01-09 18:23:38,257 - dq_comparison - INFO - --- Comparing Row 1 ---
2026-01-09 18:23:38,258 - dq_comparison - INFO -   ✅ JoinDate: '1676851200000000000' → '2023-02-20' vs '2023-02-20 00:00:00' → '2023-02-20'
2026-01-09 18:23:38,258 - dq_comparison - INFO -   ✅ CustomerName: 'Jane Smith' → 'jane smith' vs 'Jane Smith' → 'jane smith'
2026-01-09 18:23:38,259 - dq_comparison - INFO -   ✅ Email: 'jane@email.com' → 'jane@email.com' vs 'jane@email.com' → 'jane@email.com'
2026-01-09 18:23:38,259 - dq_comparison - INFO -   ✅ Country: 'USA' → 'usa' vs 'USA' → 'usa'
2026-01-09 18:23:38,261 - dq_comparison - INFO -   ✅ Salary: '60000.0' → '60000' vs '60000.0' → '60000'
2026-01-09 18:23:38,261 - dq_comparison - INFO - --- Comparing Row 2 ---
2026-01-09 18:23:38,261 - dq_comparison - INFO -   ✅ JoinDate: '1678406400000000000' → '2023-03-10' vs '2023-03-10 00:00:00' → '2023-03-10'
2026-01-09 18:23:38,262 - dq_comparison - INFO -   ✅ CustomerName: 'Bob Johnson' → 'bob johnson' vs 'Bob Johnson' → 'bob johnson'
2026-01-09 18:23:38,263 - dq_comparison - INFO -   ✅ Email: '' → 'NULL' vs 'nan' → 'NULL'
2026-01-09 18:23:38,264 - dq_comparison - INFO -   ✅ Country: 'USA' → 'usa' vs 'USA' → 'usa'
2026-01-09 18:23:38,264 - dq_comparison - INFO -   ✅ Salary: '55000.0' → '55000' vs '55000.0' → '55000'
2026-01-09 18:23:38,266 - dq_comparison - INFO - Hash-based Comparison Results (with duplicate handling):
2026-01-09 18:23:38,266 - dq_comparison - INFO -   • Unique source hashes: 14
2026-01-09 18:23:38,267 - dq_comparison - INFO -   • Unique target hashes: 14
2026-01-09 18:23:38,267 - dq_comparison - INFO -   • Common hashes: 13
2026-01-09 18:23:38,268 - dq_comparison - INFO -   • Common rows (counting duplicates): 14
2026-01-09 18:23:38,269 - dq_comparison - INFO -   • Rows only in source (counting duplicates): 1
2026-01-09 18:23:38,270 - dq_comparison - INFO -   • Rows only in target (counting duplicates): 1
2026-01-09 18:23:38,271 - dq_comparison - INFO - Found 1 rows missing in target
2026-01-09 18:23:38,286 - dq_comparison - INFO - Found 1 extra rows in target
2026-01-09 18:23:38,300 - dq_comparison - INFO - HASH-ONLY COMPARISON COMPLETED
2026-01-09 18:23:38,301 - dq_comparison - INFO - Returning counts for simple scoring:
2026-01-09 18:23:38,302 - dq_comparison - INFO -   Common rows: 14
2026-01-09 18:23:38,303 - dq_comparison - INFO -   Unique to source: 1
2026-01-09 18:23:38,304 - dq_comparison - INFO -   Unique to target: 1
2026-01-09 18:23:38,305 - dq_comparison - INFO -   Value mismatches: 20
2026-01-09 18:23:38,306 - dq_comparison - INFO -   Missing rows: 1
2026-01-09 18:23:38,306 - dq_comparison - INFO -   Extra rows: 1
2026-01-09 18:23:38,307 - dq_comparison - INFO - Analyzing data quality metrics...
2026-01-09 18:23:38,321 - dq_comparison - INFO - Null values - Source: 6 (4.00%), Target: 6 (4.00%)
2026-01-09 18:23:38,323 - dq_comparison - INFO - Duplicate rows (normalized) - Source: 1, Target: 1
2026-01-09 18:23:38,327 - dq_comparison - INFO - Source duplicate samples: ['Row 2', 'Row 7']
2026-01-09 18:23:38,329 - dq_comparison - INFO - Target duplicate samples: ['Row 2', 'Row 7']
2026-01-09 18:23:38,342 - dq_error_log - INFO - Retrieved 11 error logs for session CMP_20260109_182337
2026-01-09 18:23:38,343 - dq_comparison - INFO - 
📊 SIMPLE SCORING CALCULATION:
2026-01-09 18:23:38,343 - dq_comparison - INFO -   Source rows: 15
2026-01-09 18:23:38,344 - dq_comparison - INFO -   Common rows (matched): 14
2026-01-09 18:23:38,345 - dq_comparison - INFO -   Calculation: (14 / 15) * 100 = 93.33%
2026-01-09 18:23:38,346 - dq_comparison - INFO -   Explanation: 14 matched rows out of 15 total source rows
2026-01-09 18:23:38,347 - dq_comparison - INFO - 
=== AUDIT LOGGING SECTION ===
2026-01-09 18:23:38,347 - dq_comparison - INFO - 🔍 Audit logging is ENABLED in APP_SETTINGS
2026-01-09 18:23:38,348 - dq_audit - INFO - Audit class initialized with database: dq_checks
2026-01-09 18:23:38,349 - dq_comparison - INFO - Attempting to log audit record for session: CMP_20260109_182337
2026-01-09 18:23:38,349 - dq_audit - INFO - Starting database insertion for comparison...
2026-01-09 18:23:38,368 - dq_audit - INFO - Inserted comparison record with ID: 595
2026-01-09 18:23:38,369 - dq_comparison - INFO - ✅ Audit record logged successfully (ID: 595)
2026-01-09 18:23:38,380 - dq_error_log - INFO - Retrieved 11 error logs for session CMP_20260109_182337
2026-01-09 18:23:38,392 - dq_error_log - INFO - Retrieved summary: 11 total errors for session CMP_20260109_182337
2026-01-09 18:23:38,393 - dq_audit - INFO - Audit class initialized with database: dq_checks
2026-01-09 18:23:38,411 - dq_audit - INFO - Retrieved 1 audit logs for session CMP_20260109_182337
2026-01-09 18:23:38,412 - dq_comparison - INFO - 
🔍 Final results verification:
2026-01-09 18:23:38,414 - dq_comparison - INFO -    Session ID: CMP_20260109_182337
2026-01-09 18:23:38,414 - dq_comparison - INFO -    DQ Score (Simple %): 93.33%
2026-01-09 18:23:38,417 - dq_comparison - INFO -    Source rows: 15
2026-01-09 18:23:38,418 - dq_comparison - INFO -    Matched rows: 14
2026-01-09 18:23:38,419 - dq_comparison - INFO -    Calculation: (14 / 15) * 100
2026-01-09 18:23:38,420 - dq_comparison - INFO - Comparison analysis completed successfully
2026-01-09 18:23:38,435 - dq_audit - INFO - Retrieved 1 audit logs for session CMP_20260109_182337
2026-01-09 18:23:38,447 - dq_error_log - INFO - Retrieved 11 error logs for session CMP_20260109_182337
2026-01-09 18:23:38,464 - dq_error_log - INFO - Retrieved summary: 11 total errors for session CMP_20260109_182337
2026-01-09 18:23:38,466 - __main__ - INFO - Comparison completed for session CMP_20260109_182337
2026-01-09 18:23:38,475 - __main__ - INFO - Completed with status 200 in 0.604s
2026-01-09 18:23:48,787 - __main__ - INFO - POST /api/compare - Request started
2026-01-09 18:23:48,789 - __main__ - INFO - Comparison request - Source: database, Target: csv
2026-01-09 18:23:48,791 - __main__ - INFO - Comparison analysis request received
2026-01-09 18:23:48,792 - __main__ - INFO - DEBUG source_data from nested: {'source_type': 'database', 'db_type': 'mysql', 'host': 'localhost', 'port': 3306, 'database': 'dq_checks', 'table': 'customers', 'user': 'root', 'password': 'root'}
2026-01-09 18:23:48,793 - __main__ - INFO - Starting comparison for session CMP_20260109_182348
2026-01-09 18:23:48,795 - dq_comparison - INFO - Starting comparison analysis in UI mode
2026-01-09 18:23:48,795 - dq_comparison - INFO - LOADING SOURCE AND TARGET DATA
2026-01-09 18:23:48,797 - dq_comparison - INFO - 
==================================================
2026-01-09 18:23:48,797 - dq_comparison - INFO - 🔗 SOURCE DATA CONFIGURATION
2026-01-09 18:23:48,798 - dq_comparison - INFO - ==================================================
2026-01-09 18:23:48,799 - dq_comparison - INFO - 
🗄️ SOURCE DATABASE CONFIGURATION
2026-01-09 18:23:48,800 - dq_comparison - INFO - ----------------------------------------
2026-01-09 18:23:48,801 - dq_comparison - INFO - UI mode: Using provided database configuration for SOURCE
2026-01-09 18:23:48,802 - dq_unified - INFO - Loading data from DATABASE
2026-01-09 18:23:48,802 - dq_unified - INFO - Loading large database table: customers
2026-01-09 18:23:48,803 - dq_unified - INFO - Normalized DB config with schema: dq_checks
2026-01-09 18:23:48,814 - dq_unified - INFO - MySQL table customers has 15 rows
2026-01-09 18:23:48,814 - dq_unified - INFO - Loading 15 rows from MySQL...
2026-01-09 18:23:48,820 - dq_unified - INFO - Loaded 15 rows from MySQL
2026-01-09 18:23:48,825 - dq_unified - INFO - Memory optimization: 0.0MB -> 0.0MB (Saved: 0.0MB)
2026-01-09 18:23:48,826 - dq_unified - INFO - Standardizing data types...
2026-01-09 18:23:48,829 - dq_unified - INFO - Data type standardization complete
2026-01-09 18:23:48,830 - dq_unified - INFO - Loaded 15 rows, 10 columns. Memory: 138.2MB total, 0.0MB for dataframe
2026-01-09 18:23:48,831 - dq_comparison - INFO - SOURCE database loaded: 15 rows, 10 columns
2026-01-09 18:23:48,831 - dq_comparison - INFO - 
==================================================
2026-01-09 18:23:48,832 - dq_comparison - INFO - 🔗 TARGET DATA CONFIGURATION
2026-01-09 18:23:48,833 - dq_comparison - INFO - ==================================================
2026-01-09 18:23:48,833 - dq_comparison - INFO - DEBUG load_csv_source called for TARGET
2026-01-09 18:23:48,833 - dq_comparison - INFO - DEBUG: Using file_path from 'target_file_path': C:\\Users\\003160\\OneDrive - wisseninfotech.com\\Documents\\DQ-Checks-Shashi\\Test_data\\sample_data.csv
2026-01-09 18:23:48,838 - dq_comparison - INFO - TARGET CSV loaded: 15 rows, 10 columns
2026-01-09 18:23:48,839 - dq_comparison - INFO - Source data loaded: 15 rows, 10 columns
2026-01-09 18:23:48,839 - dq_comparison - INFO - Target data loaded: 15 rows, 10 columns
2026-01-09 18:23:48,840 - dq_comparison - INFO - SELECTING COLUMNS FOR COMPARISON
2026-01-09 18:23:48,841 - dq_comparison - INFO - Source columns (original): ['CustomerName', 'Email', 'Phone', 'Salary', 'Department', 'JoinDate', 'PostalCode', 'City', 'Country', 'State']
2026-01-09 18:23:48,842 - dq_comparison - INFO - Target columns (original): ['CustomerName', 'Email', 'Phone', 'Salary', 'Department', 'JoinDate', 'PostalCode', 'City', 'Country', 'State']
2026-01-09 18:23:48,842 - dq_comparison - INFO - Common columns lowercased: ['joindate', 'customername', 'email', 'country', 'salary', 'postalcode', 'city', 'state', 'phone', 'department']
2026-01-09 18:23:48,843 - dq_comparison - INFO - Found 10 common columns between source and target (case-insensitive)
2026-01-09 18:23:48,843 - dq_comparison - INFO - User column selection input: all
2026-01-09 18:23:48,844 - dq_comparison - INFO - User selected ALL common columns for comparison
2026-01-09 18:23:48,844 - dq_comparison - INFO - Selected 10 columns for comparison: ['JoinDate', 'CustomerName', 'Email', 'Country', 'Salary']...
2026-01-09 18:23:48,844 - dq_comparison - INFO - GENERATING COMPREHENSIVE COMPARISON REPORT
2026-01-09 18:23:48,846 - dq_comparison - INFO - Report details - Source: Database: mysql - dq_checks.customers, Target: CSV: sample_data.csv, Selected columns: 10
2026-01-09 18:23:48,847 - dq_comparison - INFO - Initializing Error Logger...
2026-01-09 18:23:48,848 - dq_error_log - INFO - ErrorLogger initialized with database: dq_checks
2026-01-09 18:23:48,859 - dq_error_log - INFO - Database connection successful
2026-01-09 18:23:48,860 - dq_comparison - INFO - Session ID: CMP_20260109_182348
2026-01-09 18:23:48,861 - dq_comparison - INFO - ✅ Row counts match: 15 rows
2026-01-09 18:23:48,861 - dq_comparison - INFO - Comparing column structures...
2026-01-09 18:23:48,863 - dq_comparison - WARNING - Found 6 incompatible data type mismatches
2026-01-09 18:23:48,863 - dq_comparison - INFO - Column structure comparison complete. Match: False
2026-01-09 18:23:48,933 - dq_comparison - INFO - Validating primary key/unique fields...
2026-01-09 18:23:48,933 - dq_comparison - INFO - Checking key fields: ['PostalCode']
2026-01-09 18:23:48,936 - dq_comparison - WARNING - Field 'PostalCode' has duplicates in source: 2 rows
2026-01-09 18:23:48,936 - dq_comparison - WARNING - Field 'PostalCode' has duplicates in target: 2 rows
2026-01-09 18:23:48,937 - dq_comparison - INFO - Primary key validation complete. Passed: False
2026-01-09 18:23:48,960 - dq_comparison - INFO - Comparing table-level metadata...
2026-01-09 18:23:48,971 - dq_comparison - INFO - Table metadata comparison complete. Match: False
2026-01-09 18:23:48,972 - dq_comparison - INFO - SECOND CHECK: HASH-BASED COMPARISON WITH PERFECT NORMALIZATION
2026-01-09 18:23:48,975 - dq_comparison - INFO - === DEBUG: DATA TYPE CHECK ===
2026-01-09 18:23:48,975 - dq_comparison - INFO - Column: JoinDate
2026-01-09 18:23:48,976 - dq_comparison - INFO -   Source type: <class 'numpy.int64'>, value: 1673740800000000000
2026-01-09 18:23:48,977 - dq_comparison - INFO -   Target type: <class 'str'>, value: 15-01-2023
2026-01-09 18:23:48,978 - dq_comparison - INFO -   Normalized: '2023-01-15' vs '2023-01-15'
2026-01-09 18:23:48,978 - dq_comparison - INFO -   Match: True
2026-01-09 18:23:48,978 - dq_comparison - INFO - Column: CustomerName
2026-01-09 18:23:48,979 - dq_comparison - INFO -   Source type: <class 'str'>, value: John Doe
2026-01-09 18:23:48,979 - dq_comparison - INFO -   Target type: <class 'str'>, value:    John Doe
2026-01-09 18:23:48,980 - dq_comparison - INFO -   Normalized: 'john doe' vs 'john doe'
2026-01-09 18:23:48,981 - dq_comparison - INFO -   Match: True
2026-01-09 18:23:48,981 - dq_comparison - INFO - Column: Email
2026-01-09 18:23:48,982 - dq_comparison - INFO -   Source type: <class 'str'>, value: john@email.com
2026-01-09 18:23:48,982 - dq_comparison - INFO -   Target type: <class 'str'>, value: john@email.com
2026-01-09 18:23:48,983 - dq_comparison - INFO -   Normalized: 'john@email.com' vs 'john@email.com'
2026-01-09 18:23:48,983 - dq_comparison - INFO -   Match: True
2026-01-09 18:23:48,985 - dq_comparison - INFO - Source DF columns: ['CustomerName', 'Email', 'Phone', 'Salary', 'Department', 'JoinDate', 'PostalCode', 'City', 'Country', 'State']
2026-01-09 18:23:48,985 - dq_comparison - INFO - Target DF columns: ['CustomerName', 'Email', 'Phone', 'Salary', 'Department', 'JoinDate', 'PostalCode', 'City', 'Country', 'State']
2026-01-09 18:23:48,986 - dq_comparison - INFO - Selected columns for comparison: ['JoinDate', 'CustomerName', 'Email', 'Country', 'Salary', 'PostalCode', 'City', 'State', 'Phone', 'Department']
2026-01-09 18:23:48,986 - dq_comparison - INFO - Using 10 common columns for hash comparison
2026-01-09 18:23:48,987 - dq_comparison - INFO - Source columns: ['JoinDate', 'CustomerName', 'Email', 'Country', 'Salary', 'PostalCode', 'City', 'State', 'Phone', 'Department']
2026-01-09 18:23:48,987 - dq_comparison - INFO - Target columns: ['JoinDate', 'CustomerName', 'Email', 'Country', 'Salary', 'PostalCode', 'City', 'State', 'Phone', 'Department']
2026-01-09 18:23:48,988 - dq_comparison - INFO - Generating hashes for source data (15 rows)...
2026-01-09 18:23:48,989 - dq_comparison - INFO - DEBUG HASH ROW: JoinDate: '1673740800000000000' -> '2023-01-15' | CustomerName: 'John Doe' -> 'john doe' | Email: 'john@email.com' -> 'john@email.com' | Country: 'USA' -> 'usa' | Salary: '50000.0' -> '50000'
2026-01-09 18:23:48,990 - dq_comparison - INFO - DEBUG HASH STRING: 2023-01-15|john doe|john@email.com|usa|50000...
2026-01-09 18:23:48,991 - dq_comparison - INFO - DEBUG HASH RESULT: 05270b08...
2026-01-09 18:23:48,992 - dq_comparison - INFO - DEBUG HASH ROW: JoinDate: '1676851200000000000' -> '2023-02-20' | CustomerName: 'Jane Smith' -> 'jane smith' | Email: 'jane@email.com' -> 'jane@email.com' | Country: 'USA' -> 'usa' | Salary: '60000.0' -> '60000'
2026-01-09 18:23:48,992 - dq_comparison - INFO - DEBUG HASH STRING: 2023-02-20|jane smith|jane@email.com|usa|60000...
2026-01-09 18:23:48,993 - dq_comparison - INFO - DEBUG HASH RESULT: b492d676...
2026-01-09 18:23:48,993 - dq_comparison - INFO - DEBUG HASH ROW: JoinDate: '1678406400000000000' -> '2023-03-10' | CustomerName: 'Bob Johnson' -> 'bob johnson' | Email: '' -> 'NULL' | Country: 'USA' -> 'usa' | Salary: '55000.0' -> '55000'
2026-01-09 18:23:48,995 - dq_comparison - INFO - DEBUG HASH STRING: 2023-03-10|bob johnson|NULL|usa|55000...
2026-01-09 18:23:48,995 - dq_comparison - INFO - DEBUG HASH RESULT: a9f38256...
2026-01-09 18:23:48,995 - dq_comparison - INFO - DEBUG HASH ROW: JoinDate: '1673740800000000000' -> '2023-01-15' | CustomerName: 'Alice Brown' -> 'alice brown' | Email: 'alice@email.com' -> 'alice@email.com' | Country: 'USA' -> 'usa' | Salary: '70000.0' -> '70000'
2026-01-09 18:23:48,997 - dq_comparison - INFO - DEBUG HASH STRING: 2023-01-15|alice brown|alice@email.com|usa|70000...
2026-01-09 18:23:48,997 - dq_comparison - INFO - DEBUG HASH RESULT: 22bb83e3...
2026-01-09 18:23:48,998 - dq_comparison - INFO - DEBUG HASH ROW: JoinDate: '1680652800000000000' -> '2023-04-05' | CustomerName: 'Charlie Wilson' -> 'charlie wilson' | Email: 'charlie@email.com' -> 'charlie@email.com' | Country: 'USA' -> 'usa' | Salary: '48000.0' -> '48000'
2026-01-09 18:23:48,998 - dq_comparison - INFO - DEBUG HASH STRING: 2023-04-05|charlie wilson|charlie@email.com|usa|48000...
2026-01-09 18:23:49,000 - dq_comparison - INFO - DEBUG HASH RESULT: bc019761...
2026-01-09 18:23:49,000 - dq_comparison - INFO - DEBUG HASH ROW: JoinDate: '1673740800000000000' -> '2023-01-15' | CustomerName: 'John Doe' -> 'john doe' | Email: 'john@email.com' -> 'john@email.com' | Country: 'USA' -> 'usa' | Salary: '50000.0' -> '50000'
2026-01-09 18:23:49,001 - dq_comparison - INFO - DEBUG HASH STRING: 2023-01-15|john doe|john@email.com|usa|50000...
2026-01-09 18:23:49,002 - dq_comparison - INFO - DEBUG HASH RESULT: 05270b08...
2026-01-09 18:23:49,003 - dq_comparison - INFO - DEBUG HASH ROW: JoinDate: '1683849600000000000' -> '2023-05-12' | CustomerName: 'David Lee' -> 'david lee' | Email: 'david@email.com' -> 'david@email.com' | Country: 'USA' -> 'usa' | Salary: 'nan' -> 'NULL'
2026-01-09 18:23:49,003 - dq_comparison - INFO - DEBUG HASH STRING: 2023-05-12|david lee|david@email.com|usa|NULL...
2026-01-09 18:23:49,004 - dq_comparison - INFO - DEBUG HASH RESULT: ca86ecd9...
2026-01-09 18:23:49,005 - dq_comparison - INFO - DEBUG HASH ROW: JoinDate: '1687046400000000000' -> '2023-06-18' | CustomerName: 'Sarah Chen' -> 'sarah chen' | Email: 'sarah@email.com' -> 'sarah@email.com' | Country: 'USA' -> 'usa' | Salary: '52000.0' -> '52000'
2026-01-09 18:23:49,006 - dq_comparison - INFO - DEBUG HASH STRING: 2023-06-18|sarah chen|sarah@email.com|usa|52000...
2026-01-09 18:23:49,006 - dq_comparison - INFO - DEBUG HASH RESULT: 12401390...
2026-01-09 18:23:49,007 - dq_comparison - INFO - DEBUG HASH ROW: JoinDate: '1689984000000000000' -> '2023-07-22' | CustomerName: 'Mike Davis' -> 'mike davis' | Email: 'invalid-email' -> 'invalid-email' | Country: 'USA' -> 'usa' | Salary: '58000.0' -> '58000'
2026-01-09 18:23:49,008 - dq_comparison - INFO - DEBUG HASH STRING: 2023-07-22|mike davis|invalid-email|usa|58000...
2026-01-09 18:23:49,009 - dq_comparison - INFO - DEBUG HASH RESULT: 873e4152...
2026-01-09 18:23:49,010 - dq_comparison - INFO - DEBUG HASH ROW: JoinDate: '1693353600000000000' -> '2023-08-30' | CustomerName: 'Lisa Wang' -> 'lisa wang' | Email: 'lisa@email.com' -> 'lisa@email.com' | Country: 'USA' -> 'usa' | Salary: '62000.0' -> '62000'
2026-01-09 18:23:49,010 - dq_comparison - INFO - DEBUG HASH STRING: 2023-08-30|lisa wang|lisa@email.com|usa|62000...
2026-01-09 18:23:49,011 - dq_comparison - INFO - DEBUG HASH RESULT: ad8ddad0...
2026-01-09 18:23:49,011 - dq_comparison - INFO - DEBUG HASH ROW: JoinDate: '1694304000000000000' -> '2023-09-10' | CustomerName: 'Tom Wilson' -> 'tom wilson' | Email: 'tom@email.com' -> 'tom@email.com' | Country: 'USA' -> 'usa' | Salary: '45000.0' -> '45000'
2026-01-09 18:23:49,012 - dq_comparison - INFO - DEBUG HASH STRING: 2023-09-10|tom wilson|tom@email.com|usa|45000...
2026-01-09 18:23:49,013 - dq_comparison - INFO - DEBUG HASH RESULT: 4dc4ef06...
2026-01-09 18:23:49,013 - dq_comparison - INFO - DEBUG HASH ROW: JoinDate: '1697328000000000000' -> '2023-10-15' | CustomerName: 'None' -> 'NULL' | Email: 'empty@email.com' -> 'empty@email.com' | Country: 'USA' -> 'usa' | Salary: '53000.0' -> '53000'
2026-01-09 18:23:49,014 - dq_comparison - INFO - DEBUG HASH STRING: 2023-10-15|NULL|empty@email.com|usa|53000...
2026-01-09 18:23:49,015 - dq_comparison - INFO - DEBUG HASH RESULT: 699bf199...
2026-01-09 18:23:49,016 - dq_comparison - INFO - DEBUG HASH ROW: JoinDate: '1700438400000000000' -> '2023-11-20' | CustomerName: 'Robert Brown' -> 'robert brown' | Email: 'robert@email.com' -> 'robert@email.com' | Country: 'USA' -> 'usa' | Salary: '67000.0' -> '67000'
2026-01-09 18:23:49,016 - dq_comparison - INFO - DEBUG HASH STRING: 2023-11-20|robert brown|robert@email.com|usa|67000...
2026-01-09 18:23:49,017 - dq_comparison - INFO - DEBUG HASH RESULT: 5f75b7f1...
2026-01-09 18:23:49,017 - dq_comparison - INFO - DEBUG HASH ROW: JoinDate: '1701734400000000000' -> '2023-12-05' | CustomerName: 'Nancy Davis' -> 'nancy davis' | Email: 'nancy@email.com' -> 'nancy@email.com' | Country: 'USA' -> 'usa' | Salary: 'nan' -> 'NULL'
2026-01-09 18:23:49,018 - dq_comparison - INFO - DEBUG HASH STRING: 2023-12-05|nancy davis|nancy@email.com|usa|NULL...
2026-01-09 18:23:49,018 - dq_comparison - INFO - DEBUG HASH RESULT: 978dbdfc...
2026-01-09 18:23:49,020 - dq_comparison - INFO - DEBUG HASH ROW: JoinDate: '1704844800000000000' -> '2024-01-10' | CustomerName: 'Kevin Lee' -> 'kevin lee' | Email: 'kevin@email.com' -> 'kevin@email.com' | Country: 'USA' -> 'usa' | Salary: '49000.0' -> '49000'
2026-01-09 18:23:49,021 - dq_comparison - INFO - DEBUG HASH STRING: 2024-01-10|kevin lee|kevin@email.com|usa|49000...
2026-01-09 18:23:49,021 - dq_comparison - INFO - DEBUG HASH RESULT: 7dadd9c5...
2026-01-09 18:23:49,022 - dq_comparison - INFO - === DEBUG: SAMPLE HASHES ===
2026-01-09 18:23:49,022 - dq_comparison - INFO - Hash 1: 05270b089809dc5b... (sample row 0)
2026-01-09 18:23:49,023 - dq_comparison - INFO - Hash 2: b492d676ae79a1ce... (sample row 1)
2026-01-09 18:23:49,023 - dq_comparison - INFO - Hash 3: a9f3825616eafd86... (sample row 2)
2026-01-09 18:23:49,023 - dq_comparison - INFO - Generating hashes for target data (15 rows)...
2026-01-09 18:23:49,027 - dq_comparison - INFO - 
======================================================================
2026-01-09 18:23:49,028 - dq_comparison - INFO - 🔍 DEBUG: ANALYZING WHY HASHES DON'T MATCH
2026-01-09 18:23:49,029 - dq_comparison - INFO - ======================================================================
2026-01-09 18:23:49,029 - dq_comparison - INFO - 
--- Analyzing Row 0 ---
2026-01-09 18:23:49,030 - dq_comparison - INFO - Column 'JoinDate' → 'JoinDate':
2026-01-09 18:23:49,030 - dq_comparison - INFO -   Source: '1673740800000000000' (type: int64) → '2023-01-15'
2026-01-09 18:23:49,031 - dq_comparison - INFO -   Target: '15-01-2023' (type: str) → '2023-01-15'
2026-01-09 18:23:49,031 - dq_comparison - INFO -   Match after normalization: ✅ YES
2026-01-09 18:23:49,032 - dq_comparison - INFO - Column 'CustomerName' → 'CustomerName':
2026-01-09 18:23:49,033 - dq_comparison - INFO -   Source: 'John Doe' (type: str) → 'john doe'
2026-01-09 18:23:49,033 - dq_comparison - INFO -   Target: '   John Doe' (type: str) → 'john doe'
2026-01-09 18:23:49,034 - dq_comparison - INFO -   Match after normalization: ✅ YES
2026-01-09 18:23:49,035 - dq_comparison - INFO - Column 'Email' → 'Email':
2026-01-09 18:23:49,035 - dq_comparison - INFO -   Source: 'john@email.com' (type: str) → 'john@email.com'
2026-01-09 18:23:49,036 - dq_comparison - INFO -   Target: 'john@email.com' (type: str) → 'john@email.com'
2026-01-09 18:23:49,037 - dq_comparison - INFO -   Match after normalization: ✅ YES
2026-01-09 18:23:49,037 - dq_comparison - INFO - Column 'Country' → 'Country':
2026-01-09 18:23:49,038 - dq_comparison - INFO -   Source: 'USA' (type: str) → 'usa'
2026-01-09 18:23:49,038 - dq_comparison - INFO -   Target: 'USA' (type: str) → 'usa'
2026-01-09 18:23:49,039 - dq_comparison - INFO -   Match after normalization: ✅ YES
2026-01-09 18:23:49,040 - dq_comparison - INFO - Column 'Salary' → 'Salary':
2026-01-09 18:23:49,040 - dq_comparison - INFO -   Source: '50000.0' (type: float32) → '50000'
2026-01-09 18:23:49,041 - dq_comparison - INFO -   Target: '50000.0' (type: float64) → '50000'
2026-01-09 18:23:49,041 - dq_comparison - INFO -   Match after normalization: ✅ YES
2026-01-09 18:23:49,041 - dq_comparison - INFO - 
Hash components for Row 0:
2026-01-09 18:23:49,043 - dq_comparison - INFO - Source hash string start: 2023-01-15|john doe|john@email.com...
2026-01-09 18:23:49,043 - dq_comparison - INFO - Target hash string start: 2023-01-15|john doe|john@email.com...
2026-01-09 18:23:49,044 - dq_comparison - INFO - Same? ✅ YES
2026-01-09 18:23:49,045 - dq_comparison - INFO - 
--- Analyzing Row 1 ---
2026-01-09 18:23:49,046 - dq_comparison - INFO - Column 'JoinDate' → 'JoinDate':
2026-01-09 18:23:49,046 - dq_comparison - INFO -   Source: '1676851200000000000' (type: int64) → '2023-02-20'
2026-01-09 18:23:49,046 - dq_comparison - INFO -   Target: '20-02-2023' (type: str) → '2023-02-20'
2026-01-09 18:23:49,046 - dq_comparison - INFO -   Match after normalization: ✅ YES
2026-01-09 18:23:49,047 - dq_comparison - INFO - Column 'CustomerName' → 'CustomerName':
2026-01-09 18:23:49,048 - dq_comparison - INFO -   Source: 'Jane Smith' (type: str) → 'jane smith'
2026-01-09 18:23:49,049 - dq_comparison - INFO -   Target: 'Jane      Smith' (type: str) → 'jane smith'
2026-01-09 18:23:49,049 - dq_comparison - INFO -   Match after normalization: ✅ YES
2026-01-09 18:23:49,050 - dq_comparison - INFO - Column 'Email' → 'Email':
2026-01-09 18:23:49,051 - dq_comparison - INFO -   Source: 'jane@email.com' (type: str) → 'jane@email.com'
2026-01-09 18:23:49,052 - dq_comparison - INFO -   Target: 'jane@email.com' (type: str) → 'jane@email.com'
2026-01-09 18:23:49,052 - dq_comparison - INFO -   Match after normalization: ✅ YES
2026-01-09 18:23:49,053 - dq_comparison - INFO - Column 'Country' → 'Country':
2026-01-09 18:23:49,053 - dq_comparison - INFO -   Source: 'USA' (type: str) → 'usa'
2026-01-09 18:23:49,054 - dq_comparison - INFO -   Target: 'USA' (type: str) → 'usa'
2026-01-09 18:23:49,054 - dq_comparison - INFO -   Match after normalization: ✅ YES
2026-01-09 18:23:49,054 - dq_comparison - INFO - Column 'Salary' → 'Salary':
2026-01-09 18:23:49,056 - dq_comparison - INFO -   Source: '60000.0' (type: float32) → '60000'
2026-01-09 18:23:49,056 - dq_comparison - INFO -   Target: '60000.0' (type: float64) → '60000'
2026-01-09 18:23:49,057 - dq_comparison - INFO -   Match after normalization: ✅ YES
2026-01-09 18:23:49,057 - dq_comparison - INFO - 
Hash components for Row 1:
2026-01-09 18:23:49,058 - dq_comparison - INFO - Source hash string start: 2023-02-20|jane smith|jane@email.com...
2026-01-09 18:23:49,058 - dq_comparison - INFO - Target hash string start: 2023-02-20|jane smith|jane@email.com...
2026-01-09 18:23:49,059 - dq_comparison - INFO - Same? ✅ YES
2026-01-09 18:23:49,059 - dq_comparison - INFO - 
--- Analyzing Row 2 ---
2026-01-09 18:23:49,060 - dq_comparison - INFO - Column 'JoinDate' → 'JoinDate':
2026-01-09 18:23:49,061 - dq_comparison - INFO -   Source: '1678406400000000000' (type: int64) → '2023-03-10'
2026-01-09 18:23:49,061 - dq_comparison - INFO -   Target: '10-03-2023' (type: str) → '2023-03-10'
2026-01-09 18:23:49,061 - dq_comparison - INFO -   Match after normalization: ✅ YES
2026-01-09 18:23:49,063 - dq_comparison - INFO - Column 'CustomerName' → 'CustomerName':
2026-01-09 18:23:49,063 - dq_comparison - INFO -   Source: 'Bob Johnson' (type: str) → 'bob johnson'
2026-01-09 18:23:49,064 - dq_comparison - INFO -   Target: 'Bob        Johnson' (type: str) → 'bob johnson'
2026-01-09 18:23:49,065 - dq_comparison - INFO -   Match after normalization: ✅ YES
2026-01-09 18:23:49,065 - dq_comparison - INFO - Column 'Email' → 'Email':
2026-01-09 18:23:49,066 - dq_comparison - INFO -   Source: '' (type: str) → 'NULL'
2026-01-09 18:23:49,067 - dq_comparison - INFO -   Target: 'nan' (type: float) → 'NULL'
2026-01-09 18:23:49,067 - dq_comparison - INFO -   Match after normalization: ✅ YES
2026-01-09 18:23:49,067 - dq_comparison - INFO - Column 'Country' → 'Country':
2026-01-09 18:23:49,068 - dq_comparison - INFO -   Source: 'USA' (type: str) → 'usa'
2026-01-09 18:23:49,068 - dq_comparison - INFO -   Target: 'USA' (type: str) → 'usa'
2026-01-09 18:23:49,069 - dq_comparison - INFO -   Match after normalization: ✅ YES
2026-01-09 18:23:49,069 - dq_comparison - INFO - Column 'Salary' → 'Salary':
2026-01-09 18:23:49,070 - dq_comparison - INFO -   Source: '55000.0' (type: float32) → '55000'
2026-01-09 18:23:49,071 - dq_comparison - INFO -   Target: '55000.0' (type: float64) → '55000'
2026-01-09 18:23:49,071 - dq_comparison - INFO -   Match after normalization: ✅ YES
2026-01-09 18:23:49,072 - dq_comparison - INFO - 
Hash components for Row 2:
2026-01-09 18:23:49,073 - dq_comparison - INFO - Source hash string start: 2023-03-10|bob johnson|NULL...
2026-01-09 18:23:49,073 - dq_comparison - INFO - Target hash string start: 2023-03-10|bob johnson|NULL...
2026-01-09 18:23:49,073 - dq_comparison - INFO - Same? ✅ YES
2026-01-09 18:23:49,074 - dq_comparison - INFO - 
--- Column Data Types Analysis ---
2026-01-09 18:23:49,074 - dq_comparison - INFO - Column 1: 'JoinDate' (int64) ↔ 'JoinDate' (object)
2026-01-09 18:23:49,074 - dq_comparison - INFO -   Sample: Source='1673740800000000000', Target='15-01-2023'
2026-01-09 18:23:49,076 - dq_comparison - INFO - Column 2: 'CustomerName' (object) ↔ 'CustomerName' (object)
2026-01-09 18:23:49,076 - dq_comparison - INFO -   Sample: Source='John Doe', Target='   John Doe'
2026-01-09 18:23:49,076 - dq_comparison - INFO - Column 3: 'Email' (object) ↔ 'Email' (object)
2026-01-09 18:23:49,078 - dq_comparison - INFO -   Sample: Source='john@email.com', Target='john@email.com'
2026-01-09 18:23:49,078 - dq_comparison - INFO - Column 4: 'Country' (category) ↔ 'Country' (object)
2026-01-09 18:23:49,079 - dq_comparison - INFO -   Sample: Source='USA', Target='USA'
2026-01-09 18:23:49,079 - dq_comparison - INFO - Column 5: 'Salary' (float32) ↔ 'Salary' (float64)
2026-01-09 18:23:49,080 - dq_comparison - INFO -   Sample: Source='50000.0', Target='50000.0'
2026-01-09 18:23:49,080 - dq_comparison - INFO - === DEBUG: DIRECT ROW COMPARISON ===
2026-01-09 18:23:49,081 - dq_comparison - INFO - --- Comparing Row 0 ---
2026-01-09 18:23:49,082 - dq_comparison - INFO -   ✅ JoinDate: '1673740800000000000' → '2023-01-15' vs '15-01-2023' → '2023-01-15'
2026-01-09 18:23:49,083 - dq_comparison - INFO -   ✅ CustomerName: 'John Doe' → 'john doe' vs '   John Doe' → 'john doe'
2026-01-09 18:23:49,083 - dq_comparison - INFO -   ✅ Email: 'john@email.com' → 'john@email.com' vs 'john@email.com' → 'john@email.com'
2026-01-09 18:23:49,085 - dq_comparison - INFO -   ✅ Country: 'USA' → 'usa' vs 'USA' → 'usa'
2026-01-09 18:23:49,085 - dq_comparison - INFO -   ✅ Salary: '50000.0' → '50000' vs '50000.0' → '50000'
2026-01-09 18:23:49,086 - dq_comparison - INFO - --- Comparing Row 1 ---
2026-01-09 18:23:49,087 - dq_comparison - INFO -   ✅ JoinDate: '1676851200000000000' → '2023-02-20' vs '20-02-2023' → '2023-02-20'
2026-01-09 18:23:49,088 - dq_comparison - INFO -   ✅ CustomerName: 'Jane Smith' → 'jane smith' vs 'Jane      Smith' → 'jane smith'
2026-01-09 18:23:49,088 - dq_comparison - INFO -   ✅ Email: 'jane@email.com' → 'jane@email.com' vs 'jane@email.com' → 'jane@email.com'
2026-01-09 18:23:49,088 - dq_comparison - INFO -   ✅ Country: 'USA' → 'usa' vs 'USA' → 'usa'
2026-01-09 18:23:49,089 - dq_comparison - INFO -   ✅ Salary: '60000.0' → '60000' vs '60000.0' → '60000'
2026-01-09 18:23:49,090 - dq_comparison - INFO - --- Comparing Row 2 ---
2026-01-09 18:23:49,091 - dq_comparison - INFO -   ✅ JoinDate: '1678406400000000000' → '2023-03-10' vs '10-03-2023' → '2023-03-10'
2026-01-09 18:23:49,092 - dq_comparison - INFO -   ✅ CustomerName: 'Bob Johnson' → 'bob johnson' vs 'Bob        Johnson' → 'bob johnson'
2026-01-09 18:23:49,093 - dq_comparison - INFO -   ✅ Email: '' → 'NULL' vs 'nan' → 'NULL'
2026-01-09 18:23:49,094 - dq_comparison - INFO -   ✅ Country: 'USA' → 'usa' vs 'USA' → 'usa'
2026-01-09 18:23:49,095 - dq_comparison - INFO -   ✅ Salary: '55000.0' → '55000' vs '55000.0' → '55000'
2026-01-09 18:23:49,096 - dq_comparison - INFO - Hash-based Comparison Results (with duplicate handling):
2026-01-09 18:23:49,097 - dq_comparison - INFO -   • Unique source hashes: 14
2026-01-09 18:23:49,097 - dq_comparison - INFO -   • Unique target hashes: 14
2026-01-09 18:23:49,098 - dq_comparison - INFO -   • Common hashes: 13
2026-01-09 18:23:49,099 - dq_comparison - INFO -   • Common rows (counting duplicates): 14
2026-01-09 18:23:49,099 - dq_comparison - INFO -   • Rows only in source (counting duplicates): 1
2026-01-09 18:23:49,100 - dq_comparison - INFO -   • Rows only in target (counting duplicates): 1
2026-01-09 18:23:49,100 - dq_comparison - INFO - Found 1 rows missing in target
2026-01-09 18:23:49,121 - dq_comparison - INFO - Found 1 extra rows in target
2026-01-09 18:23:49,136 - dq_comparison - INFO - HASH-ONLY COMPARISON COMPLETED
2026-01-09 18:23:49,136 - dq_comparison - INFO - Returning counts for simple scoring:
2026-01-09 18:23:49,137 - dq_comparison - INFO -   Common rows: 14
2026-01-09 18:23:49,138 - dq_comparison - INFO -   Unique to source: 1
2026-01-09 18:23:49,138 - dq_comparison - INFO -   Unique to target: 1
2026-01-09 18:23:49,139 - dq_comparison - INFO -   Value mismatches: 20
2026-01-09 18:23:49,139 - dq_comparison - INFO -   Missing rows: 1
2026-01-09 18:23:49,140 - dq_comparison - INFO -   Extra rows: 1
2026-01-09 18:23:49,140 - dq_comparison - INFO - Analyzing data quality metrics...
2026-01-09 18:23:49,155 - dq_comparison - INFO - Null values - Source: 6 (4.00%), Target: 6 (4.00%)
2026-01-09 18:23:49,158 - dq_comparison - INFO - Duplicate rows (normalized) - Source: 1, Target: 1
2026-01-09 18:23:49,159 - dq_comparison - INFO - Source duplicate samples: ['Row 2', 'Row 7']
2026-01-09 18:23:49,161 - dq_comparison - INFO - Target duplicate samples: ['Row 2', 'Row 7']
2026-01-09 18:23:49,174 - dq_error_log - INFO - Retrieved 10 error logs for session CMP_20260109_182348
2026-01-09 18:23:49,176 - dq_comparison - INFO - 
📊 SIMPLE SCORING CALCULATION:
2026-01-09 18:23:49,177 - dq_comparison - INFO -   Source rows: 15
2026-01-09 18:23:49,178 - dq_comparison - INFO -   Common rows (matched): 14
2026-01-09 18:23:49,178 - dq_comparison - INFO -   Calculation: (14 / 15) * 100 = 93.33%
2026-01-09 18:23:49,179 - dq_comparison - INFO -   Explanation: 14 matched rows out of 15 total source rows
2026-01-09 18:23:49,180 - dq_comparison - INFO - 
=== AUDIT LOGGING SECTION ===
2026-01-09 18:23:49,181 - dq_comparison - INFO - 🔍 Audit logging is ENABLED in APP_SETTINGS
2026-01-09 18:23:49,183 - dq_audit - INFO - Audit class initialized with database: dq_checks
2026-01-09 18:23:49,184 - dq_comparison - INFO - Attempting to log audit record for session: CMP_20260109_182348
2026-01-09 18:23:49,185 - dq_audit - INFO - Starting database insertion for comparison...
2026-01-09 18:23:49,198 - dq_audit - INFO - Inserted comparison record with ID: 596
2026-01-09 18:23:49,200 - dq_comparison - INFO - ✅ Audit record logged successfully (ID: 596)
2026-01-09 18:23:49,213 - dq_error_log - INFO - Retrieved 10 error logs for session CMP_20260109_182348
2026-01-09 18:23:49,229 - dq_error_log - INFO - Retrieved summary: 10 total errors for session CMP_20260109_182348
2026-01-09 18:23:49,230 - dq_audit - INFO - Audit class initialized with database: dq_checks
2026-01-09 18:23:49,252 - dq_audit - INFO - Retrieved 1 audit logs for session CMP_20260109_182348
2026-01-09 18:23:49,254 - dq_comparison - INFO - 
🔍 Final results verification:
2026-01-09 18:23:49,255 - dq_comparison - INFO -    Session ID: CMP_20260109_182348
2026-01-09 18:23:49,257 - dq_comparison - INFO -    DQ Score (Simple %): 93.33%
2026-01-09 18:23:49,258 - dq_comparison - INFO -    Source rows: 15
2026-01-09 18:23:49,260 - dq_comparison - INFO -    Matched rows: 14
2026-01-09 18:23:49,261 - dq_comparison - INFO -    Calculation: (14 / 15) * 100
2026-01-09 18:23:49,262 - dq_comparison - INFO - Comparison analysis completed successfully
2026-01-09 18:23:49,282 - dq_audit - INFO - Retrieved 1 audit logs for session CMP_20260109_182348
2026-01-09 18:23:49,299 - dq_error_log - INFO - Retrieved 10 error logs for session CMP_20260109_182348
2026-01-09 18:23:49,319 - dq_error_log - INFO - Retrieved summary: 10 total errors for session CMP_20260109_182348
2026-01-09 18:23:49,320 - __main__ - INFO - Comparison completed for session CMP_20260109_182348
2026-01-09 18:23:49,327 - __main__ - INFO - Completed with status 200 in 0.540s
