2026-01-15 15:36:04,867 - root - INFO - CLI Mode Logging Initialized
2026-01-15 15:36:04,868 - root - INFO - CLI logs will be saved to: logs/dq_framework_20260115_153604.log
2026-01-15 15:36:04,868 - __main__ - INFO - 🚀 UNIVERSAL DATA QUALITY FRAMEWORK INITIALIZED
2026-01-15 15:36:04,869 - __main__ - INFO - Starting system resource check
2026-01-15 15:36:04,874 - __main__ - INFO - Total RAM: 15.7 GB
2026-01-15 15:36:04,874 - __main__ - INFO - Available RAM: 4.6 GB
2026-01-15 15:36:04,875 - __main__ - INFO - Memory used: 70.7%
2026-01-15 15:36:04,875 - __main__ - INFO - Memory status: OK
2026-01-15 15:36:04,877 - __main__ - INFO - Free disk space: 259.8 GB
2026-01-15 15:36:04,877 - __main__ - INFO - Disk used: 45.5%
2026-01-15 15:36:04,878 - __main__ - INFO - Disk space: OK
2026-01-15 15:36:05,379 - __main__ - INFO - CPU cores: 8
2026-01-15 15:36:05,379 - __main__ - INFO - CPU usage: 15.5%
2026-01-15 15:36:05,380 - __main__ - INFO - Python version: 3.12.4
2026-01-15 15:36:05,381 - __main__ - INFO - System platform: win32
2026-01-15 15:36:05,381 - __main__ - INFO - User session started at: 2026-01-15 15:36:05.381245
2026-01-15 15:36:05,381 - __main__ - INFO - Displaying main menu options to user
2026-01-15 15:36:06,222 - __main__ - INFO - User selected option: 2
2026-01-15 15:36:06,225 - __main__ - INFO - Starting Source-Target Comparison module
2026-01-15 15:36:06,235 - dq_comparison - INFO - STARTING UNIVERSAL SOURCE-TARGET COMPARISON TOOL
2026-01-15 15:36:06,235 - dq_comparison - INFO - LOADING SOURCE AND TARGET DATA
2026-01-15 15:36:06,238 - dq_comparison - INFO - 
==================================================
2026-01-15 15:36:06,241 - dq_comparison - INFO - 🔗 SOURCE DATA CONFIGURATION
2026-01-15 15:36:06,242 - dq_comparison - INFO - ==================================================
2026-01-15 15:36:08,883 - dq_comparison - INFO - DEBUG load_excel_source called for SOURCE
2026-01-15 15:36:08,885 - dq_comparison - INFO - DEBUG ui_data: None
2026-01-15 15:36:08,885 - dq_comparison - INFO - DEBUG ui_data type: <class 'NoneType'>
2026-01-15 15:36:25,740 - dq_comparison - INFO - SOURCE Excel loaded: 89,999 rows, 12 columns
2026-01-15 15:36:25,741 - dq_comparison - INFO - 
==================================================
2026-01-15 15:36:25,742 - dq_comparison - INFO - 🔗 TARGET DATA CONFIGURATION
2026-01-15 15:36:25,745 - dq_comparison - INFO - ==================================================
2026-01-15 15:36:27,576 - dq_comparison - INFO - DEBUG load_csv_source called for TARGET
2026-01-15 15:36:31,522 - dq_comparison - INFO - TARGET CSV loaded: 100,500 rows, 12 columns
2026-01-15 15:36:31,522 - dq_comparison - INFO - SELECTING COLUMNS FOR COMPARISON
2026-01-15 15:36:31,524 - dq_comparison - INFO - Source columns (original): ['id', 'customer_id', 'transaction_id', 'customer_name', 'email', 'phone', 'transaction_date', 'amount', 'quantity', 'age', 'status', 'description']
2026-01-15 15:36:31,527 - dq_comparison - INFO - Target columns (original): ['id', 'customer_id', 'transaction_id', 'customer_name', 'email', 'phone', 'transaction_date', 'amount', 'quantity', 'age', 'status', 'description']
2026-01-15 15:36:31,528 - dq_comparison - INFO - Common columns lowercased: ['id', 'amount', 'quantity', 'email', 'customer_name', 'transaction_id', 'description', 'transaction_date', 'customer_id', 'age', 'phone', 'status']
2026-01-15 15:36:31,529 - dq_comparison - INFO - Found 12 common columns between source and target (case-insensitive)
2026-01-15 15:36:31,531 - dq_comparison - INFO - 
📋 Common columns available for comparison:
2026-01-15 15:36:31,531 - dq_comparison - INFO -   1. id (Source) ↔ id (Target)
2026-01-15 15:36:31,531 - dq_comparison - INFO -   2. amount (Source) ↔ amount (Target)
2026-01-15 15:36:31,532 - dq_comparison - INFO -   3. quantity (Source) ↔ quantity (Target)
2026-01-15 15:36:31,533 - dq_comparison - INFO -   4. email (Source) ↔ email (Target)
2026-01-15 15:36:31,533 - dq_comparison - INFO -   5. customer_name (Source) ↔ customer_name (Target)
2026-01-15 15:36:31,534 - dq_comparison - INFO -   6. transaction_id (Source) ↔ transaction_id (Target)
2026-01-15 15:36:31,534 - dq_comparison - INFO -   7. description (Source) ↔ description (Target)
2026-01-15 15:36:31,535 - dq_comparison - INFO -   8. transaction_date (Source) ↔ transaction_date (Target)
2026-01-15 15:36:31,535 - dq_comparison - INFO -   9. customer_id (Source) ↔ customer_id (Target)
2026-01-15 15:36:31,537 - dq_comparison - INFO -   10. age (Source) ↔ age (Target)
2026-01-15 15:36:31,537 - dq_comparison - INFO -   11. phone (Source) ↔ phone (Target)
2026-01-15 15:36:31,538 - dq_comparison - INFO -   12. status (Source) ↔ status (Target)
2026-01-15 15:36:32,888 - dq_comparison - INFO - User column selection input: all
2026-01-15 15:36:32,889 - dq_comparison - INFO - User selected ALL common columns for comparison
2026-01-15 15:36:32,892 - dq_comparison - INFO - GENERATING COMPREHENSIVE COMPARISON REPORT
2026-01-15 15:36:32,893 - dq_comparison - INFO - Report details - Source: Excel: source_data_90k.xlsx (source_data_90k), Target: CSV: Target_data_100k.csv, Selected columns: 12
2026-01-15 15:36:32,893 - dq_comparison - INFO - Initializing Error Logger...
2026-01-15 15:36:32,894 - dq_error_log - INFO - ErrorLogger initialized with database: dq_checks
2026-01-15 15:36:33,425 - dq_error_log - INFO - Database connection successful
2026-01-15 15:36:33,425 - dq_comparison - INFO - Session ID: CMP_20260115_153633
2026-01-15 15:36:33,427 - dq_comparison - INFO - 
======================================================================
2026-01-15 15:36:33,427 - dq_comparison - INFO - 🔄 RUNNING SOURCE-TARGET COMPARISON WITH PERFECT NORMALIZATION
2026-01-15 15:36:33,431 - dq_comparison - INFO - ======================================================================
2026-01-15 15:36:33,431 - dq_comparison - INFO - Session ID: CMP_20260115_153633
2026-01-15 15:36:33,432 - dq_comparison - INFO - Source: Excel: source_data_90k.xlsx (source_data_90k)
2026-01-15 15:36:33,432 - dq_comparison - INFO - Target: CSV: Target_data_100k.csv
2026-01-15 15:36:33,433 - dq_comparison - INFO - Selected columns: 12
2026-01-15 15:36:33,433 - dq_comparison - INFO - ======================================================================
2026-01-15 15:36:33,434 - dq_comparison - INFO - 
1️⃣ FIRST: ROW COUNT CHECK
2026-01-15 15:36:33,435 - dq_comparison - WARNING - ❌ Row count mismatch: Source=89,999, Target=100,500, Difference=10,501
2026-01-15 15:36:33,436 - dq_comparison - WARNING -    Extra in target: 10,501 rows
2026-01-15 15:36:33,436 - dq_comparison - INFO - 
2️⃣ COLUMN STRUCTURE COMPARISON
2026-01-15 15:36:33,437 - dq_comparison - INFO - Comparing column structures...
2026-01-15 15:36:33,437 - dq_comparison - INFO - Column structure comparison complete. Match: True
2026-01-15 15:36:33,438 - dq_comparison - INFO - 
3️⃣ PRIMARY KEY VALIDATION
2026-01-15 15:36:33,438 - dq_comparison - INFO - Validating primary key/unique fields...
2026-01-15 15:36:33,439 - dq_comparison - INFO - Checking key fields: ['id', 'customer_id']
2026-01-15 15:36:33,449 - dq_comparison - WARNING - Field 'id' has duplicates in source: 406 rows
2026-01-15 15:36:33,450 - dq_comparison - WARNING - Field 'id' has duplicates in target: 500 rows
2026-01-15 15:36:33,483 - dq_comparison - WARNING - Field 'customer_id' has duplicates in source: 804 rows
2026-01-15 15:36:33,484 - dq_comparison - WARNING - Field 'customer_id' has duplicates in target: 1000 rows
2026-01-15 15:36:33,485 - dq_comparison - INFO - Primary key validation complete. Passed: False
2026-01-15 15:36:33,555 - dq_comparison - INFO -    Key fields found: ['id', 'customer_id']
2026-01-15 15:36:33,555 - dq_comparison - INFO -    Unique in source: ❌
2026-01-15 15:36:33,557 - dq_comparison - INFO -    Unique in target: ❌
2026-01-15 15:36:33,560 - dq_comparison - INFO -    Validation passed: ❌
2026-01-15 15:36:33,561 - dq_comparison - WARNING -    Source duplicates in 'id': 406 rows
2026-01-15 15:36:33,561 - dq_comparison - WARNING -      Sample values: [42732, 34440, 58427]
2026-01-15 15:36:33,562 - dq_comparison - WARNING -    Source duplicates in 'customer_id': 804 rows
2026-01-15 15:36:33,563 - dq_comparison - WARNING -      Sample values: ['CUST029319', 'CUST042732', 'CUST034440']
2026-01-15 15:36:33,563 - dq_comparison - WARNING -    Target duplicates in 'id': 500 rows
2026-01-15 15:36:33,563 - dq_comparison - WARNING -      Sample values: [42732, 34440, 58427]
2026-01-15 15:36:33,565 - dq_comparison - WARNING -    Target duplicates in 'customer_id': 1000 rows
2026-01-15 15:36:33,565 - dq_comparison - WARNING -      Sample values: ['CUST029319', 'CUST042732', 'CUST034440']
2026-01-15 15:36:33,566 - dq_comparison - INFO -    Column names match: ✅
2026-01-15 15:36:33,566 - dq_comparison - INFO -    Column order match: ✅
2026-01-15 15:36:33,567 - dq_comparison - INFO -    Data types match: ✅
2026-01-15 15:36:33,567 - dq_comparison - INFO - 
4️⃣ TABLE METADATA COMPARISON
2026-01-15 15:36:33,567 - dq_comparison - INFO - Comparing table-level metadata...
2026-01-15 15:36:34,469 - dq_comparison - INFO - Table metadata comparison complete. Match: False
2026-01-15 15:36:34,489 - dq_comparison - INFO -    Table metadata match: ❌
2026-01-15 15:36:34,489 - dq_comparison - INFO -    Source: 89,999 rows, 12 cols, 44.51 MB
2026-01-15 15:36:34,490 - dq_comparison - INFO -    Target: 100,500 rows, 12 cols, 50.71 MB
2026-01-15 15:36:34,491 - dq_comparison - WARNING -    Found 1 metadata differences:
2026-01-15 15:36:34,491 - dq_comparison - WARNING -      • Row Count: Source=89999, Target=100500
2026-01-15 15:36:34,492 - dq_comparison - INFO - 
5️⃣ HASH-BASED COMPARISON
2026-01-15 15:36:34,492 - dq_comparison - INFO - ℹ️  Note: All NULL values normalized to 'NULL'
2026-01-15 15:36:34,493 - dq_comparison - INFO - ℹ️  Note: Dates normalized to YYYY-MM-DD
2026-01-15 15:36:34,494 - dq_comparison - INFO - ℹ️  Note: Strings trimmed and case-normalized
2026-01-15 15:36:34,495 - dq_comparison - INFO - ℹ️  Note: Phone numbers stripped to digits only, leading zeros removed
2026-01-15 15:36:34,495 - dq_comparison - INFO - SECOND CHECK: HASH-BASED COMPARISON WITH PERFECT NORMALIZATION
2026-01-15 15:36:34,505 - dq_comparison - INFO - === DEBUG: DATA TYPE CHECK ===
2026-01-15 15:36:34,506 - dq_comparison - INFO - Column: id
2026-01-15 15:36:34,508 - dq_comparison - INFO -   Source type: <class 'numpy.int64'>, value: 78303
2026-01-15 15:36:34,509 - dq_comparison - INFO -   Target type: <class 'numpy.int64'>, value: 78303
2026-01-15 15:36:34,510 - dq_comparison - INFO -   Normalized: '78303' vs '78303'
2026-01-15 15:36:34,511 - dq_comparison - INFO -   Match: True
2026-01-15 15:36:34,512 - dq_comparison - INFO - Column: amount
2026-01-15 15:36:34,512 - dq_comparison - INFO -   Source type: <class 'numpy.float64'>, value: 8653.56
2026-01-15 15:36:34,513 - dq_comparison - INFO -   Target type: <class 'numpy.float64'>, value: 8653.56
2026-01-15 15:36:34,513 - dq_comparison - INFO -   Normalized: '8653.56' vs '8653.56'
2026-01-15 15:36:34,514 - dq_comparison - INFO -   Match: True
2026-01-15 15:36:34,514 - dq_comparison - INFO - Column: quantity
2026-01-15 15:36:34,515 - dq_comparison - INFO -   Source type: <class 'numpy.int64'>, value: 41
2026-01-15 15:36:34,515 - dq_comparison - INFO -   Target type: <class 'numpy.int64'>, value: 41
2026-01-15 15:36:34,516 - dq_comparison - INFO -   Normalized: '41' vs '41'
2026-01-15 15:36:34,517 - dq_comparison - INFO -   Match: True
2026-01-15 15:36:34,517 - dq_comparison - INFO - Source DF columns: ['id', 'customer_id', 'transaction_id', 'customer_name', 'email', 'phone', 'transaction_date', 'amount', 'quantity', 'age', 'status', 'description']
2026-01-15 15:36:34,518 - dq_comparison - INFO - Target DF columns: ['id', 'customer_id', 'transaction_id', 'customer_name', 'email', 'phone', 'transaction_date', 'amount', 'quantity', 'age', 'status', 'description']
2026-01-15 15:36:34,518 - dq_comparison - INFO - Selected columns for comparison: ['id', 'amount', 'quantity', 'email', 'customer_name', 'transaction_id', 'description', 'transaction_date', 'customer_id', 'age', 'phone', 'status']
2026-01-15 15:36:34,522 - dq_comparison - INFO - Using 12 common columns for hash comparison
2026-01-15 15:36:34,524 - dq_comparison - INFO - Source columns: ['id', 'amount', 'quantity', 'email', 'customer_name', 'transaction_id', 'description', 'transaction_date', 'customer_id', 'age', 'phone', 'status']
2026-01-15 15:36:34,525 - dq_comparison - INFO - Target columns: ['id', 'amount', 'quantity', 'email', 'customer_name', 'transaction_id', 'description', 'transaction_date', 'customer_id', 'age', 'phone', 'status']
2026-01-15 15:36:34,525 - dq_comparison - INFO - Generating hashes for source data (89999 rows)...
2026-01-15 15:36:48,503 - dq_comparison - INFO - === DEBUG: SAMPLE HASHES ===
2026-01-15 15:36:48,506 - dq_comparison - INFO - Hash 1: 29777ea445fab8a3... (sample row 0)
2026-01-15 15:36:48,507 - dq_comparison - INFO - Hash 2: 9d0298595eaeabaa... (sample row 1)
2026-01-15 15:36:48,508 - dq_comparison - INFO - Hash 3: 3cdefbd610bd7982... (sample row 2)
2026-01-15 15:36:48,508 - dq_comparison - INFO - Generating hashes for target data (100500 rows)...
2026-01-15 15:37:30,966 - dq_comparison - INFO - 
======================================================================
2026-01-15 15:37:30,967 - dq_comparison - INFO - 🔍 DEBUG: ANALYZING WHY HASHES DON'T MATCH
2026-01-15 15:37:30,967 - dq_comparison - INFO - ======================================================================
2026-01-15 15:37:30,968 - dq_comparison - INFO - 
--- Analyzing Row 0 ---
2026-01-15 15:37:30,970 - dq_comparison - INFO - Column 'id' → 'id':
2026-01-15 15:37:30,970 - dq_comparison - INFO -   Source: '78303' (type: int64) → '78303'
2026-01-15 15:37:30,971 - dq_comparison - INFO -   Target: '78303' (type: int64) → '78303'
2026-01-15 15:37:30,972 - dq_comparison - INFO -   Match after normalization: ✅ YES
2026-01-15 15:37:30,972 - dq_comparison - INFO - Column 'amount' → 'amount':
2026-01-15 15:37:30,973 - dq_comparison - INFO -   Source: '8653.56' (type: float64) → '8653.56'
2026-01-15 15:37:30,974 - dq_comparison - INFO -   Target: '8653.56' (type: float64) → '8653.56'
2026-01-15 15:37:30,975 - dq_comparison - INFO -   Match after normalization: ✅ YES
2026-01-15 15:37:30,975 - dq_comparison - INFO - Column 'quantity' → 'quantity':
2026-01-15 15:37:30,976 - dq_comparison - INFO -   Source: '41' (type: int64) → '41'
2026-01-15 15:37:30,976 - dq_comparison - INFO -   Target: '41' (type: int64) → '41'
2026-01-15 15:37:30,977 - dq_comparison - INFO -   Match after normalization: ✅ YES
2026-01-15 15:37:30,978 - dq_comparison - INFO - Column 'email' → 'email':
2026-01-15 15:37:30,979 - dq_comparison - INFO -   Source: 'david.jones@company.com' (type: str) → 'david.jones@company.com'
2026-01-15 15:37:30,980 - dq_comparison - INFO -   Target: 'david.jones@company.com' (type: str) → 'david.jones@company.com'
2026-01-15 15:37:30,980 - dq_comparison - INFO -   Match after normalization: ✅ YES
2026-01-15 15:37:30,981 - dq_comparison - INFO - Column 'customer_name' → 'customer_name':
2026-01-15 15:37:30,981 - dq_comparison - INFO -   Source: 'Michael Davis' (type: str) → 'michael davis'
2026-01-15 15:37:30,984 - dq_comparison - INFO -   Target: 'Michael Davis' (type: str) → 'michael davis'
2026-01-15 15:37:30,985 - dq_comparison - INFO -   Match after normalization: ✅ YES
2026-01-15 15:37:30,985 - dq_comparison - INFO - 
Hash components for Row 0:
2026-01-15 15:37:30,986 - dq_comparison - INFO - Source hash string start: 78303|8653.56|41...
2026-01-15 15:37:30,986 - dq_comparison - INFO - Target hash string start: 78303|8653.56|41...
2026-01-15 15:37:30,987 - dq_comparison - INFO - Same? ✅ YES
2026-01-15 15:37:30,988 - dq_comparison - INFO - 
--- Analyzing Row 1 ---
2026-01-15 15:37:30,989 - dq_comparison - INFO - Column 'id' → 'id':
2026-01-15 15:37:30,989 - dq_comparison - INFO -   Source: '66465' (type: int64) → '66465'
2026-01-15 15:37:30,990 - dq_comparison - INFO -   Target: '66465' (type: int64) → '66465'
2026-01-15 15:37:30,994 - dq_comparison - INFO -   Match after normalization: ✅ YES
2026-01-15 15:37:30,995 - dq_comparison - INFO - Column 'amount' → 'amount':
2026-01-15 15:37:30,996 - dq_comparison - INFO -   Source: '1948.44' (type: float64) → '1948.44'
2026-01-15 15:37:30,997 - dq_comparison - INFO -   Target: '1948.44' (type: float64) → '1948.44'
2026-01-15 15:37:30,997 - dq_comparison - INFO -   Match after normalization: ✅ YES
2026-01-15 15:37:30,998 - dq_comparison - INFO - Column 'quantity' → 'quantity':
2026-01-15 15:37:30,999 - dq_comparison - INFO -   Source: '73' (type: int64) → '73'
2026-01-15 15:37:30,999 - dq_comparison - INFO -   Target: '73' (type: int64) → '73'
2026-01-15 15:37:31,000 - dq_comparison - INFO -   Match after normalization: ✅ YES
2026-01-15 15:37:31,000 - dq_comparison - INFO - Column 'email' → 'email':
2026-01-15 15:37:31,002 - dq_comparison - INFO -   Source: 'jennifer.williams@gmail.com' (type: str) → 'jennifer.williams@gmail.com'
2026-01-15 15:37:31,003 - dq_comparison - INFO -   Target: 'jennifer.williams@gmail.com' (type: str) → 'jennifer.williams@gmail.com'
2026-01-15 15:37:31,003 - dq_comparison - INFO -   Match after normalization: ✅ YES
2026-01-15 15:37:31,004 - dq_comparison - INFO - Column 'customer_name' → 'customer_name':
2026-01-15 15:37:31,005 - dq_comparison - INFO -   Source: 'Susan Brown' (type: str) → 'susan brown'
2026-01-15 15:37:31,005 - dq_comparison - INFO -   Target: 'Susan Brown' (type: str) → 'susan brown'
2026-01-15 15:37:31,008 - dq_comparison - INFO -   Match after normalization: ✅ YES
2026-01-15 15:37:31,010 - dq_comparison - INFO - 
Hash components for Row 1:
2026-01-15 15:37:31,011 - dq_comparison - INFO - Source hash string start: 66465|1948.44|73...
2026-01-15 15:37:31,011 - dq_comparison - INFO - Target hash string start: 66465|1948.44|73...
2026-01-15 15:37:31,012 - dq_comparison - INFO - Same? ✅ YES
2026-01-15 15:37:31,012 - dq_comparison - INFO - 
--- Analyzing Row 2 ---
2026-01-15 15:37:31,013 - dq_comparison - INFO - Column 'id' → 'id':
2026-01-15 15:37:31,013 - dq_comparison - INFO -   Source: '93228' (type: int64) → '93228'
2026-01-15 15:37:31,014 - dq_comparison - INFO -   Target: '93228' (type: int64) → '93228'
2026-01-15 15:37:31,014 - dq_comparison - INFO -   Match after normalization: ✅ YES
2026-01-15 15:37:31,015 - dq_comparison - INFO - Column 'amount' → 'amount':
2026-01-15 15:37:31,016 - dq_comparison - INFO -   Source: '237.49' (type: float64) → '237.49'
2026-01-15 15:37:31,016 - dq_comparison - INFO -   Target: '237.49' (type: float64) → '237.49'
2026-01-15 15:37:31,016 - dq_comparison - INFO -   Match after normalization: ✅ YES
2026-01-15 15:37:31,017 - dq_comparison - INFO - Column 'quantity' → 'quantity':
2026-01-15 15:37:31,018 - dq_comparison - INFO -   Source: '17' (type: int64) → '17'
2026-01-15 15:37:31,019 - dq_comparison - INFO -   Target: '17' (type: int64) → '17'
2026-01-15 15:37:31,020 - dq_comparison - INFO -   Match after normalization: ✅ YES
2026-01-15 15:37:31,021 - dq_comparison - INFO - Column 'email' → 'email':
2026-01-15 15:37:31,022 - dq_comparison - INFO -   Source: 'james.davis@hotmail.com' (type: str) → 'james.davis@hotmail.com'
2026-01-15 15:37:31,025 - dq_comparison - INFO -   Target: 'james.davis@hotmail.com' (type: str) → 'james.davis@hotmail.com'
2026-01-15 15:37:31,025 - dq_comparison - INFO -   Match after normalization: ✅ YES
2026-01-15 15:37:31,026 - dq_comparison - INFO - Column 'customer_name' → 'customer_name':
2026-01-15 15:37:31,026 - dq_comparison - INFO -   Source: 'nan' (type: float) → 'NULL'
2026-01-15 15:37:31,027 - dq_comparison - INFO -   Target: 'nan' (type: float) → 'NULL'
2026-01-15 15:37:31,027 - dq_comparison - INFO -   Match after normalization: ✅ YES
2026-01-15 15:37:31,027 - dq_comparison - INFO - 
Hash components for Row 2:
2026-01-15 15:37:31,028 - dq_comparison - INFO - Source hash string start: 93228|237.49|17...
2026-01-15 15:37:31,029 - dq_comparison - INFO - Target hash string start: 93228|237.49|17...
2026-01-15 15:37:31,029 - dq_comparison - INFO - Same? ✅ YES
2026-01-15 15:37:31,030 - dq_comparison - INFO - 
--- Column Data Types Analysis ---
2026-01-15 15:37:31,030 - dq_comparison - INFO - Column 1: 'id' (int64) ↔ 'id' (int64)
2026-01-15 15:37:31,032 - dq_comparison - INFO -   Sample: Source='78303', Target='78303'
2026-01-15 15:37:31,032 - dq_comparison - INFO - Column 2: 'amount' (float64) ↔ 'amount' (float64)
2026-01-15 15:37:31,032 - dq_comparison - INFO -   Sample: Source='8653.56', Target='8653.56'
2026-01-15 15:37:31,033 - dq_comparison - INFO - Column 3: 'quantity' (int64) ↔ 'quantity' (int64)
2026-01-15 15:37:31,034 - dq_comparison - INFO -   Sample: Source='41', Target='41'
2026-01-15 15:37:31,035 - dq_comparison - INFO - Column 4: 'email' (object) ↔ 'email' (object)
2026-01-15 15:37:31,037 - dq_comparison - INFO -   Sample: Source='david.jones@company.com', Target='david.jones@company.com'
2026-01-15 15:37:31,040 - dq_comparison - INFO - Column 5: 'customer_name' (object) ↔ 'customer_name' (object)
2026-01-15 15:37:31,040 - dq_comparison - INFO -   Sample: Source='Michael Davis', Target='Michael Davis'
2026-01-15 15:37:31,041 - dq_comparison - INFO - PERFORMING DETAILED ROW-LEVEL COMPARISON WITH PAGINATION...
2026-01-15 15:37:31,077 - dq_comparison - INFO - Found 36,543 total mismatches
2026-01-15 15:37:31,077 - dq_comparison - INFO - Will process detailed comparisons for first 5,000 rows
2026-01-15 15:37:39,206 - dq_comparison - INFO - Progress: 500/5,000 rows (8.2s)
2026-01-15 15:37:48,860 - dq_comparison - INFO - Progress: 1,000/5,000 rows (17.8s)
2026-01-15 15:37:59,084 - dq_comparison - INFO - Progress: 1,500/5,000 rows (28.0s)
2026-01-15 15:38:09,201 - dq_comparison - INFO - Progress: 2,000/5,000 rows (38.2s)
2026-01-15 15:38:16,847 - dq_comparison - INFO - Progress: 2,500/5,000 rows (45.8s)
2026-01-15 15:38:23,964 - dq_comparison - INFO - Progress: 3,000/5,000 rows (52.9s)
2026-01-15 15:38:31,041 - dq_comparison - INFO - Progress: 3,500/5,000 rows (60.0s)
2026-01-15 15:38:37,982 - dq_comparison - INFO - Progress: 4,000/5,000 rows (66.9s)
2026-01-15 15:38:44,963 - dq_comparison - INFO - Progress: 4,500/5,000 rows (73.9s)
2026-01-15 15:38:54,098 - dq_comparison - INFO - Progress: 5,000/5,000 rows (83.1s)
2026-01-15 15:38:54,188 - dq_comparison - INFO - 
================================================================================
2026-01-15 15:38:54,188 - dq_comparison - INFO - DETAILED MISMATCH SUMMARY:
2026-01-15 15:38:54,191 - dq_comparison - INFO -   Total mismatches found: 5000
2026-01-15 15:38:54,191 - dq_comparison - INFO -   Detailed comparisons logged: 1000
2026-01-15 15:38:54,195 - dq_comparison - INFO -   First 10 rows displayed above
2026-01-15 15:38:54,196 - dq_comparison - INFO -   All mismatches stored in database with complete data
2026-01-15 15:38:54,197 - dq_comparison - INFO -   Use API to retrieve all 5000 mismatches
2026-01-15 15:38:54,199 - dq_comparison - INFO - ================================================================================
2026-01-15 15:38:54,324 - dq_comparison - INFO - Hash-based Comparison Results (with duplicate handling):
2026-01-15 15:38:54,324 - dq_comparison - INFO -   • Unique source hashes: 89796
2026-01-15 15:38:54,326 - dq_comparison - INFO -   • Unique target hashes: 100250
2026-01-15 15:38:54,330 - dq_comparison - INFO -   • Common hashes: 76784
2026-01-15 15:38:54,331 - dq_comparison - INFO -   • Common rows (counting duplicates): 76,958
2026-01-15 15:38:54,331 - dq_comparison - INFO -   • Rows only in source (counting duplicates): 13,041
2026-01-15 15:38:54,332 - dq_comparison - INFO -   • Rows only in target (counting duplicates): 23,542
2026-01-15 15:38:54,461 - dq_comparison - INFO - HASH-ONLY COMPARISON COMPLETED
2026-01-15 15:38:54,462 - dq_comparison - INFO - Returning counts for simple scoring:
2026-01-15 15:38:54,463 - dq_comparison - INFO -   Common rows: 76,958
2026-01-15 15:38:54,464 - dq_comparison - INFO -   Unique to source: 13,041
2026-01-15 15:38:54,465 - dq_comparison - INFO -   Unique to target: 23,542
2026-01-15 15:38:54,465 - dq_comparison - INFO -   Value mismatches: 438996
2026-01-15 15:38:54,467 - dq_comparison - INFO -   Missing rows: 13,041
2026-01-15 15:38:54,467 - dq_comparison - INFO -   Extra rows: 23,542
2026-01-15 15:38:54,480 - dq_comparison - INFO - 
========================================================================================================================
COMPARISON: Excel (source_data_90k.xlsx (source_data_90k)) vs CSV (Target_data_100k.csv)
========================================================================================================================
Row   | Diff Count | Source (Sample)                          | Target (Sample)                         
------------------------------------------------------------------------------------------------------------------------
2     | 1          | id: 78303                                | id: 78303                               
5     | 1          | id: 1748                                 | id: 1748                                
7     | 1          | id: 19261                                | id: 19261                               
10    | 1          | id: 18568                                | id: 18568                               
11    | 1          | id: 31083                                | id: 31083                               
18    | 1          | id: 65288                                | id: 65288                               
19    | 1          | id: 7733                                 | id: 7733                                
22    | 1          | id: 34431                                | id: 34431                               
39    | 2          | id: 21398                                | id: 21398                               
44    | 1          | id: 56253                                | id: 56253                               
------------------------------------------------------------------------------------------------------------------------
Showing 1-10 of 1000 mismatched rows. Use API for complete data.
========================================================================================================================
2026-01-15 15:38:54,481 - dq_comparison - INFO - Returning enhanced mismatch structure with 1000 detailed mismatches
2026-01-15 15:38:54,564 - dq_comparison - INFO - New structure: 100 detailed mismatches
2026-01-15 15:38:54,564 - dq_comparison - INFO - 
6️⃣ DATA QUALITY ANALYSIS
2026-01-15 15:38:54,566 - dq_comparison - INFO - Analyzing data quality metrics...
2026-01-15 15:39:16,338 - dq_comparison - INFO - Null values - Source: 7439 (0.69%), Target: 8315 (0.69%)
2026-01-15 15:39:16,620 - dq_comparison - INFO - Duplicate rows (normalized) - Source: 203, Target: 250
2026-01-15 15:39:16,761 - dq_comparison - INFO - Source duplicate samples: ['Row 169', 'Row 383', 'Row 639']
2026-01-15 15:39:16,909 - dq_comparison - INFO - Target duplicate samples: ['Row 169', 'Row 383', 'Row 639']
2026-01-15 15:39:17,063 - dq_error_log - INFO - Retrieved 100 error logs for session CMP_20260115_153633
2026-01-15 15:39:17,064 - dq_comparison - INFO - 
📊 SIMPLE SCORING CALCULATION:
2026-01-15 15:39:17,065 - dq_comparison - INFO -   Source rows: 89999
2026-01-15 15:39:17,065 - dq_comparison - INFO -   Common rows (matched): 76958
2026-01-15 15:39:17,069 - dq_comparison - INFO -   Calculation: (76958 / 89999) * 100 = 85.51%
2026-01-15 15:39:17,069 - dq_comparison - INFO -   Explanation: 76958 matched rows out of 89999 total source rows
2026-01-15 15:39:17,070 - dq_comparison - INFO - 
=== AUDIT LOGGING SECTION ===
2026-01-15 15:39:17,075 - dq_comparison - INFO - 🔍 Audit logging is ENABLED in APP_SETTINGS
2026-01-15 15:39:17,075 - dq_audit - INFO - Audit class initialized with database: dq_checks
2026-01-15 15:39:17,076 - dq_comparison - INFO - Attempting to log audit record for session: CMP_20260115_153633
2026-01-15 15:39:17,076 - dq_audit - INFO - Starting database insertion for comparison...
2026-01-15 15:39:17,096 - dq_audit - INFO - Inserted comparison record with ID: 698
2026-01-15 15:39:17,097 - dq_comparison - INFO - ✅ Audit record logged successfully (ID: 698)
2026-01-15 15:39:17,098 - dq_comparison - INFO - 
======================================================================
2026-01-15 15:39:17,098 - dq_comparison - INFO - 📊 COMPARISON RESULTS SUMMARY
2026-01-15 15:39:17,099 - dq_comparison - INFO - ======================================================================
2026-01-15 15:39:17,100 - dq_comparison - INFO - Session ID: CMP_20260115_153633
2026-01-15 15:39:17,101 - dq_comparison - INFO - Source: Excel: source_data_90k.xlsx (source_data_90k) (89,999 rows)
2026-01-15 15:39:17,102 - dq_comparison - INFO - Target: CSV: Target_data_100k.csv (100,500 rows)
2026-01-15 15:39:17,103 - dq_comparison - INFO - Selected columns: 12
2026-01-15 15:39:17,103 - dq_comparison - INFO - ----------------------------------------------------------------------
2026-01-15 15:39:17,103 - dq_comparison - INFO - 1️⃣ Row count match: ❌ No
2026-01-15 15:39:17,104 - dq_comparison - INFO -    Missing in target: 0 rows
2026-01-15 15:39:17,104 - dq_comparison - INFO -    Extra in target: 10,501 rows
2026-01-15 15:39:17,104 - dq_comparison - INFO - 2️⃣ Column structure match: ✅ Yes
2026-01-15 15:39:17,105 - dq_comparison - INFO - 3️ Primary key validation: ❌ Failed
2026-01-15 15:39:17,105 - dq_comparison - INFO -    Key fields: ['id', 'customer_id']
2026-01-15 15:39:17,106 - dq_comparison - INFO - 4️ Table metadata: ❌ Mismatch
2026-01-15 15:39:17,106 - dq_comparison - INFO -    • Row Count: 89999 vs 100500
2026-01-15 15:39:17,107 - dq_comparison - INFO - 5️⃣ Common rows (both Excel (source_data_90k.xlsx (source_data_90k)) and CSV (Target_data_100k.csv)): 76,958 (85.51% of Excel (source_data_90k.xlsx (source_data_90k)))
2026-01-15 15:39:17,107 - dq_comparison - INFO - 6️⃣ Excel (source_data_90k.xlsx (source_data_90k))-only rows: 13,041 (present ONLY in Excel (source_data_90k.xlsx (source_data_90k)), NOT in CSV (Target_data_100k.csv))
2026-01-15 15:39:17,108 - dq_comparison - INFO - 7️⃣ CSV (Target_data_100k.csv)-only rows: 23,542 (present ONLY in CSV (Target_data_100k.csv), NOT in Excel (source_data_90k.xlsx (source_data_90k)))
2026-01-15 15:39:17,112 - dq_comparison - INFO - 8️⃣ Column value mismatches: 0
2026-01-15 15:39:17,113 - dq_comparison - INFO - 9️ Data quality match: ❌ No
2026-01-15 15:39:17,114 - dq_comparison - INFO - 📈 DQ Score: 85.51%
2026-01-15 15:39:17,115 - dq_comparison - INFO - 📊 Calculation: (76,958 / 89,999) * 100 = 85.51%
2026-01-15 15:39:17,115 - dq_comparison - INFO - ======================================================================
2026-01-15 15:39:17,116 - dq_comparison - INFO - 
⚠️  GOOD MATCH! Some differences found.
2026-01-15 15:39:17,117 - dq_comparison - INFO - 
🔍 NORMALIZATION APPLIED:
2026-01-15 15:39:17,117 - dq_comparison - INFO -    • NULL values → 'NULL' (consistent representation)
2026-01-15 15:39:17,117 - dq_comparison - INFO -    • Dates → YYYY-MM-DD format
2026-01-15 15:39:17,118 - dq_comparison - INFO -    • Strings → trimmed + lowercase
2026-01-15 15:39:17,119 - dq_comparison - INFO -    • Numeric values → standardized format
2026-01-15 15:39:17,119 - dq_comparison - INFO -    • Phone numbers → digits only, ALL leading zeros removed
2026-01-15 15:39:17,120 - dq_comparison - INFO -    • Extra whitespace removed
2026-01-15 15:39:17,121 - dq_comparison - INFO - 
🔍 DETAILED ERROR ANALYSIS:
2026-01-15 15:39:17,121 - dq_comparison - INFO - --------------------------------------------------
2026-01-15 15:39:17,122 - dq_comparison - INFO - 📊 SOURCE-ONLY ROWS: 13,041 rows
2026-01-15 15:39:17,122 - dq_comparison - INFO -    Present only in Excel (source_data_90k.xlsx (source_data_90k)), missing from CSV (Target_data_100k.csv)
2026-01-15 15:39:17,124 - dq_comparison - INFO - 📊 TARGET-ONLY ROWS: 23,542 rows
2026-01-15 15:39:17,127 - dq_comparison - INFO -    Present only in CSV (Target_data_100k.csv), extra (not in Excel (source_data_90k.xlsx (source_data_90k)))
2026-01-15 15:39:17,189 - dq_error_log - INFO - Retrieved 10 errors for session CMP_20260115_153633
2026-01-15 15:39:17,190 - dq_comparison - INFO - 
📋 SAMPLE ERRORS (10 found):
2026-01-15 15:39:17,191 - dq_comparison - INFO - 
1. Row 0 - Duplicate Count Mismatch
2026-01-15 15:39:17,195 - dq_comparison - INFO -    Column: 
2026-01-15 15:39:17,196 - dq_comparison - INFO -    Duplicate count mismatch (normalized). Source=203, Target=250
2026-01-15 15:39:17,197 - dq_comparison - INFO - 
2. Row 0 - Metadata Row Count
2026-01-15 15:39:17,197 - dq_comparison - INFO -    Column: 
2026-01-15 15:39:17,198 - dq_comparison - INFO -    Metadata mismatch: Row Count
2026-01-15 15:39:17,198 - dq_comparison - INFO - 
3. Row 0 - Duplicate Primary Key
2026-01-15 15:39:17,199 - dq_comparison - INFO -    Column: customer_id
2026-01-15 15:39:17,199 - dq_comparison - INFO -    Primary key field 'customer_id' has 804 duplicates in source
2026-01-15 15:39:17,200 - dq_comparison - INFO - 
💡 For complete error details, run:
2026-01-15 15:39:17,202 - dq_comparison - INFO -    USE dq_checks;
2026-01-15 15:39:17,203 - dq_comparison - INFO -    SELECT excel_row, column_name, error_type, error_description,
2026-01-15 15:39:17,203 - dq_comparison - INFO -           actual_value, expected_value
2026-01-15 15:39:17,207 - dq_comparison - INFO -    FROM dq_error_logs
2026-01-15 15:39:17,211 - dq_comparison - INFO -    WHERE session_id = 'CMP_20260115_153633'
2026-01-15 15:39:17,213 - dq_comparison - INFO -    ORDER BY excel_row, column_name;
2026-01-15 15:39:17,233 - dq_comparison - INFO - 
✅ Comparison completed! Session ID: CMP_20260115_153633
2026-01-15 15:39:17,347 - dq_error_log - INFO - Retrieved 100 error logs for session CMP_20260115_153633
2026-01-15 15:39:17,407 - dq_error_log - INFO - Retrieved summary: 5007 total errors for session CMP_20260115_153633
2026-01-15 15:39:17,408 - dq_audit - INFO - Audit class initialized with database: dq_checks
2026-01-15 15:39:17,425 - dq_audit - INFO - Retrieved 1 audit logs for session CMP_20260115_153633
2026-01-15 15:39:17,425 - dq_comparison - INFO - 
🔍 Final results verification:
2026-01-15 15:39:17,426 - dq_comparison - INFO -    Session ID: CMP_20260115_153633
2026-01-15 15:39:17,429 - dq_comparison - INFO -    DQ Score (Simple %): 85.51%
2026-01-15 15:39:17,430 - dq_comparison - INFO -    Source rows: 89999
2026-01-15 15:39:17,430 - dq_comparison - INFO -    Matched rows: 76958
2026-01-15 15:39:17,431 - dq_comparison - INFO -    Calculation: (76958 / 89999) * 100
2026-01-15 15:39:17,449 - __main__ - INFO - Source-Target Comparison completed successfully
2026-01-15 15:39:17,449 - __main__ - INFO - Displaying main menu options to user
2026-01-15 15:39:19,600 - __main__ - INFO - User selected option: 6
2026-01-15 15:39:19,601 - __main__ - INFO - User session ended. Duration: 0:03:14.220530
2026-01-15 15:39:19,601 - __main__ - INFO - 👋 Thank you for using Universal Data Quality Framework!
