2026-01-17 17:56:13,642 - root - INFO - CLI Mode Logging Initialized
2026-01-17 17:56:13,643 - root - INFO - CLI logs will be saved to: logs/dq_framework_20260117_175613.log
2026-01-17 17:56:13,643 - __main__ - INFO - 🚀 UNIVERSAL DATA QUALITY FRAMEWORK INITIALIZED
2026-01-17 17:56:13,645 - __main__ - INFO - Starting system resource check
2026-01-17 17:56:13,651 - __main__ - INFO - Total RAM: 15.7 GB
2026-01-17 17:56:13,651 - __main__ - INFO - Available RAM: 2.3 GB
2026-01-17 17:56:13,651 - __main__ - INFO - Memory used: 85.3%
2026-01-17 17:56:13,652 - __main__ - INFO - Memory status: OK
2026-01-17 17:56:13,653 - __main__ - INFO - Free disk space: 253.9 GB
2026-01-17 17:56:13,653 - __main__ - INFO - Disk used: 46.7%
2026-01-17 17:56:13,653 - __main__ - INFO - Disk space: OK
2026-01-17 17:56:14,154 - __main__ - INFO - CPU cores: 8
2026-01-17 17:56:14,154 - __main__ - INFO - CPU usage: 16.0%
2026-01-17 17:56:14,155 - __main__ - INFO - Python version: 3.12.4
2026-01-17 17:56:14,155 - __main__ - INFO - System platform: win32
2026-01-17 17:56:14,155 - __main__ - INFO - User session started at: 2026-01-17 17:56:14.155256
2026-01-17 17:56:14,155 - __main__ - INFO - Displaying main menu options to user
2026-01-17 17:56:14,956 - __main__ - INFO - User selected option: 2
2026-01-17 17:56:14,957 - __main__ - INFO - Starting Source-Target Comparison module
2026-01-17 17:56:14,962 - dq_comparison - INFO - STARTING UNIVERSAL SOURCE-TARGET COMPARISON TOOL
2026-01-17 17:56:14,962 - dq_comparison - INFO - LOADING SOURCE AND TARGET DATA
2026-01-17 17:56:14,963 - dq_comparison - INFO - 
==================================================
2026-01-17 17:56:14,963 - dq_comparison - INFO - 🔗 SOURCE DATA CONFIGURATION
2026-01-17 17:56:14,964 - dq_comparison - INFO - ==================================================
2026-01-17 17:56:16,194 - dq_comparison - INFO - 
🗄️ SOURCE DATABASE CONFIGURATION
2026-01-17 17:56:16,194 - dq_comparison - INFO - ----------------------------------------
2026-01-17 17:56:17,105 - dq_comparison - INFO - Selected database type code: mysql
2026-01-17 17:56:18,355 - dq_comparison - INFO - User selected Browse and Select mode for SOURCE
2026-01-17 17:56:18,363 - database_navigator - INFO - DatabaseNavigator initialized
2026-01-17 17:56:18,363 - database_navigator - INFO - Starting database navigation...
2026-01-17 17:56:18,364 - database_navigator - INFO - Database type: mysql
2026-01-17 17:56:18,364 - database_navigator - INFO - Getting database configuration...
2026-01-17 17:56:19,959 - database_navigator - INFO - Connecting to MYSQL...
2026-01-17 17:56:20,101 - database_navigator - INFO - Successfully connected to MYSQL!
2026-01-17 17:56:20,107 - database_navigator - INFO - get_databases() called. db_type: mysql, connection exists: True
2026-01-17 17:56:20,108 - database_navigator - INFO - Found 13 databases
2026-01-17 17:56:22,309 - database_navigator - INFO - Selected database: dq_checks
2026-01-17 17:56:22,313 - database_navigator - INFO - Found 1 schemas
2026-01-17 17:56:23,635 - database_navigator - INFO - Selected schema: dq_checks
2026-01-17 17:56:23,641 - database_navigator - INFO - Found 18 tables in schema 'dq_checks'
2026-01-17 17:56:25,893 - database_navigator - INFO - Selected table: comparison_small_source15
2026-01-17 17:56:25,898 - database_navigator - INFO - Selection complete: {'type': 'mysql', 'database': 'dq_checks', 'schema': 'dq_checks', 'table': 'comparison_small_source15', 'selection_mode': 'hierarchical', 'host': 'localhost', 'port': '3306', 'user': 'root', 'password': 'root'}
2026-01-17 17:56:25,899 - dq_comparison - INFO - Selected via navigation for SOURCE: dq_checks.dq_checks.comparison_small_source15
2026-01-17 17:56:25,899 - dq_unified - INFO - Loading data from DATABASE
2026-01-17 17:56:25,899 - dq_unified - INFO - Loading large database table: comparison_small_source15
2026-01-17 17:56:25,900 - dq_unified - INFO - Normalized DB config with schema: dq_checks
2026-01-17 17:56:25,910 - dq_unified - INFO - MySQL table comparison_small_source15 has 15 rows
2026-01-17 17:56:25,910 - dq_unified - INFO - Loading 15 rows from MySQL...
2026-01-17 17:56:26,349 - dq_unified - INFO - Loaded 15 rows from MySQL
2026-01-17 17:56:26,362 - dq_unified - INFO - Memory optimization: 0.0MB -> 0.0MB (Saved: 0.0MB)
2026-01-17 17:56:26,363 - dq_unified - INFO - Loaded 15 rows, 16 columns. Memory: 111.4MB total, 0.0MB for dataframe
2026-01-17 17:56:26,363 - dq_comparison - INFO - SOURCE database loaded: 15 rows, 16 columns
2026-01-17 17:56:26,363 - dq_comparison - INFO - 
==================================================
2026-01-17 17:56:26,364 - dq_comparison - INFO - 🔗 TARGET DATA CONFIGURATION
2026-01-17 17:56:26,364 - dq_comparison - INFO - ==================================================
2026-01-17 17:56:27,780 - dq_comparison - INFO - 
🗄️ TARGET DATABASE CONFIGURATION
2026-01-17 17:56:27,781 - dq_comparison - INFO - ----------------------------------------
2026-01-17 17:56:38,060 - dq_comparison - INFO - Selected database type code: postgresql
2026-01-17 17:56:39,858 - dq_comparison - INFO - User selected Browse and Select mode for TARGET
2026-01-17 17:56:39,865 - dq_comparison - INFO - Converted 'postgresql' to 'postgres' for database_navigator compatibility
2026-01-17 17:56:39,866 - database_navigator - INFO - DatabaseNavigator initialized
2026-01-17 17:56:39,866 - database_navigator - INFO - Starting database navigation...
2026-01-17 17:56:39,867 - database_navigator - INFO - Database type: postgres
2026-01-17 17:56:39,868 - database_navigator - INFO - Getting database configuration...
2026-01-17 17:56:43,827 - database_navigator - INFO - Connecting to POSTGRES...
2026-01-17 17:56:43,828 - database_navigator - INFO - Connecting to PostgreSQL...
2026-01-17 17:56:43,829 - database_navigator - INFO - Connecting to PostgreSQL: host=localhost, port=5432, database=postgres, user=postgres
2026-01-17 17:56:43,929 - database_navigator - INFO - Connection object created: <connection object at 0x000001A289F8EAC0; dsn: 'user=postgres password=xxx dbname=postgres host=localhost port=5432', closed: 0>
2026-01-17 17:56:43,930 - database_navigator - INFO - ✅ PostgreSQL connection successful to database: postgres
2026-01-17 17:56:43,934 - database_navigator - INFO - get_databases() called. db_type: postgres, connection exists: True
2026-01-17 17:56:43,941 - database_navigator - INFO - Raw rows: [('dq_checks',), ('finewise-testdb',), ('postgres',)]
2026-01-17 17:56:43,942 - database_navigator - INFO - Found 3 databases
2026-01-17 17:56:45,332 - database_navigator - INFO - Selected database: dq_checks
2026-01-17 17:56:45,333 - database_navigator - INFO - Reconnecting to PostgreSQL database: dq_checks
2026-01-17 17:56:45,333 - database_navigator - INFO - Connecting to POSTGRES...
2026-01-17 17:56:45,334 - database_navigator - INFO - Connecting to PostgreSQL...
2026-01-17 17:56:45,335 - database_navigator - INFO - Connecting to PostgreSQL: host=localhost, port=5432, database=dq_checks, user=postgres
2026-01-17 17:56:45,450 - database_navigator - INFO - Connection object created: <connection object at 0x000001A289F8E350; dsn: 'user=postgres password=xxx dbname=dq_checks host=localhost port=5432', closed: 0>
2026-01-17 17:56:45,450 - database_navigator - INFO - ✅ PostgreSQL connection successful to database: dq_checks
2026-01-17 17:56:45,465 - database_navigator - INFO - Found 4 schemas
2026-01-17 17:56:48,249 - database_navigator - INFO - Selected schema: public
2026-01-17 17:56:48,251 - database_navigator - INFO - Ensuring connection to database: dq_checks for table list
2026-01-17 17:56:48,253 - database_navigator - INFO - Reconnecting to PostgreSQL database: dq_checks
2026-01-17 17:56:48,253 - database_navigator - INFO - Connecting to POSTGRES...
2026-01-17 17:56:48,253 - database_navigator - INFO - Connecting to PostgreSQL...
2026-01-17 17:56:48,253 - database_navigator - INFO - Connecting to PostgreSQL: host=localhost, port=5432, database=dq_checks, user=postgres
2026-01-17 17:56:48,346 - database_navigator - INFO - Connection object created: <connection object at 0x000001A289F8EBD0; dsn: 'user=postgres password=xxx dbname=dq_checks host=localhost port=5432', closed: 0>
2026-01-17 17:56:48,346 - database_navigator - INFO - ✅ PostgreSQL connection successful to database: dq_checks
2026-01-17 17:56:48,347 - database_navigator - INFO - Connected to database: dq_checks, schema: public
2026-01-17 17:56:48,374 - database_navigator - INFO - Found 5 tables in dq_checks.public: ['comparison_small_target13', 'customers', 'customers_bkp', 'employee', 'stg_transactions']
2026-01-17 17:56:48,374 - database_navigator - INFO - Found 5 tables in schema 'public'
2026-01-17 17:56:50,076 - database_navigator - INFO - Selected table: comparison_small_target13
2026-01-17 17:56:50,082 - database_navigator - INFO - Selection complete: {'type': 'postgresql', 'database': 'dq_checks', 'schema': 'public', 'table': 'comparison_small_target13', 'selection_mode': 'hierarchical', 'host': 'localhost', 'port': '5432', 'user': 'postgres', 'password': 'postgres'}
2026-01-17 17:56:50,083 - dq_comparison - INFO - Selected via navigation for TARGET: dq_checks.public.comparison_small_target13
2026-01-17 17:56:50,084 - dq_unified - INFO - Loading data from DATABASE
2026-01-17 17:56:50,085 - dq_unified - INFO - Loading large database table: comparison_small_target13
2026-01-17 17:56:50,085 - dq_unified - INFO - Normalized DB config with schema: public
2026-01-17 17:56:50,202 - dq_unified - INFO - PostgreSQL table public.comparison_small_target13 has 13 rows
2026-01-17 17:56:50,202 - dq_unified - INFO - Loading 13 rows from PostgreSQL...
2026-01-17 17:56:50,206 - dq_unified - INFO - Loaded 13 rows from PostgreSQL
2026-01-17 17:56:50,213 - dq_unified - INFO - Memory optimization: 0.0MB -> 0.0MB (Saved: 0.0MB)
2026-01-17 17:56:50,214 - dq_unified - INFO - Loaded 13 rows, 16 columns. Memory: 112.1MB total, 0.0MB for dataframe
2026-01-17 17:56:50,214 - dq_comparison - INFO - TARGET database loaded: 13 rows, 16 columns
2026-01-17 17:56:50,216 - dq_comparison - INFO - SELECTING COLUMNS FOR COMPARISON
2026-01-17 17:56:50,216 - dq_comparison - INFO - Source columns (original): ['transaction_id', 'account_id', 'customer_id', 'transaction_date', 'posting_date', 'transaction_type', 'currency', 'amount', 'balance_after', 'status', 'merchant_name', 'merchant_category', 'country', 'reference_code', 'created_at', 'updated_at']
2026-01-17 17:56:50,216 - dq_comparison - INFO - Target columns (original): ['transaction_id', 'account_id', 'customer_id', 'transaction_date', 'posting_date', 'transaction_type', 'currency', 'amount', 'balance_after', 'status', 'merchant_name', 'merchant_category', 'country', 'reference_code', 'created_at', 'updated_at']
2026-01-17 17:56:50,216 - dq_comparison - INFO - Common columns lowercased: ['currency', 'posting_date', 'balance_after', 'transaction_id', 'reference_code', 'updated_at', 'account_id', 'country', 'amount', 'transaction_type', 'customer_id', 'status', 'created_at', 'transaction_date', 'merchant_category', 'merchant_name']
2026-01-17 17:56:50,217 - dq_comparison - INFO - Found 16 common columns between source and target (case-insensitive)
2026-01-17 17:56:50,217 - dq_comparison - INFO - 
📋 Common columns available for comparison:
2026-01-17 17:56:50,217 - dq_comparison - INFO -   1. currency (Source) ↔ currency (Target)
2026-01-17 17:56:50,217 - dq_comparison - INFO -   2. posting_date (Source) ↔ posting_date (Target)
2026-01-17 17:56:50,218 - dq_comparison - INFO -   3. balance_after (Source) ↔ balance_after (Target)
2026-01-17 17:56:50,218 - dq_comparison - INFO -   4. transaction_id (Source) ↔ transaction_id (Target)
2026-01-17 17:56:50,219 - dq_comparison - INFO -   5. reference_code (Source) ↔ reference_code (Target)
2026-01-17 17:56:50,219 - dq_comparison - INFO -   6. updated_at (Source) ↔ updated_at (Target)
2026-01-17 17:56:50,219 - dq_comparison - INFO -   7. account_id (Source) ↔ account_id (Target)
2026-01-17 17:56:50,219 - dq_comparison - INFO -   8. country (Source) ↔ country (Target)
2026-01-17 17:56:50,220 - dq_comparison - INFO -   9. amount (Source) ↔ amount (Target)
2026-01-17 17:56:50,220 - dq_comparison - INFO -   10. transaction_type (Source) ↔ transaction_type (Target)
2026-01-17 17:56:50,220 - dq_comparison - INFO -   11. customer_id (Source) ↔ customer_id (Target)
2026-01-17 17:56:50,221 - dq_comparison - INFO -   12. status (Source) ↔ status (Target)
2026-01-17 17:56:50,221 - dq_comparison - INFO -   13. created_at (Source) ↔ created_at (Target)
2026-01-17 17:56:50,221 - dq_comparison - INFO -   14. transaction_date (Source) ↔ transaction_date (Target)
2026-01-17 17:56:50,221 - dq_comparison - INFO -   15. merchant_category (Source) ↔ merchant_category (Target)
2026-01-17 17:56:50,221 - dq_comparison - INFO -   16. merchant_name (Source) ↔ merchant_name (Target)
2026-01-17 17:56:52,096 - dq_comparison - INFO - User column selection input: all
2026-01-17 17:56:52,098 - dq_comparison - INFO - User selected ALL common columns for comparison
2026-01-17 17:56:52,098 - dq_comparison - INFO - GENERATING COMPREHENSIVE COMPARISON REPORT
2026-01-17 17:56:52,100 - dq_comparison - INFO - Report details - Source: Database: mysql - dq_checks.comparison_small_source15, Target: Database: postgresql - dq_checks.comparison_small_target13, Selected columns: 16
2026-01-17 17:56:52,101 - dq_comparison - INFO - Initializing Error Logger...
2026-01-17 17:56:52,101 - dq_error_log - INFO - ErrorLogger initialized with database: dq_checks
2026-01-17 17:56:52,114 - dq_error_log - INFO - Database connection successful
2026-01-17 17:56:52,114 - dq_comparison - INFO - Session ID: CMP_20260117_175652
2026-01-17 17:56:52,115 - dq_comparison - INFO - 
======================================================================
2026-01-17 17:56:52,118 - dq_comparison - INFO - 🔄 RUNNING SOURCE-TARGET COMPARISON WITH PERFECT NORMALIZATION
2026-01-17 17:56:52,118 - dq_comparison - INFO - ======================================================================
2026-01-17 17:56:52,120 - dq_comparison - INFO - Session ID: CMP_20260117_175652
2026-01-17 17:56:52,120 - dq_comparison - INFO - Source: Database: mysql - dq_checks.comparison_small_source15
2026-01-17 17:56:52,121 - dq_comparison - INFO - Target: Database: postgresql - dq_checks.comparison_small_target13
2026-01-17 17:56:52,121 - dq_comparison - INFO - Selected columns: 16
2026-01-17 17:56:52,121 - dq_comparison - INFO - ======================================================================
2026-01-17 17:56:52,122 - dq_comparison - INFO - 
1️⃣ FIRST: ROW COUNT CHECK
2026-01-17 17:56:52,122 - dq_comparison - WARNING - ❌ Row count mismatch: Source=15, Target=13, Difference=2
2026-01-17 17:56:52,122 - dq_comparison - WARNING -    Missing in target: 2 rows
2026-01-17 17:56:52,123 - dq_comparison - INFO - 
2️⃣ COLUMN STRUCTURE COMPARISON
2026-01-17 17:56:52,123 - dq_comparison - INFO - Comparing column structures...
2026-01-17 17:56:52,123 - dq_comparison - INFO - Column structure comparison complete. Match: True
2026-01-17 17:56:52,124 - dq_comparison - INFO - 
3️⃣ PRIMARY KEY VALIDATION
2026-01-17 17:56:52,124 - dq_comparison - INFO - Validating primary key/unique fields...
2026-01-17 17:56:52,124 - dq_comparison - INFO - Checking key fields: ['transaction_id', 'customer_id', 'reference_code']
2026-01-17 17:56:52,127 - dq_comparison - WARNING - Field 'customer_id' has duplicates in source: 15 rows
2026-01-17 17:56:52,127 - dq_comparison - WARNING - Field 'customer_id' has duplicates in target: 13 rows
2026-01-17 17:56:52,129 - dq_comparison - INFO - Primary key validation complete. Passed: False
2026-01-17 17:56:52,151 - dq_comparison - INFO -    Key fields found: ['transaction_id', 'customer_id', 'reference_code']
2026-01-17 17:56:52,151 - dq_comparison - INFO -    Unique in source: ❌
2026-01-17 17:56:52,152 - dq_comparison - INFO -    Unique in target: ❌
2026-01-17 17:56:52,152 - dq_comparison - INFO -    Validation passed: ❌
2026-01-17 17:56:52,153 - dq_comparison - WARNING -    Source duplicates in 'customer_id': 15 rows
2026-01-17 17:56:52,154 - dq_comparison - WARNING -      Sample values: ['CUST9001']
2026-01-17 17:56:52,154 - dq_comparison - WARNING -    Target duplicates in 'customer_id': 13 rows
2026-01-17 17:56:52,155 - dq_comparison - WARNING -      Sample values: ['CUST9001']
2026-01-17 17:56:52,155 - dq_comparison - INFO -    Column names match: ✅
2026-01-17 17:56:52,156 - dq_comparison - INFO -    Column order match: ✅
2026-01-17 17:56:52,156 - dq_comparison - INFO -    Data types match: ✅
2026-01-17 17:56:52,156 - dq_comparison - INFO - 
4️⃣ TABLE METADATA COMPARISON
2026-01-17 17:56:52,156 - dq_comparison - INFO - Comparing table-level metadata...
2026-01-17 17:56:52,168 - dq_comparison - INFO - Table metadata comparison complete. Match: False
2026-01-17 17:56:52,181 - dq_comparison - INFO -    Table metadata match: ❌
2026-01-17 17:56:52,181 - dq_comparison - INFO -    Source: 15 rows, 16 cols, 0.01 MB
2026-01-17 17:56:52,182 - dq_comparison - INFO -    Target: 13 rows, 16 cols, 0.0 MB
2026-01-17 17:56:52,183 - dq_comparison - WARNING -    Found 1 metadata differences:
2026-01-17 17:56:52,184 - dq_comparison - WARNING -      • Row Count: Source=15, Target=13
2026-01-17 17:56:52,184 - dq_comparison - INFO - 
5️⃣ HASH-BASED COMPARISON
2026-01-17 17:56:52,184 - dq_comparison - INFO - ℹ️  Note: All NULL values normalized to 'NULL'
2026-01-17 17:56:52,185 - dq_comparison - INFO - ℹ️  Note: Dates normalized to YYYY-MM-DD
2026-01-17 17:56:52,185 - dq_comparison - INFO - ℹ️  Note: Strings trimmed and case-normalized
2026-01-17 17:56:52,185 - dq_comparison - INFO - ℹ️  Note: Phone numbers stripped to digits only, leading zeros removed
2026-01-17 17:56:52,185 - dq_comparison - INFO - SECOND CHECK: HASH-BASED COMPARISON WITH PERFECT NORMALIZATION
2026-01-17 17:56:52,189 - dq_comparison - INFO - === DEBUG: DATA TYPE CHECK ===
2026-01-17 17:56:52,190 - dq_comparison - INFO - Column: currency
2026-01-17 17:56:52,190 - dq_comparison - INFO -   Source type: <class 'str'>, value: EUR
2026-01-17 17:56:52,191 - dq_comparison - INFO -   Target type: <class 'str'>, value: EUR
2026-01-17 17:56:52,191 - dq_comparison - INFO -   Normalized: 'eur' vs 'eur'
2026-01-17 17:56:52,191 - dq_comparison - INFO -   Match: True
2026-01-17 17:56:52,192 - dq_comparison - INFO - Column: posting_date
2026-01-17 17:56:52,195 - dq_comparison - INFO -   Source type: <class 'datetime.date'>, value: 2024-01-02
2026-01-17 17:56:52,196 - dq_comparison - INFO -   Target type: <class 'datetime.date'>, value: 2024-01-02
2026-01-17 17:56:52,196 - dq_comparison - INFO -   Normalized: '2024-01-02' vs '2024-01-02'
2026-01-17 17:56:52,197 - dq_comparison - INFO -   Match: True
2026-01-17 17:56:52,197 - dq_comparison - INFO - Column: balance_after
2026-01-17 17:56:52,198 - dq_comparison - INFO -   Source type: <class 'str'>, value: 44576.32
2026-01-17 17:56:52,198 - dq_comparison - INFO -   Target type: <class 'numpy.float32'>, value: 54897.9296875
2026-01-17 17:56:52,198 - dq_comparison - INFO -   Normalized: '44576.32' vs '54897.93'
2026-01-17 17:56:52,199 - dq_comparison - INFO -   Match: False
2026-01-17 17:56:52,199 - dq_comparison - INFO - Source DF columns: ['transaction_id', 'account_id', 'customer_id', 'transaction_date', 'posting_date', 'transaction_type', 'currency', 'amount', 'balance_after', 'status', 'merchant_name', 'merchant_category', 'country', 'reference_code', 'created_at', 'updated_at']
2026-01-17 17:56:52,200 - dq_comparison - INFO - Target DF columns: ['transaction_id', 'account_id', 'customer_id', 'transaction_date', 'posting_date', 'transaction_type', 'currency', 'amount', 'balance_after', 'status', 'merchant_name', 'merchant_category', 'country', 'reference_code', 'created_at', 'updated_at']
2026-01-17 17:56:52,200 - dq_comparison - INFO - Selected columns for comparison: ['currency', 'posting_date', 'balance_after', 'transaction_id', 'reference_code', 'updated_at', 'account_id', 'country', 'amount', 'transaction_type', 'customer_id', 'status', 'created_at', 'transaction_date', 'merchant_category', 'merchant_name']
2026-01-17 17:56:52,200 - dq_comparison - INFO - Using 16 common columns for hash comparison
2026-01-17 17:56:52,200 - dq_comparison - INFO - Source columns: ['currency', 'posting_date', 'balance_after', 'transaction_id', 'reference_code', 'updated_at', 'account_id', 'country', 'amount', 'transaction_type', 'customer_id', 'status', 'created_at', 'transaction_date', 'merchant_category', 'merchant_name']
2026-01-17 17:56:52,201 - dq_comparison - INFO - Target columns: ['currency', 'posting_date', 'balance_after', 'transaction_id', 'reference_code', 'updated_at', 'account_id', 'country', 'amount', 'transaction_type', 'customer_id', 'status', 'created_at', 'transaction_date', 'merchant_category', 'merchant_name']
2026-01-17 17:56:52,201 - dq_comparison - INFO - Generating hashes for source data (15 rows)...
2026-01-17 17:56:52,206 - dq_comparison - INFO - === DEBUG: SAMPLE HASHES ===
2026-01-17 17:56:52,206 - dq_comparison - INFO - Hash 1: f0432fca798cd667... (sample row 0)
2026-01-17 17:56:52,206 - dq_comparison - INFO - Hash 2: 81d635ec6bd14def... (sample row 1)
2026-01-17 17:56:52,207 - dq_comparison - INFO - Hash 3: ef31e3c7f0ca38fd... (sample row 2)
2026-01-17 17:56:52,207 - dq_comparison - INFO - Generating hashes for target data (13 rows)...
2026-01-17 17:56:52,212 - dq_comparison - INFO - Created hash mapping: 13 hashes → target rows
2026-01-17 17:56:52,212 - dq_comparison - INFO - 
======================================================================
2026-01-17 17:56:52,213 - dq_comparison - INFO - 🔍 DEBUG: ANALYZING WHY HASHES DON'T MATCH
2026-01-17 17:56:52,213 - dq_comparison - INFO - ======================================================================
2026-01-17 17:56:52,213 - dq_comparison - INFO - 
--- Analyzing Row 0 ---
2026-01-17 17:56:52,214 - dq_comparison - INFO - Column 'currency' → 'currency':
2026-01-17 17:56:52,214 - dq_comparison - INFO -   Source: 'EUR' (type: str) → 'eur'
2026-01-17 17:56:52,215 - dq_comparison - INFO -   Target: 'None' (type: NoneType) → 'NULL'
2026-01-17 17:56:52,215 - dq_comparison - INFO -   Match after normalization: ❌ NO
2026-01-17 17:56:52,215 - dq_comparison - INFO - Column 'posting_date' → 'posting_date':
2026-01-17 17:56:52,216 - dq_comparison - INFO -   Source: '2024-01-02' (type: date) → '2024-01-02'
2026-01-17 17:56:52,216 - dq_comparison - INFO -   Target: 'None' (type: NoneType) → 'NULL'
2026-01-17 17:56:52,216 - dq_comparison - INFO -   Match after normalization: ❌ NO
2026-01-17 17:56:52,216 - dq_comparison - INFO -   ⚠️ DATE MISMATCH DETECTED!
2026-01-17 17:56:52,217 - dq_comparison - INFO -     Source appears to be: 2024-01-02
2026-01-17 17:56:52,217 - dq_comparison - INFO -     Target appears to be (timestamp): None
2026-01-17 17:56:52,217 - dq_comparison - INFO - Column 'balance_after' → 'balance_after':
2026-01-17 17:56:52,217 - dq_comparison - INFO -   Source: '44576.32' (type: str) → '44576.32'
2026-01-17 17:56:52,218 - dq_comparison - INFO -   Target: 'None' (type: NoneType) → 'NULL'
2026-01-17 17:56:52,218 - dq_comparison - INFO -   Match after normalization: ❌ NO
2026-01-17 17:56:52,218 - dq_comparison - INFO - Column 'transaction_id' → 'transaction_id':
2026-01-17 17:56:52,219 - dq_comparison - INFO -   Source: '0b0ccaa7-6fde-4868-a20d-8064a87e4914' (type: str) → '0b0ccaa7-6fde-4868-a20d-8064a87e4914'
2026-01-17 17:56:52,219 - dq_comparison - INFO -   Target: 'None' (type: NoneType) → 'NULL'
2026-01-17 17:56:52,219 - dq_comparison - INFO -   Match after normalization: ❌ NO
2026-01-17 17:56:52,219 - dq_comparison - INFO - Column 'reference_code' → 'reference_code':
2026-01-17 17:56:52,220 - dq_comparison - INFO -   Source: 'REF000012' (type: str) → 'REF000012'
2026-01-17 17:56:52,220 - dq_comparison - INFO -   Target: 'None' (type: NoneType) → 'NULL'
2026-01-17 17:56:52,220 - dq_comparison - INFO -   Match after normalization: ❌ NO
2026-01-17 17:56:52,220 - dq_comparison - INFO - 
Hash components for Row 0:
2026-01-17 17:56:52,221 - dq_comparison - INFO - Source hash string start: eur|2024-01-02|44576.32...
2026-01-17 17:56:52,221 - dq_comparison - INFO - Target hash string start: NULL|NULL|NULL...
2026-01-17 17:56:52,221 - dq_comparison - INFO - Same? ❌ NO
2026-01-17 17:56:52,221 - dq_comparison - INFO - 
--- Analyzing Row 1 ---
2026-01-17 17:56:52,222 - dq_comparison - INFO - Column 'currency' → 'currency':
2026-01-17 17:56:52,222 - dq_comparison - INFO -   Source: 'INR' (type: str) → 'inr'
2026-01-17 17:56:52,222 - dq_comparison - INFO -   Target: 'None' (type: NoneType) → 'NULL'
2026-01-17 17:56:52,223 - dq_comparison - INFO -   Match after normalization: ❌ NO
2026-01-17 17:56:52,227 - dq_comparison - INFO - Column 'posting_date' → 'posting_date':
2026-01-17 17:56:52,227 - dq_comparison - INFO -   Source: '2024-01-02' (type: date) → '2024-01-02'
2026-01-17 17:56:52,228 - dq_comparison - INFO -   Target: 'None' (type: NoneType) → 'NULL'
2026-01-17 17:56:52,228 - dq_comparison - INFO -   Match after normalization: ❌ NO
2026-01-17 17:56:52,228 - dq_comparison - INFO -   ⚠️ DATE MISMATCH DETECTED!
2026-01-17 17:56:52,229 - dq_comparison - INFO -     Source appears to be: 2024-01-02
2026-01-17 17:56:52,229 - dq_comparison - INFO -     Target appears to be (timestamp): None
2026-01-17 17:56:52,229 - dq_comparison - INFO - Column 'balance_after' → 'balance_after':
2026-01-17 17:56:52,229 - dq_comparison - INFO -   Source: '46590.92' (type: str) → '46590.92'
2026-01-17 17:56:52,230 - dq_comparison - INFO -   Target: 'None' (type: NoneType) → 'NULL'
2026-01-17 17:56:52,230 - dq_comparison - INFO -   Match after normalization: ❌ NO
2026-01-17 17:56:52,230 - dq_comparison - INFO - Column 'transaction_id' → 'transaction_id':
2026-01-17 17:56:52,230 - dq_comparison - INFO -   Source: '21de9b66-d966-4f89-8a71-dedd548b149b' (type: str) → '21de9b66-d966-4f89-8a71-dedd548b149b'
2026-01-17 17:56:52,231 - dq_comparison - INFO -   Target: 'None' (type: NoneType) → 'NULL'
2026-01-17 17:56:52,231 - dq_comparison - INFO -   Match after normalization: ❌ NO
2026-01-17 17:56:52,231 - dq_comparison - INFO - Column 'reference_code' → 'reference_code':
2026-01-17 17:56:52,231 - dq_comparison - INFO -   Source: 'REF000004' (type: str) → 'REF000004'
2026-01-17 17:56:52,231 - dq_comparison - INFO -   Target: 'None' (type: NoneType) → 'NULL'
2026-01-17 17:56:52,232 - dq_comparison - INFO -   Match after normalization: ❌ NO
2026-01-17 17:56:52,232 - dq_comparison - INFO - 
Hash components for Row 1:
2026-01-17 17:56:52,232 - dq_comparison - INFO - Source hash string start: inr|2024-01-02|46590.92...
2026-01-17 17:56:52,233 - dq_comparison - INFO - Target hash string start: NULL|NULL|NULL...
2026-01-17 17:56:52,233 - dq_comparison - INFO - Same? ❌ NO
2026-01-17 17:56:52,233 - dq_comparison - INFO - 
--- Analyzing Row 2 ---
2026-01-17 17:56:52,234 - dq_comparison - INFO - Column 'currency' → 'currency':
2026-01-17 17:56:52,234 - dq_comparison - INFO -   Source: 'EUR' (type: str) → 'eur'
2026-01-17 17:56:52,234 - dq_comparison - INFO -   Target: 'None' (type: NoneType) → 'NULL'
2026-01-17 17:56:52,234 - dq_comparison - INFO -   Match after normalization: ❌ NO
2026-01-17 17:56:52,235 - dq_comparison - INFO - Column 'posting_date' → 'posting_date':
2026-01-17 17:56:52,235 - dq_comparison - INFO -   Source: '2024-01-02' (type: date) → '2024-01-02'
2026-01-17 17:56:52,235 - dq_comparison - INFO -   Target: 'None' (type: NoneType) → 'NULL'
2026-01-17 17:56:52,235 - dq_comparison - INFO -   Match after normalization: ❌ NO
2026-01-17 17:56:52,236 - dq_comparison - INFO -   ⚠️ DATE MISMATCH DETECTED!
2026-01-17 17:56:52,236 - dq_comparison - INFO -     Source appears to be: 2024-01-02
2026-01-17 17:56:52,236 - dq_comparison - INFO -     Target appears to be (timestamp): None
2026-01-17 17:56:52,236 - dq_comparison - INFO - Column 'balance_after' → 'balance_after':
2026-01-17 17:56:52,237 - dq_comparison - INFO -   Source: '56858.35' (type: str) → '56858.35'
2026-01-17 17:56:52,237 - dq_comparison - INFO -   Target: 'None' (type: NoneType) → 'NULL'
2026-01-17 17:56:52,237 - dq_comparison - INFO -   Match after normalization: ❌ NO
2026-01-17 17:56:52,237 - dq_comparison - INFO - Column 'transaction_id' → 'transaction_id':
2026-01-17 17:56:52,238 - dq_comparison - INFO -   Source: '33063be6-7ea8-432f-869c-20de5281eca7' (type: str) → '33063be6-7ea8-432f-869c-20de5281eca7'
2026-01-17 17:56:52,238 - dq_comparison - INFO -   Target: 'None' (type: NoneType) → 'NULL'
2026-01-17 17:56:52,238 - dq_comparison - INFO -   Match after normalization: ❌ NO
2026-01-17 17:56:52,238 - dq_comparison - INFO - Column 'reference_code' → 'reference_code':
2026-01-17 17:56:52,243 - dq_comparison - INFO -   Source: 'REF000001' (type: str) → 'REF000001'
2026-01-17 17:56:52,243 - dq_comparison - INFO -   Target: 'None' (type: NoneType) → 'NULL'
2026-01-17 17:56:52,244 - dq_comparison - INFO -   Match after normalization: ❌ NO
2026-01-17 17:56:52,244 - dq_comparison - INFO - 
Hash components for Row 2:
2026-01-17 17:56:52,245 - dq_comparison - INFO - Source hash string start: eur|2024-01-02|56858.35...
2026-01-17 17:56:52,245 - dq_comparison - INFO - Target hash string start: NULL|NULL|NULL...
2026-01-17 17:56:52,245 - dq_comparison - INFO - Same? ❌ NO
2026-01-17 17:56:52,246 - dq_comparison - INFO - 
--- Column Data Types Analysis ---
2026-01-17 17:56:52,246 - dq_comparison - INFO - Column 1: 'currency' (category) ↔ 'currency' (category)
2026-01-17 17:56:52,246 - dq_comparison - INFO -   Sample: Source='EUR', Target='EUR'
2026-01-17 17:56:52,246 - dq_comparison - INFO - Column 2: 'posting_date' (category) ↔ 'posting_date' (category)
2026-01-17 17:56:52,247 - dq_comparison - INFO -   Sample: Source='2024-01-02', Target='2024-01-02'
2026-01-17 17:56:52,247 - dq_comparison - INFO - Column 3: 'balance_after' (object) ↔ 'balance_after' (float32)
2026-01-17 17:56:52,247 - dq_comparison - INFO -   Sample: Source='44576.32', Target='54897.9296875'
2026-01-17 17:56:52,247 - dq_comparison - INFO - Column 4: 'transaction_id' (object) ↔ 'transaction_id' (object)
2026-01-17 17:56:52,247 - dq_comparison - INFO -   Sample: Source='0b0ccaa7-6fde-4868-a20d-8064a87e4914', Target='3ec6eecf-ef59-4447-9929-28a2e39e7231'
2026-01-17 17:56:52,248 - dq_comparison - INFO - Column 5: 'reference_code' (object) ↔ 'reference_code' (object)
2026-01-17 17:56:52,248 - dq_comparison - INFO -   Sample: Source='REF000012', Target='REF000000'
2026-01-17 17:56:52,248 - dq_comparison - INFO - PERFORMING DETAILED ROW-LEVEL COMPARISON WITH PAGINATION...
2026-01-17 17:56:52,248 - dq_comparison - INFO - Found 28 total mismatches
2026-01-17 17:56:52,248 - dq_comparison - INFO - Will process detailed comparisons for first 28 rows
2026-01-17 17:56:52,255 - dq_comparison - INFO - 
================================================================================
2026-01-17 17:56:52,256 - dq_comparison - INFO - DETAILED MISMATCH SUMMARY:
2026-01-17 17:56:52,256 - dq_comparison - INFO -   Total mismatches found: 15
2026-01-17 17:56:52,257 - dq_comparison - INFO -   Detailed comparisons logged: 15
2026-01-17 17:56:52,257 - dq_comparison - INFO -   First 10 rows displayed above
2026-01-17 17:56:52,257 - dq_comparison - INFO -   All mismatches stored in database with complete data
2026-01-17 17:56:52,257 - dq_comparison - INFO -   Use API to retrieve all 15 mismatches
2026-01-17 17:56:52,258 - dq_comparison - INFO - ================================================================================
2026-01-17 17:56:52,258 - dq_comparison - INFO - Hash-based Comparison Results (with duplicate handling):
2026-01-17 17:56:52,258 - dq_comparison - INFO -   • Unique source hashes: 15
2026-01-17 17:56:52,258 - dq_comparison - INFO -   • Unique target hashes: 13
2026-01-17 17:56:52,259 - dq_comparison - INFO -   • Common hashes: 0
2026-01-17 17:56:52,259 - dq_comparison - INFO -   • Common rows (counting duplicates): 0
2026-01-17 17:56:52,259 - dq_comparison - INFO -   • Rows only in source (counting duplicates): 15
2026-01-17 17:56:52,259 - dq_comparison - INFO -   • Rows only in target (counting duplicates): 13
2026-01-17 17:56:52,261 - dq_comparison - INFO - HASH-ONLY COMPARISON COMPLETED
2026-01-17 17:56:52,262 - dq_comparison - INFO - Returning counts for simple scoring:
2026-01-17 17:56:52,262 - dq_comparison - INFO -   Common rows: 0
2026-01-17 17:56:52,262 - dq_comparison - INFO -   Unique to source: 15
2026-01-17 17:56:52,262 - dq_comparison - INFO -   Unique to target: 13
2026-01-17 17:56:52,262 - dq_comparison - INFO -   Value mismatches: 448
2026-01-17 17:56:52,263 - dq_comparison - INFO -   Missing rows: 15
2026-01-17 17:56:52,263 - dq_comparison - INFO -   Extra rows: 13
2026-01-17 17:56:52,263 - dq_comparison - INFO - 
========================================================================================================================
COMPARISON: Mysql Database vs Postgresql Database
========================================================================================================================
Row   | Diff Count | Source (Sample)                          | Target (Sample)                         
------------------------------------------------------------------------------------------------------------------------
2     | 16         | currency: EUR                            | currency: NULL                          
3     | 16         | currency: INR                            | currency: NULL                          
4     | 16         | currency: EUR                            | currency: NULL                          
5     | 16         | currency: USD                            | currency: NULL                          
6     | 16         | currency: EUR                            | currency: NULL                          
7     | 16         | currency: USD                            | currency: NULL                          
8     | 16         | currency: INR                            | currency: NULL                          
9     | 16         | currency: USD                            | currency: NULL                          
10    | 16         | currency: INR                            | currency: NULL                          
11    | 16         | currency: INR                            | currency: NULL                          
------------------------------------------------------------------------------------------------------------------------
Showing 1-10 of 15 mismatched rows. Use API for complete data.
========================================================================================================================
2026-01-17 17:56:52,264 - dq_comparison - INFO - Returning enhanced mismatch structure with 15 detailed mismatches
2026-01-17 17:56:52,264 - dq_comparison - INFO - New structure: 15 detailed mismatches
2026-01-17 17:56:52,264 - dq_comparison - INFO - 
6️⃣ DATA QUALITY ANALYSIS
2026-01-17 17:56:52,264 - dq_comparison - INFO - Analyzing data quality metrics...
2026-01-17 17:56:52,279 - dq_comparison - INFO - Null values - Source: 0 (0.00%), Target: 0 (0.00%)
2026-01-17 17:56:52,281 - dq_comparison - INFO - Duplicate rows (normalized) - Source: 0, Target: 0
2026-01-17 17:56:52,294 - dq_error_log - INFO - Retrieved 3 error logs for session CMP_20260117_175652
2026-01-17 17:56:52,294 - dq_comparison - INFO - 
📊 SIMPLE SCORING CALCULATION:
2026-01-17 17:56:52,295 - dq_comparison - INFO -   Source rows: 15
2026-01-17 17:56:52,295 - dq_comparison - INFO -   Common rows (matched): 0
2026-01-17 17:56:52,295 - dq_comparison - INFO -   Calculation: (0 / 15) * 100 = 0.00%
2026-01-17 17:56:52,296 - dq_comparison - INFO -   Explanation: 0 matched rows out of 15 total source rows
2026-01-17 17:56:52,296 - dq_comparison - INFO - 
=== AUDIT LOGGING SECTION ===
2026-01-17 17:56:52,299 - dq_comparison - INFO - 🔍 Audit logging is ENABLED in APP_SETTINGS
2026-01-17 17:56:52,299 - dq_audit - INFO - Audit class initialized with database: dq_checks
2026-01-17 17:56:52,300 - dq_comparison - INFO - Attempting to log audit record for session: CMP_20260117_175652
2026-01-17 17:56:52,300 - dq_audit - INFO - Starting database insertion for comparison...
2026-01-17 17:56:52,314 - dq_audit - INFO - Inserted comparison record with ID: 759
2026-01-17 17:56:52,314 - dq_comparison - INFO - ✅ Audit record logged successfully (ID: 759)
2026-01-17 17:56:52,314 - dq_comparison - INFO - 
======================================================================
2026-01-17 17:56:52,315 - dq_comparison - INFO - 📊 COMPARISON RESULTS SUMMARY
2026-01-17 17:56:52,315 - dq_comparison - INFO - ======================================================================
2026-01-17 17:56:52,315 - dq_comparison - INFO - Session ID: CMP_20260117_175652
2026-01-17 17:56:52,316 - dq_comparison - INFO - Source: Database: mysql - dq_checks.comparison_small_source15 (15 rows)
2026-01-17 17:56:52,319 - dq_comparison - INFO - Target: Database: postgresql - dq_checks.comparison_small_target13 (13 rows)
2026-01-17 17:56:52,319 - dq_comparison - INFO - Selected columns: 16
2026-01-17 17:56:52,319 - dq_comparison - INFO - ----------------------------------------------------------------------
2026-01-17 17:56:52,319 - dq_comparison - INFO - 1️⃣ Row count match: ❌ No
2026-01-17 17:56:52,320 - dq_comparison - INFO -    Missing in target: 2 rows
2026-01-17 17:56:52,320 - dq_comparison - INFO -    Extra in target: 0 rows
2026-01-17 17:56:52,320 - dq_comparison - INFO - 2️⃣ Column structure match: ✅ Yes
2026-01-17 17:56:52,320 - dq_comparison - INFO - 3️ Primary key validation: ❌ Failed
2026-01-17 17:56:52,321 - dq_comparison - INFO -    Key fields: ['transaction_id', 'customer_id', 'reference_code']
2026-01-17 17:56:52,321 - dq_comparison - INFO - 4️ Table metadata: ❌ Mismatch
2026-01-17 17:56:52,321 - dq_comparison - INFO -    • Row Count: 15 vs 13
2026-01-17 17:56:52,322 - dq_comparison - INFO - 5️⃣ Common rows (both Mysql Database and Postgresql Database): 0 (0.00% of Mysql Database)
2026-01-17 17:56:52,322 - dq_comparison - INFO - 6️⃣ Mysql Database-only rows: 15 (present ONLY in Mysql Database, NOT in Postgresql Database)
2026-01-17 17:56:52,322 - dq_comparison - INFO - 7️⃣ Postgresql Database-only rows: 13 (present ONLY in Postgresql Database, NOT in Mysql Database)
2026-01-17 17:56:52,322 - dq_comparison - INFO - 8️⃣ Column value mismatches: 0
2026-01-17 17:56:52,323 - dq_comparison - INFO - 9️ Data quality match: ✅ Yes
2026-01-17 17:56:52,323 - dq_comparison - INFO - 📈 DQ Score: 0.00%
2026-01-17 17:56:52,323 - dq_comparison - INFO - 📊 Calculation: (0 / 15) * 100 = 0.00%
2026-01-17 17:56:52,324 - dq_comparison - INFO - ======================================================================
2026-01-17 17:56:52,324 - dq_comparison - INFO - 
❌ LOW MATCH! Major differences found.
2026-01-17 17:56:52,324 - dq_comparison - INFO - 
🔍 NORMALIZATION APPLIED:
2026-01-17 17:56:52,324 - dq_comparison - INFO -    • NULL values → 'NULL' (consistent representation)
2026-01-17 17:56:52,325 - dq_comparison - INFO -    • Dates → YYYY-MM-DD format
2026-01-17 17:56:52,325 - dq_comparison - INFO -    • Strings → trimmed + lowercase
2026-01-17 17:56:52,325 - dq_comparison - INFO -    • Numeric values → standardized format
2026-01-17 17:56:52,326 - dq_comparison - INFO -    • Phone numbers → digits only, ALL leading zeros removed
2026-01-17 17:56:52,326 - dq_comparison - INFO -    • Extra whitespace removed
2026-01-17 17:56:52,326 - dq_comparison - INFO - 
🔍 DETAILED ERROR ANALYSIS:
2026-01-17 17:56:52,327 - dq_comparison - INFO - --------------------------------------------------
2026-01-17 17:56:52,327 - dq_comparison - INFO - 📊 SOURCE-ONLY ROWS: 15 rows
2026-01-17 17:56:52,327 - dq_comparison - INFO -    Present only in Mysql Database, missing from Postgresql Database
2026-01-17 17:56:52,328 - dq_comparison - INFO - 📊 TARGET-ONLY ROWS: 13 rows
2026-01-17 17:56:52,328 - dq_comparison - INFO -    Present only in Postgresql Database, extra (not in Mysql Database)
2026-01-17 17:56:52,337 - dq_error_log - INFO - Retrieved 3 errors for session CMP_20260117_175652
2026-01-17 17:56:52,338 - dq_comparison - INFO - 
📋 SAMPLE ERRORS (3 found):
2026-01-17 17:56:52,338 - dq_comparison - INFO - 
1. Row 0 - Metadata Row Count
2026-01-17 17:56:52,338 - dq_comparison - INFO -    Column: 
2026-01-17 17:56:52,339 - dq_comparison - INFO -    Metadata mismatch: Row Count
2026-01-17 17:56:52,339 - dq_comparison - INFO - 
2. Row 0 - Duplicate Primary Key
2026-01-17 17:56:52,339 - dq_comparison - INFO -    Column: customer_id
2026-01-17 17:56:52,340 - dq_comparison - INFO -    Primary key field 'customer_id' has 15 duplicates in source
2026-01-17 17:56:52,340 - dq_comparison - INFO - 
3. Row 0 - Duplicate Primary Key
2026-01-17 17:56:52,340 - dq_comparison - INFO -    Column: customer_id
2026-01-17 17:56:52,340 - dq_comparison - INFO -    Primary key field 'customer_id' has 13 duplicates in target
2026-01-17 17:56:52,341 - dq_comparison - INFO - 
💡 For complete error details, run:
2026-01-17 17:56:52,341 - dq_comparison - INFO -    USE dq_checks;
2026-01-17 17:56:52,341 - dq_comparison - INFO -    SELECT excel_row, column_name, error_type, error_description,
2026-01-17 17:56:52,341 - dq_comparison - INFO -           actual_value, expected_value
2026-01-17 17:56:52,341 - dq_comparison - INFO -    FROM dq_error_logs
2026-01-17 17:56:52,342 - dq_comparison - INFO -    WHERE session_id = 'CMP_20260117_175652'
2026-01-17 17:56:52,342 - dq_comparison - INFO -    ORDER BY excel_row, column_name;
2026-01-17 17:56:52,355 - dq_comparison - INFO - 
✅ Comparison completed! Session ID: CMP_20260117_175652
2026-01-17 17:56:52,365 - dq_error_log - INFO - Retrieved 4 error logs for session CMP_20260117_175652
2026-01-17 17:56:52,376 - dq_error_log - INFO - Retrieved summary: 4 total errors for session CMP_20260117_175652
2026-01-17 17:56:52,377 - dq_audit - INFO - Audit class initialized with database: dq_checks
2026-01-17 17:56:52,390 - dq_audit - INFO - Retrieved 1 audit logs for session CMP_20260117_175652
2026-01-17 17:56:52,390 - dq_comparison - INFO - 
🔍 Final results verification:
2026-01-17 17:56:52,390 - dq_comparison - INFO -    Session ID: CMP_20260117_175652
2026-01-17 17:56:52,392 - dq_comparison - INFO -    DQ Score (Simple %): 0.00%
2026-01-17 17:56:52,392 - dq_comparison - INFO -    Source rows: 15
2026-01-17 17:56:52,393 - dq_comparison - INFO -    Matched rows: 0
2026-01-17 17:56:52,393 - dq_comparison - INFO -    Calculation: (0 / 15) * 100
2026-01-17 17:56:52,394 - __main__ - INFO - Source-Target Comparison completed successfully
2026-01-17 17:56:52,396 - __main__ - INFO - Displaying main menu options to user
2026-01-17 18:01:13,379 - __main__ - INFO - User selected option: 6
2026-01-17 18:01:13,380 - __main__ - INFO - User session ended. Duration: 0:04:59.225654
2026-01-17 18:01:13,381 - __main__ - INFO - 👋 Thank you for using Universal Data Quality Framework!
