2026-01-30 17:02:34,235 - root - INFO - CLI Mode Logging Initialized
2026-01-30 17:02:34,236 - root - INFO - CLI logs will be saved to: logs/dq_framework_20260130_170234.log
2026-01-30 17:02:34,236 - __main__ - INFO - 🚀 UNIVERSAL DATA QUALITY FRAMEWORK INITIALIZED
2026-01-30 17:02:34,237 - __main__ - INFO - Starting system resource check
2026-01-30 17:02:34,242 - __main__ - INFO - Total RAM: 15.7 GB
2026-01-30 17:02:34,242 - __main__ - INFO - Available RAM: 2.4 GB
2026-01-30 17:02:34,243 - __main__ - INFO - Memory used: 84.5%
2026-01-30 17:02:34,243 - __main__ - INFO - Memory status: OK
2026-01-30 17:02:34,243 - __main__ - INFO - Free disk space: 258.2 GB
2026-01-30 17:02:34,243 - __main__ - INFO - Disk used: 45.8%
2026-01-30 17:02:34,243 - __main__ - INFO - Disk space: OK
2026-01-30 17:02:34,745 - __main__ - INFO - CPU cores: 8
2026-01-30 17:02:34,745 - __main__ - INFO - CPU usage: 1.9%
2026-01-30 17:02:34,746 - __main__ - INFO - Python version: 3.12.4
2026-01-30 17:02:34,746 - __main__ - INFO - System platform: win32
2026-01-30 17:02:34,746 - __main__ - INFO - User session started at: 2026-01-30 17:02:34.746360
2026-01-30 17:02:34,747 - __main__ - INFO - Displaying main menu options to user
2026-01-30 17:02:38,167 - __main__ - INFO - User selected option: 2
2026-01-30 17:02:38,168 - __main__ - INFO - Starting Source-Target Comparison module
2026-01-30 17:02:38,171 - dq_comparison - INFO - STARTING UNIVERSAL SOURCE-TARGET COMPARISON TOOL
2026-01-30 17:02:38,171 - dq_comparison - INFO - LOADING SOURCE AND TARGET DATA
2026-01-30 17:02:38,171 - dq_comparison - INFO - 
==================================================
2026-01-30 17:02:38,171 - dq_comparison - INFO - 🔗 SOURCE DATA CONFIGURATION
2026-01-30 17:02:38,172 - dq_comparison - INFO - ==================================================
2026-01-30 17:02:43,099 - dq_comparison - INFO - DEBUG load_excel_source called for SOURCE
2026-01-30 17:02:43,101 - dq_comparison - INFO - DEBUG ui_data: None
2026-01-30 17:02:43,103 - dq_comparison - INFO - DEBUG ui_data type: <class 'NoneType'>
2026-01-30 17:02:50,532 - dq_comparison - INFO - SOURCE Excel loaded: 8,999 rows, 13 columns
2026-01-30 17:02:50,532 - dq_comparison - INFO - 
==================================================
2026-01-30 17:02:50,533 - dq_comparison - INFO - 🔗 TARGET DATA CONFIGURATION
2026-01-30 17:02:50,534 - dq_comparison - INFO - ==================================================
2026-01-30 17:02:58,448 - dq_comparison - INFO - DEBUG load_csv_source called for TARGET
2026-01-30 17:03:01,505 - dq_comparison - INFO - TARGET CSV loaded: 10,000 rows, 13 columns
2026-01-30 17:03:01,506 - dq_comparison - INFO - SELECTING COLUMNS FOR COMPARISON
2026-01-30 17:03:01,506 - dq_comparison - INFO - Source columns (original): ['ProductID', 'ProductName', 'Category', 'SubCategory', 'Brand', 'UOM', 'Length_cm', 'Width_cm', 'Height_cm', 'Weight_kg', 'Price', 'CountryOfOrigin', 'Barcode']
2026-01-30 17:03:01,506 - dq_comparison - INFO - Target columns (original): ['ProductID', 'ProductName', 'Category', 'SubCategory', 'Brand', 'UOM', 'Length_cm', 'Width_cm', 'Height_cm', 'Weight_kg', 'Price', 'CountryOfOrigin', 'Barcode']
2026-01-30 17:03:01,507 - dq_comparison - INFO - Common columns lowercased: ['uom', 'length_cm', 'countryoforigin', 'price', 'productid', 'width_cm', 'height_cm', 'weight_kg', 'subcategory', 'category', 'productname', 'brand', 'barcode']
2026-01-30 17:03:01,507 - dq_comparison - INFO - Found 13 common columns between source and target (case-insensitive)
2026-01-30 17:03:01,507 - dq_comparison - INFO - 
📋 Common columns available for comparison:
2026-01-30 17:03:01,508 - dq_comparison - INFO -   1. UOM (Source) ↔ UOM (Target)
2026-01-30 17:03:01,508 - dq_comparison - INFO -   2. Length_cm (Source) ↔ Length_cm (Target)
2026-01-30 17:03:01,508 - dq_comparison - INFO -   3. CountryOfOrigin (Source) ↔ CountryOfOrigin (Target)
2026-01-30 17:03:01,509 - dq_comparison - INFO -   4. Price (Source) ↔ Price (Target)
2026-01-30 17:03:01,509 - dq_comparison - INFO -   5. ProductID (Source) ↔ ProductID (Target)
2026-01-30 17:03:01,509 - dq_comparison - INFO -   6. Width_cm (Source) ↔ Width_cm (Target)
2026-01-30 17:03:01,510 - dq_comparison - INFO -   7. Height_cm (Source) ↔ Height_cm (Target)
2026-01-30 17:03:01,510 - dq_comparison - INFO -   8. Weight_kg (Source) ↔ Weight_kg (Target)
2026-01-30 17:03:01,510 - dq_comparison - INFO -   9. SubCategory (Source) ↔ SubCategory (Target)
2026-01-30 17:03:01,511 - dq_comparison - INFO -   10. Category (Source) ↔ Category (Target)
2026-01-30 17:03:01,511 - dq_comparison - INFO -   11. ProductName (Source) ↔ ProductName (Target)
2026-01-30 17:03:01,511 - dq_comparison - INFO -   12. Brand (Source) ↔ Brand (Target)
2026-01-30 17:03:01,511 - dq_comparison - INFO -   13. Barcode (Source) ↔ Barcode (Target)
2026-01-30 17:03:03,492 - dq_comparison - INFO - User column selection input: all
2026-01-30 17:03:03,493 - dq_comparison - INFO - User selected ALL common columns for comparison
2026-01-30 17:03:03,495 - dq_comparison - INFO - GENERATING COMPREHENSIVE COMPARISON REPORT
2026-01-30 17:03:03,495 - dq_comparison - INFO - Report details - Source: Excel: product_master_9k.xlsx (product_master_9k), Target: CSV: product_master_10k.csv, Selected columns: 13
2026-01-30 17:03:03,495 - dq_comparison - INFO - Initializing Error Logger...
2026-01-30 17:03:03,496 - dq_error_log - INFO - ErrorLogger initialized with database: dq_checks
2026-01-30 17:03:03,608 - dq_error_log - INFO - Database connection successful
2026-01-30 17:03:03,609 - dq_comparison - INFO - Session ID: CMP_20260130_170303
2026-01-30 17:03:03,610 - dq_comparison - INFO - 
======================================================================
2026-01-30 17:03:03,610 - dq_comparison - INFO - 🔄 RUNNING SOURCE-TARGET COMPARISON WITH PERFECT NORMALIZATION
2026-01-30 17:03:03,611 - dq_comparison - INFO - ======================================================================
2026-01-30 17:03:03,612 - dq_comparison - INFO - Session ID: CMP_20260130_170303
2026-01-30 17:03:03,612 - dq_comparison - INFO - Source: Excel: product_master_9k.xlsx (product_master_9k)
2026-01-30 17:03:03,612 - dq_comparison - INFO - Target: CSV: product_master_10k.csv
2026-01-30 17:03:03,612 - dq_comparison - INFO - Selected columns: 13
2026-01-30 17:03:03,613 - dq_comparison - INFO - ======================================================================
2026-01-30 17:03:03,613 - dq_comparison - INFO - 
1️⃣ FIRST: ROW COUNT CHECK
2026-01-30 17:03:03,613 - dq_comparison - WARNING - ❌ Row count mismatch: Source=8,999, Target=10,000, Difference=1,001
2026-01-30 17:03:03,613 - dq_comparison - WARNING -    Extra in target: 1,001 rows
2026-01-30 17:03:03,614 - dq_comparison - INFO - 
2️⃣ COLUMN STRUCTURE COMPARISON
2026-01-30 17:03:03,614 - dq_comparison - INFO - Comparing column structures...
2026-01-30 17:03:03,614 - dq_comparison - INFO - Column structure comparison complete. Match: True
2026-01-30 17:03:03,614 - dq_comparison - INFO - 
3️⃣ PRIMARY KEY VALIDATION
2026-01-30 17:03:03,615 - dq_comparison - INFO - Validating primary key/unique fields...
2026-01-30 17:03:03,615 - dq_comparison - INFO - Auto-detecting key fields from data...
2026-01-30 17:03:03,635 - dq_comparison - INFO - Auto-detected common key fields: ['ProductID', 'Weight_kg', 'ProductName', 'Price', 'Width_cm', 'Barcode']
2026-01-30 17:03:03,646 - dq_comparison - WARNING - Primary key validation failed - duplicates in: ['Price', 'Width_cm', 'Barcode']
2026-01-30 17:03:03,646 - dq_comparison - INFO - Primary key validation complete. Status: DUPLICATE_VALUES
2026-01-30 17:03:03,705 - dq_comparison - INFO - 
3️⃣ PRIMARY KEY / UNIQUE FIELD VALIDATION
2026-01-30 17:03:03,705 - dq_comparison - INFO - --------------------------------------------------
2026-01-30 17:03:03,706 - dq_comparison - INFO -    ❌ Status: Failed (duplicate values found)
2026-01-30 17:03:03,706 - dq_comparison - INFO -    📝 Message: Duplicate values found in key fields: ['Price', 'Width_cm', 'Barcode']
2026-01-30 17:03:03,708 - dq_comparison - INFO -    🔑 Validated fields: ProductID ↔ ProductID, Weight_kg ↔ Weight_kg, ProductName ↔ ProductName, Price ↔ Price, Width_cm ↔ Width_cm, Barcode ↔ Barcode
2026-01-30 17:03:03,708 - dq_comparison - INFO -    📊 Source duplicates found:
2026-01-30 17:03:03,708 - dq_comparison - INFO -         • Price: 1201 duplicate rows
2026-01-30 17:03:03,708 - dq_comparison - INFO -           Sample values: [9702, 10984]
2026-01-30 17:03:03,709 - dq_comparison - INFO -         • Width_cm: 8999 duplicate rows
2026-01-30 17:03:03,709 - dq_comparison - INFO -           Sample values: [118, 148]
2026-01-30 17:03:03,709 - dq_comparison - INFO -         • Barcode: 562 duplicate rows
2026-01-30 17:03:03,709 - dq_comparison - INFO -           Sample values: [nan, 3766610000000.0]
2026-01-30 17:03:03,710 - dq_comparison - INFO -    📊 Target duplicates found:
2026-01-30 17:03:03,710 - dq_comparison - INFO -         • Price: 1460 duplicate rows
2026-01-30 17:03:03,710 - dq_comparison - INFO -           Sample values: [9702, 10984]
2026-01-30 17:03:03,710 - dq_comparison - INFO -         • Width_cm: 10000 duplicate rows
2026-01-30 17:03:03,710 - dq_comparison - INFO -           Sample values: [118, 148]
2026-01-30 17:03:03,711 - dq_comparison - INFO -         • Barcode: 642 duplicate rows
2026-01-30 17:03:03,711 - dq_comparison - INFO -           Sample values: [nan, 3766610000000.0]
2026-01-30 17:03:03,711 - dq_comparison - INFO -    🔍 Detection method: Auto-detected
2026-01-30 17:03:03,711 - dq_comparison - INFO - --------------------------------------------------
2026-01-30 17:03:03,711 - dq_comparison - INFO -    Column names match: ✅
2026-01-30 17:03:03,712 - dq_comparison - INFO -    Column order match: ✅
2026-01-30 17:03:03,712 - dq_comparison - INFO -    Data types match: ✅
2026-01-30 17:03:03,712 - dq_comparison - INFO - 
4️⃣ TABLE METADATA COMPARISON
2026-01-30 17:03:03,712 - dq_comparison - INFO - Comparing table-level metadata...
2026-01-30 17:03:03,760 - dq_comparison - INFO - Table metadata comparison complete. Match: False
2026-01-30 17:03:03,760 - dq_comparison - INFO -    Table metadata match: ❌
2026-01-30 17:03:03,761 - dq_comparison - INFO -    Source: 8,999 rows, 13 cols, 3.36 MB
2026-01-30 17:03:03,761 - dq_comparison - INFO -    Target: 10,000 rows, 13 cols, 3.73 MB
2026-01-30 17:03:03,763 - dq_comparison - WARNING -    Found 1 metadata differences:
2026-01-30 17:03:03,763 - dq_comparison - WARNING -      • Row Count: Source=8999, Target=10000
2026-01-30 17:03:03,764 - dq_comparison - INFO - 
5️⃣ HASH-BASED COMPARISON
2026-01-30 17:03:03,764 - dq_comparison - INFO - ℹ️  Note: All NULL values normalized to 'NULL'
2026-01-30 17:03:03,764 - dq_comparison - INFO - ℹ️  Note: Dates normalized to YYYY-MM-DD
2026-01-30 17:03:03,764 - dq_comparison - INFO - ℹ️  Note: Strings trimmed and case-normalized
2026-01-30 17:03:03,765 - dq_comparison - INFO - ℹ️  Note: Phone numbers stripped to digits only, leading zeros removed
2026-01-30 17:03:03,765 - dq_comparison - INFO - SECOND CHECK: HASH-BASED COMPARISON WITH PERFECT NORMALIZATION
2026-01-30 17:03:03,770 - dq_comparison - INFO - Starting comparison of 18,999 total rows...
2026-01-30 17:03:03,770 - dq_comparison - INFO - === DEBUG: DATA TYPE CHECK ===
2026-01-30 17:03:03,771 - dq_comparison - INFO - Column: UOM
2026-01-30 17:03:03,771 - dq_comparison - INFO -   Source type: <class 'str'>, value: PR
2026-01-30 17:03:03,771 - dq_comparison - INFO -   Target type: <class 'str'>, value: PR
2026-01-30 17:03:03,773 - dq_comparison - INFO -   Normalized: 'pr' vs 'pr'
2026-01-30 17:03:03,774 - dq_comparison - INFO -   Match: True
2026-01-30 17:03:03,774 - dq_comparison - INFO - Column: Length_cm
2026-01-30 17:03:03,774 - dq_comparison - INFO -   Source type: <class 'numpy.int64'>, value: 139
2026-01-30 17:03:03,774 - dq_comparison - INFO -   Target type: <class 'numpy.int64'>, value: 139
2026-01-30 17:03:03,775 - dq_comparison - INFO -   Normalized: '139' vs '139'
2026-01-30 17:03:03,775 - dq_comparison - INFO -   Match: True
2026-01-30 17:03:03,775 - dq_comparison - INFO - Column: CountryOfOrigin
2026-01-30 17:03:03,775 - dq_comparison - INFO -   Source type: <class 'str'>, value: Germany
2026-01-30 17:03:03,776 - dq_comparison - INFO -   Target type: <class 'str'>, value: Germany
2026-01-30 17:03:03,776 - dq_comparison - INFO -   Normalized: 'germany' vs 'germany'
2026-01-30 17:03:03,776 - dq_comparison - INFO -   Match: True
2026-01-30 17:03:03,776 - dq_comparison - INFO - Source DF columns: ['ProductID', 'ProductName', 'Category', 'SubCategory', 'Brand', 'UOM', 'Length_cm', 'Width_cm', 'Height_cm', 'Weight_kg', 'Price', 'CountryOfOrigin', 'Barcode']
2026-01-30 17:03:03,777 - dq_comparison - INFO - Target DF columns: ['ProductID', 'ProductName', 'Category', 'SubCategory', 'Brand', 'UOM', 'Length_cm', 'Width_cm', 'Height_cm', 'Weight_kg', 'Price', 'CountryOfOrigin', 'Barcode']
2026-01-30 17:03:03,777 - dq_comparison - INFO - Selected columns for comparison: ['UOM', 'Length_cm', 'CountryOfOrigin', 'Price', 'ProductID', 'Width_cm', 'Height_cm', 'Weight_kg', 'SubCategory', 'Category', 'ProductName', 'Brand', 'Barcode']
2026-01-30 17:03:03,777 - dq_comparison - INFO - Using 13 common columns for hash comparison
2026-01-30 17:03:03,777 - dq_comparison - INFO - Source columns: ['UOM', 'Length_cm', 'CountryOfOrigin', 'Price', 'ProductID', 'Width_cm', 'Height_cm', 'Weight_kg', 'SubCategory', 'Category', 'ProductName', 'Brand', 'Barcode']
2026-01-30 17:03:03,778 - dq_comparison - INFO - Target columns: ['UOM', 'Length_cm', 'CountryOfOrigin', 'Price', 'ProductID', 'Width_cm', 'Height_cm', 'Weight_kg', 'SubCategory', 'Category', 'ProductName', 'Brand', 'Barcode']
2026-01-30 17:03:03,778 - dq_comparison - INFO - Generating hashes for source data (8999 rows)...
2026-01-30 17:03:04,355 - dq_comparison - INFO -    Hashing source data: 10.0% complete (1,900/18,999 rows)
2026-01-30 17:03:04,930 - dq_comparison - INFO -    Hashing source data: 20.0% complete (3,800/18,999 rows)
2026-01-30 17:03:05,530 - dq_comparison - INFO -    Hashing source data: 30.0% complete (5,700/18,999 rows)
2026-01-30 17:03:06,130 - dq_comparison - INFO -    Hashing source data: 40.0% complete (7,600/18,999 rows)
2026-01-30 17:03:06,557 - dq_comparison - INFO - === DEBUG: SAMPLE HASHES ===
2026-01-30 17:03:06,557 - dq_comparison - INFO - Hash 1: 2252946295c985df... (sample row 0)
2026-01-30 17:03:06,558 - dq_comparison - INFO - Hash 2: aacac383f4992d26... (sample row 1)
2026-01-30 17:03:06,559 - dq_comparison - INFO - Hash 3: fc023e0b08264799... (sample row 2)
2026-01-30 17:03:06,560 - dq_comparison - INFO - Generating hashes for target data (10000 rows)...
2026-01-30 17:03:06,716 - dq_comparison - INFO -    Hashing target data: 50.0% complete (9,500/18,999 rows)
2026-01-30 17:03:07,294 - dq_comparison - INFO -    Hashing target data: 60.0% complete (11,400/18,999 rows)
2026-01-30 17:03:07,880 - dq_comparison - INFO -    Hashing target data: 70.0% complete (13,300/18,999 rows)
2026-01-30 17:03:08,464 - dq_comparison - INFO -    Hashing target data: 80.0% complete (15,200/18,999 rows)
2026-01-30 17:03:09,056 - dq_comparison - INFO -    Hashing target data: 90.0% complete (17,100/18,999 rows)
2026-01-30 17:03:09,658 - dq_comparison - INFO - 
======================================================================
2026-01-30 17:03:09,658 - dq_comparison - INFO - 🔍 DEBUG: ANALYZING WHY HASHES DON'T MATCH
2026-01-30 17:03:09,659 - dq_comparison - INFO - ======================================================================
2026-01-30 17:03:09,659 - dq_comparison - INFO - 
--- Analyzing Row 0 ---
2026-01-30 17:03:09,661 - dq_comparison - INFO - Column 'UOM' → 'UOM':
2026-01-30 17:03:09,661 - dq_comparison - INFO -   Source: 'PR' (type: str) → 'pr'
2026-01-30 17:03:09,662 - dq_comparison - INFO -   Target: 'PR' (type: str) → 'pr'
2026-01-30 17:03:09,662 - dq_comparison - INFO -   Match after normalization: ✅ YES
2026-01-30 17:03:09,662 - dq_comparison - INFO - Column 'Length_cm' → 'Length_cm':
2026-01-30 17:03:09,663 - dq_comparison - INFO -   Source: '139' (type: int64) → '139'
2026-01-30 17:03:09,663 - dq_comparison - INFO -   Target: '139' (type: int64) → '139'
2026-01-30 17:03:09,663 - dq_comparison - INFO -   Match after normalization: ✅ YES
2026-01-30 17:03:09,664 - dq_comparison - INFO - Column 'CountryOfOrigin' → 'CountryOfOrigin':
2026-01-30 17:03:09,664 - dq_comparison - INFO -   Source: 'Germany' (type: str) → 'germany'
2026-01-30 17:03:09,664 - dq_comparison - INFO -   Target: 'Germany' (type: str) → 'germany'
2026-01-30 17:03:09,665 - dq_comparison - INFO -   Match after normalization: ✅ YES
2026-01-30 17:03:09,665 - dq_comparison - INFO - Column 'Price' → 'Price':
2026-01-30 17:03:09,665 - dq_comparison - INFO -   Source: '21662' (type: int64) → '21662'
2026-01-30 17:03:09,665 - dq_comparison - INFO -   Target: '21662' (type: int64) → '21662'
2026-01-30 17:03:09,665 - dq_comparison - INFO -   Match after normalization: ✅ YES
2026-01-30 17:03:09,666 - dq_comparison - INFO - Column 'ProductID' → 'ProductID':
2026-01-30 17:03:09,666 - dq_comparison - INFO -   Source: '1001' (type: int64) → '1001'
2026-01-30 17:03:09,666 - dq_comparison - INFO -   Target: '1001' (type: int64) → '1001'
2026-01-30 17:03:09,666 - dq_comparison - INFO -   Match after normalization: ✅ YES
2026-01-30 17:03:09,667 - dq_comparison - INFO - 
Hash components for Row 0:
2026-01-30 17:03:09,667 - dq_comparison - INFO - Source hash string start: pr|139|germany...
2026-01-30 17:03:09,667 - dq_comparison - INFO - Target hash string start: pr|139|germany...
2026-01-30 17:03:09,667 - dq_comparison - INFO - Same? ✅ YES
2026-01-30 17:03:09,667 - dq_comparison - INFO - 
--- Analyzing Row 1 ---
2026-01-30 17:03:09,668 - dq_comparison - INFO - Column 'UOM' → 'UOM':
2026-01-30 17:03:09,668 - dq_comparison - INFO -   Source: 'KG' (type: str) → 'kg'
2026-01-30 17:03:09,668 - dq_comparison - INFO -   Target: 'KG' (type: str) → 'kg'
2026-01-30 17:03:09,668 - dq_comparison - INFO -   Match after normalization: ✅ YES
2026-01-30 17:03:09,669 - dq_comparison - INFO - Column 'Length_cm' → 'Length_cm':
2026-01-30 17:03:09,669 - dq_comparison - INFO -   Source: '66' (type: int64) → '66'
2026-01-30 17:03:09,669 - dq_comparison - INFO -   Target: '66' (type: int64) → '66'
2026-01-30 17:03:09,669 - dq_comparison - INFO -   Match after normalization: ✅ YES
2026-01-30 17:03:09,670 - dq_comparison - INFO - Column 'CountryOfOrigin' → 'CountryOfOrigin':
2026-01-30 17:03:09,670 - dq_comparison - INFO -   Source: 'USA' (type: str) → 'usa'
2026-01-30 17:03:09,670 - dq_comparison - INFO -   Target: 'USA' (type: str) → 'usa'
2026-01-30 17:03:09,670 - dq_comparison - INFO -   Match after normalization: ✅ YES
2026-01-30 17:03:09,671 - dq_comparison - INFO - Column 'Price' → 'Price':
2026-01-30 17:03:09,674 - dq_comparison - INFO -   Source: '9702' (type: int64) → '9702'
2026-01-30 17:03:09,674 - dq_comparison - INFO -   Target: '9702' (type: int64) → '9702'
2026-01-30 17:03:09,675 - dq_comparison - INFO -   Match after normalization: ✅ YES
2026-01-30 17:03:09,675 - dq_comparison - INFO - Column 'ProductID' → 'ProductID':
2026-01-30 17:03:09,675 - dq_comparison - INFO -   Source: '1002' (type: int64) → '1002'
2026-01-30 17:03:09,675 - dq_comparison - INFO -   Target: '1002' (type: int64) → '1002'
2026-01-30 17:03:09,675 - dq_comparison - INFO -   Match after normalization: ✅ YES
2026-01-30 17:03:09,676 - dq_comparison - INFO - 
Hash components for Row 1:
2026-01-30 17:03:09,676 - dq_comparison - INFO - Source hash string start: kg|66|usa...
2026-01-30 17:03:09,676 - dq_comparison - INFO - Target hash string start: kg|66|usa...
2026-01-30 17:03:09,676 - dq_comparison - INFO - Same? ✅ YES
2026-01-30 17:03:09,677 - dq_comparison - INFO - 
--- Analyzing Row 2 ---
2026-01-30 17:03:09,677 - dq_comparison - INFO - Column 'UOM' → 'UOM':
2026-01-30 17:03:09,677 - dq_comparison - INFO -   Source: 'KG' (type: str) → 'kg'
2026-01-30 17:03:09,678 - dq_comparison - INFO -   Target: 'KG' (type: str) → 'kg'
2026-01-30 17:03:09,678 - dq_comparison - INFO -   Match after normalization: ✅ YES
2026-01-30 17:03:09,678 - dq_comparison - INFO - Column 'Length_cm' → 'Length_cm':
2026-01-30 17:03:09,678 - dq_comparison - INFO -   Source: '86' (type: int64) → '86'
2026-01-30 17:03:09,678 - dq_comparison - INFO -   Target: '86' (type: int64) → '86'
2026-01-30 17:03:09,679 - dq_comparison - INFO -   Match after normalization: ✅ YES
2026-01-30 17:03:09,679 - dq_comparison - INFO - Column 'CountryOfOrigin' → 'CountryOfOrigin':
2026-01-30 17:03:09,679 - dq_comparison - INFO -   Source: 'Germany' (type: str) → 'germany'
2026-01-30 17:03:09,679 - dq_comparison - INFO -   Target: 'Germany' (type: str) → 'germany'
2026-01-30 17:03:09,680 - dq_comparison - INFO -   Match after normalization: ✅ YES
2026-01-30 17:03:09,680 - dq_comparison - INFO - Column 'Price' → 'Price':
2026-01-30 17:03:09,680 - dq_comparison - INFO -   Source: '9291' (type: int64) → '9291'
2026-01-30 17:03:09,680 - dq_comparison - INFO -   Target: '9291' (type: int64) → '9291'
2026-01-30 17:03:09,681 - dq_comparison - INFO -   Match after normalization: ✅ YES
2026-01-30 17:03:09,681 - dq_comparison - INFO - Column 'ProductID' → 'ProductID':
2026-01-30 17:03:09,681 - dq_comparison - INFO -   Source: '1003' (type: int64) → '1003'
2026-01-30 17:03:09,681 - dq_comparison - INFO -   Target: '1003' (type: int64) → '1003'
2026-01-30 17:03:09,682 - dq_comparison - INFO -   Match after normalization: ✅ YES
2026-01-30 17:03:09,682 - dq_comparison - INFO - 
Hash components for Row 2:
2026-01-30 17:03:09,682 - dq_comparison - INFO - Source hash string start: kg|86|germany...
2026-01-30 17:03:09,682 - dq_comparison - INFO - Target hash string start: kg|86|germany...
2026-01-30 17:03:09,683 - dq_comparison - INFO - Same? ✅ YES
2026-01-30 17:03:09,683 - dq_comparison - INFO - 
--- Column Data Types Analysis ---
2026-01-30 17:03:09,683 - dq_comparison - INFO - Column 1: 'UOM' (object) ↔ 'UOM' (object)
2026-01-30 17:03:09,683 - dq_comparison - INFO -   Sample: Source='PR', Target='PR'
2026-01-30 17:03:09,684 - dq_comparison - INFO - Column 2: 'Length_cm' (int64) ↔ 'Length_cm' (int64)
2026-01-30 17:03:09,684 - dq_comparison - INFO -   Sample: Source='139', Target='139'
2026-01-30 17:03:09,684 - dq_comparison - INFO - Column 3: 'CountryOfOrigin' (object) ↔ 'CountryOfOrigin' (object)
2026-01-30 17:03:09,684 - dq_comparison - INFO -   Sample: Source='Germany', Target='Germany'
2026-01-30 17:03:09,684 - dq_comparison - INFO - Column 4: 'Price' (int64) ↔ 'Price' (int64)
2026-01-30 17:03:09,685 - dq_comparison - INFO -   Sample: Source='21662', Target='21662'
2026-01-30 17:03:09,685 - dq_comparison - INFO - Column 5: 'ProductID' (int64) ↔ 'ProductID' (int64)
2026-01-30 17:03:09,685 - dq_comparison - INFO -   Sample: Source='1001', Target='1001'
2026-01-30 17:03:09,685 - dq_comparison - INFO - PERFORMING DETAILED ROW-LEVEL COMPARISON WITH PAGINATION...
2026-01-30 17:03:09,687 - dq_comparison - INFO - Found 1,005 total mismatches
2026-01-30 17:03:09,689 - dq_comparison - INFO - Will process detailed comparisons for first 1,005 rows
2026-01-30 17:03:14,673 - dq_comparison - INFO - Progress: 500/1,005 rows (5.0s)
2026-01-30 17:03:19,773 - dq_comparison - INFO - Progress: 1,000/1,005 rows (10.1s)
2026-01-30 17:03:19,833 - dq_comparison - INFO - 
================================================================================
2026-01-30 17:03:19,834 - dq_comparison - INFO - DETAILED MISMATCH SUMMARY:
2026-01-30 17:03:19,835 - dq_comparison - INFO -   Total mismatches found: 1003
2026-01-30 17:03:19,835 - dq_comparison - INFO -   Detailed comparisons logged: 1003
2026-01-30 17:03:19,837 - dq_comparison - INFO -   First 10 rows displayed above
2026-01-30 17:03:19,837 - dq_comparison - INFO -   All mismatches stored in database with complete data
2026-01-30 17:03:19,837 - dq_comparison - INFO -   Use API to retrieve all 1003 mismatches
2026-01-30 17:03:19,838 - dq_comparison - INFO - ================================================================================
2026-01-30 17:03:19,840 - dq_comparison - INFO - Hash-based Comparison Results (with duplicate handling):
2026-01-30 17:03:19,841 - dq_comparison - INFO -   • Unique source hashes: 8999
2026-01-30 17:03:19,841 - dq_comparison - INFO -   • Unique target hashes: 10000
2026-01-30 17:03:19,842 - dq_comparison - INFO -   • Common hashes: 8997
2026-01-30 17:03:19,842 - dq_comparison - INFO -   • Common rows (counting duplicates): 8,997
2026-01-30 17:03:19,842 - dq_comparison - INFO -   • Rows only in source (counting duplicates): 2
2026-01-30 17:03:19,843 - dq_comparison - INFO -   • Rows only in target (counting duplicates): 1,003
2026-01-30 17:03:19,847 - dq_comparison - INFO - HASH-ONLY COMPARISON COMPLETED
2026-01-30 17:03:19,847 - dq_comparison - INFO - Returning counts for simple scoring:
2026-01-30 17:03:19,848 - dq_comparison - INFO -   Common rows: 8,997
2026-01-30 17:03:19,848 - dq_comparison - INFO -   Unique to source: 2
2026-01-30 17:03:19,848 - dq_comparison - INFO -   Unique to target: 1,003
2026-01-30 17:03:19,848 - dq_comparison - INFO -   Value mismatches: 13065
2026-01-30 17:03:19,849 - dq_comparison - INFO -   Missing rows: 2
2026-01-30 17:03:19,849 - dq_comparison - INFO -   Extra rows: 1,003
2026-01-30 17:03:19,849 - dq_comparison - INFO - 
========================================================================================================================
COMPARISON: Excel (product_master_9k.xlsx (product_master_9k)) vs CSV (product_master_10k.csv)
========================================================================================================================
Row   | Diff Count | Source (Sample)                          | Target (Sample)                         
------------------------------------------------------------------------------------------------------------------------
8996  | 1          | UOM: PR                                  | UOM: PR                                 
8999  | 1          | UOM: EA                                  | UOM: EA                                 
9001  | 13         | UOM: NULL                                | UOM: PR                                 
9002  | 13         | UOM: NULL                                | UOM: KG                                 
9003  | 13         | UOM: NULL                                | UOM: KG                                 
9004  | 13         | UOM: NULL                                | UOM: EA                                 
9005  | 13         | UOM: NULL                                | UOM: PR                                 
9006  | 13         | UOM: NULL                                | UOM: LT                                 
9007  | 13         | UOM: NULL                                | UOM: LT                                 
9008  | 13         | UOM: NULL                                | UOM: LT                                 
------------------------------------------------------------------------------------------------------------------------
Showing 1-10 of 1003 mismatched rows. Use API for complete data.
========================================================================================================================
2026-01-30 17:03:19,850 - dq_comparison - INFO - Returning enhanced mismatch structure with 1003 detailed mismatches
2026-01-30 17:03:19,859 - dq_comparison - INFO - New structure: 100 detailed mismatches
2026-01-30 17:03:19,859 - dq_comparison - INFO - 
6️⃣ DATA QUALITY ANALYSIS
2026-01-30 17:03:19,860 - dq_comparison - INFO - Analyzing data quality metrics...
2026-01-30 17:03:24,173 - dq_comparison - INFO - Null values - Source: 486 (0.42%), Target: 534 (0.41%)
2026-01-30 17:03:24,190 - dq_comparison - INFO - Duplicate rows (normalized) - Source: 0, Target: 0
2026-01-30 17:03:24,226 - dq_error_log - INFO - Retrieved 100 error logs for session CMP_20260130_170303
2026-01-30 17:03:24,226 - dq_comparison - INFO - 
📊 SIMPLE SCORING CALCULATION:
2026-01-30 17:03:24,227 - dq_comparison - INFO -   Source rows: 8999
2026-01-30 17:03:24,228 - dq_comparison - INFO -   Common rows (matched): 8997
2026-01-30 17:03:24,229 - dq_comparison - INFO -   Calculation: (8997 / 8999) * 100 = 99.98%
2026-01-30 17:03:24,229 - dq_comparison - INFO -   Explanation: 8997 matched rows out of 8999 total source rows
2026-01-30 17:03:24,229 - dq_comparison - INFO - 
=== AUDIT LOGGING SECTION ===
2026-01-30 17:03:24,230 - dq_comparison - INFO - 🔍 Audit logging is ENABLED in APP_SETTINGS
2026-01-30 17:03:24,230 - dq_audit - INFO - Audit class initialized with database: dq_checks
2026-01-30 17:03:24,230 - dq_comparison - INFO - Attempting to log audit record for session: CMP_20260130_170303
2026-01-30 17:03:24,231 - dq_audit - INFO - Starting database insertion for comparison...
2026-01-30 17:03:24,244 - dq_audit - INFO - Inserted comparison record with ID: 858
2026-01-30 17:03:24,245 - dq_comparison - INFO - ✅ Audit record logged successfully (ID: 858)
2026-01-30 17:03:24,245 - dq_comparison - INFO - 
======================================================================
2026-01-30 17:03:24,245 - dq_comparison - INFO - 📊 COMPARISON RESULTS SUMMARY
2026-01-30 17:03:24,245 - dq_comparison - INFO - ======================================================================
2026-01-30 17:03:24,246 - dq_comparison - INFO - Session ID: CMP_20260130_170303
2026-01-30 17:03:24,246 - dq_comparison - INFO - Source: Excel: product_master_9k.xlsx (product_master_9k) (8,999 rows)
2026-01-30 17:03:24,246 - dq_comparison - INFO - Target: CSV: product_master_10k.csv (10,000 rows)
2026-01-30 17:03:24,247 - dq_comparison - INFO - Selected columns: 13
2026-01-30 17:03:24,250 - dq_comparison - INFO - ----------------------------------------------------------------------
2026-01-30 17:03:24,251 - dq_comparison - INFO - 1️⃣ Row count match: ❌ No
2026-01-30 17:03:24,251 - dq_comparison - INFO -    Missing in target: 0 rows
2026-01-30 17:03:24,251 - dq_comparison - INFO -    Extra in target: 1,001 rows
2026-01-30 17:03:24,251 - dq_comparison - INFO - 2️⃣ Column structure match: ✅ Yes
2026-01-30 17:03:24,252 - dq_comparison - INFO - 3️ Primary key validation: ❌ Failed
2026-01-30 17:03:24,252 - dq_comparison - INFO -    Key fields: [{'source_column': 'ProductID', 'target_column': 'ProductID'}, {'source_column': 'Weight_kg', 'target_column': 'Weight_kg'}, {'source_column': 'ProductName', 'target_column': 'ProductName'}, {'source_column': 'Price', 'target_column': 'Price'}, {'source_column': 'Width_cm', 'target_column': 'Width_cm'}, {'source_column': 'Barcode', 'target_column': 'Barcode'}]
2026-01-30 17:03:24,252 - dq_comparison - INFO - 4️ Table metadata: ❌ Mismatch
2026-01-30 17:03:24,252 - dq_comparison - INFO -    • Row Count: 8999 vs 10000
2026-01-30 17:03:24,253 - dq_comparison - INFO - 5️⃣ Common rows (both Excel (product_master_9k.xlsx (product_master_9k)) and CSV (product_master_10k.csv)): 8,997 (99.98% of Excel (product_master_9k.xlsx (product_master_9k)))
2026-01-30 17:03:24,253 - dq_comparison - INFO - 6️⃣ Excel (product_master_9k.xlsx (product_master_9k))-only rows: 2 (present ONLY in Excel (product_master_9k.xlsx (product_master_9k)), NOT in CSV (product_master_10k.csv))
2026-01-30 17:03:24,253 - dq_comparison - INFO - 7️⃣ CSV (product_master_10k.csv)-only rows: 1,003 (present ONLY in CSV (product_master_10k.csv), NOT in Excel (product_master_9k.xlsx (product_master_9k)))
2026-01-30 17:03:24,253 - dq_comparison - INFO - 8️⃣ Column value mismatches: 0
2026-01-30 17:03:24,254 - dq_comparison - INFO - 9️ Data quality match: ❌ No
2026-01-30 17:03:24,254 - dq_comparison - INFO - 📈 DQ Score: 99.98%
2026-01-30 17:03:24,254 - dq_comparison - INFO - 📊 Calculation: (8,997 / 8,999) * 100 = 99.98%
2026-01-30 17:03:24,255 - dq_comparison - INFO - ======================================================================
2026-01-30 17:03:24,255 - dq_comparison - INFO - 
✅ HIGH MATCH! Minor differences only.
2026-01-30 17:03:24,255 - dq_comparison - INFO - 
🔍 NORMALIZATION APPLIED:
2026-01-30 17:03:24,256 - dq_comparison - INFO -    • NULL values → 'NULL' (consistent representation)
2026-01-30 17:03:24,256 - dq_comparison - INFO -    • Dates → YYYY-MM-DD format
2026-01-30 17:03:24,256 - dq_comparison - INFO -    • Strings → trimmed + lowercase
2026-01-30 17:03:24,257 - dq_comparison - INFO -    • Numeric values → standardized format
2026-01-30 17:03:24,257 - dq_comparison - INFO -    • Phone numbers → digits only, ALL leading zeros removed
2026-01-30 17:03:24,257 - dq_comparison - INFO -    • Extra whitespace removed
2026-01-30 17:03:24,257 - dq_comparison - INFO - 
🔍 DETAILED ERROR ANALYSIS:
2026-01-30 17:03:24,258 - dq_comparison - INFO - --------------------------------------------------
2026-01-30 17:03:24,258 - dq_comparison - INFO - 📊 SOURCE-ONLY ROWS: 2 rows
2026-01-30 17:03:24,258 - dq_comparison - INFO -    Present only in Excel (product_master_9k.xlsx (product_master_9k)), missing from CSV (product_master_10k.csv)
2026-01-30 17:03:24,258 - dq_comparison - INFO - 📊 TARGET-ONLY ROWS: 1,003 rows
2026-01-30 17:03:24,259 - dq_comparison - INFO -    Present only in CSV (product_master_10k.csv), extra (not in Excel (product_master_9k.xlsx (product_master_9k)))
2026-01-30 17:03:24,284 - dq_error_log - INFO - Retrieved 10 errors for session CMP_20260130_170303
2026-01-30 17:03:24,284 - dq_comparison - INFO - 
📋 SAMPLE ERRORS (10 found):
2026-01-30 17:03:24,285 - dq_comparison - INFO - 
1. Row 0 - Duplicate Primary Key
2026-01-30 17:03:24,286 - dq_comparison - INFO -    Column: Barcode
2026-01-30 17:03:24,287 - dq_comparison - INFO -    Primary key field 'Barcode' has 562 duplicates in source
2026-01-30 17:03:24,287 - dq_comparison - INFO - 
2. Row 0 - Duplicate Primary Key
2026-01-30 17:03:24,287 - dq_comparison - INFO -    Column: Barcode
2026-01-30 17:03:24,288 - dq_comparison - INFO -    Primary key field 'Barcode' has 642 duplicates in target
2026-01-30 17:03:24,288 - dq_comparison - INFO - 
3. Row 0 - Duplicate Primary Key
2026-01-30 17:03:24,288 - dq_comparison - INFO -    Column: Price
2026-01-30 17:03:24,288 - dq_comparison - INFO -    Primary key field 'Price' has 1201 duplicates in source
2026-01-30 17:03:24,289 - dq_comparison - INFO - 
💡 For complete error details, run:
2026-01-30 17:03:24,289 - dq_comparison - INFO -    USE dq_checks;
2026-01-30 17:03:24,289 - dq_comparison - INFO -    SELECT excel_row, column_name, error_type, error_description,
2026-01-30 17:03:24,290 - dq_comparison - INFO -           actual_value, expected_value
2026-01-30 17:03:24,290 - dq_comparison - INFO -    FROM dq_error_logs
2026-01-30 17:03:24,290 - dq_comparison - INFO -    WHERE session_id = 'CMP_20260130_170303'
2026-01-30 17:03:24,290 - dq_comparison - INFO -    ORDER BY excel_row, column_name;
2026-01-30 17:03:24,300 - dq_comparison - INFO - 
✅ Comparison completed! Session ID: CMP_20260130_170303
2026-01-30 17:03:24,330 - dq_error_log - INFO - Retrieved 100 error logs for session CMP_20260130_170303
2026-01-30 17:03:24,346 - dq_error_log - INFO - Retrieved summary: 1010 total errors for session CMP_20260130_170303
2026-01-30 17:03:24,346 - dq_audit - INFO - Audit class initialized with database: dq_checks
2026-01-30 17:03:24,357 - dq_audit - INFO - Retrieved 1 audit logs for session CMP_20260130_170303
2026-01-30 17:03:24,357 - dq_comparison - INFO - 
🔍 Final results verification:
2026-01-30 17:03:24,358 - dq_comparison - INFO -    Session ID: CMP_20260130_170303
2026-01-30 17:03:24,359 - dq_comparison - INFO -    DQ Score (Simple %): 99.98%
2026-01-30 17:03:24,359 - dq_comparison - INFO -    Source rows: 8999
2026-01-30 17:03:24,359 - dq_comparison - INFO -    Matched rows: 8997
2026-01-30 17:03:24,359 - dq_comparison - INFO -    Calculation: (8997 / 8999) * 100
2026-01-30 17:03:24,361 - __main__ - INFO - Source-Target Comparison completed successfully
2026-01-30 17:03:24,361 - __main__ - INFO - Displaying main menu options to user
2026-01-30 17:03:28,278 - __main__ - INFO - User selected option: 6
2026-01-30 17:03:28,278 - __main__ - INFO - User session ended. Duration: 0:00:53.531836
2026-01-30 17:03:28,279 - __main__ - INFO - 👋 Thank you for using Universal Data Quality Framework!
