2026-01-12 13:12:33,049 - root - INFO - CLI Mode Logging Initialized
2026-01-12 13:12:33,049 - root - INFO - CLI logs will be saved to: logs/dq_framework_20260112_131233.log
2026-01-12 13:12:33,050 - __main__ - INFO - 🚀 UNIVERSAL DATA QUALITY FRAMEWORK INITIALIZED
2026-01-12 13:12:33,051 - __main__ - INFO - Starting system resource check
2026-01-12 13:12:33,056 - __main__ - INFO - Total RAM: 15.7 GB
2026-01-12 13:12:33,056 - __main__ - INFO - Available RAM: 2.9 GB
2026-01-12 13:12:33,057 - __main__ - INFO - Memory used: 81.5%
2026-01-12 13:12:33,057 - __main__ - INFO - Memory status: OK
2026-01-12 13:12:33,058 - __main__ - INFO - Free disk space: 258.5 GB
2026-01-12 13:12:33,059 - __main__ - INFO - Disk used: 45.7%
2026-01-12 13:12:33,059 - __main__ - INFO - Disk space: OK
2026-01-12 13:12:33,560 - __main__ - INFO - CPU cores: 8
2026-01-12 13:12:33,561 - __main__ - INFO - CPU usage: 22.4%
2026-01-12 13:12:33,561 - __main__ - INFO - Python version: 3.12.4
2026-01-12 13:12:33,562 - __main__ - INFO - System platform: win32
2026-01-12 13:12:33,562 - __main__ - INFO - User session started at: 2026-01-12 13:12:33.562358
2026-01-12 13:12:33,563 - __main__ - INFO - Displaying main menu options to user
2026-01-12 13:12:34,863 - __main__ - INFO - User selected option: 2
2026-01-12 13:12:34,864 - __main__ - INFO - Starting Source-Target Comparison module
2026-01-12 13:12:34,868 - dq_comparison - INFO - STARTING UNIVERSAL SOURCE-TARGET COMPARISON TOOL
2026-01-12 13:12:34,869 - dq_comparison - INFO - LOADING SOURCE AND TARGET DATA
2026-01-12 13:12:34,869 - dq_comparison - INFO - 
==================================================
2026-01-12 13:12:34,870 - dq_comparison - INFO - 🔗 SOURCE DATA CONFIGURATION
2026-01-12 13:12:34,870 - dq_comparison - INFO - ==================================================
2026-01-12 13:12:43,448 - dq_comparison - INFO - 
🗄️ SOURCE DATABASE CONFIGURATION
2026-01-12 13:12:43,449 - dq_comparison - INFO - ----------------------------------------
2026-01-12 13:12:47,472 - dq_comparison - INFO - Selected database type code: postgresql
2026-01-12 13:12:48,815 - dq_comparison - INFO - User selected Browse and Select mode for SOURCE
2026-01-12 13:12:48,823 - dq_comparison - INFO - Converted 'postgresql' to 'postgres' for database_navigator compatibility
2026-01-12 13:12:48,823 - database_navigator - INFO - DatabaseNavigator initialized
2026-01-12 13:12:48,823 - database_navigator - INFO - Starting database navigation...
2026-01-12 13:12:48,823 - database_navigator - INFO - Database type: postgres
2026-01-12 13:12:48,824 - database_navigator - INFO - Getting database configuration...
2026-01-12 13:12:51,157 - database_navigator - INFO - Connecting to POSTGRES...
2026-01-12 13:12:51,158 - database_navigator - INFO - Connecting to PostgreSQL...
2026-01-12 13:12:51,159 - database_navigator - INFO - Connecting to PostgreSQL: host=localhost, port=5432, database=postgres, user=postgres
2026-01-12 13:12:51,310 - database_navigator - INFO - Connection object created: <connection object at 0x00000220CE393230; dsn: 'user=postgres password=xxx dbname=postgres host=localhost port=5432', closed: 0>
2026-01-12 13:12:51,312 - database_navigator - INFO - ✅ PostgreSQL connection successful to database: postgres
2026-01-12 13:12:51,315 - database_navigator - INFO - get_databases() called. db_type: postgres, connection exists: True
2026-01-12 13:12:51,342 - database_navigator - INFO - Raw rows: [('dq_checks',), ('finewise-testdb',), ('postgres',)]
2026-01-12 13:12:51,343 - database_navigator - INFO - Found 3 databases
2026-01-12 13:12:52,650 - database_navigator - INFO - Selected database: dq_checks
2026-01-12 13:12:52,651 - database_navigator - INFO - Reconnecting to PostgreSQL database: dq_checks
2026-01-12 13:12:52,652 - database_navigator - INFO - Connecting to POSTGRES...
2026-01-12 13:12:52,654 - database_navigator - INFO - Connecting to PostgreSQL...
2026-01-12 13:12:52,654 - database_navigator - INFO - Connecting to PostgreSQL: host=localhost, port=5432, database=dq_checks, user=postgres
2026-01-12 13:12:52,779 - database_navigator - INFO - Connection object created: <connection object at 0x00000220CE393340; dsn: 'user=postgres password=xxx dbname=dq_checks host=localhost port=5432', closed: 0>
2026-01-12 13:12:52,780 - database_navigator - INFO - ✅ PostgreSQL connection successful to database: dq_checks
2026-01-12 13:12:52,813 - database_navigator - INFO - Found 4 schemas
2026-01-12 13:12:54,251 - database_navigator - INFO - Selected schema: public
2026-01-12 13:12:54,255 - database_navigator - INFO - Ensuring connection to database: dq_checks for table list
2026-01-12 13:12:54,256 - database_navigator - INFO - Reconnecting to PostgreSQL database: dq_checks
2026-01-12 13:12:54,256 - database_navigator - INFO - Connecting to POSTGRES...
2026-01-12 13:12:54,257 - database_navigator - INFO - Connecting to PostgreSQL...
2026-01-12 13:12:54,257 - database_navigator - INFO - Connecting to PostgreSQL: host=localhost, port=5432, database=dq_checks, user=postgres
2026-01-12 13:12:54,380 - database_navigator - INFO - Connection object created: <connection object at 0x00000220CE393450; dsn: 'user=postgres password=xxx dbname=dq_checks host=localhost port=5432', closed: 0>
2026-01-12 13:12:54,381 - database_navigator - INFO - ✅ PostgreSQL connection successful to database: dq_checks
2026-01-12 13:12:54,382 - database_navigator - INFO - Connected to database: dq_checks, schema: public
2026-01-12 13:12:54,418 - database_navigator - INFO - Found 2 tables in dq_checks.public: ['customers', 'employee']
2026-01-12 13:12:54,418 - database_navigator - INFO - Found 2 tables in schema 'public'
2026-01-12 13:12:56,976 - database_navigator - INFO - Selected table: customers
2026-01-12 13:12:56,983 - database_navigator - INFO - Selection complete: {'type': 'postgresql', 'database': 'dq_checks', 'schema': 'public', 'table': 'customers', 'selection_mode': 'hierarchical', 'host': 'localhost', 'port': '5432', 'user': 'postgres', 'password': 'postgres'}
2026-01-12 13:12:56,983 - dq_comparison - INFO - Selected via navigation for SOURCE: dq_checks.public.customers
2026-01-12 13:12:56,984 - dq_unified - INFO - Loading data from DATABASE
2026-01-12 13:12:56,984 - dq_unified - INFO - Loading large database table: customers
2026-01-12 13:12:56,984 - dq_unified - INFO - Normalized DB config with schema: public
2026-01-12 13:12:57,220 - dq_unified - INFO - PostgreSQL table public.customers has 15 rows
2026-01-12 13:12:57,220 - dq_unified - INFO - Loading 15 rows from PostgreSQL...
2026-01-12 13:12:57,910 - dq_unified - INFO - Loaded 15 rows from PostgreSQL
2026-01-12 13:12:57,919 - dq_unified - INFO - Memory optimization: 0.0MB -> 0.0MB (Saved: 0.0MB)
2026-01-12 13:12:57,919 - dq_unified - INFO - Standardizing data types...
2026-01-12 13:12:57,923 - dq_unified - INFO - Data type standardization complete
2026-01-12 13:12:57,925 - dq_unified - INFO - Loaded 15 rows, 10 columns. Memory: 106.4MB total, 0.0MB for dataframe
2026-01-12 13:12:57,925 - dq_comparison - INFO - SOURCE database loaded: 15 rows, 10 columns
2026-01-12 13:12:57,925 - dq_comparison - INFO - 
==================================================
2026-01-12 13:12:57,926 - dq_comparison - INFO - 🔗 TARGET DATA CONFIGURATION
2026-01-12 13:12:57,927 - dq_comparison - INFO - ==================================================
2026-01-12 13:13:00,477 - dq_comparison - INFO - 
🗄️ TARGET DATABASE CONFIGURATION
2026-01-12 13:13:00,478 - dq_comparison - INFO - ----------------------------------------
2026-01-12 13:13:05,302 - dq_comparison - INFO - Selected database type code: mysql
2026-01-12 13:13:06,670 - dq_comparison - INFO - User selected Browse and Select mode for TARGET
2026-01-12 13:13:06,679 - database_navigator - INFO - DatabaseNavigator initialized
2026-01-12 13:13:06,679 - database_navigator - INFO - Starting database navigation...
2026-01-12 13:13:06,680 - database_navigator - INFO - Database type: mysql
2026-01-12 13:13:06,680 - database_navigator - INFO - Getting database configuration...
2026-01-12 13:13:08,416 - database_navigator - INFO - Connecting to MYSQL...
2026-01-12 13:13:08,464 - database_navigator - INFO - Successfully connected to MYSQL!
2026-01-12 13:13:08,467 - database_navigator - INFO - get_databases() called. db_type: mysql, connection exists: True
2026-01-12 13:13:08,475 - database_navigator - INFO - Found 13 databases
2026-01-12 13:13:10,915 - database_navigator - INFO - Selected database: dq_checks
2026-01-12 13:13:10,919 - database_navigator - INFO - Found 1 schemas
2026-01-12 13:13:12,151 - database_navigator - INFO - Selected schema: dq_checks
2026-01-12 13:13:12,161 - database_navigator - INFO - Found 7 tables in schema 'dq_checks'
2026-01-12 13:13:14,692 - database_navigator - INFO - Selected table: customers
2026-01-12 13:13:14,700 - database_navigator - INFO - Selection complete: {'type': 'mysql', 'database': 'dq_checks', 'schema': 'dq_checks', 'table': 'customers', 'selection_mode': 'hierarchical', 'host': 'localhost', 'port': '3306', 'user': 'root', 'password': 'root'}
2026-01-12 13:13:14,701 - dq_comparison - INFO - Selected via navigation for TARGET: dq_checks.dq_checks.customers
2026-01-12 13:13:14,701 - dq_unified - INFO - Loading data from DATABASE
2026-01-12 13:13:14,702 - dq_unified - INFO - Loading large database table: customers
2026-01-12 13:13:14,703 - dq_unified - INFO - Normalized DB config with schema: dq_checks
2026-01-12 13:13:14,719 - dq_unified - INFO - MySQL table customers has 15 rows
2026-01-12 13:13:14,719 - dq_unified - INFO - Loading 15 rows from MySQL...
2026-01-12 13:13:14,723 - dq_unified - INFO - Loaded 15 rows from MySQL
2026-01-12 13:13:14,726 - dq_unified - INFO - Memory optimization: 0.0MB -> 0.0MB (Saved: 0.0MB)
2026-01-12 13:13:14,727 - dq_unified - INFO - Standardizing data types...
2026-01-12 13:13:14,730 - dq_unified - INFO - Data type standardization complete
2026-01-12 13:13:14,732 - dq_unified - INFO - Loaded 15 rows, 10 columns. Memory: 110.9MB total, 0.0MB for dataframe
2026-01-12 13:13:14,732 - dq_comparison - INFO - TARGET database loaded: 15 rows, 10 columns
2026-01-12 13:13:14,733 - dq_comparison - INFO - SELECTING COLUMNS FOR COMPARISON
2026-01-12 13:13:14,733 - dq_comparison - INFO - Source columns (original): ['customername', 'email', 'phone', 'salary', 'department', 'joindate', 'postalcode', 'city', 'country', 'state']
2026-01-12 13:13:14,734 - dq_comparison - INFO - Target columns (original): ['CustomerName', 'Email', 'Phone', 'Salary', 'Department', 'JoinDate', 'PostalCode', 'City', 'Country', 'State']
2026-01-12 13:13:14,735 - dq_comparison - INFO - Common columns lowercased: ['customername', 'phone', 'postalcode', 'joindate', 'email', 'city', 'department', 'state', 'country', 'salary']
2026-01-12 13:13:14,735 - dq_comparison - INFO - Found 10 common columns between source and target (case-insensitive)
2026-01-12 13:13:14,736 - dq_comparison - INFO - 
📋 Common columns available for comparison:
2026-01-12 13:13:14,737 - dq_comparison - INFO -   1. customername (Source) ↔ CustomerName (Target)
2026-01-12 13:13:14,737 - dq_comparison - INFO -   2. phone (Source) ↔ Phone (Target)
2026-01-12 13:13:14,738 - dq_comparison - INFO -   3. postalcode (Source) ↔ PostalCode (Target)
2026-01-12 13:13:14,738 - dq_comparison - INFO -   4. joindate (Source) ↔ JoinDate (Target)
2026-01-12 13:13:14,738 - dq_comparison - INFO -   5. email (Source) ↔ Email (Target)
2026-01-12 13:13:14,739 - dq_comparison - INFO -   6. city (Source) ↔ City (Target)
2026-01-12 13:13:14,739 - dq_comparison - INFO -   7. department (Source) ↔ Department (Target)
2026-01-12 13:13:14,739 - dq_comparison - INFO -   8. state (Source) ↔ State (Target)
2026-01-12 13:13:14,740 - dq_comparison - INFO -   9. country (Source) ↔ Country (Target)
2026-01-12 13:13:14,740 - dq_comparison - INFO -   10. salary (Source) ↔ Salary (Target)
2026-01-12 13:13:16,350 - dq_comparison - INFO - User column selection input: all
2026-01-12 13:13:16,351 - dq_comparison - INFO - User selected ALL common columns for comparison
2026-01-12 13:13:16,353 - dq_comparison - INFO - GENERATING COMPREHENSIVE COMPARISON REPORT
2026-01-12 13:13:16,353 - dq_comparison - INFO - Report details - Source: Database: postgresql - dq_checks.customers, Target: Database: mysql - dq_checks.customers, Selected columns: 10
2026-01-12 13:13:16,354 - dq_comparison - INFO - Initializing Error Logger...
2026-01-12 13:13:16,354 - dq_error_log - INFO - ErrorLogger initialized with database: dq_checks
2026-01-12 13:13:16,378 - dq_error_log - INFO - Database connection successful
2026-01-12 13:13:16,379 - dq_comparison - INFO - Session ID: CMP_20260112_131316
2026-01-12 13:13:16,380 - dq_comparison - INFO - 
======================================================================
2026-01-12 13:13:16,382 - dq_comparison - INFO - 🔄 RUNNING SOURCE-TARGET COMPARISON WITH PERFECT NORMALIZATION
2026-01-12 13:13:16,383 - dq_comparison - INFO - ======================================================================
2026-01-12 13:13:16,383 - dq_comparison - INFO - Session ID: CMP_20260112_131316
2026-01-12 13:13:16,384 - dq_comparison - INFO - Source: Database: postgresql - dq_checks.customers
2026-01-12 13:13:16,385 - dq_comparison - INFO - Target: Database: mysql - dq_checks.customers
2026-01-12 13:13:16,385 - dq_comparison - INFO - Selected columns: 10
2026-01-12 13:13:16,386 - dq_comparison - INFO - ======================================================================
2026-01-12 13:13:16,386 - dq_comparison - INFO - 
1️⃣ FIRST: ROW COUNT CHECK
2026-01-12 13:13:16,387 - dq_comparison - INFO - ✅ Row counts match: 15 rows
2026-01-12 13:13:16,387 - dq_comparison - INFO - 
2️⃣ COLUMN STRUCTURE COMPARISON
2026-01-12 13:13:16,388 - dq_comparison - INFO - Comparing column structures...
2026-01-12 13:13:16,388 - dq_comparison - INFO - Column structure comparison complete. Match: False
2026-01-12 13:13:16,543 - dq_comparison - INFO - 
3️⃣ PRIMARY KEY VALIDATION
2026-01-12 13:13:16,543 - dq_comparison - INFO - Validating primary key/unique fields...
2026-01-12 13:13:16,545 - dq_comparison - INFO - Checking key fields: ['postalcode']
2026-01-12 13:13:16,547 - dq_comparison - WARNING - No key fields found in both datasets
2026-01-12 13:13:16,563 - dq_comparison - INFO -    No key fields specified or detected
2026-01-12 13:13:16,564 - dq_comparison - INFO -    Column names match: ❌
2026-01-12 13:13:16,564 - dq_comparison - INFO -    Column order match: ❌
2026-01-12 13:13:16,566 - dq_comparison - INFO -    Data types match: ✅
2026-01-12 13:13:16,566 - dq_comparison - WARNING -    Missing in target: ['customername', 'email', 'phone', 'salary', 'department', 'joindate', 'postalcode', 'city', 'country', 'state']
2026-01-12 13:13:16,566 - dq_comparison - WARNING -    Missing in source: ['CustomerName', 'Email', 'Phone', 'Salary', 'Department', 'JoinDate', 'PostalCode', 'City', 'Country', 'State']
2026-01-12 13:13:16,567 - dq_comparison - INFO - 
4️⃣ TABLE METADATA COMPARISON
2026-01-12 13:13:16,567 - dq_comparison - INFO - Comparing table-level metadata...
2026-01-12 13:13:16,580 - dq_comparison - INFO - Table metadata comparison complete. Match: False
2026-01-12 13:13:16,580 - dq_comparison - INFO -    Table metadata match: ❌
2026-01-12 13:13:16,581 - dq_comparison - INFO -    Source: 15 rows, 10 cols, 0.0 MB
2026-01-12 13:13:16,581 - dq_comparison - INFO -    Target: 15 rows, 10 cols, 0.0 MB
2026-01-12 13:13:16,581 - dq_comparison - INFO - 
5️⃣ HASH-BASED COMPARISON
2026-01-12 13:13:16,581 - dq_comparison - INFO - ℹ️  Note: All NULL values normalized to 'NULL'
2026-01-12 13:13:16,582 - dq_comparison - INFO - ℹ️  Note: Dates normalized to YYYY-MM-DD
2026-01-12 13:13:16,582 - dq_comparison - INFO - ℹ️  Note: Strings trimmed and case-normalized
2026-01-12 13:13:16,583 - dq_comparison - INFO - ℹ️  Note: Phone numbers stripped to digits only, leading zeros removed
2026-01-12 13:13:16,583 - dq_comparison - INFO - SECOND CHECK: HASH-BASED COMPARISON WITH PERFECT NORMALIZATION
2026-01-12 13:13:16,590 - dq_comparison - INFO - === DEBUG: DATA TYPE CHECK ===
2026-01-12 13:13:16,590 - dq_comparison - INFO - Column: customername
2026-01-12 13:13:16,591 - dq_comparison - INFO -   Source type: <class 'str'>, value: John Doe
2026-01-12 13:13:16,591 - dq_comparison - INFO -   Target type: <class 'str'>, value: John Doe
2026-01-12 13:13:16,592 - dq_comparison - INFO -   Normalized: 'john doe' vs 'john doe'
2026-01-12 13:13:16,595 - dq_comparison - INFO -   Match: True
2026-01-12 13:13:16,595 - dq_comparison - INFO - Column: phone
2026-01-12 13:13:16,595 - dq_comparison - INFO -   Source type: <class 'numpy.int64'>, value: 1234567890
2026-01-12 13:13:16,596 - dq_comparison - INFO -   Target type: <class 'numpy.int64'>, value: 1234567890
2026-01-12 13:13:16,596 - dq_comparison - INFO -   Normalized: '1234567890' vs '1234567890'
2026-01-12 13:13:16,597 - dq_comparison - INFO -   Match: True
2026-01-12 13:13:16,597 - dq_comparison - INFO - Column: postalcode
2026-01-12 13:13:16,597 - dq_comparison - INFO -   Source type: <class 'numpy.float64'>, value: 10001.0
2026-01-12 13:13:16,598 - dq_comparison - INFO -   Target type: <class 'numpy.float64'>, value: 10001.0
2026-01-12 13:13:16,599 - dq_comparison - INFO -   Normalized: '10001' vs '10001'
2026-01-12 13:13:16,599 - dq_comparison - INFO -   Match: True
2026-01-12 13:13:16,599 - dq_comparison - INFO - Source DF columns: ['customername', 'email', 'phone', 'salary', 'department', 'joindate', 'postalcode', 'city', 'country', 'state']
2026-01-12 13:13:16,600 - dq_comparison - INFO - Target DF columns: ['CustomerName', 'Email', 'Phone', 'Salary', 'Department', 'JoinDate', 'PostalCode', 'City', 'Country', 'State']
2026-01-12 13:13:16,600 - dq_comparison - INFO - Selected columns for comparison: ['customername', 'phone', 'postalcode', 'joindate', 'email', 'city', 'department', 'state', 'country', 'salary']
2026-01-12 13:13:16,601 - dq_comparison - INFO - Using 10 common columns for hash comparison
2026-01-12 13:13:16,601 - dq_comparison - INFO - Source columns: ['customername', 'phone', 'postalcode', 'joindate', 'email', 'city', 'department', 'state', 'country', 'salary']
2026-01-12 13:13:16,601 - dq_comparison - INFO - Target columns: ['CustomerName', 'Phone', 'PostalCode', 'JoinDate', 'Email', 'City', 'Department', 'State', 'Country', 'Salary']
2026-01-12 13:13:16,602 - dq_comparison - INFO - Generating hashes for source data (15 rows)...
2026-01-12 13:13:16,604 - dq_comparison - INFO - DEBUG HASH ROW: customername: 'John Doe' -> 'john doe' | phone: '1234567890' -> '1234567890' | postalcode: '10001.0' -> '10001' | joindate: '1673740800000000000' -> '2023-01-15' | email: 'john@email.com' -> 'john@email.com'
2026-01-12 13:13:16,604 - dq_comparison - INFO - DEBUG HASH STRING: john doe|1234567890|10001|2023-01-15|john@email.com...
2026-01-12 13:13:16,604 - dq_comparison - INFO - DEBUG HASH RESULT: ed6a1566...
2026-01-12 13:13:16,605 - dq_comparison - INFO - DEBUG HASH ROW: customername: 'Jane Smith' -> 'jane smith' | phone: '9876543210' -> '9876543210' | postalcode: '10002.0' -> '10002' | joindate: '1676851200000000000' -> '2023-02-20' | email: 'jane@email.com' -> 'jane@email.com'
2026-01-12 13:13:16,605 - dq_comparison - INFO - DEBUG HASH STRING: jane smith|9876543210|10002|2023-02-20|jane@email.com...
2026-01-12 13:13:16,606 - dq_comparison - INFO - DEBUG HASH RESULT: e1fce4b2...
2026-01-12 13:13:16,606 - dq_comparison - INFO - DEBUG HASH ROW: customername: 'Bob Johnson' -> 'bob johnson' | phone: '5551234567' -> '5551234567' | postalcode: '10003.0' -> '10003' | joindate: '1678406400000000000' -> '2023-03-10' | email: 'None' -> 'NULL'
2026-01-12 13:13:16,606 - dq_comparison - INFO - DEBUG HASH STRING: bob johnson|5551234567|10003|2023-03-10|NULL...
2026-01-12 13:13:16,606 - dq_comparison - INFO - DEBUG HASH RESULT: 1cc6ba96...
2026-01-12 13:13:16,607 - dq_comparison - INFO - DEBUG HASH ROW: customername: 'Alice Brown' -> 'alice brown' | phone: '4445556666' -> '4445556666' | postalcode: '10004.0' -> '10004' | joindate: '1673740800000000000' -> '2023-01-15' | email: 'alice@email.com' -> 'alice@email.com'
2026-01-12 13:13:16,607 - dq_comparison - INFO - DEBUG HASH STRING: alice brown|4445556666|10004|2023-01-15|alice@email.com...
2026-01-12 13:13:16,607 - dq_comparison - INFO - DEBUG HASH RESULT: 34ad8ddb...
2026-01-12 13:13:16,608 - dq_comparison - INFO - DEBUG HASH ROW: customername: 'Charlie Wilson' -> 'charlie wilson' | phone: '3334445555' -> '3334445555' | postalcode: '10005.0' -> '10005' | joindate: '1680652800000000000' -> '2023-04-05' | email: 'charlie@email.com' -> 'charlie@email.com'
2026-01-12 13:13:16,612 - dq_comparison - INFO - DEBUG HASH STRING: charlie wilson|3334445555|10005|2023-04-05|charlie@email.com...
2026-01-12 13:13:16,612 - dq_comparison - INFO - DEBUG HASH RESULT: 19b50cd5...
2026-01-12 13:13:16,613 - dq_comparison - INFO - DEBUG HASH ROW: customername: 'John Doe' -> 'john doe' | phone: '1234567890' -> '1234567890' | postalcode: '10001.0' -> '10001' | joindate: '1673740800000000000' -> '2023-01-15' | email: 'john@email.com' -> 'john@email.com'
2026-01-12 13:13:16,613 - dq_comparison - INFO - DEBUG HASH STRING: john doe|1234567890|10001|2023-01-15|john@email.com...
2026-01-12 13:13:16,613 - dq_comparison - INFO - DEBUG HASH RESULT: ed6a1566...
2026-01-12 13:13:16,614 - dq_comparison - INFO - DEBUG HASH ROW: customername: 'David Lee' -> 'david lee' | phone: '2223334444' -> '2223334444' | postalcode: '10006.0' -> '10006' | joindate: '1683849600000000000' -> '2023-05-12' | email: 'david@email.com' -> 'david@email.com'
2026-01-12 13:13:16,614 - dq_comparison - INFO - DEBUG HASH STRING: david lee|2223334444|10006|2023-05-12|david@email.com...
2026-01-12 13:13:16,614 - dq_comparison - INFO - DEBUG HASH RESULT: c46b8c8b...
2026-01-12 13:13:16,615 - dq_comparison - INFO - DEBUG HASH ROW: customername: 'Sarah Chen' -> 'sarah chen' | phone: '1112223333' -> '1112223333' | postalcode: '10007.0' -> '10007' | joindate: '1687046400000000000' -> '2023-06-18' | email: 'sarah@email.com' -> 'sarah@email.com'
2026-01-12 13:13:16,615 - dq_comparison - INFO - DEBUG HASH STRING: sarah chen|1112223333|10007|2023-06-18|sarah@email.com...
2026-01-12 13:13:16,615 - dq_comparison - INFO - DEBUG HASH RESULT: de4cf9ae...
2026-01-12 13:13:16,616 - dq_comparison - INFO - DEBUG HASH ROW: customername: 'Mike Davis' -> 'mike davis' | phone: '9998887777' -> '9998887777' | postalcode: 'nan' -> 'NULL' | joindate: '1689984000000000000' -> '2023-07-22' | email: 'invalid-email' -> 'invalid-email'
2026-01-12 13:13:16,616 - dq_comparison - INFO - DEBUG HASH STRING: mike davis|9998887777|NULL|2023-07-22|invalid-email...
2026-01-12 13:13:16,616 - dq_comparison - INFO - DEBUG HASH RESULT: 79bea8dc...
2026-01-12 13:13:16,617 - dq_comparison - INFO - DEBUG HASH ROW: customername: 'Lisa Wang' -> 'lisa wang' | phone: '6667778888' -> '6667778888' | postalcode: '10008.0' -> '10008' | joindate: '1693353600000000000' -> '2023-08-30' | email: 'lisa@email.com' -> 'lisa@email.com'
2026-01-12 13:13:16,617 - dq_comparison - INFO - DEBUG HASH STRING: lisa wang|6667778888|10008|2023-08-30|lisa@email.com...
2026-01-12 13:13:16,617 - dq_comparison - INFO - DEBUG HASH RESULT: ccf89fa4...
2026-01-12 13:13:16,618 - dq_comparison - INFO - DEBUG HASH ROW: customername: 'Tom Wilson' -> 'tom wilson' | phone: '7778889999' -> '7778889999' | postalcode: '10009.0' -> '10009' | joindate: '1694304000000000000' -> '2023-09-10' | email: 'tom@email.com' -> 'tom@email.com'
2026-01-12 13:13:16,618 - dq_comparison - INFO - DEBUG HASH STRING: tom wilson|7778889999|10009|2023-09-10|tom@email.com...
2026-01-12 13:13:16,619 - dq_comparison - INFO - DEBUG HASH RESULT: eb3a5af5...
2026-01-12 13:13:16,619 - dq_comparison - INFO - DEBUG HASH ROW: customername: 'None' -> 'NULL' | phone: '8889990000' -> '8889990000' | postalcode: '10010.0' -> '10010' | joindate: '1697328000000000000' -> '2023-10-15' | email: 'empty@email.com' -> 'empty@email.com'
2026-01-12 13:13:16,619 - dq_comparison - INFO - DEBUG HASH STRING: NULL|8889990000|10010|2023-10-15|empty@email.com...
2026-01-12 13:13:16,620 - dq_comparison - INFO - DEBUG HASH RESULT: ed51f1b5...
2026-01-12 13:13:16,620 - dq_comparison - INFO - DEBUG HASH ROW: customername: 'Robert Brown' -> 'robert brown' | phone: '9990001111' -> '9990001111' | postalcode: '10011.0' -> '10011' | joindate: '1700438400000000000' -> '2023-11-20' | email: 'robert@email.com' -> 'robert@email.com'
2026-01-12 13:13:16,621 - dq_comparison - INFO - DEBUG HASH STRING: robert brown|9990001111|10011|2023-11-20|robert@email.com...
2026-01-12 13:13:16,621 - dq_comparison - INFO - DEBUG HASH RESULT: 1fd90651...
2026-01-12 13:13:16,622 - dq_comparison - INFO - DEBUG HASH ROW: customername: 'Nancy Davis' -> 'nancy davis' | phone: '1112222' -> '1112222' | postalcode: '10012.0' -> '10012' | joindate: '1701734400000000000' -> '2023-12-05' | email: 'nancy@email.com' -> 'nancy@email.com'
2026-01-12 13:13:16,622 - dq_comparison - INFO - DEBUG HASH STRING: nancy davis|1112222|10012|2023-12-05|nancy@email.com...
2026-01-12 13:13:16,622 - dq_comparison - INFO - DEBUG HASH RESULT: 5e0971cd...
2026-01-12 13:13:16,623 - dq_comparison - INFO - DEBUG HASH ROW: customername: 'Kevin Lee' -> 'kevin lee' | phone: '1112223333' -> '1112223333' | postalcode: '10013.0' -> '10013' | joindate: '1704844800000000000' -> '2024-01-10' | email: 'kevin@email.com' -> 'kevin@email.com'
2026-01-12 13:13:16,623 - dq_comparison - INFO - DEBUG HASH STRING: kevin lee|1112223333|10013|2024-01-10|kevin@email.com...
2026-01-12 13:13:16,623 - dq_comparison - INFO - DEBUG HASH RESULT: 712e8b9d...
2026-01-12 13:13:16,624 - dq_comparison - INFO - === DEBUG: SAMPLE HASHES ===
2026-01-12 13:13:16,627 - dq_comparison - INFO - Hash 1: ed6a1566788c25f7... (sample row 0)
2026-01-12 13:13:16,627 - dq_comparison - INFO - Hash 2: e1fce4b28d1696d8... (sample row 1)
2026-01-12 13:13:16,628 - dq_comparison - INFO - Hash 3: 1cc6ba96dfc4a278... (sample row 2)
2026-01-12 13:13:16,628 - dq_comparison - INFO - Generating hashes for target data (15 rows)...
2026-01-12 13:13:16,631 - dq_comparison - INFO - 
======================================================================
2026-01-12 13:13:16,631 - dq_comparison - INFO - 🔍 DEBUG: ANALYZING WHY HASHES DON'T MATCH
2026-01-12 13:13:16,632 - dq_comparison - INFO - ======================================================================
2026-01-12 13:13:16,632 - dq_comparison - INFO - 
--- Analyzing Row 0 ---
2026-01-12 13:13:16,633 - dq_comparison - INFO - Column 'customername' → 'CustomerName':
2026-01-12 13:13:16,633 - dq_comparison - INFO -   Source: 'John Doe' (type: str) → 'john doe'
2026-01-12 13:13:16,633 - dq_comparison - INFO -   Target: 'John Doe' (type: str) → 'john doe'
2026-01-12 13:13:16,634 - dq_comparison - INFO -   Match after normalization: ✅ YES
2026-01-12 13:13:16,634 - dq_comparison - INFO - Column 'phone' → 'Phone':
2026-01-12 13:13:16,635 - dq_comparison - INFO -   Source: '1234567890' (type: int64) → '1234567890'
2026-01-12 13:13:16,635 - dq_comparison - INFO -   Target: '1234567890' (type: int64) → '1234567890'
2026-01-12 13:13:16,635 - dq_comparison - INFO -   Match after normalization: ✅ YES
2026-01-12 13:13:16,636 - dq_comparison - INFO - Column 'postalcode' → 'PostalCode':
2026-01-12 13:13:16,636 - dq_comparison - INFO -   Source: '10001.0' (type: float64) → '10001'
2026-01-12 13:13:16,637 - dq_comparison - INFO -   Target: '10001.0' (type: float64) → '10001'
2026-01-12 13:13:16,637 - dq_comparison - INFO -   Match after normalization: ✅ YES
2026-01-12 13:13:16,637 - dq_comparison - INFO - Column 'joindate' → 'JoinDate':
2026-01-12 13:13:16,637 - dq_comparison - INFO -   Source: '1673740800000000000' (type: int64) → '2023-01-15'
2026-01-12 13:13:16,638 - dq_comparison - INFO -   Target: '1673740800000000000' (type: int64) → '2023-01-15'
2026-01-12 13:13:16,638 - dq_comparison - INFO -   Match after normalization: ✅ YES
2026-01-12 13:13:16,638 - dq_comparison - INFO - Column 'email' → 'Email':
2026-01-12 13:13:16,638 - dq_comparison - INFO -   Source: 'john@email.com' (type: str) → 'john@email.com'
2026-01-12 13:13:16,639 - dq_comparison - INFO -   Target: 'john@email.com' (type: str) → 'john@email.com'
2026-01-12 13:13:16,639 - dq_comparison - INFO -   Match after normalization: ✅ YES
2026-01-12 13:13:16,639 - dq_comparison - INFO - 
Hash components for Row 0:
2026-01-12 13:13:16,639 - dq_comparison - INFO - Source hash string start: john doe|1234567890|10001...
2026-01-12 13:13:16,639 - dq_comparison - INFO - Target hash string start: john doe|1234567890|10001...
2026-01-12 13:13:16,639 - dq_comparison - INFO - Same? ✅ YES
2026-01-12 13:13:16,640 - dq_comparison - INFO - 
--- Analyzing Row 1 ---
2026-01-12 13:13:16,643 - dq_comparison - INFO - Column 'customername' → 'CustomerName':
2026-01-12 13:13:16,643 - dq_comparison - INFO -   Source: 'Jane Smith' (type: str) → 'jane smith'
2026-01-12 13:13:16,644 - dq_comparison - INFO -   Target: 'Jane Smith' (type: str) → 'jane smith'
2026-01-12 13:13:16,644 - dq_comparison - INFO -   Match after normalization: ✅ YES
2026-01-12 13:13:16,644 - dq_comparison - INFO - Column 'phone' → 'Phone':
2026-01-12 13:13:16,644 - dq_comparison - INFO -   Source: '9876543210' (type: int64) → '9876543210'
2026-01-12 13:13:16,645 - dq_comparison - INFO -   Target: '9876543210' (type: int64) → '9876543210'
2026-01-12 13:13:16,645 - dq_comparison - INFO -   Match after normalization: ✅ YES
2026-01-12 13:13:16,645 - dq_comparison - INFO - Column 'postalcode' → 'PostalCode':
2026-01-12 13:13:16,645 - dq_comparison - INFO -   Source: '10002.0' (type: float64) → '10002'
2026-01-12 13:13:16,646 - dq_comparison - INFO -   Target: '10002.0' (type: float64) → '10002'
2026-01-12 13:13:16,646 - dq_comparison - INFO -   Match after normalization: ✅ YES
2026-01-12 13:13:16,646 - dq_comparison - INFO - Column 'joindate' → 'JoinDate':
2026-01-12 13:13:16,646 - dq_comparison - INFO -   Source: '1676851200000000000' (type: int64) → '2023-02-20'
2026-01-12 13:13:16,647 - dq_comparison - INFO -   Target: '1676851200000000000' (type: int64) → '2023-02-20'
2026-01-12 13:13:16,647 - dq_comparison - INFO -   Match after normalization: ✅ YES
2026-01-12 13:13:16,647 - dq_comparison - INFO - Column 'email' → 'Email':
2026-01-12 13:13:16,647 - dq_comparison - INFO -   Source: 'jane@email.com' (type: str) → 'jane@email.com'
2026-01-12 13:13:16,648 - dq_comparison - INFO -   Target: 'jane@email.com' (type: str) → 'jane@email.com'
2026-01-12 13:13:16,648 - dq_comparison - INFO -   Match after normalization: ✅ YES
2026-01-12 13:13:16,648 - dq_comparison - INFO - 
Hash components for Row 1:
2026-01-12 13:13:16,648 - dq_comparison - INFO - Source hash string start: jane smith|9876543210|10002...
2026-01-12 13:13:16,649 - dq_comparison - INFO - Target hash string start: jane smith|9876543210|10002...
2026-01-12 13:13:16,649 - dq_comparison - INFO - Same? ✅ YES
2026-01-12 13:13:16,649 - dq_comparison - INFO - 
--- Analyzing Row 2 ---
2026-01-12 13:13:16,650 - dq_comparison - INFO - Column 'customername' → 'CustomerName':
2026-01-12 13:13:16,650 - dq_comparison - INFO -   Source: 'Bob Johnson' (type: str) → 'bob johnson'
2026-01-12 13:13:16,650 - dq_comparison - INFO -   Target: 'Bob Johnson' (type: str) → 'bob johnson'
2026-01-12 13:13:16,650 - dq_comparison - INFO -   Match after normalization: ✅ YES
2026-01-12 13:13:16,650 - dq_comparison - INFO - Column 'phone' → 'Phone':
2026-01-12 13:13:16,651 - dq_comparison - INFO -   Source: '5551234567' (type: int64) → '5551234567'
2026-01-12 13:13:16,651 - dq_comparison - INFO -   Target: '5551234567' (type: int64) → '5551234567'
2026-01-12 13:13:16,651 - dq_comparison - INFO -   Match after normalization: ✅ YES
2026-01-12 13:13:16,652 - dq_comparison - INFO - Column 'postalcode' → 'PostalCode':
2026-01-12 13:13:16,652 - dq_comparison - INFO -   Source: '10003.0' (type: float64) → '10003'
2026-01-12 13:13:16,652 - dq_comparison - INFO -   Target: '10003.0' (type: float64) → '10003'
2026-01-12 13:13:16,653 - dq_comparison - INFO -   Match after normalization: ✅ YES
2026-01-12 13:13:16,653 - dq_comparison - INFO - Column 'joindate' → 'JoinDate':
2026-01-12 13:13:16,653 - dq_comparison - INFO -   Source: '1678406400000000000' (type: int64) → '2023-03-10'
2026-01-12 13:13:16,653 - dq_comparison - INFO -   Target: '1678406400000000000' (type: int64) → '2023-03-10'
2026-01-12 13:13:16,654 - dq_comparison - INFO -   Match after normalization: ✅ YES
2026-01-12 13:13:16,654 - dq_comparison - INFO - Column 'email' → 'Email':
2026-01-12 13:13:16,654 - dq_comparison - INFO -   Source: 'None' (type: NoneType) → 'NULL'
2026-01-12 13:13:16,654 - dq_comparison - INFO -   Target: '' (type: str) → 'NULL'
2026-01-12 13:13:16,655 - dq_comparison - INFO -   Match after normalization: ✅ YES
2026-01-12 13:13:16,658 - dq_comparison - INFO - 
Hash components for Row 2:
2026-01-12 13:13:16,659 - dq_comparison - INFO - Source hash string start: bob johnson|5551234567|10003...
2026-01-12 13:13:16,659 - dq_comparison - INFO - Target hash string start: bob johnson|5551234567|10003...
2026-01-12 13:13:16,660 - dq_comparison - INFO - Same? ✅ YES
2026-01-12 13:13:16,660 - dq_comparison - INFO - 
--- Column Data Types Analysis ---
2026-01-12 13:13:16,660 - dq_comparison - INFO - Column 1: 'customername' (object) ↔ 'CustomerName' (object)
2026-01-12 13:13:16,661 - dq_comparison - INFO -   Sample: Source='John Doe', Target='John Doe'
2026-01-12 13:13:16,661 - dq_comparison - INFO - Column 2: 'phone' (int64) ↔ 'Phone' (int64)
2026-01-12 13:13:16,661 - dq_comparison - INFO -   Sample: Source='1234567890', Target='1234567890'
2026-01-12 13:13:16,662 - dq_comparison - INFO - Column 3: 'postalcode' (float64) ↔ 'PostalCode' (float64)
2026-01-12 13:13:16,662 - dq_comparison - INFO -   Sample: Source='10001.0', Target='10001.0'
2026-01-12 13:13:16,662 - dq_comparison - INFO - Column 4: 'joindate' (int64) ↔ 'JoinDate' (int64)
2026-01-12 13:13:16,662 - dq_comparison - INFO -   Sample: Source='1673740800000000000', Target='1673740800000000000'
2026-01-12 13:13:16,663 - dq_comparison - INFO - Column 5: 'email' (object) ↔ 'Email' (object)
2026-01-12 13:13:16,663 - dq_comparison - INFO -   Sample: Source='john@email.com', Target='john@email.com'
2026-01-12 13:13:16,663 - dq_comparison - INFO - === DEBUG: DIRECT ROW COMPARISON ===
2026-01-12 13:13:16,663 - dq_comparison - INFO - --- Comparing Row 0 ---
2026-01-12 13:13:16,664 - dq_comparison - INFO -   ✅ customername: 'John Doe' → 'john doe' vs 'John Doe' → 'john doe'
2026-01-12 13:13:16,664 - dq_comparison - INFO -   ✅ phone: '1234567890' → '1234567890' vs '1234567890' → '1234567890'
2026-01-12 13:13:16,665 - dq_comparison - INFO -   ✅ postalcode: '10001.0' → '10001' vs '10001.0' → '10001'
2026-01-12 13:13:16,665 - dq_comparison - INFO -   ✅ joindate: '1673740800000000000' → '2023-01-15' vs '1673740800000000000' → '2023-01-15'
2026-01-12 13:13:16,665 - dq_comparison - INFO -   ✅ email: 'john@email.com' → 'john@email.com' vs 'john@email.com' → 'john@email.com'
2026-01-12 13:13:16,665 - dq_comparison - INFO - --- Comparing Row 1 ---
2026-01-12 13:13:16,666 - dq_comparison - INFO -   ✅ customername: 'Jane Smith' → 'jane smith' vs 'Jane Smith' → 'jane smith'
2026-01-12 13:13:16,666 - dq_comparison - INFO -   ✅ phone: '9876543210' → '9876543210' vs '9876543210' → '9876543210'
2026-01-12 13:13:16,666 - dq_comparison - INFO -   ✅ postalcode: '10002.0' → '10002' vs '10002.0' → '10002'
2026-01-12 13:13:16,666 - dq_comparison - INFO -   ✅ joindate: '1676851200000000000' → '2023-02-20' vs '1676851200000000000' → '2023-02-20'
2026-01-12 13:13:16,666 - dq_comparison - INFO -   ✅ email: 'jane@email.com' → 'jane@email.com' vs 'jane@email.com' → 'jane@email.com'
2026-01-12 13:13:16,667 - dq_comparison - INFO - --- Comparing Row 2 ---
2026-01-12 13:13:16,667 - dq_comparison - INFO -   ✅ customername: 'Bob Johnson' → 'bob johnson' vs 'Bob Johnson' → 'bob johnson'
2026-01-12 13:13:16,667 - dq_comparison - INFO -   ✅ phone: '5551234567' → '5551234567' vs '5551234567' → '5551234567'
2026-01-12 13:13:16,668 - dq_comparison - INFO -   ✅ postalcode: '10003.0' → '10003' vs '10003.0' → '10003'
2026-01-12 13:13:16,668 - dq_comparison - INFO -   ✅ joindate: '1678406400000000000' → '2023-03-10' vs '1678406400000000000' → '2023-03-10'
2026-01-12 13:13:16,668 - dq_comparison - INFO -   ✅ email: 'None' → 'NULL' vs '' → 'NULL'
2026-01-12 13:13:16,668 - dq_comparison - INFO - Hash-based Comparison Results (with duplicate handling):
2026-01-12 13:13:16,669 - dq_comparison - INFO -   • Unique source hashes: 14
2026-01-12 13:13:16,669 - dq_comparison - INFO -   • Unique target hashes: 14
2026-01-12 13:13:16,669 - dq_comparison - INFO -   • Common hashes: 14
2026-01-12 13:13:16,669 - dq_comparison - INFO -   • Common rows (counting duplicates): 15
2026-01-12 13:13:16,669 - dq_comparison - INFO -   • Rows only in source (counting duplicates): 0
2026-01-12 13:13:16,669 - dq_comparison - INFO -   • Rows only in target (counting duplicates): 0
2026-01-12 13:13:16,677 - dq_comparison - INFO - HASH-ONLY COMPARISON COMPLETED
2026-01-12 13:13:16,677 - dq_comparison - INFO - Returning counts for simple scoring:
2026-01-12 13:13:16,677 - dq_comparison - INFO -   Common rows: 15
2026-01-12 13:13:16,677 - dq_comparison - INFO -   Unique to source: 0
2026-01-12 13:13:16,677 - dq_comparison - INFO -   Unique to target: 0
2026-01-12 13:13:16,677 - dq_comparison - INFO -   Value mismatches: 0
2026-01-12 13:13:16,677 - dq_comparison - INFO -   Missing rows: 0
2026-01-12 13:13:16,677 - dq_comparison - INFO -   Extra rows: 0
2026-01-12 13:13:16,678 - dq_comparison - INFO - 
6️⃣ DATA QUALITY ANALYSIS
2026-01-12 13:13:16,678 - dq_comparison - INFO - Analyzing data quality metrics...
2026-01-12 13:13:16,690 - dq_comparison - INFO - Null values - Source: 7 (4.67%), Target: 6 (4.00%)
2026-01-12 13:13:16,707 - dq_comparison - INFO - Duplicate rows (normalized) - Source: 1, Target: 1
2026-01-12 13:13:16,709 - dq_comparison - INFO - Source duplicate samples: ['Row 2', 'Row 7']
2026-01-12 13:13:16,710 - dq_comparison - INFO - Target duplicate samples: ['Row 2', 'Row 7']
2026-01-12 13:13:16,722 - dq_error_log - INFO - Retrieved 12 error logs for session CMP_20260112_131316
2026-01-12 13:13:16,723 - dq_comparison - INFO - 
📊 SIMPLE SCORING CALCULATION:
2026-01-12 13:13:16,723 - dq_comparison - INFO -   Source rows: 15
2026-01-12 13:13:16,723 - dq_comparison - INFO -   Common rows (matched): 15
2026-01-12 13:13:16,724 - dq_comparison - INFO -   Calculation: (15 / 15) * 100 = 100.00%
2026-01-12 13:13:16,724 - dq_comparison - INFO -   Explanation: 15 matched rows out of 15 total source rows
2026-01-12 13:13:16,724 - dq_comparison - INFO - 
=== AUDIT LOGGING SECTION ===
2026-01-12 13:13:16,728 - dq_comparison - INFO - 🔍 Audit logging is ENABLED in APP_SETTINGS
2026-01-12 13:13:16,729 - dq_audit - INFO - Audit class initialized with database: dq_checks
2026-01-12 13:13:16,729 - dq_comparison - INFO - Attempting to log audit record for session: CMP_20260112_131316
2026-01-12 13:13:16,730 - dq_audit - INFO - Starting database insertion for comparison...
2026-01-12 13:13:16,745 - dq_audit - INFO - Inserted comparison record with ID: 638
2026-01-12 13:13:16,745 - dq_comparison - INFO - ✅ Audit record logged successfully (ID: 638)
2026-01-12 13:13:16,745 - dq_comparison - INFO - 
======================================================================
2026-01-12 13:13:16,746 - dq_comparison - INFO - 📊 COMPARISON RESULTS SUMMARY
2026-01-12 13:13:16,746 - dq_comparison - INFO - ======================================================================
2026-01-12 13:13:16,746 - dq_comparison - INFO - Session ID: CMP_20260112_131316
2026-01-12 13:13:16,746 - dq_comparison - INFO - Source: Database: postgresql - dq_checks.customers (15 rows)
2026-01-12 13:13:16,746 - dq_comparison - INFO - Target: Database: mysql - dq_checks.customers (15 rows)
2026-01-12 13:13:16,747 - dq_comparison - INFO - Selected columns: 10
2026-01-12 13:13:16,747 - dq_comparison - INFO - ----------------------------------------------------------------------
2026-01-12 13:13:16,747 - dq_comparison - INFO - 1️⃣ Row count match: ✅ Yes
2026-01-12 13:13:16,747 - dq_comparison - INFO - 2️⃣ Column structure match: ❌ No
2026-01-12 13:13:16,748 - dq_comparison - INFO -    Missing in target: 10 columns
2026-01-12 13:13:16,748 - dq_comparison - INFO -      ['customername', 'email', 'phone', 'salary', 'department']
2026-01-12 13:13:16,748 - dq_comparison - INFO -    Missing in source: 10 columns
2026-01-12 13:13:16,748 - dq_comparison - INFO -      ['CustomerName', 'Email', 'Phone', 'Salary', 'Department']
2026-01-12 13:13:16,748 - dq_comparison - INFO - 3️ Primary key validation: ❌ Failed
2026-01-12 13:13:16,748 - dq_comparison - INFO - 4️ Table metadata: ❌ Mismatch
2026-01-12 13:13:16,749 - dq_comparison - INFO - 5️⃣ Common rows (both datasets): 15 (100.00% of source)
2026-01-12 13:13:16,751 - dq_comparison - INFO - 6️⃣ Source-only rows: 0
2026-01-12 13:13:16,751 - dq_comparison - INFO - 7️⃣ Target-only rows: 0
2026-01-12 13:13:16,752 - dq_comparison - INFO - 8️⃣ Column value mismatches: 0
2026-01-12 13:13:16,752 - dq_comparison - INFO - 9️ Data quality match: ❌ No
2026-01-12 13:13:16,752 - dq_comparison - INFO - 📈 DQ Score: 100.00%
2026-01-12 13:13:16,753 - dq_comparison - INFO - 📊 Calculation: (15 / 15) * 100 = 100.00%
2026-01-12 13:13:16,753 - dq_comparison - INFO - ======================================================================
2026-01-12 13:13:16,753 - dq_comparison - INFO - 
🎉 PERFECT MATCH! All data is identical after normalization.
2026-01-12 13:13:16,754 - dq_comparison - INFO - 
🔍 NORMALIZATION APPLIED:
2026-01-12 13:13:16,754 - dq_comparison - INFO -    • NULL values → 'NULL' (consistent representation)
2026-01-12 13:13:16,754 - dq_comparison - INFO -    • Dates → YYYY-MM-DD format
2026-01-12 13:13:16,755 - dq_comparison - INFO -    • Strings → trimmed + lowercase
2026-01-12 13:13:16,755 - dq_comparison - INFO -    • Numeric values → standardized format
2026-01-12 13:13:16,755 - dq_comparison - INFO -    • Phone numbers → digits only, ALL leading zeros removed
2026-01-12 13:13:16,755 - dq_comparison - INFO -    • Extra whitespace removed
2026-01-12 13:13:16,756 - dq_comparison - INFO - 
💡 For complete error details, run:
2026-01-12 13:13:16,756 - dq_comparison - INFO -    USE dq_checks;
2026-01-12 13:13:16,756 - dq_comparison - INFO -    SELECT excel_row, column_name, error_type, error_description,
2026-01-12 13:13:16,757 - dq_comparison - INFO -           actual_value, expected_value
2026-01-12 13:13:16,757 - dq_comparison - INFO -    FROM dq_error_logs
2026-01-12 13:13:16,757 - dq_comparison - INFO -    WHERE session_id = 'CMP_20260112_131316'
2026-01-12 13:13:16,758 - dq_comparison - INFO -    ORDER BY excel_row, column_name;
2026-01-12 13:13:16,771 - dq_comparison - INFO - 
✅ Comparison completed! Session ID: CMP_20260112_131316
2026-01-12 13:13:16,781 - dq_error_log - INFO - Retrieved 13 error logs for session CMP_20260112_131316
2026-01-12 13:13:16,792 - dq_error_log - INFO - Retrieved summary: 13 total errors for session CMP_20260112_131316
2026-01-12 13:13:16,793 - dq_audit - INFO - Audit class initialized with database: dq_checks
2026-01-12 13:13:16,808 - dq_audit - INFO - Retrieved 1 audit logs for session CMP_20260112_131316
2026-01-12 13:13:16,809 - dq_comparison - INFO - 
🔍 Final results verification:
2026-01-12 13:13:16,809 - dq_comparison - INFO -    Session ID: CMP_20260112_131316
2026-01-12 13:13:16,809 - dq_comparison - INFO -    DQ Score (Simple %): 100.00%
2026-01-12 13:13:16,811 - dq_comparison - INFO -    Source rows: 15
2026-01-12 13:13:16,811 - dq_comparison - INFO -    Matched rows: 15
2026-01-12 13:13:16,812 - dq_comparison - INFO -    Calculation: (15 / 15) * 100
2026-01-12 13:13:16,813 - __main__ - INFO - Source-Target Comparison completed successfully
2026-01-12 13:13:16,813 - __main__ - INFO - Displaying main menu options to user
2026-01-12 13:13:31,997 - __main__ - INFO - User selected option: 6
2026-01-12 13:13:31,998 - __main__ - INFO - User session ended. Duration: 0:00:58.436613
2026-01-12 13:13:31,999 - __main__ - INFO - 👋 Thank you for using Universal Data Quality Framework!
