2026-01-02 12:36:08,068 - root - INFO - CLI Mode Logging Initialized
2026-01-02 12:36:08,068 - root - INFO - CLI logs will be saved to: logs/dq_framework_20260102_123608.log
2026-01-02 12:36:08,069 - __main__ - INFO - 🚀 UNIVERSAL DATA QUALITY FRAMEWORK INITIALIZED
2026-01-02 12:36:08,070 - __main__ - INFO - Starting system resource check
2026-01-02 12:36:08,082 - __main__ - INFO - Total RAM: 15.7 GB
2026-01-02 12:36:08,082 - __main__ - INFO - Available RAM: 2.7 GB
2026-01-02 12:36:08,083 - __main__ - INFO - Memory used: 83.2%
2026-01-02 12:36:08,083 - __main__ - INFO - Memory status: OK
2026-01-02 12:36:08,084 - __main__ - INFO - Free disk space: 261.9 GB
2026-01-02 12:36:08,084 - __main__ - INFO - Disk used: 45.0%
2026-01-02 12:36:08,084 - __main__ - INFO - Disk space: OK
2026-01-02 12:36:08,587 - __main__ - INFO - CPU cores: 8
2026-01-02 12:36:08,588 - __main__ - INFO - CPU usage: 91.4%
2026-01-02 12:36:08,588 - __main__ - WARNING - High CPU usage
2026-01-02 12:36:08,589 - __main__ - INFO - Python version: 3.12.4
2026-01-02 12:36:08,589 - __main__ - INFO - System platform: win32
2026-01-02 12:36:08,589 - __main__ - INFO - User session started at: 2026-01-02 12:36:08.589553
2026-01-02 12:36:08,590 - __main__ - INFO - Displaying main menu options to user
2026-01-02 12:36:11,200 - __main__ - INFO - User selected option: 2
2026-01-02 12:36:11,202 - __main__ - INFO - Starting Source-Target Comparison module
2026-01-02 12:36:11,209 - dq_comparison - INFO - STARTING UNIVERSAL SOURCE-TARGET COMPARISON TOOL
2026-01-02 12:36:11,210 - dq_comparison - INFO - LOADING SOURCE AND TARGET DATA
2026-01-02 12:36:11,211 - dq_comparison - INFO - 
==================================================
2026-01-02 12:36:11,212 - dq_comparison - INFO - 🔗 SOURCE DATA CONFIGURATION
2026-01-02 12:36:11,213 - dq_comparison - INFO - ==================================================
2026-01-02 12:36:12,836 - dq_comparison - INFO - 
🗄️ SOURCE DATABASE CONFIGURATION
2026-01-02 12:36:12,837 - dq_comparison - INFO - ----------------------------------------
2026-01-02 12:36:18,202 - dq_unified - INFO - Getting database config from config file
2026-01-02 12:36:18,206 - dq_unified - INFO - Using POSTGRESQL configuration from config file
2026-01-02 12:36:29,762 - dq_unified - INFO - Database configuration from config file: postgresql, Table: customers
2026-01-02 12:36:29,764 - dq_unified - INFO - Loading data from DATABASE
2026-01-02 12:36:29,767 - dq_unified - INFO - Loading large database table: customers
2026-01-02 12:36:29,768 - dq_unified - INFO - Normalized DB config with schema: public
2026-01-02 12:36:30,156 - dq_unified - INFO - PostgreSQL table public.customers has 15 rows
2026-01-02 12:36:30,157 - dq_unified - INFO - Loading 15 rows from PostgreSQL...
2026-01-02 12:36:32,925 - dq_unified - INFO - Loaded 15 rows from PostgreSQL
2026-01-02 12:36:32,941 - dq_unified - INFO - Memory optimization: 0.0MB -> 0.0MB (Saved: 0.0MB)
2026-01-02 12:36:32,942 - dq_unified - INFO - Standardizing data types...
2026-01-02 12:36:32,947 - dq_unified - INFO - Data type standardization complete
2026-01-02 12:36:32,950 - dq_unified - INFO - Loaded 15 rows, 10 columns. Memory: 105.4MB total, 0.0MB for dataframe
2026-01-02 12:36:32,951 - dq_comparison - INFO - SOURCE database loaded: 15 rows, 10 columns
2026-01-02 12:36:32,952 - dq_comparison - INFO - 
==================================================
2026-01-02 12:36:32,953 - dq_comparison - INFO - 🔗 TARGET DATA CONFIGURATION
2026-01-02 12:36:32,953 - dq_comparison - INFO - ==================================================
2026-01-02 12:37:21,711 - dq_comparison - INFO - TARGET Excel loaded: 15 rows, 10 columns
2026-01-02 12:37:21,711 - dq_comparison - INFO - SELECTING COLUMNS FOR COMPARISON
2026-01-02 12:37:21,712 - dq_comparison - INFO - Source columns (original): ['customername', 'email', 'phone', 'salary', 'department', 'joindate', 'postalcode', 'city', 'country', 'state']
2026-01-02 12:37:21,716 - dq_comparison - INFO - Target columns (original): ['CustomerName', 'Email', 'Phone', 'Salary', 'Department', 'JoinDate', 'PostalCode', 'City', 'Country', 'State']
2026-01-02 12:37:21,717 - dq_comparison - INFO - Common columns lowercased: ['postalcode', 'department', 'joindate', 'country', 'customername', 'phone', 'state', 'email', 'city', 'salary']
2026-01-02 12:37:21,718 - dq_comparison - INFO - Found 10 common columns between source and target (case-insensitive, excluding CustomerID)
2026-01-02 12:37:21,718 - dq_comparison - INFO - 
📋 Common columns available for comparison:
2026-01-02 12:37:21,719 - dq_comparison - INFO -   1. postalcode (Source) ↔ PostalCode (Target)
2026-01-02 12:37:21,720 - dq_comparison - INFO -   2. department (Source) ↔ Department (Target)
2026-01-02 12:37:21,720 - dq_comparison - INFO -   3. joindate (Source) ↔ JoinDate (Target)
2026-01-02 12:37:21,721 - dq_comparison - INFO -   4. country (Source) ↔ Country (Target)
2026-01-02 12:37:21,721 - dq_comparison - INFO -   5. customername (Source) ↔ CustomerName (Target)
2026-01-02 12:37:21,722 - dq_comparison - INFO -   6. phone (Source) ↔ Phone (Target)
2026-01-02 12:37:21,722 - dq_comparison - INFO -   7. state (Source) ↔ State (Target)
2026-01-02 12:37:21,723 - dq_comparison - INFO -   8. email (Source) ↔ Email (Target)
2026-01-02 12:37:21,723 - dq_comparison - INFO -   9. city (Source) ↔ City (Target)
2026-01-02 12:37:21,724 - dq_comparison - INFO -   10. salary (Source) ↔ Salary (Target)
2026-01-02 12:38:03,046 - dq_comparison - INFO - User column selection input: all
2026-01-02 12:38:03,048 - dq_comparison - INFO - User selected ALL common columns for comparison
2026-01-02 12:38:03,049 - dq_comparison - INFO - GENERATING COMPREHENSIVE COMPARISON REPORT
2026-01-02 12:38:03,053 - dq_comparison - INFO - Report details - Source: Database: postgresql - dq_checks.customers, Target: Excel: sample_data.xlsx (sample_data), Selected columns: 10
2026-01-02 12:38:03,053 - dq_comparison - INFO - Initializing Error Logger...
2026-01-02 12:38:03,055 - dq_error_log - INFO - ErrorLogger initialized with database: dq_checks
2026-01-02 12:38:03,211 - dq_error_log - INFO - Database connection successful
2026-01-02 12:38:03,213 - dq_comparison - INFO - Session ID: CMP_20260102_123803
2026-01-02 12:38:03,213 - dq_comparison - INFO - 
======================================================================
2026-01-02 12:38:03,218 - dq_comparison - INFO - 🔄 RUNNING SOURCE-TARGET COMPARISON WITH PERFECT NORMALIZATION
2026-01-02 12:38:03,218 - dq_comparison - INFO - ======================================================================
2026-01-02 12:38:03,219 - dq_comparison - INFO - Session ID: CMP_20260102_123803
2026-01-02 12:38:03,219 - dq_comparison - INFO - Source: Database: postgresql - dq_checks.customers
2026-01-02 12:38:03,220 - dq_comparison - INFO - Target: Excel: sample_data.xlsx (sample_data)
2026-01-02 12:38:03,220 - dq_comparison - INFO - Selected columns: 10
2026-01-02 12:38:03,221 - dq_comparison - INFO - ======================================================================
2026-01-02 12:38:03,221 - dq_comparison - INFO - 
1️⃣ FIRST: ROW COUNT CHECK
2026-01-02 12:38:03,222 - dq_comparison - INFO - ✅ Row counts match: 15 rows
2026-01-02 12:38:03,223 - dq_comparison - INFO - 
2️⃣ COLUMN STRUCTURE COMPARISON
2026-01-02 12:38:03,223 - dq_comparison - INFO - Comparing column structures...
2026-01-02 12:38:03,224 - dq_comparison - INFO - Column structure comparison complete. Match: False
2026-01-02 12:38:03,397 - dq_comparison - INFO - 
3️⃣ PRIMARY KEY VALIDATION
2026-01-02 12:38:03,398 - dq_comparison - INFO - Validating primary key/unique fields...
2026-01-02 12:38:03,399 - dq_comparison - INFO - Checking key fields: ['postalcode']
2026-01-02 12:38:03,403 - dq_comparison - WARNING - No key fields found in both datasets
2026-01-02 12:38:03,421 - dq_comparison - INFO -    No key fields specified or detected
2026-01-02 12:38:03,421 - dq_comparison - INFO -    Column names match: ❌
2026-01-02 12:38:03,422 - dq_comparison - INFO -    Column order match: ❌
2026-01-02 12:38:03,423 - dq_comparison - INFO -    Data types match: ✅
2026-01-02 12:38:03,424 - dq_comparison - WARNING -    Missing in target: ['customername', 'email', 'phone', 'salary', 'department', 'joindate', 'postalcode', 'city', 'country', 'state']
2026-01-02 12:38:03,425 - dq_comparison - WARNING -    Missing in source: ['CustomerName', 'Email', 'Phone', 'Salary', 'Department', 'JoinDate', 'PostalCode', 'City', 'Country', 'State']
2026-01-02 12:38:03,426 - dq_comparison - INFO - 
4️⃣ TABLE METADATA COMPARISON
2026-01-02 12:38:03,430 - dq_comparison - INFO - Comparing table-level metadata...
2026-01-02 12:38:03,453 - dq_comparison - INFO - Table metadata comparison complete. Match: False
2026-01-02 12:38:03,454 - dq_comparison - INFO -    Table metadata match: ❌
2026-01-02 12:38:03,455 - dq_comparison - INFO -    Source: 15 rows, 10 cols, 0.0 MB
2026-01-02 12:38:03,456 - dq_comparison - INFO -    Target: 15 rows, 10 cols, 0.01 MB
2026-01-02 12:38:03,460 - dq_comparison - INFO - 
5️⃣ HASH-BASED COMPARISON
2026-01-02 12:38:03,461 - dq_comparison - INFO - ℹ️  Note: All NULL values normalized to 'NULL'
2026-01-02 12:38:03,461 - dq_comparison - INFO - ℹ️  Note: Dates normalized to YYYY-MM-DD
2026-01-02 12:38:03,462 - dq_comparison - INFO - ℹ️  Note: Strings trimmed and case-normalized
2026-01-02 12:38:03,463 - dq_comparison - INFO - ℹ️  Note: Phone numbers stripped to digits only, leading zeros removed
2026-01-02 12:38:03,464 - dq_comparison - INFO - SECOND CHECK: HASH-BASED COMPARISON WITH PERFECT NORMALIZATION
2026-01-02 12:38:03,465 - dq_comparison - INFO - Source DF columns: ['customername', 'email', 'phone', 'salary', 'department', 'joindate', 'postalcode', 'city', 'country', 'state']
2026-01-02 12:38:03,466 - dq_comparison - INFO - Target DF columns: ['CustomerName', 'Email', 'Phone', 'Salary', 'Department', 'JoinDate', 'PostalCode', 'City', 'Country', 'State']
2026-01-02 12:38:03,466 - dq_comparison - INFO - Selected columns for comparison: ['postalcode', 'department', 'joindate', 'country', 'customername', 'phone', 'state', 'email', 'city', 'salary']
2026-01-02 12:38:03,467 - dq_comparison - INFO - Using 10 common columns for hash comparison
2026-01-02 12:38:03,468 - dq_comparison - INFO - Source columns: ['postalcode', 'department', 'joindate', 'country', 'customername', 'phone', 'state', 'email', 'city', 'salary']
2026-01-02 12:38:03,469 - dq_comparison - INFO - Target columns: ['PostalCode', 'Department', 'JoinDate', 'Country', 'CustomerName', 'Phone', 'State', 'Email', 'City', 'Salary']
2026-01-02 12:38:03,471 - dq_comparison - INFO - Generating hashes for source data (15 rows)...
2026-01-02 12:38:03,483 - dq_comparison - INFO - Generating hashes for target data (15 rows)...
2026-01-02 12:38:03,491 - dq_comparison - INFO - Hash-based Comparison Results (with duplicate handling):
2026-01-02 12:38:03,492 - dq_comparison - INFO -   • Unique source hashes: 14
2026-01-02 12:38:03,492 - dq_comparison - INFO -   • Unique target hashes: 14
2026-01-02 12:38:03,496 - dq_comparison - INFO -   • Common hashes: 0
2026-01-02 12:38:03,498 - dq_comparison - INFO -   • Common rows (counting duplicates): 0
2026-01-02 12:38:03,499 - dq_comparison - INFO -   • Rows only in source (counting duplicates): 15
2026-01-02 12:38:03,500 - dq_comparison - INFO -   • Rows only in target (counting duplicates): 15
2026-01-02 12:38:03,500 - dq_comparison - INFO - Found 15 rows missing in target
2026-01-02 12:38:03,518 - dq_error_log - ERROR - General Error logging error: slice(None, 200, None)
2026-01-02 12:38:03,545 - dq_error_log - INFO - Created fallback file: dq_error_logs_fallback.csv
2026-01-02 12:38:03,562 - dq_error_log - ERROR - General Error logging error: slice(None, 200, None)
2026-01-02 12:38:03,594 - dq_error_log - ERROR - General Error logging error: slice(None, 200, None)
2026-01-02 12:38:03,623 - dq_error_log - ERROR - General Error logging error: slice(None, 200, None)
2026-01-02 12:38:03,654 - dq_error_log - ERROR - General Error logging error: slice(None, 200, None)
2026-01-02 12:38:03,669 - dq_comparison - INFO - Found 15 extra rows in target
2026-01-02 12:38:03,684 - dq_error_log - ERROR - General Error logging error: slice(None, 200, None)
2026-01-02 12:38:03,713 - dq_error_log - ERROR - General Error logging error: slice(None, 200, None)
2026-01-02 12:38:03,746 - dq_error_log - ERROR - General Error logging error: slice(None, 200, None)
2026-01-02 12:38:03,775 - dq_error_log - ERROR - General Error logging error: slice(None, 200, None)
2026-01-02 12:38:03,805 - dq_error_log - ERROR - General Error logging error: slice(None, 200, None)
2026-01-02 12:38:03,818 - dq_comparison - INFO - PERFORMING DETAILED COLUMN-BY-COLUMN COMPARISON...
2026-01-02 12:38:03,819 - dq_comparison - INFO - Will compare 15 rows (min of source:15 and target:15)
2026-01-02 12:38:03,836 - dq_error_log - ERROR - General Error logging error: slice(None, 200, None)
2026-01-02 12:38:03,869 - dq_error_log - ERROR - General Error logging error: slice(None, 200, None)
2026-01-02 12:38:03,900 - dq_error_log - ERROR - General Error logging error: slice(None, 200, None)
2026-01-02 12:38:03,930 - dq_error_log - ERROR - General Error logging error: slice(None, 200, None)
2026-01-02 12:38:03,960 - dq_error_log - ERROR - General Error logging error: slice(None, 200, None)
2026-01-02 12:38:03,992 - dq_error_log - ERROR - General Error logging error: slice(None, 200, None)
2026-01-02 12:38:04,026 - dq_error_log - ERROR - General Error logging error: slice(None, 200, None)
2026-01-02 12:38:04,060 - dq_error_log - ERROR - General Error logging error: slice(None, 200, None)
2026-01-02 12:38:04,090 - dq_error_log - ERROR - General Error logging error: slice(None, 200, None)
2026-01-02 12:38:04,121 - dq_error_log - ERROR - General Error logging error: slice(None, 200, None)
2026-01-02 12:38:04,152 - dq_error_log - ERROR - General Error logging error: slice(None, 200, None)
2026-01-02 12:38:04,178 - dq_error_log - ERROR - General Error logging error: slice(None, 200, None)
2026-01-02 12:38:04,210 - dq_error_log - ERROR - General Error logging error: slice(None, 200, None)
2026-01-02 12:38:04,239 - dq_error_log - ERROR - General Error logging error: slice(None, 200, None)
2026-01-02 12:38:04,267 - dq_error_log - ERROR - General Error logging error: slice(None, 200, None)
2026-01-02 12:38:04,293 - dq_error_log - ERROR - General Error logging error: slice(None, 200, None)
2026-01-02 12:38:04,308 - dq_comparison - INFO - Found 16 column value mismatches across all rows
2026-01-02 12:38:04,308 - dq_comparison - INFO - Returning counts for simple scoring:
2026-01-02 12:38:04,309 - dq_comparison - INFO -   Common rows: 0
2026-01-02 12:38:04,312 - dq_comparison - INFO -   Unique to source: 15
2026-01-02 12:38:04,312 - dq_comparison - INFO -   Unique to target: 15
2026-01-02 12:38:04,313 - dq_comparison - INFO -   Value mismatches: 16
2026-01-02 12:38:04,314 - dq_comparison - INFO - 
6️⃣ DATA QUALITY ANALYSIS
2026-01-02 12:38:04,314 - dq_comparison - INFO - Analyzing data quality metrics...
2026-01-02 12:38:04,335 - dq_comparison - INFO - Null values - Source: 7 (4.67%), Target: 6 (4.00%)
2026-01-02 12:38:04,354 - dq_comparison - INFO - Duplicate rows (normalized) - Source: 1, Target: 1
2026-01-02 12:38:04,357 - dq_comparison - INFO - Source duplicate samples: ['Row 2', 'Row 7']
2026-01-02 12:38:04,359 - dq_comparison - INFO - Target duplicate samples: ['Row 2', 'Row 7']
2026-01-02 12:38:04,375 - dq_error_log - INFO - Retrieved 12 errors for session CMP_20260102_123803
2026-01-02 12:38:04,376 - dq_comparison - INFO - 
📊 SIMPLE SCORING CALCULATION:
2026-01-02 12:38:04,376 - dq_comparison - INFO -   Source rows: 15
2026-01-02 12:38:04,379 - dq_comparison - INFO -   Common rows (matched): 0
2026-01-02 12:38:04,379 - dq_comparison - INFO -   Calculation: (0 / 15) * 100 = 0.00%
2026-01-02 12:38:04,380 - dq_comparison - INFO -   Explanation: 0 matched rows out of 15 total source rows
2026-01-02 12:38:04,381 - dq_comparison - INFO - 
=== AUDIT LOGGING SECTION ===
2026-01-02 12:38:04,389 - dq_comparison - INFO - 🔍 Audit logging is ENABLED in APP_SETTINGS
2026-01-02 12:38:04,389 - dq_audit - INFO - Audit class initialized with database: dq_checks
2026-01-02 12:38:04,390 - dq_comparison - INFO - Attempting to log audit record for session: CMP_20260102_123803
2026-01-02 12:38:04,391 - dq_audit - INFO - Starting database insertion for comparison...
2026-01-02 12:38:04,414 - dq_audit - INFO - Inserted comparison record with ID: 505
2026-01-02 12:38:04,414 - dq_comparison - INFO - ✅ Audit record logged successfully (ID: 505)
2026-01-02 12:38:04,420 - dq_comparison - INFO - 
======================================================================
2026-01-02 12:38:04,420 - dq_comparison - INFO - 📊 COMPARISON RESULTS SUMMARY
2026-01-02 12:38:04,421 - dq_comparison - INFO - ======================================================================
2026-01-02 12:38:04,421 - dq_comparison - INFO - Session ID: CMP_20260102_123803
2026-01-02 12:38:04,422 - dq_comparison - INFO - Source: Database: postgresql - dq_checks.customers (15 rows)
2026-01-02 12:38:04,422 - dq_comparison - INFO - Target: Excel: sample_data.xlsx (sample_data) (15 rows)
2026-01-02 12:38:04,423 - dq_comparison - INFO - Selected columns: 10
2026-01-02 12:38:04,423 - dq_comparison - INFO - ----------------------------------------------------------------------
2026-01-02 12:38:04,423 - dq_comparison - INFO - 1️⃣ Row count match: ✅ Yes
2026-01-02 12:38:04,423 - dq_comparison - INFO - 2️⃣ Column structure match: ❌ No
2026-01-02 12:38:04,424 - dq_comparison - INFO -    Missing in target: 10 columns
2026-01-02 12:38:04,424 - dq_comparison - INFO -      ['customername', 'email', 'phone', 'salary', 'department']
2026-01-02 12:38:04,425 - dq_comparison - INFO -    Missing in source: 10 columns
2026-01-02 12:38:04,425 - dq_comparison - INFO -      ['CustomerName', 'Email', 'Phone', 'Salary', 'Department']
2026-01-02 12:38:04,426 - dq_comparison - INFO - 3️ Primary key validation: ❌ Failed
2026-01-02 12:38:04,426 - dq_comparison - INFO - 4️ Table metadata: ❌ Mismatch
2026-01-02 12:38:04,427 - dq_comparison - INFO - 5️ Common rows (hash match): 0 (0.00% of source)
2026-01-02 12:38:04,427 - dq_comparison - INFO - 6️ Rows only in source: 15
2026-01-02 12:38:04,429 - dq_comparison - INFO - 7️ Rows only in target: 15
2026-01-02 12:38:04,434 - dq_comparison - INFO - 8️ Column value mismatches: 0
2026-01-02 12:38:04,435 - dq_comparison - INFO - 9️ Data quality match: ❌ No
2026-01-02 12:38:04,435 - dq_comparison - INFO - 📈 DQ Score: 0.00%
2026-01-02 12:38:04,435 - dq_comparison - INFO - 📊 Calculation: (0 / 15) * 100 = 0.00%
2026-01-02 12:38:04,436 - dq_comparison - INFO - ======================================================================
2026-01-02 12:38:04,436 - dq_comparison - INFO - 
❌ LOW MATCH! Major differences found.
2026-01-02 12:38:04,437 - dq_comparison - INFO - 
🔍 NORMALIZATION APPLIED:
2026-01-02 12:38:04,438 - dq_comparison - INFO -    • NULL values → 'NULL' (consistent representation)
2026-01-02 12:38:04,438 - dq_comparison - INFO -    • Dates → YYYY-MM-DD format
2026-01-02 12:38:04,439 - dq_comparison - INFO -    • Strings → trimmed + lowercase
2026-01-02 12:38:04,440 - dq_comparison - INFO -    • Numeric values → standardized format
2026-01-02 12:38:04,440 - dq_comparison - INFO -    • Phone numbers → digits only, ALL leading zeros removed
2026-01-02 12:38:04,441 - dq_comparison - INFO -    • Extra whitespace removed
2026-01-02 12:38:04,441 - dq_comparison - INFO - 
🔍 DETAILED ERROR ANALYSIS:
2026-01-02 12:38:04,441 - dq_comparison - INFO - --------------------------------------------------
2026-01-02 12:38:04,458 - dq_error_log - INFO - Retrieved 12 errors for session CMP_20260102_123803
2026-01-02 12:38:04,458 - dq_comparison - INFO - Total errors found: 12
2026-01-02 12:38:04,460 - dq_comparison - INFO - 
💡 For complete error details, run:
2026-01-02 12:38:04,460 - dq_comparison - INFO -    USE dq_checks;
2026-01-02 12:38:04,463 - dq_comparison - INFO -    SELECT excel_row, column_name, error_type, error_description,
2026-01-02 12:38:04,464 - dq_comparison - INFO -           actual_value, expected_value
2026-01-02 12:38:04,465 - dq_comparison - INFO -    FROM dq_error_logs
2026-01-02 12:38:04,465 - dq_comparison - INFO -    WHERE session_id = 'CMP_20260102_123803'
2026-01-02 12:38:04,466 - dq_comparison - INFO -    ORDER BY excel_row, column_name;
2026-01-02 12:38:04,486 - dq_comparison - INFO - 
✅ Comparison completed! Session ID: CMP_20260102_123803
2026-01-02 12:38:04,503 - dq_error_log - INFO - Retrieved 13 error logs for session CMP_20260102_123803
2026-01-02 12:38:04,524 - dq_error_log - INFO - Retrieved summary: 13 total errors for session CMP_20260102_123803
2026-01-02 12:38:04,524 - dq_audit - INFO - Audit class initialized with database: dq_checks
2026-01-02 12:38:04,548 - dq_audit - INFO - Retrieved 1 audit logs for session CMP_20260102_123803
2026-01-02 12:38:04,549 - dq_comparison - INFO - 
🔍 Final results verification:
2026-01-02 12:38:04,552 - dq_comparison - INFO -    Session ID: CMP_20260102_123803
2026-01-02 12:38:04,553 - dq_comparison - INFO -    DQ Score (Simple %): 0.00%
2026-01-02 12:38:04,555 - dq_comparison - INFO -    Source rows: 15
2026-01-02 12:38:04,556 - dq_comparison - INFO -    Matched rows: 0
2026-01-02 12:38:04,558 - dq_comparison - INFO -    Calculation: (0 / 15) * 100
2026-01-02 12:38:04,560 - __main__ - INFO - Source-Target Comparison completed successfully
2026-01-02 12:38:04,560 - __main__ - INFO - Displaying main menu options to user
2026-01-02 12:38:23,353 - __main__ - INFO - User selected option: 6
2026-01-02 12:38:23,353 - __main__ - INFO - User session ended. Duration: 0:02:14.763505
2026-01-02 12:38:23,353 - __main__ - INFO - 👋 Thank you for using Universal Data Quality Framework!
