2026-01-15 10:17:37,460 - root - INFO - CLI Mode Logging Initialized
2026-01-15 10:17:37,461 - root - INFO - CLI logs will be saved to: logs/dq_framework_20260115_101737.log
2026-01-15 10:17:37,461 - __main__ - INFO - 🚀 UNIVERSAL DATA QUALITY FRAMEWORK INITIALIZED
2026-01-15 10:17:37,461 - __main__ - INFO - Starting system resource check
2026-01-15 10:17:37,467 - __main__ - INFO - Total RAM: 15.7 GB
2026-01-15 10:17:37,467 - __main__ - INFO - Available RAM: 4.2 GB
2026-01-15 10:17:37,467 - __main__ - INFO - Memory used: 73.5%
2026-01-15 10:17:37,467 - __main__ - INFO - Memory status: OK
2026-01-15 10:17:37,468 - __main__ - INFO - Free disk space: 261.2 GB
2026-01-15 10:17:37,469 - __main__ - INFO - Disk used: 45.2%
2026-01-15 10:17:37,469 - __main__ - INFO - Disk space: OK
2026-01-15 10:17:37,970 - __main__ - INFO - CPU cores: 8
2026-01-15 10:17:37,970 - __main__ - INFO - CPU usage: 39.5%
2026-01-15 10:17:37,970 - __main__ - INFO - Python version: 3.12.4
2026-01-15 10:17:37,970 - __main__ - INFO - System platform: win32
2026-01-15 10:17:37,972 - __main__ - INFO - User session started at: 2026-01-15 10:17:37.972194
2026-01-15 10:17:37,972 - __main__ - INFO - Displaying main menu options to user
2026-01-15 10:17:38,986 - __main__ - INFO - User selected option: 2
2026-01-15 10:17:38,987 - __main__ - INFO - Starting Source-Target Comparison module
2026-01-15 10:17:38,990 - dq_comparison - INFO - STARTING UNIVERSAL SOURCE-TARGET COMPARISON TOOL
2026-01-15 10:17:38,991 - dq_comparison - INFO - LOADING SOURCE AND TARGET DATA
2026-01-15 10:17:38,991 - dq_comparison - INFO - 
==================================================
2026-01-15 10:17:38,991 - dq_comparison - INFO - 🔗 SOURCE DATA CONFIGURATION
2026-01-15 10:17:38,992 - dq_comparison - INFO - ==================================================
2026-01-15 10:17:40,118 - dq_comparison - INFO - 
🗄️ SOURCE DATABASE CONFIGURATION
2026-01-15 10:17:40,119 - dq_comparison - INFO - ----------------------------------------
2026-01-15 10:17:43,890 - dq_comparison - INFO - Selected database type code: mysql
2026-01-15 10:17:48,004 - dq_unified - INFO - Getting database config from config file
2026-01-15 10:17:48,005 - dq_unified - INFO - Using MYSQL configuration from config file
2026-01-15 10:17:53,839 - dq_unified - INFO - Database configuration from config file: mysql, Table: customers_bkp
2026-01-15 10:17:53,840 - dq_unified - INFO - Loading data from DATABASE
2026-01-15 10:17:53,840 - dq_unified - INFO - Loading large database table: customers_bkp
2026-01-15 10:17:53,841 - dq_unified - INFO - Normalized DB config with schema: dq_checks
2026-01-15 10:17:54,066 - dq_unified - INFO - MySQL table customers_bkp has 12 rows
2026-01-15 10:17:54,066 - dq_unified - INFO - Loading 12 rows from MySQL...
2026-01-15 10:17:54,676 - dq_unified - INFO - Loaded 12 rows from MySQL
2026-01-15 10:17:54,692 - dq_unified - INFO - Memory optimization: 0.0MB -> 0.0MB (Saved: 0.0MB)
2026-01-15 10:17:54,692 - dq_unified - INFO - Standardizing data types...
2026-01-15 10:17:54,698 - dq_unified - INFO - Data type standardization complete
2026-01-15 10:17:54,700 - dq_unified - INFO - Loaded 12 rows, 10 columns. Memory: 111.6MB total, 0.0MB for dataframe
2026-01-15 10:17:54,700 - dq_comparison - INFO - SOURCE database loaded: 12 rows, 10 columns
2026-01-15 10:17:54,700 - dq_comparison - INFO - 
==================================================
2026-01-15 10:17:54,700 - dq_comparison - INFO - 🔗 TARGET DATA CONFIGURATION
2026-01-15 10:17:54,701 - dq_comparison - INFO - ==================================================
2026-01-15 10:17:57,050 - dq_comparison - INFO - 
🗄️ TARGET DATABASE CONFIGURATION
2026-01-15 10:17:57,051 - dq_comparison - INFO - ----------------------------------------
2026-01-15 10:17:57,856 - dq_comparison - INFO - Selected database type code: postgresql
2026-01-15 10:17:59,051 - dq_unified - INFO - Getting database config from config file
2026-01-15 10:17:59,052 - dq_unified - INFO - Using POSTGRESQL configuration from config file
2026-01-15 10:18:04,281 - dq_unified - INFO - Database configuration from config file: postgresql, Table: customers
2026-01-15 10:18:04,282 - dq_unified - INFO - Loading data from DATABASE
2026-01-15 10:18:04,282 - dq_unified - INFO - Loading large database table: customers
2026-01-15 10:18:04,283 - dq_unified - INFO - Normalized DB config with schema: public
2026-01-15 10:18:04,499 - dq_unified - INFO - PostgreSQL table public.customers has 15 rows
2026-01-15 10:18:04,499 - dq_unified - INFO - Loading 15 rows from PostgreSQL...
2026-01-15 10:18:04,504 - dq_unified - INFO - Loaded 15 rows from PostgreSQL
2026-01-15 10:18:04,506 - dq_unified - INFO - Memory optimization: 0.0MB -> 0.0MB (Saved: 0.0MB)
2026-01-15 10:18:04,508 - dq_unified - INFO - Standardizing data types...
2026-01-15 10:18:04,510 - dq_unified - INFO - Data type standardization complete
2026-01-15 10:18:04,511 - dq_unified - INFO - Loaded 15 rows, 10 columns. Memory: 112.2MB total, 0.0MB for dataframe
2026-01-15 10:18:04,511 - dq_comparison - INFO - TARGET database loaded: 15 rows, 10 columns
2026-01-15 10:18:04,512 - dq_comparison - INFO - SELECTING COLUMNS FOR COMPARISON
2026-01-15 10:18:04,512 - dq_comparison - INFO - Source columns (original): ['CustomerName', 'Email', 'Phone', 'Salary', 'Department', 'JoinDate', 'PostalCode', 'City', 'Country', 'State']
2026-01-15 10:18:04,513 - dq_comparison - INFO - Target columns (original): ['customername', 'email', 'phone', 'salary', 'department', 'joindate', 'postalcode', 'city', 'country', 'state']
2026-01-15 10:18:04,513 - dq_comparison - INFO - Common columns lowercased: ['postalcode', 'phone', 'city', 'customername', 'country', 'salary', 'state', 'joindate', 'department', 'email']
2026-01-15 10:18:04,513 - dq_comparison - INFO - Found 10 common columns between source and target (case-insensitive)
2026-01-15 10:18:04,513 - dq_comparison - INFO - 
📋 Common columns available for comparison:
2026-01-15 10:18:04,514 - dq_comparison - INFO -   1. PostalCode (Source) ↔ postalcode (Target)
2026-01-15 10:18:04,514 - dq_comparison - INFO -   2. Phone (Source) ↔ phone (Target)
2026-01-15 10:18:04,514 - dq_comparison - INFO -   3. City (Source) ↔ city (Target)
2026-01-15 10:18:04,515 - dq_comparison - INFO -   4. CustomerName (Source) ↔ customername (Target)
2026-01-15 10:18:04,515 - dq_comparison - INFO -   5. Country (Source) ↔ country (Target)
2026-01-15 10:18:04,515 - dq_comparison - INFO -   6. Salary (Source) ↔ salary (Target)
2026-01-15 10:18:04,515 - dq_comparison - INFO -   7. State (Source) ↔ state (Target)
2026-01-15 10:18:04,516 - dq_comparison - INFO -   8. JoinDate (Source) ↔ joindate (Target)
2026-01-15 10:18:04,516 - dq_comparison - INFO -   9. Department (Source) ↔ department (Target)
2026-01-15 10:18:04,517 - dq_comparison - INFO -   10. Email (Source) ↔ email (Target)
2026-01-15 10:18:05,880 - dq_comparison - INFO - User column selection input: all
2026-01-15 10:18:05,881 - dq_comparison - INFO - User selected ALL common columns for comparison
2026-01-15 10:18:05,881 - dq_comparison - INFO - GENERATING COMPREHENSIVE COMPARISON REPORT
2026-01-15 10:18:05,883 - dq_comparison - INFO - Report details - Source: Database: mysql - dq_checks.customers_bkp, Target: Database: postgresql - dq_checks.customers, Selected columns: 10
2026-01-15 10:18:05,883 - dq_comparison - INFO - Initializing Error Logger...
2026-01-15 10:18:05,884 - dq_error_log - INFO - ErrorLogger initialized with database: dq_checks
2026-01-15 10:18:05,895 - dq_error_log - INFO - Database connection successful
2026-01-15 10:18:05,895 - dq_comparison - INFO - Session ID: CMP_20260115_101805
2026-01-15 10:18:05,896 - dq_comparison - INFO - 
======================================================================
2026-01-15 10:18:05,897 - dq_comparison - INFO - 🔄 RUNNING SOURCE-TARGET COMPARISON WITH PERFECT NORMALIZATION
2026-01-15 10:18:05,898 - dq_comparison - INFO - ======================================================================
2026-01-15 10:18:05,898 - dq_comparison - INFO - Session ID: CMP_20260115_101805
2026-01-15 10:18:05,899 - dq_comparison - INFO - Source: Database: mysql - dq_checks.customers_bkp
2026-01-15 10:18:05,899 - dq_comparison - INFO - Target: Database: postgresql - dq_checks.customers
2026-01-15 10:18:05,899 - dq_comparison - INFO - Selected columns: 10
2026-01-15 10:18:05,899 - dq_comparison - INFO - ======================================================================
2026-01-15 10:18:05,899 - dq_comparison - INFO - 
1️⃣ FIRST: ROW COUNT CHECK
2026-01-15 10:18:05,900 - dq_comparison - WARNING - ❌ Row count mismatch: Source=12, Target=15, Difference=3
2026-01-15 10:18:05,900 - dq_comparison - WARNING -    Extra in target: 3 rows
2026-01-15 10:18:05,901 - dq_comparison - INFO - 
2️⃣ COLUMN STRUCTURE COMPARISON
2026-01-15 10:18:05,901 - dq_comparison - INFO - Comparing column structures...
2026-01-15 10:18:05,901 - dq_comparison - INFO - Column structure comparison complete. Match: False
2026-01-15 10:18:05,901 - dq_comparison - INFO - 
3️⃣ PRIMARY KEY VALIDATION
2026-01-15 10:18:05,902 - dq_comparison - INFO - Validating primary key/unique fields...
2026-01-15 10:18:05,902 - dq_comparison - INFO - Checking key fields: ['PostalCode']
2026-01-15 10:18:05,902 - dq_comparison - WARNING - No key fields found in both datasets
2026-01-15 10:18:05,919 - dq_comparison - INFO -    No key fields specified or detected
2026-01-15 10:18:05,919 - dq_comparison - INFO -    Column names match: ❌
2026-01-15 10:18:05,920 - dq_comparison - INFO -    Column order match: ❌
2026-01-15 10:18:05,920 - dq_comparison - INFO -    Data types match: ✅
2026-01-15 10:18:05,921 - dq_comparison - WARNING -    Missing in target: ['CustomerName', 'Email', 'Phone', 'Salary', 'Department', 'JoinDate', 'PostalCode', 'City', 'Country', 'State']
2026-01-15 10:18:05,921 - dq_comparison - WARNING -    Missing in source: ['customername', 'email', 'phone', 'salary', 'department', 'joindate', 'postalcode', 'city', 'country', 'state']
2026-01-15 10:18:05,921 - dq_comparison - INFO - 
4️⃣ TABLE METADATA COMPARISON
2026-01-15 10:18:05,921 - dq_comparison - INFO - Comparing table-level metadata...
2026-01-15 10:18:05,934 - dq_comparison - INFO - Table metadata comparison complete. Match: False
2026-01-15 10:18:05,947 - dq_comparison - INFO -    Table metadata match: ❌
2026-01-15 10:18:05,947 - dq_comparison - INFO -    Source: 12 rows, 10 cols, 0.0 MB
2026-01-15 10:18:05,947 - dq_comparison - INFO -    Target: 15 rows, 10 cols, 0.0 MB
2026-01-15 10:18:05,949 - dq_comparison - WARNING -    Found 1 metadata differences:
2026-01-15 10:18:05,950 - dq_comparison - WARNING -      • Row Count: Source=12, Target=15
2026-01-15 10:18:05,950 - dq_comparison - INFO - 
5️⃣ HASH-BASED COMPARISON
2026-01-15 10:18:05,950 - dq_comparison - INFO - ℹ️  Note: All NULL values normalized to 'NULL'
2026-01-15 10:18:05,951 - dq_comparison - INFO - ℹ️  Note: Dates normalized to YYYY-MM-DD
2026-01-15 10:18:05,951 - dq_comparison - INFO - ℹ️  Note: Strings trimmed and case-normalized
2026-01-15 10:18:05,951 - dq_comparison - INFO - ℹ️  Note: Phone numbers stripped to digits only, leading zeros removed
2026-01-15 10:18:05,951 - dq_comparison - INFO - SECOND CHECK: HASH-BASED COMPARISON WITH PERFECT NORMALIZATION
2026-01-15 10:18:05,956 - dq_comparison - INFO - === DEBUG: DATA TYPE CHECK ===
2026-01-15 10:18:05,956 - dq_comparison - INFO - Column: PostalCode
2026-01-15 10:18:05,956 - dq_comparison - INFO -   Source type: <class 'numpy.float64'>, value: 10001.0
2026-01-15 10:18:05,958 - dq_comparison - INFO -   Target type: <class 'numpy.float64'>, value: 10001.0
2026-01-15 10:18:05,960 - dq_comparison - INFO -   Normalized: '10001' vs '10001'
2026-01-15 10:18:05,960 - dq_comparison - INFO -   Match: True
2026-01-15 10:18:05,960 - dq_comparison - INFO - Column: Phone
2026-01-15 10:18:05,960 - dq_comparison - INFO -   Source type: <class 'numpy.int64'>, value: 1234567890
2026-01-15 10:18:05,960 - dq_comparison - INFO -   Target type: <class 'numpy.int64'>, value: 1234567890
2026-01-15 10:18:05,961 - dq_comparison - INFO -   Normalized: '1234567890' vs '1234567890'
2026-01-15 10:18:05,961 - dq_comparison - INFO -   Match: True
2026-01-15 10:18:05,961 - dq_comparison - INFO - Column: City
2026-01-15 10:18:05,962 - dq_comparison - INFO -   Source type: <class 'str'>, value: New York
2026-01-15 10:18:05,962 - dq_comparison - INFO -   Target type: <class 'str'>, value: New York
2026-01-15 10:18:05,962 - dq_comparison - INFO -   Normalized: 'new york' vs 'new york'
2026-01-15 10:18:05,962 - dq_comparison - INFO -   Match: True
2026-01-15 10:18:05,963 - dq_comparison - INFO - Source DF columns: ['CustomerName', 'Email', 'Phone', 'Salary', 'Department', 'JoinDate', 'PostalCode', 'City', 'Country', 'State']
2026-01-15 10:18:05,963 - dq_comparison - INFO - Target DF columns: ['customername', 'email', 'phone', 'salary', 'department', 'joindate', 'postalcode', 'city', 'country', 'state']
2026-01-15 10:18:05,963 - dq_comparison - INFO - Selected columns for comparison: ['PostalCode', 'Phone', 'City', 'CustomerName', 'Country', 'Salary', 'State', 'JoinDate', 'Department', 'Email']
2026-01-15 10:18:05,964 - dq_comparison - INFO - Using 10 common columns for hash comparison
2026-01-15 10:18:05,964 - dq_comparison - INFO - Source columns: ['PostalCode', 'Phone', 'City', 'CustomerName', 'Country', 'Salary', 'State', 'JoinDate', 'Department', 'Email']
2026-01-15 10:18:05,964 - dq_comparison - INFO - Target columns: ['postalcode', 'phone', 'city', 'customername', 'country', 'salary', 'state', 'joindate', 'department', 'email']
2026-01-15 10:18:05,964 - dq_comparison - INFO - Generating hashes for source data (12 rows)...
2026-01-15 10:18:05,966 - dq_comparison - INFO - DEBUG HASH ROW: PostalCode: '10001.0' -> '10001' | Phone: '1234567890' -> '1234567890' | City: 'New York' -> 'new york' | CustomerName: 'John Doe' -> 'john doe' | Country: 'USA' -> 'usa'
2026-01-15 10:18:05,966 - dq_comparison - INFO - DEBUG HASH STRING: 10001|1234567890|new york|john doe|usa...
2026-01-15 10:18:05,969 - dq_comparison - INFO - DEBUG HASH RESULT: 25d1f562...
2026-01-15 10:18:05,969 - dq_comparison - INFO - DEBUG HASH ROW: PostalCode: '10002.0' -> '10002' | Phone: '9876543210' -> '9876543210' | City: 'India' -> 'india' | CustomerName: 'Jane Smith' -> 'jane smith' | Country: 'USA' -> 'usa'
2026-01-15 10:18:05,970 - dq_comparison - INFO - DEBUG HASH STRING: 10002|9876543210|india|jane smith|usa...
2026-01-15 10:18:05,970 - dq_comparison - INFO - DEBUG HASH RESULT: 943a9e04...
2026-01-15 10:18:05,970 - dq_comparison - INFO - DEBUG HASH ROW: PostalCode: '10003.0' -> '10003' | Phone: '5551234567' -> '5551234567' | City: 'Boston' -> 'boston' | CustomerName: 'Bob Johnson' -> 'bob johnson' | Country: 'USA' -> 'usa'
2026-01-15 10:18:05,970 - dq_comparison - INFO - DEBUG HASH STRING: 10003|5551234567|boston|bob johnson|usa...
2026-01-15 10:18:05,971 - dq_comparison - INFO - DEBUG HASH RESULT: df0919ed...
2026-01-15 10:18:05,971 - dq_comparison - INFO - DEBUG HASH ROW: PostalCode: '10004.0' -> '10004' | Phone: '4445556666' -> '4445556666' | City: 'Seattle' -> 'seattle' | CustomerName: 'Alice Brown' -> 'alice brown' | Country: 'USA' -> 'usa'
2026-01-15 10:18:05,971 - dq_comparison - INFO - DEBUG HASH STRING: 10004|4445556666|seattle|alice brown|usa...
2026-01-15 10:18:05,971 - dq_comparison - INFO - DEBUG HASH RESULT: b821cfd8...
2026-01-15 10:18:05,971 - dq_comparison - INFO - DEBUG HASH ROW: PostalCode: '10005.0' -> '10005' | Phone: '3334445555' -> '3334445555' | City: 'Miami' -> 'miami' | CustomerName: 'Charlie Wilson' -> 'charlie wilson' | Country: 'USA' -> 'usa'
2026-01-15 10:18:05,972 - dq_comparison - INFO - DEBUG HASH STRING: 10005|3334445555|miami|charlie wilson|usa...
2026-01-15 10:18:05,972 - dq_comparison - INFO - DEBUG HASH RESULT: 06d1d497...
2026-01-15 10:18:05,972 - dq_comparison - INFO - DEBUG HASH ROW: PostalCode: '10001.0' -> '10001' | Phone: '1234567890' -> '1234567890' | City: 'New York' -> 'new york' | CustomerName: 'John Doe' -> 'john doe' | Country: 'USA' -> 'usa'
2026-01-15 10:18:05,972 - dq_comparison - INFO - DEBUG HASH STRING: 10001|1234567890|new york|john doe|usa...
2026-01-15 10:18:05,972 - dq_comparison - INFO - DEBUG HASH RESULT: 25d1f562...
2026-01-15 10:18:05,973 - dq_comparison - INFO - DEBUG HASH ROW: PostalCode: '10006.0' -> '10006' | Phone: '2223334444' -> '2223334444' | City: 'Atlanta' -> 'atlanta' | CustomerName: 'sai kumar' -> 'sai kumar' | Country: 'USA' -> 'usa'
2026-01-15 10:18:05,976 - dq_comparison - INFO - DEBUG HASH STRING: 10006|2223334444|atlanta|sai kumar|usa...
2026-01-15 10:18:05,976 - dq_comparison - INFO - DEBUG HASH RESULT: efe010ea...
2026-01-15 10:18:05,977 - dq_comparison - INFO - DEBUG HASH ROW: PostalCode: '10007.0' -> '10007' | Phone: '1112223333' -> '1112223333' | City: 'Denver' -> 'denver' | CustomerName: 'Sarah Chen' -> 'sarah chen' | Country: 'USA' -> 'usa'
2026-01-15 10:18:05,977 - dq_comparison - INFO - DEBUG HASH STRING: 10007|1112223333|denver|sarah chen|usa...
2026-01-15 10:18:05,977 - dq_comparison - INFO - DEBUG HASH RESULT: a9ed8b9a...
2026-01-15 10:18:05,978 - dq_comparison - INFO - DEBUG HASH ROW: PostalCode: 'nan' -> 'NULL' | Phone: '9998887777' -> '9998887777' | City: 'Phoenix' -> 'phoenix' | CustomerName: 'Mike Davis' -> 'mike davis' | Country: 'USA' -> 'usa'
2026-01-15 10:18:05,978 - dq_comparison - INFO - DEBUG HASH STRING: NULL|9998887777|phoenix|mike davis|usa...
2026-01-15 10:18:05,978 - dq_comparison - INFO - DEBUG HASH RESULT: 8cd02af5...
2026-01-15 10:18:05,979 - dq_comparison - INFO - DEBUG HASH ROW: PostalCode: '10009.0' -> '10009' | Phone: '6667778888' -> '6667778888' | City: 'Austin' -> 'austin' | CustomerName: 'Lisa Wang' -> 'lisa wang' | Country: 'USA' -> 'usa'
2026-01-15 10:18:05,979 - dq_comparison - INFO - DEBUG HASH STRING: 10009|6667778888|austin|lisa wang|usa...
2026-01-15 10:18:05,979 - dq_comparison - INFO - DEBUG HASH RESULT: f45ce776...
2026-01-15 10:18:05,979 - dq_comparison - INFO - DEBUG HASH ROW: PostalCode: '10009.0' -> '10009' | Phone: '7778889999' -> '7778889999' | City: 'Portland' -> 'portland' | CustomerName: 'Tom Wilson' -> 'tom wilson' | Country: 'USA' -> 'usa'
2026-01-15 10:18:05,979 - dq_comparison - INFO - DEBUG HASH STRING: 10009|7778889999|portland|tom wilson|usa...
2026-01-15 10:18:05,980 - dq_comparison - INFO - DEBUG HASH RESULT: e9ee6f80...
2026-01-15 10:18:05,980 - dq_comparison - INFO - DEBUG HASH ROW: PostalCode: '10010.0' -> '10010' | Phone: '8889990000' -> '8889990000' | City: 'Detroit' -> 'detroit' | CustomerName: 'None' -> 'NULL' | Country: 'USA' -> 'usa'
2026-01-15 10:18:05,980 - dq_comparison - INFO - DEBUG HASH STRING: 10010|8889990000|detroit|NULL|usa...
2026-01-15 10:18:05,980 - dq_comparison - INFO - DEBUG HASH RESULT: 22e8d550...
2026-01-15 10:18:05,980 - dq_comparison - INFO - === DEBUG: SAMPLE HASHES ===
2026-01-15 10:18:05,981 - dq_comparison - INFO - Hash 1: 25d1f562fa3cfb94... (sample row 0)
2026-01-15 10:18:05,981 - dq_comparison - INFO - Hash 2: 943a9e0416f3435e... (sample row 1)
2026-01-15 10:18:05,981 - dq_comparison - INFO - Hash 3: df0919ed8f2f61b7... (sample row 2)
2026-01-15 10:18:05,981 - dq_comparison - INFO - Generating hashes for target data (15 rows)...
2026-01-15 10:18:05,984 - dq_comparison - INFO - 
======================================================================
2026-01-15 10:18:05,984 - dq_comparison - INFO - 🔍 DEBUG: ANALYZING WHY HASHES DON'T MATCH
2026-01-15 10:18:05,984 - dq_comparison - INFO - ======================================================================
2026-01-15 10:18:05,984 - dq_comparison - INFO - 
--- Analyzing Row 0 ---
2026-01-15 10:18:05,985 - dq_comparison - INFO - Column 'PostalCode' → 'postalcode':
2026-01-15 10:18:05,985 - dq_comparison - INFO -   Source: '10001.0' (type: float64) → '10001'
2026-01-15 10:18:05,985 - dq_comparison - INFO -   Target: '10001.0' (type: float64) → '10001'
2026-01-15 10:18:05,985 - dq_comparison - INFO -   Match after normalization: ✅ YES
2026-01-15 10:18:05,986 - dq_comparison - INFO - Column 'Phone' → 'phone':
2026-01-15 10:18:05,986 - dq_comparison - INFO -   Source: '1234567890' (type: int64) → '1234567890'
2026-01-15 10:18:05,986 - dq_comparison - INFO -   Target: '1234567890' (type: int64) → '1234567890'
2026-01-15 10:18:05,986 - dq_comparison - INFO -   Match after normalization: ✅ YES
2026-01-15 10:18:05,986 - dq_comparison - INFO - Column 'City' → 'city':
2026-01-15 10:18:05,986 - dq_comparison - INFO -   Source: 'New York' (type: str) → 'new york'
2026-01-15 10:18:05,987 - dq_comparison - INFO -   Target: 'New York' (type: str) → 'new york'
2026-01-15 10:18:05,987 - dq_comparison - INFO -   Match after normalization: ✅ YES
2026-01-15 10:18:05,987 - dq_comparison - INFO - Column 'CustomerName' → 'customername':
2026-01-15 10:18:05,987 - dq_comparison - INFO -   Source: 'John Doe' (type: str) → 'john doe'
2026-01-15 10:18:05,987 - dq_comparison - INFO -   Target: 'John Doe' (type: str) → 'john doe'
2026-01-15 10:18:05,987 - dq_comparison - INFO -   Match after normalization: ✅ YES
2026-01-15 10:18:05,988 - dq_comparison - INFO - Column 'Country' → 'country':
2026-01-15 10:18:05,991 - dq_comparison - INFO -   Source: 'USA' (type: str) → 'usa'
2026-01-15 10:18:05,992 - dq_comparison - INFO -   Target: 'USA' (type: str) → 'usa'
2026-01-15 10:18:05,992 - dq_comparison - INFO -   Match after normalization: ✅ YES
2026-01-15 10:18:05,992 - dq_comparison - INFO - 
Hash components for Row 0:
2026-01-15 10:18:05,993 - dq_comparison - INFO - Source hash string start: 10001|1234567890|new york...
2026-01-15 10:18:05,993 - dq_comparison - INFO - Target hash string start: 10001|1234567890|new york...
2026-01-15 10:18:05,993 - dq_comparison - INFO - Same? ✅ YES
2026-01-15 10:18:05,993 - dq_comparison - INFO - 
--- Analyzing Row 1 ---
2026-01-15 10:18:05,994 - dq_comparison - INFO - Column 'PostalCode' → 'postalcode':
2026-01-15 10:18:05,994 - dq_comparison - INFO -   Source: '10002.0' (type: float64) → '10002'
2026-01-15 10:18:05,994 - dq_comparison - INFO -   Target: '10002.0' (type: float64) → '10002'
2026-01-15 10:18:05,994 - dq_comparison - INFO -   Match after normalization: ✅ YES
2026-01-15 10:18:05,994 - dq_comparison - INFO - Column 'Phone' → 'phone':
2026-01-15 10:18:05,995 - dq_comparison - INFO -   Source: '9876543210' (type: int64) → '9876543210'
2026-01-15 10:18:05,995 - dq_comparison - INFO -   Target: '9876543210' (type: int64) → '9876543210'
2026-01-15 10:18:05,995 - dq_comparison - INFO -   Match after normalization: ✅ YES
2026-01-15 10:18:05,995 - dq_comparison - INFO - Column 'City' → 'city':
2026-01-15 10:18:05,995 - dq_comparison - INFO -   Source: 'India' (type: str) → 'india'
2026-01-15 10:18:05,995 - dq_comparison - INFO -   Target: 'Chicago' (type: str) → 'chicago'
2026-01-15 10:18:05,996 - dq_comparison - INFO -   Match after normalization: ❌ NO
2026-01-15 10:18:05,996 - dq_comparison - INFO - Column 'CustomerName' → 'customername':
2026-01-15 10:18:05,996 - dq_comparison - INFO -   Source: 'Jane Smith' (type: str) → 'jane smith'
2026-01-15 10:18:05,996 - dq_comparison - INFO -   Target: 'Jane Smith' (type: str) → 'jane smith'
2026-01-15 10:18:05,997 - dq_comparison - INFO -   Match after normalization: ✅ YES
2026-01-15 10:18:05,997 - dq_comparison - INFO - Column 'Country' → 'country':
2026-01-15 10:18:05,997 - dq_comparison - INFO -   Source: 'USA' (type: str) → 'usa'
2026-01-15 10:18:05,998 - dq_comparison - INFO -   Target: 'USA' (type: str) → 'usa'
2026-01-15 10:18:05,998 - dq_comparison - INFO -   Match after normalization: ✅ YES
2026-01-15 10:18:05,998 - dq_comparison - INFO - 
Hash components for Row 1:
2026-01-15 10:18:05,998 - dq_comparison - INFO - Source hash string start: 10002|9876543210|india...
2026-01-15 10:18:05,999 - dq_comparison - INFO - Target hash string start: 10002|9876543210|chicago...
2026-01-15 10:18:05,999 - dq_comparison - INFO - Same? ❌ NO
2026-01-15 10:18:05,999 - dq_comparison - INFO - 
--- Analyzing Row 2 ---
2026-01-15 10:18:06,000 - dq_comparison - INFO - Column 'PostalCode' → 'postalcode':
2026-01-15 10:18:06,000 - dq_comparison - INFO -   Source: '10003.0' (type: float64) → '10003'
2026-01-15 10:18:06,000 - dq_comparison - INFO -   Target: '10003.0' (type: float64) → '10003'
2026-01-15 10:18:06,000 - dq_comparison - INFO -   Match after normalization: ✅ YES
2026-01-15 10:18:06,001 - dq_comparison - INFO - Column 'Phone' → 'phone':
2026-01-15 10:18:06,001 - dq_comparison - INFO -   Source: '5551234567' (type: int64) → '5551234567'
2026-01-15 10:18:06,001 - dq_comparison - INFO -   Target: '5551234567' (type: int64) → '5551234567'
2026-01-15 10:18:06,001 - dq_comparison - INFO -   Match after normalization: ✅ YES
2026-01-15 10:18:06,002 - dq_comparison - INFO - Column 'City' → 'city':
2026-01-15 10:18:06,002 - dq_comparison - INFO -   Source: 'Boston' (type: str) → 'boston'
2026-01-15 10:18:06,002 - dq_comparison - INFO -   Target: 'Boston' (type: str) → 'boston'
2026-01-15 10:18:06,002 - dq_comparison - INFO -   Match after normalization: ✅ YES
2026-01-15 10:18:06,002 - dq_comparison - INFO - Column 'CustomerName' → 'customername':
2026-01-15 10:18:06,003 - dq_comparison - INFO -   Source: 'Bob Johnson' (type: str) → 'bob johnson'
2026-01-15 10:18:06,003 - dq_comparison - INFO -   Target: 'Bob Johnson' (type: str) → 'bob johnson'
2026-01-15 10:18:06,003 - dq_comparison - INFO -   Match after normalization: ✅ YES
2026-01-15 10:18:06,007 - dq_comparison - INFO - Column 'Country' → 'country':
2026-01-15 10:18:06,007 - dq_comparison - INFO -   Source: 'USA' (type: str) → 'usa'
2026-01-15 10:18:06,007 - dq_comparison - INFO -   Target: 'USA' (type: str) → 'usa'
2026-01-15 10:18:06,008 - dq_comparison - INFO -   Match after normalization: ✅ YES
2026-01-15 10:18:06,008 - dq_comparison - INFO - 
Hash components for Row 2:
2026-01-15 10:18:06,008 - dq_comparison - INFO - Source hash string start: 10003|5551234567|boston...
2026-01-15 10:18:06,008 - dq_comparison - INFO - Target hash string start: 10003|5551234567|boston...
2026-01-15 10:18:06,008 - dq_comparison - INFO - Same? ✅ YES
2026-01-15 10:18:06,009 - dq_comparison - INFO - 
--- Column Data Types Analysis ---
2026-01-15 10:18:06,009 - dq_comparison - INFO - Column 1: 'PostalCode' (float64) ↔ 'postalcode' (float64)
2026-01-15 10:18:06,010 - dq_comparison - INFO -   Sample: Source='10001.0', Target='10001.0'
2026-01-15 10:18:06,010 - dq_comparison - INFO - Column 2: 'Phone' (int64) ↔ 'phone' (int64)
2026-01-15 10:18:06,010 - dq_comparison - INFO -   Sample: Source='1234567890', Target='1234567890'
2026-01-15 10:18:06,010 - dq_comparison - INFO - Column 3: 'City' (object) ↔ 'city' (object)
2026-01-15 10:18:06,011 - dq_comparison - INFO -   Sample: Source='New York', Target='New York'
2026-01-15 10:18:06,011 - dq_comparison - INFO - Column 4: 'CustomerName' (object) ↔ 'customername' (object)
2026-01-15 10:18:06,011 - dq_comparison - INFO -   Sample: Source='John Doe', Target='John Doe'
2026-01-15 10:18:06,011 - dq_comparison - INFO - Column 5: 'Country' (category) ↔ 'country' (category)
2026-01-15 10:18:06,011 - dq_comparison - INFO -   Sample: Source='USA', Target='USA'
2026-01-15 10:18:06,012 - dq_comparison - INFO - PERFORMING DETAILED ROW-LEVEL COMPARISON WITH PAGINATION...
2026-01-15 10:18:06,030 - dq_comparison - WARNING - Error processing mismatch row 1: 'str' object has no attribute 'join_output'
2026-01-15 10:18:06,045 - dq_comparison - WARNING - Error processing mismatch row 6: 'str' object has no attribute 'join_output'
2026-01-15 10:18:06,059 - dq_comparison - WARNING - Error processing mismatch row 9: 'str' object has no attribute 'join_output'
2026-01-15 10:18:06,073 - dq_comparison - INFO - 
================================================================================
2026-01-15 10:18:06,073 - dq_comparison - INFO - ROW 14: PostalCode: 'NULL' ≠ '10011.0'; Phone: 'NULL' ≠ '9990001111'; City: 'NULL' ≠ 'Las Vegas'; CustomerName: 'NULL' ≠ 'Robert Brown'; Country: 'NULL' ≠ 'USA'; ... (+5 more differences)
2026-01-15 10:18:06,074 - dq_comparison - INFO - --------------------------------------------------------------------------------
2026-01-15 10:18:06,075 - dq_comparison - INFO - SOURCE DATA: ROW NOT FOUND (position 14)
2026-01-15 10:18:06,075 - dq_comparison - INFO - TARGET DATA: postalcode: 10011.0; phone: 9990001111; city: Las Vegas; customername: Robert Brown; country: USA; salary: 67000.0; state: AS; joindate: 1700438400000000000; department: IT; email: robert@email.com
2026-01-15 10:18:06,091 - dq_comparison - INFO - 
================================================================================
2026-01-15 10:18:06,091 - dq_comparison - INFO - ROW 15: PostalCode: 'NULL' ≠ '10012.0'; Phone: 'NULL' ≠ '1112222'; City: 'NULL' ≠ 'Orlando'; CustomerName: 'NULL' ≠ 'Nancy Davis'; Country: 'NULL' ≠ 'USA'; ... (+4 more differences)
2026-01-15 10:18:06,091 - dq_comparison - INFO - --------------------------------------------------------------------------------
2026-01-15 10:18:06,092 - dq_comparison - INFO - SOURCE DATA: ROW NOT FOUND (position 15)
2026-01-15 10:18:06,093 - dq_comparison - INFO - TARGET DATA: postalcode: 10012.0; phone: 1112222; city: Orlando; customername: Nancy Davis; country: USA; salary: NULL; state: BR; joindate: 1701734400000000000; department: HR; email: nancy@email.com
2026-01-15 10:18:06,107 - dq_comparison - INFO - 
================================================================================
2026-01-15 10:18:06,107 - dq_comparison - INFO - ROW 16: PostalCode: 'NULL' ≠ '10013.0'; Phone: 'NULL' ≠ '1112223333'; City: 'NULL' ≠ 'San Diego'; CustomerName: 'NULL' ≠ 'Kevin Lee'; Country: 'NULL' ≠ 'USA'; ... (+5 more differences)
2026-01-15 10:18:06,108 - dq_comparison - INFO - --------------------------------------------------------------------------------
2026-01-15 10:18:06,108 - dq_comparison - INFO - SOURCE DATA: ROW NOT FOUND (position 16)
2026-01-15 10:18:06,108 - dq_comparison - INFO - TARGET DATA: postalcode: 10013.0; phone: 1112223333; city: San Diego; customername: Kevin Lee; country: USA; salary: 49000.0; state: GA; joindate: 1704844800000000000; department: Sales; email: kevin@email.com
2026-01-15 10:18:06,108 - dq_comparison - INFO - 
================================================================================
2026-01-15 10:18:06,109 - dq_comparison - INFO - DETAILED MISMATCH SUMMARY:
2026-01-15 10:18:06,109 - dq_comparison - INFO -   Total mismatches found: 6
2026-01-15 10:18:06,109 - dq_comparison - INFO -   Detailed comparisons logged: 6
2026-01-15 10:18:06,109 - dq_comparison - INFO -   First 10 rows displayed above
2026-01-15 10:18:06,109 - dq_comparison - INFO -   All mismatches stored in database with complete data
2026-01-15 10:18:06,110 - dq_comparison - INFO - ================================================================================
2026-01-15 10:18:06,110 - dq_comparison - INFO - Hash-based Comparison Results (with duplicate handling):
2026-01-15 10:18:06,110 - dq_comparison - INFO -   • Unique source hashes: 11
2026-01-15 10:18:06,110 - dq_comparison - INFO -   • Unique target hashes: 14
2026-01-15 10:18:06,110 - dq_comparison - INFO -   • Common hashes: 8
2026-01-15 10:18:06,111 - dq_comparison - INFO -   • Common rows (counting duplicates): 9
2026-01-15 10:18:06,111 - dq_comparison - INFO -   • Rows only in source (counting duplicates): 3
2026-01-15 10:18:06,111 - dq_comparison - INFO -   • Rows only in target (counting duplicates): 6
2026-01-15 10:18:06,111 - dq_comparison - INFO - Found 3 source-only rows
2026-01-15 10:18:06,115 - dq_comparison - INFO - Found 6 target-only rows
2026-01-15 10:18:06,115 - dq_comparison - INFO - HASH-ONLY COMPARISON COMPLETED
2026-01-15 10:18:06,115 - dq_comparison - INFO - Returning counts for simple scoring:
2026-01-15 10:18:06,115 - dq_comparison - INFO -   Common rows: 9
2026-01-15 10:18:06,116 - dq_comparison - INFO -   Unique to source: 3
2026-01-15 10:18:06,116 - dq_comparison - INFO -   Unique to target: 6
2026-01-15 10:18:06,116 - dq_comparison - INFO -   Value mismatches: 90
2026-01-15 10:18:06,117 - dq_comparison - INFO -   Missing rows: 3
2026-01-15 10:18:06,117 - dq_comparison - INFO -   Extra rows: 6
2026-01-15 10:18:06,117 - dq_comparison - INFO - 
========================================================================================================================
Comparison of specific row data where differences were detected.
========================================================================================================================
Row   | Mismatch Summary                         | Source Data                         | Target Data                        
------------------------------------------------------------------------------------------------------------------------
3     | City: 'India' ≠ 'Chicago'                | PostalCode: 100... (+2 more columns) (+7 more) | postalcode: 100... (+2 more columns) (+7 more)
8     | CustomerName: 'sai kumar' ≠ 'David Lee'  | PostalCode: 100... (+2 more columns) (+7 more) | postalcode: 100... (+2 more columns) (+7 more)
11    | PostalCode: '10009.0' ≠ '10008.0'        | PostalCode: 100... (+2 more columns) (+7 more) | postalcode: 100... (+2 more columns) (+7 more)
14    | PostalCode: 'NULL' ≠ '10011.0'; Phone: ' | PostalCode: NUL... (+2 more columns) (+7 more) | postalcode: 100... (+2 more columns) (+7 more)
15    | PostalCode: 'NULL' ≠ '10012.0'; Phone: ' | PostalCode: NUL... (+2 more columns) (+7 more) | postalcode: 100... (+2 more columns) (+7 more)
16    | PostalCode: 'NULL' ≠ '10013.0'; Phone: ' | PostalCode: NUL... (+2 more columns) (+7 more) | postalcode: 100... (+2 more columns) (+7 more)
------------------------------------------------------------------------------------------------------------------------
Showing all 6 mismatched rows.
========================================================================================================================
2026-01-15 10:18:06,118 - dq_comparison - INFO - Returning enhanced mismatch structure with 6 detailed mismatches
2026-01-15 10:18:06,118 - dq_comparison - INFO - New structure: 6 detailed mismatches
2026-01-15 10:18:06,118 - dq_comparison - INFO - 
6️⃣ DATA QUALITY ANALYSIS
2026-01-15 10:18:06,118 - dq_comparison - INFO - Analyzing data quality metrics...
2026-01-15 10:18:06,129 - dq_comparison - INFO - Null values - Source: 5 (4.17%), Target: 7 (4.67%)
2026-01-15 10:18:06,132 - dq_comparison - INFO - Duplicate rows (normalized) - Source: 1, Target: 1
2026-01-15 10:18:06,134 - dq_comparison - INFO - Source duplicate samples: ['Row 2', 'Row 7']
2026-01-15 10:18:06,135 - dq_comparison - INFO - Target duplicate samples: ['Row 2', 'Row 7']
2026-01-15 10:18:06,144 - dq_error_log - INFO - Retrieved 8 error logs for session CMP_20260115_101805
2026-01-15 10:18:06,146 - dq_comparison - INFO - 
📊 SIMPLE SCORING CALCULATION:
2026-01-15 10:18:06,146 - dq_comparison - INFO -   Source rows: 12
2026-01-15 10:18:06,148 - dq_comparison - INFO -   Common rows (matched): 9
2026-01-15 10:18:06,148 - dq_comparison - INFO -   Calculation: (9 / 12) * 100 = 75.00%
2026-01-15 10:18:06,148 - dq_comparison - INFO -   Explanation: 9 matched rows out of 12 total source rows
2026-01-15 10:18:06,149 - dq_comparison - INFO - 
=== AUDIT LOGGING SECTION ===
2026-01-15 10:18:06,152 - dq_comparison - INFO - 🔍 Audit logging is ENABLED in APP_SETTINGS
2026-01-15 10:18:06,152 - dq_audit - INFO - Audit class initialized with database: dq_checks
2026-01-15 10:18:06,153 - dq_comparison - INFO - Attempting to log audit record for session: CMP_20260115_101805
2026-01-15 10:18:06,153 - dq_audit - INFO - Starting database insertion for comparison...
2026-01-15 10:18:06,169 - dq_audit - INFO - Inserted comparison record with ID: 686
2026-01-15 10:18:06,169 - dq_comparison - INFO - ✅ Audit record logged successfully (ID: 686)
2026-01-15 10:18:06,169 - dq_comparison - INFO - 
======================================================================
2026-01-15 10:18:06,170 - dq_comparison - INFO - 📊 COMPARISON RESULTS SUMMARY
2026-01-15 10:18:06,170 - dq_comparison - INFO - ======================================================================
2026-01-15 10:18:06,170 - dq_comparison - INFO - Session ID: CMP_20260115_101805
2026-01-15 10:18:06,170 - dq_comparison - INFO - Source: Database: mysql - dq_checks.customers_bkp (12 rows)
2026-01-15 10:18:06,170 - dq_comparison - INFO - Target: Database: postgresql - dq_checks.customers (15 rows)
2026-01-15 10:18:06,170 - dq_comparison - INFO - Selected columns: 10
2026-01-15 10:18:06,170 - dq_comparison - INFO - ----------------------------------------------------------------------
2026-01-15 10:18:06,171 - dq_comparison - INFO - 1️⃣ Row count match: ❌ No
2026-01-15 10:18:06,171 - dq_comparison - INFO -    Missing in target: 0 rows
2026-01-15 10:18:06,172 - dq_comparison - INFO -    Extra in target: 3 rows
2026-01-15 10:18:06,173 - dq_comparison - INFO - 2️⃣ Column structure match: ❌ No
2026-01-15 10:18:06,174 - dq_comparison - INFO -    Missing in target: 10 columns
2026-01-15 10:18:06,175 - dq_comparison - INFO -      ['CustomerName', 'Email', 'Phone', 'Salary', 'Department']
2026-01-15 10:18:06,175 - dq_comparison - INFO -    Missing in source: 10 columns
2026-01-15 10:18:06,176 - dq_comparison - INFO -      ['customername', 'email', 'phone', 'salary', 'department']
2026-01-15 10:18:06,176 - dq_comparison - INFO - 3️ Primary key validation: ❌ Failed
2026-01-15 10:18:06,176 - dq_comparison - INFO - 4️ Table metadata: ❌ Mismatch
2026-01-15 10:18:06,177 - dq_comparison - INFO -    • Row Count: 12 vs 15
2026-01-15 10:18:06,177 - dq_comparison - INFO - 5️⃣ Common rows (both Mysql Database and Postgresql Database): 9 (75.00% of Mysql Database)
2026-01-15 10:18:06,177 - dq_comparison - INFO - 6️⃣ Mysql Database-only rows: 3 (present ONLY in Mysql Database, NOT in Postgresql Database)
2026-01-15 10:18:06,177 - dq_comparison - INFO - 7️⃣ Postgresql Database-only rows: 6 (present ONLY in Postgresql Database, NOT in Mysql Database)
2026-01-15 10:18:06,177 - dq_comparison - INFO - 8️⃣ Column value mismatches: 0
2026-01-15 10:18:06,178 - dq_comparison - INFO - 9️ Data quality match: ❌ No
2026-01-15 10:18:06,178 - dq_comparison - INFO - 📈 DQ Score: 75.00%
2026-01-15 10:18:06,178 - dq_comparison - INFO - 📊 Calculation: (9 / 12) * 100 = 75.00%
2026-01-15 10:18:06,178 - dq_comparison - INFO - ======================================================================
2026-01-15 10:18:06,179 - dq_comparison - INFO - 
⚠️  FAIR MATCH! Significant differences found.
2026-01-15 10:18:06,179 - dq_comparison - INFO - 
🔍 NORMALIZATION APPLIED:
2026-01-15 10:18:06,179 - dq_comparison - INFO -    • NULL values → 'NULL' (consistent representation)
2026-01-15 10:18:06,179 - dq_comparison - INFO -    • Dates → YYYY-MM-DD format
2026-01-15 10:18:06,179 - dq_comparison - INFO -    • Strings → trimmed + lowercase
2026-01-15 10:18:06,180 - dq_comparison - INFO -    • Numeric values → standardized format
2026-01-15 10:18:06,180 - dq_comparison - INFO -    • Phone numbers → digits only, ALL leading zeros removed
2026-01-15 10:18:06,180 - dq_comparison - INFO -    • Extra whitespace removed
2026-01-15 10:18:06,181 - dq_comparison - INFO - 
🔍 DETAILED ERROR ANALYSIS:
2026-01-15 10:18:06,181 - dq_comparison - INFO - --------------------------------------------------
2026-01-15 10:18:06,181 - dq_comparison - INFO - 📊 SOURCE-ONLY ROWS: 3 rows
2026-01-15 10:18:06,181 - dq_comparison - INFO -    Present only in Mysql Database, missing from Postgresql Database
2026-01-15 10:18:06,182 - dq_comparison - INFO - 📊 TARGET-ONLY ROWS: 6 rows
2026-01-15 10:18:06,182 - dq_comparison - INFO -    Present only in Postgresql Database, extra (not in Mysql Database)
2026-01-15 10:18:06,192 - dq_error_log - INFO - Retrieved 8 errors for session CMP_20260115_101805
2026-01-15 10:18:06,193 - dq_comparison - INFO - 
📋 SAMPLE ERRORS (8 found):
2026-01-15 10:18:06,193 - dq_comparison - INFO - 
1. Row 0 - Metadata Row Count
2026-01-15 10:18:06,193 - dq_comparison - INFO -    Column: 
2026-01-15 10:18:06,194 - dq_comparison - INFO -    Metadata mismatch: Row Count
2026-01-15 10:18:06,194 - dq_comparison - INFO - 
2. Row 0 - Key Field Missing
2026-01-15 10:18:06,195 - dq_comparison - INFO -    Column: PostalCode
2026-01-15 10:18:06,195 - dq_comparison - INFO -    Primary key field 'PostalCode' missing in one or both datasets
2026-01-15 10:18:06,195 - dq_comparison - INFO - 
3. Row 3 - Row Data Mismatch
2026-01-15 10:18:06,196 - dq_comparison - INFO -    Row 3: Detailed data mismatch detected
2026-01-15 10:18:06,196 - dq_comparison - INFO - 
💡 For complete error details, run:
2026-01-15 10:18:06,196 - dq_comparison - INFO -    USE dq_checks;
2026-01-15 10:18:06,196 - dq_comparison - INFO -    SELECT excel_row, column_name, error_type, error_description,
2026-01-15 10:18:06,196 - dq_comparison - INFO -           actual_value, expected_value
2026-01-15 10:18:06,197 - dq_comparison - INFO -    FROM dq_error_logs
2026-01-15 10:18:06,197 - dq_comparison - INFO -    WHERE session_id = 'CMP_20260115_101805'
2026-01-15 10:18:06,197 - dq_comparison - INFO -    ORDER BY excel_row, column_name;
2026-01-15 10:18:06,212 - dq_comparison - INFO - 
✅ Comparison completed! Session ID: CMP_20260115_101805
2026-01-15 10:18:06,223 - dq_error_log - INFO - Retrieved 9 error logs for session CMP_20260115_101805
2026-01-15 10:18:06,235 - dq_error_log - INFO - Retrieved summary: 9 total errors for session CMP_20260115_101805
2026-01-15 10:18:06,235 - dq_audit - INFO - Audit class initialized with database: dq_checks
2026-01-15 10:18:06,249 - dq_audit - INFO - Retrieved 1 audit logs for session CMP_20260115_101805
2026-01-15 10:18:06,251 - dq_comparison - INFO - 
🔍 Final results verification:
2026-01-15 10:18:06,251 - dq_comparison - INFO -    Session ID: CMP_20260115_101805
2026-01-15 10:18:06,252 - dq_comparison - INFO -    DQ Score (Simple %): 75.00%
2026-01-15 10:18:06,252 - dq_comparison - INFO -    Source rows: 12
2026-01-15 10:18:06,253 - dq_comparison - INFO -    Matched rows: 9
2026-01-15 10:18:06,253 - dq_comparison - INFO -    Calculation: (9 / 12) * 100
2026-01-15 10:18:06,253 - __main__ - INFO - Source-Target Comparison completed successfully
2026-01-15 10:18:06,253 - __main__ - INFO - Displaying main menu options to user
2026-01-15 10:18:09,477 - __main__ - INFO - User selected option: 6
2026-01-15 10:18:09,477 - __main__ - INFO - User session ended. Duration: 0:00:31.505766
2026-01-15 10:18:09,478 - __main__ - INFO - 👋 Thank you for using Universal Data Quality Framework!
