2026-01-17 20:27:20,822 - root - INFO - CLI Mode Logging Initialized
2026-01-17 20:27:20,822 - root - INFO - CLI logs will be saved to: logs/dq_framework_20260117_202720.log
2026-01-17 20:27:20,822 - __main__ - INFO - 🚀 UNIVERSAL DATA QUALITY FRAMEWORK INITIALIZED
2026-01-17 20:27:20,823 - __main__ - INFO - Starting system resource check
2026-01-17 20:27:20,829 - __main__ - INFO - Total RAM: 15.7 GB
2026-01-17 20:27:20,829 - __main__ - INFO - Available RAM: 2.8 GB
2026-01-17 20:27:20,829 - __main__ - INFO - Memory used: 82.0%
2026-01-17 20:27:20,829 - __main__ - INFO - Memory status: OK
2026-01-17 20:27:20,831 - __main__ - INFO - Free disk space: 256.5 GB
2026-01-17 20:27:20,831 - __main__ - INFO - Disk used: 46.2%
2026-01-17 20:27:20,831 - __main__ - INFO - Disk space: OK
2026-01-17 20:27:21,333 - __main__ - INFO - CPU cores: 8
2026-01-17 20:27:21,333 - __main__ - INFO - CPU usage: 19.0%
2026-01-17 20:27:21,333 - __main__ - INFO - Python version: 3.12.4
2026-01-17 20:27:21,333 - __main__ - INFO - System platform: win32
2026-01-17 20:27:21,333 - __main__ - INFO - User session started at: 2026-01-17 20:27:21.333464
2026-01-17 20:27:21,334 - __main__ - INFO - Displaying main menu options to user
2026-01-17 20:27:22,258 - __main__ - INFO - User selected option: 2
2026-01-17 20:27:22,258 - __main__ - INFO - Starting Source-Target Comparison module
2026-01-17 20:27:22,262 - dq_comparison - INFO - STARTING UNIVERSAL SOURCE-TARGET COMPARISON TOOL
2026-01-17 20:27:22,263 - dq_comparison - INFO - LOADING SOURCE AND TARGET DATA
2026-01-17 20:27:22,263 - dq_comparison - INFO - 
==================================================
2026-01-17 20:27:22,264 - dq_comparison - INFO - 🔗 SOURCE DATA CONFIGURATION
2026-01-17 20:27:22,264 - dq_comparison - INFO - ==================================================
2026-01-17 20:27:23,624 - dq_comparison - INFO - 
🗄️ SOURCE DATABASE CONFIGURATION
2026-01-17 20:27:23,626 - dq_comparison - INFO - ----------------------------------------
2026-01-17 20:27:26,737 - dq_comparison - INFO - Selected database type code: mysql
2026-01-17 20:27:27,819 - dq_comparison - INFO - User selected Browse and Select mode for SOURCE
2026-01-17 20:27:27,826 - database_navigator - INFO - DatabaseNavigator initialized
2026-01-17 20:27:27,826 - database_navigator - INFO - Starting database navigation...
2026-01-17 20:27:27,826 - database_navigator - INFO - Database type: mysql
2026-01-17 20:27:27,827 - database_navigator - INFO - Getting database configuration...
2026-01-17 20:27:30,328 - database_navigator - INFO - Connecting to MYSQL...
2026-01-17 20:27:30,435 - database_navigator - INFO - Successfully connected to MYSQL!
2026-01-17 20:27:30,438 - database_navigator - INFO - get_databases() called. db_type: mysql, connection exists: True
2026-01-17 20:27:30,440 - database_navigator - INFO - Found 13 databases
2026-01-17 20:27:32,299 - database_navigator - INFO - Selected database: dq_checks
2026-01-17 20:27:32,303 - database_navigator - INFO - Found 1 schemas
2026-01-17 20:27:33,433 - database_navigator - INFO - Selected schema: dq_checks
2026-01-17 20:27:33,435 - database_navigator - INFO - Found 18 tables in schema 'dq_checks'
2026-01-17 20:27:36,927 - database_navigator - INFO - Selected table: customers_bkp
2026-01-17 20:27:36,932 - database_navigator - INFO - Selection complete: {'type': 'mysql', 'database': 'dq_checks', 'schema': 'dq_checks', 'table': 'customers_bkp', 'selection_mode': 'hierarchical', 'host': 'localhost', 'port': '3306', 'user': 'root', 'password': 'root'}
2026-01-17 20:27:36,933 - dq_comparison - INFO - Selected via navigation for SOURCE: dq_checks.dq_checks.customers_bkp
2026-01-17 20:27:36,933 - dq_unified - INFO - Loading data from DATABASE
2026-01-17 20:27:36,933 - dq_unified - INFO - Loading large database table: customers_bkp
2026-01-17 20:27:36,935 - dq_unified - INFO - Normalized DB config with schema: dq_checks
2026-01-17 20:27:36,946 - dq_unified - INFO - MySQL table customers_bkp has 12 rows
2026-01-17 20:27:36,947 - dq_unified - INFO - Loading 12 rows from MySQL...
2026-01-17 20:27:37,370 - dq_unified - INFO - Loaded 12 rows from MySQL
2026-01-17 20:27:37,378 - dq_unified - INFO - Memory optimization: 0.0MB -> 0.0MB (Saved: 0.0MB)
2026-01-17 20:27:37,379 - dq_unified - INFO - Loaded 12 rows, 10 columns. Memory: 111.3MB total, 0.0MB for dataframe
2026-01-17 20:27:37,379 - dq_comparison - INFO - SOURCE database loaded: 12 rows, 10 columns
2026-01-17 20:27:37,380 - dq_comparison - INFO - 
==================================================
2026-01-17 20:27:37,380 - dq_comparison - INFO - 🔗 TARGET DATA CONFIGURATION
2026-01-17 20:27:37,380 - dq_comparison - INFO - ==================================================
2026-01-17 20:27:41,318 - dq_comparison - INFO - 
🗄️ TARGET DATABASE CONFIGURATION
2026-01-17 20:27:41,319 - dq_comparison - INFO - ----------------------------------------
2026-01-17 20:27:42,366 - dq_comparison - INFO - Selected database type code: postgresql
2026-01-17 20:27:43,816 - dq_comparison - INFO - User selected Browse and Select mode for TARGET
2026-01-17 20:27:43,821 - dq_comparison - INFO - Converted 'postgresql' to 'postgres' for database_navigator compatibility
2026-01-17 20:27:43,823 - database_navigator - INFO - DatabaseNavigator initialized
2026-01-17 20:27:43,823 - database_navigator - INFO - Starting database navigation...
2026-01-17 20:27:43,823 - database_navigator - INFO - Database type: postgres
2026-01-17 20:27:43,824 - database_navigator - INFO - Getting database configuration...
2026-01-17 20:27:46,182 - database_navigator - INFO - Connecting to POSTGRES...
2026-01-17 20:27:46,183 - database_navigator - INFO - Connecting to PostgreSQL...
2026-01-17 20:27:46,184 - database_navigator - INFO - Connecting to PostgreSQL: host=localhost, port=5432, database=postgres, user=postgres
2026-01-17 20:27:46,303 - database_navigator - INFO - Connection object created: <connection object at 0x0000024AA967E350; dsn: 'user=postgres password=xxx dbname=postgres host=localhost port=5432', closed: 0>
2026-01-17 20:27:46,303 - database_navigator - INFO - ✅ PostgreSQL connection successful to database: postgres
2026-01-17 20:27:46,308 - database_navigator - INFO - get_databases() called. db_type: postgres, connection exists: True
2026-01-17 20:27:46,315 - database_navigator - INFO - Raw rows: [('dq_checks',), ('finewise-testdb',), ('postgres',)]
2026-01-17 20:27:46,315 - database_navigator - INFO - Found 3 databases
2026-01-17 20:27:47,621 - database_navigator - INFO - Selected database: dq_checks
2026-01-17 20:27:47,622 - database_navigator - INFO - Reconnecting to PostgreSQL database: dq_checks
2026-01-17 20:27:47,623 - database_navigator - INFO - Connecting to POSTGRES...
2026-01-17 20:27:47,624 - database_navigator - INFO - Connecting to PostgreSQL...
2026-01-17 20:27:47,624 - database_navigator - INFO - Connecting to PostgreSQL: host=localhost, port=5432, database=dq_checks, user=postgres
2026-01-17 20:27:47,729 - database_navigator - INFO - Connection object created: <connection object at 0x0000024AA967EBD0; dsn: 'user=postgres password=xxx dbname=dq_checks host=localhost port=5432', closed: 0>
2026-01-17 20:27:47,730 - database_navigator - INFO - ✅ PostgreSQL connection successful to database: dq_checks
2026-01-17 20:27:47,746 - database_navigator - INFO - Found 4 schemas
2026-01-17 20:27:49,095 - database_navigator - INFO - Selected schema: public
2026-01-17 20:27:49,098 - database_navigator - INFO - Ensuring connection to database: dq_checks for table list
2026-01-17 20:27:49,099 - database_navigator - INFO - Reconnecting to PostgreSQL database: dq_checks
2026-01-17 20:27:49,099 - database_navigator - INFO - Connecting to POSTGRES...
2026-01-17 20:27:49,100 - database_navigator - INFO - Connecting to PostgreSQL...
2026-01-17 20:27:49,100 - database_navigator - INFO - Connecting to PostgreSQL: host=localhost, port=5432, database=dq_checks, user=postgres
2026-01-17 20:27:49,220 - database_navigator - INFO - Connection object created: <connection object at 0x0000024AA967E8A0; dsn: 'user=postgres password=xxx dbname=dq_checks host=localhost port=5432', closed: 0>
2026-01-17 20:27:49,221 - database_navigator - INFO - ✅ PostgreSQL connection successful to database: dq_checks
2026-01-17 20:27:49,222 - database_navigator - INFO - Connected to database: dq_checks, schema: public
2026-01-17 20:27:49,248 - database_navigator - INFO - Found 5 tables in dq_checks.public: ['comparison_small_target13', 'customers', 'customers_bkp', 'employee', 'stg_transactions']
2026-01-17 20:27:49,249 - database_navigator - INFO - Found 5 tables in schema 'public'
2026-01-17 20:27:51,872 - database_navigator - INFO - Selected table: customers
2026-01-17 20:27:51,878 - database_navigator - INFO - Selection complete: {'type': 'postgresql', 'database': 'dq_checks', 'schema': 'public', 'table': 'customers', 'selection_mode': 'hierarchical', 'host': 'localhost', 'port': '5432', 'user': 'postgres', 'password': 'postgres'}
2026-01-17 20:27:51,878 - dq_comparison - INFO - Selected via navigation for TARGET: dq_checks.public.customers
2026-01-17 20:27:51,878 - dq_unified - INFO - Loading data from DATABASE
2026-01-17 20:27:51,878 - dq_unified - INFO - Loading large database table: customers
2026-01-17 20:27:51,879 - dq_unified - INFO - Normalized DB config with schema: public
2026-01-17 20:27:51,993 - dq_unified - INFO - PostgreSQL table public.customers has 15 rows
2026-01-17 20:27:51,993 - dq_unified - INFO - Loading 15 rows from PostgreSQL...
2026-01-17 20:27:51,997 - dq_unified - INFO - Loaded 15 rows from PostgreSQL
2026-01-17 20:27:52,001 - dq_unified - INFO - Memory optimization: 0.0MB -> 0.0MB (Saved: 0.0MB)
2026-01-17 20:27:52,001 - dq_unified - INFO - Loaded 15 rows, 10 columns. Memory: 111.9MB total, 0.0MB for dataframe
2026-01-17 20:27:52,002 - dq_comparison - INFO - TARGET database loaded: 15 rows, 10 columns
2026-01-17 20:27:52,002 - dq_comparison - INFO - SELECTING COLUMNS FOR COMPARISON
2026-01-17 20:27:52,002 - dq_comparison - INFO - Source columns (original): ['CustomerName', 'Email', 'Phone', 'Salary', 'Department', 'JoinDate', 'PostalCode', 'City', 'Country', 'State']
2026-01-17 20:27:52,003 - dq_comparison - INFO - Target columns (original): ['customername', 'email', 'phone', 'salary', 'department', 'joindate', 'postalcode', 'city', 'country', 'state']
2026-01-17 20:27:52,003 - dq_comparison - INFO - Common columns lowercased: ['salary', 'email', 'phone', 'state', 'city', 'customername', 'joindate', 'department', 'postalcode', 'country']
2026-01-17 20:27:52,003 - dq_comparison - INFO - Found 10 common columns between source and target (case-insensitive)
2026-01-17 20:27:52,004 - dq_comparison - INFO - 
📋 Common columns available for comparison:
2026-01-17 20:27:52,004 - dq_comparison - INFO -   1. Salary (Source) ↔ salary (Target)
2026-01-17 20:27:52,004 - dq_comparison - INFO -   2. Email (Source) ↔ email (Target)
2026-01-17 20:27:52,005 - dq_comparison - INFO -   3. Phone (Source) ↔ phone (Target)
2026-01-17 20:27:52,005 - dq_comparison - INFO -   4. State (Source) ↔ state (Target)
2026-01-17 20:27:52,005 - dq_comparison - INFO -   5. City (Source) ↔ city (Target)
2026-01-17 20:27:52,006 - dq_comparison - INFO -   6. CustomerName (Source) ↔ customername (Target)
2026-01-17 20:27:52,006 - dq_comparison - INFO -   7. JoinDate (Source) ↔ joindate (Target)
2026-01-17 20:27:52,006 - dq_comparison - INFO -   8. Department (Source) ↔ department (Target)
2026-01-17 20:27:52,007 - dq_comparison - INFO -   9. PostalCode (Source) ↔ postalcode (Target)
2026-01-17 20:27:52,007 - dq_comparison - INFO -   10. Country (Source) ↔ country (Target)
2026-01-17 20:27:53,791 - dq_comparison - INFO - User column selection input: all
2026-01-17 20:27:53,793 - dq_comparison - INFO - User selected ALL common columns for comparison
2026-01-17 20:27:53,793 - dq_comparison - INFO - GENERATING COMPREHENSIVE COMPARISON REPORT
2026-01-17 20:27:53,795 - dq_comparison - INFO - Report details - Source: Database: mysql - dq_checks.customers_bkp, Target: Database: postgresql - dq_checks.customers, Selected columns: 10
2026-01-17 20:27:53,795 - dq_comparison - INFO - Initializing Error Logger...
2026-01-17 20:27:53,796 - dq_error_log - INFO - ErrorLogger initialized with database: dq_checks
2026-01-17 20:27:53,809 - dq_error_log - INFO - Database connection successful
2026-01-17 20:27:53,810 - dq_comparison - INFO - Session ID: CMP_20260117_202753
2026-01-17 20:27:53,811 - dq_comparison - INFO - 
======================================================================
2026-01-17 20:27:53,811 - dq_comparison - INFO - 🔄 RUNNING SOURCE-TARGET COMPARISON WITH PERFECT NORMALIZATION
2026-01-17 20:27:53,811 - dq_comparison - INFO - ======================================================================
2026-01-17 20:27:53,812 - dq_comparison - INFO - Session ID: CMP_20260117_202753
2026-01-17 20:27:53,812 - dq_comparison - INFO - Source: Database: mysql - dq_checks.customers_bkp
2026-01-17 20:27:53,812 - dq_comparison - INFO - Target: Database: postgresql - dq_checks.customers
2026-01-17 20:27:53,813 - dq_comparison - INFO - Selected columns: 10
2026-01-17 20:27:53,814 - dq_comparison - INFO - ======================================================================
2026-01-17 20:27:53,815 - dq_comparison - INFO - 
1️⃣ FIRST: ROW COUNT CHECK
2026-01-17 20:27:53,815 - dq_comparison - WARNING - ❌ Row count mismatch: Source=12, Target=15, Difference=3
2026-01-17 20:27:53,816 - dq_comparison - WARNING -    Extra in target: 3 rows
2026-01-17 20:27:53,816 - dq_comparison - INFO - 
2️⃣ COLUMN STRUCTURE COMPARISON
2026-01-17 20:27:53,816 - dq_comparison - INFO - Comparing column structures...
2026-01-17 20:27:53,816 - dq_comparison - INFO - Column structure comparison complete. Match: False
2026-01-17 20:27:53,817 - dq_comparison - INFO - 
3️⃣ PRIMARY KEY VALIDATION
2026-01-17 20:27:53,817 - dq_comparison - INFO - Validating primary key/unique fields...
2026-01-17 20:27:53,817 - dq_comparison - INFO - Checking key fields: ['PostalCode']
2026-01-17 20:27:53,817 - dq_comparison - WARNING - No key fields found in both datasets
2026-01-17 20:27:53,829 - dq_comparison - INFO -    No key fields specified or detected
2026-01-17 20:27:53,830 - dq_comparison - INFO -    Column names match: ❌
2026-01-17 20:27:53,830 - dq_comparison - INFO -    Column order match: ❌
2026-01-17 20:27:53,831 - dq_comparison - INFO -    Data types match: ✅
2026-01-17 20:27:53,831 - dq_comparison - WARNING -    Missing in target: ['CustomerName', 'Email', 'Phone', 'Salary', 'Department', 'JoinDate', 'PostalCode', 'City', 'Country', 'State']
2026-01-17 20:27:53,831 - dq_comparison - WARNING -    Missing in source: ['customername', 'email', 'phone', 'salary', 'department', 'joindate', 'postalcode', 'city', 'country', 'state']
2026-01-17 20:27:53,831 - dq_comparison - INFO - 
4️⃣ TABLE METADATA COMPARISON
2026-01-17 20:27:53,832 - dq_comparison - INFO - Comparing table-level metadata...
2026-01-17 20:27:53,840 - dq_comparison - INFO - Table metadata comparison complete. Match: False
2026-01-17 20:27:53,853 - dq_comparison - INFO -    Table metadata match: ❌
2026-01-17 20:27:53,853 - dq_comparison - INFO -    Source: 12 rows, 10 cols, 0.0 MB
2026-01-17 20:27:53,854 - dq_comparison - INFO -    Target: 15 rows, 10 cols, 0.01 MB
2026-01-17 20:27:53,854 - dq_comparison - WARNING -    Found 1 metadata differences:
2026-01-17 20:27:53,854 - dq_comparison - WARNING -      • Row Count: Source=12, Target=15
2026-01-17 20:27:53,854 - dq_comparison - INFO - 
5️⃣ HASH-BASED COMPARISON
2026-01-17 20:27:53,855 - dq_comparison - INFO - ℹ️  Note: All NULL values normalized to 'NULL'
2026-01-17 20:27:53,855 - dq_comparison - INFO - ℹ️  Note: Dates normalized to YYYY-MM-DD
2026-01-17 20:27:53,855 - dq_comparison - INFO - ℹ️  Note: Strings trimmed and case-normalized
2026-01-17 20:27:53,855 - dq_comparison - INFO - ℹ️  Note: Phone numbers stripped to digits only, leading zeros removed
2026-01-17 20:27:53,856 - dq_comparison - INFO - SECOND CHECK: HASH-BASED COMPARISON WITH PERFECT NORMALIZATION
2026-01-17 20:27:53,862 - dq_comparison - INFO - === DEBUG: DATA TYPE CHECK ===
2026-01-17 20:27:53,862 - dq_comparison - INFO - Column: Salary
2026-01-17 20:27:53,863 - dq_comparison - INFO -   Source type: <class 'numpy.float32'>, value: 50000.0
2026-01-17 20:27:53,863 - dq_comparison - INFO -   Target type: <class 'numpy.float32'>, value: 50000.0
2026-01-17 20:27:53,864 - dq_comparison - INFO -   Normalized: '50000' vs '50000'
2026-01-17 20:27:53,864 - dq_comparison - INFO -   Match: True
2026-01-17 20:27:53,864 - dq_comparison - INFO - Column: Email
2026-01-17 20:27:53,864 - dq_comparison - INFO -   Source type: <class 'str'>, value: john@email.com
2026-01-17 20:27:53,865 - dq_comparison - INFO -   Target type: <class 'str'>, value: john@email.com
2026-01-17 20:27:53,865 - dq_comparison - INFO -   Normalized: 'john@email.com' vs 'john@email.com'
2026-01-17 20:27:53,865 - dq_comparison - INFO -   Match: True
2026-01-17 20:27:53,866 - dq_comparison - INFO - Column: Phone
2026-01-17 20:27:53,866 - dq_comparison - INFO -   Source type: <class 'str'>, value: 1234567890
2026-01-17 20:27:53,866 - dq_comparison - INFO -   Target type: <class 'str'>, value: 1234567890
2026-01-17 20:27:53,866 - dq_comparison - INFO -   Normalized: '1234567890' vs '1234567890'
2026-01-17 20:27:53,867 - dq_comparison - INFO -   Match: True
2026-01-17 20:27:53,867 - dq_comparison - INFO - Source DF columns: ['CustomerName', 'Email', 'Phone', 'Salary', 'Department', 'JoinDate', 'PostalCode', 'City', 'Country', 'State']
2026-01-17 20:27:53,867 - dq_comparison - INFO - Target DF columns: ['customername', 'email', 'phone', 'salary', 'department', 'joindate', 'postalcode', 'city', 'country', 'state']
2026-01-17 20:27:53,867 - dq_comparison - INFO - Selected columns for comparison: ['Salary', 'Email', 'Phone', 'State', 'City', 'CustomerName', 'JoinDate', 'Department', 'PostalCode', 'Country']
2026-01-17 20:27:53,867 - dq_comparison - INFO - Using 10 common columns for hash comparison
2026-01-17 20:27:53,868 - dq_comparison - INFO - Source columns: ['Salary', 'Email', 'Phone', 'State', 'City', 'CustomerName', 'JoinDate', 'Department', 'PostalCode', 'Country']
2026-01-17 20:27:53,868 - dq_comparison - INFO - Target columns: ['salary', 'email', 'phone', 'state', 'city', 'customername', 'joindate', 'department', 'postalcode', 'country']
2026-01-17 20:27:53,868 - dq_comparison - INFO - Generating hashes for source data (12 rows)...
2026-01-17 20:27:53,871 - dq_comparison - INFO - === DEBUG: SOURCES SAMPLE HASHES ===
2026-01-17 20:27:53,871 - dq_comparison - INFO - Hash 1: 2906792398a72a8d955e0ffbea655547... (Source row 0)
2026-01-17 20:27:53,871 - dq_comparison - INFO - Hash 2: 49f9e803dcde4b787ea4b1ba34b5e051... (Source row 1)
2026-01-17 20:27:53,871 - dq_comparison - INFO - Hash 3: c6a2b604b0586f5ca6e9596b1d7f97d8... (Source row 2)
2026-01-17 20:27:53,872 - dq_comparison - INFO - Hash 4: 4092ef852d174b492689bf1524c17cf1... (Source row 3)
2026-01-17 20:27:53,872 - dq_comparison - INFO - Hash 5: d9c77d958b1ecdbd146e54cb89ac942e... (Source row 4)
2026-01-17 20:27:53,872 - dq_comparison - INFO - Hash 6: 5d00056cff02f544510ee9ac9967ca55... (Source row 6)
2026-01-17 20:27:53,872 - dq_comparison - INFO - Hash 7: 8eb52643d57c1fdef25c31f90a0db0fb... (Source row 7)
2026-01-17 20:27:53,873 - dq_comparison - INFO - Hash 8: bf315af0f1222a48804c8131a4e62c9f... (Source row 8)
2026-01-17 20:27:53,873 - dq_comparison - INFO - Hash 9: cd8f0bc5c2e8bf5608ea1b1787e9ac67... (Source row 9)
2026-01-17 20:27:53,873 - dq_comparison - INFO - Hash 10: 08eb10c5f148e3f4f623fbf82fd3f86f... (Source row 10)
2026-01-17 20:27:53,873 - dq_comparison - INFO - Hash 11: 58df92120309ad1bac41d2ed4ec8e990... (Source row 11)
2026-01-17 20:27:53,874 - dq_comparison - INFO - Generating hashes for target data (15 rows)...
2026-01-17 20:27:53,881 - dq_comparison - INFO - === DEBUG: TARGET SAMPLE HASHES ===
2026-01-17 20:27:53,881 - dq_comparison - INFO - Hash 1: 2906792398a72a8d955e0ffbea655547... (Target row 0)
2026-01-17 20:27:53,882 - dq_comparison - INFO - Hash 2: d950a314bb84ca1af20c497aaf7e7e01... (Target row 1)
2026-01-17 20:27:53,882 - dq_comparison - INFO - Hash 3: c6a2b604b0586f5ca6e9596b1d7f97d8... (Target row 2)
2026-01-17 20:27:53,882 - dq_comparison - INFO - Hash 4: 4092ef852d174b492689bf1524c17cf1... (Target row 3)
2026-01-17 20:27:53,882 - dq_comparison - INFO - Hash 5: d9c77d958b1ecdbd146e54cb89ac942e... (Target row 4)
2026-01-17 20:27:53,883 - dq_comparison - INFO - Hash 6: a4e04126ce7ac45ad1be05cee4d0021c... (Target row 6)
2026-01-17 20:27:53,883 - dq_comparison - INFO - Hash 7: 8eb52643d57c1fdef25c31f90a0db0fb... (Target row 7)
2026-01-17 20:27:53,883 - dq_comparison - INFO - Hash 8: bf315af0f1222a48804c8131a4e62c9f... (Target row 8)
2026-01-17 20:27:53,884 - dq_comparison - INFO - Hash 9: 6a2c170cdab44bfc74dd587ff71ff121... (Target row 9)
2026-01-17 20:27:53,884 - dq_comparison - INFO - Hash 10: 08eb10c5f148e3f4f623fbf82fd3f86f... (Target row 10)
2026-01-17 20:27:53,884 - dq_comparison - INFO - Hash 11: 58df92120309ad1bac41d2ed4ec8e990... (Target row 11)
2026-01-17 20:27:53,884 - dq_comparison - INFO - Hash 12: 2561cca16a5e5e6c3ccb80bea7e1a9f2... (Target row 12)
2026-01-17 20:27:53,885 - dq_comparison - INFO - Hash 13: 7fae69a7a82f9477e59560e7edcca304... (Target row 13)
2026-01-17 20:27:53,885 - dq_comparison - INFO - Hash 14: c767fe6b94a4d8b6a5c7d2cead90aa01... (Target row 14)
2026-01-17 20:27:53,885 - dq_comparison - INFO - 
======================================================================
2026-01-17 20:27:53,885 - dq_comparison - INFO - 🔍 DEBUG: ANALYZING WHY HASHES DON'T MATCH
2026-01-17 20:27:53,886 - dq_comparison - INFO - ======================================================================
2026-01-17 20:27:53,886 - dq_comparison - INFO - --- Analyzing Row 0 ---
2026-01-17 20:27:53,887 - dq_comparison - INFO - Column 'Salary' → 'salary':
2026-01-17 20:27:53,887 - dq_comparison - INFO -   Source: '50000.0' (type: float32) → '50000'
2026-01-17 20:27:53,887 - dq_comparison - INFO -   Target: '50000.0' (type: float32) → '50000'
2026-01-17 20:27:53,887 - dq_comparison - INFO -   Match after normalization: ✅ YES
2026-01-17 20:27:53,888 - dq_comparison - INFO - Column 'Email' → 'email':
2026-01-17 20:27:53,888 - dq_comparison - INFO -   Source: 'john@email.com' (type: str) → 'john@email.com'
2026-01-17 20:27:53,888 - dq_comparison - INFO -   Target: 'john@email.com' (type: str) → 'john@email.com'
2026-01-17 20:27:53,888 - dq_comparison - INFO -   Match after normalization: ✅ YES
2026-01-17 20:27:53,889 - dq_comparison - INFO - Column 'Phone' → 'phone':
2026-01-17 20:27:53,889 - dq_comparison - INFO -   Source: '1234567890' (type: str) → '1234567890'
2026-01-17 20:27:53,889 - dq_comparison - INFO -   Target: '1234567890' (type: str) → '1234567890'
2026-01-17 20:27:53,889 - dq_comparison - INFO -   Match after normalization: ✅ YES
2026-01-17 20:27:53,892 - dq_comparison - INFO - Column 'State' → 'state':
2026-01-17 20:27:53,892 - dq_comparison - INFO -   Source: 'TS' (type: str) → 'ts'
2026-01-17 20:27:53,893 - dq_comparison - INFO -   Target: 'TS' (type: str) → 'ts'
2026-01-17 20:27:53,893 - dq_comparison - INFO -   Match after normalization: ✅ YES
2026-01-17 20:27:53,893 - dq_comparison - INFO - Column 'City' → 'city':
2026-01-17 20:27:53,894 - dq_comparison - INFO -   Source: 'New York' (type: str) → 'new york'
2026-01-17 20:27:53,894 - dq_comparison - INFO -   Target: 'New York' (type: str) → 'new york'
2026-01-17 20:27:53,894 - dq_comparison - INFO -   Match after normalization: ✅ YES
2026-01-17 20:27:53,895 - dq_comparison - INFO - 
Hash components for Row 0:
2026-01-17 20:27:53,895 - dq_comparison - INFO - Source hash string start: 50000|john@email.com|1234567890...
2026-01-17 20:27:53,895 - dq_comparison - INFO - Target hash string start: 50000|john@email.com|1234567890...
2026-01-17 20:27:53,895 - dq_comparison - INFO - Same? ✅ YES
2026-01-17 20:27:53,895 - dq_comparison - INFO - --- Analyzing Row 1 ---
2026-01-17 20:27:53,896 - dq_comparison - INFO - Column 'Salary' → 'salary':
2026-01-17 20:27:53,896 - dq_comparison - INFO -   Source: '60000.0' (type: float32) → '60000'
2026-01-17 20:27:53,897 - dq_comparison - INFO -   Target: '60000.0' (type: float32) → '60000'
2026-01-17 20:27:53,897 - dq_comparison - INFO -   Match after normalization: ✅ YES
2026-01-17 20:27:53,897 - dq_comparison - INFO - Column 'Email' → 'email':
2026-01-17 20:27:53,897 - dq_comparison - INFO -   Source: 'jane@email.com' (type: str) → 'jane@email.com'
2026-01-17 20:27:53,898 - dq_comparison - INFO -   Target: 'jane@email.com' (type: str) → 'jane@email.com'
2026-01-17 20:27:53,898 - dq_comparison - INFO -   Match after normalization: ✅ YES
2026-01-17 20:27:53,899 - dq_comparison - INFO - Column 'Phone' → 'phone':
2026-01-17 20:27:53,899 - dq_comparison - INFO -   Source: '9876543210' (type: str) → '9876543210'
2026-01-17 20:27:53,899 - dq_comparison - INFO -   Target: '9876543210' (type: str) → '9876543210'
2026-01-17 20:27:53,899 - dq_comparison - INFO -   Match after normalization: ✅ YES
2026-01-17 20:27:53,900 - dq_comparison - INFO - Column 'State' → 'state':
2026-01-17 20:27:53,900 - dq_comparison - INFO -   Source: 'AP' (type: str) → 'ap'
2026-01-17 20:27:53,900 - dq_comparison - INFO -   Target: 'AP' (type: str) → 'ap'
2026-01-17 20:27:53,900 - dq_comparison - INFO -   Match after normalization: ✅ YES
2026-01-17 20:27:53,901 - dq_comparison - INFO - Column 'City' → 'city':
2026-01-17 20:27:53,901 - dq_comparison - INFO -   Source: 'India' (type: str) → 'india'
2026-01-17 20:27:53,901 - dq_comparison - INFO -   Target: 'Chicago' (type: str) → 'chicago'
2026-01-17 20:27:53,901 - dq_comparison - INFO -   Match after normalization: ❌ NO
2026-01-17 20:27:53,902 - dq_comparison - INFO - 
Hash components for Row 1:
2026-01-17 20:27:53,902 - dq_comparison - INFO - Source hash string start: 60000|jane@email.com|9876543210...
2026-01-17 20:27:53,902 - dq_comparison - INFO - Target hash string start: 60000|jane@email.com|9876543210...
2026-01-17 20:27:53,903 - dq_comparison - INFO - Same? ✅ YES
2026-01-17 20:27:53,903 - dq_comparison - INFO - --- Analyzing Row 2 ---
2026-01-17 20:27:53,903 - dq_comparison - INFO - Column 'Salary' → 'salary':
2026-01-17 20:27:53,904 - dq_comparison - INFO -   Source: '55000.0' (type: float32) → '55000'
2026-01-17 20:27:53,904 - dq_comparison - INFO -   Target: '55000.0' (type: float32) → '55000'
2026-01-17 20:27:53,904 - dq_comparison - INFO -   Match after normalization: ✅ YES
2026-01-17 20:27:53,904 - dq_comparison - INFO - Column 'Email' → 'email':
2026-01-17 20:27:53,905 - dq_comparison - INFO -   Source: '' (type: str) → 'NULL'
2026-01-17 20:27:53,905 - dq_comparison - INFO -   Target: 'None' (type: NoneType) → 'NULL'
2026-01-17 20:27:53,905 - dq_comparison - INFO -   Match after normalization: ✅ YES
2026-01-17 20:27:53,905 - dq_comparison - INFO - Column 'Phone' → 'phone':
2026-01-17 20:27:53,908 - dq_comparison - INFO -   Source: '5551234567' (type: str) → '5551234567'
2026-01-17 20:27:53,909 - dq_comparison - INFO -   Target: '5551234567' (type: str) → '5551234567'
2026-01-17 20:27:53,909 - dq_comparison - INFO -   Match after normalization: ✅ YES
2026-01-17 20:27:53,910 - dq_comparison - INFO - Column 'State' → 'state':
2026-01-17 20:27:53,910 - dq_comparison - INFO -   Source: 'KL' (type: str) → 'kl'
2026-01-17 20:27:53,910 - dq_comparison - INFO -   Target: 'KL' (type: str) → 'kl'
2026-01-17 20:27:53,911 - dq_comparison - INFO -   Match after normalization: ✅ YES
2026-01-17 20:27:53,911 - dq_comparison - INFO - Column 'City' → 'city':
2026-01-17 20:27:53,911 - dq_comparison - INFO -   Source: 'Boston' (type: str) → 'boston'
2026-01-17 20:27:53,911 - dq_comparison - INFO -   Target: 'Boston' (type: str) → 'boston'
2026-01-17 20:27:53,912 - dq_comparison - INFO -   Match after normalization: ✅ YES
2026-01-17 20:27:53,912 - dq_comparison - INFO - 
Hash components for Row 2:
2026-01-17 20:27:53,913 - dq_comparison - INFO - Source hash string start: 55000|NULL|5551234567...
2026-01-17 20:27:53,913 - dq_comparison - INFO - Target hash string start: 55000|NULL|5551234567...
2026-01-17 20:27:53,913 - dq_comparison - INFO - Same? ✅ YES
2026-01-17 20:27:53,913 - dq_comparison - INFO - 
--- Column Data Types Analysis ---
2026-01-17 20:27:53,913 - dq_comparison - INFO - Column 1: 'Salary' (float32) ↔ 'salary' (float32)
2026-01-17 20:27:53,914 - dq_comparison - INFO -   Sample: Source='50000.0', Target='50000.0'
2026-01-17 20:27:53,914 - dq_comparison - INFO - Column 2: 'Email' (object) ↔ 'email' (object)
2026-01-17 20:27:53,915 - dq_comparison - INFO -   Sample: Source='john@email.com', Target='john@email.com'
2026-01-17 20:27:53,915 - dq_comparison - INFO - Column 3: 'Phone' (object) ↔ 'phone' (object)
2026-01-17 20:27:53,915 - dq_comparison - INFO -   Sample: Source='1234567890', Target='1234567890'
2026-01-17 20:27:53,915 - dq_comparison - INFO - Column 4: 'State' (object) ↔ 'state' (object)
2026-01-17 20:27:53,916 - dq_comparison - INFO -   Sample: Source='TS', Target='TS'
2026-01-17 20:27:53,916 - dq_comparison - INFO - Column 5: 'City' (object) ↔ 'city' (object)
2026-01-17 20:27:53,916 - dq_comparison - INFO -   Sample: Source='New York', Target='New York'
2026-01-17 20:27:53,917 - dq_comparison - INFO - PERFORMING DETAILED ROW-LEVEL COMPARISON WITH PAGINATION...
2026-01-17 20:27:53,917 - dq_comparison - INFO - Found 9 total mismatches
2026-01-17 20:27:53,917 - dq_comparison - INFO - Will process detailed comparisons for first 9 rows
2026-01-17 20:27:53,987 - dq_comparison - INFO - 
================================================================================
2026-01-17 20:27:53,987 - dq_comparison - INFO - DETAILED MISMATCH SUMMARY:
2026-01-17 20:27:53,988 - dq_comparison - INFO -   Total mismatches found: 6
2026-01-17 20:27:53,989 - dq_comparison - INFO -   Detailed comparisons logged: 6
2026-01-17 20:27:53,989 - dq_comparison - INFO -   First 10 rows displayed above
2026-01-17 20:27:53,990 - dq_comparison - INFO -   All mismatches stored in database with complete data
2026-01-17 20:27:53,990 - dq_comparison - INFO - ================================================================================
2026-01-17 20:27:53,990 - dq_comparison - INFO - Hash-based Comparison Results (with duplicate handling):
2026-01-17 20:27:53,990 - dq_comparison - INFO -   • Unique source hashes: 11
2026-01-17 20:27:53,990 - dq_comparison - INFO -   • Unique target hashes: 14
2026-01-17 20:27:53,990 - dq_comparison - INFO -   • Common hashes: 8
2026-01-17 20:27:53,991 - dq_comparison - INFO -   • Common rows (counting duplicates): 9
2026-01-17 20:27:53,991 - dq_comparison - INFO -   • Rows only in source (counting duplicates): 3
2026-01-17 20:27:53,991 - dq_comparison - INFO -   • Rows only in target (counting duplicates): 6
2026-01-17 20:27:53,993 - dq_comparison - INFO - HASH-ONLY COMPARISON COMPLETED
2026-01-17 20:27:53,993 - dq_comparison - INFO - Returning counts for simple scoring:
2026-01-17 20:27:53,993 - dq_comparison - INFO -   Common rows: 9
2026-01-17 20:27:53,993 - dq_comparison - INFO -   Unique to source: 3
2026-01-17 20:27:53,994 - dq_comparison - INFO -   Unique to target: 6
2026-01-17 20:27:53,994 - dq_comparison - INFO -   Value mismatches: 90
2026-01-17 20:27:53,994 - dq_comparison - INFO -   Missing rows: 3
2026-01-17 20:27:53,994 - dq_comparison - INFO -   Extra rows: 6
2026-01-17 20:27:53,995 - dq_comparison - INFO - 
========================================================================================================================
COMPARISON: Mysql Database vs Postgresql Database
========================================================================================================================
Row   | Diff Count | Source (Sample)                          | Target (Sample)                         
------------------------------------------------------------------------------------------------------------------------
3     | 1          | Salary: 60000.0                          | salary: 60000.0                         
8     | 1          | Salary: NULL                             | salary: NULL                            
11    | 1          | Salary: 62000.0                          | salary: 62000.0                         
14    | 10         | Salary: NULL                             | salary: 67000.0                         
15    | 9          | Salary: NULL                             | salary: NULL                            
16    | 10         | Salary: NULL                             | salary: 49000.0                         
------------------------------------------------------------------------------------------------------------------------
Showing all 6 mismatched rows.
========================================================================================================================
2026-01-17 20:27:53,995 - dq_comparison - INFO - Returning enhanced mismatch structure with 6 detailed mismatches
2026-01-17 20:27:53,995 - dq_comparison - INFO - New structure: 6 detailed mismatches
2026-01-17 20:27:53,995 - dq_comparison - INFO - 
6️⃣ DATA QUALITY ANALYSIS
2026-01-17 20:27:53,996 - dq_comparison - INFO - Analyzing data quality metrics...
2026-01-17 20:27:54,006 - dq_comparison - INFO - Null values - Source: 4 (3.33%), Target: 6 (4.00%)
2026-01-17 20:27:54,008 - dq_comparison - INFO - Duplicate rows (normalized) - Source: 1, Target: 1
2026-01-17 20:27:54,010 - dq_comparison - INFO - Source duplicate samples: ['Row 2', 'Row 7']
2026-01-17 20:27:54,011 - dq_comparison - INFO - Target duplicate samples: ['Row 2', 'Row 7']
2026-01-17 20:27:54,022 - dq_error_log - INFO - Retrieved 8 error logs for session CMP_20260117_202753
2026-01-17 20:27:54,023 - dq_comparison - INFO - 
📊 SIMPLE SCORING CALCULATION:
2026-01-17 20:27:54,023 - dq_comparison - INFO -   Source rows: 12
2026-01-17 20:27:54,025 - dq_comparison - INFO -   Common rows (matched): 9
2026-01-17 20:27:54,025 - dq_comparison - INFO -   Calculation: (9 / 12) * 100 = 75.00%
2026-01-17 20:27:54,026 - dq_comparison - INFO -   Explanation: 9 matched rows out of 12 total source rows
2026-01-17 20:27:54,026 - dq_comparison - INFO - 
=== AUDIT LOGGING SECTION ===
2026-01-17 20:27:54,029 - dq_comparison - INFO - 🔍 Audit logging is ENABLED in APP_SETTINGS
2026-01-17 20:27:54,029 - dq_audit - INFO - Audit class initialized with database: dq_checks
2026-01-17 20:27:54,030 - dq_comparison - INFO - Attempting to log audit record for session: CMP_20260117_202753
2026-01-17 20:27:54,030 - dq_audit - INFO - Starting database insertion for comparison...
2026-01-17 20:27:54,045 - dq_audit - INFO - Inserted comparison record with ID: 766
2026-01-17 20:27:54,046 - dq_comparison - INFO - ✅ Audit record logged successfully (ID: 766)
2026-01-17 20:27:54,047 - dq_comparison - INFO - 
======================================================================
2026-01-17 20:27:54,048 - dq_comparison - INFO - 📊 COMPARISON RESULTS SUMMARY
2026-01-17 20:27:54,049 - dq_comparison - INFO - ======================================================================
2026-01-17 20:27:54,049 - dq_comparison - INFO - Session ID: CMP_20260117_202753
2026-01-17 20:27:54,049 - dq_comparison - INFO - Source: Database: mysql - dq_checks.customers_bkp (12 rows)
2026-01-17 20:27:54,050 - dq_comparison - INFO - Target: Database: postgresql - dq_checks.customers (15 rows)
2026-01-17 20:27:54,050 - dq_comparison - INFO - Selected columns: 10
2026-01-17 20:27:54,050 - dq_comparison - INFO - ----------------------------------------------------------------------
2026-01-17 20:27:54,050 - dq_comparison - INFO - 1️⃣ Row count match: ❌ No
2026-01-17 20:27:54,051 - dq_comparison - INFO -    Missing in target: 0 rows
2026-01-17 20:27:54,051 - dq_comparison - INFO -    Extra in target: 3 rows
2026-01-17 20:27:54,051 - dq_comparison - INFO - 2️⃣ Column structure match: ❌ No
2026-01-17 20:27:54,051 - dq_comparison - INFO -    Missing in target: 10 columns
2026-01-17 20:27:54,052 - dq_comparison - INFO -      ['CustomerName', 'Email', 'Phone', 'Salary', 'Department']
2026-01-17 20:27:54,052 - dq_comparison - INFO -    Missing in source: 10 columns
2026-01-17 20:27:54,052 - dq_comparison - INFO -      ['customername', 'email', 'phone', 'salary', 'department']
2026-01-17 20:27:54,052 - dq_comparison - INFO - 3️ Primary key validation: ❌ Failed
2026-01-17 20:27:54,053 - dq_comparison - INFO - 4️ Table metadata: ❌ Mismatch
2026-01-17 20:27:54,053 - dq_comparison - INFO -    • Row Count: 12 vs 15
2026-01-17 20:27:54,053 - dq_comparison - INFO - 5️⃣ Common rows (both Mysql Database and Postgresql Database): 9 (75.00% of Mysql Database)
2026-01-17 20:27:54,053 - dq_comparison - INFO - 6️⃣ Mysql Database-only rows: 3 (present ONLY in Mysql Database, NOT in Postgresql Database)
2026-01-17 20:27:54,054 - dq_comparison - INFO - 7️⃣ Postgresql Database-only rows: 6 (present ONLY in Postgresql Database, NOT in Mysql Database)
2026-01-17 20:27:54,054 - dq_comparison - INFO - 8️⃣ Column value mismatches: 0
2026-01-17 20:27:54,054 - dq_comparison - INFO - 9️ Data quality match: ❌ No
2026-01-17 20:27:54,055 - dq_comparison - INFO - 📈 DQ Score: 75.00%
2026-01-17 20:27:54,055 - dq_comparison - INFO - 📊 Calculation: (9 / 12) * 100 = 75.00%
2026-01-17 20:27:54,055 - dq_comparison - INFO - ======================================================================
2026-01-17 20:27:54,055 - dq_comparison - INFO - 
⚠️  FAIR MATCH! Significant differences found.
2026-01-17 20:27:54,056 - dq_comparison - INFO - 
🔍 NORMALIZATION APPLIED:
2026-01-17 20:27:54,056 - dq_comparison - INFO -    • NULL values → 'NULL' (consistent representation)
2026-01-17 20:27:54,056 - dq_comparison - INFO -    • Dates → YYYY-MM-DD format
2026-01-17 20:27:54,056 - dq_comparison - INFO -    • Strings → trimmed + lowercase
2026-01-17 20:27:54,057 - dq_comparison - INFO -    • Numeric values → standardized format
2026-01-17 20:27:54,057 - dq_comparison - INFO -    • Phone numbers → digits only, ALL leading zeros removed
2026-01-17 20:27:54,057 - dq_comparison - INFO -    • Extra whitespace removed
2026-01-17 20:27:54,057 - dq_comparison - INFO - 
🔍 DETAILED ERROR ANALYSIS:
2026-01-17 20:27:54,057 - dq_comparison - INFO - --------------------------------------------------
2026-01-17 20:27:54,058 - dq_comparison - INFO - 📊 SOURCE-ONLY ROWS: 3 rows
2026-01-17 20:27:54,058 - dq_comparison - INFO -    Present only in Mysql Database, missing from Postgresql Database
2026-01-17 20:27:54,058 - dq_comparison - INFO - 📊 TARGET-ONLY ROWS: 6 rows
2026-01-17 20:27:54,058 - dq_comparison - INFO -    Present only in Postgresql Database, extra (not in Mysql Database)
2026-01-17 20:27:54,068 - dq_error_log - INFO - Retrieved 8 errors for session CMP_20260117_202753
2026-01-17 20:27:54,069 - dq_comparison - INFO - 
📋 SAMPLE ERRORS (8 found):
2026-01-17 20:27:54,069 - dq_comparison - INFO - 
1. Row 0 - Metadata Row Count
2026-01-17 20:27:54,070 - dq_comparison - INFO -    Column: 
2026-01-17 20:27:54,070 - dq_comparison - INFO -    Metadata mismatch: Row Count
2026-01-17 20:27:54,070 - dq_comparison - INFO - 
2. Row 0 - Key Field Missing
2026-01-17 20:27:54,070 - dq_comparison - INFO -    Column: PostalCode
2026-01-17 20:27:54,071 - dq_comparison - INFO -    Primary key field 'PostalCode' missing in one or both datasets
2026-01-17 20:27:54,071 - dq_comparison - INFO - 
3. Row 3 - Row Data Mismatch
2026-01-17 20:27:54,071 - dq_comparison - INFO -    Row 3: Detailed data mismatch detected
2026-01-17 20:27:54,071 - dq_comparison - INFO - 
💡 For complete error details, run:
2026-01-17 20:27:54,071 - dq_comparison - INFO -    USE dq_checks;
2026-01-17 20:27:54,072 - dq_comparison - INFO -    SELECT excel_row, column_name, error_type, error_description,
2026-01-17 20:27:54,072 - dq_comparison - INFO -           actual_value, expected_value
2026-01-17 20:27:54,072 - dq_comparison - INFO -    FROM dq_error_logs
2026-01-17 20:27:54,072 - dq_comparison - INFO -    WHERE session_id = 'CMP_20260117_202753'
2026-01-17 20:27:54,073 - dq_comparison - INFO -    ORDER BY excel_row, column_name;
2026-01-17 20:27:54,086 - dq_comparison - INFO - 
✅ Comparison completed! Session ID: CMP_20260117_202753
2026-01-17 20:27:54,095 - dq_error_log - INFO - Retrieved 9 error logs for session CMP_20260117_202753
2026-01-17 20:27:54,108 - dq_error_log - INFO - Retrieved summary: 9 total errors for session CMP_20260117_202753
2026-01-17 20:27:54,109 - dq_audit - INFO - Audit class initialized with database: dq_checks
2026-01-17 20:27:54,123 - dq_audit - INFO - Retrieved 1 audit logs for session CMP_20260117_202753
2026-01-17 20:27:54,124 - dq_comparison - INFO - 
🔍 Final results verification:
2026-01-17 20:27:54,124 - dq_comparison - INFO -    Session ID: CMP_20260117_202753
2026-01-17 20:27:54,125 - dq_comparison - INFO -    DQ Score (Simple %): 75.00%
2026-01-17 20:27:54,126 - dq_comparison - INFO -    Source rows: 12
2026-01-17 20:27:54,126 - dq_comparison - INFO -    Matched rows: 9
2026-01-17 20:27:54,127 - dq_comparison - INFO -    Calculation: (9 / 12) * 100
2026-01-17 20:27:54,127 - __main__ - INFO - Source-Target Comparison completed successfully
2026-01-17 20:27:54,127 - __main__ - INFO - Displaying main menu options to user
2026-01-17 20:27:55,792 - __main__ - INFO - User selected option: 6
2026-01-17 20:27:55,793 - __main__ - INFO - User session ended. Duration: 0:00:34.460296
2026-01-17 20:27:55,793 - __main__ - INFO - 👋 Thank you for using Universal Data Quality Framework!
