2026-01-28 17:34:16,074 - root - INFO - CLI Mode Logging Initialized
2026-01-28 17:34:16,074 - root - INFO - CLI logs will be saved to: logs/dq_framework_20260128_173416.log
2026-01-28 17:34:16,075 - __main__ - INFO - 🚀 UNIVERSAL DATA QUALITY FRAMEWORK INITIALIZED
2026-01-28 17:34:16,075 - __main__ - INFO - Starting system resource check
2026-01-28 17:34:16,080 - __main__ - INFO - Total RAM: 15.7 GB
2026-01-28 17:34:16,081 - __main__ - INFO - Available RAM: 6.2 GB
2026-01-28 17:34:16,081 - __main__ - INFO - Memory used: 60.8%
2026-01-28 17:34:16,081 - __main__ - INFO - Memory status: OK
2026-01-28 17:34:16,082 - __main__ - INFO - Free disk space: 260.2 GB
2026-01-28 17:34:16,085 - __main__ - INFO - Disk used: 45.4%
2026-01-28 17:34:16,085 - __main__ - INFO - Disk space: OK
2026-01-28 17:34:16,586 - __main__ - INFO - CPU cores: 8
2026-01-28 17:34:16,586 - __main__ - INFO - CPU usage: 32.4%
2026-01-28 17:34:16,586 - __main__ - INFO - Python version: 3.12.4
2026-01-28 17:34:16,587 - __main__ - INFO - System platform: win32
2026-01-28 17:34:16,587 - __main__ - INFO - User session started at: 2026-01-28 17:34:16.587319
2026-01-28 17:34:16,587 - __main__ - INFO - Displaying main menu options to user
2026-01-28 17:34:18,594 - __main__ - INFO - User selected option: 2
2026-01-28 17:34:18,595 - __main__ - INFO - Starting Source-Target Comparison module
2026-01-28 17:34:18,604 - dq_comparison - INFO - STARTING UNIVERSAL SOURCE-TARGET COMPARISON TOOL
2026-01-28 17:34:18,605 - dq_comparison - INFO - LOADING SOURCE AND TARGET DATA
2026-01-28 17:34:18,605 - dq_comparison - INFO - 
==================================================
2026-01-28 17:34:18,607 - dq_comparison - INFO - 🔗 SOURCE DATA CONFIGURATION
2026-01-28 17:34:18,607 - dq_comparison - INFO - ==================================================
2026-01-28 17:34:19,663 - dq_comparison - INFO - 
🗄️ SOURCE DATABASE CONFIGURATION
2026-01-28 17:34:19,665 - dq_comparison - INFO - ----------------------------------------
2026-01-28 17:34:21,136 - dq_comparison - INFO - Selected database type code: mysql
2026-01-28 17:34:22,077 - dq_comparison - INFO - User selected Browse and Select mode for SOURCE
2026-01-28 17:34:22,090 - database_navigator - INFO - DatabaseNavigator initialized
2026-01-28 17:34:22,091 - database_navigator - INFO - Starting database navigation...
2026-01-28 17:34:22,094 - database_navigator - INFO - Database type: mysql
2026-01-28 17:34:22,098 - database_navigator - INFO - Getting database configuration...
2026-01-28 17:34:23,907 - database_navigator - INFO - Connecting to MYSQL...
2026-01-28 17:34:24,145 - database_navigator - INFO - Successfully connected to MYSQL!
2026-01-28 17:34:24,153 - database_navigator - INFO - get_databases() called. db_type: mysql, connection exists: True
2026-01-28 17:34:24,156 - database_navigator - INFO - Found 13 databases
2026-01-28 17:34:29,178 - database_navigator - INFO - Selected database: dq_checks
2026-01-28 17:34:29,186 - database_navigator - INFO - Found 1 schemas
2026-01-28 17:34:30,531 - database_navigator - INFO - Selected schema: dq_checks
2026-01-28 17:34:30,541 - database_navigator - INFO - Found 10 tables in schema 'dq_checks'
2026-01-28 17:34:33,576 - database_navigator - INFO - Selected table: customers_bkp
2026-01-28 17:34:33,585 - database_navigator - INFO - Selection complete: {'type': 'mysql', 'database': 'dq_checks', 'schema': 'dq_checks', 'table': 'customers_bkp', 'selection_mode': 'hierarchical', 'host': 'localhost', 'port': '3306', 'user': 'root', 'password': 'root'}
2026-01-28 17:34:33,587 - dq_comparison - INFO - Selected via navigation for SOURCE: dq_checks.dq_checks.customers_bkp
2026-01-28 17:34:33,587 - dq_unified - INFO - Loading data from DATABASE
2026-01-28 17:34:33,588 - dq_unified - INFO - Loading large database table: customers_bkp
2026-01-28 17:34:33,589 - dq_unified - INFO - Normalized DB config with schema: dq_checks
2026-01-28 17:34:33,609 - dq_unified - INFO - MySQL table customers_bkp has 12 rows
2026-01-28 17:34:33,609 - dq_unified - INFO - Loading 12 rows from MySQL...
2026-01-28 17:34:34,273 - dq_unified - INFO - Loaded 12 rows from MySQL
2026-01-28 17:34:34,284 - dq_unified - INFO - Memory optimization: 0.0MB -> 0.0MB (Saved: 0.0MB)
2026-01-28 17:34:34,286 - dq_unified - INFO - Loaded 12 rows, 10 columns. Memory: 109.8MB total, 0.0MB for dataframe
2026-01-28 17:34:34,286 - dq_comparison - INFO - SOURCE database loaded: 12 rows, 10 columns
2026-01-28 17:34:34,287 - dq_comparison - INFO - 
==================================================
2026-01-28 17:34:34,288 - dq_comparison - INFO - 🔗 TARGET DATA CONFIGURATION
2026-01-28 17:34:34,288 - dq_comparison - INFO - ==================================================
2026-01-28 17:34:40,411 - dq_comparison - INFO - 
🗄️ TARGET DATABASE CONFIGURATION
2026-01-28 17:34:40,413 - dq_comparison - INFO - ----------------------------------------
2026-01-28 17:34:48,435 - dq_comparison - INFO - Selected database type code: postgresql
2026-01-28 17:34:49,942 - dq_comparison - INFO - User selected Browse and Select mode for TARGET
2026-01-28 17:34:49,953 - dq_comparison - INFO - Converted 'postgresql' to 'postgres' for database_navigator compatibility
2026-01-28 17:34:49,954 - database_navigator - INFO - DatabaseNavigator initialized
2026-01-28 17:34:49,955 - database_navigator - INFO - Starting database navigation...
2026-01-28 17:34:49,955 - database_navigator - INFO - Database type: postgres
2026-01-28 17:34:49,956 - database_navigator - INFO - Getting database configuration...
2026-01-28 17:34:52,639 - database_navigator - INFO - Connecting to POSTGRES...
2026-01-28 17:34:52,640 - database_navigator - INFO - Connecting to PostgreSQL...
2026-01-28 17:34:52,640 - database_navigator - INFO - Connecting to PostgreSQL: host=localhost, port=5432, database=postgres, user=postgres
2026-01-28 17:34:52,816 - database_navigator - INFO - Connection object created: <connection object at 0x0000022F7EA199C0; dsn: 'user=postgres password=xxx dbname=postgres host=localhost port=5432', closed: 0>
2026-01-28 17:34:52,817 - database_navigator - INFO - ✅ PostgreSQL connection successful to database: postgres
2026-01-28 17:34:52,826 - database_navigator - INFO - get_databases() called. db_type: postgres, connection exists: True
2026-01-28 17:34:52,840 - database_navigator - INFO - Raw rows: [('dq_checks',), ('finewise-testdb',), ('postgres',)]
2026-01-28 17:34:52,840 - database_navigator - INFO - Found 3 databases
2026-01-28 17:34:55,406 - database_navigator - INFO - Selected database: dq_checks
2026-01-28 17:34:55,408 - database_navigator - INFO - Reconnecting to PostgreSQL database: dq_checks
2026-01-28 17:34:55,408 - database_navigator - INFO - Connecting to POSTGRES...
2026-01-28 17:34:55,412 - database_navigator - INFO - Connecting to PostgreSQL...
2026-01-28 17:34:55,412 - database_navigator - INFO - Connecting to PostgreSQL: host=localhost, port=5432, database=dq_checks, user=postgres
2026-01-28 17:34:55,547 - database_navigator - INFO - Connection object created: <connection object at 0x0000022F7EA1A240; dsn: 'user=postgres password=xxx dbname=dq_checks host=localhost port=5432', closed: 0>
2026-01-28 17:34:55,549 - database_navigator - INFO - ✅ PostgreSQL connection successful to database: dq_checks
2026-01-28 17:34:55,575 - database_navigator - INFO - Found 4 schemas
2026-01-28 17:34:58,682 - database_navigator - INFO - Selected schema: public
2026-01-28 17:34:58,688 - database_navigator - INFO - Ensuring connection to database: dq_checks for table list
2026-01-28 17:34:58,689 - database_navigator - INFO - Reconnecting to PostgreSQL database: dq_checks
2026-01-28 17:34:58,690 - database_navigator - INFO - Connecting to POSTGRES...
2026-01-28 17:34:58,690 - database_navigator - INFO - Connecting to PostgreSQL...
2026-01-28 17:34:58,690 - database_navigator - INFO - Connecting to PostgreSQL: host=localhost, port=5432, database=dq_checks, user=postgres
2026-01-28 17:34:58,868 - database_navigator - INFO - Connection object created: <connection object at 0x0000022F7EA19F10; dsn: 'user=postgres password=xxx dbname=dq_checks host=localhost port=5432', closed: 0>
2026-01-28 17:34:58,868 - database_navigator - INFO - ✅ PostgreSQL connection successful to database: dq_checks
2026-01-28 17:34:58,870 - database_navigator - INFO - Connected to database: dq_checks, schema: public
2026-01-28 17:34:58,912 - database_navigator - INFO - Found 5 tables in dq_checks.public: ['comparison_small_target13', 'customers', 'customers_bkp', 'employee', 'stg_transactions']
2026-01-28 17:34:58,912 - database_navigator - INFO - Found 5 tables in schema 'public'
2026-01-28 17:35:01,538 - database_navigator - INFO - Selected table: customers
2026-01-28 17:35:01,548 - database_navigator - INFO - Selection complete: {'type': 'postgresql', 'database': 'dq_checks', 'schema': 'public', 'table': 'customers', 'selection_mode': 'hierarchical', 'host': 'localhost', 'port': '5432', 'user': 'postgres', 'password': 'postgres'}
2026-01-28 17:35:01,549 - dq_comparison - INFO - Selected via navigation for TARGET: dq_checks.public.customers
2026-01-28 17:35:01,549 - dq_unified - INFO - Loading data from DATABASE
2026-01-28 17:35:01,550 - dq_unified - INFO - Loading large database table: customers
2026-01-28 17:35:01,550 - dq_unified - INFO - Normalized DB config with schema: public
2026-01-28 17:35:01,710 - dq_unified - INFO - PostgreSQL table public.customers has 15 rows
2026-01-28 17:35:01,711 - dq_unified - INFO - Loading 15 rows from PostgreSQL...
2026-01-28 17:35:01,717 - dq_unified - INFO - Loaded 15 rows from PostgreSQL
2026-01-28 17:35:01,723 - dq_unified - INFO - Memory optimization: 0.0MB -> 0.0MB (Saved: 0.0MB)
2026-01-28 17:35:01,724 - dq_unified - INFO - Loaded 15 rows, 10 columns. Memory: 110.4MB total, 0.0MB for dataframe
2026-01-28 17:35:01,725 - dq_comparison - INFO - TARGET database loaded: 15 rows, 10 columns
2026-01-28 17:35:01,725 - dq_comparison - INFO - SELECTING COLUMNS FOR COMPARISON
2026-01-28 17:35:01,726 - dq_comparison - INFO - Source columns (original): ['CustomerName', 'Email', 'Phone', 'Salary', 'Department', 'JoinDate', 'PostalCode', 'City', 'Country', 'State']
2026-01-28 17:35:01,727 - dq_comparison - INFO - Target columns (original): ['customername', 'email', 'phone', 'salary', 'department', 'joindate', 'postalcode', 'city', 'country', 'state']
2026-01-28 17:35:01,727 - dq_comparison - INFO - Common columns lowercased: ['salary', 'customername', 'state', 'postalcode', 'country', 'email', 'city', 'joindate', 'phone', 'department']
2026-01-28 17:35:01,729 - dq_comparison - INFO - Found 10 common columns between source and target (case-insensitive)
2026-01-28 17:35:01,730 - dq_comparison - INFO - 
📋 Common columns available for comparison:
2026-01-28 17:35:01,730 - dq_comparison - INFO -   1. Salary (Source) ↔ salary (Target)
2026-01-28 17:35:01,731 - dq_comparison - INFO -   2. CustomerName (Source) ↔ customername (Target)
2026-01-28 17:35:01,731 - dq_comparison - INFO -   3. State (Source) ↔ state (Target)
2026-01-28 17:35:01,732 - dq_comparison - INFO -   4. PostalCode (Source) ↔ postalcode (Target)
2026-01-28 17:35:01,733 - dq_comparison - INFO -   5. Country (Source) ↔ country (Target)
2026-01-28 17:35:01,736 - dq_comparison - INFO -   6. Email (Source) ↔ email (Target)
2026-01-28 17:35:01,739 - dq_comparison - INFO -   7. City (Source) ↔ city (Target)
2026-01-28 17:35:01,739 - dq_comparison - INFO -   8. JoinDate (Source) ↔ joindate (Target)
2026-01-28 17:35:01,740 - dq_comparison - INFO -   9. Phone (Source) ↔ phone (Target)
2026-01-28 17:35:01,740 - dq_comparison - INFO -   10. Department (Source) ↔ department (Target)
2026-01-28 17:35:03,408 - dq_comparison - INFO - User column selection input: all
2026-01-28 17:35:03,413 - dq_comparison - INFO - User selected ALL common columns for comparison
2026-01-28 17:35:03,414 - dq_comparison - INFO - GENERATING COMPREHENSIVE COMPARISON REPORT
2026-01-28 17:35:03,415 - dq_comparison - INFO - Report details - Source: Database: mysql - dq_checks.customers_bkp, Target: Database: postgresql - dq_checks.customers, Selected columns: 10
2026-01-28 17:35:03,415 - dq_comparison - INFO - Initializing Error Logger...
2026-01-28 17:35:03,416 - dq_error_log - INFO - ErrorLogger initialized with database: dq_checks
2026-01-28 17:35:03,442 - dq_error_log - INFO - Database connection successful
2026-01-28 17:35:03,443 - dq_comparison - INFO - Session ID: CMP_20260128_173503
2026-01-28 17:35:03,444 - dq_comparison - INFO - 
======================================================================
2026-01-28 17:35:03,445 - dq_comparison - INFO - 🔄 RUNNING SOURCE-TARGET COMPARISON WITH PERFECT NORMALIZATION
2026-01-28 17:35:03,446 - dq_comparison - INFO - ======================================================================
2026-01-28 17:35:03,448 - dq_comparison - INFO - Session ID: CMP_20260128_173503
2026-01-28 17:35:03,451 - dq_comparison - INFO - Source: Database: mysql - dq_checks.customers_bkp
2026-01-28 17:35:03,452 - dq_comparison - INFO - Target: Database: postgresql - dq_checks.customers
2026-01-28 17:35:03,453 - dq_comparison - INFO - Selected columns: 10
2026-01-28 17:35:03,454 - dq_comparison - INFO - ======================================================================
2026-01-28 17:35:03,454 - dq_comparison - INFO - 
1️⃣ FIRST: ROW COUNT CHECK
2026-01-28 17:35:03,455 - dq_comparison - WARNING - ❌ Row count mismatch: Source=12, Target=15, Difference=3
2026-01-28 17:35:03,456 - dq_comparison - WARNING -    Extra in target: 3 rows
2026-01-28 17:35:03,457 - dq_comparison - INFO - 
2️⃣ COLUMN STRUCTURE COMPARISON
2026-01-28 17:35:03,457 - dq_comparison - INFO - Comparing column structures...
2026-01-28 17:35:03,458 - dq_comparison - INFO - Column structure comparison complete. Match: False
2026-01-28 17:35:03,459 - dq_comparison - INFO - 
3️⃣ PRIMARY KEY VALIDATION
2026-01-28 17:35:03,459 - dq_comparison - INFO - Validating primary key/unique fields...
2026-01-28 17:35:03,460 - dq_comparison - INFO - Checking key fields: ['PostalCode']
2026-01-28 17:35:03,460 - dq_comparison - WARNING - No key fields found in both datasets
2026-01-28 17:35:03,484 - dq_comparison - INFO -    No key fields specified or detected
2026-01-28 17:35:03,484 - dq_comparison - INFO -    Column names match: ❌
2026-01-28 17:35:03,486 - dq_comparison - INFO -    Column order match: ❌
2026-01-28 17:35:03,486 - dq_comparison - INFO -    Data types match: ✅
2026-01-28 17:35:03,490 - dq_comparison - WARNING -    Missing in target: ['CustomerName', 'Email', 'Phone', 'Salary', 'Department', 'JoinDate', 'PostalCode', 'City', 'Country', 'State']
2026-01-28 17:35:03,491 - dq_comparison - WARNING -    Missing in source: ['customername', 'email', 'phone', 'salary', 'department', 'joindate', 'postalcode', 'city', 'country', 'state']
2026-01-28 17:35:03,492 - dq_comparison - INFO - 
4️⃣ TABLE METADATA COMPARISON
2026-01-28 17:35:03,492 - dq_comparison - INFO - Comparing table-level metadata...
2026-01-28 17:35:03,503 - dq_comparison - INFO - Table metadata comparison complete. Match: False
2026-01-28 17:35:03,524 - dq_comparison - INFO -    Table metadata match: ❌
2026-01-28 17:35:03,525 - dq_comparison - INFO -    Source: 12 rows, 10 cols, 0.0 MB
2026-01-28 17:35:03,526 - dq_comparison - INFO -    Target: 15 rows, 10 cols, 0.01 MB
2026-01-28 17:35:03,531 - dq_comparison - WARNING -    Found 1 metadata differences:
2026-01-28 17:35:03,532 - dq_comparison - WARNING -      • Row Count: Source=12, Target=15
2026-01-28 17:35:03,533 - dq_comparison - INFO - 
5️⃣ HASH-BASED COMPARISON
2026-01-28 17:35:03,534 - dq_comparison - INFO - ℹ️  Note: All NULL values normalized to 'NULL'
2026-01-28 17:35:03,534 - dq_comparison - INFO - ℹ️  Note: Dates normalized to YYYY-MM-DD
2026-01-28 17:35:03,535 - dq_comparison - INFO - ℹ️  Note: Strings trimmed and case-normalized
2026-01-28 17:35:03,536 - dq_comparison - INFO - ℹ️  Note: Phone numbers stripped to digits only, leading zeros removed
2026-01-28 17:35:03,536 - dq_comparison - INFO - SECOND CHECK: HASH-BASED COMPARISON WITH PERFECT NORMALIZATION
2026-01-28 17:35:03,548 - dq_comparison - INFO - Starting comparison of 27 total rows...
2026-01-28 17:35:03,548 - dq_comparison - INFO - === DEBUG: DATA TYPE CHECK ===
2026-01-28 17:35:03,549 - dq_comparison - INFO - Column: Salary
2026-01-28 17:35:03,550 - dq_comparison - INFO -   Source type: <class 'numpy.float32'>, value: 50000.0
2026-01-28 17:35:03,550 - dq_comparison - INFO -   Target type: <class 'numpy.float32'>, value: 50000.0
2026-01-28 17:35:03,553 - dq_comparison - INFO -   Normalized: '50000' vs '50000'
2026-01-28 17:35:03,553 - dq_comparison - INFO -   Match: True
2026-01-28 17:35:03,554 - dq_comparison - INFO - Column: CustomerName
2026-01-28 17:35:03,554 - dq_comparison - INFO -   Source type: <class 'str'>, value: John Doe
2026-01-28 17:35:03,556 - dq_comparison - INFO -   Target type: <class 'str'>, value: John Doe
2026-01-28 17:35:03,561 - dq_comparison - INFO -   Normalized: 'john doe' vs 'john doe'
2026-01-28 17:35:03,562 - dq_comparison - INFO -   Match: True
2026-01-28 17:35:03,563 - dq_comparison - INFO - Column: State
2026-01-28 17:35:03,563 - dq_comparison - INFO -   Source type: <class 'str'>, value: TS
2026-01-28 17:35:03,564 - dq_comparison - INFO -   Target type: <class 'str'>, value: TS
2026-01-28 17:35:03,565 - dq_comparison - INFO -   Normalized: 'ts' vs 'ts'
2026-01-28 17:35:03,565 - dq_comparison - INFO -   Match: True
2026-01-28 17:35:03,566 - dq_comparison - INFO - Source DF columns: ['CustomerName', 'Email', 'Phone', 'Salary', 'Department', 'JoinDate', 'PostalCode', 'City', 'Country', 'State']
2026-01-28 17:35:03,567 - dq_comparison - INFO - Target DF columns: ['customername', 'email', 'phone', 'salary', 'department', 'joindate', 'postalcode', 'city', 'country', 'state']
2026-01-28 17:35:03,568 - dq_comparison - INFO - Selected columns for comparison: ['Salary', 'CustomerName', 'State', 'PostalCode', 'Country', 'Email', 'City', 'JoinDate', 'Phone', 'Department']
2026-01-28 17:35:03,569 - dq_comparison - INFO - Using 10 common columns for hash comparison
2026-01-28 17:35:03,569 - dq_comparison - INFO - Source columns: ['Salary', 'CustomerName', 'State', 'PostalCode', 'Country', 'Email', 'City', 'JoinDate', 'Phone', 'Department']
2026-01-28 17:35:03,572 - dq_comparison - INFO - Target columns: ['salary', 'customername', 'state', 'postalcode', 'country', 'email', 'city', 'joindate', 'phone', 'department']
2026-01-28 17:35:03,576 - dq_comparison - INFO - Generating hashes for source data (12 rows)...
2026-01-28 17:35:03,584 - dq_comparison - INFO -    Hashing source data: 11.1% complete (3/27 rows)
2026-01-28 17:35:03,588 - dq_comparison - INFO -    Hashing source data: 22.2% complete (6/27 rows)
2026-01-28 17:35:03,592 - dq_comparison - INFO -    Hashing source data: 33.3% complete (9/27 rows)
2026-01-28 17:35:03,598 - dq_comparison - INFO -    Hashing source data: 44.4% complete (12/27 rows)
2026-01-28 17:35:03,601 - dq_comparison - INFO - === DEBUG: SAMPLE HASHES ===
2026-01-28 17:35:03,601 - dq_comparison - INFO - Hash 1: e20fe9cf2affa2b3... (sample row 0)
2026-01-28 17:35:03,602 - dq_comparison - INFO - Hash 2: b08c32df1d0e30b0... (sample row 1)
2026-01-28 17:35:03,606 - dq_comparison - INFO - Hash 3: d411bdb4a216e5fd... (sample row 2)
2026-01-28 17:35:03,606 - dq_comparison - INFO - Generating hashes for target data (15 rows)...
2026-01-28 17:35:03,611 - dq_comparison - INFO -    Hashing target data: 55.6% complete (15/27 rows)
2026-01-28 17:35:03,615 - dq_comparison - INFO -    Hashing target data: 66.7% complete (18/27 rows)
2026-01-28 17:35:03,624 - dq_comparison - INFO -    Hashing target data: 77.8% complete (21/27 rows)
2026-01-28 17:35:03,630 - dq_comparison - INFO -    Hashing target data: 88.9% complete (24/27 rows)
2026-01-28 17:35:03,635 - dq_comparison - INFO -    Hashing target data: 100.0% complete (27/27 rows)
2026-01-28 17:35:03,638 - dq_comparison - INFO - 
======================================================================
2026-01-28 17:35:03,638 - dq_comparison - INFO - 🔍 DEBUG: ANALYZING WHY HASHES DON'T MATCH
2026-01-28 17:35:03,639 - dq_comparison - INFO - ======================================================================
2026-01-28 17:35:03,640 - dq_comparison - INFO - 
--- Analyzing Row 0 ---
2026-01-28 17:35:03,641 - dq_comparison - INFO - Column 'Salary' → 'salary':
2026-01-28 17:35:03,641 - dq_comparison - INFO -   Source: '50000.0' (type: float32) → '50000'
2026-01-28 17:35:03,642 - dq_comparison - INFO -   Target: '50000.0' (type: float32) → '50000'
2026-01-28 17:35:03,642 - dq_comparison - INFO -   Match after normalization: ✅ YES
2026-01-28 17:35:03,643 - dq_comparison - INFO - Column 'CustomerName' → 'customername':
2026-01-28 17:35:03,644 - dq_comparison - INFO -   Source: 'John Doe' (type: str) → 'john doe'
2026-01-28 17:35:03,644 - dq_comparison - INFO -   Target: 'John Doe' (type: str) → 'john doe'
2026-01-28 17:35:03,645 - dq_comparison - INFO -   Match after normalization: ✅ YES
2026-01-28 17:35:03,646 - dq_comparison - INFO - Column 'State' → 'state':
2026-01-28 17:35:03,646 - dq_comparison - INFO -   Source: 'TS' (type: str) → 'ts'
2026-01-28 17:35:03,650 - dq_comparison - INFO -   Target: 'TS' (type: str) → 'ts'
2026-01-28 17:35:03,653 - dq_comparison - INFO -   Match after normalization: ✅ YES
2026-01-28 17:35:03,654 - dq_comparison - INFO - Column 'PostalCode' → 'postalcode':
2026-01-28 17:35:03,655 - dq_comparison - INFO -   Source: '10001' (type: str) → '10001'
2026-01-28 17:35:03,655 - dq_comparison - INFO -   Target: '10001' (type: str) → '10001'
2026-01-28 17:35:03,656 - dq_comparison - INFO -   Match after normalization: ✅ YES
2026-01-28 17:35:03,657 - dq_comparison - INFO - Column 'Country' → 'country':
2026-01-28 17:35:03,658 - dq_comparison - INFO -   Source: 'USA' (type: str) → 'usa'
2026-01-28 17:35:03,658 - dq_comparison - INFO -   Target: 'USA' (type: str) → 'usa'
2026-01-28 17:35:03,659 - dq_comparison - INFO -   Match after normalization: ✅ YES
2026-01-28 17:35:03,659 - dq_comparison - INFO - 
Hash components for Row 0:
2026-01-28 17:35:03,660 - dq_comparison - INFO - Source hash string start: 50000|john doe|ts...
2026-01-28 17:35:03,661 - dq_comparison - INFO - Target hash string start: 50000|john doe|ts...
2026-01-28 17:35:03,662 - dq_comparison - INFO - Same? ✅ YES
2026-01-28 17:35:03,662 - dq_comparison - INFO - 
--- Analyzing Row 1 ---
2026-01-28 17:35:03,665 - dq_comparison - INFO - Column 'Salary' → 'salary':
2026-01-28 17:35:03,668 - dq_comparison - INFO -   Source: '60000.0' (type: float32) → '60000'
2026-01-28 17:35:03,668 - dq_comparison - INFO -   Target: '60000.0' (type: float32) → '60000'
2026-01-28 17:35:03,669 - dq_comparison - INFO -   Match after normalization: ✅ YES
2026-01-28 17:35:03,670 - dq_comparison - INFO - Column 'CustomerName' → 'customername':
2026-01-28 17:35:03,670 - dq_comparison - INFO -   Source: 'Jane Smith' (type: str) → 'jane smith'
2026-01-28 17:35:03,670 - dq_comparison - INFO -   Target: 'Jane Smith' (type: str) → 'jane smith'
2026-01-28 17:35:03,671 - dq_comparison - INFO -   Match after normalization: ✅ YES
2026-01-28 17:35:03,671 - dq_comparison - INFO - Column 'State' → 'state':
2026-01-28 17:35:03,672 - dq_comparison - INFO -   Source: 'AP' (type: str) → 'ap'
2026-01-28 17:35:03,672 - dq_comparison - INFO -   Target: 'AP' (type: str) → 'ap'
2026-01-28 17:35:03,672 - dq_comparison - INFO -   Match after normalization: ✅ YES
2026-01-28 17:35:03,673 - dq_comparison - INFO - Column 'PostalCode' → 'postalcode':
2026-01-28 17:35:03,673 - dq_comparison - INFO -   Source: '10002' (type: str) → '10002'
2026-01-28 17:35:03,674 - dq_comparison - INFO -   Target: '10002' (type: str) → '10002'
2026-01-28 17:35:03,674 - dq_comparison - INFO -   Match after normalization: ✅ YES
2026-01-28 17:35:03,675 - dq_comparison - INFO - Column 'Country' → 'country':
2026-01-28 17:35:03,675 - dq_comparison - INFO -   Source: 'USA' (type: str) → 'usa'
2026-01-28 17:35:03,677 - dq_comparison - INFO -   Target: 'USA' (type: str) → 'usa'
2026-01-28 17:35:03,678 - dq_comparison - INFO -   Match after normalization: ✅ YES
2026-01-28 17:35:03,678 - dq_comparison - INFO - 
Hash components for Row 1:
2026-01-28 17:35:03,680 - dq_comparison - INFO - Source hash string start: 60000|jane smith|ap...
2026-01-28 17:35:03,683 - dq_comparison - INFO - Target hash string start: 60000|jane smith|ap...
2026-01-28 17:35:03,684 - dq_comparison - INFO - Same? ✅ YES
2026-01-28 17:35:03,685 - dq_comparison - INFO - 
--- Analyzing Row 2 ---
2026-01-28 17:35:03,686 - dq_comparison - INFO - Column 'Salary' → 'salary':
2026-01-28 17:35:03,686 - dq_comparison - INFO -   Source: '55000.0' (type: float32) → '55000'
2026-01-28 17:35:03,687 - dq_comparison - INFO -   Target: '55000.0' (type: float32) → '55000'
2026-01-28 17:35:03,687 - dq_comparison - INFO -   Match after normalization: ✅ YES
2026-01-28 17:35:03,687 - dq_comparison - INFO - Column 'CustomerName' → 'customername':
2026-01-28 17:35:03,689 - dq_comparison - INFO -   Source: 'Bob Johnson' (type: str) → 'bob johnson'
2026-01-28 17:35:03,689 - dq_comparison - INFO -   Target: 'Bob Johnson' (type: str) → 'bob johnson'
2026-01-28 17:35:03,690 - dq_comparison - INFO -   Match after normalization: ✅ YES
2026-01-28 17:35:03,691 - dq_comparison - INFO - Column 'State' → 'state':
2026-01-28 17:35:03,691 - dq_comparison - INFO -   Source: 'KL' (type: str) → 'kl'
2026-01-28 17:35:03,692 - dq_comparison - INFO -   Target: 'KL' (type: str) → 'kl'
2026-01-28 17:35:03,692 - dq_comparison - INFO -   Match after normalization: ✅ YES
2026-01-28 17:35:03,693 - dq_comparison - INFO - Column 'PostalCode' → 'postalcode':
2026-01-28 17:35:03,693 - dq_comparison - INFO -   Source: '10003' (type: str) → '10003'
2026-01-28 17:35:03,697 - dq_comparison - INFO -   Target: '10003' (type: str) → '10003'
2026-01-28 17:35:03,700 - dq_comparison - INFO -   Match after normalization: ✅ YES
2026-01-28 17:35:03,701 - dq_comparison - INFO - Column 'Country' → 'country':
2026-01-28 17:35:03,701 - dq_comparison - INFO -   Source: 'USA' (type: str) → 'usa'
2026-01-28 17:35:03,702 - dq_comparison - INFO -   Target: 'USA' (type: str) → 'usa'
2026-01-28 17:35:03,702 - dq_comparison - INFO -   Match after normalization: ✅ YES
2026-01-28 17:35:03,703 - dq_comparison - INFO - 
Hash components for Row 2:
2026-01-28 17:35:03,704 - dq_comparison - INFO - Source hash string start: 55000|bob johnson|kl...
2026-01-28 17:35:03,704 - dq_comparison - INFO - Target hash string start: 55000|bob johnson|kl...
2026-01-28 17:35:03,704 - dq_comparison - INFO - Same? ✅ YES
2026-01-28 17:35:03,705 - dq_comparison - INFO - 
--- Column Data Types Analysis ---
2026-01-28 17:35:03,705 - dq_comparison - INFO - Column 1: 'Salary' (float32) ↔ 'salary' (float32)
2026-01-28 17:35:03,706 - dq_comparison - INFO -   Sample: Source='50000.0', Target='50000.0'
2026-01-28 17:35:03,707 - dq_comparison - INFO - Column 2: 'CustomerName' (object) ↔ 'customername' (object)
2026-01-28 17:35:03,708 - dq_comparison - INFO -   Sample: Source='John Doe', Target='John Doe'
2026-01-28 17:35:03,708 - dq_comparison - INFO - Column 3: 'State' (object) ↔ 'state' (object)
2026-01-28 17:35:03,709 - dq_comparison - INFO -   Sample: Source='TS', Target='TS'
2026-01-28 17:35:03,709 - dq_comparison - INFO - Column 4: 'PostalCode' (object) ↔ 'postalcode' (object)
2026-01-28 17:35:03,709 - dq_comparison - INFO -   Sample: Source='10001', Target='10001'
2026-01-28 17:35:03,713 - dq_comparison - INFO - Column 5: 'Country' (category) ↔ 'country' (category)
2026-01-28 17:35:03,716 - dq_comparison - INFO -   Sample: Source='USA', Target='USA'
2026-01-28 17:35:03,716 - dq_comparison - INFO - PERFORMING DETAILED ROW-LEVEL COMPARISON WITH PAGINATION...
2026-01-28 17:35:03,717 - dq_comparison - INFO - Found 9 total mismatches
2026-01-28 17:35:03,717 - dq_comparison - INFO - Will process detailed comparisons for first 9 rows
2026-01-28 17:35:03,824 - dq_comparison - INFO - 
================================================================================
2026-01-28 17:35:03,824 - dq_comparison - INFO - DETAILED MISMATCH SUMMARY:
2026-01-28 17:35:03,829 - dq_comparison - INFO -   Total mismatches found: 6
2026-01-28 17:35:03,829 - dq_comparison - INFO -   Detailed comparisons logged: 6
2026-01-28 17:35:03,830 - dq_comparison - INFO -   First 10 rows displayed above
2026-01-28 17:35:03,830 - dq_comparison - INFO -   All mismatches stored in database with complete data
2026-01-28 17:35:03,831 - dq_comparison - INFO - ================================================================================
2026-01-28 17:35:03,831 - dq_comparison - INFO - Hash-based Comparison Results (with duplicate handling):
2026-01-28 17:35:03,832 - dq_comparison - INFO -   • Unique source hashes: 11
2026-01-28 17:35:03,833 - dq_comparison - INFO -   • Unique target hashes: 14
2026-01-28 17:35:03,833 - dq_comparison - INFO -   • Common hashes: 8
2026-01-28 17:35:03,833 - dq_comparison - INFO -   • Common rows (counting duplicates): 9
2026-01-28 17:35:03,834 - dq_comparison - INFO -   • Rows only in source (counting duplicates): 3
2026-01-28 17:35:03,834 - dq_comparison - INFO -   • Rows only in target (counting duplicates): 6
2026-01-28 17:35:03,838 - dq_comparison - INFO - HASH-ONLY COMPARISON COMPLETED
2026-01-28 17:35:03,839 - dq_comparison - INFO - Returning counts for simple scoring:
2026-01-28 17:35:03,839 - dq_comparison - INFO -   Common rows: 9
2026-01-28 17:35:03,839 - dq_comparison - INFO -   Unique to source: 3
2026-01-28 17:35:03,840 - dq_comparison - INFO -   Unique to target: 6
2026-01-28 17:35:03,840 - dq_comparison - INFO -   Value mismatches: 90
2026-01-28 17:35:03,841 - dq_comparison - INFO -   Missing rows: 3
2026-01-28 17:35:03,841 - dq_comparison - INFO -   Extra rows: 6
2026-01-28 17:35:03,843 - dq_comparison - INFO - 
========================================================================================================================
COMPARISON: Mysql Database vs Postgresql Database
========================================================================================================================
Row   | Diff Count | Source (Sample)                          | Target (Sample)                         
------------------------------------------------------------------------------------------------------------------------
3     | 1          | Salary: 60000.0                          | salary: 60000.0                         
8     | 1          | Salary: NULL                             | salary: NULL                            
11    | 1          | Salary: 62000.0                          | salary: 62000.0                         
14    | 10         | Salary: NULL                             | salary: 67000.0                         
15    | 9          | Salary: NULL                             | salary: NULL                            
16    | 10         | Salary: NULL                             | salary: 49000.0                         
------------------------------------------------------------------------------------------------------------------------
Showing all 6 mismatched rows.
========================================================================================================================
2026-01-28 17:35:03,843 - dq_comparison - INFO - Returning enhanced mismatch structure with 6 detailed mismatches
2026-01-28 17:35:03,844 - dq_comparison - INFO - New structure: 6 detailed mismatches
2026-01-28 17:35:03,845 - dq_comparison - INFO - 
6️⃣ DATA QUALITY ANALYSIS
2026-01-28 17:35:03,845 - dq_comparison - INFO - Analyzing data quality metrics...
2026-01-28 17:35:03,879 - dq_comparison - INFO - Null values - Source: 4 (3.33%), Target: 6 (4.00%)
2026-01-28 17:35:03,882 - dq_comparison - INFO - Duplicate rows (normalized) - Source: 1, Target: 1
2026-01-28 17:35:03,884 - dq_comparison - INFO - Source duplicate samples: ['Row 2', 'Row 7']
2026-01-28 17:35:03,886 - dq_comparison - INFO - Target duplicate samples: ['Row 2', 'Row 7']
2026-01-28 17:35:03,901 - dq_error_log - INFO - Retrieved 8 error logs for session CMP_20260128_173503
2026-01-28 17:35:03,901 - dq_comparison - INFO - 
📊 SIMPLE SCORING CALCULATION:
2026-01-28 17:35:03,902 - dq_comparison - INFO -   Source rows: 12
2026-01-28 17:35:03,905 - dq_comparison - INFO -   Common rows (matched): 9
2026-01-28 17:35:03,906 - dq_comparison - INFO -   Calculation: (9 / 12) * 100 = 75.00%
2026-01-28 17:35:03,906 - dq_comparison - INFO -   Explanation: 9 matched rows out of 12 total source rows
2026-01-28 17:35:03,907 - dq_comparison - INFO - 
=== AUDIT LOGGING SECTION ===
2026-01-28 17:35:03,907 - dq_comparison - INFO - 🔍 Audit logging is ENABLED in APP_SETTINGS
2026-01-28 17:35:03,907 - dq_audit - INFO - Audit class initialized with database: dq_checks
2026-01-28 17:35:03,908 - dq_comparison - INFO - Attempting to log audit record for session: CMP_20260128_173503
2026-01-28 17:35:03,908 - dq_audit - INFO - Starting database insertion for comparison...
2026-01-28 17:35:03,933 - dq_audit - INFO - Inserted comparison record with ID: 838
2026-01-28 17:35:03,933 - dq_comparison - INFO - ✅ Audit record logged successfully (ID: 838)
2026-01-28 17:35:03,935 - dq_comparison - INFO - 
======================================================================
2026-01-28 17:35:03,938 - dq_comparison - INFO - 📊 COMPARISON RESULTS SUMMARY
2026-01-28 17:35:03,939 - dq_comparison - INFO - ======================================================================
2026-01-28 17:35:03,939 - dq_comparison - INFO - Session ID: CMP_20260128_173503
2026-01-28 17:35:03,940 - dq_comparison - INFO - Source: Database: mysql - dq_checks.customers_bkp (12 rows)
2026-01-28 17:35:03,940 - dq_comparison - INFO - Target: Database: postgresql - dq_checks.customers (15 rows)
2026-01-28 17:35:03,941 - dq_comparison - INFO - Selected columns: 10
2026-01-28 17:35:03,942 - dq_comparison - INFO - ----------------------------------------------------------------------
2026-01-28 17:35:03,943 - dq_comparison - INFO - 1️⃣ Row count match: ❌ No
2026-01-28 17:35:03,943 - dq_comparison - INFO -    Missing in target: 0 rows
2026-01-28 17:35:03,944 - dq_comparison - INFO -    Extra in target: 3 rows
2026-01-28 17:35:03,945 - dq_comparison - INFO - 2️⃣ Column structure match: ❌ No
2026-01-28 17:35:03,945 - dq_comparison - INFO -    Missing in target: 10 columns
2026-01-28 17:35:03,946 - dq_comparison - INFO -      ['CustomerName', 'Email', 'Phone', 'Salary', 'Department']
2026-01-28 17:35:03,946 - dq_comparison - INFO -    Missing in source: 10 columns
2026-01-28 17:35:03,947 - dq_comparison - INFO -      ['customername', 'email', 'phone', 'salary', 'department']
2026-01-28 17:35:03,947 - dq_comparison - INFO - 3️ Primary key validation: ❌ Failed
2026-01-28 17:35:03,948 - dq_comparison - INFO - 4️ Table metadata: ❌ Mismatch
2026-01-28 17:35:03,949 - dq_comparison - INFO -    • Row Count: 12 vs 15
2026-01-28 17:35:03,949 - dq_comparison - INFO - 5️⃣ Common rows (both Mysql Database and Postgresql Database): 9 (75.00% of Mysql Database)
2026-01-28 17:35:03,950 - dq_comparison - INFO - 6️⃣ Mysql Database-only rows: 3 (present ONLY in Mysql Database, NOT in Postgresql Database)
2026-01-28 17:35:03,951 - dq_comparison - INFO - 7️⃣ Postgresql Database-only rows: 6 (present ONLY in Postgresql Database, NOT in Mysql Database)
2026-01-28 17:35:03,951 - dq_comparison - INFO - 8️⃣ Column value mismatches: 0
2026-01-28 17:35:03,952 - dq_comparison - INFO - 9️ Data quality match: ❌ No
2026-01-28 17:35:03,953 - dq_comparison - INFO - 📈 DQ Score: 75.00%
2026-01-28 17:35:03,953 - dq_comparison - INFO - 📊 Calculation: (9 / 12) * 100 = 75.00%
2026-01-28 17:35:03,954 - dq_comparison - INFO - ======================================================================
2026-01-28 17:35:03,954 - dq_comparison - INFO - 
⚠️  FAIR MATCH! Significant differences found.
2026-01-28 17:35:03,955 - dq_comparison - INFO - 
🔍 NORMALIZATION APPLIED:
2026-01-28 17:35:03,956 - dq_comparison - INFO -    • NULL values → 'NULL' (consistent representation)
2026-01-28 17:35:03,961 - dq_comparison - INFO -    • Dates → YYYY-MM-DD format
2026-01-28 17:35:03,961 - dq_comparison - INFO -    • Strings → trimmed + lowercase
2026-01-28 17:35:03,962 - dq_comparison - INFO -    • Numeric values → standardized format
2026-01-28 17:35:03,963 - dq_comparison - INFO -    • Phone numbers → digits only, ALL leading zeros removed
2026-01-28 17:35:03,963 - dq_comparison - INFO -    • Extra whitespace removed
2026-01-28 17:35:03,964 - dq_comparison - INFO - 
🔍 DETAILED ERROR ANALYSIS:
2026-01-28 17:35:03,965 - dq_comparison - INFO - --------------------------------------------------
2026-01-28 17:35:03,965 - dq_comparison - INFO - 📊 SOURCE-ONLY ROWS: 3 rows
2026-01-28 17:35:03,966 - dq_comparison - INFO -    Present only in Mysql Database, missing from Postgresql Database
2026-01-28 17:35:03,966 - dq_comparison - INFO - 📊 TARGET-ONLY ROWS: 6 rows
2026-01-28 17:35:03,967 - dq_comparison - INFO -    Present only in Postgresql Database, extra (not in Mysql Database)
2026-01-28 17:35:03,983 - dq_error_log - INFO - Retrieved 8 errors for session CMP_20260128_173503
2026-01-28 17:35:03,984 - dq_comparison - INFO - 
📋 SAMPLE ERRORS (8 found):
2026-01-28 17:35:03,985 - dq_comparison - INFO - 
1. Row 0 - Metadata Row Count
2026-01-28 17:35:03,985 - dq_comparison - INFO -    Column: 
2026-01-28 17:35:03,986 - dq_comparison - INFO -    Metadata mismatch: Row Count
2026-01-28 17:35:03,986 - dq_comparison - INFO - 
2. Row 0 - Key Field Missing
2026-01-28 17:35:03,987 - dq_comparison - INFO -    Column: PostalCode
2026-01-28 17:35:03,988 - dq_comparison - INFO -    Primary key field 'PostalCode' missing in one or both datasets
2026-01-28 17:35:03,991 - dq_comparison - INFO - 
3. Row 3 - Row Data Mismatch
2026-01-28 17:35:03,992 - dq_comparison - INFO -    Row 3: Detailed data mismatch detected
2026-01-28 17:35:03,992 - dq_comparison - INFO - 
💡 For complete error details, run:
2026-01-28 17:35:03,993 - dq_comparison - INFO -    USE dq_checks;
2026-01-28 17:35:03,993 - dq_comparison - INFO -    SELECT excel_row, column_name, error_type, error_description,
2026-01-28 17:35:03,994 - dq_comparison - INFO -           actual_value, expected_value
2026-01-28 17:35:03,996 - dq_comparison - INFO -    FROM dq_error_logs
2026-01-28 17:35:03,996 - dq_comparison - INFO -    WHERE session_id = 'CMP_20260128_173503'
2026-01-28 17:35:03,996 - dq_comparison - INFO -    ORDER BY excel_row, column_name;
2026-01-28 17:35:04,013 - dq_comparison - INFO - 
✅ Comparison completed! Session ID: CMP_20260128_173503
2026-01-28 17:35:04,027 - dq_error_log - INFO - Retrieved 9 error logs for session CMP_20260128_173503
2026-01-28 17:35:04,045 - dq_error_log - INFO - Retrieved summary: 9 total errors for session CMP_20260128_173503
2026-01-28 17:35:04,046 - dq_audit - INFO - Audit class initialized with database: dq_checks
2026-01-28 17:35:04,067 - dq_audit - INFO - Retrieved 1 audit logs for session CMP_20260128_173503
2026-01-28 17:35:04,068 - dq_comparison - INFO - 
🔍 Final results verification:
2026-01-28 17:35:04,069 - dq_comparison - INFO -    Session ID: CMP_20260128_173503
2026-01-28 17:35:04,069 - dq_comparison - INFO -    DQ Score (Simple %): 75.00%
2026-01-28 17:35:04,073 - dq_comparison - INFO -    Source rows: 12
2026-01-28 17:35:04,073 - dq_comparison - INFO -    Matched rows: 9
2026-01-28 17:35:04,074 - dq_comparison - INFO -    Calculation: (9 / 12) * 100
2026-01-28 17:35:04,075 - __main__ - INFO - Source-Target Comparison completed successfully
2026-01-28 17:35:04,075 - __main__ - INFO - Displaying main menu options to user
2026-01-28 17:35:05,322 - __main__ - INFO - User selected option: 6
2026-01-28 17:35:05,323 - __main__ - INFO - User session ended. Duration: 0:00:48.736041
2026-01-28 17:35:05,325 - __main__ - INFO - 👋 Thank you for using Universal Data Quality Framework!
