2026-01-17 23:03:18,356 - root - INFO - CLI Mode Logging Initialized
2026-01-17 23:03:18,356 - root - INFO - CLI logs will be saved to: logs/dq_framework_20260117_230318.log
2026-01-17 23:03:18,357 - __main__ - INFO - 🚀 UNIVERSAL DATA QUALITY FRAMEWORK INITIALIZED
2026-01-17 23:03:18,362 - __main__ - INFO - Starting system resource check
2026-01-17 23:03:18,372 - __main__ - INFO - Total RAM: 15.7 GB
2026-01-17 23:03:18,373 - __main__ - INFO - Available RAM: 2.8 GB
2026-01-17 23:03:18,374 - __main__ - INFO - Memory used: 82.3%
2026-01-17 23:03:18,375 - __main__ - INFO - Memory status: OK
2026-01-17 23:03:18,377 - __main__ - INFO - Free disk space: 255.4 GB
2026-01-17 23:03:18,377 - __main__ - INFO - Disk used: 46.4%
2026-01-17 23:03:18,378 - __main__ - INFO - Disk space: OK
2026-01-17 23:03:18,880 - __main__ - INFO - CPU cores: 8
2026-01-17 23:03:18,880 - __main__ - INFO - CPU usage: 15.0%
2026-01-17 23:03:18,882 - __main__ - INFO - Python version: 3.12.4
2026-01-17 23:03:18,885 - __main__ - INFO - System platform: win32
2026-01-17 23:03:18,885 - __main__ - INFO - User session started at: 2026-01-17 23:03:18.885553
2026-01-17 23:03:18,886 - __main__ - INFO - Displaying main menu options to user
2026-01-17 23:03:20,264 - __main__ - INFO - User selected option: 2
2026-01-17 23:03:20,265 - __main__ - INFO - Starting Source-Target Comparison module
2026-01-17 23:03:20,268 - dq_comparison - INFO - STARTING UNIVERSAL SOURCE-TARGET COMPARISON TOOL
2026-01-17 23:03:20,271 - dq_comparison - INFO - LOADING SOURCE AND TARGET DATA
2026-01-17 23:03:20,272 - dq_comparison - INFO - 
==================================================
2026-01-17 23:03:20,272 - dq_comparison - INFO - 🔗 SOURCE DATA CONFIGURATION
2026-01-17 23:03:20,273 - dq_comparison - INFO - ==================================================
2026-01-17 23:03:21,683 - dq_comparison - INFO - 
🗄️ SOURCE DATABASE CONFIGURATION
2026-01-17 23:03:21,684 - dq_comparison - INFO - ----------------------------------------
2026-01-17 23:03:40,417 - dq_comparison - INFO - Selected database type code: mysql
2026-01-17 23:03:41,767 - dq_comparison - INFO - User selected Browse and Select mode for SOURCE
2026-01-17 23:03:41,777 - database_navigator - INFO - DatabaseNavigator initialized
2026-01-17 23:03:41,778 - database_navigator - INFO - Starting database navigation...
2026-01-17 23:03:41,778 - database_navigator - INFO - Database type: mysql
2026-01-17 23:03:41,779 - database_navigator - INFO - Getting database configuration...
2026-01-17 23:03:44,507 - database_navigator - INFO - Connecting to MYSQL...
2026-01-17 23:03:44,695 - database_navigator - INFO - Successfully connected to MYSQL!
2026-01-17 23:03:44,704 - database_navigator - INFO - get_databases() called. db_type: mysql, connection exists: True
2026-01-17 23:03:44,707 - database_navigator - INFO - Found 13 databases
2026-01-17 23:03:46,637 - database_navigator - INFO - Selected database: dq_checks
2026-01-17 23:03:46,643 - database_navigator - INFO - Found 1 schemas
2026-01-17 23:03:48,048 - database_navigator - INFO - Selected schema: dq_checks
2026-01-17 23:03:48,056 - database_navigator - INFO - Found 18 tables in schema 'dq_checks'
2026-01-17 23:03:51,573 - database_navigator - INFO - Selected table: comparison_small_source15
2026-01-17 23:03:51,581 - database_navigator - INFO - Selection complete: {'type': 'mysql', 'database': 'dq_checks', 'schema': 'dq_checks', 'table': 'comparison_small_source15', 'selection_mode': 'hierarchical', 'host': 'localhost', 'port': '3306', 'user': 'root', 'password': 'root'}
2026-01-17 23:03:51,583 - dq_comparison - INFO - Selected via navigation for SOURCE: dq_checks.dq_checks.comparison_small_source15
2026-01-17 23:03:51,583 - dq_unified - INFO - Loading data from DATABASE
2026-01-17 23:03:51,584 - dq_unified - INFO - Loading large database table: comparison_small_source15
2026-01-17 23:03:51,585 - dq_unified - INFO - Normalized DB config with schema: dq_checks
2026-01-17 23:03:51,602 - dq_unified - INFO - MySQL table comparison_small_source15 has 15 rows
2026-01-17 23:03:51,602 - dq_unified - INFO - Loading 15 rows from MySQL...
2026-01-17 23:03:52,187 - dq_unified - INFO - Loaded 15 rows from MySQL
2026-01-17 23:03:52,198 - dq_unified - INFO - Memory optimization: 0.0MB -> 0.0MB (Saved: 0.0MB)
2026-01-17 23:03:52,200 - dq_unified - INFO - Loaded 15 rows, 16 columns. Memory: 111.2MB total, 0.0MB for dataframe
2026-01-17 23:03:52,200 - dq_comparison - INFO - SOURCE database loaded: 15 rows, 16 columns
2026-01-17 23:03:52,202 - dq_comparison - INFO - 
==================================================
2026-01-17 23:03:52,203 - dq_comparison - INFO - 🔗 TARGET DATA CONFIGURATION
2026-01-17 23:03:52,203 - dq_comparison - INFO - ==================================================
2026-01-17 23:03:53,747 - dq_comparison - INFO - 
🗄️ TARGET DATABASE CONFIGURATION
2026-01-17 23:03:53,749 - dq_comparison - INFO - ----------------------------------------
2026-01-17 23:03:55,199 - dq_comparison - INFO - Selected database type code: postgresql
2026-01-17 23:03:56,638 - dq_comparison - INFO - User selected Browse and Select mode for TARGET
2026-01-17 23:03:56,650 - dq_comparison - INFO - Converted 'postgresql' to 'postgres' for database_navigator compatibility
2026-01-17 23:03:56,650 - database_navigator - INFO - DatabaseNavigator initialized
2026-01-17 23:03:56,651 - database_navigator - INFO - Starting database navigation...
2026-01-17 23:03:56,651 - database_navigator - INFO - Database type: postgres
2026-01-17 23:03:56,652 - database_navigator - INFO - Getting database configuration...
2026-01-17 23:03:59,032 - database_navigator - INFO - Connecting to POSTGRES...
2026-01-17 23:03:59,033 - database_navigator - INFO - Connecting to PostgreSQL...
2026-01-17 23:03:59,038 - database_navigator - INFO - Connecting to PostgreSQL: host=localhost, port=5432, database=postgres, user=postgres
2026-01-17 23:03:59,220 - database_navigator - INFO - Connection object created: <connection object at 0x00000285A3CB6BD0; dsn: 'user=postgres password=xxx dbname=postgres host=localhost port=5432', closed: 0>
2026-01-17 23:03:59,221 - database_navigator - INFO - ✅ PostgreSQL connection successful to database: postgres
2026-01-17 23:03:59,228 - database_navigator - INFO - get_databases() called. db_type: postgres, connection exists: True
2026-01-17 23:03:59,241 - database_navigator - INFO - Raw rows: [('dq_checks',), ('finewise-testdb',), ('postgres',)]
2026-01-17 23:03:59,242 - database_navigator - INFO - Found 3 databases
2026-01-17 23:04:00,600 - database_navigator - INFO - Selected database: dq_checks
2026-01-17 23:04:00,604 - database_navigator - INFO - Reconnecting to PostgreSQL database: dq_checks
2026-01-17 23:04:00,605 - database_navigator - INFO - Connecting to POSTGRES...
2026-01-17 23:04:00,605 - database_navigator - INFO - Connecting to PostgreSQL...
2026-01-17 23:04:00,606 - database_navigator - INFO - Connecting to PostgreSQL: host=localhost, port=5432, database=dq_checks, user=postgres
2026-01-17 23:04:00,782 - database_navigator - INFO - Connection object created: <connection object at 0x00000285A3F14040; dsn: 'user=postgres password=xxx dbname=dq_checks host=localhost port=5432', closed: 0>
2026-01-17 23:04:00,782 - database_navigator - INFO - ✅ PostgreSQL connection successful to database: dq_checks
2026-01-17 23:04:00,806 - database_navigator - INFO - Found 4 schemas
2026-01-17 23:04:02,382 - database_navigator - INFO - Selected schema: public
2026-01-17 23:04:02,388 - database_navigator - INFO - Ensuring connection to database: dq_checks for table list
2026-01-17 23:04:02,389 - database_navigator - INFO - Reconnecting to PostgreSQL database: dq_checks
2026-01-17 23:04:02,390 - database_navigator - INFO - Connecting to POSTGRES...
2026-01-17 23:04:02,390 - database_navigator - INFO - Connecting to PostgreSQL...
2026-01-17 23:04:02,391 - database_navigator - INFO - Connecting to PostgreSQL: host=localhost, port=5432, database=dq_checks, user=postgres
2026-01-17 23:04:02,566 - database_navigator - INFO - Connection object created: <connection object at 0x00000285A3F14150; dsn: 'user=postgres password=xxx dbname=dq_checks host=localhost port=5432', closed: 0>
2026-01-17 23:04:02,567 - database_navigator - INFO - ✅ PostgreSQL connection successful to database: dq_checks
2026-01-17 23:04:02,572 - database_navigator - INFO - Connected to database: dq_checks, schema: public
2026-01-17 23:04:02,612 - database_navigator - INFO - Found 5 tables in dq_checks.public: ['comparison_small_target13', 'customers', 'customers_bkp', 'employee', 'stg_transactions']
2026-01-17 23:04:02,613 - database_navigator - INFO - Found 5 tables in schema 'public'
2026-01-17 23:04:04,111 - database_navigator - INFO - Selected table: comparison_small_target13
2026-01-17 23:04:04,118 - database_navigator - INFO - Selection complete: {'type': 'postgresql', 'database': 'dq_checks', 'schema': 'public', 'table': 'comparison_small_target13', 'selection_mode': 'hierarchical', 'host': 'localhost', 'port': '5432', 'user': 'postgres', 'password': 'postgres'}
2026-01-17 23:04:04,119 - dq_comparison - INFO - Selected via navigation for TARGET: dq_checks.public.comparison_small_target13
2026-01-17 23:04:04,120 - dq_unified - INFO - Loading data from DATABASE
2026-01-17 23:04:04,120 - dq_unified - INFO - Loading large database table: comparison_small_target13
2026-01-17 23:04:04,120 - dq_unified - INFO - Normalized DB config with schema: public
2026-01-17 23:04:04,295 - dq_unified - INFO - PostgreSQL table public.comparison_small_target13 has 13 rows
2026-01-17 23:04:04,295 - dq_unified - INFO - Loading 13 rows from PostgreSQL...
2026-01-17 23:04:04,302 - dq_unified - INFO - Loaded 13 rows from PostgreSQL
2026-01-17 23:04:04,310 - dq_unified - INFO - Memory optimization: 0.0MB -> 0.0MB (Saved: 0.0MB)
2026-01-17 23:04:04,311 - dq_unified - INFO - Loaded 13 rows, 16 columns. Memory: 111.8MB total, 0.0MB for dataframe
2026-01-17 23:04:04,311 - dq_comparison - INFO - TARGET database loaded: 13 rows, 16 columns
2026-01-17 23:04:04,314 - dq_comparison - INFO - SELECTING COLUMNS FOR COMPARISON
2026-01-17 23:04:04,315 - dq_comparison - INFO - Source columns (original): ['transaction_id', 'account_id', 'customer_id', 'transaction_date', 'posting_date', 'transaction_type', 'currency', 'amount', 'balance_after', 'status', 'merchant_name', 'merchant_category', 'country', 'reference_code', 'created_at', 'updated_at']
2026-01-17 23:04:04,317 - dq_comparison - INFO - Target columns (original): ['transaction_id', 'account_id', 'customer_id', 'transaction_date', 'posting_date', 'transaction_type', 'currency', 'amount', 'balance_after', 'status', 'merchant_name', 'merchant_category', 'country', 'reference_code', 'created_at', 'updated_at']
2026-01-17 23:04:04,317 - dq_comparison - INFO - Common columns lowercased: ['transaction_id', 'account_id', 'customer_id', 'transaction_date', 'posting_date', 'transaction_type', 'currency', 'amount', 'balance_after', 'status', 'merchant_name', 'merchant_category', 'country', 'reference_code', 'created_at', 'updated_at']
2026-01-17 23:04:04,318 - dq_comparison - INFO - Found 16 common columns between source and target (case-insensitive)
2026-01-17 23:04:04,319 - dq_comparison - INFO - 
📋 Common columns available for comparison:
2026-01-17 23:04:04,319 - dq_comparison - INFO -   1. transaction_id (Source) ↔ transaction_id (Target)
2026-01-17 23:04:04,320 - dq_comparison - INFO -   2. account_id (Source) ↔ account_id (Target)
2026-01-17 23:04:04,320 - dq_comparison - INFO -   3. customer_id (Source) ↔ customer_id (Target)
2026-01-17 23:04:04,321 - dq_comparison - INFO -   4. transaction_date (Source) ↔ transaction_date (Target)
2026-01-17 23:04:04,322 - dq_comparison - INFO -   5. posting_date (Source) ↔ posting_date (Target)
2026-01-17 23:04:04,323 - dq_comparison - INFO -   6. transaction_type (Source) ↔ transaction_type (Target)
2026-01-17 23:04:04,324 - dq_comparison - INFO -   7. currency (Source) ↔ currency (Target)
2026-01-17 23:04:04,324 - dq_comparison - INFO -   8. amount (Source) ↔ amount (Target)
2026-01-17 23:04:04,325 - dq_comparison - INFO -   9. balance_after (Source) ↔ balance_after (Target)
2026-01-17 23:04:04,325 - dq_comparison - INFO -   10. status (Source) ↔ status (Target)
2026-01-17 23:04:04,326 - dq_comparison - INFO -   11. merchant_name (Source) ↔ merchant_name (Target)
2026-01-17 23:04:04,327 - dq_comparison - INFO -   12. merchant_category (Source) ↔ merchant_category (Target)
2026-01-17 23:04:04,327 - dq_comparison - INFO -   13. country (Source) ↔ country (Target)
2026-01-17 23:04:04,332 - dq_comparison - INFO -   14. reference_code (Source) ↔ reference_code (Target)
2026-01-17 23:04:04,333 - dq_comparison - INFO -   15. created_at (Source) ↔ created_at (Target)
2026-01-17 23:04:04,334 - dq_comparison - INFO -   16. updated_at (Source) ↔ updated_at (Target)
2026-01-17 23:04:05,825 - dq_comparison - INFO - User column selection input: all
2026-01-17 23:04:05,827 - dq_comparison - INFO - User selected ALL common columns for comparison
2026-01-17 23:04:05,827 - dq_comparison - INFO - GENERATING COMPREHENSIVE COMPARISON REPORT
2026-01-17 23:04:05,830 - dq_comparison - INFO - Report details - Source: Database: mysql - dq_checks.comparison_small_source15, Target: Database: postgresql - dq_checks.comparison_small_target13, Selected columns: 16
2026-01-17 23:04:05,831 - dq_comparison - INFO - Initializing Error Logger...
2026-01-17 23:04:05,832 - dq_error_log - INFO - ErrorLogger initialized with database: dq_checks
2026-01-17 23:04:05,849 - dq_error_log - INFO - Database connection successful
2026-01-17 23:04:05,849 - dq_comparison - INFO - Session ID: CMP_20260117_230405
2026-01-17 23:04:05,851 - dq_comparison - INFO - 
======================================================================
2026-01-17 23:04:05,852 - dq_comparison - INFO - 🔄 RUNNING SOURCE-TARGET COMPARISON WITH PERFECT NORMALIZATION
2026-01-17 23:04:05,853 - dq_comparison - INFO - ======================================================================
2026-01-17 23:04:05,854 - dq_comparison - INFO - Session ID: CMP_20260117_230405
2026-01-17 23:04:05,855 - dq_comparison - INFO - Source: Database: mysql - dq_checks.comparison_small_source15
2026-01-17 23:04:05,855 - dq_comparison - INFO - Target: Database: postgresql - dq_checks.comparison_small_target13
2026-01-17 23:04:05,856 - dq_comparison - INFO - Selected columns: 16
2026-01-17 23:04:05,857 - dq_comparison - INFO - ======================================================================
2026-01-17 23:04:05,857 - dq_comparison - INFO - 
1️⃣ FIRST: ROW COUNT CHECK
2026-01-17 23:04:05,858 - dq_comparison - WARNING - ❌ Row count mismatch: Source=15, Target=13, Difference=2
2026-01-17 23:04:05,858 - dq_comparison - WARNING -    Missing in target: 2 rows
2026-01-17 23:04:05,859 - dq_comparison - INFO - 
2️⃣ COLUMN STRUCTURE COMPARISON
2026-01-17 23:04:05,860 - dq_comparison - INFO - Comparing column structures...
2026-01-17 23:04:05,860 - dq_comparison - INFO - Column structure comparison complete. Match: True
2026-01-17 23:04:05,861 - dq_comparison - INFO - 
3️⃣ PRIMARY KEY VALIDATION
2026-01-17 23:04:05,864 - dq_comparison - INFO - Validating primary key/unique fields...
2026-01-17 23:04:05,867 - dq_comparison - INFO - Checking key fields: ['transaction_id', 'customer_id', 'reference_code']
2026-01-17 23:04:05,871 - dq_comparison - WARNING - Field 'customer_id' has duplicates in source: 15 rows
2026-01-17 23:04:05,872 - dq_comparison - WARNING - Field 'customer_id' has duplicates in target: 13 rows
2026-01-17 23:04:05,873 - dq_comparison - INFO - Primary key validation complete. Passed: False
2026-01-17 23:04:05,911 - dq_comparison - INFO -    Key fields found: ['transaction_id', 'customer_id', 'reference_code']
2026-01-17 23:04:05,911 - dq_comparison - INFO -    Unique in source: ❌
2026-01-17 23:04:05,913 - dq_comparison - INFO -    Unique in target: ❌
2026-01-17 23:04:05,916 - dq_comparison - INFO -    Validation passed: ❌
2026-01-17 23:04:05,916 - dq_comparison - WARNING -    Source duplicates in 'customer_id': 15 rows
2026-01-17 23:04:05,918 - dq_comparison - WARNING -      Sample values: ['CUST9001']
2026-01-17 23:04:05,918 - dq_comparison - WARNING -    Target duplicates in 'customer_id': 13 rows
2026-01-17 23:04:05,919 - dq_comparison - WARNING -      Sample values: ['CUST9001']
2026-01-17 23:04:05,920 - dq_comparison - INFO -    Column names match: ✅
2026-01-17 23:04:05,920 - dq_comparison - INFO -    Column order match: ✅
2026-01-17 23:04:05,921 - dq_comparison - INFO -    Data types match: ✅
2026-01-17 23:04:05,921 - dq_comparison - INFO - 
4️⃣ TABLE METADATA COMPARISON
2026-01-17 23:04:05,923 - dq_comparison - INFO - Comparing table-level metadata...
2026-01-17 23:04:05,944 - dq_comparison - INFO - Table metadata comparison complete. Match: False
2026-01-17 23:04:05,965 - dq_comparison - INFO -    Table metadata match: ❌
2026-01-17 23:04:05,965 - dq_comparison - INFO -    Source: 15 rows, 16 cols, 0.01 MB
2026-01-17 23:04:05,966 - dq_comparison - INFO -    Target: 13 rows, 16 cols, 0.0 MB
2026-01-17 23:04:05,966 - dq_comparison - WARNING -    Found 1 metadata differences:
2026-01-17 23:04:05,967 - dq_comparison - WARNING -      • Row Count: Source=15, Target=13
2026-01-17 23:04:05,968 - dq_comparison - INFO - 
5️⃣ HASH-BASED COMPARISON
2026-01-17 23:04:05,968 - dq_comparison - INFO - ℹ️  Note: All NULL values normalized to 'NULL'
2026-01-17 23:04:05,969 - dq_comparison - INFO - ℹ️  Note: Dates normalized to YYYY-MM-DD
2026-01-17 23:04:05,970 - dq_comparison - INFO - ℹ️  Note: Strings trimmed and case-normalized
2026-01-17 23:04:05,971 - dq_comparison - INFO - ℹ️  Note: Phone numbers stripped to digits only, leading zeros removed
2026-01-17 23:04:05,976 - dq_comparison - INFO - 🧠 SMART COMPARISON WITH AUTO-DETECTED STRATEGY
2026-01-17 23:04:05,981 - dq_comparison - INFO - Detected comparison strategy: key_based
2026-01-17 23:04:05,981 - dq_comparison - INFO - Strategy details: {'key_columns': ['transaction_id', 'reference_code']}
2026-01-17 23:04:05,988 - dq_comparison - INFO - Matched 13 row pairs
2026-01-17 23:04:05,989 - dq_comparison - INFO - Source-only rows: 2
2026-01-17 23:04:05,989 - dq_comparison - INFO - Target-only rows: 0
2026-01-17 23:04:06,001 - dq_comparison - INFO - 
🎯 SMART COMPARISON RESULTS (key_based):
2026-01-17 23:04:06,001 - dq_comparison - INFO -    Strategy: Match rows using key column(s): ['transaction_id', 'reference_code']
2026-01-17 23:04:06,005 - dq_comparison - INFO -    Total source rows: 15
2026-01-17 23:04:06,006 - dq_comparison - INFO -    Total target rows: 13
2026-01-17 23:04:06,009 - dq_comparison - INFO -    Matched row pairs: 13
2026-01-17 23:04:06,009 - dq_comparison - INFO -    Perfect matches: 11
2026-01-17 23:04:06,010 - dq_comparison - INFO -    Value mismatches: 2
2026-01-17 23:04:06,011 - dq_comparison - INFO -    Source-only rows: 2
2026-01-17 23:04:06,012 - dq_comparison - INFO -    Target-only rows: 0
2026-01-17 23:04:06,013 - dq_comparison - INFO -    Match percentage: 73.33%
2026-01-17 23:04:06,014 - dq_comparison - INFO -    Assessment: FAIR
2026-01-17 23:04:06,014 - dq_comparison - INFO - New structure: 2 detailed mismatches
2026-01-17 23:04:06,015 - dq_comparison - INFO - 
6️⃣ DATA QUALITY ANALYSIS
2026-01-17 23:04:06,015 - dq_comparison - INFO - Analyzing data quality metrics...
2026-01-17 23:04:06,033 - dq_comparison - INFO - Null values - Source: 0 (0.00%), Target: 0 (0.00%)
2026-01-17 23:04:06,040 - dq_comparison - INFO - Duplicate rows (normalized) - Source: 0, Target: 0
2026-01-17 23:04:06,058 - dq_error_log - INFO - Retrieved 3 error logs for session CMP_20260117_230405
2026-01-17 23:04:06,059 - dq_comparison - INFO - 
📊 SIMPLE SCORING CALCULATION:
2026-01-17 23:04:06,059 - dq_comparison - INFO -   Source rows: 15
2026-01-17 23:04:06,060 - dq_comparison - INFO -   Common rows (matched): 11
2026-01-17 23:04:06,061 - dq_comparison - INFO -   Calculation: (11 / 15) * 100 = 73.33%
2026-01-17 23:04:06,062 - dq_comparison - INFO -   Explanation: 11 matched rows out of 15 total source rows
2026-01-17 23:04:06,063 - dq_comparison - INFO - 
=== AUDIT LOGGING SECTION ===
2026-01-17 23:04:06,069 - dq_comparison - INFO - 🔍 Audit logging is ENABLED in APP_SETTINGS
2026-01-17 23:04:06,069 - dq_audit - INFO - Audit class initialized with database: dq_checks
2026-01-17 23:04:06,070 - dq_comparison - INFO - Attempting to log audit record for session: CMP_20260117_230405
2026-01-17 23:04:06,071 - dq_audit - INFO - Starting database insertion for comparison...
2026-01-17 23:04:06,103 - dq_audit - INFO - Inserted comparison record with ID: 774
2026-01-17 23:04:06,104 - dq_comparison - INFO - ✅ Audit record logged successfully (ID: 774)
2026-01-17 23:04:06,106 - dq_comparison - INFO - 
======================================================================
2026-01-17 23:04:06,106 - dq_comparison - INFO - 📊 COMPARISON RESULTS SUMMARY
2026-01-17 23:04:06,110 - dq_comparison - INFO - ======================================================================
2026-01-17 23:04:06,111 - dq_comparison - INFO - Session ID: CMP_20260117_230405
2026-01-17 23:04:06,113 - dq_comparison - INFO - Source: Database: mysql - dq_checks.comparison_small_source15 (15 rows)
2026-01-17 23:04:06,113 - dq_comparison - INFO - Target: Database: postgresql - dq_checks.comparison_small_target13 (13 rows)
2026-01-17 23:04:06,114 - dq_comparison - INFO - Selected columns: 16
2026-01-17 23:04:06,115 - dq_comparison - INFO - ----------------------------------------------------------------------
2026-01-17 23:04:06,116 - dq_comparison - INFO - 1️⃣ Row count match: ❌ No
2026-01-17 23:04:06,116 - dq_comparison - INFO -    Missing in target: 2 rows
2026-01-17 23:04:06,117 - dq_comparison - INFO -    Extra in target: 0 rows
2026-01-17 23:04:06,119 - dq_comparison - INFO - 2️⃣ Column structure match: ✅ Yes
2026-01-17 23:04:06,120 - dq_comparison - INFO - 3️ Primary key validation: ❌ Failed
2026-01-17 23:04:06,121 - dq_comparison - INFO -    Key fields: ['transaction_id', 'customer_id', 'reference_code']
2026-01-17 23:04:06,121 - dq_comparison - INFO - 4️ Table metadata: ❌ Mismatch
2026-01-17 23:04:06,125 - dq_comparison - INFO -    • Row Count: 15 vs 13
2026-01-17 23:04:06,128 - dq_comparison - INFO - 5️⃣ Common rows (both Mysql Database and Postgresql Database): 11 (73.33% of Mysql Database)
2026-01-17 23:04:06,132 - dq_comparison - INFO - 6️⃣ Mysql Database-only rows: 2 (present ONLY in Mysql Database, NOT in Postgresql Database)
2026-01-17 23:04:06,133 - dq_comparison - INFO - 7️⃣ Postgresql Database-only rows: 0 (present ONLY in Postgresql Database, NOT in Mysql Database)
2026-01-17 23:04:06,134 - dq_comparison - INFO - 8️⃣ Column value mismatches: 0
2026-01-17 23:04:06,135 - dq_comparison - INFO - 9️ Data quality match: ✅ Yes
2026-01-17 23:04:06,136 - dq_comparison - INFO - 📈 DQ Score: 73.33%
2026-01-17 23:04:06,136 - dq_comparison - INFO - 📊 Calculation: (11 / 15) * 100 = 73.33%
2026-01-17 23:04:06,137 - dq_comparison - INFO - ======================================================================
2026-01-17 23:04:06,138 - dq_comparison - INFO - 
⚠️  FAIR MATCH! Significant differences found.
2026-01-17 23:04:06,138 - dq_comparison - INFO - 
🔍 NORMALIZATION APPLIED:
2026-01-17 23:04:06,139 - dq_comparison - INFO -    • NULL values → 'NULL' (consistent representation)
2026-01-17 23:04:06,140 - dq_comparison - INFO -    • Dates → YYYY-MM-DD format
2026-01-17 23:04:06,140 - dq_comparison - INFO -    • Strings → trimmed + lowercase
2026-01-17 23:04:06,141 - dq_comparison - INFO -    • Numeric values → standardized format
2026-01-17 23:04:06,142 - dq_comparison - INFO -    • Phone numbers → digits only, ALL leading zeros removed
2026-01-17 23:04:06,142 - dq_comparison - INFO -    • Extra whitespace removed
2026-01-17 23:04:06,143 - dq_comparison - INFO - 
🔍 DETAILED ERROR ANALYSIS:
2026-01-17 23:04:06,146 - dq_comparison - INFO - --------------------------------------------------
2026-01-17 23:04:06,148 - dq_comparison - INFO - 📊 SOURCE-ONLY ROWS: 2 rows
2026-01-17 23:04:06,149 - dq_comparison - INFO -    Present only in Mysql Database, missing from Postgresql Database
2026-01-17 23:04:06,167 - dq_error_log - INFO - Retrieved 3 errors for session CMP_20260117_230405
2026-01-17 23:04:06,168 - dq_comparison - INFO - 
📋 SAMPLE ERRORS (3 found):
2026-01-17 23:04:06,169 - dq_comparison - INFO - 
1. Row 0 - Metadata Row Count
2026-01-17 23:04:06,172 - dq_comparison - INFO -    Column: 
2026-01-17 23:04:06,173 - dq_comparison - INFO -    Metadata mismatch: Row Count
2026-01-17 23:04:06,173 - dq_comparison - INFO - 
2. Row 0 - Duplicate Primary Key
2026-01-17 23:04:06,174 - dq_comparison - INFO -    Column: customer_id
2026-01-17 23:04:06,176 - dq_comparison - INFO -    Primary key field 'customer_id' has 15 duplicates in source
2026-01-17 23:04:06,179 - dq_comparison - INFO - 
3. Row 0 - Duplicate Primary Key
2026-01-17 23:04:06,180 - dq_comparison - INFO -    Column: customer_id
2026-01-17 23:04:06,180 - dq_comparison - INFO -    Primary key field 'customer_id' has 13 duplicates in target
2026-01-17 23:04:06,181 - dq_comparison - INFO - 
💡 For complete error details, run:
2026-01-17 23:04:06,182 - dq_comparison - INFO -    USE dq_checks;
2026-01-17 23:04:06,183 - dq_comparison - INFO -    SELECT excel_row, column_name, error_type, error_description,
2026-01-17 23:04:06,183 - dq_comparison - INFO -           actual_value, expected_value
2026-01-17 23:04:06,184 - dq_comparison - INFO -    FROM dq_error_logs
2026-01-17 23:04:06,185 - dq_comparison - INFO -    WHERE session_id = 'CMP_20260117_230405'
2026-01-17 23:04:06,186 - dq_comparison - INFO -    ORDER BY excel_row, column_name;
2026-01-17 23:04:06,207 - dq_comparison - INFO - 
✅ Comparison completed! Session ID: CMP_20260117_230405
2026-01-17 23:04:06,224 - dq_error_log - INFO - Retrieved 4 error logs for session CMP_20260117_230405
2026-01-17 23:04:06,241 - dq_error_log - INFO - Retrieved summary: 4 total errors for session CMP_20260117_230405
2026-01-17 23:04:06,242 - dq_audit - INFO - Audit class initialized with database: dq_checks
2026-01-17 23:04:06,269 - dq_audit - INFO - Retrieved 1 audit logs for session CMP_20260117_230405
2026-01-17 23:04:06,270 - dq_comparison - INFO - 
🔍 Final results verification:
2026-01-17 23:04:06,275 - dq_comparison - INFO -    Session ID: CMP_20260117_230405
2026-01-17 23:04:06,276 - dq_comparison - INFO -    DQ Score (Simple %): 73.33%
2026-01-17 23:04:06,277 - dq_comparison - INFO -    Source rows: 15
2026-01-17 23:04:06,278 - dq_comparison - INFO -    Matched rows: 11
2026-01-17 23:04:06,278 - dq_comparison - INFO -    Calculation: (11 / 15) * 100
2026-01-17 23:04:06,279 - __main__ - INFO - Source-Target Comparison completed successfully
2026-01-17 23:04:06,279 - __main__ - INFO - Displaying main menu options to user
2026-01-17 23:04:57,720 - __main__ - INFO - User selected option: 6
2026-01-17 23:04:57,722 - __main__ - INFO - User session ended. Duration: 0:01:38.837047
2026-01-17 23:04:57,722 - __main__ - INFO - 👋 Thank you for using Universal Data Quality Framework!
