2026-01-17 22:12:55,785 - root - INFO - CLI Mode Logging Initialized
2026-01-17 22:12:55,785 - root - INFO - CLI logs will be saved to: logs/dq_framework_20260117_221255.log
2026-01-17 22:12:55,786 - __main__ - INFO - 🚀 UNIVERSAL DATA QUALITY FRAMEWORK INITIALIZED
2026-01-17 22:12:55,787 - __main__ - INFO - Starting system resource check
2026-01-17 22:12:55,793 - __main__ - INFO - Total RAM: 15.7 GB
2026-01-17 22:12:55,794 - __main__ - INFO - Available RAM: 2.8 GB
2026-01-17 22:12:55,794 - __main__ - INFO - Memory used: 82.2%
2026-01-17 22:12:55,794 - __main__ - INFO - Memory status: OK
2026-01-17 22:12:55,795 - __main__ - INFO - Free disk space: 255.4 GB
2026-01-17 22:12:55,795 - __main__ - INFO - Disk used: 46.4%
2026-01-17 22:12:55,795 - __main__ - INFO - Disk space: OK
2026-01-17 22:12:56,296 - __main__ - INFO - CPU cores: 8
2026-01-17 22:12:56,296 - __main__ - INFO - CPU usage: 25.0%
2026-01-17 22:12:56,296 - __main__ - INFO - Python version: 3.12.4
2026-01-17 22:12:56,296 - __main__ - INFO - System platform: win32
2026-01-17 22:12:56,297 - __main__ - INFO - User session started at: 2026-01-17 22:12:56.297519
2026-01-17 22:12:56,297 - __main__ - INFO - Displaying main menu options to user
2026-01-17 22:12:57,582 - __main__ - INFO - User selected option: 2
2026-01-17 22:12:57,584 - __main__ - INFO - Starting Source-Target Comparison module
2026-01-17 22:12:57,592 - dq_comparison - INFO - STARTING UNIVERSAL SOURCE-TARGET COMPARISON TOOL
2026-01-17 22:12:57,594 - dq_comparison - INFO - LOADING SOURCE AND TARGET DATA
2026-01-17 22:12:57,596 - dq_comparison - INFO - 
==================================================
2026-01-17 22:12:57,597 - dq_comparison - INFO - 🔗 SOURCE DATA CONFIGURATION
2026-01-17 22:12:57,600 - dq_comparison - INFO - ==================================================
2026-01-17 22:12:58,725 - dq_comparison - INFO - 
🗄️ SOURCE DATABASE CONFIGURATION
2026-01-17 22:12:58,726 - dq_comparison - INFO - ----------------------------------------
2026-01-17 22:13:00,111 - dq_comparison - INFO - Selected database type code: mysql
2026-01-17 22:13:01,444 - dq_comparison - INFO - User selected Browse and Select mode for SOURCE
2026-01-17 22:13:01,450 - database_navigator - INFO - DatabaseNavigator initialized
2026-01-17 22:13:01,450 - database_navigator - INFO - Starting database navigation...
2026-01-17 22:13:01,450 - database_navigator - INFO - Database type: mysql
2026-01-17 22:13:01,451 - database_navigator - INFO - Getting database configuration...
2026-01-17 22:13:03,207 - database_navigator - INFO - Connecting to MYSQL...
2026-01-17 22:13:03,399 - database_navigator - INFO - Successfully connected to MYSQL!
2026-01-17 22:13:03,404 - database_navigator - INFO - get_databases() called. db_type: mysql, connection exists: True
2026-01-17 22:13:03,406 - database_navigator - INFO - Found 13 databases
2026-01-17 22:13:05,891 - database_navigator - INFO - Selected database: dq_checks
2026-01-17 22:13:05,895 - database_navigator - INFO - Found 1 schemas
2026-01-17 22:13:07,094 - database_navigator - INFO - Selected schema: dq_checks
2026-01-17 22:13:07,099 - database_navigator - INFO - Found 18 tables in schema 'dq_checks'
2026-01-17 22:13:10,049 - database_navigator - INFO - Selected table: comparison_small_source15
2026-01-17 22:13:10,055 - database_navigator - INFO - Selection complete: {'type': 'mysql', 'database': 'dq_checks', 'schema': 'dq_checks', 'table': 'comparison_small_source15', 'selection_mode': 'hierarchical', 'host': 'localhost', 'port': '3306', 'user': 'root', 'password': 'root'}
2026-01-17 22:13:10,057 - dq_comparison - INFO - Selected via navigation for SOURCE: dq_checks.dq_checks.comparison_small_source15
2026-01-17 22:13:10,058 - dq_unified - INFO - Loading data from DATABASE
2026-01-17 22:13:10,058 - dq_unified - INFO - Loading large database table: comparison_small_source15
2026-01-17 22:13:10,058 - dq_unified - INFO - Normalized DB config with schema: dq_checks
2026-01-17 22:13:10,069 - dq_unified - INFO - MySQL table comparison_small_source15 has 15 rows
2026-01-17 22:13:10,070 - dq_unified - INFO - Loading 15 rows from MySQL...
2026-01-17 22:13:10,533 - dq_unified - INFO - Loaded 15 rows from MySQL
2026-01-17 22:13:10,544 - dq_unified - INFO - Memory optimization: 0.0MB -> 0.0MB (Saved: 0.0MB)
2026-01-17 22:13:10,545 - dq_unified - INFO - Loaded 15 rows, 16 columns. Memory: 111.7MB total, 0.0MB for dataframe
2026-01-17 22:13:10,546 - dq_comparison - INFO - SOURCE database loaded: 15 rows, 16 columns
2026-01-17 22:13:10,546 - dq_comparison - INFO - 
==================================================
2026-01-17 22:13:10,547 - dq_comparison - INFO - 🔗 TARGET DATA CONFIGURATION
2026-01-17 22:13:10,547 - dq_comparison - INFO - ==================================================
2026-01-17 22:13:12,085 - dq_comparison - INFO - 
🗄️ TARGET DATABASE CONFIGURATION
2026-01-17 22:13:12,086 - dq_comparison - INFO - ----------------------------------------
2026-01-17 22:13:25,236 - dq_comparison - INFO - Selected database type code: postgresql
2026-01-17 22:13:26,539 - dq_comparison - INFO - User selected Browse and Select mode for TARGET
2026-01-17 22:13:26,546 - dq_comparison - INFO - Converted 'postgresql' to 'postgres' for database_navigator compatibility
2026-01-17 22:13:26,546 - database_navigator - INFO - DatabaseNavigator initialized
2026-01-17 22:13:26,546 - database_navigator - INFO - Starting database navigation...
2026-01-17 22:13:26,546 - database_navigator - INFO - Database type: postgres
2026-01-17 22:13:26,547 - database_navigator - INFO - Getting database configuration...
2026-01-17 22:13:28,765 - database_navigator - INFO - Connecting to POSTGRES...
2026-01-17 22:13:28,767 - database_navigator - INFO - Connecting to PostgreSQL...
2026-01-17 22:13:28,769 - database_navigator - INFO - Connecting to PostgreSQL: host=localhost, port=5432, database=postgres, user=postgres
2026-01-17 22:13:28,896 - database_navigator - INFO - Connection object created: <connection object at 0x0000012B38776BD0; dsn: 'user=postgres password=xxx dbname=postgres host=localhost port=5432', closed: 0>
2026-01-17 22:13:28,896 - database_navigator - INFO - ✅ PostgreSQL connection successful to database: postgres
2026-01-17 22:13:28,900 - database_navigator - INFO - get_databases() called. db_type: postgres, connection exists: True
2026-01-17 22:13:28,906 - database_navigator - INFO - Raw rows: [('dq_checks',), ('finewise-testdb',), ('postgres',)]
2026-01-17 22:13:28,906 - database_navigator - INFO - Found 3 databases
2026-01-17 22:13:30,439 - database_navigator - INFO - Selected database: dq_checks
2026-01-17 22:13:30,441 - database_navigator - INFO - Reconnecting to PostgreSQL database: dq_checks
2026-01-17 22:13:30,441 - database_navigator - INFO - Connecting to POSTGRES...
2026-01-17 22:13:30,443 - database_navigator - INFO - Connecting to PostgreSQL...
2026-01-17 22:13:30,443 - database_navigator - INFO - Connecting to PostgreSQL: host=localhost, port=5432, database=dq_checks, user=postgres
2026-01-17 22:13:30,551 - database_navigator - INFO - Connection object created: <connection object at 0x0000012B389E0040; dsn: 'user=postgres password=xxx dbname=dq_checks host=localhost port=5432', closed: 0>
2026-01-17 22:13:30,552 - database_navigator - INFO - ✅ PostgreSQL connection successful to database: dq_checks
2026-01-17 22:13:30,569 - database_navigator - INFO - Found 4 schemas
2026-01-17 22:13:31,962 - database_navigator - INFO - Selected schema: public
2026-01-17 22:13:31,963 - database_navigator - INFO - Ensuring connection to database: dq_checks for table list
2026-01-17 22:13:31,965 - database_navigator - INFO - Reconnecting to PostgreSQL database: dq_checks
2026-01-17 22:13:31,966 - database_navigator - INFO - Connecting to POSTGRES...
2026-01-17 22:13:31,966 - database_navigator - INFO - Connecting to PostgreSQL...
2026-01-17 22:13:31,966 - database_navigator - INFO - Connecting to PostgreSQL: host=localhost, port=5432, database=dq_checks, user=postgres
2026-01-17 22:13:32,075 - database_navigator - INFO - Connection object created: <connection object at 0x0000012B389E0150; dsn: 'user=postgres password=xxx dbname=dq_checks host=localhost port=5432', closed: 0>
2026-01-17 22:13:32,077 - database_navigator - INFO - ✅ PostgreSQL connection successful to database: dq_checks
2026-01-17 22:13:32,077 - database_navigator - INFO - Connected to database: dq_checks, schema: public
2026-01-17 22:13:32,106 - database_navigator - INFO - Found 5 tables in dq_checks.public: ['comparison_small_target13', 'customers', 'customers_bkp', 'employee', 'stg_transactions']
2026-01-17 22:13:32,106 - database_navigator - INFO - Found 5 tables in schema 'public'
2026-01-17 22:13:33,843 - database_navigator - INFO - Selected table: comparison_small_target13
2026-01-17 22:13:33,849 - database_navigator - INFO - Selection complete: {'type': 'postgresql', 'database': 'dq_checks', 'schema': 'public', 'table': 'comparison_small_target13', 'selection_mode': 'hierarchical', 'host': 'localhost', 'port': '5432', 'user': 'postgres', 'password': 'postgres'}
2026-01-17 22:13:33,850 - dq_comparison - INFO - Selected via navigation for TARGET: dq_checks.public.comparison_small_target13
2026-01-17 22:13:33,850 - dq_unified - INFO - Loading data from DATABASE
2026-01-17 22:13:33,850 - dq_unified - INFO - Loading large database table: comparison_small_target13
2026-01-17 22:13:33,851 - dq_unified - INFO - Normalized DB config with schema: public
2026-01-17 22:13:33,984 - dq_unified - INFO - PostgreSQL table public.comparison_small_target13 has 13 rows
2026-01-17 22:13:33,985 - dq_unified - INFO - Loading 13 rows from PostgreSQL...
2026-01-17 22:13:33,989 - dq_unified - INFO - Loaded 13 rows from PostgreSQL
2026-01-17 22:13:33,997 - dq_unified - INFO - Memory optimization: 0.0MB -> 0.0MB (Saved: 0.0MB)
2026-01-17 22:13:33,997 - dq_unified - INFO - Loaded 13 rows, 16 columns. Memory: 112.3MB total, 0.0MB for dataframe
2026-01-17 22:13:33,998 - dq_comparison - INFO - TARGET database loaded: 13 rows, 16 columns
2026-01-17 22:13:33,998 - dq_comparison - INFO - SELECTING COLUMNS FOR COMPARISON
2026-01-17 22:13:33,998 - dq_comparison - INFO - Source columns (original): ['transaction_id', 'account_id', 'customer_id', 'transaction_date', 'posting_date', 'transaction_type', 'currency', 'amount', 'balance_after', 'status', 'merchant_name', 'merchant_category', 'country', 'reference_code', 'created_at', 'updated_at']
2026-01-17 22:13:33,999 - dq_comparison - INFO - Target columns (original): ['transaction_id', 'account_id', 'customer_id', 'transaction_date', 'posting_date', 'transaction_type', 'currency', 'amount', 'balance_after', 'status', 'merchant_name', 'merchant_category', 'country', 'reference_code', 'created_at', 'updated_at']
2026-01-17 22:13:33,999 - dq_comparison - INFO - Common columns lowercased: ['transaction_id', 'account_id', 'customer_id', 'transaction_date', 'posting_date', 'transaction_type', 'currency', 'amount', 'balance_after', 'status', 'merchant_name', 'merchant_category', 'country', 'reference_code', 'created_at', 'updated_at']
2026-01-17 22:13:34,000 - dq_comparison - INFO - Found 16 common columns between source and target (case-insensitive)
2026-01-17 22:13:34,000 - dq_comparison - INFO - 
📋 Common columns available for comparison:
2026-01-17 22:13:34,000 - dq_comparison - INFO -   1. transaction_id (Source) ↔ transaction_id (Target)
2026-01-17 22:13:34,000 - dq_comparison - INFO -   2. account_id (Source) ↔ account_id (Target)
2026-01-17 22:13:34,002 - dq_comparison - INFO -   3. customer_id (Source) ↔ customer_id (Target)
2026-01-17 22:13:34,002 - dq_comparison - INFO -   4. transaction_date (Source) ↔ transaction_date (Target)
2026-01-17 22:13:34,002 - dq_comparison - INFO -   5. posting_date (Source) ↔ posting_date (Target)
2026-01-17 22:13:34,003 - dq_comparison - INFO -   6. transaction_type (Source) ↔ transaction_type (Target)
2026-01-17 22:13:34,003 - dq_comparison - INFO -   7. currency (Source) ↔ currency (Target)
2026-01-17 22:13:34,003 - dq_comparison - INFO -   8. amount (Source) ↔ amount (Target)
2026-01-17 22:13:34,004 - dq_comparison - INFO -   9. balance_after (Source) ↔ balance_after (Target)
2026-01-17 22:13:34,004 - dq_comparison - INFO -   10. status (Source) ↔ status (Target)
2026-01-17 22:13:34,004 - dq_comparison - INFO -   11. merchant_name (Source) ↔ merchant_name (Target)
2026-01-17 22:13:34,004 - dq_comparison - INFO -   12. merchant_category (Source) ↔ merchant_category (Target)
2026-01-17 22:13:34,005 - dq_comparison - INFO -   13. country (Source) ↔ country (Target)
2026-01-17 22:13:34,005 - dq_comparison - INFO -   14. reference_code (Source) ↔ reference_code (Target)
2026-01-17 22:13:34,005 - dq_comparison - INFO -   15. created_at (Source) ↔ created_at (Target)
2026-01-17 22:13:34,005 - dq_comparison - INFO -   16. updated_at (Source) ↔ updated_at (Target)
2026-01-17 22:13:35,793 - dq_comparison - INFO - User column selection input: all
2026-01-17 22:13:35,794 - dq_comparison - INFO - User selected ALL common columns for comparison
2026-01-17 22:13:35,794 - dq_comparison - INFO - GENERATING COMPREHENSIVE COMPARISON REPORT
2026-01-17 22:13:35,796 - dq_comparison - INFO - Report details - Source: Database: mysql - dq_checks.comparison_small_source15, Target: Database: postgresql - dq_checks.comparison_small_target13, Selected columns: 16
2026-01-17 22:13:35,796 - dq_comparison - INFO - Initializing Error Logger...
2026-01-17 22:13:35,797 - dq_error_log - INFO - ErrorLogger initialized with database: dq_checks
2026-01-17 22:13:35,810 - dq_error_log - INFO - Database connection successful
2026-01-17 22:13:35,811 - dq_comparison - INFO - Session ID: CMP_20260117_221335
2026-01-17 22:13:35,811 - dq_comparison - INFO - 
======================================================================
2026-01-17 22:13:35,811 - dq_comparison - INFO - 🔄 RUNNING SOURCE-TARGET COMPARISON WITH PERFECT NORMALIZATION
2026-01-17 22:13:35,811 - dq_comparison - INFO - ======================================================================
2026-01-17 22:13:35,812 - dq_comparison - INFO - Session ID: CMP_20260117_221335
2026-01-17 22:13:35,812 - dq_comparison - INFO - Source: Database: mysql - dq_checks.comparison_small_source15
2026-01-17 22:13:35,812 - dq_comparison - INFO - Target: Database: postgresql - dq_checks.comparison_small_target13
2026-01-17 22:13:35,813 - dq_comparison - INFO - Selected columns: 16
2026-01-17 22:13:35,813 - dq_comparison - INFO - ======================================================================
2026-01-17 22:13:35,813 - dq_comparison - INFO - 
1️⃣ FIRST: ROW COUNT CHECK
2026-01-17 22:13:35,814 - dq_comparison - WARNING - ❌ Row count mismatch: Source=15, Target=13, Difference=2
2026-01-17 22:13:35,814 - dq_comparison - WARNING -    Missing in target: 2 rows
2026-01-17 22:13:35,814 - dq_comparison - INFO - 
2️⃣ COLUMN STRUCTURE COMPARISON
2026-01-17 22:13:35,815 - dq_comparison - INFO - Comparing column structures...
2026-01-17 22:13:35,815 - dq_comparison - INFO - Column structure comparison complete. Match: True
2026-01-17 22:13:35,815 - dq_comparison - INFO - 
3️⃣ PRIMARY KEY VALIDATION
2026-01-17 22:13:35,815 - dq_comparison - INFO - Validating primary key/unique fields...
2026-01-17 22:13:35,816 - dq_comparison - INFO - Checking key fields: ['transaction_id', 'customer_id', 'reference_code']
2026-01-17 22:13:35,818 - dq_comparison - WARNING - Field 'customer_id' has duplicates in source: 15 rows
2026-01-17 22:13:35,818 - dq_comparison - WARNING - Field 'customer_id' has duplicates in target: 13 rows
2026-01-17 22:13:35,819 - dq_comparison - INFO - Primary key validation complete. Passed: False
2026-01-17 22:13:35,843 - dq_comparison - INFO -    Key fields found: ['transaction_id', 'customer_id', 'reference_code']
2026-01-17 22:13:35,843 - dq_comparison - INFO -    Unique in source: ❌
2026-01-17 22:13:35,843 - dq_comparison - INFO -    Unique in target: ❌
2026-01-17 22:13:35,844 - dq_comparison - INFO -    Validation passed: ❌
2026-01-17 22:13:35,844 - dq_comparison - WARNING -    Source duplicates in 'customer_id': 15 rows
2026-01-17 22:13:35,844 - dq_comparison - WARNING -      Sample values: ['CUST9001']
2026-01-17 22:13:35,844 - dq_comparison - WARNING -    Target duplicates in 'customer_id': 13 rows
2026-01-17 22:13:35,845 - dq_comparison - WARNING -      Sample values: ['CUST9001']
2026-01-17 22:13:35,845 - dq_comparison - INFO -    Column names match: ✅
2026-01-17 22:13:35,845 - dq_comparison - INFO -    Column order match: ✅
2026-01-17 22:13:35,845 - dq_comparison - INFO -    Data types match: ✅
2026-01-17 22:13:35,846 - dq_comparison - INFO - 
4️⃣ TABLE METADATA COMPARISON
2026-01-17 22:13:35,846 - dq_comparison - INFO - Comparing table-level metadata...
2026-01-17 22:13:35,858 - dq_comparison - INFO - Table metadata comparison complete. Match: False
2026-01-17 22:13:35,872 - dq_comparison - INFO -    Table metadata match: ❌
2026-01-17 22:13:35,873 - dq_comparison - INFO -    Source: 15 rows, 16 cols, 0.01 MB
2026-01-17 22:13:35,873 - dq_comparison - INFO -    Target: 13 rows, 16 cols, 0.0 MB
2026-01-17 22:13:35,875 - dq_comparison - WARNING -    Found 1 metadata differences:
2026-01-17 22:13:35,875 - dq_comparison - WARNING -      • Row Count: Source=15, Target=13
2026-01-17 22:13:35,876 - dq_comparison - INFO - 
5️⃣ HASH-BASED COMPARISON
2026-01-17 22:13:35,876 - dq_comparison - INFO - ℹ️  Note: All NULL values normalized to 'NULL'
2026-01-17 22:13:35,876 - dq_comparison - INFO - ℹ️  Note: Dates normalized to YYYY-MM-DD
2026-01-17 22:13:35,877 - dq_comparison - INFO - ℹ️  Note: Strings trimmed and case-normalized
2026-01-17 22:13:35,877 - dq_comparison - INFO - ℹ️  Note: Phone numbers stripped to digits only, leading zeros removed
2026-01-17 22:13:35,877 - dq_comparison - INFO - 🧠 SMART COMPARISON WITH AUTO-DETECTED STRATEGY
2026-01-17 22:13:35,881 - dq_comparison - INFO - Detected comparison strategy: key_based
2026-01-17 22:13:35,881 - dq_comparison - INFO - Strategy details: {'key_columns': ['transaction_id', 'reference_code']}
2026-01-17 22:13:35,886 - dq_comparison - INFO - Matched 13 row pairs
2026-01-17 22:13:35,886 - dq_comparison - INFO - Source-only rows: 2
2026-01-17 22:13:35,886 - dq_comparison - INFO - Target-only rows: 0
2026-01-17 22:13:35,894 - dq_comparison - INFO - 
🎯 SMART COMPARISON RESULTS (key_based):
2026-01-17 22:13:35,895 - dq_comparison - INFO -    Strategy: Match rows using key column(s): ['transaction_id', 'reference_code']
2026-01-17 22:13:35,895 - dq_comparison - INFO -    Total source rows: 15
2026-01-17 22:13:35,895 - dq_comparison - INFO -    Total target rows: 13
2026-01-17 22:13:35,896 - dq_comparison - INFO -    Matched row pairs: 13
2026-01-17 22:13:35,899 - dq_comparison - INFO -    Perfect matches: 11
2026-01-17 22:13:35,899 - dq_comparison - INFO -    Value mismatches: 2
2026-01-17 22:13:35,899 - dq_comparison - INFO -    Source-only rows: 2
2026-01-17 22:13:35,899 - dq_comparison - INFO -    Target-only rows: 0
2026-01-17 22:13:35,899 - dq_comparison - INFO -    Match percentage: 73.33%
2026-01-17 22:13:35,899 - dq_comparison - INFO -    Assessment: FAIR
2026-01-17 22:13:35,900 - dq_comparison - INFO - New structure: 2 detailed mismatches
2026-01-17 22:13:35,900 - dq_comparison - INFO - 
6️⃣ DATA QUALITY ANALYSIS
2026-01-17 22:13:35,900 - dq_comparison - INFO - Analyzing data quality metrics...
2026-01-17 22:13:35,915 - dq_comparison - INFO - Null values - Source: 0 (0.00%), Target: 0 (0.00%)
2026-01-17 22:13:35,918 - dq_comparison - INFO - Duplicate rows (normalized) - Source: 0, Target: 0
2026-01-17 22:13:35,929 - dq_error_log - INFO - Retrieved 3 error logs for session CMP_20260117_221335
2026-01-17 22:13:35,930 - dq_comparison - INFO - 
📊 SIMPLE SCORING CALCULATION:
2026-01-17 22:13:35,930 - dq_comparison - INFO -   Source rows: 15
2026-01-17 22:13:35,931 - dq_comparison - INFO -   Common rows (matched): 11
2026-01-17 22:13:35,932 - dq_comparison - INFO -   Calculation: (11 / 15) * 100 = 73.33%
2026-01-17 22:13:35,932 - dq_comparison - INFO -   Explanation: 11 matched rows out of 15 total source rows
2026-01-17 22:13:35,933 - dq_comparison - INFO - 
=== AUDIT LOGGING SECTION ===
2026-01-17 22:13:35,936 - dq_comparison - INFO - 🔍 Audit logging is ENABLED in APP_SETTINGS
2026-01-17 22:13:35,937 - dq_audit - INFO - Audit class initialized with database: dq_checks
2026-01-17 22:13:35,937 - dq_comparison - INFO - Attempting to log audit record for session: CMP_20260117_221335
2026-01-17 22:13:35,938 - dq_audit - INFO - Starting database insertion for comparison...
2026-01-17 22:13:35,953 - dq_audit - INFO - Inserted comparison record with ID: 769
2026-01-17 22:13:35,953 - dq_comparison - INFO - ✅ Audit record logged successfully (ID: 769)
2026-01-17 22:13:35,954 - dq_comparison - INFO - 
======================================================================
2026-01-17 22:13:35,954 - dq_comparison - INFO - 📊 COMPARISON RESULTS SUMMARY
2026-01-17 22:13:35,954 - dq_comparison - INFO - ======================================================================
2026-01-17 22:13:35,955 - dq_comparison - INFO - Session ID: CMP_20260117_221335
2026-01-17 22:13:35,955 - dq_comparison - INFO - Source: Database: mysql - dq_checks.comparison_small_source15 (15 rows)
2026-01-17 22:13:35,955 - dq_comparison - INFO - Target: Database: postgresql - dq_checks.comparison_small_target13 (13 rows)
2026-01-17 22:13:35,955 - dq_comparison - INFO - Selected columns: 16
2026-01-17 22:13:35,956 - dq_comparison - INFO - ----------------------------------------------------------------------
2026-01-17 22:13:35,956 - dq_comparison - INFO - 1️⃣ Row count match: ❌ No
2026-01-17 22:13:35,956 - dq_comparison - INFO -    Missing in target: 2 rows
2026-01-17 22:13:35,956 - dq_comparison - INFO -    Extra in target: 0 rows
2026-01-17 22:13:35,957 - dq_comparison - INFO - 2️⃣ Column structure match: ✅ Yes
2026-01-17 22:13:35,957 - dq_comparison - INFO - 3️ Primary key validation: ❌ Failed
2026-01-17 22:13:35,957 - dq_comparison - INFO -    Key fields: ['transaction_id', 'customer_id', 'reference_code']
2026-01-17 22:13:35,957 - dq_comparison - INFO - 4️ Table metadata: ❌ Mismatch
2026-01-17 22:13:35,957 - dq_comparison - INFO -    • Row Count: 15 vs 13
2026-01-17 22:13:35,958 - dq_comparison - INFO - 5️⃣ Common rows (both Mysql Database and Postgresql Database): 11 (73.33% of Mysql Database)
2026-01-17 22:13:35,958 - dq_comparison - INFO - 6️⃣ Mysql Database-only rows: 2 (present ONLY in Mysql Database, NOT in Postgresql Database)
2026-01-17 22:13:35,960 - dq_comparison - INFO - 7️⃣ Postgresql Database-only rows: 0 (present ONLY in Postgresql Database, NOT in Mysql Database)
2026-01-17 22:13:35,962 - dq_comparison - INFO - 8️⃣ Column value mismatches: 0
2026-01-17 22:13:35,962 - dq_comparison - INFO - 9️ Data quality match: ✅ Yes
2026-01-17 22:13:35,962 - dq_comparison - INFO - 📈 DQ Score: 73.33%
2026-01-17 22:13:35,962 - dq_comparison - INFO - 📊 Calculation: (11 / 15) * 100 = 73.33%
2026-01-17 22:13:35,962 - dq_comparison - INFO - ======================================================================
2026-01-17 22:13:35,963 - dq_comparison - INFO - 
⚠️  FAIR MATCH! Significant differences found.
2026-01-17 22:13:35,963 - dq_comparison - INFO - 
🔍 NORMALIZATION APPLIED:
2026-01-17 22:13:35,963 - dq_comparison - INFO -    • NULL values → 'NULL' (consistent representation)
2026-01-17 22:13:35,963 - dq_comparison - INFO -    • Dates → YYYY-MM-DD format
2026-01-17 22:13:35,964 - dq_comparison - INFO -    • Strings → trimmed + lowercase
2026-01-17 22:13:35,964 - dq_comparison - INFO -    • Numeric values → standardized format
2026-01-17 22:13:35,964 - dq_comparison - INFO -    • Phone numbers → digits only, ALL leading zeros removed
2026-01-17 22:13:35,964 - dq_comparison - INFO -    • Extra whitespace removed
2026-01-17 22:13:35,964 - dq_comparison - INFO - 
🔍 DETAILED ERROR ANALYSIS:
2026-01-17 22:13:35,965 - dq_comparison - INFO - --------------------------------------------------
2026-01-17 22:13:35,965 - dq_comparison - INFO - 📊 SOURCE-ONLY ROWS: 2 rows
2026-01-17 22:13:35,965 - dq_comparison - INFO -    Present only in Mysql Database, missing from Postgresql Database
2026-01-17 22:13:35,974 - dq_error_log - INFO - Retrieved 3 errors for session CMP_20260117_221335
2026-01-17 22:13:35,978 - dq_comparison - INFO - 
📋 SAMPLE ERRORS (3 found):
2026-01-17 22:13:35,978 - dq_comparison - INFO - 
1. Row 0 - Metadata Row Count
2026-01-17 22:13:35,978 - dq_comparison - INFO -    Column: 
2026-01-17 22:13:35,978 - dq_comparison - INFO -    Metadata mismatch: Row Count
2026-01-17 22:13:35,979 - dq_comparison - INFO - 
2. Row 0 - Duplicate Primary Key
2026-01-17 22:13:35,979 - dq_comparison - INFO -    Column: customer_id
2026-01-17 22:13:35,979 - dq_comparison - INFO -    Primary key field 'customer_id' has 15 duplicates in source
2026-01-17 22:13:35,980 - dq_comparison - INFO - 
3. Row 0 - Duplicate Primary Key
2026-01-17 22:13:35,980 - dq_comparison - INFO -    Column: customer_id
2026-01-17 22:13:35,980 - dq_comparison - INFO -    Primary key field 'customer_id' has 13 duplicates in target
2026-01-17 22:13:35,980 - dq_comparison - INFO - 
💡 For complete error details, run:
2026-01-17 22:13:35,980 - dq_comparison - INFO -    USE dq_checks;
2026-01-17 22:13:35,981 - dq_comparison - INFO -    SELECT excel_row, column_name, error_type, error_description,
2026-01-17 22:13:35,981 - dq_comparison - INFO -           actual_value, expected_value
2026-01-17 22:13:35,981 - dq_comparison - INFO -    FROM dq_error_logs
2026-01-17 22:13:35,981 - dq_comparison - INFO -    WHERE session_id = 'CMP_20260117_221335'
2026-01-17 22:13:35,981 - dq_comparison - INFO -    ORDER BY excel_row, column_name;
2026-01-17 22:13:35,993 - dq_comparison - INFO - 
✅ Comparison completed! Session ID: CMP_20260117_221335
2026-01-17 22:13:36,003 - dq_error_log - INFO - Retrieved 4 error logs for session CMP_20260117_221335
2026-01-17 22:13:36,016 - dq_error_log - INFO - Retrieved summary: 4 total errors for session CMP_20260117_221335
2026-01-17 22:13:36,017 - dq_audit - INFO - Audit class initialized with database: dq_checks
2026-01-17 22:13:36,032 - dq_audit - INFO - Retrieved 1 audit logs for session CMP_20260117_221335
2026-01-17 22:13:36,033 - dq_comparison - INFO - 
🔍 Final results verification:
2026-01-17 22:13:36,033 - dq_comparison - INFO -    Session ID: CMP_20260117_221335
2026-01-17 22:13:36,034 - dq_comparison - INFO -    DQ Score (Simple %): 73.33%
2026-01-17 22:13:36,034 - dq_comparison - INFO -    Source rows: 15
2026-01-17 22:13:36,034 - dq_comparison - INFO -    Matched rows: 11
2026-01-17 22:13:36,035 - dq_comparison - INFO -    Calculation: (11 / 15) * 100
2026-01-17 22:13:36,035 - __main__ - INFO - Source-Target Comparison completed successfully
2026-01-17 22:13:36,035 - __main__ - INFO - Displaying main menu options to user
2026-01-17 22:13:49,138 - __main__ - INFO - User selected option: 6
2026-01-17 22:13:49,139 - __main__ - INFO - User session ended. Duration: 0:00:52.841868
2026-01-17 22:13:49,139 - __main__ - INFO - 👋 Thank you for using Universal Data Quality Framework!
