2026-01-17 20:26:42,810 - root - INFO - CLI Mode Logging Initialized
2026-01-17 20:26:42,810 - root - INFO - CLI logs will be saved to: logs/dq_framework_20260117_202642.log
2026-01-17 20:26:42,810 - __main__ - INFO - 🚀 UNIVERSAL DATA QUALITY FRAMEWORK INITIALIZED
2026-01-17 20:26:42,811 - __main__ - INFO - Starting system resource check
2026-01-17 20:26:42,818 - __main__ - INFO - Total RAM: 15.7 GB
2026-01-17 20:26:42,819 - __main__ - INFO - Available RAM: 2.9 GB
2026-01-17 20:26:42,819 - __main__ - INFO - Memory used: 81.4%
2026-01-17 20:26:42,819 - __main__ - INFO - Memory status: OK
2026-01-17 20:26:42,821 - __main__ - INFO - Free disk space: 256.7 GB
2026-01-17 20:26:42,821 - __main__ - INFO - Disk used: 46.1%
2026-01-17 20:26:42,821 - __main__ - INFO - Disk space: OK
2026-01-17 20:26:43,322 - __main__ - INFO - CPU cores: 8
2026-01-17 20:26:43,322 - __main__ - INFO - CPU usage: 22.6%
2026-01-17 20:26:43,323 - __main__ - INFO - Python version: 3.12.4
2026-01-17 20:26:43,323 - __main__ - INFO - System platform: win32
2026-01-17 20:26:43,324 - __main__ - INFO - User session started at: 2026-01-17 20:26:43.324662
2026-01-17 20:26:43,324 - __main__ - INFO - Displaying main menu options to user
2026-01-17 20:26:44,388 - __main__ - INFO - User selected option: 2
2026-01-17 20:26:44,389 - __main__ - INFO - Starting Source-Target Comparison module
2026-01-17 20:26:44,393 - dq_comparison - INFO - STARTING UNIVERSAL SOURCE-TARGET COMPARISON TOOL
2026-01-17 20:26:44,393 - dq_comparison - INFO - LOADING SOURCE AND TARGET DATA
2026-01-17 20:26:44,393 - dq_comparison - INFO - 
==================================================
2026-01-17 20:26:44,394 - dq_comparison - INFO - 🔗 SOURCE DATA CONFIGURATION
2026-01-17 20:26:44,394 - dq_comparison - INFO - ==================================================
2026-01-17 20:26:45,501 - dq_comparison - INFO - 
🗄️ SOURCE DATABASE CONFIGURATION
2026-01-17 20:26:45,502 - dq_comparison - INFO - ----------------------------------------
2026-01-17 20:26:47,984 - dq_comparison - INFO - Selected database type code: mysql
2026-01-17 20:26:49,186 - dq_comparison - INFO - User selected Browse and Select mode for SOURCE
2026-01-17 20:26:49,191 - database_navigator - INFO - DatabaseNavigator initialized
2026-01-17 20:26:49,191 - database_navigator - INFO - Starting database navigation...
2026-01-17 20:26:49,191 - database_navigator - INFO - Database type: mysql
2026-01-17 20:26:49,192 - database_navigator - INFO - Getting database configuration...
2026-01-17 20:26:50,782 - database_navigator - INFO - Connecting to MYSQL...
2026-01-17 20:26:50,892 - database_navigator - INFO - Successfully connected to MYSQL!
2026-01-17 20:26:50,896 - database_navigator - INFO - get_databases() called. db_type: mysql, connection exists: True
2026-01-17 20:26:50,899 - database_navigator - INFO - Found 13 databases
2026-01-17 20:26:53,710 - database_navigator - INFO - Selected database: dq_checks
2026-01-17 20:26:53,712 - database_navigator - INFO - Found 1 schemas
2026-01-17 20:26:56,535 - database_navigator - INFO - Selected schema: dq_checks
2026-01-17 20:26:56,542 - database_navigator - INFO - Found 18 tables in schema 'dq_checks'
2026-01-17 20:27:00,052 - database_navigator - INFO - Selected table: comparison_small_source15
2026-01-17 20:27:00,057 - database_navigator - INFO - Selection complete: {'type': 'mysql', 'database': 'dq_checks', 'schema': 'dq_checks', 'table': 'comparison_small_source15', 'selection_mode': 'hierarchical', 'host': 'localhost', 'port': '3306', 'user': 'root', 'password': 'root'}
2026-01-17 20:27:00,058 - dq_comparison - INFO - Selected via navigation for SOURCE: dq_checks.dq_checks.comparison_small_source15
2026-01-17 20:27:00,058 - dq_unified - INFO - Loading data from DATABASE
2026-01-17 20:27:00,058 - dq_unified - INFO - Loading large database table: comparison_small_source15
2026-01-17 20:27:00,059 - dq_unified - INFO - Normalized DB config with schema: dq_checks
2026-01-17 20:27:00,069 - dq_unified - INFO - MySQL table comparison_small_source15 has 15 rows
2026-01-17 20:27:00,069 - dq_unified - INFO - Loading 15 rows from MySQL...
2026-01-17 20:27:00,473 - dq_unified - INFO - Loaded 15 rows from MySQL
2026-01-17 20:27:00,484 - dq_unified - INFO - Memory optimization: 0.0MB -> 0.0MB (Saved: 0.0MB)
2026-01-17 20:27:00,485 - dq_unified - INFO - Loaded 15 rows, 16 columns. Memory: 111.6MB total, 0.0MB for dataframe
2026-01-17 20:27:00,485 - dq_comparison - INFO - SOURCE database loaded: 15 rows, 16 columns
2026-01-17 20:27:00,485 - dq_comparison - INFO - 
==================================================
2026-01-17 20:27:00,486 - dq_comparison - INFO - 🔗 TARGET DATA CONFIGURATION
2026-01-17 20:27:00,486 - dq_comparison - INFO - ==================================================
2026-01-17 20:27:01,714 - dq_comparison - INFO - 
🗄️ TARGET DATABASE CONFIGURATION
2026-01-17 20:27:01,715 - dq_comparison - INFO - ----------------------------------------
2026-01-17 20:27:02,504 - dq_comparison - INFO - Selected database type code: postgresql
2026-01-17 20:27:03,602 - dq_comparison - INFO - User selected Browse and Select mode for TARGET
2026-01-17 20:27:03,608 - dq_comparison - INFO - Converted 'postgresql' to 'postgres' for database_navigator compatibility
2026-01-17 20:27:03,608 - database_navigator - INFO - DatabaseNavigator initialized
2026-01-17 20:27:03,609 - database_navigator - INFO - Starting database navigation...
2026-01-17 20:27:03,609 - database_navigator - INFO - Database type: postgres
2026-01-17 20:27:03,609 - database_navigator - INFO - Getting database configuration...
2026-01-17 20:27:05,948 - database_navigator - INFO - Connecting to POSTGRES...
2026-01-17 20:27:05,948 - database_navigator - INFO - Connecting to PostgreSQL...
2026-01-17 20:27:05,948 - database_navigator - INFO - Connecting to PostgreSQL: host=localhost, port=5432, database=postgres, user=postgres
2026-01-17 20:27:06,063 - database_navigator - INFO - Connection object created: <connection object at 0x000001C88B5FEAC0; dsn: 'user=postgres password=xxx dbname=postgres host=localhost port=5432', closed: 0>
2026-01-17 20:27:06,063 - database_navigator - INFO - ✅ PostgreSQL connection successful to database: postgres
2026-01-17 20:27:06,067 - database_navigator - INFO - get_databases() called. db_type: postgres, connection exists: True
2026-01-17 20:27:06,074 - database_navigator - INFO - Raw rows: [('dq_checks',), ('finewise-testdb',), ('postgres',)]
2026-01-17 20:27:06,074 - database_navigator - INFO - Found 3 databases
2026-01-17 20:27:07,446 - database_navigator - INFO - Selected database: dq_checks
2026-01-17 20:27:07,447 - database_navigator - INFO - Reconnecting to PostgreSQL database: dq_checks
2026-01-17 20:27:07,448 - database_navigator - INFO - Connecting to POSTGRES...
2026-01-17 20:27:07,450 - database_navigator - INFO - Connecting to PostgreSQL...
2026-01-17 20:27:07,450 - database_navigator - INFO - Connecting to PostgreSQL: host=localhost, port=5432, database=dq_checks, user=postgres
2026-01-17 20:27:07,558 - database_navigator - INFO - Connection object created: <connection object at 0x000001C88B5FE350; dsn: 'user=postgres password=xxx dbname=dq_checks host=localhost port=5432', closed: 0>
2026-01-17 20:27:07,559 - database_navigator - INFO - ✅ PostgreSQL connection successful to database: dq_checks
2026-01-17 20:27:07,577 - database_navigator - INFO - Found 4 schemas
2026-01-17 20:27:08,872 - database_navigator - INFO - Selected schema: public
2026-01-17 20:27:08,876 - database_navigator - INFO - Ensuring connection to database: dq_checks for table list
2026-01-17 20:27:08,876 - database_navigator - INFO - Reconnecting to PostgreSQL database: dq_checks
2026-01-17 20:27:08,876 - database_navigator - INFO - Connecting to POSTGRES...
2026-01-17 20:27:08,876 - database_navigator - INFO - Connecting to PostgreSQL...
2026-01-17 20:27:08,876 - database_navigator - INFO - Connecting to PostgreSQL: host=localhost, port=5432, database=dq_checks, user=postgres
2026-01-17 20:27:08,984 - database_navigator - INFO - Connection object created: <connection object at 0x000001C88B5FEBD0; dsn: 'user=postgres password=xxx dbname=dq_checks host=localhost port=5432', closed: 0>
2026-01-17 20:27:08,985 - database_navigator - INFO - ✅ PostgreSQL connection successful to database: dq_checks
2026-01-17 20:27:08,986 - database_navigator - INFO - Connected to database: dq_checks, schema: public
2026-01-17 20:27:09,013 - database_navigator - INFO - Found 5 tables in dq_checks.public: ['comparison_small_target13', 'customers', 'customers_bkp', 'employee', 'stg_transactions']
2026-01-17 20:27:09,013 - database_navigator - INFO - Found 5 tables in schema 'public'
2026-01-17 20:27:10,411 - database_navigator - INFO - Selected table: comparison_small_target13
2026-01-17 20:27:10,416 - database_navigator - INFO - Selection complete: {'type': 'postgresql', 'database': 'dq_checks', 'schema': 'public', 'table': 'comparison_small_target13', 'selection_mode': 'hierarchical', 'host': 'localhost', 'port': '5432', 'user': 'postgres', 'password': 'postgres'}
2026-01-17 20:27:10,417 - dq_comparison - INFO - Selected via navigation for TARGET: dq_checks.public.comparison_small_target13
2026-01-17 20:27:10,417 - dq_unified - INFO - Loading data from DATABASE
2026-01-17 20:27:10,417 - dq_unified - INFO - Loading large database table: comparison_small_target13
2026-01-17 20:27:10,418 - dq_unified - INFO - Normalized DB config with schema: public
2026-01-17 20:27:10,519 - dq_unified - INFO - PostgreSQL table public.comparison_small_target13 has 13 rows
2026-01-17 20:27:10,519 - dq_unified - INFO - Loading 13 rows from PostgreSQL...
2026-01-17 20:27:10,523 - dq_unified - INFO - Loaded 13 rows from PostgreSQL
2026-01-17 20:27:10,530 - dq_unified - INFO - Memory optimization: 0.0MB -> 0.0MB (Saved: 0.0MB)
2026-01-17 20:27:10,531 - dq_unified - INFO - Loaded 13 rows, 16 columns. Memory: 112.3MB total, 0.0MB for dataframe
2026-01-17 20:27:10,531 - dq_comparison - INFO - TARGET database loaded: 13 rows, 16 columns
2026-01-17 20:27:10,532 - dq_comparison - INFO - SELECTING COLUMNS FOR COMPARISON
2026-01-17 20:27:10,532 - dq_comparison - INFO - Source columns (original): ['transaction_id', 'account_id', 'customer_id', 'transaction_date', 'posting_date', 'transaction_type', 'currency', 'amount', 'balance_after', 'status', 'merchant_name', 'merchant_category', 'country', 'reference_code', 'created_at', 'updated_at']
2026-01-17 20:27:10,533 - dq_comparison - INFO - Target columns (original): ['transaction_id', 'account_id', 'customer_id', 'transaction_date', 'posting_date', 'transaction_type', 'currency', 'amount', 'balance_after', 'status', 'merchant_name', 'merchant_category', 'country', 'reference_code', 'created_at', 'updated_at']
2026-01-17 20:27:10,533 - dq_comparison - INFO - Common columns lowercased: ['country', 'transaction_id', 'status', 'amount', 'currency', 'transaction_date', 'transaction_type', 'account_id', 'created_at', 'updated_at', 'customer_id', 'merchant_name', 'reference_code', 'merchant_category', 'balance_after', 'posting_date']
2026-01-17 20:27:10,534 - dq_comparison - INFO - Found 16 common columns between source and target (case-insensitive)
2026-01-17 20:27:10,534 - dq_comparison - INFO - 
📋 Common columns available for comparison:
2026-01-17 20:27:10,534 - dq_comparison - INFO -   1. country (Source) ↔ country (Target)
2026-01-17 20:27:10,535 - dq_comparison - INFO -   2. transaction_id (Source) ↔ transaction_id (Target)
2026-01-17 20:27:10,535 - dq_comparison - INFO -   3. status (Source) ↔ status (Target)
2026-01-17 20:27:10,535 - dq_comparison - INFO -   4. amount (Source) ↔ amount (Target)
2026-01-17 20:27:10,536 - dq_comparison - INFO -   5. currency (Source) ↔ currency (Target)
2026-01-17 20:27:10,536 - dq_comparison - INFO -   6. transaction_date (Source) ↔ transaction_date (Target)
2026-01-17 20:27:10,536 - dq_comparison - INFO -   7. transaction_type (Source) ↔ transaction_type (Target)
2026-01-17 20:27:10,536 - dq_comparison - INFO -   8. account_id (Source) ↔ account_id (Target)
2026-01-17 20:27:10,537 - dq_comparison - INFO -   9. created_at (Source) ↔ created_at (Target)
2026-01-17 20:27:10,537 - dq_comparison - INFO -   10. updated_at (Source) ↔ updated_at (Target)
2026-01-17 20:27:10,537 - dq_comparison - INFO -   11. customer_id (Source) ↔ customer_id (Target)
2026-01-17 20:27:10,538 - dq_comparison - INFO -   12. merchant_name (Source) ↔ merchant_name (Target)
2026-01-17 20:27:10,538 - dq_comparison - INFO -   13. reference_code (Source) ↔ reference_code (Target)
2026-01-17 20:27:10,538 - dq_comparison - INFO -   14. merchant_category (Source) ↔ merchant_category (Target)
2026-01-17 20:27:10,538 - dq_comparison - INFO -   15. balance_after (Source) ↔ balance_after (Target)
2026-01-17 20:27:10,539 - dq_comparison - INFO -   16. posting_date (Source) ↔ posting_date (Target)
2026-01-17 20:27:12,127 - dq_comparison - INFO - User column selection input: all
2026-01-17 20:27:12,129 - dq_comparison - INFO - User selected ALL common columns for comparison
2026-01-17 20:27:12,129 - dq_comparison - INFO - GENERATING COMPREHENSIVE COMPARISON REPORT
2026-01-17 20:27:12,131 - dq_comparison - INFO - Report details - Source: Database: mysql - dq_checks.comparison_small_source15, Target: Database: postgresql - dq_checks.comparison_small_target13, Selected columns: 16
2026-01-17 20:27:12,131 - dq_comparison - INFO - Initializing Error Logger...
2026-01-17 20:27:12,131 - dq_error_log - INFO - ErrorLogger initialized with database: dq_checks
2026-01-17 20:27:12,145 - dq_error_log - INFO - Database connection successful
2026-01-17 20:27:12,147 - dq_comparison - INFO - Session ID: CMP_20260117_202712
2026-01-17 20:27:12,149 - dq_comparison - INFO - 
======================================================================
2026-01-17 20:27:12,149 - dq_comparison - INFO - 🔄 RUNNING SOURCE-TARGET COMPARISON WITH PERFECT NORMALIZATION
2026-01-17 20:27:12,149 - dq_comparison - INFO - ======================================================================
2026-01-17 20:27:12,149 - dq_comparison - INFO - Session ID: CMP_20260117_202712
2026-01-17 20:27:12,149 - dq_comparison - INFO - Source: Database: mysql - dq_checks.comparison_small_source15
2026-01-17 20:27:12,150 - dq_comparison - INFO - Target: Database: postgresql - dq_checks.comparison_small_target13
2026-01-17 20:27:12,150 - dq_comparison - INFO - Selected columns: 16
2026-01-17 20:27:12,151 - dq_comparison - INFO - ======================================================================
2026-01-17 20:27:12,151 - dq_comparison - INFO - 
1️⃣ FIRST: ROW COUNT CHECK
2026-01-17 20:27:12,151 - dq_comparison - WARNING - ❌ Row count mismatch: Source=15, Target=13, Difference=2
2026-01-17 20:27:12,152 - dq_comparison - WARNING -    Missing in target: 2 rows
2026-01-17 20:27:12,152 - dq_comparison - INFO - 
2️⃣ COLUMN STRUCTURE COMPARISON
2026-01-17 20:27:12,152 - dq_comparison - INFO - Comparing column structures...
2026-01-17 20:27:12,152 - dq_comparison - INFO - Column structure comparison complete. Match: True
2026-01-17 20:27:12,153 - dq_comparison - INFO - 
3️⃣ PRIMARY KEY VALIDATION
2026-01-17 20:27:12,153 - dq_comparison - INFO - Validating primary key/unique fields...
2026-01-17 20:27:12,153 - dq_comparison - INFO - Checking key fields: ['transaction_id', 'customer_id', 'reference_code']
2026-01-17 20:27:12,155 - dq_comparison - WARNING - Field 'customer_id' has duplicates in source: 15 rows
2026-01-17 20:27:12,156 - dq_comparison - WARNING - Field 'customer_id' has duplicates in target: 13 rows
2026-01-17 20:27:12,157 - dq_comparison - INFO - Primary key validation complete. Passed: False
2026-01-17 20:27:12,182 - dq_comparison - INFO -    Key fields found: ['transaction_id', 'customer_id', 'reference_code']
2026-01-17 20:27:12,182 - dq_comparison - INFO -    Unique in source: ❌
2026-01-17 20:27:12,183 - dq_comparison - INFO -    Unique in target: ❌
2026-01-17 20:27:12,185 - dq_comparison - INFO -    Validation passed: ❌
2026-01-17 20:27:12,185 - dq_comparison - WARNING -    Source duplicates in 'customer_id': 15 rows
2026-01-17 20:27:12,185 - dq_comparison - WARNING -      Sample values: ['CUST9001']
2026-01-17 20:27:12,186 - dq_comparison - WARNING -    Target duplicates in 'customer_id': 13 rows
2026-01-17 20:27:12,186 - dq_comparison - WARNING -      Sample values: ['CUST9001']
2026-01-17 20:27:12,186 - dq_comparison - INFO -    Column names match: ✅
2026-01-17 20:27:12,186 - dq_comparison - INFO -    Column order match: ✅
2026-01-17 20:27:12,187 - dq_comparison - INFO -    Data types match: ✅
2026-01-17 20:27:12,187 - dq_comparison - INFO - 
4️⃣ TABLE METADATA COMPARISON
2026-01-17 20:27:12,187 - dq_comparison - INFO - Comparing table-level metadata...
2026-01-17 20:27:12,198 - dq_comparison - INFO - Table metadata comparison complete. Match: False
2026-01-17 20:27:12,210 - dq_comparison - INFO -    Table metadata match: ❌
2026-01-17 20:27:12,211 - dq_comparison - INFO -    Source: 15 rows, 16 cols, 0.01 MB
2026-01-17 20:27:12,211 - dq_comparison - INFO -    Target: 13 rows, 16 cols, 0.0 MB
2026-01-17 20:27:12,213 - dq_comparison - WARNING -    Found 1 metadata differences:
2026-01-17 20:27:12,213 - dq_comparison - WARNING -      • Row Count: Source=15, Target=13
2026-01-17 20:27:12,214 - dq_comparison - INFO - 
5️⃣ HASH-BASED COMPARISON
2026-01-17 20:27:12,214 - dq_comparison - INFO - ℹ️  Note: All NULL values normalized to 'NULL'
2026-01-17 20:27:12,214 - dq_comparison - INFO - ℹ️  Note: Dates normalized to YYYY-MM-DD
2026-01-17 20:27:12,215 - dq_comparison - INFO - ℹ️  Note: Strings trimmed and case-normalized
2026-01-17 20:27:12,215 - dq_comparison - INFO - ℹ️  Note: Phone numbers stripped to digits only, leading zeros removed
2026-01-17 20:27:12,215 - dq_comparison - INFO - SECOND CHECK: HASH-BASED COMPARISON WITH PERFECT NORMALIZATION
2026-01-17 20:27:12,221 - dq_comparison - INFO - === DEBUG: DATA TYPE CHECK ===
2026-01-17 20:27:12,221 - dq_comparison - INFO - Column: country
2026-01-17 20:27:12,221 - dq_comparison - INFO -   Source type: <class 'str'>, value: IN
2026-01-17 20:27:12,222 - dq_comparison - INFO -   Target type: <class 'str'>, value: IN
2026-01-17 20:27:12,222 - dq_comparison - INFO -   Normalized: 'in' vs 'in'
2026-01-17 20:27:12,222 - dq_comparison - INFO -   Match: True
2026-01-17 20:27:12,222 - dq_comparison - INFO - Column: transaction_id
2026-01-17 20:27:12,223 - dq_comparison - INFO -   Source type: <class 'str'>, value: 0b0ccaa7-6fde-4868-a20d-8064a87e4914
2026-01-17 20:27:12,223 - dq_comparison - INFO -   Target type: <class 'str'>, value: 3ec6eecf-ef59-4447-9929-28a2e39e7231
2026-01-17 20:27:12,224 - dq_comparison - INFO -   Normalized: '0b0ccaa7-6fde-4868-a20d-8064a87e4914' vs '3ec6eecf-ef59-4447-9929-28a2e39e7231'
2026-01-17 20:27:12,226 - dq_comparison - INFO -   Match: False
2026-01-17 20:27:12,227 - dq_comparison - INFO - Column: status
2026-01-17 20:27:12,228 - dq_comparison - INFO -   Source type: <class 'str'>, value: SUCCESS
2026-01-17 20:27:12,228 - dq_comparison - INFO -   Target type: <class 'str'>, value: SUCCESS
2026-01-17 20:27:12,228 - dq_comparison - INFO -   Normalized: 'success' vs 'success'
2026-01-17 20:27:12,228 - dq_comparison - INFO -   Match: True
2026-01-17 20:27:12,229 - dq_comparison - INFO - Source DF columns: ['transaction_id', 'account_id', 'customer_id', 'transaction_date', 'posting_date', 'transaction_type', 'currency', 'amount', 'balance_after', 'status', 'merchant_name', 'merchant_category', 'country', 'reference_code', 'created_at', 'updated_at']
2026-01-17 20:27:12,229 - dq_comparison - INFO - Target DF columns: ['transaction_id', 'account_id', 'customer_id', 'transaction_date', 'posting_date', 'transaction_type', 'currency', 'amount', 'balance_after', 'status', 'merchant_name', 'merchant_category', 'country', 'reference_code', 'created_at', 'updated_at']
2026-01-17 20:27:12,229 - dq_comparison - INFO - Selected columns for comparison: ['country', 'transaction_id', 'status', 'amount', 'currency', 'transaction_date', 'transaction_type', 'account_id', 'created_at', 'updated_at', 'customer_id', 'merchant_name', 'reference_code', 'merchant_category', 'balance_after', 'posting_date']
2026-01-17 20:27:12,230 - dq_comparison - INFO - Using 16 common columns for hash comparison
2026-01-17 20:27:12,230 - dq_comparison - INFO - Source columns: ['country', 'transaction_id', 'status', 'amount', 'currency', 'transaction_date', 'transaction_type', 'account_id', 'created_at', 'updated_at', 'customer_id', 'merchant_name', 'reference_code', 'merchant_category', 'balance_after', 'posting_date']
2026-01-17 20:27:12,230 - dq_comparison - INFO - Target columns: ['country', 'transaction_id', 'status', 'amount', 'currency', 'transaction_date', 'transaction_type', 'account_id', 'created_at', 'updated_at', 'customer_id', 'merchant_name', 'reference_code', 'merchant_category', 'balance_after', 'posting_date']
2026-01-17 20:27:12,231 - dq_comparison - INFO - Generating hashes for source data (15 rows)...
2026-01-17 20:27:12,235 - dq_comparison - INFO - === DEBUG: SOURCES SAMPLE HASHES ===
2026-01-17 20:27:12,235 - dq_comparison - INFO - Hash 1: 589940db7b81acd859e2aa50d137139a... (Source row 0)
2026-01-17 20:27:12,235 - dq_comparison - INFO - Hash 2: 69337269d8139087ce87889c718cf1af... (Source row 1)
2026-01-17 20:27:12,235 - dq_comparison - INFO - Hash 3: a6817f1606ac96f77eca0cfa5b6ccbb8... (Source row 2)
2026-01-17 20:27:12,236 - dq_comparison - INFO - Hash 4: 4f4bd31bc45865954a19ce43681ad518... (Source row 3)
2026-01-17 20:27:12,236 - dq_comparison - INFO - Hash 5: 307669615c23574fdd8f8acb61222ab8... (Source row 4)
2026-01-17 20:27:12,236 - dq_comparison - INFO - Hash 6: 05dda324e249672bb0cdf5a248808be0... (Source row 5)
2026-01-17 20:27:12,237 - dq_comparison - INFO - Hash 7: 2ad0dca9bc18b37deece2a55523fd69c... (Source row 6)
2026-01-17 20:27:12,237 - dq_comparison - INFO - Hash 8: cab7e0d8a5a69b6fbac8ddc261d5cec1... (Source row 7)
2026-01-17 20:27:12,237 - dq_comparison - INFO - Hash 9: 22e6a4e26cf1e86ee6f21ac94a8a6e51... (Source row 8)
2026-01-17 20:27:12,237 - dq_comparison - INFO - Hash 10: 7d6dc7a89e9166347f3840436da1a53a... (Source row 9)
2026-01-17 20:27:12,237 - dq_comparison - INFO - Hash 11: b1dc9c8dad9f9e816564b3256d5ff6a5... (Source row 10)
2026-01-17 20:27:12,238 - dq_comparison - INFO - Hash 12: 31434cfeeeae3e19c571b58ffc537646... (Source row 11)
2026-01-17 20:27:12,238 - dq_comparison - INFO - Hash 13: 4e16b8e7e68815749dfc968824c4ce97... (Source row 12)
2026-01-17 20:27:12,238 - dq_comparison - INFO - Hash 14: 2170a09a04d81eda6427be374ec49a79... (Source row 13)
2026-01-17 20:27:12,238 - dq_comparison - INFO - Hash 15: 88dd53aac2ef2e9031fa579642bf96e3... (Source row 14)
2026-01-17 20:27:12,239 - dq_comparison - INFO - Generating hashes for target data (13 rows)...
2026-01-17 20:27:12,245 - dq_comparison - INFO - === DEBUG: TARGET SAMPLE HASHES ===
2026-01-17 20:27:12,245 - dq_comparison - INFO - Hash 1: 18f1cdb9d9589ce1c84db73c20783c27... (Target row 0)
2026-01-17 20:27:12,246 - dq_comparison - INFO - Hash 2: e7bce8e4b25b7ec0a12d930e926085b7... (Target row 1)
2026-01-17 20:27:12,246 - dq_comparison - INFO - Hash 3: 180f5894aadef03dada5de875530e3df... (Target row 2)
2026-01-17 20:27:12,246 - dq_comparison - INFO - Hash 4: 628f55cfae6454ce4e637a1e444bd36c... (Target row 3)
2026-01-17 20:27:12,247 - dq_comparison - INFO - Hash 5: 78fc5e1dcabe026a9db4124ac43234f9... (Target row 4)
2026-01-17 20:27:12,247 - dq_comparison - INFO - Hash 6: 5140e90e9c4b62711611dd3c65cd91ec... (Target row 5)
2026-01-17 20:27:12,247 - dq_comparison - INFO - Hash 7: c1dd3760c51221cd25abcfbd8e1107b3... (Target row 6)
2026-01-17 20:27:12,247 - dq_comparison - INFO - Hash 8: 98bbf225be28c847951de025516b94b6... (Target row 7)
2026-01-17 20:27:12,247 - dq_comparison - INFO - Hash 9: 811450bbb2b4879a1174c4587cce89ad... (Target row 8)
2026-01-17 20:27:12,248 - dq_comparison - INFO - Hash 10: 34f45d26acd9040f3510edb73cf989aa... (Target row 9)
2026-01-17 20:27:12,248 - dq_comparison - INFO - Hash 11: 68e1294419a018399e238d2992f310ca... (Target row 10)
2026-01-17 20:27:12,248 - dq_comparison - INFO - Hash 12: 25bff2ba6207c2d7c22dc9de2bd91006... (Target row 11)
2026-01-17 20:27:12,248 - dq_comparison - INFO - Hash 13: 4564443e3408b388f1fd6185461fd12c... (Target row 12)
2026-01-17 20:27:12,248 - dq_comparison - INFO - 
======================================================================
2026-01-17 20:27:12,249 - dq_comparison - INFO - 🔍 DEBUG: ANALYZING WHY HASHES DON'T MATCH
2026-01-17 20:27:12,249 - dq_comparison - INFO - ======================================================================
2026-01-17 20:27:12,249 - dq_comparison - INFO - --- Analyzing Row 0 ---
2026-01-17 20:27:12,250 - dq_comparison - INFO - Column 'country' → 'country':
2026-01-17 20:27:12,250 - dq_comparison - INFO -   Source: 'IN' (type: str) → 'in'
2026-01-17 20:27:12,250 - dq_comparison - INFO -   Target: 'IN' (type: str) → 'in'
2026-01-17 20:27:12,250 - dq_comparison - INFO -   Match after normalization: ✅ YES
2026-01-17 20:27:12,251 - dq_comparison - INFO - Column 'transaction_id' → 'transaction_id':
2026-01-17 20:27:12,251 - dq_comparison - INFO -   Source: '0b0ccaa7-6fde-4868-a20d-8064a87e4914' (type: str) → '0b0ccaa7-6fde-4868-a20d-8064a87e4914'
2026-01-17 20:27:12,251 - dq_comparison - INFO -   Target: '3ec6eecf-ef59-4447-9929-28a2e39e7231' (type: str) → '3ec6eecf-ef59-4447-9929-28a2e39e7231'
2026-01-17 20:27:12,251 - dq_comparison - INFO -   Match after normalization: ❌ NO
2026-01-17 20:27:12,251 - dq_comparison - INFO - Column 'status' → 'status':
2026-01-17 20:27:12,251 - dq_comparison - INFO -   Source: 'SUCCESS' (type: str) → 'success'
2026-01-17 20:27:12,251 - dq_comparison - INFO -   Target: 'SUCCESS' (type: str) → 'success'
2026-01-17 20:27:12,252 - dq_comparison - INFO -   Match after normalization: ✅ YES
2026-01-17 20:27:12,252 - dq_comparison - INFO - Column 'amount' → 'amount':
2026-01-17 20:27:12,252 - dq_comparison - INFO -   Source: '536.83' (type: str) → '536.83'
2026-01-17 20:27:12,252 - dq_comparison - INFO -   Target: '5896.93017578125' (type: float32) → '5896.93'
2026-01-17 20:27:12,252 - dq_comparison - INFO -   Match after normalization: ❌ NO
2026-01-17 20:27:12,253 - dq_comparison - INFO - Column 'currency' → 'currency':
2026-01-17 20:27:12,253 - dq_comparison - INFO -   Source: 'EUR' (type: str) → 'eur'
2026-01-17 20:27:12,253 - dq_comparison - INFO -   Target: 'EUR' (type: str) → 'eur'
2026-01-17 20:27:12,253 - dq_comparison - INFO -   Match after normalization: ✅ YES
2026-01-17 20:27:12,253 - dq_comparison - INFO - 
Hash components for Row 0:
2026-01-17 20:27:12,254 - dq_comparison - INFO - Source hash string start: in|0b0ccaa7-6fde-4868-a20d-8064a87e4914|success...
2026-01-17 20:27:12,254 - dq_comparison - INFO - Target hash string start: in|3ec6eecf-ef59-4447-9929-28a2e39e7231|success...
2026-01-17 20:27:12,254 - dq_comparison - INFO - Same? ❌ NO
2026-01-17 20:27:12,254 - dq_comparison - INFO - --- Analyzing Row 1 ---
2026-01-17 20:27:12,255 - dq_comparison - INFO - Column 'country' → 'country':
2026-01-17 20:27:12,258 - dq_comparison - INFO -   Source: 'IN' (type: str) → 'in'
2026-01-17 20:27:12,259 - dq_comparison - INFO -   Target: 'US' (type: str) → 'us'
2026-01-17 20:27:12,259 - dq_comparison - INFO -   Match after normalization: ❌ NO
2026-01-17 20:27:12,259 - dq_comparison - INFO - Column 'transaction_id' → 'transaction_id':
2026-01-17 20:27:12,260 - dq_comparison - INFO -   Source: '21de9b66-d966-4f89-8a71-dedd548b149b' (type: str) → '21de9b66-d966-4f89-8a71-dedd548b149b'
2026-01-17 20:27:12,260 - dq_comparison - INFO -   Target: '33063be6-7ea8-432f-869c-20de5281eca7' (type: str) → '33063be6-7ea8-432f-869c-20de5281eca7'
2026-01-17 20:27:12,260 - dq_comparison - INFO -   Match after normalization: ❌ NO
2026-01-17 20:27:12,261 - dq_comparison - INFO - Column 'status' → 'status':
2026-01-17 20:27:12,261 - dq_comparison - INFO -   Source: 'SUCCESS' (type: str) → 'success'
2026-01-17 20:27:12,261 - dq_comparison - INFO -   Target: 'SUCCESS' (type: str) → 'success'
2026-01-17 20:27:12,261 - dq_comparison - INFO -   Match after normalization: ✅ YES
2026-01-17 20:27:12,262 - dq_comparison - INFO - Column 'amount' → 'amount':
2026-01-17 20:27:12,262 - dq_comparison - INFO -   Source: '1389.09' (type: str) → '1389.09'
2026-01-17 20:27:12,262 - dq_comparison - INFO -   Target: '2460.419921875' (type: float32) → '2460.42'
2026-01-17 20:27:12,262 - dq_comparison - INFO -   Match after normalization: ❌ NO
2026-01-17 20:27:12,262 - dq_comparison - INFO - Column 'currency' → 'currency':
2026-01-17 20:27:12,262 - dq_comparison - INFO -   Source: 'INR' (type: str) → 'inr'
2026-01-17 20:27:12,263 - dq_comparison - INFO -   Target: 'EUR' (type: str) → 'eur'
2026-01-17 20:27:12,263 - dq_comparison - INFO -   Match after normalization: ❌ NO
2026-01-17 20:27:12,263 - dq_comparison - INFO - 
Hash components for Row 1:
2026-01-17 20:27:12,263 - dq_comparison - INFO - Source hash string start: in|21de9b66-d966-4f89-8a71-dedd548b149b|success...
2026-01-17 20:27:12,263 - dq_comparison - INFO - Target hash string start: us|33063be6-7ea8-432f-869c-20de5281eca7|success...
2026-01-17 20:27:12,264 - dq_comparison - INFO - Same? ❌ NO
2026-01-17 20:27:12,264 - dq_comparison - INFO - --- Analyzing Row 2 ---
2026-01-17 20:27:12,264 - dq_comparison - INFO - Column 'country' → 'country':
2026-01-17 20:27:12,265 - dq_comparison - INFO -   Source: 'US' (type: str) → 'us'
2026-01-17 20:27:12,265 - dq_comparison - INFO -   Target: 'US' (type: str) → 'us'
2026-01-17 20:27:12,265 - dq_comparison - INFO -   Match after normalization: ✅ YES
2026-01-17 20:27:12,265 - dq_comparison - INFO - Column 'transaction_id' → 'transaction_id':
2026-01-17 20:27:12,266 - dq_comparison - INFO -   Source: '33063be6-7ea8-432f-869c-20de5281eca7' (type: str) → '33063be6-7ea8-432f-869c-20de5281eca7'
2026-01-17 20:27:12,266 - dq_comparison - INFO -   Target: '6a90c3b3-b134-4177-81b5-94fb1ef59619' (type: str) → '6a90c3b3-b134-4177-81b5-94fb1ef59619'
2026-01-17 20:27:12,266 - dq_comparison - INFO -   Match after normalization: ❌ NO
2026-01-17 20:27:12,266 - dq_comparison - INFO - Column 'status' → 'status':
2026-01-17 20:27:12,266 - dq_comparison - INFO -   Source: 'SUCCESS' (type: str) → 'success'
2026-01-17 20:27:12,267 - dq_comparison - INFO -   Target: 'SUCCESS' (type: str) → 'success'
2026-01-17 20:27:12,267 - dq_comparison - INFO -   Match after normalization: ✅ YES
2026-01-17 20:27:12,267 - dq_comparison - INFO - Column 'amount' → 'amount':
2026-01-17 20:27:12,267 - dq_comparison - INFO -   Source: '2460.42' (type: str) → '2460.42'
2026-01-17 20:27:12,267 - dq_comparison - INFO -   Target: '4816.169921875' (type: float32) → '4816.17'
2026-01-17 20:27:12,267 - dq_comparison - INFO -   Match after normalization: ❌ NO
2026-01-17 20:27:12,268 - dq_comparison - INFO - Column 'currency' → 'currency':
2026-01-17 20:27:12,268 - dq_comparison - INFO -   Source: 'EUR' (type: str) → 'eur'
2026-01-17 20:27:12,268 - dq_comparison - INFO -   Target: 'INR' (type: str) → 'inr'
2026-01-17 20:27:12,268 - dq_comparison - INFO -   Match after normalization: ❌ NO
2026-01-17 20:27:12,268 - dq_comparison - INFO - 
Hash components for Row 2:
2026-01-17 20:27:12,269 - dq_comparison - INFO - Source hash string start: us|33063be6-7ea8-432f-869c-20de5281eca7|success...
2026-01-17 20:27:12,269 - dq_comparison - INFO - Target hash string start: us|6a90c3b3-b134-4177-81b5-94fb1ef59619|success...
2026-01-17 20:27:12,269 - dq_comparison - INFO - Same? ❌ NO
2026-01-17 20:27:12,269 - dq_comparison - INFO - 
--- Column Data Types Analysis ---
2026-01-17 20:27:12,269 - dq_comparison - INFO - Column 1: 'country' (category) ↔ 'country' (category)
2026-01-17 20:27:12,270 - dq_comparison - INFO -   Sample: Source='IN', Target='IN'
2026-01-17 20:27:12,273 - dq_comparison - INFO - Column 2: 'transaction_id' (object) ↔ 'transaction_id' (object)
2026-01-17 20:27:12,273 - dq_comparison - INFO -   Sample: Source='0b0ccaa7-6fde-4868-a20d-8064a87e4914', Target='3ec6eecf-ef59-4447-9929-28a2e39e7231'
2026-01-17 20:27:12,274 - dq_comparison - INFO - Column 3: 'status' (category) ↔ 'status' (category)
2026-01-17 20:27:12,274 - dq_comparison - INFO -   Sample: Source='SUCCESS', Target='SUCCESS'
2026-01-17 20:27:12,274 - dq_comparison - INFO - Column 4: 'amount' (object) ↔ 'amount' (float32)
2026-01-17 20:27:12,275 - dq_comparison - INFO -   Sample: Source='536.83', Target='5896.93017578125'
2026-01-17 20:27:12,275 - dq_comparison - INFO - Column 5: 'currency' (category) ↔ 'currency' (category)
2026-01-17 20:27:12,275 - dq_comparison - INFO -   Sample: Source='EUR', Target='EUR'
2026-01-17 20:27:12,275 - dq_comparison - INFO - PERFORMING DETAILED ROW-LEVEL COMPARISON WITH PAGINATION...
2026-01-17 20:27:12,276 - dq_comparison - INFO - Found 28 total mismatches
2026-01-17 20:27:12,276 - dq_comparison - INFO - Will process detailed comparisons for first 28 rows
2026-01-17 20:27:12,452 - dq_comparison - INFO - 
================================================================================
2026-01-17 20:27:12,452 - dq_comparison - INFO - DETAILED MISMATCH SUMMARY:
2026-01-17 20:27:12,453 - dq_comparison - INFO -   Total mismatches found: 15
2026-01-17 20:27:12,455 - dq_comparison - INFO -   Detailed comparisons logged: 15
2026-01-17 20:27:12,455 - dq_comparison - INFO -   First 10 rows displayed above
2026-01-17 20:27:12,455 - dq_comparison - INFO -   All mismatches stored in database with complete data
2026-01-17 20:27:12,456 - dq_comparison - INFO -   Use API to retrieve all 15 mismatches
2026-01-17 20:27:12,457 - dq_comparison - INFO - ================================================================================
2026-01-17 20:27:12,457 - dq_comparison - INFO - Hash-based Comparison Results (with duplicate handling):
2026-01-17 20:27:12,457 - dq_comparison - INFO -   • Unique source hashes: 15
2026-01-17 20:27:12,457 - dq_comparison - INFO -   • Unique target hashes: 13
2026-01-17 20:27:12,457 - dq_comparison - INFO -   • Common hashes: 0
2026-01-17 20:27:12,457 - dq_comparison - INFO -   • Common rows (counting duplicates): 0
2026-01-17 20:27:12,458 - dq_comparison - INFO -   • Rows only in source (counting duplicates): 15
2026-01-17 20:27:12,458 - dq_comparison - INFO -   • Rows only in target (counting duplicates): 13
2026-01-17 20:27:12,460 - dq_comparison - INFO - HASH-ONLY COMPARISON COMPLETED
2026-01-17 20:27:12,460 - dq_comparison - INFO - Returning counts for simple scoring:
2026-01-17 20:27:12,461 - dq_comparison - INFO -   Common rows: 0
2026-01-17 20:27:12,461 - dq_comparison - INFO -   Unique to source: 15
2026-01-17 20:27:12,461 - dq_comparison - INFO -   Unique to target: 13
2026-01-17 20:27:12,461 - dq_comparison - INFO -   Value mismatches: 448
2026-01-17 20:27:12,462 - dq_comparison - INFO -   Missing rows: 15
2026-01-17 20:27:12,462 - dq_comparison - INFO -   Extra rows: 13
2026-01-17 20:27:12,462 - dq_comparison - INFO - 
========================================================================================================================
COMPARISON: Mysql Database vs Postgresql Database
========================================================================================================================
Row   | Diff Count | Source (Sample)                          | Target (Sample)                         
------------------------------------------------------------------------------------------------------------------------
2     | 6          | country: IN                              | country: IN                             
3     | 7          | country: IN                              | country: US                             
4     | 8          | country: US                              | country: US                             
5     | 8          | country: DE                              | country: DE                             
6     | 8          | country: IN                              | country: IN                             
7     | 0          | country: IN                              | country: IN                             
8     | 7          | country: DE                              | country: IN                             
9     | 9          | country: DE                              | country: US                             
10    | 8          | country: US                              | country: DE                             
11    | 7          | country: DE                              | country: DE                             
------------------------------------------------------------------------------------------------------------------------
Showing 1-10 of 15 mismatched rows. Use API for complete data.
========================================================================================================================
2026-01-17 20:27:12,464 - dq_comparison - INFO - Returning enhanced mismatch structure with 15 detailed mismatches
2026-01-17 20:27:12,464 - dq_comparison - INFO - New structure: 15 detailed mismatches
2026-01-17 20:27:12,464 - dq_comparison - INFO - 
6️⃣ DATA QUALITY ANALYSIS
2026-01-17 20:27:12,464 - dq_comparison - INFO - Analyzing data quality metrics...
2026-01-17 20:27:12,479 - dq_comparison - INFO - Null values - Source: 0 (0.00%), Target: 0 (0.00%)
2026-01-17 20:27:12,481 - dq_comparison - INFO - Duplicate rows (normalized) - Source: 0, Target: 0
2026-01-17 20:27:12,492 - dq_error_log - INFO - Retrieved 18 error logs for session CMP_20260117_202712
2026-01-17 20:27:12,493 - dq_comparison - INFO - 
📊 SIMPLE SCORING CALCULATION:
2026-01-17 20:27:12,494 - dq_comparison - INFO -   Source rows: 15
2026-01-17 20:27:12,494 - dq_comparison - INFO -   Common rows (matched): 0
2026-01-17 20:27:12,494 - dq_comparison - INFO -   Calculation: (0 / 15) * 100 = 0.00%
2026-01-17 20:27:12,494 - dq_comparison - INFO -   Explanation: 0 matched rows out of 15 total source rows
2026-01-17 20:27:12,495 - dq_comparison - INFO - 
=== AUDIT LOGGING SECTION ===
2026-01-17 20:27:12,498 - dq_comparison - INFO - 🔍 Audit logging is ENABLED in APP_SETTINGS
2026-01-17 20:27:12,498 - dq_audit - INFO - Audit class initialized with database: dq_checks
2026-01-17 20:27:12,498 - dq_comparison - INFO - Attempting to log audit record for session: CMP_20260117_202712
2026-01-17 20:27:12,498 - dq_audit - INFO - Starting database insertion for comparison...
2026-01-17 20:27:12,511 - dq_audit - INFO - Inserted comparison record with ID: 765
2026-01-17 20:27:12,512 - dq_comparison - INFO - ✅ Audit record logged successfully (ID: 765)
2026-01-17 20:27:12,512 - dq_comparison - INFO - 
======================================================================
2026-01-17 20:27:12,512 - dq_comparison - INFO - 📊 COMPARISON RESULTS SUMMARY
2026-01-17 20:27:12,513 - dq_comparison - INFO - ======================================================================
2026-01-17 20:27:12,513 - dq_comparison - INFO - Session ID: CMP_20260117_202712
2026-01-17 20:27:12,513 - dq_comparison - INFO - Source: Database: mysql - dq_checks.comparison_small_source15 (15 rows)
2026-01-17 20:27:12,513 - dq_comparison - INFO - Target: Database: postgresql - dq_checks.comparison_small_target13 (13 rows)
2026-01-17 20:27:12,514 - dq_comparison - INFO - Selected columns: 16
2026-01-17 20:27:12,514 - dq_comparison - INFO - ----------------------------------------------------------------------
2026-01-17 20:27:12,514 - dq_comparison - INFO - 1️⃣ Row count match: ❌ No
2026-01-17 20:27:12,514 - dq_comparison - INFO -    Missing in target: 2 rows
2026-01-17 20:27:12,515 - dq_comparison - INFO -    Extra in target: 0 rows
2026-01-17 20:27:12,515 - dq_comparison - INFO - 2️⃣ Column structure match: ✅ Yes
2026-01-17 20:27:12,515 - dq_comparison - INFO - 3️ Primary key validation: ❌ Failed
2026-01-17 20:27:12,516 - dq_comparison - INFO -    Key fields: ['transaction_id', 'customer_id', 'reference_code']
2026-01-17 20:27:12,516 - dq_comparison - INFO - 4️ Table metadata: ❌ Mismatch
2026-01-17 20:27:12,516 - dq_comparison - INFO -    • Row Count: 15 vs 13
2026-01-17 20:27:12,516 - dq_comparison - INFO - 5️⃣ Common rows (both Mysql Database and Postgresql Database): 0 (0.00% of Mysql Database)
2026-01-17 20:27:12,516 - dq_comparison - INFO - 6️⃣ Mysql Database-only rows: 15 (present ONLY in Mysql Database, NOT in Postgresql Database)
2026-01-17 20:27:12,517 - dq_comparison - INFO - 7️⃣ Postgresql Database-only rows: 13 (present ONLY in Postgresql Database, NOT in Mysql Database)
2026-01-17 20:27:12,517 - dq_comparison - INFO - 8️⃣ Column value mismatches: 0
2026-01-17 20:27:12,517 - dq_comparison - INFO - 9️ Data quality match: ✅ Yes
2026-01-17 20:27:12,517 - dq_comparison - INFO - 📈 DQ Score: 0.00%
2026-01-17 20:27:12,518 - dq_comparison - INFO - 📊 Calculation: (0 / 15) * 100 = 0.00%
2026-01-17 20:27:12,518 - dq_comparison - INFO - ======================================================================
2026-01-17 20:27:12,518 - dq_comparison - INFO - 
❌ LOW MATCH! Major differences found.
2026-01-17 20:27:12,519 - dq_comparison - INFO - 
🔍 NORMALIZATION APPLIED:
2026-01-17 20:27:12,522 - dq_comparison - INFO -    • NULL values → 'NULL' (consistent representation)
2026-01-17 20:27:12,522 - dq_comparison - INFO -    • Dates → YYYY-MM-DD format
2026-01-17 20:27:12,523 - dq_comparison - INFO -    • Strings → trimmed + lowercase
2026-01-17 20:27:12,523 - dq_comparison - INFO -    • Numeric values → standardized format
2026-01-17 20:27:12,523 - dq_comparison - INFO -    • Phone numbers → digits only, ALL leading zeros removed
2026-01-17 20:27:12,523 - dq_comparison - INFO -    • Extra whitespace removed
2026-01-17 20:27:12,524 - dq_comparison - INFO - 
🔍 DETAILED ERROR ANALYSIS:
2026-01-17 20:27:12,524 - dq_comparison - INFO - --------------------------------------------------
2026-01-17 20:27:12,524 - dq_comparison - INFO - 📊 SOURCE-ONLY ROWS: 15 rows
2026-01-17 20:27:12,524 - dq_comparison - INFO -    Present only in Mysql Database, missing from Postgresql Database
2026-01-17 20:27:12,525 - dq_comparison - INFO - 📊 TARGET-ONLY ROWS: 13 rows
2026-01-17 20:27:12,525 - dq_comparison - INFO -    Present only in Postgresql Database, extra (not in Mysql Database)
2026-01-17 20:27:12,535 - dq_error_log - INFO - Retrieved 10 errors for session CMP_20260117_202712
2026-01-17 20:27:12,536 - dq_comparison - INFO - 
📋 SAMPLE ERRORS (10 found):
2026-01-17 20:27:12,537 - dq_comparison - INFO - 
1. Row 0 - Metadata Row Count
2026-01-17 20:27:12,537 - dq_comparison - INFO -    Column: 
2026-01-17 20:27:12,538 - dq_comparison - INFO -    Metadata mismatch: Row Count
2026-01-17 20:27:12,538 - dq_comparison - INFO - 
2. Row 0 - Duplicate Primary Key
2026-01-17 20:27:12,538 - dq_comparison - INFO -    Column: customer_id
2026-01-17 20:27:12,539 - dq_comparison - INFO -    Primary key field 'customer_id' has 15 duplicates in source
2026-01-17 20:27:12,539 - dq_comparison - INFO - 
3. Row 0 - Duplicate Primary Key
2026-01-17 20:27:12,539 - dq_comparison - INFO -    Column: customer_id
2026-01-17 20:27:12,539 - dq_comparison - INFO -    Primary key field 'customer_id' has 13 duplicates in target
2026-01-17 20:27:12,540 - dq_comparison - INFO - 
💡 For complete error details, run:
2026-01-17 20:27:12,540 - dq_comparison - INFO -    USE dq_checks;
2026-01-17 20:27:12,540 - dq_comparison - INFO -    SELECT excel_row, column_name, error_type, error_description,
2026-01-17 20:27:12,540 - dq_comparison - INFO -           actual_value, expected_value
2026-01-17 20:27:12,540 - dq_comparison - INFO -    FROM dq_error_logs
2026-01-17 20:27:12,541 - dq_comparison - INFO -    WHERE session_id = 'CMP_20260117_202712'
2026-01-17 20:27:12,541 - dq_comparison - INFO -    ORDER BY excel_row, column_name;
2026-01-17 20:27:12,553 - dq_comparison - INFO - 
✅ Comparison completed! Session ID: CMP_20260117_202712
2026-01-17 20:27:12,563 - dq_error_log - INFO - Retrieved 19 error logs for session CMP_20260117_202712
2026-01-17 20:27:12,574 - dq_error_log - INFO - Retrieved summary: 19 total errors for session CMP_20260117_202712
2026-01-17 20:27:12,574 - dq_audit - INFO - Audit class initialized with database: dq_checks
2026-01-17 20:27:12,587 - dq_audit - INFO - Retrieved 1 audit logs for session CMP_20260117_202712
2026-01-17 20:27:12,587 - dq_comparison - INFO - 
🔍 Final results verification:
2026-01-17 20:27:12,587 - dq_comparison - INFO -    Session ID: CMP_20260117_202712
2026-01-17 20:27:12,589 - dq_comparison - INFO -    DQ Score (Simple %): 0.00%
2026-01-17 20:27:12,589 - dq_comparison - INFO -    Source rows: 15
2026-01-17 20:27:12,590 - dq_comparison - INFO -    Matched rows: 0
2026-01-17 20:27:12,590 - dq_comparison - INFO -    Calculation: (0 / 15) * 100
2026-01-17 20:27:12,590 - __main__ - INFO - Source-Target Comparison completed successfully
2026-01-17 20:27:12,591 - __main__ - INFO - Displaying main menu options to user
2026-01-17 20:27:16,019 - __main__ - INFO - User selected option: 6
2026-01-17 20:27:16,020 - __main__ - INFO - User session ended. Duration: 0:00:32.696309
2026-01-17 20:27:16,021 - __main__ - INFO - 👋 Thank you for using Universal Data Quality Framework!
