2026-01-17 20:25:36,682 - root - INFO - CLI Mode Logging Initialized
2026-01-17 20:25:36,682 - root - INFO - CLI logs will be saved to: logs/dq_framework_20260117_202536.log
2026-01-17 20:25:36,682 - __main__ - INFO - 🚀 UNIVERSAL DATA QUALITY FRAMEWORK INITIALIZED
2026-01-17 20:25:36,683 - __main__ - INFO - Starting system resource check
2026-01-17 20:25:36,689 - __main__ - INFO - Total RAM: 15.7 GB
2026-01-17 20:25:36,689 - __main__ - INFO - Available RAM: 2.9 GB
2026-01-17 20:25:36,689 - __main__ - INFO - Memory used: 81.8%
2026-01-17 20:25:36,689 - __main__ - INFO - Memory status: OK
2026-01-17 20:25:36,690 - __main__ - INFO - Free disk space: 254.7 GB
2026-01-17 20:25:36,690 - __main__ - INFO - Disk used: 46.5%
2026-01-17 20:25:36,690 - __main__ - INFO - Disk space: OK
2026-01-17 20:25:37,191 - __main__ - INFO - CPU cores: 8
2026-01-17 20:25:37,191 - __main__ - INFO - CPU usage: 16.8%
2026-01-17 20:25:37,191 - __main__ - INFO - Python version: 3.12.4
2026-01-17 20:25:37,191 - __main__ - INFO - System platform: win32
2026-01-17 20:25:37,191 - __main__ - INFO - User session started at: 2026-01-17 20:25:37.191567
2026-01-17 20:25:37,191 - __main__ - INFO - Displaying main menu options to user
2026-01-17 20:25:38,569 - __main__ - INFO - User selected option: 2
2026-01-17 20:25:38,571 - __main__ - INFO - Starting Source-Target Comparison module
2026-01-17 20:25:38,575 - dq_comparison - INFO - STARTING UNIVERSAL SOURCE-TARGET COMPARISON TOOL
2026-01-17 20:25:38,575 - dq_comparison - INFO - LOADING SOURCE AND TARGET DATA
2026-01-17 20:25:38,575 - dq_comparison - INFO - 
==================================================
2026-01-17 20:25:38,575 - dq_comparison - INFO - 🔗 SOURCE DATA CONFIGURATION
2026-01-17 20:25:38,575 - dq_comparison - INFO - ==================================================
2026-01-17 20:25:39,511 - dq_comparison - INFO - 
🗄️ SOURCE DATABASE CONFIGURATION
2026-01-17 20:25:39,512 - dq_comparison - INFO - ----------------------------------------
2026-01-17 20:25:41,079 - dq_comparison - INFO - Selected database type code: mysql
2026-01-17 20:25:42,205 - dq_comparison - INFO - User selected Browse and Select mode for SOURCE
2026-01-17 20:25:42,209 - database_navigator - INFO - DatabaseNavigator initialized
2026-01-17 20:25:42,209 - database_navigator - INFO - Starting database navigation...
2026-01-17 20:25:42,209 - database_navigator - INFO - Database type: mysql
2026-01-17 20:25:42,210 - database_navigator - INFO - Getting database configuration...
2026-01-17 20:25:43,811 - database_navigator - INFO - Connecting to MYSQL...
2026-01-17 20:25:43,922 - database_navigator - INFO - Successfully connected to MYSQL!
2026-01-17 20:25:43,926 - database_navigator - INFO - get_databases() called. db_type: mysql, connection exists: True
2026-01-17 20:25:43,928 - database_navigator - INFO - Found 13 databases
2026-01-17 20:25:45,725 - database_navigator - INFO - Selected database: dq_checks
2026-01-17 20:25:45,729 - database_navigator - INFO - Found 1 schemas
2026-01-17 20:25:46,860 - database_navigator - INFO - Selected schema: dq_checks
2026-01-17 20:25:46,865 - database_navigator - INFO - Found 18 tables in schema 'dq_checks'
2026-01-17 20:25:50,515 - database_navigator - INFO - Selected table: comparison_small_source15
2026-01-17 20:25:50,522 - database_navigator - INFO - Selection complete: {'type': 'mysql', 'database': 'dq_checks', 'schema': 'dq_checks', 'table': 'comparison_small_source15', 'selection_mode': 'hierarchical', 'host': 'localhost', 'port': '3306', 'user': 'root', 'password': 'root'}
2026-01-17 20:25:50,523 - dq_comparison - INFO - Selected via navigation for SOURCE: dq_checks.dq_checks.comparison_small_source15
2026-01-17 20:25:50,523 - dq_unified - INFO - Loading data from DATABASE
2026-01-17 20:25:50,523 - dq_unified - INFO - Loading large database table: comparison_small_source15
2026-01-17 20:25:50,524 - dq_unified - INFO - Normalized DB config with schema: dq_checks
2026-01-17 20:25:50,533 - dq_unified - INFO - MySQL table comparison_small_source15 has 15 rows
2026-01-17 20:25:50,533 - dq_unified - INFO - Loading 15 rows from MySQL...
2026-01-17 20:25:50,926 - dq_unified - INFO - Loaded 15 rows from MySQL
2026-01-17 20:25:50,937 - dq_unified - INFO - Memory optimization: 0.0MB -> 0.0MB (Saved: 0.0MB)
2026-01-17 20:25:50,938 - dq_unified - INFO - Loaded 15 rows, 16 columns. Memory: 111.6MB total, 0.0MB for dataframe
2026-01-17 20:25:50,938 - dq_comparison - INFO - SOURCE database loaded: 15 rows, 16 columns
2026-01-17 20:25:50,939 - dq_comparison - INFO - 
==================================================
2026-01-17 20:25:50,939 - dq_comparison - INFO - 🔗 TARGET DATA CONFIGURATION
2026-01-17 20:25:50,939 - dq_comparison - INFO - ==================================================
2026-01-17 20:25:52,058 - dq_comparison - INFO - 
🗄️ TARGET DATABASE CONFIGURATION
2026-01-17 20:25:52,059 - dq_comparison - INFO - ----------------------------------------
2026-01-17 20:25:57,116 - dq_comparison - INFO - Selected database type code: postgresql
2026-01-17 20:25:59,050 - dq_comparison - INFO - User selected Browse and Select mode for TARGET
2026-01-17 20:25:59,056 - dq_comparison - INFO - Converted 'postgresql' to 'postgres' for database_navigator compatibility
2026-01-17 20:25:59,057 - database_navigator - INFO - DatabaseNavigator initialized
2026-01-17 20:25:59,057 - database_navigator - INFO - Starting database navigation...
2026-01-17 20:25:59,057 - database_navigator - INFO - Database type: postgres
2026-01-17 20:25:59,058 - database_navigator - INFO - Getting database configuration...
2026-01-17 20:26:01,294 - database_navigator - INFO - Connecting to POSTGRES...
2026-01-17 20:26:01,295 - database_navigator - INFO - Connecting to PostgreSQL...
2026-01-17 20:26:01,295 - database_navigator - INFO - Connecting to PostgreSQL: host=localhost, port=5432, database=postgres, user=postgres
2026-01-17 20:26:01,388 - database_navigator - INFO - Connection object created: <connection object at 0x000002D60486EAC0; dsn: 'user=postgres password=xxx dbname=postgres host=localhost port=5432', closed: 0>
2026-01-17 20:26:01,389 - database_navigator - INFO - ✅ PostgreSQL connection successful to database: postgres
2026-01-17 20:26:01,394 - database_navigator - INFO - get_databases() called. db_type: postgres, connection exists: True
2026-01-17 20:26:01,399 - database_navigator - INFO - Raw rows: [('dq_checks',), ('finewise-testdb',), ('postgres',)]
2026-01-17 20:26:01,399 - database_navigator - INFO - Found 3 databases
2026-01-17 20:26:02,698 - database_navigator - INFO - Selected database: dq_checks
2026-01-17 20:26:02,699 - database_navigator - INFO - Reconnecting to PostgreSQL database: dq_checks
2026-01-17 20:26:02,700 - database_navigator - INFO - Connecting to POSTGRES...
2026-01-17 20:26:02,702 - database_navigator - INFO - Connecting to PostgreSQL...
2026-01-17 20:26:02,702 - database_navigator - INFO - Connecting to PostgreSQL: host=localhost, port=5432, database=dq_checks, user=postgres
2026-01-17 20:26:02,813 - database_navigator - INFO - Connection object created: <connection object at 0x000002D60486E350; dsn: 'user=postgres password=xxx dbname=dq_checks host=localhost port=5432', closed: 0>
2026-01-17 20:26:02,813 - database_navigator - INFO - ✅ PostgreSQL connection successful to database: dq_checks
2026-01-17 20:26:02,832 - database_navigator - INFO - Found 4 schemas
2026-01-17 20:26:04,137 - database_navigator - INFO - Selected schema: public
2026-01-17 20:26:04,140 - database_navigator - INFO - Ensuring connection to database: dq_checks for table list
2026-01-17 20:26:04,140 - database_navigator - INFO - Reconnecting to PostgreSQL database: dq_checks
2026-01-17 20:26:04,140 - database_navigator - INFO - Connecting to POSTGRES...
2026-01-17 20:26:04,141 - database_navigator - INFO - Connecting to PostgreSQL...
2026-01-17 20:26:04,141 - database_navigator - INFO - Connecting to PostgreSQL: host=localhost, port=5432, database=dq_checks, user=postgres
2026-01-17 20:26:04,242 - database_navigator - INFO - Connection object created: <connection object at 0x000002D60486EBD0; dsn: 'user=postgres password=xxx dbname=dq_checks host=localhost port=5432', closed: 0>
2026-01-17 20:26:04,243 - database_navigator - INFO - ✅ PostgreSQL connection successful to database: dq_checks
2026-01-17 20:26:04,245 - database_navigator - INFO - Connected to database: dq_checks, schema: public
2026-01-17 20:26:04,266 - database_navigator - INFO - Found 5 tables in dq_checks.public: ['comparison_small_target13', 'customers', 'customers_bkp', 'employee', 'stg_transactions']
2026-01-17 20:26:04,266 - database_navigator - INFO - Found 5 tables in schema 'public'
2026-01-17 20:26:10,536 - database_navigator - INFO - Selected table: customers
2026-01-17 20:26:10,542 - database_navigator - INFO - Selection complete: {'type': 'postgresql', 'database': 'dq_checks', 'schema': 'public', 'table': 'customers', 'selection_mode': 'hierarchical', 'host': 'localhost', 'port': '5432', 'user': 'postgres', 'password': 'postgres'}
2026-01-17 20:26:10,542 - dq_comparison - INFO - Selected via navigation for TARGET: dq_checks.public.customers
2026-01-17 20:26:10,543 - dq_unified - INFO - Loading data from DATABASE
2026-01-17 20:26:10,543 - dq_unified - INFO - Loading large database table: customers
2026-01-17 20:26:10,543 - dq_unified - INFO - Normalized DB config with schema: public
2026-01-17 20:26:10,753 - dq_unified - INFO - PostgreSQL table public.customers has 15 rows
2026-01-17 20:26:10,754 - dq_unified - INFO - Loading 15 rows from PostgreSQL...
2026-01-17 20:26:10,757 - dq_unified - INFO - Loaded 15 rows from PostgreSQL
2026-01-17 20:26:10,760 - dq_unified - INFO - Memory optimization: 0.0MB -> 0.0MB (Saved: 0.0MB)
2026-01-17 20:26:10,761 - dq_unified - INFO - Loaded 15 rows, 10 columns. Memory: 112.2MB total, 0.0MB for dataframe
2026-01-17 20:26:10,761 - dq_comparison - INFO - TARGET database loaded: 15 rows, 10 columns
2026-01-17 20:26:10,762 - dq_comparison - INFO - SELECTING COLUMNS FOR COMPARISON
2026-01-17 20:26:10,762 - dq_comparison - INFO - Source columns (original): ['transaction_id', 'account_id', 'customer_id', 'transaction_date', 'posting_date', 'transaction_type', 'currency', 'amount', 'balance_after', 'status', 'merchant_name', 'merchant_category', 'country', 'reference_code', 'created_at', 'updated_at']
2026-01-17 20:26:10,763 - dq_comparison - INFO - Target columns (original): ['customername', 'email', 'phone', 'salary', 'department', 'joindate', 'postalcode', 'city', 'country', 'state']
2026-01-17 20:26:10,763 - dq_comparison - INFO - Common columns lowercased: ['country']
2026-01-17 20:26:10,763 - dq_comparison - INFO - Found 1 common columns between source and target (case-insensitive)
2026-01-17 20:26:10,764 - dq_comparison - INFO - 
📋 Common columns available for comparison:
2026-01-17 20:26:10,764 - dq_comparison - INFO -   1. country (Source) ↔ country (Target)
2026-01-17 20:26:14,777 - dq_comparison - INFO - User column selection input: all
2026-01-17 20:26:14,778 - dq_comparison - INFO - User selected ALL common columns for comparison
2026-01-17 20:26:14,779 - dq_comparison - INFO - GENERATING COMPREHENSIVE COMPARISON REPORT
2026-01-17 20:26:14,779 - dq_comparison - INFO - Report details - Source: Database: mysql - dq_checks.comparison_small_source15, Target: Database: postgresql - dq_checks.customers, Selected columns: 1
2026-01-17 20:26:14,781 - dq_comparison - INFO - Initializing Error Logger...
2026-01-17 20:26:14,781 - dq_error_log - INFO - ErrorLogger initialized with database: dq_checks
2026-01-17 20:26:14,792 - dq_error_log - INFO - Database connection successful
2026-01-17 20:26:14,793 - dq_comparison - INFO - Session ID: CMP_20260117_202614
2026-01-17 20:26:14,793 - dq_comparison - INFO - 
======================================================================
2026-01-17 20:26:14,793 - dq_comparison - INFO - 🔄 RUNNING SOURCE-TARGET COMPARISON WITH PERFECT NORMALIZATION
2026-01-17 20:26:14,794 - dq_comparison - INFO - ======================================================================
2026-01-17 20:26:14,794 - dq_comparison - INFO - Session ID: CMP_20260117_202614
2026-01-17 20:26:14,794 - dq_comparison - INFO - Source: Database: mysql - dq_checks.comparison_small_source15
2026-01-17 20:26:14,795 - dq_comparison - INFO - Target: Database: postgresql - dq_checks.customers
2026-01-17 20:26:14,795 - dq_comparison - INFO - Selected columns: 1
2026-01-17 20:26:14,795 - dq_comparison - INFO - ======================================================================
2026-01-17 20:26:14,795 - dq_comparison - INFO - 
1️⃣ FIRST: ROW COUNT CHECK
2026-01-17 20:26:14,795 - dq_comparison - INFO - ✅ Row counts match: 15 rows
2026-01-17 20:26:14,795 - dq_comparison - INFO - 
2️⃣ COLUMN STRUCTURE COMPARISON
2026-01-17 20:26:14,797 - dq_comparison - INFO - Comparing column structures...
2026-01-17 20:26:14,800 - dq_comparison - INFO - Column structure comparison complete. Match: False
2026-01-17 20:26:14,800 - dq_comparison - INFO - 
3️⃣ PRIMARY KEY VALIDATION
2026-01-17 20:26:14,801 - dq_comparison - INFO - Validating primary key/unique fields...
2026-01-17 20:26:14,801 - dq_comparison - INFO - Checking key fields: ['reference_code']
2026-01-17 20:26:14,801 - dq_comparison - WARNING - No key fields found in both datasets
2026-01-17 20:26:14,816 - dq_comparison - INFO -    No key fields specified or detected
2026-01-17 20:26:14,817 - dq_comparison - INFO -    Column names match: ❌
2026-01-17 20:26:14,817 - dq_comparison - INFO -    Column order match: ❌
2026-01-17 20:26:14,818 - dq_comparison - INFO -    Data types match: ✅
2026-01-17 20:26:14,818 - dq_comparison - WARNING -    Missing in target: ['transaction_id', 'account_id', 'customer_id', 'transaction_date', 'posting_date', 'transaction_type', 'currency', 'amount', 'balance_after', 'status', 'merchant_name', 'merchant_category', 'reference_code', 'created_at', 'updated_at']
2026-01-17 20:26:14,818 - dq_comparison - WARNING -    Missing in source: ['customername', 'email', 'phone', 'salary', 'department', 'joindate', 'postalcode', 'city', 'state']
2026-01-17 20:26:14,818 - dq_comparison - INFO - 
4️⃣ TABLE METADATA COMPARISON
2026-01-17 20:26:14,818 - dq_comparison - INFO - Comparing table-level metadata...
2026-01-17 20:26:14,823 - dq_comparison - INFO - Table metadata comparison complete. Match: False
2026-01-17 20:26:14,839 - dq_comparison - INFO -    Table metadata match: ❌
2026-01-17 20:26:14,839 - dq_comparison - INFO -    Source: 15 rows, 16 cols, 0.01 MB
2026-01-17 20:26:14,839 - dq_comparison - INFO -    Target: 15 rows, 10 cols, 0.01 MB
2026-01-17 20:26:14,840 - dq_comparison - WARNING -    Found 1 metadata differences:
2026-01-17 20:26:14,840 - dq_comparison - WARNING -      • Column Count: Source=16, Target=10
2026-01-17 20:26:14,841 - dq_comparison - INFO - 
5️⃣ HASH-BASED COMPARISON
2026-01-17 20:26:14,841 - dq_comparison - INFO - ℹ️  Note: All NULL values normalized to 'NULL'
2026-01-17 20:26:14,841 - dq_comparison - INFO - ℹ️  Note: Dates normalized to YYYY-MM-DD
2026-01-17 20:26:14,841 - dq_comparison - INFO - ℹ️  Note: Strings trimmed and case-normalized
2026-01-17 20:26:14,842 - dq_comparison - INFO - ℹ️  Note: Phone numbers stripped to digits only, leading zeros removed
2026-01-17 20:26:14,842 - dq_comparison - INFO - SECOND CHECK: HASH-BASED COMPARISON WITH PERFECT NORMALIZATION
2026-01-17 20:26:14,848 - dq_comparison - INFO - === DEBUG: DATA TYPE CHECK ===
2026-01-17 20:26:14,848 - dq_comparison - INFO - Column: country
2026-01-17 20:26:14,848 - dq_comparison - INFO -   Source type: <class 'str'>, value: IN
2026-01-17 20:26:14,849 - dq_comparison - INFO -   Target type: <class 'str'>, value: USA
2026-01-17 20:26:14,850 - dq_comparison - INFO -   Normalized: 'in' vs 'usa'
2026-01-17 20:26:14,850 - dq_comparison - INFO -   Match: False
2026-01-17 20:26:14,850 - dq_comparison - INFO - Source DF columns: ['transaction_id', 'account_id', 'customer_id', 'transaction_date', 'posting_date', 'transaction_type', 'currency', 'amount', 'balance_after', 'status', 'merchant_name', 'merchant_category', 'country', 'reference_code', 'created_at', 'updated_at']
2026-01-17 20:26:14,851 - dq_comparison - INFO - Target DF columns: ['customername', 'email', 'phone', 'salary', 'department', 'joindate', 'postalcode', 'city', 'country', 'state']
2026-01-17 20:26:14,851 - dq_comparison - INFO - Selected columns for comparison: ['country']
2026-01-17 20:26:14,851 - dq_comparison - INFO - Using 1 common columns for hash comparison
2026-01-17 20:26:14,852 - dq_comparison - INFO - Source columns: ['country']
2026-01-17 20:26:14,852 - dq_comparison - INFO - Target columns: ['country']
2026-01-17 20:26:14,852 - dq_comparison - INFO - Generating hashes for source data (15 rows)...
2026-01-17 20:26:14,855 - dq_comparison - INFO - === DEBUG: SOURCES SAMPLE HASHES ===
2026-01-17 20:26:14,855 - dq_comparison - INFO - Hash 1: 13b5bfe96f3e2fe411c9f66f4a582adf... (Source row 0)
2026-01-17 20:26:14,856 - dq_comparison - INFO - Hash 2: 0b3b97fa66886c5688ee4ae80ec0c3c2... (Source row 2)
2026-01-17 20:26:14,856 - dq_comparison - INFO - Hash 3: 5f02f0889301fd7be1ac972c11bf3e7d... (Source row 3)
2026-01-17 20:26:14,857 - dq_comparison - INFO - Generating hashes for target data (15 rows)...
2026-01-17 20:26:14,859 - dq_comparison - INFO - === DEBUG: TARGET SAMPLE HASHES ===
2026-01-17 20:26:14,861 - dq_comparison - INFO - Hash 1: ada53304c5b9e4a839615b6e8f908eb6... (Target row 0)
2026-01-17 20:26:14,862 - dq_comparison - INFO - 
======================================================================
2026-01-17 20:26:14,862 - dq_comparison - INFO - 🔍 DEBUG: ANALYZING WHY HASHES DON'T MATCH
2026-01-17 20:26:14,862 - dq_comparison - INFO - ======================================================================
2026-01-17 20:26:14,863 - dq_comparison - INFO - --- Analyzing Row 0 ---
2026-01-17 20:26:14,863 - dq_comparison - INFO - Column 'country' → 'country':
2026-01-17 20:26:14,864 - dq_comparison - INFO -   Source: 'IN' (type: str) → 'in'
2026-01-17 20:26:14,864 - dq_comparison - INFO -   Target: 'USA' (type: str) → 'usa'
2026-01-17 20:26:14,864 - dq_comparison - INFO -   Match after normalization: ❌ NO
2026-01-17 20:26:14,865 - dq_comparison - INFO - 
Hash components for Row 0:
2026-01-17 20:26:14,865 - dq_comparison - INFO - Source hash string start: in...
2026-01-17 20:26:14,865 - dq_comparison - INFO - Target hash string start: usa...
2026-01-17 20:26:14,866 - dq_comparison - INFO - Same? ❌ NO
2026-01-17 20:26:14,866 - dq_comparison - INFO - --- Analyzing Row 1 ---
2026-01-17 20:26:14,867 - dq_comparison - INFO - Column 'country' → 'country':
2026-01-17 20:26:14,867 - dq_comparison - INFO -   Source: 'IN' (type: str) → 'in'
2026-01-17 20:26:14,867 - dq_comparison - INFO -   Target: 'USA' (type: str) → 'usa'
2026-01-17 20:26:14,868 - dq_comparison - INFO -   Match after normalization: ❌ NO
2026-01-17 20:26:14,868 - dq_comparison - INFO - 
Hash components for Row 1:
2026-01-17 20:26:14,868 - dq_comparison - INFO - Source hash string start: in...
2026-01-17 20:26:14,868 - dq_comparison - INFO - Target hash string start: usa...
2026-01-17 20:26:14,868 - dq_comparison - INFO - Same? ❌ NO
2026-01-17 20:26:14,868 - dq_comparison - INFO - --- Analyzing Row 2 ---
2026-01-17 20:26:14,869 - dq_comparison - INFO - Column 'country' → 'country':
2026-01-17 20:26:14,869 - dq_comparison - INFO -   Source: 'US' (type: str) → 'us'
2026-01-17 20:26:14,870 - dq_comparison - INFO -   Target: 'USA' (type: str) → 'usa'
2026-01-17 20:26:14,870 - dq_comparison - INFO -   Match after normalization: ❌ NO
2026-01-17 20:26:14,870 - dq_comparison - INFO - 
Hash components for Row 2:
2026-01-17 20:26:14,870 - dq_comparison - INFO - Source hash string start: us...
2026-01-17 20:26:14,871 - dq_comparison - INFO - Target hash string start: usa...
2026-01-17 20:26:14,871 - dq_comparison - INFO - Same? ❌ NO
2026-01-17 20:26:14,871 - dq_comparison - INFO - 
--- Column Data Types Analysis ---
2026-01-17 20:26:14,872 - dq_comparison - INFO - Column 1: 'country' (category) ↔ 'country' (category)
2026-01-17 20:26:14,873 - dq_comparison - INFO -   Sample: Source='IN', Target='USA'
2026-01-17 20:26:14,873 - dq_comparison - INFO - PERFORMING DETAILED ROW-LEVEL COMPARISON WITH PAGINATION...
2026-01-17 20:26:14,874 - dq_comparison - INFO - Found 30 total mismatches
2026-01-17 20:26:14,877 - dq_comparison - INFO - Will process detailed comparisons for first 30 rows
2026-01-17 20:26:15,046 - dq_comparison - INFO - 
================================================================================
2026-01-17 20:26:15,046 - dq_comparison - INFO - DETAILED MISMATCH SUMMARY:
2026-01-17 20:26:15,047 - dq_comparison - INFO -   Total mismatches found: 15
2026-01-17 20:26:15,049 - dq_comparison - INFO -   Detailed comparisons logged: 15
2026-01-17 20:26:15,049 - dq_comparison - INFO -   First 10 rows displayed above
2026-01-17 20:26:15,049 - dq_comparison - INFO -   All mismatches stored in database with complete data
2026-01-17 20:26:15,050 - dq_comparison - INFO -   Use API to retrieve all 15 mismatches
2026-01-17 20:26:15,050 - dq_comparison - INFO - ================================================================================
2026-01-17 20:26:15,050 - dq_comparison - INFO - Hash-based Comparison Results (with duplicate handling):
2026-01-17 20:26:15,051 - dq_comparison - INFO -   • Unique source hashes: 3
2026-01-17 20:26:15,051 - dq_comparison - INFO -   • Unique target hashes: 1
2026-01-17 20:26:15,051 - dq_comparison - INFO -   • Common hashes: 0
2026-01-17 20:26:15,052 - dq_comparison - INFO -   • Common rows (counting duplicates): 0
2026-01-17 20:26:15,052 - dq_comparison - INFO -   • Rows only in source (counting duplicates): 15
2026-01-17 20:26:15,053 - dq_comparison - INFO -   • Rows only in target (counting duplicates): 15
2026-01-17 20:26:15,054 - dq_comparison - INFO - HASH-ONLY COMPARISON COMPLETED
2026-01-17 20:26:15,054 - dq_comparison - INFO - Returning counts for simple scoring:
2026-01-17 20:26:15,054 - dq_comparison - INFO -   Common rows: 0
2026-01-17 20:26:15,054 - dq_comparison - INFO -   Unique to source: 15
2026-01-17 20:26:15,055 - dq_comparison - INFO -   Unique to target: 15
2026-01-17 20:26:15,055 - dq_comparison - INFO -   Value mismatches: 30
2026-01-17 20:26:15,055 - dq_comparison - INFO -   Missing rows: 15
2026-01-17 20:26:15,055 - dq_comparison - INFO -   Extra rows: 15
2026-01-17 20:26:15,056 - dq_comparison - INFO - 
========================================================================================================================
COMPARISON: Mysql Database vs Postgresql Database
========================================================================================================================
Row   | Diff Count | Source (Sample)                          | Target (Sample)                         
------------------------------------------------------------------------------------------------------------------------
2     | 1          | country: IN                              | country: USA                            
3     | 1          | country: IN                              | country: USA                            
6     | 1          | country: IN                              | country: USA                            
7     | 1          | country: IN                              | country: USA                            
12    | 1          | country: IN                              | country: USA                            
15    | 1          | country: IN                              | country: USA                            
4     | 1          | country: US                              | country: USA                            
10    | 1          | country: US                              | country: USA                            
13    | 1          | country: US                              | country: USA                            
14    | 1          | country: US                              | country: USA                            
------------------------------------------------------------------------------------------------------------------------
Showing 1-10 of 15 mismatched rows. Use API for complete data.
========================================================================================================================
2026-01-17 20:26:15,056 - dq_comparison - INFO - Returning enhanced mismatch structure with 15 detailed mismatches
2026-01-17 20:26:15,056 - dq_comparison - INFO - New structure: 15 detailed mismatches
2026-01-17 20:26:15,057 - dq_comparison - INFO - 
6️⃣ DATA QUALITY ANALYSIS
2026-01-17 20:26:15,057 - dq_comparison - INFO - Analyzing data quality metrics...
2026-01-17 20:26:15,061 - dq_comparison - INFO - Null values - Source: 0 (0.00%), Target: 0 (0.00%)
2026-01-17 20:26:15,064 - dq_comparison - INFO - Duplicate rows (normalized) - Source: 12, Target: 14
2026-01-17 20:26:15,065 - dq_comparison - INFO - Source duplicate samples: ['Row 2', 'Row 3', 'Row 4']
2026-01-17 20:26:15,065 - dq_comparison - INFO - Target duplicate samples: ['Row 2', 'Row 3', 'Row 4']
2026-01-17 20:26:15,088 - dq_error_log - INFO - Retrieved 18 error logs for session CMP_20260117_202614
2026-01-17 20:26:15,089 - dq_comparison - INFO - 
📊 SIMPLE SCORING CALCULATION:
2026-01-17 20:26:15,089 - dq_comparison - INFO -   Source rows: 15
2026-01-17 20:26:15,089 - dq_comparison - INFO -   Common rows (matched): 0
2026-01-17 20:26:15,090 - dq_comparison - INFO -   Calculation: (0 / 15) * 100 = 0.00%
2026-01-17 20:26:15,090 - dq_comparison - INFO -   Explanation: 0 matched rows out of 15 total source rows
2026-01-17 20:26:15,090 - dq_comparison - INFO - 
=== AUDIT LOGGING SECTION ===
2026-01-17 20:26:15,094 - dq_comparison - INFO - 🔍 Audit logging is ENABLED in APP_SETTINGS
2026-01-17 20:26:15,094 - dq_audit - INFO - Audit class initialized with database: dq_checks
2026-01-17 20:26:15,095 - dq_comparison - INFO - Attempting to log audit record for session: CMP_20260117_202614
2026-01-17 20:26:15,095 - dq_audit - INFO - Starting database insertion for comparison...
2026-01-17 20:26:15,107 - dq_audit - INFO - Inserted comparison record with ID: 764
2026-01-17 20:26:15,108 - dq_comparison - INFO - ✅ Audit record logged successfully (ID: 764)
2026-01-17 20:26:15,108 - dq_comparison - INFO - 
======================================================================
2026-01-17 20:26:15,109 - dq_comparison - INFO - 📊 COMPARISON RESULTS SUMMARY
2026-01-17 20:26:15,110 - dq_comparison - INFO - ======================================================================
2026-01-17 20:26:15,110 - dq_comparison - INFO - Session ID: CMP_20260117_202614
2026-01-17 20:26:15,110 - dq_comparison - INFO - Source: Database: mysql - dq_checks.comparison_small_source15 (15 rows)
2026-01-17 20:26:15,111 - dq_comparison - INFO - Target: Database: postgresql - dq_checks.customers (15 rows)
2026-01-17 20:26:15,111 - dq_comparison - INFO - Selected columns: 1
2026-01-17 20:26:15,111 - dq_comparison - INFO - ----------------------------------------------------------------------
2026-01-17 20:26:15,112 - dq_comparison - INFO - 1️⃣ Row count match: ✅ Yes
2026-01-17 20:26:15,112 - dq_comparison - INFO - 2️⃣ Column structure match: ❌ No
2026-01-17 20:26:15,112 - dq_comparison - INFO -    Missing in target: 15 columns
2026-01-17 20:26:15,112 - dq_comparison - INFO -      ['transaction_id', 'account_id', 'customer_id', 'transaction_date', 'posting_date']
2026-01-17 20:26:15,113 - dq_comparison - INFO -    Missing in source: 9 columns
2026-01-17 20:26:15,113 - dq_comparison - INFO -      ['customername', 'email', 'phone', 'salary', 'department']
2026-01-17 20:26:15,113 - dq_comparison - INFO - 3️ Primary key validation: ❌ Failed
2026-01-17 20:26:15,114 - dq_comparison - INFO - 4️ Table metadata: ❌ Mismatch
2026-01-17 20:26:15,114 - dq_comparison - INFO -    • Column Count: 16 vs 10
2026-01-17 20:26:15,114 - dq_comparison - INFO - 5️⃣ Common rows (both Mysql Database and Postgresql Database): 0 (0.00% of Mysql Database)
2026-01-17 20:26:15,114 - dq_comparison - INFO - 6️⃣ Mysql Database-only rows: 15 (present ONLY in Mysql Database, NOT in Postgresql Database)
2026-01-17 20:26:15,115 - dq_comparison - INFO - 7️⃣ Postgresql Database-only rows: 15 (present ONLY in Postgresql Database, NOT in Mysql Database)
2026-01-17 20:26:15,115 - dq_comparison - INFO - 8️⃣ Column value mismatches: 0
2026-01-17 20:26:15,115 - dq_comparison - INFO - 9️ Data quality match: ❌ No
2026-01-17 20:26:15,116 - dq_comparison - INFO - 📈 DQ Score: 0.00%
2026-01-17 20:26:15,116 - dq_comparison - INFO - 📊 Calculation: (0 / 15) * 100 = 0.00%
2026-01-17 20:26:15,116 - dq_comparison - INFO - ======================================================================
2026-01-17 20:26:15,116 - dq_comparison - INFO - 
❌ LOW MATCH! Major differences found.
2026-01-17 20:26:15,116 - dq_comparison - INFO - 
🔍 NORMALIZATION APPLIED:
2026-01-17 20:26:15,117 - dq_comparison - INFO -    • NULL values → 'NULL' (consistent representation)
2026-01-17 20:26:15,117 - dq_comparison - INFO -    • Dates → YYYY-MM-DD format
2026-01-17 20:26:15,117 - dq_comparison - INFO -    • Strings → trimmed + lowercase
2026-01-17 20:26:15,117 - dq_comparison - INFO -    • Numeric values → standardized format
2026-01-17 20:26:15,118 - dq_comparison - INFO -    • Phone numbers → digits only, ALL leading zeros removed
2026-01-17 20:26:15,118 - dq_comparison - INFO -    • Extra whitespace removed
2026-01-17 20:26:15,118 - dq_comparison - INFO - 
🔍 DETAILED ERROR ANALYSIS:
2026-01-17 20:26:15,118 - dq_comparison - INFO - --------------------------------------------------
2026-01-17 20:26:15,118 - dq_comparison - INFO - 📊 SOURCE-ONLY ROWS: 15 rows
2026-01-17 20:26:15,119 - dq_comparison - INFO -    Present only in Mysql Database, missing from Postgresql Database
2026-01-17 20:26:15,119 - dq_comparison - INFO - 📊 TARGET-ONLY ROWS: 15 rows
2026-01-17 20:26:15,119 - dq_comparison - INFO -    Present only in Postgresql Database, extra (not in Mysql Database)
2026-01-17 20:26:15,130 - dq_error_log - INFO - Retrieved 10 errors for session CMP_20260117_202614
2026-01-17 20:26:15,131 - dq_comparison - INFO - 
📋 SAMPLE ERRORS (10 found):
2026-01-17 20:26:15,131 - dq_comparison - INFO - 
1. Row 0 - Metadata Column Count
2026-01-17 20:26:15,132 - dq_comparison - INFO -    Column: 
2026-01-17 20:26:15,132 - dq_comparison - INFO -    Metadata mismatch: Column Count
2026-01-17 20:26:15,132 - dq_comparison - INFO - 
2. Row 0 - Duplicate Count Mismatch
2026-01-17 20:26:15,133 - dq_comparison - INFO -    Column: 
2026-01-17 20:26:15,133 - dq_comparison - INFO -    Duplicate count mismatch (normalized). Source=12, Target=14
2026-01-17 20:26:15,133 - dq_comparison - INFO - 
3. Row 0 - Key Field Missing
2026-01-17 20:26:15,133 - dq_comparison - INFO -    Column: reference_code
2026-01-17 20:26:15,134 - dq_comparison - INFO -    Primary key field 'reference_code' missing in one or both datasets
2026-01-17 20:26:15,134 - dq_comparison - INFO - 
💡 For complete error details, run:
2026-01-17 20:26:15,134 - dq_comparison - INFO -    USE dq_checks;
2026-01-17 20:26:15,134 - dq_comparison - INFO -    SELECT excel_row, column_name, error_type, error_description,
2026-01-17 20:26:15,135 - dq_comparison - INFO -           actual_value, expected_value
2026-01-17 20:26:15,135 - dq_comparison - INFO -    FROM dq_error_logs
2026-01-17 20:26:15,135 - dq_comparison - INFO -    WHERE session_id = 'CMP_20260117_202614'
2026-01-17 20:26:15,136 - dq_comparison - INFO -    ORDER BY excel_row, column_name;
2026-01-17 20:26:15,148 - dq_comparison - INFO - 
✅ Comparison completed! Session ID: CMP_20260117_202614
2026-01-17 20:26:15,160 - dq_error_log - INFO - Retrieved 19 error logs for session CMP_20260117_202614
2026-01-17 20:26:15,175 - dq_error_log - INFO - Retrieved summary: 19 total errors for session CMP_20260117_202614
2026-01-17 20:26:15,175 - dq_audit - INFO - Audit class initialized with database: dq_checks
2026-01-17 20:26:15,192 - dq_audit - INFO - Retrieved 1 audit logs for session CMP_20260117_202614
2026-01-17 20:26:15,193 - dq_comparison - INFO - 
🔍 Final results verification:
2026-01-17 20:26:15,193 - dq_comparison - INFO -    Session ID: CMP_20260117_202614
2026-01-17 20:26:15,194 - dq_comparison - INFO -    DQ Score (Simple %): 0.00%
2026-01-17 20:26:15,194 - dq_comparison - INFO -    Source rows: 15
2026-01-17 20:26:15,194 - dq_comparison - INFO -    Matched rows: 0
2026-01-17 20:26:15,195 - dq_comparison - INFO -    Calculation: (0 / 15) * 100
2026-01-17 20:26:15,195 - __main__ - INFO - Source-Target Comparison completed successfully
2026-01-17 20:26:15,196 - __main__ - INFO - Displaying main menu options to user
2026-01-17 20:26:38,852 - __main__ - INFO - User selected option: 6
2026-01-17 20:26:38,856 - __main__ - INFO - User session ended. Duration: 0:01:01.665152
2026-01-17 20:26:38,857 - __main__ - INFO - 👋 Thank you for using Universal Data Quality Framework!
