2026-01-17 17:21:38,642 - root - INFO - CLI Mode Logging Initialized
2026-01-17 17:21:38,643 - root - INFO - CLI logs will be saved to: logs/dq_framework_20260117_172138.log
2026-01-17 17:21:38,643 - __main__ - INFO - 🚀 UNIVERSAL DATA QUALITY FRAMEWORK INITIALIZED
2026-01-17 17:21:38,645 - __main__ - INFO - Starting system resource check
2026-01-17 17:21:38,652 - __main__ - INFO - Total RAM: 15.7 GB
2026-01-17 17:21:38,652 - __main__ - INFO - Available RAM: 3.0 GB
2026-01-17 17:21:38,653 - __main__ - INFO - Memory used: 81.0%
2026-01-17 17:21:38,653 - __main__ - INFO - Memory status: OK
2026-01-17 17:21:38,653 - __main__ - INFO - Free disk space: 253.7 GB
2026-01-17 17:21:38,654 - __main__ - INFO - Disk used: 46.7%
2026-01-17 17:21:38,654 - __main__ - INFO - Disk space: OK
2026-01-17 17:21:39,155 - __main__ - INFO - CPU cores: 8
2026-01-17 17:21:39,155 - __main__ - INFO - CPU usage: 57.2%
2026-01-17 17:21:39,155 - __main__ - INFO - Python version: 3.12.4
2026-01-17 17:21:39,155 - __main__ - INFO - System platform: win32
2026-01-17 17:21:39,156 - __main__ - INFO - User session started at: 2026-01-17 17:21:39.156065
2026-01-17 17:21:39,156 - __main__ - INFO - Displaying main menu options to user
2026-01-17 17:21:42,421 - __main__ - INFO - User selected option: 2
2026-01-17 17:21:42,424 - __main__ - INFO - Starting Source-Target Comparison module
2026-01-17 17:21:42,432 - dq_comparison - INFO - STARTING UNIVERSAL SOURCE-TARGET COMPARISON TOOL
2026-01-17 17:21:42,432 - dq_comparison - INFO - LOADING SOURCE AND TARGET DATA
2026-01-17 17:21:42,433 - dq_comparison - INFO - 
==================================================
2026-01-17 17:21:42,434 - dq_comparison - INFO - 🔗 SOURCE DATA CONFIGURATION
2026-01-17 17:21:42,438 - dq_comparison - INFO - ==================================================
2026-01-17 17:21:43,872 - dq_comparison - INFO - 
🗄️ SOURCE DATABASE CONFIGURATION
2026-01-17 17:21:43,873 - dq_comparison - INFO - ----------------------------------------
2026-01-17 17:21:45,251 - dq_comparison - INFO - Selected database type code: mysql
2026-01-17 17:21:46,660 - dq_comparison - INFO - User selected Browse and Select mode for SOURCE
2026-01-17 17:21:46,670 - database_navigator - INFO - DatabaseNavigator initialized
2026-01-17 17:21:46,670 - database_navigator - INFO - Starting database navigation...
2026-01-17 17:21:46,672 - database_navigator - INFO - Database type: mysql
2026-01-17 17:21:46,672 - database_navigator - INFO - Getting database configuration...
2026-01-17 17:21:52,059 - database_navigator - INFO - Connecting to MYSQL...
2026-01-17 17:21:52,452 - database_navigator - INFO - Successfully connected to MYSQL!
2026-01-17 17:21:52,459 - database_navigator - INFO - get_databases() called. db_type: mysql, connection exists: True
2026-01-17 17:21:52,484 - database_navigator - INFO - Found 13 databases
2026-01-17 17:21:54,554 - database_navigator - INFO - Selected database: dq_checks
2026-01-17 17:21:54,557 - database_navigator - INFO - Found 1 schemas
2026-01-17 17:21:55,814 - database_navigator - INFO - Selected schema: dq_checks
2026-01-17 17:21:55,836 - database_navigator - INFO - Found 18 tables in schema 'dq_checks'
2026-01-17 17:21:59,638 - database_navigator - INFO - Selected table: comparison_small_source15
2026-01-17 17:21:59,647 - database_navigator - INFO - Selection complete: {'type': 'mysql', 'database': 'dq_checks', 'schema': 'dq_checks', 'table': 'comparison_small_source15', 'selection_mode': 'hierarchical', 'host': 'localhost', 'port': '3306', 'user': 'root', 'password': 'root'}
2026-01-17 17:21:59,649 - dq_comparison - INFO - Selected via navigation for SOURCE: dq_checks.dq_checks.comparison_small_source15
2026-01-17 17:21:59,649 - dq_unified - INFO - Loading data from DATABASE
2026-01-17 17:21:59,650 - dq_unified - INFO - Loading large database table: comparison_small_source15
2026-01-17 17:21:59,651 - dq_unified - INFO - Normalized DB config with schema: dq_checks
2026-01-17 17:21:59,667 - dq_unified - INFO - MySQL table comparison_small_source15 has 15 rows
2026-01-17 17:21:59,668 - dq_unified - INFO - Loading 15 rows from MySQL...
2026-01-17 17:22:01,152 - dq_unified - INFO - Loaded 15 rows from MySQL
2026-01-17 17:22:01,169 - dq_unified - INFO - Memory optimization: 0.0MB -> 0.0MB (Saved: 0.0MB)
2026-01-17 17:22:01,170 - dq_unified - INFO - Loaded 15 rows, 16 columns. Memory: 111.4MB total, 0.0MB for dataframe
2026-01-17 17:22:01,171 - dq_comparison - INFO - SOURCE database loaded: 15 rows, 16 columns
2026-01-17 17:22:01,172 - dq_comparison - INFO - 
==================================================
2026-01-17 17:22:01,172 - dq_comparison - INFO - 🔗 TARGET DATA CONFIGURATION
2026-01-17 17:22:01,173 - dq_comparison - INFO - ==================================================
2026-01-17 17:22:03,799 - dq_comparison - INFO - 
🗄️ TARGET DATABASE CONFIGURATION
2026-01-17 17:22:03,800 - dq_comparison - INFO - ----------------------------------------
2026-01-17 17:22:05,575 - dq_comparison - INFO - Selected database type code: postgresql
2026-01-17 17:22:06,959 - dq_comparison - INFO - User selected Browse and Select mode for TARGET
2026-01-17 17:22:06,969 - dq_comparison - INFO - Converted 'postgresql' to 'postgres' for database_navigator compatibility
2026-01-17 17:22:06,970 - database_navigator - INFO - DatabaseNavigator initialized
2026-01-17 17:22:06,971 - database_navigator - INFO - Starting database navigation...
2026-01-17 17:22:06,971 - database_navigator - INFO - Database type: postgres
2026-01-17 17:22:06,972 - database_navigator - INFO - Getting database configuration...
2026-01-17 17:22:09,598 - database_navigator - INFO - Connecting to POSTGRES...
2026-01-17 17:22:09,601 - database_navigator - INFO - Connecting to PostgreSQL...
2026-01-17 17:22:09,601 - database_navigator - INFO - Connecting to PostgreSQL: host=localhost, port=5432, database=postgres, user=postgres
2026-01-17 17:22:09,798 - database_navigator - INFO - Connection object created: <connection object at 0x00000258D50CEAC0; dsn: 'user=postgres password=xxx dbname=postgres host=localhost port=5432', closed: 0>
2026-01-17 17:22:09,799 - database_navigator - INFO - ✅ PostgreSQL connection successful to database: postgres
2026-01-17 17:22:09,808 - database_navigator - INFO - get_databases() called. db_type: postgres, connection exists: True
2026-01-17 17:22:09,840 - database_navigator - INFO - Raw rows: [('dq_checks',), ('finewise-testdb',), ('postgres',)]
2026-01-17 17:22:09,841 - database_navigator - INFO - Found 3 databases
2026-01-17 17:22:11,384 - database_navigator - INFO - Selected database: dq_checks
2026-01-17 17:22:11,387 - database_navigator - INFO - Reconnecting to PostgreSQL database: dq_checks
2026-01-17 17:22:11,388 - database_navigator - INFO - Connecting to POSTGRES...
2026-01-17 17:22:11,391 - database_navigator - INFO - Connecting to PostgreSQL...
2026-01-17 17:22:11,392 - database_navigator - INFO - Connecting to PostgreSQL: host=localhost, port=5432, database=dq_checks, user=postgres
2026-01-17 17:22:11,555 - database_navigator - INFO - Connection object created: <connection object at 0x00000258D50CE350; dsn: 'user=postgres password=xxx dbname=dq_checks host=localhost port=5432', closed: 0>
2026-01-17 17:22:11,555 - database_navigator - INFO - ✅ PostgreSQL connection successful to database: dq_checks
2026-01-17 17:22:11,621 - database_navigator - INFO - Found 4 schemas
2026-01-17 17:22:14,287 - database_navigator - INFO - Selected schema: public
2026-01-17 17:22:14,291 - database_navigator - INFO - Ensuring connection to database: dq_checks for table list
2026-01-17 17:22:14,292 - database_navigator - INFO - Reconnecting to PostgreSQL database: dq_checks
2026-01-17 17:22:14,292 - database_navigator - INFO - Connecting to POSTGRES...
2026-01-17 17:22:14,293 - database_navigator - INFO - Connecting to PostgreSQL...
2026-01-17 17:22:14,293 - database_navigator - INFO - Connecting to PostgreSQL: host=localhost, port=5432, database=dq_checks, user=postgres
2026-01-17 17:22:14,484 - database_navigator - INFO - Connection object created: <connection object at 0x00000258D50CEBD0; dsn: 'user=postgres password=xxx dbname=dq_checks host=localhost port=5432', closed: 0>
2026-01-17 17:22:14,485 - database_navigator - INFO - ✅ PostgreSQL connection successful to database: dq_checks
2026-01-17 17:22:14,487 - database_navigator - INFO - Connected to database: dq_checks, schema: public
2026-01-17 17:22:14,576 - database_navigator - INFO - Found 5 tables in dq_checks.public: ['comparison_small_target13', 'customers', 'customers_bkp', 'employee', 'stg_transactions']
2026-01-17 17:22:14,577 - database_navigator - INFO - Found 5 tables in schema 'public'
2026-01-17 17:22:17,007 - database_navigator - INFO - Selected table: comparison_small_target13
2026-01-17 17:22:17,017 - database_navigator - INFO - Selection complete: {'type': 'postgresql', 'database': 'dq_checks', 'schema': 'public', 'table': 'comparison_small_target13', 'selection_mode': 'hierarchical', 'host': 'localhost', 'port': '5432', 'user': 'postgres', 'password': 'postgres'}
2026-01-17 17:22:17,018 - dq_comparison - INFO - Selected via navigation for TARGET: dq_checks.public.comparison_small_target13
2026-01-17 17:22:17,019 - dq_unified - INFO - Loading data from DATABASE
2026-01-17 17:22:17,020 - dq_unified - INFO - Loading large database table: comparison_small_target13
2026-01-17 17:22:17,020 - dq_unified - INFO - Normalized DB config with schema: public
2026-01-17 17:22:17,214 - dq_unified - INFO - PostgreSQL table public.comparison_small_target13 has 13 rows
2026-01-17 17:22:17,214 - dq_unified - INFO - Loading 13 rows from PostgreSQL...
2026-01-17 17:22:17,221 - dq_unified - INFO - Loaded 13 rows from PostgreSQL
2026-01-17 17:22:17,229 - dq_unified - INFO - Memory optimization: 0.0MB -> 0.0MB (Saved: 0.0MB)
2026-01-17 17:22:17,233 - dq_unified - INFO - Loaded 13 rows, 16 columns. Memory: 112.1MB total, 0.0MB for dataframe
2026-01-17 17:22:17,233 - dq_comparison - INFO - TARGET database loaded: 13 rows, 16 columns
2026-01-17 17:22:17,236 - dq_comparison - INFO - SELECTING COLUMNS FOR COMPARISON
2026-01-17 17:22:17,237 - dq_comparison - INFO - Source columns (original): ['transaction_id', 'account_id', 'customer_id', 'transaction_date', 'posting_date', 'transaction_type', 'currency', 'amount', 'balance_after', 'status', 'merchant_name', 'merchant_category', 'country', 'reference_code', 'created_at', 'updated_at']
2026-01-17 17:22:17,238 - dq_comparison - INFO - Target columns (original): ['transaction_id', 'account_id', 'customer_id', 'transaction_date', 'posting_date', 'transaction_type', 'currency', 'amount', 'balance_after', 'status', 'merchant_name', 'merchant_category', 'country', 'reference_code', 'created_at', 'updated_at']
2026-01-17 17:22:17,238 - dq_comparison - INFO - Common columns lowercased: ['reference_code', 'account_id', 'customer_id', 'created_at', 'amount', 'posting_date', 'status', 'country', 'merchant_category', 'transaction_date', 'balance_after', 'merchant_name', 'updated_at', 'transaction_type', 'currency', 'transaction_id']
2026-01-17 17:22:17,239 - dq_comparison - INFO - Found 16 common columns between source and target (case-insensitive)
2026-01-17 17:22:17,240 - dq_comparison - INFO - 
📋 Common columns available for comparison:
2026-01-17 17:22:17,241 - dq_comparison - INFO -   1. reference_code (Source) ↔ reference_code (Target)
2026-01-17 17:22:17,241 - dq_comparison - INFO -   2. account_id (Source) ↔ account_id (Target)
2026-01-17 17:22:17,242 - dq_comparison - INFO -   3. customer_id (Source) ↔ customer_id (Target)
2026-01-17 17:22:17,242 - dq_comparison - INFO -   4. created_at (Source) ↔ created_at (Target)
2026-01-17 17:22:17,243 - dq_comparison - INFO -   5. amount (Source) ↔ amount (Target)
2026-01-17 17:22:17,244 - dq_comparison - INFO -   6. posting_date (Source) ↔ posting_date (Target)
2026-01-17 17:22:17,244 - dq_comparison - INFO -   7. status (Source) ↔ status (Target)
2026-01-17 17:22:17,245 - dq_comparison - INFO -   8. country (Source) ↔ country (Target)
2026-01-17 17:22:17,246 - dq_comparison - INFO -   9. merchant_category (Source) ↔ merchant_category (Target)
2026-01-17 17:22:17,253 - dq_comparison - INFO -   10. transaction_date (Source) ↔ transaction_date (Target)
2026-01-17 17:22:17,254 - dq_comparison - INFO -   11. balance_after (Source) ↔ balance_after (Target)
2026-01-17 17:22:17,255 - dq_comparison - INFO -   12. merchant_name (Source) ↔ merchant_name (Target)
2026-01-17 17:22:17,255 - dq_comparison - INFO -   13. updated_at (Source) ↔ updated_at (Target)
2026-01-17 17:22:17,256 - dq_comparison - INFO -   14. transaction_type (Source) ↔ transaction_type (Target)
2026-01-17 17:22:17,257 - dq_comparison - INFO -   15. currency (Source) ↔ currency (Target)
2026-01-17 17:22:17,257 - dq_comparison - INFO -   16. transaction_id (Source) ↔ transaction_id (Target)
2026-01-17 17:22:18,812 - dq_comparison - INFO - User column selection input: all
2026-01-17 17:22:18,813 - dq_comparison - INFO - User selected ALL common columns for comparison
2026-01-17 17:22:18,814 - dq_comparison - INFO - GENERATING COMPREHENSIVE COMPARISON REPORT
2026-01-17 17:22:18,816 - dq_comparison - INFO - Report details - Source: Database: mysql - dq_checks.comparison_small_source15, Target: Database: postgresql - dq_checks.comparison_small_target13, Selected columns: 16
2026-01-17 17:22:18,817 - dq_comparison - INFO - Initializing Error Logger...
2026-01-17 17:22:18,817 - dq_error_log - INFO - ErrorLogger initialized with database: dq_checks
2026-01-17 17:22:18,839 - dq_error_log - INFO - Database connection successful
2026-01-17 17:22:18,840 - dq_comparison - INFO - Session ID: CMP_20260117_172218
2026-01-17 17:22:18,840 - dq_comparison - INFO - 
======================================================================
2026-01-17 17:22:18,842 - dq_comparison - INFO - 🔄 RUNNING SOURCE-TARGET COMPARISON WITH PERFECT NORMALIZATION
2026-01-17 17:22:18,842 - dq_comparison - INFO - ======================================================================
2026-01-17 17:22:18,843 - dq_comparison - INFO - Session ID: CMP_20260117_172218
2026-01-17 17:22:18,843 - dq_comparison - INFO - Source: Database: mysql - dq_checks.comparison_small_source15
2026-01-17 17:22:18,844 - dq_comparison - INFO - Target: Database: postgresql - dq_checks.comparison_small_target13
2026-01-17 17:22:18,845 - dq_comparison - INFO - Selected columns: 16
2026-01-17 17:22:18,845 - dq_comparison - INFO - ======================================================================
2026-01-17 17:22:18,845 - dq_comparison - INFO - 
1️⃣ FIRST: ROW COUNT CHECK
2026-01-17 17:22:18,846 - dq_comparison - WARNING - ❌ Row count mismatch: Source=15, Target=13, Difference=2
2026-01-17 17:22:18,846 - dq_comparison - WARNING -    Missing in target: 2 rows
2026-01-17 17:22:18,847 - dq_comparison - INFO - 
2️⃣ COLUMN STRUCTURE COMPARISON
2026-01-17 17:22:18,848 - dq_comparison - INFO - Comparing column structures...
2026-01-17 17:22:18,848 - dq_comparison - INFO - Column structure comparison complete. Match: True
2026-01-17 17:22:18,849 - dq_comparison - INFO - 
3️⃣ PRIMARY KEY VALIDATION
2026-01-17 17:22:18,854 - dq_comparison - INFO - Validating primary key/unique fields...
2026-01-17 17:22:18,855 - dq_comparison - INFO - Checking key fields: ['transaction_id', 'customer_id', 'reference_code']
2026-01-17 17:22:18,858 - dq_comparison - WARNING - Field 'customer_id' has duplicates in source: 15 rows
2026-01-17 17:22:18,859 - dq_comparison - WARNING - Field 'customer_id' has duplicates in target: 13 rows
2026-01-17 17:22:18,861 - dq_comparison - INFO - Primary key validation complete. Passed: False
2026-01-17 17:22:18,912 - dq_comparison - INFO -    Key fields found: ['transaction_id', 'customer_id', 'reference_code']
2026-01-17 17:22:18,912 - dq_comparison - INFO -    Unique in source: ❌
2026-01-17 17:22:18,914 - dq_comparison - INFO -    Unique in target: ❌
2026-01-17 17:22:18,917 - dq_comparison - INFO -    Validation passed: ❌
2026-01-17 17:22:18,918 - dq_comparison - WARNING -    Source duplicates in 'customer_id': 15 rows
2026-01-17 17:22:18,919 - dq_comparison - WARNING -      Sample values: ['CUST9001']
2026-01-17 17:22:18,919 - dq_comparison - WARNING -    Target duplicates in 'customer_id': 13 rows
2026-01-17 17:22:18,920 - dq_comparison - WARNING -      Sample values: ['CUST9001']
2026-01-17 17:22:18,921 - dq_comparison - INFO -    Column names match: ✅
2026-01-17 17:22:18,921 - dq_comparison - INFO -    Column order match: ✅
2026-01-17 17:22:18,922 - dq_comparison - INFO -    Data types match: ✅
2026-01-17 17:22:18,922 - dq_comparison - INFO - 
4️⃣ TABLE METADATA COMPARISON
2026-01-17 17:22:18,923 - dq_comparison - INFO - Comparing table-level metadata...
2026-01-17 17:22:18,939 - dq_comparison - INFO - Table metadata comparison complete. Match: False
2026-01-17 17:22:18,963 - dq_comparison - INFO -    Table metadata match: ❌
2026-01-17 17:22:18,963 - dq_comparison - INFO -    Source: 15 rows, 16 cols, 0.01 MB
2026-01-17 17:22:18,965 - dq_comparison - INFO -    Target: 13 rows, 16 cols, 0.0 MB
2026-01-17 17:22:18,969 - dq_comparison - WARNING -    Found 1 metadata differences:
2026-01-17 17:22:18,969 - dq_comparison - WARNING -      • Row Count: Source=15, Target=13
2026-01-17 17:22:18,970 - dq_comparison - INFO - 
5️⃣ HASH-BASED COMPARISON
2026-01-17 17:22:18,971 - dq_comparison - INFO - ℹ️  Note: All NULL values normalized to 'NULL'
2026-01-17 17:22:18,972 - dq_comparison - INFO - ℹ️  Note: Dates normalized to YYYY-MM-DD
2026-01-17 17:22:18,972 - dq_comparison - INFO - ℹ️  Note: Strings trimmed and case-normalized
2026-01-17 17:22:18,973 - dq_comparison - INFO - ℹ️  Note: Phone numbers stripped to digits only, leading zeros removed
2026-01-17 17:22:18,974 - dq_comparison - INFO - SECOND CHECK: HASH-BASED COMPARISON WITH PERFECT NORMALIZATION
2026-01-17 17:22:18,985 - dq_comparison - INFO - === DEBUG: DATA TYPE CHECK ===
2026-01-17 17:22:18,985 - dq_comparison - INFO - Column: reference_code
2026-01-17 17:22:18,986 - dq_comparison - INFO -   Source type: <class 'str'>, value: REF000012
2026-01-17 17:22:18,986 - dq_comparison - INFO -   Target type: <class 'str'>, value: REF000000
2026-01-17 17:22:18,988 - dq_comparison - INFO -   Normalized: 'REF000012' vs 'REF000000'
2026-01-17 17:22:18,988 - dq_comparison - INFO -   Match: False
2026-01-17 17:22:18,990 - dq_comparison - INFO - Column: account_id
2026-01-17 17:22:18,992 - dq_comparison - INFO -   Source type: <class 'str'>, value: ACC1001
2026-01-17 17:22:18,995 - dq_comparison - INFO -   Target type: <class 'str'>, value: ACC1001
2026-01-17 17:22:18,996 - dq_comparison - INFO -   Normalized: 'ACC1001' vs 'ACC1001'
2026-01-17 17:22:18,997 - dq_comparison - INFO -   Match: True
2026-01-17 17:22:18,998 - dq_comparison - INFO - Column: customer_id
2026-01-17 17:22:18,999 - dq_comparison - INFO -   Source type: <class 'str'>, value: CUST9001
2026-01-17 17:22:18,999 - dq_comparison - INFO -   Target type: <class 'str'>, value: CUST9001
2026-01-17 17:22:19,000 - dq_comparison - INFO -   Normalized: 'CUST9001' vs 'CUST9001'
2026-01-17 17:22:19,001 - dq_comparison - INFO -   Match: True
2026-01-17 17:22:19,002 - dq_comparison - INFO - Source DF columns: ['transaction_id', 'account_id', 'customer_id', 'transaction_date', 'posting_date', 'transaction_type', 'currency', 'amount', 'balance_after', 'status', 'merchant_name', 'merchant_category', 'country', 'reference_code', 'created_at', 'updated_at']
2026-01-17 17:22:19,002 - dq_comparison - INFO - Target DF columns: ['transaction_id', 'account_id', 'customer_id', 'transaction_date', 'posting_date', 'transaction_type', 'currency', 'amount', 'balance_after', 'status', 'merchant_name', 'merchant_category', 'country', 'reference_code', 'created_at', 'updated_at']
2026-01-17 17:22:19,003 - dq_comparison - INFO - Selected columns for comparison: ['reference_code', 'account_id', 'customer_id', 'created_at', 'amount', 'posting_date', 'status', 'country', 'merchant_category', 'transaction_date', 'balance_after', 'merchant_name', 'updated_at', 'transaction_type', 'currency', 'transaction_id']
2026-01-17 17:22:19,004 - dq_comparison - INFO - Using 16 common columns for hash comparison
2026-01-17 17:22:19,004 - dq_comparison - INFO - Source columns: ['reference_code', 'account_id', 'customer_id', 'created_at', 'amount', 'posting_date', 'status', 'country', 'merchant_category', 'transaction_date', 'balance_after', 'merchant_name', 'updated_at', 'transaction_type', 'currency', 'transaction_id']
2026-01-17 17:22:19,006 - dq_comparison - INFO - Target columns: ['reference_code', 'account_id', 'customer_id', 'created_at', 'amount', 'posting_date', 'status', 'country', 'merchant_category', 'transaction_date', 'balance_after', 'merchant_name', 'updated_at', 'transaction_type', 'currency', 'transaction_id']
2026-01-17 17:22:19,009 - dq_comparison - INFO - Generating hashes for source data (15 rows)...
2026-01-17 17:22:19,021 - dq_comparison - INFO - === DEBUG: SAMPLE HASHES ===
2026-01-17 17:22:19,021 - dq_comparison - INFO - Hash 1: a4a6d629988b5b0e... (sample row 0)
2026-01-17 17:22:19,022 - dq_comparison - INFO - Hash 2: d7c9dbf66439414b... (sample row 1)
2026-01-17 17:22:19,024 - dq_comparison - INFO - Hash 3: 6a50df5f99d30cb4... (sample row 2)
2026-01-17 17:22:19,027 - dq_comparison - INFO - Generating hashes for target data (13 rows)...
2026-01-17 17:22:19,034 - dq_comparison - INFO - Created hash mapping: 13 hashes → target rows
2026-01-17 17:22:19,035 - dq_comparison - INFO - 
======================================================================
2026-01-17 17:22:19,036 - dq_comparison - INFO - 🔍 DEBUG: ANALYZING WHY HASHES DON'T MATCH
2026-01-17 17:22:19,037 - dq_comparison - INFO - ======================================================================
2026-01-17 17:22:19,039 - dq_comparison - INFO - 
--- Analyzing Row 0 ---
2026-01-17 17:22:19,042 - dq_comparison - INFO - Column 'reference_code' → 'reference_code':
2026-01-17 17:22:19,042 - dq_comparison - INFO -   Source: 'REF000012' (type: str) → 'REF000012'
2026-01-17 17:22:19,043 - dq_comparison - INFO -   Target: 'None' (type: NoneType) → 'NULL'
2026-01-17 17:22:19,044 - dq_comparison - INFO -   Match after normalization: ❌ NO
2026-01-17 17:22:19,045 - dq_comparison - INFO - Column 'account_id' → 'account_id':
2026-01-17 17:22:19,045 - dq_comparison - INFO -   Source: 'ACC1001' (type: str) → 'ACC1001'
2026-01-17 17:22:19,046 - dq_comparison - INFO -   Target: 'None' (type: NoneType) → 'NULL'
2026-01-17 17:22:19,047 - dq_comparison - INFO -   Match after normalization: ❌ NO
2026-01-17 17:22:19,049 - dq_comparison - INFO - Column 'customer_id' → 'customer_id':
2026-01-17 17:22:19,049 - dq_comparison - INFO -   Source: 'CUST9001' (type: str) → 'CUST9001'
2026-01-17 17:22:19,050 - dq_comparison - INFO -   Target: 'None' (type: NoneType) → 'NULL'
2026-01-17 17:22:19,051 - dq_comparison - INFO -   Match after normalization: ❌ NO
2026-01-17 17:22:19,051 - dq_comparison - INFO - Column 'created_at' → 'created_at':
2026-01-17 17:22:19,052 - dq_comparison - INFO -   Source: '2024-01-01 10:00:00' (type: Timestamp) → '2024-01-01'
2026-01-17 17:22:19,055 - dq_comparison - INFO -   Target: 'None' (type: NoneType) → 'NULL'
2026-01-17 17:22:19,057 - dq_comparison - INFO -   Match after normalization: ❌ NO
2026-01-17 17:22:19,058 - dq_comparison - INFO - Column 'amount' → 'amount':
2026-01-17 17:22:19,058 - dq_comparison - INFO -   Source: '536.83' (type: str) → '536.83'
2026-01-17 17:22:19,059 - dq_comparison - INFO -   Target: 'None' (type: NoneType) → 'NULL'
2026-01-17 17:22:19,060 - dq_comparison - INFO -   Match after normalization: ❌ NO
2026-01-17 17:22:19,061 - dq_comparison - INFO - 
Hash components for Row 0:
2026-01-17 17:22:19,062 - dq_comparison - INFO - Source hash string start: REF000012|ACC1001|CUST9001...
2026-01-17 17:22:19,062 - dq_comparison - INFO - Target hash string start: NULL|NULL|NULL...
2026-01-17 17:22:19,063 - dq_comparison - INFO - Same? ❌ NO
2026-01-17 17:22:19,064 - dq_comparison - INFO - 
--- Analyzing Row 1 ---
2026-01-17 17:22:19,066 - dq_comparison - INFO - Column 'reference_code' → 'reference_code':
2026-01-17 17:22:19,066 - dq_comparison - INFO -   Source: 'REF000004' (type: str) → 'REF000004'
2026-01-17 17:22:19,067 - dq_comparison - INFO -   Target: 'None' (type: NoneType) → 'NULL'
2026-01-17 17:22:19,069 - dq_comparison - INFO -   Match after normalization: ❌ NO
2026-01-17 17:22:19,071 - dq_comparison - INFO - Column 'account_id' → 'account_id':
2026-01-17 17:22:19,072 - dq_comparison - INFO -   Source: 'ACC1001' (type: str) → 'ACC1001'
2026-01-17 17:22:19,073 - dq_comparison - INFO -   Target: 'None' (type: NoneType) → 'NULL'
2026-01-17 17:22:19,073 - dq_comparison - INFO -   Match after normalization: ❌ NO
2026-01-17 17:22:19,075 - dq_comparison - INFO - Column 'customer_id' → 'customer_id':
2026-01-17 17:22:19,076 - dq_comparison - INFO -   Source: 'CUST9001' (type: str) → 'CUST9001'
2026-01-17 17:22:19,076 - dq_comparison - INFO -   Target: 'None' (type: NoneType) → 'NULL'
2026-01-17 17:22:19,077 - dq_comparison - INFO -   Match after normalization: ❌ NO
2026-01-17 17:22:19,078 - dq_comparison - INFO - Column 'created_at' → 'created_at':
2026-01-17 17:22:19,078 - dq_comparison - INFO -   Source: '2024-01-01 10:00:00' (type: Timestamp) → '2024-01-01'
2026-01-17 17:22:19,079 - dq_comparison - INFO -   Target: 'None' (type: NoneType) → 'NULL'
2026-01-17 17:22:19,080 - dq_comparison - INFO -   Match after normalization: ❌ NO
2026-01-17 17:22:19,080 - dq_comparison - INFO - Column 'amount' → 'amount':
2026-01-17 17:22:19,081 - dq_comparison - INFO -   Source: '1389.09' (type: str) → '1389.09'
2026-01-17 17:22:19,082 - dq_comparison - INFO -   Target: 'None' (type: NoneType) → 'NULL'
2026-01-17 17:22:19,082 - dq_comparison - INFO -   Match after normalization: ❌ NO
2026-01-17 17:22:19,086 - dq_comparison - INFO - 
Hash components for Row 1:
2026-01-17 17:22:19,089 - dq_comparison - INFO - Source hash string start: REF000004|ACC1001|CUST9001...
2026-01-17 17:22:19,089 - dq_comparison - INFO - Target hash string start: NULL|NULL|NULL...
2026-01-17 17:22:19,090 - dq_comparison - INFO - Same? ❌ NO
2026-01-17 17:22:19,092 - dq_comparison - INFO - 
--- Analyzing Row 2 ---
2026-01-17 17:22:19,093 - dq_comparison - INFO - Column 'reference_code' → 'reference_code':
2026-01-17 17:22:19,094 - dq_comparison - INFO -   Source: 'REF000001' (type: str) → 'REF000001'
2026-01-17 17:22:19,094 - dq_comparison - INFO -   Target: 'None' (type: NoneType) → 'NULL'
2026-01-17 17:22:19,095 - dq_comparison - INFO -   Match after normalization: ❌ NO
2026-01-17 17:22:19,096 - dq_comparison - INFO - Column 'account_id' → 'account_id':
2026-01-17 17:22:19,097 - dq_comparison - INFO -   Source: 'ACC1001' (type: str) → 'ACC1001'
2026-01-17 17:22:19,098 - dq_comparison - INFO -   Target: 'None' (type: NoneType) → 'NULL'
2026-01-17 17:22:19,099 - dq_comparison - INFO -   Match after normalization: ❌ NO
2026-01-17 17:22:19,104 - dq_comparison - INFO - Column 'customer_id' → 'customer_id':
2026-01-17 17:22:19,105 - dq_comparison - INFO -   Source: 'CUST9001' (type: str) → 'CUST9001'
2026-01-17 17:22:19,105 - dq_comparison - INFO -   Target: 'None' (type: NoneType) → 'NULL'
2026-01-17 17:22:19,106 - dq_comparison - INFO -   Match after normalization: ❌ NO
2026-01-17 17:22:19,107 - dq_comparison - INFO - Column 'created_at' → 'created_at':
2026-01-17 17:22:19,107 - dq_comparison - INFO -   Source: '2024-01-01 10:00:00' (type: Timestamp) → '2024-01-01'
2026-01-17 17:22:19,108 - dq_comparison - INFO -   Target: 'None' (type: NoneType) → 'NULL'
2026-01-17 17:22:19,108 - dq_comparison - INFO -   Match after normalization: ❌ NO
2026-01-17 17:22:19,109 - dq_comparison - INFO - Column 'amount' → 'amount':
2026-01-17 17:22:19,110 - dq_comparison - INFO -   Source: '2460.42' (type: str) → '2460.42'
2026-01-17 17:22:19,110 - dq_comparison - INFO -   Target: 'None' (type: NoneType) → 'NULL'
2026-01-17 17:22:19,111 - dq_comparison - INFO -   Match after normalization: ❌ NO
2026-01-17 17:22:19,112 - dq_comparison - INFO - 
Hash components for Row 2:
2026-01-17 17:22:19,112 - dq_comparison - INFO - Source hash string start: REF000001|ACC1001|CUST9001...
2026-01-17 17:22:19,113 - dq_comparison - INFO - Target hash string start: NULL|NULL|NULL...
2026-01-17 17:22:19,115 - dq_comparison - INFO - Same? ❌ NO
2026-01-17 17:22:19,119 - dq_comparison - INFO - 
--- Column Data Types Analysis ---
2026-01-17 17:22:19,119 - dq_comparison - INFO - Column 1: 'reference_code' (object) ↔ 'reference_code' (object)
2026-01-17 17:22:19,120 - dq_comparison - INFO -   Sample: Source='REF000012', Target='REF000000'
2026-01-17 17:22:19,121 - dq_comparison - INFO - Column 2: 'account_id' (category) ↔ 'account_id' (category)
2026-01-17 17:22:19,121 - dq_comparison - INFO -   Sample: Source='ACC1001', Target='ACC1001'
2026-01-17 17:22:19,122 - dq_comparison - INFO - Column 3: 'customer_id' (category) ↔ 'customer_id' (category)
2026-01-17 17:22:19,123 - dq_comparison - INFO -   Sample: Source='CUST9001', Target='CUST9001'
2026-01-17 17:22:19,123 - dq_comparison - INFO - Column 4: 'created_at' (datetime64[ns]) ↔ 'created_at' (datetime64[ns])
2026-01-17 17:22:19,124 - dq_comparison - INFO -   Sample: Source='2024-01-01 10:00:00', Target='2024-01-01 10:00:00'
2026-01-17 17:22:19,126 - dq_comparison - INFO - Column 5: 'amount' (object) ↔ 'amount' (float32)
2026-01-17 17:22:19,126 - dq_comparison - INFO -   Sample: Source='536.83', Target='5896.93017578125'
2026-01-17 17:22:19,127 - dq_comparison - INFO - PERFORMING DETAILED ROW-LEVEL COMPARISON WITH PAGINATION...
2026-01-17 17:22:19,128 - dq_comparison - INFO - Found 28 total mismatches
2026-01-17 17:22:19,128 - dq_comparison - INFO - Will process detailed comparisons for first 28 rows
2026-01-17 17:22:19,151 - dq_error_log - ERROR - Error logging immediate mismatch: Python type dict cannot be converted
2026-01-17 17:22:19,205 - dq_error_log - ERROR - Error logging immediate mismatch: Python type dict cannot be converted
2026-01-17 17:22:19,241 - dq_error_log - ERROR - Error logging immediate mismatch: Python type dict cannot be converted
2026-01-17 17:22:19,278 - dq_error_log - ERROR - Error logging immediate mismatch: Python type dict cannot be converted
2026-01-17 17:22:19,317 - dq_error_log - ERROR - Error logging immediate mismatch: Python type dict cannot be converted
2026-01-17 17:22:19,350 - dq_error_log - ERROR - Error logging immediate mismatch: Python type dict cannot be converted
2026-01-17 17:22:19,383 - dq_error_log - ERROR - Error logging immediate mismatch: Python type dict cannot be converted
2026-01-17 17:22:19,422 - dq_error_log - ERROR - Error logging immediate mismatch: Python type dict cannot be converted
2026-01-17 17:22:19,455 - dq_error_log - ERROR - Error logging immediate mismatch: Python type dict cannot be converted
2026-01-17 17:22:19,485 - dq_error_log - ERROR - Error logging immediate mismatch: Python type dict cannot be converted
2026-01-17 17:22:19,518 - dq_error_log - ERROR - Error logging immediate mismatch: Python type dict cannot be converted
2026-01-17 17:22:19,554 - dq_error_log - ERROR - Error logging immediate mismatch: Python type dict cannot be converted
2026-01-17 17:22:19,588 - dq_error_log - ERROR - Error logging immediate mismatch: Python type dict cannot be converted
2026-01-17 17:22:19,624 - dq_error_log - ERROR - Error logging immediate mismatch: Python type dict cannot be converted
2026-01-17 17:22:19,663 - dq_error_log - ERROR - Error logging immediate mismatch: Python type dict cannot be converted
2026-01-17 17:22:19,683 - dq_comparison - INFO - 
================================================================================
2026-01-17 17:22:19,683 - dq_comparison - INFO - DETAILED MISMATCH SUMMARY:
2026-01-17 17:22:19,684 - dq_comparison - INFO -   Total mismatches found: 15
2026-01-17 17:22:19,685 - dq_comparison - INFO -   Detailed comparisons logged: 15
2026-01-17 17:22:19,688 - dq_comparison - INFO -   First 10 rows displayed above
2026-01-17 17:22:19,689 - dq_comparison - INFO -   All mismatches stored in database with complete data
2026-01-17 17:22:19,690 - dq_comparison - INFO -   Use API to retrieve all 15 mismatches
2026-01-17 17:22:19,691 - dq_comparison - INFO - ================================================================================
2026-01-17 17:22:19,692 - dq_comparison - INFO - Hash-based Comparison Results (with duplicate handling):
2026-01-17 17:22:19,692 - dq_comparison - INFO -   • Unique source hashes: 15
2026-01-17 17:22:19,693 - dq_comparison - INFO -   • Unique target hashes: 13
2026-01-17 17:22:19,693 - dq_comparison - INFO -   • Common hashes: 0
2026-01-17 17:22:19,694 - dq_comparison - INFO -   • Common rows (counting duplicates): 0
2026-01-17 17:22:19,695 - dq_comparison - INFO -   • Rows only in source (counting duplicates): 15
2026-01-17 17:22:19,695 - dq_comparison - INFO -   • Rows only in target (counting duplicates): 13
2026-01-17 17:22:19,705 - dq_comparison - INFO - HASH-ONLY COMPARISON COMPLETED
2026-01-17 17:22:19,706 - dq_comparison - INFO - Returning counts for simple scoring:
2026-01-17 17:22:19,707 - dq_comparison - INFO -   Common rows: 0
2026-01-17 17:22:19,707 - dq_comparison - INFO -   Unique to source: 15
2026-01-17 17:22:19,708 - dq_comparison - INFO -   Unique to target: 13
2026-01-17 17:22:19,708 - dq_comparison - INFO -   Value mismatches: 448
2026-01-17 17:22:19,710 - dq_comparison - INFO -   Missing rows: 15
2026-01-17 17:22:19,710 - dq_comparison - INFO -   Extra rows: 13
2026-01-17 17:22:19,711 - dq_comparison - INFO - 
========================================================================================================================
COMPARISON: Mysql Database vs Postgresql Database
========================================================================================================================
Row   | Diff Count | Source (Sample)                          | Target (Sample)                         
------------------------------------------------------------------------------------------------------------------------
2     | 16         | reference_code: REF000012                | reference_code: NULL                    
3     | 16         | reference_code: REF000004                | reference_code: NULL                    
4     | 16         | reference_code: REF000001                | reference_code: NULL                    
5     | 16         | reference_code: REF000009                | reference_code: NULL                    
6     | 16         | reference_code: REF000000                | reference_code: NULL                    
7     | 16         | reference_code: REF000005                | reference_code: NULL                    
8     | 16         | reference_code: REF000003                | reference_code: NULL                    
9     | 16         | reference_code: REF000008                | reference_code: NULL                    
10    | 16         | reference_code: REF000002                | reference_code: NULL                    
11    | 16         | reference_code: REF000010                | reference_code: NULL                    
------------------------------------------------------------------------------------------------------------------------
Showing 1-10 of 15 mismatched rows. Use API for complete data.
========================================================================================================================
2026-01-17 17:22:19,712 - dq_comparison - INFO - Returning enhanced mismatch structure with 15 detailed mismatches
2026-01-17 17:22:19,713 - dq_comparison - INFO - New structure: 15 detailed mismatches
2026-01-17 17:22:19,713 - dq_comparison - INFO - 
6️⃣ DATA QUALITY ANALYSIS
2026-01-17 17:22:19,714 - dq_comparison - INFO - Analyzing data quality metrics...
2026-01-17 17:22:19,732 - dq_comparison - INFO - Null values - Source: 0 (0.00%), Target: 0 (0.00%)
2026-01-17 17:22:19,735 - dq_comparison - INFO - Duplicate rows (normalized) - Source: 0, Target: 0
2026-01-17 17:22:19,754 - dq_error_log - INFO - Retrieved 18 error logs for session CMP_20260117_172218
2026-01-17 17:22:19,754 - dq_comparison - INFO - 
📊 SIMPLE SCORING CALCULATION:
2026-01-17 17:22:19,755 - dq_comparison - INFO -   Source rows: 15
2026-01-17 17:22:19,758 - dq_comparison - INFO -   Common rows (matched): 0
2026-01-17 17:22:19,758 - dq_comparison - INFO -   Calculation: (0 / 15) * 100 = 0.00%
2026-01-17 17:22:19,759 - dq_comparison - INFO -   Explanation: 0 matched rows out of 15 total source rows
2026-01-17 17:22:19,760 - dq_comparison - INFO - 
=== AUDIT LOGGING SECTION ===
2026-01-17 17:22:19,769 - dq_comparison - INFO - 🔍 Audit logging is ENABLED in APP_SETTINGS
2026-01-17 17:22:19,770 - dq_audit - INFO - Audit class initialized with database: dq_checks
2026-01-17 17:22:19,770 - dq_comparison - INFO - Attempting to log audit record for session: CMP_20260117_172218
2026-01-17 17:22:19,771 - dq_audit - INFO - Starting database insertion for comparison...
2026-01-17 17:22:19,797 - dq_audit - INFO - Inserted comparison record with ID: 756
2026-01-17 17:22:19,798 - dq_comparison - INFO - ✅ Audit record logged successfully (ID: 756)
2026-01-17 17:22:19,799 - dq_comparison - INFO - 
======================================================================
2026-01-17 17:22:19,800 - dq_comparison - INFO - 📊 COMPARISON RESULTS SUMMARY
2026-01-17 17:22:19,803 - dq_comparison - INFO - ======================================================================
2026-01-17 17:22:19,804 - dq_comparison - INFO - Session ID: CMP_20260117_172218
2026-01-17 17:22:19,804 - dq_comparison - INFO - Source: Database: mysql - dq_checks.comparison_small_source15 (15 rows)
2026-01-17 17:22:19,805 - dq_comparison - INFO - Target: Database: postgresql - dq_checks.comparison_small_target13 (13 rows)
2026-01-17 17:22:19,805 - dq_comparison - INFO - Selected columns: 16
2026-01-17 17:22:19,805 - dq_comparison - INFO - ----------------------------------------------------------------------
2026-01-17 17:22:19,806 - dq_comparison - INFO - 1️⃣ Row count match: ❌ No
2026-01-17 17:22:19,806 - dq_comparison - INFO -    Missing in target: 2 rows
2026-01-17 17:22:19,807 - dq_comparison - INFO -    Extra in target: 0 rows
2026-01-17 17:22:19,807 - dq_comparison - INFO - 2️⃣ Column structure match: ✅ Yes
2026-01-17 17:22:19,808 - dq_comparison - INFO - 3️ Primary key validation: ❌ Failed
2026-01-17 17:22:19,812 - dq_comparison - INFO -    Key fields: ['transaction_id', 'customer_id', 'reference_code']
2026-01-17 17:22:19,812 - dq_comparison - INFO - 4️ Table metadata: ❌ Mismatch
2026-01-17 17:22:19,813 - dq_comparison - INFO -    • Row Count: 15 vs 13
2026-01-17 17:22:19,813 - dq_comparison - INFO - 5️⃣ Common rows (both Mysql Database and Postgresql Database): 0 (0.00% of Mysql Database)
2026-01-17 17:22:19,814 - dq_comparison - INFO - 6️⃣ Mysql Database-only rows: 15 (present ONLY in Mysql Database, NOT in Postgresql Database)
2026-01-17 17:22:19,815 - dq_comparison - INFO - 7️⃣ Postgresql Database-only rows: 13 (present ONLY in Postgresql Database, NOT in Mysql Database)
2026-01-17 17:22:19,816 - dq_comparison - INFO - 8️⃣ Column value mismatches: 0
2026-01-17 17:22:19,816 - dq_comparison - INFO - 9️ Data quality match: ✅ Yes
2026-01-17 17:22:19,817 - dq_comparison - INFO - 📈 DQ Score: 0.00%
2026-01-17 17:22:19,818 - dq_comparison - INFO - 📊 Calculation: (0 / 15) * 100 = 0.00%
2026-01-17 17:22:19,818 - dq_comparison - INFO - ======================================================================
2026-01-17 17:22:19,819 - dq_comparison - INFO - 
❌ LOW MATCH! Major differences found.
2026-01-17 17:22:19,819 - dq_comparison - INFO - 
🔍 NORMALIZATION APPLIED:
2026-01-17 17:22:19,820 - dq_comparison - INFO -    • NULL values → 'NULL' (consistent representation)
2026-01-17 17:22:19,821 - dq_comparison - INFO -    • Dates → YYYY-MM-DD format
2026-01-17 17:22:19,821 - dq_comparison - INFO -    • Strings → trimmed + lowercase
2026-01-17 17:22:19,822 - dq_comparison - INFO -    • Numeric values → standardized format
2026-01-17 17:22:19,822 - dq_comparison - INFO -    • Phone numbers → digits only, ALL leading zeros removed
2026-01-17 17:22:19,823 - dq_comparison - INFO -    • Extra whitespace removed
2026-01-17 17:22:19,824 - dq_comparison - INFO - 
🔍 DETAILED ERROR ANALYSIS:
2026-01-17 17:22:19,829 - dq_comparison - INFO - --------------------------------------------------
2026-01-17 17:22:19,830 - dq_comparison - INFO - 📊 SOURCE-ONLY ROWS: 15 rows
2026-01-17 17:22:19,830 - dq_comparison - INFO -    Present only in Mysql Database, missing from Postgresql Database
2026-01-17 17:22:19,830 - dq_comparison - INFO - 📊 TARGET-ONLY ROWS: 13 rows
2026-01-17 17:22:19,831 - dq_comparison - INFO -    Present only in Postgresql Database, extra (not in Mysql Database)
2026-01-17 17:22:19,849 - dq_error_log - INFO - Retrieved 10 errors for session CMP_20260117_172218
2026-01-17 17:22:19,850 - dq_comparison - INFO - 
📋 SAMPLE ERRORS (10 found):
2026-01-17 17:22:19,851 - dq_comparison - INFO - 
1. Row 0 - Metadata Row Count
2026-01-17 17:22:19,852 - dq_comparison - INFO -    Column: 
2026-01-17 17:22:19,852 - dq_comparison - INFO -    Metadata mismatch: Row Count
2026-01-17 17:22:19,853 - dq_comparison - INFO - 
2. Row 0 - Duplicate Primary Key
2026-01-17 17:22:19,854 - dq_comparison - INFO -    Column: customer_id
2026-01-17 17:22:19,856 - dq_comparison - INFO -    Primary key field 'customer_id' has 15 duplicates in source
2026-01-17 17:22:19,859 - dq_comparison - INFO - 
3. Row 0 - Duplicate Primary Key
2026-01-17 17:22:19,860 - dq_comparison - INFO -    Column: customer_id
2026-01-17 17:22:19,860 - dq_comparison - INFO -    Primary key field 'customer_id' has 13 duplicates in target
2026-01-17 17:22:19,861 - dq_comparison - INFO - 
💡 For complete error details, run:
2026-01-17 17:22:19,861 - dq_comparison - INFO -    USE dq_checks;
2026-01-17 17:22:19,862 - dq_comparison - INFO -    SELECT excel_row, column_name, error_type, error_description,
2026-01-17 17:22:19,863 - dq_comparison - INFO -           actual_value, expected_value
2026-01-17 17:22:19,864 - dq_comparison - INFO -    FROM dq_error_logs
2026-01-17 17:22:19,865 - dq_comparison - INFO -    WHERE session_id = 'CMP_20260117_172218'
2026-01-17 17:22:19,866 - dq_comparison - INFO -    ORDER BY excel_row, column_name;
2026-01-17 17:22:19,886 - dq_comparison - INFO - 
✅ Comparison completed! Session ID: CMP_20260117_172218
2026-01-17 17:22:19,904 - dq_error_log - INFO - Retrieved 19 error logs for session CMP_20260117_172218
2026-01-17 17:22:19,924 - dq_error_log - INFO - Retrieved summary: 19 total errors for session CMP_20260117_172218
2026-01-17 17:22:19,925 - dq_audit - INFO - Audit class initialized with database: dq_checks
2026-01-17 17:22:19,952 - dq_audit - INFO - Retrieved 1 audit logs for session CMP_20260117_172218
2026-01-17 17:22:19,953 - dq_comparison - INFO - 
🔍 Final results verification:
2026-01-17 17:22:19,954 - dq_comparison - INFO -    Session ID: CMP_20260117_172218
2026-01-17 17:22:19,957 - dq_comparison - INFO -    DQ Score (Simple %): 0.00%
2026-01-17 17:22:19,958 - dq_comparison - INFO -    Source rows: 15
2026-01-17 17:22:19,959 - dq_comparison - INFO -    Matched rows: 0
2026-01-17 17:22:19,959 - dq_comparison - INFO -    Calculation: (0 / 15) * 100
2026-01-17 17:22:19,960 - __main__ - INFO - Source-Target Comparison completed successfully
2026-01-17 17:22:19,960 - __main__ - INFO - Displaying main menu options to user
2026-01-17 17:36:33,626 - __main__ - INFO - User selected option: 6
2026-01-17 17:36:33,628 - __main__ - INFO - User session ended. Duration: 0:14:54.472643
2026-01-17 17:36:33,628 - __main__ - INFO - 👋 Thank you for using Universal Data Quality Framework!
