2026-01-14 13:18:42,677 - root - INFO - CLI Mode Logging Initialized
2026-01-14 13:18:42,677 - root - INFO - CLI logs will be saved to: logs/dq_framework_20260114_131842.log
2026-01-14 13:18:42,677 - __main__ - INFO - 🚀 UNIVERSAL DATA QUALITY FRAMEWORK INITIALIZED
2026-01-14 13:18:42,679 - __main__ - INFO - Starting system resource check
2026-01-14 13:18:42,687 - __main__ - INFO - Total RAM: 15.7 GB
2026-01-14 13:18:42,688 - __main__ - INFO - Available RAM: 2.6 GB
2026-01-14 13:18:42,688 - __main__ - INFO - Memory used: 83.7%
2026-01-14 13:18:42,688 - __main__ - INFO - Memory status: OK
2026-01-14 13:18:42,689 - __main__ - INFO - Free disk space: 259.4 GB
2026-01-14 13:18:42,689 - __main__ - INFO - Disk used: 45.5%
2026-01-14 13:18:42,689 - __main__ - INFO - Disk space: OK
2026-01-14 13:18:43,190 - __main__ - INFO - CPU cores: 8
2026-01-14 13:18:43,190 - __main__ - INFO - CPU usage: 25.8%
2026-01-14 13:18:43,190 - __main__ - INFO - Python version: 3.12.4
2026-01-14 13:18:43,191 - __main__ - INFO - System platform: win32
2026-01-14 13:18:43,191 - __main__ - INFO - User session started at: 2026-01-14 13:18:43.191627
2026-01-14 13:18:43,191 - __main__ - INFO - Displaying main menu options to user
2026-01-14 13:18:44,182 - __main__ - INFO - User selected option: 2
2026-01-14 13:18:44,184 - __main__ - INFO - Starting Source-Target Comparison module
2026-01-14 13:18:44,189 - dq_comparison - INFO - STARTING UNIVERSAL SOURCE-TARGET COMPARISON TOOL
2026-01-14 13:18:44,189 - dq_comparison - INFO - LOADING SOURCE AND TARGET DATA
2026-01-14 13:18:44,190 - dq_comparison - INFO - 
==================================================
2026-01-14 13:18:44,190 - dq_comparison - INFO - 🔗 SOURCE DATA CONFIGURATION
2026-01-14 13:18:44,190 - dq_comparison - INFO - ==================================================
2026-01-14 13:18:45,434 - dq_comparison - INFO - DEBUG load_excel_source called for SOURCE
2026-01-14 13:18:45,435 - dq_comparison - INFO - DEBUG ui_data: None
2026-01-14 13:18:45,439 - dq_comparison - INFO - DEBUG ui_data type: <class 'NoneType'>
2026-01-14 13:18:50,079 - dq_comparison - INFO - SOURCE Excel loaded: 50 rows, 8 columns
2026-01-14 13:18:50,079 - dq_comparison - INFO - 
==================================================
2026-01-14 13:18:50,081 - dq_comparison - INFO - 🔗 TARGET DATA CONFIGURATION
2026-01-14 13:18:50,084 - dq_comparison - INFO - ==================================================
2026-01-14 13:18:51,402 - dq_comparison - INFO - DEBUG load_csv_source called for TARGET
2026-01-14 13:18:58,740 - dq_comparison - INFO - TARGET CSV loaded: 50 rows, 8 columns
2026-01-14 13:18:58,741 - dq_comparison - INFO - SELECTING COLUMNS FOR COMPARISON
2026-01-14 13:18:58,743 - dq_comparison - INFO - Source columns (original): ['CustomerID', 'FirstName', 'LastName', 'PhoneNumber', 'Email', 'Salary', 'JoinDate', 'Address']
2026-01-14 13:18:58,745 - dq_comparison - INFO - Target columns (original): ['CustomerID', 'FirstName', 'LastName', 'PhoneNumber', 'Email', 'Salary', 'JoinDate', 'Address']
2026-01-14 13:18:58,745 - dq_comparison - INFO - Common columns lowercased: ['firstname', 'lastname', 'address', 'email', 'salary', 'customerid', 'joindate', 'phonenumber']
2026-01-14 13:18:58,748 - dq_comparison - INFO - Found 8 common columns between source and target (case-insensitive)
2026-01-14 13:18:58,749 - dq_comparison - INFO - 
📋 Common columns available for comparison:
2026-01-14 13:18:58,750 - dq_comparison - INFO -   1. FirstName (Source) ↔ FirstName (Target)
2026-01-14 13:18:58,750 - dq_comparison - INFO -   2. LastName (Source) ↔ LastName (Target)
2026-01-14 13:18:58,751 - dq_comparison - INFO -   3. Address (Source) ↔ Address (Target)
2026-01-14 13:18:58,752 - dq_comparison - INFO -   4. Email (Source) ↔ Email (Target)
2026-01-14 13:18:58,753 - dq_comparison - INFO -   5. Salary (Source) ↔ Salary (Target)
2026-01-14 13:18:58,754 - dq_comparison - INFO -   6. CustomerID (Source) ↔ CustomerID (Target)
2026-01-14 13:18:58,755 - dq_comparison - INFO -   7. JoinDate (Source) ↔ JoinDate (Target)
2026-01-14 13:18:58,755 - dq_comparison - INFO -   8. PhoneNumber (Source) ↔ PhoneNumber (Target)
2026-01-14 13:19:00,267 - dq_comparison - INFO - User column selection input: all
2026-01-14 13:19:00,272 - dq_comparison - INFO - User selected ALL common columns for comparison
2026-01-14 13:19:00,272 - dq_comparison - INFO - GENERATING COMPREHENSIVE COMPARISON REPORT
2026-01-14 13:19:00,273 - dq_comparison - INFO - Report details - Source: Excel: test_source.xlsx (Sheet1), Target: CSV: test_target.csv, Selected columns: 8
2026-01-14 13:19:00,274 - dq_comparison - INFO - Initializing Error Logger...
2026-01-14 13:19:00,274 - dq_error_log - INFO - ErrorLogger initialized with database: dq_checks
2026-01-14 13:19:00,469 - dq_error_log - INFO - Database connection successful
2026-01-14 13:19:00,471 - dq_comparison - INFO - Session ID: CMP_20260114_131900
2026-01-14 13:19:00,471 - dq_comparison - INFO - 
======================================================================
2026-01-14 13:19:00,475 - dq_comparison - INFO - 🔄 RUNNING SOURCE-TARGET COMPARISON WITH PERFECT NORMALIZATION
2026-01-14 13:19:00,477 - dq_comparison - INFO - ======================================================================
2026-01-14 13:19:00,477 - dq_comparison - INFO - Session ID: CMP_20260114_131900
2026-01-14 13:19:00,478 - dq_comparison - INFO - Source: Excel: test_source.xlsx (Sheet1)
2026-01-14 13:19:00,478 - dq_comparison - INFO - Target: CSV: test_target.csv
2026-01-14 13:19:00,479 - dq_comparison - INFO - Selected columns: 8
2026-01-14 13:19:00,480 - dq_comparison - INFO - ======================================================================
2026-01-14 13:19:00,480 - dq_comparison - INFO - 
1️⃣ FIRST: ROW COUNT CHECK
2026-01-14 13:19:00,481 - dq_comparison - INFO - ✅ Row counts match: 50 rows
2026-01-14 13:19:00,482 - dq_comparison - INFO - 
2️⃣ COLUMN STRUCTURE COMPARISON
2026-01-14 13:19:00,482 - dq_comparison - INFO - Comparing column structures...
2026-01-14 13:19:00,483 - dq_comparison - INFO - Column structure comparison complete. Match: True
2026-01-14 13:19:00,483 - dq_comparison - INFO - 
3️⃣ PRIMARY KEY VALIDATION
2026-01-14 13:19:00,484 - dq_comparison - INFO - Validating primary key/unique fields...
2026-01-14 13:19:00,485 - dq_comparison - INFO - Checking key fields: ['CustomerID', 'CustomerID']
2026-01-14 13:19:00,488 - dq_comparison - INFO - Primary key validation complete. Passed: True
2026-01-14 13:19:00,488 - dq_comparison - INFO -    Key fields found: ['CustomerID', 'CustomerID']
2026-01-14 13:19:00,489 - dq_comparison - INFO -    Unique in source: ✅
2026-01-14 13:19:00,490 - dq_comparison - INFO -    Unique in target: ✅
2026-01-14 13:19:00,490 - dq_comparison - INFO -    Validation passed: ✅
2026-01-14 13:19:00,491 - dq_comparison - INFO -    Column names match: ✅
2026-01-14 13:19:00,492 - dq_comparison - INFO -    Column order match: ✅
2026-01-14 13:19:00,496 - dq_comparison - INFO -    Data types match: ✅
2026-01-14 13:19:00,496 - dq_comparison - INFO - 
4️⃣ TABLE METADATA COMPARISON
2026-01-14 13:19:00,496 - dq_comparison - INFO - Comparing table-level metadata...
2026-01-14 13:19:00,507 - dq_comparison - INFO - Table metadata comparison complete. Match: True
2026-01-14 13:19:00,507 - dq_comparison - INFO -    Table metadata match: ✅
2026-01-14 13:19:00,508 - dq_comparison - INFO -    Source: 50 rows, 8 cols, 0.02 MB
2026-01-14 13:19:00,512 - dq_comparison - INFO -    Target: 50 rows, 8 cols, 0.02 MB
2026-01-14 13:19:00,513 - dq_comparison - INFO - 
5️⃣ HASH-BASED COMPARISON
2026-01-14 13:19:00,514 - dq_comparison - INFO - ℹ️  Note: All NULL values normalized to 'NULL'
2026-01-14 13:19:00,514 - dq_comparison - INFO - ℹ️  Note: Dates normalized to YYYY-MM-DD
2026-01-14 13:19:00,515 - dq_comparison - INFO - ℹ️  Note: Strings trimmed and case-normalized
2026-01-14 13:19:00,516 - dq_comparison - INFO - ℹ️  Note: Phone numbers stripped to digits only, leading zeros removed
2026-01-14 13:19:00,516 - dq_comparison - INFO - SECOND CHECK: HASH-BASED COMPARISON WITH PERFECT NORMALIZATION
2026-01-14 13:19:00,526 - dq_comparison - INFO - === DEBUG: DATA TYPE CHECK ===
2026-01-14 13:19:00,527 - dq_comparison - INFO - Column: FirstName
2026-01-14 13:19:00,528 - dq_comparison - INFO -   Source type: <class 'str'>, value: Mark
2026-01-14 13:19:00,529 - dq_comparison - INFO -   Target type: <class 'str'>, value: Mark
2026-01-14 13:19:00,529 - dq_comparison - INFO -   Normalized: 'mark' vs 'mark'
2026-01-14 13:19:00,530 - dq_comparison - INFO -   Match: True
2026-01-14 13:19:00,530 - dq_comparison - INFO - Column: LastName
2026-01-14 13:19:00,531 - dq_comparison - INFO -   Source type: <class 'str'>, value: Morris
2026-01-14 13:19:00,531 - dq_comparison - INFO -   Target type: <class 'str'>, value: Morris
2026-01-14 13:19:00,532 - dq_comparison - INFO -   Normalized: 'morris' vs 'morris'
2026-01-14 13:19:00,532 - dq_comparison - INFO -   Match: True
2026-01-14 13:19:00,533 - dq_comparison - INFO - Column: Address
2026-01-14 13:19:00,534 - dq_comparison - INFO -   Source type: <class 'str'>, value: 6702 Watson Bypass, Brownland, KS 13081
2026-01-14 13:19:00,534 - dq_comparison - INFO -   Target type: <class 'str'>, value: 6702 Watson Bypass, Brownland, KS 13081
2026-01-14 13:19:00,535 - dq_comparison - INFO -   Normalized: '6702 watson bypass, brownland, ks 13081' vs '6702 watson bypass, brownland, ks 13081'
2026-01-14 13:19:00,536 - dq_comparison - INFO -   Match: True
2026-01-14 13:19:00,536 - dq_comparison - INFO - Source DF columns: ['CustomerID', 'FirstName', 'LastName', 'PhoneNumber', 'Email', 'Salary', 'JoinDate', 'Address']
2026-01-14 13:19:00,537 - dq_comparison - INFO - Target DF columns: ['CustomerID', 'FirstName', 'LastName', 'PhoneNumber', 'Email', 'Salary', 'JoinDate', 'Address']
2026-01-14 13:19:00,538 - dq_comparison - INFO - Selected columns for comparison: ['FirstName', 'LastName', 'Address', 'Email', 'Salary', 'CustomerID', 'JoinDate', 'PhoneNumber']
2026-01-14 13:19:00,541 - dq_comparison - INFO - Using 8 common columns for hash comparison
2026-01-14 13:19:00,544 - dq_comparison - INFO - Source columns: ['FirstName', 'LastName', 'Address', 'Email', 'Salary', 'CustomerID', 'JoinDate', 'PhoneNumber']
2026-01-14 13:19:00,545 - dq_comparison - INFO - Target columns: ['FirstName', 'LastName', 'Address', 'Email', 'Salary', 'CustomerID', 'JoinDate', 'PhoneNumber']
2026-01-14 13:19:00,545 - dq_comparison - INFO - Generating hashes for source data (50 rows)...
2026-01-14 13:19:00,548 - dq_comparison - INFO - DEBUG HASH ROW: FirstName: 'Mark' -> 'mark' | LastName: 'Morris' -> 'morris' | Address: '6702 Watson Bypass, Brownland, KS 13081' -> '6702 watson bypass, brownland, ks 13081' | Email: 'mark.morris@example.com' -> 'mark.morris@example.com' | Salary: '111916' -> '111916'
2026-01-14 13:19:00,548 - dq_comparison - INFO - DEBUG HASH STRING: mark|morris|6702 watson bypass, brownland, ks 13081|mark.morris@example.com|111916...
2026-01-14 13:19:00,549 - dq_comparison - INFO - DEBUG HASH RESULT: 3a292fb5...
2026-01-14 13:19:00,550 - dq_comparison - INFO - DEBUG HASH ROW: FirstName: 'Dennis' -> 'dennis' | LastName: 'Owens' -> 'owens' | Address: '815 Rogers Row Apt. 396, Williamfurt, WA 10567' -> '815 rogers row apt. 396, williamfurt, wa 10567' | Email: 'dennis.owens@example.com' -> 'dennis.owens@example.com' | Salary: '39264' -> '39264'
2026-01-14 13:19:00,550 - dq_comparison - INFO - DEBUG HASH STRING: dennis|owens|815 rogers row apt. 396, williamfurt, wa 10567|dennis.owens@example.com|39264...
2026-01-14 13:19:00,551 - dq_comparison - INFO - DEBUG HASH RESULT: ba17cf28...
2026-01-14 13:19:00,552 - dq_comparison - INFO - DEBUG HASH ROW: FirstName: 'Felicia' -> 'felicia' | LastName: 'Hatfield' -> 'hatfield' | Address: '25439 Carney Mills Apt. 076, New April, CT 16626' -> '25439 carney mills apt. 076, new april, ct 16626' | Email: 'felicia.hatfield@example.com' -> 'felicia.hatfield@example.com' | Salary: '41191' -> '41191'
2026-01-14 13:19:00,552 - dq_comparison - INFO - DEBUG HASH STRING: felicia|hatfield|25439 carney mills apt. 076, new april, ct 16626|felicia.hatfield@example.com|41191...
2026-01-14 13:19:00,553 - dq_comparison - INFO - DEBUG HASH RESULT: 63158871...
2026-01-14 13:19:00,554 - dq_comparison - INFO - DEBUG HASH ROW: FirstName: 'Michael' -> 'michael' | LastName: 'Jenkins' -> 'jenkins' | Address: '57717 Mcbride Forks, East Derrick, MS 02913' -> '57717 mcbride forks, east derrick, ms 02913' | Email: 'michael.jenkins@example.com' -> 'michael.jenkins@example.com' | Salary: '116934' -> '116934'
2026-01-14 13:19:00,557 - dq_comparison - INFO - DEBUG HASH STRING: michael|jenkins|57717 mcbride forks, east derrick, ms 02913|michael.jenkins@example.com|116934...
2026-01-14 13:19:00,561 - dq_comparison - INFO - DEBUG HASH RESULT: 56abf6e2...
2026-01-14 13:19:00,562 - dq_comparison - INFO - DEBUG HASH ROW: FirstName: 'Nicholas' -> 'nicholas' | LastName: 'Smith' -> 'smith' | Address: '21259 Andrew Pass Suite 771, Frostfort, DC 47552' -> '21259 andrew pass suite 771, frostfort, dc 47552' | Email: 'nicholas.smith@example.com' -> 'nicholas.smith@example.com' | Salary: '46558' -> '46558'
2026-01-14 13:19:00,563 - dq_comparison - INFO - DEBUG HASH STRING: nicholas|smith|21259 andrew pass suite 771, frostfort, dc 47552|nicholas.smith@example.com|46558...
2026-01-14 13:19:00,563 - dq_comparison - INFO - DEBUG HASH RESULT: 55ee2adc...
2026-01-14 13:19:00,565 - dq_comparison - INFO - DEBUG HASH ROW: FirstName: 'Joseph' -> 'joseph' | LastName: 'Guerra' -> 'guerra' | Address: '34480 Jesse Prairie, Olsenside, MN 78898' -> '34480 jesse prairie, olsenside, mn 78898' | Email: 'joseph.guerra@example.com' -> 'joseph.guerra@example.com' | Salary: '79928' -> '79928'
2026-01-14 13:19:00,565 - dq_comparison - INFO - DEBUG HASH STRING: joseph|guerra|34480 jesse prairie, olsenside, mn 78898|joseph.guerra@example.com|79928...
2026-01-14 13:19:00,566 - dq_comparison - INFO - DEBUG HASH RESULT: 928db7d8...
2026-01-14 13:19:00,568 - dq_comparison - INFO - DEBUG HASH ROW: FirstName: 'Gabrielle' -> 'gabrielle' | LastName: 'Bell' -> 'bell' | Address: '592 Martinez Lodge Suite 654, Lake Susanton, VA 54606' -> '592 martinez lodge suite 654, lake susanton, va 54606' | Email: 'gabrielle.bell@example.com' -> 'gabrielle.bell@example.com' | Salary: '85292' -> '85292'
2026-01-14 13:19:00,568 - dq_comparison - INFO - DEBUG HASH STRING: gabrielle|bell|592 martinez lodge suite 654, lake susanton, va 54606|gabrielle.bell@example.com|85292...
2026-01-14 13:19:00,569 - dq_comparison - INFO - DEBUG HASH RESULT: 98272188...
2026-01-14 13:19:00,570 - dq_comparison - INFO - DEBUG HASH ROW: FirstName: 'Joel' -> 'joel' | LastName: 'Barber' -> 'barber' | Address: 'PSC 3606, Box 9194, APO AP 13934' -> 'psc 3606, box 9194, apo ap 13934' | Email: 'joel.barber@example.com' -> 'joel.barber@example.com' | Salary: '50803' -> '50803'
2026-01-14 13:19:00,572 - dq_comparison - INFO - DEBUG HASH STRING: joel|barber|psc 3606, box 9194, apo ap 13934|joel.barber@example.com|50803...
2026-01-14 13:19:00,575 - dq_comparison - INFO - DEBUG HASH RESULT: c4104b79...
2026-01-14 13:19:00,577 - dq_comparison - INFO - DEBUG HASH ROW: FirstName: 'Autumn' -> 'autumn' | LastName: 'Flores' -> 'flores' | Address: '85787 Heather Plains, Port Alberttown, NJ 91311' -> '85787 heather plains, port alberttown, nj 91311' | Email: 'autumn.flores@example.com' -> 'autumn.flores@example.com' | Salary: '84264' -> '84264'
2026-01-14 13:19:00,577 - dq_comparison - INFO - DEBUG HASH STRING: autumn|flores|85787 heather plains, port alberttown, nj 91311|autumn.flores@example.com|84264...
2026-01-14 13:19:00,577 - dq_comparison - INFO - DEBUG HASH RESULT: fc7998ac...
2026-01-14 13:19:00,578 - dq_comparison - INFO - DEBUG HASH ROW: FirstName: 'Jared' -> 'jared' | LastName: 'Andrews' -> 'andrews' | Address: '372 Brittney Underpass Suite 324, Skinnermouth, DC 83658' -> '372 brittney underpass suite 324, skinnermouth, dc 83658' | Email: 'jared.andrews@example.com' -> 'jared.andrews@example.com' | Salary: '119153' -> '119153'
2026-01-14 13:19:00,579 - dq_comparison - INFO - DEBUG HASH STRING: jared|andrews|372 brittney underpass suite 324, skinnermouth, dc 83658|jared.andrews@example.com|119153...
2026-01-14 13:19:00,579 - dq_comparison - INFO - DEBUG HASH RESULT: d7a4c5a8...
2026-01-14 13:19:00,580 - dq_comparison - INFO - DEBUG HASH ROW: FirstName: 'Jason' -> 'jason' | LastName: 'Kim' -> 'kim' | Address: '6714 Lorraine Heights Apt. 942, East Brianfurt, LA 40548' -> '6714 lorraine heights apt. 942, east brianfurt, la 40548' | Email: 'jason.kim@example.com' -> 'jason.kim@example.com' | Salary: '39331' -> '39331'
2026-01-14 13:19:00,581 - dq_comparison - INFO - DEBUG HASH STRING: jason|kim|6714 lorraine heights apt. 942, east brianfurt, la 40548|jason.kim@example.com|39331...
2026-01-14 13:19:00,581 - dq_comparison - INFO - DEBUG HASH RESULT: 86909980...
2026-01-14 13:19:00,582 - dq_comparison - INFO - DEBUG HASH ROW: FirstName: 'Ryan' -> 'ryan' | LastName: 'Barton' -> 'barton' | Address: '210 Ochoa Pass, Crystalhaven, ND 49508' -> '210 ochoa pass, crystalhaven, nd 49508' | Email: 'ryan.barton@example.com' -> 'ryan.barton@example.com' | Salary: '48099' -> '48099'
2026-01-14 13:19:00,583 - dq_comparison - INFO - DEBUG HASH STRING: ryan|barton|210 ochoa pass, crystalhaven, nd 49508|ryan.barton@example.com|48099...
2026-01-14 13:19:00,583 - dq_comparison - INFO - DEBUG HASH RESULT: a5913be5...
2026-01-14 13:19:00,584 - dq_comparison - INFO - DEBUG HASH ROW: FirstName: 'Michael' -> 'michael' | LastName: 'Williams' -> 'williams' | Address: '9630 Amber Views, Port Tracy, AR 01162' -> '9630 amber views, port tracy, ar 01162' | Email: 'michael.williams@example.com' -> 'michael.williams@example.com' | Salary: '95775' -> '95775'
2026-01-14 13:19:00,588 - dq_comparison - INFO - DEBUG HASH STRING: michael|williams|9630 amber views, port tracy, ar 01162|michael.williams@example.com|95775...
2026-01-14 13:19:00,591 - dq_comparison - INFO - DEBUG HASH RESULT: 4d2cf731...
2026-01-14 13:19:00,592 - dq_comparison - INFO - DEBUG HASH ROW: FirstName: 'Jennifer' -> 'jennifer' | LastName: 'White' -> 'white' | Address: '255 Lucas Key Suite 075, South Michelehaven, PA 59058' -> '255 lucas key suite 075, south michelehaven, pa 59058' | Email: 'jennifer.white@example.com' -> 'jennifer.white@example.com' | Salary: '83452' -> '83452'
2026-01-14 13:19:00,593 - dq_comparison - INFO - DEBUG HASH STRING: jennifer|white|255 lucas key suite 075, south michelehaven, pa 59058|jennifer.white@example.com|83452...
2026-01-14 13:19:00,593 - dq_comparison - INFO - DEBUG HASH RESULT: 8c0885f1...
2026-01-14 13:19:00,594 - dq_comparison - INFO - DEBUG HASH ROW: FirstName: 'Shawn' -> 'shawn' | LastName: 'Park' -> 'park' | Address: '48664 Mills Loaf, New Jennifershire, OK 32510' -> '48664 mills loaf, new jennifershire, ok 32510' | Email: 'shawn.park@example.com' -> 'shawn.park@example.com' | Salary: '98946' -> '98946'
2026-01-14 13:19:00,595 - dq_comparison - INFO - DEBUG HASH STRING: shawn|park|48664 mills loaf, new jennifershire, ok 32510|shawn.park@example.com|98946...
2026-01-14 13:19:00,596 - dq_comparison - INFO - DEBUG HASH RESULT: f357f3bf...
2026-01-14 13:19:00,597 - dq_comparison - INFO - DEBUG HASH ROW: FirstName: 'Jill' -> 'jill' | LastName: 'Robertson' -> 'robertson' | Address: '58301 Christina Oval, New Albert, OK 52302' -> '58301 christina oval, new albert, ok 52302' | Email: 'jill.robertson@example.com' -> 'jill.robertson@example.com' | Salary: '49573' -> '49573'
2026-01-14 13:19:00,597 - dq_comparison - INFO - DEBUG HASH STRING: jill|robertson|58301 christina oval, new albert, ok 52302|jill.robertson@example.com|49573...
2026-01-14 13:19:00,598 - dq_comparison - INFO - DEBUG HASH RESULT: 27593ab4...
2026-01-14 13:19:00,599 - dq_comparison - INFO - DEBUG HASH ROW: FirstName: 'Robert' -> 'robert' | LastName: 'Lyons' -> 'lyons' | Address: '432 Nash Lodge, Gonzalezfort, MH 90452' -> '432 nash lodge, gonzalezfort, mh 90452' | Email: 'robert.lyons@example.com' -> 'robert.lyons@example.com' | Salary: '36536' -> '36536'
2026-01-14 13:19:00,600 - dq_comparison - INFO - DEBUG HASH STRING: robert|lyons|432 nash lodge, gonzalezfort, mh 90452|robert.lyons@example.com|36536...
2026-01-14 13:19:00,600 - dq_comparison - INFO - DEBUG HASH RESULT: ed30ada8...
2026-01-14 13:19:00,601 - dq_comparison - INFO - DEBUG HASH ROW: FirstName: 'Jacob' -> 'jacob' | LastName: 'Acevedo' -> 'acevedo' | Address: 'PSC 8275, Box 4866, APO AE 97498' -> 'psc 8275, box 4866, apo ae 97498' | Email: 'jacob.acevedo@example.com' -> 'jacob.acevedo@example.com' | Salary: '34641' -> '34641'
2026-01-14 13:19:00,607 - dq_comparison - INFO - DEBUG HASH STRING: jacob|acevedo|psc 8275, box 4866, apo ae 97498|jacob.acevedo@example.com|34641...
2026-01-14 13:19:00,608 - dq_comparison - INFO - DEBUG HASH RESULT: b6e03bdb...
2026-01-14 13:19:00,609 - dq_comparison - INFO - DEBUG HASH ROW: FirstName: 'Christina' -> 'christina' | LastName: 'Park' -> 'park' | Address: '37987 Becky Wells Apt. 935, Port Gary, NC 79584' -> '37987 becky wells apt. 935, port gary, nc 79584' | Email: 'christina.park@example.com' -> 'christina.park@example.com' | Salary: '106994' -> '106994'
2026-01-14 13:19:00,610 - dq_comparison - INFO - DEBUG HASH STRING: christina|park|37987 becky wells apt. 935, port gary, nc 79584|christina.park@example.com|106994...
2026-01-14 13:19:00,611 - dq_comparison - INFO - DEBUG HASH RESULT: c7928894...
2026-01-14 13:19:00,612 - dq_comparison - INFO - DEBUG HASH ROW: FirstName: 'Barbara' -> 'barbara' | LastName: 'Morgan' -> 'morgan' | Address: '1324 Barbara Camp Suite 372, Port Nicolefort, FL 24835' -> '1324 barbara camp suite 372, port nicolefort, fl 24835' | Email: 'barbara.morgan@example.com' -> 'barbara.morgan@example.com' | Salary: '38187' -> '38187'
2026-01-14 13:19:00,612 - dq_comparison - INFO - DEBUG HASH STRING: barbara|morgan|1324 barbara camp suite 372, port nicolefort, fl 24835|barbara.morgan@example.com|38187...
2026-01-14 13:19:00,613 - dq_comparison - INFO - DEBUG HASH RESULT: 3bac009c...
2026-01-14 13:19:00,615 - dq_comparison - INFO - DEBUG HASH ROW: FirstName: 'April' -> 'april' | LastName: 'Lee' -> 'lee' | Address: '31438 Omar Avenue, North Sarahville, FL 51548' -> '31438 omar avenue, north sarahville, fl 51548' | Email: 'april.lee@example.com' -> 'april.lee@example.com' | Salary: '71935' -> '71935'
2026-01-14 13:19:00,615 - dq_comparison - INFO - DEBUG HASH STRING: april|lee|31438 omar avenue, north sarahville, fl 51548|april.lee@example.com|71935...
2026-01-14 13:19:00,616 - dq_comparison - INFO - DEBUG HASH RESULT: 0b77e379...
2026-01-14 13:19:00,621 - dq_comparison - INFO - DEBUG HASH ROW: FirstName: 'Christina' -> 'christina' | LastName: 'Morrison' -> 'morrison' | Address: 'USNV Brown, FPO AA 95726' -> 'usnv brown, fpo aa 95726' | Email: 'christina.morrison@example.com' -> 'christina.morrison@example.com' | Salary: '100357' -> '100357'
2026-01-14 13:19:00,622 - dq_comparison - INFO - DEBUG HASH STRING: christina|morrison|usnv brown, fpo aa 95726|christina.morrison@example.com|100357...
2026-01-14 13:19:00,623 - dq_comparison - INFO - DEBUG HASH RESULT: 4295f44a...
2026-01-14 13:19:00,624 - dq_comparison - INFO - DEBUG HASH ROW: FirstName: 'Jennifer' -> 'jennifer' | LastName: 'Morgan' -> 'morgan' | Address: '37845 Christopher Motorway, Wintersland, PA 90021' -> '37845 christopher motorway, wintersland, pa 90021' | Email: 'jennifer.morgan@example.com' -> 'jennifer.morgan@example.com' | Salary: '74962' -> '74962'
2026-01-14 13:19:00,624 - dq_comparison - INFO - DEBUG HASH STRING: jennifer|morgan|37845 christopher motorway, wintersland, pa 90021|jennifer.morgan@example.com|74962...
2026-01-14 13:19:00,625 - dq_comparison - INFO - DEBUG HASH RESULT: 2b663a45...
2026-01-14 13:19:00,626 - dq_comparison - INFO - DEBUG HASH ROW: FirstName: 'David' -> 'david' | LastName: 'Duran' -> 'duran' | Address: '1515 James Land Suite 516, Hamiltonville, MA 70369' -> '1515 james land suite 516, hamiltonville, ma 70369' | Email: 'david.duran@example.com' -> 'david.duran@example.com' | Salary: '98121' -> '98121'
2026-01-14 13:19:00,626 - dq_comparison - INFO - DEBUG HASH STRING: david|duran|1515 james land suite 516, hamiltonville, ma 70369|david.duran@example.com|98121...
2026-01-14 13:19:00,627 - dq_comparison - INFO - DEBUG HASH RESULT: 3bcdfb18...
2026-01-14 13:19:00,628 - dq_comparison - INFO - DEBUG HASH ROW: FirstName: 'Jordan' -> 'jordan' | LastName: 'Wood' -> 'wood' | Address: '12606 Johnson Unions Apt. 511, East Ryan, KS 99517' -> '12606 johnson unions apt. 511, east ryan, ks 99517' | Email: 'jordan.wood@example.com' -> 'jordan.wood@example.com' | Salary: '45422' -> '45422'
2026-01-14 13:19:00,628 - dq_comparison - INFO - DEBUG HASH STRING: jordan|wood|12606 johnson unions apt. 511, east ryan, ks 99517|jordan.wood@example.com|45422...
2026-01-14 13:19:00,629 - dq_comparison - INFO - DEBUG HASH RESULT: 5f88a902...
2026-01-14 13:19:00,630 - dq_comparison - INFO - DEBUG HASH ROW: FirstName: 'Jeffrey' -> 'jeffrey' | LastName: 'Freeman' -> 'freeman' | Address: '871 Gary Mill, Osbornchester, HI 96073' -> '871 gary mill, osbornchester, hi 96073' | Email: 'jeffrey.freeman@example.com' -> 'jeffrey.freeman@example.com' | Salary: '111634' -> '111634'
2026-01-14 13:19:00,630 - dq_comparison - INFO - DEBUG HASH STRING: jeffrey|freeman|871 gary mill, osbornchester, hi 96073|jeffrey.freeman@example.com|111634...
2026-01-14 13:19:00,631 - dq_comparison - INFO - DEBUG HASH RESULT: 5010eeb7...
2026-01-14 13:19:00,632 - dq_comparison - INFO - DEBUG HASH ROW: FirstName: 'Elizabeth' -> 'elizabeth' | LastName: 'Wright' -> 'wright' | Address: '1136 Jason Loop Apt. 649, Kendraburgh, PA 88529' -> '1136 jason loop apt. 649, kendraburgh, pa 88529' | Email: 'elizabeth.wright@example.com' -> 'elizabeth.wright@example.com' | Salary: '99097' -> '99097'
2026-01-14 13:19:00,634 - dq_comparison - INFO - DEBUG HASH STRING: elizabeth|wright|1136 jason loop apt. 649, kendraburgh, pa 88529|elizabeth.wright@example.com|99097...
2026-01-14 13:19:00,636 - dq_comparison - INFO - DEBUG HASH RESULT: 1f8fd7dc...
2026-01-14 13:19:00,637 - dq_comparison - INFO - DEBUG HASH ROW: FirstName: 'Martin' -> 'martin' | LastName: 'Reed' -> 'reed' | Address: '64883 Daniels Estates, Jodifort, MS 28546' -> '64883 daniels estates, jodifort, ms 28546' | Email: 'martin.reed@example.com' -> 'martin.reed@example.com' | Salary: '114429' -> '114429'
2026-01-14 13:19:00,637 - dq_comparison - INFO - DEBUG HASH STRING: martin|reed|64883 daniels estates, jodifort, ms 28546|martin.reed@example.com|114429...
2026-01-14 13:19:00,638 - dq_comparison - INFO - DEBUG HASH RESULT: d618d6f3...
2026-01-14 13:19:00,639 - dq_comparison - INFO - DEBUG HASH ROW: FirstName: 'Elizabeth' -> 'elizabeth' | LastName: 'Lane' -> 'lane' | Address: '806 Smith Mills Apt. 737, Evanshaven, WA 13442' -> '806 smith mills apt. 737, evanshaven, wa 13442' | Email: 'elizabeth.lane@example.com' -> 'elizabeth.lane@example.com' | Salary: '93270' -> '93270'
2026-01-14 13:19:00,639 - dq_comparison - INFO - DEBUG HASH STRING: elizabeth|lane|806 smith mills apt. 737, evanshaven, wa 13442|elizabeth.lane@example.com|93270...
2026-01-14 13:19:00,640 - dq_comparison - INFO - DEBUG HASH RESULT: 2f8464df...
2026-01-14 13:19:00,641 - dq_comparison - INFO - DEBUG HASH ROW: FirstName: 'Michael' -> 'michael' | LastName: 'Jordan' -> 'jordan' | Address: 'USS Flores, FPO AP 36260' -> 'uss flores, fpo ap 36260' | Email: 'michael.jordan@example.com' -> 'michael.jordan@example.com' | Salary: '76901' -> '76901'
2026-01-14 13:19:00,641 - dq_comparison - INFO - DEBUG HASH STRING: michael|jordan|uss flores, fpo ap 36260|michael.jordan@example.com|76901...
2026-01-14 13:19:00,641 - dq_comparison - INFO - DEBUG HASH RESULT: 0d826e2e...
2026-01-14 13:19:00,642 - dq_comparison - INFO - DEBUG HASH ROW: FirstName: 'Edward' -> 'edward' | LastName: 'Ramirez' -> 'ramirez' | Address: '61072 Anthony Throughway Suite 039, New Brittany, WY 99273' -> '61072 anthony throughway suite 039, new brittany, wy 99273' | Email: 'edward.ramirez@example.com' -> 'edward.ramirez@example.com' | Salary: '40447' -> '40447'
2026-01-14 13:19:00,643 - dq_comparison - INFO - DEBUG HASH STRING: edward|ramirez|61072 anthony throughway suite 039, new brittany, wy 99273|edward.ramirez@example.com|40447...
2026-01-14 13:19:00,643 - dq_comparison - INFO - DEBUG HASH RESULT: 133a8658...
2026-01-14 13:19:00,644 - dq_comparison - INFO - DEBUG HASH ROW: FirstName: 'Linda' -> 'linda' | LastName: 'Melendez' -> 'melendez' | Address: '022 Floyd Route Apt. 449, Port Samuel, MT 24126' -> '022 floyd route apt. 449, port samuel, mt 24126' | Email: 'linda.melendez@example.com' -> 'linda.melendez@example.com' | Salary: '117596' -> '117596'
2026-01-14 13:19:00,644 - dq_comparison - INFO - DEBUG HASH STRING: linda|melendez|022 floyd route apt. 449, port samuel, mt 24126|linda.melendez@example.com|117596...
2026-01-14 13:19:00,645 - dq_comparison - INFO - DEBUG HASH RESULT: de9fd6c3...
2026-01-14 13:19:00,646 - dq_comparison - INFO - DEBUG HASH ROW: FirstName: 'Douglas' -> 'douglas' | LastName: 'Smith' -> 'smith' | Address: 'USCGC Tapia, FPO AE 73916' -> 'uscgc tapia, fpo ae 73916' | Email: 'douglas.smith@example.com' -> 'douglas.smith@example.com' | Salary: '44106' -> '44106'
2026-01-14 13:19:00,646 - dq_comparison - INFO - DEBUG HASH STRING: douglas|smith|uscgc tapia, fpo ae 73916|douglas.smith@example.com|44106...
2026-01-14 13:19:00,651 - dq_comparison - INFO - DEBUG HASH RESULT: a884bf8c...
2026-01-14 13:19:00,653 - dq_comparison - INFO - DEBUG HASH ROW: FirstName: 'Nathaniel' -> 'nathaniel' | LastName: 'White' -> 'white' | Address: '264 Chavez Forge, Johnsonfort, WV 27270' -> '264 chavez forge, johnsonfort, wv 27270' | Email: 'nathaniel.white@example.com' -> 'nathaniel.white@example.com' | Salary: '85426' -> '85426'
2026-01-14 13:19:00,653 - dq_comparison - INFO - DEBUG HASH STRING: nathaniel|white|264 chavez forge, johnsonfort, wv 27270|nathaniel.white@example.com|85426...
2026-01-14 13:19:00,654 - dq_comparison - INFO - DEBUG HASH RESULT: b2bfd814...
2026-01-14 13:19:00,655 - dq_comparison - INFO - DEBUG HASH ROW: FirstName: 'Connie' -> 'connie' | LastName: 'Nguyen' -> 'nguyen' | Address: '44857 Washington Island, Lake Charlenefort, MA 32869' -> '44857 washington island, lake charlenefort, ma 32869' | Email: 'connie.nguyen@example.com' -> 'connie.nguyen@example.com' | Salary: '88819' -> '88819'
2026-01-14 13:19:00,655 - dq_comparison - INFO - DEBUG HASH STRING: connie|nguyen|44857 washington island, lake charlenefort, ma 32869|connie.nguyen@example.com|88819...
2026-01-14 13:19:00,656 - dq_comparison - INFO - DEBUG HASH RESULT: 7139c074...
2026-01-14 13:19:00,657 - dq_comparison - INFO - DEBUG HASH ROW: FirstName: 'Lisa' -> 'lisa' | LastName: 'Woods' -> 'woods' | Address: '5235 Duffy Field, Millerfort, MI 34624' -> '5235 duffy field, millerfort, mi 34624' | Email: 'LISA.WOODS@EXAMPLE.COM' -> 'lisa.woods@example.com' | Salary: '61162' -> '61162'
2026-01-14 13:19:00,657 - dq_comparison - INFO - DEBUG HASH STRING: lisa|woods|5235 duffy field, millerfort, mi 34624|lisa.woods@example.com|61162...
2026-01-14 13:19:00,658 - dq_comparison - INFO - DEBUG HASH RESULT: f6b80724...
2026-01-14 13:19:00,659 - dq_comparison - INFO - DEBUG HASH ROW: FirstName: 'Jeanne' -> 'jeanne' | LastName: 'Nichols' -> 'nichols' | Address: '8137 Nicholas Wells, South Andreaton, SC 99338' -> '8137 nicholas wells, south andreaton, sc 99338' | Email: 'JEANNE.NICHOLS@EXAMPLE.COM' -> 'jeanne.nichols@example.com' | Salary: '98239' -> '98239'
2026-01-14 13:19:00,659 - dq_comparison - INFO - DEBUG HASH STRING: jeanne|nichols|8137 nicholas wells, south andreaton, sc 99338|jeanne.nichols@example.com|98239...
2026-01-14 13:19:00,660 - dq_comparison - INFO - DEBUG HASH RESULT: 90aa9567...
2026-01-14 13:19:00,661 - dq_comparison - INFO - DEBUG HASH ROW: FirstName: 'Logan' -> 'logan' | LastName: 'Gross' -> 'gross' | Address: '2148 Blair Mission, Marybury, ID 53359' -> '2148 blair mission, marybury, id 53359' | Email: 'LOGAN.GROSS@EXAMPLE.COM' -> 'logan.gross@example.com' | Salary: '60926' -> '60926'
2026-01-14 13:19:00,661 - dq_comparison - INFO - DEBUG HASH STRING: logan|gross|2148 blair mission, marybury, id 53359|logan.gross@example.com|60926...
2026-01-14 13:19:00,662 - dq_comparison - INFO - DEBUG HASH RESULT: 0120b598...
2026-01-14 13:19:00,664 - dq_comparison - INFO - DEBUG HASH ROW: FirstName: 'Kevin' -> 'kevin' | LastName: 'Yates' -> 'yates' | Address: '487 Bryant Union, Julianfort, CO 40601' -> '487 bryant union, julianfort, co 40601' | Email: 'KEVIN.YATES@EXAMPLE.COM' -> 'kevin.yates@example.com' | Salary: '111507' -> '111507'
2026-01-14 13:19:00,666 - dq_comparison - INFO - DEBUG HASH STRING: kevin|yates|487 bryant union, julianfort, co 40601|kevin.yates@example.com|111507...
2026-01-14 13:19:00,668 - dq_comparison - INFO - DEBUG HASH RESULT: 0d26ec09...
2026-01-14 13:19:00,669 - dq_comparison - INFO - DEBUG HASH ROW: FirstName: 'Lisa' -> 'lisa' | LastName: 'Moore' -> 'moore' | Address: '05862 Pacheco Crossroad Suite 078, Weisshaven, TN 83237' -> '05862 pacheco crossroad suite 078, weisshaven, tn 83237' | Email: 'LISA.MOORE@EXAMPLE.COM' -> 'lisa.moore@example.com' | Salary: '34060' -> '34060'
2026-01-14 13:19:00,670 - dq_comparison - INFO - DEBUG HASH STRING: lisa|moore|05862 pacheco crossroad suite 078, weisshaven, tn 83237|lisa.moore@example.com|34060...
2026-01-14 13:19:00,670 - dq_comparison - INFO - DEBUG HASH RESULT: 128e0863...
2026-01-14 13:19:00,672 - dq_comparison - INFO - DEBUG HASH ROW: FirstName: 'Scott' -> 'scott' | LastName: 'Ashley' -> 'ashley' | Address: '  692 Stephanie Stravenue Suite 698, South Angela, TX 20461  ' -> '692 stephanie stravenue suite 698, south angela, tx 20461' | Email: 'scott.ashley@example.com' -> 'scott.ashley@example.com' | Salary: '113363' -> '113363'
2026-01-14 13:19:00,672 - dq_comparison - INFO - DEBUG HASH STRING: scott|ashley|692 stephanie stravenue suite 698, south angela, tx 20461|scott.ashley@example.com|113363...
2026-01-14 13:19:00,673 - dq_comparison - INFO - DEBUG HASH RESULT: ddd3dfbd...
2026-01-14 13:19:00,674 - dq_comparison - INFO - DEBUG HASH ROW: FirstName: 'David' -> 'david' | LastName: 'Baker' -> 'baker' | Address: '  31596 Cooper Turnpike, Cynthiamouth, UT 15112  ' -> '31596 cooper turnpike, cynthiamouth, ut 15112' | Email: 'david.baker@example.com' -> 'david.baker@example.com' | Salary: '93681' -> '93681'
2026-01-14 13:19:00,674 - dq_comparison - INFO - DEBUG HASH STRING: david|baker|31596 cooper turnpike, cynthiamouth, ut 15112|david.baker@example.com|93681...
2026-01-14 13:19:00,674 - dq_comparison - INFO - DEBUG HASH RESULT: 3a216c46...
2026-01-14 13:19:00,675 - dq_comparison - INFO - DEBUG HASH ROW: FirstName: 'Rachel' -> 'rachel' | LastName: 'Rodriguez' -> 'rodriguez' | Address: '  72284 Jessica Fall, East Jeremy, GA 04567  ' -> '72284 jessica fall, east jeremy, ga 04567' | Email: 'rachel.rodriguez@example.com' -> 'rachel.rodriguez@example.com' | Salary: '77279' -> '77279'
2026-01-14 13:19:00,675 - dq_comparison - INFO - DEBUG HASH STRING: rachel|rodriguez|72284 jessica fall, east jeremy, ga 04567|rachel.rodriguez@example.com|77279...
2026-01-14 13:19:00,676 - dq_comparison - INFO - DEBUG HASH RESULT: 098e9fe1...
2026-01-14 13:19:00,677 - dq_comparison - INFO - DEBUG HASH ROW: FirstName: 'Jonathan' -> 'jonathan' | LastName: 'Brown' -> 'brown' | Address: '  1045 Mosley Mills Apt. 818, Lewisland, MI 95655  ' -> '1045 mosley mills apt. 818, lewisland, mi 95655' | Email: 'jonathan.brown@example.com' -> 'jonathan.brown@example.com' | Salary: '84295' -> '84295'
2026-01-14 13:19:00,678 - dq_comparison - INFO - DEBUG HASH STRING: jonathan|brown|1045 mosley mills apt. 818, lewisland, mi 95655|jonathan.brown@example.com|84295...
2026-01-14 13:19:00,678 - dq_comparison - INFO - DEBUG HASH RESULT: 837038e1...
2026-01-14 13:19:00,679 - dq_comparison - INFO - DEBUG HASH ROW: FirstName: 'Stephanie' -> 'stephanie' | LastName: 'Jordan' -> 'jordan' | Address: '  938 Knight Junction, New Molly, WY 16427  ' -> '938 knight junction, new molly, wy 16427' | Email: 'stephanie.jordan@example.com' -> 'stephanie.jordan@example.com' | Salary: '62444' -> '62444'
2026-01-14 13:19:00,683 - dq_comparison - INFO - DEBUG HASH STRING: stephanie|jordan|938 knight junction, new molly, wy 16427|stephanie.jordan@example.com|62444...
2026-01-14 13:19:00,683 - dq_comparison - INFO - DEBUG HASH RESULT: 65e580d8...
2026-01-14 13:19:00,685 - dq_comparison - INFO - DEBUG HASH ROW: FirstName: 'Kathleen' -> 'kathleen' | LastName: 'Medina' -> 'medina' | Address: 'nan' -> 'NULL' | Email: 'kathleen.medina@example.com' -> 'kathleen.medina@example.com' | Salary: '108150' -> '108150'
2026-01-14 13:19:00,686 - dq_comparison - INFO - DEBUG HASH STRING: kathleen|medina|NULL|kathleen.medina@example.com|108150...
2026-01-14 13:19:00,686 - dq_comparison - INFO - DEBUG HASH RESULT: 7c7ea3b9...
2026-01-14 13:19:00,688 - dq_comparison - INFO - DEBUG HASH ROW: FirstName: 'Donna' -> 'donna' | LastName: 'Melton' -> 'melton' | Address: 'nan' -> 'NULL' | Email: 'donna.melton@example.com' -> 'donna.melton@example.com' | Salary: '55606' -> '55606'
2026-01-14 13:19:00,688 - dq_comparison - INFO - DEBUG HASH STRING: donna|melton|NULL|donna.melton@example.com|55606...
2026-01-14 13:19:00,689 - dq_comparison - INFO - DEBUG HASH RESULT: e0f085bb...
2026-01-14 13:19:00,690 - dq_comparison - INFO - DEBUG HASH ROW: FirstName: 'Connor' -> 'connor' | LastName: 'Hull' -> 'hull' | Address: 'nan' -> 'NULL' | Email: 'connor.hull@example.com' -> 'connor.hull@example.com' | Salary: '65948' -> '65948'
2026-01-14 13:19:00,690 - dq_comparison - INFO - DEBUG HASH STRING: connor|hull|NULL|connor.hull@example.com|65948...
2026-01-14 13:19:00,691 - dq_comparison - INFO - DEBUG HASH RESULT: 743281dd...
2026-01-14 13:19:00,692 - dq_comparison - INFO - DEBUG HASH ROW: FirstName: 'Stacey' -> 'stacey' | LastName: 'Jacobs' -> 'jacobs' | Address: 'nan' -> 'NULL' | Email: 'stacey.jacobs@example.com' -> 'stacey.jacobs@example.com' | Salary: '38311' -> '38311'
2026-01-14 13:19:00,692 - dq_comparison - INFO - DEBUG HASH STRING: stacey|jacobs|NULL|stacey.jacobs@example.com|38311...
2026-01-14 13:19:00,693 - dq_comparison - INFO - DEBUG HASH RESULT: d5152aba...
2026-01-14 13:19:00,695 - dq_comparison - INFO - DEBUG HASH ROW: FirstName: 'Mark' -> 'mark' | LastName: 'Lester' -> 'lester' | Address: 'nan' -> 'NULL' | Email: 'mark.lester@example.com' -> 'mark.lester@example.com' | Salary: '37605' -> '37605'
2026-01-14 13:19:00,699 - dq_comparison - INFO - DEBUG HASH STRING: mark|lester|NULL|mark.lester@example.com|37605...
2026-01-14 13:19:00,700 - dq_comparison - INFO - DEBUG HASH RESULT: 443bd0bc...
2026-01-14 13:19:00,701 - dq_comparison - INFO - === DEBUG: SAMPLE HASHES ===
2026-01-14 13:19:00,702 - dq_comparison - INFO - Hash 1: 3a292fb56a305347... (sample row 0)
2026-01-14 13:19:00,702 - dq_comparison - INFO - Hash 2: ba17cf28809efc77... (sample row 1)
2026-01-14 13:19:00,703 - dq_comparison - INFO - Hash 3: 631588719c6454e5... (sample row 2)
2026-01-14 13:19:00,704 - dq_comparison - INFO - Generating hashes for target data (50 rows)...
2026-01-14 13:19:00,718 - dq_comparison - INFO - 
======================================================================
2026-01-14 13:19:00,719 - dq_comparison - INFO - 🔍 DEBUG: ANALYZING WHY HASHES DON'T MATCH
2026-01-14 13:19:00,719 - dq_comparison - INFO - ======================================================================
2026-01-14 13:19:00,720 - dq_comparison - INFO - 
--- Analyzing Row 0 ---
2026-01-14 13:19:00,721 - dq_comparison - INFO - Column 'FirstName' → 'FirstName':
2026-01-14 13:19:00,722 - dq_comparison - INFO -   Source: 'Mark' (type: str) → 'mark'
2026-01-14 13:19:00,723 - dq_comparison - INFO -   Target: 'Mark' (type: str) → 'mark'
2026-01-14 13:19:00,723 - dq_comparison - INFO -   Match after normalization: ✅ YES
2026-01-14 13:19:00,724 - dq_comparison - INFO - Column 'LastName' → 'LastName':
2026-01-14 13:19:00,724 - dq_comparison - INFO -   Source: 'Morris' (type: str) → 'morris'
2026-01-14 13:19:00,725 - dq_comparison - INFO -   Target: 'Morris' (type: str) → 'morris'
2026-01-14 13:19:00,731 - dq_comparison - INFO -   Match after normalization: ✅ YES
2026-01-14 13:19:00,731 - dq_comparison - INFO - Column 'Address' → 'Address':
2026-01-14 13:19:00,732 - dq_comparison - INFO -   Source: '6702 Watson Bypass, Brownland, KS 13081' (type: str) → '6702 watson bypass, brownland, ks 13081'
2026-01-14 13:19:00,733 - dq_comparison - INFO -   Target: '6702 Watson Bypass, Brownland, KS 13081' (type: str) → '6702 watson bypass, brownland, ks 13081'
2026-01-14 13:19:00,733 - dq_comparison - INFO -   Match after normalization: ✅ YES
2026-01-14 13:19:00,734 - dq_comparison - INFO - Column 'Email' → 'Email':
2026-01-14 13:19:00,735 - dq_comparison - INFO -   Source: 'mark.morris@example.com' (type: str) → 'mark.morris@example.com'
2026-01-14 13:19:00,735 - dq_comparison - INFO -   Target: 'mark.morris@example.com' (type: str) → 'mark.morris@example.com'
2026-01-14 13:19:00,736 - dq_comparison - INFO -   Match after normalization: ✅ YES
2026-01-14 13:19:00,737 - dq_comparison - INFO - Column 'Salary' → 'Salary':
2026-01-14 13:19:00,738 - dq_comparison - INFO -   Source: '111916' (type: int64) → '111916'
2026-01-14 13:19:00,738 - dq_comparison - INFO -   Target: '111916' (type: int64) → '111916'
2026-01-14 13:19:00,739 - dq_comparison - INFO -   Match after normalization: ✅ YES
2026-01-14 13:19:00,740 - dq_comparison - INFO - 
Hash components for Row 0:
2026-01-14 13:19:00,740 - dq_comparison - INFO - Source hash string start: mark|morris|6702 watson bypass, brownland, ks 13081...
2026-01-14 13:19:00,741 - dq_comparison - INFO - Target hash string start: mark|morris|6702 watson bypass, brownland, ks 13081...
2026-01-14 13:19:00,743 - dq_comparison - INFO - Same? ✅ YES
2026-01-14 13:19:00,746 - dq_comparison - INFO - 
--- Analyzing Row 1 ---
2026-01-14 13:19:00,747 - dq_comparison - INFO - Column 'FirstName' → 'FirstName':
2026-01-14 13:19:00,747 - dq_comparison - INFO -   Source: 'Dennis' (type: str) → 'dennis'
2026-01-14 13:19:00,748 - dq_comparison - INFO -   Target: 'Dennis' (type: str) → 'dennis'
2026-01-14 13:19:00,749 - dq_comparison - INFO -   Match after normalization: ✅ YES
2026-01-14 13:19:00,750 - dq_comparison - INFO - Column 'LastName' → 'LastName':
2026-01-14 13:19:00,750 - dq_comparison - INFO -   Source: 'Owens' (type: str) → 'owens'
2026-01-14 13:19:00,751 - dq_comparison - INFO -   Target: 'Owens' (type: str) → 'owens'
2026-01-14 13:19:00,752 - dq_comparison - INFO -   Match after normalization: ✅ YES
2026-01-14 13:19:00,753 - dq_comparison - INFO - Column 'Address' → 'Address':
2026-01-14 13:19:00,754 - dq_comparison - INFO -   Source: '815 Rogers Row Apt. 396, Williamfurt, WA 10567' (type: str) → '815 rogers row apt. 396, williamfurt, wa 10567'
2026-01-14 13:19:00,754 - dq_comparison - INFO -   Target: '815 Rogers Row Apt. 396, Williamfurt, WA 10567' (type: str) → '815 rogers row apt. 396, williamfurt, wa 10567'
2026-01-14 13:19:00,755 - dq_comparison - INFO -   Match after normalization: ✅ YES
2026-01-14 13:19:00,756 - dq_comparison - INFO - Column 'Email' → 'Email':
2026-01-14 13:19:00,761 - dq_comparison - INFO -   Source: 'dennis.owens@example.com' (type: str) → 'dennis.owens@example.com'
2026-01-14 13:19:00,762 - dq_comparison - INFO -   Target: 'dennis.owens@example.com' (type: str) → 'dennis.owens@example.com'
2026-01-14 13:19:00,763 - dq_comparison - INFO -   Match after normalization: ✅ YES
2026-01-14 13:19:00,763 - dq_comparison - INFO - Column 'Salary' → 'Salary':
2026-01-14 13:19:00,764 - dq_comparison - INFO -   Source: '39264' (type: int64) → '39264'
2026-01-14 13:19:00,764 - dq_comparison - INFO -   Target: '39264' (type: int64) → '39264'
2026-01-14 13:19:00,765 - dq_comparison - INFO -   Match after normalization: ✅ YES
2026-01-14 13:19:00,766 - dq_comparison - INFO - 
Hash components for Row 1:
2026-01-14 13:19:00,767 - dq_comparison - INFO - Source hash string start: dennis|owens|815 rogers row apt. 396, williamfurt, wa 10567...
2026-01-14 13:19:00,767 - dq_comparison - INFO - Target hash string start: dennis|owens|815 rogers row apt. 396, williamfurt, wa 10567...
2026-01-14 13:19:00,768 - dq_comparison - INFO - Same? ✅ YES
2026-01-14 13:19:00,768 - dq_comparison - INFO - 
--- Analyzing Row 2 ---
2026-01-14 13:19:00,769 - dq_comparison - INFO - Column 'FirstName' → 'FirstName':
2026-01-14 13:19:00,770 - dq_comparison - INFO -   Source: 'Felicia' (type: str) → 'felicia'
2026-01-14 13:19:00,771 - dq_comparison - INFO -   Target: 'Felicia' (type: str) → 'felicia'
2026-01-14 13:19:00,771 - dq_comparison - INFO -   Match after normalization: ✅ YES
2026-01-14 13:19:00,773 - dq_comparison - INFO - Column 'LastName' → 'LastName':
2026-01-14 13:19:00,776 - dq_comparison - INFO -   Source: 'Hatfield' (type: str) → 'hatfield'
2026-01-14 13:19:00,776 - dq_comparison - INFO -   Target: 'Hatfield' (type: str) → 'hatfield'
2026-01-14 13:19:00,777 - dq_comparison - INFO -   Match after normalization: ✅ YES
2026-01-14 13:19:00,778 - dq_comparison - INFO - Column 'Address' → 'Address':
2026-01-14 13:19:00,778 - dq_comparison - INFO -   Source: '25439 Carney Mills Apt. 076, New April, CT 16626' (type: str) → '25439 carney mills apt. 076, new april, ct 16626'
2026-01-14 13:19:00,779 - dq_comparison - INFO -   Target: '25439 Carney Mills Apt. 076, New April, CT 16626' (type: str) → '25439 carney mills apt. 076, new april, ct 16626'
2026-01-14 13:19:00,780 - dq_comparison - INFO -   Match after normalization: ✅ YES
2026-01-14 13:19:00,780 - dq_comparison - INFO - Column 'Email' → 'Email':
2026-01-14 13:19:00,781 - dq_comparison - INFO -   Source: 'felicia.hatfield@example.com' (type: str) → 'felicia.hatfield@example.com'
2026-01-14 13:19:00,781 - dq_comparison - INFO -   Target: 'felicia.hatfield@example.com' (type: str) → 'felicia.hatfield@example.com'
2026-01-14 13:19:00,782 - dq_comparison - INFO -   Match after normalization: ✅ YES
2026-01-14 13:19:00,783 - dq_comparison - INFO - Column 'Salary' → 'Salary':
2026-01-14 13:19:00,783 - dq_comparison - INFO -   Source: '41191' (type: int64) → '41191'
2026-01-14 13:19:00,784 - dq_comparison - INFO -   Target: '41191' (type: int64) → '41191'
2026-01-14 13:19:00,784 - dq_comparison - INFO -   Match after normalization: ✅ YES
2026-01-14 13:19:00,785 - dq_comparison - INFO - 
Hash components for Row 2:
2026-01-14 13:19:00,786 - dq_comparison - INFO - Source hash string start: felicia|hatfield|25439 carney mills apt. 076, new april, ct 16626...
2026-01-14 13:19:00,786 - dq_comparison - INFO - Target hash string start: felicia|hatfield|25439 carney mills apt. 076, new april, ct 16626...
2026-01-14 13:19:00,787 - dq_comparison - INFO - Same? ✅ YES
2026-01-14 13:19:00,790 - dq_comparison - INFO - 
--- Column Data Types Analysis ---
2026-01-14 13:19:00,793 - dq_comparison - INFO - Column 1: 'FirstName' (object) ↔ 'FirstName' (object)
2026-01-14 13:19:00,793 - dq_comparison - INFO -   Sample: Source='Mark', Target='Mark'
2026-01-14 13:19:00,794 - dq_comparison - INFO - Column 2: 'LastName' (object) ↔ 'LastName' (object)
2026-01-14 13:19:00,795 - dq_comparison - INFO -   Sample: Source='Morris', Target='Morris'
2026-01-14 13:19:00,795 - dq_comparison - INFO - Column 3: 'Address' (object) ↔ 'Address' (object)
2026-01-14 13:19:00,795 - dq_comparison - INFO -   Sample: Source='6702 Watson Bypass, Brownland, KS 13081', Target='6702 Watson Bypass, Brownland, KS 13081'
2026-01-14 13:19:00,796 - dq_comparison - INFO - Column 4: 'Email' (object) ↔ 'Email' (object)
2026-01-14 13:19:00,796 - dq_comparison - INFO -   Sample: Source='mark.morris@example.com', Target='mark.morris@example.com'
2026-01-14 13:19:00,797 - dq_comparison - INFO - Column 5: 'Salary' (int64) ↔ 'Salary' (int64)
2026-01-14 13:19:00,797 - dq_comparison - INFO -   Sample: Source='111916', Target='111916'
2026-01-14 13:19:00,798 - dq_comparison - INFO - PERFORMING DETAILED ROW-LEVEL COMPARISON WITH PAGINATION...
2026-01-14 13:19:00,798 - dq_comparison - INFO - Hash-based Comparison Results (with duplicate handling):
2026-01-14 13:19:00,799 - dq_comparison - INFO -   • Unique source hashes: 50
2026-01-14 13:19:00,800 - dq_comparison - INFO -   • Unique target hashes: 50
2026-01-14 13:19:00,800 - dq_comparison - INFO -   • Common hashes: 10
2026-01-14 13:19:00,800 - dq_comparison - INFO -   • Common rows (counting duplicates): 10
2026-01-14 13:19:00,801 - dq_comparison - INFO -   • Rows only in source (counting duplicates): 40
2026-01-14 13:19:00,802 - dq_comparison - INFO -   • Rows only in target (counting duplicates): 40
2026-01-14 13:19:00,802 - dq_comparison - INFO - Found 40 source-only rows
2026-01-14 13:19:00,819 - dq_error_log - ERROR - MySQL Error logging error: Not all parameters were used in the SQL statement
2026-01-14 13:19:00,852 - dq_error_log - ERROR - MySQL Error logging error: Not all parameters were used in the SQL statement
2026-01-14 13:19:00,885 - dq_error_log - ERROR - MySQL Error logging error: Not all parameters were used in the SQL statement
2026-01-14 13:19:00,916 - dq_error_log - ERROR - MySQL Error logging error: Not all parameters were used in the SQL statement
2026-01-14 13:19:00,947 - dq_error_log - ERROR - MySQL Error logging error: Not all parameters were used in the SQL statement
2026-01-14 13:19:00,970 - dq_comparison - INFO - Found 40 target-only rows
2026-01-14 13:19:00,985 - dq_error_log - ERROR - MySQL Error logging error: Not all parameters were used in the SQL statement
2026-01-14 13:19:01,014 - dq_error_log - ERROR - MySQL Error logging error: Not all parameters were used in the SQL statement
2026-01-14 13:19:01,046 - dq_error_log - ERROR - MySQL Error logging error: Not all parameters were used in the SQL statement
2026-01-14 13:19:01,079 - dq_error_log - ERROR - MySQL Error logging error: Not all parameters were used in the SQL statement
2026-01-14 13:19:01,115 - dq_error_log - ERROR - MySQL Error logging error: Not all parameters were used in the SQL statement
2026-01-14 13:19:01,131 - dq_comparison - INFO - HASH-ONLY COMPARISON COMPLETED
2026-01-14 13:19:01,131 - dq_comparison - INFO - Returning counts for simple scoring:
2026-01-14 13:19:01,132 - dq_comparison - INFO -   Common rows: 10
2026-01-14 13:19:01,132 - dq_comparison - INFO -   Unique to source: 40
2026-01-14 13:19:01,133 - dq_comparison - INFO -   Unique to target: 40
2026-01-14 13:19:01,134 - dq_comparison - INFO -   Value mismatches: 640
2026-01-14 13:19:01,135 - dq_comparison - INFO -   Missing rows: 40
2026-01-14 13:19:01,135 - dq_comparison - INFO -   Extra rows: 40
2026-01-14 13:19:01,136 - dq_comparison - INFO - 
6️⃣ DATA QUALITY ANALYSIS
2026-01-14 13:19:01,137 - dq_comparison - INFO - Analyzing data quality metrics...
2026-01-14 13:19:01,155 - dq_comparison - INFO - Null values - Source: 5 (1.25%), Target: 5 (1.25%)
2026-01-14 13:19:01,157 - dq_comparison - INFO - Duplicate rows (normalized) - Source: 0, Target: 0
2026-01-14 13:19:01,174 - dq_error_log - INFO - Retrieved 0 error logs for session CMP_20260114_131900
2026-01-14 13:19:01,175 - dq_comparison - INFO - 
📊 SIMPLE SCORING CALCULATION:
2026-01-14 13:19:01,176 - dq_comparison - INFO -   Source rows: 50
2026-01-14 13:19:01,180 - dq_comparison - INFO -   Common rows (matched): 10
2026-01-14 13:19:01,181 - dq_comparison - INFO -   Calculation: (10 / 50) * 100 = 20.00%
2026-01-14 13:19:01,182 - dq_comparison - INFO -   Explanation: 10 matched rows out of 50 total source rows
2026-01-14 13:19:01,182 - dq_comparison - INFO - 
=== AUDIT LOGGING SECTION ===
2026-01-14 13:19:01,188 - dq_comparison - INFO - 🔍 Audit logging is ENABLED in APP_SETTINGS
2026-01-14 13:19:01,188 - dq_audit - INFO - Audit class initialized with database: dq_checks
2026-01-14 13:19:01,189 - dq_comparison - INFO - Attempting to log audit record for session: CMP_20260114_131900
2026-01-14 13:19:01,192 - dq_audit - INFO - Starting database insertion for comparison...
2026-01-14 13:19:01,216 - dq_audit - INFO - Inserted comparison record with ID: 661
2026-01-14 13:19:01,217 - dq_comparison - INFO - ✅ Audit record logged successfully (ID: 661)
2026-01-14 13:19:01,218 - dq_comparison - INFO - 
======================================================================
2026-01-14 13:19:01,222 - dq_comparison - INFO - 📊 COMPARISON RESULTS SUMMARY
2026-01-14 13:19:01,224 - dq_comparison - INFO - ======================================================================
2026-01-14 13:19:01,226 - dq_comparison - INFO - Session ID: CMP_20260114_131900
2026-01-14 13:19:01,226 - dq_comparison - INFO - Source: Excel: test_source.xlsx (Sheet1) (50 rows)
2026-01-14 13:19:01,227 - dq_comparison - INFO - Target: CSV: test_target.csv (50 rows)
2026-01-14 13:19:01,228 - dq_comparison - INFO - Selected columns: 8
2026-01-14 13:19:01,228 - dq_comparison - INFO - ----------------------------------------------------------------------
2026-01-14 13:19:01,229 - dq_comparison - INFO - 1️⃣ Row count match: ✅ Yes
2026-01-14 13:19:01,230 - dq_comparison - INFO - 2️⃣ Column structure match: ✅ Yes
2026-01-14 13:19:01,230 - dq_comparison - INFO - 3️ Primary key validation: ✅ Passed
2026-01-14 13:19:01,231 - dq_comparison - INFO -    Key fields: ['CustomerID', 'CustomerID']
2026-01-14 13:19:01,232 - dq_comparison - INFO - 4️ Table metadata: ✅ Match
2026-01-14 13:19:01,232 - dq_comparison - INFO - 5️⃣ Common rows (both datasets): 10 (20.00% of source)
2026-01-14 13:19:01,233 - dq_comparison - INFO - 6️⃣ Source-only rows: 40
2026-01-14 13:19:01,234 - dq_comparison - INFO - 7️⃣ Target-only rows: 40
2026-01-14 13:19:01,235 - dq_comparison - INFO - 8️⃣ Column value mismatches: 0
2026-01-14 13:19:01,236 - dq_comparison - INFO - 9️ Data quality match: ✅ Yes
2026-01-14 13:19:01,239 - dq_comparison - INFO - 📈 DQ Score: 20.00%
2026-01-14 13:19:01,242 - dq_comparison - INFO - 📊 Calculation: (10 / 50) * 100 = 20.00%
2026-01-14 13:19:01,243 - dq_comparison - INFO - ======================================================================
2026-01-14 13:19:01,243 - dq_comparison - INFO - 
❌ LOW MATCH! Major differences found.
2026-01-14 13:19:01,244 - dq_comparison - INFO - 
🔍 NORMALIZATION APPLIED:
2026-01-14 13:19:01,244 - dq_comparison - INFO -    • NULL values → 'NULL' (consistent representation)
2026-01-14 13:19:01,245 - dq_comparison - INFO -    • Dates → YYYY-MM-DD format
2026-01-14 13:19:01,246 - dq_comparison - INFO -    • Strings → trimmed + lowercase
2026-01-14 13:19:01,247 - dq_comparison - INFO -    • Numeric values → standardized format
2026-01-14 13:19:01,247 - dq_comparison - INFO -    • Phone numbers → digits only, ALL leading zeros removed
2026-01-14 13:19:01,248 - dq_comparison - INFO -    • Extra whitespace removed
2026-01-14 13:19:01,249 - dq_comparison - INFO - 
🔍 DETAILED ERROR ANALYSIS:
2026-01-14 13:19:01,250 - dq_comparison - INFO - --------------------------------------------------
2026-01-14 13:19:01,250 - dq_comparison - INFO - 📊 SOURCE-ONLY ROWS: 40 rows
2026-01-14 13:19:01,251 - dq_comparison - INFO -    Present only in Excel, missing from CSV
2026-01-14 13:19:01,253 - dq_comparison - INFO - 📊 TARGET-ONLY ROWS: 40 rows
2026-01-14 13:19:01,258 - dq_comparison - INFO -    Present only in CSV, extra (not in Excel)
2026-01-14 13:19:01,277 - dq_error_log - INFO - Retrieved 0 errors for session CMP_20260114_131900
2026-01-14 13:19:01,278 - dq_comparison - INFO - 
💡 For complete error details, run:
2026-01-14 13:19:01,279 - dq_comparison - INFO -    USE dq_checks;
2026-01-14 13:19:01,280 - dq_comparison - INFO -    SELECT excel_row, column_name, error_type, error_description,
2026-01-14 13:19:01,281 - dq_comparison - INFO -           actual_value, expected_value
2026-01-14 13:19:01,281 - dq_comparison - INFO -    FROM dq_error_logs
2026-01-14 13:19:01,282 - dq_comparison - INFO -    WHERE session_id = 'CMP_20260114_131900'
2026-01-14 13:19:01,283 - dq_comparison - INFO -    ORDER BY excel_row, column_name;
2026-01-14 13:19:01,308 - dq_error_log - ERROR - MySQL Error logging error: Not all parameters were used in the SQL statement
2026-01-14 13:19:01,328 - dq_comparison - INFO - 
✅ Comparison completed! Session ID: CMP_20260114_131900
2026-01-14 13:19:01,352 - dq_error_log - INFO - Retrieved 0 error logs for session CMP_20260114_131900
2026-01-14 13:19:01,376 - dq_error_log - INFO - Retrieved summary: 0 total errors for session CMP_20260114_131900
2026-01-14 13:19:01,377 - dq_audit - INFO - Audit class initialized with database: dq_checks
2026-01-14 13:19:01,401 - dq_audit - INFO - Retrieved 1 audit logs for session CMP_20260114_131900
2026-01-14 13:19:01,401 - dq_comparison - INFO - 
🔍 Final results verification:
2026-01-14 13:19:01,406 - dq_comparison - INFO -    Session ID: CMP_20260114_131900
2026-01-14 13:19:01,407 - dq_comparison - INFO -    DQ Score (Simple %): 20.00%
2026-01-14 13:19:01,407 - dq_comparison - INFO -    Source rows: 50
2026-01-14 13:19:01,409 - dq_comparison - INFO -    Matched rows: 10
2026-01-14 13:19:01,413 - dq_comparison - INFO -    Calculation: (10 / 50) * 100
2026-01-14 13:19:01,414 - __main__ - INFO - Source-Target Comparison completed successfully
2026-01-14 13:19:01,415 - __main__ - INFO - Displaying main menu options to user
2026-01-14 13:28:35,521 - __main__ - INFO - User selected option: 6
2026-01-14 13:28:35,522 - __main__ - INFO - User session ended. Duration: 0:09:52.330675
2026-01-14 13:28:35,522 - __main__ - INFO - 👋 Thank you for using Universal Data Quality Framework!
