2026-01-17 21:41:59,867 - root - INFO - CLI Mode Logging Initialized
2026-01-17 21:41:59,867 - root - INFO - CLI logs will be saved to: logs/dq_framework_20260117_214159.log
2026-01-17 21:41:59,867 - __main__ - INFO - 🚀 UNIVERSAL DATA QUALITY FRAMEWORK INITIALIZED
2026-01-17 21:41:59,868 - __main__ - INFO - Starting system resource check
2026-01-17 21:41:59,874 - __main__ - INFO - Total RAM: 15.7 GB
2026-01-17 21:41:59,874 - __main__ - INFO - Available RAM: 3.4 GB
2026-01-17 21:41:59,874 - __main__ - INFO - Memory used: 78.1%
2026-01-17 21:41:59,874 - __main__ - INFO - Memory status: OK
2026-01-17 21:41:59,875 - __main__ - INFO - Free disk space: 256.3 GB
2026-01-17 21:41:59,875 - __main__ - INFO - Disk used: 46.2%
2026-01-17 21:41:59,875 - __main__ - INFO - Disk space: OK
2026-01-17 21:42:00,376 - __main__ - INFO - CPU cores: 8
2026-01-17 21:42:00,376 - __main__ - INFO - CPU usage: 13.8%
2026-01-17 21:42:00,377 - __main__ - INFO - Python version: 3.12.4
2026-01-17 21:42:00,377 - __main__ - INFO - System platform: win32
2026-01-17 21:42:00,377 - __main__ - INFO - User session started at: 2026-01-17 21:42:00.377602
2026-01-17 21:42:00,377 - __main__ - INFO - Displaying main menu options to user
2026-01-17 21:42:01,683 - __main__ - INFO - User selected option: 2
2026-01-17 21:42:01,684 - __main__ - INFO - Starting Source-Target Comparison module
2026-01-17 21:42:01,687 - dq_comparison - INFO - STARTING UNIVERSAL SOURCE-TARGET COMPARISON TOOL
2026-01-17 21:42:01,687 - dq_comparison - INFO - LOADING SOURCE AND TARGET DATA
2026-01-17 21:42:01,687 - dq_comparison - INFO - 
==================================================
2026-01-17 21:42:01,688 - dq_comparison - INFO - 🔗 SOURCE DATA CONFIGURATION
2026-01-17 21:42:01,688 - dq_comparison - INFO - ==================================================
2026-01-17 21:42:02,792 - dq_comparison - INFO - 
🗄️ SOURCE DATABASE CONFIGURATION
2026-01-17 21:42:02,793 - dq_comparison - INFO - ----------------------------------------
2026-01-17 21:42:05,196 - dq_comparison - INFO - Selected database type code: mysql
2026-01-17 21:42:06,319 - dq_comparison - INFO - User selected Browse and Select mode for SOURCE
2026-01-17 21:42:06,326 - database_navigator - INFO - DatabaseNavigator initialized
2026-01-17 21:42:06,326 - database_navigator - INFO - Starting database navigation...
2026-01-17 21:42:06,326 - database_navigator - INFO - Database type: mysql
2026-01-17 21:42:06,326 - database_navigator - INFO - Getting database configuration...
2026-01-17 21:42:08,151 - database_navigator - INFO - Connecting to MYSQL...
2026-01-17 21:42:08,690 - database_navigator - INFO - Successfully connected to MYSQL!
2026-01-17 21:42:08,693 - database_navigator - INFO - get_databases() called. db_type: mysql, connection exists: True
2026-01-17 21:42:08,697 - database_navigator - INFO - Found 13 databases
2026-01-17 21:42:12,222 - database_navigator - INFO - Selected database: dq_checks
2026-01-17 21:42:12,227 - database_navigator - INFO - Found 1 schemas
2026-01-17 21:42:13,631 - database_navigator - INFO - Selected schema: dq_checks
2026-01-17 21:42:13,644 - database_navigator - INFO - Found 18 tables in schema 'dq_checks'
2026-01-17 21:42:14,680 - database_navigator - INFO - Selected table: comparison_small_source15
2026-01-17 21:42:14,685 - database_navigator - INFO - Selection complete: {'type': 'mysql', 'database': 'dq_checks', 'schema': 'dq_checks', 'table': 'comparison_small_source15', 'selection_mode': 'hierarchical', 'host': 'localhost', 'port': '3306', 'user': 'root', 'password': 'root'}
2026-01-17 21:42:14,686 - dq_comparison - INFO - Selected via navigation for SOURCE: dq_checks.dq_checks.comparison_small_source15
2026-01-17 21:42:14,686 - dq_unified - INFO - Loading data from DATABASE
2026-01-17 21:42:14,687 - dq_unified - INFO - Loading large database table: comparison_small_source15
2026-01-17 21:42:14,687 - dq_unified - INFO - Normalized DB config with schema: dq_checks
2026-01-17 21:42:14,698 - dq_unified - INFO - MySQL table comparison_small_source15 has 15 rows
2026-01-17 21:42:14,699 - dq_unified - INFO - Loading 15 rows from MySQL...
2026-01-17 21:42:15,612 - dq_unified - INFO - Loaded 15 rows from MySQL
2026-01-17 21:42:15,624 - dq_unified - INFO - Memory optimization: 0.0MB -> 0.0MB (Saved: 0.0MB)
2026-01-17 21:42:15,624 - dq_unified - INFO - Loaded 15 rows, 16 columns. Memory: 111.4MB total, 0.0MB for dataframe
2026-01-17 21:42:15,625 - dq_comparison - INFO - SOURCE database loaded: 15 rows, 16 columns
2026-01-17 21:42:15,625 - dq_comparison - INFO - 
==================================================
2026-01-17 21:42:15,627 - dq_comparison - INFO - 🔗 TARGET DATA CONFIGURATION
2026-01-17 21:42:15,627 - dq_comparison - INFO - ==================================================
2026-01-17 21:42:16,851 - dq_comparison - INFO - 
🗄️ TARGET DATABASE CONFIGURATION
2026-01-17 21:42:16,853 - dq_comparison - INFO - ----------------------------------------
2026-01-17 21:42:18,612 - dq_comparison - INFO - Selected database type code: postgresql
2026-01-17 21:42:19,777 - dq_comparison - INFO - User selected Browse and Select mode for TARGET
2026-01-17 21:42:19,784 - dq_comparison - INFO - Converted 'postgresql' to 'postgres' for database_navigator compatibility
2026-01-17 21:42:19,784 - database_navigator - INFO - DatabaseNavigator initialized
2026-01-17 21:42:19,784 - database_navigator - INFO - Starting database navigation...
2026-01-17 21:42:19,785 - database_navigator - INFO - Database type: postgres
2026-01-17 21:42:19,785 - database_navigator - INFO - Getting database configuration...
2026-01-17 21:42:22,766 - database_navigator - INFO - Connecting to POSTGRES...
2026-01-17 21:42:22,767 - database_navigator - INFO - Connecting to PostgreSQL...
2026-01-17 21:42:22,769 - database_navigator - INFO - Connecting to PostgreSQL: host=localhost, port=5432, database=postgres, user=postgres
2026-01-17 21:42:22,873 - database_navigator - INFO - Connection object created: <connection object at 0x000002070754EBD0; dsn: 'user=postgres password=xxx dbname=postgres host=localhost port=5432', closed: 0>
2026-01-17 21:42:22,873 - database_navigator - INFO - ✅ PostgreSQL connection successful to database: postgres
2026-01-17 21:42:22,877 - database_navigator - INFO - get_databases() called. db_type: postgres, connection exists: True
2026-01-17 21:42:22,898 - database_navigator - INFO - Raw rows: [('dq_checks',), ('finewise-testdb',), ('postgres',)]
2026-01-17 21:42:22,898 - database_navigator - INFO - Found 3 databases
2026-01-17 21:42:23,997 - database_navigator - INFO - Selected database: dq_checks
2026-01-17 21:42:23,998 - database_navigator - INFO - Reconnecting to PostgreSQL database: dq_checks
2026-01-17 21:42:23,998 - database_navigator - INFO - Connecting to POSTGRES...
2026-01-17 21:42:24,000 - database_navigator - INFO - Connecting to PostgreSQL...
2026-01-17 21:42:24,000 - database_navigator - INFO - Connecting to PostgreSQL: host=localhost, port=5432, database=dq_checks, user=postgres
2026-01-17 21:42:24,218 - database_navigator - INFO - Connection object created: <connection object at 0x000002070754E460; dsn: 'user=postgres password=xxx dbname=dq_checks host=localhost port=5432', closed: 0>
2026-01-17 21:42:24,218 - database_navigator - INFO - ✅ PostgreSQL connection successful to database: dq_checks
2026-01-17 21:42:24,253 - database_navigator - INFO - Found 4 schemas
2026-01-17 21:42:26,337 - database_navigator - INFO - Selected schema: public
2026-01-17 21:42:26,340 - database_navigator - INFO - Ensuring connection to database: dq_checks for table list
2026-01-17 21:42:26,341 - database_navigator - INFO - Reconnecting to PostgreSQL database: dq_checks
2026-01-17 21:42:26,341 - database_navigator - INFO - Connecting to POSTGRES...
2026-01-17 21:42:26,342 - database_navigator - INFO - Connecting to PostgreSQL...
2026-01-17 21:42:26,343 - database_navigator - INFO - Connecting to PostgreSQL: host=localhost, port=5432, database=dq_checks, user=postgres
2026-01-17 21:42:26,448 - database_navigator - INFO - Connection object created: <connection object at 0x000002070754ECE0; dsn: 'user=postgres password=xxx dbname=dq_checks host=localhost port=5432', closed: 0>
2026-01-17 21:42:26,448 - database_navigator - INFO - ✅ PostgreSQL connection successful to database: dq_checks
2026-01-17 21:42:26,449 - database_navigator - INFO - Connected to database: dq_checks, schema: public
2026-01-17 21:42:26,500 - database_navigator - INFO - Found 5 tables in dq_checks.public: ['comparison_small_target13', 'customers', 'customers_bkp', 'employee', 'stg_transactions']
2026-01-17 21:42:26,500 - database_navigator - INFO - Found 5 tables in schema 'public'
2026-01-17 21:42:28,114 - database_navigator - INFO - Selected table: comparison_small_target13
2026-01-17 21:42:28,119 - database_navigator - INFO - Selection complete: {'type': 'postgresql', 'database': 'dq_checks', 'schema': 'public', 'table': 'comparison_small_target13', 'selection_mode': 'hierarchical', 'host': 'localhost', 'port': '5432', 'user': 'postgres', 'password': 'postgres'}
2026-01-17 21:42:28,120 - dq_comparison - INFO - Selected via navigation for TARGET: dq_checks.public.comparison_small_target13
2026-01-17 21:42:28,120 - dq_unified - INFO - Loading data from DATABASE
2026-01-17 21:42:28,120 - dq_unified - INFO - Loading large database table: comparison_small_target13
2026-01-17 21:42:28,120 - dq_unified - INFO - Normalized DB config with schema: public
2026-01-17 21:42:28,342 - dq_unified - INFO - PostgreSQL table public.comparison_small_target13 has 13 rows
2026-01-17 21:42:28,342 - dq_unified - INFO - Loading 13 rows from PostgreSQL...
2026-01-17 21:42:28,347 - dq_unified - INFO - Loaded 13 rows from PostgreSQL
2026-01-17 21:42:28,354 - dq_unified - INFO - Memory optimization: 0.0MB -> 0.0MB (Saved: 0.0MB)
2026-01-17 21:42:28,354 - dq_unified - INFO - Loaded 13 rows, 16 columns. Memory: 112.1MB total, 0.0MB for dataframe
2026-01-17 21:42:28,354 - dq_comparison - INFO - TARGET database loaded: 13 rows, 16 columns
2026-01-17 21:42:28,355 - dq_comparison - INFO - SELECTING COLUMNS FOR COMPARISON
2026-01-17 21:42:28,355 - dq_comparison - INFO - Source columns (original): ['transaction_id', 'account_id', 'customer_id', 'transaction_date', 'posting_date', 'transaction_type', 'currency', 'amount', 'balance_after', 'status', 'merchant_name', 'merchant_category', 'country', 'reference_code', 'created_at', 'updated_at']
2026-01-17 21:42:28,355 - dq_comparison - INFO - Target columns (original): ['transaction_id', 'account_id', 'customer_id', 'transaction_date', 'posting_date', 'transaction_type', 'currency', 'amount', 'balance_after', 'status', 'merchant_name', 'merchant_category', 'country', 'reference_code', 'created_at', 'updated_at']
2026-01-17 21:42:28,355 - dq_comparison - INFO - Common columns lowercased: ['transaction_id', 'account_id', 'customer_id', 'transaction_date', 'posting_date', 'transaction_type', 'currency', 'amount', 'balance_after', 'status', 'merchant_name', 'merchant_category', 'country', 'reference_code', 'created_at', 'updated_at']
2026-01-17 21:42:28,356 - dq_comparison - INFO - Found 16 common columns between source and target (case-insensitive)
2026-01-17 21:42:28,356 - dq_comparison - INFO - 
📋 Common columns available for comparison:
2026-01-17 21:42:28,356 - dq_comparison - INFO -   1. transaction_id (Source) ↔ transaction_id (Target)
2026-01-17 21:42:28,357 - dq_comparison - INFO -   2. account_id (Source) ↔ account_id (Target)
2026-01-17 21:42:28,358 - dq_comparison - INFO -   3. customer_id (Source) ↔ customer_id (Target)
2026-01-17 21:42:28,358 - dq_comparison - INFO -   4. transaction_date (Source) ↔ transaction_date (Target)
2026-01-17 21:42:28,358 - dq_comparison - INFO -   5. posting_date (Source) ↔ posting_date (Target)
2026-01-17 21:42:28,359 - dq_comparison - INFO -   6. transaction_type (Source) ↔ transaction_type (Target)
2026-01-17 21:42:28,359 - dq_comparison - INFO -   7. currency (Source) ↔ currency (Target)
2026-01-17 21:42:28,359 - dq_comparison - INFO -   8. amount (Source) ↔ amount (Target)
2026-01-17 21:42:28,359 - dq_comparison - INFO -   9. balance_after (Source) ↔ balance_after (Target)
2026-01-17 21:42:28,360 - dq_comparison - INFO -   10. status (Source) ↔ status (Target)
2026-01-17 21:42:28,360 - dq_comparison - INFO -   11. merchant_name (Source) ↔ merchant_name (Target)
2026-01-17 21:42:28,360 - dq_comparison - INFO -   12. merchant_category (Source) ↔ merchant_category (Target)
2026-01-17 21:42:28,360 - dq_comparison - INFO -   13. country (Source) ↔ country (Target)
2026-01-17 21:42:28,361 - dq_comparison - INFO -   14. reference_code (Source) ↔ reference_code (Target)
2026-01-17 21:42:28,361 - dq_comparison - INFO -   15. created_at (Source) ↔ created_at (Target)
2026-01-17 21:42:28,361 - dq_comparison - INFO -   16. updated_at (Source) ↔ updated_at (Target)
2026-01-17 21:42:29,949 - dq_comparison - INFO - User column selection input: all
2026-01-17 21:42:29,950 - dq_comparison - INFO - User selected ALL common columns for comparison
2026-01-17 21:42:29,951 - dq_comparison - INFO - GENERATING COMPREHENSIVE COMPARISON REPORT
2026-01-17 21:42:29,952 - dq_comparison - INFO - Report details - Source: Database: mysql - dq_checks.comparison_small_source15, Target: Database: postgresql - dq_checks.comparison_small_target13, Selected columns: 16
2026-01-17 21:42:29,953 - dq_comparison - INFO - Initializing Error Logger...
2026-01-17 21:42:29,953 - dq_error_log - INFO - ErrorLogger initialized with database: dq_checks
2026-01-17 21:42:29,965 - dq_error_log - INFO - Database connection successful
2026-01-17 21:42:29,965 - dq_comparison - INFO - Session ID: CMP_20260117_214229
2026-01-17 21:42:29,965 - dq_comparison - INFO - 
======================================================================
2026-01-17 21:42:29,965 - dq_comparison - INFO - 🔄 RUNNING SOURCE-TARGET COMPARISON WITH PERFECT NORMALIZATION
2026-01-17 21:42:29,967 - dq_comparison - INFO - ======================================================================
2026-01-17 21:42:29,969 - dq_comparison - INFO - Session ID: CMP_20260117_214229
2026-01-17 21:42:29,970 - dq_comparison - INFO - Source: Database: mysql - dq_checks.comparison_small_source15
2026-01-17 21:42:29,970 - dq_comparison - INFO - Target: Database: postgresql - dq_checks.comparison_small_target13
2026-01-17 21:42:29,970 - dq_comparison - INFO - Selected columns: 16
2026-01-17 21:42:29,971 - dq_comparison - INFO - ======================================================================
2026-01-17 21:42:29,971 - dq_comparison - INFO - 
1️⃣ FIRST: ROW COUNT CHECK
2026-01-17 21:42:29,971 - dq_comparison - WARNING - ❌ Row count mismatch: Source=15, Target=13, Difference=2
2026-01-17 21:42:29,971 - dq_comparison - WARNING -    Missing in target: 2 rows
2026-01-17 21:42:29,972 - dq_comparison - INFO - 
2️⃣ COLUMN STRUCTURE COMPARISON
2026-01-17 21:42:29,972 - dq_comparison - INFO - Comparing column structures...
2026-01-17 21:42:29,972 - dq_comparison - INFO - Column structure comparison complete. Match: True
2026-01-17 21:42:29,973 - dq_comparison - INFO - 
3️⃣ PRIMARY KEY VALIDATION
2026-01-17 21:42:29,973 - dq_comparison - INFO - Validating primary key/unique fields...
2026-01-17 21:42:29,973 - dq_comparison - INFO - Checking key fields: ['transaction_id', 'customer_id', 'reference_code']
2026-01-17 21:42:29,975 - dq_comparison - WARNING - Field 'customer_id' has duplicates in source: 15 rows
2026-01-17 21:42:29,976 - dq_comparison - WARNING - Field 'customer_id' has duplicates in target: 13 rows
2026-01-17 21:42:29,976 - dq_comparison - INFO - Primary key validation complete. Passed: False
2026-01-17 21:42:30,002 - dq_comparison - INFO -    Key fields found: ['transaction_id', 'customer_id', 'reference_code']
2026-01-17 21:42:30,003 - dq_comparison - INFO -    Unique in source: ❌
2026-01-17 21:42:30,003 - dq_comparison - INFO -    Unique in target: ❌
2026-01-17 21:42:30,005 - dq_comparison - INFO -    Validation passed: ❌
2026-01-17 21:42:30,006 - dq_comparison - WARNING -    Source duplicates in 'customer_id': 15 rows
2026-01-17 21:42:30,006 - dq_comparison - WARNING -      Sample values: ['CUST9001']
2026-01-17 21:42:30,006 - dq_comparison - WARNING -    Target duplicates in 'customer_id': 13 rows
2026-01-17 21:42:30,007 - dq_comparison - WARNING -      Sample values: ['CUST9001']
2026-01-17 21:42:30,007 - dq_comparison - INFO -    Column names match: ✅
2026-01-17 21:42:30,007 - dq_comparison - INFO -    Column order match: ✅
2026-01-17 21:42:30,007 - dq_comparison - INFO -    Data types match: ✅
2026-01-17 21:42:30,008 - dq_comparison - INFO - 
4️⃣ TABLE METADATA COMPARISON
2026-01-17 21:42:30,008 - dq_comparison - INFO - Comparing table-level metadata...
2026-01-17 21:42:30,020 - dq_comparison - INFO - Table metadata comparison complete. Match: False
2026-01-17 21:42:30,032 - dq_comparison - INFO -    Table metadata match: ❌
2026-01-17 21:42:30,032 - dq_comparison - INFO -    Source: 15 rows, 16 cols, 0.01 MB
2026-01-17 21:42:30,034 - dq_comparison - INFO -    Target: 13 rows, 16 cols, 0.0 MB
2026-01-17 21:42:30,034 - dq_comparison - WARNING -    Found 1 metadata differences:
2026-01-17 21:42:30,034 - dq_comparison - WARNING -      • Row Count: Source=15, Target=13
2026-01-17 21:42:30,034 - dq_comparison - INFO - 
5️⃣ HASH-BASED COMPARISON
2026-01-17 21:42:30,034 - dq_comparison - INFO - ℹ️  Note: All NULL values normalized to 'NULL'
2026-01-17 21:42:30,035 - dq_comparison - INFO - ℹ️  Note: Dates normalized to YYYY-MM-DD
2026-01-17 21:42:30,035 - dq_comparison - INFO - ℹ️  Note: Strings trimmed and case-normalized
2026-01-17 21:42:30,036 - dq_comparison - INFO - ℹ️  Note: Phone numbers stripped to digits only, leading zeros removed
2026-01-17 21:42:30,036 - dq_comparison - INFO - SECOND CHECK: HASH-BASED COMPARISON WITH PERFECT NORMALIZATION
2026-01-17 21:42:30,042 - dq_comparison - INFO - === DEBUG: DATA TYPE CHECK ===
2026-01-17 21:42:30,042 - dq_comparison - INFO - Column: transaction_id
2026-01-17 21:42:30,042 - dq_comparison - INFO -   Source type: <class 'str'>, value: 0b0ccaa7-6fde-4868-a20d-8064a87e4914
2026-01-17 21:42:30,043 - dq_comparison - INFO -   Target type: <class 'str'>, value: 3ec6eecf-ef59-4447-9929-28a2e39e7231
2026-01-17 21:42:30,046 - dq_comparison - INFO -   Normalized: '0b0ccaa7-6fde-4868-a20d-8064a87e4914' vs '3ec6eecf-ef59-4447-9929-28a2e39e7231'
2026-01-17 21:42:30,046 - dq_comparison - INFO -   Match: False
2026-01-17 21:42:30,047 - dq_comparison - INFO - Column: account_id
2026-01-17 21:42:30,048 - dq_comparison - INFO -   Source type: <class 'str'>, value: ACC1001
2026-01-17 21:42:30,048 - dq_comparison - INFO -   Target type: <class 'str'>, value: ACC1001
2026-01-17 21:42:30,049 - dq_comparison - INFO -   Normalized: 'ACC1001' vs 'ACC1001'
2026-01-17 21:42:30,049 - dq_comparison - INFO -   Match: True
2026-01-17 21:42:30,049 - dq_comparison - INFO - Column: customer_id
2026-01-17 21:42:30,049 - dq_comparison - INFO -   Source type: <class 'str'>, value: CUST9001
2026-01-17 21:42:30,050 - dq_comparison - INFO -   Target type: <class 'str'>, value: CUST9001
2026-01-17 21:42:30,051 - dq_comparison - INFO -   Normalized: 'CUST9001' vs 'CUST9001'
2026-01-17 21:42:30,051 - dq_comparison - INFO -   Match: True
2026-01-17 21:42:30,052 - dq_comparison - INFO - Source DF columns: ['transaction_id', 'account_id', 'customer_id', 'transaction_date', 'posting_date', 'transaction_type', 'currency', 'amount', 'balance_after', 'status', 'merchant_name', 'merchant_category', 'country', 'reference_code', 'created_at', 'updated_at']
2026-01-17 21:42:30,053 - dq_comparison - INFO - Target DF columns: ['transaction_id', 'account_id', 'customer_id', 'transaction_date', 'posting_date', 'transaction_type', 'currency', 'amount', 'balance_after', 'status', 'merchant_name', 'merchant_category', 'country', 'reference_code', 'created_at', 'updated_at']
2026-01-17 21:42:30,053 - dq_comparison - INFO - Selected columns for comparison: ['transaction_id', 'account_id', 'customer_id', 'transaction_date', 'posting_date', 'transaction_type', 'currency', 'amount', 'balance_after', 'status', 'merchant_name', 'merchant_category', 'country', 'reference_code', 'created_at', 'updated_at']
2026-01-17 21:42:30,053 - dq_comparison - INFO - Using 16 common columns for hash comparison
2026-01-17 21:42:30,053 - dq_comparison - INFO - Source columns: ['transaction_id', 'account_id', 'customer_id', 'transaction_date', 'posting_date', 'transaction_type', 'currency', 'amount', 'balance_after', 'status', 'merchant_name', 'merchant_category', 'country', 'reference_code', 'created_at', 'updated_at']
2026-01-17 21:42:30,054 - dq_comparison - INFO - Target columns: ['transaction_id', 'account_id', 'customer_id', 'transaction_date', 'posting_date', 'transaction_type', 'currency', 'amount', 'balance_after', 'status', 'merchant_name', 'merchant_category', 'country', 'reference_code', 'created_at', 'updated_at']
2026-01-17 21:42:30,054 - dq_comparison - INFO - Generating hashes for source data (15 rows)...
2026-01-17 21:42:30,059 - dq_comparison - INFO - === DEBUG: SOURCES SAMPLE HASHES ===
2026-01-17 21:42:30,060 - dq_comparison - INFO - Hash 1: a2dd7804f8406248390874ef447c1f4b... (Source row 0)
2026-01-17 21:42:30,061 - dq_comparison - INFO - Hash 2: 9d7665b5ee79490dd4674c2916ae22a5... (Source row 1)
2026-01-17 21:42:30,061 - dq_comparison - INFO - Hash 3: a3cdd19a4bcbd4ff6809ec8bb8c34e15... (Source row 2)
2026-01-17 21:42:30,062 - dq_comparison - INFO - Hash 4: 79910e1eb95fe97ddea22b1c662a0b3b... (Source row 3)
2026-01-17 21:42:30,062 - dq_comparison - INFO - Hash 5: 8fe1fb4ec0fe87dcc6610ceb57ae9d71... (Source row 4)
2026-01-17 21:42:30,062 - dq_comparison - INFO - Hash 6: 2bed1dd939f23c70eff106310cba217b... (Source row 5)
2026-01-17 21:42:30,063 - dq_comparison - INFO - Hash 7: ce6f3080200525c6fd8d372b37fc07b6... (Source row 6)
2026-01-17 21:42:30,063 - dq_comparison - INFO - Hash 8: 8982169eccd45693a4f8daf51c6e21b8... (Source row 7)
2026-01-17 21:42:30,063 - dq_comparison - INFO - Hash 9: 4635e533b4bcb14110d5e35306ed5a8e... (Source row 8)
2026-01-17 21:42:30,064 - dq_comparison - INFO - Hash 10: 1a66e062ad0d78875db0c2c516395cb3... (Source row 9)
2026-01-17 21:42:30,064 - dq_comparison - INFO - Hash 11: 85d06d1ba3599bbfb2e23da57f879621... (Source row 10)
2026-01-17 21:42:30,064 - dq_comparison - INFO - Hash 12: 4004a9b0a576d68c1e60b6da12f2ffcf... (Source row 11)
2026-01-17 21:42:30,065 - dq_comparison - INFO - Hash 13: 2cda24370cd36a13577b7f023d7b4807... (Source row 12)
2026-01-17 21:42:30,065 - dq_comparison - INFO - Hash 14: 52335d91353f1d6dfc3c1e9a924c6e50... (Source row 13)
2026-01-17 21:42:30,066 - dq_comparison - INFO - Hash 15: f222df667a3f24ea5768c470e59f8bfb... (Source row 14)
2026-01-17 21:42:30,066 - dq_comparison - INFO - Generating hashes for target data (13 rows)...
2026-01-17 21:42:30,071 - dq_comparison - INFO - === DEBUG: TARGET SAMPLE HASHES ===
2026-01-17 21:42:30,071 - dq_comparison - INFO - Hash 1: 2bdbf563d6dd6ef258fc591550628b0b... (Target row 0)
2026-01-17 21:42:30,072 - dq_comparison - INFO - Hash 2: cff0e5a8b02b766415988dbee531ff8f... (Target row 1)
2026-01-17 21:42:30,073 - dq_comparison - INFO - Hash 3: bb813f48f1a27dd1d3709789fc2f6660... (Target row 2)
2026-01-17 21:42:30,073 - dq_comparison - INFO - Hash 4: 7f8ebca5b3768ba8754cbbcf2f7a41e6... (Target row 3)
2026-01-17 21:42:30,073 - dq_comparison - INFO - Hash 5: a3bf42784e6b606181ab18a68af39587... (Target row 4)
2026-01-17 21:42:30,073 - dq_comparison - INFO - Hash 6: d99f8b55162dce4d4c89b9a30418084a... (Target row 5)
2026-01-17 21:42:30,076 - dq_comparison - INFO - Hash 7: 743c0639b5cb42849200809dc589cfb0... (Target row 6)
2026-01-17 21:42:30,077 - dq_comparison - INFO - Hash 8: 87327879fdc5c3e2ff2f2681ee8dbf0e... (Target row 7)
2026-01-17 21:42:30,078 - dq_comparison - INFO - Hash 9: e24fc5a1685581404d0dfde8ffab86b8... (Target row 8)
2026-01-17 21:42:30,078 - dq_comparison - INFO - Hash 10: a45d97e741c6bce4085bd360fefcfc41... (Target row 9)
2026-01-17 21:42:30,078 - dq_comparison - INFO - Hash 11: c0f1800f1dfb382935483c08ba49f3ae... (Target row 10)
2026-01-17 21:42:30,078 - dq_comparison - INFO - Hash 12: 6a14cc88a4aed613e5ef6f8358eb9f39... (Target row 11)
2026-01-17 21:42:30,079 - dq_comparison - INFO - Hash 13: eb4bff6e19990dde13fccde591235383... (Target row 12)
2026-01-17 21:42:30,079 - dq_comparison - INFO - 
======================================================================
2026-01-17 21:42:30,079 - dq_comparison - INFO - 🔍 DEBUG: ANALYZING WHY HASHES DON'T MATCH
2026-01-17 21:42:30,079 - dq_comparison - INFO - ======================================================================
2026-01-17 21:42:30,080 - dq_comparison - INFO - --- Analyzing Row 0 ---
2026-01-17 21:42:30,080 - dq_comparison - INFO - Column 'transaction_id' → 'transaction_id':
2026-01-17 21:42:30,080 - dq_comparison - INFO -   Source: '0b0ccaa7-6fde-4868-a20d-8064a87e4914' (type: str) → '0b0ccaa7-6fde-4868-a20d-8064a87e4914'
2026-01-17 21:42:30,080 - dq_comparison - INFO -   Target: '3ec6eecf-ef59-4447-9929-28a2e39e7231' (type: str) → '3ec6eecf-ef59-4447-9929-28a2e39e7231'
2026-01-17 21:42:30,081 - dq_comparison - INFO -   Match after normalization: ❌ NO
2026-01-17 21:42:30,081 - dq_comparison - INFO - Column 'account_id' → 'account_id':
2026-01-17 21:42:30,081 - dq_comparison - INFO -   Source: 'ACC1001' (type: str) → 'ACC1001'
2026-01-17 21:42:30,081 - dq_comparison - INFO -   Target: 'ACC1001' (type: str) → 'ACC1001'
2026-01-17 21:42:30,082 - dq_comparison - INFO -   Match after normalization: ✅ YES
2026-01-17 21:42:30,082 - dq_comparison - INFO - Column 'customer_id' → 'customer_id':
2026-01-17 21:42:30,082 - dq_comparison - INFO -   Source: 'CUST9001' (type: str) → 'CUST9001'
2026-01-17 21:42:30,083 - dq_comparison - INFO -   Target: 'CUST9001' (type: str) → 'CUST9001'
2026-01-17 21:42:30,083 - dq_comparison - INFO -   Match after normalization: ✅ YES
2026-01-17 21:42:30,083 - dq_comparison - INFO - Column 'transaction_date' → 'transaction_date':
2026-01-17 21:42:30,083 - dq_comparison - INFO -   Source: '2024-01-01' (type: date) → '2024-01-01'
2026-01-17 21:42:30,084 - dq_comparison - INFO -   Target: '2024-01-01' (type: date) → '2024-01-01'
2026-01-17 21:42:30,084 - dq_comparison - INFO -   Match after normalization: ✅ YES
2026-01-17 21:42:30,084 - dq_comparison - INFO - Column 'posting_date' → 'posting_date':
2026-01-17 21:42:30,084 - dq_comparison - INFO -   Source: '2024-01-02' (type: date) → '2024-01-02'
2026-01-17 21:42:30,084 - dq_comparison - INFO -   Target: '2024-01-02' (type: date) → '2024-01-02'
2026-01-17 21:42:30,084 - dq_comparison - INFO -   Match after normalization: ✅ YES
2026-01-17 21:42:30,084 - dq_comparison - INFO - 
Hash components for Row 0:
2026-01-17 21:42:30,086 - dq_comparison - INFO - Source hash string start: 0b0ccaa7-6fde-4868-a20d-8064a87e4914|ACC1001|CUST9001...
2026-01-17 21:42:30,086 - dq_comparison - INFO - Target hash string start: 3ec6eecf-ef59-4447-9929-28a2e39e7231|ACC1001|CUST9001...
2026-01-17 21:42:30,086 - dq_comparison - INFO - Same? ❌ NO
2026-01-17 21:42:30,086 - dq_comparison - INFO - --- Analyzing Row 1 ---
2026-01-17 21:42:30,087 - dq_comparison - INFO - Column 'transaction_id' → 'transaction_id':
2026-01-17 21:42:30,087 - dq_comparison - INFO -   Source: '21de9b66-d966-4f89-8a71-dedd548b149b' (type: str) → '21de9b66-d966-4f89-8a71-dedd548b149b'
2026-01-17 21:42:30,087 - dq_comparison - INFO -   Target: '33063be6-7ea8-432f-869c-20de5281eca7' (type: str) → '33063be6-7ea8-432f-869c-20de5281eca7'
2026-01-17 21:42:30,087 - dq_comparison - INFO -   Match after normalization: ❌ NO
2026-01-17 21:42:30,087 - dq_comparison - INFO - Column 'account_id' → 'account_id':
2026-01-17 21:42:30,088 - dq_comparison - INFO -   Source: 'ACC1001' (type: str) → 'ACC1001'
2026-01-17 21:42:30,088 - dq_comparison - INFO -   Target: 'ACC1001' (type: str) → 'ACC1001'
2026-01-17 21:42:30,088 - dq_comparison - INFO -   Match after normalization: ✅ YES
2026-01-17 21:42:30,088 - dq_comparison - INFO - Column 'customer_id' → 'customer_id':
2026-01-17 21:42:30,088 - dq_comparison - INFO -   Source: 'CUST9001' (type: str) → 'CUST9001'
2026-01-17 21:42:30,093 - dq_comparison - INFO -   Target: 'CUST9001' (type: str) → 'CUST9001'
2026-01-17 21:42:30,094 - dq_comparison - INFO -   Match after normalization: ✅ YES
2026-01-17 21:42:30,094 - dq_comparison - INFO - Column 'transaction_date' → 'transaction_date':
2026-01-17 21:42:30,095 - dq_comparison - INFO -   Source: '2024-01-01' (type: date) → '2024-01-01'
2026-01-17 21:42:30,095 - dq_comparison - INFO -   Target: '2024-01-01' (type: date) → '2024-01-01'
2026-01-17 21:42:30,095 - dq_comparison - INFO -   Match after normalization: ✅ YES
2026-01-17 21:42:30,096 - dq_comparison - INFO - Column 'posting_date' → 'posting_date':
2026-01-17 21:42:30,096 - dq_comparison - INFO -   Source: '2024-01-02' (type: date) → '2024-01-02'
2026-01-17 21:42:30,096 - dq_comparison - INFO -   Target: '2024-01-02' (type: date) → '2024-01-02'
2026-01-17 21:42:30,096 - dq_comparison - INFO -   Match after normalization: ✅ YES
2026-01-17 21:42:30,096 - dq_comparison - INFO - 
Hash components for Row 1:
2026-01-17 21:42:30,096 - dq_comparison - INFO - Source hash string start: 21de9b66-d966-4f89-8a71-dedd548b149b|ACC1001|CUST9001...
2026-01-17 21:42:30,096 - dq_comparison - INFO - Target hash string start: 33063be6-7ea8-432f-869c-20de5281eca7|ACC1001|CUST9001...
2026-01-17 21:42:30,097 - dq_comparison - INFO - Same? ❌ NO
2026-01-17 21:42:30,097 - dq_comparison - INFO - --- Analyzing Row 2 ---
2026-01-17 21:42:30,098 - dq_comparison - INFO - Column 'transaction_id' → 'transaction_id':
2026-01-17 21:42:30,098 - dq_comparison - INFO -   Source: '33063be6-7ea8-432f-869c-20de5281eca7' (type: str) → '33063be6-7ea8-432f-869c-20de5281eca7'
2026-01-17 21:42:30,098 - dq_comparison - INFO -   Target: '6a90c3b3-b134-4177-81b5-94fb1ef59619' (type: str) → '6a90c3b3-b134-4177-81b5-94fb1ef59619'
2026-01-17 21:42:30,098 - dq_comparison - INFO -   Match after normalization: ❌ NO
2026-01-17 21:42:30,099 - dq_comparison - INFO - Column 'account_id' → 'account_id':
2026-01-17 21:42:30,099 - dq_comparison - INFO -   Source: 'ACC1001' (type: str) → 'ACC1001'
2026-01-17 21:42:30,100 - dq_comparison - INFO -   Target: 'ACC1001' (type: str) → 'ACC1001'
2026-01-17 21:42:30,100 - dq_comparison - INFO -   Match after normalization: ✅ YES
2026-01-17 21:42:30,100 - dq_comparison - INFO - Column 'customer_id' → 'customer_id':
2026-01-17 21:42:30,100 - dq_comparison - INFO -   Source: 'CUST9001' (type: str) → 'CUST9001'
2026-01-17 21:42:30,101 - dq_comparison - INFO -   Target: 'CUST9001' (type: str) → 'CUST9001'
2026-01-17 21:42:30,101 - dq_comparison - INFO -   Match after normalization: ✅ YES
2026-01-17 21:42:30,101 - dq_comparison - INFO - Column 'transaction_date' → 'transaction_date':
2026-01-17 21:42:30,102 - dq_comparison - INFO -   Source: '2024-01-01' (type: date) → '2024-01-01'
2026-01-17 21:42:30,102 - dq_comparison - INFO -   Target: '2024-01-01' (type: date) → '2024-01-01'
2026-01-17 21:42:30,102 - dq_comparison - INFO -   Match after normalization: ✅ YES
2026-01-17 21:42:30,102 - dq_comparison - INFO - Column 'posting_date' → 'posting_date':
2026-01-17 21:42:30,102 - dq_comparison - INFO -   Source: '2024-01-02' (type: date) → '2024-01-02'
2026-01-17 21:42:30,103 - dq_comparison - INFO -   Target: '2024-01-02' (type: date) → '2024-01-02'
2026-01-17 21:42:30,103 - dq_comparison - INFO -   Match after normalization: ✅ YES
2026-01-17 21:42:30,103 - dq_comparison - INFO - 
Hash components for Row 2:
2026-01-17 21:42:30,103 - dq_comparison - INFO - Source hash string start: 33063be6-7ea8-432f-869c-20de5281eca7|ACC1001|CUST9001...
2026-01-17 21:42:30,104 - dq_comparison - INFO - Target hash string start: 6a90c3b3-b134-4177-81b5-94fb1ef59619|ACC1001|CUST9001...
2026-01-17 21:42:30,104 - dq_comparison - INFO - Same? ❌ NO
2026-01-17 21:42:30,104 - dq_comparison - INFO - 
--- Column Data Types Analysis ---
2026-01-17 21:42:30,109 - dq_comparison - INFO - Column 1: 'transaction_id' (object) ↔ 'transaction_id' (object)
2026-01-17 21:42:30,110 - dq_comparison - INFO -   Sample: Source='0b0ccaa7-6fde-4868-a20d-8064a87e4914', Target='3ec6eecf-ef59-4447-9929-28a2e39e7231'
2026-01-17 21:42:30,111 - dq_comparison - INFO - Column 2: 'account_id' (category) ↔ 'account_id' (category)
2026-01-17 21:42:30,111 - dq_comparison - INFO -   Sample: Source='ACC1001', Target='ACC1001'
2026-01-17 21:42:30,111 - dq_comparison - INFO - Column 3: 'customer_id' (category) ↔ 'customer_id' (category)
2026-01-17 21:42:30,111 - dq_comparison - INFO -   Sample: Source='CUST9001', Target='CUST9001'
2026-01-17 21:42:30,111 - dq_comparison - INFO - Column 4: 'transaction_date' (category) ↔ 'transaction_date' (category)
2026-01-17 21:42:30,111 - dq_comparison - INFO -   Sample: Source='2024-01-01', Target='2024-01-01'
2026-01-17 21:42:30,112 - dq_comparison - INFO - Column 5: 'posting_date' (category) ↔ 'posting_date' (category)
2026-01-17 21:42:30,112 - dq_comparison - INFO -   Sample: Source='2024-01-02', Target='2024-01-02'
2026-01-17 21:42:30,112 - dq_comparison - INFO - PERFORMING DETAILED ROW-LEVEL COMPARISON WITH PAGINATION...
2026-01-17 21:42:30,113 - dq_comparison - INFO - Found 28 total mismatches
2026-01-17 21:42:30,113 - dq_comparison - INFO - Will process detailed comparisons for first 28 rows
2026-01-17 21:42:30,295 - dq_comparison - INFO - 
================================================================================
2026-01-17 21:42:30,295 - dq_comparison - INFO - DETAILED MISMATCH SUMMARY:
2026-01-17 21:42:30,296 - dq_comparison - INFO -   Total mismatches found: 15
2026-01-17 21:42:30,297 - dq_comparison - INFO -   Detailed comparisons logged: 15
2026-01-17 21:42:30,297 - dq_comparison - INFO -   First 10 rows displayed above
2026-01-17 21:42:30,297 - dq_comparison - INFO -   All mismatches stored in database with complete data
2026-01-17 21:42:30,298 - dq_comparison - INFO -   Use API to retrieve all 15 mismatches
2026-01-17 21:42:30,298 - dq_comparison - INFO - ================================================================================
2026-01-17 21:42:30,298 - dq_comparison - INFO - Hash-based Comparison Results (with duplicate handling):
2026-01-17 21:42:30,299 - dq_comparison - INFO -   • Unique source hashes: 15
2026-01-17 21:42:30,299 - dq_comparison - INFO -   • Unique target hashes: 13
2026-01-17 21:42:30,300 - dq_comparison - INFO -   • Common hashes: 0
2026-01-17 21:42:30,300 - dq_comparison - INFO -   • Common rows (counting duplicates): 0
2026-01-17 21:42:30,301 - dq_comparison - INFO -   • Rows only in source (counting duplicates): 15
2026-01-17 21:42:30,301 - dq_comparison - INFO -   • Rows only in target (counting duplicates): 13
2026-01-17 21:42:30,304 - dq_comparison - INFO - HASH-ONLY COMPARISON COMPLETED
2026-01-17 21:42:30,304 - dq_comparison - INFO - Returning counts for simple scoring:
2026-01-17 21:42:30,304 - dq_comparison - INFO -   Common rows: 0
2026-01-17 21:42:30,304 - dq_comparison - INFO -   Unique to source: 15
2026-01-17 21:42:30,304 - dq_comparison - INFO -   Unique to target: 13
2026-01-17 21:42:30,304 - dq_comparison - INFO -   Value mismatches: 448
2026-01-17 21:42:30,305 - dq_comparison - INFO -   Missing rows: 15
2026-01-17 21:42:30,308 - dq_comparison - INFO -   Extra rows: 13
2026-01-17 21:42:30,308 - dq_comparison - INFO - 
========================================================================================================================
COMPARISON: Mysql Database vs Postgresql Database
========================================================================================================================
Row   | Diff Count | Source (Sample)                          | Target (Sample)                         
------------------------------------------------------------------------------------------------------------------------
2     | 6          | transaction_id: 0b0ccaa7-6fde-4868-a20d-8064a8 | transaction_id: 3ec6eecf-ef59-4447-9929-28a2e3
3     | 7          | transaction_id: 21de9b66-d966-4f89-8a71-dedd54 | transaction_id: 33063be6-7ea8-432f-869c-20de52
4     | 8          | transaction_id: 33063be6-7ea8-432f-869c-20de52 | transaction_id: 6a90c3b3-b134-4177-81b5-94fb1e
5     | 8          | transaction_id: 33a06ed2-58b4-43c5-802b-339a0a | transaction_id: 56c444ae-d9e6-440a-b902-2c7f3d
6     | 8          | transaction_id: 3ec6eecf-ef59-4447-9929-28a2e3 | transaction_id: 21de9b66-d966-4f89-8a71-dedd54
7     | 0          | transaction_id: 44a4b4cd-6011-4980-bb3e-1930d2 | transaction_id: 44a4b4cd-6011-4980-bb3e-1930d2
8     | 7          | transaction_id: 56c444ae-d9e6-440a-b902-2c7f3d | transaction_id: f147eeca-a10f-4a5b-a3cb-90fdff
9     | 9          | transaction_id: 5d534d24-509c-4af6-abdb-20af2a | transaction_id: fe7e09b8-92d0-43a8-85bf-1cdc45
10    | 8          | transaction_id: 6a90c3b3-b134-4177-81b5-94fb1e | transaction_id: 5d534d24-509c-4af6-abdb-20af2a
11    | 7          | transaction_id: 7d73c994-c959-40a8-b29a-ae4ff7 | transaction_id: 33a06ed2-58b4-43c5-802b-339a0a
------------------------------------------------------------------------------------------------------------------------
Showing 1-10 of 15 mismatched rows. Use API for complete data.
========================================================================================================================
2026-01-17 21:42:30,308 - dq_comparison - INFO - Returning enhanced mismatch structure with 15 detailed mismatches
2026-01-17 21:42:30,309 - dq_comparison - INFO - New structure: 15 detailed mismatches
2026-01-17 21:42:30,309 - dq_comparison - INFO - 
6️⃣ DATA QUALITY ANALYSIS
2026-01-17 21:42:30,309 - dq_comparison - INFO - Analyzing data quality metrics...
2026-01-17 21:42:30,323 - dq_comparison - INFO - Null values - Source: 0 (0.00%), Target: 0 (0.00%)
2026-01-17 21:42:30,325 - dq_comparison - INFO - Duplicate rows (normalized) - Source: 0, Target: 0
2026-01-17 21:42:30,334 - dq_error_log - INFO - Retrieved 18 error logs for session CMP_20260117_214229
2026-01-17 21:42:30,335 - dq_comparison - INFO - 
📊 SIMPLE SCORING CALCULATION:
2026-01-17 21:42:30,335 - dq_comparison - INFO -   Source rows: 15
2026-01-17 21:42:30,335 - dq_comparison - INFO -   Common rows (matched): 0
2026-01-17 21:42:30,336 - dq_comparison - INFO -   Calculation: (0 / 15) * 100 = 0.00%
2026-01-17 21:42:30,336 - dq_comparison - INFO -   Explanation: 0 matched rows out of 15 total source rows
2026-01-17 21:42:30,337 - dq_comparison - INFO - 
=== AUDIT LOGGING SECTION ===
2026-01-17 21:42:30,341 - dq_comparison - INFO - 🔍 Audit logging is ENABLED in APP_SETTINGS
2026-01-17 21:42:30,341 - dq_audit - INFO - Audit class initialized with database: dq_checks
2026-01-17 21:42:30,342 - dq_comparison - INFO - Attempting to log audit record for session: CMP_20260117_214229
2026-01-17 21:42:30,342 - dq_audit - INFO - Starting database insertion for comparison...
2026-01-17 21:42:30,357 - dq_audit - INFO - Inserted comparison record with ID: 767
2026-01-17 21:42:30,358 - dq_comparison - INFO - ✅ Audit record logged successfully (ID: 767)
2026-01-17 21:42:30,358 - dq_comparison - INFO - 
======================================================================
2026-01-17 21:42:30,359 - dq_comparison - INFO - 📊 COMPARISON RESULTS SUMMARY
2026-01-17 21:42:30,359 - dq_comparison - INFO - ======================================================================
2026-01-17 21:42:30,359 - dq_comparison - INFO - Session ID: CMP_20260117_214229
2026-01-17 21:42:30,359 - dq_comparison - INFO - Source: Database: mysql - dq_checks.comparison_small_source15 (15 rows)
2026-01-17 21:42:30,360 - dq_comparison - INFO - Target: Database: postgresql - dq_checks.comparison_small_target13 (13 rows)
2026-01-17 21:42:30,360 - dq_comparison - INFO - Selected columns: 16
2026-01-17 21:42:30,360 - dq_comparison - INFO - ----------------------------------------------------------------------
2026-01-17 21:42:30,361 - dq_comparison - INFO - 1️⃣ Row count match: ❌ No
2026-01-17 21:42:30,361 - dq_comparison - INFO -    Missing in target: 2 rows
2026-01-17 21:42:30,361 - dq_comparison - INFO -    Extra in target: 0 rows
2026-01-17 21:42:30,362 - dq_comparison - INFO - 2️⃣ Column structure match: ✅ Yes
2026-01-17 21:42:30,362 - dq_comparison - INFO - 3️ Primary key validation: ❌ Failed
2026-01-17 21:42:30,362 - dq_comparison - INFO -    Key fields: ['transaction_id', 'customer_id', 'reference_code']
2026-01-17 21:42:30,362 - dq_comparison - INFO - 4️ Table metadata: ❌ Mismatch
2026-01-17 21:42:30,362 - dq_comparison - INFO -    • Row Count: 15 vs 13
2026-01-17 21:42:30,362 - dq_comparison - INFO - 5️⃣ Common rows (both Mysql Database and Postgresql Database): 0 (0.00% of Mysql Database)
2026-01-17 21:42:30,363 - dq_comparison - INFO - 6️⃣ Mysql Database-only rows: 15 (present ONLY in Mysql Database, NOT in Postgresql Database)
2026-01-17 21:42:30,363 - dq_comparison - INFO - 7️⃣ Postgresql Database-only rows: 13 (present ONLY in Postgresql Database, NOT in Mysql Database)
2026-01-17 21:42:30,363 - dq_comparison - INFO - 8️⃣ Column value mismatches: 0
2026-01-17 21:42:30,363 - dq_comparison - INFO - 9️ Data quality match: ✅ Yes
2026-01-17 21:42:30,364 - dq_comparison - INFO - 📈 DQ Score: 0.00%
2026-01-17 21:42:30,364 - dq_comparison - INFO - 📊 Calculation: (0 / 15) * 100 = 0.00%
2026-01-17 21:42:30,364 - dq_comparison - INFO - ======================================================================
2026-01-17 21:42:30,365 - dq_comparison - INFO - 
❌ LOW MATCH! Major differences found.
2026-01-17 21:42:30,365 - dq_comparison - INFO - 
🔍 NORMALIZATION APPLIED:
2026-01-17 21:42:30,365 - dq_comparison - INFO -    • NULL values → 'NULL' (consistent representation)
2026-01-17 21:42:30,365 - dq_comparison - INFO -    • Dates → YYYY-MM-DD format
2026-01-17 21:42:30,366 - dq_comparison - INFO -    • Strings → trimmed + lowercase
2026-01-17 21:42:30,367 - dq_comparison - INFO -    • Numeric values → standardized format
2026-01-17 21:42:30,367 - dq_comparison - INFO -    • Phone numbers → digits only, ALL leading zeros removed
2026-01-17 21:42:30,369 - dq_comparison - INFO -    • Extra whitespace removed
2026-01-17 21:42:30,370 - dq_comparison - INFO - 
🔍 DETAILED ERROR ANALYSIS:
2026-01-17 21:42:30,370 - dq_comparison - INFO - --------------------------------------------------
2026-01-17 21:42:30,371 - dq_comparison - INFO - 📊 SOURCE-ONLY ROWS: 15 rows
2026-01-17 21:42:30,371 - dq_comparison - INFO -    Present only in Mysql Database, missing from Postgresql Database
2026-01-17 21:42:30,371 - dq_comparison - INFO - 📊 TARGET-ONLY ROWS: 13 rows
2026-01-17 21:42:30,372 - dq_comparison - INFO -    Present only in Postgresql Database, extra (not in Mysql Database)
2026-01-17 21:42:30,380 - dq_error_log - INFO - Retrieved 10 errors for session CMP_20260117_214229
2026-01-17 21:42:30,381 - dq_comparison - INFO - 
📋 SAMPLE ERRORS (10 found):
2026-01-17 21:42:30,381 - dq_comparison - INFO - 
1. Row 0 - Metadata Row Count
2026-01-17 21:42:30,382 - dq_comparison - INFO -    Column: 
2026-01-17 21:42:30,384 - dq_comparison - INFO -    Metadata mismatch: Row Count
2026-01-17 21:42:30,385 - dq_comparison - INFO - 
2. Row 0 - Duplicate Primary Key
2026-01-17 21:42:30,386 - dq_comparison - INFO -    Column: customer_id
2026-01-17 21:42:30,386 - dq_comparison - INFO -    Primary key field 'customer_id' has 15 duplicates in source
2026-01-17 21:42:30,386 - dq_comparison - INFO - 
3. Row 0 - Duplicate Primary Key
2026-01-17 21:42:30,387 - dq_comparison - INFO -    Column: customer_id
2026-01-17 21:42:30,387 - dq_comparison - INFO -    Primary key field 'customer_id' has 13 duplicates in target
2026-01-17 21:42:30,387 - dq_comparison - INFO - 
💡 For complete error details, run:
2026-01-17 21:42:30,388 - dq_comparison - INFO -    USE dq_checks;
2026-01-17 21:42:30,388 - dq_comparison - INFO -    SELECT excel_row, column_name, error_type, error_description,
2026-01-17 21:42:30,389 - dq_comparison - INFO -           actual_value, expected_value
2026-01-17 21:42:30,389 - dq_comparison - INFO -    FROM dq_error_logs
2026-01-17 21:42:30,389 - dq_comparison - INFO -    WHERE session_id = 'CMP_20260117_214229'
2026-01-17 21:42:30,390 - dq_comparison - INFO -    ORDER BY excel_row, column_name;
2026-01-17 21:42:30,401 - dq_comparison - INFO - 
✅ Comparison completed! Session ID: CMP_20260117_214229
2026-01-17 21:42:30,411 - dq_error_log - INFO - Retrieved 19 error logs for session CMP_20260117_214229
2026-01-17 21:42:30,423 - dq_error_log - INFO - Retrieved summary: 19 total errors for session CMP_20260117_214229
2026-01-17 21:42:30,424 - dq_audit - INFO - Audit class initialized with database: dq_checks
2026-01-17 21:42:30,453 - dq_audit - INFO - Retrieved 1 audit logs for session CMP_20260117_214229
2026-01-17 21:42:30,453 - dq_comparison - INFO - 
🔍 Final results verification:
2026-01-17 21:42:30,454 - dq_comparison - INFO -    Session ID: CMP_20260117_214229
2026-01-17 21:42:30,456 - dq_comparison - INFO -    DQ Score (Simple %): 0.00%
2026-01-17 21:42:30,456 - dq_comparison - INFO -    Source rows: 15
2026-01-17 21:42:30,456 - dq_comparison - INFO -    Matched rows: 0
2026-01-17 21:42:30,456 - dq_comparison - INFO -    Calculation: (0 / 15) * 100
2026-01-17 21:42:30,457 - __main__ - INFO - Source-Target Comparison completed successfully
2026-01-17 21:42:30,457 - __main__ - INFO - Displaying main menu options to user
2026-01-17 21:42:57,298 - __main__ - INFO - User selected option: 6
2026-01-17 21:42:57,299 - __main__ - INFO - User session ended. Duration: 0:00:56.922285
2026-01-17 21:42:57,299 - __main__ - INFO - 👋 Thank you for using Universal Data Quality Framework!
