2026-01-28 15:58:36,622 - root - INFO - CLI Mode Logging Initialized
2026-01-28 15:58:36,623 - root - INFO - CLI logs will be saved to: logs/dq_framework_20260128_155836.log
2026-01-28 15:58:36,623 - __main__ - INFO - 🚀 UNIVERSAL DATA QUALITY FRAMEWORK INITIALIZED
2026-01-28 15:58:36,624 - __main__ - INFO - Starting system resource check
2026-01-28 15:58:36,630 - __main__ - INFO - Total RAM: 15.7 GB
2026-01-28 15:58:36,630 - __main__ - INFO - Available RAM: 2.1 GB
2026-01-28 15:58:36,630 - __main__ - INFO - Memory used: 86.5%
2026-01-28 15:58:36,630 - __main__ - INFO - Memory status: OK
2026-01-28 15:58:36,631 - __main__ - INFO - Free disk space: 259.0 GB
2026-01-28 15:58:36,631 - __main__ - INFO - Disk used: 45.6%
2026-01-28 15:58:36,631 - __main__ - INFO - Disk space: OK
2026-01-28 15:58:37,133 - __main__ - INFO - CPU cores: 8
2026-01-28 15:58:37,133 - __main__ - INFO - CPU usage: 13.7%
2026-01-28 15:58:37,134 - __main__ - INFO - Python version: 3.12.4
2026-01-28 15:58:37,134 - __main__ - INFO - System platform: win32
2026-01-28 15:58:37,134 - __main__ - INFO - User session started at: 2026-01-28 15:58:37.134745
2026-01-28 15:58:37,134 - __main__ - INFO - Displaying main menu options to user
2026-01-28 15:58:38,985 - __main__ - INFO - User selected option: 2
2026-01-28 15:58:38,986 - __main__ - INFO - Starting Source-Target Comparison module
2026-01-28 15:58:38,990 - dq_comparison - INFO - STARTING UNIVERSAL SOURCE-TARGET COMPARISON TOOL
2026-01-28 15:58:38,991 - dq_comparison - INFO - LOADING SOURCE AND TARGET DATA
2026-01-28 15:58:38,991 - dq_comparison - INFO - 
==================================================
2026-01-28 15:58:38,991 - dq_comparison - INFO - 🔗 SOURCE DATA CONFIGURATION
2026-01-28 15:58:38,991 - dq_comparison - INFO - ==================================================
2026-01-28 15:58:58,754 - dq_comparison - INFO - 
🗄️ SOURCE DATABASE CONFIGURATION
2026-01-28 15:58:58,755 - dq_comparison - INFO - ----------------------------------------
2026-01-28 15:59:00,363 - dq_comparison - INFO - Selected database type code: postgresql
2026-01-28 15:59:01,678 - dq_comparison - INFO - User selected Browse and Select mode for SOURCE
2026-01-28 15:59:01,686 - dq_comparison - INFO - Converted 'postgresql' to 'postgres' for database_navigator compatibility
2026-01-28 15:59:01,686 - database_navigator - INFO - DatabaseNavigator initialized
2026-01-28 15:59:01,687 - database_navigator - INFO - Starting database navigation...
2026-01-28 15:59:01,687 - database_navigator - INFO - Database type: postgres
2026-01-28 15:59:01,687 - database_navigator - INFO - Getting database configuration...
2026-01-28 15:59:06,860 - database_navigator - INFO - Connecting to POSTGRES...
2026-01-28 15:59:06,861 - database_navigator - INFO - Connecting to PostgreSQL...
2026-01-28 15:59:06,863 - database_navigator - INFO - Connecting to PostgreSQL: host=localhost, port=5432, database=postgres, user=postgres
2026-01-28 15:59:07,010 - database_navigator - INFO - Connection object created: <connection object at 0x00000189DD306CE0; dsn: 'user=postgres password=xxx dbname=postgres host=localhost port=5432', closed: 0>
2026-01-28 15:59:07,012 - database_navigator - INFO - ✅ PostgreSQL connection successful to database: postgres
2026-01-28 15:59:07,014 - database_navigator - INFO - get_databases() called. db_type: postgres, connection exists: True
2026-01-28 15:59:07,037 - database_navigator - INFO - Raw rows: [('dq_checks',), ('finewise-testdb',), ('postgres',)]
2026-01-28 15:59:07,038 - database_navigator - INFO - Found 3 databases
2026-01-28 15:59:10,219 - database_navigator - INFO - Selected database: dq_checks
2026-01-28 15:59:10,221 - database_navigator - INFO - Reconnecting to PostgreSQL database: dq_checks
2026-01-28 15:59:10,222 - database_navigator - INFO - Connecting to POSTGRES...
2026-01-28 15:59:10,222 - database_navigator - INFO - Connecting to PostgreSQL...
2026-01-28 15:59:10,223 - database_navigator - INFO - Connecting to PostgreSQL: host=localhost, port=5432, database=dq_checks, user=postgres
2026-01-28 15:59:10,345 - database_navigator - INFO - Connection object created: <connection object at 0x00000189DD306DF0; dsn: 'user=postgres password=xxx dbname=dq_checks host=localhost port=5432', closed: 0>
2026-01-28 15:59:10,346 - database_navigator - INFO - ✅ PostgreSQL connection successful to database: dq_checks
2026-01-28 15:59:10,390 - database_navigator - INFO - Found 4 schemas
2026-01-28 15:59:13,298 - database_navigator - INFO - Selected schema: public
2026-01-28 15:59:13,300 - database_navigator - INFO - Ensuring connection to database: dq_checks for table list
2026-01-28 15:59:13,301 - database_navigator - INFO - Reconnecting to PostgreSQL database: dq_checks
2026-01-28 15:59:13,301 - database_navigator - INFO - Connecting to POSTGRES...
2026-01-28 15:59:13,301 - database_navigator - INFO - Connecting to PostgreSQL...
2026-01-28 15:59:13,302 - database_navigator - INFO - Connecting to PostgreSQL: host=localhost, port=5432, database=dq_checks, user=postgres
2026-01-28 15:59:13,520 - database_navigator - INFO - Connection object created: <connection object at 0x00000189DD306F00; dsn: 'user=postgres password=xxx dbname=dq_checks host=localhost port=5432', closed: 0>
2026-01-28 15:59:13,521 - database_navigator - INFO - ✅ PostgreSQL connection successful to database: dq_checks
2026-01-28 15:59:13,523 - database_navigator - INFO - Connected to database: dq_checks, schema: public
2026-01-28 15:59:13,587 - database_navigator - INFO - Found 5 tables in dq_checks.public: ['comparison_small_target13', 'customers', 'customers_bkp', 'employee', 'stg_transactions']
2026-01-28 15:59:13,587 - database_navigator - INFO - Found 5 tables in schema 'public'
2026-01-28 15:59:36,519 - database_navigator - INFO - Selected table: employee
2026-01-28 15:59:36,528 - database_navigator - INFO - Selection complete: {'type': 'postgresql', 'database': 'dq_checks', 'schema': 'public', 'table': 'employee', 'selection_mode': 'hierarchical', 'host': 'localhost', 'port': '5432', 'user': 'postgres', 'password': 'postgres'}
2026-01-28 15:59:36,529 - dq_comparison - INFO - Selected via navigation for SOURCE: dq_checks.public.employee
2026-01-28 15:59:36,529 - dq_unified - INFO - Loading data from DATABASE
2026-01-28 15:59:36,529 - dq_unified - INFO - Loading large database table: employee
2026-01-28 15:59:36,529 - dq_unified - INFO - Normalized DB config with schema: public
2026-01-28 15:59:36,806 - dq_unified - INFO - PostgreSQL table public.employee has 89,999 rows
2026-01-28 15:59:36,806 - dq_unified - INFO - Loading 89,999 rows from PostgreSQL...
2026-01-28 15:59:37,082 - dq_unified - INFO - Loaded 89,999 rows from PostgreSQL
2026-01-28 15:59:37,634 - dq_unified - INFO - Memory optimization: 60.9MB -> 25.8MB (Saved: 35.1MB)
2026-01-28 15:59:37,702 - dq_unified - INFO - Loaded 89,999 rows, 12 columns. Memory: 172.5MB total, 25.8MB for dataframe
2026-01-28 15:59:37,702 - dq_comparison - INFO - SOURCE database loaded: 89,999 rows, 12 columns
2026-01-28 15:59:37,703 - dq_comparison - INFO - 
==================================================
2026-01-28 15:59:37,705 - dq_comparison - INFO - 🔗 TARGET DATA CONFIGURATION
2026-01-28 15:59:37,705 - dq_comparison - INFO - ==================================================
2026-01-28 15:59:41,137 - dq_comparison - INFO - DEBUG load_excel_source called for TARGET
2026-01-28 15:59:41,139 - dq_comparison - INFO - DEBUG ui_data: None
2026-01-28 15:59:41,139 - dq_comparison - INFO - DEBUG ui_data type: <class 'NoneType'>
2026-01-28 16:03:13,618 - dq_comparison - INFO - TARGET Excel loaded: 100,500 rows, 12 columns
2026-01-28 16:03:13,618 - dq_comparison - INFO - SELECTING COLUMNS FOR COMPARISON
2026-01-28 16:03:13,620 - dq_comparison - INFO - Source columns (original): ['id', 'customer_id', 'transaction_id', 'customer_name', 'email', 'phone', 'transaction_date', 'amount', 'quantity', 'age', 'status', 'description']
2026-01-28 16:03:13,621 - dq_comparison - INFO - Target columns (original): ['id', 'customer_id', 'transaction_id', 'customer_name', 'email', 'phone', 'transaction_date', 'amount', 'quantity', 'age', 'status', 'description']
2026-01-28 16:03:13,622 - dq_comparison - INFO - Common columns lowercased: ['amount', 'age', 'status', 'transaction_id', 'quantity', 'customer_id', 'customer_name', 'transaction_date', 'description', 'email', 'phone', 'id']
2026-01-28 16:03:13,623 - dq_comparison - INFO - Found 12 common columns between source and target (case-insensitive)
2026-01-28 16:03:13,623 - dq_comparison - INFO - 
📋 Common columns available for comparison:
2026-01-28 16:03:13,624 - dq_comparison - INFO -   1. amount (Source) ↔ amount (Target)
2026-01-28 16:03:13,625 - dq_comparison - INFO -   2. age (Source) ↔ age (Target)
2026-01-28 16:03:13,626 - dq_comparison - INFO -   3. status (Source) ↔ status (Target)
2026-01-28 16:03:13,627 - dq_comparison - INFO -   4. transaction_id (Source) ↔ transaction_id (Target)
2026-01-28 16:03:13,627 - dq_comparison - INFO -   5. quantity (Source) ↔ quantity (Target)
2026-01-28 16:03:13,628 - dq_comparison - INFO -   6. customer_id (Source) ↔ customer_id (Target)
2026-01-28 16:03:13,629 - dq_comparison - INFO -   7. customer_name (Source) ↔ customer_name (Target)
2026-01-28 16:03:13,630 - dq_comparison - INFO -   8. transaction_date (Source) ↔ transaction_date (Target)
2026-01-28 16:03:13,630 - dq_comparison - INFO -   9. description (Source) ↔ description (Target)
2026-01-28 16:03:13,630 - dq_comparison - INFO -   10. email (Source) ↔ email (Target)
2026-01-28 16:03:13,630 - dq_comparison - INFO -   11. phone (Source) ↔ phone (Target)
2026-01-28 16:03:13,631 - dq_comparison - INFO -   12. id (Source) ↔ id (Target)
2026-01-28 16:03:17,073 - dq_comparison - INFO - User column selection input: all
2026-01-28 16:03:17,075 - dq_comparison - INFO - User selected ALL common columns for comparison
2026-01-28 16:03:17,075 - dq_comparison - INFO - GENERATING COMPREHENSIVE COMPARISON REPORT
2026-01-28 16:03:17,077 - dq_comparison - INFO - Report details - Source: Database: postgresql - dq_checks.employee, Target: Excel: Target_data_100k.xlsx (Target_data_100k), Selected columns: 12
2026-01-28 16:03:17,078 - dq_comparison - INFO - Initializing Error Logger...
2026-01-28 16:03:17,078 - dq_error_log - INFO - ErrorLogger initialized with database: dq_checks
2026-01-28 16:03:17,235 - dq_error_log - INFO - Database connection successful
2026-01-28 16:03:17,236 - dq_comparison - INFO - Session ID: CMP_20260128_160317
2026-01-28 16:03:17,236 - dq_comparison - INFO - 
======================================================================
2026-01-28 16:03:17,237 - dq_comparison - INFO - 🔄 RUNNING SOURCE-TARGET COMPARISON WITH PERFECT NORMALIZATION
2026-01-28 16:03:17,238 - dq_comparison - INFO - ======================================================================
2026-01-28 16:03:17,238 - dq_comparison - INFO - Session ID: CMP_20260128_160317
2026-01-28 16:03:17,238 - dq_comparison - INFO - Source: Database: postgresql - dq_checks.employee
2026-01-28 16:03:17,239 - dq_comparison - INFO - Target: Excel: Target_data_100k.xlsx (Target_data_100k)
2026-01-28 16:03:17,239 - dq_comparison - INFO - Selected columns: 12
2026-01-28 16:03:17,239 - dq_comparison - INFO - ======================================================================
2026-01-28 16:03:17,240 - dq_comparison - INFO - 
1️⃣ FIRST: ROW COUNT CHECK
2026-01-28 16:03:17,240 - dq_comparison - WARNING - ❌ Row count mismatch: Source=89,999, Target=100,500, Difference=10,501
2026-01-28 16:03:17,240 - dq_comparison - WARNING -    Extra in target: 10,501 rows
2026-01-28 16:03:17,241 - dq_comparison - INFO - 
2️⃣ COLUMN STRUCTURE COMPARISON
2026-01-28 16:03:17,241 - dq_comparison - INFO - Comparing column structures...
2026-01-28 16:03:17,241 - dq_comparison - INFO - Column structure comparison complete. Match: True
2026-01-28 16:03:17,242 - dq_comparison - INFO - 
3️⃣ PRIMARY KEY VALIDATION
2026-01-28 16:03:17,242 - dq_comparison - INFO - Validating primary key/unique fields...
2026-01-28 16:03:17,242 - dq_comparison - INFO - Checking key fields: ['id', 'customer_id']
2026-01-28 16:03:17,271 - dq_comparison - WARNING - Field 'id' has duplicates in source: 406 rows
2026-01-28 16:03:17,271 - dq_comparison - WARNING - Field 'id' has duplicates in target: 500 rows
2026-01-28 16:03:17,306 - dq_comparison - WARNING - Field 'customer_id' has duplicates in source: 804 rows
2026-01-28 16:03:17,306 - dq_comparison - WARNING - Field 'customer_id' has duplicates in target: 1000 rows
2026-01-28 16:03:17,306 - dq_comparison - INFO - Primary key validation complete. Passed: False
2026-01-28 16:03:17,352 - dq_comparison - INFO -    Key fields found: ['id', 'customer_id']
2026-01-28 16:03:17,352 - dq_comparison - INFO -    Unique in source: ❌
2026-01-28 16:03:17,353 - dq_comparison - INFO -    Unique in target: ❌
2026-01-28 16:03:17,354 - dq_comparison - INFO -    Validation passed: ❌
2026-01-28 16:03:17,355 - dq_comparison - WARNING -    Source duplicates in 'id': 406 rows
2026-01-28 16:03:17,355 - dq_comparison - WARNING -      Sample values: ['42732', '34440', '58427']
2026-01-28 16:03:17,355 - dq_comparison - WARNING -    Source duplicates in 'customer_id': 804 rows
2026-01-28 16:03:17,355 - dq_comparison - WARNING -      Sample values: ['CUST029319', 'CUST042732', 'CUST034440']
2026-01-28 16:03:17,355 - dq_comparison - WARNING -    Target duplicates in 'id': 500 rows
2026-01-28 16:03:17,356 - dq_comparison - WARNING -      Sample values: [42732, 34440, 58427]
2026-01-28 16:03:17,356 - dq_comparison - WARNING -    Target duplicates in 'customer_id': 1000 rows
2026-01-28 16:03:17,356 - dq_comparison - WARNING -      Sample values: ['CUST029319', 'CUST042732', 'CUST034440']
2026-01-28 16:03:17,357 - dq_comparison - INFO -    Column names match: ✅
2026-01-28 16:03:17,357 - dq_comparison - INFO -    Column order match: ✅
2026-01-28 16:03:17,357 - dq_comparison - INFO -    Data types match: ✅
2026-01-28 16:03:17,357 - dq_comparison - INFO - 
4️⃣ TABLE METADATA COMPARISON
2026-01-28 16:03:17,358 - dq_comparison - INFO - Comparing table-level metadata...
2026-01-28 16:03:18,476 - dq_comparison - INFO - Table metadata comparison complete. Match: False
2026-01-28 16:03:18,513 - dq_comparison - INFO -    Table metadata match: ❌
2026-01-28 16:03:18,513 - dq_comparison - INFO -    Source: 89,999 rows, 12 cols, 25.79 MB
2026-01-28 16:03:18,515 - dq_comparison - INFO -    Target: 100,500 rows, 12 cols, 49.7 MB
2026-01-28 16:03:18,516 - dq_comparison - WARNING -    Found 2 metadata differences:
2026-01-28 16:03:18,517 - dq_comparison - WARNING -      • Row Count: Source=89999, Target=100500
2026-01-28 16:03:18,518 - dq_comparison - WARNING -      • Memory Usage: Source=25.79 MB, Target=49.7 MB
2026-01-28 16:03:18,518 - dq_comparison - INFO - 
5️⃣ HASH-BASED COMPARISON
2026-01-28 16:03:18,519 - dq_comparison - INFO - ℹ️  Note: All NULL values normalized to 'NULL'
2026-01-28 16:03:18,519 - dq_comparison - INFO - ℹ️  Note: Dates normalized to YYYY-MM-DD
2026-01-28 16:03:18,520 - dq_comparison - INFO - ℹ️  Note: Strings trimmed and case-normalized
2026-01-28 16:03:18,520 - dq_comparison - INFO - ℹ️  Note: Phone numbers stripped to digits only, leading zeros removed
2026-01-28 16:03:18,520 - dq_comparison - INFO - SECOND CHECK: HASH-BASED COMPARISON WITH PERFECT NORMALIZATION
2026-01-28 16:03:18,530 - dq_comparison - INFO - Starting comparison of 190,499 total rows...
2026-01-28 16:03:18,530 - dq_comparison - INFO - === DEBUG: DATA TYPE CHECK ===
2026-01-28 16:03:18,531 - dq_comparison - INFO - Column: amount
2026-01-28 16:03:18,531 - dq_comparison - INFO -   Source type: <class 'str'>, value: 8653.56
2026-01-28 16:03:18,531 - dq_comparison - INFO -   Target type: <class 'numpy.float64'>, value: 8653.56
2026-01-28 16:03:18,532 - dq_comparison - INFO -   Normalized: '8653.56' vs '8653.56'
2026-01-28 16:03:18,532 - dq_comparison - INFO -   Match: True
2026-01-28 16:03:18,532 - dq_comparison - INFO - Column: age
2026-01-28 16:03:18,532 - dq_comparison - INFO -   Source type: <class 'str'>, value: 50
2026-01-28 16:03:18,533 - dq_comparison - INFO -   Target type: <class 'numpy.int64'>, value: 50
2026-01-28 16:03:18,534 - dq_comparison - INFO -   Normalized: '50' vs '50'
2026-01-28 16:03:18,534 - dq_comparison - INFO -   Match: True
2026-01-28 16:03:18,534 - dq_comparison - INFO - Column: status
2026-01-28 16:03:18,534 - dq_comparison - INFO -   Source type: <class 'str'>, value: PENDING
2026-01-28 16:03:18,535 - dq_comparison - INFO -   Target type: <class 'str'>, value: PENDING
2026-01-28 16:03:18,535 - dq_comparison - INFO -   Normalized: 'pending' vs 'pending'
2026-01-28 16:03:18,535 - dq_comparison - INFO -   Match: True
2026-01-28 16:03:18,535 - dq_comparison - INFO - Source DF columns: ['id', 'customer_id', 'transaction_id', 'customer_name', 'email', 'phone', 'transaction_date', 'amount', 'quantity', 'age', 'status', 'description']
2026-01-28 16:03:18,536 - dq_comparison - INFO - Target DF columns: ['id', 'customer_id', 'transaction_id', 'customer_name', 'email', 'phone', 'transaction_date', 'amount', 'quantity', 'age', 'status', 'description']
2026-01-28 16:03:18,536 - dq_comparison - INFO - Selected columns for comparison: ['amount', 'age', 'status', 'transaction_id', 'quantity', 'customer_id', 'customer_name', 'transaction_date', 'description', 'email', 'phone', 'id']
2026-01-28 16:03:18,536 - dq_comparison - INFO - Using 12 common columns for hash comparison
2026-01-28 16:03:18,536 - dq_comparison - INFO - Source columns: ['amount', 'age', 'status', 'transaction_id', 'quantity', 'customer_id', 'customer_name', 'transaction_date', 'description', 'email', 'phone', 'id']
2026-01-28 16:03:18,536 - dq_comparison - INFO - Target columns: ['amount', 'age', 'status', 'transaction_id', 'quantity', 'customer_id', 'customer_name', 'transaction_date', 'description', 'email', 'phone', 'id']
2026-01-28 16:03:18,537 - dq_comparison - INFO - Generating hashes for source data (89999 rows)...
2026-01-28 16:03:21,509 - dq_comparison - INFO -    Hashing source data: 10.0% complete (19,050/190,499 rows)
2026-01-28 16:03:24,504 - dq_comparison - INFO -    Hashing source data: 20.0% complete (38,100/190,499 rows)
2026-01-28 16:03:26,320 - dq_comparison - INFO -    Hashing source data: 26.2% complete (50,000/190,499 rows)
2026-01-28 16:03:29,485 - dq_comparison - INFO -    Hashing source data: 36.2% complete (69,050/190,499 rows)
2026-01-28 16:03:32,448 - dq_comparison - INFO -    Hashing source data: 46.2% complete (88,100/190,499 rows)
2026-01-28 16:03:32,754 - dq_comparison - INFO - === DEBUG: SAMPLE HASHES ===
2026-01-28 16:03:32,757 - dq_comparison - INFO - Hash 1: 6d897f31f71d42cf... (sample row 0)
2026-01-28 16:03:32,757 - dq_comparison - INFO - Hash 2: 9f8604ec8beb2f3e... (sample row 1)
2026-01-28 16:03:32,757 - dq_comparison - INFO - Hash 3: 87e9caa1e94ecb88... (sample row 2)
2026-01-28 16:03:32,759 - dq_comparison - INFO - Generating hashes for target data (100500 rows)...
2026-01-28 16:03:34,196 - dq_comparison - INFO -    Hashing target data: 52.5% complete (100,000/190,499 rows)
2026-01-28 16:03:36,874 - dq_comparison - INFO -    Hashing target data: 62.5% complete (119,050/190,499 rows)
2026-01-28 16:03:39,602 - dq_comparison - INFO -    Hashing target data: 72.5% complete (138,100/190,499 rows)
2026-01-28 16:03:42,908 - dq_comparison - INFO -    Hashing target data: 78.7% complete (150,000/190,499 rows)
2026-01-28 16:03:45,505 - dq_comparison - INFO -    Hashing target data: 88.7% complete (169,050/190,499 rows)
2026-01-28 16:03:48,108 - dq_comparison - INFO -    Hashing target data: 98.7% complete (188,100/190,499 rows)
2026-01-28 16:03:48,423 - dq_comparison - INFO - 
======================================================================
2026-01-28 16:03:48,424 - dq_comparison - INFO - 🔍 DEBUG: ANALYZING WHY HASHES DON'T MATCH
2026-01-28 16:03:48,425 - dq_comparison - INFO - ======================================================================
2026-01-28 16:03:48,426 - dq_comparison - INFO - 
--- Analyzing Row 0 ---
2026-01-28 16:03:48,427 - dq_comparison - INFO - Column 'amount' → 'amount':
2026-01-28 16:03:48,427 - dq_comparison - INFO -   Source: '8653.56' (type: str) → '8653.56'
2026-01-28 16:03:48,427 - dq_comparison - INFO -   Target: '8653.56' (type: float64) → '8653.56'
2026-01-28 16:03:48,428 - dq_comparison - INFO -   Match after normalization: ✅ YES
2026-01-28 16:03:48,428 - dq_comparison - INFO - Column 'age' → 'age':
2026-01-28 16:03:48,429 - dq_comparison - INFO -   Source: '50' (type: str) → '50'
2026-01-28 16:03:48,429 - dq_comparison - INFO -   Target: '50' (type: int64) → '50'
2026-01-28 16:03:48,429 - dq_comparison - INFO -   Match after normalization: ✅ YES
2026-01-28 16:03:48,430 - dq_comparison - INFO - Column 'status' → 'status':
2026-01-28 16:03:48,431 - dq_comparison - INFO -   Source: 'PENDING' (type: str) → 'pending'
2026-01-28 16:03:48,431 - dq_comparison - INFO -   Target: 'PENDING' (type: str) → 'pending'
2026-01-28 16:03:48,431 - dq_comparison - INFO -   Match after normalization: ✅ YES
2026-01-28 16:03:48,432 - dq_comparison - INFO - Column 'transaction_id' → 'transaction_id':
2026-01-28 16:03:48,432 - dq_comparison - INFO -   Source: 'TX00078303' (type: str) → 'TX00078303'
2026-01-28 16:03:48,432 - dq_comparison - INFO -   Target: 'TX00078303' (type: str) → 'TX00078303'
2026-01-28 16:03:48,433 - dq_comparison - INFO -   Match after normalization: ✅ YES
2026-01-28 16:03:48,433 - dq_comparison - INFO - Column 'quantity' → 'quantity':
2026-01-28 16:03:48,433 - dq_comparison - INFO -   Source: '41' (type: str) → '41'
2026-01-28 16:03:48,433 - dq_comparison - INFO -   Target: '41' (type: int64) → '41'
2026-01-28 16:03:48,433 - dq_comparison - INFO -   Match after normalization: ✅ YES
2026-01-28 16:03:48,434 - dq_comparison - INFO - 
Hash components for Row 0:
2026-01-28 16:03:48,434 - dq_comparison - INFO - Source hash string start: 8653.56|50|pending...
2026-01-28 16:03:48,434 - dq_comparison - INFO - Target hash string start: 8653.56|50|pending...
2026-01-28 16:03:48,434 - dq_comparison - INFO - Same? ✅ YES
2026-01-28 16:03:48,435 - dq_comparison - INFO - 
--- Analyzing Row 1 ---
2026-01-28 16:03:48,435 - dq_comparison - INFO - Column 'amount' → 'amount':
2026-01-28 16:03:48,435 - dq_comparison - INFO -   Source: '1948.44' (type: str) → '1948.44'
2026-01-28 16:03:48,435 - dq_comparison - INFO -   Target: '1948.44' (type: float64) → '1948.44'
2026-01-28 16:03:48,436 - dq_comparison - INFO -   Match after normalization: ✅ YES
2026-01-28 16:03:48,436 - dq_comparison - INFO - Column 'age' → 'age':
2026-01-28 16:03:48,436 - dq_comparison - INFO -   Source: '49' (type: str) → '49'
2026-01-28 16:03:48,436 - dq_comparison - INFO -   Target: '49' (type: int64) → '49'
2026-01-28 16:03:48,436 - dq_comparison - INFO -   Match after normalization: ✅ YES
2026-01-28 16:03:48,437 - dq_comparison - INFO - Column 'status' → 'status':
2026-01-28 16:03:48,437 - dq_comparison - INFO -   Source: 'ACTIVE' (type: str) → 'active'
2026-01-28 16:03:48,437 - dq_comparison - INFO -   Target: 'ACTIVE' (type: str) → 'active'
2026-01-28 16:03:48,437 - dq_comparison - INFO -   Match after normalization: ✅ YES
2026-01-28 16:03:48,438 - dq_comparison - INFO - Column 'transaction_id' → 'transaction_id':
2026-01-28 16:03:48,438 - dq_comparison - INFO -   Source: 'TX00066465' (type: str) → 'TX00066465'
2026-01-28 16:03:48,438 - dq_comparison - INFO -   Target: 'TX00066465' (type: str) → 'TX00066465'
2026-01-28 16:03:48,438 - dq_comparison - INFO -   Match after normalization: ✅ YES
2026-01-28 16:03:48,438 - dq_comparison - INFO - Column 'quantity' → 'quantity':
2026-01-28 16:03:48,439 - dq_comparison - INFO -   Source: '73' (type: str) → '73'
2026-01-28 16:03:48,439 - dq_comparison - INFO -   Target: '73' (type: int64) → '73'
2026-01-28 16:03:48,439 - dq_comparison - INFO -   Match after normalization: ✅ YES
2026-01-28 16:03:48,439 - dq_comparison - INFO - 
Hash components for Row 1:
2026-01-28 16:03:48,440 - dq_comparison - INFO - Source hash string start: 1948.44|49|active...
2026-01-28 16:03:48,440 - dq_comparison - INFO - Target hash string start: 1948.44|49|active...
2026-01-28 16:03:48,440 - dq_comparison - INFO - Same? ✅ YES
2026-01-28 16:03:48,441 - dq_comparison - INFO - 
--- Analyzing Row 2 ---
2026-01-28 16:03:48,441 - dq_comparison - INFO - Column 'amount' → 'amount':
2026-01-28 16:03:48,441 - dq_comparison - INFO -   Source: '237.49' (type: str) → '237.49'
2026-01-28 16:03:48,441 - dq_comparison - INFO -   Target: '237.49' (type: float64) → '237.49'
2026-01-28 16:03:48,442 - dq_comparison - INFO -   Match after normalization: ✅ YES
2026-01-28 16:03:48,442 - dq_comparison - INFO - Column 'age' → 'age':
2026-01-28 16:03:48,442 - dq_comparison - INFO -   Source: '65' (type: str) → '65'
2026-01-28 16:03:48,443 - dq_comparison - INFO -   Target: '65' (type: int64) → '65'
2026-01-28 16:03:48,443 - dq_comparison - INFO -   Match after normalization: ✅ YES
2026-01-28 16:03:48,443 - dq_comparison - INFO - Column 'status' → 'status':
2026-01-28 16:03:48,444 - dq_comparison - INFO -   Source: 'CANCELLED' (type: str) → 'cancelled'
2026-01-28 16:03:48,444 - dq_comparison - INFO -   Target: 'CANCELLED' (type: str) → 'cancelled'
2026-01-28 16:03:48,444 - dq_comparison - INFO -   Match after normalization: ✅ YES
2026-01-28 16:03:48,444 - dq_comparison - INFO - Column 'transaction_id' → 'transaction_id':
2026-01-28 16:03:48,445 - dq_comparison - INFO -   Source: 'TX00093228' (type: str) → 'TX00093228'
2026-01-28 16:03:48,447 - dq_comparison - INFO -   Target: 'TX00093228' (type: str) → 'TX00093228'
2026-01-28 16:03:48,448 - dq_comparison - INFO -   Match after normalization: ✅ YES
2026-01-28 16:03:48,448 - dq_comparison - INFO - Column 'quantity' → 'quantity':
2026-01-28 16:03:48,448 - dq_comparison - INFO -   Source: '17' (type: str) → '17'
2026-01-28 16:03:48,448 - dq_comparison - INFO -   Target: '17' (type: int64) → '17'
2026-01-28 16:03:48,449 - dq_comparison - INFO -   Match after normalization: ✅ YES
2026-01-28 16:03:48,449 - dq_comparison - INFO - 
Hash components for Row 2:
2026-01-28 16:03:48,449 - dq_comparison - INFO - Source hash string start: 237.49|65|cancelled...
2026-01-28 16:03:48,449 - dq_comparison - INFO - Target hash string start: 237.49|65|cancelled...
2026-01-28 16:03:48,450 - dq_comparison - INFO - Same? ✅ YES
2026-01-28 16:03:48,450 - dq_comparison - INFO - 
--- Column Data Types Analysis ---
2026-01-28 16:03:48,450 - dq_comparison - INFO - Column 1: 'amount' (object) ↔ 'amount' (float64)
2026-01-28 16:03:48,451 - dq_comparison - INFO -   Sample: Source='8653.56', Target='8653.56'
2026-01-28 16:03:48,451 - dq_comparison - INFO - Column 2: 'age' (category) ↔ 'age' (int64)
2026-01-28 16:03:48,451 - dq_comparison - INFO -   Sample: Source='50', Target='50'
2026-01-28 16:03:48,451 - dq_comparison - INFO - Column 3: 'status' (category) ↔ 'status' (object)
2026-01-28 16:03:48,452 - dq_comparison - INFO -   Sample: Source='PENDING', Target='PENDING'
2026-01-28 16:03:48,452 - dq_comparison - INFO - Column 4: 'transaction_id' (object) ↔ 'transaction_id' (object)
2026-01-28 16:03:48,452 - dq_comparison - INFO -   Sample: Source='TX00078303', Target='TX00078303'
2026-01-28 16:03:48,453 - dq_comparison - INFO - Column 5: 'quantity' (category) ↔ 'quantity' (int64)
2026-01-28 16:03:48,453 - dq_comparison - INFO -   Sample: Source='41', Target='41'
2026-01-28 16:03:48,453 - dq_comparison - INFO - PERFORMING DETAILED ROW-LEVEL COMPARISON WITH PAGINATION...
2026-01-28 16:03:48,475 - dq_comparison - INFO - Found 10,463 total mismatches
2026-01-28 16:03:48,476 - dq_comparison - INFO - Will process detailed comparisons for first 5,000 rows
2026-01-28 16:03:55,220 - dq_comparison - INFO - Progress: 500/5,000 rows (6.8s)
2026-01-28 16:04:01,262 - dq_comparison - INFO - Progress: 1,000/5,000 rows (12.8s)
2026-01-28 16:04:07,363 - dq_comparison - INFO - Progress: 1,500/5,000 rows (18.9s)
2026-01-28 16:04:13,686 - dq_comparison - INFO - Progress: 2,000/5,000 rows (25.2s)
2026-01-28 16:04:22,714 - dq_comparison - INFO - Progress: 2,500/5,000 rows (34.3s)
2026-01-28 16:04:30,762 - dq_comparison - INFO - Progress: 3,000/5,000 rows (42.3s)
2026-01-28 16:04:38,616 - dq_comparison - INFO - Progress: 3,500/5,000 rows (50.2s)
2026-01-28 16:04:46,313 - dq_comparison - INFO - Progress: 4,000/5,000 rows (57.9s)
2026-01-28 16:04:54,242 - dq_comparison - INFO - Progress: 4,500/5,000 rows (65.8s)
2026-01-28 16:05:00,831 - dq_comparison - INFO - Progress: 5,000/5,000 rows (72.4s)
2026-01-28 16:05:00,847 - dq_comparison - INFO - 
================================================================================
2026-01-28 16:05:00,847 - dq_comparison - INFO - DETAILED MISMATCH SUMMARY:
2026-01-28 16:05:00,848 - dq_comparison - INFO -   Total mismatches found: 4997
2026-01-28 16:05:00,848 - dq_comparison - INFO -   Detailed comparisons logged: 4997
2026-01-28 16:05:00,849 - dq_comparison - INFO -   First 10 rows displayed above
2026-01-28 16:05:00,849 - dq_comparison - INFO -   All mismatches stored in database with complete data
2026-01-28 16:05:00,849 - dq_comparison - INFO -   Use API to retrieve all 4997 mismatches
2026-01-28 16:05:00,849 - dq_comparison - INFO - ================================================================================
2026-01-28 16:05:00,890 - dq_comparison - INFO - Hash-based Comparison Results (with duplicate handling):
2026-01-28 16:05:00,890 - dq_comparison - INFO -   • Unique source hashes: 89796
2026-01-28 16:05:00,891 - dq_comparison - INFO -   • Unique target hashes: 100250
2026-01-28 16:05:00,892 - dq_comparison - INFO -   • Common hashes: 89793
2026-01-28 16:05:00,893 - dq_comparison - INFO -   • Common rows (counting duplicates): 89,996
2026-01-28 16:05:00,894 - dq_comparison - INFO -   • Rows only in source (counting duplicates): 3
2026-01-28 16:05:00,894 - dq_comparison - INFO -   • Rows only in target (counting duplicates): 10,504
2026-01-28 16:05:00,943 - dq_comparison - INFO - HASH-ONLY COMPARISON COMPLETED
2026-01-28 16:05:00,943 - dq_comparison - INFO - Returning counts for simple scoring:
2026-01-28 16:05:00,944 - dq_comparison - INFO -   Common rows: 89,996
2026-01-28 16:05:00,945 - dq_comparison - INFO -   Unique to source: 3
2026-01-28 16:05:00,945 - dq_comparison - INFO -   Unique to target: 10,504
2026-01-28 16:05:00,945 - dq_comparison - INFO -   Value mismatches: 126084
2026-01-28 16:05:00,946 - dq_comparison - INFO -   Missing rows: 3
2026-01-28 16:05:00,946 - dq_comparison - INFO -   Extra rows: 10,504
2026-01-28 16:05:00,947 - dq_comparison - INFO - 
========================================================================================================================
COMPARISON: Postgresql Database vs Excel (Target_data_100k.xlsx (Target_data_100k))
========================================================================================================================
Row   | Diff Count | Source (Sample)                          | Target (Sample)                         
------------------------------------------------------------------------------------------------------------------------
39    | 1          | amount: 2553.44                          | amount: 2553.44                         
24898 | 1          | amount: 5374.81                          | amount: 5374.81                         
61471 | 1          | amount: NaN                              | amount: NULL                            
90001 | 12         | amount: NULL                             | amount: 6013.06                         
90002 | 12         | amount: NULL                             | amount: 7554.93                         
90003 | 12         | amount: NULL                             | amount: 7024.96                         
90004 | 12         | amount: NULL                             | amount: 2335.61                         
90005 | 12         | amount: NULL                             | amount: 9051.02                         
90006 | 12         | amount: NULL                             | amount: 7510.39                         
90007 | 12         | amount: NULL                             | amount: 6596.81                         
------------------------------------------------------------------------------------------------------------------------
Showing 1-10 of 4997 mismatched rows. Use API for complete data.
========================================================================================================================
2026-01-28 16:05:00,947 - dq_comparison - INFO - Returning enhanced mismatch structure with 4997 detailed mismatches
2026-01-28 16:05:00,990 - dq_comparison - INFO - New structure: 100 detailed mismatches
2026-01-28 16:05:00,991 - dq_comparison - INFO - 
6️⃣ DATA QUALITY ANALYSIS
2026-01-28 16:05:00,992 - dq_comparison - INFO - Analyzing data quality metrics...
2026-01-28 16:05:10,052 - dq_comparison - INFO - Null values - Source: 0 (0.00%), Target: 8315 (0.69%)
2026-01-28 16:05:10,305 - dq_comparison - INFO - Duplicate rows (normalized) - Source: 203, Target: 250
2026-01-28 16:05:10,418 - dq_comparison - INFO - Source duplicate samples: ['Row 169', 'Row 383', 'Row 639']
2026-01-28 16:05:10,539 - dq_comparison - INFO - Target duplicate samples: ['Row 169', 'Row 383', 'Row 639']
2026-01-28 16:05:10,699 - dq_error_log - INFO - Retrieved 100 error logs for session CMP_20260128_160317
2026-01-28 16:05:10,700 - dq_comparison - INFO - 
📊 SIMPLE SCORING CALCULATION:
2026-01-28 16:05:10,701 - dq_comparison - INFO -   Source rows: 89999
2026-01-28 16:05:10,702 - dq_comparison - INFO -   Common rows (matched): 89996
2026-01-28 16:05:10,703 - dq_comparison - INFO -   Calculation: (89996 / 89999) * 100 = 100.00%
2026-01-28 16:05:10,703 - dq_comparison - INFO -   Explanation: 89996 matched rows out of 89999 total source rows
2026-01-28 16:05:10,703 - dq_comparison - INFO - 
=== AUDIT LOGGING SECTION ===
2026-01-28 16:05:10,704 - dq_comparison - INFO - 🔍 Audit logging is ENABLED in APP_SETTINGS
2026-01-28 16:05:10,704 - dq_audit - INFO - Audit class initialized with database: dq_checks
2026-01-28 16:05:10,704 - dq_comparison - INFO - Attempting to log audit record for session: CMP_20260128_160317
2026-01-28 16:05:10,705 - dq_audit - INFO - Starting database insertion for comparison...
2026-01-28 16:05:10,721 - dq_audit - INFO - Inserted comparison record with ID: 832
2026-01-28 16:05:10,722 - dq_comparison - INFO - ✅ Audit record logged successfully (ID: 832)
2026-01-28 16:05:10,722 - dq_comparison - INFO - 
======================================================================
2026-01-28 16:05:10,722 - dq_comparison - INFO - 📊 COMPARISON RESULTS SUMMARY
2026-01-28 16:05:10,722 - dq_comparison - INFO - ======================================================================
2026-01-28 16:05:10,723 - dq_comparison - INFO - Session ID: CMP_20260128_160317
2026-01-28 16:05:10,723 - dq_comparison - INFO - Source: Database: postgresql - dq_checks.employee (89,999 rows)
2026-01-28 16:05:10,723 - dq_comparison - INFO - Target: Excel: Target_data_100k.xlsx (Target_data_100k) (100,500 rows)
2026-01-28 16:05:10,723 - dq_comparison - INFO - Selected columns: 12
2026-01-28 16:05:10,723 - dq_comparison - INFO - ----------------------------------------------------------------------
2026-01-28 16:05:10,724 - dq_comparison - INFO - 1️⃣ Row count match: ❌ No
2026-01-28 16:05:10,724 - dq_comparison - INFO -    Missing in target: 0 rows
2026-01-28 16:05:10,724 - dq_comparison - INFO -    Extra in target: 10,501 rows
2026-01-28 16:05:10,724 - dq_comparison - INFO - 2️⃣ Column structure match: ✅ Yes
2026-01-28 16:05:10,725 - dq_comparison - INFO - 3️ Primary key validation: ❌ Failed
2026-01-28 16:05:10,725 - dq_comparison - INFO -    Key fields: ['id', 'customer_id']
2026-01-28 16:05:10,725 - dq_comparison - INFO - 4️ Table metadata: ❌ Mismatch
2026-01-28 16:05:10,725 - dq_comparison - INFO -    • Row Count: 89999 vs 100500
2026-01-28 16:05:10,725 - dq_comparison - INFO -    • Memory Usage: 25.79 MB vs 49.7 MB
2026-01-28 16:05:10,726 - dq_comparison - INFO - 5️⃣ Common rows (both Postgresql Database and Excel (Target_data_100k.xlsx (Target_data_100k))): 89,996 (100.00% of Postgresql Database)
2026-01-28 16:05:10,726 - dq_comparison - INFO - 6️⃣ Postgresql Database-only rows: 3 (present ONLY in Postgresql Database, NOT in Excel (Target_data_100k.xlsx (Target_data_100k)))
2026-01-28 16:05:10,726 - dq_comparison - INFO - 7️⃣ Excel (Target_data_100k.xlsx (Target_data_100k))-only rows: 10,504 (present ONLY in Excel (Target_data_100k.xlsx (Target_data_100k)), NOT in Postgresql Database)
2026-01-28 16:05:10,726 - dq_comparison - INFO - 8️⃣ Column value mismatches: 0
2026-01-28 16:05:10,726 - dq_comparison - INFO - 9️ Data quality match: ❌ No
2026-01-28 16:05:10,727 - dq_comparison - INFO - 📈 DQ Score: 100.00%
2026-01-28 16:05:10,729 - dq_comparison - INFO - 📊 Calculation: (89,996 / 89,999) * 100 = 100.00%
2026-01-28 16:05:10,729 - dq_comparison - INFO - ======================================================================
2026-01-28 16:05:10,729 - dq_comparison - INFO - 
🎉 PERFECT MATCH! All data is identical after normalization.
2026-01-28 16:05:10,730 - dq_comparison - INFO - 
🔍 NORMALIZATION APPLIED:
2026-01-28 16:05:10,730 - dq_comparison - INFO -    • NULL values → 'NULL' (consistent representation)
2026-01-28 16:05:10,730 - dq_comparison - INFO -    • Dates → YYYY-MM-DD format
2026-01-28 16:05:10,731 - dq_comparison - INFO -    • Strings → trimmed + lowercase
2026-01-28 16:05:10,731 - dq_comparison - INFO -    • Numeric values → standardized format
2026-01-28 16:05:10,731 - dq_comparison - INFO -    • Phone numbers → digits only, ALL leading zeros removed
2026-01-28 16:05:10,732 - dq_comparison - INFO -    • Extra whitespace removed
2026-01-28 16:05:10,732 - dq_comparison - INFO - 
🔍 DETAILED ERROR ANALYSIS:
2026-01-28 16:05:10,732 - dq_comparison - INFO - --------------------------------------------------
2026-01-28 16:05:10,732 - dq_comparison - INFO - 📊 SOURCE-ONLY ROWS: 3 rows
2026-01-28 16:05:10,733 - dq_comparison - INFO -    Present only in Postgresql Database, missing from Excel (Target_data_100k.xlsx (Target_data_100k))
2026-01-28 16:05:10,733 - dq_comparison - INFO - 📊 TARGET-ONLY ROWS: 10,504 rows
2026-01-28 16:05:10,733 - dq_comparison - INFO -    Present only in Excel (Target_data_100k.xlsx (Target_data_100k)), extra (not in Postgresql Database)
2026-01-28 16:05:10,778 - dq_error_log - INFO - Retrieved 10 errors for session CMP_20260128_160317
2026-01-28 16:05:10,779 - dq_comparison - INFO - 
📋 SAMPLE ERRORS (10 found):
2026-01-28 16:05:10,779 - dq_comparison - INFO - 
1. Row 0 - Duplicate Count Mismatch
2026-01-28 16:05:10,781 - dq_comparison - INFO -    Column: 
2026-01-28 16:05:10,781 - dq_comparison - INFO -    Duplicate count mismatch (normalized). Source=203, Target=250
2026-01-28 16:05:10,782 - dq_comparison - INFO - 
2. Row 0 - Metadata Row Count
2026-01-28 16:05:10,782 - dq_comparison - INFO -    Column: 
2026-01-28 16:05:10,782 - dq_comparison - INFO -    Metadata mismatch: Row Count
2026-01-28 16:05:10,783 - dq_comparison - INFO - 
3. Row 0 - Metadata Memory Usage
2026-01-28 16:05:10,783 - dq_comparison - INFO -    Column: 
2026-01-28 16:05:10,783 - dq_comparison - INFO -    Metadata mismatch: Memory Usage
2026-01-28 16:05:10,784 - dq_comparison - INFO - 
💡 For complete error details, run:
2026-01-28 16:05:10,784 - dq_comparison - INFO -    USE dq_checks;
2026-01-28 16:05:10,784 - dq_comparison - INFO -    SELECT excel_row, column_name, error_type, error_description,
2026-01-28 16:05:10,784 - dq_comparison - INFO -           actual_value, expected_value
2026-01-28 16:05:10,784 - dq_comparison - INFO -    FROM dq_error_logs
2026-01-28 16:05:10,785 - dq_comparison - INFO -    WHERE session_id = 'CMP_20260128_160317'
2026-01-28 16:05:10,785 - dq_comparison - INFO -    ORDER BY excel_row, column_name;
2026-01-28 16:05:10,796 - dq_comparison - INFO - 
✅ Comparison completed! Session ID: CMP_20260128_160317
2026-01-28 16:05:10,927 - dq_error_log - INFO - Retrieved 100 error logs for session CMP_20260128_160317
2026-01-28 16:05:10,976 - dq_error_log - INFO - Retrieved summary: 5005 total errors for session CMP_20260128_160317
2026-01-28 16:05:10,977 - dq_audit - INFO - Audit class initialized with database: dq_checks
2026-01-28 16:05:10,993 - dq_audit - INFO - Retrieved 1 audit logs for session CMP_20260128_160317
2026-01-28 16:05:10,994 - dq_comparison - INFO - 
🔍 Final results verification:
2026-01-28 16:05:10,994 - dq_comparison - INFO -    Session ID: CMP_20260128_160317
2026-01-28 16:05:10,996 - dq_comparison - INFO -    DQ Score (Simple %): 100.00%
2026-01-28 16:05:10,996 - dq_comparison - INFO -    Source rows: 89999
2026-01-28 16:05:10,996 - dq_comparison - INFO -    Matched rows: 89996
2026-01-28 16:05:10,996 - dq_comparison - INFO -    Calculation: (89996 / 89999) * 100
2026-01-28 16:05:11,043 - __main__ - INFO - Source-Target Comparison completed successfully
2026-01-28 16:05:11,043 - __main__ - INFO - Displaying main menu options to user
2026-01-28 16:05:13,455 - __main__ - INFO - User selected option: 6
2026-01-28 16:05:13,457 - __main__ - INFO - User session ended. Duration: 0:06:36.321847
2026-01-28 16:05:13,458 - __main__ - INFO - 👋 Thank you for using Universal Data Quality Framework!
