2026-01-17 22:59:07,740 - root - INFO - CLI Mode Logging Initialized
2026-01-17 22:59:07,741 - root - INFO - CLI logs will be saved to: logs/dq_framework_20260117_225907.log
2026-01-17 22:59:07,742 - __main__ - INFO - 🚀 UNIVERSAL DATA QUALITY FRAMEWORK INITIALIZED
2026-01-17 22:59:07,743 - __main__ - INFO - Starting system resource check
2026-01-17 22:59:07,751 - __main__ - INFO - Total RAM: 15.7 GB
2026-01-17 22:59:07,752 - __main__ - INFO - Available RAM: 2.7 GB
2026-01-17 22:59:07,752 - __main__ - INFO - Memory used: 82.8%
2026-01-17 22:59:07,752 - __main__ - INFO - Memory status: OK
2026-01-17 22:59:07,753 - __main__ - INFO - Free disk space: 255.5 GB
2026-01-17 22:59:07,753 - __main__ - INFO - Disk used: 46.4%
2026-01-17 22:59:07,753 - __main__ - INFO - Disk space: OK
2026-01-17 22:59:08,255 - __main__ - INFO - CPU cores: 8
2026-01-17 22:59:08,256 - __main__ - INFO - CPU usage: 81.6%
2026-01-17 22:59:08,257 - __main__ - INFO - Python version: 3.12.4
2026-01-17 22:59:08,257 - __main__ - INFO - System platform: win32
2026-01-17 22:59:08,257 - __main__ - INFO - User session started at: 2026-01-17 22:59:08.257816
2026-01-17 22:59:08,257 - __main__ - INFO - Displaying main menu options to user
2026-01-17 22:59:09,214 - __main__ - INFO - User selected option: 2
2026-01-17 22:59:09,220 - __main__ - INFO - Starting Source-Target Comparison module
2026-01-17 22:59:09,260 - dq_comparison - INFO - STARTING UNIVERSAL SOURCE-TARGET COMPARISON TOOL
2026-01-17 22:59:09,272 - dq_comparison - INFO - LOADING SOURCE AND TARGET DATA
2026-01-17 22:59:09,278 - dq_comparison - INFO - 
==================================================
2026-01-17 22:59:09,280 - dq_comparison - INFO - 🔗 SOURCE DATA CONFIGURATION
2026-01-17 22:59:09,282 - dq_comparison - INFO - ==================================================
2026-01-17 22:59:10,491 - dq_comparison - INFO - 
🗄️ SOURCE DATABASE CONFIGURATION
2026-01-17 22:59:10,493 - dq_comparison - INFO - ----------------------------------------
2026-01-17 22:59:12,043 - dq_comparison - INFO - Selected database type code: mysql
2026-01-17 22:59:13,112 - dq_comparison - INFO - User selected Browse and Select mode for SOURCE
2026-01-17 22:59:13,125 - database_navigator - INFO - DatabaseNavigator initialized
2026-01-17 22:59:13,126 - database_navigator - INFO - Starting database navigation...
2026-01-17 22:59:13,126 - database_navigator - INFO - Database type: mysql
2026-01-17 22:59:13,127 - database_navigator - INFO - Getting database configuration...
2026-01-17 22:59:15,946 - database_navigator - INFO - Connecting to MYSQL...
2026-01-17 22:59:16,354 - database_navigator - INFO - Successfully connected to MYSQL!
2026-01-17 22:59:16,362 - database_navigator - INFO - get_databases() called. db_type: mysql, connection exists: True
2026-01-17 22:59:16,368 - database_navigator - INFO - Found 13 databases
2026-01-17 22:59:18,133 - database_navigator - INFO - Selected database: dq_checks
2026-01-17 22:59:18,138 - database_navigator - INFO - Found 1 schemas
2026-01-17 22:59:19,406 - database_navigator - INFO - Selected schema: dq_checks
2026-01-17 22:59:19,417 - database_navigator - INFO - Found 18 tables in schema 'dq_checks'
2026-01-17 22:59:22,125 - database_navigator - INFO - Selected table: comparison_small_source15
2026-01-17 22:59:22,133 - database_navigator - INFO - Selection complete: {'type': 'mysql', 'database': 'dq_checks', 'schema': 'dq_checks', 'table': 'comparison_small_source15', 'selection_mode': 'hierarchical', 'host': 'localhost', 'port': '3306', 'user': 'root', 'password': 'root'}
2026-01-17 22:59:22,136 - dq_comparison - INFO - Selected via navigation for SOURCE: dq_checks.dq_checks.comparison_small_source15
2026-01-17 22:59:22,136 - dq_unified - INFO - Loading data from DATABASE
2026-01-17 22:59:22,136 - dq_unified - INFO - Loading large database table: comparison_small_source15
2026-01-17 22:59:22,137 - dq_unified - INFO - Normalized DB config with schema: dq_checks
2026-01-17 22:59:22,157 - dq_unified - INFO - MySQL table comparison_small_source15 has 15 rows
2026-01-17 22:59:22,158 - dq_unified - INFO - Loading 15 rows from MySQL...
2026-01-17 22:59:23,459 - dq_unified - INFO - Loaded 15 rows from MySQL
2026-01-17 22:59:23,475 - dq_unified - INFO - Memory optimization: 0.0MB -> 0.0MB (Saved: 0.0MB)
2026-01-17 22:59:23,476 - dq_unified - INFO - Loaded 15 rows, 16 columns. Memory: 111.7MB total, 0.0MB for dataframe
2026-01-17 22:59:23,477 - dq_comparison - INFO - SOURCE database loaded: 15 rows, 16 columns
2026-01-17 22:59:23,477 - dq_comparison - INFO - 
==================================================
2026-01-17 22:59:23,480 - dq_comparison - INFO - 🔗 TARGET DATA CONFIGURATION
2026-01-17 22:59:23,480 - dq_comparison - INFO - ==================================================
2026-01-17 22:59:24,588 - dq_comparison - INFO - 
🗄️ TARGET DATABASE CONFIGURATION
2026-01-17 22:59:24,589 - dq_comparison - INFO - ----------------------------------------
2026-01-17 22:59:28,097 - dq_comparison - INFO - Selected database type code: postgresql
2026-01-17 22:59:29,222 - dq_comparison - INFO - User selected Browse and Select mode for TARGET
2026-01-17 22:59:29,233 - dq_comparison - INFO - Converted 'postgresql' to 'postgres' for database_navigator compatibility
2026-01-17 22:59:29,234 - database_navigator - INFO - DatabaseNavigator initialized
2026-01-17 22:59:29,235 - database_navigator - INFO - Starting database navigation...
2026-01-17 22:59:29,236 - database_navigator - INFO - Database type: postgres
2026-01-17 22:59:29,236 - database_navigator - INFO - Getting database configuration...
2026-01-17 22:59:31,719 - database_navigator - INFO - Connecting to POSTGRES...
2026-01-17 22:59:31,720 - database_navigator - INFO - Connecting to PostgreSQL...
2026-01-17 22:59:31,724 - database_navigator - INFO - Connecting to PostgreSQL: host=localhost, port=5432, database=postgres, user=postgres
2026-01-17 22:59:31,913 - database_navigator - INFO - Connection object created: <connection object at 0x00000201C8762BD0; dsn: 'user=postgres password=xxx dbname=postgres host=localhost port=5432', closed: 0>
2026-01-17 22:59:31,914 - database_navigator - INFO - ✅ PostgreSQL connection successful to database: postgres
2026-01-17 22:59:31,922 - database_navigator - INFO - get_databases() called. db_type: postgres, connection exists: True
2026-01-17 22:59:31,954 - database_navigator - INFO - Raw rows: [('dq_checks',), ('finewise-testdb',), ('postgres',)]
2026-01-17 22:59:31,954 - database_navigator - INFO - Found 3 databases
2026-01-17 22:59:33,189 - database_navigator - INFO - Selected database: dq_checks
2026-01-17 22:59:33,191 - database_navigator - INFO - Reconnecting to PostgreSQL database: dq_checks
2026-01-17 22:59:33,193 - database_navigator - INFO - Connecting to POSTGRES...
2026-01-17 22:59:33,193 - database_navigator - INFO - Connecting to PostgreSQL...
2026-01-17 22:59:33,194 - database_navigator - INFO - Connecting to PostgreSQL: host=localhost, port=5432, database=dq_checks, user=postgres
2026-01-17 22:59:33,372 - database_navigator - INFO - Connection object created: <connection object at 0x00000201C89D4040; dsn: 'user=postgres password=xxx dbname=dq_checks host=localhost port=5432', closed: 0>
2026-01-17 22:59:33,373 - database_navigator - INFO - ✅ PostgreSQL connection successful to database: dq_checks
2026-01-17 22:59:33,434 - database_navigator - INFO - Found 4 schemas
2026-01-17 22:59:38,944 - database_navigator - INFO - Selected schema: public
2026-01-17 22:59:38,948 - database_navigator - INFO - Ensuring connection to database: dq_checks for table list
2026-01-17 22:59:38,948 - database_navigator - INFO - Reconnecting to PostgreSQL database: dq_checks
2026-01-17 22:59:38,950 - database_navigator - INFO - Connecting to POSTGRES...
2026-01-17 22:59:38,951 - database_navigator - INFO - Connecting to PostgreSQL...
2026-01-17 22:59:38,952 - database_navigator - INFO - Connecting to PostgreSQL: host=localhost, port=5432, database=dq_checks, user=postgres
2026-01-17 22:59:39,132 - database_navigator - INFO - Connection object created: <connection object at 0x00000201C89D4150; dsn: 'user=postgres password=xxx dbname=dq_checks host=localhost port=5432', closed: 0>
2026-01-17 22:59:39,133 - database_navigator - INFO - ✅ PostgreSQL connection successful to database: dq_checks
2026-01-17 22:59:39,135 - database_navigator - INFO - Connected to database: dq_checks, schema: public
2026-01-17 22:59:39,228 - database_navigator - INFO - Found 5 tables in dq_checks.public: ['comparison_small_target13', 'customers', 'customers_bkp', 'employee', 'stg_transactions']
2026-01-17 22:59:39,229 - database_navigator - INFO - Found 5 tables in schema 'public'
2026-01-17 22:59:51,653 - database_navigator - INFO - Selected table: comparison_small_target13
2026-01-17 22:59:51,664 - database_navigator - INFO - Selection complete: {'type': 'postgresql', 'database': 'dq_checks', 'schema': 'public', 'table': 'comparison_small_target13', 'selection_mode': 'hierarchical', 'host': 'localhost', 'port': '5432', 'user': 'postgres', 'password': 'postgres'}
2026-01-17 22:59:51,665 - dq_comparison - INFO - Selected via navigation for TARGET: dq_checks.public.comparison_small_target13
2026-01-17 22:59:51,667 - dq_unified - INFO - Loading data from DATABASE
2026-01-17 22:59:51,670 - dq_unified - INFO - Loading large database table: comparison_small_target13
2026-01-17 22:59:51,670 - dq_unified - INFO - Normalized DB config with schema: public
2026-01-17 22:59:51,876 - dq_unified - INFO - PostgreSQL table public.comparison_small_target13 has 13 rows
2026-01-17 22:59:51,876 - dq_unified - INFO - Loading 13 rows from PostgreSQL...
2026-01-17 22:59:51,884 - dq_unified - INFO - Loaded 13 rows from PostgreSQL
2026-01-17 22:59:51,892 - dq_unified - INFO - Memory optimization: 0.0MB -> 0.0MB (Saved: 0.0MB)
2026-01-17 22:59:51,893 - dq_unified - INFO - Loaded 13 rows, 16 columns. Memory: 112.3MB total, 0.0MB for dataframe
2026-01-17 22:59:51,894 - dq_comparison - INFO - TARGET database loaded: 13 rows, 16 columns
2026-01-17 22:59:51,894 - dq_comparison - INFO - SELECTING COLUMNS FOR COMPARISON
2026-01-17 22:59:51,896 - dq_comparison - INFO - Source columns (original): ['transaction_id', 'account_id', 'customer_id', 'transaction_date', 'posting_date', 'transaction_type', 'currency', 'amount', 'balance_after', 'status', 'merchant_name', 'merchant_category', 'country', 'reference_code', 'created_at', 'updated_at']
2026-01-17 22:59:51,897 - dq_comparison - INFO - Target columns (original): ['transaction_id', 'account_id', 'customer_id', 'transaction_date', 'posting_date', 'transaction_type', 'currency', 'amount', 'balance_after', 'status', 'merchant_name', 'merchant_category', 'country', 'reference_code', 'created_at', 'updated_at']
2026-01-17 22:59:51,900 - dq_comparison - INFO - Common columns lowercased: ['transaction_id', 'account_id', 'customer_id', 'transaction_date', 'posting_date', 'transaction_type', 'currency', 'amount', 'balance_after', 'status', 'merchant_name', 'merchant_category', 'country', 'reference_code', 'created_at', 'updated_at']
2026-01-17 22:59:51,904 - dq_comparison - INFO - Found 16 common columns between source and target (case-insensitive)
2026-01-17 22:59:51,904 - dq_comparison - INFO - 
📋 Common columns available for comparison:
2026-01-17 22:59:51,905 - dq_comparison - INFO -   1. transaction_id (Source) ↔ transaction_id (Target)
2026-01-17 22:59:51,906 - dq_comparison - INFO -   2. account_id (Source) ↔ account_id (Target)
2026-01-17 22:59:51,906 - dq_comparison - INFO -   3. customer_id (Source) ↔ customer_id (Target)
2026-01-17 22:59:51,907 - dq_comparison - INFO -   4. transaction_date (Source) ↔ transaction_date (Target)
2026-01-17 22:59:51,907 - dq_comparison - INFO -   5. posting_date (Source) ↔ posting_date (Target)
2026-01-17 22:59:51,908 - dq_comparison - INFO -   6. transaction_type (Source) ↔ transaction_type (Target)
2026-01-17 22:59:51,909 - dq_comparison - INFO -   7. currency (Source) ↔ currency (Target)
2026-01-17 22:59:51,910 - dq_comparison - INFO -   8. amount (Source) ↔ amount (Target)
2026-01-17 22:59:51,910 - dq_comparison - INFO -   9. balance_after (Source) ↔ balance_after (Target)
2026-01-17 22:59:51,910 - dq_comparison - INFO -   10. status (Source) ↔ status (Target)
2026-01-17 22:59:51,913 - dq_comparison - INFO -   11. merchant_name (Source) ↔ merchant_name (Target)
2026-01-17 22:59:51,915 - dq_comparison - INFO -   12. merchant_category (Source) ↔ merchant_category (Target)
2026-01-17 22:59:51,917 - dq_comparison - INFO -   13. country (Source) ↔ country (Target)
2026-01-17 22:59:51,918 - dq_comparison - INFO -   14. reference_code (Source) ↔ reference_code (Target)
2026-01-17 22:59:51,918 - dq_comparison - INFO -   15. created_at (Source) ↔ created_at (Target)
2026-01-17 22:59:51,919 - dq_comparison - INFO -   16. updated_at (Source) ↔ updated_at (Target)
2026-01-17 22:59:53,501 - dq_comparison - INFO - User column selection input: all
2026-01-17 22:59:53,503 - dq_comparison - INFO - User selected ALL common columns for comparison
2026-01-17 22:59:53,506 - dq_comparison - INFO - GENERATING COMPREHENSIVE COMPARISON REPORT
2026-01-17 22:59:53,507 - dq_comparison - INFO - Report details - Source: Database: mysql - dq_checks.comparison_small_source15, Target: Database: postgresql - dq_checks.comparison_small_target13, Selected columns: 16
2026-01-17 22:59:53,507 - dq_comparison - INFO - Initializing Error Logger...
2026-01-17 22:59:53,508 - dq_error_log - INFO - ErrorLogger initialized with database: dq_checks
2026-01-17 22:59:53,532 - dq_error_log - INFO - Database connection successful
2026-01-17 22:59:53,533 - dq_comparison - INFO - Session ID: CMP_20260117_225953
2026-01-17 22:59:53,534 - dq_comparison - INFO - 
======================================================================
2026-01-17 22:59:53,537 - dq_comparison - INFO - 🔄 RUNNING SOURCE-TARGET COMPARISON WITH PERFECT NORMALIZATION
2026-01-17 22:59:53,537 - dq_comparison - INFO - ======================================================================
2026-01-17 22:59:53,538 - dq_comparison - INFO - Session ID: CMP_20260117_225953
2026-01-17 22:59:53,539 - dq_comparison - INFO - Source: Database: mysql - dq_checks.comparison_small_source15
2026-01-17 22:59:53,539 - dq_comparison - INFO - Target: Database: postgresql - dq_checks.comparison_small_target13
2026-01-17 22:59:53,540 - dq_comparison - INFO - Selected columns: 16
2026-01-17 22:59:53,540 - dq_comparison - INFO - ======================================================================
2026-01-17 22:59:53,541 - dq_comparison - INFO - 
1️⃣ FIRST: ROW COUNT CHECK
2026-01-17 22:59:53,542 - dq_comparison - WARNING - ❌ Row count mismatch: Source=15, Target=13, Difference=2
2026-01-17 22:59:53,542 - dq_comparison - WARNING -    Missing in target: 2 rows
2026-01-17 22:59:53,545 - dq_comparison - INFO - 
2️⃣ COLUMN STRUCTURE COMPARISON
2026-01-17 22:59:53,547 - dq_comparison - INFO - Comparing column structures...
2026-01-17 22:59:53,549 - dq_comparison - INFO - Column structure comparison complete. Match: True
2026-01-17 22:59:53,550 - dq_comparison - INFO - 
3️⃣ PRIMARY KEY VALIDATION
2026-01-17 22:59:53,551 - dq_comparison - INFO - Validating primary key/unique fields...
2026-01-17 22:59:53,551 - dq_comparison - INFO - Checking key fields: ['transaction_id', 'customer_id', 'reference_code']
2026-01-17 22:59:53,555 - dq_comparison - WARNING - Field 'customer_id' has duplicates in source: 15 rows
2026-01-17 22:59:53,555 - dq_comparison - WARNING - Field 'customer_id' has duplicates in target: 13 rows
2026-01-17 22:59:53,557 - dq_comparison - INFO - Primary key validation complete. Passed: False
2026-01-17 22:59:53,601 - dq_comparison - INFO -    Key fields found: ['transaction_id', 'customer_id', 'reference_code']
2026-01-17 22:59:53,602 - dq_comparison - INFO -    Unique in source: ❌
2026-01-17 22:59:53,603 - dq_comparison - INFO -    Unique in target: ❌
2026-01-17 22:59:53,607 - dq_comparison - INFO -    Validation passed: ❌
2026-01-17 22:59:53,607 - dq_comparison - WARNING -    Source duplicates in 'customer_id': 15 rows
2026-01-17 22:59:53,608 - dq_comparison - WARNING -      Sample values: ['CUST9001']
2026-01-17 22:59:53,609 - dq_comparison - WARNING -    Target duplicates in 'customer_id': 13 rows
2026-01-17 22:59:53,610 - dq_comparison - WARNING -      Sample values: ['CUST9001']
2026-01-17 22:59:53,611 - dq_comparison - INFO -    Column names match: ✅
2026-01-17 22:59:53,612 - dq_comparison - INFO -    Column order match: ✅
2026-01-17 22:59:53,613 - dq_comparison - INFO -    Data types match: ✅
2026-01-17 22:59:53,614 - dq_comparison - INFO - 
4️⃣ TABLE METADATA COMPARISON
2026-01-17 22:59:53,614 - dq_comparison - INFO - Comparing table-level metadata...
2026-01-17 22:59:53,632 - dq_comparison - INFO - Table metadata comparison complete. Match: False
2026-01-17 22:59:53,657 - dq_comparison - INFO -    Table metadata match: ❌
2026-01-17 22:59:53,657 - dq_comparison - INFO -    Source: 15 rows, 16 cols, 0.01 MB
2026-01-17 22:59:53,659 - dq_comparison - INFO -    Target: 13 rows, 16 cols, 0.0 MB
2026-01-17 22:59:53,664 - dq_comparison - WARNING -    Found 1 metadata differences:
2026-01-17 22:59:53,664 - dq_comparison - WARNING -      • Row Count: Source=15, Target=13
2026-01-17 22:59:53,665 - dq_comparison - INFO - 
5️⃣ HASH-BASED COMPARISON
2026-01-17 22:59:53,666 - dq_comparison - INFO - ℹ️  Note: All NULL values normalized to 'NULL'
2026-01-17 22:59:53,667 - dq_comparison - INFO - ℹ️  Note: Dates normalized to YYYY-MM-DD
2026-01-17 22:59:53,667 - dq_comparison - INFO - ℹ️  Note: Strings trimmed and case-normalized
2026-01-17 22:59:53,670 - dq_comparison - INFO - ℹ️  Note: Phone numbers stripped to digits only, leading zeros removed
2026-01-17 22:59:53,673 - dq_comparison - INFO - 🔄 GENERIC POSITION-BASED COMPARISON
2026-01-17 22:59:53,686 - dq_comparison - INFO - 
========================================================================================================================
COMPARISON: Mysql Database vs Postgresql Database
========================================================================================================================
Row   | Diff Count | Source (Sample)                          | Target (Sample)                         
------------------------------------------------------------------------------------------------------------------------
2     | 6          | transaction_id: 0b0ccaa7-6fde-4868-a20... | transaction_id: 3ec6eecf-ef59-4447-992...
3     | 7          | transaction_id: 21de9b66-d966-4f89-8a7... | transaction_id: 33063be6-7ea8-432f-869...
4     | 8          | transaction_id: 33063be6-7ea8-432f-869... | transaction_id: 6a90c3b3-b134-4177-81b...
5     | 8          | transaction_id: 33a06ed2-58b4-43c5-802... | transaction_id: 56c444ae-d9e6-440a-b90...
6     | 8          | transaction_id: 3ec6eecf-ef59-4447-992... | transaction_id: 21de9b66-d966-4f89-8a7...
8     | 7          | transaction_id: 56c444ae-d9e6-440a-b90... | transaction_id: f147eeca-a10f-4a5b-a3c...
9     | 9          | transaction_id: 5d534d24-509c-4af6-abd... | transaction_id: fe7e09b8-92d0-43a8-85b...
10    | 8          | transaction_id: 6a90c3b3-b134-4177-81b... | transaction_id: 5d534d24-509c-4af6-abd...
11    | 7          | transaction_id: 7d73c994-c959-40a8-b29... | transaction_id: 33a06ed2-58b4-43c5-802...
12    | 7          | transaction_id: 97fac06b-322b-4fe0-94d... | transaction_id: 7d73c994-c959-40a8-b29...
------------------------------------------------------------------------------------------------------------------------
Showing first 10 of 14 mismatched rows.
Summary: 12 row mismatches, 2 source-only rows, 0 target-only rows
========================================================================================================================
2026-01-17 22:59:53,687 - dq_comparison - INFO - 
📊 POSITION-BASED COMPARISON SUMMARY:
2026-01-17 22:59:53,688 - dq_comparison - INFO -    Total rows compared: 13
2026-01-17 22:59:53,692 - dq_comparison - INFO -    Common rows (position matches): 13
2026-01-17 22:59:53,692 - dq_comparison - INFO -    Source-only rows: 2
2026-01-17 22:59:53,693 - dq_comparison - INFO -    Target-only rows: 0
2026-01-17 22:59:53,693 - dq_comparison - INFO -    Row mismatches: 12
2026-01-17 22:59:53,694 - dq_comparison - INFO -    Match percentage: 55.29%
2026-01-17 22:59:53,695 - dq_comparison - INFO - New structure: 0 detailed mismatches
2026-01-17 22:59:53,697 - dq_comparison - INFO - 
6️⃣ DATA QUALITY ANALYSIS
2026-01-17 22:59:53,697 - dq_comparison - INFO - Analyzing data quality metrics...
2026-01-17 22:59:53,716 - dq_comparison - INFO - Null values - Source: 0 (0.00%), Target: 0 (0.00%)
2026-01-17 22:59:53,720 - dq_comparison - INFO - Duplicate rows (normalized) - Source: 0, Target: 0
2026-01-17 22:59:53,737 - dq_error_log - INFO - Retrieved 3 error logs for session CMP_20260117_225953
2026-01-17 22:59:53,737 - dq_comparison - INFO - 
📊 SIMPLE SCORING CALCULATION:
2026-01-17 22:59:53,738 - dq_comparison - INFO -   Source rows: 15
2026-01-17 22:59:53,742 - dq_comparison - INFO -   Common rows (matched): 13
2026-01-17 22:59:53,742 - dq_comparison - INFO -   Calculation: (13 / 15) * 100 = 86.67%
2026-01-17 22:59:53,744 - dq_comparison - INFO -   Explanation: 13 matched rows out of 15 total source rows
2026-01-17 22:59:53,744 - dq_comparison - INFO - 
=== AUDIT LOGGING SECTION ===
2026-01-17 22:59:53,751 - dq_comparison - INFO - 🔍 Audit logging is ENABLED in APP_SETTINGS
2026-01-17 22:59:53,751 - dq_audit - INFO - Audit class initialized with database: dq_checks
2026-01-17 22:59:53,752 - dq_comparison - INFO - Attempting to log audit record for session: CMP_20260117_225953
2026-01-17 22:59:53,753 - dq_audit - INFO - Starting database insertion for comparison...
2026-01-17 22:59:53,778 - dq_audit - INFO - Inserted comparison record with ID: 771
2026-01-17 22:59:53,780 - dq_comparison - INFO - ✅ Audit record logged successfully (ID: 771)
2026-01-17 22:59:53,781 - dq_comparison - INFO - 
======================================================================
2026-01-17 22:59:53,781 - dq_comparison - INFO - 📊 COMPARISON RESULTS SUMMARY
2026-01-17 22:59:53,785 - dq_comparison - INFO - ======================================================================
2026-01-17 22:59:53,786 - dq_comparison - INFO - Session ID: CMP_20260117_225953
2026-01-17 22:59:53,786 - dq_comparison - INFO - Source: Database: mysql - dq_checks.comparison_small_source15 (15 rows)
2026-01-17 22:59:53,788 - dq_comparison - INFO - Target: Database: postgresql - dq_checks.comparison_small_target13 (13 rows)
2026-01-17 22:59:53,789 - dq_comparison - INFO - Selected columns: 16
2026-01-17 22:59:53,790 - dq_comparison - INFO - ----------------------------------------------------------------------
2026-01-17 22:59:53,790 - dq_comparison - INFO - 1️⃣ Row count match: ❌ No
2026-01-17 22:59:53,791 - dq_comparison - INFO -    Missing in target: 2 rows
2026-01-17 22:59:53,792 - dq_comparison - INFO -    Extra in target: 0 rows
2026-01-17 22:59:53,793 - dq_comparison - INFO - 2️⃣ Column structure match: ✅ Yes
2026-01-17 22:59:53,798 - dq_comparison - INFO - 3️ Primary key validation: ❌ Failed
2026-01-17 22:59:53,799 - dq_comparison - INFO -    Key fields: ['transaction_id', 'customer_id', 'reference_code']
2026-01-17 22:59:53,800 - dq_comparison - INFO - 4️ Table metadata: ❌ Mismatch
2026-01-17 22:59:53,801 - dq_comparison - INFO -    • Row Count: 15 vs 13
2026-01-17 22:59:53,801 - dq_comparison - INFO - 5️⃣ Common rows (both Mysql Database and Postgresql Database): 13 (86.67% of Mysql Database)
2026-01-17 22:59:53,802 - dq_comparison - INFO - 6️⃣ Mysql Database-only rows: 2 (present ONLY in Mysql Database, NOT in Postgresql Database)
2026-01-17 22:59:53,803 - dq_comparison - INFO - 7️⃣ Postgresql Database-only rows: 0 (present ONLY in Postgresql Database, NOT in Mysql Database)
2026-01-17 22:59:53,804 - dq_comparison - INFO - 8️⃣ Column value mismatches: 0
2026-01-17 22:59:53,804 - dq_comparison - INFO - 9️ Data quality match: ✅ Yes
2026-01-17 22:59:53,805 - dq_comparison - INFO - 📈 DQ Score: 86.67%
2026-01-17 22:59:53,806 - dq_comparison - INFO - 📊 Calculation: (13 / 15) * 100 = 86.67%
2026-01-17 22:59:53,807 - dq_comparison - INFO - ======================================================================
2026-01-17 22:59:53,807 - dq_comparison - INFO - 
⚠️  GOOD MATCH! Some differences found.
2026-01-17 22:59:53,808 - dq_comparison - INFO - 
🔍 NORMALIZATION APPLIED:
2026-01-17 22:59:53,809 - dq_comparison - INFO -    • NULL values → 'NULL' (consistent representation)
2026-01-17 22:59:53,814 - dq_comparison - INFO -    • Dates → YYYY-MM-DD format
2026-01-17 22:59:53,815 - dq_comparison - INFO -    • Strings → trimmed + lowercase
2026-01-17 22:59:53,815 - dq_comparison - INFO -    • Numeric values → standardized format
2026-01-17 22:59:53,816 - dq_comparison - INFO -    • Phone numbers → digits only, ALL leading zeros removed
2026-01-17 22:59:53,816 - dq_comparison - INFO -    • Extra whitespace removed
2026-01-17 22:59:53,816 - dq_comparison - INFO - 
🔍 DETAILED ERROR ANALYSIS:
2026-01-17 22:59:53,817 - dq_comparison - INFO - --------------------------------------------------
2026-01-17 22:59:53,817 - dq_comparison - INFO - 📊 SOURCE-ONLY ROWS: 2 rows
2026-01-17 22:59:53,818 - dq_comparison - INFO -    Present only in Mysql Database, missing from Postgresql Database
2026-01-17 22:59:53,837 - dq_error_log - INFO - Retrieved 3 errors for session CMP_20260117_225953
2026-01-17 22:59:53,837 - dq_comparison - INFO - 
📋 SAMPLE ERRORS (3 found):
2026-01-17 22:59:53,838 - dq_comparison - INFO - 
1. Row 0 - Metadata Row Count
2026-01-17 22:59:53,839 - dq_comparison - INFO -    Column: 
2026-01-17 22:59:53,839 - dq_comparison - INFO -    Metadata mismatch: Row Count
2026-01-17 22:59:53,840 - dq_comparison - INFO - 
2. Row 0 - Duplicate Primary Key
2026-01-17 22:59:53,841 - dq_comparison - INFO -    Column: customer_id
2026-01-17 22:59:53,845 - dq_comparison - INFO -    Primary key field 'customer_id' has 15 duplicates in source
2026-01-17 22:59:53,846 - dq_comparison - INFO - 
3. Row 0 - Duplicate Primary Key
2026-01-17 22:59:53,847 - dq_comparison - INFO -    Column: customer_id
2026-01-17 22:59:53,847 - dq_comparison - INFO -    Primary key field 'customer_id' has 13 duplicates in target
2026-01-17 22:59:53,848 - dq_comparison - INFO - 
💡 For complete error details, run:
2026-01-17 22:59:53,849 - dq_comparison - INFO -    USE dq_checks;
2026-01-17 22:59:53,850 - dq_comparison - INFO -    SELECT excel_row, column_name, error_type, error_description,
2026-01-17 22:59:53,851 - dq_comparison - INFO -           actual_value, expected_value
2026-01-17 22:59:53,852 - dq_comparison - INFO -    FROM dq_error_logs
2026-01-17 22:59:53,852 - dq_comparison - INFO -    WHERE session_id = 'CMP_20260117_225953'
2026-01-17 22:59:53,853 - dq_comparison - INFO -    ORDER BY excel_row, column_name;
2026-01-17 22:59:53,874 - dq_comparison - INFO - 
✅ Comparison completed! Session ID: CMP_20260117_225953
2026-01-17 22:59:53,894 - dq_error_log - INFO - Retrieved 4 error logs for session CMP_20260117_225953
2026-01-17 22:59:53,913 - dq_error_log - INFO - Retrieved summary: 4 total errors for session CMP_20260117_225953
2026-01-17 22:59:53,914 - dq_audit - INFO - Audit class initialized with database: dq_checks
2026-01-17 22:59:53,939 - dq_audit - INFO - Retrieved 1 audit logs for session CMP_20260117_225953
2026-01-17 22:59:53,939 - dq_comparison - INFO - 
🔍 Final results verification:
2026-01-17 22:59:53,942 - dq_comparison - INFO -    Session ID: CMP_20260117_225953
2026-01-17 22:59:53,945 - dq_comparison - INFO -    DQ Score (Simple %): 86.67%
2026-01-17 22:59:53,946 - dq_comparison - INFO -    Source rows: 15
2026-01-17 22:59:53,946 - dq_comparison - INFO -    Matched rows: 13
2026-01-17 22:59:53,947 - dq_comparison - INFO -    Calculation: (13 / 15) * 100
2026-01-17 22:59:53,949 - __main__ - INFO - Source-Target Comparison completed successfully
2026-01-17 22:59:53,951 - __main__ - INFO - Displaying main menu options to user
2026-01-17 23:00:40,766 - __main__ - INFO - User selected option: 6
2026-01-17 23:00:40,767 - __main__ - INFO - User session ended. Duration: 0:01:32.510008
2026-01-17 23:00:40,767 - __main__ - INFO - 👋 Thank you for using Universal Data Quality Framework!
