2026-01-17 17:50:04,772 - root - INFO - CLI Mode Logging Initialized
2026-01-17 17:50:04,773 - root - INFO - CLI logs will be saved to: logs/dq_framework_20260117_175004.log
2026-01-17 17:50:04,773 - __main__ - INFO - 🚀 UNIVERSAL DATA QUALITY FRAMEWORK INITIALIZED
2026-01-17 17:50:04,775 - __main__ - INFO - Starting system resource check
2026-01-17 17:50:04,782 - __main__ - INFO - Total RAM: 15.7 GB
2026-01-17 17:50:04,783 - __main__ - INFO - Available RAM: 2.8 GB
2026-01-17 17:50:04,784 - __main__ - INFO - Memory used: 82.4%
2026-01-17 17:50:04,784 - __main__ - INFO - Memory status: OK
2026-01-17 17:50:04,785 - __main__ - INFO - Free disk space: 254.8 GB
2026-01-17 17:50:04,785 - __main__ - INFO - Disk used: 46.5%
2026-01-17 17:50:04,786 - __main__ - INFO - Disk space: OK
2026-01-17 17:50:05,288 - __main__ - INFO - CPU cores: 8
2026-01-17 17:50:05,289 - __main__ - INFO - CPU usage: 30.1%
2026-01-17 17:50:05,289 - __main__ - INFO - Python version: 3.12.4
2026-01-17 17:50:05,289 - __main__ - INFO - System platform: win32
2026-01-17 17:50:05,289 - __main__ - INFO - User session started at: 2026-01-17 17:50:05.289053
2026-01-17 17:50:05,289 - __main__ - INFO - Displaying main menu options to user
2026-01-17 17:50:08,627 - __main__ - INFO - User selected option: 2
2026-01-17 17:50:08,629 - __main__ - INFO - Starting Source-Target Comparison module
2026-01-17 17:50:08,631 - dq_comparison - INFO - STARTING UNIVERSAL SOURCE-TARGET COMPARISON TOOL
2026-01-17 17:50:08,631 - dq_comparison - INFO - LOADING SOURCE AND TARGET DATA
2026-01-17 17:50:08,631 - dq_comparison - INFO - 
==================================================
2026-01-17 17:50:08,631 - dq_comparison - INFO - 🔗 SOURCE DATA CONFIGURATION
2026-01-17 17:50:08,632 - dq_comparison - INFO - ==================================================
2026-01-17 17:50:10,913 - dq_comparison - INFO - 
🗄️ SOURCE DATABASE CONFIGURATION
2026-01-17 17:50:10,915 - dq_comparison - INFO - ----------------------------------------
2026-01-17 17:50:13,294 - dq_comparison - INFO - Selected database type code: mysql
2026-01-17 17:50:14,684 - dq_comparison - INFO - User selected Browse and Select mode for SOURCE
2026-01-17 17:50:14,693 - database_navigator - INFO - DatabaseNavigator initialized
2026-01-17 17:50:14,693 - database_navigator - INFO - Starting database navigation...
2026-01-17 17:50:14,693 - database_navigator - INFO - Database type: mysql
2026-01-17 17:50:14,694 - database_navigator - INFO - Getting database configuration...
2026-01-17 17:50:16,872 - database_navigator - INFO - Connecting to MYSQL...
2026-01-17 17:50:17,010 - database_navigator - INFO - Successfully connected to MYSQL!
2026-01-17 17:50:17,015 - database_navigator - INFO - get_databases() called. db_type: mysql, connection exists: True
2026-01-17 17:50:17,018 - database_navigator - INFO - Found 13 databases
2026-01-17 17:50:19,415 - database_navigator - INFO - Selected database: dq_checks
2026-01-17 17:50:19,419 - database_navigator - INFO - Found 1 schemas
2026-01-17 17:50:20,845 - database_navigator - INFO - Selected schema: dq_checks
2026-01-17 17:50:20,853 - database_navigator - INFO - Found 18 tables in schema 'dq_checks'
2026-01-17 17:50:22,639 - database_navigator - INFO - Selected table: comparison_small_source15
2026-01-17 17:50:22,645 - database_navigator - INFO - Selection complete: {'type': 'mysql', 'database': 'dq_checks', 'schema': 'dq_checks', 'table': 'comparison_small_source15', 'selection_mode': 'hierarchical', 'host': 'localhost', 'port': '3306', 'user': 'root', 'password': 'root'}
2026-01-17 17:50:22,645 - dq_comparison - INFO - Selected via navigation for SOURCE: dq_checks.dq_checks.comparison_small_source15
2026-01-17 17:50:22,646 - dq_unified - INFO - Loading data from DATABASE
2026-01-17 17:50:22,646 - dq_unified - INFO - Loading large database table: comparison_small_source15
2026-01-17 17:50:22,646 - dq_unified - INFO - Normalized DB config with schema: dq_checks
2026-01-17 17:50:22,657 - dq_unified - INFO - MySQL table comparison_small_source15 has 15 rows
2026-01-17 17:50:22,657 - dq_unified - INFO - Loading 15 rows from MySQL...
2026-01-17 17:50:23,102 - dq_unified - INFO - Loaded 15 rows from MySQL
2026-01-17 17:50:23,112 - dq_unified - INFO - Memory optimization: 0.0MB -> 0.0MB (Saved: 0.0MB)
2026-01-17 17:50:23,112 - dq_unified - INFO - Loaded 15 rows, 16 columns. Memory: 111.6MB total, 0.0MB for dataframe
2026-01-17 17:50:23,113 - dq_comparison - INFO - SOURCE database loaded: 15 rows, 16 columns
2026-01-17 17:50:23,114 - dq_comparison - INFO - 
==================================================
2026-01-17 17:50:23,114 - dq_comparison - INFO - 🔗 TARGET DATA CONFIGURATION
2026-01-17 17:50:23,115 - dq_comparison - INFO - ==================================================
2026-01-17 17:50:24,656 - dq_comparison - INFO - 
🗄️ TARGET DATABASE CONFIGURATION
2026-01-17 17:50:24,657 - dq_comparison - INFO - ----------------------------------------
2026-01-17 17:50:25,917 - dq_comparison - INFO - Selected database type code: postgresql
2026-01-17 17:50:27,788 - dq_comparison - INFO - User selected Browse and Select mode for TARGET
2026-01-17 17:50:27,794 - dq_comparison - INFO - Converted 'postgresql' to 'postgres' for database_navigator compatibility
2026-01-17 17:50:27,794 - database_navigator - INFO - DatabaseNavigator initialized
2026-01-17 17:50:27,795 - database_navigator - INFO - Starting database navigation...
2026-01-17 17:50:27,795 - database_navigator - INFO - Database type: postgres
2026-01-17 17:50:27,795 - database_navigator - INFO - Getting database configuration...
2026-01-17 17:50:30,485 - database_navigator - INFO - Connecting to POSTGRES...
2026-01-17 17:50:30,486 - database_navigator - INFO - Connecting to PostgreSQL...
2026-01-17 17:50:30,486 - database_navigator - INFO - Connecting to PostgreSQL: host=localhost, port=5432, database=postgres, user=postgres
2026-01-17 17:50:30,596 - database_navigator - INFO - Connection object created: <connection object at 0x00000233FD3FEAC0; dsn: 'user=postgres password=xxx dbname=postgres host=localhost port=5432', closed: 0>
2026-01-17 17:50:30,596 - database_navigator - INFO - ✅ PostgreSQL connection successful to database: postgres
2026-01-17 17:50:30,601 - database_navigator - INFO - get_databases() called. db_type: postgres, connection exists: True
2026-01-17 17:50:30,607 - database_navigator - INFO - Raw rows: [('dq_checks',), ('finewise-testdb',), ('postgres',)]
2026-01-17 17:50:30,607 - database_navigator - INFO - Found 3 databases
2026-01-17 17:50:32,355 - database_navigator - INFO - Selected database: dq_checks
2026-01-17 17:50:32,357 - database_navigator - INFO - Reconnecting to PostgreSQL database: dq_checks
2026-01-17 17:50:32,358 - database_navigator - INFO - Connecting to POSTGRES...
2026-01-17 17:50:32,359 - database_navigator - INFO - Connecting to PostgreSQL...
2026-01-17 17:50:32,360 - database_navigator - INFO - Connecting to PostgreSQL: host=localhost, port=5432, database=dq_checks, user=postgres
2026-01-17 17:50:32,479 - database_navigator - INFO - Connection object created: <connection object at 0x00000233FD3FE350; dsn: 'user=postgres password=xxx dbname=dq_checks host=localhost port=5432', closed: 0>
2026-01-17 17:50:32,481 - database_navigator - INFO - ✅ PostgreSQL connection successful to database: dq_checks
2026-01-17 17:50:32,496 - database_navigator - INFO - Found 4 schemas
2026-01-17 17:50:34,530 - database_navigator - INFO - Selected schema: public
2026-01-17 17:50:34,534 - database_navigator - INFO - Ensuring connection to database: dq_checks for table list
2026-01-17 17:50:34,535 - database_navigator - INFO - Reconnecting to PostgreSQL database: dq_checks
2026-01-17 17:50:34,535 - database_navigator - INFO - Connecting to POSTGRES...
2026-01-17 17:50:34,536 - database_navigator - INFO - Connecting to PostgreSQL...
2026-01-17 17:50:34,536 - database_navigator - INFO - Connecting to PostgreSQL: host=localhost, port=5432, database=dq_checks, user=postgres
2026-01-17 17:50:34,640 - database_navigator - INFO - Connection object created: <connection object at 0x00000233FD3FEBD0; dsn: 'user=postgres password=xxx dbname=dq_checks host=localhost port=5432', closed: 0>
2026-01-17 17:50:34,640 - database_navigator - INFO - ✅ PostgreSQL connection successful to database: dq_checks
2026-01-17 17:50:34,642 - database_navigator - INFO - Connected to database: dq_checks, schema: public
2026-01-17 17:50:34,669 - database_navigator - INFO - Found 5 tables in dq_checks.public: ['comparison_small_target13', 'customers', 'customers_bkp', 'employee', 'stg_transactions']
2026-01-17 17:50:34,669 - database_navigator - INFO - Found 5 tables in schema 'public'
2026-01-17 17:50:36,967 - database_navigator - INFO - Selected table: comparison_small_target13
2026-01-17 17:50:36,971 - database_navigator - INFO - Selection complete: {'type': 'postgresql', 'database': 'dq_checks', 'schema': 'public', 'table': 'comparison_small_target13', 'selection_mode': 'hierarchical', 'host': 'localhost', 'port': '5432', 'user': 'postgres', 'password': 'postgres'}
2026-01-17 17:50:36,972 - dq_comparison - INFO - Selected via navigation for TARGET: dq_checks.public.comparison_small_target13
2026-01-17 17:50:36,972 - dq_unified - INFO - Loading data from DATABASE
2026-01-17 17:50:36,973 - dq_unified - INFO - Loading large database table: comparison_small_target13
2026-01-17 17:50:36,973 - dq_unified - INFO - Normalized DB config with schema: public
2026-01-17 17:50:37,079 - dq_unified - INFO - PostgreSQL table public.comparison_small_target13 has 13 rows
2026-01-17 17:50:37,079 - dq_unified - INFO - Loading 13 rows from PostgreSQL...
2026-01-17 17:50:37,083 - dq_unified - INFO - Loaded 13 rows from PostgreSQL
2026-01-17 17:50:37,090 - dq_unified - INFO - Memory optimization: 0.0MB -> 0.0MB (Saved: 0.0MB)
2026-01-17 17:50:37,091 - dq_unified - INFO - Loaded 13 rows, 16 columns. Memory: 112.3MB total, 0.0MB for dataframe
2026-01-17 17:50:37,092 - dq_comparison - INFO - TARGET database loaded: 13 rows, 16 columns
2026-01-17 17:50:37,092 - dq_comparison - INFO - SELECTING COLUMNS FOR COMPARISON
2026-01-17 17:50:37,092 - dq_comparison - INFO - Source columns (original): ['transaction_id', 'account_id', 'customer_id', 'transaction_date', 'posting_date', 'transaction_type', 'currency', 'amount', 'balance_after', 'status', 'merchant_name', 'merchant_category', 'country', 'reference_code', 'created_at', 'updated_at']
2026-01-17 17:50:37,093 - dq_comparison - INFO - Target columns (original): ['transaction_id', 'account_id', 'customer_id', 'transaction_date', 'posting_date', 'transaction_type', 'currency', 'amount', 'balance_after', 'status', 'merchant_name', 'merchant_category', 'country', 'reference_code', 'created_at', 'updated_at']
2026-01-17 17:50:37,093 - dq_comparison - INFO - Common columns lowercased: ['transaction_type', 'customer_id', 'country', 'status', 'merchant_category', 'posting_date', 'transaction_id', 'account_id', 'updated_at', 'transaction_date', 'amount', 'created_at', 'merchant_name', 'reference_code', 'balance_after', 'currency']
2026-01-17 17:50:37,094 - dq_comparison - INFO - Found 16 common columns between source and target (case-insensitive)
2026-01-17 17:50:37,097 - dq_comparison - INFO - 
📋 Common columns available for comparison:
2026-01-17 17:50:37,097 - dq_comparison - INFO -   1. transaction_type (Source) ↔ transaction_type (Target)
2026-01-17 17:50:37,098 - dq_comparison - INFO -   2. customer_id (Source) ↔ customer_id (Target)
2026-01-17 17:50:37,098 - dq_comparison - INFO -   3. country (Source) ↔ country (Target)
2026-01-17 17:50:37,099 - dq_comparison - INFO -   4. status (Source) ↔ status (Target)
2026-01-17 17:50:37,099 - dq_comparison - INFO -   5. merchant_category (Source) ↔ merchant_category (Target)
2026-01-17 17:50:37,099 - dq_comparison - INFO -   6. posting_date (Source) ↔ posting_date (Target)
2026-01-17 17:50:37,100 - dq_comparison - INFO -   7. transaction_id (Source) ↔ transaction_id (Target)
2026-01-17 17:50:37,100 - dq_comparison - INFO -   8. account_id (Source) ↔ account_id (Target)
2026-01-17 17:50:37,100 - dq_comparison - INFO -   9. updated_at (Source) ↔ updated_at (Target)
2026-01-17 17:50:37,101 - dq_comparison - INFO -   10. transaction_date (Source) ↔ transaction_date (Target)
2026-01-17 17:50:37,101 - dq_comparison - INFO -   11. amount (Source) ↔ amount (Target)
2026-01-17 17:50:37,101 - dq_comparison - INFO -   12. created_at (Source) ↔ created_at (Target)
2026-01-17 17:50:37,102 - dq_comparison - INFO -   13. merchant_name (Source) ↔ merchant_name (Target)
2026-01-17 17:50:37,102 - dq_comparison - INFO -   14. reference_code (Source) ↔ reference_code (Target)
2026-01-17 17:50:37,102 - dq_comparison - INFO -   15. balance_after (Source) ↔ balance_after (Target)
2026-01-17 17:50:37,103 - dq_comparison - INFO -   16. currency (Source) ↔ currency (Target)
2026-01-17 17:50:39,871 - dq_comparison - INFO - User column selection input: all
2026-01-17 17:50:39,872 - dq_comparison - INFO - User selected ALL common columns for comparison
2026-01-17 17:50:39,872 - dq_comparison - INFO - GENERATING COMPREHENSIVE COMPARISON REPORT
2026-01-17 17:50:39,874 - dq_comparison - INFO - Report details - Source: Database: mysql - dq_checks.comparison_small_source15, Target: Database: postgresql - dq_checks.comparison_small_target13, Selected columns: 16
2026-01-17 17:50:39,874 - dq_comparison - INFO - Initializing Error Logger...
2026-01-17 17:50:39,875 - dq_error_log - INFO - ErrorLogger initialized with database: dq_checks
2026-01-17 17:50:39,890 - dq_error_log - INFO - Database connection successful
2026-01-17 17:50:39,891 - dq_comparison - INFO - Session ID: CMP_20260117_175039
2026-01-17 17:50:39,892 - dq_comparison - INFO - 
======================================================================
2026-01-17 17:50:39,892 - dq_comparison - INFO - 🔄 RUNNING SOURCE-TARGET COMPARISON WITH PERFECT NORMALIZATION
2026-01-17 17:50:39,892 - dq_comparison - INFO - ======================================================================
2026-01-17 17:50:39,893 - dq_comparison - INFO - Session ID: CMP_20260117_175039
2026-01-17 17:50:39,893 - dq_comparison - INFO - Source: Database: mysql - dq_checks.comparison_small_source15
2026-01-17 17:50:39,894 - dq_comparison - INFO - Target: Database: postgresql - dq_checks.comparison_small_target13
2026-01-17 17:50:39,894 - dq_comparison - INFO - Selected columns: 16
2026-01-17 17:50:39,894 - dq_comparison - INFO - ======================================================================
2026-01-17 17:50:39,895 - dq_comparison - INFO - 
1️⃣ FIRST: ROW COUNT CHECK
2026-01-17 17:50:39,895 - dq_comparison - WARNING - ❌ Row count mismatch: Source=15, Target=13, Difference=2
2026-01-17 17:50:39,895 - dq_comparison - WARNING -    Missing in target: 2 rows
2026-01-17 17:50:39,895 - dq_comparison - INFO - 
2️⃣ COLUMN STRUCTURE COMPARISON
2026-01-17 17:50:39,895 - dq_comparison - INFO - Comparing column structures...
2026-01-17 17:50:39,896 - dq_comparison - INFO - Column structure comparison complete. Match: True
2026-01-17 17:50:39,896 - dq_comparison - INFO - 
3️⃣ PRIMARY KEY VALIDATION
2026-01-17 17:50:39,896 - dq_comparison - INFO - Validating primary key/unique fields...
2026-01-17 17:50:39,897 - dq_comparison - INFO - Checking key fields: ['transaction_id', 'customer_id', 'reference_code']
2026-01-17 17:50:39,899 - dq_comparison - WARNING - Field 'customer_id' has duplicates in source: 15 rows
2026-01-17 17:50:39,899 - dq_comparison - WARNING - Field 'customer_id' has duplicates in target: 13 rows
2026-01-17 17:50:39,900 - dq_comparison - INFO - Primary key validation complete. Passed: False
2026-01-17 17:50:39,927 - dq_comparison - INFO -    Key fields found: ['transaction_id', 'customer_id', 'reference_code']
2026-01-17 17:50:39,927 - dq_comparison - INFO -    Unique in source: ❌
2026-01-17 17:50:39,927 - dq_comparison - INFO -    Unique in target: ❌
2026-01-17 17:50:39,928 - dq_comparison - INFO -    Validation passed: ❌
2026-01-17 17:50:39,928 - dq_comparison - WARNING -    Source duplicates in 'customer_id': 15 rows
2026-01-17 17:50:39,929 - dq_comparison - WARNING -      Sample values: ['CUST9001']
2026-01-17 17:50:39,929 - dq_comparison - WARNING -    Target duplicates in 'customer_id': 13 rows
2026-01-17 17:50:39,929 - dq_comparison - WARNING -      Sample values: ['CUST9001']
2026-01-17 17:50:39,929 - dq_comparison - INFO -    Column names match: ✅
2026-01-17 17:50:39,930 - dq_comparison - INFO -    Column order match: ✅
2026-01-17 17:50:39,930 - dq_comparison - INFO -    Data types match: ✅
2026-01-17 17:50:39,931 - dq_comparison - INFO - 
4️⃣ TABLE METADATA COMPARISON
2026-01-17 17:50:39,931 - dq_comparison - INFO - Comparing table-level metadata...
2026-01-17 17:50:39,943 - dq_comparison - INFO - Table metadata comparison complete. Match: False
2026-01-17 17:50:39,958 - dq_comparison - INFO -    Table metadata match: ❌
2026-01-17 17:50:39,958 - dq_comparison - INFO -    Source: 15 rows, 16 cols, 0.01 MB
2026-01-17 17:50:39,959 - dq_comparison - INFO -    Target: 13 rows, 16 cols, 0.0 MB
2026-01-17 17:50:39,959 - dq_comparison - WARNING -    Found 1 metadata differences:
2026-01-17 17:50:39,960 - dq_comparison - WARNING -      • Row Count: Source=15, Target=13
2026-01-17 17:50:39,961 - dq_comparison - INFO - 
5️⃣ HASH-BASED COMPARISON
2026-01-17 17:50:39,961 - dq_comparison - INFO - ℹ️  Note: All NULL values normalized to 'NULL'
2026-01-17 17:50:39,961 - dq_comparison - INFO - ℹ️  Note: Dates normalized to YYYY-MM-DD
2026-01-17 17:50:39,962 - dq_comparison - INFO - ℹ️  Note: Strings trimmed and case-normalized
2026-01-17 17:50:39,962 - dq_comparison - INFO - ℹ️  Note: Phone numbers stripped to digits only, leading zeros removed
2026-01-17 17:50:39,962 - dq_comparison - INFO - SECOND CHECK: HASH-BASED COMPARISON WITH PERFECT NORMALIZATION
2026-01-17 17:50:39,968 - dq_comparison - INFO - === DEBUG: DATA TYPE CHECK ===
2026-01-17 17:50:39,968 - dq_comparison - INFO - Column: transaction_type
2026-01-17 17:50:39,968 - dq_comparison - INFO -   Source type: <class 'str'>, value: CREDIT
2026-01-17 17:50:39,969 - dq_comparison - INFO -   Target type: <class 'str'>, value: CREDIT
2026-01-17 17:50:39,969 - dq_comparison - INFO -   Normalized: 'credit' vs 'credit'
2026-01-17 17:50:39,970 - dq_comparison - INFO -   Match: True
2026-01-17 17:50:39,970 - dq_comparison - INFO - Column: customer_id
2026-01-17 17:50:39,970 - dq_comparison - INFO -   Source type: <class 'str'>, value: CUST9001
2026-01-17 17:50:39,971 - dq_comparison - INFO -   Target type: <class 'str'>, value: CUST9001
2026-01-17 17:50:39,972 - dq_comparison - INFO -   Normalized: 'CUST9001' vs 'CUST9001'
2026-01-17 17:50:39,972 - dq_comparison - INFO -   Match: True
2026-01-17 17:50:39,972 - dq_comparison - INFO - Column: country
2026-01-17 17:50:39,973 - dq_comparison - INFO -   Source type: <class 'str'>, value: IN
2026-01-17 17:50:39,973 - dq_comparison - INFO -   Target type: <class 'str'>, value: IN
2026-01-17 17:50:39,973 - dq_comparison - INFO -   Normalized: 'in' vs 'in'
2026-01-17 17:50:39,974 - dq_comparison - INFO -   Match: True
2026-01-17 17:50:39,974 - dq_comparison - INFO - Source DF columns: ['transaction_id', 'account_id', 'customer_id', 'transaction_date', 'posting_date', 'transaction_type', 'currency', 'amount', 'balance_after', 'status', 'merchant_name', 'merchant_category', 'country', 'reference_code', 'created_at', 'updated_at']
2026-01-17 17:50:39,974 - dq_comparison - INFO - Target DF columns: ['transaction_id', 'account_id', 'customer_id', 'transaction_date', 'posting_date', 'transaction_type', 'currency', 'amount', 'balance_after', 'status', 'merchant_name', 'merchant_category', 'country', 'reference_code', 'created_at', 'updated_at']
2026-01-17 17:50:39,975 - dq_comparison - INFO - Selected columns for comparison: ['transaction_type', 'customer_id', 'country', 'status', 'merchant_category', 'posting_date', 'transaction_id', 'account_id', 'updated_at', 'transaction_date', 'amount', 'created_at', 'merchant_name', 'reference_code', 'balance_after', 'currency']
2026-01-17 17:50:39,975 - dq_comparison - INFO - Using 16 common columns for hash comparison
2026-01-17 17:50:39,975 - dq_comparison - INFO - Source columns: ['transaction_type', 'customer_id', 'country', 'status', 'merchant_category', 'posting_date', 'transaction_id', 'account_id', 'updated_at', 'transaction_date', 'amount', 'created_at', 'merchant_name', 'reference_code', 'balance_after', 'currency']
2026-01-17 17:50:39,976 - dq_comparison - INFO - Target columns: ['transaction_type', 'customer_id', 'country', 'status', 'merchant_category', 'posting_date', 'transaction_id', 'account_id', 'updated_at', 'transaction_date', 'amount', 'created_at', 'merchant_name', 'reference_code', 'balance_after', 'currency']
2026-01-17 17:50:39,976 - dq_comparison - INFO - Generating hashes for source data (15 rows)...
2026-01-17 17:50:39,981 - dq_comparison - INFO - === DEBUG: SAMPLE HASHES ===
2026-01-17 17:50:39,981 - dq_comparison - INFO - Hash 1: 5c6e9b02f25a6781... (sample row 0)
2026-01-17 17:50:39,982 - dq_comparison - INFO - Hash 2: 5540b4be3218d395... (sample row 1)
2026-01-17 17:50:39,982 - dq_comparison - INFO - Hash 3: 1902f3fa3e1db1cf... (sample row 2)
2026-01-17 17:50:39,983 - dq_comparison - INFO - Generating hashes for target data (13 rows)...
2026-01-17 17:50:39,990 - dq_comparison - INFO - Created hash mapping: 13 hashes → target rows
2026-01-17 17:50:39,991 - dq_comparison - INFO - 
======================================================================
2026-01-17 17:50:39,991 - dq_comparison - INFO - 🔍 DEBUG: ANALYZING WHY HASHES DON'T MATCH
2026-01-17 17:50:39,991 - dq_comparison - INFO - ======================================================================
2026-01-17 17:50:39,992 - dq_comparison - INFO - 
--- Analyzing Row 0 ---
2026-01-17 17:50:39,992 - dq_comparison - INFO - Column 'transaction_type' → 'transaction_type':
2026-01-17 17:50:39,992 - dq_comparison - INFO -   Source: 'CREDIT' (type: str) → 'credit'
2026-01-17 17:50:39,992 - dq_comparison - INFO -   Target: 'None' (type: NoneType) → 'NULL'
2026-01-17 17:50:39,994 - dq_comparison - INFO -   Match after normalization: ❌ NO
2026-01-17 17:50:39,995 - dq_comparison - INFO - Column 'customer_id' → 'customer_id':
2026-01-17 17:50:39,996 - dq_comparison - INFO -   Source: 'CUST9001' (type: str) → 'CUST9001'
2026-01-17 17:50:39,996 - dq_comparison - INFO -   Target: 'None' (type: NoneType) → 'NULL'
2026-01-17 17:50:39,997 - dq_comparison - INFO -   Match after normalization: ❌ NO
2026-01-17 17:50:39,997 - dq_comparison - INFO - Column 'country' → 'country':
2026-01-17 17:50:39,997 - dq_comparison - INFO -   Source: 'IN' (type: str) → 'in'
2026-01-17 17:50:39,997 - dq_comparison - INFO -   Target: 'None' (type: NoneType) → 'NULL'
2026-01-17 17:50:39,997 - dq_comparison - INFO -   Match after normalization: ❌ NO
2026-01-17 17:50:39,998 - dq_comparison - INFO - Column 'status' → 'status':
2026-01-17 17:50:39,998 - dq_comparison - INFO -   Source: 'SUCCESS' (type: str) → 'success'
2026-01-17 17:50:39,998 - dq_comparison - INFO -   Target: 'None' (type: NoneType) → 'NULL'
2026-01-17 17:50:39,998 - dq_comparison - INFO -   Match after normalization: ❌ NO
2026-01-17 17:50:39,999 - dq_comparison - INFO - Column 'merchant_category' → 'merchant_category':
2026-01-17 17:50:39,999 - dq_comparison - INFO -   Source: 'Retail' (type: str) → 'retail'
2026-01-17 17:50:40,000 - dq_comparison - INFO -   Target: 'None' (type: NoneType) → 'NULL'
2026-01-17 17:50:40,000 - dq_comparison - INFO -   Match after normalization: ❌ NO
2026-01-17 17:50:40,000 - dq_comparison - INFO - 
Hash components for Row 0:
2026-01-17 17:50:40,000 - dq_comparison - INFO - Source hash string start: credit|CUST9001|in...
2026-01-17 17:50:40,001 - dq_comparison - INFO - Target hash string start: NULL|NULL|NULL...
2026-01-17 17:50:40,001 - dq_comparison - INFO - Same? ❌ NO
2026-01-17 17:50:40,001 - dq_comparison - INFO - 
--- Analyzing Row 1 ---
2026-01-17 17:50:40,003 - dq_comparison - INFO - Column 'transaction_type' → 'transaction_type':
2026-01-17 17:50:40,003 - dq_comparison - INFO -   Source: 'DEBIT' (type: str) → 'debit'
2026-01-17 17:50:40,003 - dq_comparison - INFO -   Target: 'None' (type: NoneType) → 'NULL'
2026-01-17 17:50:40,003 - dq_comparison - INFO -   Match after normalization: ❌ NO
2026-01-17 17:50:40,004 - dq_comparison - INFO - Column 'customer_id' → 'customer_id':
2026-01-17 17:50:40,004 - dq_comparison - INFO -   Source: 'CUST9001' (type: str) → 'CUST9001'
2026-01-17 17:50:40,005 - dq_comparison - INFO -   Target: 'None' (type: NoneType) → 'NULL'
2026-01-17 17:50:40,005 - dq_comparison - INFO -   Match after normalization: ❌ NO
2026-01-17 17:50:40,005 - dq_comparison - INFO - Column 'country' → 'country':
2026-01-17 17:50:40,005 - dq_comparison - INFO -   Source: 'IN' (type: str) → 'in'
2026-01-17 17:50:40,006 - dq_comparison - INFO -   Target: 'None' (type: NoneType) → 'NULL'
2026-01-17 17:50:40,006 - dq_comparison - INFO -   Match after normalization: ❌ NO
2026-01-17 17:50:40,007 - dq_comparison - INFO - Column 'status' → 'status':
2026-01-17 17:50:40,007 - dq_comparison - INFO -   Source: 'SUCCESS' (type: str) → 'success'
2026-01-17 17:50:40,007 - dq_comparison - INFO -   Target: 'None' (type: NoneType) → 'NULL'
2026-01-17 17:50:40,007 - dq_comparison - INFO -   Match after normalization: ❌ NO
2026-01-17 17:50:40,008 - dq_comparison - INFO - Column 'merchant_category' → 'merchant_category':
2026-01-17 17:50:40,008 - dq_comparison - INFO -   Source: 'Transport' (type: str) → 'transport'
2026-01-17 17:50:40,009 - dq_comparison - INFO -   Target: 'None' (type: NoneType) → 'NULL'
2026-01-17 17:50:40,011 - dq_comparison - INFO -   Match after normalization: ❌ NO
2026-01-17 17:50:40,011 - dq_comparison - INFO - 
Hash components for Row 1:
2026-01-17 17:50:40,013 - dq_comparison - INFO - Source hash string start: debit|CUST9001|in...
2026-01-17 17:50:40,013 - dq_comparison - INFO - Target hash string start: NULL|NULL|NULL...
2026-01-17 17:50:40,013 - dq_comparison - INFO - Same? ❌ NO
2026-01-17 17:50:40,013 - dq_comparison - INFO - 
--- Analyzing Row 2 ---
2026-01-17 17:50:40,014 - dq_comparison - INFO - Column 'transaction_type' → 'transaction_type':
2026-01-17 17:50:40,014 - dq_comparison - INFO -   Source: 'CREDIT' (type: str) → 'credit'
2026-01-17 17:50:40,014 - dq_comparison - INFO -   Target: 'None' (type: NoneType) → 'NULL'
2026-01-17 17:50:40,015 - dq_comparison - INFO -   Match after normalization: ❌ NO
2026-01-17 17:50:40,015 - dq_comparison - INFO - Column 'customer_id' → 'customer_id':
2026-01-17 17:50:40,015 - dq_comparison - INFO -   Source: 'CUST9001' (type: str) → 'CUST9001'
2026-01-17 17:50:40,016 - dq_comparison - INFO -   Target: 'None' (type: NoneType) → 'NULL'
2026-01-17 17:50:40,016 - dq_comparison - INFO -   Match after normalization: ❌ NO
2026-01-17 17:50:40,016 - dq_comparison - INFO - Column 'country' → 'country':
2026-01-17 17:50:40,016 - dq_comparison - INFO -   Source: 'US' (type: str) → 'us'
2026-01-17 17:50:40,017 - dq_comparison - INFO -   Target: 'None' (type: NoneType) → 'NULL'
2026-01-17 17:50:40,017 - dq_comparison - INFO -   Match after normalization: ❌ NO
2026-01-17 17:50:40,018 - dq_comparison - INFO - Column 'status' → 'status':
2026-01-17 17:50:40,018 - dq_comparison - INFO -   Source: 'SUCCESS' (type: str) → 'success'
2026-01-17 17:50:40,018 - dq_comparison - INFO -   Target: 'None' (type: NoneType) → 'NULL'
2026-01-17 17:50:40,018 - dq_comparison - INFO -   Match after normalization: ❌ NO
2026-01-17 17:50:40,019 - dq_comparison - INFO - Column 'merchant_category' → 'merchant_category':
2026-01-17 17:50:40,019 - dq_comparison - INFO -   Source: 'Transport' (type: str) → 'transport'
2026-01-17 17:50:40,019 - dq_comparison - INFO -   Target: 'None' (type: NoneType) → 'NULL'
2026-01-17 17:50:40,019 - dq_comparison - INFO -   Match after normalization: ❌ NO
2026-01-17 17:50:40,020 - dq_comparison - INFO - 
Hash components for Row 2:
2026-01-17 17:50:40,021 - dq_comparison - INFO - Source hash string start: credit|CUST9001|us...
2026-01-17 17:50:40,021 - dq_comparison - INFO - Target hash string start: NULL|NULL|NULL...
2026-01-17 17:50:40,021 - dq_comparison - INFO - Same? ❌ NO
2026-01-17 17:50:40,021 - dq_comparison - INFO - 
--- Column Data Types Analysis ---
2026-01-17 17:50:40,022 - dq_comparison - INFO - Column 1: 'transaction_type' (category) ↔ 'transaction_type' (category)
2026-01-17 17:50:40,022 - dq_comparison - INFO -   Sample: Source='CREDIT', Target='CREDIT'
2026-01-17 17:50:40,022 - dq_comparison - INFO - Column 2: 'customer_id' (category) ↔ 'customer_id' (category)
2026-01-17 17:50:40,023 - dq_comparison - INFO -   Sample: Source='CUST9001', Target='CUST9001'
2026-01-17 17:50:40,023 - dq_comparison - INFO - Column 3: 'country' (category) ↔ 'country' (category)
2026-01-17 17:50:40,023 - dq_comparison - INFO -   Sample: Source='IN', Target='IN'
2026-01-17 17:50:40,024 - dq_comparison - INFO - Column 4: 'status' (category) ↔ 'status' (category)
2026-01-17 17:50:40,027 - dq_comparison - INFO -   Sample: Source='SUCCESS', Target='SUCCESS'
2026-01-17 17:50:40,027 - dq_comparison - INFO - Column 5: 'merchant_category' (category) ↔ 'merchant_category' (category)
2026-01-17 17:50:40,028 - dq_comparison - INFO -   Sample: Source='Retail', Target='Electronics'
2026-01-17 17:50:40,028 - dq_comparison - INFO - PERFORMING DETAILED ROW-LEVEL COMPARISON WITH PAGINATION...
2026-01-17 17:50:40,029 - dq_comparison - INFO - Found 28 total mismatches
2026-01-17 17:50:40,029 - dq_comparison - INFO - Will process detailed comparisons for first 28 rows
2026-01-17 17:50:40,039 - dq_error_log - ERROR - Error logging immediate mismatch: Python type dict cannot be converted
2026-01-17 17:50:40,060 - dq_error_log - ERROR - Error logging immediate mismatch: Python type dict cannot be converted
2026-01-17 17:50:40,079 - dq_error_log - ERROR - Error logging immediate mismatch: Python type dict cannot be converted
2026-01-17 17:50:40,098 - dq_error_log - ERROR - Error logging immediate mismatch: Python type dict cannot be converted
2026-01-17 17:50:40,120 - dq_error_log - ERROR - Error logging immediate mismatch: Python type dict cannot be converted
2026-01-17 17:50:40,139 - dq_error_log - ERROR - Error logging immediate mismatch: Python type dict cannot be converted
2026-01-17 17:50:40,157 - dq_error_log - ERROR - Error logging immediate mismatch: Python type dict cannot be converted
2026-01-17 17:50:40,176 - dq_error_log - ERROR - Error logging immediate mismatch: Python type dict cannot be converted
2026-01-17 17:50:40,196 - dq_error_log - ERROR - Error logging immediate mismatch: Python type dict cannot be converted
2026-01-17 17:50:40,215 - dq_error_log - ERROR - Error logging immediate mismatch: Python type dict cannot be converted
2026-01-17 17:50:40,235 - dq_error_log - ERROR - Error logging immediate mismatch: Python type dict cannot be converted
2026-01-17 17:50:40,256 - dq_error_log - ERROR - Error logging immediate mismatch: Python type dict cannot be converted
2026-01-17 17:50:40,280 - dq_error_log - ERROR - Error logging immediate mismatch: Python type dict cannot be converted
2026-01-17 17:50:40,302 - dq_error_log - ERROR - Error logging immediate mismatch: Python type dict cannot be converted
2026-01-17 17:50:40,322 - dq_error_log - ERROR - Error logging immediate mismatch: Python type dict cannot be converted
2026-01-17 17:50:40,333 - dq_comparison - INFO - 
================================================================================
2026-01-17 17:50:40,333 - dq_comparison - INFO - DETAILED MISMATCH SUMMARY:
2026-01-17 17:50:40,334 - dq_comparison - INFO -   Total mismatches found: 15
2026-01-17 17:50:40,335 - dq_comparison - INFO -   Detailed comparisons logged: 15
2026-01-17 17:50:40,335 - dq_comparison - INFO -   First 10 rows displayed above
2026-01-17 17:50:40,336 - dq_comparison - INFO -   All mismatches stored in database with complete data
2026-01-17 17:50:40,336 - dq_comparison - INFO -   Use API to retrieve all 15 mismatches
2026-01-17 17:50:40,336 - dq_comparison - INFO - ================================================================================
2026-01-17 17:50:40,337 - dq_comparison - INFO - Hash-based Comparison Results (with duplicate handling):
2026-01-17 17:50:40,337 - dq_comparison - INFO -   • Unique source hashes: 15
2026-01-17 17:50:40,337 - dq_comparison - INFO -   • Unique target hashes: 13
2026-01-17 17:50:40,338 - dq_comparison - INFO -   • Common hashes: 0
2026-01-17 17:50:40,338 - dq_comparison - INFO -   • Common rows (counting duplicates): 0
2026-01-17 17:50:40,338 - dq_comparison - INFO -   • Rows only in source (counting duplicates): 15
2026-01-17 17:50:40,339 - dq_comparison - INFO -   • Rows only in target (counting duplicates): 13
2026-01-17 17:50:40,339 - dq_comparison - INFO - HASH-ONLY COMPARISON COMPLETED
2026-01-17 17:50:40,340 - dq_comparison - INFO - Returning counts for simple scoring:
2026-01-17 17:50:40,340 - dq_comparison - INFO -   Common rows: 0
2026-01-17 17:50:40,340 - dq_comparison - INFO -   Unique to source: 15
2026-01-17 17:50:40,340 - dq_comparison - INFO -   Unique to target: 13
2026-01-17 17:50:40,340 - dq_comparison - INFO -   Value mismatches: 448
2026-01-17 17:50:40,341 - dq_comparison - INFO -   Missing rows: 15
2026-01-17 17:50:40,341 - dq_comparison - INFO -   Extra rows: 13
2026-01-17 17:50:40,341 - dq_comparison - INFO - 
========================================================================================================================
COMPARISON: Mysql Database vs Postgresql Database
========================================================================================================================
Row   | Diff Count | Source (Sample)                          | Target (Sample)                         
------------------------------------------------------------------------------------------------------------------------
2     | 16         | transaction_type: CREDIT                 | transaction_type: NULL                  
3     | 16         | transaction_type: DEBIT                  | transaction_type: NULL                  
4     | 16         | transaction_type: CREDIT                 | transaction_type: NULL                  
5     | 16         | transaction_type: CREDIT                 | transaction_type: NULL                  
6     | 16         | transaction_type: CREDIT                 | transaction_type: NULL                  
7     | 16         | transaction_type: CREDIT                 | transaction_type: NULL                  
8     | 16         | transaction_type: DEBIT                  | transaction_type: NULL                  
9     | 16         | transaction_type: DEBIT                  | transaction_type: NULL                  
10    | 16         | transaction_type: DEBIT                  | transaction_type: NULL                  
11    | 16         | transaction_type: DEBIT                  | transaction_type: NULL                  
------------------------------------------------------------------------------------------------------------------------
Showing 1-10 of 15 mismatched rows. Use API for complete data.
========================================================================================================================
2026-01-17 17:50:40,342 - dq_comparison - INFO - Returning enhanced mismatch structure with 15 detailed mismatches
2026-01-17 17:50:40,342 - dq_comparison - INFO - New structure: 15 detailed mismatches
2026-01-17 17:50:40,342 - dq_comparison - INFO - 
6️⃣ DATA QUALITY ANALYSIS
2026-01-17 17:50:40,342 - dq_comparison - INFO - Analyzing data quality metrics...
2026-01-17 17:50:40,359 - dq_comparison - INFO - Null values - Source: 0 (0.00%), Target: 0 (0.00%)
2026-01-17 17:50:40,361 - dq_comparison - INFO - Duplicate rows (normalized) - Source: 0, Target: 0
2026-01-17 17:50:40,373 - dq_error_log - INFO - Retrieved 18 error logs for session CMP_20260117_175039
2026-01-17 17:50:40,374 - dq_comparison - INFO - 
📊 SIMPLE SCORING CALCULATION:
2026-01-17 17:50:40,374 - dq_comparison - INFO -   Source rows: 15
2026-01-17 17:50:40,374 - dq_comparison - INFO -   Common rows (matched): 0
2026-01-17 17:50:40,375 - dq_comparison - INFO -   Calculation: (0 / 15) * 100 = 0.00%
2026-01-17 17:50:40,375 - dq_comparison - INFO -   Explanation: 0 matched rows out of 15 total source rows
2026-01-17 17:50:40,376 - dq_comparison - INFO - 
=== AUDIT LOGGING SECTION ===
2026-01-17 17:50:40,380 - dq_comparison - INFO - 🔍 Audit logging is ENABLED in APP_SETTINGS
2026-01-17 17:50:40,381 - dq_audit - INFO - Audit class initialized with database: dq_checks
2026-01-17 17:50:40,381 - dq_comparison - INFO - Attempting to log audit record for session: CMP_20260117_175039
2026-01-17 17:50:40,382 - dq_audit - INFO - Starting database insertion for comparison...
2026-01-17 17:50:40,395 - dq_audit - INFO - Inserted comparison record with ID: 758
2026-01-17 17:50:40,395 - dq_comparison - INFO - ✅ Audit record logged successfully (ID: 758)
2026-01-17 17:50:40,395 - dq_comparison - INFO - 
======================================================================
2026-01-17 17:50:40,397 - dq_comparison - INFO - 📊 COMPARISON RESULTS SUMMARY
2026-01-17 17:50:40,397 - dq_comparison - INFO - ======================================================================
2026-01-17 17:50:40,398 - dq_comparison - INFO - Session ID: CMP_20260117_175039
2026-01-17 17:50:40,398 - dq_comparison - INFO - Source: Database: mysql - dq_checks.comparison_small_source15 (15 rows)
2026-01-17 17:50:40,398 - dq_comparison - INFO - Target: Database: postgresql - dq_checks.comparison_small_target13 (13 rows)
2026-01-17 17:50:40,398 - dq_comparison - INFO - Selected columns: 16
2026-01-17 17:50:40,399 - dq_comparison - INFO - ----------------------------------------------------------------------
2026-01-17 17:50:40,399 - dq_comparison - INFO - 1️⃣ Row count match: ❌ No
2026-01-17 17:50:40,399 - dq_comparison - INFO -    Missing in target: 2 rows
2026-01-17 17:50:40,399 - dq_comparison - INFO -    Extra in target: 0 rows
2026-01-17 17:50:40,400 - dq_comparison - INFO - 2️⃣ Column structure match: ✅ Yes
2026-01-17 17:50:40,400 - dq_comparison - INFO - 3️ Primary key validation: ❌ Failed
2026-01-17 17:50:40,400 - dq_comparison - INFO -    Key fields: ['transaction_id', 'customer_id', 'reference_code']
2026-01-17 17:50:40,401 - dq_comparison - INFO - 4️ Table metadata: ❌ Mismatch
2026-01-17 17:50:40,401 - dq_comparison - INFO -    • Row Count: 15 vs 13
2026-01-17 17:50:40,401 - dq_comparison - INFO - 5️⃣ Common rows (both Mysql Database and Postgresql Database): 0 (0.00% of Mysql Database)
2026-01-17 17:50:40,402 - dq_comparison - INFO - 6️⃣ Mysql Database-only rows: 15 (present ONLY in Mysql Database, NOT in Postgresql Database)
2026-01-17 17:50:40,402 - dq_comparison - INFO - 7️⃣ Postgresql Database-only rows: 13 (present ONLY in Postgresql Database, NOT in Mysql Database)
2026-01-17 17:50:40,402 - dq_comparison - INFO - 8️⃣ Column value mismatches: 0
2026-01-17 17:50:40,402 - dq_comparison - INFO - 9️ Data quality match: ✅ Yes
2026-01-17 17:50:40,402 - dq_comparison - INFO - 📈 DQ Score: 0.00%
2026-01-17 17:50:40,403 - dq_comparison - INFO - 📊 Calculation: (0 / 15) * 100 = 0.00%
2026-01-17 17:50:40,403 - dq_comparison - INFO - ======================================================================
2026-01-17 17:50:40,403 - dq_comparison - INFO - 
❌ LOW MATCH! Major differences found.
2026-01-17 17:50:40,404 - dq_comparison - INFO - 
🔍 NORMALIZATION APPLIED:
2026-01-17 17:50:40,404 - dq_comparison - INFO -    • NULL values → 'NULL' (consistent representation)
2026-01-17 17:50:40,404 - dq_comparison - INFO -    • Dates → YYYY-MM-DD format
2026-01-17 17:50:40,405 - dq_comparison - INFO -    • Strings → trimmed + lowercase
2026-01-17 17:50:40,405 - dq_comparison - INFO -    • Numeric values → standardized format
2026-01-17 17:50:40,406 - dq_comparison - INFO -    • Phone numbers → digits only, ALL leading zeros removed
2026-01-17 17:50:40,406 - dq_comparison - INFO -    • Extra whitespace removed
2026-01-17 17:50:40,406 - dq_comparison - INFO - 
🔍 DETAILED ERROR ANALYSIS:
2026-01-17 17:50:40,406 - dq_comparison - INFO - --------------------------------------------------
2026-01-17 17:50:40,407 - dq_comparison - INFO - 📊 SOURCE-ONLY ROWS: 15 rows
2026-01-17 17:50:40,407 - dq_comparison - INFO -    Present only in Mysql Database, missing from Postgresql Database
2026-01-17 17:50:40,407 - dq_comparison - INFO - 📊 TARGET-ONLY ROWS: 13 rows
2026-01-17 17:50:40,407 - dq_comparison - INFO -    Present only in Postgresql Database, extra (not in Mysql Database)
2026-01-17 17:50:40,418 - dq_error_log - INFO - Retrieved 10 errors for session CMP_20260117_175039
2026-01-17 17:50:40,418 - dq_comparison - INFO - 
📋 SAMPLE ERRORS (10 found):
2026-01-17 17:50:40,419 - dq_comparison - INFO - 
1. Row 0 - Metadata Row Count
2026-01-17 17:50:40,420 - dq_comparison - INFO -    Column: 
2026-01-17 17:50:40,420 - dq_comparison - INFO -    Metadata mismatch: Row Count
2026-01-17 17:50:40,420 - dq_comparison - INFO - 
2. Row 0 - Duplicate Primary Key
2026-01-17 17:50:40,421 - dq_comparison - INFO -    Column: customer_id
2026-01-17 17:50:40,421 - dq_comparison - INFO -    Primary key field 'customer_id' has 15 duplicates in source
2026-01-17 17:50:40,422 - dq_comparison - INFO - 
3. Row 0 - Duplicate Primary Key
2026-01-17 17:50:40,423 - dq_comparison - INFO -    Column: customer_id
2026-01-17 17:50:40,423 - dq_comparison - INFO -    Primary key field 'customer_id' has 13 duplicates in target
2026-01-17 17:50:40,424 - dq_comparison - INFO - 
💡 For complete error details, run:
2026-01-17 17:50:40,424 - dq_comparison - INFO -    USE dq_checks;
2026-01-17 17:50:40,425 - dq_comparison - INFO -    SELECT excel_row, column_name, error_type, error_description,
2026-01-17 17:50:40,426 - dq_comparison - INFO -           actual_value, expected_value
2026-01-17 17:50:40,427 - dq_comparison - INFO -    FROM dq_error_logs
2026-01-17 17:50:40,428 - dq_comparison - INFO -    WHERE session_id = 'CMP_20260117_175039'
2026-01-17 17:50:40,428 - dq_comparison - INFO -    ORDER BY excel_row, column_name;
2026-01-17 17:50:40,439 - dq_comparison - INFO - 
✅ Comparison completed! Session ID: CMP_20260117_175039
2026-01-17 17:50:40,449 - dq_error_log - INFO - Retrieved 19 error logs for session CMP_20260117_175039
2026-01-17 17:50:40,462 - dq_error_log - INFO - Retrieved summary: 19 total errors for session CMP_20260117_175039
2026-01-17 17:50:40,463 - dq_audit - INFO - Audit class initialized with database: dq_checks
2026-01-17 17:50:40,480 - dq_audit - INFO - Retrieved 1 audit logs for session CMP_20260117_175039
2026-01-17 17:50:40,481 - dq_comparison - INFO - 
🔍 Final results verification:
2026-01-17 17:50:40,482 - dq_comparison - INFO -    Session ID: CMP_20260117_175039
2026-01-17 17:50:40,483 - dq_comparison - INFO -    DQ Score (Simple %): 0.00%
2026-01-17 17:50:40,484 - dq_comparison - INFO -    Source rows: 15
2026-01-17 17:50:40,485 - dq_comparison - INFO -    Matched rows: 0
2026-01-17 17:50:40,489 - dq_comparison - INFO -    Calculation: (0 / 15) * 100
2026-01-17 17:50:40,489 - __main__ - INFO - Source-Target Comparison completed successfully
2026-01-17 17:50:40,490 - __main__ - INFO - Displaying main menu options to user
2026-01-17 17:56:08,828 - __main__ - INFO - User selected option: 6
2026-01-17 17:56:08,829 - __main__ - INFO - User session ended. Duration: 0:06:03.540635
2026-01-17 17:56:08,829 - __main__ - INFO - 👋 Thank you for using Universal Data Quality Framework!
